play_id,game_id,old_game_id,home_team,away_team,season_type,week_x,posteam,posteam_type,defteam,side_of_field,yardline_100,game_date,quarter_seconds_remaining,half_seconds_remaining,game_seconds_remaining,game_half,quarter_end,drive,sp,qtr,down,goal_to_go,time,yrdln,ydstogo,ydsnet,desc,play_type,yards_gained,shotgun,no_huddle,qb_dropback,qb_kneel,qb_spike,qb_scramble,pass_length,pass_location,air_yards,yards_after_catch,run_location,run_gap,field_goal_result,kick_distance,extra_point_result,two_point_conv_result,home_timeouts_remaining,away_timeouts_remaining,timeout,timeout_team,td_team,td_player_name,td_player_id,posteam_timeouts_remaining,defteam_timeouts_remaining,total_home_score,total_away_score,posteam_score,defteam_score,score_differential,posteam_score_post,defteam_score_post,score_differential_post,no_score_prob,opp_fg_prob,opp_safety_prob,opp_td_prob,fg_prob,safety_prob,td_prob,extra_point_prob,two_point_conversion_prob,ep,epa,total_home_epa,total_away_epa,total_home_rush_epa,total_away_rush_epa,total_home_pass_epa,total_away_pass_epa,air_epa,yac_epa,comp_air_epa,comp_yac_epa,total_home_comp_air_epa,total_away_comp_air_epa,total_home_comp_yac_epa,total_away_comp_yac_epa,total_home_raw_air_epa,total_away_raw_air_epa,total_home_raw_yac_epa,total_away_raw_yac_epa,wp,def_wp,home_wp,away_wp,wpa,vegas_wpa,vegas_home_wpa,home_wp_post,away_wp_post,vegas_wp,vegas_home_wp,total_home_rush_wpa,total_away_rush_wpa,total_home_pass_wpa,total_away_pass_wpa,air_wpa,yac_wpa,comp_air_wpa,comp_yac_wpa,total_home_comp_air_wpa,total_away_comp_air_wpa,total_home_comp_yac_wpa,total_away_comp_yac_wpa,total_home_raw_air_wpa,total_away_raw_air_wpa,total_home_raw_yac_wpa,total_away_raw_yac_wpa,punt_blocked,first_down_rush,first_down_pass,first_down_penalty,third_down_converted,third_down_failed,fourth_down_converted,fourth_down_failed,incomplete_pass,touchback,interception,punt_inside_twenty,punt_in_endzone,punt_out_of_bounds,punt_downed,punt_fair_catch,kickoff_inside_twenty,kickoff_in_endzone,kickoff_out_of_bounds,kickoff_downed,kickoff_fair_catch,fumble_forced,fumble_not_forced,fumble_out_of_bounds,solo_tackle,safety,penalty,tackled_for_loss,fumble_lost,own_kickoff_recovery,own_kickoff_recovery_td,qb_hit,rush_attempt,pass_attempt,sack,touchdown,pass_touchdown,rush_touchdown,return_touchdown,extra_point_attempt,two_point_attempt,field_goal_attempt,kickoff_attempt,punt_attempt,fumble,complete_pass,assist_tackle,lateral_reception,lateral_rush,lateral_return,lateral_recovery,passer_player_id,passer_player_name,passing_yards,receiver_player_id,receiver_player_name,receiving_yards,rusher_player_id,rusher_player_name,rushing_yards,lateral_receiver_player_id,lateral_receiver_player_name,lateral_receiving_yards,lateral_rusher_player_id,lateral_rusher_player_name,lateral_rushing_yards,lateral_sack_player_id,lateral_sack_player_name,interception_player_id,interception_player_name,lateral_interception_player_id,lateral_interception_player_name,punt_returner_player_id,punt_returner_player_name,lateral_punt_returner_player_id,lateral_punt_returner_player_name,kickoff_returner_player_name,kickoff_returner_player_id,lateral_kickoff_returner_player_id,lateral_kickoff_returner_player_name,punter_player_id,punter_player_name,kicker_player_name,kicker_player_id,own_kickoff_recovery_player_id,own_kickoff_recovery_player_name,blocked_player_id,blocked_player_name,tackle_for_loss_1_player_id,tackle_for_loss_1_player_name,tackle_for_loss_2_player_id,tackle_for_loss_2_player_name,qb_hit_1_player_id,qb_hit_1_player_name,qb_hit_2_player_id,qb_hit_2_player_name,forced_fumble_player_1_team,forced_fumble_player_1_player_id,forced_fumble_player_1_player_name,forced_fumble_player_2_team,forced_fumble_player_2_player_id,forced_fumble_player_2_player_name,solo_tackle_1_team,solo_tackle_2_team,solo_tackle_1_player_id,solo_tackle_2_player_id,solo_tackle_1_player_name,solo_tackle_2_player_name,assist_tackle_1_player_id,assist_tackle_1_player_name,assist_tackle_1_team,assist_tackle_2_player_id,assist_tackle_2_player_name,assist_tackle_2_team,assist_tackle_3_player_id,assist_tackle_3_player_name,assist_tackle_3_team,assist_tackle_4_player_id,assist_tackle_4_player_name,assist_tackle_4_team,tackle_with_assist,tackle_with_assist_1_player_id,tackle_with_assist_1_player_name,tackle_with_assist_1_team,tackle_with_assist_2_player_id,tackle_with_assist_2_player_name,tackle_with_assist_2_team,pass_defense_1_player_id,pass_defense_1_player_name,pass_defense_2_player_id,pass_defense_2_player_name,fumbled_1_team,fumbled_1_player_id,fumbled_1_player_name,fumbled_2_player_id,fumbled_2_player_name,fumbled_2_team,fumble_recovery_1_team,fumble_recovery_1_yards,fumble_recovery_1_player_id,fumble_recovery_1_player_name,fumble_recovery_2_team,fumble_recovery_2_yards,fumble_recovery_2_player_id,fumble_recovery_2_player_name,sack_player_id,sack_player_name,half_sack_1_player_id,half_sack_1_player_name,half_sack_2_player_id,half_sack_2_player_name,return_team,return_yards,penalty_team,penalty_player_id,penalty_player_name,penalty_yards,replay_or_challenge,replay_or_challenge_result,penalty_type,defensive_two_point_attempt,defensive_two_point_conv,defensive_extra_point_attempt,defensive_extra_point_conv,safety_player_name,safety_player_id,season_x,cp,cpoe,series,series_success,series_result,order_sequence,start_time,time_of_day,stadium,weather,nfl_api_id,play_clock,play_deleted,play_type_nfl,special_teams_play,st_play_type,end_clock_time,end_yard_line,fixed_drive,fixed_drive_result,drive_real_start_time,drive_play_count,drive_time_of_possession,drive_first_downs,drive_inside20,drive_ended_with_score,drive_quarter_start,drive_quarter_end,drive_yards_penalized,drive_start_transition,drive_end_transition,drive_game_clock_start,drive_game_clock_end,drive_start_yard_line,drive_end_yard_line,drive_play_id_started,drive_play_id_ended,away_score,home_score,location,result,total,spread_line,total_line,div_game,roof,surface,temp,wind,home_coach,away_coach,stadium_id,game_stadium,aborted_play,success,passer,passer_jersey_number,rusher,rusher_jersey_number,receiver,receiver_jersey_number,pass,rush,first_down,special,play,passer_id,rusher_id,receiver_id,name,jersey_number,id,fantasy_player_name,fantasy_player_id,fantasy,fantasy_id,out_of_bounds,home_opening_kickoff,qb_epa,xyac_epa,xyac_mean_yardage,xyac_median_yardage,xyac_success,xyac_fd,xpass,pass_oe,date_x,injured_player,season_y,game_type,team,week_y,gsis_id,position,full_name,first_name,last_name,report_primary_injury,report_secondary_injury,report_status,practice_primary_injury,practice_secondary_injury,practice_status,date_modified,date_y
4872,2022_01_PIT_CIN,2022091103,CIN,PIT,REG,1,CIN,home,PIT,PIT,44.0,2022-09-11,105,105,105,Overtime,0,28.0,0,5,1.0,0,01:45,PIT 44,10,5.0,(1:45) (Shotgun) 9-J.Burrow pass short right to 88-H.Hurst pushed ob at PIT 38 for 6 yards (34-T.Edmunds). PIT-97-C.Heyward was injured during the play.,pass,6.0,1,0,1.0,0,0,0,short,right,0.0,6.0,,,,,,,0,1,0.0,,,,,0.0,1.0,20,20,20.0,20.0,0.0,20.0,20.0,0.0,0.538313806056976,0.0124703831970692,0.000248989497777,0.0157571397721767,0.16547529399395,0.0020385531242936,0.265695810317993,0.0,0.0,2.21216455346439,-0.64372989378171,-3.07919819283457,3.07919819283457,-2.24668882624246,2.24668882624246,-7.50751096495313,7.50751096495313,-0.333066126448102,-0.310663767333608,-0.333066126448102,-0.310663767333608,10.2415257621956,-10.2415257621956,11.7723513746052,-11.7723513746052,24.7240256966957,-24.7240256966957,-20.0281310090504,20.0281310090504,0.433209657436237,0.566790342563763,0.433209657436237,0.566790342563763,-0.10462782625109,-0.10462782625109,-0.10462782625109,0.328581831185147,0.671418168814853,0.433209657436237,0.433209657436237,-0.179127631883603,0.179127631883603,0.049380499167306,-0.049380499167306,0.269487142795697,-0.374114969046786,0.269487142795697,-0.374114969046786,0.632077057463595,-0.632077057463595,0.413486040501179,-0.413486040501179,0.407074944199541,-0.407074944199541,-0.0665384050492012,0.0665384050492012,0.0,0.0,0.0,0.0,0.0,0.0,0.0,0.0,0.0,0,0.0,0.0,0.0,0.0,0.0,0.0,0.0,0.0,0.0,0.0,0.0,0.0,0.0,0.0,1.0,0.0,0.0,0.0,0.0,0.0,0.0,0.0,0.0,1.0,0.0,0.0,0.0,0.0,0.0,0.0,0.0,0.0,0.0,0.0,0.0,1.0,0.0,0.0,0.0,0.0,0.0,00-0036442,J.Burrow,6.0,00-0034830,H.Hurst,6.0,,,,,,,,,,,,,,,,,,,,,,,,,,,,,,,,,,,,,,,,,,,,,,PIT,,00-0034858,,T.Edmunds,,,,,,,,,,,,,,0.0,,,,,,,,,,,,,,,,,,,,,,,,,,,,,,,,0.0,,,,,0,,,0.0,0.0,0.0,0.0,,,2022,0.736298024654388,26.3701975345612,68,0,Punt,4872,"9/11/22, 13:03:29",2022-09-11T20:34:58Z,Paycor Stadium,"Cloudy Temp: 76° F, Humidity: 83%, Wind: S 5 mph",7ae7be32-d24c-11ec-b23d-d15a91047884,0,0,PASS,0,,,,28,Punt,2022-09-11T20:31:41Z,5.0,1:26,1.0,0.0,0.0,5.0,5.0,0.0,MISSED_FG,PUNT,02:22,00:56,CIN 45,50,4789.0,4976.0,23,20,Home,-3,43,7.5,44.5,1,outdoors,fieldturf,,,Zac Taylor,Mike Tomlin,CIN00,Paycor Stadium,0,0.0,J.Burrow,9.0,,,H.Hurst,88.0,1,0,0.0,0,1,00-0036442,,00-0034830,J.Burrow,9.0,00-0036442,H.Hurst,00-0034830,H.Hurst,00-0034830,1,0,-0.64372989378171,0.551341371523471,6.98136201663874,6.0,0.606849074596539,0.233743101591244,0.854354977607727,14.5645022392273,2022-09-11,C.Heyward,2022,REG,PIT,1,00-0027969,DT,Cameron Heyward,Cameron,Heyward,,,,Not injury related - resting player,,Full Participation in Practice,2022-09-09T18:20:08Z,2022-09-09 18:20:08
4307,2022_12_LV_SEA,2022112708,SEA,LV,REG,12,LV,away,SEA,SEA,37.0,2022-11-27,387,387,387,Overtime,0,25.0,0,5,3.0,0,06:27,SEA 37,1,37.0,(6:27) 28-J.Jacobs left guard to SEA 38 for -1 yards (93-S.Harris). SEA-26-R.Neal was injured during the play.,run,-1.0,0,0,0.0,0,0,0,,,,,left,guard,,,,,2,2,0.0,,,,,2.0,2.0,34,34,34.0,34.0,0.0,34.0,34.0,0.0,0.170831859111786,0.0597435086965561,0.0007067598053254,0.0777463689446449,0.293716549873352,0.0017198317218571,0.395535081624985,0.0,0.0,2.92846625612583,-2.49312505609553,-0.450815348299574,0.450815348299574,-0.71199057941744,0.71199057941744,-4.26544482652886,4.26544482652886,,,0.0,0.0,-4.63925544871017,4.63925544871017,-2.76144659519196,2.76144659519196,-7.4625684771454,7.4625684771454,5.74776334144784,-5.74776334144784,0.690971463220194,0.309028536779806,0.309028536779806,0.690971463220194,-0.0998531861339272,-0.0998531861339272,0.0998531861339272,0.408881722913733,0.591118277086267,0.690971463220194,0.309028536779806,0.0168433134428762,-0.0168433134428762,-0.356046052776877,0.356046052776877,,,0.0,0.0,-0.348819140791613,0.348819140791613,0.0289418190653012,-0.0289418190653012,-0.333281179754714,0.333281179754714,0.123625207429803,-0.123625207429803,0.0,0.0,0.0,0.0,0.0,1.0,0.0,0.0,0.0,0,0.0,0.0,0.0,0.0,0.0,0.0,0.0,0.0,0.0,0.0,0.0,0.0,0.0,0.0,1.0,0.0,0.0,1.0,0.0,0.0,0.0,0.0,1.0,0.0,0.0,0.0,0.0,0.0,0.0,0.0,0.0,0.0,0.0,0.0,0.0,0.0,0.0,0.0,0.0,0.0,0.0,,,,,,,00-0035700,J.Jacobs,-1.0,,,,,,,,,,,,,,,,,,,,,,,,,,,,,00-0031270,S.Harris,,,,,,,,,,,,,SEA,,00-0031270,,S.Harris,,,,,,,,,,,,,,0.0,,,,,,,,,,,,,,,,,,,,,,,,,,,,,,,,0.0,,,,,0,,,0.0,0.0,0.0,0.0,,,2022,,,65,0,Missed field goal,4307,"11/27/22, 16:05:39",2022-11-28T00:28:08.057Z,Lumen Field,"Partly Cloudy Temp: 45° F, Humidity: 75%, Wind: N 7 mph",9575372f-d24c-11ec-b23d-d15a91047884,0,0,RUSH,0,,2022-11-28T00:28:11.093Z,,25,Missed field goal,2022-11-28T00:23:14.060Z,8.0,4:09,2.0,0.0,0.0,5.0,5.0,0.0,KICKOFF,MISSED_FG,10:00,05:51,LV 25,SEA 38,4159.0,4331.0,40,34,Home,-6,74,4.0,47.5,0,outdoors,fieldturf,44.0,8.0,Pete Carroll,Josh McDaniels,SEA00,Lumen Field,0,0.0,,,J.Jacobs,28.0,,,0,1,0.0,0,1,,00-0035700,,J.Jacobs,28.0,00-0035700,J.Jacobs,00-0035700,J.Jacobs,00-0035700,0,0,-2.49312505609553,,,,,,0.206978127360344,-20.6978127360344,2022-11-27,R.Neal,2022,REG,SEA,12,00-0034527,S,Ryan Neal,Ryan,Neal,,,,Ankle,,Full Participation in Practice,2022-11-25T22:16:19Z,2022-11-25 22:16:19
4169,2022_06_ARI_SEA,2022101609,SEA,ARI,REG,6,ARI,away,SEA,ARI,78.0,2022-10-16,36,36,36,Half2,0,23.0,0,4,2.0,0,00:36,ARI 22,18,5.0,"(:36) (No Huddle, Shotgun) 1-K.Murray pass short right to 18-A.Green to ARI 27 for 5 yards (30-M.Jackson). SEA-93-S.Harris was injured during the play.",pass,5.0,1,1,1.0,0,0,0,short,right,5.0,0.0,,,,,,,2,0,0.0,,,,,0.0,2.0,19,9,9.0,19.0,-10.0,9.0,19.0,-10.0,0.885627508163452,0.0298633314669132,0.0013454958098009,0.0115048605948687,0.0547177717089653,0.0002800632501021,0.0166610106825829,0.0,0.0,0.108525506220758,-0.058111677179113,9.35275001637638,-9.35275001637638,-3.51300052183494,3.51300052183494,5.31764837713126,-5.31764837713126,-0.058111677179113,0.0,-0.058111677179113,0.0,3.57375353534007,-3.57375353534007,-7.34426987415645,7.34426987415645,-2.95834723196458,2.95834723196458,5.4963338751389,-5.4963338751389,0.0070740031078457,0.992925996892154,0.992925996892154,0.0070740031078457,-0.0012193983420729,-0.0008324524387717,0.0008324524387717,0.994145395234227,0.0058546047657728,0.0049640187062323,0.995035981293768,0.101313597588886,-0.101313597588886,0.160594146698713,-0.160594146698713,-0.0012193983420729,0.0,-0.0012193983420729,0.0,-0.0201872074976563,0.0201872074976563,-0.126647021621466,0.126647021621466,-0.0150388302281499,0.0150388302281499,0.0549824237823486,-0.0549824237823486,0.0,0.0,0.0,0.0,0.0,0.0,0.0,0.0,0.0,0,0.0,0.0,0.0,0.0,0.0,0.0,0.0,0.0,0.0,0.0,0.0,0.0,0.0,0.0,1.0,0.0,0.0,0.0,0.0,0.0,0.0,0.0,0.0,1.0,0.0,0.0,0.0,0.0,0.0,0.0,0.0,0.0,0.0,0.0,0.0,1.0,0.0,0.0,0.0,0.0,0.0,00-0035228,K.Murray,5.0,00-0027942,A.Green,5.0,,,,,,,,,,,,,,,,,,,,,,,,,,,,,,,,,,,,,,,,,,,,,,SEA,,00-0035277,,M.Jackson,,,,,,,,,,,,,,0.0,,,,,,,,,,,,,,,,,,,,,,,,,,,,,,,,0.0,,,,,0,,,0.0,0.0,0.0,0.0,,,2022,0.787513852119446,21.2486147880554,56,0,End of half,4169,"10/16/22, 16:05:30",2022-10-16T23:12:30.720Z,Lumen Field,"Sunny Temp: 72° F, Humidity: 44%, Wind: SE 5 mph",7ae986f2-d24c-11ec-b23d-d15a91047884,0,0,PASS,0,,2022-10-16T23:12:36.603Z,,23,End of half,2022-10-16T23:11:58.187Z,3.0,1:08,0.0,0.0,0.0,4.0,4.0,0.0,PUNT,END_GAME,01:08,00:00,ARI 30,ARI 27,4150.0,4231.0,9,19,Home,10,28,-2.5,50.0,1,outdoors,fieldturf,,,Pete Carroll,Kliff Kingsbury,SEA00,Lumen Field,0,0.0,K.Murray,1.0,,,A.Green,18.0,1,0,0.0,0,1,00-0035228,,00-0027942,K.Murray,1.0,00-0035228,A.Green,00-0027942,A.Green,00-0027942,0,0,-0.058111677179113,0.163791575914242,4.009270014707,2.0,0.597066485090181,0.0518850914668292,0.972004652023315,2.79953479766846,2022-10-16,S.Harris,2022,REG,SEA,6,00-0031270,DE,Shelby Harris,Shelby,Harris,Hip,,Questionable,Hip,,Full Participation in Practice,2022-10-14T19:49:51Z,2022-10-14 19:49:51
4114,2022_04_MIN_NO,2022100200,NO,MIN,REG,4,NO,home,MIN,NO,75.0,2022-10-02,24,24,24,Half2,0,21.0,0,4,1.0,0,00:24,NO 25,10,32.0,(:24) (Shotgun) 14-A.Dalton pass deep middle to 12-C.Olave to MIN 43 for 32 yards (24-C.Bynum). MIN-22-H.Smith was injured during the play. His return is Questionable. NO-12-C.Olave was injured during the play. His return is Probable.,pass,32.0,1,0,1.0,0,0,0,deep,middle,30.0,2.0,,,,,,,0,2,0.0,,,,,0.0,2.0,25,28,25.0,28.0,-3.0,25.0,28.0,-3.0,0.940480589866638,0.0054268036037683,0.0005204960471019,0.0067985360510647,0.0331466719508171,0.0001851162815,0.0134418597444892,0.0,0.0,0.128992111363914,0.780288959969766,-2.65790981794987,2.65790981794987,5.57744264625565,-5.57744264625565,5.45628346360407,-5.45628346360407,1.00066964497091,-0.220380685001146,1.00066964497091,-0.220380685001146,6.67387726449394,-6.67387726449394,-9.32244312054945,9.32244312054945,5.57913246372934,-5.57913246372934,-0.49542554673328,0.49542554673328,0.131322681903839,0.868677318096161,0.131322681903839,0.868677318096161,0.0948180258274078,0.060883492231369,0.060883492231369,0.226140707731247,0.773859292268753,0.0757303982973099,0.0757303982973099,0.228587149909012,-0.228587149909012,0.169959497300914,-0.169959497300914,-0.0367267951369286,0.131544820964336,-0.0367267951369286,0.131544820964336,0.228481765855828,-0.228481765855828,-0.272406798100817,0.272406798100817,0.223024722208061,-0.223024722208061,-0.102773349976885,0.102773349976885,0.0,0.0,1.0,0.0,0.0,0.0,0.0,0.0,0.0,0,0.0,0.0,0.0,0.0,0.0,0.0,0.0,0.0,0.0,0.0,0.0,0.0,0.0,0.0,1.0,0.0,0.0,0.0,0.0,0.0,0.0,0.0,0.0,1.0,0.0,0.0,0.0,0.0,0.0,0.0,0.0,0.0,0.0,0.0,0.0,1.0,0.0,0.0,0.0,0.0,0.0,00-0027973,A.Dalton,32.0,00-0037239,C.Olave,32.0,,,,,,,,,,,,,,,,,,,,,,,,,,,,,,,,,,,,,,,,,,,,,,MIN,,00-0036629,,C.Bynum,,,,,,,,,,,,,,0.0,,,,,,,,,,,,,,,,,,,,,,,,,,,,,,,,0.0,,,,,0,,,0.0,0.0,0.0,0.0,,,2022,0.401935517787933,59.8064482212067,57,1,First down,4114,"10/2/22, 09:33:38",2022-10-02T16:31:00.357Z,Tottenham Hotspur Stadium,"Partly Cloudy Temp: 64° F, Humidity: 79%, Wind: SE 6 mph",7ae8c66e-d24c-11ec-b23d-d15a91047884,0,0,PASS,0,,2022-10-02T16:31:05.660Z,,21,Missed field goal,2022-10-02T16:30:19.480Z,4.0,0:24,1.0,0.0,0.0,4.0,4.0,0.0,KICKOFF,MISSED_FG,00:24,00:00,NO 25,MIN 43,4099.0,4195.0,28,25,Neutral,-3,53,-4.0,42.0,0,outdoors,,,,Dennis Allen,Kevin O'Connell,LON02,Tottenham Stadium,0,1.0,A.Dalton,14.0,,,C.Olave,12.0,1,0,1.0,0,1,00-0027973,,00-0037239,A.Dalton,14.0,00-0027973,C.Olave,00-0037239,C.Olave,00-0037239,0,0,0.780288959969766,0.694102134102948,8.03730205987813,4.0,1.0,1.0,0.985878109931946,1.41218900680542,2022-10-02,H.Smith,2022,REG,MIN,4,00-0029606,S,Harrison Smith,Harrison,Smith,,,,Concussion,,Full Participation in Practice,2022-09-30T16:57:29Z,2022-09-30 16:57:29
3919,2022_04_SEA_DET,2022100205,DET,SEA,REG,4,SEA,away,DET,SEA,75.0,2022-10-02,326,326,326,Half2,0,18.0,0,4,1.0,0,05:26,SEA 25,10,75.0,(5:26) 7-G.Smith pass short right to 1-D.Eskridge to SEA 35 for 10 yards (24-A.Oruwariye). SEA-1-D.Eskridge was injured during the play. DET-24-A.Oruwariye was injured during the play. His return is Questionable.,pass,10.0,0,0,1.0,0,0,0,short,right,3.0,7.0,,,,,,,3,2,0.0,,,,,2.0,3.0,38,41,41.0,38.0,3.0,41.0,38.0,3.0,0.252919644117355,0.110666707158089,0.0013039377517998,0.175294667482376,0.16811241209507,0.0026728438679128,0.289029806852341,0.0,0.0,0.971220902632922,0.550560075207613,-11.1473194175961,11.1473194175961,-5.23745942329685,5.23745942329685,-13.6871329747426,13.6871329747426,-0.48006901377812,1.03062908898573,-0.48006901377812,1.03062908898573,6.49791717371507,-6.49791717371507,-8.67001562315272,8.67001562315272,14.6702674665658,-14.6702674665658,-27.3147698435196,27.3147698435196,0.734155058860779,0.265844941139221,0.265844941139221,0.734155058860779,0.0093954801559448,0.0223406553268433,-0.0223406553268433,0.256449460983276,0.743550539016724,0.723089814186096,0.276910185813904,-0.279200588250701,0.279200588250701,-0.251915443719988,0.251915443719988,0.0,0.0093954801559448,0.0,0.0093954801559448,0.0870800461894597,-0.0870800461894597,-0.169047869068364,0.169047869068364,0.0870800461894597,-0.0870800461894597,-0.343703099771537,0.343703099771537,0.0,0.0,1.0,0.0,0.0,0.0,0.0,0.0,0.0,0,0.0,0.0,0.0,0.0,0.0,0.0,0.0,0.0,0.0,0.0,0.0,0.0,0.0,0.0,1.0,0.0,0.0,0.0,0.0,0.0,0.0,0.0,0.0,1.0,0.0,0.0,0.0,0.0,0.0,0.0,0.0,0.0,0.0,0.0,0.0,1.0,0.0,0.0,0.0,0.0,0.0,00-0030565,G.Smith,10.0,00-0036620,D.Eskridge,10.0,,,,,,,,,,,,,,,,,,,,,,,,,,,,,,,,,,,,,,,,,,,,,,DET,,00-0035270,,A.Oruwariye,,,,,,,,,,,,,,0.0,,,,,,,,,,,,,,,,,,,,,,,,,,,,,,,,0.0,,,,,0,,,0.0,0.0,0.0,0.0,,,2022,0.818437814712524,18.1562185287476,53,1,First down,3919,"10/2/22, 13:02:37",2022-10-02T20:00:03.653Z,Ford Field,"Controlled Climate Temp: 68° F, Humidity: 70%, Wind: mph",7ae8de21-d24c-11ec-b23d-d15a91047884,0,0,PASS,0,,2022-10-02T20:00:09.857Z,,18,Touchdown,2022-10-02T19:59:15.137Z,7.0,3:12,3.0,0.0,1.0,4.0,4.0,0.0,KICKOFF,TOUCHDOWN,05:26,02:14,SEA 25,DET 41,3904.0,4094.0,48,45,Home,-3,93,3.0,48.5,0,dome,fieldturf,,,Dan Campbell,Pete Carroll,DET00,Ford Field,0,1.0,G.Smith,7.0,,,D.Eskridge,1.0,1,0,1.0,0,1,00-0030565,,00-0036620,G.Smith,7.0,00-0030565,D.Eskridge,00-0036620,D.Eskridge,00-0036620,0,0,0.550560075207613,0.774884010443279,4.83181009942928,3.0,0.684772135777166,0.235337780875852,0.339747279882431,66.0252720117569,2022-10-02,D.Eskridge,2022,REG,SEA,4,00-0036620,WR,D'Wayne Eskridge,D'Wayne,Eskridge,,,,Illness,,Full Participation in Practice,2022-09-30T21:31:27Z,2022-09-30 21:31:27
3885,2022_17_MIA_NE,2023010105,NE,MIA,REG,17,MIA,away,NE,NE,31.0,2023-01-01,90,90,90,Half2,0,21.0,0,4,2.0,0,01:30,NE 31,10,61.0,"(1:30) (Shotgun) 19-S.Thompson pass short right to 14-T.Sherfield to NE 8 for 23 yards (3-J.Peppers, 31-Jo.Jones). NE-31-Jo.Jones was injured during the play.",pass,23.0,1,0,1.0,0,0,0,short,right,14.0,9.0,,,,,,,2,0,0.0,,,,,0.0,2.0,23,14,14.0,23.0,-9.0,14.0,23.0,-9.0,0.357644885778427,0.0144404452294111,0.0002882599073927,0.0172390881925821,0.243853911757469,0.0033797572832554,0.363153606653214,0.0,0.0,3.11582502356032,1.72763055533869,2.86911104280497,-2.86911104280497,-2.28701692697359,2.28701692697359,-0.676010386384836,0.676010386384836,1.30151873640716,0.426111818931531,1.30151873640716,0.426111818931531,0.349473670198426,-0.349473670198426,-7.11427757906495,7.11427757906495,-6.71563187100335,6.71563187100335,11.1782494145225,-11.1782494145225,0.0356526523828506,0.964347347617149,0.964347347617149,0.0356526523828506,0.0227352902293205,0.0207727458328009,-0.0207727458328009,0.941612057387829,0.0583879426121712,0.0248887743800879,0.975111225619912,0.0480317035094163,-0.0480317035094163,0.1132710274859,-0.1132710274859,0.0,0.0227352902293205,0.0,0.0227352902293205,-0.730673592604012,0.730673592604012,0.489112170413137,-0.489112170413137,-0.728806782580227,0.728806782580227,0.93012299736061,-0.93012299736061,0.0,0.0,1.0,0.0,0.0,0.0,0.0,0.0,0.0,0,0.0,0.0,0.0,0.0,0.0,0.0,0.0,0.0,0.0,0.0,0.0,0.0,0.0,0.0,0.0,0.0,0.0,0.0,0.0,0.0,0.0,0.0,0.0,1.0,0.0,0.0,0.0,0.0,0.0,0.0,0.0,0.0,0.0,0.0,0.0,1.0,1.0,0.0,0.0,0.0,0.0,00-0037327,S.Thompson,23.0,00-0034487,T.Sherfield,23.0,,,,,,,,,,,,,,,,,,,,,,,,,,,,,,,,,,,,,,,,,,,,,,,,,,,,00-0032580,Jo.Jones,NE,,,,,,,,,,1.0,00-0033883,J.Peppers,NE,,,,,,,,,,,,,,,,,,,,,,,,,,,,,0.0,,,,,0,,,0.0,0.0,0.0,0.0,,,2022,0.562697887420654,43.7302112579346,48,1,First down,3885,"1/1/23, 13:02:25",2023-01-01T21:04:27.023Z,Gillette Stadium,"Partly Cloudy Temp: 51° F, Humidity: 56%, Wind: SE 12 mph",ba112d95-d24c-11ec-b23d-d15a91047884,0,0,PASS,0,,2023-01-01T21:04:34.380Z,,21,Touchdown,2023-01-01T20:56:21Z,9.0,1:28,5.0,1.0,1.0,4.0,4.0,-1.0,DOWNS,TOUCHDOWN,02:32,01:04,MIA 39,NE 4,3683.0,3981.0,21,23,Home,2,44,3.0,41.5,1,outdoors,fieldturf,53.0,2.0,Bill Belichick,Mike McDaniel,BOS00,Gillette Stadium,0,1.0,S.Thompson,19.0,,,T.Sherfield,14.0,1,0,1.0,0,1,00-0037327,,00-0034487,S.Thompson,19.0,00-0037327,T.Sherfield,00-0034487,T.Sherfield,00-0034487,0,0,1.72763055533869,0.186465617830994,2.55978002271149,1.0,1.0,0.999339846079238,0.986774444580078,1.32255554199219,2023-01-01,Jo.Jones,2022,REG,NE,17,00-0032580,CB,Jonathan Jones,Jonathan,Jones,Chest,,Questionable,Chest,,Limited Participation in Practice,2022-12-30T20:32:44Z,2022-12-30 20:32:44
3879,2022_04_NYJ_PIT,2022100210,PIT,NYJ,REG,4,NYJ,away,PIT,PIT,46.0,2022-10-02,120,120,120,Half2,0,22.0,0,4,3.0,0,02:00,PIT 46,6,65.0,(2:00) (Shotgun) 2-Z.Wilson pass short middle to 83-T.Conklin to PIT 38 for 8 yards (39-M.Fitzpatrick). PIT-39-M.Fitzpatrick was injured during the play. His return is Questionable.,pass,8.0,1,0,1.0,0,0,0,short,middle,6.0,2.0,,,,,,,3,3,0.0,,,,,3.0,3.0,20,17,17.0,20.0,-3.0,17.0,20.0,-3.0,0.415932089090347,0.0688390582799912,0.0004023899964522,0.0622347556054592,0.182592555880547,0.0027085857000201,0.267290562391281,0.0,0.0,1.78126353170956,1.16432585491566,-1.46535643306561,1.46535643306561,3.37481730265426,-3.37481730265426,-5.86219111780473,5.86219111780473,0.98860758630326,0.1757182686124,0.98860758630326,0.1757182686124,-5.21640042727813,5.21640042727813,-3.99505395042231,3.99505395042231,0.233817077416461,-0.233817077416461,-2.86665150705246,2.86665150705246,0.364410728216171,0.635589271783829,0.635589271783829,0.364410728216171,0.0892030000686646,0.0964385867118835,-0.0964385867118835,0.546386271715164,0.453613728284836,0.324415981769562,0.675584018230438,0.152111087808769,-0.152111087808769,-0.28076350697993,0.28076350697993,0.0,0.0892030000686646,0.0,0.0892030000686646,0.0531027711441274,-0.0531027711441274,-0.414331013751232,0.414331013751232,0.0587904847671743,-0.0587904847671743,-0.22392488498708,0.22392488498708,0.0,0.0,1.0,0.0,1.0,0.0,0.0,0.0,0.0,0,0.0,0.0,0.0,0.0,0.0,0.0,0.0,0.0,0.0,0.0,0.0,0.0,0.0,0.0,1.0,0.0,0.0,0.0,0.0,0.0,0.0,0.0,0.0,1.0,0.0,0.0,0.0,0.0,0.0,0.0,0.0,0.0,0.0,0.0,0.0,1.0,0.0,0.0,0.0,0.0,0.0,00-0037013,Z.Wilson,8.0,00-0034270,T.Conklin,8.0,,,,,,,,,,,,,,,,,,,,,,,,,,,,,,,,,,,,,,,,,,,,,,PIT,,00-0034789,,M.Fitzpatrick,,,,,,,,,,,,,,0.0,,,,,,,,,,,,,,,,,,,,,,,,,,,,,,,,0.0,,,,,0,,,0.0,0.0,0.0,0.0,,,2022,0.690172970294952,30.9827029705048,52,1,First down,3879,"10/2/22, 13:02:27",2022-10-02T19:59:01.997Z,Acrisure Stadium,"Cloudy Temp: 58° F, Humidity: 83%, Wind: NE 8 mph",7ae8f3a6-d24c-11ec-b23d-d15a91047884,0,0,PASS,0,,2022-10-02T19:59:06.090Z,,22,Touchdown,2022-10-02T19:54:32.630Z,10.0,3:18,5.0,1.0,1.0,4.0,4.0,-5.0,INTERCEPTION,TOUCHDOWN,03:34,00:16,NYJ 35,PIT 2,3810.0,4131.0,24,20,Home,-4,44,3.0,41.0,0,outdoors,grass,,,Mike Tomlin,Robert Saleh,PIT00,Acrisure Stadium,0,1.0,Z.Wilson,2.0,,,T.Conklin,83.0,1,0,1.0,0,1,00-0037013,,00-0034270,Z.Wilson,2.0,00-0037013,T.Conklin,00-0034270,T.Conklin,00-0034270,0,1,1.16432585491566,0.308170739123693,4.67924494028557,3.0,0.983822303445777,0.983822303445777,0.983838677406311,1.6161322593689,2022-10-02,M.Fitzpatrick,2022,REG,PIT,4,00-0034789,S,Minkah Fitzpatrick,Minkah,Fitzpatrick,,,,Concussion,,Full Participation in Practice,2022-09-30T20:46:15Z,2022-09-30 20:46:15
3868,2022_06_NE_CLE,2022101601,CLE,NE,REG,6,NE,away,CLE,CLE,44.0,2022-10-16,335,335,335,Half2,0,21.0,0,4,2.0,0,05:35,CLE 44,7,-11.0,(5:35) 4-B.Zappe sacked at NE 48 for -8 yards (95-M.Garrett). CLE-95-M.Garrett was injured during the play. His return is Questionable.,pass,-8.0,0,0,1.0,0,0,0,,,,,,,,,,,3,2,0.0,,,,,2.0,3.0,15,24,24.0,15.0,9.0,24.0,15.0,9.0,0.222175106406212,0.0646759942173958,0.000814891711343,0.098027840256691,0.256646752357483,0.0038583120331168,0.353801071643829,0.0,0.0,2.37241173477378,-1.80147819744889,-13.1857652096966,13.1857652096966,-4.89344529891494,4.89344529891494,-15.3529628766801,15.3529628766801,,,0.0,0.0,11.9685734275845,-11.9685734275845,-16.6979199265479,16.6979199265479,35.236226740526,-35.236226740526,-50.2756301902407,50.2756301902407,0.954066097736359,0.0459339022636414,0.0459339022636414,0.954066097736359,-0.0140582919120789,-0.0282595753669739,0.0282595753669739,0.0599921941757202,0.94000780582428,0.955207884311676,0.044792115688324,-0.167174175373148,0.167174175373148,-0.548713039887368,0.548713039887368,,,0.0,0.0,0.120669429661962,-0.120669429661962,-0.460153533264549,0.460153533264549,0.11743378779504,-0.11743378779504,-0.737386928990038,0.737386928990038,0.0,0.0,0.0,0.0,0.0,0.0,0.0,0.0,0.0,0,0.0,0.0,0.0,0.0,0.0,0.0,0.0,0.0,0.0,0.0,0.0,0.0,0.0,0.0,1.0,0.0,0.0,0.0,0.0,0.0,0.0,1.0,0.0,1.0,1.0,0.0,0.0,0.0,0.0,0.0,0.0,0.0,0.0,0.0,0.0,0.0,0.0,0.0,0.0,0.0,0.0,00-0038108,B.Zappe,,,,,,,,,,,,,,,,,,,,,,,,,,,,,,,,,,,,00-0033868,M.Garrett,,,00-0033868,M.Garrett,,,,,,,,,CLE,,00-0033868,,M.Garrett,,,,,,,,,,,,,,0.0,,,,,,,,,,,,,,,,,,,,,,,,,00-0033868,M.Garrett,,,,,,0.0,,,,,0,,,0.0,0.0,0.0,0.0,,,2022,,,49,0,Punt,3868,"10/16/22, 13:02:38",2022-10-16T20:01:45.200Z,Cleveland Browns Stadium,"Sunny Temp: 62° F, Humidity: 41%, Wind: N 11 mph",7ae96309-d24c-11ec-b23d-d15a91047884,0,0,SACK,0,,2022-10-16T20:01:49.563Z,,21,Punt,2022-10-16T19:54:46.280Z,3.0,1:45,0.0,0.0,0.0,4.0,4.0,0.0,KICKOFF,PUNT,06:17,04:32,CLE 47,NE 42,3783.0,3914.0,38,15,Home,-23,53,2.5,43.0,0,outdoors,grass,,,Kevin Stefanski,Bill Belichick,CLE00,FirstEnergy Stadium,0,0.0,B.Zappe,4.0,,,,,1,0,0.0,0,1,00-0038108,,,B.Zappe,4.0,00-0038108,,,,,0,1,-1.80147819744889,,,,,,0.41820615530014,58.179384469986,2022-10-16,M.Garrett,2022,REG,CLE,6,00-0033868,DE,Myles Garrett,Myles,Garrett,,,,"shoulder, biceps, hand",,Limited Participation in Practice,2022-10-14T18:01:30Z,2022-10-14 18:01:30
3862,2022_03_NO_CAR,2022092500,CAR,NO,REG,3,NO,away,CAR,NO,52.0,2022-09-25,176,176,176,Half2,0,23.0,0,4,1.0,0,02:56,NO 48,10,90.0,(2:56) (Shotgun) 2-J.Winston pass deep right to 10-T.Smith to CAR 4 for 48 yards (21-J.Chinn). NO-10-T.Smith was injured during the play. He is Out.,pass,48.0,1,0,1.0,0,0,0,deep,right,47.0,1.0,,,,,,,2,0,0.0,,,,,0.0,2.0,22,7,7.0,22.0,-15.0,7.0,22.0,-15.0,0.443854361772537,0.0245016235858202,0.0003463583416305,0.0351004526019096,0.106642857193947,0.0023447403218597,0.387209624052048,0.0,0.0,2.71518466493581,3.26101599575486,13.2318640473969,-13.2318640473969,9.83547741929954,-9.83547741929954,-11.992643881546,11.992643881546,2.88465594049194,0.376360055262921,2.88465594049194,0.376360055262921,-19.4947679156177,19.4947679156177,6.92505300479285,-6.92505300479285,-20.4661634511287,20.4661634511287,10.2645369954746,-10.2645369954746,0.0051637268625199,0.99483627313748,0.99483627313748,0.0051637268625199,0.0012420243583619,0.0016299067065119,-0.0016299067065119,0.993594248779118,0.0064057512208819,0.0064797485247254,0.993520251475275,0.254216646389324,-0.254216646389324,-0.255147070433944,0.255147070433944,-7.86432065069675e-05,0.0013206675648689,-7.86432065069675e-05,0.0013206675648689,-0.0772501206956804,0.0772501206956804,-0.108074263945222,0.108074263945222,-0.0713566965423524,0.0713566965423524,-0.100640612930059,0.100640612930059,0.0,0.0,1.0,0.0,0.0,0.0,0.0,0.0,0.0,0,0.0,0.0,0.0,0.0,0.0,0.0,0.0,0.0,0.0,0.0,0.0,0.0,0.0,0.0,1.0,0.0,0.0,0.0,0.0,0.0,0.0,0.0,0.0,1.0,0.0,0.0,0.0,0.0,0.0,0.0,0.0,0.0,0.0,0.0,0.0,1.0,0.0,0.0,0.0,0.0,0.0,00-0031503,J.Winston,48.0,00-0034765,T.Smith,48.0,,,,,,,,,,,,,,,,,,,,,,,,,,,,,,,,,,,,,,,,,,,,,,CAR,,00-0036293,,J.Chinn,,,,,,,,,,,,,,0.0,,,,,,,,,,,,,,,,,,,,,,,,,,,,,,,,0.0,,,,,0,,,0.0,0.0,0.0,0.0,,,2022,0.268411964178085,73.1588035821915,50,1,First down,3862,"9/25/22, 13:03:23",2022-09-25T19:51:12.153Z,Bank of America Stadium,"Partly Cloudy Temp: 68° F, Humidity: 70%, Wind: SSW 7 mph",7ae87c4c-d24c-11ec-b23d-d15a91047884,0,0,PASS,0,,2022-09-25T19:51:20.227Z,,23,Touchdown,2022-09-25T19:50:32.480Z,3.0,1:06,3.0,1.0,1.0,4.0,4.0,0.0,PUNT,TOUCHDOWN,03:28,02:22,NO 10,CAR 4,3838.0,3914.0,14,22,Home,8,36,-2.0,41.0,1,outdoors,grass,,,Matt Rhule,Dennis Allen,CAR00,Bank of America Stadium,0,1.0,J.Winston,2.0,,,T.Smith,10.0,1,0,1.0,0,1,00-0031503,,00-0034765,J.Winston,2.0,00-0031503,T.Smith,00-0034765,T.Smith,00-0034765,0,1,3.26101599575486,0.942812565719121,3.32432504931057,5.0,1.0,1.0,0.966420114040375,3.35798859596252,2022-09-25,T.Smith,2022,REG,NO,3,00-0034765,WR,Tre'Quan Smith,Tre'Quan,Smith,,,,Shoulder,,Full Participation in Practice,2022-09-23T19:05:22Z,2022-09-23 19:05:22
3860,2022_06_MIN_MIA,2022101604,MIA,MIN,REG,6,MIA,home,MIN,MIA,83.0,2022-10-16,157,157,157,Half2,0,28.0,0,4,1.0,0,02:37,MIA 17,10,83.0,(2:37) (Shotgun) 5-T.Bridgewater pass short right to 17-J.Waddle to MIN 34 for 49 yards (58-J.Hicks). MIA-17-J.Waddle was injured during the play.,pass,49.0,1,0,1.0,0,0,0,short,right,-4.0,53.0,,,,,,,0,2,0.0,,,,,0.0,2.0,10,24,10.0,24.0,-14.0,10.0,24.0,-14.0,0.638092875480652,0.0357209593057632,0.0016079919878393,0.0644396543502808,0.0847742557525635,0.0022997360210865,0.173064514994621,0.0,0.0,0.908917401917279,2.45970013679471,-12.6231072637317,12.6231072637317,-3.81899604067439,3.81899604067439,-3.90577720343165,3.90577720343165,-0.61454622540623,3.07424636220094,-0.61454622540623,3.07424636220094,14.6934474281443,-14.6934474281443,-3.63877405566745,3.63877405566745,13.6700270971342,-13.6700270971342,-12.0476710524667,12.0476710524667,0.0038522388786077,0.996147761121392,0.0038522388786077,0.996147761121392,0.0012891525402665,0.0025418051518499,0.0025418051518499,0.0051413914188742,0.994858608581126,0.0019988613203167,0.0019988613203167,-0.130970925785601,0.130970925785601,-0.265994263206847,0.265994263206847,-0.0006049589719623,0.0018941115122288,-0.0006049589719623,0.0018941115122288,0.020109123696335,-0.020109123696335,0.14054540800862,-0.14054540800862,-0.0015379887477081,0.0015379887477081,-0.0896050662267953,0.0896050662267953,0.0,0.0,1.0,0.0,0.0,0.0,0.0,0.0,0.0,0,0.0,0.0,0.0,0.0,0.0,0.0,0.0,0.0,0.0,0.0,0.0,0.0,0.0,0.0,1.0,0.0,0.0,0.0,0.0,0.0,0.0,0.0,0.0,1.0,0.0,0.0,0.0,0.0,0.0,0.0,0.0,0.0,0.0,0.0,0.0,1.0,0.0,0.0,0.0,0.0,0.0,00-0031237,T.Bridgewater,49.0,00-0036613,J.Waddle,49.0,,,,,,,,,,,,,,,,,,,,,,,,,,,,,,,,,,,,,,,,,,,,,,MIN,,00-0032129,,J.Hicks,,,,,,,,,,,,,,0.0,,,,,,,,,,,,,,,,,,,,,,,,,,,,,,,,0.0,,,,,0,,,0.0,0.0,0.0,0.0,,,2022,0.881597101688385,11.8402898311615,53,1,First down,3860,"10/16/22, 13:02:37",2022-10-16T19:56:18.657Z,Hard Rock Stadium,"Partly Cloudy Temp: 86° F, Humidity: 55%, Wind: ENE 14 mph",7ae9709e-d24c-11ec-b23d-d15a91047884,0,0,PASS,0,,2022-10-16T19:56:28.233Z,,28,Touchdown,2022-10-16T19:56:18.657Z,6.0,1:13,4.0,1.0,1.0,4.0,4.0,-5.0,PUNT,TOUCHDOWN,02:37,01:24,MIA 17,MIN 3,3860.0,4065.0,24,16,Home,-8,40,-3.0,45.0,0,outdoors,grass,,,Mike McDaniel,Kevin O'Connell,MIA00,Hard Rock Stadium,0,1.0,T.Bridgewater,5.0,,,J.Waddle,17.0,1,0,1.0,0,1,00-0031237,,00-0036613,T.Bridgewater,5.0,00-0031237,J.Waddle,00-0036613,J.Waddle,00-0036613,0,0,2.45970013679471,0.762895701619949,10.4823496702375,9.0,0.547918224678142,0.245839586452348,0.957359313964844,4.26406860351563,2022-10-16,J.Waddle,2022,REG,MIA,6,00-0036613,WR,Jaylen Waddle,Jaylen,Waddle,,,,Groin,,Full Participation in Practice,2022-10-14T19:32:00Z,2022-10-14 19:32:00
3836,2022_13_BUF_NE,2022120100,NE,BUF,REG,13,NE,home,BUF,BUF,21.0,2022-12-01,133,133,133,Half2,0,18.0,0,4,3.0,1,02:13,BUF 21,21,57.0,(2:13) (Shotgun) 10-M.Jones pass incomplete deep right to 15-N.Agholor. BUF-97-J.Phillips was injured during the play.,pass,0.0,1,0,1.0,0,0,0,deep,right,21.0,,,,,,,,3,2,0.0,,,,,3.0,2.0,7,24,7.0,24.0,-17.0,7.0,24.0,-17.0,0.153764426708221,0.0195597223937511,0.0003743487468454,0.0248425304889679,0.649646520614624,0.0013696366222575,0.150442853569984,0.0,0.0,2.77145323198056,-0.314853412220833,-19.2066649342077,19.2066649342077,-1.88557790184859,1.88557790184859,-10.9822404907891,10.9822404907891,4.22854676801944,-4.54340018024027,0.0,0.0,-11.7653473739338,11.7653473739338,-0.388375926824205,0.388375926824205,-10.6490410410624,10.6490410410624,-2.82815864568599,2.82815864568599,0.001494109397754,0.998505890602246,0.001494109397754,0.998505890602246,-0.0005125574534758,-0.0002815453044604,-0.0002815453044604,0.0009815519442781,0.999018448055722,0.0007264092564582,0.0007264092564582,-0.165168455386904,0.165168455386904,-0.235674134425446,0.235674134425446,0.0,-0.0005125574534758,0.0,0.0,-0.172579225170967,0.172579225170967,-0.155911468968744,0.155911468968744,-0.189295987616834,0.189295987616834,-0.133363391922804,0.133363391922804,0.0,0.0,0.0,0.0,0.0,1.0,0.0,0.0,1.0,0,0.0,0.0,0.0,0.0,0.0,0.0,0.0,0.0,0.0,0.0,0.0,0.0,0.0,0.0,0.0,0.0,0.0,0.0,0.0,0.0,0.0,0.0,0.0,1.0,0.0,0.0,0.0,0.0,0.0,0.0,0.0,0.0,0.0,0.0,0.0,0.0,0.0,0.0,0.0,0.0,0.0,00-0036972,M.Jones,,00-0031549,N.Agholor,,,,,,,,,,,,,,,,,,,,,,,,,,,,,,,,,,,,,,,,,,,,,,,,,,,,,,,,,,,,,,,,,0.0,,,,,,,,,,,,,,,,,,,,,,,,,,,,,,,,0.0,,,,,0,,,0.0,0.0,0.0,0.0,,,2022,0.237528771162033,-23.7528771162033,50,0,Field goal,3836,"12/1/22, 20:15:51",2022-12-02T04:01:36.987Z,Gillette Stadium,"Clear Temp: 35° F, Humidity: 52%, Wind: SE 5 mph",ba0e8213-d24c-11ec-b23d-d15a91047884,0,0,PASS,0,,2022-12-02T04:01:53.270Z,,18,Field goal,2022-12-02T03:48:04.007Z,17.0,5:45,5.0,1.0,1.0,4.0,4.0,-3.0,PUNT,FIELD_GOAL,07:38,01:53,NE 22,BUF 21,3416.0,3858.0,24,10,Home,-14,34,-3.5,43.5,1,outdoors,fieldturf,35.0,2.0,Bill Belichick,Sean McDermott,BOS00,Gillette Stadium,0,0.0,M.Jones,10.0,,,N.Agholor,15.0,1,0,0.0,0,1,00-0036972,,00-0031549,M.Jones,10.0,00-0036972,N.Agholor,00-0031549,N.Agholor,00-0031549,0,1,-0.314853412220833,,,,,,0.961330235004425,3.8669764995575,2022-12-01,J.Phillips,2022,REG,BUF,13,00-0031557,DE,Jordan Phillips,Jordan,Phillips,,,,Eye,,Full Participation in Practice,2022-11-30T16:35:52Z,2022-11-30 16:35:52
3824,2022_06_ARI_SEA,2022101609,SEA,ARI,REG,6,ARI,away,SEA,ARI,55.0,2022-10-16,299,299,299,Half2,0,21.0,0,4,1.0,0,04:59,ARI 45,10,37.0,"(4:59) (Shotgun) 1-K.Murray pass short left to 4-R.Moore to ARI 38 for -7 yards (52-D.Taylor, 95-M.Adams). SEA-52-D.Taylor was injured during the play.",pass,-7.0,1,0,1.0,0,0,0,short,left,-3.0,-4.0,,,,,,,2,1,0.0,,,,,1.0,2.0,19,9,9.0,19.0,-10.0,9.0,19.0,-10.0,0.332476854324341,0.0594603009521961,0.0017654529074206,0.0787003412842751,0.203684642910957,0.0018578568706288,0.322054535150528,0.0,0.0,2.13633719086647,-1.1099848333979,8.37681148794945,-8.37681148794945,-1.48139227946801,1.48139227946801,1.92686066500755,-1.92686066500755,-0.895068905781955,-0.214915927615948,-0.895068905781955,-0.214915927615948,2.38102468434954,-2.38102468434954,-7.41938344208757,7.41938344208757,3.15662651247112,-3.15662651247112,-3.40090742646285,3.40090742646285,0.0705154687166214,0.929484531283379,0.929484531283379,0.0705154687166214,-0.0177320800721645,-0.0231412649154663,0.0231412649154663,0.947216611355543,0.0527833886444569,0.107661813497543,0.892338186502457,0.0841475455752501,-0.0841475455752501,0.117301620543003,-0.117301620543003,0.0,-0.0177320800721645,0.0,-0.0177320800721645,-0.0214066058397293,0.0214066058397293,-0.134800221771002,0.134800221771002,-0.0180087387561798,0.0180087387561798,0.0245884619653225,-0.0245884619653225,0.0,0.0,0.0,0.0,0.0,0.0,0.0,0.0,0.0,0,0.0,0.0,0.0,0.0,0.0,0.0,0.0,0.0,0.0,0.0,0.0,0.0,0.0,0.0,0.0,0.0,0.0,0.0,0.0,0.0,0.0,0.0,0.0,1.0,0.0,0.0,0.0,0.0,0.0,0.0,0.0,0.0,0.0,0.0,0.0,1.0,1.0,0.0,0.0,0.0,0.0,00-0035228,K.Murray,-7.0,00-0036936,R.Moore,-7.0,,,,,,,,,,,,,,,,,,,,,,,,,,,,,,,,00-0036413,D.Taylor,,,,,,,,,,,,,,,,,,,00-0035946,M.Adams,SEA,,,,,,,,,,1.0,00-0036413,D.Taylor,SEA,,,,,,,,,,,,,,,,,,,,,,,,,,,,,0.0,,,,,0,,,0.0,0.0,0.0,0.0,,,2022,0.876000225543976,12.3999774456024,53,0,Turnover,3824,"10/16/22, 16:05:30",2022-10-16T22:55:29.433Z,Lumen Field,"Sunny Temp: 72° F, Humidity: 44%, Wind: SE 5 mph",7ae986f2-d24c-11ec-b23d-d15a91047884,0,0,PASS,0,,2022-10-16T22:55:36.473Z,,21,Turnover,2022-10-16T22:51:48.610Z,11.0,2:48,3.0,0.0,0.0,4.0,4.0,0.0,PUNT,INTERCEPTION,06:40,03:52,ARI 7,ARI 44,3660.0,3894.0,9,19,Home,10,28,-2.5,50.0,1,outdoors,fieldturf,,,Pete Carroll,Kliff Kingsbury,SEA00,Lumen Field,0,0.0,K.Murray,1.0,,,R.Moore,4.0,1,0,0.0,0,1,00-0035228,,00-0036936,K.Murray,1.0,00-0035228,R.Moore,00-0036936,R.Moore,00-0036936,0,0,-1.1099848333979,1.07085238364219,9.55512411895324,8.0,0.544634360179771,0.248860667750705,0.940273344516754,5.97266554832459,2022-10-16,D.Taylor,2022,REG,SEA,6,00-0036413,LB,Darrell Taylor,Darrell,Taylor,,,,Neck,,Full Participation in Practice,2022-10-14T21:00:31Z,2022-10-14 21:00:31
3801,2022_13_CLE_HOU,2022120404,HOU,CLE,REG,13,HOU,home,CLE,CLE,45.0,2022-12-04,161,161,161,Half2,0,26.0,0,4,4.0,0,02:41,CLE 45,3,75.0,(2:41) (Shotgun) 3-K.Allen pass deep left to 15-C.Moore to CLE 6 for 39 yards (33-R.Harrison; 54-D.Jones). CLE-33-R.Harrison was injured during the play.,pass,39.0,1,0,1.0,0,0,0,deep,left,18.0,21.0,,,,,,,1,2,0.0,,,,,1.0,2.0,8,27,8.0,27.0,-19.0,8.0,27.0,-19.0,0.485803991556168,0.087135411798954,0.0005441799294203,0.100374430418015,0.133123368024826,0.0097419330850243,0.183276653289795,0.0,0.0,0.736674935091287,4.80865527968854,-20.0909080730528,20.0909080730528,-5.70191064486474,5.70191064486474,-8.84645398440041,8.84645398440041,3.17353116325103,1.63512411643751,3.17353116325103,1.63512411643751,-5.1984990122146,5.1984990122146,8.49316694069421,-8.49316694069421,0.895592282817233,-0.895592282817233,-11.5967867499726,11.5967867499726,0.0009052351815626,0.999094764818437,0.0009052351815626,0.999094764818437,0.00256140565034,0.000637251738226,0.000637251738226,0.0034666408319026,0.996533359168097,0.0002682569029275,0.0002682569029275,-0.613167584494409,0.613167584494409,-0.0018454262408274,0.0018454262408274,0.0,0.00256140565034,0.0,0.00256140565034,-0.012018991750665,0.012018991750665,0.0040761496638879,-0.0040761496638879,-0.383120679995045,0.383120679995045,0.353225307922919,-0.353225307922919,0.0,0.0,1.0,0.0,0.0,0.0,1.0,0.0,0.0,0,0.0,0.0,0.0,0.0,0.0,0.0,0.0,0.0,0.0,0.0,0.0,0.0,0.0,0.0,0.0,0.0,0.0,0.0,0.0,0.0,0.0,0.0,0.0,1.0,0.0,0.0,0.0,0.0,0.0,0.0,0.0,0.0,0.0,0.0,0.0,1.0,1.0,0.0,0.0,0.0,0.0,00-0034577,K.Allen,39.0,00-0032398,C.Moore,39.0,,,,,,,,,,,,,,,,,,,,,,,,,,,,,,,,,,,,,,,,,,,,,,,,,,,,00-0034779,R.Harrison,CLE,00-0032388,D.Jones,CLE,,,,,,,0.0,,,,,,,,,,,,,,,,,,,,,,,,,,,,,,,,0.0,,,,,0,,,0.0,0.0,0.0,0.0,,,2022,0.471587389707565,52.8412610292435,54,1,First down,3801,"12/4/22, 13:02:33",2022-12-04T21:04:01.017Z,NRG Stadium,"Cloudy Temp: 68° F, Humidity: 74%, Wind: NNE 4 mph",ba0f6ad4-d24c-11ec-b23d-d15a91047884,0,0,PASS,0,,2022-12-04T21:04:14.643Z,,26,Touchdown,2022-12-04T21:00:43.153Z,7.0,2:06,3.0,1.0,1.0,4.0,4.0,0.0,KICKOFF,TOUCHDOWN,04:03,01:57,HOU 25,CLE 6,3673.0,3858.0,27,14,Home,-13,41,-7.5,47.0,0,closed,astroturf,,,Lovie Smith,Kevin Stefanski,HOU00,NRG Stadium,0,1.0,K.Allen,3.0,,,C.Moore,15.0,1,0,1.0,0,1,00-0034577,,00-0032398,K.Allen,3.0,00-0034577,C.Moore,00-0032398,C.Moore,00-0032398,0,1,4.80865527968854,0.506152405066678,5.77369579553488,3.0,1.0,1.0,0.966679155826569,3.33208441734314,2022-12-04,R.Harrison,2022,REG,CLE,13,00-0034779,S,Ronnie Harrison,Ronnie,Harrison,,,,Shoulder,,Full Participation in Practice,2022-12-02T19:18:07Z,2022-12-02 19:18:07
3798,2022_07_PIT_MIA,2022102311,MIA,PIT,REG,7,MIA,home,PIT,PIT,42.0,2022-10-23,161,161,161,Half2,0,22.0,0,4,3.0,0,02:41,PIT 42,3,7.0,(2:41) 1-T.Tagovailoa pass incomplete short left to 10-T.Hill. PIT-29-L.Wallace was injured during the play.,pass,0.0,0,0,1.0,0,0,0,short,left,11.0,,,,,,,,2,0,0.0,,,,,2.0,0.0,16,10,16.0,10.0,6.0,16.0,10.0,6.0,0.663128554821014,0.0462530367076397,0.0003186740505043,0.0558968894183636,0.101395353674889,0.0047537051141262,0.128253757953644,0.0,0.0,0.680795092775952,-0.90871944942046,7.12311646112357,-7.12311646112357,-6.54193642351311,6.54193642351311,10.4587223295013,-10.4587223295013,1.23889416235033,-2.14761361177079,0.0,0.0,11.0472376419058,-11.0472376419058,-5.42550084757386,5.42550084757386,16.1563622150863,-16.1563622150863,-7.53628721949007,7.53628721949007,0.915062844753265,0.0849371552467346,0.915062844753265,0.0849371552467346,-0.0230393409729004,-0.0195688605308533,-0.0195688605308533,0.892023503780365,0.107976496219635,0.947599470615387,0.947599470615387,0.113013550639153,-0.113013550639153,0.093987263568144,-0.093987263568144,0.0,-0.0230393409729004,0.0,0.0,-0.239769529829358,0.239769529829358,0.221487943190173,-0.221487943190173,-0.243357193003033,0.243357193003033,0.298491913932399,-0.298491913932399,0.0,0.0,0.0,0.0,0.0,1.0,0.0,0.0,1.0,0,0.0,0.0,0.0,0.0,0.0,0.0,0.0,0.0,0.0,0.0,0.0,0.0,0.0,0.0,0.0,0.0,0.0,0.0,0.0,0.0,0.0,0.0,0.0,1.0,0.0,0.0,0.0,0.0,0.0,0.0,0.0,0.0,0.0,0.0,0.0,0.0,0.0,0.0,0.0,0.0,0.0,00-0036212,T.Tagovailoa,,00-0033040,T.Hill,,,,,,,,,,,,,,,,,,,,,,,,,,,,,,,,,,,,,,,,,,,,,,,,,,,,,,,,,,,,,,,,,0.0,,,,,,,,,,,,,,,,,,,,,,,,,,,,,,,,0.0,,,,,0,,,0.0,0.0,0.0,0.0,,,2022,0.559505343437195,-55.9505343437195,53,0,Punt,3798,"10/23/22, 20:23:49",2022-10-24T03:12:00.130Z,Hard Rock Stadium,"Partly Cloudy Temp: 78° F, Humidity: 63%, Wind: ENE 10 mph",957349f6-d24c-11ec-b23d-d15a91047884,0,0,PASS,0,,2022-10-24T03:12:04.033Z,,22,Punt,2022-10-24T03:09:49.880Z,3.0,0:26,0.0,0.0,0.0,4.0,4.0,0.0,INTERCEPTION,PUNT,02:57,02:31,PIT 49,PIT 42,3749.0,3830.0,10,16,Home,6,26,7.5,44.5,0,outdoors,grass,,,Mike McDaniel,Mike Tomlin,MIA00,Hard Rock Stadium,0,0.0,T.Tagovailoa,1.0,,,T.Hill,10.0,1,0,0.0,0,1,00-0036212,,00-0033040,T.Tagovailoa,1.0,00-0036212,T.Hill,00-0033040,T.Hill,00-0033040,0,1,-0.90871944942046,0.35483786980021,3.59144685973297,1.0,1.0,1.0,0.524736344814301,47.52636551857,2022-10-23,L.Wallace,2022,REG,PIT,7,00-0034514,CB,Levi Wallace,Levi,Wallace,,,,Concussion,,Full Participation in Practice,2022-10-21T18:59:13Z,2022-10-21 18:59:13
3766,2022_08_NYG_SEA,2022103011,SEA,NYG,REG,8,SEA,home,NYG,SEA,70.0,2022-10-30,75,75,75,Half2,0,23.0,0,4,4.0,0,01:15,SEA 30,10,1.0,"(1:15) 4-M.Dickson punts 57 yards to NYG 13, Center-46-C.Tinker. 30-D.Holmes ran ob at NYG 13 for no gain (83-D.Young). SEA-26-R.Neal was injured during the play.",punt,0.0,0,0,0.0,0,0,0,,,,,,,,57.0,,,2,0,0.0,,,,,2.0,0.0,27,13,27.0,13.0,14.0,27.0,13.0,14.0,0.778523862361908,0.0767313688993454,0.001348658464849,0.0708608999848366,0.0435628406703472,0.0009595794253982,0.0280127953737974,0.0,0.0,-0.40022047504317,0.178528417251073,13.8554412976093,-13.8554412976093,3.41565982977045,-3.41565982977045,-2.87865759132396,2.87865759132396,,,0.0,0.0,-7.9139218935743,7.9139218935743,6.79977026729329,-6.79977026729329,-1.20632434211439,1.20632434211439,-0.179296492684763,0.179296492684763,0.999379992485046,0.0006200075149536,0.999379992485046,0.0006200075149536,-0.0008155513787642,-0.000173962675035,-0.000173962675035,0.998564441106282,0.0014355588937178,0.999655604362488,0.999655604362488,0.183253636682713,-0.183253636682713,-0.207584344391969,0.207584344391969,,,0.0,0.0,-0.533752782593622,0.533752782593622,0.508096029763924,-0.508096029763924,-0.535504332135572,0.535504332135572,0.391397813117014,-0.391397813117014,0.0,0.0,0.0,0.0,0.0,0.0,0.0,0.0,0.0,0,0.0,1.0,0.0,0.0,0.0,0.0,0.0,0.0,0.0,0.0,0.0,0.0,0.0,0.0,1.0,0.0,0.0,0.0,0.0,0.0,0.0,0.0,0.0,0.0,0.0,0.0,0.0,0.0,0.0,0.0,0.0,0.0,0.0,1.0,0.0,0.0,0.0,0.0,0.0,0.0,0.0,,,,,,,,,,,,,,,,,,,,,,00-0036394,D.Holmes,,,,,,,00-0034160,M.Dickson,,,,,,,,,,,,,,,,,,,,,SEA,,00-0037093,,D.Young,,,,,,,,,,,,,,0.0,,,,,,,,,,,,,,,,,,,,,,,,,,,,,,,NYG,0.0,,,,,0,,,0.0,0.0,0.0,0.0,,,2022,,,51,0,Punt,3766,"10/30/22, 16:25:31",2022-10-30T23:21:18Z,Lumen Field,"Rain Temp: 54° F, Humidity: 72%, Wind: N 12 mph",9573e35d-d24c-11ec-b23d-d15a91047884,0,0,PUNT,1,,,,23,Punt,2022-10-30T23:11:13.937Z,6.0,1:25,1.0,0.0,0.0,4.0,4.0,-15.0,DOWNS,PUNT,02:32,01:07,SEA 29,SEA 30,3601.0,3766.0,13,27,Home,14,40,3.0,44.5,0,outdoors,fieldturf,,,Pete Carroll,Brian Daboll,SEA00,Lumen Field,0,1.0,,,,,,,0,0,0.0,1,0,,,,,,,,,,,1,1,0.178528417251073,,,,,,,,2022-10-30,R.Neal,2022,REG,SEA,8,00-0034527,S,Ryan Neal,Ryan,Neal,,,,Ankle,,Full Participation in Practice,2022-10-28T21:06:33Z,2022-10-28 21:06:33
3765,2022_22_KC_PHI,2023021200,PHI,KC,POST,22,KC,away,PHI,KC,62.0,2023-02-12,272,272,272,Half2,0,17.0,0,4,1.0,0,04:32,KC 38,10,66.0,(4:32) 10-I.Pacheco up the middle to KC 40 for 2 yards (23-C.Gardner-Johnson; 97-J.Hargrave). KC-10-I.Pacheco was injured during the play.,run,2.0,0,0,0.0,0,0,0,,,,,middle,,,,,,2,2,0.0,,,,,2.0,2.0,35,35,35.0,35.0,0.0,35.0,35.0,0.0,0.291380643844605,0.0774864926934242,0.0006768771563656,0.111360602080822,0.197058886289597,0.001859255018644,0.320177227258682,0.0,0.0,1.8227983127581,-0.589658790151589,-1.73961761130827,1.73961761130827,-4.83173146266188,4.83173146266188,0.386196535182113,-0.386196535182113,,,0.0,0.0,7.65393875576785,-7.65393875576785,-3.48797592103755,3.48797592103755,12.4733918073144,-12.4733918073144,-10.1457116436619,10.1457116436619,0.50190281867981,0.49809718132019,0.49809718132019,0.50190281867981,-0.0250993072986603,-0.051125705242157,0.051125705242157,0.523196488618851,0.476803511381149,0.592669785022736,0.407330214977264,-0.0038897788321239,0.0038897788321239,-0.050051030231463,0.050051030231463,,,0.0,0.0,0.251452594723918,-0.251452594723918,-0.112212252060141,0.112212252060141,0.251452594723918,-0.251452594723918,-0.22523536924478,0.22523536924478,0.0,0.0,0.0,0.0,0.0,0.0,0.0,0.0,0.0,0,0.0,0.0,0.0,0.0,0.0,0.0,0.0,0.0,0.0,0.0,0.0,0.0,0.0,0.0,0.0,0.0,0.0,0.0,0.0,0.0,0.0,0.0,1.0,0.0,0.0,0.0,0.0,0.0,0.0,0.0,0.0,0.0,0.0,0.0,0.0,0.0,1.0,0.0,0.0,0.0,0.0,,,,,,,00-0037197,I.Pacheco,2.0,,,,,,,,,,,,,,,,,,,,,,,,,,,,,,,,,,,,,,,,,,,,,,,,,00-0035253,C.Gardner-Johnson,PHI,00-0033109,J.Hargrave,PHI,,,,,,,0.0,,,,,,,,,,,,,,,,,,,,,,,,,,,,,,,,0.0,,,,,0,,,0.0,0.0,0.0,0.0,,,2022,,,52,1,First down,3765,"2/12/23, 18:43:39",2023-02-13T02:56:40.573Z,State Farm Stadium,"Sunny Temp: 77° F, Humidity: 9%, Wind: SE 11 mph",70e5ba20-9aaa-11ed-99e5-6b206f74937e,0,0,RUSH,0,,2023-02-13T02:56:45.120Z,,17,Field goal,2023-02-13T02:54:53.933Z,12.0,5:07,4.0,1.0,1.0,4.0,4.0,4.0,KICKOFF,FIELD_GOAL,05:15,00:08,KC 25,PHI 9,3700.0,4024.0,38,35,Neutral,-3,73,1.0,51.0,0,closed,grass,,,Nick Sirianni,Andy Reid,PHO00,State Farm Stadium,0,0.0,,,I.Pacheco,10.0,,,0,1,0.0,0,1,,00-0037197,,I.Pacheco,10.0,00-0037197,I.Pacheco,00-0037197,I.Pacheco,00-0037197,0,1,-0.589658790151589,,,,,,0.537040591239929,-53.7040591239929,2023-02-12,I.Pacheco,2022,SB,KC,22,00-0037197,RB,Isiah Pacheco,Isiah,Pacheco,,,,Wrist,,Full Participation in Practice,2023-02-10T21:21:45Z,2023-02-10 21:21:45
3759,2022_03_LV_TEN,2022092507,TEN,LV,REG,3,LV,away,TEN,TEN,9.0,2022-09-25,86,86,86,Half2,0,18.0,0,4,2.0,1,01:26,TEN 9,9,81.0,(1:26) (Shotgun) 4-D.Carr pass incomplete short left to 10-M.Hollins. TEN-26-K.Fulton was injured during the play. His return is Questionable.,pass,0.0,1,0,1.0,0,0,0,short,left,9.0,,,,,,,,1,0,0.0,,,,,0.0,1.0,24,16,16.0,24.0,-8.0,16.0,24.0,-8.0,0.232336446642876,0.0025788131169974,0.0003117615415249,0.0144200883805752,0.268829971551895,0.0022964510135352,0.479226469993591,0.0,0.0,4.05636752553983,-1.33839684899431,2.22265943922791,-2.22265943922791,-3.48415951450597,3.48415951450597,10.1075646249727,-10.1075646249727,2.94363247446017,-4.28202932345448,0.0,0.0,-8.26729819143657,8.26729819143657,10.2102239560918,-10.2102239560918,-24.8554541486083,24.8554541486083,35.610133517467,-35.610133517467,0.129725068807602,0.870274931192398,0.870274931192398,0.129725068807602,-0.0056216344237327,0.0195868611335754,-0.0195868611335754,0.875896565616131,0.124103434383869,0.183070436120033,0.816929563879967,0.111641630674866,-0.111641630674866,0.3228886005209,-0.3228886005209,0.0,-0.0056216344237327,0.0,0.0,-0.0657690045903442,0.0657690045903442,0.133949531077984,-0.133949531077984,-0.0637661097119567,0.0637661097119567,0.360687015413884,-0.360687015413884,0.0,0.0,0.0,0.0,0.0,0.0,0.0,0.0,1.0,0,0.0,0.0,0.0,0.0,0.0,0.0,0.0,0.0,0.0,0.0,0.0,0.0,0.0,0.0,0.0,0.0,0.0,0.0,0.0,0.0,0.0,0.0,0.0,1.0,0.0,0.0,0.0,0.0,0.0,0.0,0.0,0.0,0.0,0.0,0.0,0.0,0.0,0.0,0.0,0.0,0.0,00-0031280,D.Carr,,00-0033555,M.Hollins,,,,,,,,,,,,,,,,,,,,,,,,,,,,,,,,,,,,,,,,,,,,,,,,,,,,,,,,,,,,,,,,,0.0,,,,,,,,,,,,,,,,,,,,,,,,,,,,,,,,0.0,,,,,0,,,0.0,0.0,0.0,0.0,,,2022,0.358195543289185,-35.8195543289185,55,1,Touchdown,3759,"9/25/22, 13:02:55",2022-09-25T20:03:27.220Z,Nissan Stadium,"Cloudy Temp: 77° F, Humidity: 72%, Wind: W 5 mph",7ae89aac-d24c-11ec-b23d-d15a91047884,0,0,PASS,0,,2022-09-25T20:03:31.327Z,,18,Touchdown,2022-09-25T19:49:43.730Z,14.0,1:43,5.0,1.0,1.0,4.0,4.0,0.0,PUNT,TOUCHDOWN,02:57,01:14,LV 19,TEN 9,3407.0,3842.0,22,24,Home,2,46,-1.5,45.5,0,outdoors,grass,,,Mike Vrabel,Josh McDaniels,NAS00,Nissan Stadium,0,0.0,D.Carr,4.0,,,M.Hollins,10.0,1,0,0.0,0,1,00-0031280,,00-0033555,D.Carr,4.0,00-0031280,M.Hollins,00-0033555,M.Hollins,00-0033555,0,1,-1.33839684899431,,,,,,0.966340959072113,3.3659040927887,2022-09-25,K.Fulton,2022,REG,TEN,3,00-0036416,CB,Kristian Fulton,Kristian,Fulton,,,,Hamstring,,Full Participation in Practice,2022-09-23T19:41:46Z,2022-09-23 19:41:46
3733,2022_07_SEA_LAC,2022102309,LAC,SEA,REG,7,LAC,home,SEA,SEA,30.0,2022-10-23,457,457,457,Half2,0,22.0,0,4,3.0,0,07:37,SEA 30,5,49.0,(7:37) (Shotgun) 10-J.Herbert sacked at SEA 38 for -8 yards (77-Q.Jefferson). SEA-10-U.Nwosu was injured during the play.,pass,-8.0,1,0,1.0,0,0,0,,,,,,,,,,,3,2,0.0,,,,,3.0,2.0,16,30,16.0,30.0,-14.0,16.0,30.0,-14.0,0.0660770609974861,0.0501812063157558,0.0008625283371657,0.0797618478536606,0.438463985919952,0.0007547467248514,0.363898605108261,0.0,0.0,3.15359007637017,-2.90068854298443,-24.7779746611506,24.7779746611506,-5.74661588983145,5.74661588983145,-15.1450839861846,15.1450839861846,,,0.0,0.0,-13.8796032690443,13.8796032690443,10.6270939232782,-10.6270939232782,-13.5472725630971,13.5472725630971,5.88587750159814,-5.88587750159814,0.0583702996373177,0.941629700362682,0.0583702996373177,0.941629700362682,-0.0241078920662403,-0.0217006765305996,-0.0217006765305996,0.0342624075710773,0.965737592428923,0.065161257982254,0.065161257982254,-0.133633436715556,0.133633436715556,-0.339181656385652,0.339181656385652,,,0.0,0.0,-0.303221869136555,0.303221869136555,0.108471107155553,-0.108471107155553,-0.303632820810539,0.303632820810539,0.0049299192135249,-0.0049299192135249,0.0,0.0,0.0,0.0,0.0,1.0,0.0,0.0,0.0,0,0.0,0.0,0.0,0.0,0.0,0.0,0.0,0.0,0.0,0.0,0.0,0.0,0.0,0.0,1.0,0.0,0.0,0.0,0.0,0.0,0.0,1.0,0.0,1.0,1.0,0.0,0.0,0.0,0.0,0.0,0.0,0.0,0.0,0.0,0.0,0.0,0.0,0.0,0.0,0.0,0.0,00-0036355,J.Herbert,,,,,,,,,,,,,,,,,,,,,,,,,,,,,,,,,,,,00-0032416,Q.Jefferson,,,00-0032416,Q.Jefferson,,,,,,,,,SEA,,00-0032416,,Q.Jefferson,,,,,,,,,,,,,,0.0,,,,,,,,,,,,,,,,,,,,,,,,,00-0032416,Q.Jefferson,,,,,,0.0,,,,,0,,,0.0,0.0,0.0,0.0,,,2022,,,55,0,Turnover on downs,3733,"10/23/22, 16:26:40",2022-10-23T23:20:50.707Z,SoFi Stadium,"Sunny Temp: 73° F, Humidity: 45%, Wind: SSW 5 mph",95733654-d24c-11ec-b23d-d15a91047884,0,0,SACK,0,,2022-10-23T23:20:55.500Z,,22,Turnover on downs,2022-10-23T23:17:29.607Z,7.0,2:01,2.0,0.0,0.0,4.0,4.0,0.0,KICKOFF,DOWNS,09:09,07:08,LAC 25,SEA 38,3610.0,3768.0,37,23,Home,-14,60,5.5,51.5,0,dome,matrixturf,,,Brandon Staley,Pete Carroll,LAX01,SoFi Stadium,0,0.0,J.Herbert,10.0,,,,,1,0,0.0,0,1,00-0036355,,,J.Herbert,10.0,00-0036355,,,,,0,0,-2.90068854298443,,,,,,0.972186803817749,2.7813196182251,2022-10-23,U.Nwosu,2022,REG,SEA,7,00-0034350,LB,Uchenna Nwosu,Uchenna,Nwosu,,,,Not injury related - resting player,,Full Participation in Practice,2022-10-20T23:04:42Z,2022-10-20 23:04:42
3707,2022_02_NE_PIT,2022091806,PIT,NE,REG,2,NE,away,PIT,PIT,20.0,2022-09-18,111,111,111,Half2,0,19.0,0,4,3.0,0,01:51,PIT 20,3,46.0,(1:51) 37-D.Harris left tackle to PIT 15 for 5 yards (97-C.Heyward). PIT-97-C.Heyward was injured during the play. NE-37-D.Harris was injured during the play.,run,5.0,0,0,0.0,0,0,0,,,,,left,tackle,,,,,0,2,0.0,,,,,2.0,0.0,14,17,17.0,14.0,3.0,17.0,14.0,3.0,0.341708481311798,0.0140721676871181,0.000376105075702,0.0159208569675684,0.440389603376389,0.0016033870633691,0.185929372906685,0.0,0.0,2.47146648261696,1.14064061368117,-7.53473173109619,7.53473173109619,-2.6709473770461,2.6709473770461,-9.94849014497847,9.94849014497847,,,0.0,0.0,-4.89144001906971,4.89144001906971,-4.56686696637273,4.56686696637273,-12.8682969458168,12.8682969458168,5.22776974687722,-5.22776974687722,0.920235693454742,0.0797643065452576,0.0797643065452576,0.920235693454742,0.0300936102867126,0.0182399749755859,-0.0182399749755859,0.0496706962585449,0.950329303741455,0.953840553760529,0.0461594462394714,-0.266443663349926,0.266443663349926,-0.428818643557373,0.428818643557373,,,0.0,0.0,0.409660722583532,-0.409660722583532,-0.698785305487458,0.698785305487458,0.142262752622366,-0.142262752622366,-0.460333079563919,0.460333079563919,0.0,1.0,0.0,0.0,1.0,0.0,0.0,0.0,0.0,0,0.0,0.0,0.0,0.0,0.0,0.0,0.0,0.0,0.0,0.0,0.0,0.0,0.0,0.0,1.0,0.0,0.0,0.0,0.0,0.0,0.0,0.0,1.0,0.0,0.0,0.0,0.0,0.0,0.0,0.0,0.0,0.0,0.0,0.0,0.0,0.0,0.0,0.0,0.0,0.0,0.0,,,,,,,00-0035657,D.Harris,5.0,,,,,,,,,,,,,,,,,,,,,,,,,,,,,,,,,,,,,,,,,,,PIT,,00-0027969,,C.Heyward,,,,,,,,,,,,,,0.0,,,,,,,,,,,,,,,,,,,,,,,,,,,,,,,,0.0,,,,,0,,,0.0,0.0,0.0,0.0,,,2022,,,49,1,First down,3707,"9/18/22, 13:02:27",2022-09-18T19:56:13.837Z,Acrisure Stadium,"Mostly Cloudy Temp: 81° F, Humidity: 51%, Wind: SW 8 mph",7ae83f73-d24c-11ec-b23d-d15a91047884,0,0,RUSH,0,,2022-09-18T19:56:17.197Z,,19,End of half,2022-09-18T19:45:58.453Z,13.0,6:33,4.0,1.0,0.0,4.0,4.0,-10.0,PUNT,END_GAME,06:33,00:00,NE 30,PIT 21,3490.0,3811.0,17,14,Home,-3,31,-3.0,40.0,0,outdoors,grass,,,Mike Tomlin,Bill Belichick,PIT00,Acrisure Stadium,0,1.0,,,D.Harris,37.0,,,0,1,1.0,0,1,,00-0035657,,D.Harris,37.0,00-0035657,D.Harris,00-0035657,D.Harris,00-0035657,0,1,1.14064061368117,,,,,,0.150511890649796,-15.0511890649796,2022-09-18,C.Heyward,2022,REG,PIT,2,00-0027969,DT,Cameron Heyward,Cameron,Heyward,,,,Not injury related - resting player,,Full Participation in Practice,2022-09-16T19:25:57Z,2022-09-16 19:25:57
3675,2022_16_TB_ARI,2022122502,ARI,TB,REG,16,ARI,home,TB,ARI,51.0,2022-12-25,377,377,377,Half2,0,22.0,0,4,1.0,0,06:17,ARI 49,10,30.0,(6:17) (Shotgun) Direct snap to 6-J.Conner. 6-J.Conner left end to TB 45 for 6 yards (32-M.Edwards). TB-32-M.Edwards was injured during the play.,run,6.0,1,0,0.0,0,0,0,,,,,left,end,,,,,3,2,0.0,,,,,3.0,2.0,16,13,16.0,13.0,3.0,16.0,13.0,3.0,0.172234639525414,0.0657042339444161,0.0010327785275876,0.0955997630953789,0.254531502723694,0.0029080267995595,0.407989084720612,0.0,0.0,2.75695755425841,0.298051437130198,4.28176540817367,-4.28176540817367,5.49541917344887,-5.49541917344887,-5.03384369728681,5.03384369728681,,,0.0,0.0,9.41226531751454,-9.41226531751454,-16.1326859642236,16.1326859642236,8.36868649284588,-8.36868649284588,-6.87460580625864,6.87460580625864,0.836665391921997,0.163334608078003,0.836665391921997,0.163334608078003,-0.0006226301193237,0.0082442760467529,0.0082442760467529,0.836042761802673,0.163957238197327,0.749149739742279,0.749149739742279,0.139963555955615,-0.139963555955615,-0.185484245957833,0.185484245957833,,,0.0,0.0,0.0910989791154861,-0.0910989791154861,-0.197621688785058,0.197621688785058,0.0927783995866776,-0.0927783995866776,-0.0934902732987222,0.0934902732987222,0.0,0.0,0.0,0.0,0.0,0.0,0.0,0.0,0.0,0,0.0,0.0,0.0,0.0,0.0,0.0,0.0,0.0,0.0,0.0,0.0,0.0,0.0,0.0,1.0,0.0,0.0,0.0,0.0,0.0,0.0,0.0,1.0,0.0,0.0,0.0,0.0,0.0,0.0,0.0,0.0,0.0,0.0,0.0,0.0,0.0,0.0,0.0,0.0,0.0,0.0,,,,,,,00-0033553,J.Conner,6.0,,,,,,,,,,,,,,,,,,,,,,,,,,,,,,,,,,,,,,,,,,,TB,,00-0035681,,M.Edwards,,,,,,,,,,,,,,0.0,,,,,,,,,,,,,,,,,,,,,,,,,,,,,,,,0.0,,,,,0,,,0.0,0.0,0.0,0.0,,,2022,,,49,0,Turnover,3675,"12/25/22, 20:22:46",2022-12-26T04:10:41.423Z,State Farm Stadium,"Clear Temp: 69° F, Humidity: 27%, Wind: WSW 2 mph",ba110615-d24c-11ec-b23d-d15a91047884,0,0,RUSH,0,,2022-12-26T04:10:46.063Z,,22,Turnover,2022-12-26T04:08:09.573Z,6.0,3:14,2.0,0.0,0.0,4.0,4.0,0.0,KICKOFF,FUMBLE,08:03,04:49,ARI 25,TB 42,3581.0,3723.0,19,16,Home,-3,35,-7.5,41.5,0,open,grass,,,Kliff Kingsbury,Todd Bowles,PHO00,State Farm Stadium,0,1.0,,,J.Conner,6.0,,6.0,0,1,0.0,0,1,,00-0033553,,J.Conner,6.0,00-0033553,J.Conner,00-0033553,J.Conner,00-0033553,0,0,0.298051437130198,,,,,,0.324485659599304,-32.4485659599304,2022-12-25,M.Edwards,2022,REG,TB,16,00-0035681,S,Mike Edwards,Mike,Edwards,Hamstring,,Questionable,Hamstring,,Limited Participation in Practice,2022-12-23T19:24:55Z,2022-12-23 19:24:55
3665,2022_03_PHI_WAS,2022092508,WAS,PHI,REG,3,PHI,away,WAS,PHI,59.0,2022-09-25,454,454,454,Half2,0,23.0,0,4,3.0,0,07:34,PHI 41,1,11.0,(7:34) (Shotgun) 1-J.Hurts left end to PHI 45 for 4 yards (31-K.Curl). WAS-31-K.Curl was injured during the play.,run,4.0,1,0,0.0,0,0,0,,,,,left,end,,,,,3,3,0.0,,,,,3.0,3.0,2,24,24.0,2.0,22.0,24.0,2.0,22.0,0.186778023838997,0.101722411811352,0.0018234299495816,0.143403068184853,0.207150235772133,0.0038299709558486,0.355292826890945,0.0,0.0,1.80352486483753,0.477369934553281,-29.6426268143857,29.6426268143857,7.6627414788527,-7.6627414788527,-40.4566364118916,40.4566364118916,,,0.0,0.0,-17.6507106403296,17.6507106403296,-8.23084446549183,8.23084446549183,-27.7439151529688,27.7439151529688,3.23481373832625,-3.23481373832625,0.999828696250916,0.0001713037490844,0.0001713037490844,0.999828696250916,1.53779983520508e-05,2.26497650146484e-06,-2.26497650146484e-06,0.0001559257507324,0.999844074249268,0.99996292591095,3.7074089050293e-05,0.0950472829863429,-0.0950472829863429,-0.706474882934323,0.706474882934323,,,0.0,0.0,-0.104215444098715,0.104215444098715,-0.311105702888743,0.311105702888743,-0.105757915447955,0.105757915447955,-0.272445356416573,0.272445356416573,0.0,1.0,0.0,0.0,1.0,0.0,0.0,0.0,0.0,0,0.0,0.0,0.0,0.0,0.0,0.0,0.0,0.0,0.0,0.0,0.0,0.0,0.0,0.0,1.0,0.0,0.0,0.0,0.0,0.0,0.0,0.0,1.0,0.0,0.0,0.0,0.0,0.0,0.0,0.0,0.0,0.0,0.0,0.0,0.0,0.0,0.0,0.0,0.0,0.0,0.0,,,,,,,00-0036389,J.Hurts,4.0,,,,,,,,,,,,,,,,,,,,,,,,,,,,,,,,,,,,,,,,,,,WAS,,00-0036349,,K.Curl,,,,,,,,,,,,,,0.0,,,,,,,,,,,,,,,,,,,,,,,,,,,,,,,,0.0,,,,,0,,,0.0,0.0,0.0,0.0,,,2022,,,53,1,First down,3665,"9/25/22, 13:02:33",2022-09-25T19:49:30.123Z,Commanders Field,"Sunny Temp: 72° F, Humidity: 60%, Wind: SSW 9 mph",7ae89f57-d24c-11ec-b23d-d15a91047884,0,0,RUSH,0,,2022-09-25T19:49:35.667Z,,23,Punt,2022-09-25T19:48:08.277Z,6.0,3:50,1.0,0.0,0.0,4.0,4.0,0.0,DOWNS,PUNT,08:55,05:05,PHI 32,PHI 43,3623.0,3771.0,24,8,Home,-16,32,-6.0,47.0,1,outdoors,grass,,,Ron Rivera,Nick Sirianni,WAS00,FedExField,0,1.0,,,J.Hurts,1.0,,,0,1,1.0,0,1,,00-0036389,,J.Hurts,1.0,00-0036389,J.Hurts,00-0036389,J.Hurts,00-0036389,0,1,0.477369934553281,,,,,,0.216731935739517,-21.6731935739517,2022-09-25,K.Curl,2022,REG,WAS,3,00-0036349,S,Kamren Curl,Kamren,Curl,,,,Thumb,,Full Participation in Practice,2022-09-23T18:19:33Z,2022-09-23 18:19:33
3588,2022_15_PHI_CHI,2022121801,CHI,PHI,REG,15,CHI,home,PHI,CHI,66.0,2022-12-18,444,444,444,Half2,0,21.0,0,4,3.0,0,07:24,CHI 34,4,-4.0,"(7:24) (Shotgun) 1-J.Fields scrambles left end to PHI 48 for 18 yards (94-J.Sweat). CHI-1-J.Fields was injured during the play. PENALTY on CHI-71-R.Reiff, Offensive Holding, 10 yards, enforced at CHI 34 - No Play.",no_play,0.0,1,0,0.0,0,0,1,,,,,,,,,,,3,3,0.0,,,,,3.0,3.0,13,17,13.0,17.0,-4.0,13.0,17.0,-4.0,0.205985382199287,0.120497412979603,0.0021275712642818,0.189960807561874,0.184130862355232,0.0030571033712476,0.294240862131119,0.0,0.0,0.922719794325531,-1.5494428826496,-6.19884565612301,6.19884565612301,-7.42670898151118,7.42670898151118,1.96762669262727,-1.96762669262727,,,0.0,0.0,-3.11495502555044,3.11495502555044,0.580912173863592,-0.580912173863592,-30.8907629665919,30.8907629665919,42.5629304321065,-42.5629304321065,0.341798573732376,0.658201426267624,0.341798573732376,0.658201426267624,-0.0836574137210846,-0.0438487380743027,-0.0438487380743027,0.258141160011292,0.741858839988709,0.208575665950775,0.208575665950775,-0.146414080349524,0.146414080349524,-0.185206781629414,0.185206781629414,,,0.0,0.0,0.0184248685836792,-0.0184248685836792,-0.284991275075765,0.284991275075765,0.0150475203990936,-0.0150475203990936,0.121586401458888,-0.121586401458888,0.0,0.0,0.0,0.0,0.0,0.0,0.0,0.0,0.0,0,0.0,0.0,0.0,0.0,0.0,0.0,0.0,0.0,0.0,0.0,0.0,0.0,0.0,0.0,0.0,0.0,1.0,0.0,0.0,0.0,0.0,0.0,0.0,0.0,0.0,0.0,0.0,0.0,0.0,0.0,0.0,0.0,0.0,0.0,0.0,0.0,0.0,0.0,0.0,0.0,0.0,,,,,,,,,,,,,,,,,,,,,,,,,,,,,,,,,,,,,,,,,,,,,,,,,,,,,,,,,,,,,,,,,,,,,,0.0,,,,,,,,,,,,,,,,,,,,,,,,,,,,,,,,0.0,CHI,00-0029672,R.Reiff,10.0,0,,Offensive Holding,0.0,0.0,0.0,0.0,,,2022,,,46,0,Punt,3588,"12/18/22, 13:02:44",2022-12-18T20:43:36.670Z,Soldier Field,"Sunny Temp: 18° F, Humidity: 71%, Wind: S 16 mph",ba107f18-d24c-11ec-b23d-d15a91047884,0,0,PENALTY,0,,2022-12-18T20:43:46.303Z,,21,Punt,2022-12-18T20:42:35.440Z,3.0,1:38,0.0,0.0,0.0,4.0,4.0,-10.0,MISSED_FG,PUNT,08:25,06:47,CHI 28,CHI 24,3539.0,3649.0,25,20,Home,-5,45,-8.5,48.0,0,outdoors,grass,17.0,17.0,Matt Eberflus,Nick Sirianni,CHI98,Soldier Field,0,0.0,J.Fields,1.0,,1.0,,,1,0,0.0,0,1,00-0036945,,,J.Fields,1.0,00-0036945,,,J.Fields,00-0036945,0,1,-1.5494428826496,,,,,,0.959376633167267,4.06233668327332,2022-12-18,J.Fields,2022,REG,CHI,15,00-0036945,QB,Justin Fields,Justin,Fields,,,,Illness,,Full Participation in Practice,2022-12-16T19:43:02Z,2022-12-16 19:43:02
3577,2022_16_PHI_DAL,2022122409,DAL,PHI,REG,16,PHI,away,DAL,PHI,52.0,2022-12-24,291,291,291,Half2,0,17.0,0,4,2.0,0,04:51,PHI 48,10,32.0,(4:51) (Shotgun) 10-G.Minshew pass short middle to 26-M.Sanders to DAL 46 for 6 yards (26-D.Bland). PHI-65-L.Johnson was injured during the play. His return is Questionable.,pass,6.0,1,0,1.0,0,0,0,short,middle,0.0,6.0,,,,,,,3,3,0.0,,,,,3.0,3.0,34,34,34.0,34.0,0.0,34.0,34.0,0.0,0.22910013794899,0.0704625546932221,0.0006329519092105,0.126516982913017,0.216226190328598,0.0035667268093675,0.353494495153427,0.0,0.0,2.03200104238931,0.1334618445253,-3.97048222384183,3.97048222384183,6.94748192715717,-6.94748192715717,-14.5900262900639,14.5900262900639,-0.766417407197878,0.899879251723178,-0.766417407197878,0.899879251723178,-10.3297015257704,10.3297015257704,9.58697829305311,-9.58697829305311,-7.45810433794395,7.45810433794395,-0.822750581249024,0.822750581249024,0.521656036376953,0.478343963623047,0.478343963623047,0.521656036376953,-0.0246506631374359,-0.0226233005523682,0.0226233005523682,0.502994626760483,0.497005373239517,0.548133254051209,0.451866745948792,0.185339672893868,-0.185339672893868,-0.280240923030962,0.280240923030962,0.0,-0.0246506631374359,0.0,-0.0246506631374359,0.18678138549064,-0.18678138549064,-0.179006130742433,0.179006130742433,0.190008977005227,-0.190008977005227,-0.264599168114993,0.264599168114993,0.0,0.0,0.0,0.0,0.0,0.0,0.0,0.0,0.0,0,0.0,0.0,0.0,0.0,0.0,0.0,0.0,0.0,0.0,0.0,0.0,0.0,0.0,0.0,1.0,0.0,0.0,0.0,0.0,0.0,0.0,0.0,0.0,1.0,0.0,0.0,0.0,0.0,0.0,0.0,0.0,0.0,0.0,0.0,0.0,1.0,0.0,0.0,0.0,0.0,0.0,00-0035289,G.Minshew,6.0,00-0035243,M.Sanders,6.0,,,,,,,,,,,,,,,,,,,,,,,,,,,,,,,,,,,,,,,,,,,,,,DAL,,00-0037275,,D.Bland,,,,,,,,,,,,,,0.0,,,,,,,,,,,,,,,,,,,,,,,,,,,,,,,,0.0,,,,,0,,,0.0,0.0,0.0,0.0,,,2022,0.625804543495178,37.4195456504822,54,0,Turnover,3577,"12/24/22, 16:25:26",2022-12-25T00:02:14Z,AT&T Stadium,,ba10f1c1-d24c-11ec-b23d-d15a91047884,0,0,PASS,0,,,,17,Turnover,2022-12-24T23:59:34.767Z,5.0,1:30,1.0,0.0,0.0,4.0,4.0,0.0,KICKOFF,INTERCEPTION,05:49,04:19,PHI 22,DAL 46,3483.0,3606.0,34,40,Home,6,74,4.0,48.0,1,closed,matrixturf,,,Mike McCarthy,Nick Sirianni,DAL00,AT&T Stadium,0,1.0,G.Minshew II,10.0,,,M.Sanders,26.0,1,0,0.0,0,1,00-0035289,,00-0035243,G.Minshew II,10.0,00-0035289,M.Sanders,00-0035243,M.Sanders,00-0035243,0,0,0.1334618445253,1.11099283208602,7.61574848290184,6.0,0.539472644100897,0.249152128468268,0.679396033287048,32.0603966712952,2022-12-24,L.Johnson,2022,REG,PHI,16,00-0030561,T,Lane Johnson,Lane,Johnson,,,,Not injury related - resting player,,Limited Participation in Practice,2022-12-21T20:38:59Z,2022-12-21 20:38:59
3560,2022_11_CLE_BUF,2022112002,BUF,CLE,REG,11,CLE,away,BUF,CLE,59.0,2022-11-20,327,327,327,Half2,0,19.0,0,4,1.0,0,05:27,CLE 41,5,75.0,(5:27) (Shotgun) 27-K.Hunt right tackle to BUF 48 for 11 yards (58-M.Milano). CLE-78-J.Conklin was injured during the play.,run,11.0,1,0,0.0,0,0,0,,,,,right,tackle,,,,,1,3,0.0,,,,,3.0,1.0,28,10,10.0,28.0,-18.0,10.0,28.0,-18.0,0.24125736951828,0.0657646283507347,0.0013701961142942,0.098159521818161,0.194011256098747,0.0016750306822359,0.397761970758438,0.0,0.0,2.48256669496186,0.423357597435825,21.2020134254855,-21.2020134254855,14.2282838596294,-14.2282838596294,-2.82771215819845,2.82771215819845,,,0.0,0.0,6.33791027747793,-6.33791027747793,-8.73208330557145,8.73208330557145,-3.93817876410321,3.93817876410321,0.742506441348484,-0.742506441348484,0.0040966616943478,0.995903338305652,0.995903338305652,0.0040966616943478,-0.0020231103990227,-0.0009476338746026,0.0009476338746026,0.997926448704675,0.0020735512953251,0.0022884323261678,0.997711567673832,0.227240504696965,-0.227240504696965,-0.0634917676874656,0.0634917676874656,,,0.0,0.0,0.170540513986979,-0.170540513986979,-0.144416198134422,0.144416198134422,0.170540513986979,-0.170540513986979,-0.18612118344754,0.18612118344754,0.0,1.0,0.0,0.0,0.0,0.0,0.0,0.0,0.0,0,0.0,0.0,0.0,0.0,0.0,0.0,0.0,0.0,0.0,0.0,0.0,0.0,0.0,0.0,1.0,0.0,0.0,0.0,0.0,0.0,0.0,0.0,1.0,0.0,0.0,0.0,0.0,0.0,0.0,0.0,0.0,0.0,0.0,0.0,0.0,0.0,0.0,0.0,0.0,0.0,0.0,,,,,,,00-0033923,K.Hunt,11.0,,,,,,,,,,,,,,,,,,,,,,,,,,,,,,,,,,,,,,,,,,,BUF,,00-0033571,,M.Milano,,,,,,,,,,,,,,0.0,,,,,,,,,,,,,,,,,,,,,,,,,,,,,,,,0.0,,,,,0,,,0.0,0.0,0.0,0.0,,,2022,,,52,1,First down,3560,"11/20/22, 13:02:25",2022-11-20T20:49:41.530Z,Ford Field,"Controlled Climate Temp: 68° F, Humidity: 70%, Wind: mph",9574db42-d24c-11ec-b23d-d15a91047884,0,0,RUSH,0,,2022-11-20T20:49:47.590Z,,19,Touchdown,2022-11-20T20:45:06.420Z,9.0,2:34,5.0,1.0,1.0,4.0,4.0,5.0,KICKOFF,TOUCHDOWN,06:45,04:11,CLE 25,BUF 7,3413.0,3679.0,23,31,Neutral,8,54,7.5,50.5,0,dome,fieldturf,,,Sean McDermott,Kevin Stefanski,DET00,Ford Field,0,1.0,,,K.Hunt,27.0,,,0,1,1.0,0,1,,00-0033923,,K.Hunt,27.0,00-0033923,K.Hunt,00-0033923,K.Hunt,00-0033923,0,0,0.423357597435825,,,,,,0.899125874042511,-89.9125874042511,2022-11-20,J.Conklin,2022,REG,CLE,11,00-0033057,T,Jack Conklin,Jack,Conklin,,,,Foot,Not injury related - resting p,Full Participation in Practice,2022-11-18T18:54:37Z,2022-11-18 18:54:37
3544,2022_08_CAR_ATL,2022103001,ATL,CAR,REG,8,ATL,home,CAR,ATL,59.0,2022-10-30,172,172,172,Half2,0,19.0,0,4,1.0,0,02:52,ATL 41,10,75.0,"(2:52) (No Huddle, Shotgun) 1-M.Mariota pass short left to 5-D.London to CAR 42 for 17 yards (26-D.Jackson). CAR-26-D.Jackson was injured during the play.",pass,17.0,1,1,1.0,0,0,0,short,left,14.0,3.0,,,,,,,3,3,0.0,,,,,3.0,3.0,24,28,24.0,28.0,-4.0,24.0,28.0,-4.0,0.335949540138245,0.0740909427404404,0.0006319059175439,0.0780902206897736,0.21192555129528,0.0033502504229545,0.295961618423462,0.0,0.0,1.94404029881116,1.02160248003202,-4.02504141309454,4.02504141309454,-9.08820708420912,9.08820708420912,5.34783615578535,-5.34783615578535,0.861308707331773,0.160293772700243,0.861308707331773,0.160293772700243,-4.64086992217926,4.64086992217926,0.284927683416754,-0.284927683416754,-13.8071565736318,13.8071565736318,22.5564458053476,-22.5564458053476,0.323655843734741,0.676344156265259,0.323655843734741,0.676344156265259,0.0770920217037201,0.0624870955944061,0.0624870955944061,0.400747865438461,0.599252134561539,0.344709575176239,0.344709575176239,-0.486018194560503,0.486018194560503,0.186638847117763,-0.186638847117763,0.0,0.0770920217037201,0.0,0.0770920217037201,-0.0143857619907517,0.0143857619907517,-0.258533255588158,0.258533255588158,-0.0143857619907517,0.0143857619907517,0.285887854595728,-0.285887854595728,0.0,0.0,1.0,0.0,0.0,0.0,0.0,0.0,0.0,0,0.0,0.0,0.0,0.0,0.0,0.0,0.0,0.0,0.0,0.0,0.0,0.0,0.0,0.0,1.0,0.0,0.0,0.0,0.0,0.0,0.0,0.0,0.0,1.0,0.0,0.0,0.0,0.0,0.0,0.0,0.0,0.0,0.0,0.0,0.0,1.0,0.0,0.0,0.0,0.0,0.0,00-0032268,M.Mariota,17.0,00-0037238,D.London,17.0,,,,,,,,,,,,,,,,,,,,,,,,,,,,,,,,,,,,,,,,,,,,,,CAR,,00-0034356,,D.Jackson,,,,,,,,,,,,,,0.0,,,,,,,,,,,,,,,,,,,,,,,,,,,,,,,,0.0,,,,,0,,,0.0,0.0,0.0,0.0,,,2022,0.648691058158875,35.1308941841126,51,1,First down,3544,"10/30/22, 13:02:45",2022-10-30T19:51:50.403Z,Mercedes-Benz Stadium,"Indoors Temp: 72° F, Humidity: 25%, Wind: N/A 0 mph",9573892c-d24c-11ec-b23d-d15a91047884,0,0,PASS,0,,2022-10-30T19:51:59.077Z,,19,Touchdown,2022-10-30T19:49:44.343Z,4.0,0:52,3.0,0.0,1.0,4.0,4.0,-5.0,KICKOFF,TOUCHDOWN,03:06,02:14,ATL 25,CAR 47,3478.0,3619.0,34,37,Home,3,71,4.5,41.0,1,closed,fieldturf,,,Arthur Smith,Steve Wilks,ATL97,Mercedes-Benz Stadium,0,1.0,M.Mariota,1.0,,,D.London,5.0,1,0,1.0,0,1,00-0032268,,00-0037238,M.Mariota,1.0,00-0032268,D.London,00-0037238,D.London,00-0037238,0,1,1.02160248003202,0.203818955650736,3.47560250677634,1.0,1.0,0.999580800067633,0.812310099601746,18.7689900398254,2022-10-30,D.Jackson,2022,REG,CAR,8,00-0034356,CB,Donte Jackson,Donte,Jackson,,,,Ankle,,Full Participation in Practice,2022-10-28T16:37:35Z,2022-10-28 16:37:35
3514,2022_18_NYJ_MIA,2023010807,MIA,NYJ,REG,18,MIA,home,NYJ,MIA,56.0,2023-01-08,120,120,120,Half2,0,17.0,0,4,2.0,0,02:00,MIA 44,9,36.0,"(2:00) (Shotgun) 19-S.Thompson pass short left to 17-J.Waddle to MIA 46 for 2 yards (56-Qu.Williams). MIA-17-J.Waddle was injured during the play. PENALTY on NYJ-56-Qu.Williams, Horse Collar Tackle, 15 yards, enforced at MIA 46.",pass,2.0,1,0,1.0,0,0,0,short,left,2.0,0.0,,,,,,,2,1,0.0,,,,,2.0,1.0,6,6,6.0,6.0,0.0,6.0,6.0,0.0,0.59028959274292,0.050573792308569,0.0005207024514675,0.0438442528247833,0.171587213873863,0.002289516152814,0.140894889831543,0.0,0.0,1.04593235114589,1.24653201265028,0.659595036238898,-0.659595036238898,9.64211962904289,-9.64211962904289,-9.23683123702562,9.23683123702562,-0.294330946810078,1.54086295946036,-0.294330946810078,1.54086295946036,-6.33101603121031,6.33101603121031,-3.17538519465879,3.17538519465879,-6.75961996457772,6.75961996457772,-1.39380955648289,1.39380955648289,0.663363397121429,0.336636602878571,0.663363397121429,0.336636602878571,0.0833477973937988,0.0716561675071716,0.0716561675071716,0.746711194515228,0.253288805484772,0.713854908943176,0.713854908943176,0.442655831575394,-0.442655831575394,-0.309955686330795,0.309955686330795,0.0,0.0833477973937988,0.0,0.0833477973937988,-0.367668837308884,0.367668837308884,-0.0243191719055176,0.0243191719055176,-0.362646847963333,0.362646847963333,0.0607035756111145,-0.0607035756111145,0.0,0.0,0.0,1.0,0.0,0.0,0.0,0.0,0.0,0,0.0,0.0,0.0,0.0,0.0,0.0,0.0,0.0,0.0,0.0,0.0,0.0,0.0,0.0,1.0,0.0,1.0,0.0,0.0,0.0,0.0,0.0,0.0,1.0,0.0,0.0,0.0,0.0,0.0,0.0,0.0,0.0,0.0,0.0,0.0,1.0,0.0,0.0,0.0,0.0,0.0,00-0037327,S.Thompson,2.0,00-0036613,J.Waddle,2.0,,,,,,,,,,,,,,,,,,,,,,,,,,,,,,,,,,,,,,,,,,,,,,NYJ,,00-0035680,,Qu.Williams,,,,,,,,,,,,,,0.0,,,,,,,,,,,,,,,,,,,,,,,,,,,,,,,,0.0,NYJ,00-0035680,Qu.Williams,15.0,0,,Horse Collar Tackle,0.0,0.0,0.0,0.0,,,2022,0.80314701795578,19.685298204422,44,1,First down,3514,"1/8/23, 13:03:18",2023-01-08T20:53:15.900Z,Hard Rock Stadium,"Temp: 78° F, Humidity: 54%, Wind: ENE 11 mph",ba117d16-d24c-11ec-b23d-d15a91047884,0,0,PASS,0,,2023-01-08T20:53:21.473Z,,17,Field goal,2023-01-08T20:48:44.563Z,8.0,2:43,2.0,0.0,1.0,4.0,4.0,15.0,PUNT,FIELD_GOAL,03:01,00:18,MIA 32,NYJ 32,3434.0,3629.0,6,11,Home,5,17,3.5,37.5,1,outdoors,grass,75.0,9.0,Mike McDaniel,Robert Saleh,MIA00,Hard Rock Stadium,0,1.0,S.Thompson,19.0,,,J.Waddle,17.0,1,0,1.0,0,1,00-0037327,,00-0036613,S.Thompson,19.0,00-0037327,J.Waddle,00-0036613,J.Waddle,00-0036613,0,1,1.24653201265028,0.614753390047388,5.2008699922153,4.0,0.612276425235905,0.28149477916304,0.712250709533691,28.7749290466309,2023-01-08,J.Waddle,2022,REG,MIA,18,00-0036613,WR,Jaylen Waddle,Jaylen,Waddle,,,,Shoulder,,Full Participation in Practice,2023-01-06T20:09:15Z,2023-01-06 20:09:15
3495,2022_10_MIN_BUF,2022111301,BUF,MIN,REG,10,MIN,away,BUF,MIN,55.0,2022-11-13,495,495,495,Half2,0,19.0,0,4,2.0,0,08:15,MIN 45,10,66.0,(8:15) (Shotgun) 8-K.Cousins pass short left to 17-K.Osborn pushed ob at BUF 49 for 6 yards (39-C.Lewis). BUF-39-C.Lewis was injured during the play.,pass,6.0,1,0,1.0,0,0,0,short,left,-1.0,7.0,,,,,,,3,1,0.0,,,,,1.0,3.0,27,17,17.0,27.0,-10.0,17.0,27.0,-10.0,0.197782695293427,0.0905827656388283,0.0013726424658671,0.15874345600605,0.228530004620552,0.0039688549004495,0.319019615650177,0.0,0.0,1.54096725932322,0.110740215051919,6.97568093110802,-6.97568093110802,-5.91072591443663,5.91072591443663,9.23937210537531,-9.23937210537531,-1.0283502235543,1.13909043860622,-1.0283502235543,1.13909043860622,10.2965075918764,-10.2965075918764,-6.27967252890812,6.27967252890812,8.6448571930523,-8.6448571930523,5.64479877995598,-5.64479877995598,0.0798097401857376,0.920190259814262,0.920190259814262,0.0798097401857376,0.0013308525085449,-0.0117558240890503,0.0117558240890503,0.918859407305717,0.0811405926942825,0.0747697949409485,0.925230205059052,0.0203609481288891,-0.0203609481288891,0.247412934379881,-0.247412934379881,0.0,0.0013308525085449,0.0,0.0013308525085449,-0.0023124334940264,0.0023124334940264,0.0283833220601082,-0.0283833220601082,-0.0043130633959124,0.0043130633959124,0.291718985885382,-0.291718985885382,0.0,0.0,0.0,0.0,0.0,0.0,0.0,0.0,0.0,0,0.0,0.0,0.0,0.0,0.0,0.0,0.0,0.0,0.0,0.0,0.0,0.0,0.0,0.0,1.0,0.0,0.0,0.0,0.0,0.0,0.0,0.0,0.0,1.0,0.0,0.0,0.0,0.0,0.0,0.0,0.0,0.0,0.0,0.0,0.0,1.0,0.0,0.0,0.0,0.0,0.0,00-0029604,K.Cousins,6.0,00-0036345,K.Osborn,6.0,,,,,,,,,,,,,,,,,,,,,,,,,,,,,,,,,,,,,,,,,,,,,,BUF,,00-0035357,,C.Lewis,,,,,,,,,,,,,,0.0,,,,,,,,,,,,,,,,,,,,,,,,,,,,,,,,0.0,,,,,0,,,0.0,0.0,0.0,0.0,,,2022,0.867213547229767,13.2786452770233,47,1,First down,3495,"11/13/22, 13:02:40",2022-11-13T20:40:50.177Z,Highmark Stadium,"Cloudy Temp: 38° F, Humidity: 83%, Wind: NW 8 mph",95747922-d24c-11ec-b23d-d15a91047884,0,0,PASS,0,,2022-11-13T20:40:55.347Z,,19,Touchdown,2022-11-13T20:36:16.503Z,13.0,5:53,5.0,1.0,1.0,4.0,4.0,0.0,INTERCEPTION,TOUCHDOWN,10:27,04:34,MIN 34,BUF 3,3366.0,3683.0,33,30,Home,-3,63,6.5,47.0,0,outdoors,a_turf,38.0,11.0,Sean McDermott,Kevin O'Connell,BUF00,New Era Field,0,1.0,K.Cousins,8.0,,,K.Osborn,17.0,1,0,0.0,0,1,00-0029604,,00-0036345,K.Cousins,8.0,00-0029604,K.Osborn,00-0036345,K.Osborn,00-0036345,1,1,0.110740215051919,1.12796061054537,7.43049027198867,6.0,0.475379277428147,0.212886792083737,0.872484624385834,12.7515375614166,2022-11-13,C.Lewis,2022,REG,BUF,10,00-0035357,CB,Cameron Lewis,Cameron,Lewis,,,,Forearm,,Full Participation in Practice,2022-11-11T19:57:34Z,2022-11-11 19:57:34
3467,2022_18_KC_LV,2023010700,LV,KC,REG,18,LV,home,KC,LV,57.0,2023-01-07,285,285,285,Half2,0,18.0,0,4,2.0,0,04:45,LV 43,21,16.0,(4:45) (Shotgun) 3-J.Stidham pass incomplete deep middle to 17-D.Adams. LV-17-D.Adams was injured during the play.,pass,0.0,1,0,1.0,0,0,0,deep,middle,18.0,,,,,,,,1,3,0.0,,,,,1.0,3.0,13,31,13.0,31.0,-18.0,13.0,31.0,-18.0,0.303980767726898,0.0665169954299927,0.0007586611318401,0.149910807609558,0.198967635631561,0.0083152195438742,0.271549910306931,0.0,0.0,1.26393875631038,-0.781617194763385,-20.7757979250223,20.7757979250223,-12.8170464612776,12.8170464612776,-6.28211307730754,6.28211307730754,1.39672555244761,-2.17834274721099,0.0,0.0,1.88452978752474,-1.88452978752474,2.99746048955598,-2.99746048955598,11.8358183903635,-11.8358183903635,-14.8129459963075,14.8129459963075,0.0015418247785419,0.998458175221458,0.0015418247785419,0.998458175221458,-0.0002098535187542,-7.43886339478195e-05,-7.43886339478195e-05,0.0013319712597876,0.998668028740212,0.0005681281909346,0.0005681281909346,-0.150624912217142,0.150624912217142,-0.406905818436289,0.406905818436289,0.0,-0.0002098535187542,0.0,0.0,-0.0505437414070997,0.0505437414070997,-0.0330200126336422,0.0330200126336422,-0.0561624328514967,0.0561624328514967,-0.164137475396274,0.164137475396274,0.0,0.0,0.0,0.0,0.0,0.0,0.0,0.0,1.0,0,0.0,0.0,0.0,0.0,0.0,0.0,0.0,0.0,0.0,0.0,0.0,0.0,0.0,0.0,0.0,0.0,0.0,0.0,0.0,0.0,0.0,0.0,0.0,1.0,0.0,0.0,0.0,0.0,0.0,0.0,0.0,0.0,0.0,0.0,0.0,0.0,0.0,0.0,0.0,0.0,0.0,00-0035264,J.Stidham,,00-0031381,D.Adams,,,,,,,,,,,,,,,,,,,,,,,,,,,,,,,,,,,,,,,,,,,,,,,,,,,,,,,,,,,,,,,,,0.0,,,,,,,,,,,,,,,,,,,,,,,,,,,,,,,,0.0,,,,,0,,,0.0,0.0,0.0,0.0,,,2022,0.69089013338089,-69.089013338089,53,0,Turnover on downs,3467,"1/7/23, 16:30:31",2023-01-08T00:10:02.893Z,Allegiant Stadium,"Partly Cloudy Temp: 54° F, Humidity: 53%, Wind: SE 4 mph",ba11997e-d24c-11ec-b23d-d15a91047884,0,0,PASS,0,,2023-01-08T00:10:09.633Z,,18,Turnover on downs,2023-01-08T00:06:16.697Z,8.0,1:43,2.0,0.0,0.0,4.0,4.0,4.0,PUNT,DOWNS,06:07,04:24,LV 18,LV 43,3324.0,3526.0,31,13,Home,-18,44,-9.0,51.5,1,dome,grass,,,Josh McDaniels,Andy Reid,VEG00,Allegiant Stadium,0,0.0,J.Stidham,3.0,,,D.Adams,17.0,1,0,0.0,0,1,00-0035264,,00-0031381,J.Stidham,3.0,00-0035264,D.Adams,00-0031381,D.Adams,00-0031381,0,0,-0.781617194763385,0.563525909216495,3.90271026850678,2.0,1.0,0.445329722948372,0.916723310947418,8.32766890525818,2023-01-07,D.Adams,2022,REG,LV,18,00-0031381,WR,Davante Adams,Davante,Adams,,,,Illness,,Full Participation in Practice,2023-01-05T23:02:00Z,2023-01-05 23:02:00
3464,2022_19_SEA_SF,2023011400,SF,SEA,POST,19,SF,home,SEA,SEA,23.0,2023-01-14,436,436,436,Half2,0,18.0,0,4,3.0,0,07:16,SEA 23,7,24.0,(7:16) (Shotgun) 23-C.McCaffrey up the middle to SEA 13 for 10 yards (6-Q.Diggs). SEA-26-R.Neal was injured during the play.,run,10.0,1,0,0.0,0,0,0,,,,,middle,,,,,,3,2,0.0,,,,,3.0,2.0,38,17,38.0,17.0,21.0,38.0,17.0,21.0,0.0586027167737484,0.0290269274264574,0.0004410455876495,0.0418712869286537,0.549161612987518,0.000833072932437,0.320063352584839,0.0,0.0,3.50853257096605,1.38105771766277,29.69778600536,-29.69778600536,4.47275280896924,-4.47275280896924,21.5056360043021,-21.5056360043021,,,0.0,0.0,-4.59411588066723,4.59411588066723,17.2695884870482,-17.2695884870482,8.22880001828889,-8.22880001828889,6.03931740731804,-6.03931740731804,0.99937492609024,0.0006250739097595,0.99937492609024,0.0006250739097595,0.0002093315124511,6.23464584350586e-05,6.23464584350586e-05,0.999584257602692,0.0004157423973083,0.999842405319214,0.999842405319214,0.184515977337295,-0.184515977337295,0.188113886749044,-0.188113886749044,,,0.0,0.0,-0.0224261917173862,0.0224261917173862,0.192164726433948,-0.192164726433948,-0.0226715840399265,0.0226715840399265,0.0573226575457008,-0.0573226575457008,0.0,1.0,0.0,0.0,1.0,0.0,0.0,0.0,0.0,0,0.0,0.0,0.0,0.0,0.0,0.0,0.0,0.0,0.0,0.0,0.0,0.0,0.0,0.0,1.0,0.0,0.0,0.0,0.0,0.0,0.0,0.0,1.0,0.0,0.0,0.0,0.0,0.0,0.0,0.0,0.0,0.0,0.0,0.0,0.0,0.0,0.0,0.0,0.0,0.0,0.0,,,,,,,00-0033280,C.McCaffrey,10.0,,,,,,,,,,,,,,,,,,,,,,,,,,,,,,,,,,,,,,,,,,,SEA,,00-0031608,,Q.Diggs,,,,,,,,,,,,,,0.0,,,,,,,,,,,,,,,,,,,,,,,,,,,,,,,,0.0,,,,,0,,,0.0,0.0,0.0,0.0,,,2022,,,49,1,First down,3464,"1/14/23, 16:33:00",2023-01-15T00:10:50.700Z,Levi's® Stadium,"Rain Temp: 57° F, Humidity: 77%, Wind: SSW 5 mph",f4ed1058-8fd5-11ed-9789-5c606116f089,0,0,RUSH,0,,2023-01-15T00:10:56.573Z,,18,Field goal,2023-01-15T00:07:12.210Z,10.0,5:49,2.0,1.0,1.0,4.0,4.0,0.0,INTERCEPTION,FIELD_GOAL,10:45,04:56,SEA 37,SEA 13,3337.0,3552.0,23,41,Home,18,64,10.0,42.0,1,outdoors,grass,57.0,11.0,Kyle Shanahan,Pete Carroll,SFO01,Levi's Stadium,0,1.0,,,C.McCaffrey,23.0,,,0,1,1.0,0,1,,00-0033280,,C.McCaffrey,23.0,00-0033280,C.McCaffrey,00-0033280,C.McCaffrey,00-0033280,0,0,1.38105771766277,,,,,,0.863170146942139,-86.3170146942139,2023-01-14,R.Neal,2022,WC,SEA,19,00-0034527,S,Ryan Neal,Ryan,Neal,,,,Knee,,Limited Participation in Practice,2023-01-12T22:04:26Z,2023-01-12 22:04:26
3456,2022_10_ATL_CAR,2022111000,CAR,ATL,REG,10,ATL,away,CAR,ATL,90.0,2022-11-10,279,279,279,Half2,0,19.0,0,4,3.0,0,04:39,ATL 10,3,97.0,"(4:39) (No Huddle, Shotgun) 1-M.Mariota scrambles right tackle to ATL 24 for 14 yards (49-F.Luvu). CAR-26-D.Jackson was injured during the play. His return is Questionable.",run,14.0,1,1,1.0,0,0,1,,,,,right,tackle,,,,,2,3,0.0,,,,,3.0,2.0,22,9,9.0,22.0,-13.0,9.0,22.0,-13.0,0.341065645217896,0.159126102924347,0.0099215656518936,0.217848584055901,0.100429713726044,0.0011967974714934,0.170411556959152,0.0,0.0,-0.525597893632948,1.43013030150905,14.6886107862088,-14.6886107862088,5.85168052878714,-5.85168052878714,8.21612812339845,-8.21612812339845,,,0.0,0.0,-7.60289340649615,7.60289340649615,7.1979992435663,-7.1979992435663,-20.2472830505285,20.2472830505285,22.5122334591852,-22.5122334591852,0.0273059438914061,0.972694056108594,0.972694056108594,0.0273059438914061,0.0070803705602884,0.0067462399601936,-0.0067462399601936,0.965613685548306,0.0343863144516945,0.0329254865646362,0.967074513435364,0.0921769791100796,-0.0921769791100796,0.190994321712804,-0.190994321712804,,,0.0,0.0,0.0640841424465179,-0.0640841424465179,-0.0312881717741967,0.0312881717741967,0.0640841424465179,-0.0640841424465179,0.055475983181548,-0.055475983181548,0.0,1.0,0.0,0.0,1.0,0.0,0.0,0.0,0.0,0,0.0,0.0,0.0,0.0,0.0,0.0,0.0,0.0,0.0,0.0,0.0,0.0,0.0,0.0,1.0,0.0,0.0,0.0,0.0,0.0,0.0,0.0,1.0,0.0,0.0,0.0,0.0,0.0,0.0,0.0,0.0,0.0,0.0,0.0,0.0,0.0,0.0,0.0,0.0,0.0,0.0,,,,,,,00-0032268,M.Mariota,14.0,,,,,,,,,,,,,,,,,,,,,,,,,,,,,,,,,,,,,,,,,,,CAR,,00-0034302,,F.Luvu,,,,,,,,,,,,,,0.0,,,,,,,,,,,,,,,,,,,,,,,,,,,,,,,,0.0,,,,,0,,,0.0,0.0,0.0,0.0,,,2022,,,46,1,First down,3456,"11/10/22, 20:15:59",2022-11-11T03:55:26.193Z,Bank of America Stadium,"Light Rain Temp: 60° F, Humidity: 94%, Wind: ENE 11 mph",95746a29-d24c-11ec-b23d-d15a91047884,0,0,RUSH,0,,2022-11-11T03:55:32.800Z,,19,Touchdown,2022-11-11T03:54:10.920Z,8.0,2:22,5.0,0.0,1.0,4.0,4.0,0.0,PUNT,TOUCHDOWN,05:18,02:56,ATL 3,CAR 25,3399.0,3625.0,15,25,Home,10,40,-2.5,41.5,1,outdoors,grass,61.0,12.0,Steve Wilks,Arthur Smith,CAR00,Bank of America Stadium,0,1.0,M.Mariota,1.0,,1.0,,,1,0,1.0,0,1,00-0032268,,,M.Mariota,1.0,00-0032268,M.Mariota,00-0032268,M.Mariota,00-0032268,0,0,1.43013030150905,,,,,,0.930819869041443,6.91801309585571,2022-11-10,D.Jackson,2022,REG,CAR,10,00-0034356,CB,Donte Jackson,Donte,Jackson,Ankle,,Questionable,Ankle,,Full Participation in Practice,2022-11-09T19:04:37Z,2022-11-09 19:04:37
3440,2022_10_DEN_TEN,2022111307,TEN,DEN,REG,10,DEN,away,TEN,DEN,81.0,2022-11-13,770,770,770,Half2,0,21.0,0,4,2.0,0,12:50,DEN 19,19,1.0,"(12:50) (Shotgun) 3-R.Wilson pass short middle to 25-M.Gordon to DEN 28 for 9 yards (51-D.Long, 95-D.Walker). TEN-51-D.Long was injured during the play. His return is Questionable.",pass,9.0,1,0,1.0,0,0,0,short,middle,2.0,7.0,,,,,,,3,3,0.0,,,,,3.0,3.0,14,10,10.0,14.0,-4.0,10.0,14.0,-4.0,0.0760716423392296,0.193010941147804,0.0035049261059612,0.30823090672493,0.153277218341827,0.0030654442962259,0.262838900089264,0.0,0.0,-0.437824178487062,0.293875476811081,2.19346131109395,-2.19346131109395,2.41561530798208,-2.41561530798208,-2.05330208141855,2.05330208141855,-0.639001282397658,0.932876759208739,-0.639001282397658,0.932876759208739,4.81845911557321,-4.81845911557321,-8.04199037363287,8.04199037363287,-17.9023748692125,17.9023748692125,13.2512270890871,-13.2512270890871,0.254386425018311,0.74561357498169,0.74561357498169,0.254386425018311,0.0039969682693481,0.011913388967514,-0.011913388967514,0.741616606712341,0.258383393287659,0.259664326906204,0.740335673093796,0.127032428979874,-0.127032428979874,-0.122717269171234,0.122717269171234,0.0,0.0039969682693481,0.0,0.0039969682693481,-0.0149223609330627,0.0149223609330627,-0.0786505913264743,0.0786505913264743,-0.0149223609330627,0.0149223609330627,-0.202304629040479,0.202304629040479,0.0,0.0,0.0,0.0,0.0,0.0,0.0,0.0,0.0,0,0.0,0.0,0.0,0.0,0.0,0.0,0.0,0.0,0.0,0.0,0.0,0.0,0.0,0.0,0.0,0.0,0.0,0.0,0.0,0.0,0.0,0.0,0.0,1.0,0.0,0.0,0.0,0.0,0.0,0.0,0.0,0.0,0.0,0.0,0.0,1.0,1.0,0.0,0.0,0.0,0.0,00-0029263,R.Wilson,9.0,00-0032144,M.Gordon,9.0,,,,,,,,,,,,,,,,,,,,,,,,,,,,,,,,,,,,,,,,,,,,,,,,,,,,00-0033782,D.Walker,TEN,,,,,,,,,,1.0,00-0035292,D.Long,TEN,,,,,,,,,,,,,,,,,,,,,,,,,,,,,0.0,,,,,0,,,0.0,0.0,0.0,0.0,,,2022,0.831088185310364,16.8911814689636,43,0,Punt,3440,"11/13/22, 13:03:33",2022-11-13T20:42:51.093Z,Nissan Stadium,"Cloudy Temp: 35° F, Humidity: 55%, Wind: NNE 7 mph",9574a185-d24c-11ec-b23d-d15a91047884,0,0,PASS,0,,2022-11-13T20:42:56.997Z,,21,Punt,2022-11-13T20:40:46.267Z,5.0,3:30,1.0,0.0,0.0,4.0,4.0,0.0,PUNT,PUNT,14:49,11:19,DEN 18,DEN 19,3366.0,3486.0,10,17,Home,7,27,2.5,40.0,0,outdoors,grass,36.0,9.0,Mike Vrabel,Nathaniel Hackett,NAS00,Nissan Stadium,0,1.0,R.Wilson,3.0,,,M.Gordon,25.0,1,0,0.0,0,1,00-0029263,,00-0032144,R.Wilson,3.0,00-0029263,M.Gordon,00-0032144,M.Gordon,00-0032144,0,1,0.293875476811081,0.69026238430421,5.9975527875722,5.0,0.421728058427107,0.0440242781187408,0.882369816303253,11.7630183696747,2022-11-13,D.Long,2022,REG,TEN,10,00-0035292,LB,David Long,David,Long,,,,Knee,,Full Participation in Practice,2022-11-11T20:42:27Z,2022-11-11 20:42:27
3431,2022_05_DET_NE,2022100905,NE,DET,REG,5,DET,away,NE,NE,18.0,2022-10-09,196,196,196,Half2,0,17.0,0,4,3.0,0,03:16,NE 18,4,57.0,"(3:16) (No Huddle, Shotgun) 16-J.Goff pass incomplete short right to 8-J.Reynolds. DET-8-J.Reynolds was injured during the play.",pass,0.0,1,1,1.0,0,0,0,short,right,10.0,,,,,,,,1,3,0.0,,,,,3.0,1.0,29,0,0.0,29.0,-29.0,0.0,29.0,-29.0,0.143141627311707,0.0161389168351889,0.0002898247330449,0.0291056782007217,0.450393408536911,0.0010868324898183,0.359843701124191,0.0,0.0,3.619523651083,-1.15363914496265,31.151046638349,-31.151046638349,5.0579112167627,-5.0579112167627,24.2104902143542,-24.2104902143542,1.42077808367321,-2.57441722863587,0.0,0.0,5.38074963859981,-5.38074963859981,-3.89379142971404,3.89379142971404,-4.31660122208996,4.31660122208996,17.6266041843405,-17.6266041843405,0.0001696156978141,0.999830384302186,0.999830384302186,0.0001696156978141,-1.65645033121109e-05,-1.37462084239814e-05,1.37462084239814e-05,0.999846948805498,0.000153051194502,5.66365160921123e-05,0.999943363483908,0.0042007426236523,-0.0042007426236523,0.444862776736756,-0.444862776736756,0.0,-1.65645033121109e-05,0.0,0.0,-0.0543819677113788,0.0543819677113788,0.146325347026507,-0.146325347026507,-0.950287670901162,0.950287670901162,1.18046930718811,-1.18046930718811,0.0,0.0,0.0,0.0,0.0,1.0,0.0,0.0,1.0,0,0.0,0.0,0.0,0.0,0.0,0.0,0.0,0.0,0.0,0.0,0.0,0.0,0.0,0.0,0.0,0.0,0.0,0.0,0.0,0.0,0.0,0.0,0.0,1.0,0.0,0.0,0.0,0.0,0.0,0.0,0.0,0.0,0.0,0.0,0.0,0.0,0.0,0.0,0.0,0.0,0.0,00-0033106,J.Goff,,00-0033943,J.Reynolds,,,,,,,,,,,,,,,,,,,,,,,,,,,,,,,,,,,,,,,,,,,,,,,,,,,,,,,,,,,,,,,,,0.0,,,,,,,,,,,,,,,,,,,,,,,,,,,,,,,,0.0,,,,,0,,,0.0,0.0,0.0,0.0,,,2022,0.448068290948868,-44.8068290948868,53,0,Turnover on downs,3431,"10/9/22, 13:02:49",2022-10-09T19:46:53Z,Gillette Stadium,"Sunny Temp: 58° F, Humidity: 44%, Wind: NE 12 mph",7ae92d18-d24c-11ec-b23d-d15a91047884,0,0,PASS,0,,,,17,Turnover on downs,2022-10-09T19:42:55Z,7.0,1:59,2.0,1.0,0.0,4.0,4.0,0.0,KICKOFF,DOWNS,05:01,03:02,DET 25,NE 18,3281.0,3456.0,0,29,Home,29,29,3.0,46.5,0,outdoors,fieldturf,,,Bill Belichick,Dan Campbell,BOS00,Gillette Stadium,0,0.0,J.Goff,16.0,,,J.Reynolds,8.0,1,0,0.0,0,1,00-0033106,,00-0033943,J.Goff,16.0,00-0033106,J.Reynolds,00-0033943,J.Reynolds,00-0033943,0,0,-1.15363914496265,0.465585346000404,2.18515894020675,1.0,1.0,1.0,0.943878531455994,5.61214685440064,2022-10-09,J.Reynolds,2022,REG,DET,5,00-0033943,WR,Josh Reynolds,Josh,Reynolds,Ankle,,Questionable,Ankle,,Limited Participation in Practice,2022-10-07T19:57:10Z,2022-10-07 19:57:10
3420,2022_16_GB_MIA,2022122500,MIA,GB,REG,16,GB,away,MIA,MIA,38.0,2022-12-25,190,190,190,Half2,0,20.0,0,4,1.0,0,03:10,MIA 38,20,56.0,(3:10) 33-A.Jones right end to MIA 20 for 18 yards (8-J.Holland). MIA-21-E.Rowe was injured during the play.,run,18.0,0,0,0.0,0,0,0,,,,,right,end,,,,,3,2,0.0,,,,,2.0,3.0,20,23,23.0,20.0,3.0,23.0,20.0,3.0,0.285122036933899,0.0443753600120544,0.0003954550775233,0.0539836883544922,0.295073986053467,0.0046334597282111,0.316415995359421,0.0,0.0,2.59759803646011,1.67770592542365,-8.92117865962791,8.92117865962791,-1.66834263142664,1.66834263142664,1.46631540246914,-1.46631540246914,,,0.0,0.0,10.2742396247922,-10.2742396247922,-6.73270461903441,6.73270461903441,-9.67764068819815,9.67764068819815,10.8417160260668,-10.8417160260668,0.813951849937439,0.186048150062561,0.186048150062561,0.813951849937439,0.0468676686286926,0.065753161907196,-0.065753161907196,0.139180481433868,0.860819518566132,0.796149015426636,0.203850984573364,-0.14905370285365,0.14905370285365,0.0376664162620107,-0.0376664162620107,,,0.0,0.0,-0.0039093472196815,0.0039093472196815,0.216207120674685,-0.216207120674685,-0.0039093472196815,0.0039093472196815,0.0185750463186063,-0.0185750463186063,0.0,0.0,0.0,0.0,0.0,0.0,0.0,0.0,0.0,0,0.0,0.0,0.0,0.0,0.0,0.0,0.0,0.0,0.0,0.0,0.0,0.0,0.0,0.0,1.0,0.0,0.0,0.0,0.0,0.0,0.0,0.0,1.0,0.0,0.0,0.0,0.0,0.0,0.0,0.0,0.0,0.0,0.0,0.0,0.0,0.0,0.0,0.0,0.0,0.0,0.0,,,,,,,00-0033293,A.Jones,18.0,,,,,,,,,,,,,,,,,,,,,,,,,,,,,,,,,,,,,,,,,,,MIA,,00-0036998,,J.Holland,,,,,,,,,,,,,,0.0,,,,,,,,,,,,,,,,,,,,,,,,,,,,,,,,0.0,,,,,0,,,0.0,0.0,0.0,0.0,,,2022,,,47,1,First down,3420,"12/25/22, 13:02:44",2022-12-25T20:45:40.910Z,Hard Rock Stadium,"Temp: 46° F, Humidity: 63%, Wind: NW 12 mph",ba10fc16-d24c-11ec-b23d-d15a91047884,0,0,RUSH,0,,2022-12-25T20:45:47.307Z,,20,Field goal,2022-12-25T20:38:35.753Z,9.0,4:00,3.0,1.0,1.0,4.0,4.0,-5.0,INTERCEPTION,FIELD_GOAL,06:02,02:02,GB 36,MIA 8,3271.0,3559.0,26,20,Home,-6,46,3.5,49.0,0,outdoors,grass,45.0,14.0,Mike McDaniel,Matt LaFleur,MIA00,Hard Rock Stadium,0,1.0,,,A.Jones,33.0,,,0,1,0.0,0,1,,00-0033293,,A.Jones,33.0,00-0033293,A.Jones,00-0033293,A.Jones,00-0033293,0,1,1.67770592542365,,,,,,0.386909633874893,-38.6909633874893,2022-12-25,E.Rowe,2022,REG,MIA,16,00-0031555,S,Eric Rowe,Eric,Rowe,Hamstring,,Questionable,Hamstring,,Limited Participation in Practice,2022-12-23T20:07:55Z,2022-12-23 20:07:55
3387,2022_03_BUF_MIA,2022092503,MIA,BUF,REG,3,BUF,away,MIA,BUF,79.0,2022-09-25,508,508,508,Half2,0,15.0,0,4,2.0,0,08:28,BUF 21,26,73.0,(8:28) (Shotgun) 17-J.Allen pass short middle to 14-S.Diggs to BUF 37 for 16 yards (8-J.Holland). BUF-14-S.Diggs was injured during the play.,pass,16.0,1,0,1.0,0,0,0,short,middle,13.0,3.0,,,,,,,1,2,0.0,,,,,2.0,1.0,21,17,17.0,21.0,-4.0,17.0,21.0,-4.0,0.234390631318092,0.179121345281601,0.0041539734229445,0.222932517528534,0.135082140564919,0.0016332637751475,0.222686097025871,0.0,0.0,-0.13888397696428,0.717625140212476,1.73600392496208,-1.73600392496208,-5.02232692667167,5.02232692667167,0.719775629799004,-0.719775629799004,-0.008847891818732,0.726473032031208,-0.008847891818732,0.726473032031208,17.8581727234552,-17.8581727234552,-28.4447519066162,28.4447519066162,6.52216680523923,-6.52216680523923,-14.1430322510108,14.1430322510108,0.252679765224457,0.747320234775543,0.747320234775543,0.252679765224457,0.0073268115520477,0.0533614754676819,-0.0533614754676819,0.739993423223496,0.260006576776505,0.295894742012024,0.704105257987976,-0.0612912661277327,0.0612912661277327,0.016221612551315,-0.016221612551315,0.0,0.0073268115520477,0.0,0.0073268115520477,0.571918034714946,-0.571918034714946,-0.893473083082821,0.893473083082821,0.571918034714946,-0.571918034714946,-0.730718219582226,0.730718219582226,0.0,0.0,0.0,0.0,0.0,0.0,0.0,0.0,0.0,0,0.0,0.0,0.0,0.0,0.0,0.0,0.0,0.0,0.0,0.0,0.0,0.0,0.0,0.0,1.0,0.0,0.0,0.0,0.0,0.0,0.0,0.0,0.0,1.0,0.0,0.0,0.0,0.0,0.0,0.0,0.0,0.0,0.0,0.0,0.0,1.0,0.0,0.0,0.0,0.0,0.0,00-0034857,J.Allen,16.0,00-0031588,S.Diggs,16.0,,,,,,,,,,,,,,,,,,,,,,,,,,,,,,,,,,,,,,,,,,,,,,MIA,,00-0036998,,J.Holland,,,,,,,,,,,,,,0.0,,,,,,,,,,,,,,,,,,,,,,,,,,,,,,,,0.0,,,,,0,,,0.0,0.0,0.0,0.0,,,2022,0.764948964118958,23.5051035881043,49,1,First down,3387,"9/25/22, 13:02:41",2022-09-25T19:47:43.470Z,Hard Rock Stadium,"Partly Sunny Temp: 89° F, Humidity: 63%, Wind: N 5 mph",7ae88861-d24c-11ec-b23d-d15a91047884,0,0,PASS,0,,2022-09-25T19:47:51.570Z,,15,Turnover on downs,2022-09-25T19:39:26.807Z,17.0,8:19,5.0,1.0,0.0,4.0,4.0,-10.0,KICKOFF,DOWNS,10:05,01:46,BUF 25,MIA 2,3284.0,3746.0,19,21,Home,2,40,-4.0,54.0,1,outdoors,grass,,,Mike McDaniel,Sean McDermott,MIA00,Hard Rock Stadium,0,1.0,J.Allen,17.0,,,S.Diggs,14.0,1,0,0.0,0,1,00-0034857,,00-0031588,J.Allen,17.0,00-0034857,S.Diggs,00-0031588,S.Diggs,00-0031588,0,0,0.717625140212476,0.527459453911794,3.99598720180802,2.0,0.708721281087492,0.0516493442119099,0.9046990275383,9.53009724617004,2022-09-25,S.Diggs,2022,REG,BUF,3,00-0031588,WR,Stefon Diggs,Stefon,Diggs,,,,Not injury related - resting player,,Did Not Participate In Practice,2022-09-23T19:03:22Z,2022-09-23 19:03:22
3385,2022_04_DEN_LV,2022100212,LV,DEN,REG,4,LV,home,DEN,LV,71.0,2022-10-02,397,397,397,Half2,0,20.0,0,4,3.0,0,06:37,LV 29,6,75.0,(6:37) (Shotgun) 4-D.Carr scrambles left end to LV 38 for 9 yards (21-K.Williams). DEN-5-R.Gregory was injured during the play.,run,9.0,1,0,1.0,0,0,1,,,,,left,end,,,,,2,3,0.0,,,,,2.0,3.0,25,23,25.0,23.0,2.0,25.0,23.0,2.0,0.206527128815651,0.139219656586647,0.0017313638236373,0.223234981298447,0.161861747503281,0.003549029584974,0.263876110315323,0.0,0.0,0.356049507390708,1.46407011663541,3.87881247844582,-3.87881247844582,11.2152589249599,-11.2152589249599,-8.95180063467941,8.95180063467941,,,0.0,0.0,-5.83926965499597,5.83926965499597,1.51664689040626,-1.51664689040626,-0.659860961018801,0.659860961018801,-10.4411411352403,10.4411411352403,0.738875031471252,0.261124968528748,0.738875031471252,0.261124968528748,0.0374727249145508,0.0525996088981628,0.0525996088981628,0.776347756385803,0.223652243614197,0.727459967136383,0.727459967136383,0.461259841993406,-0.461259841993406,-0.0998684855171443,0.0998684855171443,,,0.0,0.0,0.0355956970227262,-0.0355956970227262,-0.0424576983293794,0.0424576983293794,0.0456262497675917,-0.0456262497675917,-0.22976598744004,0.22976598744004,0.0,1.0,0.0,0.0,1.0,0.0,0.0,0.0,0.0,0,0.0,0.0,0.0,0.0,0.0,0.0,0.0,0.0,0.0,0.0,0.0,0.0,0.0,0.0,1.0,0.0,0.0,0.0,0.0,0.0,0.0,0.0,1.0,0.0,0.0,0.0,0.0,0.0,0.0,0.0,0.0,0.0,0.0,0.0,0.0,0.0,0.0,0.0,0.0,0.0,0.0,,,,,,,00-0031280,D.Carr,9.0,,,,,,,,,,,,,,,,,,,,,,,,,,,,,,,,,,,,,,,,,,,DEN,,00-0031253,,K.Williams,,,,,,,,,,,,,,0.0,,,,,,,,,,,,,,,,,,,,,,,,,,,,,,,,0.0,,,,,0,,,0.0,0.0,0.0,0.0,,,2022,,,47,1,First down,3385,"10/2/22, 16:25:40",2022-10-02T23:12:06.960Z,Allegiant Stadium,"Mostly Sunny Temp: 93° F, Humidity: 23%, Wind: SSE 8 mph",7ae8fe2c-d24c-11ec-b23d-d15a91047884,0,0,RUSH,0,,2022-10-02T23:12:13.100Z,,20,Touchdown,2022-10-02T23:09:56.767Z,10.0,5:14,5.0,1.0,1.0,4.0,4.0,0.0,KICKOFF,TOUCHDOWN,07:16,02:02,LV 25,DEN 7,3318.0,3566.0,23,32,Home,9,55,2.5,45.5,1,dome,grass,,,Josh McDaniels,Nathaniel Hackett,VEG00,Allegiant Stadium,0,1.0,D.Carr,4.0,,4.0,,,1,0,1.0,0,1,00-0031280,,,D.Carr,4.0,00-0031280,D.Carr,00-0031280,D.Carr,00-0031280,0,1,1.46407011663541,,,,,,0.973180115222931,2.68198847770691,2022-10-02,R.Gregory,2022,REG,DEN,4,00-0032197,DE,Randy Gregory,Randy,Gregory,,,,Knee,,Full Participation in Practice,2022-09-30T19:51:18Z,2022-09-30 19:51:18
3384,2022_03_PHI_WAS,2022092508,WAS,PHI,REG,3,WAS,home,PHI,PHI,42.0,2022-09-25,750,750,750,Half2,0,22.0,0,4,3.0,0,12:30,PHI 42,5,30.0,"(12:30) (No Huddle, Shotgun) 11-C.Wentz pass short right to 23-J.McKissic to PHI 37 for 5 yards (24-J.Bradberry). PHI-7-H.Reddick was injured during the play.",pass,5.0,1,1,1.0,0,0,0,short,right,1.0,4.0,,,,,,,3,3,0.0,,,,,3.0,3.0,2,24,2.0,24.0,-22.0,2.0,24.0,-22.0,0.0624703355133534,0.105637162923813,0.0012752633774653,0.168421477079391,0.269257217645645,0.0042828638106584,0.388655662536621,0.0,0.0,2.03851466323249,1.50409387506079,-23.8191234767016,23.8191234767016,9.49855793741881,-9.49855793741881,-36.0553817055741,36.0553817055741,-1.53407601895742,3.03816989401821,-1.53407601895742,3.03816989401821,-16.3742330434907,16.3742330434907,-11.5146841827664,11.5146841827664,-25.6815034831525,25.6815034831525,0.685609620533124,-0.685609620533124,0.0039761126972734,0.996023887302727,0.0039761126972734,0.996023887302727,0.000866871792823,0.0001711966469883,0.0001711966469883,0.0048429844900965,0.995157015509903,0.0023577150423079,0.0023577150423079,0.0961461740080267,-0.0961461740080267,-0.702296901412388,0.702296901412388,0.0,0.000866871792823,0.0,0.000866871792823,-0.104215444098715,0.104215444098715,-0.311311318656952,0.311311318656952,-0.105757915447955,0.105757915447955,-0.271159286495821,0.271159286495821,0.0,0.0,1.0,0.0,1.0,0.0,0.0,0.0,0.0,0,0.0,0.0,0.0,0.0,0.0,0.0,0.0,0.0,0.0,0.0,0.0,0.0,0.0,0.0,1.0,0.0,0.0,0.0,0.0,0.0,0.0,0.0,0.0,1.0,0.0,0.0,0.0,0.0,0.0,0.0,0.0,0.0,0.0,0.0,0.0,1.0,0.0,0.0,0.0,0.0,0.0,00-0032950,C.Wentz,5.0,00-0032602,J.McKissic,5.0,,,,,,,,,,,,,,,,,,,,,,,,,,,,,,,,,,,,,,,,,,,,,,PHI,,00-0032890,,J.Bradberry,,,,,,,,,,,,,,0.0,,,,,,,,,,,,,,,,,,,,,,,,,,,,,,,,0.0,,,,,0,,,0.0,0.0,0.0,0.0,,,2022,0.7799933552742,22.00066447258,49,1,First down,3384,"9/25/22, 13:02:33",2022-09-25T19:37:48.723Z,Commanders Field,"Sunny Temp: 72° F, Humidity: 60%, Wind: SSW 9 mph",7ae89f57-d24c-11ec-b23d-d15a91047884,0,0,PASS,0,,2022-09-25T19:37:54.060Z,,22,Turnover on downs,2022-09-25T19:34:40.400Z,13.0,5:11,4.0,1.0,0.0,4.0,4.0,5.0,KICKOFF,DOWNS,14:06,08:55,WAS 39,PHI 26,3263.0,3604.0,24,8,Home,-16,32,-6.0,47.0,1,outdoors,grass,,,Ron Rivera,Nick Sirianni,WAS00,FedExField,0,1.0,C.Wentz,11.0,,,J.McKissic,23.0,1,0,1.0,0,1,00-0032950,,00-0032602,C.Wentz,11.0,00-0032950,J.McKissic,00-0032602,J.McKissic,00-0032602,0,1,1.50409387506079,2.08966994039464,6.53804178681457,5.0,0.570412667933852,0.570412667933852,0.971155941486359,2.88440585136414,2022-09-25,H.Reddick,2022,REG,PHI,3,00-0033875,LB,Haason Reddick,Haason,Reddick,,,,Knee,,Full Participation in Practice,2022-09-23T18:24:45Z,2022-09-23 18:24:45
