play_id,game_id,old_game_id,home_team,away_team,season_type,week_x,posteam,posteam_type,defteam,side_of_field,yardline_100,game_date,quarter_seconds_remaining,half_seconds_remaining,game_seconds_remaining,game_half,quarter_end,drive,sp,qtr,down,goal_to_go,time,yrdln,ydstogo,ydsnet,desc,play_type,yards_gained,shotgun,no_huddle,qb_dropback,qb_kneel,qb_spike,qb_scramble,pass_length,pass_location,air_yards,yards_after_catch,run_location,run_gap,field_goal_result,kick_distance,extra_point_result,two_point_conv_result,home_timeouts_remaining,away_timeouts_remaining,timeout,timeout_team,td_team,td_player_name,td_player_id,posteam_timeouts_remaining,defteam_timeouts_remaining,total_home_score,total_away_score,posteam_score,defteam_score,score_differential,posteam_score_post,defteam_score_post,score_differential_post,no_score_prob,opp_fg_prob,opp_safety_prob,opp_td_prob,fg_prob,safety_prob,td_prob,extra_point_prob,two_point_conversion_prob,ep,epa,total_home_epa,total_away_epa,total_home_rush_epa,total_away_rush_epa,total_home_pass_epa,total_away_pass_epa,air_epa,yac_epa,comp_air_epa,comp_yac_epa,total_home_comp_air_epa,total_away_comp_air_epa,total_home_comp_yac_epa,total_away_comp_yac_epa,total_home_raw_air_epa,total_away_raw_air_epa,total_home_raw_yac_epa,total_away_raw_yac_epa,wp,def_wp,home_wp,away_wp,wpa,vegas_wpa,vegas_home_wpa,home_wp_post,away_wp_post,vegas_wp,vegas_home_wp,total_home_rush_wpa,total_away_rush_wpa,total_home_pass_wpa,total_away_pass_wpa,air_wpa,yac_wpa,comp_air_wpa,comp_yac_wpa,total_home_comp_air_wpa,total_away_comp_air_wpa,total_home_comp_yac_wpa,total_away_comp_yac_wpa,total_home_raw_air_wpa,total_away_raw_air_wpa,total_home_raw_yac_wpa,total_away_raw_yac_wpa,punt_blocked,first_down_rush,first_down_pass,first_down_penalty,third_down_converted,third_down_failed,fourth_down_converted,fourth_down_failed,incomplete_pass,touchback,interception,punt_inside_twenty,punt_in_endzone,punt_out_of_bounds,punt_downed,punt_fair_catch,kickoff_inside_twenty,kickoff_in_endzone,kickoff_out_of_bounds,kickoff_downed,kickoff_fair_catch,fumble_forced,fumble_not_forced,fumble_out_of_bounds,solo_tackle,safety,penalty,tackled_for_loss,fumble_lost,own_kickoff_recovery,own_kickoff_recovery_td,qb_hit,rush_attempt,pass_attempt,sack,touchdown,pass_touchdown,rush_touchdown,return_touchdown,extra_point_attempt,two_point_attempt,field_goal_attempt,kickoff_attempt,punt_attempt,fumble,complete_pass,assist_tackle,lateral_reception,lateral_rush,lateral_return,lateral_recovery,passer_player_id,passer_player_name,passing_yards,receiver_player_id,receiver_player_name,receiving_yards,rusher_player_id,rusher_player_name,rushing_yards,lateral_receiver_player_id,lateral_receiver_player_name,lateral_receiving_yards,lateral_rusher_player_id,lateral_rusher_player_name,lateral_rushing_yards,lateral_sack_player_id,lateral_sack_player_name,interception_player_id,interception_player_name,lateral_interception_player_id,lateral_interception_player_name,punt_returner_player_id,punt_returner_player_name,lateral_punt_returner_player_id,lateral_punt_returner_player_name,kickoff_returner_player_name,kickoff_returner_player_id,lateral_kickoff_returner_player_id,lateral_kickoff_returner_player_name,punter_player_id,punter_player_name,kicker_player_name,kicker_player_id,own_kickoff_recovery_player_id,own_kickoff_recovery_player_name,blocked_player_id,blocked_player_name,tackle_for_loss_1_player_id,tackle_for_loss_1_player_name,tackle_for_loss_2_player_id,tackle_for_loss_2_player_name,qb_hit_1_player_id,qb_hit_1_player_name,qb_hit_2_player_id,qb_hit_2_player_name,forced_fumble_player_1_team,forced_fumble_player_1_player_id,forced_fumble_player_1_player_name,forced_fumble_player_2_team,forced_fumble_player_2_player_id,forced_fumble_player_2_player_name,solo_tackle_1_team,solo_tackle_2_team,solo_tackle_1_player_id,solo_tackle_2_player_id,solo_tackle_1_player_name,solo_tackle_2_player_name,assist_tackle_1_player_id,assist_tackle_1_player_name,assist_tackle_1_team,assist_tackle_2_player_id,assist_tackle_2_player_name,assist_tackle_2_team,assist_tackle_3_player_id,assist_tackle_3_player_name,assist_tackle_3_team,assist_tackle_4_player_id,assist_tackle_4_player_name,assist_tackle_4_team,tackle_with_assist,tackle_with_assist_1_player_id,tackle_with_assist_1_player_name,tackle_with_assist_1_team,tackle_with_assist_2_player_id,tackle_with_assist_2_player_name,tackle_with_assist_2_team,pass_defense_1_player_id,pass_defense_1_player_name,pass_defense_2_player_id,pass_defense_2_player_name,fumbled_1_team,fumbled_1_player_id,fumbled_1_player_name,fumbled_2_player_id,fumbled_2_player_name,fumbled_2_team,fumble_recovery_1_team,fumble_recovery_1_yards,fumble_recovery_1_player_id,fumble_recovery_1_player_name,fumble_recovery_2_team,fumble_recovery_2_yards,fumble_recovery_2_player_id,fumble_recovery_2_player_name,sack_player_id,sack_player_name,half_sack_1_player_id,half_sack_1_player_name,half_sack_2_player_id,half_sack_2_player_name,return_team,return_yards,penalty_team,penalty_player_id,penalty_player_name,penalty_yards,replay_or_challenge,replay_or_challenge_result,penalty_type,defensive_two_point_attempt,defensive_two_point_conv,defensive_extra_point_attempt,defensive_extra_point_conv,safety_player_name,safety_player_id,season_x,cp,cpoe,series,series_success,series_result,order_sequence,start_time,time_of_day,stadium,weather,nfl_api_id,play_clock,play_deleted,play_type_nfl,special_teams_play,st_play_type,end_clock_time,end_yard_line,fixed_drive,fixed_drive_result,drive_real_start_time,drive_play_count,drive_time_of_possession,drive_first_downs,drive_inside20,drive_ended_with_score,drive_quarter_start,drive_quarter_end,drive_yards_penalized,drive_start_transition,drive_end_transition,drive_game_clock_start,drive_game_clock_end,drive_start_yard_line,drive_end_yard_line,drive_play_id_started,drive_play_id_ended,away_score,home_score,location,result,total,spread_line,total_line,div_game,roof,surface,temp,wind,home_coach,away_coach,stadium_id,game_stadium,aborted_play,success,passer,passer_jersey_number,rusher,rusher_jersey_number,receiver,receiver_jersey_number,pass,rush,first_down,special,play,passer_id,rusher_id,receiver_id,name,jersey_number,id,fantasy_player_name,fantasy_player_id,fantasy,fantasy_id,out_of_bounds,home_opening_kickoff,qb_epa,xyac_epa,xyac_mean_yardage,xyac_median_yardage,xyac_success,xyac_fd,xpass,pass_oe,date_x,injured_player,season_y,game_type,team,week_y,gsis_id,position,full_name,first_name,last_name,report_primary_injury,report_secondary_injury,report_status,practice_primary_injury,practice_secondary_injury,practice_status,date_modified,date_y
4662,2023_16_CLE_HOU,2023122404,HOU,CLE,REG,16,HOU,home,CLE,HOU,63.0,2023-12-24,74.0,74.0,74.0,Half2,0,25.0,0,4,3.0,0,01:14,HOU 37,2,35.0,(1:14) (Shotgun) 10-D.Mills pass short right to 86-D.Schultz to HOU 47 for 10 yards (37-Da.Bell). CLE-99-Z.Smith was injured during the play.,pass,10.0,1,0,1.0,0,0,0,short,right,-2.0,12.0,,,,,,,0,2,0.0,,,,,0.0,2.0,22,36,22.0,36.0,-14.0,22.0,36.0,-14.0,0.668508529663086,0.0286344569176435,0.0005763991503044,0.0405684970319271,0.146236181259155,0.0010712718358263,0.114404655992985,0.0,0.0,0.870648031122983,0.784486541699152,-17.2918557405067,17.2918557405067,3.33382545027393,-3.33382545027393,-28.4804441359739,28.4804441359739,-0.81295622990001,1.59744277159916,-0.81295622990001,1.59744277159916,-14.8545400853036,14.8545400853036,-6.37844151476747,6.37844151476747,-19.0580770711531,19.0580770711531,-7.39269898997736,7.39269898997736,0.002472948981449,0.997527051018551,0.002472948981449,0.997527051018551,-7.75973312556744e-05,3.6209006793797e-05,3.6209006793797e-05,0.0023953516501933,0.997604648349807,0.0006515684071928,0.0006515684071928,-0.0869636382680514,0.0869636382680514,-0.637915445406006,0.637915445406006,0.0,-7.75973312556744e-05,0.0,-7.75973312556744e-05,0.975646245610281,-0.975646245610281,-1.57337657374592,1.57337657374592,1.90198402863871,-1.90198402863871,-2.42239765881823,2.42239765881823,0.0,0.0,1.0,0.0,1.0,0.0,0.0,0.0,0.0,0,0.0,0.0,0.0,0.0,0.0,0.0,0.0,0.0,0.0,0.0,0.0,0.0,0.0,0.0,1.0,0.0,0.0,0.0,0.0,0.0,0.0,0.0,0.0,1.0,0.0,0.0,0.0,0.0,0.0,0.0,0.0,0.0,0.0,0.0,0.0,1.0,0.0,0.0,0.0,0.0,0.0,00-0036898,D.Mills,10.0,00-0034383,D.Schultz,10.0,,,,,,,,,,,,,,,,,,,,,,,,,,,,,,,,,,,,,,,,,,,,,,CLE,,00-0037332,,Da.Bell,,,,,,,,,,,,,,0.0,,,,,,,,,,,,,,,,,,,,,,,,,,,,,,,,0.0,,,,,0,,,0.0,0.0,0.0,0.0,,,2023,0.874567270278931,12.5432729721069,61,1,First down,4662,"12/24/23, 13:02:54",2023-12-24T21:16:26.870Z,NRG Stadium,"Thunderstorms Temp: 68° F, Humidity: 95%, Wind: ENE 2 mph",cbaf3de9-f053-11ed-b4a7-bab79e4492fa,0,0,PASS,0,,2023-12-24T21:16:34.713Z,,25,Turnover on downs,2023-12-24T21:11:33.210Z,10.0,1:42,2.0,0.0,0.0,4.0,4.0,5.0,DOWNS,DOWNS,02:06,00:24,HOU 17,CLE 48,4536.0,4802.0,36,22,Home,-14,58,-3.0,40.0,0,closed,astroturf,,,DeMeco Ryans,Kevin Stefanski,HOU00,NRG Stadium,0,1.0,D.Mills,10.0,,,D.Schultz,86.0,1,0,1.0,0,1,00-0036898,,00-0034383,D.Mills,10.0,00-0036898,D.Schultz,00-0034383,D.Schultz,00-0034383,0,0,0.784486541699152,1.34259054959442,8.50674948289816,7.0,0.723063217330491,0.723063217330491,0.906498670578003,9.35013294219971,2023-12-24,Z.Smith,2023,REG,CLE,16,00-0031576,DE,Za'Darius Smith,Za'Darius,Smith,,,,Not injury related - personal matter,,Did Not Participate In Practice,2023-12-21T20:59:51Z,2023-12-21 20:59:51
4570,2023_17_NYJ_CLE,2023122800,CLE,NYJ,REG,17,NYJ,away,CLE,CLE,40.0,2023-12-28,25.0,25.0,25.0,Half2,0,25.0,0,4,2.0,0,00:25,CLE 40,9,66.0,"(:25) (No Huddle, Shotgun) 14-T.Siemian pass short middle to 25-I.Abanikanda to CLE 32 for 8 yards (44-S.Takitaki). CLE-99-Z.Smith was injured during the play.",pass,8.0,1,1,1.0,0,0,0,short,middle,4.0,4.0,,,,,,,3,0,0.0,,,,,0.0,3.0,37,20,20.0,37.0,-17.0,20.0,37.0,-17.0,0.593122899532318,0.0090683083981275,0.000266425020527,0.0097170285880565,0.265593677759171,0.0004282928421162,0.12180332839489,0.0,0.0,1.55450394237414,0.467387879500166,16.5335985926956,-16.5335985926956,-3.65150864719869,3.65150864719869,10.3527043653299,-10.3527043653299,0.0837392776156776,0.383648601884488,0.0837392776156776,0.383648601884488,11.1662216275581,-11.1662216275581,-0.548647169445093,0.548647169445093,11.5820050570765,-11.5820050570765,-1.87742494315832,1.87742494315832,0.0006109934183768,0.999389006581623,0.999389006581623,0.0006109934183768,0.0004260156420059,0.0001563062251079,-0.0001563062251079,0.998962990939617,0.0010370090603828,0.0002628836664371,0.999737116333563,0.0602720383232061,-0.0602720383232061,0.202345438410361,-0.202345438410361,-0.000119128555525,0.000545144197531,-0.000119128555525,0.000545144197531,-0.0035862357068716,0.0035862357068716,0.175917792958908,-0.175917792958908,-0.0040203611312343,0.0040203611312343,0.212749602283361,-0.212749602283361,0.0,0.0,0.0,0.0,0.0,0.0,0.0,0.0,0.0,0,0.0,0.0,0.0,0.0,0.0,0.0,0.0,0.0,0.0,0.0,0.0,0.0,0.0,0.0,1.0,0.0,0.0,0.0,0.0,0.0,0.0,0.0,0.0,1.0,0.0,0.0,0.0,0.0,0.0,0.0,0.0,0.0,0.0,0.0,0.0,1.0,0.0,0.0,0.0,0.0,0.0,00-0032156,T.Siemian,8.0,00-0038389,I.Abanikanda,8.0,,,,,,,,,,,,,,,,,,,,,,,,,,,,,,,,,,,,,,,,,,,,,,CLE,,00-0035646,,S.Takitaki,,,,,,,,,,,,,,0.0,,,,,,,,,,,,,,,,,,,,,,,,,,,,,,,,0.0,,,,,0,,,0.0,0.0,0.0,0.0,,,2023,0.790902078151703,20.9097921848297,55,1,First down,4570,"12/28/23, 20:16:43",2023-12-29T04:19:09.947Z,Cleveland Browns Stadium,"Cloudy Temp: 47° F, Humidity: 76%, Wind: S 6 mph",cbaf78f9-f053-11ed-b4a7-bab79e4492fa,0,0,PASS,0,,2023-12-29T04:19:15.120Z,,24,End of half,2023-12-29T04:13:28.640Z,11.0,2:54,4.0,0.0,0.0,4.0,4.0,-4.0,KICKOFF,END_GAME,02:54,00:00,NYJ 22,CLE 32,4315.0,4653.0,20,37,Home,17,57,6.5,33.5,0,outdoors,grass,47.0,6.0,Kevin Stefanski,Robert Saleh,CLE00,FirstEnergy Stadium,0,1.0,T.Siemian,14.0,,,I.Abanikanda,25.0,1,0,0.0,0,1,00-0032156,,00-0038389,T.Siemian,14.0,00-0032156,I.Abanikanda,00-0038389,I.Abanikanda,00-0038389,0,1,0.467387879500166,0.474458405960175,4.56941810221179,3.0,0.995481729129096,0.343200163537404,0.901325821876526,9.86741781234741,2023-12-28,Z.Smith,2023,REG,CLE,17,00-0031576,DE,Za'Darius Smith,Za'Darius,Smith,,,,Pectoral,,Limited Participation in Practice,2023-12-27T20:26:30Z,2023-12-27 20:26:30
4495,2023_04_LA_IND,2023100106,IND,LA,REG,4,LA,away,IND,IND,35.0,2023-10-01,428.0,428.0,428.0,Overtime,0,23.0,0,5,2.0,0,07:08,IND 35,5,75.0,(7:08) 20-R.Rivers up the middle to IND 28 for 7 yards (93-E.Johnson). IND-33-D.Flowers was injured during the play.,run,7.0,0,0,0.0,0,0,0,,,,,middle,,,,,,2,1,0.0,,,,,1.0,2.0,23,23,23.0,23.0,0.0,23.0,23.0,0.0,0.097644530236721,0.0454320311546326,0.0005469367024488,0.0700479000806809,0.350261449813843,0.0009742500842548,0.435092926025391,0.0,0.0,3.47065806435421,0.67575512669282,-7.41246559314321,7.41246559314321,-7.8785437150946,7.8785437150946,-1.58343479773517,1.58343479773517,,,0.0,0.0,-1.61343437072618,1.61343437072618,0.59215021940848,-0.59215021940848,6.41114369849411,-6.41114369849411,-10.4763402400006,10.4763402400006,0.786328625923488,0.213671374076512,0.213671374076512,0.786328625923488,0.0741542804753408,0.0741542804753408,-0.0741542804753408,0.139517093601171,0.860482906398829,0.786328625923488,0.213671374076512,-0.457182355314367,0.457182355314367,0.129414474533405,-0.129414474533405,,,0.0,0.0,0.44371569424402,-0.44371569424402,-0.578547603705432,0.578547603705432,1.2078605768038,-1.2078605768038,-1.25050590864709,1.25050590864709,0.0,1.0,0.0,0.0,0.0,0.0,0.0,0.0,0.0,0,0.0,0.0,0.0,0.0,0.0,0.0,0.0,0.0,0.0,0.0,0.0,0.0,0.0,0.0,1.0,0.0,0.0,0.0,0.0,0.0,0.0,0.0,1.0,0.0,0.0,0.0,0.0,0.0,0.0,0.0,0.0,0.0,0.0,0.0,0.0,0.0,0.0,0.0,0.0,0.0,0.0,,,,,,,00-0037557,R.Rivers,7.0,,,,,,,,,,,,,,,,,,,,,,,,,,,,,,,,,,,,,,,,,,,IND,,00-0037269,,E.Johnson,,,,,,,,,,,,,,0.0,,,,,,,,,,,,,,,,,,,,,,,,,,,,,,,,0.0,,,,,0,,,0.0,0.0,0.0,0.0,,,2023,,,60,1,First down,4495,"10/1/23, 13:02:35",2023-10-01T20:16:53.090Z,Lucas Oil Stadium,"Clear Temp: 80° F, Humidity: 57%, Wind: SE 2 mph",b07d55d8-f053-11ed-b4a7-bab79e4492fa,0,0,RUSH,0,,2023-10-01T20:16:57.097Z,,23,Touchdown,2023-10-01T20:12:20.417Z,8.0,4:11,4.0,0.0,1.0,5.0,5.0,0.0,KICKOFF,TOUCHDOWN,10:00,05:49,LA 25,IND 22,4374.0,4565.0,29,23,Home,-6,52,-1.0,44.5,0,open,fieldturf,,,Shane Steichen,Sean McVay,IND00,Lucas Oil Stadium,0,1.0,,,R.Rivers,20.0,,,0,1,1.0,0,1,,00-0037557,,R.Rivers,20.0,00-0037557,R.Rivers,00-0037557,R.Rivers,00-0037557,0,0,0.67575512669282,,,,,,0.433826416730881,-43.3826416730881,2023-10-01,D.Flowers,2023,REG,IND,4,00-0037395,CB,Dallis Flowers,Dallis,Flowers,,,,Back,,Full Participation in Practice,2023-09-29T19:27:54Z,2023-09-29 19:27:54
4466,2023_15_HOU_TEN,2023121703,TEN,HOU,REG,15,TEN,home,HOU,TEN,51.0,2023-12-17,120.0,120.0,120.0,Overtime,0,23.0,0,5,3.0,0,02:00,TEN 49,8,5.0,(2:00) (Shotgun) 8-W.Levis sacked at TEN 42 for -7 yards (25-D.King). TEN-8-W.Levis was injured during the play.,pass,-7.0,1,0,1.0,0,0,0,,,,,,,,,,,2,2,0.0,,,,,2.0,2.0,16,16,16.0,16.0,0.0,16.0,16.0,0.0,0.502408564090729,0.0710096061229706,0.0003892712993547,0.0624408982694149,0.167993858456612,0.0026899992953985,0.193067833781242,0.0,0.0,1.2099427615758,-1.31665402813815,-3.34547210462862,3.34547210462862,-1.21208366579588,1.21208366579588,-1.05592000550744,1.05592000550744,,,0.0,0.0,1.01387706183596,-1.01387706183596,-3.50255941462819,3.50255941462819,12.1400602393551,-12.1400602393551,-8.00098829145348,8.00098829145348,0.363751691533253,0.636248308466747,0.363751691533253,0.636248308466747,-0.200006903382018,-0.200006903382018,-0.200006903382018,0.163744788151234,0.836255211848766,0.363751691533253,0.363751691533253,-0.151525767507476,0.151525767507476,-0.0121150106992471,0.0121150106992471,,,0.0,0.0,-0.0299051145215228,0.0299051145215228,0.241879958892241,-0.241879958892241,0.246662759023468,-0.246662759023468,-0.0340467485112328,0.0340467485112328,0.0,0.0,0.0,0.0,0.0,1.0,0.0,0.0,0.0,0,0.0,0.0,0.0,0.0,0.0,0.0,0.0,0.0,0.0,0.0,0.0,0.0,0.0,0.0,1.0,0.0,0.0,0.0,0.0,0.0,0.0,1.0,0.0,1.0,1.0,0.0,0.0,0.0,0.0,0.0,0.0,0.0,0.0,0.0,0.0,0.0,0.0,0.0,0.0,0.0,0.0,00-0039152,W.Levis,,,,,,,,,,,,,,,,,,,,,,,,,,,,,,,,,,,,00-0033566,D.King,,,00-0033566,D.King,,,,,,,,,HOU,,00-0033566,,D.King,,,,,,,,,,,,,,0.0,,,,,,,,,,,,,,,,,,,,,,,,,00-0033566,D.King,,,,,,0.0,,,,,0,,,0.0,0.0,0.0,0.0,,,2023,,,55,0,Punt,4466,"12/17/23, 13:02:35",2023-12-17T21:16:24.263Z,Nissan Stadium,"Cloudy Temp: 48° F, Humidity: 77%, Wind: NW 9 mph",cbaefa83-f053-11ed-b4a7-bab79e4492fa,0,0,SACK,0,,2023-12-17T21:16:27.910Z,,23,Punt,2023-12-17T21:11:45.250Z,5.0,2:32,1.0,0.0,0.0,5.0,5.0,0.0,PUNT,PUNT,04:15,01:43,TEN 37,TEN 42,4377.0,4493.0,19,16,Home,-3,35,3.0,38.0,1,outdoors,grass,48.0,9.0,Mike Vrabel,DeMeco Ryans,NAS00,Nissan Stadium,0,0.0,W.Levis,8.0,,,,,1,0,0.0,0,1,00-0039152,,,W.Levis,8.0,00-0039152,,,,,0,0,-1.31665402813815,,,,,,0.981360733509064,1.86392664909363,2023-12-17,W.Levis,2023,REG,TEN,15,00-0039152,QB,Will Levis,Will,Levis,,,,Ankle,,Full Participation in Practice,2023-12-15T19:42:19Z,2023-12-15 19:42:19
4373,2023_09_DAL_PHI,2023110510,PHI,DAL,REG,9,DAL,away,PHI,DAL,86.0,2023-11-05,46.0,46.0,46.0,Half2,0,19.0,0,4,1.0,0,00:46,DAL 14,10,79.0,"(:46) (Shotgun) 4-D.Prescott pass incomplete deep left to 13-M.Gallup. PHI-24-J.Bradberry was injured during the play. PENALTY on PHI-24-J.Bradberry, Defensive Pass Interference, 36 yards, enforced at DAL 14 - No Play.",no_play,0.0,1,0,0.0,0,0,0,,,,,,,,,,,0,0,0.0,,,,,0.0,0.0,28,23,23.0,28.0,-5.0,23.0,28.0,-5.0,0.909729182720184,0.0174303725361824,0.0022837945725768,0.0181026514619589,0.0378972664475441,0.0003415668907109,0.01421516854316,0.0,0.0,0.0303038459387608,1.0576701281243,2.32565618162282,-2.32565618162282,4.92255534396088,-4.92255534396088,-2.66093593555694,2.66093593555694,,,0.0,0.0,-8.74764342285926,8.74764342285926,-2.49948796027456,2.49948796027456,-16.8884890036425,16.8884890036425,12.8900652150115,-12.8900652150115,0.115729048848152,0.884270951151848,0.884270951151848,0.115729048848152,0.13737653195858,0.110853470861912,-0.110853470861912,0.746894419193268,0.253105580806732,0.112135149538517,0.887864850461483,0.354945321544132,-0.354945321544132,0.0685065404760983,-0.0685065404760983,,,0.0,0.0,0.0225705745556651,-0.0225705745556651,-0.423164121960655,0.423164121960655,0.0225705745556651,-0.0225705745556651,-0.0490555690279159,0.0490555690279159,0.0,0.0,0.0,1.0,0.0,0.0,0.0,0.0,0.0,0,0.0,0.0,0.0,0.0,0.0,0.0,0.0,0.0,0.0,0.0,0.0,0.0,0.0,0.0,0.0,0.0,1.0,0.0,0.0,0.0,0.0,0.0,0.0,0.0,0.0,0.0,0.0,0.0,0.0,0.0,0.0,0.0,0.0,0.0,0.0,0.0,0.0,0.0,0.0,0.0,0.0,,,,,,,,,,,,,,,,,,,,,,,,,,,,,,,,,,,,,,,,,,,,,,,,,,,,,,,,,,,,,,,,,,,,,,0.0,,,,,,,,,,,,,,,,,,,,,,,,,,,,,,,,0.0,PHI,00-0032890,J.Bradberry,36.0,0,,Defensive Pass Interference,0.0,0.0,0.0,0.0,,,2023,,,54,1,First down,4373,"11/5/23, 16:25:50",2023-11-06T00:34:39.130Z,Lincoln Financial Field,"Clear Temp: 64° F, Humidity: 41%, Wind: NNW 6 mph",b07edc7f-f053-11ed-b4a7-bab79e4492fa,0,0,PENALTY,0,,2023-11-06T00:34:45.503Z,,19,Turnover,2023-11-06T00:34:39.130Z,5.0,0:46,4.0,1.0,0.0,4.0,4.0,46.0,PUNT,FUMBLE,00:46,00:00,DAL 14,PHI 27,4373.0,4607.0,23,28,Home,5,51,3.5,46.5,1,outdoors,grass,64.0,6.0,Nick Sirianni,Mike McCarthy,PHI00,Lincoln Financial Field,0,1.0,D.Prescott,4.0,,,M.Gallup,13.0,1,0,1.0,0,1,00-0033077,,00-0034764,D.Prescott,4.0,00-0033077,,,M.Gallup,00-0034764,0,0,1.0576701281243,,,,,,0.987189114093781,1.28108859062195,2023-11-05,J.Bradberry,2023,REG,PHI,9,00-0032890,CB,James Bradberry,James,Bradberry,,,,Thigh,,Limited Participation in Practice,2023-11-03T19:53:37Z,2023-11-03 19:53:37
4328,2023_05_JAX_BUF,2023100800,BUF,JAX,REG,5,JAX,away,BUF,JAX,69.0,2023-10-08,199.0,199.0,199.0,Half2,0,20.0,0,4,2.0,0,03:19,JAX 31,4,75.0,(3:19) (Shotgun) 1-T.Etienne left guard to JAX 31 for no gain (25-T.Dodson; 57-A.Epenesa). JAX-74-C.Robinson was injured during the play.,run,0.0,1,0,0.0,0,0,0,,,,,left,guard,,,,,2,3,0.0,,,,,3.0,2.0,13,18,18.0,13.0,5.0,18.0,13.0,5.0,0.416768252849579,0.0858523547649384,0.0010058934567496,0.0981582403182983,0.14564037322998,0.0017825091490522,0.250792324542999,0.0,0.0,1.24935587635264,-0.735660951933824,-5.92286412441172,5.92286412441172,-1.79888701796973,1.79888701796973,3.49017349530198,-3.49017349530198,,,0.0,0.0,-5.12334989599185,5.12334989599185,0.396027062903158,-0.396027062903158,2.79987945989706,-2.79987945989706,-9.99190684466157,9.99190684466157,0.844176173210144,0.155823826789856,0.155823826789856,0.844176173210144,-0.0028249621391296,-0.0199841856956482,0.0199841856956482,0.158648788928986,0.841351211071014,0.823092997074127,0.176907002925873,-0.354916398478219,0.354916398478219,-0.0427304335889442,0.0427304335889442,,,0.0,0.0,0.230532046848811,-0.230532046848811,-0.477077354162931,0.477077354162931,0.234012570673503,-0.234012570673503,-0.596299652427435,0.596299652427435,0.0,0.0,0.0,0.0,0.0,0.0,0.0,0.0,0.0,0,0.0,0.0,0.0,0.0,0.0,0.0,0.0,0.0,0.0,0.0,0.0,0.0,0.0,0.0,0.0,0.0,0.0,0.0,0.0,0.0,0.0,0.0,1.0,0.0,0.0,0.0,0.0,0.0,0.0,0.0,0.0,0.0,0.0,0.0,0.0,0.0,1.0,0.0,0.0,0.0,0.0,,,,,,,00-0036973,T.Etienne,0.0,,,,,,,,,,,,,,,,,,,,,,,,,,,,,,,,,,,,,,,,,,,,,,,,,00-0035352,T.Dodson,BUF,00-0036192,A.Epenesa,BUF,,,,,,,0.0,,,,,,,,,,,,,,,,,,,,,,,,,,,,,,,,0.0,,,,,0,,,0.0,0.0,0.0,0.0,,,2023,,,58,1,First down,4328,"10/8/23, 09:32:35",2023-10-08T16:33:56.147Z,Tottenham Hotspur Stadium,"Partly Cloudy Temp: 75° F, Humidity: 52%, Wind: WSW 7 mph",b07d9476-f053-11ed-b4a7-bab79e4492fa,0,0,RUSH,0,,2023-10-08T16:33:59.343Z,,20,Touchdown,2023-10-08T16:32:20.350Z,5.0,1:07,2.0,0.0,1.0,4.0,4.0,0.0,KICKOFF,TOUCHDOWN,04:03,02:56,JAX 25,BUF 35,4290.0,4442.0,25,20,Neutral,-5,45,5.5,48.5,0,outdoors,,,,Sean McDermott,Doug Pederson,BUF00,New Era Field,0,0.0,,,T.Etienne,1.0,,,0,1,0.0,0,1,,00-0036973,,T.Etienne,1.0,00-0036973,T.Etienne,00-0036973,T.Etienne,00-0036973,0,0,-0.735660951933824,,,,,,0.247029066085815,-24.7029066085815,2023-10-08,C.Robinson,2023,REG,JAX,5,00-0033889,T,Cam Robinson,Cam,Robinson,,,,not injury related - returning from suspension,,Full Participation in Practice,2023-10-04T21:49:49Z,2023-10-04 21:49:49
4291,2023_10_CLE_BAL,2023111201,BAL,CLE,REG,10,CLE,away,BAL,CLE,55.0,2023-11-12,99.0,99.0,99.0,Half2,0,20.0,0,4,1.0,0,01:39,CLE 45,10,58.0,"(1:39) (No Huddle, Shotgun) 4-D.Watson scrambles left end to BAL 39 for 16 yards (6-P.Queen). CLE-4-D.Watson was injured during the play.",run,16.0,1,1,1.0,0,0,1,,,,,left,end,,,,,2,2,0.0,,,,,2.0,2.0,31,30,30.0,31.0,-1.0,30.0,31.0,-1.0,0.481974720954895,0.0485128611326218,0.0004624715656973,0.0347372256219387,0.204756796360016,0.0011162344599142,0.228439703583717,0.0,0.0,1.82595667720307,1.04217331367545,-5.05267643702878,5.05267643702878,-9.99659365542187,9.99659365542187,-5.42167007429702,5.42167007429702,,,0.0,0.0,8.35759347508429,-8.35759347508429,-11.5120513398724,11.5120513398724,-0.662143467197893,0.662143467197893,-4.44599467096973,4.44599467096973,0.505366384983063,0.494633615016937,0.494633615016937,0.505366384983063,0.0971229672431946,0.118722379207611,-0.118722379207611,0.397510647773743,0.602489352226257,0.458908319473267,0.541091680526733,-0.12077674436706,0.12077674436706,-0.181597915038363,0.181597915038363,,,0.0,0.0,0.0241444408893585,-0.0241444408893585,-0.010346544610897,0.010346544610897,0.0183451026678085,-0.0183451026678085,-0.171347760155693,0.171347760155693,0.0,1.0,0.0,0.0,0.0,0.0,0.0,0.0,0.0,0,0.0,0.0,0.0,0.0,0.0,0.0,0.0,0.0,0.0,0.0,0.0,0.0,0.0,0.0,1.0,0.0,0.0,0.0,0.0,0.0,0.0,0.0,1.0,0.0,0.0,0.0,0.0,0.0,0.0,0.0,0.0,0.0,0.0,0.0,0.0,0.0,0.0,0.0,0.0,0.0,0.0,,,,,,,00-0033537,D.Watson,16.0,,,,,,,,,,,,,,,,,,,,,,,,,,,,,,,,,,,,,,,,,,,BAL,,00-0036323,,P.Queen,,,,,,,,,,,,,,0.0,,,,,,,,,,,,,,,,,,,,,,,,,,,,,,,,0.0,,,,,0,,,0.0,0.0,0.0,0.0,,,2023,,,54,1,First down,4291,"11/12/23, 13:02:49",2023-11-12T21:17:32.267Z,M&T Bank Stadium,"Clear Temp: 49° F, Humidity: 46%, Wind: N 4 mph",cbac711d-f053-11ed-b4a7-bab79e4492fa,0,0,RUSH,0,,2023-11-12T21:17:40.410Z,,20,Field goal,2023-11-12T21:10:47Z,12.0,4:55,4.0,0.0,1.0,4.0,4.0,-5.0,PUNT,FIELD_GOAL,04:55,00:00,CLE 20,BAL 22,4111.0,4431.0,33,31,Home,-2,64,6.0,38.5,1,outdoors,grass,49.0,4.0,John Harbaugh,Kevin Stefanski,BAL00,M&T Bank Stadium,0,1.0,D.Watson,4.0,,4.0,,,1,0,1.0,0,1,00-0033537,,,D.Watson,4.0,00-0033537,D.Watson,00-0033537,D.Watson,00-0033537,0,0,1.04217331367545,,,,,,0.917406976222992,8.25930237770081,2023-11-12,D.Watson,2023,REG,CLE,10,00-0033537,QB,Deshaun Watson,Deshaun,Watson,,,,right Shoulder,,Full Participation in Practice,2023-11-10T20:45:41Z,2023-11-10 20:45:41
4250,2023_07_LV_CHI,2023102201,CHI,LV,REG,7,LV,away,CHI,CHI,2.0,2023-10-22,70.0,70.0,70.0,Half2,0,17.0,0,4,,0,01:10,CHI 2,0,60.0,TWO-POINT CONVERSION ATTEMPT. 4-A.O'Connell pass to 81-A.Hooper is incomplete. ATTEMPT FAILS. CHI-9-J.Brisker was injured during the play.,pass,0.0,0,0,1.0,0,0,0,,,,,,,,,,failure,3,1,0.0,,,,,1.0,3.0,30,12,12.0,30.0,-18.0,12.0,30.0,-18.0,0.0,0.0,0.0,0.0,0.0,0.0,0.0,0.0,0.4735,0.947,-0.947,20.1463459944518,-20.1463459944518,11.3798182148603,-11.3798182148603,15.9021252522831,-15.9021252522831,,,0.0,0.0,-13.31599898063,13.31599898063,5.77456967413309,-5.77456967413309,-39.902501024626,39.902501024626,54.1554624467424,-54.1554624467424,0.0003182824552059,0.999681717544794,0.999681717544794,0.0003182824552059,-4.41606938839101e-05,-2.89818942547093e-05,2.89818942547093e-05,0.999725878238678,0.000274121761322,0.0001704833209514,0.999829516679048,0.241080941783977,-0.241080941783977,0.236583209675096,-0.236583209675096,,,0.0,0.0,0.0103477025695611,-0.0103477025695611,0.0331240329486898,-0.0331240329486898,0.0103477025695611,-0.0103477025695611,0.232798145030683,-0.232798145030683,0.0,0.0,0.0,0.0,0.0,0.0,0.0,0.0,0.0,0,0.0,0.0,0.0,0.0,0.0,0.0,0.0,0.0,0.0,0.0,0.0,0.0,0.0,0.0,0.0,0.0,0.0,0.0,0.0,0.0,0.0,0.0,0.0,1.0,0.0,0.0,0.0,0.0,0.0,0.0,1.0,0.0,0.0,0.0,0.0,0.0,0.0,0.0,0.0,0.0,0.0,00-0038579,A.O'Connell,,00-0032392,A.Hooper,,,,,,,,,,,,,,,,,,,,,,,,,,,,,,,,,,,,,,,,,,,,,,,,,,,,,,,,,,,,,,,,,0.0,,,,,,,,,,,,,,,,,,,,,,,,,,,,,,,,0.0,,,,,0,,,0.0,0.0,0.0,0.0,,,2023,,,56,1,Touchdown,4250,"10/22/23, 13:02:56",2023-10-22T19:55:24Z,Soldier Field,"Partly Cloudy Temp: 52° F, Humidity: 68%, Wind: N 8 mph",b07e24f5-f053-11ed-b4a7-bab79e4492fa,0,0,PAT2,0,,,,17,Touchdown,2023-10-22T19:49:03.780Z,8.0,2:22,5.0,1.0,1.0,4.0,4.0,0.0,PUNT,TOUCHDOWN,03:32,01:10,LV 40,CHI 9,4037.0,4250.0,12,30,Home,18,42,-2.5,38.5,0,outdoors,grass,52.0,8.0,Matt Eberflus,Josh McDaniels,CHI98,Soldier Field,0,0.0,A.O'Connell,4.0,,,A.Hooper,81.0,1,0,0.0,0,1,00-0038579,,00-0032392,A.O'Connell,4.0,00-0038579,A.Hooper,00-0032392,A.Hooper,00-0032392,0,1,-0.947,,,,,,,,2023-10-22,J.Brisker,2023,REG,CHI,7,00-0038135,S,Jaquan Brisker,Jaquan,Brisker,Groin,,Questionable,Groin,,Limited Participation in Practice,2023-10-20T18:37:29Z,2023-10-20 18:37:29
4180,2023_07_JAX_NO,2023101900,NO,JAX,REG,7,NO,home,JAX,NO,84.0,2023-10-19,241.0,241.0,241.0,Half2,0,23.0,0,4,3.0,0,04:01,NO 16,4,6.0,"(4:01) (No Huddle, Shotgun) 4-D.Carr pass incomplete deep right to 22-R.Shaheed. NO-4-D.Carr was injured during the play.",pass,0.0,1,1,1.0,0,0,0,deep,right,25.0,,,,,,,,3,3,0.0,,,,,3.0,3.0,24,24,24.0,24.0,0.0,24.0,24.0,0.0,0.310886204242706,0.137713953852654,0.0022684028372168,0.236777693033218,0.124790944159031,0.0020785899832844,0.18548421561718,0.0,0.0,-0.398202996701002,-1.11200792621821,-2.40690776765789,2.40690776765789,6.27959849993862,-6.27959849993862,-9.97225078057656,9.97225078057656,2.32793908752501,-3.43994701374322,0.0,0.0,-9.19870805373648,9.19870805373648,15.5887161758648,-15.5887161758648,-7.97333063062979,7.97333063062979,-2.38482353260619,2.38482353260619,0.516959309577942,0.483040690422058,0.516959309577942,0.483040690422058,-0.0699983537197113,-0.0676722526550293,-0.0676722526550293,0.446960955858231,0.553039044141769,0.513140499591827,0.513140499591827,-0.0778712937111665,0.0778712937111665,-0.111837335582832,0.111837335582832,0.0,-0.0699983537197113,0.0,0.0,0.634198629751802,-0.634198629751802,-0.40600411593914,0.40600411593914,1.13021610070765,-1.13021610070765,-1.3442343777977,1.3442343777977,0.0,0.0,0.0,0.0,0.0,1.0,0.0,0.0,1.0,0,0.0,0.0,0.0,0.0,0.0,0.0,0.0,0.0,0.0,0.0,0.0,0.0,0.0,0.0,0.0,0.0,0.0,0.0,0.0,0.0,0.0,0.0,0.0,1.0,0.0,0.0,0.0,0.0,0.0,0.0,0.0,0.0,0.0,0.0,0.0,0.0,0.0,0.0,0.0,0.0,0.0,00-0031280,D.Carr,,00-0037545,R.Shaheed,,,,,,,,,,,,,,,,,,,,,,,,,,,,,,,,,,,,,,,,,,,,,,,,,,,,,,,,,,,,,,,,,0.0,,,,,,,,,,,,,,,,,,,,,,,,,,,,,,,,0.0,,,,,0,,,0.0,0.0,0.0,0.0,,,2023,0.421250462532043,-42.1250462532043,56,0,Punt,4180,"10/19/23, 20:15:41",2023-10-20T03:05:28.047Z,Caesars Superdome,"Partly Cloudy Temp: 79° F, Humidity: 57%, Wind: S 8 mph",b07e1b14-f053-11ed-b4a7-bab79e4492fa,0,0,PASS,0,,2023-10-20T03:05:34.953Z,,23,Punt,2023-10-20T03:04:37.930Z,3.0,0:45,0.0,0.0,0.0,4.0,4.0,0.0,PUNT,PUNT,04:30,03:45,NO 10,NO 16,4132.0,4203.0,31,24,Home,-7,55,2.5,41.0,0,dome,sportturf,,,Dennis Allen,Doug Pederson,NOR00,Mercedes-Benz Superdome,0,0.0,D.Carr,4.0,,,R.Shaheed,22.0,1,0,0.0,0,1,00-0031280,,00-0037545,D.Carr,4.0,00-0031280,R.Shaheed,00-0037545,R.Shaheed,00-0037545,0,0,-1.11200792621821,0.533829054568401,7.26636293729825,4.0,1.0,1.0,0.967585444450378,3.24145555496216,2023-10-19,D.Carr,2023,REG,NO,7,00-0031280,QB,Derek Carr,Derek,Carr,,,,right Shoulder,Chest,Full Participation in Practice,2023-10-18T19:12:18Z,2023-10-18 19:12:18
4170,2023_02_MIA_NE,2023091712,NE,MIA,REG,2,MIA,away,NE,MIA,70.0,2023-09-17,282.0,282.0,282.0,Half2,0,20.0,0,4,2.0,0,04:42,MIA 30,5,38.0,"(4:42) (Shotgun) 1-T.Tagovailoa pass incomplete deep right to 17-J.Waddle (9-M.Judon). MIA-17-J.Waddle was injured during the play. PENALTY on NE-30-M.Mapu, Unnecessary Roughness, 15 yards, enforced at MIA 30 - No Play.",no_play,0.0,1,0,0.0,0,0,0,,,,,,,,,,,2,2,0.0,,,,,2.0,2.0,17,24,24.0,17.0,7.0,24.0,17.0,7.0,0.393097102642059,0.0975338891148567,0.0009549999958835,0.131047442555428,0.146641969680786,0.0019436496077105,0.228780969977379,0.0,0.0,0.833436232875101,1.17145851440728,-10.3644519471132,10.3644519471132,-0.19655590961338,0.19655590961338,-16.3119235085524,16.3119235085524,,,0.0,0.0,-7.44576209888328,7.44576209888328,-5.37031894424581,5.37031894424581,-1.81336186866974,1.81336186866974,-11.9267858478325,11.9267858478325,0.906896352767944,0.0931036472320557,0.0931036472320557,0.906896352767944,0.0221052765846252,0.014087438583374,-0.014087438583374,0.0709983706474304,0.92900162935257,0.933486640453339,0.0665133595466614,-0.15370917328894,0.15370917328894,-0.400050272369274,0.400050272369274,,,0.0,0.0,0.0968192246318972,-0.0968192246318972,-0.381188202649355,0.381188202649355,0.0983151969076311,-0.0983151969076311,-0.413565747439861,0.413565747439861,0.0,0.0,0.0,1.0,0.0,0.0,0.0,0.0,0.0,0,0.0,0.0,0.0,0.0,0.0,0.0,0.0,0.0,0.0,0.0,0.0,0.0,0.0,0.0,0.0,0.0,1.0,0.0,0.0,0.0,0.0,0.0,0.0,0.0,0.0,0.0,0.0,0.0,0.0,0.0,0.0,0.0,0.0,0.0,0.0,0.0,0.0,0.0,0.0,0.0,0.0,,,,,,,,,,,,,,,,,,,,,,,,,,,,,,,,,,,,,,,,,,,,,,,,,,,,,,,,,,,,,,,,,,,,,,0.0,,,,,,,,,,,,,,,,,,,,,,,,,,,,,,,,0.0,NE,00-0039054,M.Mapu,15.0,0,,Unnecessary Roughness,0.0,0.0,0.0,0.0,,,2023,,,56,1,First down,4170,"9/17/23, 20:22:32",2023-09-18T03:07:40.047Z,Gillette Stadium,"Clear Temp: 63° F, Humidity: 77%, Wind: NE 3 mph",b07cd859-f053-11ed-b4a7-bab79e4492fa,0,0,PENALTY,0,,2023-09-18T03:07:44.287Z,,20,Missed field goal,2023-09-18T03:05:18.607Z,6.0,3:11,2.0,0.0,0.0,4.0,4.0,15.0,KICKOFF,MISSED_FG,05:25,02:14,MIA 25,NE 37,4118.0,4300.0,24,17,Home,-7,41,-2.0,46.5,1,outdoors,,,,Bill Belichick,Mike McDaniel,BOS00,Gillette Stadium,0,1.0,T.Tagovailoa,1.0,,,J.Waddle,17.0,1,0,1.0,0,1,00-0036212,,00-0036613,T.Tagovailoa,1.0,00-0036212,,,J.Waddle,00-0036613,0,1,1.17145851440728,,,,,,0.266831368207932,73.3168631792069,2023-09-17,J.Waddle,2023,REG,MIA,2,00-0036613,WR,Jaylen Waddle,Jaylen,Waddle,,,,Oblique,,Full Participation in Practice,2023-09-15T19:57:20Z,2023-09-15 19:57:20
4140,2023_14_JAX_CLE,2023121004,CLE,JAX,REG,14,JAX,away,CLE,CLE,23.0,2023-12-10,574.0,574.0,574.0,Half2,0,29.0,0,4,1.0,0,09:34,CLE 23,10,75.0,(9:34) (Shotgun) 16-T.Lawrence pass incomplete short right to 7-Z.Jones. CLE-22-G.Delpit was injured during the play. His return is Questionable.,pass,0.0,1,0,1.0,0,0,0,short,right,15.0,,,,,,,,3,3,0.0,,,,,3.0,3.0,28,14,14.0,28.0,-14.0,14.0,28.0,-14.0,0.0344054624438286,0.0277893114835024,0.0005037530791014,0.0450325198471546,0.380397886037827,0.0007948022102937,0.511076271533966,0.0,0.0,4.32071408373304,-0.388244443456642,10.7248701244545,-10.7248701244545,2.05185185163282,-2.05185185163282,8.14472223905614,-8.14472223905614,0.844431447971147,-1.23267589142779,0.0,0.0,3.30510950140888,-3.30510950140888,1.08758767938707,-1.08758767938707,-13.4531730587478,13.4531730587478,20.3691406684229,-20.3691406684229,0.0819615572690964,0.918038442730904,0.918038442730904,0.0819615572690964,-0.0085748210549354,-0.0027450621128082,0.0027450621128082,0.926613263785839,0.0733867362141609,0.0623670518398285,0.937632948160172,0.036304620003769,-0.036304620003769,0.395310065731535,-0.395310065731535,0.0,-0.0085748210549354,0.0,0.0,0.110668098317095,-0.110668098317095,0.166402732281507,-0.166402732281507,0.110668098317095,-0.110668098317095,0.239744995980085,-0.239744995980085,0.0,0.0,0.0,0.0,0.0,0.0,0.0,0.0,1.0,0,0.0,0.0,0.0,0.0,0.0,0.0,0.0,0.0,0.0,0.0,0.0,0.0,0.0,0.0,0.0,0.0,0.0,0.0,0.0,0.0,0.0,0.0,0.0,1.0,0.0,0.0,0.0,0.0,0.0,0.0,0.0,0.0,0.0,0.0,0.0,0.0,0.0,0.0,0.0,0.0,0.0,00-0036971,T.Lawrence,,00-0033891,Z.Jones,,,,,,,,,,,,,,,,,,,,,,,,,,,,,,,,,,,,,,,,,,,,,,,,,,,,,,,,,,,,,,,,,0.0,,,,,,,,,,,,,,,,,,,,,,,,,,,,,,,,0.0,,,,,0,,,0.0,0.0,0.0,0.0,,,2023,0.471248835325241,-47.1248835325241,50,1,Touchdown,4140,"12/10/23, 13:02:34",2023-12-10T20:55:46.603Z,Cleveland Browns Stadium,"Cloudy Temp: 39° F, Humidity: 70%, Wind: W 11 mph",cbae84ca-f053-11ed-b4a7-bab79e4492fa,0,0,PASS,0,,2023-12-10T20:55:51.377Z,,29,Touchdown,2023-12-10T20:50:30.523Z,9.0,3:42,4.0,1.0,1.0,4.0,4.0,15.0,KICKOFF,TOUCHDOWN,12:34,08:52,JAX 25,CLE 19,3959.0,4257.0,27,31,Home,4,58,2.5,37.5,0,outdoors,grass,39.0,11.0,Kevin Stefanski,Doug Pederson,CLE00,FirstEnergy Stadium,0,0.0,T.Lawrence,16.0,,,Z.Jones,7.0,1,0,0.0,0,1,00-0036971,,00-0033891,T.Lawrence,16.0,00-0036971,Z.Jones,00-0033891,Z.Jones,00-0033891,0,1,-0.388244443456642,0.488237118544226,2.43673661537468,1.0,1.0,1.0,0.693544745445252,30.6455254554749,2023-12-10,G.Delpit,2023,REG,CLE,14,00-0036282,S,Grant Delpit,Grant,Delpit,,,,Knee,,Did Not Participate In Practice,2023-12-08T19:46:34Z,2023-12-08 19:46:34
4121,2023_03_ATL_DET,2023092402,DET,ATL,REG,3,DET,home,ATL,DET,67.0,2023-09-24,212.0,212.0,212.0,Half2,0,22.0,0,4,2.0,0,03:32,DET 33,2,16.0,"(3:32) 13-C.Reynolds left end to DET 36 for 3 yards (44-T.Andersen). ATL-44-T.Andersen was injured during the play. Penalty on DET-8-J.Reynolds, Offensive Holding, offsetting, enforced at DET 33 - No Play. Penalty on ATL-90-D.Onyemata, Defensive Holding, offsetting.",no_play,,0,0,0.0,0,0,0,,,,,,,,,,,1,3,,,,,,1.0,3.0,20,6,20.0,6.0,14.0,20.0,6.0,14.0,0.357291638851166,0.0647612810134888,0.0007617489900439,0.117369674146175,0.155410826206207,0.0037193945609033,0.300685465335846,0.0,0.0,1.56107446504757,0.0413573846453801,16.8485576637362,-16.8485576637362,5.63173657027183,-5.63173657027183,12.5424358673529,-12.5424358673529,,,,,-0.504120485723465,0.504120485723465,-0.240913697429094,0.240913697429094,-13.6078602187163,13.6078602187163,18.9784604582549,-18.9784604582549,0.997734904289246,0.0022650957107543,0.997734904289246,0.0022650957107543,0.0,7.62939453125e-06,7.62939453125e-06,,,0.999123156070709,0.999123156070709,0.212822886081684,-0.212822886081684,0.363228236134641,-0.363228236134641,,,,,0.100613838993013,-0.100613838993013,-0.0060240553733778,0.0060240553733778,0.0953331245109439,-0.0953331245109439,0.111451335060887,-0.111451335060887,,,,,,,,,,0,,,,,,,,,,,,,,,,,,,,,,,,,,,,,,,,,,,,,,,,,,,,,,,,,,,,,,,,,,,,,,,,,,,,,,,,,,,,,,,,,,,,,,,,,,,,,,,,,,,,,,,,,,,,,,,,,,,,,,,,,,,,,,,,,,,,,,,,,,,,,,,,,,,,0,,,,,,,,,2023,,,51,1,First down,4121,"9/24/23, 13:02:19",2023-09-24T19:45:18.757Z,Ford Field,"Controlled Climate Temp: 68° F, Humidity: 70%, Wind: mph",b07cf5d7-f053-11ed-b4a7-bab79e4492fa,0,0,PENALTY,0,,2023-09-24T19:45:23.267Z,,22,Punt,2023-09-24T19:43:00.583Z,5.0,2:02,1.0,0.0,0.0,4.0,4.0,0.0,KICKOFF,PUNT,04:19,02:17,DET 25,DET 41,4075.0,4273.0,6,20,Home,14,26,3.0,47.5,0,dome,fieldturf,,,Dan Campbell,Arthur Smith,DET00,Ford Field,0,1.0,,,C.Reynolds,13.0,,,0,1,,0,1,,00-0035567,,C.Reynolds,13.0,00-0035567,,,C.Reynolds,00-0035567,0,0,0.0413573846453801,,,,,,0.0833009704947472,-8.33009704947472,2023-09-24,T.Andersen,2023,REG,ATL,3,00-0037810,LB,Troy Andersen,Troy,Andersen,,,,Concussion,,Full Participation in Practice,2023-09-20T20:36:45Z,2023-09-20 20:36:45
3985,2023_13_CAR_TB,2023120304,TB,CAR,REG,13,TB,home,CAR,TB,64.0,2023-12-03,262.0,262.0,262.0,Half2,0,24.0,0,4,1.0,0,04:22,TB 36,10,10.0,(4:22) 1-R.White right tackle to TB 39 for 3 yards (98-M.Haynes). CAR-97-Y.Gross-Matos was injured during the play.,run,3.0,0,0,0.0,0,0,0,,,,,right,tackle,,,,,3,3,0.0,,,,,3.0,3.0,21,18,21.0,18.0,3.0,21.0,18.0,3.0,0.319703251123428,0.0741601437330246,0.0007248327019624,0.115879267454147,0.179655998945236,0.0032287465874105,0.306647777557373,0.0,0.0,1.65687496413011,-0.415719795273617,2.24048534191483,-2.24048534191483,0.746390672062878,-0.746390672062878,-0.51154171070084,0.51154171070084,,,0.0,0.0,-6.60333303036168,6.60333303036168,1.90732277790084,-1.90732277790084,-4.14451307011768,4.14451307011768,-1.01989412249532,1.01989412249532,0.808822751045227,0.191177248954773,0.808822751045227,0.191177248954773,-0.0138569474220276,-0.003616988658905,-0.003616988658905,0.7949658036232,0.205034196376801,0.820823431015015,0.820823431015015,-0.0161864692830811,0.0161864692830811,0.190992824927757,-0.190992824927757,,,0.0,0.0,0.0742047429084778,-0.0742047429084778,-0.0224804541013743,0.0224804541013743,0.381780445575714,-0.381780445575714,-0.357839546903184,0.357839546903184,0.0,0.0,0.0,0.0,0.0,0.0,0.0,0.0,0.0,0,0.0,0.0,0.0,0.0,0.0,0.0,0.0,0.0,0.0,0.0,0.0,0.0,0.0,0.0,1.0,0.0,0.0,0.0,0.0,0.0,0.0,0.0,1.0,0.0,0.0,0.0,0.0,0.0,0.0,0.0,0.0,0.0,0.0,0.0,0.0,0.0,0.0,0.0,0.0,0.0,0.0,,,,,,,00-0037256,R.White,3.0,,,,,,,,,,,,,,,,,,,,,,,,,,,,,,,,,,,,,,,,,,,CAR,,00-0034382,,M.Haynes,,,,,,,,,,,,,,0.0,,,,,,,,,,,,,,,,,,,,,,,,,,,,,,,,0.0,,,,,0,,,0.0,0.0,0.0,0.0,,,2023,,,48,0,Punt,3985,"12/3/23, 16:05:20",2023-12-03T23:59:59.543Z,Raymond James Stadium,"Cloudy Temp: 81° F, Humidity: 77%, Wind: SW 8 mph",cbae30de-f053-11ed-b4a7-bab79e4492fa,0,0,RUSH,0,,2023-12-04T00:00:03.480Z,,24,Punt,2023-12-03T23:58:40.397Z,4.0,1:31,1.0,0.0,0.0,4.0,4.0,0.0,KICKOFF,PUNT,05:02,03:31,TB 25,TB 35,3937.0,4065.0,18,21,Home,3,39,4.0,37.0,1,outdoors,grass,81.0,8.0,Todd Bowles,Chris Tabor,TAM00,Raymond James Stadium,0,0.0,,,R.White,1.0,,,0,1,0.0,0,1,,00-0037256,,R.White,1.0,00-0037256,R.White,00-0037256,R.White,00-0037256,0,1,-0.415719795273617,,,,,,0.277079701423645,-27.7079701423645,2023-12-03,Y.Gross-Matos,2023,REG,CAR,13,00-0036288,LB,Yetur Gross-Matos,Yetur,Gross-Matos,Hamstring,,Questionable,Hamstring,,Limited Participation in Practice,2023-12-01T17:52:27Z,2023-12-01 17:52:27
3955,2023_09_TB_HOU,2023110505,HOU,TB,REG,9,TB,away,HOU,TB,61.0,2023-11-05,267.0,267.0,267.0,Half2,0,22.0,0,4,1.0,0,04:27,TB 39,10,61.0,(4:27) (Shotgun) 6-B.Mayfield pass short left to 13-M.Evans to TB 47 for 8 yards (5-J.Pitre; 6-D.Perryman). TB-13-M.Evans was injured during the play.,pass,8.0,1,0,1.0,0,0,0,short,left,4.0,4.0,,,,,,,3,2,0.0,,,,,2.0,3.0,33,30,30.0,33.0,-3.0,30.0,33.0,-3.0,0.273402899503708,0.0772525742650032,0.0006604611990042,0.115640990436077,0.204239666461945,0.0038289667572826,0.324974447488785,0.0,0.0,1.85263248707633,0.396670112619177,-2.42990929475954,2.42990929475954,-1.57716776467515,1.57716776467515,10.6636299573309,-10.6636299573309,-0.191901852958836,0.588571965578012,-0.191901852958836,0.588571965578012,13.1339998954209,-13.1339998954209,5.61889430092997,-5.61889430092997,29.4520884664962,-29.4520884664962,-14.2109971291632,14.2109971291632,0.345997452735901,0.654002547264099,0.654002547264099,0.345997452735901,-0.0056855678558349,6.79194927215576e-05,-6.79194927215576e-05,0.659688115119934,0.340311884880066,0.35088062286377,0.649119377136231,-0.0631173412027194,0.0631173412027194,0.234071412722354,-0.234071412722354,0.0,-0.0056855678558349,0.0,-0.0056855678558349,0.236355433791876,-0.236355433791876,0.384259133632068,-0.384259133632068,0.236355433791876,-0.236355433791876,0.217490463549976,-0.217490463549976,0.0,0.0,0.0,0.0,0.0,0.0,0.0,0.0,0.0,0,0.0,0.0,0.0,0.0,0.0,0.0,0.0,0.0,0.0,0.0,0.0,0.0,0.0,0.0,0.0,0.0,0.0,0.0,0.0,0.0,0.0,0.0,0.0,1.0,0.0,0.0,0.0,0.0,0.0,0.0,0.0,0.0,0.0,0.0,0.0,1.0,1.0,0.0,0.0,0.0,0.0,00-0034855,B.Mayfield,8.0,00-0031408,M.Evans,8.0,,,,,,,,,,,,,,,,,,,,,,,,,,,,,,,,,,,,,,,,,,,,,,,,,,,,00-0037246,J.Pitre,HOU,00-0032103,D.Perryman,HOU,,,,,,,0.0,,,,,,,,,,,,,,,,,,,,,,,,,,,,,,,,0.0,,,,,0,,,0.0,0.0,0.0,0.0,,,2023,0.798740863800049,20.1259136199951,54,1,First down,3955,"11/5/23, 13:02:51",2023-11-05T21:01:05.437Z,NRG Stadium,"Indoors Temp: 80° F, Humidity: 60%, Wind: ESE 5 mph",b07ec38f-f053-11ed-b4a7-bab79e4492fa,0,0,PASS,0,,2023-11-05T21:01:11.897Z,,22,Touchdown,2023-11-05T21:01:05.437Z,10.0,3:41,4.0,1.0,1.0,4.0,4.0,-5.0,PUNT,TOUCHDOWN,04:27,00:46,TB 39,HOU 14,3955.0,4291.0,37,39,Home,2,76,2.5,39.5,0,closed,astroturf,,,DeMeco Ryans,Todd Bowles,HOU00,NRG Stadium,0,1.0,B.Mayfield,6.0,,,M.Evans,13.0,1,0,0.0,0,1,00-0034855,,00-0031408,B.Mayfield,6.0,00-0034855,M.Evans,00-0031408,M.Evans,00-0031408,0,1,0.396670112619177,0.547887257917565,4.26716149672575,3.0,0.638595460390206,0.240622459386941,0.669396638870239,33.0603361129761,2023-11-05,M.Evans,2023,REG,TB,9,00-0031408,WR,Mike Evans,Mike,Evans,,,,Not injury related - resting player,,Did Not Participate In Practice,2023-11-03T18:16:18Z,2023-11-03 18:16:18
3934,2023_09_IND_CAR,2023110508,CAR,IND,REG,9,IND,away,CAR,IND,56.0,2023-11-05,312.0,312.0,312.0,Half2,0,17.0,0,4,4.0,0,05:12,IND 44,10,19.0,"(5:12) 8-R.Sanchez punts 41 yards to CAR 15, Center-46-L.Rhodes. 11-I.Smith-Marsette to CAR 39 for 24 yards (35-C.Lammons, 50-S.Olubi). CAR-57-C.Wooten was injured during the play.",punt,0.0,0,0,0.0,0,0,0,,,,,,,,41.0,,,2,3,0.0,,,,,3.0,2.0,13,27,27.0,13.0,14.0,27.0,13.0,14.0,0.336133480072022,0.138149112462997,0.0024890666827559,0.210618510842323,0.119762599468231,0.0037043613847345,0.189142867922783,0.0,0.0,-0.203058450017124,-1.29963990859687,-14.2015990813681,14.2015990813681,7.01113123132382,-7.01113123132382,-19.3006810262425,19.3006810262425,,,0.0,0.0,0.060565349346728,-0.060565349346728,-0.753157351689879,0.753157351689879,-1.17330051592667,1.17330051592667,-16.0023335583867,16.0023335583867,0.986527740955353,0.0134722590446472,0.0134722590446472,0.986527740955353,-0.0225695632398129,-0.0143773593008518,0.0143773593008518,0.0360418222844601,0.96395817771554,0.991385936737061,0.0086140632629394,-0.081473633646965,0.081473633646965,-0.4443037672858,0.4443037672858,,,0.0,0.0,-0.0073419176042079,0.0073419176042079,-0.0131729090864164,0.0131729090864164,-0.0298994965851307,0.0298994965851307,-0.319610973350263,0.319610973350263,0.0,0.0,0.0,0.0,0.0,0.0,0.0,0.0,0.0,0,0.0,0.0,0.0,0.0,0.0,0.0,0.0,0.0,0.0,0.0,0.0,0.0,0.0,0.0,0.0,0.0,0.0,0.0,0.0,0.0,0.0,0.0,0.0,0.0,0.0,0.0,0.0,0.0,0.0,0.0,0.0,0.0,0.0,1.0,0.0,0.0,1.0,0.0,0.0,0.0,0.0,,,,,,,,,,,,,,,,,,,,,,00-0036635,I.Smith-Marsette,,,,,,,00-0033269,R.Sanchez,,,,,,,,,,,,,,,,,,,,,,,,,,,00-0037527,S.Olubi,IND,,,,,,,,,,1.0,00-0034145,C.Lammons,IND,,,,,,,,,,,,,,,,,,,,,,,,,,,,CAR,24.0,,,,,0,,,0.0,0.0,0.0,0.0,,,2023,,,47,0,Punt,3934,"11/5/23, 16:05:27",2023-11-05T23:49:43.253Z,Bank of America Stadium,"Clear Temp: 75° F, Humidity: 31%, Wind: E 2 mph",b07ed134-f053-11ed-b4a7-bab79e4492fa,0,0,PUNT,1,,2023-11-05T23:49:55.367Z,,17,Punt,2023-11-05T23:41:15.213Z,5.0,3:11,1.0,0.0,0.0,4.0,4.0,15.0,KICKOFF,PUNT,08:09,04:58,IND 25,IND 44,3745.0,3934.0,27,13,Home,-14,40,-1.5,45.0,0,outdoors,grass,75.0,2.0,Frank Reich,Shane Steichen,CAR00,Bank of America Stadium,0,0.0,,,,,,,0,0,0.0,1,0,,,,,,,,,,,0,1,-1.29963990859687,,,,,,,,2023-11-05,C.Wooten,2023,REG,CAR,9,00-0037560,LB,Chandler Wooten,Chandler,Wooten,,,,Hamstring,,Full Participation in Practice,2023-11-03T17:42:08Z,2023-11-03 17:42:08
3890,2023_12_LA_ARI,2023112606,ARI,LA,REG,12,ARI,home,LA,LA,11.0,2023-11-26,341.0,341.0,341.0,Half2,0,19.0,0,4,3.0,0,05:41,LA 11,1,75.0,"(5:41) (No Huddle, Shotgun) 22-M.Carter left tackle to LA 6 for 5 yards (43-J.Johnson). LA-52-L.Murchison was injured during the play.",run,5.0,1,1,0.0,0,0,0,,,,,left,tackle,,,,,3,1,0.0,,,,,3.0,1.0,8,37,8.0,37.0,-29.0,8.0,37.0,-29.0,0.0564905628561974,0.0143896760419011,0.0005372575833462,0.0179977305233479,0.340357095003128,0.0008692212868481,0.569358468055725,0.0,0.0,4.83809134701733,0.726400085608475,-31.7912944537398,31.7912944537398,-6.07922743925871,6.07922743925871,-25.153122836889,25.153122836889,,,0.0,0.0,-4.63438348792261,4.63438348792261,-11.2864672740689,11.2864672740689,1.60912325885147,-1.60912325885147,-22.7732079810717,22.7732079810717,0.0005378679488785,0.999462132051121,0.0005378679488785,0.999462132051121,-1.91268045455217e-05,1.40324118547142e-05,1.40324118547142e-05,0.000518741144333,0.999481258855667,7.48032689443789e-05,7.48032689443789e-05,-0.154712421322048,0.154712421322048,-0.437717377575156,0.437717377575156,,,0.0,0.0,-0.0157112771523331,0.0157112771523331,-0.296410028087212,0.296410028087212,-0.0157112771523331,0.0157112771523331,-0.371745578252831,0.371745578252831,0.0,1.0,0.0,0.0,1.0,0.0,0.0,0.0,0.0,0,0.0,0.0,0.0,0.0,0.0,0.0,0.0,0.0,0.0,0.0,0.0,0.0,0.0,0.0,1.0,0.0,0.0,0.0,0.0,0.0,0.0,0.0,1.0,0.0,0.0,0.0,0.0,0.0,0.0,0.0,0.0,0.0,0.0,0.0,0.0,0.0,0.0,0.0,0.0,0.0,0.0,,,,,,,00-0036924,M.Carter,5.0,,,,,,,,,,,,,,,,,,,,,,,,,,,,,,,,,,,,,,,,,,,LA,,00-0033927,,J.Johnson,,,,,,,,,,,,,,0.0,,,,,,,,,,,,,,,,,,,,,,,,,,,,,,,,0.0,,,,,0,,,0.0,0.0,0.0,0.0,,,2023,,,51,1,First down,3890,"11/26/23, 16:05:25",2023-11-26T23:46:06.693Z,State Farm Stadium,"Partly Cloudy Temp: 70° F, Humidity: 16%, Wind: SW 6 mph",cbadc672-f053-11ed-b4a7-bab79e4492fa,0,0,RUSH,0,,2023-11-26T23:46:11.663Z,,19,Touchdown,2023-11-26T23:40:28.520Z,10.0,3:07,4.0,1.0,1.0,4.0,4.0,5.0,KICKOFF,TOUCHDOWN,08:19,05:12,ARI 25,LA 6,3621.0,3941.0,37,14,Home,-23,51,-3.0,45.0,1,closed,grass,,,Jonathan Gannon,Sean McVay,PHO00,State Farm Stadium,0,1.0,,,M.Carter,22.0,,,0,1,1.0,0,1,,00-0036924,,M.Carter,22.0,00-0036924,M.Carter,00-0036924,M.Carter,00-0036924,0,0,0.726400085608475,,,,,,0.483547329902649,-48.3547329902649,2023-11-26,L.Murchison,2023,REG,LA,12,00-0036237,DT,Larrell Murchison,Larrell,Murchison,,,,Knee,,Full Participation in Practice,2023-11-24T21:50:43Z,2023-11-24 21:50:43
3888,2023_12_CLE_DEN,2023112607,DEN,CLE,REG,12,CLE,away,DEN,DEN,33.0,2023-11-26,513.0,513.0,513.0,Half2,0,18.0,0,4,3.0,0,08:33,DEN 33,14,35.0,"(8:33) (Shotgun) 10-P.Walker pass incomplete short left to 2-A.Cooper. CLE-2-A.Cooper was injured during the play. Penalty on CLE-77-W.Teller, Offensive Holding, declined.",pass,0.0,1,0,1.0,0,0,0,short,left,4.0,,,,,,,,3,3,0.0,,,,,3.0,3.0,24,12,12.0,24.0,-12.0,12.0,24.0,-12.0,0.0778197646141052,0.0716163814067841,0.0011108311591669,0.117414519190788,0.497708022594452,0.0016421591863036,0.232688367366791,0.0,0.0,2.08625451684929,-1.0575254666619,12.076537814895,-12.076537814895,4.41035933623942,-4.41035933623942,6.79303304894953,-6.79303304894953,-0.282280304236338,-0.775245162425563,0.0,0.0,-7.38944521418307,7.38944521418307,3.82791863975581,-3.82791863975581,-14.8699451073771,14.8699451073771,19.6325192838147,-19.6325192838147,0.0588574968278408,0.941142503172159,0.941142503172159,0.0588574968278408,-0.0173024758696556,-0.0125069804489613,0.0125069804489613,0.958444979041815,0.0415550209581852,0.0541850998997688,0.945814900100231,0.189168381734585,-0.189168381734585,0.228601155117889,-0.228601155117889,0.0,-0.0173024758696556,0.0,0.0,-0.147409911706309,0.147409911706309,0.0928037911653519,-0.0928037911653519,-0.107028822853427,0.107028822853427,0.268773201853037,-0.268773201853037,0.0,0.0,0.0,0.0,0.0,1.0,0.0,0.0,1.0,0,0.0,0.0,0.0,0.0,0.0,0.0,0.0,0.0,0.0,0.0,0.0,0.0,0.0,0.0,0.0,0.0,0.0,0.0,0.0,0.0,0.0,0.0,0.0,1.0,0.0,0.0,0.0,0.0,0.0,0.0,0.0,0.0,0.0,0.0,0.0,0.0,0.0,0.0,0.0,0.0,0.0,00-0033275,P.Walker,,00-0031544,A.Cooper,,,,,,,,,,,,,,,,,,,,,,,,,,,,,,,,,,,,,,,,,,,,,,,,,,,,,,,,,,,,,,,,,0.0,,,,,,,,,,,,,,,,,,,,,,,,,,,,,,,,0.0,,,,,0,,,0.0,0.0,0.0,0.0,,,2023,0.746698498725891,-74.6698498725891,48,0,Turnover,3888,"11/26/23, 16:05:39",2023-11-26T23:47:44.860Z,Empower Field at Mile High,"Sunny Temp: 40° F, Humidity: 28%, Wind: NW 5 mph",cbadd1c6-f053-11ed-b4a7-bab79e4492fa,0,0,PASS,0,,2023-11-26T23:47:49.667Z,,18,Turnover,2023-11-26T23:44:48.283Z,6.0,1:43,2.0,0.0,0.0,4.0,4.0,15.0,PUNT,FUMBLE,10:07,08:24,CLE 23,DEN 33,3762.0,3932.0,12,29,Home,17,41,1.5,37.5,0,outdoors,grass,40.0,5.0,Sean Payton,Kevin Stefanski,DEN00,Empower Field at Mile High,0,0.0,P.Walker,10.0,,,A.Cooper,2.0,1,0,0.0,0,1,00-0033275,,00-0031544,P.Walker,10.0,00-0033275,A.Cooper,00-0031544,A.Cooper,00-0031544,0,0,-1.0575254666619,0.623602836140298,4.35369447534322,3.0,0.55880764129688,0.107537943898933,0.981456995010376,1.8543004989624,2023-11-26,A.Cooper,2023,REG,CLE,12,00-0031544,WR,Amari Cooper,Amari,Cooper,,,,Not injury related - resting player,,Did Not Participate In Practice,2023-11-22T22:26:44Z,2023-11-22 22:26:44
3861,2023_16_DAL_MIA,2023122410,MIA,DAL,REG,16,MIA,home,DAL,MIA,54.0,2023-12-24,199.0,199.0,199.0,Half2,0,18.0,0,4,1.0,0,03:19,MIA 46,10,64.0,(3:19) (Shotgun) 1-T.Tagovailoa pass short right to 11-C.Wilson to DAL 45 for 9 yards (21-S.Gilmore). DAL-21-S.Gilmore was injured during the play.,pass,9.0,1,0,1.0,0,0,0,short,right,8.0,1.0,,,,,,,2,3,0.0,,,,,2.0,3.0,19,20,19.0,20.0,-1.0,19.0,20.0,-1.0,0.377352625131607,0.0583857670426369,0.0004259097913745,0.0792452469468117,0.194164678454399,0.0059962691739201,0.284429460763931,0.0,0.0,1.85476694972022,0.685081790434197,0.108837701597998,-0.108837701597998,-0.180402728865819,0.180402728865819,-2.51848221546927,2.51848221546927,0.572304328728933,0.112777461705264,0.572304328728933,0.112777461705264,0.640225469775032,-0.640225469775032,-4.36110456515557,4.36110456515557,16.7935096859583,-16.7935096859583,-22.7973725876359,22.7973725876359,0.555805444717407,0.444194555282593,0.555805444717407,0.444194555282593,0.0709444284439087,0.0578148365020752,0.0578148365020752,0.626749873161316,0.373250126838684,0.536216676235199,0.536216676235199,0.118318006396294,-0.118318006396294,0.0821735836916066,-0.0821735836916066,0.0,0.0709444284439087,0.0,0.0709444284439087,-0.318094856349578,0.318094856349578,0.158584480080247,-0.158584480080247,-0.319395310489287,0.319395310489287,0.170006249937653,-0.170006249937653,0.0,0.0,0.0,0.0,0.0,0.0,0.0,0.0,0.0,0,0.0,0.0,0.0,0.0,0.0,0.0,0.0,0.0,0.0,0.0,0.0,0.0,0.0,0.0,1.0,0.0,0.0,0.0,0.0,0.0,0.0,0.0,0.0,1.0,0.0,0.0,0.0,0.0,0.0,0.0,0.0,0.0,0.0,0.0,0.0,1.0,0.0,0.0,0.0,0.0,0.0,00-0036212,T.Tagovailoa,9.0,00-0034418,C.Wilson,9.0,,,,,,,,,,,,,,,,,,,,,,,,,,,,,,,,,,,,,,,,,,,,,,DAL,,00-0029542,,S.Gilmore,,,,,,,,,,,,,,0.0,,,,,,,,,,,,,,,,,,,,,,,,,,,,,,,,0.0,,,,,0,,,0.0,0.0,0.0,0.0,,,2023,0.695928335189819,30.4071664810181,53,1,First down,3861,"12/24/23, 16:25:47",2023-12-25T00:13:43.083Z,Hard Rock Stadium,"Cloudy Temp: 75° F, Humidity: 66%, Wind: E 15 mph",cbaf5f72-f053-11ed-b4a7-bab79e4492fa,0,0,PASS,0,,2023-12-25T00:13:46.287Z,,18,Field goal,2023-12-25T00:11:35.357Z,12.0,3:27,4.0,1.0,1.0,4.0,4.0,15.0,KICKOFF,FIELD_GOAL,03:27,00:00,MIA 25,DAL 11,3802.0,4133.0,20,22,Home,2,42,1.5,48.5,0,outdoors,grass,75.0,15.0,Mike McDaniel,Mike McCarthy,MIA00,Hard Rock Stadium,0,1.0,T.Tagovailoa,1.0,,,C.Wilson,11.0,1,0,0.0,0,1,00-0036212,,00-0034418,T.Tagovailoa,1.0,00-0036212,C.Wilson,00-0034418,C.Wilson,00-0034418,0,0,0.685081790434197,0.235779097660281,3.50889332391671,1.0,0.998840920743532,0.474408356938511,0.631590962409973,36.8409037590027,2023-12-24,S.Gilmore,2023,REG,DAL,16,00-0029542,CB,Stephon Gilmore,Stephon,Gilmore,,,,Not injury related - resting player,,Did Not Participate In Practice,2023-12-20T23:25:50Z,2023-12-20 23:25:50
3857,2023_09_IND_CAR,2023110508,CAR,IND,REG,9,IND,away,CAR,IND,56.0,2023-11-05,397.0,397.0,397.0,Half2,0,17.0,0,4,1.0,0,06:37,IND 44,10,19.0,"(6:37) 21-Z.Moss left guard to IND 45 for 1 yard (49-F.Luvu, 91-N.Thurman). CAR-0-B.Burns was injured during the play.",run,1.0,0,0,0.0,0,0,0,,,,,left,guard,,,,,2,3,0.0,,,,,3.0,2.0,13,27,27.0,13.0,14.0,27.0,13.0,14.0,0.221529111266136,0.0753092020750046,0.0016496394528076,0.103082075715065,0.209757626056671,0.0017480828100815,0.386924237012863,0.0,0.0,2.39043728774413,-0.550147600937635,-17.5445871267886,17.5445871267886,6.27083362091798,-6.27083362091798,-20.6037315526603,20.6037315526603,,,0.0,0.0,0.060565349346728,-0.060565349346728,-0.753157351689879,0.753157351689879,-1.93695499382098,1.93695499382098,-16.5417296069102,16.5417296069102,0.994457602500916,0.0055423974990844,0.0055423974990844,0.994457602500916,-0.0016705393791198,-0.000361144542694,0.000361144542694,0.0072129368782043,0.992787063121796,0.994814395904541,0.0051856040954589,-0.0845956057310104,0.0845956057310104,-0.447441117368198,0.447441117368198,,,0.0,0.0,-0.0073419176042079,0.0073419176042079,-0.0131729090864164,0.0131729090864164,-0.0298994965851307,0.0298994965851307,-0.322748323432661,0.322748323432661,0.0,0.0,0.0,0.0,0.0,0.0,0.0,0.0,0.0,0,0.0,0.0,0.0,0.0,0.0,0.0,0.0,0.0,0.0,0.0,0.0,0.0,0.0,0.0,0.0,0.0,0.0,0.0,0.0,0.0,0.0,0.0,1.0,0.0,0.0,0.0,0.0,0.0,0.0,0.0,0.0,0.0,0.0,0.0,0.0,0.0,1.0,0.0,0.0,0.0,0.0,,,,,,,00-0036251,Z.Moss,1.0,,,,,,,,,,,,,,,,,,,,,,,,,,,,,,,,,,,,,,,,,,,,,,,,,00-0034723,N.Thurman,CAR,,,,,,,,,,1.0,00-0034302,F.Luvu,CAR,,,,,,,,,,,,,,,,,,,,,,,,,,,,,0.0,,,,,0,,,0.0,0.0,0.0,0.0,,,2023,,,47,0,Punt,3857,"11/5/23, 16:05:27",2023-11-05T23:44:37.747Z,Bank of America Stadium,"Clear Temp: 75° F, Humidity: 31%, Wind: E 2 mph",b07ed134-f053-11ed-b4a7-bab79e4492fa,0,0,RUSH,0,,2023-11-05T23:44:41.853Z,,17,Punt,2023-11-05T23:41:15.213Z,5.0,3:11,1.0,0.0,0.0,4.0,4.0,15.0,KICKOFF,PUNT,08:09,04:58,IND 25,IND 44,3745.0,3934.0,27,13,Home,-14,40,-1.5,45.0,0,outdoors,grass,75.0,2.0,Frank Reich,Shane Steichen,CAR00,Bank of America Stadium,0,0.0,,,Z.Moss,21.0,,,0,1,0.0,0,1,,00-0036251,,Z.Moss,21.0,00-0036251,Z.Moss,00-0036251,Z.Moss,00-0036251,0,1,-0.550147600937635,,,,,,0.123538501560688,-12.3538501560688,2023-11-05,B.Burns,2023,REG,CAR,9,00-0035713,LB,Brian Burns,Brian,Burns,,,,Elbow,,Full Participation in Practice,2023-11-03T17:39:47Z,2023-11-03 17:39:47
3746,2023_14_JAX_CLE,2023121004,CLE,JAX,REG,14,JAX,away,CLE,JAX,94.0,2023-12-10,42.0,942.0,942.0,Half2,0,27.0,0,3,1.0,0,00:42,JAX 6,10,9.0,(:42) (Shotgun) 16-T.Lawrence sacked at JAX 6 for 0 yards (54-O.Okoronkwo). CLE-54-O.Okoronkwo was injured during the play. His return is Probable.,pass,0.0,1,0,1.0,0,0,0,,,,,,,,,,,3,3,0.0,,,,,3.0,3.0,21,14,14.0,21.0,-7.0,14.0,21.0,-7.0,0.048168957233429,0.185453921556473,0.0191790740936995,0.296835213899612,0.167957305908203,0.0012141428887844,0.281191349029541,0.0,0.0,-0.197926763445139,-0.61394946440123,7.41824144880282,-7.41824144880282,2.99405644764192,-2.99405644764192,3.96346197050298,-3.96346197050298,,,0.0,0.0,1.83737395593198,-1.83737395593198,-0.0881922621047124,0.0881922621047124,-14.1078632078716,14.1078632078716,16.8425705489935,-16.8425705489935,0.15937839448452,0.84062160551548,0.84062160551548,0.15937839448452,-0.0134634375572205,-0.0101639032363892,0.0101639032363892,0.854085043072701,0.1459149569273,0.169967144727707,0.830032855272293,0.0535375111759396,-0.0535375111759396,0.305721981321121,-0.305721981321121,,,0.0,0.0,0.110668098317095,-0.110668098317095,0.0833953582821645,-0.0833953582821645,0.110668098317095,-0.110668098317095,0.150156911569671,-0.150156911569671,0.0,0.0,0.0,0.0,0.0,0.0,0.0,0.0,0.0,0,0.0,0.0,0.0,0.0,0.0,0.0,0.0,0.0,0.0,0.0,0.0,0.0,0.0,0.0,1.0,0.0,0.0,0.0,0.0,0.0,0.0,1.0,0.0,1.0,1.0,0.0,0.0,0.0,0.0,0.0,0.0,0.0,0.0,0.0,0.0,0.0,0.0,0.0,0.0,0.0,0.0,00-0036971,T.Lawrence,,,,,,,,,,,,,,,,,,,,,,,,,,,,,,,,,,,,,,,,00-0034807,O.Okoronkwo,,,,,,,,,CLE,,00-0034807,,O.Okoronkwo,,,,,,,,,,,,,,0.0,,,,,,,,,,,,,,,,,,,,,,,,,00-0034807,O.Okoronkwo,,,,,,0.0,,,,,0,,,0.0,0.0,0.0,0.0,,,2023,,,45,0,Turnover,3746,"12/10/23, 13:02:34",2023-12-10T20:38:08.547Z,Cleveland Browns Stadium,"Cloudy Temp: 39° F, Humidity: 70%, Wind: W 11 mph",cbae84ca-f053-11ed-b4a7-bab79e4492fa,0,0,SACK,0,,2023-12-10T20:38:13.990Z,,27,Turnover,2023-12-10T20:38:08.547Z,3.0,1:32,0.0,0.0,0.0,3.0,4.0,0.0,PUNT,INTERCEPTION,00:42,14:10,JAX 6,JAX 15,3746.0,3821.0,27,31,Home,4,58,2.5,37.5,0,outdoors,grass,39.0,11.0,Kevin Stefanski,Doug Pederson,CLE00,FirstEnergy Stadium,0,0.0,T.Lawrence,16.0,,,,,1,0,0.0,0,1,00-0036971,,,T.Lawrence,16.0,00-0036971,,,,,0,1,-0.61394946440123,,,,,,0.373032599687576,62.6967400312424,2023-12-10,O.Okoronkwo,2023,REG,CLE,14,00-0034807,DE,Ogbonnia Okoronkwo,Ogbonnia,Okoronkwo,,,,Foot,Groin,Full Participation in Practice,2023-12-08T19:48:03Z,2023-12-08 19:48:03
3738,2023_13_ATL_NYJ,2023120302,NYJ,ATL,REG,13,NYJ,home,ATL,NYJ,51.0,2023-12-03,689.0,689.0,689.0,Half2,0,20.0,0,4,2.0,0,11:29,NYJ 49,10,30.0,(11:29) (Shotgun) 33-D.Cook right guard to NYJ 49 for no gain (90-D.Onyemata). ATL-53-N.Landman was injured during the play.,run,0.0,1,0,0.0,0,0,0,,,,,right,guard,,,,,2,3,0.0,,,,,2.0,3.0,8,13,8.0,13.0,-5.0,8.0,13.0,-5.0,0.0952218174934387,0.0966895967721939,0.0009820641716942,0.162088185548782,0.264438480138779,0.0072853383608162,0.373294562101364,0.0,0.0,1.99429783434607,-0.896379643585533,-6.7829757692385,6.7829757692385,-3.89739994506817,3.89739994506817,-0.621546645043443,0.621546645043443,,,0.0,0.0,-8.18657244561473,8.18657244561473,6.18172821429256,-6.18172821429256,-11.437736386375,11.437736386375,8.51609977249752,-8.51609977249752,0.338831454515457,0.661168545484543,0.338831454515457,0.661168545484543,-0.0373730957508087,-0.034118577837944,-0.034118577837944,0.301458358764648,0.698541641235352,0.276741951704025,0.276741951704025,-0.138292163610458,0.138292163610458,0.0921601609939097,-0.0921601609939097,,,0.0,0.0,-0.227830414319658,0.227830414319658,0.244260489940643,-0.244260489940643,-0.232514117503786,0.232514117503786,0.262988388538361,-0.262988388538361,0.0,0.0,0.0,0.0,0.0,0.0,0.0,0.0,0.0,0,0.0,0.0,0.0,0.0,0.0,0.0,0.0,0.0,0.0,0.0,0.0,0.0,0.0,0.0,1.0,0.0,0.0,0.0,0.0,0.0,0.0,0.0,1.0,0.0,0.0,0.0,0.0,0.0,0.0,0.0,0.0,0.0,0.0,0.0,0.0,0.0,0.0,0.0,0.0,0.0,0.0,,,,,,,00-0033893,D.Cook,0.0,,,,,,,,,,,,,,,,,,,,,,,,,,,,,,,,,,,,,,,,,,,ATL,,00-0033051,,D.Onyemata,,,,,,,,,,,,,,0.0,,,,,,,,,,,,,,,,,,,,,,,,,,,,,,,,0.0,,,,,0,,,0.0,0.0,0.0,0.0,,,2023,,,44,0,Punt,3738,"12/3/23, 13:02:52",2023-12-03T20:46:49.817Z,MetLife Stadium,"Cloudy Temp: 50° F, Humidity: 90%, Wind: NE 8 mph",cbae232d-f053-11ed-b4a7-bab79e4492fa,0,0,RUSH,0,,2023-12-03T20:46:56.157Z,,20,Punt,2023-12-03T20:42:49.577Z,7.0,2:19,2.0,0.0,0.0,4.0,4.0,15.0,PUNT,PUNT,13:06,10:47,NYJ 19,NYJ 49,3588.0,3793.0,13,8,Home,-5,21,-2.0,33.0,0,outdoors,fieldturf,50.0,8.0,Robert Saleh,Arthur Smith,NYC01,MetLife Stadium,0,0.0,,,D.Cook,33.0,,,0,1,0.0,0,1,,00-0033893,,D.Cook,33.0,00-0033893,D.Cook,00-0033893,D.Cook,00-0033893,0,0,-0.896379643585533,,,,,,0.711730718612671,-71.1730718612671,2023-12-03,N.Landman,2023,REG,ATL,13,00-0037587,LB,Nate Landman,Nate,Landman,,,,Thigh,,Limited Participation in Practice,2023-12-01T19:32:54Z,2023-12-01 19:32:54
3722,2023_16_IND_ATL,2023122402,ATL,IND,REG,16,ATL,home,IND,IND,46.0,2023-12-24,438.0,438.0,438.0,Half2,0,18.0,0,4,2.0,0,07:18,IND 46,6,33.0,(7:18) 7-B.Robinson left end pushed ob at IND 20 for 26 yards (45-E.Speed). ATL-70-J.Matthews was injured during the play.,run,26.0,0,0,0.0,0,0,0,,,,,left,end,,,,,2,3,0.0,,,,,2.0,3.0,23,10,23.0,10.0,13.0,23.0,10.0,13.0,0.136046081781387,0.0645482987165451,0.0007356010610237,0.117131374776363,0.274816125631332,0.0054080788977444,0.401314467191696,0.0,0.0,2.62943008332513,2.00818656658521,18.4032877177294,-18.4032877177294,10.1736481150147,-10.1736481150147,10.679502579754,-10.679502579754,,,0.0,0.0,-3.20876567098499,3.20876567098499,4.0310495683807,-4.0310495683807,-15.330268842496,15.330268842496,19.4790490606099,-19.4790490606099,0.988359212875366,0.0116407871246338,0.988359212875366,0.0116407871246338,0.0030798912048339,0.006239891052246,0.006239891052246,0.9914391040802,0.0085608959197998,0.988339185714722,0.988339185714722,0.25495841078757,-0.25495841078757,0.357938273462356,-0.357938273462356,,,0.0,0.0,-0.758412477907836,0.758412477907836,0.859666295349598,-0.859666295349598,-0.76058139593631,0.76058139593631,0.917328966781497,-0.917328966781497,0.0,1.0,0.0,0.0,0.0,0.0,0.0,0.0,0.0,0,0.0,0.0,0.0,0.0,0.0,0.0,0.0,0.0,0.0,0.0,0.0,0.0,0.0,0.0,1.0,0.0,0.0,0.0,0.0,0.0,0.0,0.0,1.0,0.0,0.0,0.0,0.0,0.0,0.0,0.0,0.0,0.0,0.0,0.0,0.0,0.0,0.0,0.0,0.0,0.0,0.0,,,,,,,00-0038542,B.Robinson,26.0,,,,,,,,,,,,,,,,,,,,,,,,,,,,,,,,,,,,,,,,,,,IND,,00-0034987,,E.Speed,,,,,,,,,,,,,,0.0,,,,,,,,,,,,,,,,,,,,,,,,,,,,,,,,0.0,,,,,0,,,0.0,0.0,0.0,0.0,,,2023,,,51,1,First down,3722,"12/24/23, 13:02:36",2023-12-24T20:37:09.197Z,Mercedes-Benz Stadium,"Indoors Temp: 68° F, Humidity: 70%, Wind: N/A 0 mph",cbaf301f-f053-11ed-b4a7-bab79e4492fa,0,0,RUSH,0,,2023-12-24T20:37:16.037Z,,18,Field goal,2023-12-24T20:36:29.587Z,6.0,2:11,1.0,1.0,1.0,4.0,4.0,0.0,INTERCEPTION,FIELD_GOAL,07:57,05:46,50,IND 17,3693.0,3825.0,10,29,Home,19,39,3.0,44.0,0,closed,fieldturf,,,Arthur Smith,Shane Steichen,ATL97,Mercedes-Benz Stadium,0,1.0,,,B.Robinson,7.0,,,0,1,1.0,0,1,,00-0038542,,B.Robinson,7.0,00-0038542,B.Robinson,00-0038542,B.Robinson,00-0038542,1,0,2.00818656658521,,,,,,0.31240326166153,-31.240326166153,2023-12-24,J.Matthews,2023,REG,ATL,16,00-0031279,T,Jake Matthews,Jake,Matthews,,,,Knee,,Full Participation in Practice,2023-12-22T20:27:59Z,2023-12-22 20:27:59
3715,2023_01_HOU_BAL,2023091001,BAL,HOU,REG,1,BAL,home,HOU,BAL,74.0,2023-09-10,749.0,749.0,749.0,Half2,0,18.0,0,4,3.0,0,12:29,BAL 26,9,12.0,(12:29) (Shotgun) 8-L.Jackson pass short left to 4-Z.Flowers to BAL 43 for 17 yards (4-T.Thomas). BAL-79-R.Stanley was injured during the play.,pass,17.0,1,0,1.0,0,0,0,short,left,-3.0,20.0,,,,,,,2,2,0.0,,,,,2.0,2.0,22,9,22.0,9.0,13.0,22.0,9.0,13.0,0.102600932121277,0.18114797770977,0.0019126737024635,0.260551780462265,0.205330729484558,0.0045000296086072,0.243955865502358,0.0,0.0,-0.0384484375827014,2.34274757071398,16.0954995718942,-16.0954995718942,11.6855327931179,-11.6855327931179,2.88076470458487,-2.88076470458487,-1.55593017255887,3.89867774327286,-1.55593017255887,3.89867774327286,-2.21353968599578,2.21353968599578,6.37980027651952,-6.37980027651952,-12.7697523309616,12.7697523309616,15.5625579889545,-15.5625579889545,0.962583124637604,0.0374168753623962,0.962583124637604,0.0374168753623962,0.0114635825157166,0.0043389201164245,0.0043389201164245,0.97404670715332,0.0259532928466797,0.981194913387299,0.981194913387299,0.299463823596958,-0.299463823596958,0.167372908443213,-0.167372908443213,0.0,0.0114635825157166,0.0,0.0114635825157166,-0.0690338015556335,0.0690338015556335,0.201245598495007,-0.201245598495007,-0.0690338015556335,0.0690338015556335,0.19525309279561,-0.19525309279561,0.0,0.0,1.0,0.0,1.0,0.0,0.0,0.0,0.0,0,0.0,0.0,0.0,0.0,0.0,0.0,0.0,0.0,0.0,0.0,0.0,0.0,0.0,0.0,1.0,0.0,0.0,0.0,0.0,0.0,0.0,0.0,0.0,1.0,0.0,0.0,0.0,0.0,0.0,0.0,0.0,0.0,0.0,0.0,0.0,1.0,0.0,0.0,0.0,0.0,0.0,00-0034796,L.Jackson,17.0,00-0039064,Z.Flowers,17.0,,,,,,,,,,,,,,,,,,,,,,,,,,,,,,,,,,,,,,,,,,,,,,HOU,,00-0034488,,T.Thomas,,,,,,,,,,,,,,0.0,,,,,,,,,,,,,,,,,,,,,,,,,,,,,,,,0.0,,,,,0,,,0.0,0.0,0.0,0.0,,,2023,0.867082893848419,13.2917106151581,43,1,First down,3715,"9/10/23, 13:02:52",2023-09-10T19:38:32.730Z,M&T Bank Stadium,"Overcast Temp: 78° F, Humidity: 76%, Wind: SE 2 mph",b07c5134-f053-11ed-b4a7-bab79e4492fa,0,0,PASS,0,,2023-09-10T19:38:40.173Z,,18,Punt,2023-09-10T19:35:23.643Z,6.0,3:33,1.0,0.0,0.0,4.0,4.0,-5.0,KICKOFF,PUNT,13:47,10:14,BAL 25,BAL 37,3624.0,3837.0,9,25,Home,16,34,9.5,43.5,0,outdoors,,,,John Harbaugh,DeMeco Ryans,BAL00,M&T Bank Stadium,0,1.0,L.Jackson,8.0,,,Z.Flowers,4.0,1,0,1.0,0,1,00-0034796,,00-0039064,L.Jackson,8.0,00-0034796,Z.Flowers,00-0039064,Z.Flowers,00-0039064,0,1,2.34274757071398,1.65288427670304,10.2742788534815,9.0,0.289378350484185,0.289378350484185,0.965349018573761,3.4650981426239,2023-09-10,R.Stanley,2023,REG,BAL,1,00-0032965,T,Ronnie Stanley,Ronnie,Stanley,,,,Ankle,,Full Participation in Practice,2023-09-08T19:56:55Z,2023-09-08 19:56:55
3713,2023_19_PHI_TB,2024011500,TB,PHI,POST,19,TB,home,PHI,PHI,22.0,2024-01-15,387.0,387.0,387.0,Half2,0,18.0,0,4,2.0,0,06:27,PHI 22,6,83.0,"(6:27) 77-J.Skule reported in as eligible. 1-R.White right end to PHI 23 for -1 yards (55-B.Graham, 2-D.Slay). PHI-2-D.Slay was injured during the play.",run,-1.0,0,0,0.0,0,0,0,,,,,right,end,,,,,3,0,0.0,,,,,3.0,0.0,25,9,25.0,9.0,16.0,25.0,9.0,16.0,0.175114944577217,0.0239995643496513,0.0006617388571612,0.0422915332019329,0.409806877374649,0.0009559508180245,0.347169399261475,0.0,0.0,3.29215542541351,-0.600071623804979,19.0421059326482,-19.0421059326482,7.79568642379297,-7.79568642379297,8.52986537575395,-8.52986537575395,,,0.0,0.0,-0.963937351538334,0.963937351538334,15.900644806854,-15.900644806854,0.357884764991468,-0.357884764991468,14.7229831605267,-14.7229831605267,0.997731864452362,0.0022681355476379,0.997731864452362,0.0022681355476379,0.0009559392929077,0.0013032555580139,0.0013032555580139,0.99868780374527,0.0013121962547302,0.998002231121063,0.998002231121063,0.229852006137371,-0.229852006137371,0.112989036604857,-0.112989036604857,,,0.0,0.0,-0.0449764654040337,0.0449764654040337,0.329715585574602,-0.329715585574602,-0.0492222979664803,0.0492222979664803,0.266318386659121,-0.266318386659121,0.0,0.0,0.0,0.0,0.0,0.0,0.0,0.0,0.0,0,0.0,0.0,0.0,0.0,0.0,0.0,0.0,0.0,0.0,0.0,0.0,0.0,0.0,0.0,0.0,0.0,0.0,1.0,0.0,0.0,0.0,0.0,1.0,0.0,0.0,0.0,0.0,0.0,0.0,0.0,0.0,0.0,0.0,0.0,0.0,0.0,1.0,0.0,0.0,0.0,0.0,,,,,,,00-0037256,R.White,-1.0,,,,,,,,,,,,,,,,,,,,,,,,,,,,,00-0027865,B.Graham,,,,,,,,,,,,,,,,,,,00-0030062,D.Slay,PHI,,,,,,,,,,1.0,00-0027865,B.Graham,PHI,,,,,,,,,,,,,,,,,,,,,,,,,,,,,0.0,,,,,0,,,0.0,0.0,0.0,0.0,,,2023,,,48,1,Touchdown,3713,"1/15/24, 20:16:33",2024-01-16T03:58:14.123Z,Raymond James Stadium,"Cloudy Temp: 67° F, Humidity: 87%, Wind: E 1 mph",08a71e61-add2-11ee-aec3-7d8f81bc70be,0,0,RUSH,0,,2024-01-16T03:58:20.840Z,,18,Touchdown,2024-01-16T03:48:27.537Z,12.0,6:15,5.0,0.0,1.0,4.0,4.0,-10.0,DOWNS,TOUCHDOWN,11:57,05:42,TB 17,PHI 23,3389.0,3773.0,9,32,Home,23,41,-2.5,43.0,0,outdoors,grass,65.0,2.0,Todd Bowles,Nick Sirianni,TAM00,Raymond James Stadium,0,0.0,,,R.White,1.0,,,0,1,0.0,0,1,,00-0037256,,R.White,1.0,00-0037256,R.White,00-0037256,R.White,00-0037256,0,1,-0.600071623804979,,,,,,0.190242126584053,-19.0242126584053,2024-01-15,D.Slay,2023,WC,PHI,19,00-0030062,CB,Darius Slay,Darius,Slay,,,,Knee,,Full Participation in Practice,2024-01-13T20:45:59Z,2024-01-13 20:45:59
3704,2023_14_DET_CHI,2023121002,CHI,DET,REG,14,DET,away,CHI,DET,52.0,2023-12-10,465.0,465.0,465.0,Half2,0,20.0,0,4,2.0,0,07:45,DET 48,5,37.0,(7:45) 5-D.Montgomery left guard to CHI 41 for 11 yards (4-E.Jackson). CHI-91-Y.Ngakoue was injured during the play.,run,11.0,0,0,0.0,0,0,0,,,,,left,guard,,,,,3,2,0.0,,,,,2.0,3.0,28,13,13.0,28.0,-15.0,13.0,28.0,-15.0,0.19133386015892,0.080810934305191,0.0011488931486383,0.130364835262299,0.240056291222572,0.0039175944402813,0.352367550134659,0.0,0.0,2.03729247744195,0.903301873360761,15.1387421770343,-15.1387421770343,4.55003399174893,-4.55003399174893,3.36253236036499,-3.36253236036499,,,0.0,0.0,5.76391328993486,-5.76391328993486,3.33646111673443,-3.33646111673443,10.1454392355517,-10.1454392355517,-4.19052205437307,4.19052205437307,0.0360933803021908,0.963906619697809,0.963906619697809,0.0360933803021908,0.0111125856637955,0.00949352607131,-0.00949352607131,0.952794034034014,0.0472059659659863,0.0480308197438717,0.951969180256128,0.148037318848436,-0.148037318848436,0.0536991577751594,-0.0536991577751594,,,0.0,0.0,-0.0631182308410376,0.0631182308410376,0.277683409787409,-0.277683409787409,-0.0631182308410376,0.0631182308410376,0.130580562092059,-0.130580562092059,0.0,1.0,0.0,0.0,0.0,0.0,0.0,0.0,0.0,0,0.0,0.0,0.0,0.0,0.0,0.0,0.0,0.0,0.0,0.0,0.0,0.0,0.0,0.0,1.0,0.0,0.0,0.0,0.0,0.0,0.0,0.0,1.0,0.0,0.0,0.0,0.0,0.0,0.0,0.0,0.0,0.0,0.0,0.0,0.0,0.0,0.0,0.0,0.0,0.0,0.0,,,,,,,00-0035685,D.Montgomery,11.0,,,,,,,,,,,,,,,,,,,,,,,,,,,,,,,,,,,,,,,,,,,CHI,,00-0033784,,E.Jackson,,,,,,,,,,,,,,0.0,,,,,,,,,,,,,,,,,,,,,,,,,,,,,,,,0.0,,,,,0,,,0.0,0.0,0.0,0.0,,,2023,,,43,1,First down,3704,"12/10/23, 13:03:24",2023-12-10T20:44:59.737Z,Soldier Field,"Cloudy Temp: 36° F, Humidity: 70%, Wind: SE 12 mph",cbae7a77-f053-11ed-b4a7-bab79e4492fa,0,0,RUSH,0,,2023-12-10T20:45:04.953Z,,20,Turnover on downs,2023-12-10T20:42:46Z,11.0,4:04,3.0,0.0,0.0,4.0,4.0,-5.0,KICKOFF,DOWNS,09:20,05:16,DET 25,CHI 38,3619.0,3896.0,13,28,Home,15,41,-3.0,44.5,1,outdoors,grass,36.0,12.0,Matt Eberflus,Dan Campbell,CHI98,Soldier Field,0,1.0,,,D.Montgomery,5.0,,,0,1,1.0,0,1,,00-0035685,,D.Montgomery,5.0,00-0035685,D.Montgomery,00-0035685,D.Montgomery,00-0035685,0,1,0.903301873360761,,,,,,0.87983238697052,-87.983238697052,2023-12-10,Y.Ngakoue,2023,REG,CHI,14,00-0033123,DE,Yannick Ngakoue,Yannick,Ngakoue,Knee,,Questionable,Knee,,Full Participation in Practice,2023-12-08T19:51:31Z,2023-12-08 19:51:31
3694,2023_17_LV_IND,2023123105,IND,LV,REG,17,IND,home,LV,IND,62.0,2023-12-31,219.0,219.0,219.0,Half2,0,17.0,0,4,3.0,0,03:39,IND 38,8,48.0,"(3:39) (Shotgun) 10-G.Minshew pass incomplete deep right to 11-M.Pittman. LV-51-M.Koonce was injured during the play. PENALTY on LV-18-J.Jones, Defensive Pass Interference, 26 yards, enforced at IND 38 - No Play. Penalty on LV-97-J.Robinson, Defensive Offside, declined.",no_play,0.0,1,0,0.0,0,0,0,,,,,,,,,,,2,2,0.0,,,,,2.0,2.0,20,13,20.0,13.0,7.0,20.0,13.0,7.0,0.378248631954193,0.0975608825683594,0.000599154329393,0.157105997204781,0.165780320763588,0.0045157545246183,0.196189239621162,0.0,0.0,0.486074211890809,2.7939120111987,10.3100184697894,-10.3100184697894,-0.338178054498713,0.338178054498713,9.43881709091246,-9.43881709091246,,,0.0,0.0,1.40126111992868,-1.40126111992868,-2.93511800968554,2.93511800968554,-16.9849257603928,16.9849257603928,26.0034689239156,-26.0034689239156,0.918914496898651,0.0810855031013489,0.918914496898651,0.0810855031013489,0.0308930277824402,0.0453850626945496,0.0453850626945496,0.949807524681091,0.0501924753189087,0.909489154815674,0.909489154815674,0.0900146754299672,-0.0900146754299672,0.240058646478258,-0.240058646478258,,,0.0,0.0,-0.292747091845503,0.292747091845503,0.314213292026354,-0.314213292026354,-0.292747091845503,0.292747091845503,0.515817669504715,-0.515817669504715,0.0,0.0,0.0,1.0,0.0,0.0,0.0,0.0,0.0,0,0.0,0.0,0.0,0.0,0.0,0.0,0.0,0.0,0.0,0.0,0.0,0.0,0.0,0.0,0.0,0.0,1.0,0.0,0.0,0.0,0.0,0.0,0.0,0.0,0.0,0.0,0.0,0.0,0.0,0.0,0.0,0.0,0.0,0.0,0.0,0.0,0.0,0.0,0.0,0.0,0.0,,,,,,,,,,,,,,,,,,,,,,,,,,,,,,,,,,,,,,,,,,,,,,,,,,,,,,,,,,,,,,,,,,,,,,0.0,,,,,,,,,,,,,,,,,,,,,,,,,,,,,,,,0.0,LV,00-0038039,J.Jones,26.0,0,,Defensive Pass Interference,0.0,0.0,0.0,0.0,,,2023,,,50,1,First down,3694,"12/31/23, 13:02:31",2023-12-31T20:39:18.260Z,Lucas Oil Stadium,"Cloudy Temp: 33° F, Humidity: 90%, Wind: W 5 mph",cbaf9c62-f053-11ed-b4a7-bab79e4492fa,0,0,PENALTY,0,,2023-12-31T20:39:23.230Z,,17,Field goal,2023-12-31T20:35:57.340Z,7.0,1:24,2.0,0.0,1.0,4.0,4.0,30.0,KICKOFF,FIELD_GOAL,04:35,03:11,IND 25,LV 27,3597.0,3853.0,20,23,Home,3,43,3.5,42.5,0,closed,fieldturf,,,Shane Steichen,Antonio Pierce,IND00,Lucas Oil Stadium,0,1.0,G.Minshew II,10.0,,,M.Pittman,11.0,1,0,1.0,0,1,00-0035289,,00-0036252,G.Minshew II,10.0,00-0035289,,,M.Pittman,00-0036252,0,1,2.7939120111987,,,,,,0.911763608455658,8.8236391544342,2023-12-31,M.Koonce,2023,REG,LV,17,00-0036989,DE,Malcolm Koonce,Malcolm,Koonce,,,,Ribs,,Limited Participation in Practice,2023-12-29T20:30:19Z,2023-12-29 20:30:19
3690,2023_04_CIN_TEN,2023100109,TEN,CIN,REG,4,CIN,away,TEN,TEN,34.0,2023-10-01,401.0,401.0,401.0,Half2,0,17.0,0,4,1.0,0,06:41,TEN 34,10,55.0,"(6:41) (No Huddle, Shotgun) 28-J.Mixon right guard to TEN 29 for 5 yards (31-K.Byard, 90-N.Jones). TEN-93-T.Tart was injured during the play.",run,5.0,1,1,0.0,0,0,0,,,,,right,guard,,,,,2,3,0.0,,,,,3.0,2.0,27,3,3.0,27.0,-24.0,3.0,27.0,-24.0,0.111727200448513,0.0375046320259571,0.0005826777196489,0.0634734779596329,0.330363661050797,0.000867937633302,0.455480396747589,0.0,0.0,3.62319603841752,0.155728754820302,21.1733778318028,-21.1733778318028,-0.0509960597646271,0.0509960597646271,15.9211098082081,-15.9211098082081,,,0.0,0.0,13.0489291191043,-13.0489291191043,-0.0896187299475275,0.0896187299475275,19.7647656507615,-19.7647656507615,-7.26222569730801,7.26222569730801,0.0005676583386957,0.999432341661304,0.999432341661304,0.0005676583386957,-1.00103206932545e-05,3.2251700758934e-06,-3.2251700758934e-06,0.999442351981997,0.0005576480180025,0.0005154403042979,0.999484559695702,0.186985270443649,-0.186985270443649,0.237540764256591,-0.237540764256591,,,0.0,0.0,0.057677904940075,-0.057677904940075,0.174559952057778,-0.174559952057778,0.0604707699779931,-0.0604707699779931,0.212240386411894,-0.212240386411894,0.0,0.0,0.0,0.0,0.0,0.0,0.0,0.0,0.0,0,0.0,0.0,0.0,0.0,0.0,0.0,0.0,0.0,0.0,0.0,0.0,0.0,0.0,0.0,0.0,0.0,0.0,0.0,0.0,0.0,0.0,0.0,1.0,0.0,0.0,0.0,0.0,0.0,0.0,0.0,0.0,0.0,0.0,0.0,0.0,0.0,1.0,0.0,0.0,0.0,0.0,,,,,,,00-0033897,J.Mixon,5.0,,,,,,,,,,,,,,,,,,,,,,,,,,,,,,,,,,,,,,,,,,,,,,,,,00-0036695,N.Jones,TEN,,,,,,,,,,1.0,00-0033132,K.Byard,TEN,,,,,,,,,,,,,,,,,,,,,,,,,,,,,0.0,,,,,0,,,0.0,0.0,0.0,0.0,,,2023,,,48,0,Turnover on downs,3690,"10/1/23, 13:02:34",2023-10-01T19:35:14.933Z,Nissan Stadium,"Sunny Temp: 82° F, Humidity: 50%, Wind: ENE 4 mph",b07d6482-f053-11ed-b4a7-bab79e4492fa,0,0,RUSH,0,,2023-10-01T19:35:20.343Z,,17,Turnover on downs,2023-10-01T19:30:50.537Z,12.0,5:41,3.0,0.0,0.0,4.0,4.0,0.0,INTERCEPTION,DOWNS,10:31,04:50,CIN 9,TEN 37,3496.0,3767.0,3,27,Home,24,30,-2.5,41.5,0,outdoors,grass,82.0,4.0,Mike Vrabel,Zac Taylor,NAS00,Nissan Stadium,0,1.0,,,J.Mixon,28.0,,,0,1,0.0,0,1,,00-0033897,,J.Mixon,28.0,00-0033897,J.Mixon,00-0033897,J.Mixon,00-0033897,0,0,0.155728754820302,,,,,,0.807862639427185,-80.7862639427185,2023-10-01,T.Tart,2023,REG,TEN,4,00-0036181,DT,Teair Tart,Teair,Tart,Knee,,Questionable,Knee,,Limited Participation in Practice,2023-09-29T19:24:44Z,2023-09-29 19:24:44
3684,2023_13_IND_TEN,2023120305,TEN,IND,REG,13,TEN,home,IND,TEN,75.0,2023-12-03,694.0,694.0,694.0,Half2,0,21.0,0,4,1.0,0,11:34,TEN 25,10,75.0,(11:34) 22-D.Henry left end to TEN 34 for 9 yards (40-J.Jones; 44-Z.Franklin). TEN-22-D.Henry was injured during the play.,run,9.0,0,0,0.0,0,0,0,,,,,left,end,,,,,3,3,0.0,,,,,3.0,3.0,19,25,19.0,25.0,-6.0,19.0,25.0,-6.0,0.100259810686111,0.125624015927315,0.0020107293967157,0.210300475358963,0.204572379589081,0.0025865249335765,0.354646027088165,0.0,0.0,1.24841554416344,0.749128304421902,-8.46164006559369,8.46164006559369,3.50296768269618,-3.50296768269618,-1.37488742245504,1.37488742245504,,,0.0,0.0,3.12177204503678,-3.12177204503678,-12.5525985576537,12.5525985576537,0.813680512306746,-0.813680512306746,-11.3289320196521,11.3289320196521,0.211408674716949,0.788591325283051,0.211408674716949,0.788591325283051,0.0322327166795731,0.0117450207471848,0.0117450207471848,0.243641391396523,0.756358608603478,0.198409184813499,0.198409184813499,0.082498101356647,-0.082498101356647,0.0873504781942727,-0.0873504781942727,,,0.0,0.0,-0.0894234838787554,0.0894234838787554,-0.0679243355989456,0.0679243355989456,-0.0894234838787554,0.0894234838787554,-0.083891287446022,0.083891287446022,0.0,0.0,0.0,0.0,0.0,0.0,0.0,0.0,0.0,0,0.0,0.0,0.0,0.0,0.0,0.0,0.0,0.0,0.0,0.0,0.0,0.0,0.0,0.0,0.0,0.0,0.0,0.0,0.0,0.0,0.0,0.0,1.0,0.0,0.0,0.0,0.0,0.0,0.0,0.0,0.0,0.0,0.0,0.0,0.0,0.0,1.0,0.0,0.0,0.0,0.0,,,,,,,00-0032764,D.Henry,9.0,,,,,,,,,,,,,,,,,,,,,,,,,,,,,,,,,,,,,,,,,,,,,,,,,00-0038407,J.Jones,IND,00-0034431,Z.Franklin,IND,,,,,,,0.0,,,,,,,,,,,,,,,,,,,,,,,,,,,,,,,,0.0,,,,,0,,,0.0,0.0,0.0,0.0,,,2023,,,46,1,First down,3684,"12/3/23, 13:02:26",2023-12-03T20:40:44.607Z,Nissan Stadium,"Partly Sunny Temp: 53° F, Humidity: 77%, Wind: W 13 mph",cbae37ee-f053-11ed-b4a7-bab79e4492fa,0,0,RUSH,0,,2023-12-03T20:40:48.643Z,,21,Touchdown,2023-12-03T20:39:59.093Z,11.0,6:08,5.0,1.0,1.0,4.0,4.0,-5.0,KICKOFF,TOUCHDOWN,11:34,05:26,TEN 25,IND 3,3668.0,3985.0,31,28,Home,-3,59,-1.5,42.0,1,outdoors,grass,53.0,13.0,Mike Vrabel,Shane Steichen,NAS00,Nissan Stadium,0,1.0,,,D.Henry,22.0,,,0,1,0.0,0,1,,00-0032764,,D.Henry,22.0,00-0032764,D.Henry,00-0032764,D.Henry,00-0032764,0,1,0.749128304421902,,,,,,0.64998584985733,-64.998584985733,2023-12-03,D.Henry,2023,REG,TEN,13,00-0032764,RB,Derrick Henry,Derrick,Henry,,,,Not injury related - resting player,,Full Participation in Practice,2023-12-01T20:15:49Z,2023-12-01 20:15:49
3670,2023_03_DEN_MIA,2023092405,MIA,DEN,REG,3,MIA,home,DEN,MIA,81.0,2023-09-24,835.0,835.0,835.0,Half2,0,21.0,0,4,1.0,0,13:55,MIA 19,10,8.0,(13:55) New QB - #14 M White (Shotgun) 35-C.Brooks up the middle to MIA 20 for 1 yard (92-J.Harris). DEN-98-M.Purcell was injured during the play.,run,1.0,1,0,0.0,0,0,0,,,,,middle,,,,,,3,3,0.0,,,,,3.0,3.0,56,13,56.0,13.0,43.0,56.0,13.0,43.0,0.066947728395462,0.158849224448204,0.0024921675212681,0.245953902602196,0.191159427165985,0.0024936890695244,0.332103818655014,0.0,0.0,0.699983063619584,-0.460142687428743,47.6456056148346,-47.6456056148346,12.0241764784732,-12.0241764784732,32.9521663382146,-32.9521663382146,,,0.0,0.0,-1.71600050208838,1.71600050208838,21.8764172180085,-21.8764172180085,-18.6133328003376,18.6133328003376,51.5654991385522,-51.5654991385522,0.999926447868347,7.3552131652832e-05,0.999926447868347,7.3552131652832e-05,-1.84774398803711e-05,-5.96046447753906e-07,-5.96046447753906e-07,0.999907970428467,9.20295715332031e-05,0.999983668327332,0.999983668327332,0.0505938842102134,-0.0505938842102134,0.377901420695262,-0.377901420695262,,,0.0,0.0,-0.098049387781751,0.098049387781751,0.382867532980403,-0.382867532980403,-0.0979832133547036,0.0979832133547036,0.475884634049966,-0.475884634049966,0.0,0.0,0.0,0.0,0.0,0.0,0.0,0.0,0.0,0,0.0,0.0,0.0,0.0,0.0,0.0,0.0,0.0,0.0,0.0,0.0,0.0,0.0,0.0,1.0,0.0,0.0,0.0,0.0,0.0,0.0,0.0,1.0,0.0,0.0,0.0,0.0,0.0,0.0,0.0,0.0,0.0,0.0,0.0,0.0,0.0,0.0,0.0,0.0,0.0,0.0,,,,,,,00-0038685,C.Brooks,1.0,,,,,,,,,,,,,,,,,,,,,,,,,,,,,,,,,,,,,,,,,,,DEN,,00-0035073,,J.Harris,,,,,,,,,,,,,,0.0,,,,,,,,,,,,,,,,,,,,,,,,,,,,,,,,0.0,,,,,0,,,0.0,0.0,0.0,0.0,,,2023,,,53,0,Punt,3670,"9/24/23, 13:03:07",2023-09-24T19:47:46.753Z,Hard Rock Stadium,"Partly Cloudy Temp: 86° F, Humidity: 65%, Wind: SSW 5 mph",b07d048f-f053-11ed-b4a7-bab79e4492fa,0,0,RUSH,0,,2023-09-24T19:47:50.463Z,,21,Punt,2023-09-24T19:47:46.753Z,3.0,1:58,0.0,0.0,0.0,4.0,4.0,0.0,PUNT,PUNT,13:55,11:57,MIA 19,MIA 27,3670.0,3755.0,20,70,Home,50,90,6.0,47.5,0,outdoors,grass,86.0,5.0,Mike McDaniel,Sean Payton,MIA00,Hard Rock Stadium,0,0.0,,,C.Brooks,35.0,,,0,1,0.0,0,1,,00-0038685,,C.Brooks,35.0,00-0038685,C.Brooks,00-0038685,C.Brooks,00-0038685,0,1,-0.460142687428743,,,,,,0.139019146561623,-13.9019146561623,2023-09-24,M.Purcell,2023,REG,DEN,3,00-0029890,DT,Mike Purcell,Mike,Purcell,Ankle,,Questionable,Ankle,,Limited Participation in Practice,2023-09-22T20:09:10Z,2023-09-22 20:09:10
3653,2023_04_MIA_BUF,2023100101,BUF,MIA,REG,4,MIA,away,BUF,MIA,80.0,2023-10-01,609.0,609.0,609.0,Half2,0,22.0,0,4,1.0,0,10:09,MIA 20,10,59.0,(10:09) (Shotgun) 1-T.Tagovailoa pass short middle to 17-J.Waddle ran ob at MIA 37 for 17 yards (30-D.Jackson). BUF-7-Ta.Johnson was injured during the play. Ta.Johnson walks off.,pass,17.0,1,0,1.0,0,0,0,short,middle,5.0,12.0,,,,,,,3,2,0.0,,,,,2.0,3.0,48,20,20.0,48.0,-28.0,20.0,48.0,-28.0,0.157298073172569,0.150690823793411,0.0019645213615149,0.228630512952805,0.17618989944458,0.0023616617545485,0.282864511013031,0.0,0.0,0.456929494161159,0.991958384169266,29.5086000454778,-29.5086000454778,-1.94265287339032,1.94265287339032,24.6738238388757,-24.6738238388757,0.0755331767722964,0.916425207396969,0.0755331767722964,0.916425207396969,1.70144364755834,-1.70144364755834,9.68754432187416,-9.68754432187416,2.11413249766338,-2.11413249766338,16.2653519868151,-16.2653519868151,7.74596992414445e-05,0.999922540300759,0.999922540300759,7.74596992414445e-05,-1.94883505173493e-05,2.47743082582019e-06,-2.47743082582019e-06,0.999942028651276,5.79713487240952e-05,1.78246937139193e-05,0.999982175306286,0.0568888277420924,-0.0568888277420924,0.340760333838583,-0.340760333838583,0.0,-1.94883505173493e-05,0.0,-1.94883505173493e-05,-0.05667911630629,0.05667911630629,0.310996792091162,-0.310996792091162,-0.0471314058875888,0.0471314058875888,0.383216415605846,-0.383216415605846,0.0,0.0,1.0,0.0,0.0,0.0,0.0,0.0,0.0,0,0.0,0.0,0.0,0.0,0.0,0.0,0.0,0.0,0.0,0.0,0.0,0.0,0.0,0.0,1.0,0.0,0.0,0.0,0.0,0.0,0.0,0.0,0.0,1.0,0.0,0.0,0.0,0.0,0.0,0.0,0.0,0.0,0.0,0.0,0.0,1.0,0.0,0.0,0.0,0.0,0.0,00-0036212,T.Tagovailoa,17.0,00-0036613,J.Waddle,17.0,,,,,,,,,,,,,,,,,,,,,,,,,,,,,,,,,,,,,,,,,,,,,,BUF,,00-0036166,,D.Jackson,,,,,,,,,,,,,,0.0,,,,,,,,,,,,,,,,,,,,,,,,,,,,,,,,0.0,,,,,0,,,0.0,0.0,0.0,0.0,,,2023,0.79939341545105,20.060658454895,51,1,First down,3653,"10/1/23, 13:02:27",2023-10-01T19:50:48.027Z,Highmark Stadium,"Sunny, fair Temp: 70° F, Humidity: 71%, Wind: WNW 5 mph",b07d3d5d-f053-11ed-b4a7-bab79e4492fa,0,0,PASS,0,,2023-10-01T19:50:56.700Z,,22,Turnover on downs,2023-10-01T19:50:48.027Z,7.0,4:39,3.0,0.0,0.0,4.0,4.0,-5.0,PUNT,DOWNS,10:09,05:30,MIA 20,BUF 37,3653.0,3990.0,20,48,Home,28,68,2.5,53.0,1,outdoors,a_turf,70.0,2.0,Sean McDermott,Mike McDaniel,BUF00,New Era Field,0,1.0,T.Tagovailoa,1.0,,,J.Waddle,17.0,1,0,1.0,0,1,00-0036212,,00-0036613,T.Tagovailoa,1.0,00-0036212,J.Waddle,00-0036613,J.Waddle,00-0036613,1,1,0.991958384169266,0.413453268709071,4.35284321415384,3.0,0.990839481848525,0.30394789626007,0.760770916938782,23.9229083061218,2023-10-01,Ta.Johnson,2023,REG,BUF,4,00-0034376,CB,Taron Johnson,Taron,Johnson,,,,Hip,,Full Participation in Practice,2023-09-29T17:57:13Z,2023-09-29 17:57:13
3638,2023_02_WAS_DEN,2023091711,DEN,WAS,REG,2,WAS,away,DEN,WAS,62.0,2023-09-17,705.0,705.0,705.0,Half2,0,19.0,0,4,2.0,0,11:45,WAS 38,8,64.0,(11:45) (Shotgun) 8-B.Robinson left tackle to WAS 38 for no gain (91-M.Henningsen; 92-J.Harris). WAS-76-S.Cosmi was injured during the play.,run,0.0,1,0,0.0,0,0,0,,,,,left,tackle,,,,,3,3,0.0,,,,,3.0,3.0,24,28,28.0,24.0,4.0,28.0,24.0,4.0,0.0961106270551682,0.119688235223293,0.0018602780764922,0.213859722018242,0.22224648296833,0.00342423398979,0.342810451984406,0.0,0.0,1.21345776482485,-0.743810128187761,-5.22661686531459,5.22661686531459,-1.75202460850426,1.75202460850426,-7.28218679954634,7.28218679954634,,,0.0,0.0,-1.26568693114677,1.26568693114677,-4.34224684137735,4.34224684137735,-1.61489885195624,1.61489885195624,-5.76731331064103,5.76731331064103,0.719258964061737,0.280741035938263,0.280741035938263,0.719258964061737,-0.0278609395027161,-0.0121296048164368,0.0121296048164368,0.308601975440979,0.691398024559021,0.70024973154068,0.29975026845932,-0.036394509333451,0.036394509333451,-0.284091375076402,0.284091375076402,,,0.0,0.0,-0.102250423681812,0.102250423681812,-0.195804479372057,0.195804479372057,-0.108003657710628,0.108003657710628,-0.262389513504061,0.262389513504061,0.0,0.0,0.0,0.0,0.0,0.0,0.0,0.0,0.0,0,0.0,0.0,0.0,0.0,0.0,0.0,0.0,0.0,0.0,0.0,0.0,0.0,0.0,0.0,0.0,0.0,0.0,0.0,0.0,0.0,0.0,0.0,1.0,0.0,0.0,0.0,0.0,0.0,0.0,0.0,0.0,0.0,0.0,0.0,0.0,0.0,1.0,0.0,0.0,0.0,0.0,,,,,,,00-0037746,B.Robinson,0.0,,,,,,,,,,,,,,,,,,,,,,,,,,,,,,,,,,,,,,,,,,,,,,,,,00-0037303,M.Henningsen,DEN,00-0035073,J.Harris,DEN,,,,,,,0.0,,,,,,,,,,,,,,,,,,,,,,,,,,,,,,,,0.0,,,,,0,,,0.0,0.0,0.0,0.0,,,2023,,,47,1,First down,3638,"9/17/23, 16:25:31",2023-09-17T23:07:36.410Z,Empower Field at Mile High,"Sunny Temp: 81° F, Humidity: 24%, Wind: E 5 mph",b07cd3dc-f053-11ed-b4a7-bab79e4492fa,0,0,RUSH,0,,2023-09-17T23:07:39.910Z,,19,Touchdown,2023-09-17T23:06:59.107Z,8.0,5:11,4.0,1.0,1.0,4.0,4.0,5.0,PUNT,TOUCHDOWN,12:22,07:11,WAS 36,DEN 15,3615.0,3842.0,35,33,Home,-2,68,4.0,38.5,0,outdoors,,,,Sean Payton,Ron Rivera,DEN00,Empower Field at Mile High,0,0.0,,,B.Robinson,8.0,,,0,1,0.0,0,1,,00-0037746,,B.Robinson,8.0,00-0037746,B.Robinson,00-0037746,B.Robinson,00-0037746,0,0,-0.743810128187761,,,,,,0.710150063037872,-71.0150063037872,2023-09-17,S.Cosmi,2023,REG,WAS,2,00-0036618,G,Samuel Cosmi,Samuel,Cosmi,,,,Shoulder,,Full Participation in Practice,2023-09-15T17:26:32Z,2023-09-15 17:26:32
3609,2023_09_ARI_CLE,2023110503,CLE,ARI,REG,9,ARI,away,CLE,ARI,75.0,2023-11-05,460.0,460.0,460.0,Half2,0,24.0,0,4,2.0,0,07:40,ARI 25,10,-2.0,(7:40) (Shotgun) 15-C.Tune pass short right to 37-T.Jones to ARI 26 for 1 yard (29-C.Mitchell). CLE-29-C.Mitchell was injured during the play. His return is Probable.,pass,1.0,1,0,1.0,0,0,0,short,right,0.0,1.0,,,,,,,2,3,0.0,,,,,3.0,2.0,27,0,0.0,27.0,-27.0,0.0,27.0,-27.0,0.215627700090408,0.128228142857552,0.0029190750792622,0.190951481461525,0.166082099080086,0.0013937879120931,0.294797718524933,0.0,0.0,0.83743495377712,-0.692561933537945,30.8036315057705,-30.8036315057705,2.15806460875319,-2.15806460875319,30.3885825368735,-30.3885825368735,-0.640595238655806,-0.0519666948821396,-0.640595238655806,-0.0519666948821396,6.90606137289433,-6.90606137289433,9.81955765349705,-9.81955765349705,15.4551431692089,-15.4551431692089,5.56620572650997,-5.56620572650997,8.45117683638819e-05,0.999915488231636,0.999915488231636,8.45117683638819e-05,-7.14398629497737e-06,-2.13122712011682e-06,2.13122712011682e-06,0.999922632217931,7.73677820689045e-05,1.33660241772304e-05,0.999986633975823,0.135961844323901,-0.135961844323901,0.29464705975069,-0.29464705975069,0.0,-7.14398629497737e-06,0.0,-7.14398629497737e-06,-0.728045871374076,0.728045871374076,0.945634911578964,-0.945634911578964,-0.724936706838076,0.724936706838076,0.939103662276466,-0.939103662276466,0.0,0.0,0.0,0.0,0.0,0.0,0.0,0.0,0.0,0,0.0,0.0,0.0,0.0,0.0,0.0,0.0,0.0,0.0,0.0,0.0,0.0,0.0,0.0,1.0,0.0,0.0,0.0,0.0,0.0,0.0,0.0,0.0,1.0,0.0,0.0,0.0,0.0,0.0,0.0,0.0,0.0,0.0,0.0,0.0,1.0,0.0,0.0,0.0,0.0,0.0,00-0038582,C.Tune,1.0,00-0035860,T.Jones,1.0,,,,,,,,,,,,,,,,,,,,,,,,,,,,,,,,,,,,,,,,,,,,,,CLE,,00-0038585,,C.Mitchell,,,,,,,,,,,,,,0.0,,,,,,,,,,,,,,,,,,,,,,,,,,,,,,,,0.0,,,,,0,,,0.0,0.0,0.0,0.0,,,2023,0.736043930053711,26.3956069946289,44,0,Punt,3609,"11/5/23, 13:02:26",2023-11-05T20:41:44.500Z,Cleveland Browns Stadium,"Sunny Temp: 56° F, Humidity: 58%, Wind: N 7 mph",b07eb9ec-f053-11ed-b4a7-bab79e4492fa,0,0,PASS,0,,2023-11-05T20:41:50.237Z,,24,Punt,2023-11-05T20:40:18.517Z,3.0,0:59,0.0,0.0,0.0,4.0,4.0,0.0,KICKOFF,PUNT,07:48,06:49,ARI 25,ARI 23,3570.0,3660.0,0,27,Home,27,27,13.0,38.0,0,outdoors,grass,56.0,7.0,Kevin Stefanski,Jonathan Gannon,CLE00,FirstEnergy Stadium,0,0.0,C.Tune,15.0,,,T.Jones,37.0,1,0,0.0,0,1,00-0038582,,00-0035860,C.Tune,15.0,00-0038582,T.Jones,00-0035860,T.Jones,00-0035860,0,0,-0.692561933537945,0.812966121419814,6.90624657658191,6.0,0.505345979589038,0.218955742078833,0.679590880870819,32.0409119129181,2023-11-05,C.Mitchell,2023,REG,CLE,9,00-0038585,CB,Cameron Mitchell,Cameron,Mitchell,,,,Shoulder,,Full Participation in Practice,2023-11-03T19:09:06Z,2023-11-03 19:09:06
3596,2023_01_SF_PIT,2023091006,PIT,SF,REG,1,SF,away,PIT,SF,75.0,2023-09-10,900.0,900.0,900.0,Half2,0,19.0,0,4,3.0,0,15:00,SF 25,4,47.0,(15:00) (Shotgun) 13-B.Purdy pass short left to 11-B.Aiyuk to SF 47 for 22 yards (29-L.Wallace; 55-C.Holcomb). SF-71-T.Williams was injured during the play.,pass,22.0,1,0,1.0,0,0,0,short,left,13.0,9.0,,,,,,,2,3,0.0,,,,,3.0,2.0,7,27,27.0,7.0,20.0,27.0,7.0,20.0,0.0558083765208721,0.180531591176987,0.0044355248101055,0.273820787668228,0.182650119066238,0.001607981044799,0.301145613193512,0.0,0.0,0.191974274814129,2.3901405390352,-29.9473478307422,29.9473478307422,-3.71709830017062,3.71709830017062,-25.9439610581194,25.9439610581194,1.7203787448816,0.669761794153601,1.7203787448816,0.669761794153601,-17.8649483844638,17.8649483844638,-3.90633289632387,3.90633289632387,-4.25500364243635,4.25500364243635,-28.5238896141982,28.5238896141982,0.986056089401245,0.0139439105987549,0.0139439105987549,0.986056089401245,0.0042284131050109,0.0046558380126953,-0.0046558380126953,0.0097154974937439,0.990284502506256,0.989267766475677,0.0107322335243225,-0.0507493731492583,0.0507493731492583,-0.496742809217561,0.496742809217561,0.0,0.0042284131050109,0.0,0.0042284131050109,-0.0642095785850174,0.0642095785850174,-0.302746839821339,0.302746839821339,-0.0642095785850174,0.0642095785850174,-0.409512382000685,0.409512382000685,0.0,0.0,1.0,0.0,1.0,0.0,0.0,0.0,0.0,0,0.0,0.0,0.0,0.0,0.0,0.0,0.0,0.0,0.0,0.0,0.0,0.0,0.0,0.0,0.0,0.0,0.0,0.0,0.0,0.0,0.0,0.0,0.0,1.0,0.0,0.0,0.0,0.0,0.0,0.0,0.0,0.0,0.0,0.0,0.0,1.0,1.0,0.0,0.0,0.0,0.0,00-0037834,B.Purdy,22.0,00-0036261,B.Aiyuk,22.0,,,,,,,,,,,,,,,,,,,,,,,,,,,,,,,,,,,,,,,,,,,,,,,,,,,,00-0034514,L.Wallace,PIT,00-0035286,C.Holcomb,PIT,,,,,,,0.0,,,,,,,,,,,,,,,,,,,,,,,,,,,,,,,,0.0,,,,,0,,,0.0,0.0,0.0,0.0,,,2023,0.548912405967712,45.1087594032288,41,1,First down,3596,"9/10/23, 13:03:04",2023-09-10T19:35:25.630Z,Acrisure Stadium,"Cloudy Temp: 72° F, Humidity: 83%, Wind: N 3 mph",b07c6b5c-f053-11ed-b4a7-bab79e4492fa,0,0,PASS,0,,2023-09-10T19:35:32.603Z,,19,Punt,2023-09-10T19:30:33Z,7.0,4:18,2.0,0.0,0.0,3.0,4.0,0.0,DOWNS,PUNT,02:02,12:44,SF 8,PIT 45,3495.0,3703.0,30,7,Home,-23,37,-1.5,41.5,0,outdoors,,,,Mike Tomlin,Kyle Shanahan,PIT00,Acrisure Stadium,0,1.0,B.Purdy,13.0,,,B.Aiyuk,11.0,1,0,1.0,0,1,00-0037834,,00-0036261,B.Purdy,13.0,00-0037834,B.Aiyuk,00-0036261,B.Aiyuk,00-0036261,0,1,2.3901405390352,0.310203272338576,4.27522046244121,1.0,1.0,1.0,0.920276165008545,7.97238349914551,2023-09-10,T.Williams,2023,REG,SF,1,00-0027857,T,Trent Williams,Trent,Williams,,,,Not injury related - resting player,,Full Participation in Practice,2023-09-08T19:44:30Z,2023-09-08 19:44:30
3526,2023_08_BAL_ARI,2023102910,ARI,BAL,REG,8,ARI,home,BAL,BAL,12.0,2023-10-29,430.0,430.0,430.0,Half2,0,21.0,0,4,2.0,0,07:10,BAL 12,10,75.0,(7:10) (Shotgun) 9-J.Dobbs sacked at BAL 17 for -5 yards (92-J.Madubuike). BAL-99-O.Oweh was injured during the play.,pass,-5.0,1,0,1.0,0,0,0,,,,,,,,,,,3,3,0.0,,,,,3.0,3.0,7,24,7.0,24.0,-17.0,7.0,24.0,-17.0,0.0325624495744705,0.016650078818202,0.0004235111700836,0.0221735071390867,0.402033448219299,0.0007692323997616,0.525387763977051,0.0,0.0,4.6793413485284,-1.46115558885504,-18.1674989813014,18.1674989813014,-10.5477819472144,10.5477819472144,-11.5621746091504,11.5621746091504,,,0.0,0.0,0.87926844750147,-0.87926844750147,-4.44108599171159,4.44108599171159,-2.9572214036776,2.9572214036776,-9.07507125104682,9.07507125104682,0.0332565456628799,0.96674345433712,0.0332565456628799,0.96674345433712,-0.0100352559238672,-0.0053129745647311,-0.0053129745647311,0.0232212897390127,0.976778710260987,0.0149113005027175,0.0149113005027175,-0.294738146186747,0.294738146186747,-0.329709821170819,0.329709821170819,,,0.0,0.0,-0.0987735230239753,0.0987735230239753,-0.144399993121624,0.144399993121624,-0.107373400381458,0.107373400381458,-0.29791034758091,0.29791034758091,0.0,0.0,0.0,0.0,0.0,0.0,0.0,0.0,0.0,0,0.0,0.0,0.0,0.0,0.0,0.0,0.0,0.0,0.0,0.0,0.0,0.0,0.0,0.0,1.0,0.0,0.0,0.0,0.0,0.0,0.0,1.0,0.0,1.0,1.0,0.0,0.0,0.0,0.0,0.0,0.0,0.0,0.0,0.0,0.0,0.0,0.0,0.0,0.0,0.0,0.0,00-0033949,J.Dobbs,,,,,,,,,,,,,,,,,,,,,,,,,,,,,,,,,,,,00-0036130,J.Madubuike,,,00-0036130,J.Madubuike,,,,,,,,,BAL,,00-0036130,,J.Madubuike,,,,,,,,,,,,,,0.0,,,,,,,,,,,,,,,,,,,,,,,,,00-0036130,J.Madubuike,,,,,,0.0,,,,,0,,,0.0,0.0,0.0,0.0,,,2023,,,46,1,Touchdown,3526,"10/29/23, 16:25:44",2023-10-29T22:57:03.050Z,State Farm Stadium,N/A Indoors Temp: Humidity: Wind: mph,b07e8d46-f053-11ed-b4a7-bab79e4492fa,0,0,SACK,0,,2023-10-29T22:57:07.057Z,,21,Touchdown,2023-10-29T22:52:34.117Z,9.0,2:55,4.0,1.0,1.0,4.0,4.0,0.0,KICKOFF,TOUCHDOWN,09:27,06:32,ARI 25,BAL 17,3313.0,3582.0,31,24,Home,-7,55,-9.5,44.5,0,closed,grass,,,Jonathan Gannon,John Harbaugh,PHO00,State Farm Stadium,0,0.0,J.Dobbs,9.0,,,,,1,0,0.0,0,1,00-0033949,,,J.Dobbs,9.0,00-0033949,,,,,0,1,-1.46115558885504,,,,,,0.914630234241486,8.53697657585144,2023-10-29,O.Oweh,2023,REG,BAL,8,00-0036940,LB,Odafe Oweh,Odafe,Oweh,Ankle,,Questionable,Ankle,,Did Not Participate In Practice,2023-10-27T21:12:05Z,2023-10-27 21:12:05
3518,2023_01_BUF_NYJ,2023091100,NYJ,BUF,REG,1,NYJ,home,BUF,BUF,12.0,2023-09-11,111.0,111.0,111.0,Half2,0,19.0,1,4,4.0,0,01:51,BUF 12,6,15.0,"(1:51) 9-G.Zuerlein 30 yard field goal is GOOD, Center-42-T.Hennessy, Holder-5-T.Morstead. BUF-23-M.Hyde was injured during the play.",field_goal,0.0,0,0,0.0,0,0,0,,,,,,,made,30.0,,,3,1,0.0,,,,,3.0,1.0,16,13,13.0,13.0,0.0,16.0,13.0,3.0,0.027834740330051,0.0069817728835663,3.75650040712282e-05,0.0047563658453946,0.95773450953518,5.62816084768429e-05,0.0025987622624563,0.0,0.0,2.83719241808308,0.162807581916917,2.76578922426442,-2.76578922426442,5.36237919961749,-5.36237919961749,-3.07918084616501,3.07918084616501,,,0.0,0.0,4.35760580867645,-4.35760580867645,-8.23833721355789,8.23833721355789,-9.3220217290218,9.3220217290218,5.78278659132814,-5.78278659132814,0.714409828186035,0.285590171813965,0.714409828186035,0.285590171813965,0.0180991291999817,0.0383195877075195,0.0383195877075195,0.732508957386017,0.267491042613983,0.653609097003937,0.653609097003937,0.144786924123764,-0.144786924123764,-0.0899048464286161,0.0899048464286161,,,0.0,0.0,0.0365382118237185,-0.0365382118237185,-0.0678679049015045,0.0678679049015045,0.0365382118237185,-0.0365382118237185,-0.124403312802315,0.124403312802315,0.0,0.0,0.0,0.0,0.0,0.0,0.0,0.0,0.0,0,0.0,0.0,0.0,0.0,0.0,0.0,0.0,0.0,0.0,0.0,0.0,0.0,0.0,0.0,0.0,0.0,0.0,0.0,0.0,0.0,0.0,0.0,0.0,0.0,0.0,0.0,0.0,0.0,0.0,0.0,0.0,1.0,0.0,0.0,0.0,0.0,0.0,0.0,0.0,0.0,0.0,,,,,,,,,,,,,,,,,,,,,,,,,,,,,,,,G.Zuerlein,00-0029621,,,,,,,,,,,,,,,,,,,,,,,,,,,,,,,,,,,,,0.0,,,,,,,,,,,,,,,,,,,,,,,,,,,,,,,,0.0,,,,,0,,,0.0,0.0,0.0,0.0,,,2023,,,46,0,Field goal,3518,"9/11/23, 20:17:17",2023-09-12T02:55:38.723Z,MetLife Stadium,"Rain Temp: 72° F, Humidity: 88%, Wind: N 3 mph",b07c9366-f053-11ed-b4a7-bab79e4492fa,0,0,FIELD_GOAL,0,,2023-09-12T02:55:41.577Z,,19,Field goal,2023-09-12T02:46:39.717Z,8.0,3:03,1.0,1.0,1.0,4.0,4.0,0.0,FUMBLE,FIELD_GOAL,04:51,01:48,BUF 27,BUF 12,3347.0,3518.0,16,22,Home,6,38,-2.5,44.5,1,outdoors,,,,Robert Saleh,Sean McDermott,NYC01,MetLife Stadium,0,1.0,,,,,,,0,0,0.0,1,0,,,,,,,,,,,0,0,0.162807581916917,,,,,,,,2023-09-11,M.Hyde,2023,REG,BUF,1,00-0030090,S,Micah Hyde,Micah,Hyde,,,,Back,,Full Participation in Practice,2023-09-09T17:24:16Z,2023-09-09 17:24:16
3488,2023_13_DEN_HOU,2023120307,HOU,DEN,REG,13,HOU,home,DEN,HOU,64.0,2023-12-03,491.0,491.0,491.0,Half2,0,24.0,0,4,3.0,0,08:11,HOU 36,1,33.0,(8:11) 7-C.Stroud left guard to HOU 38 for 2 yards (91-M.Henningsen). HOU-7-C.Stroud was injured during the play.,run,2.0,0,0,0.0,0,0,0,,,,,left,guard,,,,,1,3,0.0,,,,,1.0,3.0,22,17,22.0,17.0,5.0,22.0,17.0,5.0,0.150461941957474,0.0955688506364822,0.0015909476205706,0.16897813975811,0.207378596067429,0.0052161486819386,0.370805323123932,0.0,0.0,1.75546992197633,0.420060829957947,7.94317286619606,-7.94317286619606,-3.58876044008583,3.58876044008583,11.9305022639101,-11.9305022639101,,,0.0,0.0,11.2530927488115,-11.2530927488115,0.843949982848293,-0.843949982848293,8.82942171039758,-8.82942171039758,3.39668364494798,-3.39668364494798,0.830175399780273,0.169824600219727,0.830175399780273,0.169824600219727,0.0081596970558166,0.025170624256134,0.025170624256134,0.83833509683609,0.16166490316391,0.832543075084686,0.832543075084686,0.0091260355715434,-0.0091260355715434,0.143981462812084,-0.143981462812084,,,0.0,0.0,0.0586923152729869,-0.0586923152729869,0.149947343861717,-0.149947343861717,0.0586923152729869,-0.0586923152729869,0.120634003078598,-0.120634003078598,0.0,1.0,0.0,0.0,1.0,0.0,0.0,0.0,0.0,0,0.0,0.0,0.0,0.0,0.0,0.0,0.0,0.0,0.0,0.0,0.0,0.0,0.0,0.0,1.0,0.0,0.0,0.0,0.0,0.0,0.0,0.0,1.0,0.0,0.0,0.0,0.0,0.0,0.0,0.0,0.0,0.0,0.0,0.0,0.0,0.0,0.0,0.0,0.0,0.0,0.0,,,,,,,00-0039163,C.Stroud,2.0,,,,,,,,,,,,,,,,,,,,,,,,,,,,,,,,,,,,,,,,,,,DEN,,00-0037303,,M.Henningsen,,,,,,,,,,,,,,0.0,,,,,,,,,,,,,,,,,,,,,,,,,,,,,,,,0.0,,,,,0,,,0.0,0.0,0.0,0.0,,,2023,,,44,1,First down,3488,"12/3/23, 13:02:37",2023-12-03T20:47:41.997Z,NRG Stadium,"Partly Sunny Temp: 67° F, Humidity: 37%, Wind: WNW 5 mph",cbae4537-f053-11ed-b4a7-bab79e4492fa,0,0,RUSH,0,,2023-12-03T20:47:45.010Z,,24,Punt,2023-12-03T20:45:13.380Z,8.0,4:57,2.0,0.0,0.0,4.0,4.0,0.0,INTERCEPTION,PUNT,09:33,04:36,HOU 27,DEN 40,3441.0,3642.0,17,22,Home,5,39,3.5,47.5,0,closed,astroturf,,,DeMeco Ryans,Sean Payton,HOU00,NRG Stadium,0,1.0,,,C.Stroud,7.0,,,0,1,1.0,0,1,,00-0039163,,C.Stroud,7.0,00-0039163,C.Stroud,00-0039163,C.Stroud,00-0039163,0,1,0.420060829957947,,,,,,0.313787430524826,-31.3787430524826,2023-12-03,C.Stroud,2023,REG,HOU,13,00-0039163,QB,C.J. Stroud,C.J.,Stroud,,,,Thigh,,Full Participation in Practice,2023-12-01T21:36:41Z,2023-12-01 21:36:41
3449,2023_06_NE_LV,2023101509,LV,NE,REG,6,NE,away,LV,LV,17.0,2023-10-15,347.0,347.0,347.0,Half2,0,15.0,0,4,2.0,0,05:47,LV 17,6,75.0,(5:47) (Shotgun) 10-M.Jones pass short middle to 14-T.Montgomery to LV 8 for 9 yards (93-B.Young). LV-21-A.Robertson was injured during the play.,pass,9.0,1,0,1.0,0,0,0,short,middle,4.0,5.0,,,,,,,3,3,0.0,,,,,3.0,3.0,19,10,10.0,19.0,-9.0,10.0,19.0,-9.0,0.0573753789067268,0.0206063967198133,0.0004172110639046,0.0289177037775517,0.387578397989273,0.0007944969693198,0.504310369491577,0.0,0.0,4.42941923561739,0.907793045102153,4.37091416982003,-4.37091416982003,-9.70825188199524,9.70825188199524,15.2573806732223,-15.2573806732223,0.116028799966443,0.79176424513571,0.116028799966443,0.79176424513571,16.7520802407992,-16.7520802407992,-4.12699954572599,4.12699954572599,19.1529048337136,-19.1529048337136,-8.90497582198302,8.90497582198302,0.191114753484726,0.808885246515274,0.808885246515274,0.191114753484726,-0.0026890635490417,0.0145146399736404,-0.0145146399736404,0.811574310064316,0.188425689935684,0.160102471709251,0.839897528290749,-0.164446844875234,0.164446844875234,0.546802853442379,-0.546802853442379,-0.0139745771884918,0.0112855136394501,-0.0139745771884918,0.0112855136394501,0.0881959025036769,-0.0881959025036769,0.364785544574261,-0.364785544574261,0.0881959025036769,-0.0881959025036769,0.322839014232159,-0.322839014232159,0.0,0.0,1.0,0.0,0.0,0.0,0.0,0.0,0.0,0,0.0,0.0,0.0,0.0,0.0,0.0,0.0,0.0,0.0,0.0,0.0,0.0,0.0,0.0,1.0,0.0,0.0,0.0,0.0,0.0,0.0,0.0,0.0,1.0,0.0,0.0,0.0,0.0,0.0,0.0,0.0,0.0,0.0,0.0,0.0,1.0,0.0,0.0,0.0,0.0,0.0,00-0036972,M.Jones,9.0,00-0032200,T.Montgomery,9.0,,,,,,,,,,,,,,,,,,,,,,,,,,,,,,,,,,,,,,,,,,,,,,LV,,00-0038978,,B.Young,,,,,,,,,,,,,,0.0,,,,,,,,,,,,,,,,,,,,,,,,,,,,,,,,0.0,,,,,0,,,0.0,0.0,0.0,0.0,,,2023,0.791320025920868,20.8679974079132,44,1,First down,3449,"10/15/23, 16:05:31",2023-10-15T22:41:42.433Z,Allegiant Stadium,"Sunny Temp: 81° F, Humidity: 13%, Wind: NNE 5 mph",b07e0339-f053-11ed-b4a7-bab79e4492fa,0,0,PASS,0,,2023-10-15T22:41:48.203Z,,15,Touchdown,2023-10-15T22:28:33.443Z,17.0,9:30,7.0,1.0,1.0,4.0,4.0,-3.0,KICKOFF,TOUCHDOWN,13:03,03:33,NE 25,LV 1,3095.0,3643.0,17,21,Home,4,38,3.0,41.5,0,dome,grass,,,Josh McDaniels,Bill Belichick,VEG00,Allegiant Stadium,0,1.0,M.Jones,10.0,,,T.Montgomery,14.0,1,0,1.0,0,1,00-0036972,,00-0032200,M.Jones,10.0,00-0036972,T.Montgomery,00-0032200,T.Montgomery,00-0032200,0,1,0.907793045102153,0.609522601296226,3.68327840228449,3.0,0.986950036283815,0.658519726392115,0.773939311504364,22.6060688495636,2023-10-15,A.Robertson,2023,REG,LV,6,00-0036375,CB,Amik Robertson,Amik,Robertson,,,,Knee,,Full Participation in Practice,2023-10-13T20:51:45Z,2023-10-13 20:51:45
3436,2023_15_BAL_JAX,2023121708,JAX,BAL,REG,15,JAX,home,BAL,JAX,75.0,2023-12-17,480.0,480.0,480.0,Half2,0,17.0,0,4,1.0,0,08:00,JAX 25,10,-6.0,(8:00) 16-T.Lawrence pass incomplete deep right to 7-Z.Jones. JAX-7-Z.Jones was injured during the play. His return is Questionable.,pass,0.0,0,0,1.0,0,0,0,deep,right,40.0,,,,,,,,3,3,0.0,,,,,3.0,3.0,7,20,7.0,20.0,-13.0,7.0,20.0,-13.0,0.184794098138809,0.11022125184536,0.0020058958325535,0.182680830359459,0.193398237228394,0.0023972587659955,0.324502408504486,0.0,0.0,1.24306472903118,-0.497138892766088,-16.6373092736909,16.6373092736909,-13.6672372672183,13.6672372672183,2.99496510414074,-2.99496510414074,2.31155555311125,-2.80869444587734,0.0,0.0,-7.43867433528067,7.43867433528067,2.32851711355504,-2.32851711355504,-6.07627128492459,6.07627128492459,3.1810506546336,-3.1810506546336,0.0518025271594524,0.948197472840548,0.0518025271594524,0.948197472840548,-0.0074413046240806,-0.0037916079163551,-0.0037916079163551,0.0443612225353718,0.955638777464628,0.0342419035732746,0.0342419035732746,-0.459074705911775,0.459074705911775,0.0936989051096272,-0.0936989051096272,0.0,-0.0074413046240806,0.0,0.0,0.0322384702353034,-0.0322384702353034,-0.0364401643669329,0.0364401643669329,0.0306444632200751,-0.0306444632200751,-0.0388029818927965,0.0388029818927965,0.0,0.0,0.0,0.0,0.0,0.0,0.0,0.0,1.0,0,0.0,0.0,0.0,0.0,0.0,0.0,0.0,0.0,0.0,0.0,0.0,0.0,0.0,0.0,0.0,0.0,0.0,0.0,0.0,0.0,0.0,0.0,0.0,1.0,0.0,0.0,0.0,0.0,0.0,0.0,0.0,0.0,0.0,0.0,0.0,0.0,0.0,0.0,0.0,0.0,0.0,00-0036971,T.Lawrence,,00-0033891,Z.Jones,,,,,,,,,,,,,,,,,,,,,,,,,,,,,,,,,,,,,,,,,,,,,,,,,,,,,,,,,,,,,,,,,0.0,,,,,,,,,,,,,,,,,,,,,,,,,,,,,,,,0.0,,,,,0,,,0.0,0.0,0.0,0.0,,,2023,0.325132638216019,-32.5132638216019,48,0,Turnover,3436,"12/17/23, 20:22:43",2023-12-18T03:58:24.050Z,EverBank Stadium,"Temp: 58° F, Humidity: 81%, Wind: W 13 mph",cbaf149d-f053-11ed-b4a7-bab79e4492fa,0,0,PASS,0,,2023-12-18T03:58:30.990Z,,17,Turnover,2023-12-18T03:57:39.407Z,3.0,0:24,0.0,0.0,0.0,4.0,4.0,0.0,KICKOFF,FUMBLE,08:00,07:36,JAX 25,JAX 25,3413.0,3485.0,23,7,Home,-16,30,-4.0,42.5,0,outdoors,grass,58.0,13.0,Doug Pederson,John Harbaugh,JAX00,TIAA Bank Stadium,0,0.0,T.Lawrence,16.0,,,Z.Jones,7.0,1,0,0.0,0,1,00-0036971,,00-0033891,T.Lawrence,16.0,00-0036971,Z.Jones,00-0033891,Z.Jones,00-0033891,0,1,-0.497138892766088,0.984139225627583,11.8657076605014,5.0,1.0,1.0,0.818522214889526,18.1477785110474,2023-12-17,Z.Jones,2023,REG,JAX,15,00-0033891,WR,Zay Jones,Zay,Jones,,,,Knee,,Limited Participation in Practice,2023-12-15T19:49:11Z,2023-12-15 19:49:11
3436,2023_14_JAX_CLE,2023121004,CLE,JAX,REG,14,JAX,away,CLE,CLE,1.0,2023-12-10,302.0,1202.0,1202.0,Half2,0,25.0,1,3,2.0,1,05:02,CLE 1,1,25.0,"(5:02) (Shotgun) Direct snap to 1-T.Etienne. 1-T.Etienne right guard to CLE 1 for no gain (33-R.Hickman, 22-G.Delpit). CLE-29-C.Mitchell was injured during the play. His return is Probable. Jacksonville challenged the short of the goal line ruling, and the play was REVERSED. (Shotgun) Direct snap to 1-T.Etienne. 1-T.Etienne right guard for 1 yard, TOUCHDOWN. CLE-29-C.Mitchell was injured during the play. His return is Probable.",run,1.0,1,0,0.0,0,0,0,,,,,right,guard,,,,,3,3,0.0,,JAX,T.Etienne,00-0036973,3.0,3.0,21,13,7.0,21.0,-14.0,13.0,21.0,-8.0,0.0020620534196496,0.0102173183113337,0.0002863120462279,0.0242541860789061,0.104904182255268,0.0012175976298749,0.85705840587616,0.0,0.0,6.11555270157987,0.884447298420128,8.08165311973532,-8.08165311973532,4.61195508763194,-4.61195508763194,2.721711445658,-2.721711445658,,,0.0,0.0,1.42658930324251,-1.42658930324251,-1.96422810305376,1.96422810305376,-13.8868106979062,13.8868106979062,15.9937169785844,-15.9937169785844,0.159548386931419,0.840451613068581,0.840451613068581,0.159548386931419,0.0308720239348475,0.046580239765139,-0.046580239765139,0.809579589133733,0.190420410866267,0.141611859202385,0.858388140797615,0.0873802536190244,-0.0873802536190244,0.268083138261581,-0.268083138261581,,,0.0,0.0,0.120240008221575,-0.120240008221575,0.013223108011321,-0.013223108011321,0.120240008221575,-0.120240008221575,0.116409596162871,-0.116409596162871,0.0,1.0,0.0,0.0,0.0,0.0,0.0,0.0,0.0,0,0.0,0.0,0.0,0.0,0.0,0.0,0.0,0.0,0.0,0.0,0.0,0.0,0.0,0.0,0.0,0.0,0.0,0.0,0.0,0.0,0.0,0.0,1.0,0.0,0.0,1.0,0.0,1.0,0.0,0.0,0.0,0.0,0.0,0.0,0.0,0.0,0.0,0.0,0.0,0.0,0.0,,,,,,,00-0036973,T.Etienne,1.0,,,,,,,,,,,,,,,,,,,,,,,,,,,,,,,,,,,,,,,,,,,,,,,,,,,,,,,,,,,,,0.0,,,,,,,,,,,,,,,,,,,,,,,,,,,,,,,,0.0,,,,,1,reversed,,0.0,0.0,0.0,0.0,,,2023,,,41,1,Touchdown,3436,"12/10/23, 13:02:34",2023-12-10T20:23:27.197Z,Cleveland Browns Stadium,"Cloudy Temp: 39° F, Humidity: 70%, Wind: W 11 mph",cbae84ca-f053-11ed-b4a7-bab79e4492fa,0,0,RUSH,0,,2023-12-10T20:23:31.037Z,,25,Touchdown,2023-12-10T20:20:16.740Z,6.0,2:27,3.0,1.0,1.0,3.0,3.0,0.0,FUMBLE,TOUCHDOWN,07:26,04:59,CLE 25,CLE 1,3312.0,3460.0,27,31,Home,4,58,2.5,37.5,0,outdoors,grass,39.0,11.0,Kevin Stefanski,Doug Pederson,CLE00,FirstEnergy Stadium,0,1.0,,,T.Etienne,1.0,,1.0,0,1,1.0,0,1,,00-0036973,,T.Etienne,1.0,00-0036973,T.Etienne,00-0036973,T.Etienne,00-0036973,0,1,0.884447298420128,,,,,,0.298487722873688,-29.8487722873688,2023-12-10,C.Mitchell,2023,REG,CLE,14,00-0038585,CB,Cameron Mitchell,Cameron,Mitchell,Hamstring,,Questionable,Hamstring,,Full Participation in Practice,2023-12-08T19:49:05Z,2023-12-08 19:49:05
3427,2023_07_LAC_KC,2023102209,KC,LAC,REG,7,LAC,away,KC,LAC,78.0,2023-10-22,480.0,480.0,480.0,Half2,0,19.0,0,4,1.0,0,08:00,LAC 22,10,5.0,(8:00) (Shotgun) 10-J.Herbert pass short left to 13-K.Allen to LAC 24 for 2 yards (32-N.Bolton). KC-32-N.Bolton was injured during the play. His return is Questionable.,pass,2.0,1,0,1.0,0,0,0,short,left,2.0,0.0,,,,,,,3,3,0.0,,,,,3.0,3.0,24,17,17.0,24.0,-7.0,17.0,24.0,-7.0,0.192139580845833,0.12331685423851,0.0021904672030359,0.2079047113657,0.172448471188545,0.0025048314128071,0.299495071172714,0.0,0.0,0.789156097918749,-0.374948714394122,5.15320246627433,-5.15320246627433,-2.75541680812603,2.75541680812603,10.4184293394112,-10.4184293394112,-0.374948714394122,0.0,-0.374948714394122,0.0,2.89109938128968,-2.89109938128968,2.61078641889617,-2.61078641889617,7.64840029671905,-7.64840029671905,-1.43859084408428,1.43859084408428,0.16417433321476,0.83582566678524,0.83582566678524,0.16417433321476,-0.0169061571359634,0.0020973458886146,-0.0020973458886146,0.852731823921204,0.147268176078796,0.124656297266483,0.875343702733517,0.042320934101571,-0.042320934101571,0.318681017550022,-0.318681017550022,-0.0169061571359634,0.0,-0.0169061571359634,0.0,-0.0344424440653801,0.0344424440653801,0.191808601629097,-0.191808601629097,-0.0344424440653801,0.0344424440653801,0.245635604273636,-0.245635604273636,0.0,0.0,0.0,0.0,0.0,0.0,0.0,0.0,0.0,0,0.0,0.0,0.0,0.0,0.0,0.0,0.0,0.0,0.0,0.0,0.0,0.0,0.0,0.0,1.0,0.0,0.0,0.0,0.0,0.0,0.0,0.0,0.0,1.0,0.0,0.0,0.0,0.0,0.0,0.0,0.0,0.0,0.0,0.0,0.0,1.0,0.0,0.0,0.0,0.0,0.0,00-0036355,J.Herbert,2.0,00-0030279,K.Allen,2.0,,,,,,,,,,,,,,,,,,,,,,,,,,,,,,,,,,,,,,,,,,,,,,KC,,00-0036621,,N.Bolton,,,,,,,,,,,,,,0.0,,,,,,,,,,,,,,,,,,,,,,,,,,,,,,,,0.0,,,,,0,,,0.0,0.0,0.0,0.0,,,2023,0.80351197719574,19.648802280426,50,0,Punt,3427,"10/22/23, 16:25:37",2023-10-22T22:54:29.400Z,GEHA Field at Arrowhead Stadium,"Temp: 72° F, Humidity: 35%, Wind: ESE 10 mph",b07e4a78-f053-11ed-b4a7-bab79e4492fa,0,0,PASS,0,,2023-10-22T22:54:34.600Z,,19,Punt,2023-10-22T22:54:29.400Z,3.0,1:44,0.0,0.0,0.0,4.0,4.0,0.0,PUNT,PUNT,08:00,06:16,LAC 22,LAC 27,3427.0,3511.0,17,31,Home,14,48,5.5,48.5,1,outdoors,grass,72.0,10.0,Andy Reid,Brandon Staley,KAN00,GEHA Field at Arrowhead Stadium,0,0.0,J.Herbert,10.0,,,K.Allen,13.0,1,0,0.0,0,1,00-0036355,,00-0030279,J.Herbert,10.0,00-0036355,K.Allen,00-0030279,K.Allen,00-0030279,0,0,-0.374948714394122,0.727055509312455,5.43408817901218,4.0,0.747829169034958,0.223706997931004,0.666861057281494,33.3138942718506,2023-10-22,N.Bolton,2023,REG,KC,7,00-0036621,LB,Nick Bolton,Nick,Bolton,,,,Ankle,,Full Participation in Practice,2023-10-20T20:10:29Z,2023-10-20 20:10:29
3425,2023_03_LAC_MIN,2023092406,MIN,LAC,REG,3,LAC,away,MIN,LAC,69.0,2023-09-24,121.0,1021.0,1021.0,Half2,0,16.0,0,3,1.0,0,02:01,LAC 31,18,6.0,(2:01) (Shotgun) 10-J.Herbert pass short right to 81-M.Williams to LAC 42 for 11 yards (97-H.Phillips). LAC-81-M.Williams was injured during the play.,pass,11.0,1,0,1.0,0,0,0,short,right,-1.0,12.0,,,,,,,2,3,0.0,,,,,3.0,2.0,17,21,21.0,17.0,4.0,21.0,17.0,4.0,0.0234704278409481,0.134756878018379,0.0035966301802545,0.230443865060806,0.203635588288307,0.0020098835229873,0.402086764574051,0.0,0.0,1.40496293408796,0.515216175932437,-6.41549580620101,6.41549580620101,5.61407518395572,-5.61407518395572,-19.4673594862992,19.4673594862992,-0.660146849695593,1.17536302562803,-0.660146849695593,1.17536302562803,3.13882839257713,-3.13882839257713,-10.1272701380076,10.1272701380076,4.77034744885168,-4.77034744885168,-17.8755762419909,17.8755762419909,0.666243851184845,0.333756148815155,0.333756148815155,0.666243851184845,0.0215803980827332,0.0232809782028198,-0.0232809782028198,0.312175750732422,0.687824249267578,0.689378678798676,0.310621321201324,0.184532776474953,-0.184532776474953,-0.679449259843528,0.679449259843528,0.0,0.0215803980827332,0.0,0.0215803980827332,-0.250833906087773,0.250833906087773,-0.0647767556236216,0.0647767556236216,-0.676999486837285,0.676999486837285,0.198257781810956,-0.198257781810956,0.0,0.0,0.0,0.0,0.0,0.0,0.0,0.0,0.0,0,0.0,0.0,0.0,0.0,0.0,0.0,0.0,0.0,0.0,0.0,0.0,0.0,0.0,0.0,1.0,0.0,0.0,0.0,0.0,0.0,0.0,0.0,0.0,1.0,0.0,0.0,0.0,0.0,0.0,0.0,0.0,0.0,0.0,0.0,0.0,1.0,0.0,0.0,0.0,0.0,0.0,00-0036355,J.Herbert,11.0,00-0033536,M.Williams,11.0,,,,,,,,,,,,,,,,,,,,,,,,,,,,,,,,,,,,,,,,,,,,,,MIN,,00-0034782,,H.Phillips,,,,,,,,,,,,,,0.0,,,,,,,,,,,,,,,,,,,,,,,,,,,,,,,,0.0,,,,,0,,,0.0,0.0,0.0,0.0,,,2023,0.895368039608002,10.4631960391998,48,0,Punt,3425,"9/24/23, 13:02:36",2023-09-24T19:24:07.667Z,U.S. Bank Stadium,"N/A (Indoors) Temp: 67° F, Humidity: 75%, Wind: SSE 8 mph",b07d0a3c-f053-11ed-b4a7-bab79e4492fa,0,0,PASS,0,,2023-09-24T19:24:12.607Z,,16,Punt,2023-09-24T19:21:56.737Z,5.0,2:54,1.0,0.0,0.0,3.0,3.0,-10.0,KICKOFF,PUNT,03:01,00:07,LAC 25,LAC 31,3348.0,3517.0,28,24,Home,-4,52,1.0,54.0,0,dome,sportturf,,,Kevin O'Connell,Brandon Staley,MIN01,U.S. Bank Stadium,0,1.0,J.Herbert,10.0,,,M.Williams,81.0,1,0,0.0,0,1,00-0036355,,00-0033536,J.Herbert,10.0,00-0036355,M.Williams,00-0033536,M.Williams,00-0033536,0,0,0.515216175932437,0.797495972007865,8.4210723429569,7.0,0.454485173919238,0.067246611812152,0.76537013053894,23.462986946106,2023-09-24,M.Williams,2023,REG,LAC,3,00-0033536,WR,Mike Williams,Mike,Williams,,,,Ankle,,Full Participation in Practice,2023-09-22T20:06:35Z,2023-09-22 20:06:35
3366,2023_11_PIT_CLE,2023111901,CLE,PIT,REG,11,PIT,away,CLE,CLE,48.0,2023-11-19,669.0,669.0,669.0,Half2,0,19.0,0,4,2.0,0,11:09,CLE 48,9,62.0,(11:09) 30-J.Warren right guard to CLE 27 for 21 yards (26-R.McLeod; 23-M.Emerson). CLE-26-R.McLeod was injured during the play.,run,21.0,0,0,0.0,0,0,0,,,,,right,guard,,,,,2,2,0.0,,,,,2.0,2.0,10,7,7.0,10.0,-3.0,7.0,10.0,-3.0,0.100806802511215,0.103371880948544,0.0012876848923042,0.143718883395195,0.278886735439301,0.0020247406791895,0.369903266429901,0.0,0.0,2.11130935628898,1.96270163950976,-2.76425771060167,2.76425771060167,-8.30870663997484,8.30870663997484,0.505883654671873,-0.505883654671873,,,0.0,0.0,-4.3508977756137,4.3508977756137,6.318712885899,-6.318712885899,-1.97703681266285,1.97703681266285,-1.82725253590111,1.82725253590111,0.390744894742966,0.609255105257034,0.609255105257034,0.390744894742966,0.12526348233223,0.101840049028397,-0.101840049028397,0.483991622924805,0.516008377075195,0.383999288082123,0.616000711917877,-0.172131272484895,0.172131272484895,0.0933404713869095,-0.0933404713869095,,,0.0,0.0,-0.0127794742584229,0.0127794742584229,0.166677415370941,-0.166677415370941,-0.0155498385429382,0.0155498385429382,0.0117462873458862,-0.0117462873458862,0.0,1.0,0.0,0.0,0.0,0.0,0.0,0.0,0.0,0,0.0,0.0,0.0,0.0,0.0,0.0,0.0,0.0,0.0,0.0,0.0,0.0,0.0,0.0,0.0,0.0,0.0,0.0,0.0,0.0,0.0,0.0,1.0,0.0,0.0,0.0,0.0,0.0,0.0,0.0,0.0,0.0,0.0,0.0,0.0,0.0,1.0,0.0,0.0,0.0,0.0,,,,,,,00-0037228,J.Warren,21.0,,,,,,,,,,,,,,,,,,,,,,,,,,,,,,,,,,,,,,,,,,,,,,,,,00-0028899,R.McLeod,CLE,00-0037250,M.Emerson,CLE,,,,,,,0.0,,,,,,,,,,,,,,,,,,,,,,,,,,,,,,,,0.0,,,,,0,,,0.0,0.0,0.0,0.0,,,2023,,,40,1,First down,3366,"11/19/23, 13:02:31",2023-11-19T20:30:49.197Z,Cleveland Browns Stadium,"Sunny Temp: 48° F, Humidity: 67%, Wind: W 11 mph",cbaced01-f053-11ed-b4a7-bab79e4492fa,0,0,RUSH,0,,2023-11-19T20:30:59.107Z,,19,Field goal,2023-11-19T20:26:24.667Z,13.0,7:10,4.0,1.0,1.0,4.0,4.0,0.0,PUNT,FIELD_GOAL,14:50,07:40,PIT 28,CLE 10,3194.0,3477.0,10,13,Home,3,23,2.5,34.0,1,outdoors,grass,48.0,11.0,Kevin Stefanski,Mike Tomlin,CLE00,FirstEnergy Stadium,0,1.0,,,J.Warren,30.0,,,0,1,1.0,0,1,,00-0037228,,J.Warren,30.0,00-0037228,J.Warren,00-0037228,J.Warren,00-0037228,0,1,1.96270163950976,,,,,,0.792485296726227,-79.2485296726227,2023-11-19,R.McLeod,2023,REG,CLE,11,00-0028899,S,Rodney McLeod,Rodney,McLeod,,,,Not injury related - resting player,,Did Not Participate In Practice,2023-11-15T20:48:26Z,2023-11-15 20:48:26
3356,2023_04_SEA_NYG,2023100200,NYG,SEA,REG,4,NYG,home,SEA,NYG,52.0,2023-10-02,812.0,812.0,812.0,Half2,0,17.0,0,4,1.0,0,13:32,NYG 48,10,2.0,"(13:32) (No Huddle, Shotgun) 8-D.Jones scrambles up the middle to SEA 40 for 12 yards (54-B.Wagner). SEA-90-Ja.Reed was injured during the play. PENALTY on NYG-68-B.Bredeson, Offensive Holding, 10 yards, enforced at NYG 48 - No Play.",no_play,0.0,1,1,0.0,0,0,1,,,,,,,,,,,2,3,0.0,,,,,2.0,3.0,3,21,3.0,21.0,-18.0,3.0,21.0,-18.0,0.0612289160490036,0.0878154411911964,0.0010172168258577,0.149496495723724,0.279144078493118,0.0068445210345089,0.414453327655792,0.0,0.0,2.44033834384754,-0.925357796018943,-19.7963900169868,19.7963900169868,-4.83091758316732,4.83091758316732,-18.0160961875054,18.0160961875054,,,0.0,0.0,-5.28931489115348,5.28931489115348,5.18300102446925,-5.18300102446925,-1.12686488148756,1.12686488148756,-4.84412594696646,4.84412594696646,0.0270336549729109,0.972966345027089,0.0270336549729109,0.972966345027089,-0.0015189964324235,-0.002916888333857,-0.002916888333857,0.0255146585404873,0.974485341459513,0.0170371048152447,0.0170371048152447,-0.19179218419877,0.19179218419877,-0.481367493784153,0.481367493784153,,,0.0,0.0,-0.0529052999969104,0.0529052999969104,-0.0140680335462093,0.0140680335462093,0.614824673796119,-0.614824673796119,-0.79751941698804,0.79751941698804,0.0,0.0,0.0,0.0,0.0,0.0,0.0,0.0,0.0,0,0.0,0.0,0.0,0.0,0.0,0.0,0.0,0.0,0.0,0.0,0.0,0.0,0.0,0.0,0.0,0.0,1.0,0.0,0.0,0.0,0.0,0.0,0.0,0.0,0.0,0.0,0.0,0.0,0.0,0.0,0.0,0.0,0.0,0.0,0.0,0.0,0.0,0.0,0.0,0.0,0.0,,,,,,,,,,,,,,,,,,,,,,,,,,,,,,,,,,,,,,,,,,,,,,,,,,,,,,,,,,,,,,,,,,,,,,0.0,,,,,,,,,,,,,,,,,,,,,,,,,,,,,,,,0.0,NYG,00-0036132,B.Bredeson,10.0,0,,Offensive Holding,0.0,0.0,0.0,0.0,,,2023,,,41,0,Punt,3356,"10/2/23, 20:15:56",2023-10-03T02:42:31.660Z,MetLife Stadium,"Fair Temp: 67° F, Humidity: 79%, Wind: SW 8 mph",b07d7cc4-f053-11ed-b4a7-bab79e4492fa,0,0,PENALTY,0,,2023-10-03T02:42:40.783Z,,17,Punt,2023-10-03T02:36:31.567Z,9.0,4:43,2.0,0.0,0.0,3.0,4.0,-10.0,KICKOFF,PUNT,01:03,11:20,NYG 25,NYG 27,3166.0,3468.0,24,3,Home,-21,27,-2.5,46.5,0,outdoors,fieldturf,67.0,8.0,Brian Daboll,Pete Carroll,NYC01,MetLife Stadium,0,0.0,D.Jones,8.0,,8.0,,,1,0,0.0,0,1,00-0035710,,,D.Jones,8.0,00-0035710,,,D.Jones,00-0035710,0,1,-0.925357796018943,,,,,,0.791129291057587,20.8870708942413,2023-10-02,Ja.Reed,2023,REG,SEA,4,00-0032387,DT,Jarran Reed,Jarran,Reed,,,,Quadricep,,Full Participation in Practice,2023-09-30T21:16:53Z,2023-09-30 21:16:53
3311,2023_11_LV_MIA,2023111906,MIA,LV,REG,11,MIA,home,LV,MIA,89.0,2023-11-19,673.0,673.0,673.0,Half2,0,21.0,0,4,3.0,0,11:13,MIA 11,9,6.0,"(11:13) (Shotgun) 1-T.Tagovailoa pass short left to 26-S.Ahmed to MIA 16 for 5 yards (41-R.Spillane, 98-M.Crosby). MIA-26-S.Ahmed was injured during the play. His return is Probable. Penalty on MIA-66-L.Cotton, Unnecessary Roughness, offsetting. Penalty on LV-18-J.Jones, Unnecessary Roughness, offsetting.",pass,5.0,1,0,1.0,0,0,0,short,left,-1.0,6.0,,,,,,,3,3,0.0,,,,,3.0,3.0,20,13,20.0,13.0,7.0,20.0,13.0,7.0,0.103022940456867,0.221126422286034,0.0042301383800804,0.316280871629715,0.137436300516129,0.0015684909885749,0.216334849596024,0.0,0.0,-0.956015814328566,-0.808625336037949,5.43088050202695,-5.43088050202695,-3.03127638602746,3.03127638602746,7.72668462382113,-7.72668462382113,-1.27397915301844,0.465353816980496,-1.27397915301844,0.465353816980496,2.52997001394397,-2.52997001394397,5.59333668461236,-5.59333668461236,3.06833018991165,-3.06833018991165,3.2428264809581,-3.2428264809581,0.841054081916809,0.158945918083191,0.841054081916809,0.158945918083191,-0.0389336347579956,-0.0067764520645141,-0.0067764520645141,0.802120447158814,0.197879552841187,0.944035828113556,0.944035828113556,-0.0797528624534607,0.0797528624534607,0.261403610178653,-0.261403610178653,0.0,-0.0389336347579956,0.0,-0.0389336347579956,-0.765543401241303,0.765543401241303,0.992037584253971,-0.992037584253971,-0.765543401241303,0.765543401241303,1.00727013237161,-1.00727013237161,0.0,0.0,0.0,0.0,0.0,1.0,0.0,0.0,0.0,0,0.0,0.0,0.0,0.0,0.0,0.0,0.0,0.0,0.0,0.0,0.0,0.0,0.0,0.0,0.0,0.0,0.0,0.0,0.0,0.0,0.0,0.0,0.0,1.0,0.0,0.0,0.0,0.0,0.0,0.0,0.0,0.0,0.0,0.0,0.0,1.0,1.0,0.0,0.0,0.0,0.0,00-0036212,T.Tagovailoa,5.0,00-0036020,S.Ahmed,5.0,,,,,,,,,,,,,,,,,,,,,,,,,,,,,,,,,,,,,,,,,,,,,,,,,,,,00-0034973,M.Crosby,LV,,,,,,,,,,1.0,00-0034720,R.Spillane,LV,,,,,,,,,,,,,,,,,,,,,,,,,,,,,0.0,,,,,0,,,0.0,0.0,0.0,0.0,,,2023,0.853133797645569,14.6866202354431,44,0,Punt,3311,"11/19/23, 13:02:34",2023-11-19T20:32:10.797Z,Hard Rock Stadium,"Partly Cloudy Temp: 82° F, Humidity: 71%, Wind: NNE 7 mph",cbad1607-f053-11ed-b4a7-bab79e4492fa,0,0,PASS,0,,2023-11-19T20:32:15.457Z,,21,Punt,2023-11-19T20:30:48.013Z,3.0,1:04,0.0,0.0,0.0,4.0,4.0,0.0,PUNT,PUNT,11:59,10:55,MIA 10,MIA 16,3254.0,3363.0,13,20,Home,7,33,14.0,44.5,0,outdoors,grass,82.0,7.0,Mike McDaniel,Antonio Pierce,MIA00,Hard Rock Stadium,0,0.0,T.Tagovailoa,1.0,,,S.Ahmed,26.0,1,0,0.0,0,1,00-0036212,,00-0036020,T.Tagovailoa,1.0,00-0036212,S.Ahmed,00-0036020,S.Ahmed,00-0036020,0,0,-0.808625336037949,1.19661184447027,7.95148737114505,6.0,0.266812325891806,0.266812325891806,0.966304779052734,3.36952209472656,2023-11-19,S.Ahmed,2023,REG,MIA,11,00-0036020,RB,Salvon Ahmed,Salvon,Ahmed,,,,Rib,,Full Participation in Practice,2023-11-17T20:46:47Z,2023-11-17 20:46:47
3309,2023_05_NYG_MIA,2023100804,MIA,NYG,REG,5,NYG,away,MIA,MIA,36.0,2023-10-08,636.0,636.0,636.0,Half2,0,17.0,0,4,2.0,0,10:36,MIA 36,6,18.0,"(10:36) (No Huddle, Shotgun) 2-T.Taylor pass short middle to 17-W.Robinson to MIA 29 for 7 yards (4-K.Kohou) [2-B.Chubb]. NYG-17-W.Robinson was injured during the play. His return is Probable.",pass,7.0,1,1,1.0,0,0,0,short,middle,6.0,1.0,,,,,,,3,3,0.0,,,,,3.0,3.0,31,13,13.0,31.0,-18.0,13.0,31.0,-18.0,0.0462730787694454,0.0678072720766068,0.0009009020868688,0.105138190090656,0.350463002920151,0.0023169117048382,0.427100628614426,0.0,0.0,3.10453628143296,0.824927675770596,13.6092156531102,-13.6092156531102,8.62184283023817,-8.62184283023817,4.93388397312579,-4.93388397312579,0.746326517080888,0.0786011586897075,0.746326517080888,0.0786011586897075,-0.955015989995165,0.955015989995165,12.7819746138121,-12.7819746138121,5.60949730571911,-5.60949730571911,-6.78120561022661,6.78120561022661,0.0212653242051601,0.97873467579484,0.97873467579484,0.0212653242051601,0.0026548635214567,0.0008652764372527,-0.0008652764372527,0.976079812273383,0.0239201877266169,0.0071752141229808,0.992824785877019,0.196714337806988,-0.196714337806988,0.167637992373818,-0.167637992373818,0.0,0.0026548635214567,0.0,0.0026548635214567,0.120339625190174,-0.120339625190174,0.167525249362163,-0.167525249362163,0.120339625190174,-0.120339625190174,-0.0896929194666562,0.0896929194666562,0.0,0.0,1.0,0.0,0.0,0.0,0.0,0.0,0.0,0,0.0,0.0,0.0,0.0,0.0,0.0,0.0,0.0,0.0,0.0,0.0,0.0,0.0,0.0,1.0,0.0,0.0,0.0,0.0,0.0,0.0,1.0,0.0,1.0,0.0,0.0,0.0,0.0,0.0,0.0,0.0,0.0,0.0,0.0,0.0,1.0,0.0,0.0,0.0,0.0,0.0,00-0028118,T.Taylor,7.0,00-0038117,W.Robinson,7.0,,,,,,,,,,,,,,,,,,,,,,,,,,,,,,,,,,,,00-0034832,B.Chubb,,,,,,,,,MIA,,00-0037353,,K.Kohou,,,,,,,,,,,,,,0.0,,,,,,,,,,,,,,,,,,,,,,,,,,,,,,,,0.0,,,,,0,,,0.0,0.0,0.0,0.0,,,2023,0.519576728343964,48.0423271656036,44,1,First down,3309,"10/8/23, 13:02:41",2023-10-08T19:34:16.007Z,Hard Rock Stadium,"Partly Cloudy Temp: 88° F, Humidity: 60%, Wind: W 8 mph",b07da7c5-f053-11ed-b4a7-bab79e4492fa,0,0,PASS,0,,2023-10-08T19:34:19.543Z,,17,Field goal,2023-10-08T19:30:35.987Z,10.0,3:54,2.0,0.0,1.0,4.0,4.0,0.0,PUNT,FIELD_GOAL,12:45,08:51,NYG 49,MIA 33,3185.0,3402.0,16,31,Home,15,47,12.5,47.5,0,outdoors,grass,88.0,8.0,Mike McDaniel,Brian Daboll,MIA00,Hard Rock Stadium,0,1.0,T.Taylor,2.0,,,W.Robinson,17.0,1,0,1.0,0,1,00-0028118,,00-0038117,T.Taylor,2.0,00-0028118,W.Robinson,00-0038117,W.Robinson,00-0038117,0,0,0.824927675770596,0.366856490182125,4.75165940902662,3.0,0.998049713089131,0.979799964581616,0.819070816040039,18.0929183959961,2023-10-08,W.Robinson,2023,REG,NYG,5,00-0038117,WR,Wan'Dale Robinson,Wan'Dale,Robinson,,,,Knee,,Limited Participation in Practice,2023-10-06T18:15:00Z,2023-10-06 18:15:00
3299,2023_19_LA_DET,2024011402,DET,LA,POST,19,LA,away,DET,DET,40.0,2024-01-14,310.0,310.0,310.0,Half2,0,15.0,0,4,1.0,0,05:10,DET 40,10,48.0,(5:10) 9-M.Stafford pass incomplete short middle to 89-T.Higbee (31-K.Joseph). LA-89-T.Higbee was injured during the play.,pass,0.0,0,0,1.0,0,0,0,short,middle,10.0,,,,,,,,3,1,0.0,,,,,1.0,3.0,24,23,23.0,24.0,-1.0,23.0,24.0,-1.0,0.170732751488686,0.0429240725934505,0.0006272324826568,0.0619724541902542,0.279936850070953,0.0032946285791695,0.440511971712112,0.0,0.0,3.36614974727854,-0.47049276670441,-6.10799055296031,6.10799055296031,2.19583164399955,-2.19583164399955,-8.78214543249486,8.78214543249486,0.462016307632439,-0.932509074336849,0.0,0.0,-0.613524094111475,0.613524094111475,-9.99546405817082,9.99546405817082,-20.4991983618859,20.4991983618859,13.2329485501944,-13.2329485501944,0.570496320724487,0.429503679275513,0.429503679275513,0.570496320724487,-0.0232013463973999,-0.0314502716064453,0.0314502716064453,0.452705025672913,0.547294974327087,0.562844812870026,0.437155187129974,0.159082894047545,-0.159082894047545,-0.29918574906672,0.29918574906672,0.0,-0.0232013463973999,0.0,0.0,-0.0437586277818903,0.0437586277818903,-0.304123221996652,0.304123221996652,-0.0437586277818903,0.0437586277818903,-0.196082144144403,0.196082144144403,0.0,0.0,0.0,0.0,0.0,0.0,0.0,0.0,1.0,0,0.0,0.0,0.0,0.0,0.0,0.0,0.0,0.0,0.0,0.0,0.0,0.0,0.0,0.0,0.0,0.0,0.0,0.0,0.0,0.0,0.0,0.0,0.0,1.0,0.0,0.0,0.0,0.0,0.0,0.0,0.0,0.0,0.0,0.0,0.0,0.0,0.0,0.0,0.0,0.0,0.0,00-0026498,M.Stafford,,00-0033110,T.Higbee,,,,,,,,,,,,,,,,,,,,,,,,,,,,,,,,,,,,,,,,,,,,,,,,,,,,,,,,,,,,,,,,,0.0,,,,,,,00-0037667,K.Joseph,,,,,,,,,,,,,,,,,,,,,,,,0.0,,,,,0,,,0.0,0.0,0.0,0.0,,,2023,0.72191047668457,-72.191047668457,52,0,Punt,3299,"1/14/24, 20:15:53",2024-01-15T03:45:19.987Z,Ford Field,"Controlled Climate Temp: 68° F, Humidity: 70%, Wind: mph",d6c41f14-add1-11ee-aec3-7d8f81bc70be,0,0,PASS,0,,2024-01-15T03:45:24.990Z,,15,Punt,2024-01-15T03:43:05.017Z,6.0,3:11,2.0,0.0,0.0,4.0,4.0,-10.0,PUNT,PUNT,07:18,04:07,LA 8,DET 44,3215.0,3409.0,23,24,Home,1,47,3.5,52.5,0,dome,fieldturf,,,Dan Campbell,Sean McVay,DET00,Ford Field,0,0.0,M.Stafford,9.0,,,T.Higbee,89.0,1,0,0.0,0,1,00-0026498,,00-0033110,M.Stafford,9.0,00-0026498,T.Higbee,00-0033110,T.Higbee,00-0033110,0,1,-0.47049276670441,0.312581002665605,4.63150022708578,3.0,0.999210701789707,0.970611722790636,0.512016654014587,48.7983345985413,2024-01-14,T.Higbee,2023,WC,LA,19,00-0033110,TE,Tyler Higbee,Tyler,Higbee,Shoulder,,Questionable,Shoulder,,Limited Participation in Practice,2024-01-12T20:42:50Z,2024-01-12 20:42:50
3271,2023_02_IND_HOU,2023091704,HOU,IND,REG,2,HOU,home,IND,IND,2.0,2023-09-17,27.0,927.0,927.0,Half2,0,15.0,0,3,1.0,1,00:27,IND 2,2,57.0,(:27) 31-D.Pierce right tackle to IND 2 for no gain (51-K.Paye). HOU-77-G.Fant was injured during the play.,run,0.0,0,0,0.0,0,0,0,,,,,right,tackle,,,,,3,2,0.0,,,,,3.0,2.0,10,31,10.0,31.0,-21.0,10.0,31.0,-21.0,0.0032249754294753,0.008682420477271,0.0002315134333912,0.0104240877553821,0.0932941809296608,0.0006220694049261,0.883520722389221,0.0,0.0,6.36629283573711,-0.365570612426382,-20.0401660788231,20.0401660788231,-12.4154590149992,12.4154590149992,-11.802777925208,11.802777925208,,,0.0,0.0,12.630350689753,-12.630350689753,-14.3390127827568,14.3390127827568,17.8142590026837,-17.8142590026837,-21.0463075239023,21.0463075239023,0.0453507341444492,0.954649265855551,0.0453507341444492,0.954649265855551,-0.0021323077380657,-0.0057277884334325,-0.0057277884334325,0.0432184264063835,0.956781573593616,0.0337822735309601,0.0337822735309601,-0.264248006367929,0.264248006367929,-0.281227493426233,0.281227493426233,,,0.0,0.0,0.0658187794028712,-0.0658187794028712,-0.105214063078094,0.105214063078094,0.0658187794028712,-0.0658187794028712,-0.160930158570338,0.160930158570338,0.0,0.0,0.0,0.0,0.0,0.0,0.0,0.0,0.0,0,0.0,0.0,0.0,0.0,0.0,0.0,0.0,0.0,0.0,0.0,0.0,0.0,0.0,0.0,1.0,0.0,0.0,0.0,0.0,0.0,0.0,0.0,1.0,0.0,0.0,0.0,0.0,0.0,0.0,0.0,0.0,0.0,0.0,0.0,0.0,0.0,0.0,0.0,0.0,0.0,0.0,,,,,,,00-0037258,D.Pierce,0.0,,,,,,,,,,,,,,,,,,,,,,,,,,,,,,,,,,,,,,,,,,,IND,,00-0036479,,K.Paye,,,,,,,,,,,,,,0.0,,,,,,,,,,,,,,,,,,,,,,,,,,,,,,,,0.0,,,,,0,,,0.0,0.0,0.0,0.0,,,2023,,,43,0,Field goal,3271,"9/17/23, 13:03:03",2023-09-17T19:15:55.030Z,NRG Stadium,"Indoors Temp: 85° F, Humidity: 47%, Wind: N 6 mph",b07cb1fb-f053-11ed-b4a7-bab79e4492fa,0,0,RUSH,0,,2023-09-17T19:15:59.537Z,,15,Field goal,2023-09-17T19:08:16.473Z,13.0,7:26,5.0,1.0,1.0,3.0,4.0,-3.0,KICKOFF,FIELD_GOAL,05:50,13:24,HOU 25,IND 18,2932.0,3390.0,31,20,Home,-11,51,-1.0,40.0,1,open,,,,DeMeco Ryans,Shane Steichen,HOU00,NRG Stadium,0,0.0,,,D.Pierce,31.0,,,0,1,0.0,0,1,,00-0037258,,D.Pierce,31.0,00-0037258,D.Pierce,00-0037258,D.Pierce,00-0037258,0,0,-0.365570612426382,,,,,,0.421316832304001,-42.1316832304001,2023-09-17,G.Fant,2023,REG,HOU,2,00-0032466,T,George Fant,George,Fant,,,,Shoulder,,Full Participation in Practice,2023-09-15T20:08:55Z,2023-09-15 20:08:55
3260,2023_09_NYG_LV,2023110509,LV,NYG,REG,9,NYG,away,LV,NYG,68.0,2023-11-05,520.0,520.0,520.0,Half2,0,21.0,0,4,1.0,0,08:40,NYG 32,10,52.0,(8:40) (Shotgun) 15-T.DeVito pass short left to 86-D.Slayton pushed ob at NYG 43 for 11 yards (1-M.Epps). NYG-73-E.Neal was injured during the play.,pass,11.0,1,0,1.0,0,0,0,short,left,3.0,8.0,,,,,,,2,3,0.0,,,,,3.0,2.0,30,6,6.0,30.0,-24.0,6.0,30.0,-24.0,0.125215440988541,0.104411728680134,0.0023069949820637,0.167390957474709,0.206194281578064,0.0013550934381783,0.393125504255295,0.0,0.0,1.88358568307012,0.643147574970499,25.4309714077011,-25.4309714077011,1.26638002007348,-1.26638002007348,20.3662692585108,-20.3662692585108,-0.414701335830614,1.05784891080111,-0.414701335830614,1.05784891080111,2.83321545738727,-2.83321545738727,2.76842367998197,-2.76842367998197,-4.95278698933544,4.95278698933544,16.8581132145533,-16.8581132145533,0.0005140922148711,0.999485907785129,0.999485907785129,0.0005140922148711,-7.13448389433324e-05,-0.0001171691546915,0.0001171691546915,0.999557252624072,0.0004427473759278,0.0003272949252277,0.999672705074772,0.0653777258747294,-0.0653777258747294,0.346618765906896,-0.346618765906896,0.0,-7.13448389433324e-05,0.0,-7.13448389433324e-05,-0.968974035415799,0.968974035415799,1.09175033197971,-1.09175033197971,-0.968974035415799,0.968974035415799,1.25170779164182,-1.25170779164182,0.0,0.0,1.0,0.0,0.0,0.0,0.0,0.0,0.0,0,0.0,0.0,0.0,0.0,0.0,0.0,0.0,0.0,0.0,0.0,0.0,0.0,0.0,0.0,1.0,0.0,0.0,0.0,0.0,0.0,0.0,0.0,0.0,1.0,0.0,0.0,0.0,0.0,0.0,0.0,0.0,0.0,0.0,0.0,0.0,1.0,0.0,0.0,0.0,0.0,0.0,00-0038476,T.DeVito,11.0,00-0035535,D.Slayton,11.0,,,,,,,,,,,,,,,,,,,,,,,,,,,,,,,,,,,,,,,,,,,,,,LV,,00-0034993,,M.Epps,,,,,,,,,,,,,,0.0,,,,,,,,,,,,,,,,,,,,,,,,,,,,,,,,0.0,,,,,0,,,0.0,0.0,0.0,0.0,,,2023,0.817093431949616,18.2906568050385,44,1,First down,3260,"11/5/23, 16:25:28",2023-11-06T00:02:31.257Z,Allegiant Stadium,"Partly Cloudy Temp: 73° F, Humidity: 13%, Wind: ENE 5 mph",b07ed7da-f053-11ed-b4a7-bab79e4492fa,0,0,PASS,0,,2023-11-06T00:02:36.410Z,,21,Turnover on downs,2023-11-06T00:00:55.627Z,7.0,3:34,3.0,0.0,0.0,4.0,4.0,0.0,KICKOFF,DOWNS,09:29,05:55,NYG 20,LV 34,3212.0,3390.0,6,30,Home,24,36,1.0,38.5,0,dome,grass,,,Antonio Pierce,Brian Daboll,VEG00,Allegiant Stadium,0,1.0,T.DeVito,15.0,,,D.Slayton,86.0,1,0,1.0,0,1,00-0038476,,00-0035535,T.DeVito,15.0,00-0038476,D.Slayton,00-0035535,D.Slayton,00-0035535,1,0,0.643147574970499,0.687098382328004,4.90958800070803,3.0,0.680446119746193,0.23389627202414,0.788690805435181,21.1309194564819,2023-11-05,E.Neal,2023,REG,NYG,9,00-0037612,T,Evan Neal,Evan,Neal,Ankle,,Questionable,Ankle,,Limited Participation in Practice,2023-11-03T18:23:02Z,2023-11-03 18:23:02
3240,2023_08_HOU_CAR,2023102900,CAR,HOU,REG,8,CAR,home,HOU,CAR,88.0,2023-10-29,600.0,600.0,600.0,Half2,0,17.0,0,4,2.0,0,10:00,CAR 12,19,-12.0,(10:00) 3-R.Blackshear right end to CAR 18 for 6 yards (6-D.Perryman). HOU-6-D.Perryman was injured during the play.,run,6.0,0,0,0.0,0,0,0,,,,,right,end,,,,,3,3,0.0,,,,,3.0,3.0,12,13,12.0,13.0,-1.0,12.0,13.0,-1.0,0.134230762720108,0.209169298410416,0.0050493963062763,0.282675683498383,0.137385949492455,0.0015390370972454,0.229949876666069,0.0,0.0,-0.59145141299814,-0.394699020544067,-2.61974523977563,2.61974523977563,-10.1141666770089,10.1141666770089,1.0434029968426,-1.0434029968426,,,0.0,0.0,3.13394267848344,-3.13394267848344,2.11553184520461,-2.11553184520461,10.8763421214244,-10.8763421214244,-7.7148278672713,7.7148278672713,0.487618297338486,0.512381702661514,0.487618297338486,0.512381702661514,-0.0262099802494049,-0.0252406299114227,-0.0252406299114227,0.461408317089081,0.538591682910919,0.330123513936996,0.330123513936996,-0.287552971184912,0.287552971184912,0.105076560731674,-0.105076560731674,,,0.0,0.0,-0.006554420907354,0.006554420907354,0.15177395939827,-0.15177395939827,-0.006554420907354,0.006554420907354,0.0905844271183014,-0.0905844271183014,0.0,0.0,0.0,0.0,0.0,0.0,0.0,0.0,0.0,0,0.0,0.0,0.0,0.0,0.0,0.0,0.0,0.0,0.0,0.0,0.0,0.0,0.0,0.0,1.0,0.0,0.0,0.0,0.0,0.0,0.0,0.0,1.0,0.0,0.0,0.0,0.0,0.0,0.0,0.0,0.0,0.0,0.0,0.0,0.0,0.0,0.0,0.0,0.0,0.0,0.0,,,,,,,00-0037429,R.Blackshear,6.0,,,,,,,,,,,,,,,,,,,,,,,,,,,,,,,,,,,,,,,,,,,HOU,,00-0032103,,D.Perryman,,,,,,,,,,,,,,0.0,,,,,,,,,,,,,,,,,,,,,,,,,,,,,,,,0.0,,,,,0,,,0.0,0.0,0.0,0.0,,,2023,,,41,0,Punt,3240,"10/29/23, 13:02:43",2023-10-29T19:25:01.163Z,Bank of America Stadium,"Clear Temp: 76° F, Humidity: 53%, Wind: SW 11 mph",b07e5d73-f053-11ed-b4a7-bab79e4492fa,0,0,RUSH,0,,2023-10-29T19:25:06.303Z,,17,Punt,2023-10-29T19:24:24.527Z,3.0,2:06,0.0,0.0,0.0,4.0,4.0,0.0,PUNT,PUNT,10:36,08:30,CAR 21,CAR 9,3213.0,3292.0,13,15,Home,2,28,-3.0,43.0,0,outdoors,grass,77.0,14.0,Frank Reich,DeMeco Ryans,CAR00,Bank of America Stadium,0,0.0,,,R.Blackshear,3.0,,,0,1,0.0,0,1,,00-0037429,,R.Blackshear,3.0,00-0037429,R.Blackshear,00-0037429,R.Blackshear,00-0037429,0,0,-0.394699020544067,,,,,,0.858002483844757,-85.8002483844757,2023-10-29,D.Perryman,2023,REG,HOU,8,00-0032103,LB,Denzel Perryman,Denzel,Perryman,,,,Hand,,Full Participation in Practice,2023-10-27T19:43:04Z,2023-10-27 19:43:04
3220,2023_15_MIN_CIN,2023121600,CIN,MIN,REG,15,CIN,home,MIN,MIN,43.0,2023-12-16,679.0,679.0,679.0,Half2,0,15.0,0,4,3.0,0,11:19,MIN 43,21,63.0,(11:19) (Shotgun) 6-J.Browning pass deep middle to 1-J.Chase to MIN 19 for 24 yards (40-I.Pace). CIN-1-J.Chase was injured during the play.,pass,24.0,1,0,1.0,0,0,0,deep,middle,21.0,3.0,,,,,,,3,3,0.0,,,,,3.0,3.0,10,17,10.0,17.0,-7.0,10.0,17.0,-7.0,0.085460789501667,0.129123151302338,0.0016523726517334,0.195542708039284,0.299560368061066,0.0054124211892485,0.28324818611145,0.0,0.0,1.13277009385638,3.54617467493517,-4.88402676505265,4.88402676505265,0.587717648333637,-0.587717648333637,-7.04940900609924,7.04940900609924,3.43172465369571,0.114450021239463,3.43172465369571,0.114450021239463,-1.59202021139208,1.59202021139208,-5.37843229129794,5.37843229129794,4.0525863734656,-4.0525863734656,-10.573642978538,10.573642978538,0.194232001900673,0.805767998099327,0.194232001900673,0.805767998099327,0.143378064036369,0.152169585227966,0.152169585227966,0.337610065937042,0.662389934062958,0.230464220046997,0.230464220046997,-0.0724291135663511,0.0724291135663511,-0.236540791806242,0.236540791806242,0.0,0.143378064036369,0.0,0.143378064036369,-0.126167914896005,0.126167914896005,-0.0401819554844175,0.0401819554844175,-0.126167914896005,0.126167914896005,-0.0247332213201795,0.0247332213201795,0.0,0.0,1.0,0.0,1.0,0.0,0.0,0.0,0.0,0,0.0,0.0,0.0,0.0,0.0,0.0,0.0,0.0,0.0,0.0,0.0,0.0,0.0,0.0,1.0,0.0,0.0,0.0,0.0,0.0,0.0,0.0,0.0,1.0,0.0,0.0,0.0,0.0,0.0,0.0,0.0,0.0,0.0,0.0,0.0,1.0,0.0,0.0,0.0,0.0,0.0,00-0035100,J.Browning,24.0,00-0036900,J.Chase,24.0,,,,,,,,,,,,,,,,,,,,,,,,,,,,,,,,,,,,,,,,,,,,,,MIN,,00-0038807,,I.Pace,,,,,,,,,,,,,,0.0,,,,,,,,,,,,,,,,,,,,,,,,,,,,,,,,0.0,,,,,0,,,0.0,0.0,0.0,0.0,,,2023,0.491399317979813,50.8600682020187,43,1,First down,3220,"12/16/23, 13:02:29",2023-12-16T20:27:48.440Z,Paycor Stadium,"Mostly cloudy Temp: 53° F, Humidity: 42%, Wind: SE 5 mph",cbaed001-f053-11ed-b4a7-bab79e4492fa,0,0,PASS,0,,2023-12-16T20:27:54.647Z,,15,Touchdown,2023-12-16T20:24:03.013Z,11.0,5:36,5.0,1.0,1.0,4.0,4.0,-11.0,PUNT,TOUCHDOWN,13:22,07:46,CIN 37,MIN 1,3079.0,3362.0,24,27,Home,3,51,3.0,41.5,0,outdoors,fieldturf,53.0,5.0,Zac Taylor,Kevin O'Connell,CIN00,Paycor Stadium,0,1.0,J.Browning,6.0,,,J.Chase,1.0,1,0,1.0,0,1,00-0035100,,00-0036900,J.Browning,6.0,00-0035100,J.Chase,00-0036900,J.Chase,00-0036900,0,1,3.54617467493517,0.177423964010959,4.00287311384454,2.0,1.0,0.973261906503467,0.973403930664062,2.65960693359375,2023-12-16,J.Chase,2023,REG,CIN,15,00-0036900,WR,Ja'Marr Chase,Ja'Marr,Chase,,,,Ankle,,Full Participation in Practice,2023-12-14T19:16:19Z,2023-12-14 19:16:19
3203,2023_10_CLE_BAL,2023111201,BAL,CLE,REG,10,BAL,home,CLE,CLE,37.0,2023-11-12,81.0,981.0,981.0,Half2,0,15.0,0,3,2.0,0,01:21,CLE 37,8,20.0,(1:21) (Shotgun) 8-L.Jackson sacked at CLE 46 for -9 yards (sack split by 95-M.Garrett and 6-J.Owusu-Koramoah). CLE-22-G.Delpit was injured during the play.,pass,-9.0,1,0,1.0,0,0,0,,,,,,,,,,,2,2,0.0,,,,,2.0,2.0,24,17,24.0,17.0,7.0,24.0,17.0,7.0,0.0301562864333391,0.070618249475956,0.0008494249195791,0.104084439575672,0.360804498195648,0.0051877847872674,0.428299367427826,0.0,0.0,3.14873996085953,-2.00542415410746,6.30756952395462,-6.30756952395462,-5.89674526399188,5.89674526399188,10.119685982457,-10.119685982457,,,0.0,0.0,7.52013071585679,-7.52013071585679,-3.67363235409721,3.67363235409721,-6.20276090063271,6.20276090063271,17.584796618669,-17.584796618669,0.857161343097687,0.142838656902313,0.857161343097687,0.142838656902313,-0.0487773418426514,-0.0306553244590759,-0.0306553244590759,0.808384001255035,0.191615998744965,0.896343469619751,0.896343469619751,0.0153011356947856,-0.0153011356947856,0.246793311976896,-0.246793311976896,,,0.0,0.0,0.0346140488982201,-0.0346140488982201,0.0555419015863539,-0.0555419015863539,0.0288147106766701,-0.0288147106766701,0.25749098225783,-0.25749098225783,0.0,0.0,0.0,0.0,0.0,0.0,0.0,0.0,0.0,0,0.0,0.0,0.0,0.0,0.0,0.0,0.0,0.0,0.0,0.0,0.0,0.0,0.0,0.0,0.0,0.0,0.0,0.0,0.0,0.0,0.0,1.0,0.0,1.0,1.0,0.0,0.0,0.0,0.0,0.0,0.0,0.0,0.0,0.0,0.0,0.0,1.0,0.0,0.0,0.0,0.0,00-0034796,L.Jackson,,,,,,,,,,,,,,,,,,,,,,,,,,,,,,,,,,,,,,,,00-0033868,M.Garrett,00-0036915,J.Owusu-Koramoah,,,,,,,,,,,,,00-0033868,M.Garrett,CLE,00-0036915,J.Owusu-Koramoah,CLE,,,,,,,0.0,,,,,,,,,,,,,,,,,,,,,,,,,,,00-0033868,M.Garrett,00-0036915,J.Owusu-Koramoah,,0.0,,,,,0,,,0.0,0.0,0.0,0.0,,,2023,,,41,0,Punt,3203,"11/12/23, 13:02:49",2023-11-12T20:28:59.287Z,M&T Bank Stadium,"Clear Temp: 49° F, Humidity: 46%, Wind: N 4 mph",cbac711d-f053-11ed-b4a7-bab79e4492fa,0,0,SACK,0,,2023-11-12T20:29:03.900Z,,15,Punt,2023-11-12T20:26:42.917Z,4.0,2:29,1.0,0.0,0.0,3.0,4.0,0.0,KICKOFF,PUNT,02:20,14:51,BAL 25,BAL 45,3106.0,3273.0,33,31,Home,-2,64,6.0,38.5,1,outdoors,grass,49.0,4.0,John Harbaugh,Kevin Stefanski,BAL00,M&T Bank Stadium,0,0.0,L.Jackson,8.0,,,,,1,0,0.0,0,1,00-0034796,,,L.Jackson,8.0,00-0034796,,,,,0,0,-2.00542415410746,,,,,,0.716075956821442,28.3924043178558,2023-11-12,G.Delpit,2023,REG,CLE,10,00-0036282,S,Grant Delpit,Grant,Delpit,,,,Shoulder,,Full Participation in Practice,2023-11-10T20:45:41Z,2023-11-10 20:45:41
3201,2023_15_KC_NE,2023121711,NE,KC,REG,15,KC,away,NE,KC,85.0,2023-12-17,883.0,883.0,883.0,Half2,0,20.0,0,4,1.0,0,14:43,KC 15,10,10.0,"(14:43) 25-C.Edwards-Helaire right guard to KC 18 for 3 yards (33-A.Jennings, 70-J.Pharms). NE-8-J.Bentley was injured during the play.",run,3.0,0,0,0.0,0,0,0,,,,,right,guard,,,,,3,2,0.0,,,,,2.0,3.0,10,27,27.0,10.0,17.0,27.0,10.0,17.0,0.0709955841302872,0.180197551846504,0.002752368338406,0.290619075298309,0.178395137190819,0.0028243323322385,0.274215936660767,0.0,0.0,-0.12008528644219,-0.276004752144218,-21.8125310900806,21.8125310900806,-2.36762358017099,2.36762358017099,-16.0224265777167,16.0224265777167,,,0.0,0.0,6.12065776874491,-6.12065776874491,-17.8872460075578,17.8872460075578,-5.16118492686242,5.16118492686242,-6.69503886843387,6.69503886843387,0.975821673870087,0.0241783261299133,0.0241783261299133,0.975821673870087,-0.0021319985389709,-0.0004902482032775,0.0004902482032775,0.0263103246688843,0.973689675331116,0.993113458156586,0.0068865418434143,-0.037407573312521,0.037407573312521,-0.39359387836589,0.39359387836589,,,0.0,0.0,0.101926887635453,-0.101926887635453,-0.514521046649813,0.514521046649813,0.101926887635453,-0.101926887635453,-0.432325045686364,0.432325045686364,0.0,0.0,0.0,0.0,0.0,0.0,0.0,0.0,0.0,0,0.0,0.0,0.0,0.0,0.0,0.0,0.0,0.0,0.0,0.0,0.0,0.0,0.0,0.0,0.0,0.0,0.0,0.0,0.0,0.0,0.0,0.0,1.0,0.0,0.0,0.0,0.0,0.0,0.0,0.0,0.0,0.0,0.0,0.0,0.0,0.0,1.0,0.0,0.0,0.0,0.0,,,,,,,00-0036360,C.Edwards-Helaire,3.0,,,,,,,,,,,,,,,,,,,,,,,,,,,,,,,,,,,,,,,,,,,,,,,,,00-0037711,J.Pharms,NE,,,,,,,,,,1.0,00-0036193,A.Jennings,NE,,,,,,,,,,,,,,,,,,,,,,,,,,,,,0.0,,,,,0,,,0.0,0.0,0.0,0.0,,,2023,,,40,1,First down,3201,"12/17/23, 13:03:03",2023-12-17T20:24:13Z,Gillette Stadium,"Cloudy and cool Temp: 53° F, Humidity: 74%, Wind: NW 7 mph",cbaf19cc-f053-11ed-b4a7-bab79e4492fa,0,0,RUSH,0,,,,20,Punt,2023-12-17T20:24:13Z,5.0,3:21,1.0,0.0,0.0,4.0,4.0,0.0,PUNT,PUNT,14:43,11:22,KC 15,KC 25,3201.0,3323.0,27,17,Home,-10,44,-10.0,39.5,0,outdoors,fieldturf,53.0,7.0,Bill Belichick,Andy Reid,BOS00,Gillette Stadium,0,0.0,,,C.Edwards-Helaire,25.0,,,0,1,0.0,0,1,,00-0036360,,C.Edwards-Helaire,25.0,00-0036360,C.Edwards-Helaire,00-0036360,C.Edwards-Helaire,00-0036360,0,1,-0.276004752144218,,,,,,0.283919185400009,-28.3919185400009,2023-12-17,J.Bentley,2023,REG,NE,15,00-0034385,LB,Ja'Whaun Bentley,Ja'Whaun,Bentley,Knee,,Questionable,Knee,,Limited Participation in Practice,2023-12-15T20:54:18Z,2023-12-15 20:54:18
3193,2023_07_SF_MIN,2023102300,MIN,SF,REG,7,MIN,home,SF,MIN,72.0,2023-10-23,795.0,795.0,795.0,Half2,0,14.0,0,4,1.0,0,13:15,MIN 28,10,30.0,(13:15) 8-K.Cousins pass short right to 2-A.Mattison to MIN 27 for -1 yards (57-D.Greenlaw). SF-57-D.Greenlaw was injured during the play.,pass,-1.0,0,0,1.0,0,0,0,short,right,-4.0,3.0,,,,,,,3,2,0.0,,,,,3.0,2.0,22,17,22.0,17.0,5.0,22.0,17.0,5.0,0.0430932268500328,0.130149021744728,0.0021269344724714,0.19355346262455,0.221760764718056,0.0026400682982057,0.406676530838013,0.0,0.0,1.76772297406569,-0.778817339800298,4.95999776513781,-4.95999776513781,4.85884526814334,-4.85884526814334,-0.825418726849675,0.825418726849675,-1.27922508539632,0.500407745596021,-1.27922508539632,0.500407745596021,-3.67584732401883,3.67584732401883,9.02418715567033,-9.02418715567033,-5.25836371636251,5.25836371636251,2.48427648305071,-2.48427648305071,0.789581656455994,0.210418343544006,0.789581656455994,0.210418343544006,-0.0368984341621399,-0.0285137295722961,-0.0285137295722961,0.752683222293854,0.247316777706146,0.659510672092438,0.659510672092438,0.145069036144351,-0.145069036144351,0.13785329442338,-0.13785329442338,0.0,-0.0368984341621399,0.0,-0.0368984341621399,0.0657513439655304,-0.0657513439655304,0.143754795006075,-0.143754795006075,0.0657513439655304,-0.0657513439655304,0.0550756452591799,-0.0550756452591799,0.0,0.0,0.0,0.0,0.0,0.0,0.0,0.0,0.0,0,0.0,0.0,0.0,0.0,0.0,0.0,0.0,0.0,0.0,0.0,0.0,0.0,0.0,0.0,1.0,0.0,0.0,0.0,0.0,0.0,0.0,0.0,0.0,1.0,0.0,0.0,0.0,0.0,0.0,0.0,0.0,0.0,0.0,0.0,0.0,1.0,0.0,0.0,0.0,0.0,0.0,00-0029604,K.Cousins,-1.0,00-0034972,A.Mattison,-1.0,,,,,,,,,,,,,,,,,,,,,,,,,,,,,,,,00-0034982,D.Greenlaw,,,,,,,,,,,,,SF,,00-0034982,,D.Greenlaw,,,,,,,,,,,,,,0.0,,,,,,,,,,,,,,,,,,,,,,,,,,,,,,,,0.0,,,,,0,,,0.0,0.0,0.0,0.0,,,2023,0.902769207954407,9.72307920455933,45,1,First down,3193,"10/23/23, 20:15:46",2023-10-24T02:39:45.893Z,U.S. Bank Stadium,"N/A (Indoors) Temp: 59° F, Humidity: 71%, Wind: ESE 4 mph",b07e5393-f053-11ed-b4a7-bab79e4492fa,0,0,PASS,0,,2023-10-24T02:39:51Z,,14,Punt,2023-10-24T02:38:54.077Z,7.0,4:07,2.0,0.0,0.0,4.0,4.0,0.0,KICKOFF,PUNT,13:21,09:14,MIN 28,SF 42,3163.0,3373.0,17,22,Home,5,39,-7.0,44.5,0,dome,sportturf,,,Kevin O'Connell,Kyle Shanahan,MIN01,U.S. Bank Stadium,0,0.0,K.Cousins,8.0,,,A.Mattison,2.0,1,0,0.0,0,1,00-0029604,,00-0034972,K.Cousins,8.0,00-0029604,A.Mattison,00-0034972,A.Mattison,00-0034972,0,1,-0.778817339800298,1.38727458752333,10.7231803378672,9.0,0.559439564676723,0.246925591112813,0.426454454660416,57.3545545339584,2023-10-23,D.Greenlaw,2023,REG,SF,7,00-0034982,LB,Dre Greenlaw,Dre,Greenlaw,Hamstring,,Questionable,Hamstring,,Limited Participation in Practice,2023-10-21T21:02:42Z,2023-10-21 21:02:42
3175,2023_03_LA_CIN,2023092501,CIN,LA,REG,3,LA,away,CIN,LA,75.0,2023-09-25,189.0,1089.0,1089.0,Half2,0,18.0,0,3,1.0,0,03:09,LA 25,10,-2.0,(3:09) 9-M.Stafford pass short left to 23-K.Williams pushed ob at LA 32 for 7 yards (55-L.Wilson). LA-70-J.Noteboom was injured during the play.,pass,7.0,0,0,1.0,0,0,0,short,left,0.0,7.0,,,,,,,2,2,0.0,,,,,2.0,2.0,16,9,9.0,16.0,-7.0,9.0,16.0,-7.0,0.0412597395479679,0.146160840988159,0.0025193637702614,0.247979864478111,0.225905522704124,0.0017292608972638,0.334445416927338,0.0,0.0,0.842912706546485,0.425469569629058,4.11260001813988,-4.11260001813988,0.597072853241116,-0.597072853241116,5.06212901400021,-5.06212901400021,-0.567515464499593,0.992985034128651,-0.567515464499593,0.992985034128651,-2.98456890095258,2.98456890095258,6.36542269581696,-6.36542269581696,8.58227956807241,-8.58227956807241,-5.05598853958772,5.05598853958772,0.213385999202728,0.786614000797272,0.786614000797272,0.213385999202728,-0.0033329129219055,0.0120098739862442,-0.0120098739862442,0.789946913719177,0.210053086280823,0.186032086610794,0.813967913389206,0.0382180324452441,-0.0382180324452441,0.173659086227417,-0.173659086227417,0.0026749968528747,-0.0060079097747802,0.0026749968528747,-0.0060079097747802,0.0749059021472931,-0.0749059021472931,0.120766967535019,-0.120766967535019,0.0749059021472931,-0.0749059021472931,0.0533337295055389,-0.0533337295055389,0.0,0.0,0.0,0.0,0.0,0.0,0.0,0.0,0.0,0,0.0,0.0,0.0,0.0,0.0,0.0,0.0,0.0,0.0,0.0,0.0,0.0,0.0,0.0,1.0,0.0,0.0,0.0,0.0,0.0,0.0,0.0,0.0,1.0,0.0,0.0,0.0,0.0,0.0,0.0,0.0,0.0,0.0,0.0,0.0,1.0,0.0,0.0,0.0,0.0,0.0,00-0026498,M.Stafford,7.0,00-0037840,K.Williams,7.0,,,,,,,,,,,,,,,,,,,,,,,,,,,,,,,,,,,,,,,,,,,,,,CIN,,00-0036294,,L.Wilson,,,,,,,,,,,,,,0.0,,,,,,,,,,,,,,,,,,,,,,,,,,,,,,,,0.0,,,,,0,,,0.0,0.0,0.0,0.0,,,2023,0.747713327407837,25.2286672592163,44,0,Punt,3175,"9/25/23, 20:15:18",2023-09-26T02:36:09.133Z,Paycor Stadium,"Mostly clear Temp: 71° F, Humidity: 70%, Wind: ENE 5 mph",b07d2ff3-f053-11ed-b4a7-bab79e4492fa,0,0,PASS,0,,2023-09-26T02:36:13.670Z,,18,Punt,2023-09-26T02:35:21.053Z,3.0,2:32,0.0,0.0,0.0,3.0,3.0,-15.0,KICKOFF,PUNT,03:09,00:37,LA 25,LA 23,3152.0,3300.0,16,19,Home,3,35,3.0,45.5,0,outdoors,fieldturf,74.0,7.0,Zac Taylor,Sean McVay,CIN00,Paycor Stadium,0,1.0,M.Stafford,9.0,,,K.Williams,23.0,1,0,0.0,0,1,00-0026498,,00-0037840,M.Stafford,9.0,00-0026498,K.Williams,00-0037840,K.Williams,00-0037840,1,1,0.425469569629058,0.813287559330842,7.03330286774872,6.0,0.60671521734912,0.226126179215498,0.532899558544159,46.7100441455841,2023-09-25,J.Noteboom,2023,REG,LA,3,00-0034803,T,Joseph Noteboom,Joseph,Noteboom,,,,Shoulder,,Full Participation in Practice,2023-09-23T19:39:20Z,2023-09-23 19:39:20
3165,2023_04_MIA_BUF,2023100101,BUF,MIA,REG,4,MIA,away,BUF,BUF,47.0,2023-10-01,44.0,944.0,944.0,Half2,0,18.0,0,3,4.0,0,00:44,BUF 47,1,20.0,(:44) (Shotgun) 1-T.Tagovailoa sacked at MIA 45 for -8 yards (91-E.Oliver). BUF-27-T.White was injured during the play. He is Out. T.White taken off field on cart.,pass,-8.0,1,0,1.0,0,0,0,,,,,,,,,,,3,2,0.0,,,,,2.0,3.0,41,20,20.0,41.0,-21.0,20.0,41.0,-21.0,0.055863693356514,0.171917378902435,0.0014429857255891,0.265128821134567,0.181985288858414,0.0059355092234909,0.317726314067841,0.0,0.0,0.407371227396652,-3.68634619051591,26.6019237031302,-26.6019237031302,1.876644716437,-1.876644716437,19.8686443309385,-19.8686443309385,,,0.0,0.0,0.667386614019051,-0.667386614019051,10.5103790551075,-10.5103790551075,3.75566256590537,-3.75566256590537,13.5460283329127,-13.5460283329127,0.0135825583711267,0.986417441628873,0.986417441628873,0.0135825583711267,-0.0072228023782372,-0.0088179782032966,0.0088179782032966,0.993640244007111,0.0063597559928894,0.0144900158047676,0.985509984195232,0.0514595790105544,-0.0514595790105544,0.340035860841775,-0.340035860841775,,,0.0,0.0,-0.05667911630629,0.05667911630629,0.310492653484533,-0.310492653484533,-0.0471314058875888,0.0471314058875888,0.382855590517709,-0.382855590517709,0.0,0.0,0.0,0.0,0.0,0.0,0.0,1.0,0.0,0,0.0,0.0,0.0,0.0,0.0,0.0,0.0,0.0,0.0,0.0,0.0,0.0,0.0,0.0,1.0,0.0,0.0,0.0,0.0,0.0,0.0,1.0,0.0,1.0,1.0,0.0,0.0,0.0,0.0,0.0,0.0,0.0,0.0,0.0,0.0,0.0,0.0,0.0,0.0,0.0,0.0,00-0036212,T.Tagovailoa,,,,,,,,,,,,,,,,,,,,,,,,,,,,,,,,,,,,00-0035230,E.Oliver,,,00-0035230,E.Oliver,,,,,,,,,BUF,,00-0035230,,E.Oliver,,,,,,,,,,,,,,0.0,,,,,,,,,,,,,,,,,,,,,,,,,00-0035230,E.Oliver,,,,,,0.0,,,,,0,,,0.0,0.0,0.0,0.0,,,2023,,,44,0,Turnover on downs,3165,"10/1/23, 13:02:27",2023-10-01T19:26:15.353Z,Highmark Stadium,"Sunny, fair Temp: 70° F, Humidity: 71%, Wind: WNW 5 mph",b07d3d5d-f053-11ed-b4a7-bab79e4492fa,0,0,SACK,0,,2023-10-01T19:26:20.357Z,,18,Turnover on downs,2023-10-01T19:18:49.240Z,5.0,2:21,1.0,0.0,0.0,3.0,3.0,0.0,KICKOFF,DOWNS,03:00,00:39,MIA 25,BUF 47,3039.0,3165.0,20,48,Home,28,68,2.5,53.0,1,outdoors,a_turf,70.0,2.0,Sean McDermott,Mike McDaniel,BUF00,New Era Field,0,0.0,T.Tagovailoa,1.0,,,,,1,0,0.0,0,1,00-0036212,,,T.Tagovailoa,1.0,00-0036212,,,,,0,1,-3.68634619051591,,,,,,0.314541727304459,68.5458272695541,2023-10-01,T.White,2023,REG,BUF,4,00-0033884,CB,Tre'Davious White,Tre'Davious,White,,,,Not injury related - resting player,,Did Not Participate In Practice,2023-09-29T17:57:26Z,2023-09-29 17:57:26
3159,2023_13_DEN_HOU,2023120307,HOU,DEN,REG,13,DEN,away,HOU,DEN,53.0,2023-12-03,834.0,834.0,834.0,Half2,0,21.0,0,4,1.0,0,13:54,DEN 47,10,75.0,(13:54) 38-J.McLaughlin right guard to HOU 45 for 8 yards (6-D.Perryman). HOU-1-J.Ward was injured during the play.,run,8.0,0,0,0.0,0,0,0,,,,,right,guard,,,,,2,3,0.0,,,,,3.0,2.0,22,10,10.0,22.0,-12.0,10.0,22.0,-12.0,0.0312097892165184,0.0936713516712189,0.001271880348213,0.1513691842556,0.282731056213379,0.0016748569905757,0.438071846961975,0.0,0.0,2.57490370585583,0.541935854242183,11.0778072830727,-11.0778072830727,-2.58148483433696,2.58148483433696,14.2326443365537,-14.2326443365537,,,0.0,0.0,14.3856176130357,-14.3856176130357,0.0838830254024776,-0.0838830254024776,11.6083039563382,-11.6083039563382,0.979798200286382,-0.979798200286382,0.104383580386639,0.895616419613361,0.895616419613361,0.104383580386639,-0.0019043013453483,0.0007615908980369,-0.0007615908980369,0.89752072095871,0.10247927904129,0.10922110080719,0.89077889919281,0.0363725966517521,-0.0363725966517521,0.215500338470596,-0.215500338470596,,,0.0,0.0,0.0586923152729869,-0.0586923152729869,0.173301106786389,-0.173301106786389,0.0586923152729869,-0.0586923152729869,0.148854634260792,-0.148854634260792,0.0,0.0,0.0,0.0,0.0,0.0,0.0,0.0,0.0,0,0.0,0.0,0.0,0.0,0.0,0.0,0.0,0.0,0.0,0.0,0.0,0.0,0.0,0.0,1.0,0.0,0.0,0.0,0.0,0.0,0.0,0.0,1.0,0.0,0.0,0.0,0.0,0.0,0.0,0.0,0.0,0.0,0.0,0.0,0.0,0.0,0.0,0.0,0.0,0.0,0.0,,,,,,,00-0038794,J.McLaughlin,8.0,,,,,,,,,,,,,,,,,,,,,,,,,,,,,,,,,,,,,,,,,,,HOU,,00-0032103,,D.Perryman,,,,,,,,,,,,,,0.0,,,,,,,,,,,,,,,,,,,,,,,,,,,,,,,,0.0,,,,,0,,,0.0,0.0,0.0,0.0,,,2023,,,39,1,First down,3159,"12/3/23, 13:02:37",2023-12-03T20:31:53.380Z,NRG Stadium,"Partly Sunny Temp: 67° F, Humidity: 37%, Wind: WNW 5 mph",cbae4537-f053-11ed-b4a7-bab79e4492fa,0,0,RUSH,0,,2023-12-03T20:31:58.657Z,,21,Touchdown,2023-12-03T20:30:07.077Z,5.0,2:12,4.0,1.0,1.0,4.0,4.0,15.0,KICKOFF,TOUCHDOWN,14:16,12:04,DEN 25,HOU 1,3103.0,3249.0,17,22,Home,5,39,3.5,47.5,0,closed,astroturf,,,DeMeco Ryans,Sean Payton,HOU00,NRG Stadium,0,1.0,,,J.McLaughlin,38.0,,,0,1,0.0,0,1,,00-0038794,,J.McLaughlin,38.0,00-0038794,J.McLaughlin,00-0038794,J.McLaughlin,00-0038794,0,1,0.541935854242183,,,,,,0.699374258518219,-69.9374258518219,2023-12-03,J.Ward,2023,REG,HOU,13,00-0031298,S,Jimmie Ward,Jimmie,Ward,,,,Hamstring,,Full Participation in Practice,2023-12-01T21:36:41Z,2023-12-01 21:36:41
3114,2023_14_PHI_DAL,2023121011,DAL,PHI,REG,14,DAL,home,PHI,DAL,64.0,2023-12-10,561.0,1461.0,1461.0,Half2,0,13.0,0,3,2.0,0,09:21,DAL 36,10,34.0,"(9:21) (Shotgun) 23-R.Dowdle right guard to DAL 40 for 4 yards (94-J.Sweat, 95-M.Tuipulotu). DAL-23-R.Dowdle was injured during the play.",run,4.0,1,0,0.0,0,0,0,,,,,right,guard,,,,,3,3,0.0,,,,,3.0,3.0,24,13,24.0,13.0,11.0,24.0,13.0,11.0,0.0053848177194595,0.120932705700398,0.0021430684719234,0.221450179815292,0.22236642241478,0.004029868170619,0.423692971467972,0.0,0.0,1.72377429110929,-0.574309551157057,11.1178294944816,-11.1178294944816,11.2796351757715,-11.2796351757715,-4.98120400753252,4.98120400753252,,,0.0,0.0,-7.27626108724508,7.27626108724508,13.5280875157041,-13.5280875157041,-11.0306092890678,11.0306092890678,14.1746914439587,-14.1746914439587,0.891106247901917,0.108893752098084,0.891106247901917,0.108893752098084,-0.0010921359062194,0.0058093667030334,0.0058093667030334,0.890014111995697,0.109985888004303,0.900084376335144,0.900084376335144,0.31712752373022,-0.31712752373022,-0.0482161756571212,0.0482161756571212,,,0.0,0.0,-0.0349216257960747,0.0349216257960747,0.0974709855233701,-0.0974709855233701,-0.0349216257960747,0.0349216257960747,0.0406226644133599,-0.0406226644133599,0.0,0.0,0.0,0.0,0.0,0.0,0.0,0.0,0.0,0,0.0,0.0,0.0,0.0,0.0,0.0,0.0,0.0,0.0,0.0,0.0,0.0,0.0,0.0,0.0,0.0,0.0,0.0,0.0,0.0,0.0,0.0,1.0,0.0,0.0,0.0,0.0,0.0,0.0,0.0,0.0,0.0,0.0,0.0,0.0,0.0,1.0,0.0,0.0,0.0,0.0,,,,,,,00-0036139,R.Dowdle,4.0,,,,,,,,,,,,,,,,,,,,,,,,,,,,,,,,,,,,,,,,,,,,,,,,,00-0036920,M.Tuipulotu,PHI,,,,,,,,,,1.0,00-0034381,J.Sweat,PHI,,,,,,,,,,,,,,,,,,,,,,,,,,,,,0.0,,,,,0,,,0.0,0.0,0.0,0.0,,,2023,,,38,1,First down,3114,"12/10/23, 20:22:28",2023-12-11T03:33:40.597Z,AT&T Stadium,,cbaeaf74-f053-11ed-b4a7-bab79e4492fa,0,0,RUSH,0,,2023-12-11T03:33:44.197Z,,13,Field goal,2023-12-11T03:31:18.853Z,9.0,5:52,2.0,0.0,1.0,3.0,3.0,-25.0,KICKOFF,FIELD_GOAL,10:41,04:49,DAL 25,PHI 41,3021.0,3306.0,13,33,Home,20,46,3.5,52.5,1,closed,matrixturf,,,Mike McCarthy,Nick Sirianni,DAL00,AT&T Stadium,0,0.0,,,R.Dowdle,23.0,,,0,1,0.0,0,1,,00-0036139,,R.Dowdle,23.0,00-0036139,R.Dowdle,00-0036139,R.Dowdle,00-0036139,0,1,-0.574309551157057,,,,,,0.614271402359009,-61.4271402359009,2023-12-10,R.Dowdle,2023,REG,DAL,14,00-0036139,RB,Rico Dowdle,Rico,Dowdle,Ankle,,Questionable,Ankle,,Full Participation in Practice,2023-12-08T20:48:24Z,2023-12-08 20:48:24
3111,2023_14_DET_CHI,2023121002,CHI,DET,REG,14,DET,away,CHI,DET,77.0,2023-12-10,91.0,991.0,991.0,Half2,0,16.0,0,3,1.0,0,01:31,DET 23,10,6.0,(1:31) 26-J.Gibbs right end to DET 29 for 6 yards (29-T.Stevenson). CHI-29-T.Stevenson was injured during the play.,run,6.0,0,0,0.0,0,0,0,,,,,right,end,,,,,3,2,0.0,,,,,2.0,3.0,19,13,13.0,19.0,-6.0,13.0,19.0,-6.0,0.0478141829371452,0.151930198073387,0.0019971863366663,0.288630455732346,0.19808541238308,0.0028848457150161,0.308657675981522,0.0,0.0,0.280431503430009,0.477644046302885,6.9465579338721,-6.9465579338721,-3.9278730173246,3.9278730173246,3.78133355390415,-3.78133355390415,,,0.0,0.0,4.60315869562328,-4.60315869562328,1.0696956255706,-1.0696956255706,7.03625749505591,-7.03625749505591,-1.60953912033808,1.60953912033808,0.226441532373428,0.773558467626572,0.773558467626572,0.226441532373428,-0.0138619244098663,-0.0101490318775177,0.0101490318775177,0.787420392036438,0.212579607963562,0.32823520898819,0.67176479101181,0.0018757300156997,-0.0018757300156997,0.0432610908604818,-0.0432610908604818,,,0.0,0.0,-0.083770223251459,0.083770223251459,0.255291762686961,-0.255291762686961,-0.083770223251459,0.083770223251459,0.128670382238619,-0.128670382238619,0.0,0.0,0.0,0.0,0.0,0.0,0.0,0.0,0.0,0,0.0,0.0,0.0,0.0,0.0,0.0,0.0,0.0,0.0,0.0,0.0,0.0,0.0,0.0,1.0,0.0,0.0,0.0,0.0,0.0,0.0,0.0,1.0,0.0,0.0,0.0,0.0,0.0,0.0,0.0,0.0,0.0,0.0,0.0,0.0,0.0,0.0,0.0,0.0,0.0,0.0,,,,,,,00-0039139,J.Gibbs,6.0,,,,,,,,,,,,,,,,,,,,,,,,,,,,,,,,,,,,,,,,,,,CHI,,00-0039071,,T.Stevenson,,,,,,,,,,,,,,0.0,,,,,,,,,,,,,,,,,,,,,,,,,,,,,,,,0.0,,,,,0,,,0.0,0.0,0.0,0.0,,,2023,,,36,0,Turnover,3111,"12/10/23, 13:03:24",2023-12-10T20:21:15.313Z,Soldier Field,"Cloudy Temp: 36° F, Humidity: 70%, Wind: SE 12 mph",cbae7a77-f053-11ed-b4a7-bab79e4492fa,0,0,RUSH,0,,2023-12-10T20:21:19.970Z,,16,Turnover,2023-12-10T20:20:32.937Z,2.0,0:36,0.0,0.0,0.0,3.0,3.0,0.0,KICKOFF,FUMBLE,01:36,01:00,DET 23,DET 29,3086.0,3133.0,13,28,Home,15,41,-3.0,44.5,1,outdoors,grass,36.0,12.0,Matt Eberflus,Dan Campbell,CHI98,Soldier Field,0,1.0,,,J.Gibbs,26.0,,,0,1,0.0,0,1,,00-0039139,,J.Gibbs,26.0,00-0039139,J.Gibbs,00-0039139,J.Gibbs,00-0039139,0,1,0.477644046302885,,,,,,0.536382436752319,-53.6382436752319,2023-12-10,T.Stevenson,2023,REG,CHI,14,00-0039071,CB,Tyrique Stevenson,Tyrique,Stevenson,,,,Ankle,,Full Participation in Practice,2023-12-08T19:50:54Z,2023-12-08 19:50:54
3089,2023_10_IND_NE,2023111200,NE,IND,REG,10,IND,away,NE,NE,33.0,2023-11-12,544.0,544.0,544.0,Half2,0,16.0,0,4,3.0,0,09:04,NE 33,11,20.0,(9:04) (Shotgun) 10-G.Minshew pass incomplete short left to 11-M.Pittman (91-D.Wise). NE-90-C.Barmore was injured during the play.,pass,0.0,1,0,1.0,0,0,0,short,left,-2.0,,,,,,,,3,3,0.0,,,,,3.0,3.0,6,7,7.0,6.0,1.0,7.0,6.0,1.0,0.0682614222168922,0.0772790461778641,0.0010592510225251,0.117157198488712,0.471848458051682,0.0016397077124565,0.262754917144775,0.0,0.0,2.20405317959376,-1.00669363301535,-1.34245703009596,1.34245703009596,6.19457888277248,-6.19457888277248,-3.87751589719582,3.87751589719582,-1.22647382924333,0.219780196227985,0.0,0.0,-3.93800718698185,3.93800718698185,-0.907813166169874,0.907813166169874,-11.7724808065686,11.7724808065686,15.3206178737397,-15.3206178737397,0.591610312461853,0.408389687538147,0.408389687538147,0.591610312461853,-0.0597529411315918,-0.0523046851158142,0.0523046851158142,0.468142628669739,0.531857371330261,0.701892971992493,0.298107028007507,0.235303725426833,-0.235303725426833,-0.376850694417954,0.376850694417954,0.0,-0.0597529411315918,0.0,0.0,-0.382101118564606,0.382101118564606,0.123573899269104,-0.123573899269104,-0.382101118564606,0.382101118564606,0.267733812332153,-0.267733812332153,0.0,0.0,0.0,0.0,0.0,1.0,0.0,0.0,1.0,0,0.0,0.0,0.0,0.0,0.0,0.0,0.0,0.0,0.0,0.0,0.0,0.0,0.0,0.0,0.0,0.0,0.0,0.0,0.0,0.0,0.0,0.0,0.0,1.0,0.0,0.0,0.0,0.0,0.0,0.0,0.0,0.0,0.0,0.0,0.0,0.0,0.0,0.0,0.0,0.0,0.0,00-0035289,G.Minshew,,00-0036252,M.Pittman,,,,,,,,,,,,,,,,,,,,,,,,,,,,,,,,,,,,,,,,,,,,,,,,,,,,,,,,,,,,,,,,,0.0,,,,,,,00-0033947,D.Wise,,,,,,,,,,,,,,,,,,,,,,,,0.0,,,,,0,,,0.0,0.0,0.0,0.0,,,2023,0.866379082202911,-86.6379082202911,43,0,Field goal,3089,"11/12/23, 09:32:57",2023-11-12T16:45:42.600Z,Frankfurt Stadium,"Cloudy Temp: 47° F, Humidity: 78%, Wind: E 1 mph",cbac6844-f053-11ed-b4a7-bab79e4492fa,0,0,PASS,0,,2023-11-12T16:45:48.210Z,,16,Field goal,2023-11-12T16:41:14.030Z,7.0,3:50,1.0,0.0,1.0,4.0,4.0,0.0,KICKOFF,FIELD_GOAL,12:44,08:54,IND 47,NE 33,2943.0,3112.0,10,6,Neutral,-4,16,-1.0,42.0,0,outdoors,grass,,,Bill Belichick,Shane Steichen,BOS00,Gillette Stadium,0,0.0,G.Minshew II,10.0,,,M.Pittman,11.0,1,0,0.0,0,1,00-0035289,,00-0036252,G.Minshew II,10.0,00-0035289,M.Pittman,00-0036252,M.Pittman,00-0036252,0,1,-1.00669363301535,1.41453737636032,8.93817698251223,8.0,0.327377312642057,0.213695158076007,0.958950579166412,4.10494208335876,2023-11-12,C.Barmore,2023,REG,NE,10,00-0036981,DT,Christian Barmore,Christian,Barmore,Knee,,Questionable,Knee,,Limited Participation in Practice,2023-11-10T16:55:41Z,2023-11-10 16:55:41
3070,2023_13_SEA_DAL,2023113000,DAL,SEA,REG,13,DAL,home,SEA,DAL,64.0,2023-11-30,560.0,1460.0,1460.0,Half2,0,11.0,0,3,2.0,0,09:20,DAL 36,4,75.0,(9:20) (Shotgun) 20-T.Pollard right guard to DAL 41 for 5 yards (33-J.Adams). SEA-33-J.Adams was injured during the play.,run,5.0,1,0,0.0,0,0,0,,,,,right,guard,,,,,3,3,0.0,,,,,3.0,3.0,20,28,20.0,28.0,-8.0,20.0,28.0,-8.0,0.0053001842461526,0.115664102137089,0.0020776146557182,0.199153140187264,0.223778858780861,0.0037899012677371,0.450236231088638,0.0,0.0,2.08535047946498,0.375064191641286,-6.74322391215308,6.74322391215308,-3.12150533520617,3.12150533520617,-2.86485031712382,2.86485031712382,,,0.0,0.0,1.45929680595873,-1.45929680595873,0.729117472015787,-0.729117472015787,-0.890950448461808,0.890950448461808,3.36679096933221,-3.36679096933221,0.255381733179092,0.744618266820908,0.255381733179092,0.744618266820908,0.0117754638195038,0.0182695984840393,0.0182695984840393,0.267157196998596,0.732842803001404,0.40277424454689,0.40277424454689,-0.15168742513513,0.15168742513513,-0.0744613581458609,0.0744613581458609,,,0.0,0.0,0.181134187357003,-0.181134187357003,-0.117139975758754,0.117139975758754,0.181134187357003,-0.181134187357003,-0.100900153847896,0.100900153847896,0.0,1.0,0.0,0.0,0.0,0.0,0.0,0.0,0.0,0,0.0,0.0,0.0,0.0,0.0,0.0,0.0,0.0,0.0,0.0,0.0,0.0,0.0,0.0,1.0,0.0,0.0,0.0,0.0,0.0,0.0,0.0,1.0,0.0,0.0,0.0,0.0,0.0,0.0,0.0,0.0,0.0,0.0,0.0,0.0,0.0,0.0,0.0,0.0,0.0,0.0,,,,,,,00-0035261,T.Pollard,5.0,,,,,,,,,,,,,,,,,,,,,,,,,,,,,,,,,,,,,,,,,,,SEA,,00-0033872,,J.Adams,,,,,,,,,,,,,,0.0,,,,,,,,,,,,,,,,,,,,,,,,,,,,,,,,0.0,,,,,0,,,0.0,0.0,0.0,0.0,,,2023,,,41,1,First down,3070,"11/30/23, 20:15:51",2023-12-01T03:20:32.933Z,AT&T Stadium,,cbae0cc9-f053-11ed-b4a7-bab79e4492fa,0,0,RUSH,0,,2023-12-01T03:20:36.437Z,,11,Touchdown,2023-12-01T03:18:41.237Z,12.0,6:20,9.0,1.0,1.0,3.0,3.0,22.0,KICKOFF,TOUCHDOWN,10:01,03:41,DAL 25,SEA 6,2991.0,3477.0,35,41,Home,6,76,9.5,47.5,0,closed,matrixturf,,,Mike McCarthy,Pete Carroll,DAL00,AT&T Stadium,0,1.0,,,T.Pollard,20.0,,,0,1,1.0,0,1,,00-0035261,,T.Pollard,20.0,00-0035261,T.Pollard,00-0035261,T.Pollard,00-0035261,0,1,0.375064191641286,,,,,,0.475841075181961,-47.5841075181961,2023-11-30,J.Adams,2023,REG,SEA,13,00-0033872,S,Jamal Adams,Jamal,Adams,,,,Knee,,Full Participation in Practice,2023-11-29T21:03:21Z,2023-11-29 21:03:21
3049,2023_17_MIA_BAL,2023123101,BAL,MIA,REG,17,MIA,away,BAL,MIA,53.0,2023-12-31,206.0,1106.0,1106.0,Half2,0,18.0,0,3,1.0,0,03:26,MIA 47,10,78.0,(3:26) 10-T.Hill right end to MIA 47 for no gain (95-T.Robinson). MIA-74-L.Eichenberg was injured during the play.,run,0.0,0,0,0.0,0,0,0,,,,,right,end,,,,,3,3,0.0,,,,,3.0,3.0,35,13,13.0,35.0,-22.0,13.0,35.0,-22.0,0.0258622169494629,0.0934420526027679,0.0013905860250815,0.170964390039444,0.278578966856003,0.0037763006985187,0.425985455513001,0.0,0.0,2.34532963042147,-0.51087741414085,19.9706818853177,-19.9706818853177,-7.0166431456455,7.0166431456455,27.7316610129014,-27.7316610129014,,,0.0,0.0,-2.30230233084876,2.30230233084876,13.2697163874982,-13.2697163874982,-4.89331563454471,4.89331563454471,31.7055541986006,-31.7055541986006,0.0056859930045902,0.99431400699541,0.99431400699541,0.0056859930045902,-0.0006707427091896,-0.0009247190319001,0.0009247190319001,0.994984749704599,0.0050152502954006,0.0066506448201835,0.993349355179816,0.0417376964541716,-0.0417376964541716,0.367079059616591,-0.367079059616591,,,0.0,0.0,-0.180809303231936,0.180809303231936,0.188311119632191,-0.188311119632191,-0.1785604050834,0.1785604050834,0.561800826409227,-0.561800826409227,0.0,0.0,0.0,0.0,0.0,0.0,0.0,0.0,0.0,0,0.0,0.0,0.0,0.0,0.0,0.0,0.0,0.0,0.0,0.0,0.0,0.0,0.0,0.0,1.0,0.0,0.0,0.0,0.0,0.0,0.0,0.0,1.0,0.0,0.0,0.0,0.0,0.0,0.0,0.0,0.0,0.0,0.0,0.0,0.0,0.0,0.0,0.0,0.0,0.0,0.0,,,,,,,00-0033040,T.Hill,0.0,,,,,,,,,,,,,,,,,,,,,,,,,,,,,,,,,,,,,,,,,,,BAL,,00-0038505,,T.Robinson,,,,,,,,,,,,,,0.0,,,,,,,,,,,,,,,,,,,,,,,,,,,,,,,,0.0,,,,,0,,,0.0,0.0,0.0,0.0,,,2023,,,44,1,First down,3049,"12/31/23, 13:02:53",2023-12-31T20:19:34.143Z,M&T Bank Stadium,"Clear Temp: 50° F, Humidity: 41%, Wind: WNW 7 mph",cbaf866d-f053-11ed-b4a7-bab79e4492fa,0,0,RUSH,0,,2023-12-31T20:19:38.250Z,,18,Touchdown,2023-12-31T20:16:18.113Z,14.0,6:42,6.0,1.0,1.0,3.0,4.0,5.0,PUNT,TOUCHDOWN,05:39,13:57,MIA 22,BAL 1,2946.0,3341.0,19,56,Home,37,75,3.0,47.0,0,outdoors,grass,50.0,7.0,John Harbaugh,Mike McDaniel,BAL00,M&T Bank Stadium,0,0.0,,,T.Hill,10.0,,,0,1,0.0,0,1,,00-0033040,,T.Hill,10.0,00-0033040,T.Hill,00-0033040,T.Hill,00-0033040,0,0,-0.51087741414085,,,,,,0.681859374046326,-68.1859374046326,2023-12-31,L.Eichenberg,2023,REG,MIA,17,00-0037010,G,Liam Eichenberg,Liam,Eichenberg,Calf,Ankle,Questionable,Calf,Ankle,Limited Participation in Practice,2023-12-29T20:55:13Z,2023-12-29 20:55:13
3002,2023_15_NYJ_MIA,2023121701,MIA,NYJ,REG,15,MIA,home,NYJ,NYJ,14.0,2023-12-17,858.0,858.0,858.0,Half2,0,16.0,0,4,1.0,0,14:18,NYJ 14,10,42.0,"(14:18) (Shotgun) 31-R.Mostert left end to NYJ 1 for 13 yards (1-A.Gardner; 99-W.McDonald). NYJ-99-W.McDonald was injured during the play. PENALTY on MIA-89-J.Hill, Offensive Holding, 10 yards, enforced at NYJ 14 - No Play.",no_play,0.0,1,0,0.0,0,0,0,,,,,,,,,,,3,3,0.0,,,,,3.0,3.0,27,0,27.0,0.0,27.0,27.0,0.0,27.0,0.0098045375198125,0.0156485084444284,0.0004368211375549,0.0312006678432226,0.314548641443253,0.0007324123871512,0.62762838602066,0.0,0.0,5.07228560873773,-1.09815839026123,35.3066349466842,-35.3066349466842,7.69453916614293,-7.69453916614293,29.7523871851018,-29.7523871851018,,,0.0,0.0,-4.50706265197368,4.50706265197368,15.2807508994301,-15.2807508994301,-2.52740265653119,2.52740265653119,24.4678915455743,-24.4678915455743,0.999781429767609,0.0002185702323913,0.999781429767609,0.0002185702323913,5.68032264709473e-05,7.74860382080078e-06,7.74860382080078e-06,0.99983823299408,0.0001617670059204,0.999966740608215,0.999966740608215,0.0865893072016132,-0.0865893072016132,0.352424498840577,-0.352424498840577,,,0.0,0.0,-0.0114922996144742,0.0114922996144742,0.0406211250995914,-0.0406211250995914,-0.0406134526710957,0.0406134526710957,0.170038058382801,-0.170038058382801,0.0,0.0,0.0,0.0,0.0,0.0,0.0,0.0,0.0,0,0.0,0.0,0.0,0.0,0.0,0.0,0.0,0.0,0.0,0.0,0.0,0.0,0.0,0.0,0.0,0.0,1.0,0.0,0.0,0.0,0.0,0.0,0.0,0.0,0.0,0.0,0.0,0.0,0.0,0.0,0.0,0.0,0.0,0.0,0.0,0.0,0.0,0.0,0.0,0.0,0.0,,,,,,,,,,,,,,,,,,,,,,,,,,,,,,,,,,,,,,,,,,,,,,,,,,,,,,,,,,,,,,,,,,,,,,0.0,,,,,,,,,,,,,,,,,,,,,,,,,,,,,,,,0.0,MIA,00-0038720,J.Hill,10.0,0,,Offensive Holding,0.0,0.0,0.0,0.0,,,2023,,,35,0,Field goal,3002,"12/17/23, 13:02:28",2023-12-17T20:22:24.933Z,Hard Rock Stadium,"Partly Cloudy Temp: 76° F, Humidity: 69%, Wind: WNW 15 mph",cbaeebf4-f053-11ed-b4a7-bab79e4492fa,0,0,PENALTY,0,,2023-12-17T20:22:30.470Z,,16,Field goal,2023-12-17T20:11:28.777Z,12.0,7:43,3.0,1.0,1.0,3.0,4.0,-10.0,INTERCEPTION,FIELD_GOAL,04:25,11:42,MIA 41,NYJ 17,2777.0,3105.0,0,30,Home,30,30,7.5,36.0,1,outdoors,grass,76.0,15.0,Mike McDaniel,Robert Saleh,MIA00,Hard Rock Stadium,0,0.0,,,R.Mostert,31.0,,,0,1,0.0,0,1,,00-0031687,,R.Mostert,31.0,00-0031687,,,R.Mostert,00-0031687,0,1,-1.09815839026123,,,,,,0.263732880353928,-26.3732880353928,2023-12-17,W.McDonald,2023,REG,NYJ,15,00-0039142,DE,Will McDonald,Will,McDonald,Knee,,Questionable,Knee,,Did Not Participate In Practice,2023-12-15T20:52:56Z,2023-12-15 20:52:56
2917,2023_16_LV_KC,2023122500,KC,LV,REG,16,LV,away,KC,KC,42.0,2023-12-25,167.0,1067.0,1067.0,Half2,0,17.0,0,3,1.0,0,02:47,KC 42,10,25.0,"(2:47) 35-Z.White right end to KC 36 for 6 yards (38-L.Sneed, 23-D.Tranquill). KC-38-L.Sneed was injured during the play.",run,6.0,0,0,0.0,0,0,0,,,,,right,end,,,,,2,3,0.0,,,,,3.0,2.0,7,17,17.0,7.0,10.0,17.0,7.0,10.0,0.0246053505688906,0.0705841854214668,0.0014412950258702,0.116840504109859,0.293191373348236,0.0017787937540561,0.491558492183685,0.0,0.0,3.29152247775346,0.218967282911763,-15.5659426001218,15.5659426001218,-6.82926307807816,6.82926307807816,-5.94711743070173,5.94711743070173,,,0.0,0.0,0.250395616079075,-0.250395616079075,5.91946047708465,-5.91946047708465,5.78995243649031,-5.78995243649031,-9.4052372166088,9.4052372166088,0.878614962100983,0.121385037899017,0.121385037899017,0.878614962100983,0.0053527951240539,0.0071292519569397,-0.0071292519569397,0.116032242774963,0.883967757225037,0.761934459209442,0.238065540790558,-0.348265599971387,0.348265599971387,-0.159655749537051,0.159655749537051,,,0.0,0.0,0.116506978869438,-0.116506978869438,0.0677890032529831,-0.0677890032529831,0.0981092005968094,-0.0981092005968094,-0.215276106931269,0.215276106931269,0.0,0.0,0.0,0.0,0.0,0.0,0.0,0.0,0.0,0,0.0,0.0,0.0,0.0,0.0,0.0,0.0,0.0,0.0,0.0,0.0,0.0,0.0,0.0,0.0,0.0,0.0,0.0,0.0,0.0,0.0,0.0,1.0,0.0,0.0,0.0,0.0,0.0,0.0,0.0,0.0,0.0,0.0,0.0,0.0,0.0,1.0,0.0,0.0,0.0,0.0,,,,,,,00-0038040,Z.White,6.0,,,,,,,,,,,,,,,,,,,,,,,,,,,,,,,,,,,,,,,,,,,,,,,,,00-0035262,D.Tranquill,KC,,,,,,,,,,1.0,00-0036374,L.Sneed,KC,,,,,,,,,,,,,,,,,,,,,,,,,,,,,0.0,,,,,0,,,0.0,0.0,0.0,0.0,,,2023,,,36,1,First down,2917,"12/25/23, 13:02:40",2023-12-25T20:15:06.100Z,GEHA Field at Arrowhead Stadium,"Temp: 38° F, Humidity: 89%, Wind: W 11 mph",cbaf696f-f053-11ed-b4a7-bab79e4492fa,0,0,RUSH,0,,2023-12-25T20:15:12.313Z,,17,Field goal,2023-12-25T20:15:06.100Z,7.0,2:23,1.0,1.0,1.0,3.0,3.0,0.0,PUNT,FIELD_GOAL,02:47,00:24,KC 42,KC 17,2917.0,3075.0,20,14,Home,-6,34,11.0,40.5,1,outdoors,grass,38.0,11.0,Andy Reid,Antonio Pierce,KAN00,GEHA Field at Arrowhead Stadium,0,1.0,,,Z.White,35.0,,,0,1,0.0,0,1,,00-0038040,,Z.White,35.0,00-0038040,Z.White,00-0038040,Z.White,00-0038040,0,1,0.218967282911763,,,,,,0.417736560106277,-41.7736560106277,2023-12-25,L.Sneed,2023,REG,KC,16,00-0036374,CB,L'Jarius Sneed,L'Jarius,Sneed,,,,Knee,,Full Participation in Practice,2023-12-23T19:57:57Z,2023-12-23 19:57:57
2912,2023_10_CLE_BAL,2023111201,BAL,CLE,REG,10,CLE,away,BAL,BAL,44.0,2023-11-12,338.0,1238.0,1238.0,Half2,0,14.0,0,3,3.0,0,05:38,BAL 44,11,75.0,(5:38) (Shotgun) 4-D.Watson pass short right to 85-D.Njoku to BAL 33 for 11 yards (0-R.Smith). BAL-44-M.Humphrey was injured during the play.,pass,11.0,1,0,1.0,0,0,0,short,right,-2.0,13.0,,,,,,,3,3,0.0,,,,,3.0,3.0,24,9,9.0,24.0,-15.0,9.0,24.0,-15.0,0.0146549753844738,0.134496778249741,0.0016408971277996,0.229259252548218,0.291264295578003,0.0054741189815104,0.323209673166275,0.0,0.0,1.13562194001861,2.51776375283953,10.9608723055151,-10.9608723055151,-2.41392874828307,2.41392874828307,11.2901722483086,-11.2901722483086,-1.66310854977928,4.18087230261881,-1.66310854977928,4.18087230261881,5.66709740343504,-5.66709740343504,-2.65553692993126,2.65553692993126,-8.05579421305447,8.05579421305447,18.6028920428349,-18.6028920428349,0.064362607896328,0.935637392103672,0.935637392103672,0.064362607896328,0.0216616466641426,0.0019820034503936,-0.0019820034503936,0.913975745439529,0.0860242545604706,0.0494628064334393,0.950537193566561,0.0972449829338031,-0.0972449829338031,0.270441208922373,-0.270441208922373,0.0,0.0216616466641426,0.0,0.0216616466641426,0.0311828181147575,-0.0311828181147575,0.0338436874726416,-0.0338436874726416,0.0253834798932076,-0.0253834798932076,0.235792768144117,-0.235792768144117,0.0,0.0,1.0,0.0,1.0,0.0,0.0,0.0,0.0,0,0.0,0.0,0.0,0.0,0.0,0.0,0.0,0.0,0.0,0.0,0.0,0.0,0.0,0.0,1.0,0.0,0.0,0.0,0.0,0.0,0.0,0.0,0.0,1.0,0.0,0.0,0.0,0.0,0.0,0.0,0.0,0.0,0.0,0.0,0.0,1.0,0.0,0.0,0.0,0.0,0.0,00-0033537,D.Watson,11.0,00-0033885,D.Njoku,11.0,,,,,,,,,,,,,,,,,,,,,,,,,,,,,,,,,,,,,,,,,,,,,,BAL,,00-0034874,,R.Smith,,,,,,,,,,,,,,0.0,,,,,,,,,,,,,,,,,,,,,,,,,,,,,,,,0.0,,,,,0,,,0.0,0.0,0.0,0.0,,,2023,0.868279755115509,13.1720244884491,37,1,First down,2912,"11/12/23, 13:02:49",2023-11-12T20:13:27.457Z,M&T Bank Stadium,"Clear Temp: 49° F, Humidity: 46%, Wind: N 4 mph",cbac711d-f053-11ed-b4a7-bab79e4492fa,0,0,PASS,0,,2023-11-12T20:13:34.663Z,,14,Touchdown,2023-11-12T20:05:36.830Z,17.0,10:09,6.0,1.0,1.0,3.0,3.0,-5.0,KICKOFF,TOUCHDOWN,12:29,02:20,CLE 25,BAL 3,2599.0,3082.0,33,31,Home,-2,64,6.0,38.5,1,outdoors,grass,49.0,4.0,John Harbaugh,Kevin Stefanski,BAL00,M&T Bank Stadium,0,1.0,D.Watson,4.0,,,D.Njoku,85.0,1,0,1.0,0,1,00-0033537,,00-0033885,D.Watson,4.0,00-0033537,D.Njoku,00-0033885,D.Njoku,00-0033885,0,0,2.51776375283953,1.58715277278488,9.02358798240311,8.0,0.322542076784885,0.210837373364484,0.986829340457916,1.31706595420837,2023-11-12,M.Humphrey,2023,REG,BAL,10,00-0033281,CB,Marlon Humphrey,Marlon,Humphrey,Hamstring,,Questionable,Hamstring,,Limited Participation in Practice,2023-11-10T21:00:06Z,2023-11-10 21:00:06
2901,2023_17_DET_DAL,2023123000,DAL,DET,REG,17,DET,away,DAL,DAL,14.0,2023-12-30,812.0,812.0,812.0,Half2,0,16.0,0,4,1.0,0,13:32,DAL 14,10,63.0,(13:32) (Shotgun) 26-J.Gibbs left end to DAL 16 for -2 yards (14-M.Bell). DAL-2-J.Lewis was injured during the play.,run,-2.0,1,0,0.0,0,0,0,,,,,left,end,,,,,3,3,0.0,,,,,3.0,3.0,10,10,10.0,10.0,0.0,10.0,10.0,0.0,0.0084661394357681,0.0179178155958653,0.0003908126673195,0.0272403676062822,0.324924290180206,0.0007517946651205,0.620308756828308,0.0,0.0,5.07322011230281,-0.955280236783437,-5.50632579723606,5.50632579723606,-0.27744144553435,0.27744144553435,-4.04878388652533,4.04878388652533,,,0.0,0.0,-7.01184150340851,7.01184150340851,0.808866696153355,-0.808866696153355,0.817508198117139,-0.817508198117139,-6.32816016227544,6.32816016227544,0.622927010059357,0.377072989940643,0.377072989940643,0.622927010059357,-0.0461647510528565,-0.0461481213569641,0.0461481213569641,0.4232377409935,0.5767622590065,0.594511985778809,0.405488014221191,-0.110625593776355,0.110625593776355,-0.0776662153232934,0.0776662153232934,,,0.0,0.0,0.0277887880802155,-0.0277887880802155,-0.0742050034035089,0.0742050034035089,0.0277887880802155,-0.0277887880802155,-0.0961529237259271,0.0961529237259271,0.0,0.0,0.0,0.0,0.0,0.0,0.0,0.0,0.0,0,0.0,0.0,0.0,0.0,0.0,0.0,0.0,0.0,0.0,0.0,0.0,0.0,0.0,0.0,1.0,0.0,0.0,1.0,0.0,0.0,0.0,0.0,1.0,0.0,0.0,0.0,0.0,0.0,0.0,0.0,0.0,0.0,0.0,0.0,0.0,0.0,0.0,0.0,0.0,0.0,0.0,,,,,,,00-0039139,J.Gibbs,-2.0,,,,,,,,,,,,,,,,,,,,,,,,,,,,,00-0037561,M.Bell,,,,,,,,,,,,,DAL,,00-0037561,,M.Bell,,,,,,,,,,,,,,0.0,,,,,,,,,,,,,,,,,,,,,,,,,,,,,,,,0.0,,,,,0,,,0.0,0.0,0.0,0.0,,,2023,,,39,0,Field goal,2901,"12/30/23, 20:15:26",2023-12-31T03:27:12.463Z,AT&T Stadium,,cbaf7f0d-f053-11ed-b4a7-bab79e4492fa,0,0,RUSH,0,,2023-12-31T03:27:16.933Z,,16,Field goal,2023-12-31T03:21:05.197Z,7.0,3:05,1.0,1.0,1.0,3.0,4.0,-15.0,KICKOFF,FIELD_GOAL,00:23,12:18,DET 25,DAL 12,2778.0,2998.0,19,20,Home,1,39,5.5,53.0,0,closed,matrixturf,,,Mike McCarthy,Dan Campbell,DAL00,AT&T Stadium,0,0.0,,,J.Gibbs,26.0,,,0,1,0.0,0,1,,00-0039139,,J.Gibbs,26.0,00-0039139,J.Gibbs,00-0039139,J.Gibbs,00-0039139,0,0,-0.955280236783437,,,,,,0.379876434803009,-37.9876434803009,2023-12-30,J.Lewis,2023,REG,DAL,17,00-0033928,CB,Jourdan Lewis,Jourdan,Lewis,,,,Not injury related - resting player,,Limited Participation in Practice,2023-12-26T18:47:40Z,2023-12-26 18:47:40
2900,2023_15_KC_NE,2023121711,NE,KC,REG,15,NE,home,KC,NE,72.0,2023-12-17,108.0,1008.0,1008.0,Half2,0,17.0,0,3,4.0,0,01:48,NE 28,7,3.0,"(1:48) 17-B.Baringer punts 64 yards to KC 8, Center-49-J.Cardona. 17-R.James to KC 26 for 18 yards (53-C.Elliss). NE-18-M.Slater was injured during the play.",punt,0.0,0,0,0.0,0,0,0,,,,,,,,64.0,,,3,2,0.0,,,,,3.0,2.0,10,27,10.0,27.0,-17.0,10.0,27.0,-17.0,0.0492665097117424,0.22082807123661,0.0036974062677472,0.335221111774445,0.143549636006355,0.0028455380816012,0.244591698050499,0.0,0.0,-0.867944938130677,0.345318072475493,-22.7312479943222,22.7312479943222,-2.64362833231521,2.64362833231521,-16.2588126412254,16.2588126412254,,,0.0,0.0,5.58019583271065,-5.58019583271065,-18.3053434758836,18.3053434758836,-3.09818114980177,3.09818114980177,-8.99442870900322,8.99442870900322,0.0328570418059826,0.967142958194017,0.0328570418059826,0.967142958194017,-0.0090307407081127,-0.0056564202532172,-0.0056564202532172,0.0238263010978699,0.97617369890213,0.0114677539095283,0.0114677539095283,-0.0395395718514919,0.0395395718514919,-0.387170062281029,0.387170062281029,,,0.0,0.0,0.101926887635453,-0.101926887635453,-0.514089162569642,0.514089162569642,0.101926887635453,-0.101926887635453,-0.425901229601502,0.425901229601502,0.0,0.0,0.0,0.0,0.0,0.0,0.0,0.0,0.0,0,0.0,0.0,0.0,0.0,0.0,0.0,0.0,0.0,0.0,0.0,0.0,0.0,0.0,0.0,1.0,0.0,0.0,0.0,0.0,0.0,0.0,0.0,0.0,0.0,0.0,0.0,0.0,0.0,0.0,0.0,0.0,0.0,0.0,1.0,0.0,0.0,0.0,0.0,0.0,0.0,0.0,,,,,,,,,,,,,,,,,,,,,,00-0034286,R.James,,,,,,,00-0038610,B.Baringer,,,,,,,,,,,,,,,,,,,,,NE,,00-0036813,,C.Elliss,,,,,,,,,,,,,,0.0,,,,,,,,,,,,,,,,,,,,,,,,,,,,,,,KC,18.0,,,,,0,,,0.0,0.0,0.0,0.0,,,2023,,,37,0,Punt,2900,"12/17/23, 13:03:03",2023-12-17T20:10:39.113Z,Gillette Stadium,"Cloudy and cool Temp: 53° F, Humidity: 74%, Wind: NW 7 mph",cbaf19cc-f053-11ed-b4a7-bab79e4492fa,0,0,PUNT,1,,2023-12-17T20:10:51.657Z,,17,Punt,2023-12-17T20:08:06.270Z,3.0,2:06,0.0,0.0,0.0,3.0,3.0,0.0,KICKOFF,PUNT,03:40,01:34,NE 25,NE 28,2800.0,2900.0,27,17,Home,-10,44,-10.0,39.5,0,outdoors,fieldturf,53.0,7.0,Bill Belichick,Andy Reid,BOS00,Gillette Stadium,0,1.0,,,,,,,0,0,0.0,1,0,,,,,,,,,,,0,1,0.345318072475493,,,,,,,,2023-12-17,M.Slater,2023,REG,NE,15,00-0026293,WR,Matt Slater,Matt,Slater,Groin,,Questionable,Groin,,Limited Participation in Practice,2023-12-15T20:54:18Z,2023-12-15 20:54:18
2889,2023_12_NE_NYG,2023112604,NYG,NE,REG,12,NYG,home,NE,NYG,81.0,2023-11-26,52.0,952.0,952.0,Half2,0,18.0,0,3,1.0,0,00:52,NYG 19,10,3.0,"(:52) (Shotgun) 15-T.DeVito scrambles left tackle to NYG 22 for 3 yards (8-J.Bentley). FUMBLES (8-J.Bentley), and recovers at NYG 22. NYG-86-D.Slayton was injured during the play.",run,3.0,1,0,1.0,0,0,1,,,,,left,tackle,,,,,3,2,0.0,,,,,3.0,2.0,7,7,7.0,7.0,0.0,7.0,7.0,0.0,0.0557089373469353,0.162645682692528,0.0027817916125059,0.218766838312149,0.206076204776764,0.0023281627800315,0.351692348718643,0.0,0.0,1.05986288143322,-0.439805610105395,-0.914779532817192,0.914779532817192,-14.130807604437,14.130807604437,11.1073515429453,-11.1073515429453,,,0.0,0.0,21.2732543392631,-21.2732543392631,-15.7452100696391,15.7452100696391,11.8363487576426,-11.8363487576426,4.46923368092394,-4.46923368092394,0.560687780380249,0.439312219619751,0.560687780380249,0.439312219619751,-0.0138026475906372,-0.0074845254421234,-0.0074845254421234,0.546885132789612,0.453114867210388,0.418035835027695,0.418035835027695,-0.457814079177455,0.457814079177455,0.253670057793225,-0.253670057793225,,,0.0,0.0,0.177338540554047,-0.177338540554047,-0.048059427599346,0.048059427599346,0.177338540554047,-0.177338540554047,0.235872006555165,-0.235872006555165,0.0,0.0,0.0,0.0,0.0,0.0,0.0,0.0,0.0,0,0.0,0.0,0.0,0.0,0.0,0.0,0.0,0.0,0.0,0.0,0.0,1.0,0.0,0.0,1.0,0.0,0.0,0.0,0.0,0.0,0.0,0.0,1.0,0.0,0.0,0.0,0.0,0.0,0.0,0.0,0.0,0.0,0.0,0.0,1.0,0.0,0.0,0.0,0.0,0.0,0.0,,,,,,,00-0038476,T.DeVito,3.0,,,,,,,,,,,,,,,,,,,,,,,,,,,,,,,,,,,,,NE,00-0034385,J.Bentley,,,,NE,,00-0034385,,J.Bentley,,,,,,,,,,,,,,0.0,,,,,,,,,,,NYG,00-0038476,T.DeVito,,,,NYG,0.0,00-0038476,T.DeVito,,,,,,,,,,,,0.0,,,,,0,,,0.0,0.0,0.0,0.0,,,2023,,,39,0,Punt,2889,"11/26/23, 13:02:35",2023-11-26T20:11:06.610Z,MetLife Stadium,"Mostly Cloudy Temp: 43° F, Humidity: 65%, Wind: N 6 mph",cbadaed2-f053-11ed-b4a7-bab79e4492fa,0,0,RUSH,0,,2023-11-26T20:11:12.247Z,,18,Punt,2023-11-26T20:11:06.610Z,3.0,1:50,0.0,0.0,0.0,3.0,4.0,-10.0,PUNT,PUNT,00:52,14:02,NYG 19,NYG 22,2889.0,3053.0,7,10,Home,3,17,-4.5,36.5,0,outdoors,fieldturf,43.0,6.0,Brian Daboll,Bill Belichick,NYC01,MetLife Stadium,0,0.0,T.DeVito,15.0,,15.0,,,1,0,0.0,0,1,00-0038476,,,T.DeVito,15.0,00-0038476,T.DeVito,00-0038476,T.DeVito,00-0038476,0,1,-0.439805610105395,,,,,,0.463491976261139,53.6508023738861,2023-11-26,D.Slayton,2023,REG,NYG,12,00-0035535,WR,Darius Slayton,Darius,Slayton,Neck,,Doubtful,Neck,,Limited Participation in Practice,2023-11-24T20:51:57Z,2023-11-24 20:51:57
2887,2023_05_NYJ_DEN,2023100809,DEN,NYJ,REG,5,NYJ,away,DEN,DEN,39.0,2023-10-08,116.0,1016.0,1016.0,Half2,0,17.0,0,3,1.0,0,01:56,DEN 39,10,47.0,(1:56) 33-D.Cook left tackle to DEN 30 for 9 yards (27-D.Mathis). NYJ-77-M.Becton was injured during the play.,run,9.0,0,0,0.0,0,0,0,,,,,left,tackle,,,,,3,3,0.0,,,,,3.0,3.0,13,18,18.0,13.0,5.0,18.0,13.0,5.0,0.0301386080682278,0.0616334863007069,0.0010593808256089,0.114678792655468,0.319860517978668,0.0032975799404084,0.469331681728363,0.0,0.0,3.26172771677375,0.70725722995121,-11.2713282968616,11.2713282968616,-9.13813771080495,9.13813771080495,-1.0104381956192,1.0104381956192,,,0.0,0.0,-2.99161300377455,2.99161300377455,1.37456394508167,-1.37456394508167,-5.44020077493042,5.44020077493042,1.57349740832715,-1.57349740832715,0.81378048658371,0.18621951341629,0.18621951341629,0.81378048658371,0.0118153691291809,0.0172197222709656,-0.0172197222709656,0.174404144287109,0.825595855712891,0.787116408348084,0.212883591651917,-0.377786906053509,0.377786906053509,-0.055237114561297,0.055237114561297,,,0.0,0.0,0.0601684153079987,-0.0601684153079987,-0.156227186454035,0.156227186454035,0.0601684153079987,-0.0601684153079987,-0.197896793616511,0.197896793616511,0.0,0.0,0.0,0.0,0.0,0.0,0.0,0.0,0.0,0,0.0,0.0,0.0,0.0,0.0,0.0,0.0,0.0,0.0,0.0,0.0,0.0,0.0,0.0,1.0,0.0,0.0,0.0,0.0,0.0,0.0,0.0,1.0,0.0,0.0,0.0,0.0,0.0,0.0,0.0,0.0,0.0,0.0,0.0,0.0,0.0,0.0,0.0,0.0,0.0,0.0,,,,,,,00-0033893,D.Cook,9.0,,,,,,,,,,,,,,,,,,,,,,,,,,,,,,,,,,,,,,,,,,,DEN,,00-0038105,,D.Mathis,,,,,,,,,,,,,,0.0,,,,,,,,,,,,,,,,,,,,,,,,,,,,,,,,0.0,,,,,0,,,0.0,0.0,0.0,0.0,,,2023,,,39,1,First down,2887,"10/8/23, 16:25:29",2023-10-08T22:31:57.203Z,Empower Field at Mile High,"Sunny Temp: 73° F, Humidity: 17%, Wind: S 9 mph",b07dbf55-f053-11ed-b4a7-bab79e4492fa,0,0,RUSH,0,,2023-10-08T22:32:03.443Z,,17,Field goal,2023-10-08T22:30:42.360Z,10.0,5:52,3.0,1.0,1.0,3.0,4.0,-5.0,FUMBLE,FIELD_GOAL,03:11,12:19,NYJ 49,DEN 4,2840.0,3153.0,31,21,Home,-10,52,2.5,42.5,0,outdoors,grass,73.0,9.0,Sean Payton,Robert Saleh,DEN00,Empower Field at Mile High,0,1.0,,,D.Cook,33.0,,,0,1,0.0,0,1,,00-0033893,,D.Cook,33.0,00-0033893,D.Cook,00-0033893,D.Cook,00-0033893,0,0,0.70725722995121,,,,,,0.414795726537704,-41.4795726537704,2023-10-08,M.Becton,2023,REG,NYJ,5,00-0036284,T,Mekhi Becton,Mekhi,Becton,,,,Knee,,Full Participation in Practice,2023-10-06T19:51:55Z,2023-10-06 19:51:55
2883,2023_12_PIT_CIN,2023112601,CIN,PIT,REG,12,PIT,away,CIN,PIT,77.0,2023-11-26,758.0,758.0,758.0,Half2,0,16.0,0,4,2.0,0,12:38,PIT 23,9,62.0,(12:38) (Shotgun) 8-K.Pickett pass incomplete deep left to 14-G.Pickens. PIT-14-G.Pickens was injured during the play.,pass,0.0,1,0,1.0,0,0,0,deep,left,27.0,,,,,,,,2,3,0.0,,,,,3.0,2.0,7,10,10.0,7.0,3.0,10.0,7.0,3.0,0.0904413014650345,0.161701455712318,0.0040189200080931,0.254177510738373,0.185717791318893,0.0016585730481892,0.302284479141235,0.0,0.0,0.404077091719955,-0.723447798984125,-4.62996341753751,4.62996341753751,1.8232406861498,-1.8232406861498,-6.16674809721504,6.16674809721504,2.32851981325075,-3.05196761223488,0.0,0.0,-7.57797614147421,7.57797614147421,4.65096655179514,-4.65096655179514,-23.3692833338864,23.3692833338864,20.2625464249382,-20.2625464249382,0.648444414138794,0.351555585861206,0.351555585861206,0.648444414138794,-0.0252091288566589,-0.0207992792129517,0.0207992792129517,0.376764714717865,0.623235285282135,0.731944382190704,0.268055617809296,0.0544862644739086,-0.0544862644739086,-0.167227232653509,0.167227232653509,0.0,-0.0252091288566589,0.0,0.0,-0.0845731198787689,0.0845731198787689,-0.0573348941391811,0.0573348941391811,-0.0885834097862244,0.0885834097862244,-0.0175421776360378,0.0175421776360378,0.0,0.0,0.0,0.0,0.0,0.0,0.0,0.0,1.0,0,0.0,0.0,0.0,0.0,0.0,0.0,0.0,0.0,0.0,0.0,0.0,0.0,0.0,0.0,0.0,0.0,0.0,0.0,0.0,0.0,0.0,0.0,0.0,1.0,0.0,0.0,0.0,0.0,0.0,0.0,0.0,0.0,0.0,0.0,0.0,0.0,0.0,0.0,0.0,0.0,0.0,00-0038102,K.Pickett,,00-0037247,G.Pickens,,,,,,,,,,,,,,,,,,,,,,,,,,,,,,,,,,,,,,,,,,,,,,,,,,,,,,,,,,,,,,,,,0.0,,,,,,,,,,,,,,,,,,,,,,,,,,,,,,,,0.0,,,,,0,,,0.0,0.0,0.0,0.0,,,2023,0.371233075857163,-37.1233075857163,38,1,First down,2883,"11/26/23, 13:02:28",2023-11-26T20:13:46.960Z,Paycor Stadium,"Rain Temp: 48° F, Humidity: 78%, Wind: SSW 9 mph",cbad89e9-f053-11ed-b4a7-bab79e4492fa,0,0,PASS,0,,2023-11-26T20:13:51.633Z,,15,Field goal,2023-11-26T20:13:10.257Z,10.0,5:07,2.0,1.0,1.0,4.0,4.0,-10.0,PUNT,FIELD_GOAL,13:10,08:03,PIT 22,CIN 16,2846.0,3126.0,16,10,Home,-6,26,-2.0,36.0,1,outdoors,fieldturf,48.0,9.0,Zac Taylor,Mike Tomlin,CIN00,Paycor Stadium,0,0.0,K.Pickett,8.0,,,G.Pickens,14.0,1,0,0.0,0,1,00-0038102,,00-0037247,K.Pickett,8.0,00-0038102,G.Pickens,00-0037247,G.Pickens,00-0037247,0,0,-0.723447798984125,0.681140010350027,9.86136634479044,4.0,1.0,1.0,0.744082689285278,25.5917310714722,2023-11-26,G.Pickens,2023,REG,PIT,12,00-0037247,WR,George Pickens,George,Pickens,,,,Shin,,Full Participation in Practice,2023-11-24T19:00:39Z,2023-11-24 19:00:39
2864,2023_19_GB_DAL,2024011401,DAL,GB,POST,19,DAL,home,GB,GB,35.0,2024-01-14,323.0,1223.0,1223.0,Half2,0,12.0,0,3,1.0,0,05:23,GB 35,10,88.0,"(5:23) (No Huddle, Shotgun) 4-D.Prescott pass short left to 3-B.Cooks to GB 29 for 6 yards (23-J.Alexander). GB-23-J.Alexander was injured during the play.",pass,6.0,1,1,1.0,0,0,0,short,left,4.0,2.0,,,,,,,3,3,0.0,,,,,3.0,3.0,10,34,10.0,34.0,-24.0,10.0,34.0,-24.0,0.0054804850369691,0.0449199229478836,0.0008271020487882,0.0841948688030243,0.345961332321167,0.0015893965028226,0.517026901245117,0.0,0.0,3.93447304412257,0.276765244547278,-26.120314344439,26.120314344439,-0.89543882542057,0.89543882542057,-25.1388497997077,25.1388497997077,-0.0595165975391865,0.336281842086464,-0.0595165975391865,0.336281842086464,-15.4423377368657,15.4423377368657,11.5880700542184,-11.5880700542184,-11.7309834252519,11.7309834252519,-10.2674480730029,10.2674480730029,0.009404657408595,0.990595342591405,0.009404657408595,0.990595342591405,-0.0007264520972967,0.0005990229547023,0.0005990229547023,0.0086782053112983,0.991321794688702,0.0205772556364536,0.0205772556364536,-0.0636509631726385,0.0636509631726385,-0.473811705243717,0.473811705243717,-6.66491687297821e-05,-0.0006598029285669,-6.66491687297821e-05,-0.0006598029285669,-0.0781479250834687,0.0781479250834687,-0.148270342033356,0.148270342033356,-0.0799841150836451,0.0799841150836451,-0.348307910375297,0.348307910375297,0.0,0.0,0.0,0.0,0.0,0.0,0.0,0.0,0.0,0,0.0,0.0,0.0,0.0,0.0,0.0,0.0,0.0,0.0,0.0,0.0,0.0,0.0,0.0,1.0,0.0,0.0,0.0,0.0,0.0,0.0,0.0,0.0,1.0,0.0,0.0,0.0,0.0,0.0,0.0,0.0,0.0,0.0,0.0,0.0,1.0,0.0,0.0,0.0,0.0,0.0,00-0033077,D.Prescott,6.0,00-0031236,B.Cooks,6.0,,,,,,,,,,,,,,,,,,,,,,,,,,,,,,,,,,,,,,,,,,,,,,GB,,00-0034728,,J.Alexander,,,,,,,,,,,,,,0.0,,,,,,,,,,,,,,,,,,,,,,,,,,,,,,,,0.0,,,,,0,,,0.0,0.0,0.0,0.0,,,2023,0.793176651000977,20.6823348999023,40,1,First down,2864,"1/14/24, 16:41:15",2024-01-14T23:40:02.193Z,AT&T Stadium,,a4727084-add1-11ee-aec3-7d8f81bc70be,0,0,PASS,0,,2024-01-14T23:40:07.900Z,,12,Touchdown,2024-01-14T23:35:02.793Z,11.0,3:35,7.0,1.0,1.0,3.0,3.0,6.0,KICKOFF,TOUCHDOWN,06:38,03:03,DAL 12,GB 1,2733.0,3153.0,48,32,Home,-16,80,7.0,52.5,0,closed,matrixturf,,,Mike McCarthy,Matt LaFleur,DAL00,AT&T Stadium,0,1.0,D.Prescott,4.0,,,B.Cooks,3.0,1,0,0.0,0,1,00-0033077,,00-0031236,D.Prescott,4.0,00-0033077,B.Cooks,00-0031236,B.Cooks,00-0031236,0,0,0.276765244547278,0.523217262927796,4.19009816795005,3.0,0.778118924965384,0.25084003226948,0.688976526260376,31.1023473739624,2024-01-14,J.Alexander,2023,WC,GB,19,00-0034728,CB,Jaire Alexander,Jaire,Alexander,Shoulder,Ankle,Questionable,Shoulder,Ankle,Did Not Participate In Practice,2024-01-12T20:12:41Z,2024-01-12 20:12:41
2807,2023_04_BAL_CLE,2023100104,CLE,BAL,REG,4,BAL,away,CLE,CLE,48.0,2023-10-01,487.0,1387.0,1387.0,Half2,0,16.0,0,3,3.0,0,08:07,CLE 48,23,-2.0,(8:07) (Shotgun) 8-L.Jackson pass incomplete short right to 35-G.Edwards (90-M.Hurst) [95-M.Garrett]. CLE-95-M.Garrett was injured during the play. His return is Questionable.,pass,0.0,1,0,1.0,0,0,0,short,right,-3.0,,,,,,,,3,2,0.0,,,,,2.0,3.0,3,21,21.0,3.0,18.0,21.0,3.0,18.0,0.0117025459185243,0.147512063384056,0.0017550695920363,0.289415627717972,0.262158632278442,0.0127276424318552,0.274728417396545,0.0,0.0,0.263074380112812,-1.17099996539764,-19.4442215327742,19.4442215327742,-7.65281509398483,7.65281509398483,-17.7910009618619,17.7910009618619,-1.03970690141432,-0.131293063983321,0.0,0.0,-4.92928381136153,4.92928381136153,-2.10851957591984,2.10851957591984,-2.63167504657758,2.63167504657758,-16.1124909347392,16.1124909347392,0.943797290325165,0.0562027096748352,0.0562027096748352,0.943797290325165,-0.0087778568267822,-0.004603624343872,0.004603624343872,0.0649805665016174,0.935019433498383,0.968025743961334,0.0319742560386658,-0.154888305842556,0.154888305842556,-0.422358017959759,0.422358017959759,0.0,-0.0087778568267822,0.0,0.0,0.0211204135928897,-0.0211204135928897,-0.0608545243740082,0.0608545243740082,0.0211204135928897,-0.0211204135928897,-0.450089432299137,0.450089432299137,0.0,0.0,0.0,0.0,0.0,1.0,0.0,0.0,1.0,0,0.0,0.0,0.0,0.0,0.0,0.0,0.0,0.0,0.0,0.0,0.0,0.0,0.0,0.0,0.0,0.0,0.0,0.0,0.0,0.0,0.0,1.0,0.0,1.0,0.0,0.0,0.0,0.0,0.0,0.0,0.0,0.0,0.0,0.0,0.0,0.0,0.0,0.0,0.0,0.0,0.0,00-0034796,L.Jackson,,00-0034184,G.Edwards,,,,,,,,,,,,,,,,,,,,,,,,,,,,,,,,,,,,,00-0033868,M.Garrett,,,,,,,,,,,,,,,,,,,,,,,,,,,0.0,,,,,,,00-0034746,M.Hurst,,,,,,,,,,,,,,,,,,,,,,,,0.0,,,,,0,,,0.0,0.0,0.0,0.0,,,2023,0.780294179916382,-78.0294179916382,32,0,Punt,2807,"10/1/23, 13:02:33",2023-10-01T19:04:05.300Z,Cleveland Browns Stadium,"Sunny Temp: 71° F, Humidity: 79%, Wind: E 1 mph",b07d4c45-f053-11ed-b4a7-bab79e4492fa,0,0,PASS,0,,2023-10-01T19:04:09.937Z,,16,Punt,2023-10-01T18:58:33.900Z,7.0,4:24,1.0,0.0,0.0,3.0,3.0,0.0,PUNT,PUNT,12:18,07:54,CLE 46,CLE 48,2643.0,2830.0,28,3,Home,-25,31,-2.0,38.5,1,outdoors,grass,71.0,7.0,Kevin Stefanski,John Harbaugh,CLE00,FirstEnergy Stadium,0,0.0,L.Jackson,8.0,,,G.Edwards,35.0,1,0,0.0,0,1,00-0034796,,00-0034184,L.Jackson,8.0,00-0034796,G.Edwards,00-0034184,G.Edwards,00-0034184,0,0,-1.17099996539764,0.690663542359845,10.8861847188673,10.0,0.240745733433869,0.0590158192790113,0.92595100402832,7.40489959716797,2023-10-01,M.Garrett,2023,REG,CLE,4,00-0033868,DE,Myles Garrett,Myles,Garrett,,,,Not injury related - resting player,,Did Not Participate In Practice,2023-09-27T20:07:19Z,2023-09-27 20:07:19
2806,2023_15_NYJ_MIA,2023121701,MIA,NYJ,REG,15,MIA,home,NYJ,MIA,55.0,2023-12-17,224.0,1124.0,1124.0,Half2,0,16.0,0,3,2.0,0,03:44,MIA 45,6,42.0,(3:44) (Shotgun) 31-R.Mostert left end to MIA 47 for 2 yards (21-A.Davis). NYJ-56-Qu.Williams was injured during the play.,run,2.0,1,0,0.0,0,0,0,,,,,left,end,,,,,3,3,0.0,,,,,3.0,3.0,27,0,27.0,0.0,27.0,27.0,0.0,27.0,0.0223590172827244,0.104511417448521,0.0015893407398834,0.180306866765022,0.23924158513546,0.0041516120545566,0.447840183973312,0.0,0.0,2.28204826614819,-0.458014791132882,33.156541203223,-33.156541203223,5.09220177211682,-5.09220177211682,29.1064724454055,-29.1064724454055,,,0.0,0.0,-3.39972903957823,3.39972903957823,13.5275025473384,-13.5275025473384,-1.42006904413574,1.42006904413574,22.7146431934826,-22.7146431934826,0.999232411384583,0.0007675886154174,0.999232411384583,0.0007675886154174,0.0001125931739807,1.81794166564941e-05,1.81794166564941e-05,0.999345004558563,0.0006549954414367,0.999820053577423,0.999820053577423,0.0862087911493671,-0.0862087911493671,0.352368589683778,-0.352368589683778,,,0.0,0.0,-0.0114922996144742,0.0114922996144742,0.0405652159427921,-0.0405652159427921,-0.0406134526710957,0.0406134526710957,0.169982149226002,-0.169982149226002,0.0,0.0,0.0,0.0,0.0,0.0,0.0,0.0,0.0,0,0.0,0.0,0.0,0.0,0.0,0.0,0.0,0.0,0.0,0.0,0.0,0.0,0.0,0.0,1.0,0.0,0.0,0.0,0.0,0.0,0.0,0.0,1.0,0.0,0.0,0.0,0.0,0.0,0.0,0.0,0.0,0.0,0.0,0.0,0.0,0.0,0.0,0.0,0.0,0.0,0.0,,,,,,,00-0031687,R.Mostert,2.0,,,,,,,,,,,,,,,,,,,,,,,,,,,,,,,,,,,,,,,,,,,NYJ,,00-0036329,,A.Davis,,,,,,,,,,,,,,0.0,,,,,,,,,,,,,,,,,,,,,,,,,,,,,,,,0.0,,,,,0,,,0.0,0.0,0.0,0.0,,,2023,,,32,1,First down,2806,"12/17/23, 13:02:28",2023-12-17T20:12:10.417Z,Hard Rock Stadium,"Partly Cloudy Temp: 76° F, Humidity: 69%, Wind: WNW 15 mph",cbaeebf4-f053-11ed-b4a7-bab79e4492fa,0,0,RUSH,0,,2023-12-17T20:12:14.620Z,,16,Field goal,2023-12-17T20:11:28.777Z,12.0,7:43,3.0,1.0,1.0,3.0,4.0,-10.0,INTERCEPTION,FIELD_GOAL,04:25,11:42,MIA 41,NYJ 17,2777.0,3105.0,0,30,Home,30,30,7.5,36.0,1,outdoors,grass,76.0,15.0,Mike McDaniel,Robert Saleh,MIA00,Hard Rock Stadium,0,0.0,,,R.Mostert,31.0,,,0,1,0.0,0,1,,00-0031687,,R.Mostert,31.0,00-0031687,R.Mostert,00-0031687,R.Mostert,00-0031687,0,1,-0.458014791132882,,,,,,0.496108114719391,-49.6108114719391,2023-12-17,Qu.Williams,2023,REG,NYJ,15,00-0035680,LB,Quincy Williams,Quincy,Williams,,,,Knee,,Full Participation in Practice,2023-12-15T20:51:43Z,2023-12-15 20:51:43
2779,2023_14_GB_NYG,2023121101,NYG,GB,REG,14,NYG,home,GB,NYG,75.0,2023-12-11,403.0,1303.0,1303.0,Half2,0,17.0,0,3,2.0,0,06:43,NYG 25,10,75.0,(6:43) (Shotgun) 15-T.DeVito scrambles up the middle to NYG 26 for 1 yard (90-L.Van Ness). GB-95-D.Wyatt was injured during the play.,run,1.0,1,0,1.0,0,0,1,,,,,middle,,,,,,3,3,0.0,,,,,3.0,3.0,14,13,14.0,13.0,1.0,14.0,13.0,1.0,0.0173194911330938,0.150994703173637,0.0021031606011092,0.267139106988907,0.192995801568031,0.0028360842261463,0.366611659526825,0.0,0.0,0.823777010198683,-0.74343277933076,0.0739312701776602,-0.0739312701776602,2.16120328760007,-2.16120328760007,3.87725064752087,-3.87725064752087,,,0.0,0.0,1.99119453295134,-1.99119453295134,-6.90746113637606,6.90746113637606,0.701616993901553,-0.701616993901553,1.91339892437029,-1.91339892437029,0.610889732837677,0.389110267162323,0.610889732837677,0.389110267162323,-0.0334264039993286,-0.0358341038227081,-0.0358341038227081,0.577463328838348,0.422536671161652,0.454766482114792,0.454766482114792,0.0571194397987163,-0.0571194397987163,0.190647274255753,-0.190647274255753,,,0.0,0.0,-0.21320840716362,0.21320840716362,0.0543768405914307,-0.0543768405914307,-0.21320840716362,0.21320840716362,0.342253148555756,-0.342253148555756,0.0,0.0,0.0,0.0,0.0,0.0,0.0,0.0,0.0,0,0.0,0.0,0.0,0.0,0.0,0.0,0.0,0.0,0.0,0.0,0.0,0.0,0.0,0.0,1.0,0.0,0.0,0.0,0.0,0.0,0.0,0.0,1.0,0.0,0.0,0.0,0.0,0.0,0.0,0.0,0.0,0.0,0.0,0.0,0.0,0.0,0.0,0.0,0.0,0.0,0.0,,,,,,,00-0038476,T.DeVito,1.0,,,,,,,,,,,,,,,,,,,,,,,,,,,,,,,,,,,,,,,,,,,GB,,00-0039112,,L.Van Ness,,,,,,,,,,,,,,0.0,,,,,,,,,,,,,,,,,,,,,,,,,,,,,,,,0.0,,,,,0,,,0.0,0.0,0.0,0.0,,,2023,,,34,1,First down,2779,"12/11/23, 20:15:32",2023-12-12T03:21:21.290Z,MetLife Stadium,"Overcast Temp: 39° F, Humidity: 50%, Wind: NW 14 mph",cbaebbe1-f053-11ed-b4a7-bab79e4492fa,0,0,RUSH,0,,2023-12-12T03:21:26.663Z,,17,Touchdown,2023-12-12T03:19:22.540Z,10.0,6:03,5.0,1.0,1.0,3.0,3.0,-5.0,KICKOFF,TOUCHDOWN,07:31,01:28,NYG 25,GB 8,2702.0,3011.0,22,24,Home,2,46,-6.0,37.5,0,outdoors,fieldturf,39.0,14.0,Brian Daboll,Matt LaFleur,NYC01,MetLife Stadium,0,0.0,T.DeVito,15.0,,15.0,,,1,0,0.0,0,1,00-0038476,,,T.DeVito,15.0,00-0038476,T.DeVito,00-0038476,T.DeVito,00-0038476,0,0,-0.74343277933076,,,,,,0.604112148284912,39.5887851715088,2023-12-11,D.Wyatt,2023,REG,GB,14,00-0037075,DE,Devonte Wyatt,Devonte,Wyatt,,,,Elbow,,Limited Participation in Practice,2023-12-09T19:52:28Z,2023-12-09 19:52:28
2774,2023_19_GB_DAL,2024011401,DAL,GB,POST,19,DAL,home,GB,DAL,88.0,2024-01-14,392.0,1292.0,1292.0,Half2,0,12.0,0,3,1.0,0,06:32,DAL 12,10,88.0,(6:32) (Shotgun) 4-D.Prescott pass short middle to 20-T.Pollard to DAL 21 for 9 yards (7-Q.Walker). GB-58-I.McDuffie was injured during the play.,pass,9.0,1,0,1.0,0,0,0,short,middle,3.0,6.0,,,,,,,3,3,0.0,,,,,3.0,3.0,10,34,10.0,34.0,-24.0,10.0,34.0,-24.0,0.0091027850285172,0.168840333819389,0.0044848760589957,0.273388266563416,0.181514009833336,0.0019058578182011,0.360763847827911,0.0,0.0,0.644492060411722,0.761309755966067,-28.9257508167311,28.9257508167311,-0.89543882542057,0.89543882542057,-27.9442862719997,27.9442862719997,-0.394807062577456,1.15611681854352,-0.394807062577456,1.15611681854352,-15.9111722124799,15.9111722124799,9.25146805754048,-9.25146805754048,-12.199817900866,12.199817900866,-12.6040500696808,12.6040500696808,0.007813349366188,0.992186650633812,0.007813349366188,0.992186650633812,0.0015831282362341,0.0036239903420209,0.0036239903420209,0.0093964776024222,0.990603522397578,0.0156324543058872,0.0156324543058872,-0.0636509631726385,0.0636509631726385,-0.473093432952593,0.473093432952593,0.0,0.0015831282362341,0.0,0.0015831282362341,-0.0780812759147389,0.0780812759147389,-0.147618718910962,0.147618718910962,-0.0799174659149153,0.0799174659149153,-0.347656287252903,0.347656287252903,0.0,0.0,0.0,0.0,0.0,0.0,0.0,0.0,0.0,0,0.0,0.0,0.0,0.0,0.0,0.0,0.0,0.0,0.0,0.0,0.0,0.0,0.0,0.0,1.0,0.0,0.0,0.0,0.0,0.0,0.0,0.0,0.0,1.0,0.0,0.0,0.0,0.0,0.0,0.0,0.0,0.0,0.0,0.0,0.0,1.0,0.0,0.0,0.0,0.0,0.0,00-0033077,D.Prescott,9.0,00-0035261,T.Pollard,9.0,,,,,,,,,,,,,,,,,,,,,,,,,,,,,,,,,,,,,,,,,,,,,,GB,,00-0037074,,Q.Walker,,,,,,,,,,,,,,0.0,,,,,,,,,,,,,,,,,,,,,,,,,,,,,,,,0.0,,,,,0,,,0.0,0.0,0.0,0.0,,,2023,0.836439311504364,16.3560688495636,38,1,First down,2774,"1/14/24, 16:41:15",2024-01-14T23:35:59.483Z,AT&T Stadium,,a4727084-add1-11ee-aec3-7d8f81bc70be,0,0,PASS,0,,2024-01-14T23:36:03.520Z,,12,Touchdown,2024-01-14T23:35:02.793Z,11.0,3:35,7.0,1.0,1.0,3.0,3.0,6.0,KICKOFF,TOUCHDOWN,06:38,03:03,DAL 12,GB 1,2733.0,3153.0,48,32,Home,-16,80,7.0,52.5,0,closed,matrixturf,,,Mike McCarthy,Matt LaFleur,DAL00,AT&T Stadium,0,1.0,D.Prescott,4.0,,,T.Pollard,20.0,1,0,0.0,0,1,00-0033077,,00-0035261,D.Prescott,4.0,00-0033077,T.Pollard,00-0035261,T.Pollard,00-0035261,0,0,0.761309755966067,0.696841226368213,5.24517987199943,4.0,0.630965534655843,0.255331490247045,0.659782290458679,34.0217709541321,2024-01-14,I.McDuffie,2023,WC,GB,19,00-0036658,LB,Isaiah McDuffie,Isaiah,McDuffie,,,,Concussion,Neck,Full Participation in Practice,2024-01-12T20:12:29Z,2024-01-12 20:12:29
2752,2023_15_HOU_TEN,2023121703,TEN,HOU,REG,15,TEN,home,HOU,TEN,74.0,2023-12-17,118.0,1018.0,1018.0,Half2,0,13.0,0,3,2.0,0,01:58,TEN 26,8,26.0,(1:58) 8-W.Levis pass deep left to 85-C.Okonkwo to TEN 48 for 22 yards (25-D.King). TEN-85-C.Okonkwo was injured during the play.,pass,22.0,0,0,1.0,0,0,0,deep,left,22.0,0.0,,,,,,,3,3,0.0,,,,,3.0,3.0,13,9,13.0,9.0,4.0,13.0,9.0,4.0,0.0395253896713257,0.146022513508797,0.0021166643127799,0.259081214666367,0.198796987533569,0.002738861599937,0.35171839594841,0.0,0.0,0.808028085622937,2.02497768169269,4.50166166012166,-4.50166166012166,1.30593799773638,-1.30593799773638,5.11731717747832,-5.11731717747832,2.02497768169269,0.0,2.02497768169269,0.0,2.55085108766798,-2.55085108766798,-3.40791626661667,3.40791626661667,5.89940430418938,-5.89940430418938,2.59081767805698,-2.59081767805698,0.717239141464233,0.282760858535767,0.717239141464233,0.282760858535767,0.0647104978561401,0.0467784404754639,0.0467784404754639,0.781949639320374,0.218050360679626,0.737221419811249,0.737221419811249,0.0434866929552733,-0.0434866929552733,0.18767911140088,-0.18767911140088,0.0647104978561401,0.0,0.0647104978561401,0.0,0.110638529062271,-0.110638529062271,-0.0157285630702972,0.0157285630702972,0.121227875351906,-0.121227875351906,0.155868216792382,-0.155868216792382,0.0,0.0,1.0,0.0,0.0,0.0,0.0,0.0,0.0,0,0.0,0.0,0.0,0.0,0.0,0.0,0.0,0.0,0.0,0.0,0.0,0.0,0.0,0.0,1.0,0.0,0.0,0.0,0.0,0.0,0.0,0.0,0.0,1.0,0.0,0.0,0.0,0.0,0.0,0.0,0.0,0.0,0.0,0.0,0.0,1.0,0.0,0.0,0.0,0.0,0.0,00-0039152,W.Levis,22.0,00-0037809,C.Okonkwo,22.0,,,,,,,,,,,,,,,,,,,,,,,,,,,,,,,,,,,,,,,,,,,,,,HOU,,00-0033566,,D.King,,,,,,,,,,,,,,0.0,,,,,,,,,,,,,,,,,,,,,,,,,,,,,,,,0.0,,,,,0,,,0.0,0.0,0.0,0.0,,,2023,0.44227996468544,55.772003531456,31,1,First down,2752,"12/17/23, 13:02:35",2023-12-17T20:05:51.890Z,Nissan Stadium,"Cloudy Temp: 48° F, Humidity: 77%, Wind: NW 9 mph",cbaefa83-f053-11ed-b4a7-bab79e4492fa,0,0,PASS,0,,2023-12-17T20:05:57.897Z,,13,Punt,2023-12-17T20:04:27.973Z,5.0,2:42,1.0,0.0,0.0,3.0,3.0,0.0,KICKOFF,PUNT,02:42,00:00,TEN 24,50,2698.0,2850.0,19,16,Home,-3,35,3.0,38.0,1,outdoors,grass,48.0,9.0,Mike Vrabel,DeMeco Ryans,NAS00,Nissan Stadium,0,1.0,W.Levis,8.0,,,C.Okonkwo,85.0,1,0,1.0,0,1,00-0039152,,00-0037809,W.Levis,8.0,00-0039152,C.Okonkwo,00-0037809,C.Okonkwo,00-0037809,0,0,2.02497768169269,0.344251955287711,5.80498198451824,3.0,1.0,1.0,0.725948691368103,27.4051308631897,2023-12-17,C.Okonkwo,2023,REG,TEN,15,00-0037809,TE,Chigoziem Okonkwo,Chigoziem,Okonkwo,,,,Ribs,,Limited Participation in Practice,2023-12-15T19:46:22Z,2023-12-15 19:46:22
2712,2023_03_TEN_CLE,2023092401,CLE,TEN,REG,3,CLE,home,TEN,TEN,17.0,2023-09-24,419.0,1319.0,1319.0,Half2,0,12.0,0,3,1.0,0,06:59,TEN 17,10,85.0,(6:59) 4-D.Watson scrambles right end to TEN 13 for 4 yards (93-T.Tart). TEN-93-T.Tart was injured during the play. His return is Questionable.,run,4.0,0,0,1.0,0,0,1,,,,,right,end,,,,,3,3,0.0,,,,,3.0,3.0,13,3,13.0,3.0,10.0,13.0,3.0,10.0,0.0039273253642022,0.0205342397093773,0.0004500695795286,0.0314693674445152,0.316743969917297,0.0007511994917877,0.62612384557724,0.0,0.0,5.05181279737735,-0.173240328382235,15.5405723836598,-15.5405723836598,-1.69684733998727,1.69684733998727,10.4309596938181,-10.4309596938181,,,0.0,0.0,4.1466113832646,-4.1466113832646,2.6324358714628,-2.6324358714628,-3.90365308934292,3.90365308934292,11.8099616239197,-11.8099616239197,0.920306026935577,0.0796939730644226,0.920306026935577,0.0796939730644226,-0.0010132789611816,-0.0003372430801391,-0.0003372430801391,0.919292747974396,0.0807072520256043,0.928921282291412,0.928921282291412,-0.0009810924530029,0.0009810924530029,0.161848137240002,-0.161848137240002,,,0.0,0.0,0.0923994724555703,-0.0923994724555703,0.0495667457580566,-0.0495667457580566,0.0923994724555703,-0.0923994724555703,0.043585330247879,-0.043585330247879,0.0,0.0,0.0,0.0,0.0,0.0,0.0,0.0,0.0,0,0.0,0.0,0.0,0.0,0.0,0.0,0.0,0.0,0.0,0.0,0.0,0.0,0.0,0.0,1.0,0.0,0.0,0.0,0.0,0.0,0.0,0.0,1.0,0.0,0.0,0.0,0.0,0.0,0.0,0.0,0.0,0.0,0.0,0.0,0.0,0.0,0.0,0.0,0.0,0.0,0.0,,,,,,,00-0033537,D.Watson,4.0,,,,,,,,,,,,,,,,,,,,,,,,,,,,,,,,,,,,,,,,,,,TEN,,00-0036181,,T.Tart,,,,,,,,,,,,,,0.0,,,,,,,,,,,,,,,,,,,,,,,,,,,,,,,,0.0,,,,,0,,,0.0,0.0,0.0,0.0,,,2023,,,30,1,First down,2712,"9/24/23, 13:02:33",2023-09-24T18:56:31.057Z,Cleveland Browns Stadium,"Sun/Clouds Temp: 68° F, Humidity: 69%, Wind: NE 5 mph",b07cf133-f053-11ed-b4a7-bab79e4492fa,0,0,RUSH,0,,2023-09-24T18:56:38.633Z,,12,Touchdown,2023-09-24T18:50:05.940Z,11.0,5:34,5.0,1.0,1.0,3.0,3.0,5.0,PUNT,TOUCHDOWN,11:23,05:49,CLE 15,TEN 3,2464.0,2791.0,3,27,Home,24,30,3.5,38.0,0,outdoors,grass,68.0,5.0,Kevin Stefanski,Mike Vrabel,CLE00,FirstEnergy Stadium,0,0.0,D.Watson,4.0,,4.0,,,1,0,0.0,0,1,00-0033537,,,D.Watson,4.0,00-0033537,D.Watson,00-0033537,D.Watson,00-0033537,0,1,-0.173240328382235,,,,,,0.401014178991318,59.8985821008682,2023-09-24,T.Tart,2023,REG,TEN,3,00-0036181,DT,Teair Tart,Teair,Tart,,,,Knee,,Full Participation in Practice,2023-09-22T20:27:04Z,2023-09-22 20:27:04
2663,2023_18_PHI_NYG,2024010711,NYG,PHI,REG,18,NYG,home,PHI,NYG,68.0,2024-01-07,418.0,1318.0,1318.0,Half2,0,18.0,0,3,2.0,0,06:58,NYG 32,17,38.0,"(6:58) (Shotgun) 2-T.Taylor pass incomplete short left [3-N.Smith]. NYG-2-T.Taylor was injured during the play. Penalty on NYG-74-M.Peart, Offensive Holding, declined.",pass,0.0,1,0,1.0,0,0,0,short,left,8.0,,,,,,,,2,3,0.0,,,,,2.0,3.0,24,0,24.0,0.0,24.0,24.0,0.0,24.0,0.0203071665018797,0.151410967111588,0.0017283688066527,0.267915636301041,0.198030352592468,0.0060765468515455,0.354530930519104,0.0,0.0,0.754861572058871,-0.945216366788372,26.7893321091121,-26.7893321091121,-3.75448496895962,3.75448496895962,31.4503273206356,-31.4503273206356,-0.0809452689718455,-0.864271097816527,0.0,0.0,8.69205917679938,-8.69205917679938,14.0062809519004,-14.0062809519004,2.58314600604353,-2.58314600604353,27.0559443340171,-27.0559443340171,0.99775642156601,0.0022435784339904,0.99775642156601,0.0022435784339904,-0.0001055002212524,-0.0002371668815612,-0.0002371668815612,0.997650921344757,0.0023490786552429,0.996496379375458,0.996496379375458,-0.198079692429326,0.198079692429326,0.665844078501996,-0.665844078501996,0.0,-0.0001055002212524,0.0,0.0,-0.0518187358975411,0.0518187358975411,0.527766052028474,-0.527766052028474,-0.0518187358975411,0.0518187358975411,0.713116201898393,-0.713116201898393,0.0,0.0,0.0,0.0,0.0,0.0,0.0,0.0,1.0,0,0.0,0.0,0.0,0.0,0.0,0.0,0.0,0.0,0.0,0.0,0.0,0.0,0.0,0.0,0.0,0.0,0.0,0.0,0.0,0.0,0.0,1.0,0.0,1.0,0.0,0.0,0.0,0.0,0.0,0.0,0.0,0.0,0.0,0.0,0.0,0.0,0.0,0.0,0.0,0.0,0.0,00-0028118,T.Taylor,,,,,,,,,,,,,,,,,,,,,,,,,,,,,,,,,,,,,,,,00-0039013,N.Smith,,,,,,,,,,,,,,,,,,,,,,,,,,,0.0,,,,,,,,,,,,,,,,,,,,,,,,,,,,,,,,0.0,,,,,0,,,0.0,0.0,0.0,0.0,,,2023,,,39,0,Punt,2663,"1/7/24, 16:25:25",2024-01-07T23:18:53.020Z,MetLife Stadium,"Overcast Temp: 36° F, Humidity: 76%, Wind: NW 12 mph",cbb018bd-f053-11ed-b4a7-bab79e4492fa,0,0,PASS,0,,2024-01-07T23:19:02.913Z,,18,Punt,2024-01-07T23:13:29.513Z,9.0,5:30,2.0,0.0,0.0,3.0,3.0,-10.0,PUNT,PUNT,11:33,06:03,NYG 3,NYG 41,2463.0,2736.0,10,27,Home,17,37,-4.5,43.0,1,outdoors,fieldturf,36.0,12.0,Brian Daboll,Nick Sirianni,NYC01,MetLife Stadium,0,0.0,T.Taylor,2.0,,,,,1,0,0.0,0,1,00-0028118,,,T.Taylor,2.0,00-0028118,,,,,0,1,-0.945216366788372,,,,,,0.737727999687195,26.2272000312805,2024-01-07,T.Taylor,2023,REG,NYG,18,00-0028118,QB,Tyrod Taylor,Tyrod,Taylor,,,,Back,,Limited Participation in Practice,2024-01-05T19:17:39Z,2024-01-05 19:17:39
2604,2023_11_TB_SF,2023111908,SF,TB,REG,11,SF,home,TB,TB,11.0,2023-11-19,172.0,1072.0,1072.0,Half2,0,12.0,0,3,3.0,0,02:52,TB 11,1,79.0,(2:52) 23-C.McCaffrey left tackle pushed ob at TB 6 for 5 yards (31-A.Winfield). TB-54-L.David was injured during the play.,run,5.0,0,0,0.0,0,0,0,,,,,left,tackle,,,,,3,3,0.0,,,,,3.0,3.0,20,7,20.0,7.0,13.0,20.0,7.0,13.0,0.0050861770287156,0.0165358893573284,0.0004742864402942,0.0321663357317448,0.337696760892868,0.0007786977221257,0.607261836528778,0.0,0.0,4.98975994274952,0.792477379902266,20.2548904209258,-20.2548904209258,0.115546326414915,-0.115546326414915,20.3289191242764,-20.3289191242764,,,0.0,0.0,9.7409048123809,-9.7409048123809,4.12355156214539,-4.12355156214539,0.147920140152564,-0.147920140152564,17.8864571695847,-17.8864571695847,0.973939478397369,0.0260605216026306,0.973939478397369,0.0260605216026306,-0.001625120639801,0.0014693737030029,0.0014693737030029,0.972314357757568,0.0276856422424316,0.990847587585449,0.990847587585449,-0.0448839515447617,0.0448839515447617,0.408647564610422,-0.408647564610422,,,0.0,0.0,-0.0304791753635151,0.0304791753635151,0.37070124852172,-0.37070124852172,-0.0304791753635151,0.0304791753635151,0.391677911157523,-0.391677911157523,0.0,1.0,0.0,0.0,1.0,0.0,0.0,0.0,0.0,0,0.0,0.0,0.0,0.0,0.0,0.0,0.0,0.0,0.0,0.0,0.0,0.0,0.0,0.0,1.0,0.0,0.0,0.0,0.0,0.0,0.0,0.0,1.0,0.0,0.0,0.0,0.0,0.0,0.0,0.0,0.0,0.0,0.0,0.0,0.0,0.0,0.0,0.0,0.0,0.0,0.0,,,,,,,00-0033280,C.McCaffrey,5.0,,,,,,,,,,,,,,,,,,,,,,,,,,,,,,,,,,,,,,,,,,,TB,,00-0036411,,A.Winfield,,,,,,,,,,,,,,0.0,,,,,,,,,,,,,,,,,,,,,,,,,,,,,,,,0.0,,,,,0,,,0.0,0.0,0.0,0.0,,,2023,,,39,1,First down,2604,"11/19/23, 16:05:26",2023-11-19T23:01:05.617Z,Levi's® Stadium,"Sunny, Clear Temp: 65° F, Humidity: 52%, Wind: NW 10 mph",cbad2535-f053-11ed-b4a7-bab79e4492fa,0,0,RUSH,0,,2023-11-19T23:01:10.790Z,,12,Touchdown,2023-11-19T22:56:46.527Z,9.0,5:18,5.0,1.0,1.0,3.0,3.0,0.0,PUNT,TOUCHDOWN,07:00,01:42,SF 21,TB 3,2425.0,2689.0,14,27,Home,13,41,13.5,41.5,0,outdoors,grass,65.0,10.0,Kyle Shanahan,Todd Bowles,SFO01,Levi's Stadium,0,1.0,,,C.McCaffrey,23.0,,,0,1,1.0,0,1,,00-0033280,,C.McCaffrey,23.0,00-0033280,C.McCaffrey,00-0033280,C.McCaffrey,00-0033280,1,1,0.792477379902266,,,,,,0.249439135193825,-24.9439135193825,2023-11-19,L.David,2023,REG,TB,11,00-0029562,LB,Lavonte David,Lavonte,David,,,,Not injury related - resting player,,Did Not Participate In Practice,2023-11-17T20:49:56Z,2023-11-17 20:49:56
2604,2023_14_PHI_DAL,2023121011,DAL,PHI,REG,14,PHI,away,DAL,PHI,63.0,2023-12-10,875.0,1775.0,1775.0,Half2,0,9.0,0,3,1.0,0,14:35,PHI 37,10,31.0,"(14:35) (No Huddle, Shotgun) 0-D.Swift left guard to PHI 43 for 6 yards (14-M.Bell). DAL-95-J.Hankins was injured during the play.",run,6.0,1,1,0.0,0,0,0,,,,,left,guard,,,,,3,3,0.0,,,,,3.0,3.0,24,6,6.0,24.0,-18.0,6.0,24.0,-18.0,0.0021608956158161,0.11341742426157,0.001665030606091,0.223942339420319,0.242526739835739,0.0043853558599948,0.411902219057083,0.0,0.0,1.70848775468767,0.254700885852799,16.616837590049,-16.616837590049,12.6060859341524,-12.6060859341524,-0.351029808180477,0.351029808180477,,,0.0,0.0,-4.70120596580091,4.70120596580091,6.4375277821382,-6.4375277821382,-6.91538661438972,6.91538661438972,6.32634333642053,-6.32634333642053,0.0813820511102676,0.918617948889732,0.918617948889732,0.0813820511102676,0.0059530362486839,0.001692958176136,-0.001692958176136,0.912664912641048,0.0873350873589516,0.0557063147425652,0.944293685257435,0.329865546683492,-0.329865546683492,-0.026021480929462,0.026021480929462,,,0.0,0.0,-0.0349216257960747,0.0349216257960747,0.0427552850758107,-0.0427552850758107,-0.0349216257960747,0.0349216257960747,-0.0020482300008265,0.0020482300008265,0.0,0.0,0.0,0.0,0.0,0.0,0.0,0.0,0.0,0,0.0,0.0,0.0,0.0,0.0,0.0,0.0,0.0,0.0,0.0,0.0,0.0,0.0,0.0,1.0,0.0,0.0,0.0,0.0,0.0,0.0,0.0,1.0,0.0,0.0,0.0,0.0,0.0,0.0,0.0,0.0,0.0,0.0,0.0,0.0,0.0,0.0,0.0,0.0,0.0,0.0,,,,,,,00-0036275,D.Swift,6.0,,,,,,,,,,,,,,,,,,,,,,,,,,,,,,,,,,,,,,,,,,,DAL,,00-0037561,,M.Bell,,,,,,,,,,,,,,0.0,,,,,,,,,,,,,,,,,,,,,,,,,,,,,,,,0.0,,,,,0,,,0.0,0.0,0.0,0.0,,,2023,,,32,1,First down,2604,"12/10/23, 20:22:28",2023-12-11T03:10:01.510Z,AT&T Stadium,,cbaeaf74-f053-11ed-b4a7-bab79e4492fa,0,0,RUSH,0,,2023-12-11T03:10:04.980Z,,9,Turnover,2023-12-11T03:08:23Z,4.0,1:29,2.0,0.0,0.0,3.0,3.0,5.0,KICKOFF,FUMBLE,15:00,13:31,PHI 25,PHI 49,2542.0,2658.0,13,33,Home,20,46,3.5,52.5,1,closed,matrixturf,,,Mike McCarthy,Nick Sirianni,DAL00,AT&T Stadium,0,1.0,,,D.Swift,0.0,,,0,1,0.0,0,1,,00-0036275,,D.Swift,0.0,00-0036275,D.Swift,00-0036275,D.Swift,00-0036275,0,1,0.254700885852799,,,,,,0.458005756139755,-45.8005756139755,2023-12-10,J.Hankins,2023,REG,DAL,14,00-0030063,DT,Johnathan Hankins,Johnathan,Hankins,,,,Not injury related - resting player,,Limited Participation in Practice,2023-12-06T20:30:23Z,2023-12-06 20:30:23
2591,2023_04_ARI_SF,2023100112,SF,ARI,REG,4,ARI,away,SF,SF,19.0,2023-10-01,323.0,1223.0,1223.0,Half2,0,10.0,0,3,2.0,0,05:23,SF 19,7,99.0,(5:23) 9-J.Dobbs pass short right to 85-T.McBride to SF 14 for 5 yards (54-F.Warner). SF-57-D.Greenlaw was injured during the play.,pass,5.0,0,0,1.0,0,0,0,short,right,4.0,1.0,,,,,,,2,3,0.0,,,,,3.0,2.0,21,10,10.0,21.0,-11.0,10.0,21.0,-11.0,0.0049931989051401,0.0260695796459913,0.0005696400767192,0.0534525513648987,0.415181666612625,0.000611720024608,0.49912166595459,0.0,0.0,4.28710422292352,0.227207306423225,7.16679002475682,-7.16679002475682,-3.36971649050247,3.36971649050247,9.29689004946314,-9.29689004946314,-0.0173281871248037,0.244535493548028,-0.0173281871248037,0.244535493548028,2.20125811686739,-2.20125811686739,3.2588160688174,-3.2588160688174,-6.25346341275144,6.25346341275144,17.6899277298832,-17.6899277298832,0.204007834196091,0.795992165803909,0.795992165803909,0.204007834196091,0.005142331123352,-0.0123825222253799,0.0123825222253799,0.790849834680557,0.209150165319443,0.071439154446125,0.928560845553875,0.0023434365245942,-0.0023434365245942,0.151988244466804,-0.151988244466804,0.0,0.005142331123352,0.0,0.005142331123352,-0.0539727243352994,0.0539727243352994,0.143774608442911,-0.143774608442911,-0.0539727243352994,0.0539727243352994,0.236592868635782,-0.236592868635782,0.0,0.0,0.0,0.0,0.0,0.0,0.0,0.0,0.0,0,0.0,0.0,0.0,0.0,0.0,0.0,0.0,0.0,0.0,0.0,0.0,0.0,0.0,0.0,1.0,0.0,0.0,0.0,0.0,0.0,0.0,0.0,0.0,1.0,0.0,0.0,0.0,0.0,0.0,0.0,0.0,0.0,0.0,0.0,0.0,1.0,0.0,0.0,0.0,0.0,0.0,00-0033949,J.Dobbs,5.0,00-0037744,T.McBride,5.0,,,,,,,,,,,,,,,,,,,,,,,,,,,,,,,,,,,,,,,,,,,,,,SF,,00-0034815,,F.Warner,,,,,,,,,,,,,,0.0,,,,,,,,,,,,,,,,,,,,,,,,,,,,,,,,0.0,,,,,0,,,0.0,0.0,0.0,0.0,,,2023,0.739760160446167,26.0239839553833,38,1,First down,2591,"10/1/23, 16:25:33",2023-10-01T22:15:00.403Z,Levi's® Stadium,"Sunny Temp: 75° F, Humidity: 36%, Wind: N 9 mph",b07d7349-f053-11ed-b4a7-bab79e4492fa,0,0,PASS,0,,2023-10-01T22:15:07.557Z,,10,Touchdown,2023-10-01T22:09:01.347Z,11.0,6:25,6.0,1.0,1.0,3.0,3.0,5.0,PUNT,TOUCHDOWN,10:37,04:12,ARI 1,SF 8,2354.0,2669.0,16,35,Home,19,51,15.0,44.0,1,outdoors,grass,75.0,9.0,Kyle Shanahan,Jonathan Gannon,SFO01,Levi's Stadium,0,1.0,J.Dobbs,9.0,,,T.McBride,85.0,1,0,0.0,0,1,00-0033949,,00-0037744,J.Dobbs,9.0,00-0033949,T.McBride,00-0037744,T.McBride,00-0037744,0,0,0.227207306423225,0.650213712511454,3.42120056928252,2.0,0.756560240377439,0.445728633989347,0.720874547958374,27.9125452041626,2023-10-01,D.Greenlaw,2023,REG,SF,4,00-0034982,LB,Dre Greenlaw,Dre,Greenlaw,Ankle,,Questionable,Ankle,,Limited Participation in Practice,2023-09-29T20:20:35Z,2023-09-29 20:20:35
2586,2023_05_KC_MIN,2023100810,MIN,KC,REG,5,MIN,home,KC,MIN,75.0,2023-10-08,606.0,1506.0,1506.0,Half2,0,10.0,0,3,2.0,0,10:06,MIN 25,10,3.0,(10:06) 2-A.Mattison right end to MIN 28 for 3 yards (23-D.Tranquill). MIN-56-G.Bradbury was injured during the play.,run,3.0,0,0,0.0,0,0,0,,,,,right,end,,,,,3,3,0.0,,,,,3.0,3.0,13,20,13.0,20.0,-7.0,13.0,20.0,-7.0,0.0058754161000251,0.150844424962997,0.0021896455436945,0.25718155503273,0.188432812690735,0.0031252524349838,0.392350941896439,0.0,0.0,1.06082208501175,-0.787788035115227,-8.83303122833802,8.83303122833802,0.413236220891122,-0.413236220891122,-12.394389479389,12.394389479389,,,0.0,0.0,-10.0103631670936,10.0103631670936,-0.552278919687328,0.552278919687328,-11.265643964638,11.265643964638,-0.880184874022865,0.880184874022865,0.270210295915604,0.729789704084396,0.270210295915604,0.729789704084396,-0.0153393447399139,-0.0212116688489914,-0.0212116688489914,0.25487095117569,0.74512904882431,0.168751090764999,0.168751090764999,-0.0507573128061349,0.0507573128061349,-0.334707220442531,0.334707220442531,,,0.0,0.0,0.333485251689517,-0.333485251689517,-0.645517971189817,0.645517971189817,0.333485251689517,-0.333485251689517,-0.632006402881941,0.632006402881941,0.0,0.0,0.0,0.0,0.0,0.0,0.0,0.0,0.0,0,0.0,0.0,0.0,0.0,0.0,0.0,0.0,0.0,0.0,0.0,0.0,0.0,0.0,0.0,1.0,0.0,0.0,0.0,0.0,0.0,0.0,0.0,1.0,0.0,0.0,0.0,0.0,0.0,0.0,0.0,0.0,0.0,0.0,0.0,0.0,0.0,0.0,0.0,0.0,0.0,0.0,,,,,,,00-0034972,A.Mattison,3.0,,,,,,,,,,,,,,,,,,,,,,,,,,,,,,,,,,,,,,,,,,,KC,,00-0035262,,D.Tranquill,,,,,,,,,,,,,,0.0,,,,,,,,,,,,,,,,,,,,,,,,,,,,,,,,0.0,,,,,0,,,0.0,0.0,0.0,0.0,,,2023,,,34,0,Punt,2586,"10/8/23, 16:25:33",2023-10-08T22:18:23.897Z,U.S. Bank Stadium,"N/A (Indoors) Temp: 58° F, Humidity: 46%, Wind: NNE 7 mph",b07dc3c7-f053-11ed-b4a7-bab79e4492fa,0,0,RUSH,0,,2023-10-08T22:18:28.337Z,,10,Punt,2023-10-08T22:17:06.487Z,3.0,0:58,0.0,0.0,0.0,3.0,3.0,0.0,KICKOFF,PUNT,10:10,09:12,MIN 25,MIN 28,2540.0,2638.0,27,20,Home,-7,47,-3.5,52.5,0,dome,sportturf,,,Kevin O'Connell,Andy Reid,MIN01,U.S. Bank Stadium,0,0.0,,,A.Mattison,2.0,,,0,1,0.0,0,1,,00-0034972,,A.Mattison,2.0,00-0034972,A.Mattison,00-0034972,A.Mattison,00-0034972,0,1,-0.787788035115227,,,,,,0.58787739276886,-58.787739276886,2023-10-08,G.Bradbury,2023,REG,MIN,5,00-0035588,C,Garrett Bradbury,Garrett,Bradbury,,,,Back,,Full Participation in Practice,2023-10-06T18:44:36Z,2023-10-06 18:44:36
2576,2023_19_MIA_KC,2024011301,KC,MIA,POST,19,KC,home,MIA,MIA,41.0,2024-01-13,669.0,1569.0,1569.0,Half2,0,14.0,0,3,2.0,0,11:09,MIA 41,10,69.0,(11:09) (Shotgun) 15-P.Mahomes pass short left to 4-R.Rice pushed ob at MIA 31 for 10 yards (51-D.Long). KC-4-R.Rice was injured during the play.,pass,10.0,1,0,1.0,0,0,0,short,left,1.0,9.0,,,,,,,3,3,0.0,,,,,3.0,3.0,16,7,16.0,7.0,9.0,16.0,7.0,9.0,0.0061298962682485,0.0859550088644028,0.0012234704336151,0.129523649811745,0.296453386545181,0.0045976699329912,0.476116925477982,0.0,0.0,3.06439646170475,1.09215926099569,14.913651244744,-14.913651244744,1.1343926267291,-1.1343926267291,12.3289690258668,-12.3289690258668,-0.850459374021739,1.94261863501742,-0.850459374021739,1.94261863501742,2.34592138443259,-2.34592138443259,10.417816284229,-10.417816284229,9.47987335515791,-9.47987335515791,1.90903775018408,-1.90903775018408,0.887954831123352,0.112045168876648,0.887954831123352,0.112045168876648,0.0138857364654541,0.0151317119598389,0.0151317119598389,0.901840567588806,0.0981594324111938,0.91354501247406,0.91354501247406,0.0512548685073853,-0.0512548685073853,0.350583231360976,-0.350583231360976,0.0,0.0138857364654541,0.0,0.0138857364654541,0.0359361469745636,-0.0359361469745636,0.290376937301222,-0.290376937301222,0.251041829586029,-0.251041829586029,0.0472164957833922,-0.0472164957833922,0.0,0.0,1.0,0.0,0.0,0.0,0.0,0.0,0.0,0,0.0,0.0,0.0,0.0,0.0,0.0,0.0,0.0,0.0,0.0,0.0,0.0,0.0,0.0,1.0,0.0,0.0,0.0,0.0,0.0,0.0,0.0,0.0,1.0,0.0,0.0,0.0,0.0,0.0,0.0,0.0,0.0,0.0,0.0,0.0,1.0,0.0,0.0,0.0,0.0,0.0,00-0033873,P.Mahomes,10.0,00-0039067,R.Rice,10.0,,,,,,,,,,,,,,,,,,,,,,,,,,,,,,,,,,,,,,,,,,,,,,MIA,,00-0035292,,D.Long,,,,,,,,,,,,,,0.0,,,,,,,,,,,,,,,,,,,,,,,,,,,,,,,,0.0,,,,,0,,,0.0,0.0,0.0,0.0,,,2023,0.817115962505341,18.2884037494659,31,1,First down,2576,"1/13/24, 20:10:21",2024-01-14T03:04:23.247Z,GEHA Field at Arrowhead Stadium,"Temp: -4° F, Humidity: 64%, Wind: NW 19 mph",66bfe042-add1-11ee-aec3-7d8f81bc70be,0,0,PASS,0,,2024-01-14T03:04:29.020Z,,14,Field goal,2024-01-14T03:01:04.870Z,13.0,5:32,5.0,1.0,1.0,3.0,3.0,0.0,PUNT,FIELD_GOAL,13:21,07:49,KC 28,MIA 3,2453.0,2760.0,7,26,Home,19,33,4.5,43.5,0,outdoors,grass,-4.0,19.0,Andy Reid,Mike McDaniel,KAN00,GEHA Field at Arrowhead Stadium,0,1.0,P.Mahomes,15.0,,,R.Rice,4.0,1,0,1.0,0,1,00-0033873,,00-0039067,P.Mahomes,15.0,00-0033873,R.Rice,00-0039067,R.Rice,00-0039067,1,1,1.09215926099569,0.943444234955862,6.07765113515779,5.0,0.435993164341198,0.239570304314839,0.589846611022949,41.0153388977051,2024-01-13,R.Rice,2023,WC,KC,19,00-0039067,WR,Rashee Rice,Rashee,Rice,,,,Hamstring,,Full Participation in Practice,2024-01-11T20:19:40Z,2024-01-11 20:19:40
2562,2023_08_NE_MIA,2023102904,MIA,NE,REG,8,NE,away,MIA,NE,77.0,2023-10-29,450.0,1350.0,1350.0,Half2,0,15.0,0,3,1.0,0,07:30,NE 23,10,24.0,(7:30) 10-M.Jones pass deep middle to 86-P.Brown to NE 47 for 24 yards (29-B.Jones). MIA-51-D.Long was injured during the play.,pass,24.0,0,0,1.0,0,0,0,deep,middle,18.0,6.0,,,,,,,3,3,0.0,,,,,3.0,3.0,24,10,10.0,24.0,-14.0,10.0,24.0,-14.0,0.0156764294952154,0.144788667559624,0.0023725100327283,0.288293182849884,0.201431751251221,0.0032238392159342,0.344213634729385,0.0,0.0,0.563075072597712,1.80465472000651,11.1060171489091,-11.1060171489091,-3.29220504758996,3.29220504758996,11.7195290487827,-11.7195290487827,1.30643272027373,0.498221999732778,1.30643272027373,0.498221999732778,11.1519992508111,-11.1519992508111,3.05668918209267,-3.05668918209267,23.9480524293031,-23.9480524293031,-10.7549704706415,10.7549704706415,0.0798588916659355,0.920141108334064,0.920141108334064,0.0798588916659355,0.0264414921402931,0.0060092210769653,-0.0060092210769653,0.893699616193771,0.106300383806229,0.03372997418046,0.96627002581954,-0.0357054762771458,0.0357054762771458,0.352705459242504,-0.352705459242504,0.0,0.0264414921402931,0.0,0.0264414921402931,-0.145153713791961,0.145153713791961,0.520457722758091,-0.520457722758091,-0.145153713791961,0.145153713791961,0.509795420383251,-0.509795420383251,0.0,0.0,1.0,0.0,0.0,0.0,0.0,0.0,0.0,0,0.0,0.0,0.0,0.0,0.0,0.0,0.0,0.0,0.0,0.0,0.0,0.0,0.0,0.0,1.0,0.0,0.0,0.0,0.0,0.0,0.0,0.0,0.0,1.0,0.0,0.0,0.0,0.0,0.0,0.0,0.0,0.0,0.0,0.0,0.0,1.0,0.0,0.0,0.0,0.0,0.0,00-0036972,M.Jones,24.0,00-0033439,P.Brown,24.0,,,,,,,,,,,,,,,,,,,,,,,,,,,,,,,,,,,,,,,,,,,,,,MIA,,00-0036221,,B.Jones,,,,,,,,,,,,,,0.0,,,,,,,,,,,,,,,,,,,,,,,,,,,,,,,,0.0,,,,,0,,,0.0,0.0,0.0,0.0,,,2023,0.696986556053162,30.3013443946838,35,1,First down,2562,"10/29/23, 13:02:26",2023-10-29T18:58:48.047Z,Hard Rock Stadium,"Partly Cloudy Temp: 83° F, Humidity: 68%, Wind: ENE 17 mph",b07e6fe9-f053-11ed-b4a7-bab79e4492fa,0,0,PASS,0,,2023-10-29T18:58:56.373Z,,15,Punt,2023-10-29T18:58:00.697Z,4.0,1:29,1.0,0.0,0.0,3.0,3.0,0.0,KICKOFF,PUNT,07:35,06:06,NE 23,NE 47,2532.0,2668.0,17,31,Home,14,48,7.5,46.5,1,outdoors,grass,83.0,17.0,Mike McDaniel,Bill Belichick,MIA00,Hard Rock Stadium,0,1.0,M.Jones,10.0,,,P.Brown,86.0,1,0,1.0,0,1,00-0036972,,00-0033439,M.Jones,10.0,00-0036972,P.Brown,00-0033439,P.Brown,00-0033439,0,0,1.80465472000651,0.352844605330127,4.70586339339207,2.0,1.0,1.0,0.487359374761581,51.2640625238419,2023-10-29,D.Long,2023,REG,MIA,8,00-0035292,LB,David Long,David,Long,,,,Knee,,Full Participation in Practice,2023-10-27T19:53:45Z,2023-10-27 19:53:45
2547,2023_11_LAC_GB,2023111903,GB,LAC,REG,11,GB,home,LAC,GB,56.0,2023-11-19,439.0,1339.0,1339.0,Half2,0,12.0,0,3,3.0,0,07:19,GB 44,1,26.0,(7:19) (Shotgun) 10-J.Love pass short right to 11-J.Reed pushed ob at GB 48 for 4 yards (36-J.Taylor). LAC-51-S.Joseph was injured during the play.,pass,4.0,1,0,1.0,0,0,0,short,right,4.0,0.0,,,,,,,3,3,0.0,,,,,3.0,3.0,10,13,10.0,13.0,-3.0,10.0,13.0,-3.0,0.0143913496285677,0.120445191860199,0.0020185220055282,0.176433280110359,0.226446568965912,0.0046252086758613,0.45563992857933,0.0,0.0,2.2776640439406,0.632173934718594,-4.44879582291469,4.44879582291469,-5.74764393681842,5.74764393681842,6.11554022992176,-6.11554022992176,0.632173934718594,0.0,0.632173934718594,0.0,-6.80157087245607,6.80157087245607,7.9077221507614,-7.9077221507614,-19.0276695741049,19.0276695741049,25.1123002885751,-25.1123002885751,0.46340349316597,0.53659650683403,0.46340349316597,0.53659650683403,0.0201521813869476,0.0355160534381866,0.0355160534381866,0.483555674552918,0.516444325447083,0.327936679124832,0.327936679124832,-0.141191195239607,0.141191195239607,0.142381728444127,-0.142381728444127,0.0201521813869476,0.0,0.0201521813869476,0.0,0.0098191797733306,-0.0098191797733306,0.0748145289755144,-0.0748145289755144,0.0098191797733306,-0.0098191797733306,0.144127250466374,-0.144127250466374,0.0,0.0,1.0,0.0,1.0,0.0,0.0,0.0,0.0,0,0.0,0.0,0.0,0.0,0.0,0.0,0.0,0.0,0.0,0.0,0.0,0.0,0.0,0.0,1.0,0.0,0.0,0.0,0.0,0.0,0.0,0.0,0.0,1.0,0.0,0.0,0.0,0.0,0.0,0.0,0.0,0.0,0.0,0.0,0.0,1.0,0.0,0.0,0.0,0.0,0.0,00-0036264,J.Love,4.0,00-0039146,J.Reed,4.0,,,,,,,,,,,,,,,,,,,,,,,,,,,,,,,,,,,,,,,,,,,,,,LAC,,00-0037307,,J.Taylor,,,,,,,,,,,,,,0.0,,,,,,,,,,,,,,,,,,,,,,,,,,,,,,,,0.0,,,,,0,,,0.0,0.0,0.0,0.0,,,2023,0.754716336727142,24.5283663272858,32,1,First down,2547,"11/19/23, 13:02:30",2023-11-19T19:58:38.917Z,Lambeau Field,"Sunny Temp: 45° F, Humidity: 55%, Wind: E 5 mph",cbacfd43-f053-11ed-b4a7-bab79e4492fa,0,0,PASS,0,,2023-11-19T19:58:42.953Z,,12,Punt,2023-11-19T19:54:34.093Z,10.0,6:37,3.0,0.0,0.0,3.0,3.0,0.0,KICKOFF,PUNT,10:44,04:07,GB 25,LAC 49,2402.0,2679.0,20,23,Home,3,43,-3.0,44.0,0,outdoors,grass,45.0,5.0,Matt LaFleur,Brandon Staley,GNB00,Lambeau Field,0,1.0,J.Love,10.0,,,J.Reed,11.0,1,0,1.0,0,1,00-0036264,,00-0039146,J.Love,10.0,00-0036264,J.Reed,00-0039146,J.Reed,00-0039146,1,1,0.632173934718594,0.24873913619321,4.55105339486909,2.0,0.999200626189122,0.999200626189122,0.296419858932495,70.3580141067505,2023-11-19,S.Joseph,2023,REG,LAC,11,00-0034810,DT,Sebastian Joseph,Sebastian,Joseph,,,,Knee,,Full Participation in Practice,2023-11-17T21:12:34Z,2023-11-17 21:12:34
2528,2023_07_LV_CHI,2023102201,CHI,LV,REG,7,CHI,home,LV,CHI,59.0,2023-10-22,590.0,1490.0,1490.0,Half2,0,11.0,0,3,1.0,0,09:50,CHI 41,10,88.0,(9:50) (Shotgun) 17-T.Bagent pass short left to 21-D.Foreman ran ob at LV 42 for 17 yards. LV-41-R.Spillane was injured during the play.,pass,17.0,1,0,1.0,0,0,0,short,left,-6.0,23.0,,,,,,,3,3,0.0,,,,,3.0,3.0,14,3,14.0,3.0,11.0,14.0,3.0,11.0,0.0079930331557989,0.106685109436512,0.0016455990262329,0.175116062164307,0.245963484048843,0.0044147572480142,0.458181917667389,0.0,0.0,2.40483442880213,1.0453959768638,15.1000551469344,-15.1000551469344,10.7488527322421,-10.7488527322421,6.41220557515749,-6.41220557515749,-1.32772316876799,2.37311914563179,-1.32772316876799,2.37311914563179,-4.09201841859613,4.09201841859613,2.21524976025103,-2.21524976025103,-17.0747277237824,17.0747277237824,24.2145737228636,-24.2145737228636,0.902137219905853,0.0978627800941467,0.902137219905853,0.0978627800941467,0.0052841901779174,0.0220839381217957,0.0220839381217957,0.907421410083771,0.0925785899162292,0.831282019615173,0.831282019615173,0.221206514316393,-0.221206514316393,0.154958426952362,-0.154958426952362,0.0,0.0052841901779174,0.0,0.0052841901779174,0.0098573863506317,-0.0098573863506317,-0.0230720490217209,0.0230720490217209,0.0098573863506317,-0.0098573863506317,0.159836128354073,-0.159836128354073,0.0,0.0,1.0,0.0,0.0,0.0,0.0,0.0,0.0,0,0.0,0.0,0.0,0.0,0.0,0.0,0.0,0.0,0.0,0.0,0.0,0.0,0.0,0.0,0.0,0.0,0.0,0.0,0.0,0.0,0.0,0.0,0.0,1.0,0.0,0.0,0.0,0.0,0.0,0.0,0.0,0.0,0.0,0.0,0.0,1.0,0.0,0.0,0.0,0.0,0.0,00-0038416,T.Bagent,17.0,00-0033925,D.Foreman,17.0,,,,,,,,,,,,,,,,,,,,,,,,,,,,,,,,,,,,,,,,,,,,,,,,,,,,,,,,,,,,,,,,0.0,,,,,,,,,,,,,,,,,,,,,,,,,,,,,,,,0.0,,,,,0,,,0.0,0.0,0.0,0.0,,,2023,0.87076610326767,12.923389673233,34,1,First down,2528,"10/22/23, 13:02:56",2023-10-22T18:48:25.343Z,Soldier Field,"Partly Cloudy Temp: 52° F, Humidity: 68%, Wind: N 8 mph",b07e24f5-f053-11ed-b4a7-bab79e4492fa,0,0,PASS,0,,2023-10-22T18:48:34.150Z,,11,Touchdown,2023-10-22T18:45:26Z,15.0,8:16,7.0,1.0,1.0,3.0,3.0,-5.0,PUNT,TOUCHDOWN,12:20,04:04,CHI 12,LV 5,2409.0,2814.0,12,30,Home,18,42,-2.5,38.5,0,outdoors,grass,52.0,8.0,Matt Eberflus,Josh McDaniels,CHI98,Soldier Field,0,1.0,T.Bagent,17.0,,,D.Foreman,21.0,1,0,1.0,0,1,00-0038416,,00-0033925,T.Bagent,17.0,00-0038416,D.Foreman,00-0033925,D.Foreman,00-0033925,1,1,1.0453959768638,1.36867457293664,11.761034279778,10.0,0.483964151062537,0.251367027231026,0.441672205924988,55.8327794075012,2023-10-22,R.Spillane,2023,REG,LV,7,00-0034720,LB,Robert Spillane,Robert,Spillane,,,,Knee,Shoulder,Full Participation in Practice,2023-10-20T20:23:43Z,2023-10-20 20:23:43
2524,2023_08_BAL_ARI,2023102910,ARI,BAL,REG,8,BAL,away,ARI,BAL,53.0,2023-10-29,452.0,1352.0,1352.0,Half2,0,14.0,0,3,3.0,0,07:32,BAL 47,8,17.0,(7:32) (Shotgun) 8-L.Jackson pass incomplete deep right to 3-O.Beckham. BAL-3-O.Beckham was injured during the play.,pass,0.0,1,0,1.0,0,0,0,deep,right,21.0,,,,,,,,3,3,0.0,,,,,3.0,3.0,7,14,14.0,7.0,7.0,14.0,7.0,7.0,0.0061326487921178,0.133216962218285,0.001657212502323,0.255994737148285,0.247636377811432,0.0055510913953185,0.349810928106308,0.0,0.0,1.00775934127159,-1.60359258041717,-7.87478399955466,7.87478399955466,-5.46642731843167,5.46642731843167,-7.32245594434578,7.32245594434578,2.93059219932184,-4.53418477973901,0.0,0.0,-1.24797161336755,1.24797161336755,-4.22101276929607,4.22101276929607,-9.48111082299147,9.48111082299147,2.63389707208474,-2.63389707208474,0.766880810260773,0.233119189739227,0.233119189739227,0.766880810260773,-0.0111356377601624,-0.0118723511695862,0.0118723511695862,0.24425482749939,0.75574517250061,0.922051012516022,0.0779489874839783,-0.182257258639755,0.182257258639755,-0.225599410733831,0.225599410733831,0.0,-0.0111356377601624,0.0,0.0,-0.0863413389536266,0.0863413389536266,-0.14794072508812,0.14794072508812,-0.0949412163111095,0.0949412163111095,-0.161675781011581,0.161675781011581,0.0,0.0,0.0,0.0,0.0,1.0,0.0,0.0,1.0,0,0.0,0.0,0.0,0.0,0.0,0.0,0.0,0.0,0.0,0.0,0.0,0.0,0.0,0.0,0.0,0.0,0.0,0.0,0.0,0.0,0.0,0.0,0.0,1.0,0.0,0.0,0.0,0.0,0.0,0.0,0.0,0.0,0.0,0.0,0.0,0.0,0.0,0.0,0.0,0.0,0.0,00-0034796,L.Jackson,,00-0031235,O.Beckham,,,,,,,,,,,,,,,,,,,,,,,,,,,,,,,,,,,,,,,,,,,,,,,,,,,,,,,,,,,,,,,,,0.0,,,,,,,,,,,,,,,,,,,,,,,,,,,,,,,,0.0,,,,,0,,,0.0,0.0,0.0,0.0,,,2023,0.42655548453331,-42.655548453331,32,0,Punt,2524,"10/29/23, 16:25:44",2023-10-29T22:17:46.327Z,State Farm Stadium,N/A Indoors Temp: Humidity: Wind: mph,b07e8d46-f053-11ed-b4a7-bab79e4492fa,0,0,PASS,0,,2023-10-29T22:17:50.700Z,,14,Punt,2023-10-29T22:14:59.760Z,5.0,2:21,1.0,0.0,0.0,3.0,3.0,0.0,PUNT,PUNT,09:41,07:20,BAL 30,BAL 47,2422.0,2547.0,31,24,Home,-7,55,-9.5,44.5,0,closed,grass,,,Jonathan Gannon,John Harbaugh,PHO00,State Farm Stadium,0,0.0,L.Jackson,8.0,,,O.Beckham,3.0,1,0,0.0,0,1,00-0034796,,00-0031235,L.Jackson,8.0,00-0034796,O.Beckham,00-0031235,O.Beckham,00-0031235,0,1,-1.60359258041717,0.370179342201885,4.99484717345331,3.0,1.0,1.0,0.979362010955811,2.06379890441895,2023-10-29,O.Beckham,2023,REG,BAL,8,00-0031235,WR,Odell Beckham,Odell,Beckham,,,,Shoulder,,Full Participation in Practice,2023-10-27T21:11:25Z,2023-10-27 21:11:25
2512,2023_06_NE_LV,2023101509,LV,NE,REG,6,LV,home,NE,LV,69.0,2023-10-15,459.0,1359.0,1359.0,Half2,0,12.0,0,3,3.0,0,07:39,LV 31,4,63.0,(7:39) (Shotgun) 7-B.Hoyer pass deep middle to 11-T.Tucker to NE 21 for 48 yards (31-Jo.Jones). NE-31-Jo.Jones was injured during the play.,pass,48.0,1,0,1.0,0,0,0,deep,middle,40.0,8.0,,,,,,,3,3,0.0,,,,,3.0,3.0,13,10,13.0,10.0,3.0,13.0,10.0,3.0,0.0096694706007838,0.147227361798286,0.0024211548734456,0.262202888727188,0.186800092458725,0.003160037798807,0.388518989086151,0.0,0.0,1.00440866034478,3.97879116528202,6.36491709924303,-6.36491709924303,-6.59921011864208,6.59921011864208,12.2064025795913,-12.2064025795913,3.4234774223296,0.555313742952421,3.4234774223296,0.555313742952421,14.6227446425939,-14.6227446425939,-3.35642478452064,3.35642478452064,14.4684832643718,-14.4684832643718,-4.5948496989546,4.5948496989546,0.686716616153717,0.313283383846283,0.686716616153717,0.313283383846283,0.101086676120758,0.11127507686615,0.11127507686615,0.787803292274475,0.212196707725525,0.68821531534195,0.68821531534195,-0.149951591312307,0.149951591312307,0.422318828500457,-0.422318828500457,0.0,0.101086676120758,0.0,0.101086676120758,0.027137917674728,-0.027137917674728,0.363693743944168,-0.363693743944168,0.027137917674728,-0.027137917674728,0.334651440382004,-0.334651440382004,0.0,0.0,1.0,0.0,1.0,0.0,0.0,0.0,0.0,0,0.0,0.0,0.0,0.0,0.0,0.0,0.0,0.0,0.0,0.0,0.0,0.0,0.0,0.0,1.0,0.0,0.0,0.0,0.0,0.0,0.0,0.0,0.0,1.0,0.0,0.0,0.0,0.0,0.0,0.0,0.0,0.0,0.0,0.0,0.0,1.0,0.0,0.0,0.0,0.0,0.0,00-0026625,B.Hoyer,48.0,00-0038563,T.Tucker,48.0,,,,,,,,,,,,,,,,,,,,,,,,,,,,,,,,,,,,,,,,,,,,,,NE,,00-0032580,,Jo.Jones,,,,,,,,,,,,,,0.0,,,,,,,,,,,,,,,,,,,,,,,,,,,,,,,,0.0,,,,,0,,,0.0,0.0,0.0,0.0,,,2023,0.407119661569595,59.2880338430405,32,1,First down,2512,"10/15/23, 16:05:31",2023-10-15T21:59:28.467Z,Allegiant Stadium,"Sunny Temp: 81° F, Humidity: 13%, Wind: NNE 5 mph",b07e0339-f053-11ed-b4a7-bab79e4492fa,0,0,PASS,0,,2023-10-15T21:59:34.907Z,,12,Field goal,2023-10-15T21:57:30.747Z,10.0,5:01,2.0,1.0,1.0,3.0,3.0,-10.0,KICKOFF,FIELD_GOAL,08:56,03:55,LV 25,NE 12,2440.0,2720.0,17,21,Home,4,38,3.0,41.5,0,dome,grass,,,Josh McDaniels,Bill Belichick,VEG00,Allegiant Stadium,0,1.0,B.Hoyer,7.0,,,T.Tucker,11.0,1,0,1.0,0,1,00-0026625,,00-0038563,B.Hoyer,7.0,00-0026625,T.Tucker,00-0038563,T.Tucker,00-0038563,0,1,3.97879116528202,1.00745962304962,12.551488137382,7.0,1.0,1.0,0.962866127490997,3.71338725090027,2023-10-15,Jo.Jones,2023,REG,NE,6,00-0032580,CB,Jonathan Jones,Jonathan,Jones,Ankle,,Questionable,Ankle,,Limited Participation in Practice,2023-10-13T18:26:48Z,2023-10-13 18:26:48
2507,2023_03_LA_CIN,2023092501,CIN,LA,REG,3,LA,away,CIN,CIN,21.0,2023-09-25,728.0,1628.0,1628.0,Half2,0,14.0,0,3,1.0,0,12:08,CIN 21,10,51.0,(12:08) 23-K.Williams right guard to CIN 17 for 4 yards (94-S.Hubbard). CIN-22-C.Awuzie was injured during the play.,run,4.0,0,0,0.0,0,0,0,,,,,right,guard,,,,,3,2,0.0,,,,,2.0,3.0,6,6,6.0,6.0,0.0,6.0,6.0,0.0,0.0029668121132999,0.0290916599333286,0.0005161649314686,0.0502454526722431,0.38644352555275,0.0009291309979744,0.529807209968567,0.0,0.0,4.42981383006554,-0.106738646747544,-6.24973798298743,6.24973798298743,-1.5987259974936,1.5987259974936,-1.24378325669776,1.24378325669776,,,0.0,0.0,-1.50369691225933,1.50369691225933,1.54144353227457,-1.54144353227457,11.0807428788394,-11.0807428788394,-12.2923575309872,12.2923575309872,0.598532497882843,0.401467502117157,0.401467502117157,0.598532497882843,-0.0093523263931274,0.0028468966484069,-0.0028468966484069,0.410819828510284,0.589180171489716,0.575043797492981,0.424956202507019,-0.0494600236415863,0.0494600236415863,-0.121033310890198,0.121033310890198,,,0.0,0.0,0.0775808990001679,-0.0775808990001679,-0.0426974296569824,0.0426974296569824,0.0775808990001679,-0.0775808990001679,-0.154099643230438,0.154099643230438,0.0,0.0,0.0,0.0,0.0,0.0,0.0,0.0,0.0,0,0.0,0.0,0.0,0.0,0.0,0.0,0.0,0.0,0.0,0.0,0.0,0.0,0.0,0.0,1.0,0.0,0.0,0.0,0.0,0.0,0.0,0.0,1.0,0.0,0.0,0.0,0.0,0.0,0.0,0.0,0.0,0.0,0.0,0.0,0.0,0.0,0.0,0.0,0.0,0.0,0.0,,,,,,,00-0037840,K.Williams,4.0,,,,,,,,,,,,,,,,,,,,,,,,,,,,,,,,,,,,,,,,,,,CIN,,00-0034834,,S.Hubbard,,,,,,,,,,,,,,0.0,,,,,,,,,,,,,,,,,,,,,,,,,,,,,,,,0.0,,,,,0,,,0.0,0.0,0.0,0.0,,,2023,,,33,0,Field goal,2507,"9/25/23, 20:15:18",2023-09-26T02:04:25.330Z,Paycor Stadium,"Mostly clear Temp: 71° F, Humidity: 70%, Wind: ENE 5 mph",b07d2ff3-f053-11ed-b4a7-bab79e4492fa,0,0,RUSH,0,,2023-09-26T02:04:29.467Z,,14,Field goal,2023-09-26T01:58:28.007Z,7.0,4:23,3.0,1.0,1.0,3.0,3.0,9.0,KICKOFF,FIELD_GOAL,15:00,10:37,LA 25,CIN 24,2318.0,2582.0,16,19,Home,3,35,3.0,45.5,0,outdoors,fieldturf,74.0,7.0,Zac Taylor,Sean McVay,CIN00,Paycor Stadium,0,0.0,,,K.Williams,23.0,,,0,1,0.0,0,1,,00-0037840,,K.Williams,23.0,00-0037840,K.Williams,00-0037840,K.Williams,00-0037840,0,1,-0.106738646747544,,,,,,0.412059247493744,-41.2059247493744,2023-09-25,C.Awuzie,2023,REG,CIN,3,00-0033548,CB,Chidobe Awuzie,Chidobe,Awuzie,,,,Not injury related - resting player,,Limited Participation in Practice,2023-09-23T18:36:29Z,2023-09-23 18:36:29
2498,2023_18_PIT_BAL,2024010600,BAL,PIT,REG,18,BAL,home,PIT,BAL,68.0,2024-01-06,254.0,1154.0,1154.0,Half2,0,17.0,0,3,2.0,0,04:14,BAL 32,8,31.0,(4:14) (Shotgun) 2-T.Huntley pass short right to 15-N.Agholor to BAL 48 for 16 yards (93-M.Robinson). PIT-90-T.Watt was injured during the play.,pass,16.0,1,0,1.0,0,0,0,short,right,15.0,1.0,,,,,,,3,3,0.0,,,,,3.0,3.0,7,7,7.0,7.0,0.0,7.0,7.0,0.0,0.0256289783865213,0.132749229669571,0.0021338567603379,0.233465999364853,0.21142490208149,0.0027009432669729,0.391896069049835,0.0,0.0,1.3461716780439,1.53739481116645,1.76102696498856,-1.76102696498856,-8.2451179890777,8.2451179890777,7.65043751330813,-7.65043751330813,1.48451323085465,0.052881580311805,1.48451323085465,0.052881580311805,15.2769385958673,-15.2769385958673,-4.99741755053401,4.99741755053401,12.3520743253757,-12.3520743253757,-5.09856297809165,5.09856297809165,0.555349707603455,0.444650292396545,0.555349707603455,0.444650292396545,0.0463392734527588,0.0611605644226074,0.0611605644226074,0.601688981056213,0.398311018943787,0.430471122264862,0.430471122264862,-0.1489348516679,0.1489348516679,0.180715194136973,-0.180715194136973,0.0,0.0463392734527588,0.0,0.0463392734527588,0.081738144159317,-0.081738144159317,0.107020666987773,-0.107020666987773,0.0764926075935364,-0.0764926075935364,0.0034142343114572,-0.0034142343114572,0.0,0.0,1.0,0.0,0.0,0.0,0.0,0.0,0.0,0,0.0,0.0,0.0,0.0,0.0,0.0,0.0,0.0,0.0,0.0,0.0,0.0,0.0,0.0,1.0,0.0,0.0,0.0,0.0,0.0,0.0,0.0,0.0,1.0,0.0,0.0,0.0,0.0,0.0,0.0,0.0,0.0,0.0,0.0,0.0,1.0,0.0,0.0,0.0,0.0,0.0,00-0035993,T.Huntley,16.0,00-0031549,N.Agholor,16.0,,,,,,,,,,,,,,,,,,,,,,,,,,,,,,,,,,,,,,,,,,,,,,PIT,,00-0037316,,M.Robinson,,,,,,,,,,,,,,0.0,,,,,,,,,,,,,,,,,,,,,,,,,,,,,,,,0.0,,,,,0,,,0.0,0.0,0.0,0.0,,,2023,0.592427134513855,40.7572865486145,33,1,First down,2498,"1/6/24, 16:32:24",2024-01-06T23:32:05.647Z,M&T Bank Stadium,"Rain Temp: 38° F, Humidity: 91%, Wind: ENE 15 mph",cbafddf8-f053-11ed-b4a7-bab79e4492fa,0,0,PASS,0,,2024-01-06T23:32:12.877Z,,17,Punt,2024-01-06T23:30:08.060Z,7.0,2:42,2.0,0.0,0.0,3.0,3.0,0.0,PUNT,PUNT,05:32,02:50,BAL 18,BAL 49,2428.0,2594.0,17,10,Home,-7,27,-3.0,34.0,1,outdoors,grass,38.0,15.0,John Harbaugh,Mike Tomlin,BAL00,M&T Bank Stadium,0,1.0,T.Huntley,2.0,,,N.Agholor,15.0,1,0,1.0,0,1,00-0035993,,00-0031549,T.Huntley,2.0,00-0035993,N.Agholor,00-0031549,N.Agholor,00-0031549,0,0,1.53739481116645,0.208266727319331,3.78468766425794,1.0,1.0,1.0,0.719218373298645,28.0781626701355,2024-01-06,T.Watt,2023,REG,PIT,18,00-0033886,LB,T.J. Watt,T.J.,Watt,,,,Not injury related - resting player,,Limited Participation in Practice,2024-01-04T20:49:21Z,2024-01-04 20:49:21
2493,2023_14_NE_PIT,2023120700,PIT,NE,REG,14,NE,away,PIT,NE,80.0,2023-12-07,471.0,1371.0,1371.0,Half2,0,16.0,0,3,1.0,0,07:51,NE 20,10,11.0,(7:51) 4-B.Zappe pass short middle to 15-E.Elliott to NE 36 for 16 yards (51-Ni.Herbig; 40-B.Martinez). PIT-95-K.Benton was injured during the play.,pass,16.0,0,0,1.0,0,0,0,short,middle,-1.0,17.0,,,,,,,3,3,0.0,,,,,3.0,3.0,10,21,21.0,10.0,11.0,21.0,10.0,11.0,0.0154824303463101,0.155912905931473,0.0024181550834327,0.289460986852646,0.198161214590073,0.0032873800955712,0.335276961326599,0.0,0.0,0.449195197317749,1.15700347162783,-15.5216228023357,15.5216228023357,-3.43870681489352,3.43870681489352,-17.9884346832071,17.9884346832071,-0.879196565132588,2.03620003676042,-0.879196565132588,2.03620003676042,-5.79260336223524,5.79260336223524,-3.82441710570129,3.82441710570129,-1.40818141348427,1.40818141348427,-13.3821371893282,13.3821371893282,0.863046824932098,0.136953175067902,0.136953175067902,0.863046824932098,0.0190629363059998,0.0197063684463501,-0.0197063684463501,0.117890238761902,0.882109761238098,0.7668816447258,0.2331183552742,-0.115313678979874,0.115313678979874,-0.464539345384502,0.464539345384502,0.0,0.0190629363059998,0.0,0.0190629363059998,-0.143036611418005,0.143036611418005,-0.205235216757444,0.205235216757444,-0.14672911916184,0.14672911916184,-0.280160535117773,0.280160535117773,0.0,0.0,1.0,0.0,0.0,0.0,0.0,0.0,0.0,0,0.0,0.0,0.0,0.0,0.0,0.0,0.0,0.0,0.0,0.0,0.0,0.0,0.0,0.0,0.0,0.0,0.0,0.0,0.0,0.0,0.0,0.0,0.0,1.0,0.0,0.0,0.0,0.0,0.0,0.0,0.0,0.0,0.0,0.0,0.0,1.0,1.0,0.0,0.0,0.0,0.0,00-0038108,B.Zappe,16.0,00-0033045,E.Elliott,16.0,,,,,,,,,,,,,,,,,,,,,,,,,,,,,,,,,,,,,,,,,,,,,,,,,,,,00-0038577,Ni.Herbig,PIT,00-0032408,B.Martinez,PIT,,,,,,,0.0,,,,,,,,,,,,,,,,,,,,,,,,,,,,,,,,0.0,,,,,0,,,0.0,0.0,0.0,0.0,,,2023,0.823061406612396,17.6938593387604,34,1,First down,2493,"12/7/23, 20:16:05",2023-12-08T03:09:26.653Z,Acrisure Stadium,"Partly Cloudy Temp: 42° F, Humidity: 71%, Wind: SW 5 mph",cbae6a14-f053-11ed-b4a7-bab79e4492fa,0,0,PASS,0,,2023-12-08T03:09:36.893Z,,16,Punt,2023-12-08T03:09:26.653Z,4.0,2:39,1.0,0.0,0.0,3.0,3.0,-10.0,PUNT,PUNT,07:51,05:12,NE 20,NE 31,2493.0,2636.0,21,18,Home,-3,39,6.0,30.0,0,outdoors,grass,42.0,5.0,Mike Tomlin,Bill Belichick,PIT00,Acrisure Stadium,0,1.0,B.Zappe,4.0,,,E.Elliott,15.0,1,0,1.0,0,1,00-0038108,,00-0033045,B.Zappe,4.0,00-0038108,E.Elliott,00-0033045,E.Elliott,00-0033045,0,0,1.15700347162783,1.07979350627629,7.84779426001478,6.0,0.577923994511366,0.22345769405365,0.424965620040894,57.5034379959106,2023-12-07,K.Benton,2023,REG,PIT,14,00-0039110,DT,Keeanu Benton,Keeanu,Benton,,,,Oblique,,Limited Participation in Practice,2023-12-06T21:01:40Z,2023-12-06 21:01:40
2474,2023_04_MIN_CAR,2023100102,CAR,MIN,REG,4,CAR,home,MIN,CAR,51.0,2023-10-01,406.0,1306.0,1306.0,Half2,0,12.0,0,3,3.0,0,06:46,CAR 49,11,38.0,(6:46) (Shotgun) 9-B.Young pass short middle to 19-A.Thielen to MIN 38 for 13 yards (7-B.Murphy). MIN-44-J.Metellus was injured during the play.,pass,13.0,1,0,1.0,0,0,0,short,middle,13.0,0.0,,,,,,,3,3,0.0,,,,,3.0,3.0,13,7,13.0,7.0,6.0,13.0,7.0,6.0,0.0139140691608191,0.140368327498436,0.001709230360575,0.231251046061516,0.236959367990494,0.0050607579760253,0.370737224817276,0.0,0.0,1.2728794279974,2.4446847543586,9.39440707024187,-9.39440707024187,-7.05577953072498,7.05577953072498,15.7432637335922,-15.7432637335922,2.4446847543586,0.0,2.4446847543586,0.0,-6.37609923956916,6.37609923956916,3.43355167946851,-3.43355167946851,-6.65905368185486,6.65905368185486,19.8766763796928,-19.8766763796928,0.750713706016541,0.249286293983459,0.750713706016541,0.249286293983459,0.0727939605712891,0.08446204662323,0.08446204662323,0.82350766658783,0.17649233341217,0.651299476623535,0.651299476623535,-0.106665909290314,0.106665909290314,0.530196862257905,-0.530196862257905,0.0727939605712891,0.0,0.0727939605712891,0.0,-0.175221581268528,0.175221581268528,0.0457137376070023,-0.0457137376070023,-0.175221581268528,0.175221581268528,0.589673495139287,-0.589673495139287,0.0,0.0,1.0,0.0,1.0,0.0,0.0,0.0,0.0,0,0.0,0.0,0.0,0.0,0.0,0.0,0.0,0.0,0.0,0.0,0.0,0.0,0.0,0.0,1.0,0.0,0.0,0.0,0.0,0.0,0.0,0.0,0.0,1.0,0.0,0.0,0.0,0.0,0.0,0.0,0.0,0.0,0.0,0.0,0.0,1.0,0.0,0.0,0.0,0.0,0.0,00-0039150,B.Young,13.0,00-0030035,A.Thielen,13.0,,,,,,,,,,,,,,,,,,,,,,,,,,,,,,,,,,,,,,,,,,,,,,MIN,,00-0035236,,B.Murphy,,,,,,,,,,,,,,0.0,,,,,,,,,,,,,,,,,,,,,,,,,,,,,,,,0.0,,,,,0,,,0.0,0.0,0.0,0.0,,,2023,0.664417684078217,33.5582315921783,33,1,First down,2474,"10/1/23, 13:02:51",2023-10-01T18:49:59.427Z,Bank of America Stadium,"Sunny Temp: 80° F, Humidity: 50%, Wind: SSW 7 mph",b07d41f8-f053-11ed-b4a7-bab79e4492fa,0,0,PASS,0,,2023-10-01T18:50:05.397Z,,12,Opp touchdown,2023-10-01T18:46:12.733Z,10.0,6:27,6.0,0.0,1.0,3.0,3.0,0.0,PUNT,FUMBLE,10:25,03:58,CAR 13,MIN 28,2320.0,2632.0,21,13,Home,-8,34,-4.5,46.5,0,outdoors,grass,78.0,7.0,Frank Reich,Kevin O'Connell,CAR00,Bank of America Stadium,0,1.0,B.Young,9.0,,,A.Thielen,19.0,1,0,1.0,0,1,00-0039150,,00-0030035,B.Young,9.0,00-0039150,A.Thielen,00-0030035,A.Thielen,00-0030035,0,0,2.4446847543586,0.237607095976617,4.03253371833125,2.0,0.999049699137686,0.997586340614362,0.976016044616699,2.39839553833008,2023-10-01,J.Metellus,2023,REG,MIN,4,00-0036348,S,Josh Metellus,Josh,Metellus,,,,Shoulder,,Full Participation in Practice,2023-09-29T18:43:19Z,2023-09-29 18:43:19
2449,2023_14_TB_ATL,2023121000,ATL,TB,REG,14,TB,away,ATL,TB,87.0,2023-12-10,598.0,1498.0,1498.0,Half2,0,16.0,0,3,3.0,0,09:58,TB 13,6,4.0,(9:58) (Shotgun) 6-B.Mayfield pass incomplete short left to 14-C.Godwin. TB-14-C.Godwin was injured during the play.,pass,0.0,1,0,1.0,0,0,0,short,left,5.0,,,,,,,,3,2,0.0,,,,,2.0,3.0,10,12,12.0,10.0,2.0,12.0,10.0,2.0,0.0071712997741997,0.21901336312294,0.0027885469608008,0.382071048021317,0.148591488599777,0.0047542816027998,0.235609948635101,0.0,0.0,-1.232561849989,-1.23652611626312,0.159311160678044,-0.159311160678044,6.7953282281748,-6.7953282281748,-1.25249328568422,1.25249328568422,-0.582427898421884,-0.654098217841238,0.0,0.0,7.93709974730155,-7.93709974730155,0.442891250539105,-0.442891250539105,5.90305599471321,-5.90305599471321,-3.91603813585123,3.91603813585123,0.532262325286865,0.467737674713135,0.467737674713135,0.532262325286865,-0.0424022376537323,-0.0405513644218445,0.0405513644218445,0.510139912366867,0.489860087633133,0.551919341087341,0.448080658912659,0.154972611404644,-0.154972611404644,0.0046088347687076,-0.0046088347687076,-0.0025689601898193,-0.039833277463913,0.0,0.0,0.0899120569229126,-0.0899120569229126,0.242940212274964,-0.242940212274964,0.0943145751953125,-0.0943145751953125,0.069673414017136,-0.069673414017136,0.0,0.0,0.0,0.0,0.0,1.0,0.0,0.0,1.0,0,0.0,0.0,0.0,0.0,0.0,0.0,0.0,0.0,0.0,0.0,0.0,0.0,0.0,0.0,0.0,0.0,0.0,0.0,0.0,0.0,0.0,0.0,0.0,1.0,0.0,0.0,0.0,0.0,0.0,0.0,0.0,0.0,0.0,0.0,0.0,0.0,0.0,0.0,0.0,0.0,0.0,00-0034855,B.Mayfield,,00-0033921,C.Godwin,,,,,,,,,,,,,,,,,,,,,,,,,,,,,,,,,,,,,,,,,,,,,,,,,,,,,,,,,,,,,,,,,0.0,,,,,,,,,,,,,,,,,,,,,,,,,,,,,,,,0.0,,,,,0,,,0.0,0.0,0.0,0.0,,,2023,0.719145655632019,-71.9145655632019,30,0,Punt,2449,"12/10/23, 13:02:44",2023-12-10T19:55:46.660Z,Mercedes-Benz Stadium,"Indoors Temp: 68° F, Humidity: 40%, Wind: 0 mph",cbae6f45-f053-11ed-b4a7-bab79e4492fa,0,0,PASS,0,,2023-12-10T19:55:51.297Z,,16,Punt,2023-12-10T19:51:57.720Z,3.0,1:14,0.0,0.0,0.0,3.0,3.0,0.0,PUNT,PUNT,10:59,09:45,TB 9,TB 13,2390.0,2490.0,29,25,Home,-4,54,1.5,41.5,1,closed,fieldturf,,,Arthur Smith,Todd Bowles,ATL97,Mercedes-Benz Stadium,0,0.0,B.Mayfield,6.0,,,C.Godwin,14.0,1,0,0.0,0,1,00-0034855,,00-0033921,B.Mayfield,6.0,00-0034855,C.Godwin,00-0033921,C.Godwin,00-0033921,0,0,-1.23652611626312,1.61682767981423,3.87202360335505,2.0,0.653465805808082,0.653465805808082,0.971769392490387,2.8230607509613,2023-12-10,C.Godwin,2023,REG,TB,14,00-0033921,WR,Chris Godwin,Chris,Godwin,,,,Not injury related - resting player,,Full Participation in Practice,2023-12-08T18:26:00Z,2023-12-08 18:26:00
2429,2023_09_ARI_CLE,2023110503,CLE,ARI,REG,9,CLE,home,ARI,CLE,55.0,2023-11-05,682.0,1582.0,1582.0,Half2,0,15.0,0,3,1.0,0,11:22,CLE 45,10,9.0,(11:22) 53-N.Harris reported in as eligible. 27-K.Hunt left guard to CLE 46 for 1 yard (25-Z.Collins). CLE-71-J.Wills was injured during the play. He is Out.,run,1.0,0,0,0.0,0,0,0,,,,,left,guard,,,,,3,3,0.0,,,,,3.0,3.0,13,0,13.0,0.0,13.0,13.0,0.0,13.0,0.0062774457037448,0.0976774021983147,0.0015259678475558,0.158060565590858,0.247166022658348,0.0044195679947733,0.484872967004776,0.0,0.0,2.74193987157196,-0.453794165048748,16.9347177882306,-16.9347177882306,3.54655916150659,-3.54655916150659,10.424630280865,-10.424630280865,,,0.0,0.0,1.75194771710085,-1.75194771710085,8.43991908820028,-8.43991908820028,11.4719332491513,-11.4719332491513,-1.81959397696044,1.81959397696044,0.944237947463989,0.0557620525360107,0.944237947463989,0.0557620525360107,-0.0045978426933288,-0.0019283294677734,-0.0019283294677734,0.93964010477066,0.0603598952293396,0.983890354633331,0.983890354633331,0.1238923817873,-0.1238923817873,0.250440238152822,-0.250440238152822,,,0.0,0.0,0.0268832576621373,-0.0268832576621373,0.214975193142891,-0.214975193142891,0.0268832576621373,-0.0268832576621373,0.19029575586319,-0.19029575586319,0.0,0.0,0.0,0.0,0.0,0.0,0.0,0.0,0.0,0,0.0,0.0,0.0,0.0,0.0,0.0,0.0,0.0,0.0,0.0,0.0,0.0,0.0,0.0,1.0,0.0,0.0,0.0,0.0,0.0,0.0,0.0,1.0,0.0,0.0,0.0,0.0,0.0,0.0,0.0,0.0,0.0,0.0,0.0,0.0,0.0,0.0,0.0,0.0,0.0,0.0,,,,,,,00-0033923,K.Hunt,1.0,,,,,,,,,,,,,,,,,,,,,,,,,,,,,,,,,,,,,,,,,,,ARI,,00-0036933,,Z.Collins,,,,,,,,,,,,,,0.0,,,,,,,,,,,,,,,,,,,,,,,,,,,,,,,,0.0,,,,,0,,,0.0,0.0,0.0,0.0,,,2023,,,28,0,Punt,2429,"11/5/23, 13:02:26",2023-11-05T19:54:44.447Z,Cleveland Browns Stadium,"Sunny Temp: 56° F, Humidity: 58%, Wind: N 7 mph",b07eb9ec-f053-11ed-b4a7-bab79e4492fa,0,0,RUSH,0,,2023-11-05T19:54:48.763Z,,15,Punt,2023-11-05T19:50:55.720Z,5.0,2:51,1.0,0.0,0.0,3.0,3.0,0.0,PUNT,PUNT,12:29,09:38,CLE 34,CLE 43,2373.0,2523.0,0,27,Home,27,27,13.0,38.0,0,outdoors,grass,56.0,7.0,Kevin Stefanski,Jonathan Gannon,CLE00,FirstEnergy Stadium,0,0.0,,,K.Hunt,27.0,,,0,1,0.0,0,1,,00-0033923,,K.Hunt,27.0,00-0033923,K.Hunt,00-0033923,K.Hunt,00-0033923,0,0,-0.453794165048748,,,,,,0.473216682672501,-47.3216682672501,2023-11-05,J.Wills,2023,REG,CLE,9,00-0036267,T,Jedrick Wills,Jedrick,Wills,,,,Foot,Ankle,Full Participation in Practice,2023-11-03T19:12:28Z,2023-11-03 19:12:28
2404,2023_09_ARI_CLE,2023110503,CLE,ARI,REG,9,CLE,home,ARI,CLE,64.0,2023-11-05,707.0,1607.0,1607.0,Half2,0,15.0,0,3,2.0,0,11:47,CLE 36,8,9.0,(11:47) (Shotgun) 4-D.Watson pass short right to 34-J.Ford to CLE 45 for 9 yards (92-K.Strong; 21-G.Williams). ARI-92-K.Strong was injured during the play.,pass,9.0,1,0,1.0,0,0,0,short,right,-6.0,15.0,,,,,,,3,3,0.0,,,,,3.0,3.0,13,0,13.0,0.0,13.0,13.0,0.0,13.0,0.0063708326779305,0.126770362257957,0.0020018154755234,0.220032230019569,0.223563194274902,0.0043226163834333,0.416938930749893,0.0,0.0,1.67336700297892,1.06857286859304,17.3885119532793,-17.3885119532793,4.00035332655534,-4.00035332655534,10.424630280865,-10.424630280865,-1.69249486131594,2.76106772990897,-1.69249486131594,2.76106772990897,1.75194771710085,-1.75194771710085,8.43991908820028,-8.43991908820028,11.4719332491513,-11.4719332491513,-1.81959397696044,1.81959397696044,0.937624335289001,0.0623756647109985,0.937624335289001,0.0623756647109985,0.0066136121749877,0.0031436681747436,0.0031436681747436,0.944237947463989,0.0557620525360107,0.980746686458588,0.980746686458588,0.128490224480629,-0.128490224480629,0.250440238152822,-0.250440238152822,0.0,0.0066136121749877,0.0,0.0066136121749877,0.0268832576621373,-0.0268832576621373,0.214975193142891,-0.214975193142891,0.0268832576621373,-0.0268832576621373,0.19029575586319,-0.19029575586319,0.0,0.0,1.0,0.0,0.0,0.0,0.0,0.0,0.0,0,0.0,0.0,0.0,0.0,0.0,0.0,0.0,0.0,0.0,0.0,0.0,0.0,0.0,0.0,0.0,0.0,0.0,0.0,0.0,0.0,0.0,0.0,0.0,1.0,0.0,0.0,0.0,0.0,0.0,0.0,0.0,0.0,0.0,0.0,0.0,1.0,1.0,0.0,0.0,0.0,0.0,00-0033537,D.Watson,9.0,00-0037267,J.Ford,9.0,,,,,,,,,,,,,,,,,,,,,,,,,,,,,,,,,,,,,,,,,,,,,,,,,,,,00-0035334,K.Strong,ARI,00-0039007,G.Williams,ARI,,,,,,,0.0,,,,,,,,,,,,,,,,,,,,,,,,,,,,,,,,0.0,,,,,0,,,0.0,0.0,0.0,0.0,,,2023,0.875135779380798,12.4864220619202,27,1,First down,2404,"11/5/23, 13:02:26",2023-11-05T19:51:37.660Z,Cleveland Browns Stadium,"Sunny Temp: 56° F, Humidity: 58%, Wind: N 7 mph",b07eb9ec-f053-11ed-b4a7-bab79e4492fa,0,0,PASS,0,,2023-11-05T19:51:45.097Z,,15,Punt,2023-11-05T19:50:55.720Z,5.0,2:51,1.0,0.0,0.0,3.0,3.0,0.0,PUNT,PUNT,12:29,09:38,CLE 34,CLE 43,2373.0,2523.0,0,27,Home,27,27,13.0,38.0,0,outdoors,grass,56.0,7.0,Kevin Stefanski,Jonathan Gannon,CLE00,FirstEnergy Stadium,0,1.0,D.Watson,4.0,,,J.Ford,34.0,1,0,1.0,0,1,00-0033537,,00-0037267,D.Watson,4.0,00-0033537,J.Ford,00-0037267,J.Ford,00-0037267,0,0,1.06857286859304,1.64002641880478,11.2957574323518,10.0,0.388381181342993,0.270058387948666,0.746891975402832,25.3108024597168,2023-11-05,K.Strong,2023,REG,ARI,9,00-0035334,DT,Kevin Strong,Kevin,Strong,Shoulder,,Questionable,Shoulder,,Limited Participation in Practice,2023-11-03T19:26:53Z,2023-11-03 19:26:53
2395,2023_17_CAR_JAX,2023123106,JAX,CAR,REG,17,JAX,home,CAR,JAX,52.0,2023-12-31,448.0,1348.0,1348.0,Half2,0,15.0,0,3,3.0,0,07:28,JAX 48,5,67.0,(7:28) (Shotgun) 3-C.Beathard scrambles up the middle to CAR 33 for 19 yards (98-M.Haynes). CAR-98-M.Haynes was injured during the play.,run,19.0,1,0,1.0,0,0,1,,,,,middle,,,,,,3,3,0.0,,,,,3.0,3.0,16,0,16.0,0.0,16.0,16.0,0.0,16.0,0.0129613941535354,0.122053362429142,0.0015445435419678,0.21202377974987,0.231207236647606,0.0051892595365643,0.415020436048508,0.0,0.0,1.75572764873505,2.2248303105589,22.2779935841541,-22.2779935841541,4.81584005715558,-4.81584005715558,15.0226424498333,-15.0226424498333,,,0.0,0.0,4.06851357297273,-4.06851357297273,5.05595349968644,-5.05595349968644,7.91449488059152,-7.91449488059152,1.70831043595413,-1.70831043595413,0.951988577842712,0.0480114221572876,0.951988577842712,0.0480114221572876,0.0135683417320251,0.0094665884971618,0.0094665884971618,0.965556919574738,0.0344430804252625,0.959669589996338,0.959669589996338,-0.0024590757856448,0.0024590757856448,0.33956491574645,-0.33956491574645,,,0.0,0.0,0.0414504706859589,-0.0414504706859589,0.254850596189499,-0.254850596189499,0.0433734953403473,-0.0433734953403473,0.222457375377417,-0.222457375377417,0.0,1.0,0.0,0.0,1.0,0.0,0.0,0.0,0.0,0,0.0,0.0,0.0,0.0,0.0,0.0,0.0,0.0,0.0,0.0,0.0,0.0,0.0,0.0,1.0,0.0,0.0,0.0,0.0,0.0,0.0,0.0,1.0,0.0,0.0,0.0,0.0,0.0,0.0,0.0,0.0,0.0,0.0,0.0,0.0,0.0,0.0,0.0,0.0,0.0,0.0,,,,,,,00-0033936,C.Beathard,19.0,,,,,,,,,,,,,,,,,,,,,,,,,,,,,,,,,,,,,,,,,,,CAR,,00-0034382,,M.Haynes,,,,,,,,,,,,,,0.0,,,,,,,,,,,,,,,,,,,,,,,,,,,,,,,,0.0,,,,,0,,,0.0,0.0,0.0,0.0,,,2023,,,28,1,First down,2395,"12/31/23, 13:02:39",2023-12-31T19:53:29.380Z,EverBank Stadium,"Temp: 56° F, Humidity: 47%, Wind: W 8 mph",cbafa1ff-f053-11ed-b4a7-bab79e4492fa,0,0,RUSH,0,,2023-12-31T19:53:37.223Z,,15,Field goal,2023-12-31T19:49:44.553Z,12.0,7:24,4.0,1.0,1.0,3.0,3.0,15.0,PUNT,FIELD_GOAL,10:24,03:00,JAX 17,CAR 16,2261.0,2567.0,0,26,Home,26,26,3.5,38.0,0,outdoors,grass,56.0,8.0,Doug Pederson,Chris Tabor,JAX00,TIAA Bank Stadium,0,1.0,C.Beathard,3.0,,3.0,,,1,0,1.0,0,1,00-0033936,,,C.Beathard,3.0,00-0033936,C.Beathard,00-0033936,C.Beathard,00-0033936,0,1,2.2248303105589,,,,,,0.961505770683289,3.84942293167114,2023-12-31,M.Haynes,2023,REG,CAR,17,00-0034382,LB,Marquis Haynes,Marquis,Haynes,Back,,Questionable,Back,,Full Participation in Practice,2023-12-29T18:54:43Z,2023-12-29 18:54:43
2372,2023_18_ATL_NO,2024010700,NO,ATL,REG,18,NO,home,ATL,ATL,25.0,2024-01-07,816.0,1716.0,1716.0,Half2,0,12.0,0,3,1.0,0,13:36,ATL 25,10,25.0,"(13:36) 73-M.Garcia reported in as eligible. 21-J.Williams left tackle to ATL 26 for -1 yards (21-M.Hughes). ATL-93-C.Campbell was injured during the play. INJURY UPDATE: ATL-55 K.Elliss, knee, out.",run,-1.0,0,0,0.0,0,0,0,,,,,left,tackle,,,,,3,3,0.0,,,,,3.0,3.0,17,17,17.0,17.0,0.0,17.0,17.0,0.0,0.0014679835876449,0.0262395385652781,0.0009114057174883,0.045249205082655,0.323039770126343,0.0007830096874386,0.602309107780457,0.0,0.0,4.78956322150771,-0.782677486538887,3.16394066083012,-3.16394066083012,1.94361699659562,-1.94361699659562,-2.2131160276408,2.2131160276408,,,0.0,0.0,5.46327135805723,-5.46327135805723,-7.56114465085557,7.56114465085557,2.80046598969012,-2.80046598969012,-2.18816394900205,2.18816394900205,0.667952239513397,0.332047760486603,0.667952239513397,0.332047760486603,-0.0256437659263611,-0.0229941010475159,-0.0229941010475159,0.642308473587036,0.357691526412964,0.713521242141724,0.713521242141724,0.100755717416968,-0.100755717416968,-0.192446740121622,0.192446740121622,,,0.0,0.0,-0.0014002442746019,0.0014002442746019,-0.177268852404866,0.177268852404866,-0.0014002442746019,0.0014002442746019,-0.108813871554646,0.108813871554646,0.0,0.0,0.0,0.0,0.0,0.0,0.0,0.0,0.0,0,0.0,0.0,0.0,0.0,0.0,0.0,0.0,0.0,0.0,0.0,0.0,0.0,0.0,0.0,1.0,0.0,0.0,1.0,0.0,0.0,0.0,0.0,1.0,0.0,0.0,0.0,0.0,0.0,0.0,0.0,0.0,0.0,0.0,0.0,0.0,0.0,0.0,0.0,0.0,0.0,0.0,,,,,,,00-0033948,J.Williams,-1.0,,,,,,,,,,,,,,,,,,,,,,,,,,,,,00-0034843,M.Hughes,,,,,,,,,,,,,ATL,,00-0034843,,M.Hughes,,,,,,,,,,,,,,0.0,,,,,,,,,,,,,,,,,,,,,,,,,,,,,,,,0.0,,,,,0,,,0.0,0.0,0.0,0.0,,,2023,,,30,1,Touchdown,2372,"1/7/24, 13:02:38",2024-01-07T19:46:40.690Z,Caesars Superdome,"Partly Cloudy Temp: 52° F, Humidity: 70%, Wind: N 10 mph",cbb01207-f053-11ed-b4a7-bab79e4492fa,0,0,RUSH,0,,2024-01-07T19:46:44.497Z,,12,Touchdown,2024-01-07T19:46:40.690Z,2.0,0:35,1.0,0.0,1.0,3.0,3.0,0.0,INTERCEPTION,TOUCHDOWN,13:36,13:01,ATL 25,ATL 26,2372.0,2441.0,17,48,Home,31,65,3.5,41.5,1,dome,sportturf,,,Dennis Allen,Arthur Smith,NOR00,Mercedes-Benz Superdome,0,0.0,,,J.Williams,21.0,,,0,1,0.0,0,1,,00-0033948,,J.Williams,21.0,00-0033948,J.Williams,00-0033948,J.Williams,00-0033948,0,1,-0.782677486538887,,,,,,0.394772559404373,-39.4772559404373,2024-01-07,C.Campbell,2023,REG,ATL,18,00-0026190,DE,Calais Campbell,Calais,Campbell,,,,Not injury related - resting player,,Did Not Participate In Practice,2024-01-03T21:05:19Z,2024-01-03 21:05:19
2366,2023_18_KC_LAC,2024010709,LAC,KC,REG,18,LAC,home,KC,KC,49.0,2024-01-07,858.0,1758.0,1758.0,Half2,0,12.0,0,3,2.0,0,14:18,KC 49,4,-2.0,(14:18) (Shotgun) 2-E.Stick right end to KC 48 for 1 yard (54-L.Chenal). LAC-79-T.Pipkins was injured during the play.,run,1.0,1,0,0.0,0,0,0,,,,,right,end,,,,,3,3,0.0,,,,,3.0,3.0,6,10,6.0,10.0,-4.0,6.0,10.0,-4.0,0.0036433767527341,0.0888181254267693,0.0013364979531616,0.138114288449287,0.242525056004524,0.0042271483689546,0.521335482597351,0.0,0.0,3.1494504516013,-0.759370015468448,-4.08809964027221,4.08809964027221,2.60253433592152,-2.60253433592152,-11.8184571291223,11.8184571291223,,,0.0,0.0,-3.64315705326209,3.64315705326209,-0.263394671317656,0.263394671317656,9.54198385071885,-9.54198385071885,-11.9013349651489,11.9013349651489,0.429300457239151,0.570699542760849,0.429300457239151,0.570699542760849,-0.0056733191013336,-0.001444399356842,-0.001444399356842,0.423627138137817,0.576372861862183,0.48514261841774,0.48514261841774,0.0404118299484253,-0.0404118299484253,-0.322152174158427,0.322152174158427,,,0.0,0.0,0.0274111330509186,-0.0274111330509186,-0.0847470760345459,0.0847470760345459,0.0274111330509186,-0.0274111330509186,-0.0656278729438782,0.0656278729438782,0.0,0.0,0.0,0.0,0.0,0.0,0.0,0.0,0.0,0,0.0,0.0,0.0,0.0,0.0,0.0,0.0,0.0,0.0,0.0,0.0,0.0,0.0,0.0,1.0,0.0,0.0,0.0,0.0,0.0,0.0,0.0,1.0,0.0,0.0,0.0,0.0,0.0,0.0,0.0,0.0,0.0,0.0,0.0,0.0,0.0,0.0,0.0,0.0,0.0,0.0,,,,,,,00-0035282,E.Stick,1.0,,,,,,,,,,,,,,,,,,,,,,,,,,,,,,,,,,,,,,,,,,,KC,,00-0037819,,L.Chenal,,,,,,,,,,,,,,0.0,,,,,,,,,,,,,,,,,,,,,,,,,,,,,,,,0.0,,,,,0,,,0.0,0.0,0.0,0.0,,,2023,,,29,0,Punt,2366,"1/7/24, 16:25:19",2024-01-07T23:05:41.207Z,SoFi Stadium,"Clear Temp: 57° F, Humidity: 28%, Wind: NNW 7 mph",cbaffd24-f053-11ed-b4a7-bab79e4492fa,0,0,RUSH,0,,2024-01-07T23:05:45.477Z,,12,Punt,2024-01-07T23:04:23.227Z,3.0,1:53,0.0,0.0,0.0,3.0,3.0,0.0,KICKOFF,PUNT,15:00,13:07,LAC 45,LAC 43,2316.0,2436.0,13,12,Home,-1,25,3.5,35.0,1,dome,matrixturf,,,Giff Smith,Andy Reid,LAX01,SoFi Stadium,0,0.0,,,E.Stick,2.0,,,0,1,0.0,0,1,,00-0035282,,E.Stick,2.0,00-0035282,E.Stick,00-0035282,E.Stick,00-0035282,0,0,-0.759370015468448,,,,,,0.42461633682251,-42.461633682251,2024-01-07,T.Pipkins,2023,REG,LAC,18,00-0035688,T,Trey Pipkins,Trey,Pipkins,,,,Wrist,,Full Participation in Practice,2024-01-05T20:04:51Z,2024-01-05 20:04:51
2328,2023_12_CLE_DEN,2023112607,DEN,CLE,REG,12,DEN,home,CLE,DEN,75.0,2023-11-26,900.0,1800.0,1800.0,Half2,0,11.0,0,3,1.0,0,15:00,DEN 25,10,6.0,(15:00) 3-R.Wilson pass short left to 33-J.Williams to DEN 27 for 2 yards (42-T.Fields). CLE-99-Z.Smith was injured during the play.,pass,2.0,0,0,1.0,0,0,0,short,left,-4.0,6.0,,,,,,,3,3,0.0,,,,,3.0,3.0,14,6,14.0,6.0,8.0,14.0,6.0,8.0,0.0046605234965682,0.144037008285522,0.0020718346349895,0.226051300764084,0.212601080536842,0.0038279336877167,0.406750351190567,0.0,0.0,1.4740977678448,-0.459611341357231,9.65209383031576,-9.65209383031576,-0.0732881798176095,0.0732881798176095,6.26779380838233,-6.26779380838233,-1.53413315396756,1.07452181261033,-1.53413315396756,1.07452181261033,-0.757845414220356,0.757845414220356,2.44922860572115,-2.44922860572115,-6.91657481802395,6.91657481802395,13.1843686264063,-13.1843686264063,0.834609687328339,0.165390312671661,0.834609687328339,0.165390312671661,-0.0119392871856689,-0.017442524433136,-0.017442524433136,0.82267040014267,0.17732959985733,0.800205528736115,0.800205528736115,0.0035821453172918,-0.0035821453172918,0.160197369754314,-0.160197369754314,0.0,-0.0119392871856689,0.0,-0.0119392871856689,-0.0007104277610778,0.0007104277610778,0.0435480624437332,-0.0435480624437332,0.0279454737901688,-0.0279454737901688,0.132251895964146,-0.132251895964146,0.0,0.0,0.0,0.0,0.0,0.0,0.0,0.0,0.0,0,0.0,0.0,0.0,0.0,0.0,0.0,0.0,0.0,0.0,0.0,0.0,0.0,0.0,0.0,1.0,0.0,0.0,0.0,0.0,0.0,0.0,0.0,0.0,1.0,0.0,0.0,0.0,0.0,0.0,0.0,0.0,0.0,0.0,0.0,0.0,1.0,0.0,0.0,0.0,0.0,0.0,00-0029263,R.Wilson,2.0,00-0036997,J.Williams,2.0,,,,,,,,,,,,,,,,,,,,,,,,,,,,,,,,,,,,,,,,,,,,,,CLE,,00-0036634,,T.Fields,,,,,,,,,,,,,,0.0,,,,,,,,,,,,,,,,,,,,,,,,,,,,,,,,0.0,,,,,0,,,0.0,0.0,0.0,0.0,,,2023,0.882168292999268,11.7831707000732,28,0,Punt,2328,"11/26/23, 16:05:39",2023-11-26T22:45:40.797Z,Empower Field at Mile High,"Sunny Temp: 40° F, Humidity: 28%, Wind: NW 5 mph",cbadd1c6-f053-11ed-b4a7-bab79e4492fa,0,0,PASS,0,,2023-11-26T22:45:47.857Z,,11,Punt,2023-11-26T22:45:02.467Z,3.0,1:54,0.0,0.0,0.0,3.0,3.0,0.0,KICKOFF,PUNT,15:00,13:06,DEN 25,DEN 31,2312.0,2420.0,12,29,Home,17,41,1.5,37.5,0,outdoors,grass,40.0,5.0,Sean Payton,Kevin Stefanski,DEN00,Empower Field at Mile High,0,0.0,R.Wilson,3.0,,,J.Williams,33.0,1,0,0.0,0,1,00-0029263,,00-0036997,R.Wilson,3.0,00-0029263,J.Williams,00-0036997,J.Williams,00-0036997,0,0,-0.459611341357231,1.56881487483167,10.7175143821296,9.0,0.477909686014755,0.247337067470653,0.451817870140076,54.8182129859924,2023-11-26,Z.Smith,2023,REG,CLE,12,00-0031576,DE,Za'Darius Smith,Za'Darius,Smith,,,,Not injury related - resting player,Not injury related - personal ,Full Participation in Practice,2023-11-24T20:14:34Z,2023-11-24 20:14:34
2322,2023_14_IND_CIN,2023121003,CIN,IND,REG,14,IND,away,CIN,IND,77.0,2023-12-10,656.0,1556.0,1556.0,Half2,0,12.0,0,3,2.0,0,10:56,IND 23,12,13.0,(10:56) (Shotgun) 10-G.Minshew pass short left to 21-Z.Moss to IND 38 for 15 yards (92-B.Hill). CIN-92-B.Hill was injured during the play.,pass,15.0,1,0,1.0,0,0,0,short,left,-3.0,18.0,,,,,,,3,3,0.0,,,,,3.0,3.0,21,14,14.0,21.0,-7.0,14.0,21.0,-7.0,0.0068733403459191,0.184099704027176,0.0030265334062278,0.334272861480713,0.174216508865356,0.003494520438835,0.294016569852829,0.0,0.0,-0.310507652815431,1.96986938477494,5.56166570626469,-5.56166570626469,1.48175121593522,-1.48175121593522,-4.87855214346629,4.87855214346629,-0.991372419521213,2.96124180429615,-0.991372419521213,2.96124180429615,-6.37323880050099,6.37323880050099,4.57939162665153,-4.57939162665153,-9.91301477563684,9.91301477563684,3.97349198297471,-3.97349198297471,0.218840003013611,0.781159996986389,0.781159996986389,0.218840003013611,0.0322877466678619,0.0303843021392822,-0.0303843021392822,0.748872250318527,0.251127749681473,0.184930816292763,0.815069183707237,0.0620630863632459,-0.0620630863632459,-0.0211176014942535,0.0211176014942535,0.0,0.0322877466678619,0.0,0.0322877466678619,-0.103984113063279,0.103984113063279,0.193248181865218,-0.193248181865218,-0.103984113063279,0.103984113063279,0.0971791118538405,-0.0971791118538405,0.0,0.0,1.0,0.0,0.0,0.0,0.0,0.0,0.0,0,0.0,0.0,0.0,0.0,0.0,0.0,0.0,0.0,0.0,0.0,0.0,0.0,0.0,0.0,1.0,0.0,0.0,0.0,0.0,0.0,0.0,0.0,0.0,1.0,0.0,0.0,0.0,0.0,0.0,0.0,0.0,0.0,0.0,0.0,0.0,1.0,0.0,0.0,0.0,0.0,0.0,00-0035289,G.Minshew,15.0,00-0036251,Z.Moss,15.0,,,,,,,,,,,,,,,,,,,,,,,,,,,,,,,,,,,,,,,,,,,,,,CIN,,00-0034800,,B.Hill,,,,,,,,,,,,,,0.0,,,,,,,,,,,,,,,,,,,,,,,,,,,,,,,,0.0,,,,,0,,,0.0,0.0,0.0,0.0,,,2023,0.879414260387421,12.0585739612579,33,1,First down,2322,"12/10/23, 13:02:32",2023-12-10T19:47:03.477Z,Paycor Stadium,"Cloudy Temp: 40° F, Humidity: 68%, Wind: WNW 9 mph",cbae7fe4-f053-11ed-b4a7-bab79e4492fa,0,0,PASS,0,,2023-12-10T19:47:10.317Z,,12,Punt,2023-12-10T19:45:41.387Z,5.0,2:06,1.0,0.0,0.0,3.0,3.0,0.0,KICKOFF,PUNT,11:38,09:32,IND 25,IND 38,2274.0,2425.0,14,34,Home,20,48,3.0,45.0,0,outdoors,fieldturf,40.0,9.0,Zac Taylor,Shane Steichen,CIN00,Paycor Stadium,0,1.0,G.Minshew II,10.0,,,Z.Moss,21.0,1,0,1.0,0,1,00-0035289,,00-0036251,G.Minshew II,10.0,00-0035289,Z.Moss,00-0036251,Z.Moss,00-0036251,0,0,1.96986938477494,1.36473794159947,9.63812971948209,8.0,0.552318105124869,0.1697414588416,0.835996925830841,16.4003074169159,2023-12-10,B.Hill,2023,REG,CIN,14,00-0034800,DT,B.J. Hill,B.J.,Hill,,,,Not injury related - resting player,,Full Participation in Practice,2023-12-08T18:47:43Z,2023-12-08 18:47:43
2282,2023_15_SF_ARI,2023121704,ARI,SF,REG,15,ARI,home,SF,ARI,75.0,2023-12-17,798.0,1698.0,1698.0,Half2,0,11.0,0,3,1.0,0,13:18,ARI 25,10,-6.0,"(13:18) 1-K.Murray pass short left to 85-T.McBride to ARI 25 for no gain (54-F.Warner) [94-C.Ferrell]. FUMBLES (54-F.Warner), ball out of bounds at ARI 26. ARI-1-K.Murray was injured during the play.",pass,0.0,0,0,1.0,0,0,0,short,left,-4.0,4.0,,,,,,,3,3,0.0,,,,,3.0,3.0,13,28,13.0,28.0,-15.0,13.0,28.0,-15.0,0.0023132725618779,0.137010127305985,0.0019963823724538,0.215745106339455,0.227433204650879,0.0030781349632889,0.412423759698868,0.0,0.0,1.65018331073225,-0.601841933559626,-17.0784084256049,17.0784084256049,3.9055158480769,-3.9055158480769,-23.9170054973443,23.9170054973443,-1.43630708754063,0.834465153981,-1.43630708754063,0.834465153981,-12.446994697937,12.446994697937,-2.45122382402095,2.45122382402095,-24.8641404424561,24.8641404424561,2.53469296996574,-2.53469296996574,0.112320177257061,0.887679822742939,0.112320177257061,0.887679822742939,-0.0105172172188759,0.0020870640873909,0.0020870640873909,0.101802960038185,0.898197039961815,0.0315847359597683,0.0315847359597683,0.115172112158445,-0.115172112158445,-0.617434956123514,0.617434956123514,0.0,-0.0105172172188759,0.0,-0.0105172172188759,-0.139070976978908,0.139070976978908,-0.255120474476259,0.255120474476259,0.700682054751744,-0.700682054751744,-1.26328213839105,1.26328213839105,0.0,0.0,0.0,0.0,0.0,0.0,0.0,0.0,0.0,0,0.0,0.0,0.0,0.0,0.0,0.0,0.0,0.0,0.0,0.0,0.0,1.0,0.0,1.0,1.0,0.0,0.0,0.0,0.0,0.0,0.0,1.0,0.0,1.0,0.0,0.0,0.0,0.0,0.0,0.0,0.0,0.0,0.0,0.0,1.0,1.0,0.0,0.0,0.0,0.0,0.0,00-0035228,K.Murray,0.0,00-0037744,T.McBride,0.0,,,,,,,,,,,,,,,,,,,,,,,,,,,,,,,,,,,,00-0035692,C.Ferrell,,,SF,00-0034815,F.Warner,,,,SF,,00-0034815,,F.Warner,,,,,,,,,,,,,,0.0,,,,,,,,,,,ARI,00-0037744,T.McBride,,,,,,,,,,,,,,,,,,,0.0,,,,,0,,,0.0,0.0,0.0,0.0,,,2023,0.651688754558563,34.8311245441437,30,0,Punt,2282,"12/17/23, 16:05:26",2023-12-17T22:53:50.323Z,State Farm Stadium,"Sunny Temp: 76° F, Humidity: 13%, Wind: NE 3 mph",cbaeffc2-f053-11ed-b4a7-bab79e4492fa,0,0,PASS,0,,2023-12-17T22:53:56.530Z,,11,Punt,2023-12-17T22:53:11.920Z,3.0,1:39,0.0,0.0,0.0,3.0,3.0,0.0,KICKOFF,PUNT,13:18,11:39,ARI 25,ARI 19,2259.0,2378.0,45,29,Home,-16,74,-12.5,48.0,1,open,grass,,,Jonathan Gannon,Kyle Shanahan,PHO00,State Farm Stadium,0,0.0,K.Murray,1.0,,,T.McBride,85.0,1,0,0.0,0,1,00-0035228,,00-0037744,K.Murray,1.0,00-0035228,T.McBride,00-0037744,T.McBride,00-0037744,0,1,-0.601841933559626,1.47547587437098,10.7249325117664,9.0,0.489304049609928,0.253728630690603,0.467597842216492,53.2402157783508,2023-12-17,K.Murray,2023,REG,ARI,15,00-0035228,QB,Kyler Murray,Kyler,Murray,,,,right Thumb,,Full Participation in Practice,2023-12-15T20:44:20Z,2023-12-15 20:44:20
2250,2023_11_CHI_DET,2023111902,DET,CHI,REG,11,CHI,away,DET,CHI,80.0,2023-11-19,744.0,1644.0,1644.0,Half2,0,11.0,0,3,2.0,0,12:24,CHI 20,5,50.0,(12:24) 21-D.Foreman left tackle to CHI 33 for 13 yards (97-A.Hutchinson; 32-B.Branch). CHI-21-D.Foreman was injured during the play. His return is Questionable.,run,13.0,0,0,0.0,0,0,0,,,,,left,tackle,,,,,3,3,0.0,,,,,3.0,3.0,14,10,10.0,14.0,-4.0,10.0,14.0,-4.0,0.0042093526571989,0.162704959511757,0.0023766914382576,0.297321259975433,0.188107430934906,0.0030442355200648,0.342236071825027,0.0,0.0,0.39194618538022,1.19624141370878,-0.0549423948085173,0.0549423948085173,1.81585566478316,-1.81585566478316,-3.2326283254149,3.2326283254149,,,0.0,0.0,7.75942139915424,-7.75942139915424,-0.641358867869712,0.641358867869712,0.513667666353285,-0.513667666353285,-1.14762329048949,1.14762329048949,0.3189896941185,0.6810103058815,0.6810103058815,0.3189896941185,0.0237211287021637,0.0279932171106339,-0.0279932171106339,0.657289177179337,0.342710822820663,0.232544258236885,0.767455741763115,0.0727068521162777,-0.0727068521162777,-0.006106444166257,0.006106444166257,,,0.0,0.0,0.342759690715716,-0.342759690715716,-0.0970865488052368,0.0970865488052368,0.342759690715716,-0.342759690715716,-0.295435518026352,0.295435518026352,0.0,1.0,0.0,0.0,0.0,0.0,0.0,0.0,0.0,0,0.0,0.0,0.0,0.0,0.0,0.0,0.0,0.0,0.0,0.0,0.0,0.0,0.0,0.0,0.0,0.0,0.0,0.0,0.0,0.0,0.0,0.0,1.0,0.0,0.0,0.0,0.0,0.0,0.0,0.0,0.0,0.0,0.0,0.0,0.0,0.0,1.0,0.0,0.0,0.0,0.0,,,,,,,00-0033925,D.Foreman,13.0,,,,,,,,,,,,,,,,,,,,,,,,,,,,,,,,,,,,,,,,,,,,,,,,,00-0037236,A.Hutchinson,DET,00-0039141,B.Branch,DET,,,,,,,0.0,,,,,,,,,,,,,,,,,,,,,,,,,,,,,,,,0.0,,,,,0,,,0.0,0.0,0.0,0.0,,,2023,,,34,1,First down,2250,"11/19/23, 13:02:34",2023-11-19T19:41:16.937Z,Ford Field,"Controlled Climate Temp: 68° F, Humidity: 70%, Wind: mph",cbacf524-f053-11ed-b4a7-bab79e4492fa,0,0,RUSH,0,,2023-11-19T19:41:22.307Z,,11,Field goal,2023-11-19T19:40:38.263Z,10.0,6:21,4.0,0.0,1.0,3.0,3.0,-5.0,PUNT,FIELD_GOAL,13:02,06:41,CHI 15,DET 35,2218.0,2529.0,26,31,Home,5,57,8.0,48.0,1,dome,fieldturf,,,Dan Campbell,Matt Eberflus,DET00,Ford Field,0,1.0,,,D.Foreman,21.0,,,0,1,1.0,0,1,,00-0033925,,D.Foreman,21.0,00-0033925,D.Foreman,00-0033925,D.Foreman,00-0033925,0,0,1.19624141370878,,,,,,0.500303208827972,-50.0303208827972,2023-11-19,D.Foreman,2023,REG,CHI,11,00-0033925,RB,D'Onta Foreman,D'Onta,Foreman,Ankle,,Questionable,Ankle,,Limited Participation in Practice,2023-11-17T19:40:50Z,2023-11-17 19:40:50
2213,2023_09_ARI_CLE,2023110503,CLE,ARI,REG,9,CLE,home,ARI,CLE,74.0,2023-11-05,827.0,1727.0,1727.0,Half2,0,13.0,0,3,3.0,0,13:47,CLE 26,9,1.0,(13:47) (Shotgun) 4-D.Watson pass incomplete deep middle to 3-M.Goodwin (21-G.Williams). CLE-3-M.Goodwin was injured during the play. He is Out.,pass,0.0,1,0,1.0,0,0,0,deep,middle,36.0,,,,,,,,3,3,0.0,,,,,3.0,3.0,13,0,13.0,0.0,13.0,13.0,0.0,13.0,0.0053936149924993,0.190549314022064,0.0021879656706005,0.294914871454239,0.186352953314781,0.0035715890116989,0.317029684782028,0.0,0.0,0.144981857854873,-1.50297037139535,13.2885835681669,-13.2885835681669,3.81340841506608,-3.81340841506608,7.65362438378072,-7.65362438378072,3.65373768121935,-5.1567080526147,0.0,0.0,3.44444257841678,-3.44444257841678,5.67885135829131,-5.67885135829131,12.6395064019598,-12.6395064019598,-5.75817302685316,5.75817302685316,0.910960614681244,0.0890393853187561,0.910960614681244,0.0890393853187561,-0.0149075388908386,-0.0046428442001342,-0.0046428442001342,0.896053075790405,0.103946924209595,0.976322293281555,0.976322293281555,0.101817011833191,-0.101817011833191,0.232392860685666,-0.232392860685666,0.0,-0.0149075388908386,0.0,0.0,0.0268832576621373,-0.0268832576621373,0.208361580967903,-0.208361580967903,0.0268832576621373,-0.0268832576621373,0.172248378396034,-0.172248378396034,0.0,0.0,0.0,0.0,0.0,1.0,0.0,0.0,1.0,0,0.0,0.0,0.0,0.0,0.0,0.0,0.0,0.0,0.0,0.0,0.0,0.0,0.0,0.0,0.0,0.0,0.0,0.0,0.0,0.0,0.0,0.0,0.0,1.0,0.0,0.0,0.0,0.0,0.0,0.0,0.0,0.0,0.0,0.0,0.0,0.0,0.0,0.0,0.0,0.0,0.0,00-0033537,D.Watson,,00-0030068,M.Goodwin,,,,,,,,,,,,,,,,,,,,,,,,,,,,,,,,,,,,,,,,,,,,,,,,,,,,,,,,,,,,,,,,,0.0,,,,,,,00-0039007,G.Williams,,,,,,,,,,,,,,,,,,,,,,,,0.0,,,,,0,,,0.0,0.0,0.0,0.0,,,2023,0.369737416505814,-36.9737416505814,25,0,Punt,2213,"11/5/23, 13:02:26",2023-11-05T19:41:43.333Z,Cleveland Browns Stadium,"Sunny Temp: 56° F, Humidity: 58%, Wind: N 7 mph",b07eb9ec-f053-11ed-b4a7-bab79e4492fa,0,0,PASS,0,,2023-11-05T19:41:50.920Z,,13,Punt,2023-11-05T19:37:02.653Z,3.0,1:33,0.0,0.0,0.0,3.0,3.0,0.0,KICKOFF,PUNT,15:00,13:27,CLE 25,CLE 26,2150.0,2243.0,0,27,Home,27,27,13.0,38.0,0,outdoors,grass,56.0,7.0,Kevin Stefanski,Jonathan Gannon,CLE00,FirstEnergy Stadium,0,0.0,D.Watson,4.0,,,M.Goodwin,3.0,1,0,0.0,0,1,00-0033537,,00-0030068,D.Watson,4.0,00-0033537,M.Goodwin,00-0030068,M.Goodwin,00-0030068,0,0,-1.50297037139535,0.677203843012268,9.60023581894347,5.0,1.0,1.0,0.978385150432587,2.16148495674133,2023-11-05,M.Goodwin,2023,REG,CLE,9,00-0030068,WR,Marquise Goodwin,Marquise,Goodwin,,,,Illness,,Full Participation in Practice,2023-11-03T19:11:33Z,2023-11-03 19:11:33
2189,2023_02_SF_LA,2023091709,LA,SF,REG,2,LA,home,SF,LA,57.0,2023-09-17,752.0,1652.0,1652.0,Half2,0,8.0,0,3,1.0,0,12:32,LA 43,10,25.0,(12:32) (No Huddle) 9-M.Stafford pass short right to 89-T.Higbee to LA 46 for 3 yards (7-C.Ward). LA-70-J.Noteboom was injured during the play.,pass,3.0,0,1,1.0,0,0,0,short,right,2.0,1.0,,,,,,,3,3,0.0,,,,,3.0,3.0,17,17,17.0,17.0,0.0,17.0,17.0,0.0,0.0037305750884115,0.097695991396904,0.001598700764589,0.156747758388519,0.236446306109428,0.0041859028860926,0.499594777822495,0.0,0.0,2.82135448441841,-0.252889233175665,2.0110824056901,-2.0110824056901,-2.53145320666954,2.53145320666954,5.47905761747631,-5.47905761747631,-0.465591001790017,0.212701768614352,-0.465591001790017,0.212701768614352,-2.18267610919429,2.18267610919429,5.27806850823828,-5.27806850823828,-6.83751098829089,6.83751098829089,10.4924541978888,-10.4924541978888,0.594565212726593,0.405434787273407,0.594565212726593,0.405434787273407,-0.0119525790214539,-0.016842782497406,-0.016842782497406,0.582612633705139,0.417387366294861,0.380618304014206,0.380618304014206,-0.088588419607588,0.088588419607588,0.198008504832361,-0.198008504832361,0.0,-0.0119525790214539,0.0,-0.0119525790214539,0.031296044588089,-0.031296044588089,0.0906285318976382,-0.0906285318976382,0.0087773501873016,-0.0087773501873016,0.147256312096689,-0.147256312096689,0.0,0.0,0.0,0.0,0.0,0.0,0.0,0.0,0.0,0,0.0,0.0,0.0,0.0,0.0,0.0,0.0,0.0,0.0,0.0,0.0,0.0,0.0,0.0,1.0,0.0,0.0,0.0,0.0,0.0,0.0,0.0,0.0,1.0,0.0,0.0,0.0,0.0,0.0,0.0,0.0,0.0,0.0,0.0,0.0,1.0,0.0,0.0,0.0,0.0,0.0,00-0026498,M.Stafford,3.0,00-0033110,T.Higbee,3.0,,,,,,,,,,,,,,,,,,,,,,,,,,,,,,,,,,,,,,,,,,,,,,SF,,00-0034573,,C.Ward,,,,,,,,,,,,,,0.0,,,,,,,,,,,,,,,,,,,,,,,,,,,,,,,,0.0,,,,,0,,,0.0,0.0,0.0,0.0,,,2023,0.836115181446075,16.3884818553925,37,0,Punt,2189,"9/17/23, 16:05:20",2023-09-17T21:51:25.437Z,SoFi Stadium,"Cloudy Temp: 71° F, Humidity: 82%, Wind: SSW 2 mph",b07cc974-f053-11ed-b4a7-bab79e4492fa,0,0,PASS,0,,2023-09-17T21:51:28.490Z,,8,Punt,2023-09-17T21:48:04.940Z,7.0,4:58,2.0,0.0,0.0,3.0,3.0,-5.0,KICKOFF,PUNT,15:00,10:02,LA 21,LA 46,2062.0,2304.0,30,23,Home,-7,53,-7.5,45.0,1,dome,,,,Sean McVay,Kyle Shanahan,LAX01,SoFi Stadium,0,0.0,M.Stafford,9.0,,,T.Higbee,89.0,1,0,0.0,0,1,00-0026498,,00-0033110,M.Stafford,9.0,00-0026498,T.Higbee,00-0033110,T.Higbee,00-0033110,0,0,-0.252889233175665,0.69356774012201,5.54919301847986,4.0,0.649644919089042,0.238858245662414,0.430440694093704,56.9559305906296,2023-09-17,J.Noteboom,2023,REG,LA,2,00-0034803,T,Joseph Noteboom,Joseph,Noteboom,,,,Ankle,,Full Participation in Practice,2023-09-15T19:58:01Z,2023-09-15 19:58:01
2188,2023_09_ARI_CLE,2023110503,CLE,ARI,REG,9,CLE,home,ARI,CLE,79.0,2023-11-05,856.0,1756.0,1756.0,Half2,0,13.0,0,3,2.0,0,14:16,CLE 21,14,1.0,(14:16) (Shotgun) 34-J.Ford right guard to CLE 26 for 5 yards (97-C.Thomas). CLE-79-D.Jones was injured during the play. His return is Questionable.,run,5.0,1,0,0.0,0,0,0,,,,,right,guard,,,,,3,3,0.0,,,,,3.0,3.0,13,0,13.0,0.0,13.0,13.0,0.0,13.0,0.0053896405734121,0.212739065289497,0.0025090584531426,0.292914479970932,0.165608868002892,0.0036937687546014,0.317145079374313,0.0,0.0,0.0305930245667696,0.114388833288103,14.7915539395622,-14.7915539395622,3.81340841506608,-3.81340841506608,9.15659475517607,-9.15659475517607,,,0.0,0.0,3.44444257841678,-3.44444257841678,5.67885135829131,-5.67885135829131,8.98576872074045,-8.98576872074045,-0.601464974238458,0.601464974238458,0.91354364156723,0.0864563584327698,0.91354364156723,0.0864563584327698,-0.0025830268859863,0.0020021796226501,0.0020021796226501,0.910960614681244,0.0890393853187561,0.974320113658905,0.974320113658905,0.101817011833191,-0.101817011833191,0.247300399576505,-0.247300399576505,,,0.0,0.0,0.0268832576621373,-0.0268832576621373,0.208361580967903,-0.208361580967903,0.0268832576621373,-0.0268832576621373,0.187155917286873,-0.187155917286873,0.0,0.0,0.0,0.0,0.0,0.0,0.0,0.0,0.0,0,0.0,0.0,0.0,0.0,0.0,0.0,0.0,0.0,0.0,0.0,0.0,0.0,0.0,0.0,1.0,0.0,0.0,0.0,0.0,0.0,0.0,0.0,1.0,0.0,0.0,0.0,0.0,0.0,0.0,0.0,0.0,0.0,0.0,0.0,0.0,0.0,0.0,0.0,0.0,0.0,0.0,,,,,,,00-0037267,J.Ford,5.0,,,,,,,,,,,,,,,,,,,,,,,,,,,,,,,,,,,,,,,,,,,ARI,,00-0037815,,C.Thomas,,,,,,,,,,,,,,0.0,,,,,,,,,,,,,,,,,,,,,,,,,,,,,,,,0.0,,,,,0,,,0.0,0.0,0.0,0.0,,,2023,,,25,0,Punt,2188,"11/5/23, 13:02:26",2023-11-05T19:38:34.577Z,Cleveland Browns Stadium,"Sunny Temp: 56° F, Humidity: 58%, Wind: N 7 mph",b07eb9ec-f053-11ed-b4a7-bab79e4492fa,0,0,RUSH,0,,2023-11-05T19:38:38.397Z,,13,Punt,2023-11-05T19:37:02.653Z,3.0,1:33,0.0,0.0,0.0,3.0,3.0,0.0,KICKOFF,PUNT,15:00,13:27,CLE 25,CLE 26,2150.0,2243.0,0,27,Home,27,27,13.0,38.0,0,outdoors,grass,56.0,7.0,Kevin Stefanski,Jonathan Gannon,CLE00,FirstEnergy Stadium,0,1.0,,,J.Ford,34.0,,,0,1,0.0,0,1,,00-0037267,,J.Ford,34.0,00-0037267,J.Ford,00-0037267,J.Ford,00-0037267,0,0,0.114388833288103,,,,,,0.80884051322937,-80.884051322937,2023-11-05,D.Jones,2023,REG,CLE,9,00-0039014,T,Dawand Jones,Dawand,Jones,Shoulder,,Questionable,Shoulder,,Limited Participation in Practice,2023-11-03T19:12:36Z,2023-11-03 19:12:36
2179,2023_06_NO_HOU,2023101505,HOU,NO,REG,6,NO,away,HOU,NO,61.0,2023-10-15,786.0,1686.0,1686.0,Half2,0,11.0,0,3,2.0,0,13:06,NO 39,10,5.0,"(13:06) (Shotgun) 4-D.Carr pass incomplete short left to 12-C.Olave [94-K.Davis]. HOU-0-S.Griffin was injured during the play. PENALTY on NO-70-T.Penning, Offensive Holding, 10 yards, enforced at NO 39 - No Play.",no_play,0.0,1,0,0.0,0,0,0,,,,,,,,,,,3,3,0.0,,,,,3.0,3.0,17,10,10.0,17.0,-7.0,10.0,17.0,-7.0,0.0023691188544035,0.123386979103088,0.001875725807622,0.243273228406906,0.242285370826721,0.0046079284511506,0.382201671600342,0.0,0.0,1.33465868281201,-0.867044032085687,7.62864953277198,-7.62864953277198,2.57703859568574,-2.57703859568574,1.52499527701415,-1.52499527701415,,,0.0,0.0,8.53140404744772,-8.53140404744772,-6.36633963295157,6.36633963295157,3.42291059286799,-3.42291059286799,-1.89791531585384,1.89791531585384,0.250383228063583,0.749616771936417,0.749616771936417,0.250383228063583,-0.0199486613273621,-0.0330547392368317,0.0330547392368317,0.769565433263779,0.230434566736221,0.372047066688538,0.627952933311462,0.159220606088638,-0.159220606088638,-0.0036001153739139,0.0036001153739139,,,0.0,0.0,0.122524946903564,-0.122524946903564,-0.116482088735264,0.116482088735264,0.122524946903564,-0.122524946903564,-0.126125062277478,0.126125062277478,0.0,0.0,0.0,0.0,0.0,0.0,0.0,0.0,0.0,0,0.0,0.0,0.0,0.0,0.0,0.0,0.0,0.0,0.0,0.0,0.0,0.0,0.0,0.0,0.0,0.0,1.0,0.0,0.0,0.0,0.0,0.0,0.0,0.0,0.0,0.0,0.0,0.0,0.0,0.0,0.0,0.0,0.0,0.0,0.0,0.0,0.0,0.0,0.0,0.0,0.0,,,,,,,,,,,,,,,,,,,,,,,,,,,,,,,,,,,,,,,,,,,,,,,,,,,,,,,,,,,,,,,,,,,,,,0.0,,,,,,,,,,,,,,,,,,,,,,,,,,,,,,,,0.0,NO,00-0037241,T.Penning,10.0,0,,Offensive Holding,0.0,0.0,0.0,0.0,,,2023,,,33,0,Punt,2179,"10/15/23, 13:03:19",2023-10-15T18:43:54.257Z,NRG Stadium,"Sunny Temp: 67° F, Humidity: 53%, Wind: N 14 mph",b07df07b-f053-11ed-b4a7-bab79e4492fa,0,0,PENALTY,0,,2023-10-15T18:43:58.193Z,,11,Punt,2023-10-15T18:41:25.643Z,5.0,3:28,1.0,0.0,0.0,3.0,3.0,-10.0,KICKOFF,PUNT,15:00,11:32,NO 25,NO 30,2094.0,2261.0,13,20,Home,7,33,-2.0,42.5,0,closed,astroturf,,,DeMeco Ryans,Dennis Allen,HOU00,NRG Stadium,0,0.0,D.Carr,4.0,,,C.Olave,12.0,1,0,0.0,0,1,00-0031280,,00-0037239,D.Carr,4.0,00-0031280,,,C.Olave,00-0037239,0,1,-0.867044032085687,,,,,,0.598626434803009,40.1373565196991,2023-10-15,S.Griffin,2023,REG,HOU,6,00-0033926,CB,Shaquill Griffin,Shaquill,Griffin,,,,Calf,,Full Participation in Practice,2023-10-13T20:00:48Z,2023-10-13 20:00:48
2161,2023_19_PIT_BUF,2024011501,BUF,PIT,POST,19,BUF,home,PIT,BUF,75.0,2024-01-15,99.0,99.0,1899.0,Half1,0,14.0,0,2,1.0,0,01:39,BUF 25,10,4.0,(1:39) (Shotgun) 17-J.Allen pass short right to 14-S.Diggs to BUF 30 for 5 yards (39-M.Fitzpatrick). BUF-14-S.Diggs was injured during the play. His return is Probable. S.Diggs walks off.,pass,5.0,1,0,1.0,0,0,0,short,right,4.0,1.0,,,,,,,0,3,0.0,,,,,0.0,3.0,21,7,21.0,7.0,14.0,21.0,7.0,14.0,0.655711352825165,0.0299180895090103,0.0006893893587403,0.0417257025837898,0.124310277402401,0.0012335951905697,0.146411567926407,0.0,0.0,1.01706603274215,-0.423470412613824,17.4543315523489,-17.4543315523489,9.66815423982916,-9.66815423982916,12.7858928505607,-12.7858928505607,-0.154157288721763,-0.269313123892061,-0.154157288721763,-0.269313123892061,4.08455947693437,-4.08455947693437,-2.12551325163804,2.12551325163804,4.38685522021842,-4.38685522021842,6.55594717389752,-6.55594717389752,0.926128506660461,0.0738714933395386,0.926128506660461,0.0738714933395386,-0.0022386312484741,0.0011272430419921,0.0011272430419921,0.923889875411987,0.0761101245880127,0.971169292926788,0.971169292926788,0.133979351538691,-0.133979351538691,0.275470568704723,-0.275470568704723,0.0,-0.0022386312484741,0.0,-0.0022386312484741,0.0924237898096196,-0.0924237898096196,0.0238373226003288,-0.0238373226003288,0.0921635559305303,-0.0921635559305303,0.150440445400917,-0.150440445400917,0.0,0.0,0.0,0.0,0.0,0.0,0.0,0.0,0.0,0,0.0,0.0,0.0,0.0,0.0,0.0,0.0,0.0,0.0,0.0,0.0,0.0,0.0,0.0,1.0,0.0,0.0,0.0,0.0,0.0,0.0,0.0,0.0,1.0,0.0,0.0,0.0,0.0,0.0,0.0,0.0,0.0,0.0,0.0,0.0,1.0,0.0,0.0,0.0,0.0,0.0,00-0034857,J.Allen,5.0,00-0031588,S.Diggs,5.0,,,,,,,,,,,,,,,,,,,,,,,,,,,,,,,,,,,,,,,,,,,,,,PIT,,00-0034789,,M.Fitzpatrick,,,,,,,,,,,,,,0.0,,,,,,,,,,,,,,,,,,,,,,,,,,,,,,,,0.0,,,,,0,,,0.0,0.0,0.0,0.0,,,2023,0.782278895378113,21.7721104621887,31,1,First down,2161,"1/15/24, 16:32:30",2024-01-15T23:00:28.853Z,Highmark Stadium,"Partly cloudy Temp: 17° F, Humidity: 57%, Wind: SW 10 mph",85495b4f-add1-11ee-aec3-7d8f81bc70be,0,0,PASS,0,,2024-01-15T23:00:33.153Z,,14,End of half,2024-01-15T22:59:48Z,4.0,1:39,1.0,0.0,0.0,2.0,2.0,0.0,KICKOFF,END_HALF,01:39,00:00,BUF 25,BUF 32,2141.0,2280.0,17,31,Home,14,48,10.0,39.5,0,outdoors,a_turf,17.0,10.0,Sean McDermott,Mike Tomlin,BUF00,New Era Field,0,0.0,J.Allen,17.0,,,S.Diggs,14.0,1,0,0.0,0,1,00-0034857,,00-0031588,J.Allen,17.0,00-0034857,S.Diggs,00-0031588,S.Diggs,00-0031588,0,0,-0.423470412613824,0.376720270995654,4.27504690665228,2.0,0.77511210332159,0.239695433177985,0.786135494709015,21.3864505290985,2024-01-15,S.Diggs,2023,WC,BUF,19,00-0031588,WR,Stefon Diggs,Stefon,Diggs,,,,Not injury related - resting player,,Did Not Participate In Practice,2024-01-12T19:54:52Z,2024-01-12 19:54:52
2144,2023_05_TEN_IND,2023100803,IND,TEN,REG,5,IND,home,TEN,IND,72.0,2023-10-08,728.0,1628.0,1628.0,Half2,0,10.0,0,3,2.0,0,12:08,IND 28,7,75.0,(12:08) (Shotgun) 10-G.Minshew pass short left to 81-M.Alie-Cox to IND 45 for 17 yards (37-A.Hooker). IND-81-M.Alie-Cox was injured during the play. He is Out.,pass,17.0,1,0,1.0,0,0,0,short,left,15.0,2.0,,,,,,,3,3,0.0,,,,,3.0,3.0,10,13,10.0,13.0,-3.0,10.0,13.0,-3.0,0.002450403990224,0.143445149064064,0.0021596946753561,0.250572711229324,0.211192816495895,0.0029915883205831,0.387187600135803,0.0,0.0,1.1612110119313,1.61193928285502,-2.73164107580669,2.73164107580669,1.82109088852303,-1.82109088852303,-1.36919416820953,1.36919416820953,1.50991376140155,0.10202552145347,1.50991376140155,0.10202552145347,0.293958582042251,-0.293958582042251,-0.354793686891564,0.354793686891564,0.798259601811878,-0.798259601811878,0.0703512348505062,-0.0703512348505062,0.438366711139679,0.561633288860321,0.438366711139679,0.561633288860321,0.0377918779850006,0.055718868970871,0.055718868970871,0.47615858912468,0.52384141087532,0.293677598237991,0.293677598237991,0.172081128215499,-0.172081128215499,-0.185994237661362,0.185994237661362,0.0,0.0377918779850006,0.0,0.0377918779850006,0.0563170909881592,-0.0563170909881592,-0.181145161390305,0.181145161390305,0.0563170909881592,-0.0563170909881592,-0.188586682081223,0.188586682081223,0.0,0.0,1.0,0.0,0.0,0.0,0.0,0.0,0.0,0,0.0,0.0,0.0,0.0,0.0,0.0,0.0,0.0,0.0,0.0,0.0,0.0,0.0,0.0,1.0,0.0,0.0,0.0,0.0,0.0,0.0,0.0,0.0,1.0,0.0,0.0,0.0,0.0,0.0,0.0,0.0,0.0,0.0,0.0,0.0,1.0,0.0,0.0,0.0,0.0,0.0,00-0035289,G.Minshew,17.0,00-0033217,M.Alie-Cox,17.0,,,,,,,,,,,,,,,,,,,,,,,,,,,,,,,,,,,,,,,,,,,,,,TEN,,00-0035632,,A.Hooker,,,,,,,,,,,,,,0.0,,,,,,,,,,,,,,,,,,,,,,,,,,,,,,,,0.0,,,,,0,,,0.0,0.0,0.0,0.0,,,2023,0.623387098312378,37.6612901687622,27,1,First down,2144,"10/8/23, 13:02:38",2023-10-08T18:44:15.227Z,Lucas Oil Stadium,"Cloudy Temp: 53° F, Humidity: 56%, Wind: WNW 7 mph",b07da31d-f053-11ed-b4a7-bab79e4492fa,0,0,PASS,0,,2023-10-08T18:44:20.123Z,,10,Touchdown,2023-10-08T18:42:58.483Z,9.0,4:48,5.0,1.0,1.0,3.0,3.0,22.0,KICKOFF,TOUCHDOWN,12:48,08:00,IND 25,TEN 3,2099.0,2361.0,16,23,Home,7,39,-2.5,43.5,1,open,fieldturf,,,Shane Steichen,Mike Vrabel,IND00,Lucas Oil Stadium,0,1.0,G.Minshew II,10.0,,,M.Alie-Cox,81.0,1,0,1.0,0,1,00-0035289,,00-0033217,G.Minshew II,10.0,00-0035289,M.Alie-Cox,00-0033217,M.Alie-Cox,00-0033217,0,1,1.61193928285502,0.262790972801728,4.26336578294286,2.0,1.0,1.0,0.68937474489212,31.062525510788,2023-10-08,M.Alie-Cox,2023,REG,IND,5,00-0033217,TE,Mo Alie-Cox,Mo,Alie-Cox,,,,Ankle,,Full Participation in Practice,2023-10-06T19:50:44Z,2023-10-06 19:50:44
2144,2023_13_KC_GB,2023120310,GB,KC,REG,13,GB,home,KC,GB,67.0,2023-12-03,571.0,1471.0,1471.0,Half2,0,8.0,0,3,1.0,0,09:31,GB 33,10,67.0,(9:31) 10-J.Love pass short left to 28-A.Dillon to GB 47 for 14 yards (6-B.Cook). KC-6-B.Cook was injured during the play. He is Out.,pass,14.0,0,0,1.0,0,0,0,short,left,-1.0,15.0,,,,,,,3,3,0.0,,,,,3.0,3.0,14,12,14.0,12.0,2.0,14.0,12.0,2.0,0.009372160769999,0.122044622898102,0.0019022971391677,0.203783348202705,0.222718000411987,0.0035501206293702,0.436629444360733,0.0,0.0,1.93523845262826,0.923197855474427,3.24423018288603,-3.24423018288603,-1.20961841447582,1.20961841447582,1.90451875302821,-1.90451875302821,-0.761402039788663,1.68459989526309,-0.761402039788663,1.68459989526309,3.8240771869896,-3.8240771869896,-5.06307282872149,5.06307282872149,3.47454391876818,-3.47454391876818,-5.21818626127788,5.21818626127788,0.697995483875275,0.302004516124725,0.697995483875275,0.302004516124725,0.0187363624572754,0.0176329016685486,0.0176329016685486,0.71673184633255,0.28326815366745,0.501918196678162,0.501918196678162,0.0257612019777298,-0.0257612019777298,0.151239271961463,-0.151239271961463,0.0,0.0187363624572754,0.0,0.0187363624572754,0.0573395301926257,-0.0573395301926257,-0.0257797837257385,0.0257797837257385,0.0573395301926257,-0.0573395301926257,-0.0305570960044861,0.0305570960044861,0.0,0.0,1.0,0.0,0.0,0.0,0.0,0.0,0.0,0,0.0,0.0,0.0,0.0,0.0,0.0,0.0,0.0,0.0,0.0,0.0,0.0,0.0,0.0,1.0,0.0,0.0,0.0,0.0,0.0,0.0,0.0,0.0,1.0,0.0,0.0,0.0,0.0,0.0,0.0,0.0,0.0,0.0,0.0,0.0,1.0,0.0,0.0,0.0,0.0,0.0,00-0036264,J.Love,14.0,00-0036265,A.Dillon,14.0,,,,,,,,,,,,,,,,,,,,,,,,,,,,,,,,,,,,,,,,,,,,,,KC,,00-0037193,,B.Cook,,,,,,,,,,,,,,0.0,,,,,,,,,,,,,,,,,,,,,,,,,,,,,,,,0.0,,,,,0,,,0.0,0.0,0.0,0.0,,,2023,0.872930765151978,12.7069234848022,31,1,First down,2144,"12/3/23, 20:22:49",2023-12-04T03:01:15.220Z,Lambeau Field,"Cloudy Temp: 31° F, Humidity: 85%, Wind: N 9 mph",cbae5b2e-f053-11ed-b4a7-bab79e4492fa,0,0,PASS,0,,2023-12-04T03:01:24.130Z,,8,Touchdown,2023-12-04T03:00:24.470Z,7.0,4:16,3.0,1.0,1.0,3.0,3.0,0.0,KICKOFF,TOUCHDOWN,09:39,05:23,GB 33,KC 12,2109.0,2340.0,19,27,Home,8,46,-5.5,43.5,0,outdoors,grass,31.0,9.0,Matt LaFleur,Andy Reid,GNB00,Lambeau Field,0,1.0,J.Love,10.0,,,A.Dillon,28.0,1,0,1.0,0,1,00-0036264,,00-0036265,J.Love,10.0,00-0036264,A.Dillon,00-0036265,A.Dillon,00-0036265,0,1,0.923197855474427,0.921792145399509,7.74487634624529,6.0,0.478769204986747,0.219810094160493,0.448886841535568,55.1113158464432,2023-12-03,B.Cook,2023,REG,KC,13,00-0037193,S,Bryan Cook,Bryan,Cook,,,,Biceps,,Full Participation in Practice,2023-12-01T19:40:03Z,2023-12-01 19:40:03
2067,2023_05_GB_LV,2023100900,LV,GB,REG,5,GB,away,LV,LV,37.0,2023-10-09,769.0,1669.0,1669.0,Half2,0,13.0,0,3,1.0,0,12:49,LV 37,10,37.0,(12:49) 28-A.Dillon left tackle to LV 32 for 5 yards (51-M.Koonce; 21-A.Robertson). LV-51-M.Koonce was injured during the play.,run,5.0,0,0,0.0,0,0,0,,,,,left,tackle,,,,,3,3,0.0,,,,,3.0,3.0,10,3,3.0,10.0,-7.0,3.0,10.0,-7.0,0.0029589261393994,0.0543848387897015,0.0011667254148051,0.103591717779636,0.334771513938904,0.003837704192847,0.499288618564606,0.0,0.0,3.61638028849848,0.167654542485252,3.31246289721655,-3.31246289721655,-3.49049692464178,3.49049692464178,7.40555992849867,-7.40555992849867,,,0.0,0.0,3.33949898023275,-3.33949898023275,5.53396735535353,-5.53396735535353,4.24608180628275,-4.24608180628275,9.11061365642698,-9.11061365642698,0.307449251413345,0.692550748586655,0.692550748586655,0.307449251413345,-0.0047291815280914,0.000939130783081,-0.000939130783081,0.697279930114746,0.302720069885254,0.355830103158951,0.644169896841049,-0.0412625670433044,0.0412625670433044,0.266820633037726,-0.266820633037726,,,0.0,0.0,0.0536000728607178,-0.0536000728607178,0.269629561527411,-0.269629561527411,0.0536000728607178,-0.0536000728607178,0.36046671233956,-0.36046671233956,0.0,0.0,0.0,0.0,0.0,0.0,0.0,0.0,0.0,0,0.0,0.0,0.0,0.0,0.0,0.0,0.0,0.0,0.0,0.0,0.0,0.0,0.0,0.0,0.0,0.0,0.0,0.0,0.0,0.0,0.0,0.0,1.0,0.0,0.0,0.0,0.0,0.0,0.0,0.0,0.0,0.0,0.0,0.0,0.0,0.0,1.0,0.0,0.0,0.0,0.0,,,,,,,00-0036265,A.Dillon,5.0,,,,,,,,,,,,,,,,,,,,,,,,,,,,,,,,,,,,,,,,,,,,,,,,,00-0036989,M.Koonce,LV,00-0036375,A.Robertson,LV,,,,,,,0.0,,,,,,,,,,,,,,,,,,,,,,,,,,,,,,,,0.0,,,,,0,,,0.0,0.0,0.0,0.0,,,2023,,,31,1,First down,2067,"10/9/23, 20:15:31",2023-10-10T01:53:59.697Z,Allegiant Stadium,"Sunny Temp: 92° F, Humidity: 11%, Wind: SW 12 mph",b07dcd2b-f053-11ed-b4a7-bab79e4492fa,0,0,RUSH,0,,2023-10-10T01:54:03.810Z,,13,Touchdown,2023-10-10T01:53:59.697Z,8.0,4:22,3.0,1.0,1.0,3.0,3.0,0.0,INTERCEPTION,TOUCHDOWN,12:49,08:27,LV 37,LV 5,2067.0,2260.0,13,17,Home,4,30,1.0,45.0,0,dome,grass,,,Josh McDaniels,Matt LaFleur,VEG00,Allegiant Stadium,0,1.0,,,A.Dillon,28.0,,,0,1,0.0,0,1,,00-0036265,,A.Dillon,28.0,00-0036265,A.Dillon,00-0036265,A.Dillon,00-0036265,0,0,0.167654542485252,,,,,,0.457685977220535,-45.7685977220535,2023-10-09,M.Koonce,2023,REG,LV,5,00-0036989,DE,Malcolm Koonce,Malcolm,Koonce,,,,Groin,,Full Participation in Practice,2023-10-07T20:34:46Z,2023-10-07 20:34:46
1964,2023_09_MIA_KC,2023110500,KC,MIA,REG,9,MIA,away,KC,KC,33.0,2023-11-05,86.0,86.0,1886.0,Half1,0,10.0,0,2,1.0,0,01:26,KC 33,10,38.0,(1:26) (Shotgun) 1-T.Tagovailoa pass short right to 81-D.Smythe to KC 30 for 3 yards (38-L.Sneed). KC-38-L.Sneed was injured during the play.,pass,3.0,1,0,1.0,0,0,0,short,right,0.0,3.0,,,,,,,1,2,0.0,,,,,2.0,1.0,14,0,0.0,14.0,-14.0,0.0,14.0,-14.0,0.340673476457596,0.0268299244344234,0.0003333507920615,0.0179070718586445,0.298473179340363,0.0019529880955815,0.313830018043518,0.0,0.0,2.88962966261897,-0.0878737856983207,12.113483014081,-12.113483014081,-0.143968479067553,0.143968479067553,12.4875409525121,-12.4875409525121,-0.267090833396651,0.17921704769833,-0.267090833396651,0.17921704769833,-0.953337811806705,0.953337811806705,11.3769904455985,-11.3769904455985,0.85753560718149,-0.85753560718149,10.5175083369249,-10.5175083369249,0.156379446387291,0.843620553612709,0.843620553612709,0.156379446387291,-0.0010477304458618,0.0039961189031601,-0.0039961189031601,0.844668284058571,0.155331715941429,0.18470025062561,0.81529974937439,0.0301156640052795,-0.0301156640052795,0.25965996469839,-0.25965996469839,0.0,-0.0010477304458618,0.0,-0.0010477304458618,0.0266698598861694,-0.0266698598861694,0.206448871749476,-0.206448871749476,0.0266698598861694,-0.0266698598861694,0.219108332055644,-0.219108332055644,0.0,0.0,0.0,0.0,0.0,0.0,0.0,0.0,0.0,0,0.0,0.0,0.0,0.0,0.0,0.0,0.0,0.0,0.0,0.0,0.0,0.0,0.0,0.0,1.0,0.0,0.0,0.0,0.0,0.0,0.0,0.0,0.0,1.0,0.0,0.0,0.0,0.0,0.0,0.0,0.0,0.0,0.0,0.0,0.0,1.0,0.0,0.0,0.0,0.0,0.0,00-0036212,T.Tagovailoa,3.0,00-0034798,D.Smythe,3.0,,,,,,,,,,,,,,,,,,,,,,,,,,,,,,,,,,,,,,,,,,,,,,KC,,00-0036374,,L.Sneed,,,,,,,,,,,,,,0.0,,,,,,,,,,,,,,,,,,,,,,,,,,,,,,,,0.0,,,,,0,,,0.0,0.0,0.0,0.0,,,2023,0.725796520709992,27.4203479290009,27,0,Opp touchdown,1964,"11/5/23, 09:32:30",2023-11-05T15:52:19.387Z,Frankfurt Stadium,"Light Rain Temp: 53° F, Humidity: 81%, Wind: SW 14 mph",b07eaa67-f053-11ed-b4a7-bab79e4492fa,0,0,PASS,0,,2023-11-05T15:52:24.390Z,,10,Opp touchdown,2023-11-05T15:47:40.340Z,5.0,1:58,2.0,0.0,1.0,2.0,2.0,0.0,KICKOFF,FUMBLE,02:31,00:33,MIA 25,KC 30,1869.0,1989.0,14,21,Neutral,7,35,1.0,51.0,0,outdoors,grass,,,Andy Reid,Mike McDaniel,KAN00,GEHA Field at Arrowhead Stadium,0,0.0,T.Tagovailoa,1.0,,,D.Smythe,81.0,1,0,0.0,0,1,00-0036212,,00-0034798,T.Tagovailoa,1.0,00-0036212,D.Smythe,00-0034798,D.Smythe,00-0034798,0,1,-0.0878737856983207,0.622153336770343,6.73102093546186,6.0,0.591215337975882,0.228613364859484,0.904373049736023,9.56269502639771,2023-11-05,L.Sneed,2023,REG,KC,9,00-0036374,CB,L'Jarius Sneed,L'Jarius,Sneed,,,,Knee,,Full Participation in Practice,2023-11-03T21:29:44Z,2023-11-03 21:29:44
1949,2023_12_KC_LV,2023112608,LV,KC,REG,12,KC,away,LV,LV,47.0,2023-11-26,756.0,1656.0,1656.0,Half2,0,10.0,0,3,2.0,0,12:36,LV 47,7,75.0,(12:36) (Shotgun) 10-I.Pacheco up the middle to LV 41 for 6 yards (59-L.Masterson). KC-79-D.Smith was injured during the play.,run,6.0,1,0,0.0,0,0,0,,,,,middle,,,,,,3,3,0.0,,,,,3.0,3.0,14,14,14.0,14.0,0.0,14.0,14.0,0.0,0.0038273963145911,0.0906872972846031,0.0013545559486374,0.174110382795334,0.283369213342667,0.0045618410222232,0.442089349031448,0.0,0.0,2.46031308197416,0.405327413929626,-2.99600750644458,2.99600750644458,0.46758152655093,-0.46758152655093,1.65881854737097,-1.65881854737097,,,0.0,0.0,1.9567224565443,-1.9567224565443,-2.53084264718927,2.53084264718927,-4.76018509793642,4.76018509793642,6.41900364530738,-6.41900364530738,0.506528794765472,0.493471205234528,0.493471205234528,0.506528794765472,0.0057812333106994,0.0104770660400391,-0.0104770660400391,0.487689971923828,0.512310028076172,0.756727039813995,0.243272960186005,0.0552918224679926,-0.0552918224679926,0.0132470807171907,-0.0132470807171907,,,0.0,0.0,0.0453934967517853,-0.0453934967517853,-0.0476861515902434,0.0476861515902434,0.0453934967517853,-0.0453934967517853,-0.0321464160345946,0.0321464160345946,0.0,0.0,0.0,0.0,0.0,0.0,0.0,0.0,0.0,0,0.0,0.0,0.0,0.0,0.0,0.0,0.0,0.0,0.0,0.0,0.0,0.0,0.0,0.0,1.0,0.0,0.0,0.0,0.0,0.0,0.0,0.0,1.0,0.0,0.0,0.0,0.0,0.0,0.0,0.0,0.0,0.0,0.0,0.0,0.0,0.0,0.0,0.0,0.0,0.0,0.0,,,,,,,00-0037197,I.Pacheco,6.0,,,,,,,,,,,,,,,,,,,,,,,,,,,,,,,,,,,,,,,,,,,LV,,00-0037517,,L.Masterson,,,,,,,,,,,,,,0.0,,,,,,,,,,,,,,,,,,,,,,,,,,,,,,,,0.0,,,,,0,,,0.0,0.0,0.0,0.0,,,2023,,,31,1,First down,1949,"11/26/23, 16:25:40",2023-11-26T23:02:24.890Z,Allegiant Stadium,"Sunny Temp: 55° F, Humidity: 26%, Wind: NE 14 mph",cbaddf6e-f053-11ed-b4a7-bab79e4492fa,0,0,RUSH,0,,2023-11-26T23:02:28.347Z,,10,Touchdown,2023-11-26T22:59:24.510Z,10.0,5:45,6.0,1.0,1.0,3.0,3.0,0.0,KICKOFF,TOUCHDOWN,15:00,09:15,KC 25,LV 1,1839.0,2090.0,31,17,Home,-14,48,-9.0,42.5,1,dome,grass,,,Antonio Pierce,Andy Reid,VEG00,Allegiant Stadium,0,1.0,,,I.Pacheco,10.0,,,0,1,0.0,0,1,,00-0037197,,I.Pacheco,10.0,00-0037197,I.Pacheco,00-0037197,I.Pacheco,00-0037197,0,1,0.405327413929626,,,,,,0.705039918422699,-70.5039918422699,2023-11-26,D.Smith,2023,REG,KC,12,00-0032217,T,Donovan Smith,Donovan,Smith,,,,Neck,,Full Participation in Practice,2023-11-24T19:41:41Z,2023-11-24 19:41:41
1931,2023_08_CLE_SEA,2023102909,SEA,CLE,REG,8,SEA,home,CLE,SEA,73.0,2023-10-29,206.0,206.0,2006.0,Half1,0,10.0,0,2,4.0,0,03:26,SEA 27,8,2.0,"(3:26) 4-M.Dickson punts 61 yards to CLE 12, Center-41-C.Stoll. 8-E.Moore to CLE 22 for 10 yards (38-B.Russell). CLE-42-T.Fields was injured during the play.",punt,0.0,0,0,0.0,0,0,0,,,,,,,,61.0,,,2,3,0.0,,,,,2.0,3.0,17,14,17.0,14.0,3.0,17.0,14.0,3.0,0.420677572488785,0.148825064301491,0.0012322487309575,0.249908432364464,0.0823599323630333,0.0033032807987183,0.093693420290947,0.0,0.0,-1.28875841619447,0.503071998246014,4.88793127331883,-4.88793127331883,-1.9040468952735,1.9040468952735,8.9216678559262,-8.9216678559262,,,0.0,0.0,3.42555893736426,-3.42555893736426,-3.46151943528093,3.46151943528093,11.9062240547792,-11.9062240547792,-8.9441690043657,8.9441690043657,0.665091216564179,0.334908783435822,0.665091216564179,0.334908783435822,-0.0076000988483429,0.0280174016952515,0.0280174016952515,0.657491117715836,0.342508882284164,0.685217976570129,0.685217976570129,0.0433400005237194,-0.0433400005237194,0.103732074027735,-0.103732074027735,,,0.0,0.0,-0.0104604288117394,0.0104604288117394,-0.0181373932529406,0.0181373932529406,-0.0104604288117394,0.0104604288117394,0.0203450790475889,-0.0203450790475889,0.0,0.0,0.0,0.0,0.0,0.0,0.0,0.0,0.0,0,0.0,0.0,0.0,0.0,0.0,0.0,0.0,0.0,0.0,0.0,0.0,0.0,0.0,0.0,1.0,0.0,0.0,0.0,0.0,0.0,0.0,0.0,0.0,0.0,0.0,0.0,0.0,0.0,0.0,0.0,0.0,0.0,0.0,1.0,0.0,0.0,0.0,0.0,0.0,0.0,0.0,,,,,,,,,,,,,,,,,,,,,,00-0036980,E.Moore,,,,,,,00-0034160,M.Dickson,,,,,,,,,,,,,,,,,,,,,SEA,,00-0038488,,B.Russell,,,,,,,,,,,,,,0.0,,,,,,,,,,,,,,,,,,,,,,,,,,,,,,,CLE,10.0,,,,,0,,,0.0,0.0,0.0,0.0,,,2023,,,27,0,Punt,1931,"10/29/23, 16:05:43",2023-10-29T21:20:18.397Z,Lumen Field,"Sunny Temp: 47° F, Humidity: 60%, Wind: N 3 mph",b07e87ae-f053-11ed-b4a7-bab79e4492fa,0,0,PUNT,1,,2023-10-29T21:20:28.407Z,,10,Punt,2023-10-29T21:16:41.510Z,3.0,1:24,0.0,0.0,0.0,2.0,2.0,-10.0,KICKOFF,PUNT,04:40,03:16,SEA 25,SEA 27,1801.0,1931.0,20,24,Home,4,44,4.0,39.5,0,outdoors,fieldturf,47.0,3.0,Pete Carroll,Kevin Stefanski,SEA00,Lumen Field,0,1.0,,,,,,,0,0,0.0,1,0,,,,,,,,,,,0,0,0.503071998246014,,,,,,,,2023-10-29,T.Fields,2023,REG,CLE,8,00-0036634,LB,Tony Fields,Tony,Fields,,,,Hip,,Full Participation in Practice,2023-10-27T18:48:19Z,2023-10-27 18:48:19
1890,2023_16_GB_CAR,2023122403,CAR,GB,REG,16,GB,away,CAR,CAR,34.0,2023-12-24,110.0,110.0,1910.0,Half1,0,8.0,0,2,3.0,0,01:50,CAR 34,10,60.0,(1:50) (Shotgun) 10-J.Love pass short right to 80-B.Melton to CAR 23 for 11 yards (24-V.Bell). CAR-98-M.Haynes was injured during the play. He is Out.,pass,11.0,1,0,1.0,0,0,0,short,right,11.0,0.0,,,,,,,2,3,0.0,,,,,3.0,2.0,10,16,16.0,10.0,6.0,16.0,10.0,6.0,0.303216695785522,0.0494602918624878,0.0003638619673438,0.0449739880859852,0.335389077663422,0.0021720000077039,0.264424055814743,0.0,0.0,2.39755310758483,1.27713921410032,-13.1400972038833,13.1400972038833,-11.0589267827454,11.0589267827454,-5.86989923870174,5.86989923870174,1.27713921410032,0.0,1.27713921410032,0.0,4.42163820215501,-4.42163820215501,-4.94488967052894,4.94488967052894,9.76735344767803,-9.76735344767803,-13.5749751202039,13.5749751202039,0.787505865097046,0.212494134902954,0.212494134902954,0.787505865097046,0.0547221899032593,0.0397113561630249,-0.0397113561630249,0.157771944999695,0.842228055000305,0.858484268188477,0.141515731811523,-0.336931716388277,0.336931716388277,-0.151421248912811,0.151421248912811,0.0547221899032593,0.0,0.0547221899032593,0.0,-0.0802128314971924,0.0802128314971924,0.0503575503826141,-0.0503575503826141,-0.0802128314971924,0.0802128314971924,-0.0091713964939117,0.0091713964939117,0.0,0.0,1.0,0.0,1.0,0.0,0.0,0.0,0.0,0,0.0,0.0,0.0,0.0,0.0,0.0,0.0,0.0,0.0,0.0,0.0,0.0,0.0,0.0,1.0,0.0,0.0,0.0,0.0,0.0,0.0,0.0,0.0,1.0,0.0,0.0,0.0,0.0,0.0,0.0,0.0,0.0,0.0,0.0,0.0,1.0,0.0,0.0,0.0,0.0,0.0,00-0036264,J.Love,11.0,00-0037091,B.Melton,11.0,,,,,,,,,,,,,,,,,,,,,,,,,,,,,,,,,,,,,,,,,,,,,,CAR,,00-0032939,,V.Bell,,,,,,,,,,,,,,0.0,,,,,,,,,,,,,,,,,,,,,,,,,,,,,,,,0.0,,,,,0,,,0.0,0.0,0.0,0.0,,,2023,0.551513850688934,44.8486149311066,29,1,First down,1890,"12/24/23, 13:02:39",2023-12-24T19:15:51.170Z,Bank of America Stadium,"Sunny Temp: 67° F, Humidity: 43%, Wind: E 1 mph",cbaf37d4-f053-11ed-b4a7-bab79e4492fa,0,0,PASS,0,,2023-12-24T19:15:56.677Z,,8,Touchdown,2023-12-24T19:08:31.197Z,11.0,3:23,4.0,0.0,1.0,2.0,2.0,0.0,DOWNS,TOUCHDOWN,04:12,00:49,GB 40,CAR 21,1704.0,2003.0,33,30,Home,-3,63,-3.5,39.5,0,outdoors,grass,67.0,1.0,Chris Tabor,Matt LaFleur,CAR00,Bank of America Stadium,0,1.0,J.Love,10.0,,,B.Melton,80.0,1,0,1.0,0,1,00-0036264,,00-0037091,J.Love,10.0,00-0036264,B.Melton,00-0037091,B.Melton,00-0037091,0,1,1.27713921410032,0.535510671537737,2.5277988051821,1.0,0.997962559602456,0.992726718570339,0.951981544494629,4.80184555053711,2023-12-24,M.Haynes,2023,REG,CAR,16,00-0034382,LB,Marquis Haynes,Marquis,Haynes,,,,Back,Illness,Full Participation in Practice,2023-12-22T17:21:13Z,2023-12-22 17:21:13
1876,2023_18_DAL_WAS,2024010707,WAS,DAL,REG,18,WAS,home,DAL,WAS,60.0,2024-01-07,120.0,120.0,1920.0,Half1,0,9.0,0,2,3.0,0,02:00,WAS 40,12,28.0,(2:00) (Shotgun) 14-S.Howell pass short right to 17-T.McLaurin ran ob at DAL 47 for 13 yards (21-S.Gilmore). DAL-21-S.Gilmore was injured during the play. He is Out.,pass,13.0,1,0,1.0,0,0,0,short,right,13.0,0.0,,,,,,,2,3,0.0,,,,,2.0,3.0,10,14,10.0,14.0,-4.0,10.0,14.0,-4.0,0.503822207450867,0.0965186804533005,0.0006155865848995,0.0995115861296654,0.132713049650192,0.0035320392344147,0.163286834955215,0.0,0.0,0.560842754668556,1.79799431515858,-3.09227386977053,3.09227386977053,-9.46930265409173,9.46930265409173,0.0668918795206772,-0.0668918795206772,1.79799431515858,0.0,1.79799431515858,0.0,-9.81444114021724,9.81444114021724,7.5374892974294,-7.5374892974294,-6.56273572996724,6.56273572996724,8.06683275677713,-8.06683275677713,0.324341207742691,0.675658792257309,0.324341207742691,0.675658792257309,0.087918758392334,0.0274525657296181,0.0274525657296181,0.412259966135025,0.587740033864975,0.0910705327987671,0.0910705327987671,-0.271799332897164,0.271799332897164,0.012304138415019,-0.012304138415019,0.087918758392334,0.0,0.087918758392334,0.0,0.0038149766852063,-0.0038149766852063,0.0227658748626709,-0.0227658748626709,0.0038149766852063,-0.0038149766852063,0.0815367102622986,-0.0815367102622986,0.0,0.0,1.0,0.0,1.0,0.0,0.0,0.0,0.0,0,0.0,0.0,0.0,0.0,0.0,0.0,0.0,0.0,0.0,0.0,0.0,0.0,0.0,0.0,1.0,0.0,0.0,0.0,0.0,0.0,0.0,0.0,0.0,1.0,0.0,0.0,0.0,0.0,0.0,0.0,0.0,0.0,0.0,0.0,0.0,1.0,0.0,0.0,0.0,0.0,0.0,00-0037077,S.Howell,13.0,00-0035659,T.McLaurin,13.0,,,,,,,,,,,,,,,,,,,,,,,,,,,,,,,,,,,,,,,,,,,,,,DAL,,00-0029542,,S.Gilmore,,,,,,,,,,,,,,0.0,,,,,,,,,,,,,,,,,,,,,,,,,,,,,,,,0.0,,,,,0,,,0.0,0.0,0.0,0.0,,,2023,0.5645951628685,43.54048371315,27,1,First down,1876,"1/7/24, 16:26:48",2024-01-07T22:40:17.660Z,Commanders Field,"Cloudy Temp: 48° F, Humidity: 52%, Wind: WNW 13 mph",cbb026b9-f053-11ed-b4a7-bab79e4492fa,0,0,PASS,0,,2024-01-07T22:40:22.397Z,,9,Turnover,2024-01-07T22:34:16.697Z,8.0,2:32,2.0,0.0,0.0,2.0,2.0,0.0,KICKOFF,INTERCEPTION,04:12,01:40,WAS 25,DAL 47,1750.0,1969.0,38,10,Home,-28,48,-13.0,47.5,1,outdoors,grass,48.0,13.0,Ron Rivera,Mike McCarthy,WAS00,FedExField,0,1.0,S.Howell,14.0,,,T.McLaurin,17.0,1,0,1.0,0,1,00-0037077,,00-0035659,S.Howell,14.0,00-0037077,T.McLaurin,00-0035659,T.McLaurin,00-0035659,1,1,1.79799431515858,0.136997794019177,2.96992338687414,1.0,0.994028754968895,0.994028754968895,0.97848105430603,2.15189456939697,2024-01-07,S.Gilmore,2023,REG,DAL,18,00-0029542,CB,Stephon Gilmore,Stephon,Gilmore,,,,Not injury related - resting player,,Limited Participation in Practice,2024-01-03T20:48:09Z,2024-01-03 20:48:09
1853,2023_01_SF_PIT,2023091006,PIT,SF,REG,1,SF,away,PIT,SF,65.0,2023-09-10,327.0,327.0,2127.0,Half1,0,10.0,0,2,1.0,0,05:27,SF 35,10,34.0,(5:27) (Shotgun) 19-D.Samuel left end to SF 40 for 5 yards (56-A.Highsmith). PIT-97-Ca.Heyward was injured during the play.,run,5.0,1,0,0.0,0,0,0,,,,,left,end,,,,,1,2,0.0,,,,,2.0,1.0,0,20,20.0,0.0,20.0,20.0,0.0,20.0,0.357323527336121,0.0813222676515579,0.00157236517407,0.116347022354603,0.183452427387238,0.0016083130612969,0.258374124765396,0.0,0.0,1.30065209185705,-0.0993567856494337,-27.8711653501318,27.8711653501318,-1.01555625995388,1.01555625995388,-26.5676910907659,26.5676910907659,,,0.0,0.0,-12.982245700201,12.982245700201,-6.99881692213239,6.99881692213239,-11.1966538070701,11.1966538070701,-12.7347989394493,12.7347989394493,0.956845819950104,0.0431541800498962,0.0431541800498962,0.956845819950104,0.005066692829132,0.0036389827728271,-0.0036389827728271,0.0380874872207642,0.961912512779236,0.966563999652863,0.0334360003471375,-0.0411043353378773,0.0411043353378773,-0.482732961771032,0.482732961771032,,,0.0,0.0,-0.101843303886196,0.101843303886196,-0.265436477959156,0.265436477959156,-0.101843303886196,0.101843303886196,-0.319226812571287,0.319226812571287,0.0,0.0,0.0,0.0,0.0,0.0,0.0,0.0,0.0,0,0.0,0.0,0.0,0.0,0.0,0.0,0.0,0.0,0.0,0.0,0.0,0.0,0.0,0.0,1.0,0.0,0.0,0.0,0.0,0.0,0.0,0.0,1.0,0.0,0.0,0.0,0.0,0.0,0.0,0.0,0.0,0.0,0.0,0.0,0.0,0.0,0.0,0.0,0.0,0.0,0.0,,,,,,,00-0035719,D.Samuel,5.0,,,,,,,,,,,,,,,,,,,,,,,,,,,,,,,,,,,,,,,,,,,PIT,,00-0036333,,A.Highsmith,,,,,,,,,,,,,,0.0,,,,,,,,,,,,,,,,,,,,,,,,,,,,,,,,0.0,,,,,0,,,0.0,0.0,0.0,0.0,,,2023,,,19,1,First down,1853,"9/10/23, 13:03:04",2023-09-10T18:13:43.460Z,Acrisure Stadium,"Cloudy Temp: 72° F, Humidity: 83%, Wind: N 3 mph",b07c6b5c-f053-11ed-b4a7-bab79e4492fa,0,0,RUSH,0,,2023-09-10T18:13:48.333Z,,10,Punt,2023-09-10T18:11:34.733Z,11.0,5:18,3.0,0.0,0.0,2.0,2.0,-5.0,PUNT,PUNT,06:53,01:35,SF 24,PIT 42,1759.0,2136.0,30,7,Home,-23,37,-1.5,41.5,0,outdoors,,,,Mike Tomlin,Kyle Shanahan,PIT00,Acrisure Stadium,0,0.0,,,D.Samuel,19.0,,,0,1,0.0,0,1,,00-0035719,,D.Samuel,19.0,00-0035719,D.Samuel,00-0035719,D.Samuel,00-0035719,0,1,-0.0993567856494337,,,,,,0.430303931236267,-43.0303931236267,2023-09-10,Ca.Heyward,2023,REG,PIT,1,00-0027969,DT,Cameron Heyward,Cameron,Heyward,,,,Not injury related - resting player,Stomach,Full Participation in Practice,2023-09-08T19:26:09Z,2023-09-08 19:26:09
1795,2023_04_MIA_BUF,2023100101,BUF,MIA,REG,4,MIA,away,BUF,MIA,86.0,2023-10-01,242.0,242.0,2042.0,Half1,0,8.0,0,2,3.0,0,04:02,MIA 14,2,8.0,(4:02) (Shotgun) 1-T.Tagovailoa pass incomplete short left to 31-R.Mostert [92-D.Jones]. MIA-72-T.Armstead was injured during the play. He is Out. T.Armstead walks off to tunnel.,pass,0.0,1,0,1.0,0,0,0,short,left,2.0,,,,,,,,1,3,0.0,,,,,3.0,1.0,21,14,14.0,21.0,-7.0,14.0,21.0,-7.0,0.445442318916321,0.118364781141281,0.0024695245083421,0.177652150392532,0.0998580455780029,0.0015424750745296,0.154670730233192,0.0,0.0,-0.218244246672839,-1.0560755985789,7.87989814706142,-7.87989814706142,1.44837210996775,-1.44837210996775,4.41988727723947,-4.41988727723947,0.664288472849876,-1.72036407142878,0.0,0.0,-0.433741055428982,0.433741055428982,4.72417967958609,-4.72417967958609,-1.55325325764716,1.55325325764716,5.97314053488663,-5.97314053488663,0.254781067371368,0.745218932628632,0.745218932628632,0.254781067371368,-0.0505095422267914,-0.0254920423030853,0.0254920423030853,0.795728474855423,0.204271525144577,0.251127392053604,0.748872607946396,0.0210149504515015,-0.0210149504515015,0.172364590881492,-0.172364590881492,0.0,-0.0505095422267914,0.0,0.0,-0.0457646212400638,0.0457646212400638,0.194989675740788,-0.194989675740788,-0.0457646212400638,0.0457646212400638,0.218129212121555,-0.218129212121555,0.0,0.0,0.0,0.0,0.0,1.0,0.0,0.0,1.0,0,0.0,0.0,0.0,0.0,0.0,0.0,0.0,0.0,0.0,0.0,0.0,0.0,0.0,0.0,0.0,0.0,0.0,0.0,0.0,0.0,0.0,1.0,0.0,1.0,0.0,0.0,0.0,0.0,0.0,0.0,0.0,0.0,0.0,0.0,0.0,0.0,0.0,0.0,0.0,0.0,0.0,00-0036212,T.Tagovailoa,,00-0031687,R.Mostert,,,,,,,,,,,,,,,,,,,,,,,,,,,,,,,,,,,,,00-0031054,D.Jones,,,,,,,,,,,,,,,,,,,,,,,,,,,0.0,,,,,,,,,,,,,,,,,,,,,,,,,,,,,,,,0.0,,,,,0,,,0.0,0.0,0.0,0.0,,,2023,0.500238120555878,-50.0238120555878,26,0,Punt,1795,"10/1/23, 13:02:27",2023-10-01T18:15:39.117Z,Highmark Stadium,"Sunny, fair Temp: 70° F, Humidity: 71%, Wind: WNW 5 mph",b07d3d5d-f053-11ed-b4a7-bab79e4492fa,0,0,PASS,0,,2023-10-01T18:15:42.587Z,,8,Punt,2023-10-01T18:14:13.197Z,3.0,1:37,0.0,0.0,0.0,2.0,2.0,0.0,PUNT,PUNT,05:28,03:51,MIA 6,MIA 14,1748.0,1825.0,20,48,Home,28,68,2.5,53.0,1,outdoors,a_turf,70.0,2.0,Sean McDermott,Mike McDaniel,BUF00,New Era Field,0,0.0,T.Tagovailoa,1.0,,,R.Mostert,31.0,1,0,0.0,0,1,00-0036212,,00-0031687,T.Tagovailoa,1.0,00-0036212,R.Mostert,00-0031687,R.Mostert,00-0031687,0,1,-1.0560755985789,0.287067319367337,5.85730878396134,3.0,0.984571810113266,0.984571810113266,0.768228769302368,23.1771230697632,2023-10-01,T.Armstead,2023,REG,MIA,4,00-0030067,T,Terron Armstead,Terron,Armstead,"back, ankle, knee",,Questionable,"back, ankle, knee",,Limited Participation in Practice,2023-09-29T19:56:32Z,2023-09-29 19:56:32
1794,2023_18_JAX_TEN,2024010702,TEN,JAX,REG,18,JAX,away,TEN,TEN,35.0,2024-01-07,183.0,183.0,1983.0,Half1,0,9.0,0,2,,0,03:03,TEN 35,0,33.0,13-T.Zentner kicks 69 yards from TEN 35 to JAX -4. 4-T.Bigsby pushed ob at JAX 20 for 24 yards (38-T.Edmunds; 35-K.Wallace). TEN-41-O.Reese was injured during the play.,kickoff,0.0,0,0,0.0,0,0,0,,,,,,,,69.0,,,3,3,0.0,,,,,3.0,3.0,21,10,10.0,21.0,-11.0,10.0,21.0,-11.0,0.397882699966431,0.0995207503437996,0.0010816825088113,0.123559609055519,0.14239639043808,0.0022157039493322,0.233343124389648,0.0,0.0,0.899379570502788,-0.273506317520514,11.4778015012572,-11.4778015012572,10.8398552696347,-10.8398552696347,-0.930836620449554,0.930836620449554,,,0.0,0.0,-5.65463614970213,5.65463614970213,1.89692254317924,-1.89692254317924,-4.72593809693353,4.72593809693353,3.79510147648398,-3.79510147648398,0.152263462543488,0.847736537456513,0.847736537456513,0.152263462543488,-0.0074411183595657,-0.0144500136375427,0.0144500136375427,0.855177655816078,0.144822344183922,0.288747489452362,0.711252510547638,0.318776220351947,-0.318776220351947,-0.0473282971633844,0.0473282971633844,,,0.0,0.0,-0.0358047485351563,0.0358047485351563,-0.0890907236589364,0.0890907236589364,-0.0358047485351563,0.0358047485351563,-0.0115235486282281,0.0115235486282281,0.0,0.0,0.0,0.0,0.0,0.0,0.0,0.0,0.0,0,0.0,0.0,0.0,0.0,0.0,0.0,0.0,1.0,0.0,0.0,0.0,0.0,0.0,0.0,0.0,0.0,0.0,0.0,0.0,0.0,0.0,0.0,0.0,0.0,0.0,0.0,0.0,0.0,0.0,0.0,0.0,0.0,1.0,0.0,0.0,0.0,1.0,0.0,0.0,0.0,0.0,,,,,,,,,,,,,,,,,,,,,,,,,,T.Bigsby,00-0038555,,,,,T.Zentner,00-0038490,,,,,,,,,,,,,,,,,,,,,,,,,00-0034858,T.Edmunds,TEN,00-0036395,K.Wallace,TEN,,,,,,,0.0,,,,,,,,,,,,,,,,,,,,,,,,,,,,,,,JAX,24.0,,,,,0,,,0.0,0.0,0.0,0.0,,,2023,,,24,1,First down,1794,"1/7/24, 13:02:26",2024-01-07T19:13:16.537Z,Nissan Stadium,"Cloudy Temp: 41° F, Humidity: 77%, Wind: W 11 mph",cbb02235-f053-11ed-b4a7-bab79e4492fa,0,0,KICK_OFF,1,,2024-01-07T19:13:25.517Z,,9,Turnover,2024-01-07T19:13:16.537Z,5.0,1:57,2.0,0.0,0.0,2.0,2.0,-5.0,KICKOFF,INTERCEPTION,03:03,01:06,JAX 20,TEN 47,1794.0,1967.0,20,28,Home,8,48,-3.5,41.5,1,outdoors,grass,41.0,11.0,Mike Vrabel,Doug Pederson,NAS00,Nissan Stadium,0,0.0,,,,,,,0,0,0.0,1,0,,,,,,,,,,,1,0,-0.273506317520514,,,,,,,,2024-01-07,O.Reese,2023,REG,TEN,18,00-0038853,LB,Otis Reese,Otis,Reese,,,,Groin,,Full Participation in Practice,2024-01-05T19:54:11Z,2024-01-05 19:54:11
1787,2023_18_MIN_DET,2024010703,DET,MIN,REG,18,DET,home,MIN,DET,76.0,2024-01-07,120.0,120.0,1920.0,Half1,0,9.0,0,2,3.0,0,02:00,DET 24,4,17.0,"(2:00) (Shotgun) 16-J.Goff pass short left to 87-S.LaPorta to DET 29 for 5 yards (44-J.Metellus). DET-87-S.LaPorta was injured during the play. He is Out. Penalty on MIN-20-J.Ward, Illegal Use of Hands, declined.",pass,5.0,1,0,1.0,0,0,0,short,left,3.0,2.0,,,,,,,2,3,0.0,,,,,2.0,3.0,13,3,13.0,3.0,10.0,13.0,3.0,10.0,0.423575609922409,0.13619427382946,0.0010819263989105,0.129011690616608,0.141083613038063,0.0021080512087792,0.166944861412048,0.0,0.0,0.282252462813631,1.06168076267932,10.4739001456222,-10.4739001456222,-0.580590916855726,0.580590916855726,7.21576412841694,-7.21576412841694,-0.988915074849501,2.05059583752882,-0.988915074849501,2.05059583752882,1.17769281187793,-1.17769281187793,2.93842730611812,-2.93842730611812,-2.89319241390331,2.89319241390331,6.79559493075374,-6.79559493075374,0.824779689311981,0.175220310688019,0.824779689311981,0.175220310688019,0.0148095488548279,0.0137385725975037,0.0137385725975037,0.839589238166809,0.160410761833191,0.845532059669495,0.845532059669495,0.0282079726457596,-0.0282079726457596,0.174693117906244,-0.174693117906244,0.0,0.0148095488548279,0.0,0.0148095488548279,-0.0099796251758028,0.0099796251758028,0.166521370410919,-0.166521370410919,-0.0099796251758028,0.0099796251758028,0.124552235007286,-0.124552235007286,0.0,0.0,1.0,0.0,1.0,0.0,0.0,0.0,0.0,0,0.0,0.0,0.0,0.0,0.0,0.0,0.0,0.0,0.0,0.0,0.0,0.0,0.0,0.0,1.0,0.0,0.0,0.0,0.0,0.0,0.0,0.0,0.0,1.0,0.0,0.0,0.0,0.0,0.0,0.0,0.0,0.0,0.0,0.0,0.0,1.0,0.0,0.0,0.0,0.0,0.0,00-0033106,J.Goff,5.0,00-0039065,S.LaPorta,5.0,,,,,,,,,,,,,,,,,,,,,,,,,,,,,,,,,,,,,,,,,,,,,,MIN,,00-0036348,,J.Metellus,,,,,,,,,,,,,,0.0,,,,,,,,,,,,,,,,,,,,,,,,,,,,,,,,0.0,,,,,0,,,0.0,0.0,0.0,0.0,,,2023,0.752845764160156,24.7154235839844,24,1,First down,1787,"1/7/24, 13:03:09",2024-01-07T19:18:35.740Z,Ford Field,"Controlled Climate Temp: 68° F, Humidity: 70%, Wind: mph",cbafedb3-f053-11ed-b4a7-bab79e4492fa,0,0,PASS,0,,2024-01-07T19:18:40.167Z,,9,Punt,2024-01-07T19:14:41.540Z,6.0,1:23,1.0,0.0,0.0,2.0,2.0,0.0,PUNT,PUNT,02:35,01:12,DET 18,DET 35,1735.0,1914.0,20,30,Home,10,50,3.5,47.5,1,dome,fieldturf,,,Dan Campbell,Kevin O'Connell,DET00,Ford Field,0,1.0,J.Goff,16.0,,,S.LaPorta,87.0,1,0,1.0,0,1,00-0033106,,00-0039065,J.Goff,16.0,00-0033106,S.LaPorta,00-0039065,S.LaPorta,00-0039065,0,1,1.06168076267932,1.50169949976379,4.57123311523901,2.0,0.685486783855595,0.685486783855595,0.962842226028442,3.71577739715576,2024-01-07,S.LaPorta,2023,REG,DET,18,00-0039065,TE,Sam LaPorta,Sam,LaPorta,,,,Ankle,,Full Participation in Practice,2024-01-05T20:41:48Z,2024-01-05 20:41:48
1787,2023_16_NYG_PHI,2023122501,PHI,NYG,REG,16,NYG,away,PHI,PHI,42.0,2023-12-25,373.0,373.0,2173.0,Half1,0,9.0,0,2,2.0,0,06:13,PHI 42,8,38.0,(6:13) (Shotgun) 26-S.Barkley right guard to PHI 37 for 5 yards (53-S.Leonard). NYG-67-J.Pugh was injured during the play.,run,5.0,1,0,0.0,0,0,0,,,,,right,guard,,,,,2,3,0.0,,,,,3.0,2.0,17,3,3.0,17.0,-14.0,3.0,17.0,-14.0,0.190181270241737,0.0627200976014137,0.0009234807803295,0.0899525359272957,0.261111408472061,0.0018119032029062,0.393299341201782,0.0,0.0,2.7203784143785,0.171489545493387,14.1030738069395,-14.1030738069395,-0.328314890095498,0.328314890095498,11.8803375223737,-11.8803375223737,,,0.0,0.0,11.5441523190239,-11.5441523190239,-1.78301005810499,1.78301005810499,12.7378537350451,-12.7378537350451,-2.18918126640219,2.18918126640219,0.123164415359497,0.876835584640503,0.876835584640503,0.123164415359497,-0.0006269514560699,-1.82539224624634e-05,1.82539224624634e-05,0.877462536096573,0.122537463903427,0.0285252500325441,0.971474749967456,0.0280164165751202,-0.0280164165751202,0.194559335310974,-0.194559335310974,,,0.0,0.0,0.0863370895385742,-0.0863370895385742,0.0957112233834645,-0.0957112233834645,0.0843560993671417,-0.0843560993671417,0.103608734508075,-0.103608734508075,0.0,0.0,0.0,0.0,0.0,0.0,0.0,0.0,0.0,0,0.0,0.0,0.0,0.0,0.0,0.0,0.0,0.0,0.0,0.0,0.0,0.0,0.0,0.0,1.0,0.0,0.0,0.0,0.0,0.0,0.0,0.0,1.0,0.0,0.0,0.0,0.0,0.0,0.0,0.0,0.0,0.0,0.0,0.0,0.0,0.0,0.0,0.0,0.0,0.0,0.0,,,,,,,00-0034844,S.Barkley,5.0,,,,,,,,,,,,,,,,,,,,,,,,,,,,,,,,,,,,,,,,,,,PHI,,00-0034846,,S.Leonard,,,,,,,,,,,,,,0.0,,,,,,,,,,,,,,,,,,,,,,,,,,,,,,,,0.0,,,,,0,,,0.0,0.0,0.0,0.0,,,2023,,,21,1,First down,1787,"12/25/23, 16:35:39",2023-12-25T22:46:20.910Z,Lincoln Financial Field,"Cloudy Temp: 51° F, Humidity: 68%, Wind: NE 5 mph",cbaf6e72-f053-11ed-b4a7-bab79e4492fa,0,0,RUSH,0,,2023-12-25T22:46:24.633Z,,9,Turnover on downs,2023-12-25T22:41:28.920Z,12.0,5:40,2.0,0.0,0.0,2.0,2.0,4.0,PUNT,DOWNS,08:27,02:47,NYG 37,PHI 21,1619.0,1936.0,25,33,Home,8,58,14.0,41.0,1,outdoors,grass,51.0,5.0,Nick Sirianni,Brian Daboll,PHI00,Lincoln Financial Field,0,1.0,,,S.Barkley,26.0,,,0,1,0.0,0,1,,00-0034844,,S.Barkley,26.0,00-0034844,S.Barkley,00-0034844,S.Barkley,00-0034844,0,0,0.171489545493387,,,,,,0.720681607723236,-72.0681607723236,2023-12-25,J.Pugh,2023,REG,NYG,16,00-0030585,G,Justin Pugh,Justin,Pugh,,,,Calf,Neck,Full Participation in Practice,2023-12-23T19:05:29Z,2023-12-23 19:05:29
1766,2023_13_DEN_HOU,2023120307,HOU,DEN,REG,13,DEN,away,HOU,HOU,26.0,2023-12-03,120.0,120.0,1920.0,Half1,0,10.0,0,2,2.0,0,02:00,HOU 26,4,56.0,(2:00) 38-J.McLaughlin right end to HOU 20 for 6 yards (5-J.Pitre). DEN-84-C.Manhertz was injured during the play. His return is Questionable.,run,6.0,0,0,0.0,0,0,0,,,,,right,end,,,,,3,3,0.0,,,,,3.0,3.0,13,0,0.0,13.0,-13.0,0.0,13.0,-13.0,0.159534394741058,0.0239228550344706,0.0002904066641349,0.0255220141261816,0.336307197809219,0.0009648065897636,0.453458309173584,0.0,0.0,3.93405589350732,0.419479043921456,10.3028760882214,-10.3028760882214,-0.128224212495192,0.128224212495192,9.25809305665405,-9.25809305665405,,,0.0,0.0,11.6867179954425,-11.6867179954425,-0.4727173204883,0.4727173204883,5.25765695906011,-5.25765695906011,1.23218498074073,-1.23218498074073,0.194267272949219,0.805732727050781,0.805732727050781,0.194267272949219,-0.0104712694883347,0.0012419670820236,-0.0012419670820236,0.816203996539116,0.183796003460884,0.15333479642868,0.84666520357132,0.0122117793862415,-0.0122117793862415,0.194783791899681,-0.194783791899681,,,0.0,0.0,0.0110052824020386,-0.0110052824020386,0.197323322296143,-0.197323322296143,0.0110052824020386,-0.0110052824020386,0.121409580111504,-0.121409580111504,0.0,1.0,0.0,0.0,0.0,0.0,0.0,0.0,0.0,0,0.0,0.0,0.0,0.0,0.0,0.0,0.0,0.0,0.0,0.0,0.0,0.0,0.0,0.0,1.0,0.0,0.0,0.0,0.0,0.0,0.0,0.0,1.0,0.0,0.0,0.0,0.0,0.0,0.0,0.0,0.0,0.0,0.0,0.0,0.0,0.0,0.0,0.0,0.0,0.0,0.0,,,,,,,00-0038794,J.McLaughlin,6.0,,,,,,,,,,,,,,,,,,,,,,,,,,,,,,,,,,,,,,,,,,,HOU,,00-0037246,,J.Pitre,,,,,,,,,,,,,,0.0,,,,,,,,,,,,,,,,,,,,,,,,,,,,,,,,0.0,,,,,0,,,0.0,0.0,0.0,0.0,,,2023,,,21,1,First down,1766,"12/3/23, 13:02:37",2023-12-03T19:20:06.707Z,NRG Stadium,"Partly Sunny Temp: 67° F, Humidity: 37%, Wind: WNW 5 mph",cbae4537-f053-11ed-b4a7-bab79e4492fa,0,0,RUSH,0,,2023-12-03T19:20:11.520Z,,10,Field goal,2023-12-03T19:11:53.080Z,13.0,5:09,4.0,1.0,1.0,2.0,2.0,0.0,PUNT,FIELD_GOAL,06:33,01:24,DEN 28,HOU 16,1575.0,1889.0,17,22,Home,5,39,3.5,47.5,0,closed,astroturf,,,DeMeco Ryans,Sean Payton,HOU00,NRG Stadium,0,1.0,,,J.McLaughlin,38.0,,,0,1,1.0,0,1,,00-0038794,,J.McLaughlin,38.0,00-0038794,J.McLaughlin,00-0038794,J.McLaughlin,00-0038794,0,1,0.419479043921456,,,,,,0.691504836082459,-69.1504836082459,2023-12-03,C.Manhertz,2023,REG,DEN,13,00-0031484,TE,Chris Manhertz,Chris,Manhertz,,,,Not injury related - resting player,,Full Participation in Practice,2023-12-01T21:11:57Z,2023-12-01 21:11:57
1753,2023_11_LAC_GB,2023111903,GB,LAC,REG,11,GB,home,LAC,GB,54.0,2023-11-19,189.0,189.0,1989.0,Half1,0,9.0,0,2,1.0,0,03:09,GB 46,10,71.0,"(3:09) 33-A.Jones left tackle to GB 48 for 2 yards (9-K.Murray, 95-N.Williams). GB-33-A.Jones was injured during the play. He is Out.",run,2.0,0,0,0.0,0,0,0,,,,,left,tackle,,,,,3,2,0.0,,,,,3.0,2.0,7,10,7.0,10.0,-3.0,7.0,10.0,-3.0,0.370942056179047,0.0562502183020115,0.0004578993539325,0.06869026273489,0.198347568511963,0.0032757958397269,0.302036225795746,0.0,0.0,2.06534958502743,-0.389028624224011,-5.05160845251521,5.05160845251521,-0.962382200450585,0.962382200450585,1.16566100205365,-1.16566100205365,,,0.0,0.0,-8.88807502092095,8.88807502092095,6.00177027739119,-6.00177027739119,-16.2947229896672,16.2947229896672,17.4294744762692,-17.4294744762692,0.465228408575058,0.534771591424942,0.465228408575058,0.534771591424942,-0.0186418890953064,-0.0228793025016785,-0.0228793025016785,0.446586519479752,0.553413480520248,0.31037163734436,0.31037163734436,0.0067649972538312,-0.0067649972538312,0.0215778358316698,-0.0215778358316698,,,0.0,0.0,-0.0459611117839813,0.0459611117839813,0.0275098986959734,-0.0275098986959734,-0.0459611117839813,0.0459611117839813,0.0791036494112292,-0.0791036494112292,0.0,0.0,0.0,0.0,0.0,0.0,0.0,0.0,0.0,0,0.0,0.0,0.0,0.0,0.0,0.0,0.0,0.0,0.0,0.0,0.0,0.0,0.0,0.0,0.0,0.0,0.0,0.0,0.0,0.0,0.0,0.0,1.0,0.0,0.0,0.0,0.0,0.0,0.0,0.0,0.0,0.0,0.0,0.0,0.0,0.0,1.0,0.0,0.0,0.0,0.0,,,,,,,00-0033293,A.Jones,2.0,,,,,,,,,,,,,,,,,,,,,,,,,,,,,,,,,,,,,,,,,,,,,,,,,00-0030500,N.Williams,LAC,,,,,,,,,,1.0,00-0036441,K.Murray,LAC,,,,,,,,,,,,,,,,,,,,,,,,,,,,,0.0,,,,,0,,,0.0,0.0,0.0,0.0,,,2023,,,22,1,First down,1753,"11/19/23, 13:02:30",2023-11-19T19:12:59.297Z,Lambeau Field,"Sunny Temp: 45° F, Humidity: 55%, Wind: E 5 mph",cbacfd43-f053-11ed-b4a7-bab79e4492fa,0,0,RUSH,0,,2023-11-19T19:13:03.380Z,,9,Field goal,2023-11-19T19:09:00.060Z,16.0,5:44,5.0,1.0,1.0,2.0,2.0,-5.0,PUNT,FIELD_GOAL,05:51,00:07,GB 19,LAC 10,1604.0,2050.0,20,23,Home,3,43,-3.0,44.0,0,outdoors,grass,45.0,5.0,Matt LaFleur,Brandon Staley,GNB00,Lambeau Field,0,0.0,,,A.Jones,33.0,,,0,1,0.0,0,1,,00-0033293,,A.Jones,33.0,00-0033293,A.Jones,00-0033293,A.Jones,00-0033293,0,1,-0.389028624224011,,,,,,0.594012439250946,-59.4012439250946,2023-11-19,A.Jones,2023,REG,GB,11,00-0033293,RB,Aaron Jones,Aaron,Jones,,,,Hamstring,,Limited Participation in Practice,2023-11-17T20:50:15Z,2023-11-17 20:50:15
1706,2023_16_LV_KC,2023122500,KC,LV,REG,16,KC,home,LV,LV,35.0,2023-12-25,288.0,288.0,2088.0,Half1,0,11.0,0,2,,0,04:48,LV 35,0,57.0,"2-D.Carlson kicks 65 yards from LV 35 to end zone, Touchback. LV-19-D.Turner was injured during the play.",kickoff,0.0,0,0,0.0,0,0,0,,,,,,,,65.0,,,2,3,0.0,,,,,2.0,3.0,7,17,7.0,17.0,-10.0,7.0,17.0,-10.0,0.36163467168808,0.0951747596263885,0.0009151141275651,0.158193856477737,0.157640933990479,0.0037059595342725,0.222734659910202,0.0,0.0,0.644765837932937,0.0755682421149686,-12.1053411261961,12.1053411261961,-10.3541548379292,10.3541548379292,-5.41872090651388,5.41872090651388,,,0.0,0.0,1.01370605800101,-1.01370605800101,0.785324254538864,-0.785324254538864,-1.59025916180774,1.59025916180774,-1.51256825251039,1.51256825251039,0.217854648828506,0.782145351171494,0.217854648828506,0.782145351171494,0.0,0.0047917962074279,0.0047917962074279,0.217854648828506,0.782145351171494,0.453395128250122,0.453395128250122,-0.365303200250241,0.365303200250241,-0.090390398837626,0.090390398837626,,,0.0,0.0,0.0671586990356445,-0.0671586990356445,0.0249117612838745,-0.0249117612838745,0.0671586990356445,-0.0671586990356445,-0.119822278358042,0.119822278358042,0.0,0.0,0.0,0.0,0.0,0.0,0.0,0.0,0.0,1,0.0,0.0,0.0,0.0,0.0,0.0,0.0,0.0,0.0,0.0,0.0,0.0,0.0,0.0,0.0,0.0,0.0,0.0,0.0,0.0,0.0,0.0,0.0,0.0,0.0,0.0,0.0,0.0,0.0,0.0,0.0,0.0,1.0,0.0,0.0,0.0,0.0,0.0,0.0,0.0,0.0,,,,,,,,,,,,,,,,,,,,,,,,,,,,,,,,D.Carlson,00-0034161,,,,,,,,,,,,,,,,,,,,,,,,,,,,,,,,,,,,,0.0,,,,,,,,,,,,,,,,,,,,,,,,,,,,,,,KC,0.0,,,,,0,,,0.0,0.0,0.0,0.0,,,2023,,,23,1,First down,1706,"12/25/23, 13:02:40",2023-12-25T19:11:10.223Z,GEHA Field at Arrowhead Stadium,"Temp: 38° F, Humidity: 89%, Wind: W 11 mph",cbaf696f-f053-11ed-b4a7-bab79e4492fa,0,0,KICK_OFF,1,,2023-12-25T19:11:14.260Z,,11,Missed field goal,2023-12-25T19:11:10.223Z,13.0,4:43,3.0,1.0,0.0,2.0,2.0,0.0,KICKOFF,MISSED_FG,04:48,00:05,KC 25,LV 18,1706.0,2119.0,20,14,Home,-6,34,11.0,40.5,1,outdoors,grass,38.0,11.0,Andy Reid,Antonio Pierce,KAN00,GEHA Field at Arrowhead Stadium,0,1.0,,,,,,,0,0,0.0,1,0,,,,,,,,,,,0,1,0.0755682421149686,,,,,,,,2023-12-25,D.Turner,2023,REG,LV,16,00-0036527,WR,D.J. Turner,D.J.,Turner,Shoulder,,Questionable,Shoulder,,Limited Participation in Practice,2023-12-23T20:07:57Z,2023-12-23 20:07:57
1701,2023_18_CLE_CIN,2024010701,CIN,CLE,REG,18,CIN,home,CLE,CLE,34.0,2024-01-07,187.0,187.0,1987.0,Half1,0,12.0,0,2,2.0,0,03:07,CLE 34,10,7.0,"(3:07) 30-C.Brown right end to CLE 32 for 2 yards (91-A.Wright, 42-T.Fields). CLE-93-S.Harris was injured during the play.",run,2.0,0,0,0.0,0,0,0,,,,,right,end,,,,,1,2,0.0,,,,,1.0,2.0,21,0,21.0,0.0,21.0,21.0,0.0,21.0,0.285673379898071,0.0349395871162415,0.0002732980356086,0.0430193208158016,0.310410052537918,0.0017252380494028,0.323959141969681,0.0,0.0,2.79589402436977,-0.380218194972258,27.3514506666268,-27.3514506666268,8.20366829354316,-8.20366829354316,19.187857542478,-19.187857542478,,,0.0,0.0,3.55449124594452,-3.55449124594452,6.38256487861509,-6.38256487861509,-5.38143833051436,5.38143833051436,20.7608974131872,-20.7608974131872,0.968909382820129,0.0310906171798706,0.968909382820129,0.0310906171798706,-0.0053516626358032,-0.0011895895004272,-0.0011895895004272,0.963557720184326,0.0364422798156738,0.992372155189514,0.992372155189514,0.110222551140798,-0.110222551140798,0.272645779767818,-0.272645779767818,,,0.0,0.0,0.019099613438101,-0.019099613438101,0.196526109336948,-0.196526109336948,0.019099613438101,-0.019099613438101,0.186833846478796,-0.186833846478796,0.0,0.0,0.0,0.0,0.0,0.0,0.0,0.0,0.0,0,0.0,0.0,0.0,0.0,0.0,0.0,0.0,0.0,0.0,0.0,0.0,0.0,0.0,0.0,0.0,0.0,0.0,0.0,0.0,0.0,0.0,0.0,1.0,0.0,0.0,0.0,0.0,0.0,0.0,0.0,0.0,0.0,0.0,0.0,0.0,0.0,1.0,0.0,0.0,0.0,0.0,,,,,,,00-0038597,C.Brown,2.0,,,,,,,,,,,,,,,,,,,,,,,,,,,,,,,,,,,,,,,,,,,,,,,,,00-0036634,T.Fields,CLE,,,,,,,,,,1.0,00-0037251,A.Wright,CLE,,,,,,,,,,,,,,,,,,,,,,,,,,,,,0.0,,,,,0,,,0.0,0.0,0.0,0.0,,,2023,,,25,0,Field goal,1701,"1/7/24, 13:02:35",2024-01-07T19:13:20.097Z,Paycor Stadium,"Cloudy Temp: 38° F, Humidity: 74%, Wind: W 12 mph",cbafe84a-f053-11ed-b4a7-bab79e4492fa,0,0,RUSH,0,,2024-01-07T19:13:24.367Z,,12,Field goal,2024-01-07T19:12:38.120Z,4.0,1:19,0.0,0.0,1.0,2.0,2.0,0.0,INTERCEPTION,FIELD_GOAL,03:14,01:55,CLE 34,CLE 27,1678.0,1758.0,14,31,Home,17,45,7.5,37.0,1,outdoors,fieldturf,38.0,12.0,Zac Taylor,Kevin Stefanski,CIN00,Paycor Stadium,0,0.0,,,C.Brown,30.0,,,0,1,0.0,0,1,,00-0038597,,C.Brown,30.0,00-0038597,C.Brown,00-0038597,C.Brown,00-0038597,0,0,-0.380218194972258,,,,,,0.621614694595337,-62.1614694595337,2024-01-07,S.Harris,2023,REG,CLE,18,00-0031270,DT,Shelby Harris,Shelby,Harris,,,,Back,,Limited Participation in Practice,2024-01-05T19:54:16Z,2024-01-05 19:54:16
1679,2023_14_MIN_LV,2023121007,LV,MIN,REG,14,MIN,away,LV,MIN,53.0,2023-12-10,68.0,68.0,1868.0,Half1,0,8.0,0,2,4.0,0,01:08,MIN 47,14,37.0,"(1:08) 14-R.Wright punts 43 yards to LV 10, Center-42-A.DePaola, fair catch by 3-D.Carter. LV-43-K.Mauga was injured during the play.",punt,0.0,0,0,0.0,0,0,0,,,,,,,,43.0,,,1,2,0.0,,,,,2.0,1.0,0,0,0.0,0.0,0.0,0.0,0.0,0.0,0.703416645526886,0.0952871218323708,0.0008641076856292,0.0504767708480358,0.0842738002538681,0.001076188404113,0.0646053627133369,0.0,0.0,0.0662843397585675,-0.536105307168327,-1.37146301660687,1.37146301660687,0.519837065134198,-0.519837065134198,-3.70563604263242,3.70563604263242,,,0.0,0.0,-13.7178211935097,13.7178211935097,6.44159830349963,-6.44159830349963,-15.5138272916083,15.5138272916083,8.03637861862427,-8.03637861862427,0.447386562824249,0.552613437175751,0.552613437175751,0.447386562824249,0.0425084233283997,0.0701294243335724,-0.0701294243335724,0.510105013847351,0.489894986152649,0.567377090454102,0.432622909545898,-0.0028841495513916,0.0028841495513916,-0.173629015684128,0.173629015684128,,,0.0,0.0,-0.168965727090836,0.168965727090836,-0.100656419992447,0.100656419992447,-0.172742247581482,0.172742247581482,-0.0651426613330841,0.0651426613330841,0.0,0.0,0.0,0.0,0.0,0.0,0.0,0.0,0.0,0,0.0,1.0,0.0,0.0,0.0,1.0,0.0,0.0,0.0,0.0,0.0,0.0,0.0,0.0,0.0,0.0,0.0,0.0,0.0,0.0,0.0,0.0,0.0,0.0,0.0,0.0,0.0,0.0,0.0,0.0,0.0,0.0,0.0,1.0,0.0,0.0,0.0,0.0,0.0,0.0,0.0,,,,,,,,,,,,,,,,,,,,,,00-0031763,D.Carter,,,,,,,00-0037500,R.Wright,,,,,,,,,,,,,,,,,,,,,,,,,,,,,,,,,,,,,,,0.0,,,,,,,,,,,,,,,,,,,,,,,,,,,,,,,LV,0.0,,,,,0,,,0.0,0.0,0.0,0.0,,,2023,,,20,0,Punt,1679,"12/10/23, 16:05:30",2023-12-10T22:17:26Z,Allegiant Stadium,"Mostly Sunny Temp: 54° F, Humidity: 15%, Wind: ENE 3 mph",cbae9976-f053-11ed-b4a7-bab79e4492fa,0,0,PUNT,1,,,,8,Punt,2023-12-10T22:06:37.147Z,8.0,2:56,3.0,0.0,0.0,2.0,2.0,5.0,PUNT,PUNT,03:58,01:02,MIN 10,MIN 47,1442.0,1679.0,3,0,Home,-3,3,-3.0,40.5,0,dome,grass,,,Antonio Pierce,Kevin O'Connell,VEG00,Allegiant Stadium,0,0.0,,,,,,,0,0,0.0,1,0,,,,,,,,,,,0,1,-0.536105307168327,,,,,,,,2023-12-10,K.Mauga,2023,REG,LV,14,00-0037383,LB,Kana'i Mauga,Kana'i,Mauga,Knee,,Questionable,Knee,,Full Participation in Practice,2023-12-08T22:11:44Z,2023-12-08 22:11:44
1678,2023_18_NYJ_NE,2024010704,NE,NYJ,REG,18,NYJ,away,NE,NYJ,58.0,2024-01-07,236.0,236.0,2036.0,Half1,0,12.0,0,2,2.0,0,03:56,NYJ 42,4,33.0,(3:56) 14-T.Siemian pass short left to 17-G.Wilson pushed ob at NYJ 46 for 4 yards (31-J.Jones). NE-48-Ja.Tavai was injured during the play.,pass,4.0,0,0,1.0,0,0,0,short,left,-1.0,5.0,,,,,,,2,2,0.0,,,,,2.0,2.0,3,6,6.0,3.0,3.0,6.0,3.0,3.0,0.396548092365265,0.0670368894934654,0.000619106402155,0.0899373069405556,0.175016030669212,0.0029270213562995,0.267915517091751,0.0,0.0,1.5744007244939,0.300045976066031,-7.66586254490539,7.66586254490539,-3.36306950054131,3.36306950054131,-3.57904188900211,3.57904188900211,-0.774528583395295,1.07457455946133,-0.774528583395295,1.07457455946133,-0.879452818771824,0.879452818771824,-0.355257778603118,0.355257778603118,-9.67597098473925,9.67597098473925,8.87174146255056,-8.87174146255056,0.654183924198151,0.345816075801849,0.345816075801849,0.654183924198151,0.0110476016998291,0.0104933977127075,-0.0104933977127075,0.33476847410202,0.66523152589798,0.669888734817505,0.330111265182495,-0.097811222076416,0.097811222076416,-0.173038989305496,0.173038989305496,0.0,0.0110476016998291,0.0,0.0110476016998291,0.0060258507728576,-0.0060258507728576,-0.025947779417038,0.025947779417038,0.0060258507728576,-0.0060258507728576,-0.093621551990509,0.093621551990509,0.0,0.0,1.0,0.0,0.0,0.0,0.0,0.0,0.0,0,0.0,0.0,0.0,0.0,0.0,0.0,0.0,0.0,0.0,0.0,0.0,0.0,0.0,0.0,1.0,0.0,0.0,0.0,0.0,0.0,0.0,0.0,0.0,1.0,0.0,0.0,0.0,0.0,0.0,0.0,0.0,0.0,0.0,0.0,0.0,1.0,0.0,0.0,0.0,0.0,0.0,00-0032156,T.Siemian,4.0,00-0037740,G.Wilson,4.0,,,,,,,,,,,,,,,,,,,,,,,,,,,,,,,,,,,,,,,,,,,,,,NE,,00-0032580,,J.Jones,,,,,,,,,,,,,,0.0,,,,,,,,,,,,,,,,,,,,,,,,,,,,,,,,0.0,,,,,0,,,0.0,0.0,0.0,0.0,,,2023,0.862110018730164,13.7889981269836,19,1,First down,1678,"1/7/24, 13:02:31",2024-01-07T19:12:07.557Z,Gillette Stadium,"Snow Temp: 33° F, Humidity: 98%, Wind: SW 14 mph",cbb00bfa-f053-11ed-b4a7-bab79e4492fa,0,0,PASS,0,,2024-01-07T19:12:11.827Z,,12,Missed field goal,2024-01-07T19:11:22Z,10.0,4:19,3.0,0.0,0.0,2.0,2.0,0.0,PUNT,MISSED_FG,04:40,00:21,NYJ 36,NE 31,1649.0,1893.0,17,3,Home,-14,20,2.5,28.5,1,outdoors,fieldturf,33.0,14.0,Bill Belichick,Robert Saleh,BOS00,Gillette Stadium,0,1.0,T.Siemian,14.0,,,G.Wilson,17.0,1,0,1.0,0,1,00-0032156,,00-0037740,T.Siemian,14.0,00-0032156,G.Wilson,00-0037740,G.Wilson,00-0037740,1,1,0.300045976066031,1.08234771936247,7.06950978215173,6.0,0.569799510587473,0.569799510587473,0.437031120061874,56.2968879938126,2024-01-07,Ja.Tavai,2023,REG,NE,18,00-0035240,LB,Jahlani Tavai,Jahlani,Tavai,Tooth,,Questionable,Tooth,,Limited Participation in Practice,2024-01-05T20:39:21Z,2024-01-05 20:39:21
1674,2023_17_ARI_PHI,2023123108,PHI,ARI,REG,17,PHI,home,ARI,PHI,67.0,2023-12-31,83.0,83.0,1883.0,Half1,0,6.0,0,2,3.0,0,01:23,PHI 33,2,75.0,"(1:23) (No Huddle, Shotgun) 1-J.Hurts pass short right to 11-A.Brown to PHI 42 for 9 yards (33-A.Hamilton). ARI-21-G.Williams was injured during the play. He is Out.",pass,9.0,1,1,1.0,0,0,0,short,right,6.0,3.0,,,,,,,2,3,0.0,,,,,2.0,3.0,14,6,14.0,6.0,8.0,14.0,6.0,8.0,0.564776420593262,0.0828957781195641,0.0008417370263487,0.0688547715544701,0.169343307614326,0.0014652195386588,0.111822761595249,0.0,0.0,0.561365483794361,0.912757804093417,7.95468845838438,-7.95468845838438,-3.34204710021565,3.34204710021565,10.4117779220216,-10.4117779220216,0.760975270299241,0.151782533794176,0.760975270299241,0.151782533794176,1.34862429252826,-1.34862429252826,-4.0453878940898,4.0453878940898,3.06624024704797,-3.06624024704797,6.32070763515021,-6.32070763515021,0.829676866531372,0.170323133468628,0.829676866531372,0.170323133468628,0.0128753185272217,0.0078820586204528,0.0078820586204528,0.842552185058594,0.157447814941406,0.920704305171967,0.920704305171967,-0.0594499856233597,0.0594499856233597,0.269259956985348,-0.269259956985348,0.0,0.0128753185272217,0.0,0.0128753185272217,0.0542312195741847,-0.0542312195741847,-0.136148184537888,0.136148184537888,0.0542312195741847,-0.0542312195741847,0.187319193706177,-0.187319193706177,0.0,0.0,1.0,0.0,1.0,0.0,0.0,0.0,0.0,0,0.0,0.0,0.0,0.0,0.0,0.0,0.0,0.0,0.0,0.0,0.0,0.0,0.0,0.0,1.0,0.0,0.0,0.0,0.0,0.0,0.0,0.0,0.0,1.0,0.0,0.0,0.0,0.0,0.0,0.0,0.0,0.0,0.0,0.0,0.0,1.0,0.0,0.0,0.0,0.0,0.0,00-0036389,J.Hurts,9.0,00-0035676,A.Brown,9.0,,,,,,,,,,,,,,,,,,,,,,,,,,,,,,,,,,,,,,,,,,,,,,ARI,,00-0032933,,A.Hamilton,,,,,,,,,,,,,,0.0,,,,,,,,,,,,,,,,,,,,,,,,,,,,,,,,0.0,,,,,0,,,0.0,0.0,0.0,0.0,,,2023,0.717555403709412,28.2444596290588,22,1,First down,1674,"12/31/23, 13:02:51",2023-12-31T19:03:21.817Z,Lincoln Financial Field,"Partly Cloudy Temp: 45° F, Humidity: 48%, Wind: NW 9 mph",cbafaf53-f053-11ed-b4a7-bab79e4492fa,0,0,PASS,0,,2023-12-31T19:03:26.553Z,,6,Touchdown,2023-12-31T19:01:41.917Z,9.0,1:34,4.0,0.0,1.0,2.0,2.0,0.0,KICKOFF,TOUCHDOWN,01:50,00:16,PHI 25,ARI 22,1603.0,1877.0,35,31,Home,-4,66,12.0,48.0,0,outdoors,grass,45.0,9.0,Nick Sirianni,Jonathan Gannon,PHI00,Lincoln Financial Field,0,1.0,J.Hurts,1.0,,,A.Brown,11.0,1,0,1.0,0,1,00-0036389,,00-0035676,J.Hurts,1.0,00-0036389,A.Brown,00-0035676,A.Brown,00-0035676,0,1,0.912757804093417,0.277058392899356,4.2700393126579,1.0,0.999489131674636,0.999489131674636,0.788070499897003,21.1929500102997,2023-12-31,G.Williams,2023,REG,ARI,17,00-0039007,CB,Garrett Williams,Garrett,Williams,Knee,,Questionable,Knee,,Limited Participation in Practice,2023-12-29T19:34:54Z,2023-12-29 19:34:54
1650,2023_13_DET_NO,2023120301,NO,DET,REG,13,DET,away,NO,DET,75.0,2023-12-03,548.0,548.0,2348.0,Half1,0,11.0,0,2,1.0,0,09:08,DET 25,10,9.0,"(9:08) 5-D.Montgomery right guard to DET 28 for 3 yards (97-M.Roach). DET-77-F.Ragnow was injured during the play. INJURY UPDATE: NO 75-A.Peat, hand, PROBABLE to return.",run,3.0,0,0,0.0,0,0,0,,,,,right,guard,,,,,3,2,0.0,,,,,2.0,3.0,7,21,21.0,7.0,14.0,21.0,7.0,14.0,0.110227458178997,0.123761266469955,0.0018169148825109,0.214170351624489,0.198337316513062,0.0025093723088502,0.349177360534668,0.0,0.0,1.17016212735325,-0.456171667203307,-17.7209624414139,17.7209624414139,-6.85254516126588,6.85254516126588,-9.02127703372389,9.02127703372389,,,0.0,0.0,1.74405412795022,-1.74405412795022,-1.29895791574381,1.29895791574381,4.16539103386458,-4.16539103386458,-12.4277533934219,12.4277533934219,0.843385577201843,0.156614422798157,0.156614422798157,0.843385577201843,-0.0088008642196655,0.0051360130310058,-0.0051360130310058,0.165415287017822,0.834584712982178,0.932433903217316,0.0675660967826843,-0.160298179784765,0.160298179784765,-0.262037118636713,0.262037118636713,,,0.0,0.0,-0.0141581431568092,0.0141581431568092,-0.0790619768789442,0.0790619768789442,-0.0141581431568092,0.0141581431568092,-0.229346662073437,0.229346662073437,0.0,0.0,0.0,0.0,0.0,0.0,0.0,0.0,0.0,0,0.0,0.0,0.0,0.0,0.0,0.0,0.0,0.0,0.0,0.0,0.0,0.0,0.0,0.0,1.0,0.0,0.0,0.0,0.0,0.0,0.0,0.0,1.0,0.0,0.0,0.0,0.0,0.0,0.0,0.0,0.0,0.0,0.0,0.0,0.0,0.0,0.0,0.0,0.0,0.0,0.0,,,,,,,00-0035685,D.Montgomery,3.0,,,,,,,,,,,,,,,,,,,,,,,,,,,,,,,,,,,,,,,,,,,NO,,00-0035763,,M.Roach,,,,,,,,,,,,,,0.0,,,,,,,,,,,,,,,,,,,,,,,,,,,,,,,,0.0,,,,,0,,,0.0,0.0,0.0,0.0,,,2023,,,21,0,Punt,1650,"12/3/23, 13:03:16",2023-12-03T19:05:34.667Z,Caesars Superdome,"Partly Cloudy Temp: 65° F, Humidity: 84%, Wind: NW 6 mph",cbae1b9e-f053-11ed-b4a7-bab79e4492fa,0,0,RUSH,0,,2023-12-03T19:05:38.903Z,,11,Punt,2023-12-03T19:04:58.630Z,3.0,1:55,0.0,0.0,0.0,2.0,2.0,0.0,KICKOFF,PUNT,09:08,07:13,DET 25,DET 34,1627.0,1742.0,33,28,Home,-5,61,-4.0,47.5,0,dome,sportturf,,,Dennis Allen,Dan Campbell,NOR00,Mercedes-Benz Superdome,0,0.0,,,D.Montgomery,5.0,,,0,1,0.0,0,1,,00-0035685,,D.Montgomery,5.0,00-0035685,D.Montgomery,00-0035685,D.Montgomery,00-0035685,0,0,-0.456171667203307,,,,,,0.472611486911774,-47.2611486911774,2023-12-03,F.Ragnow,2023,REG,DET,13,00-0034345,C,Frank Ragnow,Frank,Ragnow,,,,Back,Toe,Full Participation in Practice,2023-12-01T20:33:41Z,2023-12-01 20:33:41
1646,2023_09_MIN_ATL,2023110501,ATL,MIN,REG,9,MIN,away,ATL,MIN,73.0,2023-11-05,253.0,253.0,2053.0,Half1,0,10.0,0,2,3.0,0,04:13,MIN 27,8,75.0,"(4:13) (Shotgun) 15-J.Dobbs pass short middle to 17-K.Osborn to MIN 40 for 13 yards (20-D.Alford; 1-J.Okudah). MIN-17-K.Osborn was injured during the play. PENALTY on ATL-20-D.Alford, Unnecessary Roughness, 15 yards, enforced at MIN 40.",pass,13.0,1,0,1.0,0,0,0,short,middle,13.0,0.0,,,,,,,3,3,0.0,,,,,3.0,3.0,11,3,3.0,11.0,-8.0,3.0,11.0,-8.0,0.305590599775314,0.131470292806625,0.001316234585829,0.21925912797451,0.141325578093529,0.0028128519188612,0.198225304484367,0.0,0.0,-0.114677673904225,3.11774584592786,3.85410627734382,-3.85410627734382,1.41936062922188,-1.41936062922188,1.9885120182594,-1.9885120182594,1.99178241088521,1.12596343504265,1.99178241088521,1.12596343504265,-5.96122718631523,5.96122718631523,4.02816811449468,-4.02816811449468,-2.31086072133621,2.31086072133621,-3.5766495332932,3.5766495332932,0.200297459959984,0.799702540040016,0.799702540040016,0.200297459959984,0.0804316252470017,0.0629199296236038,-0.0629199296236038,0.719270914793015,0.280729085206985,0.19974984228611,0.80025015771389,-0.0329693704843521,0.0329693704843521,0.0237330943346024,-0.0237330943346024,0.0,0.0804316252470017,0.0,0.0804316252470017,0.0203115940093994,-0.0203115940093994,-0.0734806507825851,0.0734806507825851,0.0188335776329041,-0.0188335776329041,-0.204044058918953,0.204044058918953,0.0,0.0,1.0,1.0,1.0,0.0,0.0,0.0,0.0,0,0.0,0.0,0.0,0.0,0.0,0.0,0.0,0.0,0.0,0.0,0.0,0.0,0.0,0.0,0.0,0.0,1.0,0.0,0.0,0.0,0.0,0.0,0.0,1.0,0.0,0.0,0.0,0.0,0.0,0.0,0.0,0.0,0.0,0.0,0.0,1.0,1.0,0.0,0.0,0.0,0.0,00-0033949,J.Dobbs,13.0,00-0036345,K.Osborn,13.0,,,,,,,,,,,,,,,,,,,,,,,,,,,,,,,,,,,,,,,,,,,,,,,,,,,,00-0037034,D.Alford,ATL,00-0036274,J.Okudah,ATL,,,,,,,0.0,,,,,,,,,,,,,,,,,,,,,,,,,,,,,,,,0.0,ATL,00-0037034,D.Alford,15.0,0,,Unnecessary Roughness,0.0,0.0,0.0,0.0,,,2023,0.674055993556976,32.5944006443024,21,1,First down,1646,"11/5/23, 13:02:47",2023-11-05T19:07:41.410Z,Mercedes-Benz Stadium,"Clear Temp: 70° F, Humidity: 38%, Wind: 0 mph",b07eaef2-f053-11ed-b4a7-bab79e4492fa,0,0,PASS,0,,2023-11-05T19:07:46.617Z,,10,Touchdown,2023-11-05T19:05:39.757Z,13.0,4:37,6.0,1.0,1.0,2.0,2.0,15.0,KICKOFF,TOUCHDOWN,05:32,00:55,MIN 25,ATL 2,1579.0,1965.0,31,28,Home,-3,59,3.5,38.5,0,open,fieldturf,,,Arthur Smith,Kevin O'Connell,ATL97,Mercedes-Benz Stadium,0,1.0,J.Dobbs,15.0,,,K.Osborn,17.0,1,0,1.0,0,1,00-0033949,,00-0036345,J.Dobbs,15.0,00-0033949,K.Osborn,00-0036345,K.Osborn,00-0036345,0,1,3.11774584592786,0.337416941575933,4.65510670098593,2.0,1.0,1.0,0.984790623188019,1.52093768119812,2023-11-05,K.Osborn,2023,REG,MIN,9,00-0036345,WR,K.J. Osborn,K.J.,Osborn,,,,Chest,,Full Participation in Practice,2023-11-03T19:08:07Z,2023-11-03 19:08:07
1621,2023_17_TEN_HOU,2023123104,HOU,TEN,REG,17,TEN,away,HOU,TEN,69.0,2023-12-31,134.0,134.0,1934.0,Half1,0,8.0,0,2,4.0,0,02:14,TEN 31,4,6.0,"(2:14) 13-T.Zentner punts 57 yards to HOU 12, Center-46-M.Cox. 25-D.King to HOU 31 for 19 yards (41-O.Reese). TEN-14-C.Dowell was injured during the play. He is Out.",punt,0.0,0,0,0.0,0,0,0,,,,,,,,57.0,,,3,2,0.0,,,,,2.0,3.0,20,0,0.0,20.0,-20.0,0.0,20.0,-20.0,0.415292412042618,0.144733682274818,0.0012416403042152,0.215031445026398,0.0815353989601135,0.0017274112906307,0.140437960624695,0.0,0.0,-0.710777698783204,-0.884754027472809,26.7145426382317,-26.7145426382317,5.64308362792715,-5.64308362792715,14.4031293718076,-14.4031293718076,,,0.0,0.0,-2.42030644410988,2.42030644410988,8.31985238182824,-8.31985238182824,-1.70910488793743,1.70910488793743,7.9803884409125,-7.9803884409125,0.0312681160867214,0.968731883913279,0.968731883913279,0.0312681160867214,-0.0032852254807949,-0.0039230566471815,0.0039230566471815,0.972017109394073,0.0279828906059265,0.0206376891583204,0.97936231084168,0.161362156271935,-0.161362156271935,0.173140148897774,-0.173140148897774,,,0.0,0.0,-0.117046475410461,0.117046475410461,0.144931514370861,-0.144931514370861,-0.117046475410461,0.117046475410461,0.19892327915472,-0.19892327915472,0.0,0.0,0.0,0.0,0.0,0.0,0.0,0.0,0.0,0,0.0,0.0,0.0,0.0,0.0,0.0,0.0,0.0,0.0,0.0,0.0,0.0,0.0,0.0,1.0,0.0,0.0,0.0,0.0,0.0,0.0,0.0,0.0,0.0,0.0,0.0,0.0,0.0,0.0,0.0,0.0,0.0,0.0,1.0,0.0,0.0,0.0,0.0,0.0,0.0,0.0,,,,,,,,,,,,,,,,,,,,,,00-0033566,D.King,,,,,,,00-0038490,T.Zentner,,,,,,,,,,,,,,,,,,,,,TEN,,00-0038853,,O.Reese,,,,,,,,,,,,,,0.0,,,,,,,,,,,,,,,,,,,,,,,,,,,,,,,HOU,19.0,,,,,0,,,0.0,0.0,0.0,0.0,,,2023,,,21,0,Punt,1621,"12/31/23, 13:02:34",2023-12-31T19:06:13.840Z,NRG Stadium,"Sunny Temp: 68° F, Humidity: 59%, Wind: SW 2 mph",cbaf9774-f053-11ed-b4a7-bab79e4492fa,0,0,PUNT,1,,2023-12-31T19:06:27.857Z,,8,Punt,2023-12-31T19:03:28Z,3.0,2:16,0.0,0.0,0.0,2.0,2.0,0.0,KICKOFF,PUNT,04:17,02:01,TEN 25,TEN 31,1516.0,1621.0,3,26,Home,23,29,5.0,44.0,1,closed,astroturf,,,DeMeco Ryans,Mike Vrabel,HOU00,NRG Stadium,0,0.0,,,,,,,0,0,0.0,1,0,,,,,,,,,,,0,0,-0.884754027472809,,,,,,,,2023-12-31,C.Dowell,2023,REG,TEN,17,00-0038632,WR,Colton Dowell,Colton,Dowell,,,,Hip,,Full Participation in Practice,2023-12-29T19:53:37Z,2023-12-29 19:53:37
1597,2023_15_LAC_LV,2023121400,LV,LAC,REG,15,LV,home,LAC,LAC,14.0,2023-12-14,584.0,584.0,2384.0,Half1,0,11.0,0,2,1.0,0,09:44,LAC 14,10,14.0,(9:44) (Shotgun) 35-Z.White left tackle to LAC 11 for 3 yards (98-A.Johnson). LAC-9-K.Murray was injured during the play.,run,3.0,1,0,0.0,0,0,0,,,,,left,tackle,,,,,2,2,0.0,,,,,2.0,2.0,21,0,21.0,0.0,21.0,21.0,0.0,21.0,0.0214576572179794,0.0150987794622779,0.0004827555676456,0.026837881654501,0.322107315063477,0.0008761320495978,0.613139450550079,0.0,0.0,5.02592334203655,-0.29506968986243,30.1219946137922,-30.1219946137922,8.09307993302355,-8.09307993302355,13.9196662774193,-13.9196662774193,,,0.0,0.0,9.46013775316533,-9.46013775316533,-1.06241071381373,1.06241071381373,9.27191235206556,-9.27191235206556,-3.08686462807236,3.08686462807236,0.974261522293091,0.0257384777069092,0.974261522293091,0.0257384777069092,-0.0004830360412597,-0.0002747774124145,-0.0002747774124145,0.973778486251831,0.0262215137481689,0.984695374965668,0.984695374965668,0.131721234127775,-0.131721234127775,0.147267851281888,-0.147267851281888,,,0.0,0.0,0.0154035648052001,-0.0154035648052001,0.111758619064407,-0.111758619064407,0.0154035648052001,-0.0154035648052001,0.0205835695210261,-0.0205835695210261,0.0,0.0,0.0,0.0,0.0,0.0,0.0,0.0,0.0,0,0.0,0.0,0.0,0.0,0.0,0.0,0.0,0.0,0.0,0.0,0.0,0.0,0.0,0.0,1.0,0.0,0.0,0.0,0.0,0.0,0.0,0.0,1.0,0.0,0.0,0.0,0.0,0.0,0.0,0.0,0.0,0.0,0.0,0.0,0.0,0.0,0.0,0.0,0.0,0.0,0.0,,,,,,,00-0038040,Z.White,3.0,,,,,,,,,,,,,,,,,,,,,,,,,,,,,,,,,,,,,,,,,,,LAC,,00-0032763,,A.Johnson,,,,,,,,,,,,,,0.0,,,,,,,,,,,,,,,,,,,,,,,,,,,,,,,,0.0,,,,,0,,,0.0,0.0,0.0,0.0,,,2023,,,20,1,Touchdown,1597,"12/14/23, 20:16:00",2023-12-15T02:18:58.793Z,Allegiant Stadium,"Mostly Sunny Temp: 60° F, Humidity: 23%, Wind: S 0 mph",cbaec361-f053-11ed-b4a7-bab79e4492fa,0,0,RUSH,0,,2023-12-15T02:19:03.163Z,,11,Touchdown,2023-12-15T02:18:58.793Z,2.0,0:29,1.0,1.0,1.0,2.0,2.0,0.0,FUMBLE,TOUCHDOWN,09:44,09:15,LAC 14,LAC 11,1597.0,1650.0,21,63,Home,42,84,3.0,36.0,1,dome,grass,,,Antonio Pierce,Brandon Staley,VEG00,Allegiant Stadium,0,0.0,,,Z.White,35.0,,,0,1,0.0,0,1,,00-0038040,,Z.White,35.0,00-0038040,Z.White,00-0038040,Z.White,00-0038040,0,0,-0.29506968986243,,,,,,0.370511770248413,-37.0511770248413,2023-12-14,K.Murray,2023,REG,LAC,15,00-0036441,LB,Kenneth Murray,Kenneth,Murray,,,,Shoulder,,Full Participation in Practice,2023-12-13T22:28:28Z,2023-12-13 22:28:28
1593,2023_18_NYJ_NE,2024010704,NE,NYJ,REG,18,NE,home,NYJ,NE,71.0,2024-01-07,297.0,297.0,2097.0,Half1,0,11.0,0,2,3.0,0,04:57,NE 29,6,4.0,(4:57) (Shotgun) 4-B.Zappe pass incomplete short right to 86-P.Brown (21-A.Davis) [47-B.Huff]. NE-86-P.Brown was injured during the play.,pass,0.0,1,0,1.0,0,0,0,short,right,2.0,,,,,,,,2,2,0.0,,,,,2.0,2.0,3,6,3.0,6.0,-3.0,3.0,6.0,-3.0,0.373718172311783,0.124872393906116,0.0011668127262964,0.173518240451813,0.146835073828697,0.0033672745339572,0.176522076129913,0.0,0.0,0.0913158131297678,-1.00704564829357,-6.70714567950927,6.70714567950927,-3.27760093193501,3.27760093193501,-3.27899591293608,3.27899591293608,-0.845430697314441,-0.161614950979128,0.0,0.0,-1.65398140216712,1.65398140216712,0.719316780858208,-0.719316780858208,-10.4504995681345,10.4504995681345,9.94631602201189,-9.94631602201189,0.403126209974289,0.596873790025711,0.403126209974289,0.596873790025711,-0.0498387515544891,-0.0385561585426331,-0.0385561585426331,0.3532874584198,0.6467125415802,0.39234846830368,0.39234846830368,-0.102073431015015,0.102073431015015,-0.161991387605667,0.161991387605667,0.0,-0.0498387515544891,0.0,0.0,0.0060258507728576,-0.0060258507728576,-0.0149001777172089,0.0149001777172089,0.0060258507728576,-0.0060258507728576,-0.0825739502906799,0.0825739502906799,0.0,0.0,0.0,0.0,0.0,1.0,0.0,0.0,1.0,0,0.0,0.0,0.0,0.0,0.0,0.0,0.0,0.0,0.0,0.0,0.0,0.0,0.0,0.0,0.0,0.0,0.0,0.0,0.0,0.0,0.0,1.0,0.0,1.0,0.0,0.0,0.0,0.0,0.0,0.0,0.0,0.0,0.0,0.0,0.0,0.0,0.0,0.0,0.0,0.0,0.0,00-0038108,B.Zappe,,00-0033439,P.Brown,,,,,,,,,,,,,,,,,,,,,,,,,,,,,,,,,,,,,00-0036151,B.Huff,,,,,,,,,,,,,,,,,,,,,,,,,,,0.0,,,,,,,00-0036329,A.Davis,,,,,,,,,,,,,,,,,,,,,,,,0.0,,,,,0,,,0.0,0.0,0.0,0.0,,,2023,0.520058214664459,-52.0058214664459,18,0,Punt,1593,"1/7/24, 13:02:31",2024-01-07T19:06:09.267Z,Gillette Stadium,"Snow Temp: 33° F, Humidity: 98%, Wind: SW 14 mph",cbb00bfa-f053-11ed-b4a7-bab79e4492fa,0,0,PASS,0,,2024-01-07T19:06:18.407Z,,11,Punt,2024-01-07T19:04:21.757Z,3.0,1:27,0.0,0.0,0.0,2.0,2.0,0.0,KICKOFF,PUNT,06:07,04:40,NE 25,NE 29,1521.0,1616.0,17,3,Home,-14,20,2.5,28.5,1,outdoors,fieldturf,33.0,14.0,Bill Belichick,Robert Saleh,BOS00,Gillette Stadium,0,0.0,B.Zappe,4.0,,,P.Brown,86.0,1,0,0.0,0,1,00-0038108,,00-0033439,B.Zappe,4.0,00-0038108,P.Brown,00-0033439,P.Brown,00-0033439,0,1,-1.00704564829357,1.28440281111436,5.61473094410758,3.0,0.488487789669307,0.488487789669307,0.981419563293457,1.8580436706543,2024-01-07,P.Brown,2023,REG,NE,18,00-0033439,TE,Pharaoh Brown,Pharaoh,Brown,Ribs,,Questionable,Ribs,,Limited Participation in Practice,2024-01-05T20:39:21Z,2024-01-05 20:39:21
1586,2023_02_KC_JAX,2023091705,JAX,KC,REG,2,JAX,home,KC,JAX,83.0,2023-09-17,546.0,546.0,2346.0,Half1,0,10.0,0,2,2.0,0,09:06,JAX 17,5,38.0,(9:06) (Shotgun) 1-T.Etienne up the middle to JAX 21 for 4 yards (50-W.Gay; 32-N.Bolton). KC-32-N.Bolton was injured during the play.,run,4.0,1,0,0.0,0,0,0,,,,,middle,,,,,,3,3,0.0,,,,,3.0,3.0,3,0,3.0,0.0,3.0,3.0,0.0,3.0,0.151402667164803,0.155294612050056,0.0028555877506732,0.243512362241745,0.162734597921371,0.001914546242915,0.282285630702972,0.0,0.0,0.291850753827021,0.280831533716992,3.09109678817913,-3.09109678817913,-7.70235799223883,7.70235799223883,1.05535138677077,-1.05535138677077,,,0.0,0.0,0.889642211142927,-0.889642211142927,3.94376427005045,-3.94376427005045,-4.04523637553211,4.04523637553211,7.07692741567006,-7.07692741567006,0.63158518075943,0.36841481924057,0.63158518075943,0.36841481924057,0.0009942650794982,-0.0050702691078186,-0.0050702691078186,0.632579445838928,0.367420554161072,0.478493332862854,0.478493332862854,-0.225038796663284,0.225038796663284,-0.0869602859020233,0.0869602859020233,,,0.0,0.0,0.0155244171619415,-0.0155244171619415,0.0422775745391846,-0.0422775745391846,0.0155244171619415,-0.0155244171619415,-0.0551271140575409,0.0551271140575409,0.0,0.0,0.0,0.0,0.0,0.0,0.0,0.0,0.0,0,0.0,0.0,0.0,0.0,0.0,0.0,0.0,0.0,0.0,0.0,0.0,0.0,0.0,0.0,0.0,0.0,0.0,0.0,0.0,0.0,0.0,0.0,1.0,0.0,0.0,0.0,0.0,0.0,0.0,0.0,0.0,0.0,0.0,0.0,0.0,0.0,1.0,0.0,0.0,0.0,0.0,,,,,,,00-0036973,T.Etienne,4.0,,,,,,,,,,,,,,,,,,,,,,,,,,,,,,,,,,,,,,,,,,,,,,,,,00-0036362,W.Gay,KC,00-0036621,N.Bolton,KC,,,,,,,0.0,,,,,,,,,,,,,,,,,,,,,,,,,,,,,,,,0.0,,,,,0,,,0.0,0.0,0.0,0.0,,,2023,,,18,1,First down,1586,"9/17/23, 13:02:49",2023-09-17T18:03:38.333Z,EverBank Stadium,"Temp: 87° F, Humidity: 68%, Wind: SW 5 mph",b07cb6a9-f053-11ed-b4a7-bab79e4492fa,0,0,RUSH,0,,2023-09-17T18:03:42.393Z,,10,Turnover on downs,2023-09-17T18:03:02.930Z,11.0,5:37,3.0,0.0,0.0,2.0,2.0,5.0,INTERCEPTION,DOWNS,09:41,04:04,JAX 12,KC 45,1557.0,1825.0,17,9,Home,-8,26,-3.5,50.5,0,outdoors,,,,Doug Pederson,Andy Reid,JAX00,TIAA Bank Stadium,0,1.0,,,T.Etienne,1.0,,,0,1,0.0,0,1,,00-0036973,,T.Etienne,1.0,00-0036973,T.Etienne,00-0036973,T.Etienne,00-0036973,0,1,0.280831533716992,,,,,,0.491204410791397,-49.1204410791397,2023-09-17,N.Bolton,2023,REG,KC,2,00-0036621,LB,Nick Bolton,Nick,Bolton,,,,Not injury related - personal matter,,Did Not Participate In Practice,2023-09-15T19:07:32Z,2023-09-15 19:07:32
1583,2023_13_LAC_NE,2023120300,NE,LAC,REG,13,LAC,away,NE,LAC,69.0,2023-12-03,301.0,301.0,2101.0,Half1,0,10.0,0,2,1.0,0,05:01,LAC 31,10,22.0,(5:01) 25-J.Kelley right tackle to LAC 38 for 7 yards (8-J.Bentley; 31-J.Jones). NE-8-J.Bentley was injured during the play.,run,7.0,0,0,0.0,0,0,0,,,,,right,tackle,,,,,3,2,0.0,,,,,2.0,3.0,0,3,3.0,0.0,3.0,3.0,0.0,3.0,0.341750860214233,0.0938692539930344,0.0015443662414327,0.139786303043365,0.165178805589676,0.002457525813952,0.255412876605988,0.0,0.0,1.02514098887332,0.278595722746104,-7.13053535413928,7.13053535413928,0.0762070034979843,-0.0762070034979843,-5.50072674061991,5.50072674061991,,,0.0,0.0,-1.56717967544682,1.56717967544682,-4.31344717042521,4.31344717042521,-0.405109104933217,0.405109104933217,-5.09561763568669,5.09561763568669,0.63873416185379,0.36126583814621,0.36126583814621,0.63873416185379,0.0151570439338684,0.0080777406692504,-0.0080777406692504,0.346108794212341,0.653891205787659,0.781966745853424,0.218033254146576,-0.0213770866394043,0.0213770866394043,-0.2313472032547,0.2313472032547,,,0.0,0.0,-0.0832095146179199,0.0832095146179199,-0.133181869983673,0.133181869983673,-0.0832095146179199,0.0832095146179199,-0.14813768863678,0.14813768863678,0.0,0.0,0.0,0.0,0.0,0.0,0.0,0.0,0.0,0,0.0,0.0,0.0,0.0,0.0,0.0,0.0,0.0,0.0,0.0,0.0,0.0,0.0,0.0,0.0,0.0,0.0,0.0,0.0,0.0,0.0,0.0,1.0,0.0,0.0,0.0,0.0,0.0,0.0,0.0,0.0,0.0,0.0,0.0,0.0,0.0,1.0,0.0,0.0,0.0,0.0,,,,,,,00-0036370,J.Kelley,7.0,,,,,,,,,,,,,,,,,,,,,,,,,,,,,,,,,,,,,,,,,,,,,,,,,00-0034385,J.Bentley,NE,00-0032580,J.Jones,NE,,,,,,,0.0,,,,,,,,,,,,,,,,,,,,,,,,,,,,,,,,0.0,,,,,0,,,0.0,0.0,0.0,0.0,,,2023,,,20,1,First down,1583,"12/3/23, 13:02:30",2023-12-03T19:06:12.727Z,Gillette Stadium,"Rain Temp: 44° F, Humidity: 94%, Wind: W 8 mph",cbae1469-f053-11ed-b4a7-bab79e4492fa,0,0,RUSH,0,,2023-12-03T19:06:16.763Z,,10,Punt,2023-12-03T19:04:17.343Z,9.0,4:54,2.0,0.0,0.0,2.0,2.0,0.0,PUNT,PUNT,06:56,02:02,LAC 17,LAC 39,1504.0,1728.0,6,0,Home,-6,6,-4.5,38.5,0,outdoors,fieldturf,44.0,8.0,Bill Belichick,Brandon Staley,BOS00,Gillette Stadium,0,1.0,,,J.Kelley,25.0,,,0,1,0.0,0,1,,00-0036370,,J.Kelley,25.0,00-0036370,J.Kelley,00-0036370,J.Kelley,00-0036370,0,1,0.278595722746104,,,,,,0.508751809597015,-50.8751809597015,2023-12-03,J.Bentley,2023,REG,NE,13,00-0034385,LB,Ja'Whaun Bentley,Ja'Whaun,Bentley,,,,Hamstring,,Full Participation in Practice,2023-12-01T20:33:03Z,2023-12-01 20:33:03
1578,2023_03_CAR_SEA,2023092409,SEA,CAR,REG,3,CAR,away,SEA,CAR,62.0,2023-09-24,443.0,443.0,2243.0,Half1,0,8.0,0,2,2.0,0,07:23,CAR 38,10,75.0,(7:23) (Shotgun) 6-M.Sanders left guard to SEA 47 for 15 yards (21-D.Witherspoon; 90-Ja.Reed). CAR-6-M.Sanders was injured during the play.,run,15.0,1,0,0.0,0,0,0,,,,,left,guard,,,,,2,3,0.0,,,,,3.0,2.0,9,3,3.0,9.0,-6.0,3.0,9.0,-6.0,0.223855793476105,0.0966928079724312,0.0021310031879693,0.145759448409081,0.199690163135529,0.0016597664216533,0.330211013555527,0.0,0.0,1.59921054798178,1.30599918938242,4.13481479370967,-4.13481479370967,4.7601300230599,-4.7601300230599,0.323769184064732,-0.323769184064732,,,0.0,0.0,-1.86520013120025,1.86520013120025,0.121559016717245,-0.121559016717245,0.0396592020406388,-0.0396592020406388,-1.99133959732469,1.99133959732469,0.337082058191299,0.662917941808701,0.662917941808701,0.337082058191299,0.0423970520496368,0.0234570503234863,-0.0234570503234863,0.620520889759064,0.379479110240936,0.252388298511505,0.747611701488495,0.0879088044166565,-0.0879088044166565,-0.0721703171730042,0.0721703171730042,,,0.0,0.0,-0.0162695646286011,0.0162695646286011,-0.0698941648006439,0.0698941648006439,-0.0162695646286011,0.0162695646286011,-0.0983563363552094,0.0983563363552094,0.0,1.0,0.0,0.0,0.0,0.0,0.0,0.0,0.0,0,0.0,0.0,0.0,0.0,0.0,0.0,0.0,0.0,0.0,0.0,0.0,0.0,0.0,0.0,0.0,0.0,0.0,0.0,0.0,0.0,0.0,0.0,1.0,0.0,0.0,0.0,0.0,0.0,0.0,0.0,0.0,0.0,0.0,0.0,0.0,0.0,1.0,0.0,0.0,0.0,0.0,,,,,,,00-0035243,M.Sanders,15.0,,,,,,,,,,,,,,,,,,,,,,,,,,,,,,,,,,,,,,,,,,,,,,,,,00-0039169,D.Witherspoon,SEA,00-0032387,Ja.Reed,SEA,,,,,,,0.0,,,,,,,,,,,,,,,,,,,,,,,,,,,,,,,,0.0,,,,,0,,,0.0,0.0,0.0,0.0,,,2023,,,19,1,First down,1578,"9/24/23, 16:05:39",2023-09-24T21:13:14.387Z,Lumen Field,"Cloudy Temp: 61° F, Humidity: 76%, Wind: NE 2 mph",b07d18d8-f053-11ed-b4a7-bab79e4492fa,0,0,RUSH,0,,2023-09-24T21:13:21.160Z,,8,Touchdown,2023-09-24T21:09:33.483Z,8.0,3:51,3.0,0.0,1.0,2.0,2.0,-10.0,KICKOFF,TOUCHDOWN,08:45,04:54,CAR 25,SEA 47,1456.0,1739.0,27,37,Home,10,64,5.0,42.5,0,outdoors,fieldturf,61.0,2.0,Pete Carroll,Frank Reich,SEA00,Lumen Field,0,1.0,,,M.Sanders,6.0,,,0,1,1.0,0,1,,00-0035243,,M.Sanders,6.0,00-0035243,M.Sanders,00-0035243,M.Sanders,00-0035243,0,1,1.30599918938242,,,,,,0.620894432067871,-62.0894432067871,2023-09-24,M.Sanders,2023,REG,CAR,3,00-0035243,RB,Miles Sanders,Miles,Sanders,,,,Pectoral,,Full Participation in Practice,2023-09-22T17:08:46Z,2023-09-22 17:08:46
1542,2023_13_ARI_PIT,2023120303,PIT,ARI,REG,13,PIT,home,ARI,ARI,3.0,2023-12-03,330.0,330.0,2130.0,Half1,0,9.0,0,2,3.0,1,05:30,ARI 3,3,79.0,"(5:30) (Shotgun) 8-K.Pickett scrambles up the middle to ARI 1 for 2 yards (93-J.Ledbetter, 10-J.Woods). PIT-8-K.Pickett was injured during the play.",run,2.0,1,0,1.0,0,0,1,,,,,middle,,,,,,3,3,0.0,,,,,3.0,3.0,3,3,3.0,3.0,0.0,3.0,3.0,0.0,0.0515954904258251,0.0109263230115175,0.0003824480518233,0.0189979132264853,0.392213314771652,0.0012463898165151,0.524638116359711,0.0,0.0,4.68507028074237,0.0466033104457893,2.73356072825845,-2.73356072825845,1.25310175714549,-1.25310175714549,6.17617276046205,-6.17617276046205,,,0.0,0.0,2.26893110526726,-2.26893110526726,0.7313659437065,-0.7313659437065,-6.76756632258184,6.76756632258184,11.0481050004322,-11.0481050004322,0.676668405532837,0.323331594467163,0.676668405532837,0.323331594467163,-0.0398773550987244,-0.0211194753646851,-0.0211194753646851,0.636791050434113,0.363208949565887,0.751053333282471,0.751053333282471,-0.0116656124591827,0.0116656124591827,0.225474864244461,-0.225474864244461,,,0.0,0.0,0.0125370025634766,-0.0125370025634766,0.133041501045227,-0.133041501045227,0.0125370025634766,-0.0125370025634766,0.168371349573135,-0.168371349573135,0.0,0.0,0.0,0.0,0.0,1.0,0.0,0.0,0.0,0,0.0,0.0,0.0,0.0,0.0,0.0,0.0,0.0,0.0,0.0,0.0,0.0,0.0,0.0,0.0,0.0,0.0,0.0,0.0,0.0,0.0,0.0,1.0,0.0,0.0,0.0,0.0,0.0,0.0,0.0,0.0,0.0,0.0,0.0,0.0,0.0,1.0,0.0,0.0,0.0,0.0,,,,,,,00-0038102,K.Pickett,2.0,,,,,,,,,,,,,,,,,,,,,,,,,,,,,,,,,,,,,,,,,,,,,,,,,00-0034801,J.Woods,ARI,,,,,,,,,,1.0,00-0035343,J.Ledbetter,ARI,,,,,,,,,,,,,,,,,,,,,,,,,,,,,0.0,,,,,0,,,0.0,0.0,0.0,0.0,,,2023,,,20,0,Turnover on downs,1542,"12/3/23, 13:02:21",2023-12-03T19:01:26.227Z,Acrisure Stadium,"Mostly Cloudy Temp: 56° F, Humidity: 88%, Wind: SW 12 mph",cbae2a31-f053-11ed-b4a7-bab79e4492fa,0,0,RUSH,0,,2023-12-03T19:01:30.897Z,,9,Turnover on downs,2023-12-03T18:52:39.533Z,12.0,7:53,5.0,1.0,0.0,2.0,2.0,11.0,PUNT,DOWNS,12:44,04:51,PIT 20,ARI 1,1238.0,1567.0,24,10,Home,-14,34,6.0,41.0,0,outdoors,grass,56.0,12.0,Mike Tomlin,Jonathan Gannon,PIT00,Acrisure Stadium,0,1.0,K.Pickett,8.0,,8.0,,,1,0,0.0,0,1,00-0038102,,,K.Pickett,8.0,00-0038102,K.Pickett,00-0038102,K.Pickett,00-0038102,0,1,0.0466033104457893,,,,,,0.873239934444428,12.6760065555573,2023-12-03,K.Pickett,2023,REG,PIT,13,00-0038102,QB,Kenny Pickett,Kenny,Pickett,,,,Ankle,,Full Participation in Practice,2023-12-01T19:56:44Z,2023-12-01 19:56:44
1501,2023_15_NYJ_MIA,2023121701,MIA,NYJ,REG,15,NYJ,away,MIA,NYJ,66.0,2023-12-17,343.0,343.0,2143.0,Half1,0,10.0,0,2,3.0,0,05:43,NYJ 34,11,9.0,(5:43) (Shotgun) 2-Z.Wilson pass incomplete short right to 20-Bre.Hall. NYJ-2-Z.Wilson was injured during the play. He is Out.,pass,0.0,1,0,1.0,0,0,0,short,right,-11.0,,,,,,,,2,3,0.0,,,,,3.0,2.0,17,0,0.0,17.0,-17.0,0.0,17.0,-17.0,0.305675625801086,0.120509810745716,0.0034315534867346,0.195054814219475,0.148248121142387,0.0017441255040466,0.225335970520973,0.0,0.0,0.291808169335127,-0.985953728901222,19.6599253751057,-19.6599253751057,4.45420553864096,-4.45420553864096,17.6033326370816,-17.6033326370816,-1.59149534767494,0.605541618773714,0.0,0.0,-7.78078316617757,7.78078316617757,11.1324314737576,-11.1324314737576,-6.14253007783555,6.14253007783555,14.7160337871755,-14.7160337871755,0.0871907621622086,0.912809237837791,0.912809237837791,0.0871907621622086,-0.0007498189806938,-0.005304966121912,0.005304966121912,0.913559056818485,0.0864409431815147,0.044835526496172,0.955164473503828,0.0696549097296031,-0.0696549097296031,0.307239545411307,-0.307239545411307,0.0,-0.0007498189806938,0.0,0.0,-0.0218971967697144,0.0218971967697144,0.0141327808563294,-0.0141327808563294,-0.0218971967697144,0.0218971967697144,0.102125933295924,-0.102125933295924,0.0,0.0,0.0,0.0,0.0,1.0,0.0,0.0,1.0,0,0.0,0.0,0.0,0.0,0.0,0.0,0.0,0.0,0.0,0.0,0.0,0.0,0.0,0.0,0.0,0.0,0.0,0.0,0.0,0.0,0.0,0.0,0.0,1.0,0.0,0.0,0.0,0.0,0.0,0.0,0.0,0.0,0.0,0.0,0.0,0.0,0.0,0.0,0.0,0.0,0.0,00-0037013,Z.Wilson,,00-0038120,Bre.Hall,,,,,,,,,,,,,,,,,,,,,,,,,,,,,,,,,,,,,,,,,,,,,,,,,,,,,,,,,,,,,,,,,0.0,,,,,,,,,,,,,,,,,,,,,,,,,,,,,,,,0.0,,,,,0,,,0.0,0.0,0.0,0.0,,,2023,0.510253131389618,-51.0253131389618,16,0,Punt,1501,"12/17/23, 13:02:28",2023-12-17T19:08:06.250Z,Hard Rock Stadium,"Partly Cloudy Temp: 76° F, Humidity: 69%, Wind: WNW 15 mph",cbaeebf4-f053-11ed-b4a7-bab79e4492fa,0,0,PASS,0,,2023-12-17T19:08:11.277Z,,10,Punt,2023-12-17T19:03:34Z,5.0,2:15,1.0,0.0,0.0,2.0,2.0,5.0,KICKOFF,PUNT,07:42,05:27,NYJ 25,NYJ 34,1348.0,1535.0,0,30,Home,30,30,7.5,36.0,1,outdoors,grass,76.0,15.0,Mike McDaniel,Robert Saleh,MIA00,Hard Rock Stadium,0,0.0,Z.Wilson,2.0,,,Bre.Hall,20.0,1,0,0.0,0,1,00-0037013,,00-0038120,Z.Wilson,2.0,00-0037013,Bre.Hall,00-0038120,Bre.Hall,00-0038120,0,1,-0.985953728901222,1.2132199943277,14.3037730740398,12.0,0.173804660444148,0.154888763208874,0.97996062040329,2.00393795967102,2023-12-17,Z.Wilson,2023,REG,NYJ,15,00-0037013,QB,Zach Wilson,Zach,Wilson,,,,Knee,,Full Participation in Practice,2023-12-15T20:51:43Z,2023-12-15 20:51:43
1485,2023_10_NO_MIN,2023111204,MIN,NO,REG,10,MIN,home,NO,NO,36.0,2023-11-12,348.0,348.0,2148.0,Half1,0,7.0,0,2,1.0,0,05:48,NO 36,10,82.0,(5:48) 15-J.Dobbs pass short left to 87-T.Hockenson to NO 15 for 21 yards (1-A.Taylor). MIN-87-T.Hockenson was injured during the play.,pass,21.0,0,0,1.0,0,0,0,short,left,14.0,7.0,,,,,,,3,3,0.0,,,,,3.0,3.0,10,3,10.0,3.0,7.0,10.0,3.0,7.0,0.110217481851578,0.0389459170401096,0.0007025934173725,0.0643133744597435,0.318120390176773,0.0017398967174813,0.4659603536129,0.0,0.0,3.6511268800823,1.31145217368612,10.9133047024972,-10.9133047024972,-2.38770391768776,2.38770391768776,11.4940651922928,-11.4940651922928,0.870810170890763,0.440642002795357,0.870810170890763,0.440642002795357,6.3120732451207,-6.3120732451207,3.97588126675256,-3.97588126675256,10.911515095213,-10.911515095213,-1.14749257423926,1.14749257423926,0.811066925525665,0.188933074474335,0.811066925525665,0.188933074474335,0.0260909199714661,0.0418404936790466,0.0418404936790466,0.837157845497131,0.162842154502869,0.700216591358185,0.700216591358185,-0.170504327043845,0.170504327043845,0.402276664972305,-0.402276664972305,0.0,0.0260909199714661,0.0,0.0260909199714661,0.0015120804309845,-0.0015120804309845,0.385085791349411,-0.385085791349411,-0.0004254281520843,0.0004254281520843,0.363267481327057,-0.363267481327057,0.0,0.0,1.0,0.0,0.0,0.0,0.0,0.0,0.0,0,0.0,0.0,0.0,0.0,0.0,0.0,0.0,0.0,0.0,0.0,0.0,0.0,0.0,0.0,1.0,0.0,0.0,0.0,0.0,0.0,0.0,0.0,0.0,1.0,0.0,0.0,0.0,0.0,0.0,0.0,0.0,0.0,0.0,0.0,0.0,1.0,0.0,0.0,0.0,0.0,0.0,00-0033949,J.Dobbs,21.0,00-0035229,T.Hockenson,21.0,,,,,,,,,,,,,,,,,,,,,,,,,,,,,,,,,,,,,,,,,,,,,,NO,,00-0038121,,A.Taylor,,,,,,,,,,,,,,0.0,,,,,,,,,,,,,,,,,,,,,,,,,,,,,,,,0.0,,,,,0,,,0.0,0.0,0.0,0.0,,,2023,0.637370824813843,36.2629175186157,20,1,First down,1485,"11/12/23, 13:02:50",2023-11-12T19:00:35.813Z,U.S. Bank Stadium,"N/A (Indoors) Temp: 51° F, Humidity: 52%, Wind: SW 11 mph",cbac8bc6-f053-11ed-b4a7-bab79e4492fa,0,0,PASS,0,,2023-11-12T19:00:42.453Z,,7,Touchdown,2023-11-12T18:57:40.337Z,9.0,4:41,5.0,1.0,1.0,2.0,2.0,5.0,PUNT,TOUCHDOWN,08:11,03:30,MIN 18,NO 7,1370.0,1683.0,19,27,Home,8,46,-3.0,41.0,0,dome,sportturf,,,Kevin O'Connell,Dennis Allen,MIN01,U.S. Bank Stadium,0,1.0,J.Dobbs,15.0,,,T.Hockenson,87.0,1,0,1.0,0,1,00-0033949,,00-0035229,J.Dobbs,15.0,00-0033949,T.Hockenson,00-0035229,T.Hockenson,00-0035229,0,1,1.31145217368612,0.157744009959286,2.81275465869112,1.0,1.0,0.999369184602983,0.444153398275375,55.5846601724625,2023-11-12,T.Hockenson,2023,REG,MIN,10,00-0035229,TE,T.J. Hockenson,T.J.,Hockenson,Ribs,,Questionable,Ribs,,Limited Participation in Practice,2023-11-10T19:54:13Z,2023-11-10 19:54:13
1464,2023_07_GB_DEN,2023102208,DEN,GB,REG,7,DEN,home,GB,DEN,85.0,2023-10-22,435.0,435.0,2235.0,Half1,0,7.0,0,2,2.0,0,07:15,DEN 15,31,28.0,(7:15) (Shotgun) 38-J.McLaughlin up the middle pushed ob at DEN 38 for 23 yards (20-R.Ford). GB-26-D.Savage was injured during the play.,run,23.0,1,0,0.0,0,0,0,,,,,middle,,,,,,3,3,0.0,,,,,3.0,3.0,6,0,6.0,0.0,6.0,6.0,0.0,6.0,0.241244792938232,0.184700578451157,0.0036628507077693,0.253261357545853,0.115183562040329,0.0022275249939411,0.199719309806824,0.0,0.0,-0.586216034833342,1.29876978090033,7.08263877918944,-7.08263877918944,2.63667065667687,-2.63667065667687,5.64832162144326,-5.64832162144326,,,0.0,0.0,2.22589622612577,-2.22589622612577,3.36278639314534,-3.36278639314534,2.33483410690678,-2.33483410690678,3.31348751453648,-3.31348751453648,0.665209770202637,0.334790229797363,0.665209770202637,0.334790229797363,0.0413994193077087,0.0309159159660339,0.0309159159660339,0.706609189510346,0.293390810489655,0.670305967330933,0.670305967330933,0.100263893604279,-0.100263893604279,0.0583126246929169,-0.0583126246929169,,,0.0,0.0,-0.0243693292140961,0.0243693292140961,0.107681483030319,-0.107681483030319,-0.0243693292140961,0.0243693292140961,0.0826819539070129,-0.0826819539070129,0.0,0.0,0.0,0.0,0.0,0.0,0.0,0.0,0.0,0,0.0,0.0,0.0,0.0,0.0,0.0,0.0,0.0,0.0,0.0,0.0,0.0,0.0,0.0,1.0,0.0,0.0,0.0,0.0,0.0,0.0,0.0,1.0,0.0,0.0,0.0,0.0,0.0,0.0,0.0,0.0,0.0,0.0,0.0,0.0,0.0,0.0,0.0,0.0,0.0,0.0,,,,,,,00-0038794,J.McLaughlin,23.0,,,,,,,,,,,,,,,,,,,,,,,,,,,,,,,,,,,,,,,,,,,GB,,00-0033792,,R.Ford,,,,,,,,,,,,,,0.0,,,,,,,,,,,,,,,,,,,,,,,,,,,,,,,,0.0,,,,,0,,,0.0,0.0,0.0,0.0,,,2023,,,17,0,Punt,1464,"10/22/23, 16:25:22",2023-10-22T21:20:03.767Z,Empower Field at Mile High,"Temperatures to remain in 70s throughout the game Temp: 72° F, Humidity: 22%, Wind: W 9 mph",b07e45d3-f053-11ed-b4a7-bab79e4492fa,0,0,RUSH,0,,2023-10-22T21:20:10.640Z,,7,Punt,2023-10-22T21:16:00.157Z,5.0,3:13,1.0,0.0,0.0,2.0,2.0,11.0,PUNT,PUNT,09:44,06:31,DEN 10,DEN 38,1321.0,1524.0,17,19,Home,2,36,1.5,44.0,0,outdoors,grass,72.0,9.0,Sean Payton,Matt LaFleur,DEN00,Empower Field at Mile High,0,1.0,,,J.McLaughlin,38.0,,,0,1,0.0,0,1,,00-0038794,,J.McLaughlin,38.0,00-0038794,J.McLaughlin,00-0038794,J.McLaughlin,00-0038794,1,1,1.29876978090033,,,,,,0.610873520374298,-61.0873520374298,2023-10-22,D.Savage,2023,REG,GB,7,00-0034968,S,Darnell Savage,Darnell,Savage,Calf,,Questionable,Calf,,Limited Participation in Practice,2023-10-20T19:12:29Z,2023-10-20 19:12:29
1411,2023_16_NE_DEN,2023122411,DEN,NE,REG,16,DEN,home,NE,DEN,63.0,2023-12-24,359.0,359.0,2159.0,Half1,0,10.0,0,2,1.0,0,05:59,DEN 37,10,12.0,"(5:59) (Shotgun) 3-R.Wilson pass short middle to 85-L.Krull to DEN 48 for 11 yards (48-Ja.Tavai). NE-8-J.Bentley was injured during the play. PENALTY on DEN-77-Q.Meinerz, Unnecessary Roughness, 15 yards, enforced at DEN 37 - No Play.",no_play,0.0,1,0,0.0,0,0,0,,,,,,,,,,,3,3,0.0,,,,,3.0,3.0,7,3,7.0,3.0,4.0,7.0,3.0,4.0,0.246609747409821,0.0802643001079559,0.0018182921921834,0.135969161987305,0.195536077022553,0.0031986152753233,0.336603760719299,0.0,0.0,1.75301816803403,-1.40121672046371,4.84802708738479,-4.84802708738479,2.55259792611469,-2.55259792611469,0.307741083781154,-0.307741083781154,,,0.0,0.0,-2.6870014708313,2.6870014708313,-2.92861971596722,2.92861971596722,0.591095989273314,-0.591095989273314,-8.32361594826216,8.32361594826216,0.761460900306702,0.238539099693298,0.761460900306702,0.238539099693298,-0.029000461101532,-0.0338030457496643,-0.0338030457496643,0.73246043920517,0.26753956079483,0.858308374881744,0.858308374881744,0.110160472566226,-0.110160472566226,0.0133107006549835,-0.0133107006549835,,,0.0,0.0,0.0381262302398682,-0.0381262302398682,-0.138142570853233,0.138142570853233,0.0381262302398682,-0.0381262302398682,-0.156507059931755,0.156507059931755,0.0,0.0,0.0,0.0,0.0,0.0,0.0,0.0,0.0,0,0.0,0.0,0.0,0.0,0.0,0.0,0.0,0.0,0.0,0.0,0.0,0.0,0.0,0.0,0.0,0.0,1.0,0.0,0.0,0.0,0.0,0.0,0.0,0.0,0.0,0.0,0.0,0.0,0.0,0.0,0.0,0.0,0.0,0.0,0.0,0.0,0.0,0.0,0.0,0.0,0.0,,,,,,,,,,,,,,,,,,,,,,,,,,,,,,,,,,,,,,,,,,,,,,,,,,,,,,,,,,,,,,,,,,,,,,0.0,,,,,,,,,,,,,,,,,,,,,,,,,,,,,,,,0.0,DEN,00-0037001,Q.Meinerz,15.0,0,,Unnecessary Roughness,0.0,0.0,0.0,0.0,,,2023,,,21,0,Punt,1411,"12/24/23, 20:15:19",2023-12-25T02:12:45.067Z,Empower Field at Mile High,"Mostly cloudy to partly cloudy by end of game, temperatures falling Temp: 28° F, Humidity: 50%, Wind: SW 9 mph",cbaf6439-f053-11ed-b4a7-bab79e4492fa,0,0,PENALTY,0,,2023-12-25T02:12:50.140Z,,10,Punt,2023-12-25T02:08:24.907Z,8.0,6:02,2.0,0.0,0.0,2.0,2.0,-15.0,PUNT,PUNT,09:21,03:19,DEN 13,DEN 25,1281.0,1550.0,26,23,Home,-3,49,7.0,37.5,0,outdoors,grass,28.0,9.0,Sean Payton,Bill Belichick,DEN00,Empower Field at Mile High,0,0.0,R.Wilson,3.0,,,L.Krull,85.0,1,0,0.0,0,1,00-0029263,,00-0037539,R.Wilson,3.0,00-0029263,,,L.Krull,00-0037539,0,0,-1.40121672046371,,,,,,0.478763341903687,52.1236658096314,2023-12-24,J.Bentley,2023,REG,NE,16,00-0034385,LB,Ja'Whaun Bentley,Ja'Whaun,Bentley,Knee,,Questionable,Knee,,Limited Participation in Practice,2023-12-22T20:22:03Z,2023-12-22 20:22:03
1335,2023_05_NYG_MIA,2023100804,MIA,NYG,REG,5,NYG,away,MIA,MIA,46.0,2023-10-08,473.0,473.0,2273.0,Half1,0,7.0,0,2,3.0,0,07:53,MIA 46,2,44.0,(7:53) (Shotgun) 31-M.Breida up the middle to MIA 45 for 1 yard (2-B.Chubb). NYG-60-M.McKethan was injured during the play. His return is Probable.,run,1.0,1,0,0.0,0,0,0,,,,,middle,,,,,,3,2,0.0,,,,,2.0,3.0,14,0,0.0,14.0,-14.0,0.0,14.0,-14.0,0.182114765048027,0.0819679349660873,0.001063650008291,0.143192380666733,0.234165415167809,0.0040949424728751,0.353400945663452,0.0,0.0,1.93411498051137,-1.31284962175414,15.9302818870357,-15.9302818870357,7.00014162692241,-7.00014162692241,6.69384342205227,-6.69384342205227,,,0.0,0.0,-3.58058867248474,3.58058867248474,5.66584865294863,-5.66584865294863,-4.20197296724655,4.20197296724655,6.6087970235385,-6.6087970235385,0.122026935219765,0.877973064780235,0.877973064780235,0.122026935219765,-0.015799455344677,-0.0075350757688283,0.0075350757688283,0.893772520124912,0.106227479875088,0.0335500091314316,0.966449990868568,0.118983547719886,-0.118983547719886,0.194357671450054,-0.194357671450054,,,0.0,0.0,0.0829104563697927,-0.0829104563697927,0.0088744983077049,-0.0088744983077049,0.0829104563697927,-0.0829104563697927,0.0017582327127456,-0.0017582327127456,0.0,0.0,0.0,0.0,0.0,1.0,0.0,0.0,0.0,0,0.0,0.0,0.0,0.0,0.0,0.0,0.0,0.0,0.0,0.0,0.0,0.0,0.0,0.0,1.0,0.0,0.0,0.0,0.0,0.0,0.0,0.0,1.0,0.0,0.0,0.0,0.0,0.0,0.0,0.0,0.0,0.0,0.0,0.0,0.0,0.0,0.0,0.0,0.0,0.0,0.0,,,,,,,00-0033308,M.Breida,1.0,,,,,,,,,,,,,,,,,,,,,,,,,,,,,,,,,,,,,,,,,,,MIA,,00-0034832,,B.Chubb,,,,,,,,,,,,,,0.0,,,,,,,,,,,,,,,,,,,,,,,,,,,,,,,,0.0,,,,,0,,,0.0,0.0,0.0,0.0,,,2023,,,18,1,First down,1335,"10/8/23, 13:02:41",2023-10-08T17:59:45.500Z,Hard Rock Stadium,"Partly Cloudy Temp: 88° F, Humidity: 60%, Wind: W 8 mph",b07da7c5-f053-11ed-b4a7-bab79e4492fa,0,0,RUSH,0,,2023-10-08T17:59:48.833Z,,7,Field goal,2023-10-08T17:54:45.367Z,13.0,6:21,3.0,0.0,1.0,2.0,2.0,0.0,KICKOFF,FIELD_GOAL,10:02,03:41,NYG 25,MIA 31,1163.0,1589.0,16,31,Home,15,47,12.5,47.5,0,outdoors,grass,88.0,8.0,Mike McDaniel,Brian Daboll,MIA00,Hard Rock Stadium,0,0.0,,,M.Breida,31.0,,,0,1,0.0,0,1,,00-0033308,,M.Breida,31.0,00-0033308,M.Breida,00-0033308,M.Breida,00-0033308,0,0,-1.31284962175414,,,,,,0.661810457706451,-66.1810457706451,2023-10-08,M.McKethan,2023,REG,NYG,5,00-0037279,T,Marcus McKethan,Marcus,McKethan,,,,Knee,,Limited Participation in Practice,2023-10-06T18:15:00Z,2023-10-06 18:15:00
1321,2023_15_SF_ARI,2023121704,ARI,SF,REG,15,ARI,home,SF,SF,30.0,2023-12-17,452.0,452.0,2252.0,Half1,0,6.0,0,2,2.0,0,07:32,SF 30,9,44.0,"(7:32) 1-K.Murray sacked at SF 34 for -4 yards (97-N.Bosa). FUMBLES (97-N.Bosa) [97-N.Bosa], recovered by ARI-70-P.Johnson at SF 31. ARI-87-G.Swaim was injured during the play.",pass,-1.0,0,0,1.0,0,0,0,,,,,,,,,,,2,2,0.0,,,,,2.0,2.0,10,14,10.0,14.0,-4.0,10.0,14.0,-4.0,0.0693732723593712,0.0385916084051132,0.0004883973160758,0.0655421540141106,0.427067130804062,0.0009469834039919,0.397990494966507,0.0,0.0,3.49348212603945,-0.652352147910278,-3.63503215372361,3.63503215372361,2.19908431114163,-2.19908431114163,-8.77107265652424,8.77107265652424,,,0.0,0.0,-2.05681494117016,2.05681494117016,3.88544470977237,-3.88544470977237,-5.66339384677121,5.66339384677121,-1.52012078489909,1.52012078489909,0.471822470426559,0.528177529573441,0.471822470426559,0.528177529573441,-0.0340965390205383,-0.0070855319499969,-0.0070855319499969,0.437725931406021,0.562274068593979,0.123954556882381,0.123954556882381,0.0530541481291326,-0.0530541481291326,-0.207816018317166,0.207816018317166,,,0.0,0.0,-0.0067962408065795,0.0067962408065795,0.076911659291435,-0.076911659291435,-0.0067962408065795,0.0067962408065795,-0.14618490502638,0.14618490502638,0.0,0.0,0.0,0.0,0.0,0.0,0.0,0.0,0.0,0,0.0,0.0,0.0,0.0,0.0,0.0,0.0,0.0,0.0,0.0,0.0,1.0,0.0,0.0,1.0,0.0,0.0,0.0,0.0,0.0,0.0,1.0,0.0,1.0,1.0,0.0,0.0,0.0,0.0,0.0,0.0,0.0,0.0,0.0,1.0,0.0,0.0,0.0,0.0,0.0,0.0,00-0035228,K.Murray,,,,,,,,,,,,,,,,,,,,,,,,,,,,,,,,,,,,,,,,00-0035717,N.Bosa,,,SF,00-0035717,N.Bosa,,,,SF,,00-0035717,,N.Bosa,,,,,,,,,,,,,,0.0,,,,,,,,,,,ARI,00-0035228,K.Murray,,,,ARI,0.0,00-0038540,P.Johnson,,,,,00-0035717,N.Bosa,,,,,,0.0,,,,,0,,,0.0,0.0,0.0,0.0,,,2023,,,18,0,Field goal,1321,"12/17/23, 16:05:26",2023-12-17T21:58:30.453Z,State Farm Stadium,"Sunny Temp: 76° F, Humidity: 13%, Wind: NE 3 mph",cbaeffc2-f053-11ed-b4a7-bab79e4492fa,0,0,SACK,0,,2023-12-17T21:58:36.390Z,,6,Field goal,2023-12-17T21:53:25.357Z,11.0,6:15,3.0,0.0,1.0,2.0,2.0,0.0,PUNT,FIELD_GOAL,12:29,06:14,ARI 31,SF 25,1106.0,1391.0,45,29,Home,-16,74,-12.5,48.0,1,open,grass,,,Jonathan Gannon,Kyle Shanahan,PHO00,State Farm Stadium,0,0.0,K.Murray,1.0,,,,,1,0,0.0,0,1,00-0035228,,,K.Murray,1.0,00-0035228,,,,,0,1,-0.652352147910278,,,,,,0.755256652832031,24.4743347167969,2023-12-17,G.Swaim,2023,REG,ARI,15,00-0032141,TE,Geoff Swaim,Geoff,Swaim,Back,,Questionable,Back,,Limited Participation in Practice,2023-12-15T20:49:02Z,2023-12-15 20:49:02
1319,2023_16_ARI_CHI,2023122409,CHI,ARI,REG,16,CHI,home,ARI,ARI,36.0,2023-12-24,563.0,563.0,2363.0,Half1,0,7.0,0,2,2.0,0,09:23,ARI 36,5,54.0,(9:23) (Shotgun) 1-J.Fields pass deep left to 85-C.Kmet to ARI 7 for 29 yards (3-B.Baker). CHI-85-C.Kmet was injured during the play. His return is Doubtful.,pass,29.0,1,0,1.0,0,0,0,deep,left,25.0,4.0,,,,,,,3,3,0.0,,,,,3.0,3.0,14,0,14.0,0.0,14.0,14.0,0.0,14.0,0.0625039488077164,0.059342123568058,0.0009692255407571,0.0933737233281136,0.327625244855881,0.0020324869547039,0.45415323972702,0.0,0.0,3.33243250148371,2.07732535729883,19.9372189872967,-19.9372189872967,7.21774669893784,-7.21774669893784,10.2701586902258,-10.2701586902258,1.66042434918927,0.416901008109562,1.66042434918927,0.416901008109562,8.33392612898024,-8.33392612898024,0.0448957094922662,-0.0448957094922662,9.83286856836639,-9.83286856836639,-0.617106221092399,0.617106221092399,0.903091669082642,0.0969083309173584,0.903091669082642,0.0969083309173584,0.0218652486801147,0.0201035737991333,0.0201035737991333,0.924956917762756,0.0750430822372437,0.943586945533752,0.943586945533752,0.104290786658434,-0.104290786658434,0.204950481653214,-0.204950481653214,0.0,0.0218652486801147,0.0,0.0218652486801147,0.151334941387177,-0.151334941387177,0.0287737399339676,-0.0287737399339676,0.151334941387177,-0.151334941387177,0.0277907252311707,-0.0277907252311707,0.0,0.0,1.0,0.0,0.0,0.0,0.0,0.0,0.0,0,0.0,0.0,0.0,0.0,0.0,0.0,0.0,0.0,0.0,0.0,0.0,0.0,0.0,0.0,1.0,0.0,0.0,0.0,0.0,0.0,0.0,0.0,0.0,1.0,0.0,0.0,0.0,0.0,0.0,0.0,0.0,0.0,0.0,0.0,0.0,1.0,0.0,0.0,0.0,0.0,0.0,00-0036945,J.Fields,29.0,00-0036290,C.Kmet,29.0,,,,,,,,,,,,,,,,,,,,,,,,,,,,,,,,,,,,,,,,,,,,,,ARI,,00-0033890,,B.Baker,,,,,,,,,,,,,,0.0,,,,,,,,,,,,,,,,,,,,,,,,,,,,,,,,0.0,,,,,0,,,0.0,0.0,0.0,0.0,,,2023,0.369128376245499,63.0871623754501,18,1,First down,1319,"12/24/23, 16:25:41",2023-12-24T22:17:04.730Z,Soldier Field,"Mostly Cloudy Temp: 52° F, Humidity: 78%, Wind: SE 4 mph",cbaf58fa-f053-11ed-b4a7-bab79e4492fa,0,0,PASS,0,,2023-12-24T22:17:11.973Z,,7,Touchdown,2023-12-24T22:14:35.347Z,8.0,4:41,3.0,1.0,1.0,2.0,2.0,0.0,PUNT,TOUCHDOWN,11:53,07:12,CHI 46,ARI 1,1223.0,1419.0,16,27,Home,11,43,4.5,42.0,0,outdoors,grass,52.0,4.0,Matt Eberflus,Jonathan Gannon,CHI98,Soldier Field,0,1.0,J.Fields,1.0,,,C.Kmet,85.0,1,0,1.0,0,1,00-0036945,,00-0036290,J.Fields,1.0,00-0036945,C.Kmet,00-0036290,C.Kmet,00-0036290,0,1,2.07732535729883,0.729457083982392,4.84057429549284,4.0,1.0,1.0,0.498786419630051,50.1213580369949,2023-12-24,C.Kmet,2023,REG,CHI,16,00-0036290,TE,Cole Kmet,Cole,Kmet,Quadricep,,Questionable,Quadricep,,Limited Participation in Practice,2023-12-22T20:30:45Z,2023-12-22 20:30:45
1290,2023_06_NO_HOU,2023101505,HOU,NO,REG,6,NO,away,HOU,NO,81.0,2023-10-15,624.0,624.0,2424.0,Half1,0,7.0,0,2,1.0,0,10:24,NO 19,10,4.0,(10:24) 4-D.Carr pass incomplete deep left to 12-C.Olave. NO-74-J.Hurst was injured during the play. His return is Questionable.,pass,0.0,0,0,1.0,0,0,0,deep,left,22.0,,,,,,,,3,3,0.0,,,,,3.0,3.0,10,7,7.0,10.0,-3.0,7.0,10.0,-3.0,0.082028940320015,0.149605184793472,0.0024970863014459,0.241284981369972,0.18329806625843,0.0024304327089339,0.338855296373367,0.0,0.0,0.783937542233616,-0.593677187338471,2.05999014899135,-2.05999014899135,2.0557454105583,-2.0557454105583,-2.64194439757144,2.64194439757144,1.33071659808047,-1.92439378541894,0.0,0.0,3.49835800868459,-3.49835800868459,-3.02051252324731,3.02051252324731,1.77417400846025,-1.77417400846025,-4.41611840603169,4.41611840603169,0.394719123840332,0.605280876159668,0.605280876159668,0.394719123840332,-0.0111386179924011,-0.0131177306175232,0.0131177306175232,0.616419494152069,0.383580505847931,0.499181538820267,0.500818461179733,0.119673788547516,-0.119673788547516,-0.123144729013851,0.123144729013851,0.0,-0.0111386179924011,0.0,0.0,0.0778267201731112,-0.0778267201731112,-0.108080471327466,0.108080471327466,0.0778267201731112,-0.0778267201731112,-0.200971449186963,0.200971449186963,0.0,0.0,0.0,0.0,0.0,0.0,0.0,0.0,1.0,0,0.0,0.0,0.0,0.0,0.0,0.0,0.0,0.0,0.0,0.0,0.0,0.0,0.0,0.0,0.0,0.0,0.0,0.0,0.0,0.0,0.0,0.0,0.0,1.0,0.0,0.0,0.0,0.0,0.0,0.0,0.0,0.0,0.0,0.0,0.0,0.0,0.0,0.0,0.0,0.0,0.0,00-0031280,D.Carr,,00-0037239,C.Olave,,,,,,,,,,,,,,,,,,,,,,,,,,,,,,,,,,,,,,,,,,,,,,,,,,,,,,,,,,,,,,,,,0.0,,,,,,,,,,,,,,,,,,,,,,,,,,,,,,,,0.0,,,,,0,,,0.0,0.0,0.0,0.0,,,2023,0.512896776199341,-51.2896776199341,21,0,Punt,1290,"10/15/23, 13:03:19",2023-10-15T17:53:28.977Z,NRG Stadium,"Sunny Temp: 67° F, Humidity: 53%, Wind: N 14 mph",b07df07b-f053-11ed-b4a7-bab79e4492fa,0,0,PASS,0,,2023-10-15T17:53:33.917Z,,7,Punt,2023-10-15T17:52:33.423Z,3.0,1:21,0.0,0.0,0.0,2.0,2.0,0.0,KICKOFF,PUNT,10:28,09:07,NO 19,NO 23,1260.0,1370.0,13,20,Home,7,33,-2.0,42.5,0,closed,astroturf,,,DeMeco Ryans,Dennis Allen,HOU00,NRG Stadium,0,0.0,D.Carr,4.0,,,C.Olave,12.0,1,0,0.0,0,1,00-0031280,,00-0037239,D.Carr,4.0,00-0031280,C.Olave,00-0037239,C.Olave,00-0037239,0,1,-0.593677187338471,0.37411727466115,5.52172474793042,3.0,1.0,1.0,0.498845815658569,50.1154184341431,2023-10-15,J.Hurst,2023,REG,NO,6,00-0030694,T,James Hurst,James,Hurst,,,,Foot,,Full Participation in Practice,2023-10-13T19:10:48Z,2023-10-13 19:10:48
1282,2023_09_TB_HOU,2023110505,HOU,TB,REG,9,TB,away,HOU,HOU,40.0,2023-11-05,723.0,723.0,2523.0,Half1,0,8.0,0,2,1.0,0,12:03,HOU 40,10,40.0,(12:03) 6-B.Mayfield pass deep left to 13-M.Evans to HOU 24 for 16 yards (21-S.Nelson). HOU-1-J.Ward was injured during the play. He is Out.,pass,16.0,0,0,1.0,0,0,0,deep,left,16.0,0.0,,,,,,,2,3,0.0,,,,,3.0,2.0,7,10,10.0,7.0,3.0,10.0,7.0,3.0,0.0367047190666199,0.0646141469478607,0.0008043145062401,0.104806430637836,0.318085968494415,0.0015054364921525,0.47347903251648,0.0,0.0,3.34252592176199,1.10682390630245,-11.1977893498261,11.1977893498261,-2.38481248531025,2.38481248531025,-8.30550570838866,8.30550570838866,1.10682390630245,0.0,1.10682390630245,0.0,-1.28305220324546,1.28305220324546,-3.23278474354199,3.23278474354199,5.76687747862889,-5.76687747862889,-12.4123556075549,12.4123556075549,0.70487517118454,0.29512482881546,0.29512482881546,0.70487517118454,0.0053704380989074,0.0178050398826599,-0.0178050398826599,0.289754390716553,0.710245609283447,0.666151463985443,0.333848536014557,-0.0629272162914276,0.0629272162914276,-0.205261908476467,0.205261908476467,0.0053704380989074,0.0,0.0053704380989074,0.0,-0.0794086456298828,0.0794086456298828,-0.0107361897875026,0.0107361897875026,-0.0794086456298828,0.0794086456298828,-0.0817912444521144,0.0817912444521144,0.0,0.0,1.0,0.0,0.0,0.0,0.0,0.0,0.0,0,0.0,0.0,0.0,0.0,0.0,0.0,0.0,0.0,0.0,0.0,0.0,0.0,0.0,0.0,1.0,0.0,0.0,0.0,0.0,0.0,0.0,0.0,0.0,1.0,0.0,0.0,0.0,0.0,0.0,0.0,0.0,0.0,0.0,0.0,0.0,1.0,0.0,0.0,0.0,0.0,0.0,00-0034855,B.Mayfield,16.0,00-0031408,M.Evans,16.0,,,,,,,,,,,,,,,,,,,,,,,,,,,,,,,,,,,,,,,,,,,,,,HOU,,00-0032150,,S.Nelson,,,,,,,,,,,,,,0.0,,,,,,,,,,,,,,,,,,,,,,,,,,,,,,,,0.0,,,,,0,,,0.0,0.0,0.0,0.0,,,2023,0.589671730995178,41.0328269004822,16,1,First down,1282,"11/5/23, 13:02:51",2023-11-05T18:58:19.157Z,NRG Stadium,"Indoors Temp: 80° F, Humidity: 60%, Wind: ESE 5 mph",b07ec38f-f053-11ed-b4a7-bab79e4492fa,0,0,PASS,0,,2023-11-05T18:58:25.097Z,,8,Touchdown,2023-11-05T18:58:19.157Z,6.0,2:58,4.0,1.0,1.0,2.0,2.0,0.0,PUNT,TOUCHDOWN,12:03,09:05,HOU 40,HOU 1,1282.0,1429.0,37,39,Home,2,76,2.5,39.5,0,closed,astroturf,,,DeMeco Ryans,Todd Bowles,HOU00,NRG Stadium,0,1.0,B.Mayfield,6.0,,,M.Evans,13.0,1,0,1.0,0,1,00-0034855,,00-0031408,B.Mayfield,6.0,00-0034855,M.Evans,00-0031408,M.Evans,00-0031408,0,1,1.10682390630245,0.210623837321036,3.38971713837236,2.0,1.0,1.0,0.457842320203781,54.2157679796219,2023-11-05,J.Ward,2023,REG,HOU,9,00-0031298,S,Jimmie Ward,Jimmie,Ward,,,,Not injury related - resting player,,Limited Participation in Practice,2023-11-01T21:24:23Z,2023-11-01 21:24:23
1234,2023_01_CIN_CLE,2023091002,CLE,CIN,REG,1,CLE,home,CIN,CLE,57.0,2023-09-10,737.0,737.0,2537.0,Half1,0,8.0,0,2,2.0,0,12:17,CLE 43,11,-1.0,(12:17) (Shotgun) 4-D.Watson pass incomplete short left to 2-A.Cooper (91-T.Hendrickson). CLE-78-J.Conklin was injured during the play. He is Out.,pass,0.0,1,0,1.0,0,0,0,short,left,14.0,,,,,,,,3,3,0.0,,,,,3.0,3.0,3,0,3.0,0.0,3.0,3.0,0.0,3.0,0.071987971663475,0.118827663362026,0.0020282808691263,0.189487561583519,0.233994796872139,0.0040375380776822,0.379636138677597,0.0,0.0,1.680559954606,-0.855693561024964,5.51585790934041,-5.51585790934041,-0.276568898931146,0.276568898931146,0.7005056724544,-0.7005056724544,1.33766647847369,-2.19336003949866,0.0,0.0,2.22592471877579,-2.22592471877579,-1.61934285692405,1.61934285692405,12.329378277529,-12.329378277529,-10.8057448014491,10.8057448014491,0.731612682342529,0.268387317657471,0.731612682342529,0.268387317657471,-0.030775249004364,-0.0195350646972656,-0.0195350646972656,0.700837433338165,0.299162566661835,0.605756044387817,0.605756044387817,-0.0109617412090302,0.0109617412090302,0.0293408632278442,-0.0293408632278442,0.0,-0.030775249004364,0.0,0.0,-0.0153748691082001,0.0153748691082001,0.0190755724906921,-0.0190755724906921,-0.0153748691082001,0.0153748691082001,0.042024165391922,-0.042024165391922,0.0,0.0,0.0,0.0,0.0,0.0,0.0,0.0,1.0,0,0.0,0.0,0.0,0.0,0.0,0.0,0.0,0.0,0.0,0.0,0.0,0.0,0.0,0.0,0.0,0.0,0.0,0.0,0.0,0.0,0.0,0.0,0.0,1.0,0.0,0.0,0.0,0.0,0.0,0.0,0.0,0.0,0.0,0.0,0.0,0.0,0.0,0.0,0.0,0.0,0.0,00-0033537,D.Watson,,00-0031544,A.Cooper,,,,,,,,,,,,,,,,,,,,,,,,,,,,,,,,,,,,,,,,,,,,,,,,,,,,,,,,,,,,,,,,,0.0,,,,,,,00-0033935,T.Hendrickson,,,,,,,,,,,,,,,,,,,,,,,,0.0,,,,,0,,,0.0,0.0,0.0,0.0,,,2023,0.612468659877777,-61.2468659877777,14,0,Punt,1234,"9/10/23, 13:02:59",2023-09-10T17:52:29.227Z,Cleveland Browns Stadium,"Cloudy Temp: 68° F, Humidity: 83%, Wind: NW 8 mph",b07c5785-f053-11ed-b4a7-bab79e4492fa,0,0,PASS,0,,2023-09-10T17:52:33.397Z,,8,Punt,2023-09-10T17:50:37.183Z,4.0,1:18,0.0,0.0,0.0,2.0,2.0,-10.0,PUNT,PUNT,13:17,11:59,CLE 44,CLE 43,1169.0,1295.0,3,24,Home,21,27,-1.0,46.5,1,outdoors,,,,Kevin Stefanski,Zac Taylor,CLE00,FirstEnergy Stadium,0,0.0,D.Watson,4.0,,,A.Cooper,2.0,1,0,0.0,0,1,00-0033537,,00-0031544,D.Watson,4.0,00-0033537,A.Cooper,00-0031544,A.Cooper,00-0031544,0,0,-0.855693561024964,0.266282141457753,3.14884561253712,1.0,1.0,0.999048715049867,0.811452388763428,18.8547611236572,2023-09-10,J.Conklin,2023,REG,CLE,1,00-0033057,T,Jack Conklin,Jack,Conklin,,,,Not injury related - resting player,,Full Participation in Practice,2023-09-08T19:35:34Z,2023-09-08 19:35:34
1222,2023_14_MIN_LV,2023121007,LV,MIN,REG,14,MIN,away,LV,LV,33.0,2023-12-10,382.0,382.0,2182.0,Half1,0,6.0,0,2,1.0,0,06:22,LV 33,10,48.0,(6:22) 2-A.Mattison left tackle to LV 31 for 2 yards (51-M.Koonce). LV-98-M.Crosby was injured during the play.,run,2.0,0,0,0.0,0,0,0,,,,,left,tackle,,,,,3,3,0.0,,,,,3.0,3.0,0,0,0.0,0.0,0.0,0.0,0.0,0.0,0.084014318883419,0.0369760505855083,0.0005644539487548,0.0619734711945057,0.340140789747238,0.0013259249972179,0.475005030632019,0.0,0.0,3.80223807564471,-0.384794215206057,-5.25872784445528,5.25872784445528,3.00520258513279,-3.00520258513279,-7.26905119593721,7.26905119593721,,,0.0,0.0,-13.557966309716,13.557966309716,5.87613368825987,-5.87613368825987,-11.0249211741611,11.0249211741611,2.23986048984807,-2.23986048984807,0.605913758277893,0.394086241722107,0.394086241722107,0.605913758277893,-0.0123876929283142,-0.007015585899353,0.007015585899353,0.406473934650421,0.593526065349579,0.717678725719452,0.282321274280548,0.0686749517917633,-0.0686749517917633,-0.315555691719055,0.315555691719055,,,0.0,0.0,-0.153080612421036,0.153080612421036,-0.116965025663376,0.116965025663376,-0.156857132911682,0.156857132911682,-0.139959812164307,0.139959812164307,0.0,0.0,0.0,0.0,0.0,0.0,0.0,0.0,0.0,0,0.0,0.0,0.0,0.0,0.0,0.0,0.0,0.0,0.0,0.0,0.0,0.0,0.0,0.0,1.0,0.0,0.0,0.0,0.0,0.0,0.0,0.0,1.0,0.0,0.0,0.0,0.0,0.0,0.0,0.0,0.0,0.0,0.0,0.0,0.0,0.0,0.0,0.0,0.0,0.0,0.0,,,,,,,00-0034972,A.Mattison,2.0,,,,,,,,,,,,,,,,,,,,,,,,,,,,,,,,,,,,,,,,,,,LV,,00-0036989,,M.Koonce,,,,,,,,,,,,,,0.0,,,,,,,,,,,,,,,,,,,,,,,,,,,,,,,,0.0,,,,,0,,,0.0,0.0,0.0,0.0,,,2023,,,15,0,Missed field goal,1222,"12/10/23, 16:05:30",2023-12-10T21:52:43.710Z,Allegiant Stadium,"Mostly Sunny Temp: 54° F, Humidity: 15%, Wind: ENE 3 mph",cbae9976-f053-11ed-b4a7-bab79e4492fa,0,0,RUSH,0,,2023-12-10T21:52:47.550Z,,6,Missed field goal,2023-12-10T21:47:05.840Z,12.0,6:20,3.0,0.0,0.0,2.0,2.0,0.0,PUNT,MISSED_FG,11:52,05:32,MIN 21,LV 31,1027.0,1312.0,3,0,Home,-3,3,-3.0,40.5,0,dome,grass,,,Antonio Pierce,Kevin O'Connell,VEG00,Allegiant Stadium,0,0.0,,,A.Mattison,2.0,,,0,1,0.0,0,1,,00-0034972,,A.Mattison,2.0,00-0034972,A.Mattison,00-0034972,A.Mattison,00-0034972,0,1,-0.384794215206057,,,,,,0.473742038011551,-47.3742038011551,2023-12-10,M.Crosby,2023,REG,LV,14,00-0034973,DE,Maxx Crosby,Maxx,Crosby,Knee,,Questionable,Knee,,Limited Participation in Practice,2023-12-08T22:11:44Z,2023-12-08 22:11:44
1214,2023_05_TEN_IND,2023100803,IND,TEN,REG,5,IND,home,TEN,TEN,32.0,2023-10-08,601.0,601.0,2401.0,Half1,0,5.0,0,2,3.0,0,10:01,TEN 32,26,40.0,(10:01) (Shotgun) 5-A.Richardson pass short left to 11-M.Pittman to TEN 25 for 7 yards (21-R.McCreary). TEN-98-J.Simmons was injured during the play.,pass,7.0,1,0,1.0,0,0,0,short,left,-4.0,11.0,,,,,,,3,3,0.0,,,,,3.0,3.0,7,3,7.0,3.0,4.0,7.0,3.0,4.0,0.0379746183753014,0.062043197453022,0.00152998638805,0.0865647345781326,0.636267781257629,0.0011721329065039,0.174447551369667,0.0,0.0,2.33713776199147,-0.163881521387149,4.23264994056076,-4.23264994056076,5.08821665780852,-5.08821665780852,1.45301345341214,-1.45301345341214,-1.03672001860105,0.872838497213896,-1.03672001860105,0.872838497213896,-0.42833221150795,0.42833221150795,2.07214363570639,-2.07214363570639,-0.653517550847028,0.653517550847028,4.34433600913108,-4.34433600913108,0.684877395629883,0.315122604370117,0.684877395629883,0.315122604370117,-0.0283957123756409,-0.0035218000411987,-0.0035218000411987,0.656481683254242,0.343518316745758,0.522961556911469,0.522961556911469,0.220338783838098,-0.220338783838098,-0.0541112720966339,0.0541112720966339,0.0,-0.0283957123756409,0.0,-0.0283957123756409,0.0563170909881592,-0.0563170909881592,-0.0907975733280182,0.0907975733280182,0.0563170909881592,-0.0563170909881592,-0.0567037165164948,0.0567037165164948,0.0,0.0,0.0,0.0,0.0,1.0,0.0,0.0,0.0,0,0.0,0.0,0.0,0.0,0.0,0.0,0.0,0.0,0.0,0.0,0.0,0.0,0.0,0.0,1.0,0.0,0.0,0.0,0.0,0.0,0.0,0.0,0.0,1.0,0.0,0.0,0.0,0.0,0.0,0.0,0.0,0.0,0.0,0.0,0.0,1.0,0.0,0.0,0.0,0.0,0.0,00-0039164,A.Richardson,7.0,00-0036252,M.Pittman,7.0,,,,,,,,,,,,,,,,,,,,,,,,,,,,,,,,,,,,,,,,,,,,,,TEN,,00-0038125,,R.McCreary,,,,,,,,,,,,,,0.0,,,,,,,,,,,,,,,,,,,,,,,,,,,,,,,,0.0,,,,,0,,,0.0,0.0,0.0,0.0,,,2023,0.915339827537537,8.46601724624634,14,0,Field goal,1214,"10/8/23, 13:02:38",2023-10-08T17:48:20.807Z,Lucas Oil Stadium,"Cloudy Temp: 53° F, Humidity: 56%, Wind: WNW 7 mph",b07da31d-f053-11ed-b4a7-bab79e4492fa,0,0,PASS,0,,2023-10-08T17:48:25.880Z,,5,Field goal,2023-10-08T17:42:00.157Z,10.0,5:06,2.0,1.0,1.0,2.0,2.0,-10.0,PUNT,FIELD_GOAL,14:38,09:32,IND 35,TEN 25,974.0,1242.0,16,23,Home,7,39,-2.5,43.5,1,open,fieldturf,,,Shane Steichen,Mike Vrabel,IND00,Lucas Oil Stadium,0,0.0,A.Richardson,5.0,,,M.Pittman,11.0,1,0,0.0,0,1,00-0039164,,00-0036252,A.Richardson,5.0,00-0039164,M.Pittman,00-0036252,M.Pittman,00-0036252,0,1,-0.163881521387149,1.07582029681362,11.7476407475187,11.0,0.458833078824682,0.0259663543838542,0.766899943351746,23.3100056648254,2023-10-08,J.Simmons,2023,REG,TEN,5,00-0035643,DT,Jeffery Simmons,Jeffery,Simmons,,,,Ankle,,Limited Participation in Practice,2023-10-06T19:22:09Z,2023-10-06 19:22:09
1212,2023_12_GB_DET,2023112300,DET,GB,REG,12,DET,home,GB,DET,75.0,2023-11-23,775.0,775.0,2575.0,Half1,0,7.0,0,2,1.0,0,12:55,DET 25,10,34.0,(12:55) 70-D.Skipper reported in as eligible. 5-D.Montgomery up the middle to DET 34 for 9 yards (34-J.Owens). DET-77-F.Ragnow was injured during the play.,run,9.0,0,0,0.0,0,0,0,,,,,middle,,,,,,3,2,0.0,,,,,3.0,2.0,6,20,6.0,20.0,-14.0,6.0,20.0,-14.0,0.0459469743072987,0.129507958889008,0.0021282830275595,0.197225347161293,0.220967829227448,0.0026513650082051,0.401572197675705,0.0,0.0,1.70585372857749,0.690882516093552,-14.7007844963849,14.7007844963849,-0.0561098888283595,0.0561098888283595,-14.6340964533156,14.6340964533156,,,0.0,0.0,-4.77900722698541,4.77900722698541,-2.50091582845198,2.50091582845198,-4.40143664815696,4.40143664815696,-2.83157504169503,2.83157504169503,0.193609863519669,0.806390136480331,0.193609863519669,0.806390136480331,0.0211661905050278,0.0383772552013397,0.0383772552013397,0.214776054024696,0.785223945975304,0.419862270355225,0.419862270355225,-0.0121452957391739,0.0121452957391739,-0.321817141193092,0.321817141193092,,,0.0,0.0,-0.0071383007333853,0.0071383007333853,-0.213909622325838,0.213909622325838,-0.0109159835146049,0.0109159835146049,-0.192022617950381,0.192022617950381,0.0,0.0,0.0,0.0,0.0,0.0,0.0,0.0,0.0,0,0.0,0.0,0.0,0.0,0.0,0.0,0.0,0.0,0.0,0.0,0.0,0.0,0.0,0.0,1.0,0.0,0.0,0.0,0.0,0.0,0.0,0.0,1.0,0.0,0.0,0.0,0.0,0.0,0.0,0.0,0.0,0.0,0.0,0.0,0.0,0.0,0.0,0.0,0.0,0.0,0.0,,,,,,,00-0035685,D.Montgomery,9.0,,,,,,,,,,,,,,,,,,,,,,,,,,,,,,,,,,,,,,,,,,,GB,,00-0034485,,J.Owens,,,,,,,,,,,,,,0.0,,,,,,,,,,,,,,,,,,,,,,,,,,,,,,,,0.0,,,,,0,,,0.0,0.0,0.0,0.0,,,2023,,,17,1,First down,1212,"11/23/23, 12:35:39",2023-11-23T18:23:17.360Z,Ford Field,"Controlled Climate Temp: 68° F, Humidity: 70%, Wind: mph",cbad5477-f053-11ed-b4a7-bab79e4492fa,0,0,RUSH,0,,2023-11-23T18:23:21.597Z,,7,Punt,2023-11-23T18:21:17.140Z,8.0,4:17,2.0,0.0,0.0,2.0,2.0,0.0,DOWNS,PUNT,14:55,10:38,DET 14,DET 48,1146.0,1341.0,29,22,Home,-7,51,8.5,47.0,1,dome,fieldturf,,,Dan Campbell,Matt LaFleur,DET00,Ford Field,0,1.0,,,D.Montgomery,5.0,,,0,1,0.0,0,1,,00-0035685,,D.Montgomery,5.0,00-0035685,D.Montgomery,00-0035685,D.Montgomery,00-0035685,0,0,0.690882516093552,,,,,,0.544322371482849,-54.4322371482849,2023-11-23,F.Ragnow,2023,REG,DET,12,00-0034345,C,Frank Ragnow,Frank,Ragnow,,,,Toe,,Full Participation in Practice,2023-11-22T20:44:13Z,2023-11-22 20:44:13
1185,2023_17_CAR_JAX,2023123106,JAX,CAR,REG,17,JAX,home,CAR,CAR,13.0,2023-12-31,521.0,521.0,2321.0,Half1,0,5.0,0,2,1.0,0,08:41,CAR 13,10,54.0,"(8:41) 4-T.Bigsby up the middle to CAR 16 for -3 yards (26-D.Jackson, 95-Der.Brown). CAR-26-D.Jackson was injured during the play.",run,-3.0,0,0,0.0,0,0,0,,,,,middle,,,,,,3,2,0.0,,,,,3.0,2.0,3,0,3.0,0.0,3.0,3.0,0.0,3.0,0.0265414901077747,0.0147592350840569,0.0004392778209876,0.0246677994728088,0.338204085826874,0.0007132733007892,0.59467488527298,0.0,0.0,4.96093214378925,-1.09962431091117,5.82068016566336,-5.82068016566336,-3.35787168488605,3.35787168488605,8.8392882577485,-8.8392882577485,,,0.0,0.0,-1.00611974502681,1.00611974502681,4.62067021307303,-4.62067021307303,-4.19647589966189,4.19647589966189,9.31747831444954,-9.31747831444954,0.726080596446991,0.273919403553009,0.726080596446991,0.273919403553009,-0.0301243662834168,-0.020456075668335,-0.020456075668335,0.695956230163574,0.304043769836426,0.779234051704407,0.779234051704407,-0.107525408267975,0.107525408267975,0.230087131261826,-0.230087131261826,,,0.0,0.0,0.0209514200687408,-0.0209514200687408,0.132231384515762,-0.132231384515762,0.0209514200687408,-0.0209514200687408,0.15491995215416,-0.15491995215416,0.0,0.0,0.0,0.0,0.0,0.0,0.0,0.0,0.0,0,0.0,0.0,0.0,0.0,0.0,0.0,0.0,0.0,0.0,0.0,0.0,0.0,0.0,0.0,0.0,0.0,0.0,1.0,0.0,0.0,0.0,0.0,1.0,0.0,0.0,0.0,0.0,0.0,0.0,0.0,0.0,0.0,0.0,0.0,0.0,0.0,1.0,0.0,0.0,0.0,0.0,,,,,,,00-0038555,T.Bigsby,-3.0,,,,,,,,,,,,,,,,,,,,,,,,,,,,,00-0034356,D.Jackson,,,,,,,,,,,,,,,,,,,00-0036220,Der.Brown,CAR,,,,,,,,,,1.0,00-0034356,D.Jackson,CAR,,,,,,,,,,,,,,,,,,,,,,,,,,,,,0.0,,,,,0,,,0.0,0.0,0.0,0.0,,,2023,,,15,0,Field goal,1185,"12/31/23, 13:02:39",2023-12-31T18:46:44.713Z,EverBank Stadium,"Temp: 56° F, Humidity: 47%, Wind: W 8 mph",cbafa1ff-f053-11ed-b4a7-bab79e4492fa,0,0,RUSH,0,,2023-12-31T18:46:47.417Z,,5,Field goal,2023-12-31T18:41:37.307Z,12.0,5:47,3.0,1.0,1.0,2.0,2.0,0.0,PUNT,FIELD_GOAL,13:05,07:18,JAX 38,CAR 8,983.0,1258.0,0,26,Home,26,26,3.5,38.0,0,outdoors,grass,56.0,8.0,Doug Pederson,Chris Tabor,JAX00,TIAA Bank Stadium,0,0.0,,,T.Bigsby,4.0,,,0,1,0.0,0,1,,00-0038555,,T.Bigsby,4.0,00-0038555,T.Bigsby,00-0038555,T.Bigsby,00-0038555,0,1,-1.09962431091117,,,,,,0.390839546918869,-39.0839546918869,2023-12-31,D.Jackson,2023,REG,CAR,17,00-0034356,CB,Donte Jackson,Donte,Jackson,,,,Ankle,,Full Participation in Practice,2023-12-29T18:52:20Z,2023-12-29 18:52:20
1132,2023_17_TEN_HOU,2023123104,HOU,TEN,REG,17,TEN,away,HOU,TEN,75.0,2023-12-31,610.0,610.0,2410.0,Half1,0,5.0,1,2,1.0,0,10:10,TEN 25,10,-10.0,"(10:10) (Shotgun) 61-J.Ojukwu reported in as eligible. 8-W.Levis sacked at TEN 16 for -9 yards (55-J.Hughes). FUMBLES (55-J.Hughes) [55-J.Hughes], touched at TEN 15, RECOVERED by HOU-98-S.Rankins at TEN 13. 98-S.Rankins for 13 yards, TOUCHDOWN. TEN-8-W.Levis was injured during the play. He is Out.",pass,-10.0,1,0,1.0,0,0,0,,,,,,,,,,,3,2,0.0,,HOU,S.Rankins,00-0032759,2.0,3.0,16,0,0.0,10.0,-10.0,0.0,16.0,-16.0,0.0962086170911789,0.132280185818672,0.0019076261669397,0.213327810168266,0.213512569665909,0.0028167245909571,0.339946448802948,0.0,0.0,1.13184581883252,-8.13184581883252,19.9100481327393,-19.9100481327393,3.61043028440326,-3.61043028440326,12.9119203124942,-12.9119203124942,,,0.0,0.0,-6.88989889796358,6.88989889796358,10.7065932188416,-10.7065932188416,-7.95023189776111,7.95023189776111,12.7303063914228,-12.7303063914228,0.174323216080666,0.825676783919334,0.825676783919334,0.174323216080666,-0.0912633451535155,-0.0761511481683226,0.0761511481683226,0.91694012907285,0.0830598709271501,0.119274012744427,0.880725987255573,0.145198702812195,-0.145198702812195,0.179719011564858,-0.179719011564858,,,0.0,0.0,-0.117046475410461,0.117046475410461,0.145914573777141,-0.145914573777141,-0.117046475410461,0.117046475410461,0.205502141821804,-0.205502141821804,0.0,0.0,0.0,0.0,0.0,0.0,0.0,0.0,0.0,0,0.0,0.0,0.0,0.0,0.0,0.0,0.0,0.0,0.0,0.0,0.0,1.0,0.0,0.0,1.0,0.0,0.0,0.0,1.0,0.0,0.0,1.0,0.0,1.0,1.0,1.0,0.0,0.0,1.0,0.0,0.0,0.0,0.0,0.0,1.0,0.0,0.0,0.0,0.0,0.0,0.0,00-0039152,W.Levis,,,,,,,,,,,,,,,,,,,,,,,,,,,,,,,,,,,,,,,,00-0027881,J.Hughes,,,HOU,00-0027881,J.Hughes,,,,HOU,,00-0027881,,J.Hughes,,,,,,,,,,,,,,0.0,,,,,,,,,,,TEN,00-0039152,W.Levis,,,,HOU,13.0,00-0032759,S.Rankins,,,,,00-0027881,J.Hughes,,,,,,0.0,,,,,0,,,0.0,0.0,0.0,0.0,,,2023,,,16,0,Opp touchdown,1132,"12/31/23, 13:02:34",2023-12-31T18:45:32.823Z,NRG Stadium,"Sunny Temp: 68° F, Humidity: 59%, Wind: SW 2 mph",cbaf9774-f053-11ed-b4a7-bab79e4492fa,0,0,SACK,0,,2023-12-31T18:45:40.267Z,,5,Opp touchdown,2023-12-31T18:44:48.347Z,1.0,0:08,0.0,0.0,1.0,2.0,2.0,0.0,KICKOFF,FUMBLE,10:10,10:02,TEN 25,TEN 25,1109.0,1132.0,3,26,Home,23,29,5.0,44.0,1,closed,astroturf,,,DeMeco Ryans,Mike Vrabel,HOU00,NRG Stadium,0,0.0,W.Levis,8.0,,,,,1,0,0.0,0,1,00-0039152,,,W.Levis,8.0,00-0039152,,,,,0,0,-8.13184581883252,,,,,,0.51081907749176,48.918092250824,2023-12-31,W.Levis,2023,REG,TEN,17,00-0039152,QB,Will Levis,Will,Levis,,,,Ankle,,Full Participation in Practice,2023-12-29T19:52:35Z,2023-12-29 19:52:35
1125,2023_16_DAL_MIA,2023122410,MIA,DAL,REG,16,MIA,home,DAL,DAL,3.0,2023-12-24,694.0,694.0,2494.0,Half1,0,4.0,0,2,2.0,1,11:34,DAL 3,3,70.0,(11:34) 31-R.Mostert left end to DAL 5 for -2 yards (28-M.Hooker). MIA-31-R.Mostert was injured during the play.,run,-2.0,0,0,0.0,0,0,0,,,,,left,end,,,,,2,2,0.0,,,,,2.0,2.0,3,7,3.0,7.0,-4.0,3.0,7.0,-4.0,0.0169585719704628,0.012037836946547,0.0002607727074064,0.0170911140739918,0.217370241880417,0.0016394197009503,0.734642028808594,0.0,0.0,5.64161091193091,-1.38062287686626,0.445950055683546,-0.445950055683546,1.96237454848597,-1.96237454848597,-4.75076787359841,4.75076787359841,,,0.0,0.0,4.60199134162394,-4.60199134162394,-8.4139594862354,8.4139594862354,9.55449951958144,-9.55449951958144,-15.9675285784161,15.9675285784161,0.609371244907379,0.390628755092621,0.609371244907379,0.390628755092621,-0.0356786847114563,-0.0432345867156982,-0.0432345867156982,0.573692560195923,0.426307439804077,0.586228847503662,0.586228847503662,0.0224730670452118,-0.0224730670452118,-0.0850855108556943,0.0850855108556943,,,0.0,0.0,-0.105490863323212,0.105490863323212,0.0135840479078098,-0.0135840479078098,-0.105490863323212,0.105490863323212,-0.0403214987573819,0.0403214987573819,0.0,0.0,0.0,0.0,0.0,0.0,0.0,0.0,0.0,0,0.0,0.0,0.0,0.0,0.0,0.0,0.0,0.0,0.0,0.0,0.0,0.0,0.0,0.0,1.0,0.0,0.0,1.0,0.0,0.0,0.0,0.0,1.0,0.0,0.0,0.0,0.0,0.0,0.0,0.0,0.0,0.0,0.0,0.0,0.0,0.0,0.0,0.0,0.0,0.0,0.0,,,,,,,00-0031687,R.Mostert,-2.0,,,,,,,,,,,,,,,,,,,,,,,,,,,,,00-0033877,M.Hooker,,,,,,,,,,,,,DAL,,00-0033877,,M.Hooker,,,,,,,,,,,,,,0.0,,,,,,,,,,,,,,,,,,,,,,,,,,,,,,,,0.0,,,,,0,,,0.0,0.0,0.0,0.0,,,2023,,,16,0,Turnover on downs,1125,"12/24/23, 16:25:47",2023-12-24T22:09:21.810Z,Hard Rock Stadium,"Cloudy Temp: 75° F, Humidity: 66%, Wind: E 15 mph",cbaf5f72-f053-11ed-b4a7-bab79e4492fa,0,0,RUSH,0,,2023-12-24T22:09:25.347Z,,4,Turnover on downs,2023-12-24T21:57:20.990Z,12.0,5:28,4.0,1.0,0.0,1.0,2.0,0.0,KICKOFF,DOWNS,01:30,11:02,MIA 25,DAL 5,861.0,1191.0,20,22,Home,2,42,1.5,48.5,0,outdoors,grass,75.0,15.0,Mike McDaniel,Mike McCarthy,MIA00,Hard Rock Stadium,0,0.0,,,R.Mostert,31.0,,,0,1,0.0,0,1,,00-0031687,,R.Mostert,31.0,00-0031687,R.Mostert,00-0031687,R.Mostert,00-0031687,0,0,-1.38062287686626,,,,,,0.521373569965363,-52.1373569965363,2023-12-24,R.Mostert,2023,REG,MIA,16,00-0031687,RB,Raheem Mostert,Raheem,Mostert,,,,Knee,Ankle,Full Participation in Practice,2023-12-22T20:57:22Z,2023-12-22 20:57:22
1116,2023_16_NE_DEN,2023122411,DEN,NE,REG,16,DEN,home,NE,NE,49.0,2023-12-24,745.0,745.0,2545.0,Half1,0,8.0,0,2,1.0,0,12:25,NE 49,10,36.0,"(12:25) (No Huddle, Shotgun) 3-R.Wilson pass short middle to 38-J.McLaughlin to NE 38 for 11 yards (31-J.Jones). NE-31-J.Jones was injured during the play.",pass,11.0,1,1,1.0,0,0,0,short,middle,3.0,8.0,,,,,,,3,3,0.0,,,,,3.0,3.0,7,3,7.0,3.0,4.0,7.0,3.0,4.0,0.0610450357198715,0.0830183252692223,0.0011553332442417,0.132775843143463,0.271864533424377,0.0035107361618429,0.446630239486694,0.0,0.0,2.76823020470329,0.697578926803544,7.96203477132129,-7.96203477132129,0.542216120404191,-0.542216120404191,4.45252804259668,-4.45252804259668,-0.286896212724969,0.984475139528513,-0.286896212724969,0.984475139528513,0.974491177470342,-0.974491177470342,-2.44532540545333,2.44532540545333,4.25258863757496,-4.25258863757496,-7.84032163774828,7.84032163774828,0.766650021076202,0.233349978923798,0.766650021076202,0.233349978923798,0.0206605792045593,0.0136235952377319,0.0136235952377319,0.787310600280762,0.212689399719238,0.856263220310211,0.856263220310211,0.0443520571533228,-0.0443520571533228,0.112674623727798,-0.112674623727798,0.0,0.0206605792045593,0.0,0.0206605792045593,0.0332882106304169,-0.0332882106304169,-0.0339406281709671,0.0339406281709671,0.0332882106304169,-0.0332882106304169,-0.0523051172494888,0.0523051172494888,0.0,0.0,1.0,0.0,0.0,0.0,0.0,0.0,0.0,0,0.0,0.0,0.0,0.0,0.0,0.0,0.0,0.0,0.0,0.0,0.0,0.0,0.0,0.0,1.0,0.0,0.0,0.0,0.0,0.0,0.0,0.0,0.0,1.0,0.0,0.0,0.0,0.0,0.0,0.0,0.0,0.0,0.0,0.0,0.0,1.0,0.0,0.0,0.0,0.0,0.0,00-0029263,R.Wilson,11.0,00-0038794,J.McLaughlin,11.0,,,,,,,,,,,,,,,,,,,,,,,,,,,,,,,,,,,,,,,,,,,,,,NE,,00-0032580,,J.Jones,,,,,,,,,,,,,,0.0,,,,,,,,,,,,,,,,,,,,,,,,,,,,,,,,0.0,,,,,0,,,0.0,0.0,0.0,0.0,,,2023,0.810374140739441,18.9625859260559,16,1,First down,1116,"12/24/23, 20:15:19",2023-12-25T01:58:40.790Z,Empower Field at Mile High,"Mostly cloudy to partly cloudy by end of game, temperatures falling Temp: 28° F, Humidity: 50%, Wind: SW 9 mph",cbaf6439-f053-11ed-b4a7-bab79e4492fa,0,0,PASS,0,,2023-12-25T01:58:48.367Z,,8,Turnover,2023-12-25T01:56:50.413Z,4.0,2:03,3.0,0.0,0.0,2.0,2.0,0.0,KICKOFF,FUMBLE,13:30,11:27,DEN 25,NE 38,1044.0,1141.0,26,23,Home,-3,49,7.0,37.5,0,outdoors,grass,28.0,9.0,Sean Payton,Bill Belichick,DEN00,Empower Field at Mile High,0,1.0,R.Wilson,3.0,,,J.McLaughlin,38.0,1,0,1.0,0,1,00-0029263,,00-0038794,R.Wilson,3.0,00-0029263,J.McLaughlin,00-0038794,J.McLaughlin,00-0038794,0,0,0.697578926803544,0.616810279804094,5.24319738300983,4.0,0.610862948640715,0.266837560280692,0.497815608978272,50.2184391021729,2023-12-24,J.Jones,2023,REG,NE,16,00-0032580,CB,Jonathan Jones,Jonathan,Jones,Knee,,Questionable,Knee,,Limited Participation in Practice,2023-12-22T20:22:03Z,2023-12-22 20:22:03
1100,2023_03_CAR_SEA,2023092409,SEA,CAR,REG,3,SEA,home,CAR,CAR,25.0,2023-09-24,855.0,855.0,2655.0,Half1,0,5.0,0,2,1.0,0,14:15,CAR 25,20,64.0,(14:15) (Shotgun) 7-G.Smith pass short middle to 16-T.Lockett to CAR 16 for 9 yards (24-V.Bell). SEA-68-D.Lewis was injured during the play. His return is Questionable.,pass,9.0,1,0,1.0,0,0,0,short,middle,6.0,3.0,,,,,,,2,3,0.0,,,,,2.0,3.0,3,3,3.0,3.0,0.0,3.0,3.0,0.0,0.0179741811007261,0.0330815315246582,0.0005794612807221,0.0572149083018303,0.499744415283203,0.0012734084157273,0.390132129192352,0.0,0.0,3.7317970917793,0.347235267574433,2.7123807654134,-2.7123807654134,2.81267329491675,-2.81267329491675,2.42324082424911,-2.42324082424911,0.004566213581711,0.342669053992722,0.004566213581711,0.342669053992722,0.509104028576985,-0.509104028576985,-1.01206818013284,1.01206818013284,3.64532407361548,-3.64532407361548,-5.00380804524012,5.00380804524012,0.625422477722168,0.374577522277832,0.625422477722168,0.374577522277832,-0.0047729015350341,0.0019408464431762,0.0019408464431762,0.620649576187134,0.379350423812866,0.706791639328003,0.706791639328003,0.0602151155471802,-0.0602151155471802,0.0331037044525147,-0.0331037044525147,0.0,-0.0047729015350341,0.0,-0.0047729015350341,-0.012247234582901,0.012247234582901,-0.0069451332092285,0.0069451332092285,-0.012247234582901,0.012247234582901,-0.0428107380867004,0.0428107380867004,0.0,0.0,0.0,0.0,0.0,0.0,0.0,0.0,0.0,0,0.0,0.0,0.0,0.0,0.0,0.0,0.0,0.0,0.0,0.0,0.0,0.0,0.0,0.0,1.0,0.0,0.0,0.0,0.0,0.0,0.0,0.0,0.0,1.0,0.0,0.0,0.0,0.0,0.0,0.0,0.0,0.0,0.0,0.0,0.0,1.0,0.0,0.0,0.0,0.0,0.0,00-0030565,G.Smith,9.0,00-0032211,T.Lockett,9.0,,,,,,,,,,,,,,,,,,,,,,,,,,,,,,,,,,,,,,,,,,,,,,CAR,,00-0032939,,V.Bell,,,,,,,,,,,,,,0.0,,,,,,,,,,,,,,,,,,,,,,,,,,,,,,,,0.0,,,,,0,,,0.0,0.0,0.0,0.0,,,2023,0.800927877426148,19.9072122573853,14,0,Field goal,1100,"9/24/23, 16:05:39",2023-09-24T20:51:04.323Z,Lumen Field,"Cloudy Temp: 61° F, Humidity: 76%, Wind: NE 2 mph",b07d18d8-f053-11ed-b4a7-bab79e4492fa,0,0,PASS,0,,2023-09-24T20:51:10.697Z,,5,Field goal,2023-09-24T20:44:51.717Z,8.0,4:03,3.0,1.0,1.0,1.0,2.0,-10.0,PUNT,FIELD_GOAL,01:10,12:07,SEA 19,CAR 17,930.0,1170.0,27,37,Home,10,64,5.0,42.5,0,outdoors,fieldturf,61.0,2.0,Pete Carroll,Frank Reich,SEA00,Lumen Field,0,1.0,G.Smith,7.0,,,T.Lockett,16.0,1,0,0.0,0,1,00-0030565,,00-0032211,G.Smith,7.0,00-0030565,T.Lockett,00-0032211,T.Lockett,00-0032211,0,1,0.347235267574433,0.597618934032197,4.01506549041369,3.0,0.980307915859157,0.0469943291100208,0.749260067939758,25.0739932060242,2023-09-24,D.Lewis,2023,REG,SEA,3,00-0036417,G,Damien Lewis,Damien,Lewis,,,,Ankle,,Full Participation in Practice,2023-09-22T21:18:50Z,2023-09-22 21:18:50
1054,2023_19_CLE_HOU,2024011300,HOU,CLE,POST,19,CLE,away,HOU,HOU,24.0,2024-01-13,864.0,864.0,2664.0,Half1,0,7.0,0,2,2.0,0,14:24,HOU 24,6,75.0,(14:24) (Shotgun) 34-J.Ford up the middle to HOU 20 for 4 yards (25-D.King; 94-K.Davis). CLE-75-J.Bitonio was injured during the play. His return is Questionable.,run,4.0,1,0,0.0,0,0,0,,,,,middle,,,,,,2,2,0.0,,,,,2.0,2.0,10,7,7.0,10.0,-3.0,7.0,10.0,-3.0,0.0104561848565936,0.0322179943323135,0.0004904455854557,0.0529222153127194,0.452017277479172,0.0006993502611294,0.451196551322937,0.0,0.0,4.04773601086345,-0.101505384023767,0.607855323061813,-0.607855323061813,0.0208123913034797,-0.0208123913034797,-0.715791149695912,0.715791149695912,,,0.0,0.0,3.21361122542294,-3.21361122542294,0.387525311089121,-0.387525311089121,7.43386024265783,-7.43386024265783,-8.14965139235374,8.14965139235374,0.447185635566711,0.552814364433289,0.552814364433289,0.447185635566711,0.0029192268848419,-0.0006775259971618,0.0006775259971618,0.549895137548447,0.450104862451553,0.600887596607208,0.399112403392792,0.0127750023540316,-0.0127750023540316,0.0129231841354784,-0.0129231841354784,,,0.0,0.0,0.0328450500965118,-0.0328450500965118,0.053921553590816,-0.053921553590816,0.0328450500965118,-0.0328450500965118,-0.0199218659610334,0.0199218659610334,0.0,0.0,0.0,0.0,0.0,0.0,0.0,0.0,0.0,0,0.0,0.0,0.0,0.0,0.0,0.0,0.0,0.0,0.0,0.0,0.0,0.0,0.0,0.0,0.0,0.0,0.0,0.0,0.0,0.0,0.0,0.0,1.0,0.0,0.0,0.0,0.0,0.0,0.0,0.0,0.0,0.0,0.0,0.0,0.0,0.0,1.0,0.0,0.0,0.0,0.0,,,,,,,00-0037267,J.Ford,4.0,,,,,,,,,,,,,,,,,,,,,,,,,,,,,,,,,,,,,,,,,,,,,,,,,00-0033566,D.King,HOU,00-0036430,K.Davis,HOU,,,,,,,0.0,,,,,,,,,,,,,,,,,,,,,,,,,,,,,,,,0.0,,,,,0,,,0.0,0.0,0.0,0.0,,,2023,,,15,1,First down,1054,"1/13/24, 16:32:52",2024-01-13T22:18:19.390Z,NRG Stadium,"Sunny Temp: 62° F, Humidity: 40%, Wind: SSE 6 mph",48e8b94b-add1-11ee-aec3-7d8f81bc70be,0,0,RUSH,0,,2024-01-13T22:18:25.847Z,,7,Touchdown,2024-01-13T22:13:47.453Z,6.0,2:53,3.0,1.0,1.0,1.0,2.0,0.0,KICKOFF,TOUCHDOWN,00:11,12:18,CLE 25,HOU 11,961.0,1147.0,14,45,Home,31,59,-2.5,45.0,0,closed,astroturf,,,DeMeco Ryans,Kevin Stefanski,HOU00,NRG Stadium,0,0.0,,,J.Ford,34.0,,,0,1,0.0,0,1,,00-0037267,,J.Ford,34.0,00-0037267,J.Ford,00-0037267,J.Ford,00-0037267,0,0,-0.101505384023767,,,,,,0.635236024856567,-63.5236024856567,2024-01-13,J.Bitonio,2023,WC,CLE,19,00-0031426,G,Joel Bitonio,Joel,Bitonio,,,,Not injury related - resting player,"Oblique, Knee",Full Participation in Practice,2024-01-11T20:12:00Z,2024-01-11 20:12:00
1032,2023_12_NO_ATL,2023112600,ATL,NO,REG,12,NO,away,ATL,ATL,48.0,2023-11-26,52.0,952.0,2752.0,Half1,0,6.0,0,1,2.0,0,00:52,ATL 48,2,41.0,(:52) 41-A.Kamara left end to ATL 42 for 6 yards (33-T.Flowers; 37-D.Hellams). ATL-93-C.Campbell was injured during the play.,run,6.0,0,0,0.0,0,0,0,,,,,left,end,,,,,3,3,0.0,,,,,3.0,3.0,7,3,3.0,7.0,-4.0,3.0,7.0,-4.0,0.0196550823748112,0.0842791721224785,0.0010032661957666,0.152534618973732,0.267878651618958,0.0035226019099354,0.471126616001129,0.0,0.0,2.78598108910956,0.325661984155886,1.45040559521907,-1.45040559521907,-5.33021308900788,5.33021308900788,5.41424625609047,-5.41424625609047,,,0.0,0.0,-1.8764697581064,1.8764697581064,-3.98155602626503,3.98155602626503,-4.88310027844273,4.88310027844273,10.2973465345332,-10.2973465345332,0.353815466165543,0.646184533834457,0.646184533834457,0.353815466165543,0.0149831473827362,0.0161493420600891,-0.0161493420600891,0.631201386451721,0.368798613548279,0.514551222324371,0.485448777675629,-0.131104111671448,0.131104111671448,0.149257310010111,-0.149257310010111,,,0.0,0.0,-0.0049359202384948,0.0049359202384948,-0.196926176548004,0.196926176548004,-0.0049359202384948,0.0049359202384948,0.154193230248606,-0.154193230248606,0.0,1.0,0.0,0.0,0.0,0.0,0.0,0.0,0.0,0,0.0,0.0,0.0,0.0,0.0,0.0,0.0,0.0,0.0,0.0,0.0,0.0,0.0,0.0,0.0,0.0,0.0,0.0,0.0,0.0,0.0,0.0,1.0,0.0,0.0,0.0,0.0,0.0,0.0,0.0,0.0,0.0,0.0,0.0,0.0,0.0,1.0,0.0,0.0,0.0,0.0,,,,,,,00-0033906,A.Kamara,6.0,,,,,,,,,,,,,,,,,,,,,,,,,,,,,,,,,,,,,,,,,,,,,,,,,00-0034756,T.Flowers,ATL,00-0038628,D.Hellams,ATL,,,,,,,0.0,,,,,,,,,,,,,,,,,,,,,,,,,,,,,,,,0.0,,,,,0,,,0.0,0.0,0.0,0.0,,,2023,,,14,1,First down,1032,"11/26/23, 13:03:04",2023-11-26T18:40:47.017Z,Mercedes-Benz Stadium,"N/A (Indoors) Temp: 72° F, Humidity: 0%, Wind: N/A 0 mph",cbad7f4f-f053-11ed-b4a7-bab79e4492fa,0,0,RUSH,0,,2023-11-26T18:40:51.690Z,,6,Field goal,2023-11-26T18:35:03.007Z,7.0,2:30,3.0,0.0,1.0,1.0,2.0,20.0,KICKOFF,FIELD_GOAL,01:46,14:16,NO 25,ATL 34,946.0,1195.0,15,24,Home,9,39,-2.0,42.0,1,closed,fieldturf,,,Arthur Smith,Dennis Allen,ATL97,Mercedes-Benz Stadium,0,1.0,,,A.Kamara,41.0,,,0,1,1.0,0,1,,00-0033906,,A.Kamara,41.0,00-0033906,A.Kamara,00-0033906,A.Kamara,00-0033906,0,0,0.325661984155886,,,,,,0.334671884775162,-33.4671884775162,2023-11-26,C.Campbell,2023,REG,ATL,12,00-0026190,DE,Calais Campbell,Calais,Campbell,,,,Not injury related - resting player,,Did Not Participate In Practice,2023-11-22T21:15:20Z,2023-11-22 21:15:20
1000,2023_06_PHI_NYJ,2023101511,NYJ,PHI,REG,6,NYJ,home,PHI,PHI,37.0,2023-10-15,900.0,900.0,2700.0,Half1,0,3.0,0,2,1.0,0,15:00,PHI 37,10,50.0,(15:00) (Shotgun) 2-Z.Wilson pass incomplete deep left to 83-T.Conklin (32-R.Blankenship). NYJ-66-J.Tippmann was injured during the play.,pass,0.0,1,0,1.0,0,0,0,deep,left,28.0,,,,,,,,3,3,0.0,,,,,3.0,3.0,0,7,0.0,7.0,-7.0,0.0,7.0,-7.0,0.025643078610301,0.0568442568182945,0.0009763215202838,0.0936010032892227,0.324637353420258,0.0027872873470187,0.495510667562485,0.0,0.0,3.62036887137219,-0.548062205081806,-6.8434607045352,6.8434607045352,-2.76793912617723,2.76793912617723,-5.71840090112528,5.71840090112528,1.586433882243,-2.13449608732481,0.0,0.0,0.546973936259747,-0.546973936259747,-5.55478082277114,5.55478082277114,2.08591975446325,-2.08591975446325,-7.80432065558853,7.80432065558853,0.375026851892471,0.624973148107529,0.375026851892471,0.624973148107529,-0.0155688226222992,-0.0133836269378662,-0.0133836269378662,0.359458029270172,0.640541970729828,0.167519986629486,0.167519986629486,-0.0848179130119301,0.0848179130119301,-0.166903465986252,0.166903465986252,0.0,-0.0155688226222992,0.0,0.0,-0.107467085123062,0.107467085123062,-0.0531839728355408,0.0531839728355408,-0.107467085123062,0.107467085123062,-0.0594363808631897,0.0594363808631897,0.0,0.0,0.0,0.0,0.0,0.0,0.0,0.0,1.0,0,0.0,0.0,0.0,0.0,0.0,0.0,0.0,0.0,0.0,0.0,0.0,0.0,0.0,0.0,0.0,0.0,0.0,0.0,0.0,0.0,0.0,0.0,0.0,1.0,0.0,0.0,0.0,0.0,0.0,0.0,0.0,0.0,0.0,0.0,0.0,0.0,0.0,0.0,0.0,0.0,0.0,00-0037013,Z.Wilson,,00-0034270,T.Conklin,,,,,,,,,,,,,,,,,,,,,,,,,,,,,,,,,,,,,,,,,,,,,,,,,,,,,,,,,,,,,,,,,0.0,,,,,,,00-0037130,R.Blankenship,,,,,,,,,,,,,,,,,,,,,,,,0.0,,,,,0,,,0.0,0.0,0.0,0.0,,,2023,0.333782434463501,-33.3782434463501,14,1,First down,1000,"10/15/23, 16:25:49",2023-10-15T21:03:07.007Z,MetLife Stadium,"Partly Cloudy with a Fall Crisp Temp: 59° F, Humidity: 54%, Wind: NNW 11 mph",b07e0c8a-f053-11ed-b4a7-bab79e4492fa,0,0,PASS,0,,2023-10-15T21:03:12.610Z,,3,Field goal,2023-10-15T20:56:11.923Z,11.0,4:52,4.0,0.0,1.0,1.0,2.0,1.0,KICKOFF,FIELD_GOAL,03:04,13:12,NYJ 25,PHI 25,832.0,1245.0,14,20,Home,6,34,-6.5,43.0,0,outdoors,fieldturf,59.0,11.0,Robert Saleh,Nick Sirianni,NYC01,MetLife Stadium,0,0.0,Z.Wilson,2.0,,,T.Conklin,83.0,1,0,0.0,0,1,00-0037013,,00-0034270,Z.Wilson,2.0,00-0037013,T.Conklin,00-0034270,T.Conklin,00-0034270,0,1,-0.548062205081806,1.02927290092452,5.31870557405637,6.0,1.0,1.0,0.472008675336838,52.7991324663162,2023-10-15,J.Tippmann,2023,REG,NYJ,6,00-0039145,C,Joe Tippmann,Joe,Tippmann,,,,Knee,,Full Participation in Practice,2023-10-13T20:11:41Z,2023-10-13 20:11:41
991,2023_16_JAX_TB,2023122408,TB,JAX,REG,16,JAX,away,TB,JAX,71.0,2023-12-24,696.0,696.0,2496.0,Half1,0,4.0,0,2,2.0,0,11:36,JAX 29,18,41.0,(11:36) (Shotgun) 16-T.Lawrence pass short right to 1-T.Etienne to JAX 35 for 6 yards (24-C.Davis). TB-24-C.Davis was injured during the play.,pass,6.0,1,0,1.0,0,0,0,short,right,-6.0,12.0,,,,,,,3,3,0.0,,,,,3.0,3.0,10,0,0.0,10.0,-10.0,0.0,10.0,-10.0,0.10247990489006,0.154271557927132,0.0034368569031357,0.254458874464035,0.172295778989792,0.0033520609140396,0.30970498919487,0.0,0.0,0.440625874325633,-0.462972360663116,10.4635923724714,-10.4635923724714,1.91096022148849,-1.91096022148849,8.91693770202599,-8.91693770202599,-1.40564489644021,0.942672535777092,-1.40564489644021,0.942672535777092,-0.637413106451277,0.637413106451277,7.73574183275923,-7.73574183275923,-5.99417702143546,5.99417702143546,15.3788436307039,-15.3788436307039,0.205822885036469,0.794177114963532,0.794177114963532,0.205822885036469,-0.0161866396665573,-0.0040597319602966,0.0040597319602966,0.810363754630089,0.189636245369911,0.296652138233185,0.703347861766815,0.0579109191894531,-0.0579109191894531,0.235129478298717,-0.235129478298717,0.0,-0.0161866396665573,0.0,-0.0161866396665573,0.027876707636409,-0.027876707636409,0.172149077057838,-0.172149077057838,0.027876707636409,-0.027876707636409,0.240017756819725,-0.240017756819725,0.0,0.0,0.0,0.0,0.0,0.0,0.0,0.0,0.0,0,0.0,0.0,0.0,0.0,0.0,0.0,0.0,0.0,0.0,0.0,0.0,0.0,0.0,0.0,1.0,0.0,0.0,0.0,0.0,0.0,0.0,0.0,0.0,1.0,0.0,0.0,0.0,0.0,0.0,0.0,0.0,0.0,0.0,0.0,0.0,1.0,0.0,0.0,0.0,0.0,0.0,00-0036971,T.Lawrence,6.0,00-0036973,T.Etienne,6.0,,,,,,,,,,,,,,,,,,,,,,,,,,,,,,,,,,,,,,,,,,,,,,TB,,00-0034778,,C.Davis,,,,,,,,,,,,,,0.0,,,,,,,,,,,,,,,,,,,,,,,,,,,,,,,,0.0,,,,,0,,,0.0,0.0,0.0,0.0,,,2023,0.889636814594269,11.0363185405731,15,1,First down,991,"12/24/23, 16:05:21",2023-12-24T21:41:05.630Z,Raymond James Stadium,"Cloudy Temp: 72° F, Humidity: 72%, Wind: E 11 mph",cbaf530c-f053-11ed-b4a7-bab79e4492fa,0,0,PASS,0,,2023-12-24T21:41:10.633Z,,4,Missed field goal,2023-12-24T21:39:03.607Z,11.0,6:33,3.0,0.0,0.0,2.0,2.0,0.0,KICKOFF,MISSED_FG,12:53,06:20,JAX 25,TB 34,923.0,1199.0,12,30,Home,18,42,-2.0,43.0,0,outdoors,grass,72.0,11.0,Todd Bowles,Doug Pederson,TAM00,Raymond James Stadium,0,0.0,T.Lawrence,16.0,,,T.Etienne,1.0,1,0,0.0,0,1,00-0036971,,00-0036973,T.Lawrence,16.0,00-0036971,T.Etienne,00-0036973,T.Etienne,00-0036973,0,1,-0.462972360663116,1.11194945613485,11.1618289279504,10.0,0.304869131767191,0.0644566534319893,0.852612733840942,14.7387266159058,2023-12-24,C.Davis,2023,REG,TB,16,00-0034778,CB,Carlton Davis,Carlton,Davis,,,,Groin,,Full Participation in Practice,2023-12-22T20:45:48Z,2023-12-22 20:45:48
987,2023_07_GB_DEN,2023102208,DEN,GB,REG,7,DEN,home,GB,GB,10.0,2023-10-22,810.0,810.0,2610.0,Half1,0,5.0,0,2,2.0,0,13:30,GB 10,7,70.0,(13:30) (Shotgun) 3-R.Wilson pass incomplete short right. GB-95-D.Wyatt was injured during the play.,pass,0.0,1,0,1.0,0,0,0,short,right,3.0,,,,,,,,3,3,0.0,,,,,3.0,3.0,3,0,3.0,0.0,3.0,3.0,0.0,3.0,0.0119998985901475,0.0168983228504658,0.000423795543611,0.0283456612378359,0.391934037208557,0.0007956020417623,0.549602687358856,0.0,0.0,4.77464993891772,-0.754818631277885,6.42756017617649,-6.42756017617649,2.97477888426511,-2.97477888426511,4.8771054857045,-4.8771054857045,-0.308908076025546,-0.44591055525234,0.0,0.0,3.05292087537237,-3.05292087537237,2.76853538083216,-2.76853538083216,1.50338089861907,-1.50338089861907,3.37372458708543,-3.37372458708543,0.733813762664795,0.266186237335205,0.733813762664795,0.266186237335205,-0.0195168256759644,-0.0190476179122925,-0.0190476179122925,0.714296936988831,0.285703063011169,0.724015951156616,0.724015951156616,0.105966180562973,-0.105966180562973,0.0586979687213898,-0.0586979687213898,0.0,-0.0195168256759644,0.0,0.0,-0.0485438704490662,0.0485438704490662,0.1415895819664,-0.1415895819664,-0.0485438704490662,0.0485438704490662,0.107241839170456,-0.107241839170456,0.0,0.0,0.0,0.0,0.0,0.0,0.0,0.0,1.0,0,0.0,0.0,0.0,0.0,0.0,0.0,0.0,0.0,0.0,0.0,0.0,0.0,0.0,0.0,0.0,0.0,0.0,0.0,0.0,0.0,0.0,0.0,0.0,1.0,0.0,0.0,0.0,0.0,0.0,0.0,0.0,0.0,0.0,0.0,0.0,0.0,0.0,0.0,0.0,0.0,0.0,00-0029263,R.Wilson,,,,,,,,,,,,,,,,,,,,,,,,,,,,,,,,,,,,,,,,,,,,,,,,,,,,,,,,,,,,,,,,,,,,0.0,,,,,,,,,,,,,,,,,,,,,,,,,,,,,,,,0.0,,,,,0,,,0.0,0.0,0.0,0.0,,,2023,,,13,0,Field goal,987,"10/22/23, 16:25:22",2023-10-22T20:59:50.053Z,Empower Field at Mile High,"Temperatures to remain in 70s throughout the game Temp: 72° F, Humidity: 22%, Wind: W 9 mph",b07e45d3-f053-11ed-b4a7-bab79e4492fa,0,0,PASS,0,,2023-10-22T20:59:56.993Z,,5,Field goal,2023-10-22T20:51:49Z,11.0,4:17,5.0,1.0,1.0,1.0,2.0,5.0,PUNT,FIELD_GOAL,02:31,13:14,DEN 20,GB 10,756.0,1043.0,17,19,Home,2,36,1.5,44.0,0,outdoors,grass,72.0,9.0,Sean Payton,Matt LaFleur,DEN00,Empower Field at Mile High,0,0.0,R.Wilson,3.0,,,,,1,0,0.0,0,1,00-0029263,,,R.Wilson,3.0,00-0029263,,,,,0,1,-0.754818631277885,,,,,,0.691671669483185,30.8328330516815,2023-10-22,D.Wyatt,2023,REG,GB,7,00-0037075,DE,Devonte Wyatt,Devonte,Wyatt,Knee,,Questionable,Knee,,Limited Participation in Practice,2023-10-20T19:12:29Z,2023-10-20 19:12:29
946,2023_19_CLE_HOU,2024011300,HOU,CLE,POST,19,HOU,home,CLE,CLE,15.0,2024-01-13,11.0,911.0,2711.0,Half1,0,6.0,1,1,,0,00:11,CLE 15,0,75.0,"15-K.Fairbairn extra point is GOOD, Center-46-J.Weeks, Holder-11-C.Johnston. HOU-78-L.Tunsil was injured during the play.",extra_point,0.0,0,0,0.0,0,0,0,,,,,,,,33.0,good,,2,2,0.0,,,,,2.0,2.0,10,7,9.0,7.0,2.0,10.0,7.0,3.0,0.0,0.0,0.0,0.0,0.0,0.0,0.0,0.931428649020072,0.0,0.931428649020072,0.0685713509799278,3.53127557481639,-3.53127557481639,-0.146941425569821,0.146941425569821,2.37538291893197,-2.37538291893197,,,0.0,0.0,4.07592624920653,-4.07592624920653,2.61638435593341,-2.61638435593341,8.29617526644142,-8.29617526644142,-5.92079234750946,5.92079234750946,0.661407533386272,0.338592466613728,0.661407533386272,0.338592466613728,0.0025701194018903,0.0025508872186701,0.0025508872186701,0.663977652788162,0.336022347211838,0.507023198255344,0.507023198255344,0.0113279505904971,-0.0113279505904971,0.128452751138729,-0.128452751138729,,,0.0,0.0,0.0328450500965118,-0.0328450500965118,0.169451120594066,-0.169451120594066,0.0328450500965118,-0.0328450500965118,0.0956077010422167,-0.0956077010422167,0.0,0.0,0.0,0.0,0.0,0.0,0.0,0.0,0.0,0,0.0,0.0,0.0,0.0,0.0,0.0,0.0,0.0,0.0,0.0,0.0,0.0,0.0,0.0,0.0,0.0,0.0,0.0,0.0,0.0,0.0,0.0,0.0,0.0,0.0,0.0,0.0,0.0,0.0,1.0,0.0,0.0,0.0,0.0,0.0,0.0,0.0,0.0,0.0,0.0,0.0,,,,,,,,,,,,,,,,,,,,,,,,,,,,,,,,K.Fairbairn,00-0032726,,,,,,,,,,,,,,,,,,,,,,,,,,,,,,,,,,,,,0.0,,,,,,,,,,,,,,,,,,,,,,,,,,,,,,,,0.0,,,,,0,,,0.0,0.0,0.0,0.0,,,2023,,,13,1,Touchdown,946,"1/13/24, 16:32:52",2024-01-13T22:10:58Z,NRG Stadium,"Sunny Temp: 62° F, Humidity: 40%, Wind: SSE 6 mph",48e8b94b-add1-11ee-aec3-7d8f81bc70be,0,0,XP_KICK,1,,,,6,Touchdown,2024-01-13T22:07:29.707Z,4.0,1:58,3.0,1.0,1.0,1.0,1.0,0.0,KICKOFF,TOUCHDOWN,02:09,00:11,HOU 25,CLE 15,833.0,946.0,14,45,Home,31,59,-2.5,45.0,0,closed,astroturf,,,DeMeco Ryans,Kevin Stefanski,HOU00,NRG Stadium,0,1.0,,,,,,,0,0,0.0,1,0,,,,,,,,,,,0,0,0.0685713509799278,,,,,,,,2024-01-13,L.Tunsil,2023,WC,HOU,19,00-0032380,T,Laremy Tunsil,Laremy,Tunsil,,,,Not injury related - resting player,,Did Not Participate In Practice,2024-01-09T22:14:32Z,2024-01-09 22:14:32
938,2023_07_CLE_IND,2023102202,IND,CLE,REG,7,CLE,away,IND,CLE,75.0,2023-10-22,193.0,1093.0,2893.0,Half1,0,7.0,0,1,3.0,0,03:13,CLE 25,7,3.0,"(3:13) (Shotgun) 4-D.Watson pass deep left intended for 8-E.Moore INTERCEPTED by 23-K.Moore [54-D.Odeyingbo] at CLE 43. 23-K.Moore to CLE 43 for no gain (8-E.Moore). CLE-4-D.Watson was injured during the play. The Replay Official reviewed the interception ruling, and the play was REVERSED. (Shotgun) 4-D.Watson pass incomplete deep left to 8-E.Moore [54-D.Odeyingbo]. CLE-4-D.Watson was injured during the play.",pass,0.0,1,0,1.0,0,0,0,deep,left,18.0,,,,,,,,3,3,0.0,,,,,3.0,3.0,14,7,7.0,14.0,-7.0,7.0,14.0,-7.0,0.0184341017156839,0.168057948350906,0.0024497115518897,0.335838139057159,0.18065732717514,0.0028943491633981,0.29166841506958,0.0,0.0,-0.270500656217337,-1.4605540339835,10.2263951344186,-10.2263951344186,-3.98373238299973,3.98373238299973,13.3967744472902,-13.3967744472902,2.40913468133658,-3.86968871532008,0.0,0.0,3.22048826725222,-3.22048826725222,5.85206091054715,-5.85206091054715,1.25179774104618,-1.25179774104618,12.1449767062441,-12.1449767062441,0.223514690995216,0.776485309004784,0.776485309004784,0.223514690995216,-0.028253048658371,-0.0388334393501282,0.0388334393501282,0.804738357663155,0.195261642336845,0.401931554079056,0.598068445920944,-0.10934690237257,0.10934690237257,0.400277440799213,-0.400277440799213,0.0,-0.028253048658371,0.0,0.0,0.0741573572158814,-0.0741573572158814,0.247975205434299,-0.247975205434299,0.0741573572158814,-0.0741573572158814,0.326120083583332,-0.326120083583332,0.0,0.0,0.0,0.0,0.0,1.0,0.0,0.0,1.0,0,0.0,0.0,0.0,0.0,0.0,0.0,0.0,0.0,0.0,0.0,0.0,0.0,0.0,0.0,0.0,0.0,0.0,0.0,0.0,0.0,0.0,1.0,0.0,1.0,0.0,0.0,0.0,0.0,0.0,0.0,0.0,0.0,0.0,0.0,0.0,0.0,0.0,0.0,0.0,0.0,0.0,00-0033537,D.Watson,,00-0036980,E.Moore,,,,,,,,,,,,,,,,,,,,,,,,,,,,,,,,,,,,,00-0036480,D.Odeyingbo,,,,,,,,,,,,,,,,,,,,,,,,,,,0.0,,,,,,,,,,,,,,,,,,,,,,,,,,,,,,,,0.0,,,,,1,reversed,,0.0,0.0,0.0,0.0,,,2023,0.374412506818771,-37.4412506818771,10,0,Punt,938,"10/22/23, 13:02:41",2023-10-22T17:40:16.207Z,Lucas Oil Stadium,"Sunny Temp: 53° F, Humidity: 48%, Wind: NNE 6 mph",b07e2983-f053-11ed-b4a7-bab79e4492fa,0,0,INTERCEPTION,0,,2023-10-22T17:40:25.850Z,,7,Punt,2023-10-22T17:38:24.897Z,3.0,1:37,0.0,0.0,0.0,1.0,1.0,0.0,KICKOFF,PUNT,04:28,02:51,CLE 22,CLE 25,862.0,968.0,39,38,Home,-1,77,-3.5,40.0,0,open,fieldturf,,,Shane Steichen,Kevin Stefanski,IND00,Lucas Oil Stadium,0,0.0,D.Watson,4.0,,,E.Moore,8.0,1,0,0.0,0,1,00-0033537,,00-0036980,D.Watson,4.0,00-0033537,E.Moore,00-0036980,E.Moore,00-0036980,0,0,-1.4605540339835,0.350745392981814,5.06768548033142,2.0,1.0,1.0,0.985214650630951,1.47853493690491,2023-10-22,D.Watson,2023,REG,CLE,7,00-0033537,QB,Deshaun Watson,Deshaun,Watson,right Shoulder,,Questionable,right Shoulder,,Full Participation in Practice,2023-10-20T17:57:56Z,2023-10-20 17:57:56
928,2023_09_NYG_LV,2023110509,LV,NYG,REG,9,NYG,away,LV,NYG,54.0,2023-11-05,900.0,900.0,2700.0,Half1,0,5.0,0,2,2.0,0,15:00,NYG 46,17,27.0,(15:00) (Shotgun) 8-D.Jones sacked at NYG 36 for -10 yards (51-M.Koonce). NYG-8-D.Jones was injured during the play.,pass,-10.0,1,0,1.0,0,0,0,,,,,,,,,,,3,3,0.0,,,,,3.0,3.0,7,0,0.0,7.0,-7.0,0.0,7.0,-7.0,0.0268062148243189,0.125620678067207,0.0017952815396711,0.216734424233437,0.235925868153572,0.0069109625183045,0.386206597089767,0.0,0.0,1.52745214221068,-1.62746600271203,9.23247297451796,-9.23247297451796,4.28756910178345,-4.28756910178345,4.2301510424586,-4.2301510424586,,,0.0,0.0,4.0707852372434,-4.0707852372434,-4.24639419780578,4.24639419780578,-2.64681774144992,2.64681774144992,3.84829076158348,-3.84829076158348,0.244805410504341,0.755194589495659,0.755194589495659,0.244805410504341,-0.0245631635189056,-0.0359623432159424,0.0359623432159424,0.779757753014565,0.220242246985435,0.272606939077377,0.727393060922623,0.0570092984303439,-0.0570092984303439,0.155918672680855,-0.155918672680855,,,0.0,0.0,0.0,0.0,0.0417061150074005,-0.0417061150074005,0.0,0.0,0.102448612451553,-0.102448612451553,0.0,0.0,0.0,0.0,0.0,0.0,0.0,0.0,0.0,0,0.0,0.0,0.0,0.0,0.0,0.0,0.0,0.0,0.0,0.0,0.0,0.0,0.0,0.0,1.0,0.0,0.0,0.0,0.0,0.0,0.0,1.0,0.0,1.0,1.0,0.0,0.0,0.0,0.0,0.0,0.0,0.0,0.0,0.0,0.0,0.0,0.0,0.0,0.0,0.0,0.0,00-0035710,D.Jones,,,,,,,,,,,,,,,,,,,,,,,,,,,,,,,,,,,,00-0036989,M.Koonce,,,00-0036989,M.Koonce,,,,,,,,,LV,,00-0036989,,M.Koonce,,,,,,,,,,,,,,0.0,,,,,,,,,,,,,,,,,,,,,,,,,00-0036989,M.Koonce,,,,,,0.0,,,,,0,,,0.0,0.0,0.0,0.0,,,2023,,,12,0,Punt,928,"11/5/23, 16:25:28",2023-11-05T22:01:53.120Z,Allegiant Stadium,"Partly Cloudy Temp: 73° F, Humidity: 13%, Wind: ENE 5 mph",b07ed7da-f053-11ed-b4a7-bab79e4492fa,0,0,SACK,0,,2023-11-05T22:01:55.923Z,,5,Punt,2023-11-05T21:54:02.683Z,10.0,5:19,3.0,0.0,0.0,1.0,2.0,0.0,PUNT,PUNT,04:11,13:52,NYG 20,NYG 47,706.0,988.0,6,30,Home,24,36,1.0,38.5,0,dome,grass,,,Antonio Pierce,Brian Daboll,VEG00,Allegiant Stadium,0,0.0,D.Jones,8.0,,,,,1,0,0.0,0,1,00-0035710,,,D.Jones,8.0,00-0035710,,,,,0,0,-1.62746600271203,,,,,,0.847361981868744,15.2638018131256,2023-11-05,D.Jones,2023,REG,NYG,9,00-0035710,QB,Daniel Jones,Daniel,Jones,,,,Neck,,Full Participation in Practice,2023-11-03T18:21:44Z,2023-11-03 18:21:44
922,2023_13_SEA_DAL,2023113000,DAL,SEA,REG,13,SEA,away,DAL,DAL,23.0,2023-11-30,137.0,1037.0,2837.0,Half1,0,4.0,0,1,1.0,0,02:17,DAL 23,10,51.0,"(2:17) (No Huddle, Shotgun) 26-Z.Charbonnet right guard to DAL 23 for no gain (11-M.Parsons, 6-D.Wilson). SEA-75-A.Bradford was injured during the play.",run,0.0,1,1,0.0,0,0,0,,,,,right,guard,,,,,3,3,0.0,,,,,3.0,3.0,10,7,7.0,10.0,-3.0,7.0,10.0,-3.0,0.0053348140791058,0.0287624225020409,0.0005482740234583,0.0434001088142395,0.3781418800354,0.0007860953337512,0.543026387691498,0.0,0.0,4.54599796736147,-0.446274979389273,-2.16630849614739,2.16630849614739,-1.24016556324204,1.24016556324204,-4.88137770600897,4.88137770600897,,,0.0,0.0,2.58316986239515,-2.58316986239515,-1.20183606771752,1.20183606771752,2.23061984893866,-2.23061984893866,-3.03721413994208,3.03721413994208,0.540990114212036,0.459009885787964,0.459009885787964,0.540990114212036,-0.0140285491943359,-0.0058187544345855,0.0058187544345855,0.4730384349823,0.5269615650177,0.264974147081375,0.735025852918625,-0.0593777894973755,0.0593777894973755,-0.150615343888501,0.150615343888501,,,0.0,0.0,0.150693447483046,-0.150693447483046,-0.118883590432368,0.118883590432368,0.150693447483046,-0.150693447483046,-0.174316982957087,0.174316982957087,0.0,0.0,0.0,0.0,0.0,0.0,0.0,0.0,0.0,0,0.0,0.0,0.0,0.0,0.0,0.0,0.0,0.0,0.0,0.0,0.0,0.0,0.0,0.0,0.0,0.0,0.0,0.0,0.0,0.0,0.0,0.0,1.0,0.0,0.0,0.0,0.0,0.0,0.0,0.0,0.0,0.0,0.0,0.0,0.0,0.0,1.0,0.0,0.0,0.0,0.0,,,,,,,00-0039165,Z.Charbonnet,0.0,,,,,,,,,,,,,,,,,,,,,,,,,,,,,,,,,,,,,,,,,,,,,,,,,00-0035301,D.Wilson,DAL,,,,,,,,,,1.0,00-0036932,M.Parsons,DAL,,,,,,,,,,,,,,,,,,,,,,,,,,,,,0.0,,,,,0,,,0.0,0.0,0.0,0.0,,,2023,,,12,0,Missed field goal,922,"11/30/23, 20:15:51",2023-12-01T01:46:32.987Z,AT&T Stadium,,cbae0cc9-f053-11ed-b4a7-bab79e4492fa,0,0,RUSH,0,,2023-12-01T01:46:38.793Z,,4,Missed field goal,2023-12-01T01:41:49.570Z,9.0,3:50,2.0,1.0,0.0,1.0,1.0,-6.0,KICKOFF,MISSED_FG,04:48,00:58,SEA 25,DAL 24,734.0,1023.0,35,41,Home,6,76,9.5,47.5,0,closed,matrixturf,,,Mike McCarthy,Pete Carroll,DAL00,AT&T Stadium,0,0.0,,,Z.Charbonnet,26.0,,,0,1,0.0,0,1,,00-0039165,,Z.Charbonnet,26.0,00-0039165,Z.Charbonnet,00-0039165,Z.Charbonnet,00-0039165,0,1,-0.446274979389273,,,,,,0.428454548120499,-42.8454548120499,2023-11-30,A.Bradford,2023,REG,SEA,13,00-0039020,G,Anthony Bradford,Anthony,Bradford,,,,Knee,,Full Participation in Practice,2023-11-29T21:02:56Z,2023-11-29 21:02:56
883,2023_06_NYG_BUF,2023101512,BUF,NYG,REG,6,BUF,home,NYG,NYG,47.0,2023-10-15,171.0,1071.0,2871.0,Half1,0,5.0,0,1,1.0,0,02:51,NYG 47,10,38.0,(2:51) 28-L.Murray up the middle to NYG 37 for 10 yards (58-B.Okereke). NYG-22-A.Jackson was injured during the play. His return is Questionable. A.Jackson assisted off.,run,10.0,0,0,0.0,0,0,0,,,,,middle,,,,,,3,3,0.0,,,,,3.0,3.0,0,3,0.0,3.0,-3.0,0.0,3.0,-3.0,0.023990236222744,0.0792738571763039,0.0011495918733999,0.126774653792381,0.276254922151566,0.0035727540962398,0.48898395895958,0.0,0.0,3.13125465554185,0.597807844635099,-2.11890110489912,2.11890110489912,2.64532408583909,-2.64532408583909,-5.19415443846469,5.19415443846469,,,0.0,0.0,-1.18427150184289,1.18427150184289,-3.03947720730889,3.03947720730889,4.56915383343585,-4.56915383343585,-10.6671818777288,10.6671818777288,0.493379861116409,0.506620138883591,0.493379861116409,0.506620138883591,0.0423364341259003,0.0351428985595703,0.0351428985595703,0.53571629524231,0.46428370475769,0.794927716255188,0.794927716255188,0.107177436351776,-0.107177436351776,-0.148051559925079,0.148051559925079,,,0.0,0.0,-0.0347691476345062,0.0347691476345062,-0.0790550112724304,0.0790550112724304,-0.0347691476345062,0.0347691476345062,-0.133221298456192,0.133221298456192,0.0,1.0,0.0,0.0,0.0,0.0,0.0,0.0,0.0,0,0.0,0.0,0.0,0.0,0.0,0.0,0.0,0.0,0.0,0.0,0.0,0.0,0.0,0.0,1.0,0.0,0.0,0.0,0.0,0.0,0.0,0.0,1.0,0.0,0.0,0.0,0.0,0.0,0.0,0.0,0.0,0.0,0.0,0.0,0.0,0.0,0.0,0.0,0.0,0.0,0.0,,,,,,,00-0030513,L.Murray,10.0,,,,,,,,,,,,,,,,,,,,,,,,,,,,,,,,,,,,,,,,,,,NYG,,00-0035687,,B.Okereke,,,,,,,,,,,,,,0.0,,,,,,,,,,,,,,,,,,,,,,,,,,,,,,,,0.0,,,,,0,,,0.0,0.0,0.0,0.0,,,2023,,,11,1,First down,883,"10/15/23, 20:23:23",2023-10-16T00:56:57.430Z,Highmark Stadium,"Cloudy Temp: 46° F, Humidity: 90%, Wind: NW 7 mph",b07e111b-f053-11ed-b4a7-bab79e4492fa,0,0,RUSH,0,,2023-10-16T00:57:01.300Z,,5,Punt,2023-10-16T00:55:19.697Z,5.0,1:50,2.0,0.0,0.0,1.0,1.0,0.0,KICKOFF,PUNT,03:19,01:29,BUF 25,NYG 37,818.0,1000.0,9,14,Home,5,23,15.5,43.5,0,outdoors,a_turf,46.0,7.0,Sean McDermott,Brian Daboll,BUF00,New Era Field,0,1.0,,,L.Murray,28.0,,,0,1,1.0,0,1,,00-0030513,,L.Murray,28.0,00-0030513,L.Murray,00-0030513,L.Murray,00-0030513,0,1,0.597807844635099,,,,,,0.522555708885193,-52.2555708885193,2023-10-15,A.Jackson,2023,REG,NYG,6,00-0033878,CB,Adoree' Jackson,Adoree',Jackson,,,,Ribs,,Full Participation in Practice,2023-10-13T18:09:04Z,2023-10-13 18:09:04
873,2023_16_SEA_TEN,2023122407,TEN,SEA,REG,16,TEN,home,SEA,TEN,57.0,2023-12-24,144.0,1044.0,2844.0,Half1,0,5.0,0,1,1.0,0,02:24,TEN 43,10,57.0,"(2:24) 17-R.Tannehill pass incomplete deep left to 16-T.Burks. SEA-56-J.Brooks was injured during the play. PENALTY on SEA-6-Q.Diggs, Unnecessary Roughness, 15 yards, enforced at TEN 43 - No Play.",no_play,0.0,0,0,0.0,0,0,0,,,,,,,,,,,3,2,0.0,,,,,3.0,2.0,0,0,0.0,0.0,0.0,0.0,0.0,0.0,0.0291366204619408,0.0959755629301071,0.0014346630778163,0.140367686748505,0.252889007329941,0.0033454515505582,0.476850986480713,0.0,0.0,2.82994500827044,0.747152571100742,2.10299981152639,-2.10299981152639,2.63392399158329,-2.63392399158329,-0.230465439613909,0.230465439613909,,,0.0,0.0,-2.31054743379355,2.31054743379355,1.33893806301057,-1.33893806301057,-0.338517302181572,0.338517302181572,-1.06731985462829,1.06731985462829,0.579312324523926,0.420687675476074,0.579312324523926,0.420687675476074,0.0044721961021423,0.015109658241272,0.015109658241272,0.583784520626068,0.416215479373932,0.429289191961288,0.429289191961288,0.0190910696983337,-0.0190910696983337,-0.0035618245601654,0.0035618245601654,,,0.0,0.0,-0.0232774317264557,0.0232774317264557,0.0249332189559937,-0.0249332189559937,-0.0232774317264557,0.0232774317264557,-0.0233234167098999,0.0233234167098999,0.0,0.0,0.0,1.0,0.0,0.0,0.0,0.0,0.0,0,0.0,0.0,0.0,0.0,0.0,0.0,0.0,0.0,0.0,0.0,0.0,0.0,0.0,0.0,0.0,0.0,1.0,0.0,0.0,0.0,0.0,0.0,0.0,0.0,0.0,0.0,0.0,0.0,0.0,0.0,0.0,0.0,0.0,0.0,0.0,0.0,0.0,0.0,0.0,0.0,0.0,,,,,,,,,,,,,,,,,,,,,,,,,,,,,,,,,,,,,,,,,,,,,,,,,,,,,,,,,,,,,,,,,,,,,,0.0,,,,,,,,,,,,,,,,,,,,,,,,,,,,,,,,0.0,SEA,00-0031608,Q.Diggs,15.0,0,,Unnecessary Roughness,0.0,0.0,0.0,0.0,,,2023,,,10,1,First down,873,"12/24/23, 13:02:25",2023-12-24T18:34:38.290Z,Nissan Stadium,"Cloudy Temp: 64° F, Humidity: 70%, Wind: SSE 13 mph",cbaf4dca-f053-11ed-b4a7-bab79e4492fa,0,0,PENALTY,0,,2023-12-24T18:34:43.497Z,,5,Touchdown,2023-12-24T18:34:38.290Z,6.0,3:10,4.0,1.0,1.0,1.0,2.0,15.0,PUNT,TOUCHDOWN,02:24,14:14,TEN 43,SEA 12,873.0,1077.0,20,17,Home,-3,37,-3.0,42.0,0,outdoors,grass,61.0,4.0,Mike Vrabel,Pete Carroll,NAS00,Nissan Stadium,0,1.0,R.Tannehill,17.0,,,T.Burks,16.0,1,0,1.0,0,1,00-0029701,,00-0037742,R.Tannehill,17.0,00-0029701,,,T.Burks,00-0037742,0,1,0.747152571100742,,,,,,0.483484894037247,51.6515105962753,2023-12-24,J.Brooks,2023,REG,SEA,16,00-0036409,LB,Jordyn Brooks,Jordyn,Brooks,,,,Ankle,,Full Participation in Practice,2023-12-22T22:12:41Z,2023-12-22 22:12:41
873,2023_01_CIN_CLE,2023091002,CLE,CIN,REG,1,CLE,home,CIN,CIN,44.0,2023-09-10,58.0,958.0,2758.0,Half1,0,6.0,0,1,1.0,0,00:58,CIN 44,10,33.0,(:58) (Shotgun) 4-D.Watson pass deep right to 2-A.Cooper to CIN 24 for 20 yards (55-L.Wilson). CLE-2-A.Cooper was injured during the play. His return is Probable.,pass,20.0,1,0,1.0,0,0,0,deep,right,19.0,1.0,,,,,,,3,3,0.0,,,,,3.0,3.0,0,0,0.0,0.0,0.0,0.0,0.0,0.0,0.0367031246423721,0.0741021633148193,0.001137591083534,0.118899777531624,0.290745615959168,0.0033057250548154,0.475106030702591,0.0,0.0,3.14771039807238,1.41832797892857,5.33626074378844,-5.33626074378844,0.425596720306203,-0.425596720306203,2.2841874161968,-2.2841874161968,1.28684925986454,0.131478719064035,1.28684925986454,0.131478719064035,3.66504918574356,-3.66504918574356,-2.43775700463448,2.43775700463448,11.1504592573619,-11.1504592573619,-8.04314403753961,8.04314403753961,0.642072677612305,0.357927322387695,0.642072677612305,0.357927322387695,0.0624993443489075,0.0483137965202332,0.0483137965202332,0.704572021961212,0.295427978038788,0.54365885257721,0.54365885257721,0.006667822599411,-0.006667822599411,0.0897759199142456,-0.0897759199142456,0.0,0.0624993443489075,0.0,0.0624993443489075,-0.0043900907039642,0.0043900907039642,0.039486825466156,-0.039486825466156,-0.0043900907039642,0.0043900907039642,0.0914744436740875,-0.0914744436740875,0.0,0.0,1.0,0.0,0.0,0.0,0.0,0.0,0.0,0,0.0,0.0,0.0,0.0,0.0,0.0,0.0,0.0,0.0,0.0,0.0,0.0,0.0,0.0,1.0,0.0,0.0,0.0,0.0,0.0,0.0,0.0,0.0,1.0,0.0,0.0,0.0,0.0,0.0,0.0,0.0,0.0,0.0,0.0,0.0,1.0,0.0,0.0,0.0,0.0,0.0,00-0033537,D.Watson,20.0,00-0031544,A.Cooper,20.0,,,,,,,,,,,,,,,,,,,,,,,,,,,,,,,,,,,,,,,,,,,,,,CIN,,00-0036294,,L.Wilson,,,,,,,,,,,,,,0.0,,,,,,,,,,,,,,,,,,,,,,,,,,,,,,,,0.0,,,,,0,,,0.0,0.0,0.0,0.0,,,2023,0.547033488750458,45.2966511249542,11,1,First down,873,"9/10/23, 13:02:59",2023-09-10T17:36:42.313Z,Cleveland Browns Stadium,"Cloudy Temp: 68° F, Humidity: 83%, Wind: NW 8 mph",b07c5785-f053-11ed-b4a7-bab79e4492fa,0,0,PASS,0,,2023-09-10T17:36:49.453Z,,6,Field goal,2023-09-10T17:35:28.373Z,7.0,2:54,2.0,0.0,1.0,1.0,2.0,0.0,PUNT,FIELD_GOAL,02:09,14:15,CLE 43,CIN 24,819.0,998.0,3,24,Home,21,27,-1.0,46.5,1,outdoors,,,,Kevin Stefanski,Zac Taylor,CLE00,FirstEnergy Stadium,0,1.0,D.Watson,4.0,,,A.Cooper,2.0,1,0,1.0,0,1,00-0033537,,00-0031544,D.Watson,4.0,00-0033537,A.Cooper,00-0031544,A.Cooper,00-0031544,0,0,1.41832797892857,0.395802438668474,4.78955371587654,2.0,1.0,1.0,0.475691139698029,52.4308860301971,2023-09-10,A.Cooper,2023,REG,CLE,1,00-0031544,WR,Amari Cooper,Amari,Cooper,,,,Not injury related - resting player,,Full Participation in Practice,2023-09-08T18:52:17Z,2023-09-08 18:52:17
858,2023_06_MIN_CHI,2023101502,CHI,MIN,REG,6,CHI,home,MIN,MIN,4.0,2023-10-15,853.0,853.0,2653.0,Half1,0,3.0,0,2,3.0,1,14:13,MIN 4,4,71.0,(14:13) (Shotgun) 1-J.Fields sacked at MIN 4 for 0 yards (97-H.Phillips). MIN-0-M.Davenport was injured during the play. His return is Questionable.,pass,0.0,1,0,1.0,0,0,0,,,,,,,,,,,3,3,0.0,,,,,3.0,3.0,0,3,0.0,3.0,-3.0,0.0,3.0,-3.0,0.0105801345780492,0.0175190474838018,0.0004377494333311,0.0260177459567785,0.442244529724121,0.0013694902881979,0.501831293106079,0.0,0.0,4.6067347584758,-1.65488645489826,-2.92333663939066,2.92333663939066,3.25786215648986,-3.25786215648986,-2.29296850881246,2.29296850881246,,,0.0,0.0,3.00308247236535,-3.00308247236535,-0.285075929015875,0.285075929015875,2.12363925157115,-2.12363925157115,0.0594360829037701,-0.0594360829037701,0.566157758235931,0.433842241764069,0.566157758235931,0.433842241764069,-0.0613921880722046,-0.038451761007309,-0.038451761007309,0.504765570163727,0.495234429836273,0.377248734235764,0.377248734235764,0.113361805677414,-0.113361805677414,-0.0864377915859222,0.0864377915859222,,,0.0,0.0,-0.0033458471298217,0.0033458471298217,0.0556669235229492,-0.0556669235229492,-0.0033458471298217,0.0033458471298217,0.0529193580150604,-0.0529193580150604,0.0,0.0,0.0,0.0,0.0,1.0,0.0,0.0,0.0,0,0.0,0.0,0.0,0.0,0.0,0.0,0.0,0.0,0.0,0.0,0.0,0.0,0.0,0.0,1.0,0.0,0.0,0.0,0.0,0.0,0.0,1.0,0.0,1.0,1.0,0.0,0.0,0.0,0.0,0.0,0.0,0.0,0.0,0.0,0.0,0.0,0.0,0.0,0.0,0.0,0.0,00-0036945,J.Fields,,,,,,,,,,,,,,,,,,,,,,,,,,,,,,,,,,,,,,,,00-0034782,H.Phillips,,,,,,,,,MIN,,00-0034782,,H.Phillips,,,,,,,,,,,,,,0.0,,,,,,,,,,,,,,,,,,,,,,,,,00-0034782,H.Phillips,,,,,,0.0,,,,,0,,,0.0,0.0,0.0,0.0,,,2023,,,11,0,Field goal,858,"10/15/23, 13:03:25",2023-10-15T17:36:33.507Z,Soldier Field,"Partly Cloudy Temp: 53° F, Humidity: 74%, Wind: S 16 mph",b07de249-f053-11ed-b4a7-bab79e4492fa,0,0,SACK,0,,2023-10-15T17:36:38.947Z,,3,Field goal,2023-10-15T17:20:44.090Z,14.0,7:43,5.0,1.0,1.0,1.0,2.0,-4.0,KICKOFF,FIELD_GOAL,06:24,13:41,CHI 25,MIN 4,466.0,883.0,19,13,Home,-6,32,-3.0,44.5,1,outdoors,grass,53.0,16.0,Matt Eberflus,Kevin O'Connell,CHI98,Soldier Field,0,0.0,J.Fields,1.0,,,,,1,0,0.0,0,1,00-0036945,,,J.Fields,1.0,00-0036945,,,,,0,1,-1.65488645489826,,,,,,0.927916765213013,7.20832347869873,2023-10-15,M.Davenport,2023,REG,MIN,6,00-0034344,DE,Marcus Davenport,Marcus,Davenport,,,,Elbow,,Full Participation in Practice,2023-10-13T18:29:34Z,2023-10-13 18:29:34
831,2023_06_NE_LV,2023101509,LV,NE,REG,6,LV,home,NE,NE,18.0,2023-10-15,223.0,1123.0,2923.0,Half1,0,3.0,0,1,2.0,0,03:43,NE 18,9,42.0,(3:43) (Shotgun) 10-J.Garoppolo pass short middle intended for 17-D.Adams INTERCEPTED by 48-Ja.Tavai (5-J.Peppers) at NE 14. 48-Ja.Tavai to NE 14 for no gain (68-A.James). LV-17-D.Adams was injured during the play.,pass,0.0,1,0,1.0,0,0,0,short,middle,4.0,,,,,,,,3,3,0.0,,,,,3.0,3.0,3,0,3.0,0.0,3.0,3.0,0.0,3.0,0.003651708131656,0.0220104344189167,0.0006997171440161,0.0350862145423889,0.402015775442123,0.0008074335637502,0.535728693008423,0.0,0.0,4.64472880517133,-4.92417614371516,1.94776217127219,-1.94776217127219,-1.1290191601729,1.1290191601729,-0.210573161467778,0.210573161467778,-0.250849331147037,-4.67332681256812,0.0,0.0,-0.540998087730259,0.540998087730259,7.36761921539437,-7.36761921539437,2.80059928365517,-2.80059928365517,-3.01117244512295,3.01117244512295,0.714315414428711,0.285684585571289,0.714315414428711,0.285684585571289,-0.105235904455185,-0.120804131031036,-0.120804131031036,0.609079509973526,0.390920490026474,0.730549991130829,0.730549991130829,-0.0307590663433075,0.0307590663433075,0.0176920294761658,-0.0176920294761658,0.0,-0.105235904455185,0.0,0.0,0.0,0.0,0.20787101984024,-0.20787101984024,0.0,0.0,0.0176920294761658,-0.0176920294761658,0.0,0.0,0.0,0.0,0.0,0.0,0.0,0.0,0.0,0,1.0,0.0,0.0,0.0,0.0,0.0,0.0,0.0,0.0,0.0,0.0,0.0,0.0,0.0,1.0,0.0,0.0,0.0,0.0,0.0,0.0,0.0,0.0,1.0,0.0,0.0,0.0,0.0,0.0,0.0,0.0,0.0,0.0,0.0,0.0,0.0,0.0,0.0,0.0,0.0,0.0,00-0031345,J.Garoppolo,,00-0031381,D.Adams,,,,,,,,,,,,,00-0035240,Ja.Tavai,,,,,,,,,,,,,,,,,,,,,,,,,,,,,,,,,LV,,00-0035127,,A.James,,,,,,,,,,,,,,0.0,,,,,,,00-0033883,J.Peppers,00-0035240,Ja.Tavai,,,,,,,,,,,,,,,,,,,,,NE,0.0,,,,,0,,,0.0,0.0,0.0,0.0,,,2023,0.815065443515778,-81.5065443515778,9,0,Turnover,831,"10/15/23, 16:05:31",2023-10-15T20:33:19.973Z,Allegiant Stadium,"Sunny Temp: 81° F, Humidity: 13%, Wind: NNE 5 mph",b07e0339-f053-11ed-b4a7-bab79e4492fa,0,0,INTERCEPTION,0,,2023-10-15T20:33:26.013Z,,3,Turnover,2023-10-15T20:30:04.277Z,5.0,2:24,3.0,1.0,0.0,1.0,1.0,15.0,PUNT,INTERCEPTION,05:58,03:34,LV 40,NE 18,675.0,831.0,17,21,Home,4,38,3.0,41.5,0,dome,grass,,,Josh McDaniels,Bill Belichick,VEG00,Allegiant Stadium,0,0.0,J.Garoppolo,10.0,,,D.Adams,17.0,1,0,0.0,0,1,00-0031345,,00-0031381,J.Garoppolo,10.0,00-0031345,D.Adams,00-0031381,D.Adams,00-0031381,0,1,-4.92417614371516,0.727538813336636,3.99020307284081,3.0,0.693091596534941,0.348285364976618,0.767021298408508,23.2978701591492,2023-10-15,D.Adams,2023,REG,LV,6,00-0031381,WR,Davante Adams,Davante,Adams,,,,Shoulder,,Full Participation in Practice,2023-10-13T20:51:50Z,2023-10-13 20:51:50
810,2023_11_NYJ_BUF,2023111909,BUF,NYJ,REG,11,NYJ,away,BUF,NYJ,55.0,2023-11-19,233.0,1133.0,2933.0,Half1,0,5.0,0,1,2.0,0,03:53,NYJ 45,13,15.0,(3:53) (Shotgun) 2-Z.Wilson sacked at NYJ 39 for -6 yards (sack split by 43-T.Bernard and 56-L.Floyd). NYJ-77-M.Becton was injured during the play. He is Out. M.Becton walks off gingerly.,pass,-6.0,1,0,1.0,0,0,0,,,,,,,,,,,3,3,0.0,,,,,3.0,3.0,6,0,0.0,6.0,-6.0,0.0,6.0,-6.0,0.0239905025810003,0.123789280653,0.0020995277445763,0.232014715671539,0.236912563443184,0.0051966342143714,0.375996798276901,0.0,0.0,1.35343863954768,-1.38626844389364,8.54632389079779,-8.54632389079779,1.8668153192848,-1.8668153192848,-0.747112878382311,0.747112878382311,,,0.0,0.0,0.628193784621544,-0.628193784621544,-0.235109444125555,0.235109444125555,2.03510943474248,-2.03510943474248,-3.23786839943359,3.23786839943359,0.263149261474609,0.736850738525391,0.736850738525391,0.263149261474609,-0.0300160199403763,-0.0202439501881599,0.0202439501881599,0.766866758465767,0.233133241534233,0.135788202285767,0.864211797714233,0.1280178129673,-0.1280178129673,0.0035113841295242,-0.0035113841295242,,,0.0,0.0,0.0369575023651123,-0.0369575023651123,-0.0179754495620728,0.0179754495620728,0.0369575023651123,-0.0369575023651123,-0.0554272532463074,0.0554272532463074,0.0,0.0,0.0,0.0,0.0,0.0,0.0,0.0,0.0,0,0.0,0.0,0.0,0.0,0.0,0.0,0.0,0.0,0.0,0.0,0.0,0.0,0.0,0.0,0.0,0.0,0.0,0.0,0.0,0.0,0.0,1.0,0.0,1.0,1.0,0.0,0.0,0.0,0.0,0.0,0.0,0.0,0.0,0.0,0.0,0.0,1.0,0.0,0.0,0.0,0.0,00-0037013,Z.Wilson,,,,,,,,,,,,,,,,,,,,,,,,,,,,,,,,,,,,,,,,00-0037254,T.Bernard,00-0033072,L.Floyd,,,,,,,,,,,,,00-0037254,T.Bernard,BUF,00-0033072,L.Floyd,BUF,,,,,,,0.0,,,,,,,,,,,,,,,,,,,,,,,,,,,00-0037254,T.Bernard,00-0033072,L.Floyd,,0.0,,,,,0,,,0.0,0.0,0.0,0.0,,,2023,,,11,0,Punt,810,"11/19/23, 16:25:31",2023-11-19T21:53:14.867Z,Highmark Stadium,"Clear Temp: 40° F, Humidity: 60%, Wind: NW 9 mph",cbad2ed3-f053-11ed-b4a7-bab79e4492fa,0,0,SACK,0,,2023-11-19T21:53:19.143Z,,5,Punt,2023-11-19T21:50:21.260Z,5.0,3:38,1.0,0.0,0.0,1.0,1.0,0.0,KICKOFF,PUNT,05:56,02:18,NYJ 34,NYJ 49,701.0,866.0,6,32,Home,26,38,8.0,39.5,1,outdoors,a_turf,40.0,9.0,Sean McDermott,Robert Saleh,BUF00,New Era Field,0,0.0,Z.Wilson,2.0,,,,,1,0,0.0,0,1,00-0037013,,,Z.Wilson,2.0,00-0037013,,,,,0,0,-1.38626844389364,,,,,,0.810807168483734,18.9192831516266,2023-11-19,M.Becton,2023,REG,NYJ,11,00-0036284,T,Mekhi Becton,Mekhi,Becton,,,,Knee,Wrist,Full Participation in Practice,2023-11-17T19:51:07Z,2023-11-17 19:51:07
803,2023_06_SF_CLE,2023101504,CLE,SF,REG,6,SF,away,CLE,SF,61.0,2023-10-15,194.0,1094.0,2894.0,Half1,0,5.0,0,1,2.0,0,03:14,SF 39,8,-3.0,(3:14) (Shotgun) 13-B.Purdy scrambles right end pushed ob at SF 44 for 5 yards (23-M.Emerson). SF-71-T.Williams was injured during the play. His return is Questionable.,run,5.0,1,0,1.0,0,0,1,,,,,right,end,,,,,3,2,0.0,,,,,2.0,3.0,0,7,7.0,0.0,7.0,7.0,0.0,7.0,0.0366575084626675,0.126956105232239,0.0016192988259717,0.259744614362717,0.245501041412354,0.0042057950049638,0.325315594673157,0.0,0.0,0.819804663071409,-0.0215571105945855,-8.54152424643743,8.54152424643743,-1.70082016709934,1.70082016709934,-6.13985358863156,6.13985358863156,,,0.0,0.0,0.558571357862093,-0.558571357862093,0.471276711229983,-0.471276711229983,2.9084439635626,-2.9084439635626,-9.04829755219416,9.04829755219416,0.677304685115814,0.322695314884186,0.322695314884186,0.677304685115814,0.0003299117088317,-0.0013866424560546,0.0013866424560546,0.322365403175354,0.677634596824646,0.909409523010254,0.0905904769897461,-0.0768551826477051,0.0768551826477051,-0.102803162344199,0.102803162344199,,,0.0,0.0,0.0355884432792664,-0.0355884432792664,0.0176406288068477,-0.0176406288068477,0.0355884432792664,-0.0355884432792664,-0.138391605623465,0.138391605623465,0.0,0.0,0.0,0.0,0.0,0.0,0.0,0.0,0.0,0,0.0,0.0,0.0,0.0,0.0,0.0,0.0,0.0,0.0,0.0,0.0,0.0,0.0,0.0,1.0,0.0,0.0,0.0,0.0,0.0,0.0,0.0,1.0,0.0,0.0,0.0,0.0,0.0,0.0,0.0,0.0,0.0,0.0,0.0,0.0,0.0,0.0,0.0,0.0,0.0,0.0,,,,,,,00-0037834,B.Purdy,5.0,,,,,,,,,,,,,,,,,,,,,,,,,,,,,,,,,,,,,,,,,,,CLE,,00-0037250,,M.Emerson,,,,,,,,,,,,,,0.0,,,,,,,,,,,,,,,,,,,,,,,,,,,,,,,,0.0,,,,,0,,,0.0,0.0,0.0,0.0,,,2023,,,10,0,Punt,803,"10/15/23, 13:03:11",2023-10-15T17:34:37.763Z,Cleveland Browns Stadium,"Temp: 53° F, Humidity: 70%, Wind: NNW 15 mph",b07deb8a-f053-11ed-b4a7-bab79e4492fa,0,0,RUSH,0,,2023-10-15T17:34:45.570Z,,5,Punt,2023-10-15T17:34:01.227Z,3.0,1:43,0.0,0.0,0.0,1.0,1.0,-10.0,MISSED_FG,PUNT,03:51,02:08,SF 37,SF 34,774.0,940.0,17,19,Home,2,36,-9.5,36.0,0,outdoors,grass,53.0,15.0,Kevin Stefanski,Kyle Shanahan,CLE00,FirstEnergy Stadium,0,0.0,B.Purdy,13.0,,13.0,,,1,0,0.0,0,1,00-0037834,,,B.Purdy,13.0,00-0037834,B.Purdy,00-0037834,B.Purdy,00-0037834,1,0,-0.0215571105945855,,,,,,0.718021035194397,28.1978964805603,2023-10-15,T.Williams,2023,REG,SF,6,00-0027857,T,Trent Williams,Trent,Williams,,,,Not injury related - resting player,,Did Not Participate In Practice,2023-10-11T23:08:29Z,2023-10-11 23:08:29
802,2023_11_DAL_CAR,2023111900,CAR,DAL,REG,11,CAR,home,DAL,CAR,52.0,2023-11-19,97.0,997.0,2797.0,Half1,0,4.0,0,1,3.0,0,01:37,CAR 48,7,14.0,(1:37) (Shotgun) 9-B.Young sacked at CAR 39 for -9 yards (11-M.Parsons). CAR-63-A.Corbett was injured during the play.,pass,-9.0,1,0,1.0,0,0,0,,,,,,,,,,,3,3,0.0,,,,,3.0,3.0,0,7,0.0,7.0,-7.0,0.0,7.0,-7.0,0.0372599065303803,0.125276133418083,0.0015428010374307,0.214619487524033,0.230994015932083,0.0045286649838089,0.385779023170471,0.0,0.0,1.52124212495983,-2.20529923727736,-8.35527358586895,8.35527358586895,-2.5193819811102,2.5193819811102,-4.72942603961565,4.72942603961565,,,0.0,0.0,3.04142357548699,-3.04142357548699,-2.21626541414298,2.21626541414298,4.41154189361259,-4.41154189361259,-4.42418927256949,4.42418927256949,0.377290546894074,0.622709453105927,0.377290546894074,0.622709453105927,-0.0346797704696655,-0.0168243944644928,-0.0168243944644928,0.342610776424408,0.657389223575592,0.107529692351818,0.107529692351818,-0.0722749531269074,0.0722749531269074,-0.137919246638977,0.137919246638977,,,0.0,0.0,-0.0581471914898987,0.0581471914898987,0.0681391358375549,-0.0681391358375549,-0.0581471914898987,0.0581471914898987,0.0367469787597656,-0.0367469787597656,0.0,0.0,0.0,0.0,0.0,1.0,0.0,0.0,0.0,0,0.0,0.0,0.0,0.0,0.0,0.0,0.0,0.0,0.0,0.0,0.0,0.0,0.0,0.0,1.0,0.0,0.0,0.0,0.0,0.0,0.0,1.0,0.0,1.0,1.0,0.0,0.0,0.0,0.0,0.0,0.0,0.0,0.0,0.0,0.0,0.0,0.0,0.0,0.0,0.0,0.0,00-0039150,B.Young,,,,,,,,,,,,,,,,,,,,,,,,,,,,,,,,,,,,00-0036932,M.Parsons,,,00-0036932,M.Parsons,,,,,,,,,DAL,,00-0036932,,M.Parsons,,,,,,,,,,,,,,0.0,,,,,,,,,,,,,,,,,,,,,,,,,00-0036932,M.Parsons,,,,,,0.0,,,,,0,,,0.0,0.0,0.0,0.0,,,2023,,,12,0,Punt,802,"11/19/23, 13:02:42",2023-11-19T18:27:56.797Z,Bank of America Stadium,"Sunny Temp: 65° F, Humidity: 28%, Wind: E 2 mph",cbace39a-f053-11ed-b4a7-bab79e4492fa,0,0,SACK,0,,2023-11-19T18:28:00.403Z,,4,Punt,2023-11-19T18:24:49.143Z,5.0,2:10,1.0,0.0,0.0,1.0,1.0,0.0,KICKOFF,PUNT,03:20,01:10,CAR 25,CAR 39,681.0,822.0,33,10,Home,-23,43,-11.0,43.0,0,outdoors,grass,65.0,2.0,Frank Reich,Mike McCarthy,CAR00,Bank of America Stadium,0,0.0,B.Young,9.0,,,,,1,0,0.0,0,1,00-0039150,,,B.Young,9.0,00-0039150,,,,,0,0,-2.20529923727736,,,,,,0.981852948665619,1.81470513343811,2023-11-19,A.Corbett,2023,REG,CAR,11,00-0034261,G,Austin Corbett,Austin,Corbett,,,,Calf,,Full Participation in Practice,2023-11-17T18:31:57Z,2023-11-17 18:31:57
789,2023_05_CAR_DET,2023100802,DET,CAR,REG,5,CAR,away,DET,CAR,74.0,2023-10-08,265.0,1165.0,2965.0,Half1,0,5.0,0,1,2.0,0,04:25,CAR 26,9,75.0,(4:25) (Shotgun) 9-B.Young pass short left to 19-A.Thielen pushed ob at CAR 31 for 5 yards (25-W.Harris). DET-4-E.Moseley was injured during the play. He is Out.,pass,5.0,1,0,1.0,0,0,0,short,left,3.0,2.0,,,,,,,2,3,0.0,,,,,3.0,2.0,14,0,0.0,14.0,-14.0,0.0,14.0,-14.0,0.017529621720314,0.142792835831642,0.0033576884306967,0.271983414888382,0.192068949341774,0.0018246689578518,0.37044283747673,0.0,0.0,0.833978259703144,-0.0541382133960724,17.2331795090616,-17.2331795090616,6.60539973934647,-6.60539973934647,8.31417746760417,-8.31417746760417,-0.290516276378185,0.236378062982112,-0.290516276378185,0.236378062982112,-4.22689778363565,4.22689778363565,3.23532931116642,-3.23532931116642,-3.20346587937092,3.20346587937092,11.5176433469751,-11.5176433469751,0.122451759874821,0.877548240125179,0.877548240125179,0.122451759874821,0.000664584338665,0.0003739856183528,-0.0003739856183528,0.876883655786514,0.123116344213486,0.0473240204155445,0.952675979584455,0.156910043285748,-0.156910043285748,0.112006071740797,-0.112006071740797,0.0,0.000664584338665,0.0,0.000664584338665,-0.0894464552402496,0.0894464552402496,0.0175031905714774,-0.0175031905714774,-0.0894464552402496,0.0894464552402496,0.201452526981046,-0.201452526981046,0.0,0.0,0.0,0.0,0.0,0.0,0.0,0.0,0.0,0,0.0,0.0,0.0,0.0,0.0,0.0,0.0,0.0,0.0,0.0,0.0,0.0,0.0,0.0,1.0,0.0,0.0,0.0,0.0,0.0,0.0,0.0,0.0,1.0,0.0,0.0,0.0,0.0,0.0,0.0,0.0,0.0,0.0,0.0,0.0,1.0,0.0,0.0,0.0,0.0,0.0,00-0039150,B.Young,5.0,00-0030035,A.Thielen,5.0,,,,,,,,,,,,,,,,,,,,,,,,,,,,,,,,,,,,,,,,,,,,,,DET,,00-0035655,,W.Harris,,,,,,,,,,,,,,0.0,,,,,,,,,,,,,,,,,,,,,,,,,,,,,,,,0.0,,,,,0,,,0.0,0.0,0.0,0.0,,,2023,0.810509324073792,18.9490675926209,11,1,First down,789,"10/8/23, 13:02:40",2023-10-08T17:41:45.437Z,Ford Field,"Controlled Climate Temp: 68° F, Humidity: 70%, Wind: mph",b07d9e8c-f053-11ed-b4a7-bab79e4492fa,0,0,PASS,0,,2023-10-08T17:41:50.043Z,,5,Touchdown,2023-10-08T17:32:09.397Z,14.0,7:05,7.0,1.0,1.0,1.0,2.0,0.0,KICKOFF,TOUCHDOWN,04:53,12:48,CAR 25,DET 1,741.0,1219.0,24,42,Home,18,66,9.5,43.5,0,dome,fieldturf,,,Dan Campbell,Frank Reich,DET00,Ford Field,0,0.0,B.Young,9.0,,,A.Thielen,19.0,1,0,0.0,0,1,00-0039150,,00-0030035,B.Young,9.0,00-0039150,A.Thielen,00-0030035,A.Thielen,00-0030035,1,0,-0.0541382133960724,0.731028988133901,4.68377465304366,3.0,0.547462038317462,0.273852221289417,0.676979303359985,32.3020696640015,2023-10-08,E.Moseley,2023,REG,DET,5,00-0034096,CB,Emmanuel Moseley,Emmanuel,Moseley,Knee,Hamstring,Questionable,Knee,Hamstring,Full Participation in Practice,2023-10-06T19:35:22Z,2023-10-06 19:35:22
783,2023_15_DAL_BUF,2023121706,BUF,DAL,REG,15,DAL,away,BUF,DAL,66.0,2023-12-17,179.0,1079.0,2879.0,Half1,0,4.0,0,1,2.0,0,02:59,DAL 34,10,0.0,(2:59) 4-D.Prescott pass incomplete short middle to 20-T.Pollard. DAL-70-Z.Martin was injured during the play. He is Out. Z.Martin walks off.,pass,0.0,0,0,1.0,0,0,0,short,middle,2.0,,,,,,,,3,3,0.0,,,,,3.0,3.0,7,0,0.0,7.0,-7.0,0.0,7.0,-7.0,0.0309356562793255,0.134939223527908,0.0022929026745259,0.261143922805786,0.216925844550133,0.0036420114338398,0.350120425224304,0.0,0.0,0.871493597514927,-0.779655805323273,6.38558593169781,-6.38558593169781,3.31826401880244,-3.31826401880244,1.49432866839925,-1.49432866839925,-0.635872664861381,-0.143783140461892,0.0,0.0,-0.506086124340072,0.506086124340072,1.08984486199915,-1.08984486199915,-1.57757358637173,1.57757358637173,1.40007437457098,-1.40007437457098,0.302043050527573,0.697956949472427,0.697956949472427,0.302043050527573,-0.0205630660057068,-0.0183282494544983,0.0183282494544983,0.718520015478134,0.281479984521866,0.307038426399231,0.692961573600769,0.0683511918508166,-0.0683511918508166,0.0627331733703613,-0.0627331733703613,0.0,-0.0205630660057068,0.0,0.0,0.0,0.0,0.0605427324771881,-0.0605427324771881,0.0,0.0,0.0337753891944885,-0.0337753891944885,0.0,0.0,0.0,0.0,0.0,0.0,0.0,0.0,1.0,0,0.0,0.0,0.0,0.0,0.0,0.0,0.0,0.0,0.0,0.0,0.0,0.0,0.0,0.0,0.0,0.0,0.0,0.0,0.0,0.0,0.0,0.0,0.0,1.0,0.0,0.0,0.0,0.0,0.0,0.0,0.0,0.0,0.0,0.0,0.0,0.0,0.0,0.0,0.0,0.0,0.0,00-0033077,D.Prescott,,00-0035261,T.Pollard,,,,,,,,,,,,,,,,,,,,,,,,,,,,,,,,,,,,,,,,,,,,,,,,,,,,,,,,,,,,,,,,,0.0,,,,,,,,,,,,,,,,,,,,,,,,,,,,,,,,0.0,,,,,0,,,0.0,0.0,0.0,0.0,,,2023,0.810530424118042,-81.0530424118042,12,0,Punt,783,"12/17/23, 16:26:51",2023-12-17T21:56:00.340Z,Highmark Stadium,"Rain showers Temp: 48° F, Humidity: 90%, Wind: S 9 mph",cbaf0a05-f053-11ed-b4a7-bab79e4492fa,0,0,PASS,0,,2023-12-17T21:56:03.910Z,,4,Punt,2023-12-17T21:55:27.007Z,3.0,0:28,0.0,0.0,0.0,1.0,1.0,0.0,PUNT,PUNT,03:04,02:36,DAL 34,DAL 34,749.0,847.0,10,31,Home,21,41,2.0,49.5,0,outdoors,a_turf,48.0,9.0,Sean McDermott,Mike McCarthy,BUF00,New Era Field,0,0.0,D.Prescott,4.0,,,T.Pollard,20.0,1,0,0.0,0,1,00-0033077,,00-0035261,D.Prescott,4.0,00-0033077,T.Pollard,00-0035261,T.Pollard,00-0035261,0,1,-0.779655805323273,0.924951887482479,5.6500357365876,4.0,0.477029810717795,0.237720112374518,0.544380962848663,45.5619037151337,2023-12-17,Z.Martin,2023,REG,DAL,15,00-0031402,G,Zack Martin,Zack,Martin,,,,Not injury related - resting player,,Limited Participation in Practice,2023-12-14T20:49:33Z,2023-12-14 20:49:33
763,2023_14_TEN_MIA,2023121100,MIA,TEN,REG,14,MIA,home,TEN,MIA,57.0,2023-12-11,182.0,1082.0,2882.0,Half1,0,5.0,0,1,1.0,0,03:02,MIA 43,10,46.0,(3:02) (Shotgun) 1-T.Tagovailoa pass short right to 10-T.Hill to MIA 37 for -6 yards (0-S.Murphy-Bunting). MIA-10-T.Hill was injured during the play. His return is Questionable.,pass,-6.0,1,0,1.0,0,0,0,short,right,-4.0,-2.0,,,,,,,3,3,0.0,,,,,3.0,3.0,7,0,7.0,0.0,7.0,7.0,0.0,7.0,0.0267378836870194,0.0973008871078491,0.0015303088584914,0.16314622759819,0.243843555450439,0.0038001015782356,0.463641077280045,0.0,0.0,2.54763153824024,-1.2429899268318,10.0267352150846,-10.0267352150846,3.73373368236935,-3.73373368236935,6.57370829890715,-6.57370829890715,-1.10911602410488,-0.133873902726918,-1.10911602410488,-0.133873902726918,1.69268647348508,-1.69268647348508,1.37638966925442,-1.37638966925442,1.6823861412704,-1.6823861412704,8.5591643860098,-8.5591643860098,0.83092737197876,0.16907262802124,0.83092737197876,0.16907262802124,-0.0166765451431274,-0.009168267250061,-0.009168267250061,0.814250826835632,0.185749173164368,0.958240211009979,0.958240211009979,0.0560645908117294,-0.0560645908117294,0.209481622719941,-0.209481622719941,0.0,-0.0166765451431274,0.0,-0.0166765451431274,0.124562919139862,-0.124562919139862,0.0115875154733658,-0.0115875154733658,0.124562919139862,-0.124562919139862,0.180281173134026,-0.180281173134026,0.0,0.0,0.0,0.0,0.0,0.0,0.0,0.0,0.0,0,0.0,0.0,0.0,0.0,0.0,0.0,0.0,0.0,0.0,0.0,0.0,0.0,0.0,0.0,1.0,0.0,0.0,0.0,0.0,0.0,0.0,0.0,0.0,1.0,0.0,0.0,0.0,0.0,0.0,0.0,0.0,0.0,0.0,0.0,0.0,1.0,0.0,0.0,0.0,0.0,0.0,00-0036212,T.Tagovailoa,-6.0,00-0033040,T.Hill,-6.0,,,,,,,,,,,,,,,,,,,,,,,,,,,,,,,,00-0035239,S.Murphy-Bunting,,,,,,,,,,,,,TEN,,00-0035239,,S.Murphy-Bunting,,,,,,,,,,,,,,0.0,,,,,,,,,,,,,,,,,,,,,,,,,,,,,,,,0.0,,,,,0,,,0.0,0.0,0.0,0.0,,,2023,0.878420114517212,12.1579885482788,11,1,First down,763,"12/11/23, 20:15:23",2023-12-12T01:46:20.597Z,Hard Rock Stadium,"Partly Cloudy Temp: 64° F, Humidity: 73%, Wind: N 9 mph",cbaeb503-f053-11ed-b4a7-bab79e4492fa,0,0,PASS,0,,2023-12-12T01:46:26.003Z,,5,Punt,2023-12-12T01:44:20.610Z,10.0,5:56,3.0,0.0,0.0,1.0,2.0,-10.0,PUNT,PUNT,05:02,14:06,MIA 12,TEN 42,687.0,968.0,28,27,Home,-1,55,14.0,45.0,0,outdoors,grass,64.0,9.0,Mike McDaniel,Mike Vrabel,MIA00,Hard Rock Stadium,0,0.0,T.Tagovailoa,1.0,,,T.Hill,10.0,1,0,0.0,0,1,00-0036212,,00-0033040,T.Tagovailoa,1.0,00-0036212,T.Hill,00-0033040,T.Hill,00-0033040,0,0,-1.2429899268318,1.18746366852405,10.3753639654606,9.0,0.529287901241332,0.246045336592943,0.52365779876709,47.634220123291,2023-12-11,T.Hill,2023,REG,MIA,14,00-0033040,WR,Tyreek Hill,Tyreek,Hill,,,,Ankle,Wrist,Limited Participation in Practice,2023-12-09T21:29:04Z,2023-12-09 21:29:04
742,2023_13_DEN_HOU,2023120307,HOU,DEN,REG,13,HOU,home,DEN,DEN,3.0,2023-12-03,233.0,1133.0,2933.0,Half1,0,5.0,1,1,2.0,1,03:53,DEN 3,3,78.0,"(3:53) 31-D.Pierce up the middle for 3 yards, TOUCHDOWN. HOU-3-T.Dell was injured during the play. He is Out.",run,3.0,0,0,0.0,0,0,0,,,,,middle,,,,,,3,3,0.0,,HOU,D.Pierce,00-0037258,3.0,3.0,9,0,3.0,0.0,3.0,9.0,0.0,9.0,0.0020231821108609,0.0107411155477166,0.0003541785408742,0.0131721682846546,0.200796782970428,0.0008561583817936,0.772056400775909,0.0,0.0,5.88336058938876,1.11663941061124,9.4117332175374,-9.4117332175374,0.347090759954881,-0.347090759954881,5.25958546283744,-5.25958546283744,,,0.0,0.0,3.41929008538136,-3.41929008538136,2.26756980764912,-2.26756980764912,0.877147384395357,-0.877147384395357,1.61418696158887,-1.61418696158887,0.753158628940582,0.246841371059418,0.753158628940582,0.246841371059418,0.0201671070162845,0.01396162518039,0.01396162518039,0.773325735956867,0.226674264043133,0.784050226211548,0.784050226211548,0.0088786727492404,-0.0088786727492404,0.129659533500671,-0.129659533500671,,,0.0,0.0,0.0110052824020386,-0.0110052824020386,0.12584114074707,-0.12584114074707,0.0110052824020386,-0.0110052824020386,0.0562853217124939,-0.0562853217124939,0.0,1.0,0.0,0.0,0.0,0.0,0.0,0.0,0.0,0,0.0,0.0,0.0,0.0,0.0,0.0,0.0,0.0,0.0,0.0,0.0,0.0,0.0,0.0,0.0,0.0,0.0,0.0,0.0,0.0,0.0,0.0,1.0,0.0,0.0,1.0,0.0,1.0,0.0,0.0,0.0,0.0,0.0,0.0,0.0,0.0,0.0,0.0,0.0,0.0,0.0,,,,,,,00-0037258,D.Pierce,3.0,,,,,,,,,,,,,,,,,,,,,,,,,,,,,,,,,,,,,,,,,,,,,,,,,,,,,,,,,,,,,0.0,,,,,,,,,,,,,,,,,,,,,,,,,,,,,,,,0.0,,,,,0,,,0.0,0.0,0.0,0.0,,,2023,,,9,1,Touchdown,742,"12/3/23, 13:02:37",2023-12-03T18:33:28.877Z,NRG Stadium,"Partly Sunny Temp: 67° F, Humidity: 37%, Wind: WNW 5 mph",cbae4537-f053-11ed-b4a7-bab79e4492fa,0,0,RUSH,0,,2023-12-03T18:33:32.437Z,,5,Touchdown,2023-12-03T18:22:49.263Z,10.0,4:22,4.0,1.0,1.0,1.0,1.0,4.0,PUNT,TOUCHDOWN,08:11,03:49,HOU 22,DEN 3,495.0,763.0,17,22,Home,5,39,3.5,47.5,0,closed,astroturf,,,DeMeco Ryans,Sean Payton,HOU00,NRG Stadium,0,1.0,,,D.Pierce,31.0,,,0,1,1.0,0,1,,00-0037258,,D.Pierce,31.0,00-0037258,D.Pierce,00-0037258,D.Pierce,00-0037258,0,1,1.11663941061124,,,,,,0.544108867645264,-54.4108867645264,2023-12-03,T.Dell,2023,REG,HOU,13,00-0038977,WR,Tank Dell,Tank,Dell,Calf,,Questionable,Calf,,Limited Participation in Practice,2023-12-01T21:37:34Z,2023-12-01 21:37:34
736,2023_08_CHI_LAC,2023102913,LAC,CHI,REG,8,LAC,home,CHI,CHI,41.0,2023-10-29,198.0,1098.0,2898.0,Half1,0,4.0,0,1,2.0,0,03:18,CHI 41,7,55.0,(3:18) (Shotgun) 10-J.Herbert pass short right to 5-J.Palmer to CHI 32 for 9 yards (29-T.Stevenson). LAC-5-J.Palmer was injured during the play.,pass,9.0,1,0,1.0,0,0,0,short,right,6.0,3.0,,,,,,,3,3,0.0,,,,,3.0,3.0,7,0,7.0,0.0,7.0,7.0,0.0,7.0,0.0144311226904392,0.0705947950482369,0.001269195927307,0.129710927605629,0.29404354095459,0.0037239389494061,0.486226439476013,0.0,0.0,3.17086430685595,1.00614862621296,13.3015184815178,-13.3015184815178,0.692493009613827,-0.692493009613827,8.97755563410465,-8.97755563410465,0.288868583040312,0.71728004317265,0.288868583040312,0.71728004317265,-3.94951483886689,3.94951483886689,9.96976654522587,-9.96976654522587,-3.30332332011312,3.30332332011312,10.1277605184587,-10.1277605184587,0.833850264549255,0.166149735450745,0.833850264549255,0.166149735450745,0.0189424157142639,0.0069448351860046,0.0069448351860046,0.852792680263519,0.147207319736481,0.935260772705078,0.935260772705078,0.0603280663490295,-0.0603280663490295,0.180240135956973,-0.180240135956973,0.0,0.0189424157142639,0.0,0.0189424157142639,-0.069143071770668,0.069143071770668,0.163413014579982,-0.163413014579982,-0.069143071770668,0.069143071770668,0.175173756052226,-0.175173756052226,0.0,0.0,1.0,0.0,0.0,0.0,0.0,0.0,0.0,0,0.0,0.0,0.0,0.0,0.0,0.0,0.0,0.0,0.0,0.0,0.0,0.0,0.0,0.0,1.0,0.0,0.0,0.0,0.0,0.0,0.0,0.0,0.0,1.0,0.0,0.0,0.0,0.0,0.0,0.0,0.0,0.0,0.0,0.0,0.0,1.0,0.0,0.0,0.0,0.0,0.0,00-0036355,J.Herbert,9.0,00-0036988,J.Palmer,9.0,,,,,,,,,,,,,,,,,,,,,,,,,,,,,,,,,,,,,,,,,,,,,,CHI,,00-0039071,,T.Stevenson,,,,,,,,,,,,,,0.0,,,,,,,,,,,,,,,,,,,,,,,,,,,,,,,,0.0,,,,,0,,,0.0,0.0,0.0,0.0,,,2023,0.779603004455566,22.0396995544434,10,1,First down,736,"10/29/23, 20:22:31",2023-10-30T00:49:19.323Z,SoFi Stadium,"Clear Temp: 76° F, Humidity: 15%, Wind: SW 9 mph",b07e9c46-f053-11ed-b4a7-bab79e4492fa,0,0,PASS,0,,2023-10-30T00:49:22.693Z,,4,Touchdown,2023-10-30T00:47:31.263Z,9.0,4:18,4.0,1.0,1.0,1.0,1.0,0.0,PUNT,TOUCHDOWN,05:01,00:43,LAC 45,CHI 9,655.0,912.0,13,30,Home,17,43,9.5,46.0,0,dome,matrixturf,,,Brandon Staley,Matt Eberflus,LAX01,SoFi Stadium,0,1.0,J.Herbert,10.0,,,J.Palmer,5.0,1,0,1.0,0,1,00-0036355,,00-0036988,J.Herbert,10.0,00-0036355,J.Palmer,00-0036988,J.Palmer,00-0036988,0,0,1.00614862621296,0.514347218986961,3.25914987642318,1.0,0.996120110154152,0.582244129851461,0.702651739120483,29.7348260879517,2023-10-29,J.Palmer,2023,REG,LAC,8,00-0036988,WR,Josh Palmer,Josh,Palmer,Knee,,Questionable,Knee,,Limited Participation in Practice,2023-10-27T20:24:34Z,2023-10-27 20:24:34
610,2023_04_SEA_NYG,2023100200,NYG,SEA,REG,4,SEA,away,NYG,SEA,68.0,2023-10-02,282.0,1182.0,2982.0,Half1,0,4.0,0,1,1.0,0,04:42,SEA 32,10,14.0,"(4:42) (Shotgun) 7-G.Smith pass incomplete deep left to 16-T.Lockett. SEA-60-P.Haynes was injured during the play. Penalty on SEA-60-P.Haynes, Offensive Holding, offsetting, enforced at SEA 32 - No Play. Penalty on NYG-22-A.Jackson, Defensive Pass Interference, offsetting.",no_play,,1,0,0.0,0,0,0,,,,,,,,,,,3,3,,,,,,3.0,3.0,0,0,0.0,0.0,0.0,0.0,0.0,0.0,0.0249560866504908,0.124030135571957,0.0022664086427539,0.235110074281693,0.223673433065414,0.003023273544386,0.386940628290176,0.0,0.0,1.36325750034302,0.0105215799994767,-2.8478768481873,2.8478768481873,-1.37326112017035,1.37326112017035,-0.853662336012349,0.853662336012349,,,,,-0.701207235688344,0.701207235688344,2.40605872811284,-2.40605872811284,-1.47403264744207,1.47403264744207,1.79050857119728,-1.79050857119728,0.512747585773468,0.487252414226532,0.487252414226532,0.512747585773468,0.0,-0.004452645778656,0.004452645778656,0.487252414226532,0.512747585773468,0.63768070936203,0.36231929063797,-0.051590234041214,0.051590234041214,-0.0176594257354736,0.0176594257354736,,,,,-0.0179151296615601,0.0179151296615601,0.0774044394493103,-0.0774044394493103,-0.0179151296615601,0.0179151296615601,0.0416032671928406,-0.0416032671928406,,,,,,,,,,0,,,,,,,,,,,,,,,,,,,,,,,,,,,,,,,,,,,,,,,,,,,,,,,,,,,,,,,,,,,,,,,,,,,,,,,,,,,,,,,,,,,,,,,,,,,,,,,,,,,,,,,,,,,,,,,,,,,,,,,,,,,,,,,,,,,,,,,,,,,,,,,,,,,,0,,,,,,,,,2023,,,9,0,Punt,610,"10/2/23, 20:15:56",2023-10-03T00:41:59.060Z,MetLife Stadium,"Fair Temp: 67° F, Humidity: 79%, Wind: SW 8 mph",b07d7cc4-f053-11ed-b4a7-bab79e4492fa,0,0,PENALTY,0,,2023-10-03T00:42:04.967Z,,4,Punt,2023-10-03T00:41:23.460Z,5.0,3:40,1.0,0.0,0.0,1.0,1.0,-24.0,PUNT,PUNT,05:17,01:37,SEA 20,SEA 34,578.0,844.0,24,3,Home,-21,27,-2.5,46.5,0,outdoors,fieldturf,67.0,8.0,Brian Daboll,Pete Carroll,NYC01,MetLife Stadium,0,1.0,G.Smith,7.0,,,T.Lockett,16.0,1,0,,0,1,00-0030565,,00-0032211,G.Smith,7.0,00-0030565,,,T.Lockett,00-0032211,0,1,0.0105215799994767,,,,,,0.49056151509285,50.943848490715,2023-10-02,P.Haynes,2023,REG,SEA,4,00-0035141,G,Phil Haynes,Phil,Haynes,,,,Calf,,Full Participation in Practice,2023-09-30T21:18:08Z,2023-09-30 21:18:08
605,2023_08_CLE_SEA,2023102909,SEA,CLE,REG,8,SEA,home,CLE,CLE,29.0,2023-10-29,398.0,1298.0,3098.0,Half1,0,4.0,0,1,2.0,0,06:38,CLE 29,15,41.0,(6:38) (Shotgun) 7-G.Smith pass short right to 11-J.Smith-Njigba pushed ob at CLE 10 for 19 yards (22-G.Delpit). SEA-75-A.Bradford was injured during the play.,pass,19.0,1,0,1.0,0,0,0,short,right,-3.0,22.0,,,,,,,2,3,0.0,,,,,2.0,3.0,7,0,7.0,0.0,7.0,7.0,0.0,7.0,0.0072988276369869,0.0487840436398983,0.0005234680138528,0.0786904916167259,0.516322076320648,0.0013668509200215,0.34701418876648,0.0,0.0,3.28256674390286,1.94316422421252,14.3245328795607,-14.3245328795607,2.68609082963667,-2.68609082963667,11.5969733899401,-11.5969733899401,-0.997062342124991,2.94022656633751,-0.997062342124991,2.94022656633751,-1.43081886292202,1.43081886292202,6.75331305593136,-6.75331305593136,-0.328259468486067,0.328259468486067,5.96562005291344,-5.96562005291344,0.839676856994629,0.160323143005371,0.839676856994629,0.160323143005371,0.0179311037063599,0.0337734818458557,0.0337734818458557,0.857607960700989,0.142392039299011,0.870222687721252,0.870222687721252,0.0742584277631616,-0.0742584277631616,0.219636991620064,-0.219636991620064,0.0,0.0179311037063599,0.0,0.0179311037063599,-0.0227193534374237,0.0227193534374237,0.139296114444733,-0.139296114444733,-0.0227193534374237,0.0227193534374237,0.148508921265602,-0.148508921265602,0.0,0.0,1.0,0.0,0.0,0.0,0.0,0.0,0.0,0,0.0,0.0,0.0,0.0,0.0,0.0,0.0,0.0,0.0,0.0,0.0,0.0,0.0,0.0,1.0,0.0,0.0,0.0,0.0,0.0,0.0,0.0,0.0,1.0,0.0,0.0,0.0,0.0,0.0,0.0,0.0,0.0,0.0,0.0,0.0,1.0,0.0,0.0,0.0,0.0,0.0,00-0030565,G.Smith,19.0,00-0038543,J.Smith-Njigba,19.0,,,,,,,,,,,,,,,,,,,,,,,,,,,,,,,,,,,,,,,,,,,,,,CLE,,00-0036282,,G.Delpit,,,,,,,,,,,,,,0.0,,,,,,,,,,,,,,,,,,,,,,,,,,,,,,,,0.0,,,,,0,,,0.0,0.0,0.0,0.0,,,2023,0.877244353294373,12.2755646705627,9,1,First down,605,"10/29/23, 16:05:43",2023-10-29T20:24:49.447Z,Lumen Field,"Sunny Temp: 47° F, Humidity: 60%, Wind: N 3 mph",b07e87ae-f053-11ed-b4a7-bab79e4492fa,0,0,PASS,0,,2023-10-29T20:24:55.320Z,,4,Touchdown,2023-10-29T20:23:28.667Z,6.0,2:26,3.0,1.0,1.0,1.0,1.0,0.0,FUMBLE,TOUCHDOWN,07:56,05:30,CLE 41,CLE 12,553.0,716.0,20,24,Home,4,44,4.0,39.5,0,outdoors,fieldturf,47.0,3.0,Pete Carroll,Kevin Stefanski,SEA00,Lumen Field,0,1.0,G.Smith,7.0,,,J.Smith-Njigba,11.0,1,0,1.0,0,1,00-0030565,,00-0038543,G.Smith,7.0,00-0030565,J.Smith-Njigba,00-0038543,J.Smith-Njigba,00-0038543,1,0,1.94316422421252,1.25078728490227,9.5349414483062,8.0,0.552019788650796,0.126391910715029,0.812035858631134,18.7964141368866,2023-10-29,A.Bradford,2023,REG,SEA,8,00-0039020,G,Anthony Bradford,Anthony,Bradford,,,,Elbow,,Full Participation in Practice,2023-10-25T22:59:45Z,2023-10-25 22:59:45
584,2023_15_CHI_CLE,2023121710,CLE,CHI,REG,15,CLE,home,CHI,CLE,66.0,2023-12-17,402.0,1302.0,3102.0,Half1,0,5.0,0,1,1.0,0,06:42,CLE 34,13,0.0,"(6:42) (Shotgun) 15-J.Flacco pass short left to 85-D.Njoku to CLE 42 for 8 yards (49-T.Edmunds, 32-T.Smith). CLE-75-J.Bitonio was injured during the play.",pass,8.0,1,0,1.0,0,0,0,short,left,3.0,5.0,,,,,,,3,3,0.0,,,,,3.0,3.0,0,0,0.0,0.0,0.0,0.0,0.0,0.0,0.0171176139265299,0.124255694448948,0.0022962063085287,0.213063091039658,0.214538559317589,0.0036755227483809,0.425053358078003,0.0,0.0,1.75753909675404,0.424780303845182,0.70822163275443,-0.70822163275443,-0.348450702847913,0.348450702847913,0.394020057516173,-0.394020057516173,-0.071490271249786,0.496270575094968,-0.071490271249786,0.496270575094968,0.835423973621801,-0.835423973621801,1.15571946650743,-1.15571946650743,-5.58174360438716,5.58174360438716,5.97576366190333,-5.97576366190333,0.561172604560852,0.438827395439148,0.561172604560852,0.438827395439148,0.0013770461082458,0.0228270888328552,0.0228270888328552,0.562549650669098,0.437450349330902,0.569689631462097,0.569689631462097,-0.0282187461853027,0.0282187461853027,-0.0099923908710479,0.0099923908710479,0.0,0.0013770461082458,0.0,0.0013770461082458,0.0,0.0,0.042841762304306,-0.042841762304306,0.0,0.0,-0.0099923908710479,0.0099923908710479,0.0,0.0,0.0,0.0,0.0,0.0,0.0,0.0,0.0,0,0.0,0.0,0.0,0.0,0.0,0.0,0.0,0.0,0.0,0.0,0.0,0.0,0.0,0.0,0.0,0.0,0.0,0.0,0.0,0.0,0.0,0.0,0.0,1.0,0.0,0.0,0.0,0.0,0.0,0.0,0.0,0.0,0.0,0.0,0.0,1.0,1.0,0.0,0.0,0.0,0.0,00-0026158,J.Flacco,8.0,00-0033885,D.Njoku,8.0,,,,,,,,,,,,,,,,,,,,,,,,,,,,,,,,,,,,,,,,,,,,,,,,,,,,00-0038395,T.Smith,CHI,,,,,,,,,,1.0,00-0034673,T.Edmunds,CHI,,,,,,,,,,,,,,,,,,,,,,,,,,,,,0.0,,,,,0,,,0.0,0.0,0.0,0.0,,,2023,0.784887313842773,21.5112686157227,6,0,Punt,584,"12/17/23, 13:02:44",2023-12-17T18:26:36.253Z,Cleveland Browns Stadium,"Temp: 45° F, Humidity: 84%, Wind: SE 15 mph",cbaed4fa-f053-11ed-b4a7-bab79e4492fa,0,0,PASS,0,,2023-12-17T18:26:40.390Z,,5,Punt,2023-12-17T18:24:55.917Z,4.0,2:26,0.0,0.0,0.0,1.0,1.0,-15.0,PUNT,PUNT,07:14,04:48,CLE 37,CLE 37,548.0,688.0,17,20,Home,3,37,3.0,38.0,0,outdoors,grass,45.0,15.0,Kevin Stefanski,Matt Eberflus,CLE00,FirstEnergy Stadium,0,1.0,J.Flacco,15.0,,,D.Njoku,85.0,1,0,0.0,0,1,00-0026158,,00-0033885,J.Flacco,15.0,00-0026158,D.Njoku,00-0033885,D.Njoku,00-0033885,0,1,0.424780303845182,0.486561284524393,5.02521179422183,3.0,0.694981454696972,0.132417767134029,0.687870264053345,31.2129735946655,2023-12-17,J.Bitonio,2023,REG,CLE,15,00-0031426,G,Joel Bitonio,Joel,Bitonio,,,,Not injury related - resting player,Knee,Full Participation in Practice,2023-12-15T19:54:27Z,2023-12-15 19:54:27
550,2023_10_NYG_DAL,2023111209,DAL,NYG,REG,10,NYG,away,DAL,NYG,93.0,2023-11-12,393.0,1293.0,3093.0,Half1,0,4.0,0,1,2.0,0,06:33,NYG 7,9,-4.0,(6:33) (Shotgun) 26-S.Barkley left tackle to NYG 4 for -3 yards (58-M.Smith). NYG-78-A.Thomas was injured during the play. His return is Questionable.,run,-3.0,1,0,0.0,0,0,0,,,,,left,tackle,,,,,3,2,0.0,,,,,2.0,3.0,0,0,0.0,0.0,0.0,0.0,0.0,0.0,0.0101662380620837,0.195236191153526,0.0133954035118222,0.38174957036972,0.157143741846085,0.0021545384079217,0.240154325962067,0.0,0.0,-1.1279257889837,-1.18955436395481,0.724486612249166,-0.724486612249166,1.44298948580399,-1.44298948580399,-1.33226762968116,1.33226762968116,,,0.0,0.0,0.971332627930678,-0.971332627930678,1.8394036461832,-1.8394036461832,1.29813560075127,-1.29813560075127,-2.63040323043242,2.63040323043242,0.446608692407608,0.553391307592392,0.553391307592392,0.446608692407608,-0.0286915004253387,-0.0263765603303909,0.0263765603303909,0.582082808017731,0.417917191982269,0.116997204720974,0.883002795279026,0.011206716299057,-0.011206716299057,0.0756813585758209,-0.0756813585758209,,,0.0,0.0,0.0791890025138855,-0.0791890025138855,0.0986908078193665,-0.0986908078193665,0.0791890025138855,-0.0791890025138855,-0.0035076439380645,0.0035076439380645,0.0,0.0,0.0,0.0,0.0,0.0,0.0,0.0,0.0,0,0.0,0.0,0.0,0.0,0.0,0.0,0.0,0.0,0.0,0.0,0.0,0.0,0.0,0.0,1.0,0.0,0.0,1.0,0.0,0.0,0.0,0.0,1.0,0.0,0.0,0.0,0.0,0.0,0.0,0.0,0.0,0.0,0.0,0.0,0.0,0.0,0.0,0.0,0.0,0.0,0.0,,,,,,,00-0034844,S.Barkley,-3.0,,,,,,,,,,,,,,,,,,,,,,,,,,,,,00-0038545,M.Smith,,,,,,,,,,,,,DAL,,00-0038545,,M.Smith,,,,,,,,,,,,,,0.0,,,,,,,,,,,,,,,,,,,,,,,,,,,,,,,,0.0,,,,,0,,,0.0,0.0,0.0,0.0,,,2023,,,7,0,Punt,550,"11/12/23, 16:26:26",2023-11-12T21:50:00.813Z,AT&T Stadium,,cbacb486-f053-11ed-b4a7-bab79e4492fa,0,0,RUSH,0,,2023-11-12T21:50:04.873Z,,4,Punt,2023-11-12T21:49:24.747Z,3.0,1:50,0.0,0.0,0.0,1.0,1.0,0.0,PUNT,PUNT,07:09,05:19,NYG 6,NYG 2,521.0,609.0,17,49,Home,32,66,17.5,38.5,1,closed,matrixturf,,,Mike McCarthy,Brian Daboll,DAL00,AT&T Stadium,0,0.0,,,S.Barkley,26.0,,,0,1,0.0,0,1,,00-0034844,,S.Barkley,26.0,00-0034844,S.Barkley,00-0034844,S.Barkley,00-0034844,0,1,-1.18955436395481,,,,,,0.52489972114563,-52.489972114563,2023-11-12,A.Thomas,2023,REG,NYG,10,00-0036386,T,Andrew Thomas,Andrew,Thomas,,,,Hamstring,,Full Participation in Practice,2023-11-10T19:06:54Z,2023-11-10 19:06:54
438,2023_04_BAL_CLE,2023100104,CLE,BAL,REG,4,BAL,away,CLE,BAL,73.0,2023-10-01,551.0,1451.0,3251.0,Half1,0,3.0,0,1,2.0,0,09:11,BAL 27,3,4.0,"(9:11) (No Huddle, Shotgun) 8-L.Jackson sacked at BAL 22 for -5 yards (sack split by 96-J.Elliott and 94-D.Tomlinson). CLE-99-Z.Smith was injured during the play. His return is Questionable.",pass,-5.0,1,1,1.0,0,0,0,,,,,,,,,,,3,3,0.0,,,,,3.0,3.0,0,0,0.0,0.0,0.0,0.0,0.0,0.0,0.0110727325081825,0.144700422883034,0.0027402506675571,0.26745069026947,0.206596225500107,0.0029959641396999,0.364443689584732,0.0,0.0,0.865149830002338,-1.74349020142108,1.64856273820624,-1.64856273820624,-0.21144696418196,0.21144696418196,0.939527843613178,-0.939527843613178,,,0.0,0.0,1.4946330646053,-1.4946330646053,0.135232731699944,-0.135232731699944,3.52149110496976,-3.52149110496976,-4.32545346277766,4.32545346277766,0.423642665147781,0.576357334852219,0.576357334852219,0.423642665147781,-0.0354885458946228,-0.0363490581512451,0.0363490581512451,0.611845880746841,0.388154119253159,0.565360188484192,0.434639811515808,0.0201780498027802,-0.0201780498027802,0.0356924533843994,-0.0356924533843994,,,0.0,0.0,0.0,0.0,0.053971529006958,-0.053971529006958,0.0,0.0,0.0002039074897766,-0.0002039074897766,0.0,0.0,0.0,0.0,0.0,0.0,0.0,0.0,0.0,0,0.0,0.0,0.0,0.0,0.0,0.0,0.0,0.0,0.0,0.0,0.0,0.0,0.0,0.0,0.0,0.0,0.0,0.0,0.0,0.0,0.0,1.0,0.0,1.0,1.0,0.0,0.0,0.0,0.0,0.0,0.0,0.0,0.0,0.0,0.0,0.0,1.0,0.0,0.0,0.0,0.0,00-0034796,L.Jackson,,,,,,,,,,,,,,,,,,,,,,,,,,,,,,,,,,,,,,,,00-0036266,J.Elliott,00-0033546,D.Tomlinson,,,,,,,,,,,,,00-0036266,J.Elliott,CLE,00-0033546,D.Tomlinson,CLE,,,,,,,0.0,,,,,,,,,,,,,,,,,,,,,,,,,,,00-0036266,J.Elliott,00-0033546,D.Tomlinson,,0.0,,,,,0,,,0.0,0.0,0.0,0.0,,,2023,,,4,0,Punt,438,"10/1/23, 13:02:33",2023-10-01T17:15:37.847Z,Cleveland Browns Stadium,"Sunny Temp: 71° F, Humidity: 79%, Wind: E 1 mph",b07d4c45-f053-11ed-b4a7-bab79e4492fa,0,0,SACK,0,,2023-10-01T17:15:41.317Z,,3,Punt,2023-10-01T17:15:13.067Z,3.0,2:03,0.0,0.0,0.0,1.0,1.0,-5.0,PUNT,PUNT,09:36,07:33,BAL 20,BAL 24,406.0,542.0,28,3,Home,-25,31,-2.0,38.5,1,outdoors,grass,71.0,7.0,Kevin Stefanski,John Harbaugh,CLE00,FirstEnergy Stadium,0,0.0,L.Jackson,8.0,,,,,1,0,0.0,0,1,00-0034796,,,L.Jackson,8.0,00-0034796,,,,,0,0,-1.74349020142108,,,,,,0.401446253061295,59.8553746938705,2023-10-01,Z.Smith,2023,REG,CLE,4,00-0031576,DE,Za'Darius Smith,Za'Darius,Smith,,,,Not injury related - resting player,,Did Not Participate In Practice,2023-09-27T20:08:34Z,2023-09-27 20:08:34
419,2023_01_GB_CHI,2023091008,CHI,GB,REG,1,GB,away,CHI,CHI,12.0,2023-09-10,448.0,1348.0,3148.0,Half1,0,2.0,0,1,3.0,0,07:28,CHI 12,2,40.0,(7:28) (Shotgun) 33-A.Jones right end to CHI 5 for 7 yards (9-J.Brisker). CHI-9-J.Brisker was injured during the play.,run,7.0,1,0,0.0,0,0,0,,,,,right,end,,,,,3,2,0.0,,,,,2.0,3.0,0,0,0.0,0.0,0.0,0.0,0.0,0.0,0.0036755639594048,0.0182129684835672,0.0004346168716438,0.0414844006299973,0.455633670091629,0.0009795502992346,0.47957918047905,0.0,0.0,4.38001543062273,1.27590826584492,-7.13002146431245,7.13002146431245,-5.85822005948285,5.85822005948285,-0.333634674258065,0.333634674258065,,,0.0,0.0,-1.80852650408633,1.80852650408633,0.866955029778183,-0.866955029778183,-2.69759003235959,2.69759003235959,2.36395535810152,-2.36395535810152,0.603514969348908,0.396485030651093,0.396485030651093,0.603514969348908,0.0316449403762817,0.0279808640480042,-0.0279808640480042,0.364840090274811,0.635159909725189,0.64002275466919,0.359977245330811,-0.123052507638931,0.123052507638931,-0.0431790053844452,0.0431790053844452,,,0.0,0.0,0.0,0.0,-0.0655672252178192,0.0655672252178192,0.0,0.0,-0.0431790053844452,0.0431790053844452,0.0,1.0,0.0,0.0,1.0,0.0,0.0,0.0,0.0,0,0.0,0.0,0.0,0.0,0.0,0.0,0.0,0.0,0.0,0.0,0.0,0.0,0.0,0.0,1.0,0.0,0.0,0.0,0.0,0.0,0.0,0.0,1.0,0.0,0.0,0.0,0.0,0.0,0.0,0.0,0.0,0.0,0.0,0.0,0.0,0.0,0.0,0.0,0.0,0.0,0.0,,,,,,,00-0033293,A.Jones,7.0,,,,,,,,,,,,,,,,,,,,,,,,,,,,,,,,,,,,,,,,,,,CHI,,00-0038135,,J.Brisker,,,,,,,,,,,,,,0.0,,,,,,,,,,,,,,,,,,,,,,,,,,,,,,,,0.0,,,,,0,,,0.0,0.0,0.0,0.0,,,2023,,,5,1,First down,419,"9/10/23, 16:26:02",2023-09-10T20:42:24.330Z,Soldier Field,"Mostly Sunny Temp: 75° F, Humidity: 53%, Wind: W 7 mph",b07c75c2-f053-11ed-b4a7-bab79e4492fa,0,0,RUSH,0,,2023-09-10T20:42:29.137Z,,2,Touchdown,2023-09-10T20:35:09.530Z,11.0,5:23,4.0,1.0,1.0,1.0,1.0,0.0,DOWNS,TOUCHDOWN,11:31,06:08,CHI 40,CHI 8,229.0,522.0,38,20,Home,-18,58,1.0,41.0,1,outdoors,,,,Matt Eberflus,Matt LaFleur,CHI98,Soldier Field,0,1.0,,,A.Jones,33.0,,,0,1,1.0,0,1,,00-0033293,,A.Jones,33.0,00-0033293,A.Jones,00-0033293,A.Jones,00-0033293,0,1,1.27590826584492,,,,,,0.642785608768463,-64.2785608768463,2023-09-10,J.Brisker,2023,REG,CHI,1,00-0038135,S,Jaquan Brisker,Jaquan,Brisker,,,,Groin,,Full Participation in Practice,2023-09-08T18:13:30Z,2023-09-08 18:13:30
339,2023_09_MIA_KC,2023110500,KC,MIA,REG,9,MIA,away,KC,MIA,60.0,2023-11-05,686.0,1586.0,3386.0,Half1,0,2.0,0,1,1.0,0,11:26,MIA 40,10,8.0,"(11:26) 31-R.Mostert right end to MIA 40 for no gain (27-C.Conner, 23-D.Tranquill). MIA-17-J.Waddle was injured during the play.",run,0.0,0,0,0.0,0,0,0,,,,,right,end,,,,,3,3,0.0,,,,,3.0,3.0,7,0,0.0,7.0,-7.0,0.0,7.0,-7.0,0.006721906363964,0.111063353717327,0.0017797634936869,0.21238586306572,0.25736278295517,0.0044032055884599,0.40628308057785,0.0,0.0,1.80142569448799,-0.519187635742128,5.90401549228462,-5.90401549228462,0.492890601279214,-0.492890601279214,5.34355188789778,-5.34355188789778,,,0.0,0.0,-1.8482987669413,1.8482987669413,7.65856883249944,-7.65856883249944,0.136046201747376,-0.136046201747376,5.2075056861504,-5.2075056861504,0.33052721619606,0.66947278380394,0.66947278380394,0.33052721619606,-0.0147587656974792,-0.0111354291439056,0.0111354291439056,0.684231549501419,0.315768450498581,0.391279280185699,0.608720719814301,0.0086122751235961,-0.0086122751235961,0.127577696102694,-0.127577696102694,,,0.0,0.0,-0.0082787275314331,0.0082787275314331,0.149677727478579,-0.149677727478579,-0.0082787275314331,0.0082787275314331,0.135856423634128,-0.135856423634128,0.0,0.0,0.0,0.0,0.0,0.0,0.0,0.0,0.0,0,0.0,0.0,0.0,0.0,0.0,0.0,0.0,0.0,0.0,0.0,0.0,0.0,0.0,0.0,0.0,0.0,0.0,0.0,0.0,0.0,0.0,0.0,1.0,0.0,0.0,0.0,0.0,0.0,0.0,0.0,0.0,0.0,0.0,0.0,0.0,0.0,1.0,0.0,0.0,0.0,0.0,,,,,,,00-0031687,R.Mostert,0.0,,,,,,,,,,,,,,,,,,,,,,,,,,,,,,,,,,,,,,,,,,,,,,,,,00-0035262,D.Tranquill,KC,,,,,,,,,,1.0,00-0038982,C.Conner,KC,,,,,,,,,,,,,,,,,,,,,,,,,,,,,0.0,,,,,0,,,0.0,0.0,0.0,0.0,,,2023,,,6,0,Punt,339,"11/5/23, 09:32:30",2023-11-05T14:43:14.740Z,Frankfurt Stadium,"Light Rain Temp: 53° F, Humidity: 81%, Wind: SW 14 mph",b07eaa67-f053-11ed-b4a7-bab79e4492fa,0,0,RUSH,0,,2023-11-05T14:43:18.347Z,,2,Punt,2023-11-05T14:41:54.260Z,4.0,2:50,1.0,0.0,0.0,1.0,1.0,0.0,KICKOFF,PUNT,12:03,09:13,MIA 25,MIA 33,298.0,464.0,14,21,Neutral,7,35,1.0,51.0,0,outdoors,grass,,,Andy Reid,Mike McDaniel,KAN00,GEHA Field at Arrowhead Stadium,0,0.0,,,R.Mostert,31.0,,,0,1,0.0,0,1,,00-0031687,,R.Mostert,31.0,00-0031687,R.Mostert,00-0031687,R.Mostert,00-0031687,0,1,-0.519187635742128,,,,,,0.448088824748993,-44.8088824748993,2023-11-05,J.Waddle,2023,REG,MIA,9,00-0036613,WR,Jaylen Waddle,Jaylen,Waddle,,,,Back,,Full Participation in Practice,2023-11-03T15:49:29Z,2023-11-03 15:49:29
304,2023_11_LV_MIA,2023111906,MIA,LV,REG,11,MIA,home,LV,MIA,86.0,2023-11-19,726.0,1626.0,3426.0,Half1,0,2.0,0,1,1.0,0,12:06,MIA 14,10,13.0,(12:06) (Shotgun) 28-D.Achane right tackle to MIA 15 for 1 yard (95-J.Jenkins). LV-5-D.Deablo was injured during the play. His return is Probable.,run,1.0,1,0,0.0,0,0,0,,,,,right,tackle,,,,,3,3,0.0,,,,,3.0,3.0,0,0,0.0,0.0,0.0,0.0,0.0,0.0,0.0059723546728491,0.179172068834305,0.0026507924776524,0.274770170450211,0.190642774105072,0.0032743080519139,0.343517512083054,0.0,0.0,0.516890538390726,-0.481365997344255,0.805746907833964,-0.805746907833964,-0.481365997344255,0.481365997344255,1.29734049318358,-1.29734049318358,,,0.0,0.0,2.68623059382662,-2.68623059382662,-2.46613800479099,2.46613800479099,3.60788740310818,-3.60788740310818,-2.3105469099246,2.3105469099246,0.603209018707275,0.396790981292725,0.603209018707275,0.396790981292725,-0.0101159811019897,0.0129580497741699,0.0129580497741699,0.593093037605286,0.406906962394714,0.86741703748703,0.86741703748703,-0.0101159811019897,0.0101159811019897,0.036246120929718,-0.036246120929718,,,0.0,0.0,0.0165755748748779,-0.0165755748748779,-0.0038343369960784,0.0038343369960784,0.0165755748748779,-0.0165755748748779,0.0196705460548401,-0.0196705460548401,0.0,0.0,0.0,0.0,0.0,0.0,0.0,0.0,0.0,0,0.0,0.0,0.0,0.0,0.0,0.0,0.0,0.0,0.0,0.0,0.0,0.0,0.0,0.0,1.0,0.0,0.0,0.0,0.0,0.0,0.0,0.0,1.0,0.0,0.0,0.0,0.0,0.0,0.0,0.0,0.0,0.0,0.0,0.0,0.0,0.0,0.0,0.0,0.0,0.0,0.0,,,,,,,00-0039040,D.Achane,1.0,,,,,,,,,,,,,,,,,,,,,,,,,,,,,,,,,,,,,,,,,,,LV,,00-0030070,,J.Jenkins,,,,,,,,,,,,,,0.0,,,,,,,,,,,,,,,,,,,,,,,,,,,,,,,,0.0,,,,,0,,,0.0,0.0,0.0,0.0,,,2023,,,3,0,Turnover,304,"11/19/23, 13:02:34",2023-11-19T18:12:30.147Z,Hard Rock Stadium,"Partly Cloudy Temp: 82° F, Humidity: 71%, Wind: NNE 7 mph",cbad1607-f053-11ed-b4a7-bab79e4492fa,0,0,RUSH,0,,2023-11-19T18:12:33.123Z,,2,Turnover,2023-11-19T18:12:30.147Z,3.0,1:08,0.0,0.0,0.0,1.0,1.0,0.0,PUNT,FUMBLE,12:06,10:58,MIA 14,MIA 20,304.0,354.0,13,20,Home,7,33,14.0,44.5,0,outdoors,grass,82.0,7.0,Mike McDaniel,Antonio Pierce,MIA00,Hard Rock Stadium,0,0.0,,,D.Achane,28.0,,,0,1,0.0,0,1,,00-0039040,,D.Achane,28.0,00-0039040,D.Achane,00-0039040,D.Achane,00-0039040,0,0,-0.481365997344255,,,,,,0.459962427616119,-45.9962427616119,2023-11-19,D.Deablo,2023,REG,LV,11,00-0036990,LB,Divine Deablo,Divine,Deablo,,,,Ankle,,Full Participation in Practice,2023-11-17T20:31:17Z,2023-11-17 20:31:17
245,2023_04_SEA_NYG,2023100200,NYG,SEA,REG,4,NYG,home,SEA,SEA,37.0,2023-10-02,618.0,1518.0,3318.0,Half1,0,1.0,0,1,2.0,0,10:18,SEA 37,11,48.0,(10:18) 8-D.Jones scrambles right end to SEA 29 for 8 yards (33-J.Adams). SEA-33-J.Adams was injured during the play.,run,8.0,0,0,1.0,0,0,1,,,,,right,end,,,,,3,3,0.0,,,,,3.0,3.0,0,0,0.0,0.0,0.0,0.0,0.0,0.0,0.0059346635825932,0.0817711427807808,0.0012406669557094,0.124171175062656,0.362756848335266,0.004099893849343,0.420025587081909,0.0,0.0,2.91965645458549,0.578113208524883,2.02367189526558,-2.02367189526558,1.09162816451862,-1.09162816451862,0.932043730746955,-0.932043730746955,,,0.0,0.0,-2.0759822097607,2.0759822097607,3.96018419892062,-3.96018419892062,-2.0759822097607,2.0759822097607,3.96018419892062,-3.96018419892062,0.61005449295044,0.389945507049561,0.61005449295044,0.389945507049561,0.0124197006225586,0.0062896907329559,0.0062896907329559,0.622474193572998,0.377525806427002,0.463124692440033,0.463124692440033,0.0263115167617798,-0.0263115167617798,0.0499008893966675,-0.0499008893966675,,,0.0,0.0,-0.0179151296615601,0.0179151296615601,0.090137243270874,-0.090137243270874,-0.0179151296615601,0.0179151296615601,0.090137243270874,-0.090137243270874,0.0,0.0,0.0,0.0,0.0,0.0,0.0,0.0,0.0,0,0.0,0.0,0.0,0.0,0.0,0.0,0.0,0.0,0.0,0.0,0.0,0.0,0.0,0.0,1.0,0.0,0.0,0.0,0.0,0.0,0.0,0.0,1.0,0.0,0.0,0.0,0.0,0.0,0.0,0.0,0.0,0.0,0.0,0.0,0.0,0.0,0.0,0.0,0.0,0.0,0.0,,,,,,,00-0035710,D.Jones,8.0,,,,,,,,,,,,,,,,,,,,,,,,,,,,,,,,,,,,,,,,,,,SEA,,00-0033872,,J.Adams,,,,,,,,,,,,,,0.0,,,,,,,,,,,,,,,,,,,,,,,,,,,,,,,,0.0,,,,,0,,,0.0,0.0,0.0,0.0,,,2023,,,4,0,Turnover on downs,245,"10/2/23, 20:15:56",2023-10-03T00:21:33.570Z,MetLife Stadium,"Fair Temp: 67° F, Humidity: 79%, Wind: SW 8 mph",b07d7cc4-f053-11ed-b4a7-bab79e4492fa,0,0,RUSH,0,,2023-10-03T00:21:40.677Z,,1,Turnover on downs,2023-10-03T00:15:56.197Z,11.0,6:15,3.0,0.0,0.0,1.0,1.0,0.0,KICKOFF,DOWNS,15:00,08:45,NYG 25,SEA 27,40.0,292.0,24,3,Home,-21,27,-2.5,46.5,0,outdoors,fieldturf,67.0,8.0,Brian Daboll,Pete Carroll,NYC01,MetLife Stadium,0,1.0,D.Jones,8.0,,8.0,,,1,0,0.0,0,1,00-0035710,,,D.Jones,8.0,00-0035710,D.Jones,00-0035710,D.Jones,00-0035710,0,1,0.578113208524883,,,,,,0.759971797466278,24.0028202533722,2023-10-02,J.Adams,2023,REG,SEA,4,00-0033872,S,Jamal Adams,Jamal,Adams,,,,Knee,,Full Participation in Practice,2023-09-30T21:16:53Z,2023-09-30 21:16:53
185,2023_18_SEA_ARI,2024010712,ARI,SEA,REG,18,ARI,home,SEA,SEA,47.0,2024-01-07,680.0,1580.0,3380.0,Half1,0,1.0,0,1,1.0,0,11:20,SEA 47,10,30.0,(11:20) 1-K.Murray at QB. (Shotgun) 1-K.Murray pass incomplete deep left to 85-T.McBride (56-J.Brooks). SEA-56-J.Brooks was injured during the play.,pass,0.0,1,0,1.0,0,0,0,deep,left,27.0,,,,,,,,3,3,0.0,,,,,3.0,3.0,0,0,0.0,0.0,0.0,0.0,0.0,0.0,0.002469984581694,0.0821633711457253,0.0011115651577711,0.12454130500555,0.285137921571732,0.0037559412885457,0.50081992149353,0.0,0.0,3.24816271895543,-0.502402796875686,1.15276638139039,-1.15276638139039,-0.0954492499586195,0.0954492499586195,1.80709371273406,-1.80709371273406,1.75431843602564,-2.25672123290133,0.0,0.0,-1.10980137065053,1.10980137065053,3.41929788026027,-3.41929788026027,0.644517065375112,-0.644517065375112,1.16257664735895,-1.16257664735895,0.584446668624878,0.415553331375122,0.584446668624878,0.415553331375122,-0.0179151296615601,-0.0193603038787842,-0.0193603038787842,0.566531538963318,0.433468461036682,0.45817306637764,0.45817306637764,-0.0086420774459838,0.0086420774459838,0.0333203077316284,-0.0333203077316284,0.0,-0.0179151296615601,0.0,0.0,0.0,0.0,0.0512354373931885,-0.0512354373931885,0.0,0.0,0.0333203077316284,-0.0333203077316284,0.0,0.0,0.0,0.0,0.0,0.0,0.0,0.0,1.0,0,0.0,0.0,0.0,0.0,0.0,0.0,0.0,0.0,0.0,0.0,0.0,0.0,0.0,0.0,0.0,0.0,0.0,0.0,0.0,0.0,0.0,0.0,0.0,1.0,0.0,0.0,0.0,0.0,0.0,0.0,0.0,0.0,0.0,0.0,0.0,0.0,0.0,0.0,0.0,0.0,0.0,00-0035228,K.Murray,,00-0037744,T.McBride,,,,,,,,,,,,,,,,,,,,,,,,,,,,,,,,,,,,,,,,,,,,,,,,,,,,,,,,,,,,,,,,,0.0,,,,,,,00-0036409,J.Brooks,,,,,,,,,,,,,,,,,,,,,,,,0.0,,,,,0,,,0.0,0.0,0.0,0.0,,,2023,0.401253074407578,-40.1253074407578,3,0,Punt,185,"1/7/24, 16:25:43",2024-01-07T21:30:14.790Z,State Farm Stadium,N/A (Indoors) Temp: Humidity: Wind: mph,cbafd777-f053-11ed-b4a7-bab79e4492fa,0,0,PASS,0,,2024-01-07T21:30:20.797Z,,1,Punt,2024-01-07T21:25:43.920Z,8.0,4:06,2.0,0.0,0.0,1.0,1.0,-5.0,KICKOFF,PUNT,15:00,10:54,ARI 18,ARI 48,39.0,296.0,21,20,Home,-1,41,-2.5,48.0,1,closed,grass,,,Jonathan Gannon,Pete Carroll,PHO00,State Farm Stadium,0,0.0,K.Murray,1.0,,,T.McBride,85.0,1,0,0.0,0,1,00-0035228,,00-0037744,K.Murray,1.0,00-0035228,T.McBride,00-0037744,T.McBride,00-0037744,0,1,-0.502402796875686,0.589955329252963,7.38943390949862,5.0,1.0,1.0,0.471883028745651,52.8116971254349,2024-01-07,J.Brooks,2023,REG,SEA,18,00-0036409,LB,Jordyn Brooks,Jordyn,Brooks,Ankle,,Questionable,Ankle,,Full Participation in Practice,2024-01-05T20:44:23Z,2024-01-05 20:44:23
184,2023_11_LAC_GB,2023111903,GB,LAC,REG,11,GB,home,LAC,GB,58.0,2023-11-19,786.0,1686.0,3486.0,Half1,0,1.0,0,1,1.0,0,13:06,GB 42,10,41.0,"(13:06) (No Huddle) 33-A.Jones left tackle to GB 42 for no gain (51-S.Joseph, 95-N.Williams). LAC-97-J.Bosa was injured during the play. He is Out.",run,0.0,0,1,0.0,0,0,0,,,,,left,tackle,,,,,3,3,0.0,,,,,3.0,3.0,0,0,0.0,0.0,0.0,0.0,0.0,0.0,0.0050660502165556,0.104727476835251,0.0015832834178581,0.163441270589829,0.24862964451313,0.0047826045192778,0.471769660711289,0.0,0.0,2.5964038760867,-0.569229789311066,0.553076318930835,-0.553076318930835,-0.569229789311066,0.569229789311066,2.39236251544207,-2.39236251544207,,,0.0,0.0,-0.281119656516239,0.281119656516239,2.67348217195831,-2.67348217195831,-0.281119656516239,0.281119656516239,2.67348217195831,-2.67348217195831,0.572573363780975,0.427426636219025,0.572573363780975,0.427426636219025,-0.0180367827415466,-0.0155588090419769,-0.0155588090419769,0.554536581039429,0.445463418960571,0.420966178178787,0.420966178178787,-0.0180367827415466,0.0180367827415466,0.0414789319038391,-0.0414789319038391,,,0.0,0.0,0.017861008644104,-0.017861008644104,0.0236179232597351,-0.0236179232597351,0.017861008644104,-0.017861008644104,0.0236179232597351,-0.0236179232597351,0.0,0.0,0.0,0.0,0.0,0.0,0.0,0.0,0.0,0,0.0,0.0,0.0,0.0,0.0,0.0,0.0,0.0,0.0,0.0,0.0,0.0,0.0,0.0,0.0,0.0,0.0,0.0,0.0,0.0,0.0,0.0,1.0,0.0,0.0,0.0,0.0,0.0,0.0,0.0,0.0,0.0,0.0,0.0,0.0,0.0,1.0,0.0,0.0,0.0,0.0,,,,,,,00-0033293,A.Jones,0.0,,,,,,,,,,,,,,,,,,,,,,,,,,,,,,,,,,,,,,,,,,,,,,,,,00-0030500,N.Williams,LAC,,,,,,,,,,1.0,00-0034810,S.Joseph,LAC,,,,,,,,,,,,,,,,,,,,,,,,,,,,,0.0,,,,,0,,,0.0,0.0,0.0,0.0,,,2023,,,3,0,Turnover on downs,184,"11/19/23, 13:02:30",2023-11-19T18:06:51.263Z,Lambeau Field,"Sunny Temp: 45° F, Humidity: 55%, Wind: E 5 mph",cbacfd43-f053-11ed-b4a7-bab79e4492fa,0,0,RUSH,0,,2023-11-19T18:06:54.497Z,,1,Turnover on downs,2023-11-19T18:02:30.937Z,7.0,3:57,2.0,0.0,0.0,1.0,1.0,0.0,KICKOFF,DOWNS,15:00,11:03,GB 8,50,39.0,256.0,20,23,Home,3,43,-3.0,44.0,0,outdoors,grass,45.0,5.0,Matt LaFleur,Brandon Staley,GNB00,Lambeau Field,0,0.0,,,A.Jones,33.0,,,0,1,0.0,0,1,,00-0033293,,A.Jones,33.0,00-0033293,A.Jones,00-0033293,A.Jones,00-0033293,0,1,-0.569229789311066,,,,,,0.429932177066803,-42.9932177066803,2023-11-19,J.Bosa,2023,REG,LAC,11,00-0033156,DE,Joey Bosa,Joey,Bosa,,,,Hand,,Full Participation in Practice,2023-11-17T21:12:08Z,2023-11-17 21:12:08
62,2023_17_CAR_JAX,2023123106,JAX,CAR,REG,17,JAX,home,CAR,JAX,60.0,2023-12-31,894.0,1794.0,3594.0,Half1,0,1.0,0,1,1.0,0,14:54,JAX 40,10,43.0,(14:54) 1-T.Etienne up the middle to JAX 45 for 5 yards (54-K.Grugier-Hill). CAR-49-F.Luvu was injured during the play.,run,5.0,0,0,0.0,0,0,0,,,,,middle,,,,,,3,3,0.0,,,,,3.0,3.0,0,0,0.0,0.0,0.0,0.0,0.0,0.0,0.0044710249640047,0.11035817861557,0.0016368380747735,0.174595713615417,0.239970564842224,0.0048851929605007,0.464082479476929,0.0,0.0,2.421741229482,0.0756642566993833,1.02330771833658,-1.02330771833658,0.0756642566993833,-0.0756642566993833,0.0,0.0,,,0.0,0.0,0.0,0.0,0.0,0.0,0.0,0.0,0.0,0.0,0.572573363780975,0.427426636219025,0.572573363780975,0.427426636219025,-0.0053814649581909,-0.0251024961471558,-0.0251024961471558,0.567191898822784,0.432808101177216,0.650409162044525,0.650409162044525,-0.0053814649581909,0.0053814649581909,0.0,0.0,,,0.0,0.0,0.0,0.0,0.0,0.0,0.0,0.0,0.0,0.0,0.0,0.0,0.0,0.0,0.0,0.0,0.0,0.0,0.0,0,0.0,0.0,0.0,0.0,0.0,0.0,0.0,0.0,0.0,0.0,0.0,0.0,0.0,0.0,1.0,0.0,0.0,0.0,0.0,0.0,0.0,0.0,1.0,0.0,0.0,0.0,0.0,0.0,0.0,0.0,0.0,0.0,0.0,0.0,0.0,0.0,0.0,0.0,0.0,0.0,0.0,,,,,,,00-0036973,T.Etienne,5.0,,,,,,,,,,,,,,,,,,,,,,,,,,,,,,,,,,,,,,,,,,,CAR,,00-0032437,,K.Grugier-Hill,,,,,,,,,,,,,,0.0,,,,,,,,,,,,,,,,,,,,,,,,,,,,,,,,0.0,,,,,0,,,0.0,0.0,0.0,0.0,,,2023,,,1,1,First down,62,"12/31/23, 13:02:39",2023-12-31T18:03:17.707Z,EverBank Stadium,"Temp: 56° F, Humidity: 47%, Wind: W 8 mph",cbafa1ff-f053-11ed-b4a7-bab79e4492fa,0,0,RUSH,0,,2023-12-31T18:03:21.733Z,,1,Field goal,2023-12-31T18:02:39.470Z,13.0,6:24,3.0,1.0,1.0,1.0,1.0,0.0,KICKOFF,FIELD_GOAL,15:00,08:36,JAX 40,CAR 17,39.0,372.0,0,26,Home,26,26,3.5,38.0,0,outdoors,grass,56.0,8.0,Doug Pederson,Chris Tabor,JAX00,TIAA Bank Stadium,0,1.0,,,T.Etienne,1.0,,,0,1,0.0,0,1,,00-0036973,,T.Etienne,1.0,00-0036973,T.Etienne,00-0036973,T.Etienne,00-0036973,0,1,0.0756642566993833,,,,,,0.472458571195602,-47.2458571195602,2023-12-31,F.Luvu,2023,REG,CAR,17,00-0034302,LB,Frankie Luvu,Frankie,Luvu,Quadricep,,Questionable,Quadricep,,Limited Participation in Practice,2023-12-29T18:54:29Z,2023-12-29 18:54:29
55,2023_19_CLE_HOU,2024011300,HOU,CLE,POST,19,CLE,away,HOU,CLE,75.0,2024-01-13,900.0,1800.0,3600.0,Half1,0,1.0,0,1,1.0,0,15:00,CLE 25,10,6.0,(15:00) 15-J.Flacco pass short middle to 34-J.Ford to CLE 36 for 11 yards (30-D.Houston-Carson). HOU-98-S.Rankins was injured during the play.,pass,11.0,0,0,1.0,0,0,0,short,middle,3.0,8.0,,,,,,,3,3,0.0,,,,,3.0,3.0,0,0,0.0,0.0,0.0,0.0,0.0,0.0,0.0022018926683813,0.13701631128788,0.0022096633911132,0.269719630479813,0.21772825717926,0.0033721679355949,0.36775204539299,0.0,0.0,0.930687751155347,0.762460079509765,-0.762460079509765,0.762460079509765,0.0,0.0,-0.762460079509765,0.762460079509765,-0.484896752052009,1.24735683156177,-0.484896752052009,1.24735683156177,0.484896752052009,-0.484896752052009,-1.24735683156177,1.24735683156177,0.484896752052009,-0.484896752052009,-1.24735683156177,1.24735683156177,0.433207958936691,0.566792041063309,0.566792041063309,0.433207958936691,0.0216914415359497,-0.0003618001937866,0.0003618001937866,0.545100599527359,0.454899400472641,0.588828980922699,0.411171019077301,0.0,0.0,-0.0216914415359497,0.0216914415359497,0.0,0.0216914415359497,0.0,0.0216914415359497,0.0,0.0,-0.0216914415359497,0.0216914415359497,0.0,0.0,-0.0216914415359497,0.0216914415359497,0.0,0.0,1.0,0.0,0.0,0.0,0.0,0.0,0.0,0,0.0,0.0,0.0,0.0,0.0,0.0,0.0,0.0,0.0,0.0,0.0,0.0,0.0,0.0,1.0,0.0,0.0,0.0,0.0,0.0,0.0,0.0,0.0,1.0,0.0,0.0,0.0,0.0,0.0,0.0,0.0,0.0,0.0,0.0,0.0,1.0,0.0,0.0,0.0,0.0,0.0,00-0026158,J.Flacco,11.0,00-0037267,J.Ford,11.0,,,,,,,,,,,,,,,,,,,,,,,,,,,,,,,,,,,,,,,,,,,,,,HOU,,00-0032790,,D.Houston-Carson,,,,,,,,,,,,,,0.0,,,,,,,,,,,,,,,,,,,,,,,,,,,,,,,,0.0,,,,,0,,,0.0,0.0,0.0,0.0,,,2023,0.834153771400452,16.5846228599548,1,1,First down,55,"1/13/24, 16:32:52",2024-01-13T21:33:32.637Z,NRG Stadium,"Sunny Temp: 62° F, Humidity: 40%, Wind: SSE 6 mph",48e8b94b-add1-11ee-aec3-7d8f81bc70be,0,0,PASS,0,,2024-01-13T21:33:39.077Z,,1,Punt,2024-01-13T21:32:52.963Z,4.0,2:35,1.0,0.0,0.0,1.0,1.0,0.0,KICKOFF,PUNT,15:00,12:25,CLE 25,CLE 31,39.0,155.0,14,45,Home,31,59,-2.5,45.0,0,closed,astroturf,,,DeMeco Ryans,Kevin Stefanski,HOU00,NRG Stadium,0,1.0,J.Flacco,15.0,,,J.Ford,34.0,1,0,1.0,0,1,00-0026158,,00-0037267,J.Flacco,15.0,00-0026158,J.Ford,00-0037267,J.Ford,00-0037267,0,0,0.762460079509765,0.782050617235278,5.21885328085045,4.0,0.612547194643412,0.257434686704073,0.488227277994156,51.1772722005844,2024-01-13,S.Rankins,2023,WC,HOU,19,00-0032759,DT,Sheldon Rankins,Sheldon,Rankins,Shoulder,,Questionable,Shoulder,,Limited Participation in Practice,2024-01-11T20:29:41Z,2024-01-11 20:29:41
