play_id,game_id,old_game_id,home_team,away_team,season_type,week_x,posteam,posteam_type,defteam,side_of_field,yardline_100,game_date,quarter_seconds_remaining,half_seconds_remaining,game_seconds_remaining,game_half,quarter_end,drive,sp,qtr,down,goal_to_go,time,yrdln,ydstogo,ydsnet,desc,play_type,yards_gained,shotgun,no_huddle,qb_dropback,qb_kneel,qb_spike,qb_scramble,pass_length,pass_location,air_yards,yards_after_catch,run_location,run_gap,field_goal_result,kick_distance,extra_point_result,two_point_conv_result,home_timeouts_remaining,away_timeouts_remaining,timeout,timeout_team,td_team,td_player_name,td_player_id,posteam_timeouts_remaining,defteam_timeouts_remaining,total_home_score,total_away_score,posteam_score,defteam_score,score_differential,posteam_score_post,defteam_score_post,score_differential_post,no_score_prob,opp_fg_prob,opp_safety_prob,opp_td_prob,fg_prob,safety_prob,td_prob,extra_point_prob,two_point_conversion_prob,ep,epa,total_home_epa,total_away_epa,total_home_rush_epa,total_away_rush_epa,total_home_pass_epa,total_away_pass_epa,air_epa,yac_epa,comp_air_epa,comp_yac_epa,total_home_comp_air_epa,total_away_comp_air_epa,total_home_comp_yac_epa,total_away_comp_yac_epa,total_home_raw_air_epa,total_away_raw_air_epa,total_home_raw_yac_epa,total_away_raw_yac_epa,wp,def_wp,home_wp,away_wp,wpa,vegas_wpa,vegas_home_wpa,home_wp_post,away_wp_post,vegas_wp,vegas_home_wp,total_home_rush_wpa,total_away_rush_wpa,total_home_pass_wpa,total_away_pass_wpa,air_wpa,yac_wpa,comp_air_wpa,comp_yac_wpa,total_home_comp_air_wpa,total_away_comp_air_wpa,total_home_comp_yac_wpa,total_away_comp_yac_wpa,total_home_raw_air_wpa,total_away_raw_air_wpa,total_home_raw_yac_wpa,total_away_raw_yac_wpa,punt_blocked,first_down_rush,first_down_pass,first_down_penalty,third_down_converted,third_down_failed,fourth_down_converted,fourth_down_failed,incomplete_pass,touchback,interception,punt_inside_twenty,punt_in_endzone,punt_out_of_bounds,punt_downed,punt_fair_catch,kickoff_inside_twenty,kickoff_in_endzone,kickoff_out_of_bounds,kickoff_downed,kickoff_fair_catch,fumble_forced,fumble_not_forced,fumble_out_of_bounds,solo_tackle,safety,penalty,tackled_for_loss,fumble_lost,own_kickoff_recovery,own_kickoff_recovery_td,qb_hit,rush_attempt,pass_attempt,sack,touchdown,pass_touchdown,rush_touchdown,return_touchdown,extra_point_attempt,two_point_attempt,field_goal_attempt,kickoff_attempt,punt_attempt,fumble,complete_pass,assist_tackle,lateral_reception,lateral_rush,lateral_return,lateral_recovery,passer_player_id,passer_player_name,passing_yards,receiver_player_id,receiver_player_name,receiving_yards,rusher_player_id,rusher_player_name,rushing_yards,lateral_receiver_player_id,lateral_receiver_player_name,lateral_receiving_yards,lateral_rusher_player_id,lateral_rusher_player_name,lateral_rushing_yards,lateral_sack_player_id,lateral_sack_player_name,interception_player_id,interception_player_name,lateral_interception_player_id,lateral_interception_player_name,punt_returner_player_id,punt_returner_player_name,lateral_punt_returner_player_id,lateral_punt_returner_player_name,kickoff_returner_player_name,kickoff_returner_player_id,lateral_kickoff_returner_player_id,lateral_kickoff_returner_player_name,punter_player_id,punter_player_name,kicker_player_name,kicker_player_id,own_kickoff_recovery_player_id,own_kickoff_recovery_player_name,blocked_player_id,blocked_player_name,tackle_for_loss_1_player_id,tackle_for_loss_1_player_name,tackle_for_loss_2_player_id,tackle_for_loss_2_player_name,qb_hit_1_player_id,qb_hit_1_player_name,qb_hit_2_player_id,qb_hit_2_player_name,forced_fumble_player_1_team,forced_fumble_player_1_player_id,forced_fumble_player_1_player_name,forced_fumble_player_2_team,forced_fumble_player_2_player_id,forced_fumble_player_2_player_name,solo_tackle_1_team,solo_tackle_2_team,solo_tackle_1_player_id,solo_tackle_2_player_id,solo_tackle_1_player_name,solo_tackle_2_player_name,assist_tackle_1_player_id,assist_tackle_1_player_name,assist_tackle_1_team,assist_tackle_2_player_id,assist_tackle_2_player_name,assist_tackle_2_team,assist_tackle_3_player_id,assist_tackle_3_player_name,assist_tackle_3_team,assist_tackle_4_player_id,assist_tackle_4_player_name,assist_tackle_4_team,tackle_with_assist,tackle_with_assist_1_player_id,tackle_with_assist_1_player_name,tackle_with_assist_1_team,tackle_with_assist_2_player_id,tackle_with_assist_2_player_name,tackle_with_assist_2_team,pass_defense_1_player_id,pass_defense_1_player_name,pass_defense_2_player_id,pass_defense_2_player_name,fumbled_1_team,fumbled_1_player_id,fumbled_1_player_name,fumbled_2_player_id,fumbled_2_player_name,fumbled_2_team,fumble_recovery_1_team,fumble_recovery_1_yards,fumble_recovery_1_player_id,fumble_recovery_1_player_name,fumble_recovery_2_team,fumble_recovery_2_yards,fumble_recovery_2_player_id,fumble_recovery_2_player_name,sack_player_id,sack_player_name,half_sack_1_player_id,half_sack_1_player_name,half_sack_2_player_id,half_sack_2_player_name,return_team,return_yards,penalty_team,penalty_player_id,penalty_player_name,penalty_yards,replay_or_challenge,replay_or_challenge_result,penalty_type,defensive_two_point_attempt,defensive_two_point_conv,defensive_extra_point_attempt,defensive_extra_point_conv,safety_player_name,safety_player_id,season_x,cp,cpoe,series,series_success,series_result,order_sequence,start_time,time_of_day,stadium,weather,nfl_api_id,play_clock,play_deleted,play_type_nfl,special_teams_play,st_play_type,end_clock_time,end_yard_line,fixed_drive,fixed_drive_result,drive_real_start_time,drive_play_count,drive_time_of_possession,drive_first_downs,drive_inside20,drive_ended_with_score,drive_quarter_start,drive_quarter_end,drive_yards_penalized,drive_start_transition,drive_end_transition,drive_game_clock_start,drive_game_clock_end,drive_start_yard_line,drive_end_yard_line,drive_play_id_started,drive_play_id_ended,away_score,home_score,location,result,total,spread_line,total_line,div_game,roof,surface,temp,wind,home_coach,away_coach,stadium_id,game_stadium,aborted_play,success,passer,passer_jersey_number,rusher,rusher_jersey_number,receiver,receiver_jersey_number,pass,rush,first_down,special,play,passer_id,rusher_id,receiver_id,name,jersey_number,id,fantasy_player_name,fantasy_player_id,fantasy,fantasy_id,out_of_bounds,home_opening_kickoff,qb_epa,xyac_epa,xyac_mean_yardage,xyac_median_yardage,xyac_success,xyac_fd,xpass,pass_oe,date_x,injured_player,season_y,game_type,team,week_y,gsis_id,position,full_name,first_name,last_name,report_primary_injury,report_secondary_injury,report_status,practice_primary_injury,practice_secondary_injury,practice_status,date_modified,date_y
4591,2019_01_DET_ARI,2019090809,ARI,DET,REG,1,ARI,home,DET,DET,38.0,2019-09-08,120.0,120.0,120.0,Half2,0,26.0,0,4,1.0,0,02:00,DET 38,10,60.0,(2:00) (Shotgun) 1-K.Murray pass short right to 19-K.Johnson to DET 38 for no gain (39-J.Agnew). DET-29-R.Melvin was injured during the play.,pass,0.0,1,0,1.0,0,0,0,short,right,0.0,0.0,,,,,,,0,2,0.0,,,,,0.0,2.0,16,24,16.0,24.0,-8.0,16.0,24.0,-8.0,0.344993978738785,0.0143603989854455,0.0002871691540349,0.017980357632041,0.199909165501595,0.0023593588266521,0.420109540224075,0.0,0.0,3.37569495703792,-0.850927476072684,-7.55752078165595,7.55752078165595,7.97716032993048,-7.97716032993048,-22.9567942195023,22.9567942195023,-0.850927476072684,0.0,-0.850927476072684,0.0,-1.82206289918395,1.82206289918395,-9.26369455055101,9.26369455055101,9.66729672288056,-9.66729672288056,-33.3412915499681,33.3412915499681,0.089067816734314,0.910932183265686,0.089067816734314,0.910932183265686,-0.010276772081852,-0.0120617896318436,-0.0120617896318436,0.078791044652462,0.921208955347538,0.0833196714520454,0.0833196714520454,-0.0766992494463921,0.0766992494463921,-0.462606369207263,0.462606369207263,-0.010276772081852,0.0,-0.010276772081852,0.0,-0.0061612021907441,0.0061612021907441,-0.30227122752769,0.30227122752769,-0.0090050962551705,0.0090050962551705,-0.496335545730126,0.496335545730126,0.0,0.0,0.0,0.0,0.0,0.0,0.0,0.0,0.0,0,0.0,0.0,0.0,0.0,0.0,0.0,0.0,0.0,0.0,0.0,0.0,0.0,0.0,0.0,1.0,0.0,0.0,0.0,0.0,0.0,0.0,0.0,0.0,1.0,0.0,0.0,0.0,0.0,0.0,0.0,0.0,0.0,0.0,0.0,0.0,1.0,0.0,0.0,0.0,0.0,0.0,00-0035228,K.Murray,0.0,00-0035287,K.Johnson,0.0,,,,,,,,,,,,,,,,,,,,,,,,,,,,,,,,,,,,,,,,,,,,,,DET,,00-0033572,,J.Agnew,,,,,,,,,,,,,,0.0,,,,,,,,,,,,,,,,,,,,,,,,,,,,,,,,0.0,,,,,0,,,0.0,0.0,0.0,0.0,,,2019,0.759630501270294,24.0369498729706,53,1,First down,4591,"9/8/19, 16:25:26",2019-09-08T23:32:18Z,State Farm Stadium,"N/A Temp: ° F, Wind: mph",10012019-0908-09c6-8cc0-ade3a436022a,0,0,PASS,0,,,,26,Touchdown,,9.0,1:48,5.0,1.0,1.0,4.0,4.0,5.0,PUNT,TOUCHDOWN,02:31,00:43,ARI 40,DET 4,4504.0,4834.0,27,27,Home,0,54,-2.5,45.5,0,closed,grass,,,Kliff Kingsbury,Matt Patricia,PHO00,State Farm Stadium,0,0.0,K.Murray,1.0,,,K.Johnson,19.0,1,0,0.0,0,1,00-0035228,,00-0035287,K.Murray,1.0,00-0035228,K.Johnson,00-0035287,K.Johnson,00-0035287,0,0,-0.850927476072684,1.03737850116863,6.96573894430185,6.0,0.604669788153842,0.240229794057086,0.977690637111664,2.23093628883362,2019-09-08,R.Melvin,2019,REG,DET,1,00-0029901,CB,Rashaan Melvin,Rashaan,Melvin,Knee,,Questionable,Knee,,Limited Participation in Practice,2019-09-06T13:04:52Z,2019-09-06 13:04:52
4222,2019_17_GB_DET,2019122905,DET,GB,REG,17,GB,away,DET,GB,73.0,2019-12-29,164.0,164.0,164.0,Half2,0,22.0,0,4,3.0,0,02:44,GB 27,9,4.0,(2:44) (Shotgun) 12-A.Rodgers pass short right to 13-A.Lazard to GB 40 for 13 yards (24-A.Oruwariye). GB-13-A.Lazard was injured during the play.,pass,13.0,1,0,1.0,0,0,0,short,right,6.0,7.0,,,,,,,2,2,0.0,,,,,2.0,2.0,20,20,20.0,20.0,0.0,20.0,20.0,0.0,0.414257317781448,0.133540689945221,0.0012693263124674,0.148714020848274,0.12364549189806,0.001262069446966,0.17731112241745,0.0,0.0,0.170479603111744,1.86772706487682,-3.96796768245986,3.96796768245986,6.98200828076454,-6.98200828076454,-19.421831844154,19.421831844154,-0.602112237364054,2.46983930224087,-0.602112237364054,2.46983930224087,-7.84631061792607,7.84631061792607,-14.2600285225199,14.2600285225199,-41.2137185500469,41.2137185500469,20.7196736361243,-20.7196736361243,0.406347751617432,0.593652248382568,0.593652248382568,0.406347751617432,0.170560240745544,0.153946399688721,-0.153946399688721,0.423092007637024,0.576907992362976,0.615431547164917,0.384568452835083,0.158316798508167,-0.158316798508167,-0.559835248379137,0.559835248379137,0.0,0.170560240745544,0.0,0.170560240745544,-0.0508263171904786,0.0508263171904786,-0.491742672591284,0.491742672591284,-0.0503982068293793,0.0503982068293793,-0.523673223524169,0.523673223524169,0.0,0.0,1.0,0.0,1.0,0.0,0.0,0.0,0.0,0,0.0,0.0,0.0,0.0,0.0,0.0,0.0,0.0,0.0,0.0,0.0,0.0,0.0,0.0,1.0,0.0,0.0,0.0,0.0,0.0,0.0,0.0,0.0,1.0,0.0,0.0,0.0,0.0,0.0,0.0,0.0,0.0,0.0,0.0,0.0,1.0,0.0,0.0,0.0,0.0,0.0,00-0023459,A.Rodgers,13.0,00-0034521,A.Lazard,13.0,,,,,,,,,,,,,,,,,,,,,,,,,,,,,,,,,,,,,,,,,,,,,,DET,,00-0035270,,A.Oruwariye,,,,,,,,,,,,,,0.0,,,,,,,,,,,,,,,,,,,,,,,,,,,,,,,,0.0,,,,,0,,,0.0,0.0,0.0,0.0,,,2019,0.725110650062561,27.4889349937439,56,1,First down,4222,"12/29/19, 13:02:29",2019-12-29T21:05:09Z,Ford Field,"Controlled Climate Temp: 68° F, Humidity: 70%, Wind: mph",10012019-1229-05b9-a4c7-ec63d5719e88,0,0,PASS,0,,,,22,Turnover,2019-12-29T21:03:40Z,6.0,1:54,1.0,0.0,0.0,4.0,4.0,-10.0,PUNT,INTERCEPTION,03:34,01:40,GB 26,GB 30,4175.0,4351.0,23,20,Home,-3,43,-13.5,44.0,1,dome,fieldturf,,,Matt Patricia,Matt LaFleur,DET00,Ford Field,0,1.0,A.Rodgers,12.0,,,A.Lazard,13.0,1,0,1.0,0,1,00-0023459,,00-0034521,A.Rodgers,12.0,00-0023459,A.Lazard,00-0034521,A.Lazard,00-0034521,0,1,1.86772706487682,1.07552619050657,3.73724856643821,2.0,0.398576883220812,0.398576883220812,0.984942555427551,1.50574445724487,2019-12-29,A.Lazard,2019,REG,GB,17,00-0034521,WR,Allen Lazard,Allen,Lazard,,,,Ankle,,Limited Participation in Practice,2019-12-27T12:55:29Z,2019-12-27 12:55:29
4151,2019_06_WAS_MIA,2019101305,MIA,WAS,REG,6,MIA,home,WAS,WAS,11.0,2019-10-13,10.0,10.0,10.0,Half2,0,24.0,1,4,2.0,0,00:10,WAS 11,10,75.0,"(:10) (Shotgun) 14-R.Fitzpatrick pass short middle to 11-D.Parker for 11 yards, TOUCHDOWN. MIA-67-D.Kilgore was injured during the play. His return is Questionable.",pass,11.0,1,0,1.0,0,0,0,short,middle,11.0,0.0,,,,,,,0,3,0.0,,MIA,D.Parker,00-0031547,0.0,3.0,16,17,10.0,17.0,-7.0,16.0,17.0,-1.0,0.234525799751282,0.0010497135808691,0.0002695626462809,0.0073727653361856,0.562096357345581,0.0004028329276479,0.194283008575439,0.0,0.0,2.99177817453165,4.00822182546835,-3.07882759078401,3.07882759078401,4.95824426824591,-4.95824426824591,-16.1185597472622,16.1185597472622,4.00822182546835,0.0,4.00822182546835,0.0,-15.8483987539366,15.8483987539366,12.3170973164691,-12.3170973164691,-12.1525462629215,12.1525462629215,3.78319766820914,-3.78319766820914,0.130989730358124,0.869010269641876,0.130989730358124,0.869010269641876,0.258023149639368,0.268986835569143,0.268986835569143,0.389012879997492,0.610987120002508,0.0741378515958786,0.0741378515958786,-0.187042527545757,0.187042527545757,-0.25625341315253,0.25625341315253,0.258023149639368,0.0,0.258023149639368,0.0,0.386787706419167,-0.386787706419167,-0.344715711321604,0.344715711321604,0.387752556606469,-0.387752556606469,-0.502934564497244,0.502934564497244,0.0,0.0,1.0,0.0,0.0,0.0,0.0,0.0,0.0,0,0.0,0.0,0.0,0.0,0.0,0.0,0.0,0.0,0.0,0.0,0.0,0.0,0.0,0.0,0.0,0.0,0.0,0.0,0.0,0.0,0.0,0.0,0.0,1.0,0.0,1.0,1.0,0.0,0.0,0.0,0.0,0.0,0.0,0.0,0.0,1.0,0.0,0.0,0.0,0.0,0.0,00-0023682,R.Fitzpatrick,11.0,00-0031547,D.Parker,11.0,,,,,,,,,,,,,,,,,,,,,,,,,,,,,,,,,,,,,,,,,,,,,,,,,,,,,,,,,,,,,,,,0.0,,,,,,,,,,,,,,,,,,,,,,,,,,,,,,,,0.0,,,,,0,,,0.0,0.0,0.0,0.0,,,2019,0.458796918392181,54.1203081607819,54,1,Touchdown,4151,"10/13/19, 13:02:41",2019-10-13T20:06:29Z,Hard Rock Stadium,"Cloudy Temp: 84° F, Humidity: 66%, Wind: E 13 mph",10012019-1013-0591-b752-982b760b96ea,0,0,PASS,0,,,,24,Touchdown,2019-10-13T19:59:33Z,9.0,1:56,5.0,1.0,1.0,4.0,4.0,0.0,PUNT,TOUCHDOWN,02:02,00:06,MIA 25,WAS 11,3934.0,4194.0,17,16,Home,-1,33,-6.0,42.0,0,outdoors,grass,84.0,13.0,Brian Flores,Bill Callahan,MIA00,Hard Rock Stadium,0,1.0,R.Fitzpatrick,14.0,,,D.Parker,11.0,1,0,1.0,0,1,00-0023682,,00-0031547,R.Fitzpatrick,14.0,00-0023682,D.Parker,00-0031547,D.Parker,00-0031547,0,0,4.00822182546835,,,,,,0.992871344089508,0.712865591049194,2019-10-13,D.Kilgore,2019,REG,MIA,6,00-0028101,C,Daniel Kilgore,Daniel,Kilgore,,,,Knee,,Limited Participation in Practice,2019-10-11T10:31:36Z,2019-10-11 10:31:36
4083,2019_10_DET_CHI,2019111000,CHI,DET,REG,10,CHI,home,DET,CHI,71.0,2019-11-10,261.0,261.0,261.0,Half2,0,22.0,0,4,3.0,0,04:21,CHI 29,11,-9.0,(4:21) (Shotgun) 10-M.Trubisky sacked at CHI 21 for -8 yards (51-J.Tavai). DET-96-M.Daniels was injured during the play.,pass,-8.0,1,0,1.0,0,0,0,,,,,,,,,,,3,3,0.0,,,,,3.0,3.0,20,13,20.0,13.0,7.0,20.0,13.0,7.0,0.346921384334564,0.12602573633194,0.0015218832995742,0.202973514795303,0.129096582531929,0.002507607685402,0.190953284502029,0.0,0.0,-0.072957624681294,-1.4370438749902,3.32242049177982,-3.32242049177982,-0.504246419819538,0.504246419819538,6.18170297150984,-6.18170297150984,,,0.0,0.0,8.68830864632037,-8.68830864632037,-3.74935926834825,3.74935926834825,13.9975967849605,-13.9975967849605,-2.72272871464473,2.72272871464473,0.908261120319366,0.0917388796806335,0.908261120319366,0.0917388796806335,-0.0377405285835266,-0.0553174614906311,-0.0553174614906311,0.87052059173584,0.12947940826416,0.917080044746399,0.917080044746399,0.0698910783976317,-0.0698910783976317,0.218388462940147,-0.218388462940147,,,0.0,0.0,0.18130521877623,-0.18130521877623,0.0499838369231687,-0.0499838369231687,0.180240337093834,-0.180240337093834,0.151661446530746,-0.151661446530746,0.0,0.0,0.0,0.0,0.0,1.0,0.0,0.0,0.0,0,0.0,0.0,0.0,0.0,0.0,0.0,0.0,0.0,0.0,0.0,0.0,0.0,0.0,0.0,1.0,0.0,0.0,0.0,0.0,0.0,0.0,1.0,0.0,1.0,1.0,0.0,0.0,0.0,0.0,0.0,0.0,0.0,0.0,0.0,0.0,0.0,0.0,0.0,0.0,0.0,0.0,00-0033869,M.Trubisky,,,,,,,,,,,,,,,,,,,,,,,,,,,,,,,,,,,,00-0035240,J.Tavai,,,00-0035240,J.Tavai,,,,,,,,,DET,,00-0035240,,J.Tavai,,,,,,,,,,,,,,0.0,,,,,,,,,,,,,,,,,,,,,,,,,00-0035240,J.Tavai,,,,,,0.0,,,,,0,,,0.0,0.0,0.0,0.0,,,2019,,,46,0,Punt,4083,"11/10/19, 13:02:29",2019-11-10T20:45:02Z,Soldier Field,"overcast Temp: 40° F, Humidity: 80%, Wind: N 12 mph mph",10012019-1110-00b6-54ac-e2ffe8f28498,0,0,SACK,0,,,,22,Punt,2019-11-10T20:41:59Z,3.0,2:22,0.0,0.0,0.0,4.0,4.0,-10.0,KICKOFF,PUNT,05:53,03:31,CHI 30,CHI 21,3971.0,4102.0,13,20,Home,7,33,6.0,38.0,1,outdoors,grass,40.0,12.0,Matt Nagy,Matt Patricia,CHI98,Soldier Field,0,0.0,M.Trubisky,10.0,,,,,1,0,0.0,0,1,00-0033869,,,M.Trubisky,10.0,00-0033869,,,,,0,0,-1.4370438749902,,,,,,0.930153071880341,6.98469281196594,2019-11-10,M.Daniels,2019,REG,DET,10,00-0029284,DT,Mike Daniels,Mike,Daniels,Foot,,Questionable,Foot,,Limited Participation in Practice,2019-11-08T12:48:48Z,2019-11-08 12:48:48
3996,2019_11_NE_PHI,2019111710,PHI,NE,REG,11,PHI,home,NE,PHI,65.0,2019-11-17,195.0,195.0,195.0,Half2,0,24.0,0,4,2.0,0,03:15,PHI 35,10,68.0,"(3:15) (Shotgun) 11-C.Wentz pass incomplete short middle to 80-J.Matthews [53-K.Van Noy]. PHI-71-J.Peters was injured during the play. His return is Questionable. PENALTY on NE-24-S.Gilmore, Defensive Holding, 5 yards, enforced at PHI 35 - No Play.",no_play,0.0,1,0,0.0,0,0,0,,,,,,,,,,,3,3,0.0,,,,,3.0,3.0,10,17,10.0,17.0,-7.0,10.0,17.0,-7.0,0.387478679418564,0.0842443779110909,0.0007302050362341,0.127339825034142,0.160300746560097,0.0030322014354169,0.236873954534531,0.0,0.0,0.999512005248107,0.686103004147299,-7.96340024523628,7.96340024523628,2.42741576036485,-2.42741576036485,-11.1467058858153,11.1467058858153,,,0.0,0.0,4.23105006749393,-4.23105006749393,-11.4714610829542,11.4714610829542,4.90223338574288,-4.90223338574288,-6.96732698819419,6.96732698819419,0.152679279446602,0.847320720553398,0.152679279446602,0.847320720553398,0.009302332997322,0.0204637497663498,0.0204637497663498,0.161981612443924,0.838018387556076,0.112851992249489,0.112851992249489,-0.0400716458261012,0.0400716458261012,-0.482054027743049,0.482054027743049,,,0.0,0.0,-0.0134696690508793,0.0134696690508793,-0.29135899245739,0.29135899245739,-0.0134696690508793,0.0134696690508793,-0.13118077814579,0.13118077814579,0.0,0.0,0.0,1.0,0.0,0.0,0.0,0.0,0.0,0,0.0,0.0,0.0,0.0,0.0,0.0,0.0,0.0,0.0,0.0,0.0,0.0,0.0,0.0,0.0,0.0,1.0,0.0,0.0,0.0,0.0,0.0,0.0,0.0,0.0,0.0,0.0,0.0,0.0,0.0,0.0,0.0,0.0,0.0,0.0,0.0,0.0,0.0,0.0,0.0,0.0,,,,,,,,,,,,,,,,,,,,,,,,,,,,,,,,,,,,,,,,,,,,,,,,,,,,,,,,,,,,,,,,,,,,,,0.0,,,,,,,,,,,,,,,,,,,,,,,,,,,,,,,,0.0,NE,00-0029542,S.Gilmore,5.0,0,,Defensive Holding,0.0,0.0,0.0,0.0,,,2019,,,56,1,First down,3996,"11/17/19, 16:25:40",2019-11-18T00:24:42Z,Lincoln Financial Field,"Cloudy Temp: 42° F, Humidity: 57%, Wind: NNE 13 mph",10012019-1117-101a-045c-dec68db66bde,0,0,PENALTY,0,,,,24,Turnover on downs,2019-11-18T00:23:14Z,11.0,3:09,4.0,0.0,0.0,4.0,4.0,5.0,PUNT,DOWNS,04:07,00:58,PHI 6,NE 26,3950.0,4232.0,17,10,Home,-7,27,-4.5,45.0,0,outdoors,grass,42.0,13.0,Doug Pederson,Bill Belichick,PHI00,Lincoln Financial Field,0,1.0,C.Wentz,11.0,,,J.Matthews,80.0,1,0,1.0,0,1,00-0032950,,00-0031299,C.Wentz,11.0,00-0032950,,,J.Matthews,00-0031299,0,1,0.686103004147299,,,,,,0.904003083705902,9.59969162940979,2019-11-17,J.Peters,2019,REG,PHI,11,00-0022531,T,Jason Peters,Jason,Peters,,,,Knee,,Full Participation in Practice,2019-11-15T12:26:59Z,2019-11-15 12:26:59
3988,2019_06_SEA_CLE,2019101302,CLE,SEA,REG,6,SEA,away,CLE,CLE,40.0,2019-10-13,422.0,422.0,422.0,Half2,0,22.0,0,4,2.0,0,07:02,CLE 40,8,79.0,(7:02) 32-C.Carson right tackle pushed ob at CLE 26 for 14 yards (96-D.Ekuale). CLE-96-D.Ekuale was injured during the play. His return is Probable.,run,14.0,0,0,0.0,0,0,0,,,,,right,tackle,,,,,2,2,0.0,,,,,2.0,2.0,28,25,25.0,28.0,-3.0,25.0,28.0,-3.0,0.193427264690399,0.0630429461598396,0.0007920110947452,0.0871378779411316,0.29134863615036,0.0017767373938113,0.362474501132965,0.0,0.0,2.61424288491253,1.4309809525148,-3.64682914780807,3.64682914780807,7.25642567077,-7.25642567077,-14.9725242833734,14.9725242833734,,,0.0,0.0,-8.27080945097259,8.27080945097259,-3.09073831886053,3.09073831886053,-11.6052066898847,11.6052066898847,-6.89731533919218,6.89731533919218,0.433135271072388,0.566864728927612,0.566864728927612,0.433135271072388,0.088722825050354,0.0914168059825897,-0.0914168059825897,0.478141903877258,0.521858096122742,0.445657461881638,0.554342538118362,0.149374038239212,-0.149374038239212,-0.469671065328623,0.469671065328623,,,0.0,0.0,0.0035869639003777,-0.0035869639003777,-0.305548648840741,0.305548648840741,-0.684712900630186,0.684712900630186,0.0990356695586883,-0.0990356695586883,0.0,1.0,0.0,0.0,0.0,0.0,0.0,0.0,0.0,0,0.0,0.0,0.0,0.0,0.0,0.0,0.0,0.0,0.0,0.0,0.0,0.0,0.0,0.0,1.0,0.0,0.0,0.0,0.0,0.0,0.0,0.0,1.0,0.0,0.0,0.0,0.0,0.0,0.0,0.0,0.0,0.0,0.0,0.0,0.0,0.0,0.0,0.0,0.0,0.0,0.0,,,,,,,00-0033594,C.Carson,14.0,,,,,,,,,,,,,,,,,,,,,,,,,,,,,,,,,,,,,,,,,,,CLE,,00-0034251,,D.Ekuale,,,,,,,,,,,,,,0.0,,,,,,,,,,,,,,,,,,,,,,,,,,,,,,,,0.0,,,,,0,,,0.0,0.0,0.0,0.0,,,2019,,,59,1,First down,3988,"10/13/19, 13:02:42",2019-10-13T20:06:29Z,Cleveland Browns Stadium,"Sunny Temp: 58° F, Humidity: 38%, Wind: South 20 mph",10012019-1013-0231-d5ee-575df785bf69,0,0,RUSH,0,,,,22,Touchdown,2019-10-13T20:01:07Z,9.0,5:32,7.0,1.0,1.0,4.0,4.0,15.0,KICKOFF,TOUCHDOWN,09:02,03:30,SEA 21,CLE 1,3828.0,4227.0,32,28,Home,-4,60,1.0,45.5,0,outdoors,grass,58.0,20.0,Freddie Kitchens,Pete Carroll,CLE00,FirstEnergy Stadium,0,1.0,,,C.Carson,32.0,,,0,1,1.0,0,1,,00-0033594,,C.Carson,32.0,00-0033594,C.Carson,00-0033594,C.Carson,00-0033594,1,1,1.4309809525148,,,,,,0.789059102535248,-78.9059102535248,2019-10-13,D.Ekuale,2019,REG,CLE,6,00-0034251,DT,Daniel Ekuale,Daniel,Ekuale,,,,Knee,,Full Participation in Practice,2019-10-11T12:01:22Z,2019-10-11 12:01:22
3979,2019_03_HOU_LAC,2019092210,LAC,HOU,REG,3,LAC,home,HOU,HOU,34.0,2019-09-22,65.0,65.0,65.0,Half2,0,20.0,0,4,4.0,0,01:05,HOU 34,2,50.0,(1:05) (Shotgun) 30-A.Ekeler up the middle to HOU 30 for 4 yards (20-J.Reid). HOU-20-J.Reid was injured during the play.,run,4.0,1,0,0.0,0,0,0,,,,,middle,,,,,,1,3,0.0,,,,,1.0,3.0,20,27,20.0,27.0,-7.0,20.0,27.0,-7.0,0.455935329198837,0.0617572851479054,0.0003884044999722,0.0317553095519543,0.302098631858826,0.0008407253189943,0.147224366664886,0.0,0.0,1.53021208156133,1.74029854498804,-5.46478200770905,5.46478200770905,5.78058226917306,-5.78058226917306,-14.5678598564257,14.5678598564257,,,0.0,0.0,-4.88996418952593,4.88996418952593,-0.518724819166379,0.518724819166379,15.7272890724707,-15.7272890724707,-24.1372789928712,24.1372789928712,0.0956681445240974,0.904331855475903,0.0956681445240974,0.904331855475903,0.0811653360724449,0.0871370732784271,0.0871370732784271,0.176833480596542,0.823166519403458,0.11660073697567,0.11660073697567,0.0944161350550193,-0.0944161350550193,-0.642407690976378,0.642407690976378,,,0.0,0.0,-0.154417317482781,0.154417317482781,-0.112038889647886,0.112038889647886,-0.154769014689278,0.154769014689278,-0.273245626808569,0.273245626808569,0.0,1.0,0.0,0.0,0.0,0.0,1.0,0.0,0.0,0,0.0,0.0,0.0,0.0,0.0,0.0,0.0,0.0,0.0,0.0,0.0,0.0,0.0,0.0,1.0,0.0,0.0,0.0,0.0,0.0,0.0,0.0,1.0,0.0,0.0,0.0,0.0,0.0,0.0,0.0,0.0,0.0,0.0,0.0,0.0,0.0,0.0,0.0,0.0,0.0,0.0,,,,,,,00-0033699,A.Ekeler,4.0,,,,,,,,,,,,,,,,,,,,,,,,,,,,,,,,,,,,,,,,,,,HOU,,00-0034361,,J.Reid,,,,,,,,,,,,,,0.0,,,,,,,,,,,,,,,,,,,,,,,,,,,,,,,,0.0,,,,,0,,,0.0,0.0,0.0,0.0,,,2019,,,54,1,First down,3979,"9/22/19, 16:25:33",2019-09-22T23:33:42Z,ROKiT Field - Dignity Health Sports Park,"Partly Cloudy Temp: 87° F, Humidity: 37%, Wind: S 4 mph",10012019-0922-10bc-9378-6897a8893cc3,0,0,RUSH,0,,,,20,Turnover on downs,2019-09-22T23:23:39Z,14.0,4:08,3.0,0.0,0.0,4.0,4.0,-10.0,PUNT,DOWNS,04:19,00:11,LAC 16,HOU 34,3745.0,4172.0,27,20,Home,-7,47,3.0,49.0,0,outdoors,grass,87.0,4.0,Anthony Lynn,Bill O'Brien,LAX97,StubHub Center,0,1.0,,,A.Ekeler,30.0,,,0,1,1.0,0,1,,00-0033699,,A.Ekeler,30.0,00-0033699,A.Ekeler,00-0033699,A.Ekeler,00-0033699,0,1,1.74029854498804,,,,,,0.926291823387146,-92.6291823387146,2019-09-22,J.Reid,2019,REG,HOU,3,00-0034361,S,Justin Reid,Justin,Reid,,,,Shoulder,,Full Participation in Practice,2019-09-20T12:12:59Z,2019-09-20 12:12:59
3952,2019_11_DAL_DET,2019111702,DET,DAL,REG,11,DAL,away,DET,DAL,69.0,2019-11-17,342.0,342.0,342.0,Half2,0,20.0,0,4,1.0,0,05:42,DAL 31,10,29.0,(5:42) 4-D.Prescott pass incomplete deep left to 19-A.Cooper [90-T.Flowers]. DAL-71-L.Collins was injured during the play. His return is Doubtful.,pass,0.0,0,0,1.0,0,0,0,deep,left,29.0,,,,,,,,2,1,0.0,,,,,1.0,2.0,27,35,35.0,27.0,8.0,35.0,27.0,8.0,0.252004683017731,0.0898899361491203,0.0020192000083625,0.130525827407837,0.17843459546566,0.0014425687259063,0.345683187246323,0.0,0.0,1.77058223425411,-0.513865457149223,-13.6061956750345,13.6061956750345,0.739792600754183,-0.739792600754183,-16.9937976180407,16.9937976180407,1.84086865733843,-2.35473411448766,0.0,0.0,-7.47594304732047,7.47594304732047,-10.030142205942,10.030142205942,-17.3070925199427,17.3070925199427,1.31058862335512,-1.31058862335512,0.942505896091461,0.0574941039085388,0.0574941039085388,0.942505896091461,-0.008455753326416,-0.0047506093978881,0.0047506093978881,0.0659498572349548,0.934050142765045,0.964285373687744,0.0357146263122559,0.0798269445464445,-0.0798269445464445,-0.694529556547998,0.694529556547998,0.0,-0.008455753326416,0.0,0.0,0.087240718881801,-0.087240718881801,-0.782447677330091,0.782447677330091,0.087240718881801,-0.087240718881801,-0.769619699791982,0.769619699791982,0.0,0.0,0.0,0.0,0.0,0.0,0.0,0.0,1.0,0,0.0,0.0,0.0,0.0,0.0,0.0,0.0,0.0,0.0,0.0,0.0,0.0,0.0,0.0,0.0,0.0,0.0,0.0,0.0,0.0,0.0,1.0,0.0,1.0,0.0,0.0,0.0,0.0,0.0,0.0,0.0,0.0,0.0,0.0,0.0,0.0,0.0,0.0,0.0,0.0,0.0,00-0033077,D.Prescott,,00-0031544,A.Cooper,,,,,,,,,,,,,,,,,,,,,,,,,,,,,,,,,,,,,00-0031566,T.Flowers,,,,,,,,,,,,,,,,,,,,,,,,,,,0.0,,,,,,,,,,,,,,,,,,,,,,,,,,,,,,,,0.0,,,,,0,,,0.0,0.0,0.0,0.0,,,2019,0.324349731206894,-32.4349731206894,53,1,First down,3952,"11/17/19, 13:02:34",2019-11-17T20:56:13Z,Ford Field,"Temp: 68° F, Humidity: 70%, Wind: mph",10012019-1117-0226-72a2-66122e2d7a7a,0,0,PASS,0,,,,20,Punt,2019-11-17T20:55:17Z,6.0,2:05,1.0,0.0,0.0,4.0,4.0,0.0,KICKOFF,PUNT,05:49,03:44,DAL 31,DET 40,3928.0,4112.0,35,27,Home,-8,62,-7.5,46.5,0,dome,fieldturf,,,Matt Patricia,Jason Garrett,DET00,Ford Field,0,0.0,D.Prescott,4.0,,,A.Cooper,19.0,1,0,0.0,0,1,00-0033077,,00-0031544,D.Prescott,4.0,00-0033077,A.Cooper,00-0031544,A.Cooper,00-0031544,0,0,-0.513865457149223,0.726823699912127,11.0633400704828,5.0,1.0,1.0,0.220848709344864,77.9151290655136,2019-11-17,L.Collins,2019,REG,DAL,11,00-0031534,T,La'el Collins,La'el,Collins,Knee,Back,Questionable,Knee,Back,Limited Participation in Practice,2019-11-15T12:31:51Z,2019-11-15 12:31:51
3948,2019_15_PHI_WAS,2019121508,WAS,PHI,REG,15,PHI,away,WAS,WAS,25.0,2019-12-15,138.0,138.0,138.0,Half2,0,19.0,0,4,1.0,0,02:18,WAS 25,10,75.0,(2:18) (Shotgun) 11-C.Wentz pass short right to 26-M.Sanders to WAS 28 for -3 yards (93-Jon.Allen). WAS-31-F.Moreau was injured during the play. His return is Questionable. 31 - hamstring injury,pass,-3.0,1,0,1.0,0,0,0,short,right,-8.0,5.0,,,,,,,2,2,0.0,,,,,2.0,2.0,27,24,24.0,27.0,-3.0,24.0,27.0,-3.0,0.200447663664818,0.019884055480361,0.0003030898224096,0.0249101668596268,0.314522981643677,0.0018339848611503,0.438098073005676,0.0,0.0,3.77929391158978,-0.874287600687239,-2.06894414522685,2.06894414522685,-9.2512226656545,9.2512226656545,5.78739264389979,-5.78739264389979,-1.32225596148055,0.447968360793311,-1.32225596148055,0.447968360793311,7.80971179297194,-7.80971179297194,-10.6632813452436,10.6632813452436,-3.26989176758798,3.26989176758798,3.37648740851101,-3.37648740851101,0.521505534648895,0.478494465351105,0.478494465351105,0.521505534648895,-0.0648748874664307,-0.0658636093139648,0.0658636093139648,0.543369352817535,0.456630647182465,0.645782768726349,0.354217231273651,-0.424478865758016,0.424478865758016,0.147197279307886,-0.147197279307886,0.0,-0.0648748874664307,0.0,-0.0648748874664307,-0.0813617906080958,0.0813617906080958,0.0197694828951075,-0.0197694828951075,-0.0781546732889887,0.0781546732889887,0.0358249476396754,-0.0358249476396754,0.0,0.0,0.0,0.0,0.0,0.0,0.0,0.0,0.0,0,0.0,0.0,0.0,0.0,0.0,0.0,0.0,0.0,0.0,0.0,0.0,0.0,0.0,0.0,1.0,0.0,0.0,0.0,0.0,0.0,0.0,0.0,0.0,1.0,0.0,0.0,0.0,0.0,0.0,0.0,0.0,0.0,0.0,0.0,0.0,1.0,0.0,0.0,0.0,0.0,0.0,00-0032950,C.Wentz,-3.0,00-0035243,M.Sanders,-3.0,,,,,,,,,,,,,,,,,,,,,,,,,,,,,,,,00-0033523,Jon.Allen,,,,,,,,,,,,,WAS,,00-0033523,,Jon.Allen,,,,,,,,,,,,,,0.0,,,,,,,,,,,,,,,,,,,,,,,,,,,,,,,,0.0,,,,,0,,,0.0,0.0,0.0,0.0,,,2019,0.722041189670563,27.7958810329437,54,1,First down,3948,"12/15/19, 13:02:43",2019-12-15T21:00:11Z,Commanders Field,"Sunny Temp: 52° F, Humidity: 44%, Wind: West 13 mph",10012019-1215-0881-ba9b-04c9aa6d3394,0,0,PASS,0,,,,19,Touchdown,2019-12-15T20:54:34Z,11.0,4:26,6.0,1.0,1.0,4.0,4.0,0.0,KICKOFF,TOUCHDOWN,04:52,00:26,PHI 25,WAS 4,3774.0,4124.0,37,27,Home,-10,64,-7.0,38.0,1,outdoors,grass,52.0,13.0,Bill Callahan,Doug Pederson,WAS00,FedExField,0,0.0,C.Wentz,11.0,,,M.Sanders,26.0,1,0,0.0,0,1,00-0032950,,00-0035243,C.Wentz,11.0,00-0032950,M.Sanders,00-0035243,M.Sanders,00-0035243,0,1,-0.874287600687239,1.28528914601092,11.1917061937565,10.0,0.412819298129762,0.186503581848228,0.553936898708344,44.6063101291657,2019-12-15,F.Moreau,2019,REG,WAS,15,00-0033918,CB,Fabian Moreau,Fabian,Moreau,Hamstring,,Questionable,Hamstring,,Limited Participation in Practice,2019-12-13T10:19:34Z,2019-12-13 10:19:34
3902,2019_04_DAL_NO,2019092912,NO,DAL,REG,4,DAL,away,NO,DAL,86.0,2019-09-29,99.0,99.0,99.0,Half2,0,18.0,0,4,1.0,0,01:39,DAL 14,10,34.0,"(1:39) (Shotgun) 4-D.Prescott sacked at DAL 3 for -11 yards (93-D.Onyemata). DAL-77-T.Smith was injured during the play. Owing to the injury and Dallas being out of timeouts, there was a 10-second runoff.",pass,-11.0,1,0,1.0,0,0,0,,,,,,,,,,,2,0,0.0,,,,,0.0,2.0,12,10,10.0,12.0,-2.0,10.0,12.0,-2.0,0.684733152389526,0.0374123342335224,0.0023248551879078,0.0504461452364922,0.0923755615949631,0.0008843645337037,0.131823644042015,0.0,0.0,0.731651192414574,-0.901862598722801,1.62730191944668,-1.62730191944668,5.15413994376127,-5.15413994376127,-4.14151095596254,4.14151095596254,,,0.0,0.0,-6.66608606412774,6.66608606412774,8.81448049582601,-8.81448049582601,-3.69782635301817,3.69782635301817,7.4682441835798,-7.4682441835798,0.278304815292358,0.721695184707642,0.721695184707642,0.278304815292358,-0.119306653738022,-0.156813114881516,0.156813114881516,0.841001838445664,0.158998161554337,0.300109177827835,0.699890822172165,0.312077356183284,-0.312077356183284,0.195109188556671,-0.195109188556671,,,0.0,0.0,0.0665141642093658,-0.0665141642093658,0.0947388410568237,-0.0947388410568237,-0.76292210817337,0.76292210817337,1.03999021649361,-1.03999021649361,0.0,0.0,0.0,0.0,0.0,0.0,0.0,0.0,0.0,0,0.0,0.0,0.0,0.0,0.0,0.0,0.0,0.0,0.0,0.0,0.0,0.0,0.0,0.0,1.0,0.0,0.0,0.0,0.0,0.0,0.0,1.0,0.0,1.0,1.0,0.0,0.0,0.0,0.0,0.0,0.0,0.0,0.0,0.0,0.0,0.0,0.0,0.0,0.0,0.0,0.0,00-0033077,D.Prescott,,,,,,,,,,,,,,,,,,,,,,,,,,,,,,,,,,,,00-0033051,D.Onyemata,,,00-0033051,D.Onyemata,,,,,,,,,NO,,00-0033051,,D.Onyemata,,,,,,,,,,,,,,0.0,,,,,,,,,,,,,,,,,,,,,,,,,00-0033051,D.Onyemata,,,,,,0.0,,,,,0,,,0.0,0.0,0.0,0.0,,,2019,,,47,1,First down,3902,"9/29/19, 20:22:27",2019-09-30T03:09:51Z,Caesars Superdome,"Sunny Temp: 87° F, Humidity: 62%, Wind: E 10 mph",10012019-0929-1223-2cbe-bce487acff58,0,0,SACK,0,,,,18,Turnover,2019-09-30T03:09:51Z,8.0,1:39,2.0,0.0,0.0,4.0,4.0,-10.0,PUNT,INTERCEPTION,01:39,00:00,DAL 14,DAL 48,3902.0,4143.0,10,12,Home,2,22,-2.5,47.0,0,dome,astroturf,,,Sean Payton,Jason Garrett,NOR00,Mercedes-Benz Superdome,0,0.0,D.Prescott,4.0,,,,,1,0,0.0,0,1,00-0033077,,,D.Prescott,4.0,00-0033077,,,,,0,0,-0.901862598722801,,,,,,0.968193531036377,3.1806468963623,2019-09-29,T.Smith,2019,REG,NO,4,00-0034765,WR,Tre'Quan Smith,Tre'Quan,Smith,Ankle,,Out,Ankle,,Did Not Participate In Practice,2019-09-27T12:08:03Z,2019-09-27 12:08:03
3898,2019_06_CAR_TB,2019101300,TB,CAR,REG,6,TB,home,CAR,TB,75.0,2019-10-13,468.0,468.0,468.0,Half2,0,28.0,0,4,3.0,0,07:48,TB 25,10,75.0,(7:48) (Shotgun) 3-J.Winston pass short right to 12-C.Godwin to TB 37 for 12 yards (47-R.Cockrell; 54-S.Thompson). TB-12-C.Godwin was injured during the play. His return is Probable.,pass,12.0,1,0,1.0,0,0,0,short,right,10.0,2.0,,,,,,,2,3,0.0,,,,,2.0,3.0,18,37,18.0,37.0,-19.0,18.0,37.0,-19.0,0.224775552749634,0.154539451003075,0.0019826178904622,0.251457273960114,0.1460330337286,0.0025518119800835,0.218660265207291,0.0,0.0,-0.253959924913943,1.86216969415545,-19.5448131600805,19.5448131600805,1.26969059416115,-1.26969059416115,-17.6624658976136,17.6624658976136,1.62036351882853,0.241806175326929,1.62036351882853,0.241806175326929,7.9148880817811,-7.9148880817811,-5.58531372786633,5.58531372786633,5.48015152770677,-5.48015152770677,-15.1928353013421,15.1928353013421,0.0065855029970407,0.993414497002959,0.0065855029970407,0.993414497002959,0.0029594739899039,0.0013678912073373,0.0013678912073373,0.0095449769869446,0.990455023013055,0.0024143401533365,0.0024143401533365,-0.163472255097573,0.163472255097573,-0.46959796950229,0.46959796950229,0.0,0.0029594739899039,0.0,0.0029594739899039,0.100430613610893,-0.100430613610893,-0.124020429626187,0.124020429626187,0.0895285366512835,-0.0895285366512835,-0.292339446786871,0.292339446786871,0.0,0.0,1.0,0.0,1.0,0.0,0.0,0.0,0.0,0,0.0,0.0,0.0,0.0,0.0,0.0,0.0,0.0,0.0,0.0,0.0,0.0,0.0,0.0,0.0,0.0,0.0,0.0,0.0,0.0,0.0,0.0,0.0,1.0,0.0,0.0,0.0,0.0,0.0,0.0,0.0,0.0,0.0,0.0,0.0,1.0,1.0,0.0,0.0,0.0,0.0,00-0031503,J.Winston,12.0,00-0033921,C.Godwin,12.0,,,,,,,,,,,,,,,,,,,,,,,,,,,,,,,,,,,,,,,,,,,,,,,,,,,,00-0031016,R.Cockrell,CAR,00-0031550,S.Thompson,CAR,,,,,,,0.0,,,,,,,,,,,,,,,,,,,,,,,,,,,,,,,,0.0,,,,,0,,,0.0,0.0,0.0,0.0,,,2019,0.519576549530029,48.0423450469971,55,1,First down,3898,"10/13/19, 09:35:30",2019-10-13T16:31:54Z,Tottenham Hotspur Stadium,"Mostly Cloudy Temp: 61° F, Humidity: 86%, Wind: SW 14 mph",10012019-1013-00d3-8370-55ee7e9487d2,0,0,PASS,0,,,,28,Touchdown,2019-10-13T16:30:01Z,11.0,3:09,4.0,1.0,1.0,4.0,4.0,0.0,KICKOFF,TOUCHDOWN,07:56,04:47,TB 25,CAR 3,3839.0,4119.0,37,26,Neutral,-11,63,-2.0,48.5,1,outdoors,grass,61.0,14.0,Bruce Arians,Ron Rivera,LON02,Tottenham Stadium,0,1.0,J.Winston,3.0,,,C.Godwin,12.0,1,0,1.0,0,1,00-0031503,,00-0033921,J.Winston,3.0,00-0031503,C.Godwin,00-0033921,C.Godwin,00-0033921,0,1,1.86216969415545,0.39791595616454,4.14763699343894,2.0,0.965008678613231,0.965008678613231,0.985884726047516,1.41152739524841,2019-10-13,C.Godwin,2019,REG,TB,6,00-0033921,WR,Chris Godwin,Chris,Godwin,,,,Hip,,Full Participation in Practice,2019-10-11T12:14:06Z,2019-10-11 12:14:06
3879,2019_03_MIA_DAL,2019092201,DAL,MIA,REG,3,DAL,home,MIA,DAL,54.0,2019-09-22,295.0,295.0,295.0,Half2,0,21.0,0,4,2.0,0,04:55,DAL 46,4,60.0,(4:55) 20-T.Pollard right end to MIA 43 for 11 yards (52-R.McMillan). MIA-28-B.McCain was injured during the play. His return is Questionable.,run,11.0,0,0,0.0,0,0,0,,,,,right,end,,,,,3,3,0.0,,,,,3.0,3.0,24,6,24.0,6.0,18.0,24.0,6.0,18.0,0.217304587364197,0.0723815932869911,0.0007425255607813,0.115952827036381,0.214276894927025,0.003793453099206,0.375548154115677,0.0,0.0,2.24895504955202,0.786099781806115,22.2196575500895,-22.2196575500895,17.5917090041995,-17.5917090041995,13.1251244270091,-13.1251244270091,,,0.0,0.0,1.00138238252839,-1.00138238252839,6.16767954325769,-6.16767954325769,-0.0993589950667229,0.0993589950667229,9.737776414447,-9.737776414447,0.998929798603058,0.0010702013969421,0.998929798603058,0.0010702013969421,0.0002306103706359,1.71661376953125e-05,1.71661376953125e-05,0.999160408973694,0.0008395910263061,0.999900102615356,0.999900102615356,0.423939654752423,-0.423939654752423,0.130100323708435,-0.130100323708435,,,0.0,0.0,-0.588343884281137,0.588343884281137,0.715688041019215,-0.715688041019215,-1.34555501998148,1.34555501998148,1.44039452339426,-1.44039452339426,0.0,1.0,0.0,0.0,0.0,0.0,0.0,0.0,0.0,0,0.0,0.0,0.0,0.0,0.0,0.0,0.0,0.0,0.0,0.0,0.0,0.0,0.0,0.0,1.0,0.0,0.0,0.0,0.0,0.0,0.0,0.0,1.0,0.0,0.0,0.0,0.0,0.0,0.0,0.0,0.0,0.0,0.0,0.0,0.0,0.0,0.0,0.0,0.0,0.0,0.0,,,,,,,00-0035261,T.Pollard,11.0,,,,,,,,,,,,,,,,,,,,,,,,,,,,,,,,,,,,,,,,,,,MIA,,00-0033461,,R.McMillan,,,,,,,,,,,,,,0.0,,,,,,,,,,,,,,,,,,,,,,,,,,,,,,,,0.0,,,,,0,,,0.0,0.0,0.0,0.0,,,2019,,,57,1,First down,3879,"9/22/19, 13:02:30",2019-09-22T19:52:35Z,AT&T Stadium,"Temp: ° F, Wind: mph",10012019-0922-01b7-f9e3-2c6d04d5c95c,0,0,RUSH,0,,,,21,Touchdown,2019-09-22T19:51:58Z,5.0,1:42,4.0,1.0,1.0,4.0,4.0,20.0,DOWNS,TOUCHDOWN,05:27,03:45,DAL 40,MIA 16,3858.0,4032.0,6,31,Home,25,37,22.0,46.5,0,closed,fieldturf,,,Jason Garrett,Brian Flores,DAL00,AT&T Stadium,0,1.0,,,T.Pollard,20.0,,,0,1,1.0,0,1,,00-0035261,,T.Pollard,20.0,00-0035261,T.Pollard,00-0035261,T.Pollard,00-0035261,0,0,0.786099781806115,,,,,,0.128834739327431,-12.8834739327431,2019-09-22,B.McCain,2019,REG,MIA,3,00-0031587,S,Bobby McCain,Bobby,McCain,Shoulder,,Questionable,Shoulder,,Limited Participation in Practice,2019-09-20T11:35:54Z,2019-09-20 11:35:54
3859,2019_14_IND_TB,2019120808,TB,IND,REG,14,TB,home,IND,IND,24.0,2019-12-08,333.0,333.0,333.0,Half2,0,23.0,0,4,2.0,0,05:33,IND 24,10,63.0,(5:33) (Shotgun) 3-J.Winston pass short left to 27-R.Jones to IND 15 for 9 yards (34-R.Ya-Sin). IND-34-R.Ya-Sin was injured during the play. His return is Questionable.,pass,9.0,1,0,1.0,0,0,0,short,left,2.0,7.0,,,,,,,3,2,0.0,,,,,3.0,2.0,31,35,31.0,35.0,-4.0,31.0,35.0,-4.0,0.0915653854608536,0.021318107843399,0.0004771170788444,0.0363427028059959,0.426332205533981,0.0008421982638537,0.42312228679657,0.0,0.0,3.92322954337578,0.625588160939515,-2.61426961631472,2.61426961631472,-3.27080038427164,3.27080038427164,0.882268139245783,-0.882268139245783,-0.538783580472227,1.16437174141174,-0.538783580472227,1.16437174141174,1.28015030504321,-1.28015030504321,18.0964969276181,-18.0964969276181,-9.58078230952378,9.58078230952378,11.9635049299224,-11.9635049299224,0.532950937747955,0.467049062252045,0.532950937747955,0.467049062252045,0.0309616327285767,0.0223771929740906,0.0223771929740906,0.563912570476532,0.436087429523468,0.547696113586426,0.547696113586426,-0.187154907770652,0.187154907770652,0.11299331071766,-0.11299331071766,0.0,0.0309616327285767,0.0,0.0309616327285767,-0.0844668823215757,0.0844668823215757,0.887174693473314,-0.887174693473314,-0.0844668823215757,0.0844668823215757,0.286390424111244,-0.286390424111244,0.0,0.0,0.0,0.0,0.0,0.0,0.0,0.0,0.0,0,0.0,0.0,0.0,0.0,0.0,0.0,0.0,0.0,0.0,0.0,0.0,0.0,0.0,0.0,1.0,0.0,0.0,0.0,0.0,0.0,0.0,0.0,0.0,1.0,0.0,0.0,0.0,0.0,0.0,0.0,0.0,0.0,0.0,0.0,0.0,1.0,0.0,0.0,0.0,0.0,0.0,00-0031503,J.Winston,9.0,00-0034816,R.Jones,9.0,,,,,,,,,,,,,,,,,,,,,,,,,,,,,,,,,,,,,,,,,,,,,,IND,,00-0035637,,R.Ya-Sin,,,,,,,,,,,,,,0.0,,,,,,,,,,,,,,,,,,,,,,,,,,,,,,,,0.0,,,,,0,,,0.0,0.0,0.0,0.0,,,2019,0.79331910610199,20.668089389801,55,1,First down,3859,"12/8/19, 13:02:43",2019-12-08T20:57:38Z,Raymond James Stadium,"Cloudy Temp: 78° F, Humidity: 58%, Wind: ESE 9 mph",10012019-1208-08af-74a0-f84693093710,0,0,PASS,0,,,,23,Touchdown,2019-12-08T20:54:58Z,8.0,4:22,4.0,1.0,1.0,4.0,4.0,0.0,MISSED_FG,TOUCHDOWN,08:13,03:51,TB 37,IND 12,3767.0,3975.0,35,38,Home,3,73,3.0,46.5,0,outdoors,grass,78.0,9.0,Bruce Arians,Frank Reich,TAM00,Raymond James Stadium,0,1.0,J.Winston,3.0,,,R.Jones,27.0,1,0,0.0,0,1,00-0031503,,00-0034816,J.Winston,3.0,00-0031503,R.Jones,00-0034816,R.Jones,00-0034816,0,1,0.625588160939515,0.702079151818441,4.90299425960984,4.0,0.447562663292047,0.219135335122701,0.698350608348846,30.1649391651154,2019-12-08,R.Ya-Sin,2019,REG,IND,14,00-0035637,CB,Rock Ya-Sin,Rock,Ya-Sin,Ankle,,Questionable,Ankle,,Did Not Participate In Practice,2019-12-06T10:25:44Z,2019-12-06 10:25:44
3827,2019_11_DAL_DET,2019111702,DET,DAL,REG,11,DET,home,DAL,DAL,46.0,2019-11-17,418.0,418.0,418.0,Half2,0,19.0,0,4,1.0,0,06:58,DAL 46,10,75.0,"(6:58) (No Huddle, Shotgun) 2-J.Driskel pass short left to 31-T.Johnson to DAL 46 for no gain (90-D.Lawrence). DAL-90-D.Lawrence was injured during the play.",pass,0.0,1,1,1.0,0,0,0,short,left,-3.0,3.0,,,,,,,2,1,0.0,,,,,2.0,1.0,21,35,21.0,35.0,-14.0,21.0,35.0,-14.0,0.17107330262661,0.05392100289464,0.0008977543911896,0.0865076258778572,0.278201907873154,0.0044201812706887,0.404978185892105,0.0,0.0,2.90918148879427,-0.501043856027536,-17.3222677435116,17.3222677435116,0.739792600754183,-0.739792600754183,-21.1525254424232,21.1525254424232,-1.0108378775185,0.509794021490961,-1.0108378775185,0.509794021490961,-9.94788674660958,9.94788674660958,-12.1500608738861,12.1500608738861,-17.9381675618934,17.9381675618934,-3.16406415907668,3.16406415907668,0.061014149338007,0.938985850661993,0.061014149338007,0.938985850661993,-0.0086915120482444,-0.0029747299849987,-0.0029747299849987,0.0523226372897625,0.947677362710238,0.0292555522173643,0.0292555522173643,0.0798269445464445,-0.0798269445464445,-0.709469509189724,0.709469509189724,0.0,-0.0086915120482444,0.0,-0.0086915120482444,0.087240718881801,-0.087240718881801,-0.822683861003234,0.822683861003234,0.087240718881801,-0.087240718881801,-0.818311636791541,0.818311636791541,0.0,0.0,0.0,0.0,0.0,0.0,0.0,0.0,0.0,0,0.0,0.0,0.0,0.0,0.0,0.0,0.0,0.0,0.0,0.0,0.0,0.0,0.0,0.0,1.0,0.0,0.0,0.0,0.0,0.0,0.0,0.0,0.0,1.0,0.0,0.0,0.0,0.0,0.0,0.0,0.0,0.0,0.0,0.0,0.0,1.0,0.0,0.0,0.0,0.0,0.0,00-0032436,J.Driskel,0.0,00-0035537,T.Johnson,0.0,,,,,,,,,,,,,,,,,,,,,,,,,,,,,,,,,,,,,,,,,,,,,,DAL,,00-0031411,,D.Lawrence,,,,,,,,,,,,,,0.0,,,,,,,,,,,,,,,,,,,,,,,,,,,,,,,,0.0,,,,,0,,,0.0,0.0,0.0,0.0,,,2019,0.89532607793808,10.467392206192,51,1,First down,3827,"11/17/19, 13:02:34",2019-11-17T20:49:25Z,Ford Field,"Temp: 68° F, Humidity: 70%, Wind: mph",10012019-1117-0226-72a2-66122e2d7a7a,0,0,PASS,0,,,,19,Touchdown,2019-11-17T20:45:15Z,5.0,2:07,3.0,0.0,1.0,4.0,4.0,0.0,KICKOFF,TOUCHDOWN,07:56,05:49,DET 25,DAL 25,3758.0,3907.0,35,27,Home,-8,62,-7.5,46.5,0,dome,fieldturf,,,Matt Patricia,Jason Garrett,DET00,Ford Field,0,0.0,J.Driskel,2.0,,,T.Johnson,31.0,1,0,0.0,0,1,00-0032436,,00-0035537,J.Driskel,2.0,00-0032436,T.Johnson,00-0035537,T.Johnson,00-0035537,0,0,-0.501043856027536,1.16764473329669,10.0498925682477,9.0,0.573011362517718,0.261414279753808,0.893868565559387,10.6131434440613,2019-11-17,D.Lawrence,2019,REG,DAL,11,00-0031411,DE,Demarcus Lawrence,Demarcus,Lawrence,,,,Neck,,Full Participation in Practice,2019-11-15T12:31:03Z,2019-11-15 12:31:03
3822,2019_12_DET_WAS,2019112407,WAS,DET,REG,12,WAS,home,DET,DET,32.0,2019-11-24,165.0,165.0,165.0,Half2,0,23.0,0,4,3.0,0,02:45,DET 32,1,54.0,(2:45) (Shotgun) 26-A.Peterson left guard to DET 30 for 2 yards (95-R.Okwara). DET-98-D.Harrison was injured during the play.,run,2.0,1,0,0.0,0,0,0,,,,,left,guard,,,,,3,3,0.0,,,,,3.0,3.0,13,16,13.0,16.0,-3.0,13.0,16.0,-3.0,0.230891212821007,0.0388898402452469,0.0002897653321269,0.0468978248536587,0.29342657327652,0.0016171087045222,0.387987673282623,0.0,0.0,3.15389382484136,0.38022355758585,-1.4405829301686,1.4405829301686,2.17171097616665,-2.17171097616665,-13.5452025215802,13.5452025215802,,,0.0,0.0,0.130022120370995,-0.130022120370995,-10.078478323139,10.078478323139,13.40740012069,-13.40740012069,-26.5854604906365,26.5854604906365,0.507096230983734,0.492903769016266,0.507096230983734,0.492903769016266,0.0213707685470581,0.0490888357162476,0.0490888357162476,0.528466999530792,0.471533000469208,0.393766671419144,0.393766671419144,0.109953597187996,-0.109953597187996,-0.365746792805271,0.365746792805271,,,0.0,0.0,0.034670814871788,-0.034670814871788,-0.26696407462366,0.26696407462366,0.01646588742733,-0.01646588742733,-0.472785141718463,0.472785141718463,0.0,1.0,0.0,0.0,1.0,0.0,0.0,0.0,0.0,0,0.0,0.0,0.0,0.0,0.0,0.0,0.0,0.0,0.0,0.0,0.0,0.0,0.0,0.0,1.0,0.0,0.0,0.0,0.0,0.0,0.0,0.0,1.0,0.0,0.0,0.0,0.0,0.0,0.0,0.0,0.0,0.0,0.0,0.0,0.0,0.0,0.0,0.0,0.0,0.0,0.0,,,,,,,00-0025394,A.Peterson,2.0,,,,,,,,,,,,,,,,,,,,,,,,,,,,,,,,,,,,,,,,,,,DET,,00-0032655,,R.Okwara,,,,,,,,,,,,,,0.0,,,,,,,,,,,,,,,,,,,,,,,,,,,,,,,,0.0,,,,,0,,,0.0,0.0,0.0,0.0,,,2019,,,51,1,First down,3822,"11/24/19, 13:02:27",2019-11-24T20:51:32Z,Commanders Field,"Sunny Temp: 46° F, Humidity: 56%, Wind: W 17 mph",10012019-1124-0734-a057-a88bc6063927,0,0,RUSH,0,,,,23,Field goal,2019-11-24T20:48:45Z,9.0,3:42,3.0,0.0,1.0,4.0,4.0,0.0,PUNT,FIELD_GOAL,05:31,01:49,WAS 22,DET 24,3719.0,3958.0,16,19,Home,3,35,-4.0,39.0,0,outdoors,grass,46.0,17.0,Bill Callahan,Matt Patricia,WAS00,FedExField,0,1.0,,,A.Peterson,26.0,,,0,1,1.0,0,1,,00-0025394,,A.Peterson,26.0,00-0025394,A.Peterson,00-0025394,A.Peterson,00-0025394,0,1,0.38022355758585,,,,,,0.255735397338867,-25.5735397338867,2019-11-24,D.Harrison,2019,REG,DET,12,00-0029040,DT,Damon Harrison,Damon,Harrison,,,,Not Injury Related,Resting Veteran,Limited Participation in Practice,2019-11-22T12:56:15Z,2019-11-22 12:56:15
3798,2019_04_DAL_NO,2019092912,NO,DAL,REG,4,NO,home,DAL,DAL,34.0,2019-09-29,116.0,116.0,116.0,Half2,0,17.0,0,4,2.0,0,01:56,DAL 34,11,15.0,"(1:56) 5-T.Bridgewater pass short right to 42-Z.Line to DAL 31 for 3 yards (25-X.Woods). DAL-25-X.Woods was injured during the play. His return is Probable. Pass 1, YAC 2",pass,3.0,0,0,1.0,0,0,0,short,right,1.0,2.0,,,,,,,2,2,0.0,,,,,2.0,2.0,12,10,12.0,10.0,2.0,12.0,10.0,2.0,0.243990018963814,0.041439987719059,0.0003020230215042,0.0337148606777191,0.375776827335358,0.0019266669405624,0.302849620580673,0.0,0.0,2.89020312600769,-0.556925536715426,3.79036810243072,-3.79036810243072,5.15413994376127,-5.15413994376127,-2.36475353522339,2.36475353522339,-0.290809510974214,-0.266116025741212,-0.290809510974214,-0.266116025741212,-6.66608606412774,6.66608606412774,8.81448049582601,-8.81448049582601,-3.69782635301817,3.69782635301817,7.4682441835798,-7.4682441835798,0.909700572490692,0.0902994275093079,0.909700572490692,0.0902994275093079,0.0054636001586914,-0.0153945088386536,-0.0153945088386536,0.915164172649384,0.0848358273506165,0.882230341434479,0.882230341434479,0.312077356183284,-0.312077356183284,0.124636560678482,-0.124636560678482,0.0107201933860779,-0.0052565932273864,0.0107201933860779,-0.0052565932273864,0.0665141642093658,-0.0665141642093658,0.0947388410568237,-0.0947388410568237,-0.76292210817337,0.76292210817337,1.03999021649361,-1.03999021649361,0.0,0.0,0.0,0.0,0.0,0.0,0.0,0.0,0.0,0,0.0,0.0,0.0,0.0,0.0,0.0,0.0,0.0,0.0,0.0,0.0,0.0,0.0,0.0,1.0,0.0,0.0,0.0,0.0,0.0,0.0,0.0,0.0,1.0,0.0,0.0,0.0,0.0,0.0,0.0,0.0,0.0,0.0,0.0,0.0,1.0,0.0,0.0,0.0,0.0,0.0,00-0031237,T.Bridgewater,3.0,00-0029931,Z.Line,3.0,,,,,,,,,,,,,,,,,,,,,,,,,,,,,,,,,,,,,,,,,,,,,,DAL,,00-0033579,,X.Woods,,,,,,,,,,,,,,0.0,,,,,,,,,,,,,,,,,,,,,,,,,,,,,,,,0.0,,,,,0,,,0.0,0.0,0.0,0.0,,,2019,0.833567142486572,16.6432857513428,46,0,Punt,3798,"9/29/19, 20:22:27",2019-09-30T03:06:17Z,Caesars Superdome,"Sunny Temp: 87° F, Humidity: 62%, Wind: E 10 mph",10012019-0929-1223-2cbe-bce487acff58,0,0,PASS,0,,,,17,Punt,2019-09-30T02:58:50Z,9.0,3:43,2.0,0.0,0.0,4.0,4.0,0.0,PUNT,PUNT,05:22,01:39,NO 38,DAL 47,3593.0,3883.0,10,12,Home,2,22,-2.5,47.0,0,dome,astroturf,,,Sean Payton,Jason Garrett,NOR00,Mercedes-Benz Superdome,0,0.0,T.Bridgewater,5.0,,,Z.Line,42.0,1,0,0.0,0,1,00-0031237,,00-0029931,T.Bridgewater,5.0,00-0031237,Z.Line,00-0029931,Z.Line,00-0029931,0,0,-0.556925536715426,0.643179100011615,6.00454236593214,5.0,0.52369339208235,0.194982966437237,0.350585103034973,64.9414896965027,2019-09-29,X.Woods,2019,REG,DAL,4,00-0033579,S,Xavier Woods,Xavier,Woods,,,,Ankle,,Full Participation in Practice,2019-09-27T11:55:14Z,2019-09-27 11:55:14
3734,2019_16_JAX_ATL,2019122205,ATL,JAX,REG,16,JAX,away,ATL,ATL,34.0,2019-12-22,387.0,387.0,387.0,Half2,0,21.0,0,4,3.0,0,06:27,ATL 34,10,60.0,(6:27) (Shotgun) 15-G.Minshew II scrambles left end to ATL 28 for 6 yards (44-V.Beasley). ATL-37-Ri.Allen was injured during the play.,run,6.0,1,0,1.0,0,0,1,,,,,left,end,,,,,3,3,0.0,,,,,3.0,3.0,24,12,12.0,24.0,-12.0,12.0,24.0,-12.0,0.0932078436017036,0.0560817308723927,0.0005695665022358,0.110109932720661,0.411510825157166,0.0014252240071073,0.327094852924347,0.0,0.0,2.58689303928986,-0.444272939988878,8.23912478742213,-8.23912478742213,1.71611619657548,-1.71611619657548,7.88802165263873,-7.88802165263873,,,0.0,0.0,14.4563617050007,-14.4563617050007,-6.34427007103543,6.34427007103543,12.115030046145,-12.115030046145,-6.57877416078438,6.57877416078438,0.0693546980619431,0.930645301938057,0.930645301938057,0.0693546980619431,-0.0273627564311028,-0.0167291834950447,0.0167291834950447,0.95800805836916,0.0419919416308403,0.0478401631116867,0.952159836888313,0.113004446628688,-0.113004446628688,0.234734417870641,-0.234734417870641,,,0.0,0.0,-0.709650631994009,0.709650631994009,0.89401631949842,-0.89401631949842,-0.706822101026774,0.706822101026774,0.88330010099709,-0.88330010099709,0.0,0.0,0.0,0.0,0.0,1.0,0.0,0.0,0.0,0,0.0,0.0,0.0,0.0,0.0,0.0,0.0,0.0,0.0,0.0,0.0,0.0,0.0,0.0,1.0,0.0,0.0,0.0,0.0,0.0,0.0,0.0,1.0,0.0,0.0,0.0,0.0,0.0,0.0,0.0,0.0,0.0,0.0,0.0,0.0,0.0,0.0,0.0,0.0,0.0,0.0,,,,,,,00-0035289,G.Minshew II,6.0,,,,,,,,,,,,,,,,,,,,,,,,,,,,,,,,,,,,,,,,,,,ATL,,00-0032240,,V.Beasley,,,,,,,,,,,,,,0.0,,,,,,,,,,,,,,,,,,,,,,,,,,,,,,,,0.0,,,,,0,,,0.0,0.0,0.0,0.0,,,2019,,,56,1,First down,3734,"12/22/19, 13:02:38",2019-12-22T20:43:09Z,Mercedes-Benz Stadium,"Temp: ° F, Wind: mph",10012019-1222-05af-f464-c9bb6467d147,0,0,RUSH,0,,,,20,Turnover on downs,2019-12-22T20:37:09Z,15.0,3:53,3.0,1.0,0.0,4.0,4.0,0.0,PUNT,DOWNS,08:23,04:30,JAX 33,ATL 7,3516.0,3845.0,12,24,Home,12,36,7.5,48.0,0,closed,fieldturf,,,Dan Quinn,Doug Marrone,ATL97,Mercedes-Benz Stadium,0,0.0,G.Minshew II,15.0,,15.0,,,1,0,0.0,0,1,00-0035289,,,G.Minshew II,15.0,00-0035289,G.Minshew II,00-0035289,G.Minshew II,00-0035289,0,1,-0.444272939988878,,,,,,0.981304526329041,1.86954736709595,2019-12-22,Ri.Allen,2019,REG,ATL,16,00-0031181,S,Ricardo Allen,Ricardo,Allen,,,,Shoulder,,Limited Participation in Practice,2019-12-20T11:50:20Z,2019-12-20 11:50:20
3723,2019_13_NE_HOU,2019120111,HOU,NE,REG,13,NE,away,HOU,HOU,40.0,2019-12-01,346.0,346.0,346.0,Half2,0,18.0,0,4,1.0,0,05:46,HOU 40,10,75.0,(5:46) (Shotgun) 12-T.Brady pass short middle to 28-J.White to HOU 21 for 19 yards (20-J.Reid; 28-V.Hargreaves). HOU-20-J.Reid was injured during the play.,pass,19.0,1,0,1.0,0,0,0,short,middle,6.0,13.0,,,,,,,3,3,0.0,,,,,3.0,3.0,28,9,9.0,28.0,-19.0,9.0,28.0,-19.0,0.127451166510582,0.0455437935888767,0.0005942582502029,0.0682863146066666,0.29126301407814,0.0028872552793473,0.463974207639694,0.0,0.0,3.51155890675727,1.11396826512646,15.7239974530656,-15.7239974530656,-5.91524126986042,5.91524126986042,20.2159758480742,-20.2159758480742,0.199618999147788,0.914349265978672,0.199618999147788,0.914349265978672,0.309069903742056,-0.309069903742056,4.22280664381105,-4.22280664381105,-17.73974318619,17.73974318619,37.1470479323365,-37.1470479323365,0.0021570392418652,0.997842960758135,0.997842960758135,0.0021570392418652,7.38082453608513e-05,5.36988954991102e-05,-5.36988954991102e-05,0.997769152512774,0.0022308474872261,0.0026062661781907,0.997393733821809,-0.117995400214568,0.117995400214568,0.543391130172367,-0.543391130172367,0.0,7.38082453608513e-05,0.0,7.38082453608513e-05,0.0515710578457722,-0.0515710578457722,0.19782342812025,-0.19782342812025,0.0506510303513417,-0.0506510303513417,0.53676239451372,-0.53676239451372,0.0,0.0,1.0,0.0,0.0,0.0,0.0,0.0,0.0,0,0.0,0.0,0.0,0.0,0.0,0.0,0.0,0.0,0.0,0.0,0.0,0.0,0.0,0.0,0.0,0.0,0.0,0.0,0.0,0.0,0.0,0.0,0.0,1.0,0.0,0.0,0.0,0.0,0.0,0.0,0.0,0.0,0.0,0.0,0.0,1.0,1.0,0.0,0.0,0.0,0.0,00-0019596,T.Brady,19.0,00-0031062,J.White,19.0,,,,,,,,,,,,,,,,,,,,,,,,,,,,,,,,,,,,,,,,,,,,,,,,,,,,00-0034361,J.Reid,HOU,00-0032758,V.Hargreaves,HOU,,,,,,,0.0,,,,,,,,,,,,,,,,,,,,,,,,,,,,,,,,0.0,,,,,0,,,0.0,0.0,0.0,0.0,,,2019,0.802927911281586,19.7072088718414,50,1,First down,3723,"12/1/19, 20:22:31",2019-12-02T04:07:29Z,NRG Stadium,"Clear Temp: 60° F, Humidity: 32%, Wind: nw 4mph mph",10012019-1201-1138-3058-f960f3efb989,0,0,PASS,0,,,,18,Touchdown,2019-12-02T04:01:43Z,13.0,6:11,6.0,1.0,1.0,4.0,4.0,12.0,KICKOFF,TOUCHDOWN,09:53,03:42,NE 25,HOU 11,3521.0,3936.0,22,28,Home,6,50,-3.5,47.0,0,closed,grass,,,Bill O'Brien,Bill Belichick,HOU00,NRG Stadium,0,1.0,T.Brady,12.0,,,J.White,28.0,1,0,1.0,0,1,00-0019596,,00-0031062,T.Brady,12.0,00-0019596,J.White,00-0031062,J.White,00-0031062,0,1,1.11396826512646,0.409866714287549,4.38641213678056,3.0,0.995578357513295,0.397495905432152,0.886451661586762,11.3548338413239,2019-12-01,J.Reid,2019,REG,HOU,13,00-0034361,S,Justin Reid,Justin,Reid,,,,Concussion,,Full Participation in Practice,2019-11-29T13:13:04Z,2019-11-29 13:13:04
3710,2019_16_GB_MIN,2019122300,MIN,GB,REG,16,GB,away,MIN,GB,74.0,2019-12-23,209.0,209.0,209.0,Half2,0,25.0,0,4,2.0,0,03:29,GB 26,6,8.0,(3:29) 33-A.Jones up the middle to GB 26 for no gain (98-L.Joseph). MIN-93-S.Stephen was injured during the play.,run,0.0,0,0,0.0,0,0,0,,,,,middle,,,,,,1,1,0.0,,,,,1.0,1.0,10,23,23.0,10.0,13.0,23.0,10.0,13.0,0.45215630531311,0.0834693312644959,0.0012450102949515,0.117927320301533,0.124043978750706,0.0013799235457554,0.219778180122376,0.0,0.0,0.834949787706137,-0.754623033106327,-16.9020839076694,16.9020839076694,-10.0184659578372,10.0184659578372,-2.35395119488079,2.35395119488079,,,0.0,0.0,5.63149557088036,-5.63149557088036,-1.80700470897136,1.80700470897136,-4.4839118536911,4.4839118536911,5.56020360470164,-5.56020360470164,0.993174016475677,0.0068259835243225,0.0068259835243225,0.993174016475677,-1.66893005371094e-05,0.0005906224250793,-0.0005906224250793,0.0068426728248596,0.99315732717514,0.992704510688782,0.0072954893112182,-0.376700602422582,0.376700602422582,-0.312662460935312,0.312662460935312,,,0.0,0.0,-0.0250010224850947,0.0250010224850947,-0.0932722128927708,0.0932722128927708,-0.0443298551114375,0.0443298551114375,-0.175236145034432,0.175236145034432,0.0,0.0,0.0,0.0,0.0,0.0,0.0,0.0,0.0,0,0.0,0.0,0.0,0.0,0.0,0.0,0.0,0.0,0.0,0.0,0.0,0.0,0.0,0.0,1.0,0.0,0.0,0.0,0.0,0.0,0.0,0.0,1.0,0.0,0.0,0.0,0.0,0.0,0.0,0.0,0.0,0.0,0.0,0.0,0.0,0.0,0.0,0.0,0.0,0.0,0.0,,,,,,,00-0033293,A.Jones,0.0,,,,,,,,,,,,,,,,,,,,,,,,,,,,,,,,,,,,,,,,,,,MIN,,00-0027885,,L.Joseph,,,,,,,,,,,,,,0.0,,,,,,,,,,,,,,,,,,,,,,,,,,,,,,,,0.0,,,,,0,,,0.0,0.0,0.0,0.0,,,2019,,,51,0,Punt,3710,"12/23/19, 20:15:37",2019-12-24T04:10:37Z,U.S. Bank Stadium,N/A (Indoors) Temp: Humidity: Wind: mph,10012019-1223-00df-8cfc-7d3eaac20349,0,0,RUSH,0,,,,25,Punt,2019-12-24T04:09:24Z,3.0,1:03,0.0,0.0,0.0,4.0,4.0,0.0,PUNT,PUNT,03:34,02:31,GB 22,GB 30,3689.0,3779.0,23,10,Home,-13,33,4.0,47.0,1,dome,sportturf,,,Mike Zimmer,Matt LaFleur,MIN01,U.S. Bank Stadium,0,0.0,,,A.Jones,33.0,,,0,1,0.0,0,1,,00-0033293,,A.Jones,33.0,00-0033293,A.Jones,00-0033293,A.Jones,00-0033293,0,0,-0.754623033106327,,,,,,0.113834448158741,-11.3834448158741,2019-12-23,S.Stephen,2019,REG,MIN,16,00-0031242,DT,Shamar Stephen,Shamar,Stephen,,,,Knee,,Full Participation in Practice,2019-12-21T10:42:13Z,2019-12-21 10:42:13
3693,2019_03_NO_SEA,2019092211,SEA,NO,REG,3,NO,away,SEA,SEA,1.0,2019-09-22,262.0,262.0,262.0,Half2,0,19.0,1,4,1.0,1,04:22,SEA 1,1,28.0,"(4:22) 64-W.Clapp reported in as eligible. 41-A.Kamara left guard for 1 yard, TOUCHDOWN. SEA-50-K.Wright was injured during the play.",run,1.0,0,0,0.0,0,0,0,,,,,left,guard,,,,,1,0,0.0,,NO,A.Kamara,00-0033906,0.0,1.0,14,33,27.0,14.0,13.0,33.0,14.0,19.0,0.04989243298769,0.0032047952990979,0.0001409208634868,0.0072297500446438,0.0549646206200123,0.0011743590002879,0.883393108844757,0.0,0.0,6.29048986383714,0.709510136162862,-23.3339315984933,23.3339315984933,-13.6220559014182,13.6220559014182,-8.15062464444782,8.15062464444782,,,0.0,0.0,18.5127309956006,-18.5127309956006,-18.8359648658952,18.8359648658952,35.6962768497178,-35.6962768497178,-43.8469014941657,43.8469014941657,0.997843146324158,0.0021568536758422,0.0021568536758422,0.997843146324158,0.0003215413173893,0.0015287552535883,-0.0015287552535883,0.0018353123584529,0.998164687641547,0.997746050357819,0.0022539496421814,-0.454188975017939,0.454188975017939,-0.0471720721038474,0.0471720721038474,,,0.0,0.0,0.825080331699412,-0.825080331699412,-0.883451335176915,0.883451335176915,0.825553996772926,-0.825553996772926,-0.872726068876773,0.872726068876773,0.0,1.0,0.0,0.0,0.0,0.0,0.0,0.0,0.0,0,0.0,0.0,0.0,0.0,0.0,0.0,0.0,0.0,0.0,0.0,0.0,0.0,0.0,0.0,0.0,0.0,0.0,0.0,0.0,0.0,0.0,0.0,1.0,0.0,0.0,1.0,0.0,1.0,0.0,0.0,0.0,0.0,0.0,0.0,0.0,0.0,0.0,0.0,0.0,0.0,0.0,,,,,,,00-0033906,A.Kamara,1.0,,,,,,,,,,,,,,,,,,,,,,,,,,,,,,,,,,,,,,,,,,,,,,,,,,,,,,,,,,,,,0.0,,,,,,,,,,,,,,,,,,,,,,,,,,,,,,,,0.0,,,,,0,,,0.0,0.0,0.0,0.0,,,2019,,,43,1,Touchdown,3693,"9/22/19, 16:25:23",2019-09-22T23:07:04Z,Lumen Field,"Rain Temp: 63° F, Humidity: 85%, Wind: 8 SSE mph",10012019-0922-1177-99e9-4e2b6960d820,0,0,RUSH,0,,,,19,Touchdown,2019-09-22T22:59:40Z,8.0,5:22,4.0,1.0,1.0,4.0,4.0,3.0,DOWNS,TOUCHDOWN,09:41,04:19,SEA 28,SEA 1,3438.0,3721.0,33,27,Home,-6,60,5.0,44.0,0,outdoors,fieldturf,63.0,8.0,Pete Carroll,Sean Payton,SEA00,CenturyLink Field,0,1.0,,,A.Kamara,41.0,,,0,1,1.0,0,1,,00-0033906,,A.Kamara,41.0,00-0033906,A.Kamara,00-0033906,A.Kamara,00-0033906,0,1,0.709510136162862,,,,,,0.0511050373315811,-5.11050373315811,2019-09-22,K.Wright,2019,REG,SEA,3,00-0028037,LB,K.J. Wright,K.J.,Wright,,,,Not Injury Related,,Full Participation in Practice,2019-09-20T15:52:18Z,2019-09-20 15:52:18
3676,2019_15_DEN_KC,2019121504,KC,DEN,REG,15,KC,home,DEN,KC,58.0,2019-12-15,200.0,200.0,200.0,Half2,0,17.0,0,4,3.0,0,03:20,KC 42,1,24.0,(3:20) 39-S.Ware right guard to KC 45 for 3 yards (45-A.Johnson). KC-77-A.Wylie was injured during the play.,run,3.0,0,0,0.0,0,0,0,,,,,right,guard,,,,,3,1,0.0,,,,,3.0,1.0,23,3,23.0,3.0,20.0,23.0,3.0,20.0,0.467458605766296,0.0581508502364159,0.0005847563734278,0.0916992872953415,0.160181805491447,0.0032475746702402,0.218677088618279,0.0,0.0,1.20026311161928,0.334265898272861,23.2197417686987,-23.2197417686987,1.0714036168647,-1.0714036168647,21.8401973142117,-21.8401973142117,,,0.0,0.0,17.444394905353,-17.444394905353,-11.2303334248136,11.2303334248136,9.12251701080822,-9.12251701080822,13.2047297413458,-13.2047297413458,0.999539852142334,0.000460147857666,0.999539852142334,0.000460147857666,0.0001671910285949,3.67164611816406e-05,3.67164611816406e-05,0.999707043170929,0.000292956829071,0.999833941459656,0.999833941459656,0.0575932781212032,-0.0575932781212032,0.359994008438662,-0.359994008438662,,,0.0,0.0,0.0276927649974823,-0.0276927649974823,0.24089319108706,-0.24089319108706,-0.712053968338296,0.712053968338296,1.06606521120947,-1.06606521120947,0.0,1.0,0.0,0.0,1.0,0.0,0.0,0.0,0.0,0,0.0,0.0,0.0,0.0,0.0,0.0,0.0,0.0,0.0,0.0,0.0,0.0,0.0,0.0,1.0,0.0,0.0,0.0,0.0,0.0,0.0,0.0,1.0,0.0,0.0,0.0,0.0,0.0,0.0,0.0,0.0,0.0,0.0,0.0,0.0,0.0,0.0,0.0,0.0,0.0,0.0,,,,,,,00-0030414,S.Ware,3.0,,,,,,,,,,,,,,,,,,,,,,,,,,,,,,,,,,,,,,,,,,,DEN,,00-0034887,,A.Johnson,,,,,,,,,,,,,,0.0,,,,,,,,,,,,,,,,,,,,,,,,,,,,,,,,0.0,,,,,0,,,0.0,0.0,0.0,0.0,,,2019,,,55,1,First down,3676,"12/15/19, 13:02:34",2019-12-15T20:51:05Z,GEHA Field at Arrowhead Stadium,"Snow Temp: 24° F, Humidity: 88%, Wind: East 8 mph",10012019-1215-048d-a422-8adafc03ed03,0,0,RUSH,0,,,,17,End of half,2019-12-15T20:49:38Z,7.0,4:47,2.0,0.0,0.0,4.0,4.0,0.0,DOWNS,END_GAME,04:47,00:00,KC 33,DEN 42,3628.0,3801.0,3,23,Home,20,26,10.0,43.0,1,outdoors,astroturf,24.0,8.0,Andy Reid,Vic Fangio,KAN00,Arrowhead Stadium,0,1.0,,,S.Ware,39.0,,,0,1,1.0,0,1,,00-0030414,,S.Ware,39.0,00-0030414,S.Ware,00-0030414,S.Ware,00-0030414,0,0,0.334265898272861,,,,,,0.126479923725128,-12.6479923725128,2019-12-15,A.Wylie,2019,REG,KC,15,00-0033831,G,Andrew Wylie,Andrew,Wylie,,,,Shoulder,,Full Participation in Practice,2019-12-13T12:21:17Z,2019-12-13 12:21:17
3661,2019_05_BAL_PIT,2019100607,PIT,BAL,REG,5,BAL,away,PIT,BAL,99.0,2019-10-06,434.0,434.0,434.0,Half2,0,18.0,0,4,1.0,0,07:14,BAL 1,10,0.0,(7:14) (Shotgun) 8-L.Jackson pass incomplete short left to 89-M.Andrews (39-M.Fitzpatrick). BAL-89-M.Andrews was injured during the play.,pass,0.0,1,0,1.0,0,0,0,short,left,7.0,,,,,,,,3,2,0.0,,,,,2.0,3.0,20,20,20.0,20.0,0.0,20.0,20.0,0.0,0.250058621168137,0.167954087257385,0.0481872260570526,0.260764986276627,0.0963221192359924,0.0010821354808285,0.175630792975426,0.0,0.0,-0.905045438325033,-0.444181169383228,-2.74778251023963,2.74778251023963,-4.41160240763566,4.41160240763566,4.08011284149527,-4.08011284149527,0.593864113092423,-1.03804528247565,0.0,0.0,-2.17685176152736,2.17685176152736,2.84139640972407,-2.84139640972407,-3.10389333433704,3.10389333433704,5.33902872317066,-5.33902872317066,0.419550567865372,0.580449432134628,0.580449432134628,0.419550567865372,-0.0233814418315887,-0.0358412861824036,0.0358412861824036,0.603830873966217,0.396169126033783,0.52347195148468,0.47652804851532,-0.246135721963194,0.246135721963194,0.0889575868422865,-0.0889575868422865,0.0,-0.0233814418315887,0.0,0.0,-0.135060628552223,0.135060628552223,0.204840167618287,-0.204840167618287,-0.129707833428169,0.129707833428169,0.211100830889237,-0.211100830889237,0.0,0.0,0.0,0.0,0.0,0.0,0.0,0.0,1.0,0,0.0,0.0,0.0,0.0,0.0,0.0,0.0,0.0,0.0,0.0,0.0,0.0,0.0,0.0,0.0,0.0,0.0,0.0,0.0,0.0,0.0,0.0,0.0,1.0,0.0,0.0,0.0,0.0,0.0,0.0,0.0,0.0,0.0,0.0,0.0,0.0,0.0,0.0,0.0,0.0,0.0,00-0034796,L.Jackson,,00-0034753,M.Andrews,,,,,,,,,,,,,,,,,,,,,,,,,,,,,,,,,,,,,,,,,,,,,,,,,,,,,,,,,,,,,,,,,0.0,,,,,,,00-0034789,M.Fitzpatrick,,,,,,,,,,,,,,,,,,,,,,,,0.0,,,,,0,,,0.0,0.0,0.0,0.0,,,2019,0.694131135940552,-69.4131135940552,48,0,Punt,3661,"10/6/19, 13:02:25",2019-10-06T19:48:45Z,Acrisure Stadium,"Rain Temp: 70° F, Humidity: 74%, Wind: From SW 7 mph",10012019-1006-076f-1eeb-14131d4217b1,0,0,PASS,0,,,,18,Punt,2019-10-06T19:48:45Z,3.0,1:09,0.0,0.0,0.0,4.0,4.0,0.0,PUNT,PUNT,07:14,06:05,BAL 1,BAL 1,3661.0,3739.0,26,23,Home,-3,49,-3.5,44.0,1,outdoors,grass,70.0,7.0,Mike Tomlin,John Harbaugh,PIT00,Heinz Field,0,0.0,L.Jackson,8.0,,,M.Andrews,89.0,1,0,0.0,0,1,00-0034796,,00-0034753,L.Jackson,8.0,00-0034796,M.Andrews,00-0034753,M.Andrews,00-0034753,0,1,-0.444181169383228,0.294706029642619,3.80145930325671,2.0,0.999303241551388,0.431330823223107,0.414178133010864,58.5821866989136,2019-10-06,M.Andrews,2019,REG,BAL,5,00-0034753,TE,Mark Andrews,Mark,Andrews,,,,Foot,,Full Participation in Practice,2019-10-04T11:57:55Z,2019-10-04 11:57:55
3657,2019_10_SEA_SF,2019111100,SF,SEA,REG,10,SF,home,SEA,SEA,23.0,2019-11-11,461.0,461.0,461.0,Half2,0,23.0,0,4,1.0,0,07:41,SEA 23,10,48.0,(7:41) 31-R.Mostert left guard to SEA 16 for 7 yards (54-B.Wagner; 37-Q.Diggs). SEA-50-K.Wright was injured during the play.,run,7.0,0,0,0.0,0,0,0,,,,,left,guard,,,,,3,1,0.0,,,,,3.0,1.0,18,21,18.0,21.0,-3.0,18.0,21.0,-3.0,0.0634472146630287,0.0236412696540356,0.0008417484350502,0.0352814607322216,0.397592186927795,0.0008295388543047,0.478366553783417,0.0,0.0,4.22342398401815,0.342899473616853,-0.500103485582299,0.500103485582299,-3.64407320506871,3.64407320506871,-1.98069835575924,1.98069835575924,,,0.0,0.0,-1.95481458673021,1.95481458673021,13.2329221104737,-13.2329221104737,9.41291051730514,-9.41291051730514,-12.5148446765763,12.5148446765763,0.599049866199493,0.400950133800507,0.599049866199493,0.400950133800507,-0.0012659430503845,0.0314323902130127,0.0314323902130127,0.597783923149109,0.402216076850891,0.628650486469269,0.628650486469269,-0.140932217906133,0.140932217906133,0.181923273000558,-0.181923273000558,,,0.0,0.0,-0.080852738343528,0.080852738343528,0.630580845200115,-0.630580845200115,-0.080852738343528,0.080852738343528,0.157060707830482,-0.157060707830482,0.0,0.0,0.0,0.0,0.0,0.0,0.0,0.0,0.0,0,0.0,0.0,0.0,0.0,0.0,0.0,0.0,0.0,0.0,0.0,0.0,0.0,0.0,0.0,0.0,0.0,0.0,0.0,0.0,0.0,0.0,0.0,1.0,0.0,0.0,0.0,0.0,0.0,0.0,0.0,0.0,0.0,0.0,0.0,0.0,0.0,1.0,0.0,0.0,0.0,0.0,,,,,,,00-0031687,R.Mostert,7.0,,,,,,,,,,,,,,,,,,,,,,,,,,,,,,,,,,,,,,,,,,,,,,,,,00-0029255,B.Wagner,SEA,00-0031608,Q.Diggs,SEA,,,,,,,0.0,,,,,,,,,,,,,,,,,,,,,,,,,,,,,,,,0.0,,,,,0,,,0.0,0.0,0.0,0.0,,,2019,,,48,0,Field goal,3657,"11/11/19, 20:15:48",2019-11-12T04:01:13Z,Levi's® Stadium,"Mostly clear Temp: 77° F, Humidity: 32%, Wind: Southerly 3 mph",10012019-1111-0041-ddf7-ecc1c7e98a82,0,0,RUSH,0,,,,23,Field goal,2019-11-12T03:58:32Z,8.0,4:05,2.0,1.0,1.0,4.0,4.0,0.0,PUNT,FIELD_GOAL,10:22,06:17,SF 31,SEA 21,3563.0,3727.0,27,24,Home,-3,51,6.5,47.0,1,outdoors,grass,77.0,3.0,Kyle Shanahan,Pete Carroll,SFO01,Levi's Stadium,0,1.0,,,R.Mostert,31.0,,,0,1,0.0,0,1,,00-0031687,,R.Mostert,31.0,00-0031687,R.Mostert,00-0031687,R.Mostert,00-0031687,0,1,0.342899473616853,,,,,,0.497345834970474,-49.7345834970474,2019-11-11,K.Wright,2019,REG,SEA,10,00-0028037,LB,K.J. Wright,K.J.,Wright,,,,Knee,,Full Participation in Practice,2019-11-09T14:42:00Z,2019-11-09 14:42:00
3656,2019_04_CAR_HOU,2019092904,HOU,CAR,REG,4,HOU,home,CAR,HOU,79.0,2019-09-29,343.0,343.0,343.0,Half2,0,21.0,0,4,1.0,0,05:43,HOU 21,10,23.0,(5:43) 25-D.Johnson left tackle to HOU 22 for 1 yard (77-K.Love). CAR-93-G.McCoy was injured during the play. His return is Questionable.,run,1.0,0,0,0.0,0,0,0,,,,,left,tackle,,,,,1,2,0.0,,,,,1.0,2.0,10,13,10.0,13.0,-3.0,10.0,13.0,-3.0,0.280714303255081,0.1101428642869,0.0017767730168998,0.163389831781387,0.174874246120453,0.0030995716806501,0.266002416610718,0.0,0.0,0.915127836633474,-0.516507207648829,-5.06774526403751,5.06774526403751,10.103850151479,-10.103850151479,-10.551243372426,10.551243372426,,,0.0,0.0,0.62959011743078,-0.62959011743078,-17.9023899670574,17.9023899670574,-2.96282334270654,2.96282334270654,-18.6105637393674,18.6105637393674,0.386201769113541,0.613798230886459,0.386201769113541,0.613798230886459,-0.0272454023361206,-0.0305172502994537,-0.0305172502994537,0.35895636677742,0.64104363322258,0.392624288797379,0.392624288797379,0.42672219481999,-0.42672219481999,-0.45806235074997,0.45806235074997,,,0.0,0.0,-0.490071326494217,0.490071326494217,-0.171057432889938,0.171057432889938,-0.488874942064285,0.488874942064285,-0.271682441234589,0.271682441234589,0.0,0.0,0.0,0.0,0.0,0.0,0.0,0.0,0.0,0,0.0,0.0,0.0,0.0,0.0,0.0,0.0,0.0,0.0,0.0,0.0,0.0,0.0,0.0,1.0,0.0,0.0,0.0,0.0,0.0,0.0,0.0,1.0,0.0,0.0,0.0,0.0,0.0,0.0,0.0,0.0,0.0,0.0,0.0,0.0,0.0,0.0,0.0,0.0,0.0,0.0,,,,,,,00-0032257,D.Johnson,1.0,,,,,,,,,,,,,,,,,,,,,,,,,,,,,,,,,,,,,,,,,,,CAR,,00-0027236,,K.Love,,,,,,,,,,,,,,0.0,,,,,,,,,,,,,,,,,,,,,,,,,,,,,,,,0.0,,,,,0,,,0.0,0.0,0.0,0.0,,,2019,,,52,1,First down,3656,"9/29/19, 13:02:39",2019-09-29T19:48:56Z,NRG Stadium,"Mostly Cloudy Temp: 89° F, Humidity: 61%, Wind: SE 6mph mph",10012019-0929-0458-fe28-11860c9f695b,0,0,RUSH,0,,,,21,Turnover,2019-09-29T19:46:53Z,6.0,2:58,2.0,0.0,0.0,4.0,4.0,5.0,PUNT,FUMBLE,07:03,04:05,HOU 10,HOU 36,3571.0,3748.0,16,10,Home,-6,26,5.5,47.5,0,closed,grass,,,Bill O'Brien,Ron Rivera,HOU00,NRG Stadium,0,0.0,,,D.Johnson,25.0,,,0,1,0.0,0,1,,00-0032257,,D.Johnson,25.0,00-0032257,D.Johnson,00-0032257,D.Johnson,00-0032257,0,0,-0.516507207648829,,,,,,0.697312653064728,-69.7312653064728,2019-09-29,G.McCoy,2019,REG,CAR,4,00-0027856,DT,Gerald McCoy,Gerald,McCoy,,,,Knee,,Full Participation in Practice,2019-09-27T11:31:38Z,2019-09-27 11:31:38
3647,2019_16_CIN_MIA,2019122208,MIA,CIN,REG,16,CIN,away,MIA,CIN,55.0,2019-12-22,630.0,630.0,630.0,Half2,0,22.0,0,4,1.0,0,10:30,CIN 45,10,72.0,(10:30) (Shotgun) 28-J.Mixon up the middle to CIN 47 for 2 yards (55-J.Baker). MIA-47-V.Biegel was injured during the play. His return is Questionable.,run,2.0,1,0,0.0,0,0,0,,,,,middle,,,,,,3,3,0.0,,,,,3.0,3.0,35,12,12.0,35.0,-23.0,12.0,35.0,-23.0,0.0936865881085396,0.0958513543009758,0.0014376239851117,0.153890684247017,0.242949604988098,0.0034824195317924,0.408701747655869,0.0,0.0,2.22906178701669,-0.373995553934947,23.434381146423,-23.434381146423,6.96511946869126,-6.96511946869126,17.4944560504663,-17.4944560504663,,,0.0,0.0,6.69090676636552,-6.69090676636552,4.9005486072565,-4.9005486072565,-1.13695683228434,1.13695683228434,10.6869169616548,-10.6869169616548,0.0020455857738852,0.997954414226115,0.997954414226115,0.0020455857738852,-0.0005077857058495,-0.0003779849503189,0.0003779849503189,0.998462199931964,0.0015378000680357,0.0020048143342137,0.997995185665786,0.09115550531082,-0.09115550531082,0.358105658688337,-0.358105658688337,,,0.0,0.0,0.148856739397311,-0.148856739397311,0.249480902583875,-0.249480902583875,0.148856739397311,-0.148856739397311,0.147257987310715,-0.147257987310715,0.0,0.0,0.0,0.0,0.0,0.0,0.0,0.0,0.0,0,0.0,0.0,0.0,0.0,0.0,0.0,0.0,0.0,0.0,0.0,0.0,0.0,0.0,0.0,1.0,0.0,0.0,0.0,0.0,0.0,0.0,0.0,1.0,0.0,0.0,0.0,0.0,0.0,0.0,0.0,0.0,0.0,0.0,0.0,0.0,0.0,0.0,0.0,0.0,0.0,0.0,,,,,,,00-0033897,J.Mixon,2.0,,,,,,,,,,,,,,,,,,,,,,,,,,,,,,,,,,,,,,,,,,,MIA,,00-0034797,,J.Baker,,,,,,,,,,,,,,0.0,,,,,,,,,,,,,,,,,,,,,,,,,,,,,,,,0.0,,,,,0,,,0.0,0.0,0.0,0.0,,,2019,,,51,1,First down,3647,"12/22/19, 13:02:47",2019-12-22T20:45:51Z,Hard Rock Stadium,"Cloudy Temp: 76° F, Humidity: 68%, Wind: ESE 15 mph",10012019-1222-08d2-52d3-0a67bb8e3004,0,0,RUSH,0,,,,22,Touchdown,2019-12-22T20:44:20Z,10.0,5:01,5.0,1.0,1.0,4.0,4.0,-5.0,KICKOFF,TOUCHDOWN,11:12,06:11,CIN 28,MIA 8,3596.0,3884.0,35,38,Home,3,73,-1.5,46.0,0,outdoors,grass,76.0,15.0,Brian Flores,Zac Taylor,MIA00,Hard Rock Stadium,0,0.0,,,J.Mixon,28.0,,,0,1,0.0,0,1,,00-0033897,,J.Mixon,28.0,00-0033897,J.Mixon,00-0033897,J.Mixon,00-0033897,0,1,-0.373995553934947,,,,,,0.781111776828766,-78.1111776828766,2019-12-22,V.Biegel,2019,REG,MIA,16,00-0033939,LB,Vince Biegel,Vince,Biegel,,,,Achilles,,Full Participation in Practice,2019-12-20T11:28:42Z,2019-12-20 11:28:42
3534,2019_03_DEN_GB,2019092202,GB,DEN,REG,3,DEN,away,GB,DEN,60.0,2019-09-22,213.0,213.0,213.0,Half2,0,20.0,0,4,3.0,0,03:33,DEN 40,14,18.0,(3:33) (Shotgun) 5-J.Flacco pass short left to 87-N.Fant to GB 44 for 16 yards (23-J.Alexander). GB-55-Z.Smith was injured during the play.,pass,16.0,1,0,1.0,0,0,0,short,left,5.0,11.0,,,,,,,3,2,0.0,,,,,2.0,3.0,27,16,16.0,27.0,-11.0,16.0,27.0,-11.0,0.420019268989563,0.106576323509216,0.0007711990620009,0.167372643947601,0.130014464259148,0.0054570361971855,0.169789060950279,0.0,0.0,0.0966010155389085,2.43514963361667,8.74517990769581,-8.74517990769581,-1.36338668409735,1.36338668409735,12.3591257519175,-12.3591257519175,-0.720372821902856,3.15552245551953,-0.720372821902856,3.15552245551953,9.11369523225585,-9.11369523225585,-4.11912791703484,4.11912791703484,12.102715886489,-12.102715886489,-9.96894580350679,9.96894580350679,0.0344674475491047,0.965532552450895,0.965532552450895,0.0344674475491047,0.0186311416327953,0.018360884860158,-0.018360884860158,0.9469014108181,0.0530985891819,0.0229572486132383,0.977042751386762,-0.0718497452719149,0.0718497452719149,0.457633636998967,-0.457633636998967,0.0,0.0186311416327953,0.0,0.0186311416327953,0.264047790425853,-0.264047790425853,-0.0060624703764915,0.0060624703764915,0.2623973080097,-0.2623973080097,-0.0907821618020535,0.0907821618020535,0.0,0.0,1.0,0.0,1.0,0.0,0.0,0.0,0.0,0,0.0,0.0,0.0,0.0,0.0,0.0,0.0,0.0,0.0,0.0,0.0,0.0,0.0,0.0,1.0,0.0,0.0,0.0,0.0,0.0,0.0,0.0,0.0,1.0,0.0,0.0,0.0,0.0,0.0,0.0,0.0,0.0,0.0,0.0,0.0,1.0,0.0,0.0,0.0,0.0,0.0,00-0026158,J.Flacco,16.0,00-0035644,N.Fant,16.0,,,,,,,,,,,,,,,,,,,,,,,,,,,,,,,,,,,,,,,,,,,,,,GB,,00-0034728,,J.Alexander,,,,,,,,,,,,,,0.0,,,,,,,,,,,,,,,,,,,,,,,,,,,,,,,,0.0,,,,,0,,,0.0,0.0,0.0,0.0,,,2019,0.740385353565216,25.9614646434784,47,1,First down,3534,"9/22/19, 13:02:21",2019-09-22T19:43:07Z,Lambeau Field,"Rain Temp: 69° F, Humidity: 93%, Wind: S-SW 7 mph",10012019-0922-027c-e869-ef2299bb2f8a,0,0,PASS,0,,,,20,Turnover on downs,2019-09-22T19:39:28Z,10.0,3:33,2.0,0.0,0.0,4.0,4.0,0.0,KICKOFF,DOWNS,05:49,02:16,DEN 25,DEN 49,3407.0,3625.0,16,27,Home,11,43,7.0,42.0,0,outdoors,grass,69.0,7.0,Matt LaFleur,Vic Fangio,GNB00,Lambeau Field,0,1.0,J.Flacco,5.0,,,N.Fant,87.0,1,0,1.0,0,1,00-0026158,,00-0035644,J.Flacco,5.0,00-0026158,N.Fant,00-0035644,N.Fant,00-0035644,0,1,2.43514963361667,0.617126825042892,4.3214657681965,3.0,0.156904027622659,0.123014570039231,0.991057157516479,0.894284248352051,2019-09-22,Z.Smith,2019,REG,GB,3,00-0031576,LB,Za'Darius Smith,Za'Darius,Smith,,,,Ankle,,Full Participation in Practice,2019-09-20T12:59:00Z,2019-09-20 12:59:00
3530,2019_18_MIN_NO,2020010500,NO,MIN,POST,18,NO,home,MIN,NO,62.0,2020-01-05,345.0,345.0,345.0,Half2,0,21.0,0,4,3.0,0,05:45,NO 38,1,37.0,(5:45) (Shotgun) 62-N.Easton reported in as eligible. Direct snap to 7-T.Hill. 7-T.Hill right tackle to NO 47 for 9 yards (50-E.Wilson; 41-A.Harris). MIN-93-S.Stephen was injured during the play. His return is Questionable.,run,9.0,1,0,0.0,0,0,0,,,,,right,tackle,,,,,2,3,0.0,,,,,2.0,3.0,17,20,17.0,20.0,-3.0,17.0,20.0,-3.0,0.228821232914925,0.0912629961967468,0.0015213235747069,0.15839621424675,0.185110941529274,0.0058832690119743,0.329003989696503,0.0,0.0,1.48452215502039,0.942757967393845,-2.7313434992102,2.7313434992102,2.46691498417162,-2.46691498417162,-3.5790700762774,3.5790700762774,,,0.0,0.0,-6.10527032904056,6.10527032904056,1.25655768676554,-1.25655768676554,-11.2009355431582,11.2009355431582,7.77026654534167,-7.77026654534167,0.397329807281494,0.602670192718506,0.397329807281494,0.602670192718506,0.0493943691253662,0.0451643764972687,0.0451643764972687,0.44672417640686,0.55327582359314,0.447901010513306,0.447901010513306,-0.0705686856293127,0.0705686856293127,-0.102064952907673,0.102064952907673,,,0.0,0.0,0.15181386405457,-0.15181386405457,-0.366403758525848,0.366403758525848,0.174127816500553,-0.174127816500553,-0.295263692736626,0.295263692736626,0.0,1.0,0.0,0.0,1.0,0.0,0.0,0.0,0.0,0,0.0,0.0,0.0,0.0,0.0,0.0,0.0,0.0,0.0,0.0,0.0,0.0,0.0,0.0,0.0,0.0,0.0,0.0,0.0,0.0,0.0,0.0,1.0,0.0,0.0,0.0,0.0,0.0,0.0,0.0,0.0,0.0,0.0,0.0,0.0,0.0,1.0,0.0,0.0,0.0,0.0,,,,,,,00-0033357,T.Hill,9.0,,,,,,,,,,,,,,,,,,,,,,,,,,,,,,,,,,,,,,,,,,,,,,,,,00-0033336,E.Wilson,MIN,00-0031799,A.Harris,MIN,,,,,,,0.0,,,,,,,,,,,,,,,,,,,,,,,,,,,,,,,,0.0,,,,,0,,,0.0,0.0,0.0,0.0,,,2019,,,48,1,First down,3530,"1/5/20, 13:05:46",2020-01-05T20:47:44Z,Caesars Superdome,"Sunny Temp: 58° F, Humidity: 50%, Wind: SE 6 mph",10012020-0105-004c-37e6-466d8ad28fe6,0,0,RUSH,0,,,,21,Turnover,2020-01-05T20:45:41Z,6.0,2:31,2.0,0.0,0.0,4.0,4.0,0.0,PUNT,FUMBLE,06:49,04:18,NO 29,MIN 20,3450.0,3615.0,26,20,Home,-6,46,7.5,50.0,0,dome,astroturf,,,Sean Payton,Mike Zimmer,NOR00,Mercedes-Benz Superdome,0,1.0,,,T.Hill,7.0,,7.0,0,1,1.0,0,1,,00-0033357,,T.Hill,7.0,00-0033357,T.Hill,00-0033357,T.Hill,00-0033357,0,0,0.942757967393845,,,,,,0.379085928201675,-37.9085928201675,2020-01-05,S.Stephen,2019,WC,MIN,18,00-0031242,DT,Shamar Stephen,Shamar,Stephen,,,,Knee,,Full Participation in Practice,2020-01-03T11:26:34Z,2020-01-03 11:26:34
3521,2019_07_NE_NYJ,2019102100,NYJ,NE,REG,7,NYJ,home,NE,NYJ,75.0,2019-10-21,752.0,752.0,752.0,Half2,0,21.0,0,4,1.0,0,12:32,NYJ 25,10,-5.0,(12:32) 14-S.Darnold pass incomplete deep right to 84-R.Griffin. NYJ-67-B.Winters was injured during the play.,pass,0.0,0,0,1.0,0,0,0,deep,right,22.0,,,,,,,,3,2,0.0,,,,,3.0,2.0,0,33,0.0,33.0,-33.0,0.0,33.0,-33.0,0.0884937718510628,0.131062105298042,0.0022038028109818,0.191835507750511,0.225308552384377,0.0026579145342111,0.358438342809677,0.0,0.0,1.44986741011962,-0.522408578079194,-38.8610256267151,38.8610256267151,-1.25896217193804,1.25896217193804,-35.8234143553947,35.8234143553947,1.29427573736757,-1.81668431544676,0.0,0.0,1.18647030362627,-1.18647030362627,-20.7760954398545,20.7760954398545,24.7674219181936,-24.7674219181936,-54.4886737424769,54.4886737424769,0.0001049141865223,0.999895085813478,0.0001049141865223,0.999895085813478,-4.51871892437339e-06,-4.25138023274485e-06,-4.25138023274485e-06,0.0001003954675979,0.999899604532402,1.7223637769348e-05,1.7223637769348e-05,0.0044111410529,-0.0044111410529,-0.622525271012992,0.622525271012992,0.0,-4.51871892437339e-06,0.0,0.0,-0.0966387250657047,0.0966387250657047,-0.289172695949674,0.289172695949674,-0.0928331632596294,0.0928331632596294,-0.461716214136686,0.461716214136686,0.0,0.0,0.0,0.0,0.0,0.0,0.0,0.0,1.0,0,0.0,0.0,0.0,0.0,0.0,0.0,0.0,0.0,0.0,0.0,0.0,0.0,0.0,0.0,0.0,0.0,0.0,0.0,0.0,0.0,0.0,0.0,0.0,1.0,0.0,0.0,0.0,0.0,0.0,0.0,0.0,0.0,0.0,0.0,0.0,0.0,0.0,0.0,0.0,0.0,0.0,00-0034869,S.Darnold,,00-0030108,R.Griffin,,,,,,,,,,,,,,,,,,,,,,,,,,,,,,,,,,,,,,,,,,,,,,,,,,,,,,,,,,,,,,,,,0.0,,,,,,,,,,,,,,,,,,,,,,,,,,,,,,,,0.0,,,,,0,,,0.0,0.0,0.0,0.0,,,2019,0.489584982395172,-48.9584982395172,47,0,Punt,3521,"10/21/19, 20:15:25",2019-10-22T02:48:31Z,MetLife Stadium,"Mostly Clear Temp: 58° F, Humidity: 73%, Wind: SSW 0 mph",10012019-1021-0074-2ae6-07d944c6f5ee,0,0,PASS,0,,,,21,Punt,2019-10-22T02:47:46Z,3.0,0:29,0.0,0.0,0.0,4.0,4.0,-5.0,KICKOFF,PUNT,12:32,12:03,NYJ 25,NYJ 20,3506.0,3623.0,33,0,Home,-33,33,-9.5,43.0,1,outdoors,fieldturf,58.0,0.0,Adam Gase,Bill Belichick,NYC01,MetLife Stadium,0,0.0,S.Darnold,14.0,,,R.Griffin,84.0,1,0,0.0,0,1,00-0034869,,00-0030108,S.Darnold,14.0,00-0034869,R.Griffin,00-0030108,R.Griffin,00-0030108,0,0,-0.522408578079194,0.314309835986523,5.86032845450973,3.0,1.0,1.0,0.709718227386475,29.0281772613525,2019-10-21,B.Winters,2019,REG,NYJ,7,00-0030066,G,Brian Winters,Brian,Winters,Shoulder,Knee,Questionable,Shoulder,Knee,Limited Participation in Practice,2019-10-19T13:37:54Z,2019-10-19 13:37:54
3511,2019_13_LAC_DEN,2019120109,DEN,LAC,REG,13,LAC,away,DEN,LAC,66.0,2019-12-01,142.0,142.0,142.0,Half2,0,21.0,0,4,4.0,0,02:22,LAC 34,1,46.0,"(2:22) (Run formation) DEN-95-D.Wolfe was injured during the play. PENALTY on LAC-66-D.Feeney, False Start, 5 yards, enforced at LAC 34 - No Play.",no_play,0.0,0,0,0.0,0,0,0,,,,,,,,,,,2,2,0.0,,,,,2.0,2.0,20,17,17.0,20.0,-3.0,17.0,20.0,-3.0,0.526834964752197,0.116454891860485,0.0009301113313995,0.142219483852386,0.0811333432793617,0.0018192088464275,0.13060799241066,0.0,0.0,-0.185466890805401,-0.487772305612452,3.87853816966526,-3.87853816966526,-4.88201199968577,4.88201199968577,-3.37002951534267,3.37002951534267,,,0.0,0.0,-1.56485605530906,1.56485605530906,-10.6760870713624,10.6760870713624,7.94661302265013,-7.94661302265013,-19.3922835315706,19.3922835315706,0.242088541388512,0.757911458611488,0.757911458611488,0.242088541388512,-0.0402257293462753,-0.0345736593008041,0.0345736593008041,,,0.274673938751221,0.725326061248779,0.0851211026310921,-0.0851211026310921,-0.233617917942588,0.233617917942588,,,0.0,0.0,-0.619562812563215,0.619562812563215,0.266930847534389,-0.266930847534389,-0.607785948034559,0.607785948034559,0.173322430917472,-0.173322430917472,0.0,0.0,0.0,0.0,0.0,0.0,0.0,0.0,0.0,0,0.0,0.0,0.0,0.0,0.0,0.0,0.0,0.0,0.0,0.0,0.0,0.0,0.0,0.0,0.0,0.0,1.0,0.0,0.0,0.0,0.0,0.0,0.0,0.0,0.0,0.0,0.0,0.0,0.0,0.0,0.0,0.0,0.0,0.0,0.0,0.0,0.0,0.0,0.0,0.0,0.0,,,,,,,,,,,,,,,,,,,,,,,,,,,,,,,,,,,,,,,,,,,,,,,,,,,,,,,,,,,,,,,,,,,,,,0.0,,,,,,,,,,,,,,,,,,,,,,,,,,,,,,,,0.0,LAC,00-0033910,D.Feeney,5.0,0,,False Start,0.0,0.0,0.0,0.0,,,2019,,,45,1,First down,3511,"12/1/19, 16:25:20",2019-12-02T00:09:32Z,Empower Field at Mile High,"Mostly Sunny Temp: 33° F, Humidity: 51%, Wind: East 7 mph",10012019-1201-0947-5d4c-fc749c7efe56,0,0,PENALTY,0,,,,21,Field goal,2019-12-02T00:03:00Z,8.0,4:12,1.0,0.0,1.0,4.0,4.0,-10.0,KICKOFF,FIELD_GOAL,04:26,00:14,LAC 25,DEN 29,3380.0,3697.0,20,23,Home,3,43,-4.5,39.0,1,outdoors,grass,33.0,7.0,Vic Fangio,Anthony Lynn,DEN00,Empower Field at Mile High,0,0.0,,,,,,,0,0,0.0,0,1,,,,,,,,,,,0,1,-0.487772305612452,,,,,,0.40473747253418,,2019-12-01,D.Wolfe,2019,REG,DEN,13,00-0029586,DE,Derek Wolfe,Derek,Wolfe,,,,Not Injury Related,,Full Participation in Practice,2019-11-29T12:59:41Z,2019-11-29 12:59:41
3498,2019_17_NO_CAR,2019122902,CAR,NO,REG,17,NO,away,CAR,NO,62.0,2019-12-29,770.0,770.0,770.0,Half2,0,22.0,0,4,2.0,0,12:50,NO 38,11,13.0,(12:50) 64-W.Clapp reported in as eligible. 27-D.Washington right guard to NO 41 for 3 yards (96-W.Horton). CAR-57-A.Smith was injured during the play.,run,3.0,0,0,0.0,0,0,0,,,,,right,guard,,,,,2,2,0.0,,,,,2.0,2.0,10,42,42.0,10.0,32.0,42.0,10.0,32.0,0.0912974402308464,0.142919257283211,0.0024561779573559,0.212475463747978,0.23291240632534,0.0019603276159614,0.315978914499283,0.0,0.0,0.993511901702732,-0.396962012397125,-40.2126991189897,40.2126991189897,-6.84120840227115,6.84120840227115,-34.0035194526894,34.0035194526894,,,0.0,0.0,0.531764816085342,-0.531764816085342,-17.6725958224561,17.6725958224561,8.97643076116219,-8.97643076116219,-39.6728435536383,39.6728435536383,0.999807417392731,0.0001925826072692,0.0001925826072692,0.999807417392731,8.34465026855469e-07,-2.50339508056641e-06,2.50339508056641e-06,0.0001917481422424,0.999808251857758,0.999985337257385,1.46627426147461e-05,-0.237580100849981,0.237580100849981,-0.361854173115972,0.361854173115972,,,0.0,0.0,-0.0486977226682939,0.0486977226682939,-0.232729513354185,0.232729513354185,-0.046560751798097,0.046560751798097,-0.303551428766042,0.303551428766042,0.0,0.0,0.0,0.0,0.0,0.0,0.0,0.0,0.0,0,0.0,0.0,0.0,0.0,0.0,0.0,0.0,0.0,0.0,0.0,0.0,0.0,0.0,0.0,1.0,0.0,0.0,0.0,0.0,0.0,0.0,0.0,1.0,0.0,0.0,0.0,0.0,0.0,0.0,0.0,0.0,0.0,0.0,0.0,0.0,0.0,0.0,0.0,0.0,0.0,0.0,,,,,,,00-0032450,D.Washington,3.0,,,,,,,,,,,,,,,,,,,,,,,,,,,,,,,,,,,,,,,,,,,CAR,,00-0030251,,W.Horton,,,,,,,,,,,,,,0.0,,,,,,,,,,,,,,,,,,,,,,,,,,,,,,,,0.0,,,,,0,,,0.0,0.0,0.0,0.0,,,2019,,,51,0,Punt,3498,"12/29/19, 13:11:24",2019-12-29T20:39:29Z,Bank of America Stadium,"Cloudy Temp: 63° F, Humidity: 89%, Wind: S 9 mph",10012019-1229-02ca-a620-60fbb2ac1049,0,0,RUSH,0,,,,22,Punt,2019-12-29T20:33:05Z,6.0,4:10,1.0,0.0,0.0,3.0,4.0,0.0,KICKOFF,PUNT,00:32,11:22,NO 25,NO 38,3379.0,3544.0,42,10,Home,-32,52,-13.5,45.0,1,outdoors,grass,63.0,9.0,Ron Rivera,Sean Payton,CAR00,Bank of America Stadium,0,0.0,,,D.Washington,27.0,,,0,1,0.0,0,1,,00-0032450,,D.Washington,27.0,00-0032450,D.Washington,00-0032450,D.Washington,00-0032450,0,0,-0.396962012397125,,,,,,0.665215790271759,-66.5215790271759,2019-12-29,A.Smith,2019,REG,CAR,17,00-0034430,LB,Andre Smith,Andre,Smith,,,,Ankle,,Full Participation in Practice,2019-12-27T10:51:24Z,2019-12-27 10:51:24
3442,2019_05_IND_KC,2019100612,KC,IND,REG,5,KC,home,IND,KC,95.0,2019-10-06,93.0,993.0,993.0,Half2,0,15.0,0,3,3.0,0,01:33,KC 5,10,0.0,(1:33) (Shotgun) 15-P.Mahomes pass incomplete deep left to 87-T.Kelce [57-K.Turay]. KC-77-A.Wylie was injured during the play.,pass,0.0,1,0,1.0,0,0,0,deep,left,22.0,,,,,,,,3,2,0.0,,,,,3.0,2.0,10,13,10.0,13.0,-3.0,10.0,13.0,-3.0,0.0445723570883274,0.252595961093903,0.0251483637839556,0.300002157688141,0.138414919376373,0.0010026240488514,0.238263607025147,0.0,0.0,-0.823004459263757,-1.3290802272968,-6.76703181734774,6.76703181734774,-5.77728426159592,5.77728426159592,4.61237296312289,-4.61237296312289,2.57813821802847,-3.90721844532527,0.0,0.0,12.1334615766536,-12.1334615766536,-4.30593872998759,4.30593872998759,20.7898743297556,-20.7898743297556,-13.5690437219298,13.5690437219298,0.34174633026123,0.65825366973877,0.34174633026123,0.65825366973877,-0.0370670557022095,-0.0549125671386719,-0.0549125671386719,0.304679274559021,0.695320725440979,0.489711552858353,0.489711552858353,-0.190281408128713,0.190281408128713,0.0919418119868327,-0.0919418119868327,0.0,-0.0370670557022095,0.0,0.0,0.240823396392732,-0.240823396392732,0.0407460033893585,-0.0407460033893585,0.240823396392732,-0.240823396392732,-0.0553166270256043,0.0553166270256043,0.0,0.0,0.0,0.0,0.0,1.0,0.0,0.0,1.0,0,0.0,0.0,0.0,0.0,0.0,0.0,0.0,0.0,0.0,0.0,0.0,0.0,0.0,0.0,0.0,0.0,0.0,0.0,0.0,0.0,0.0,1.0,0.0,1.0,0.0,0.0,0.0,0.0,0.0,0.0,0.0,0.0,0.0,0.0,0.0,0.0,0.0,0.0,0.0,0.0,0.0,00-0033873,P.Mahomes,,00-0030506,T.Kelce,,,,,,,,,,,,,,,,,,,,,,,,,,,,,,,,,,,,,00-0034354,K.Turay,,,,,,,,,,,,,,,,,,,,,,,,,,,0.0,,,,,,,,,,,,,,,,,,,,,,,,,,,,,,,,0.0,,,,,0,,,0.0,0.0,0.0,0.0,,,2019,0.305271953344345,-30.5271953344345,47,0,Punt,3442,"10/6/19, 20:22:19",2019-10-07T02:44:48Z,GEHA Field at Arrowhead Stadium,"Cloudy Temp: 59° F, Humidity: 75%, Wind: West 3 mph",10012019-1006-1233-cf23-5ebccae6fd8a,0,0,PASS,0,,,,15,Punt,2019-10-07T02:43:31Z,3.0,1:08,0.0,0.0,0.0,3.0,3.0,0.0,PUNT,PUNT,02:22,01:14,KC 5,KC 5,3399.0,3467.0,19,13,Home,-6,32,10.5,55.5,0,outdoors,astroturf,59.0,3.0,Andy Reid,Frank Reich,KAN00,Arrowhead Stadium,0,0.0,P.Mahomes,15.0,,,T.Kelce,87.0,1,0,0.0,0,1,00-0033873,,00-0030506,P.Mahomes,15.0,00-0033873,T.Kelce,00-0030506,T.Kelce,00-0030506,0,1,-1.3290802272968,0.497125989216416,7.93088899883151,2.0,1.0,1.0,0.943965494632721,5.60345053672791,2019-10-06,A.Wylie,2019,REG,KC,5,00-0033831,G,Andrew Wylie,Andrew,Wylie,,,,Chest,,Full Participation in Practice,2019-10-04T12:37:56Z,2019-10-04 12:37:56
3420,2019_02_JAX_HOU,2019091504,HOU,JAX,REG,2,HOU,home,JAX,HOU,74.0,2019-09-15,231.0,231.0,231.0,Half2,0,19.0,0,4,3.0,0,03:51,HOU 26,19,2.0,(3:51) (Shotgun) 25-D.Johnson right tackle to HOU 27 for 1 yard (56-Q.Williams). JAX-93-C.Campbell was injured during the play. His return is Questionable.,run,1.0,1,0,0.0,0,0,0,,,,,right,tackle,,,,,3,2,0.0,,,,,3.0,2.0,13,6,13.0,6.0,7.0,13.0,6.0,7.0,0.362310439348221,0.142995461821556,0.0019329073838889,0.201654151082039,0.126058652997017,0.0022526949178427,0.162795662879944,0.0,0.0,-0.322180268820375,-0.81198963848874,5.34237317179826,-5.34237317179826,1.68596072989749,-1.68596072989749,1.9833800335922,-1.9833800335922,,,0.0,0.0,8.98789299809141,-8.98789299809141,-7.03347215077619,7.03347215077619,27.4767687234562,-27.4767687234562,-30.520325361968,30.520325361968,0.906922817230225,0.0930771827697754,0.906922817230225,0.0930771827697754,-0.0334759950637817,-0.0268335938453674,-0.0268335938453674,0.873446822166443,0.126553177833557,0.909462153911591,0.909462153911591,-0.045433023202112,0.045433023202112,0.129573307931423,-0.129573307931423,,,0.0,0.0,-0.0593055635690689,0.0593055635690689,0.140506081283093,-0.140506081283093,-0.0593055635690689,0.0593055635690689,0.0492453947663307,-0.0492453947663307,0.0,0.0,0.0,0.0,0.0,1.0,0.0,0.0,0.0,0,0.0,0.0,0.0,0.0,0.0,0.0,0.0,0.0,0.0,0.0,0.0,0.0,0.0,0.0,1.0,0.0,0.0,0.0,0.0,0.0,0.0,0.0,1.0,0.0,0.0,0.0,0.0,0.0,0.0,0.0,0.0,0.0,0.0,0.0,0.0,0.0,0.0,0.0,0.0,0.0,0.0,,,,,,,00-0032257,D.Johnson,1.0,,,,,,,,,,,,,,,,,,,,,,,,,,,,,,,,,,,,,,,,,,,JAX,,00-0035680,,Q.Williams,,,,,,,,,,,,,,0.0,,,,,,,,,,,,,,,,,,,,,,,,,,,,,,,,0.0,,,,,0,,,0.0,0.0,0.0,0.0,,,2019,,,44,0,Punt,3420,"9/15/19, 13:02:27",2019-09-15T19:38:50Z,NRG Stadium,"Sunny Temp: 89° F, Humidity: 52%, Wind: North East 10mph mph",10012019-0915-04e9-7a8a-3ff364ea0f81,0,0,RUSH,0,,,,19,Punt,2019-09-15T19:34:06Z,5.0,2:25,1.0,0.0,0.0,4.0,4.0,-10.0,KICKOFF,PUNT,06:01,03:36,HOU 25,HOU 27,3263.0,3444.0,12,13,Home,1,25,7.5,43.0,1,closed,grass,,,Bill O'Brien,Doug Marrone,HOU00,NRG Stadium,0,0.0,,,D.Johnson,25.0,,,0,1,0.0,0,1,,00-0032257,,D.Johnson,25.0,00-0032257,D.Johnson,00-0032257,D.Johnson,00-0032257,0,0,-0.81198963848874,,,,,,0.738996922969818,-73.8996922969818,2019-09-15,C.Campbell,2019,REG,JAX,2,00-0026190,DE,Calais Campbell,Calais,Campbell,,,,Foot,,Full Participation in Practice,2019-09-13T10:49:31Z,2019-09-13 10:49:31
3403,2019_14_WAS_GB,2019120803,GB,WAS,REG,14,GB,home,WAS,WAS,24.0,2019-12-08,214.0,214.0,214.0,Half2,0,19.0,0,4,1.0,0,03:34,WAS 24,10,74.0,"(3:34) (Shotgun) 33-A.Jones right guard to WAS 19 for 5 yards (52-R.Anderson, 53-J.Bostic). WAS-52-R.Anderson was injured during the play.",run,5.0,1,0,0.0,0,0,0,,,,,right,guard,,,,,3,2,0.0,,,,,3.0,2.0,17,9,17.0,9.0,8.0,17.0,9.0,8.0,0.142474263906479,0.0186203047633171,0.0002852697507478,0.0277036763727665,0.350238084793091,0.0008824545657262,0.459795922040939,0.0,0.0,4.02069342939649,-0.142105076753069,12.637654176841,-12.637654176841,10.5510413139418,-10.5510413139418,2.86309331768263,-2.86309331768263,,,0.0,0.0,4.35897389642196,-4.35897389642196,2.77268323041144,-2.77268323041144,3.04726450098678,-3.04726450098678,1.68449453400518,-1.68449453400518,0.970869064331055,0.0291309356689453,0.970869064331055,0.0291309356689453,0.0020028948783874,-0.0002815127372741,-0.0002815127372741,0.972871959209442,0.0271280407905579,0.988359570503235,0.988359570503235,0.29244157110251,-0.29244157110251,0.127750907721297,-0.127750907721297,,,0.0,0.0,0.11357170033671,-0.11357170033671,0.0250409096479416,-0.0250409096479416,0.107691553118006,-0.107691553118006,0.059978723526001,-0.059978723526001,0.0,0.0,0.0,0.0,0.0,0.0,0.0,0.0,0.0,0,0.0,0.0,0.0,0.0,0.0,0.0,0.0,0.0,0.0,0.0,0.0,0.0,0.0,0.0,0.0,0.0,0.0,0.0,0.0,0.0,0.0,0.0,1.0,0.0,0.0,0.0,0.0,0.0,0.0,0.0,0.0,0.0,0.0,0.0,0.0,0.0,1.0,0.0,0.0,0.0,0.0,,,,,,,00-0033293,A.Jones,5.0,,,,,,,,,,,,,,,,,,,,,,,,,,,,,,,,,,,,,,,,,,,,,,,,,00-0030064,J.Bostic,WAS,,,,,,,,,,1.0,00-0033525,R.Anderson,WAS,,,,,,,,,,,,,,,,,,,,,,,,,,,,,0.0,,,,,0,,,0.0,0.0,0.0,0.0,,,2019,,,47,0,Field goal,3403,"12/8/19, 13:02:41",2019-12-08T20:44:19Z,Lambeau Field,"Cloudy Temp: 37° F, Humidity: 75%, Wind: SW 10 mph",10012019-1208-03f3-0a64-f4fafc573bd3,0,0,RUSH,0,,,,19,Field goal,2019-12-08T20:32:51Z,14.0,7:24,4.0,1.0,1.0,4.0,4.0,0.0,PUNT,FIELD_GOAL,09:58,02:34,GB 11,WAS 15,3098.0,3504.0,15,20,Home,5,35,13.0,42.5,0,outdoors,grass,37.0,10.0,Matt LaFleur,Bill Callahan,GNB00,Lambeau Field,0,0.0,,,A.Jones,33.0,,,0,1,0.0,0,1,,00-0033293,,A.Jones,33.0,00-0033293,A.Jones,00-0033293,A.Jones,00-0033293,0,0,-0.142105076753069,,,,,,0.112677365541458,-11.2677365541458,2019-12-08,R.Anderson,2019,REG,WAS,14,00-0033525,LB,Ryan Anderson,Ryan,Anderson,,,,Shoulder,,Full Participation in Practice,2019-12-06T09:59:54Z,2019-12-06 09:59:54
3347,2019_01_BAL_MIA,2019090803,MIA,BAL,REG,1,BAL,away,MIA,MIA,15.0,2019-09-08,727.0,727.0,727.0,Half2,0,20.0,0,4,2.0,0,12:07,MIA 15,5,42.0,(12:07) (Shotgun) 35-G.Edwards right guard to MIA 5 for 10 yards (28-B.McCain). MIA-28-B.McCain was injured during the play.,run,10.0,1,0,0.0,0,0,0,,,,,right,guard,,,,,3,3,0.0,,,,,3.0,3.0,10,52,52.0,10.0,42.0,52.0,10.0,42.0,0.0176123213022947,0.0175343193113804,0.0003850493230856,0.0388952270150185,0.368236511945725,0.0007359319133684,0.556600630283356,0.0,0.0,4.67674616596196,0.996652048372198,-56.1887926710511,56.1887926710511,-16.9951104032225,16.9951104032225,-33.5607806847124,33.5607806847124,,,0.0,0.0,-3.62831802404253,3.62831802404253,-11.158229628636,11.158229628636,14.7272839302314,-14.7272839302314,-46.9756778353635,46.9756778353635,0.999820172786713,0.0001798272132873,0.0001798272132873,0.999820172786713,2.44975090026855e-05,3.69548797607422e-06,-3.69548797607422e-06,0.0001553297042846,0.999844670295715,0.999981760978699,1.82390213012695e-05,-0.267930849457849,0.267930849457849,-0.312715940976636,0.312715940976636,,,0.0,0.0,-0.0815370444106401,0.0815370444106401,-0.088553250875282,0.088553250875282,-0.0809377197074236,0.0809377197074236,-0.233082854486145,0.233082854486145,0.0,1.0,0.0,0.0,0.0,0.0,0.0,0.0,0.0,0,0.0,0.0,0.0,0.0,0.0,0.0,0.0,0.0,0.0,0.0,0.0,0.0,0.0,0.0,1.0,0.0,0.0,0.0,0.0,0.0,0.0,0.0,1.0,0.0,0.0,0.0,0.0,0.0,0.0,0.0,0.0,0.0,0.0,0.0,0.0,0.0,0.0,0.0,0.0,0.0,0.0,,,,,,,00-0034184,G.Edwards,10.0,,,,,,,,,,,,,,,,,,,,,,,,,,,,,,,,,,,,,,,,,,,MIA,,00-0031587,,B.McCain,,,,,,,,,,,,,,0.0,,,,,,,,,,,,,,,,,,,,,,,,,,,,,,,,0.0,,,,,0,,,0.0,0.0,0.0,0.0,,,2019,,,47,1,First down,3347,"9/8/19, 13:05:09",2019-09-08T19:35:44Z,Hard Rock Stadium,"Mostly Cloudy Temp: 91° F, Humidity: 56%, Wind: SSE 8 mph",10012019-0908-0336-da8a-c49b913ba68f,0,0,RUSH,0,,,,20,Touchdown,2019-09-08T19:32:57Z,9.0,5:30,4.0,1.0,1.0,4.0,4.0,0.0,INTERCEPTION,TOUCHDOWN,14:54,09:24,MIA 42,MIA 3,3256.0,3476.0,59,10,Home,-49,69,-7.0,41.0,0,outdoors,grass,91.0,8.0,Brian Flores,John Harbaugh,MIA00,Hard Rock Stadium,0,1.0,,,G.Edwards,35.0,,,0,1,1.0,0,1,,00-0034184,,G.Edwards,35.0,00-0034184,G.Edwards,00-0034184,G.Edwards,00-0034184,0,0,0.996652048372198,,,,,,0.322416752576828,-32.2416752576828,2019-09-08,B.McCain,2019,REG,MIA,1,00-0031587,CB,Bobby McCain,Bobby,McCain,Shoulder,,Questionable,Shoulder,,Limited Participation in Practice,2019-09-06T10:43:22Z,2019-09-06 10:43:22
3314,2019_09_NYJ_MIA,2019110304,MIA,NYJ,REG,9,MIA,home,NYJ,MIA,61.0,2019-11-03,4.0,904.0,904.0,Half2,0,17.0,0,3,1.0,0,00:04,MIA 39,10,4.0,"(:04) (Shotgun) 14-R.Fitzpatrick pass short left to 19-J.Grant to MIA 47 for 8 yards (99-S.McLendon, 97-N.Shepherd). NYJ-99-S.McLendon was injured during the play. His return is Questionable.",pass,8.0,1,0,1.0,0,0,0,short,left,-4.0,12.0,,,,,,,2,3,0.0,,,,,2.0,3.0,24,15,24.0,15.0,9.0,24.0,15.0,9.0,0.0545745044946671,0.105568520724773,0.0012144463835284,0.187521010637283,0.252766132354736,0.0066886087879538,0.391666740179062,0.0,0.0,1.88156126649119,0.616666957270354,12.2222030503337,-12.2222030503337,-1.33347751421381,1.33347751421381,11.4910884364302,-11.4910884364302,-1.19069539173506,1.80736234900542,-1.19069539173506,1.80736234900542,8.4389285883517,-8.4389285883517,1.53868985860026,-1.53868985860026,10.6872477143188,-10.6872477143188,2.57372906510136,-2.57372906510136,0.896936178207398,0.103063821792603,0.896936178207398,0.103063821792603,0.0045053958892822,0.0127663612365723,0.0127663612365723,0.90144157409668,0.0985584259033203,0.82246732711792,0.82246732711792,0.1048703789711,-0.1048703789711,0.245821633670027,-0.245821633670027,0.0,0.0045053958892822,0.0,0.0045053958892822,0.261495429973424,-0.261495429973424,-0.0738208914471921,0.0738208914471921,0.261495429973424,-0.261495429973424,-0.0173100630117711,0.0173100630117711,0.0,0.0,0.0,0.0,0.0,0.0,0.0,0.0,0.0,0,0.0,0.0,0.0,0.0,0.0,0.0,0.0,0.0,0.0,0.0,0.0,0.0,0.0,0.0,0.0,0.0,0.0,0.0,0.0,0.0,0.0,0.0,0.0,1.0,0.0,0.0,0.0,0.0,0.0,0.0,0.0,0.0,0.0,0.0,0.0,1.0,1.0,0.0,0.0,0.0,0.0,00-0023682,R.Fitzpatrick,8.0,00-0032791,J.Grant,8.0,,,,,,,,,,,,,,,,,,,,,,,,,,,,,,,,,,,,,,,,,,,,,,,,,,,,00-0034760,N.Shepherd,NYJ,,,,,,,,,,1.0,00-0026564,S.McLendon,NYJ,,,,,,,,,,,,,,,,,,,,,,,,,,,,,0.0,,,,,0,,,0.0,0.0,0.0,0.0,,,2019,0.878593981266022,12.1406018733978,44,1,First down,3314,"11/3/19, 13:02:46",2019-11-03T20:31:46Z,Hard Rock Stadium,"Mostly Cloudy Temp: 85° F, Humidity: 64%, Wind: N 11 mph",10012019-1103-0432-e192-1f35621d0b44,0,0,PASS,0,,,,17,Punt,2019-11-03T20:31:46Z,5.0,3:22,1.0,0.0,0.0,3.0,4.0,-21.0,PUNT,PUNT,00:04,11:42,MIA 39,MIA 43,3314.0,3576.0,18,26,Home,8,44,-3.5,42.5,1,outdoors,grass,85.0,11.0,Brian Flores,Adam Gase,MIA00,Hard Rock Stadium,0,1.0,R.Fitzpatrick,14.0,,,J.Grant,19.0,1,0,0.0,0,1,00-0023682,,00-0032791,R.Fitzpatrick,14.0,00-0023682,J.Grant,00-0032791,J.Grant,00-0032791,0,0,0.616666957270354,1.33275782382611,10.5644368175927,9.0,0.538668760214932,0.252016660873778,0.457994163036346,54.2005836963654,2019-11-03,S.McLendon,2019,REG,NYJ,9,00-0026564,DT,Steve McLendon,Steve,McLendon,Hamstring,,Questionable,Hamstring,,Limited Participation in Practice,2019-11-01T12:39:45Z,2019-11-01 12:39:45
3297,2019_01_IND_LAC,2019090807,LAC,IND,REG,1,IND,away,LAC,LAC,19.0,2019-09-08,53.0,53.0,53.0,Half2,0,16.0,0,4,1.0,0,00:53,LAC 19,10,80.0,(:53) (Shotgun) 7-J.Brissett pass incomplete deep left to 17-D.Funchess. IND-17-D.Funchess was injured during the play. He is Out.,pass,0.0,1,0,1.0,0,0,0,deep,left,19.0,,,,,,,,3,2,0.0,,,,,2.0,3.0,24,16,16.0,24.0,-8.0,16.0,24.0,-8.0,0.1782196611166,0.011356383562088,0.0002680479665286,0.0120333451777697,0.3367560505867,0.000313582655508,0.461052983999252,0.0,0.0,4.11942754220217,-0.297445605741814,2.26153502053111,-2.26153502053111,-7.77570939355064,7.77570939355064,2.27822980294212,-2.27822980294212,2.88057245779783,-3.17801806353964,0.0,0.0,-0.979974221510264,0.979974221510264,11.334931804915,-11.334931804915,-2.43635542278868,2.43635542278868,7.64012370153065,-7.64012370153065,0.153777316212654,0.846222683787346,0.846222683787346,0.153777316212654,-0.0143683105707169,-0.0023994296789169,0.0023994296789169,0.860590994358063,0.139409005641937,0.150545448064804,0.849454551935196,0.0342091420268446,-0.0342091420268446,0.0584807541578136,-0.0584807541578136,0.0,-0.0143683105707169,0.0,0.0,0.0676316129147224,-0.0676316129147224,0.0493283460169941,-0.0493283460169941,0.0676316129147224,-0.0676316129147224,0.0525530765086323,-0.0525530765086323,0.0,0.0,0.0,0.0,0.0,0.0,0.0,0.0,1.0,0,0.0,0.0,0.0,0.0,0.0,0.0,0.0,0.0,0.0,0.0,0.0,0.0,0.0,0.0,0.0,0.0,0.0,0.0,0.0,0.0,0.0,0.0,0.0,1.0,0.0,0.0,0.0,0.0,0.0,0.0,0.0,0.0,0.0,0.0,0.0,0.0,0.0,0.0,0.0,0.0,0.0,00-0033119,J.Brissett,,00-0032055,D.Funchess,,,,,,,,,,,,,,,,,,,,,,,,,,,,,,,,,,,,,,,,,,,,,,,,,,,,,,,,,,,,,,,,,0.0,,,,,,,,,,,,,,,,,,,,,,,,,,,,,,,,0.0,,,,,0,,,0.0,0.0,0.0,0.0,,,2019,0.324179172515869,-32.4179172515869,49,1,Touchdown,3297,"9/8/19, 16:05:34",2019-09-08T22:45:21Z,ROKiT Field - Dignity Health Sports Park,"Sunny Temp: 77° F, Humidity: 52%, Wind: SW 10 mph",10012019-0908-079b-022c-fcb858990087,0,0,PASS,0,,,,16,Touchdown,2019-09-08T22:32:23Z,16.0,7:52,6.0,1.0,1.0,4.0,4.0,0.0,INTERCEPTION,TOUCHDOWN,08:30,00:38,IND 20,LAC 19,2946.0,3379.0,24,30,Home,6,54,6.0,44.5,0,outdoors,grass,77.0,10.0,Anthony Lynn,Frank Reich,LAX97,StubHub Center,0,0.0,J.Brissett,7.0,,,D.Funchess,17.0,1,0,0.0,0,1,00-0033119,,00-0032055,J.Brissett,7.0,00-0033119,D.Funchess,00-0032055,D.Funchess,00-0032055,0,1,-0.297445605741814,,,,,,0.949220061302185,5.07799386978149,2019-09-08,D.Funchess,2019,REG,IND,1,00-0032055,WR,Devin Funchess,Devin,Funchess,,,,Back,,Full Participation in Practice,2019-09-06T12:20:12Z,2019-09-06 12:20:12
3265,2019_06_WAS_MIA,2019101305,MIA,WAS,REG,6,WAS,away,MIA,MIA,35.0,2019-10-13,656.0,656.0,656.0,Half2,0,19.0,0,4,,0,10:56,MIA 35,0,4.0,"(Onside Kick formation) 7-J.Sanders kicks onside 18 yards from MIA 35 to WAS 47. RECOVERED by MIA-44-D.Lacey. WAS-83-J.Cunningham was injured during the play. His return is Questionable. PENALTY on MIA-26-S.Parker, Offside on Free Kick, 5 yards, enforced at MIA 35 - No Play.",no_play,0.0,0,0,0.0,0,0,0,,,,,,,,,,,3,3,0.0,,,,,3.0,3.0,10,17,17.0,10.0,7.0,17.0,10.0,7.0,0.0,0.0,0.0,0.0,0.0,0.0,0.0,0.0,0.0,1.04388270387426,0.0,-11.1227102946583,11.1227102946583,5.47842180477353,-5.47842180477353,-20.7412888201334,20.7412888201334,,,0.0,0.0,-19.3716488742502,19.3716488742502,12.1212908502224,-12.1212908502224,-20.9703084765933,20.9703084765933,7.9782308090098,-7.9782308090098,0.860843181610107,0.139156818389893,0.139156818389893,0.860843181610107,0.0,0.0,0.0,0.139156818389893,0.860843181610107,0.911790132522583,0.088209867477417,-0.0885195664060779,0.0885195664060779,-0.464461332720354,0.464461332720354,,,0.0,0.0,0.189369516506133,-0.189369516506133,-0.35091740324713,0.35091740324713,0.189369516506133,-0.189369516506133,-0.512759443964732,0.512759443964732,0.0,0.0,0.0,0.0,0.0,0.0,0.0,0.0,0.0,0,0.0,0.0,0.0,0.0,0.0,0.0,0.0,0.0,0.0,0.0,0.0,0.0,0.0,0.0,0.0,0.0,1.0,0.0,0.0,0.0,0.0,0.0,0.0,0.0,0.0,0.0,0.0,0.0,0.0,0.0,0.0,0.0,1.0,0.0,0.0,0.0,0.0,0.0,0.0,0.0,0.0,,,,,,,,,,,,,,,,,,,,,,,,,,,,,,,,,,,,,,,,,,,,,,,,,,,,,,,,,,,,,,,,,,,,,,0.0,,,,,,,,,,,,,,,,,,,,,,,,,,,,,,,,0.0,MIA,00-0034736,S.Parker,5.0,0,,Offside on Free Kick,0.0,0.0,0.0,0.0,,,2019,,,42,0,Punt,3265,"10/13/19, 13:02:41",2019-10-13T19:33:37Z,Hard Rock Stadium,"Cloudy Temp: 84° F, Humidity: 66%, Wind: E 13 mph",10012019-1013-0591-b752-982b760b96ea,0,0,KICK_OFF,1,,,,19,Punt,2019-10-13T19:33:37Z,3.0,1:08,0.0,0.0,0.0,4.0,4.0,0.0,KICKOFF,PUNT,10:56,09:48,WAS 23,WAS 27,3265.0,3383.0,17,16,Home,-1,33,-6.0,42.0,0,outdoors,grass,84.0,13.0,Brian Flores,Bill Callahan,MIA00,Hard Rock Stadium,0,0.0,,,,,,,0,0,0.0,0,1,,,,,,,,,,,0,0,0.0,,,,,,,,2019-10-13,J.Cunningham,2019,REG,WAS,6,00-0031462,TE,Jerome Cunningham,Jerome,Cunningham,,,,Concussion,,Full Participation in Practice,2019-10-11T11:14:13Z,2019-10-11 11:14:13
