play_id,game_id,old_game_id,home_team,away_team,season_type,week_x,posteam,posteam_type,defteam,side_of_field,yardline_100,game_date,quarter_seconds_remaining,half_seconds_remaining,game_seconds_remaining,game_half,quarter_end,drive,sp,qtr,down,goal_to_go,time,yrdln,ydstogo,ydsnet,desc,play_type,yards_gained,shotgun,no_huddle,qb_dropback,qb_kneel,qb_spike,qb_scramble,pass_length,pass_location,air_yards,yards_after_catch,run_location,run_gap,field_goal_result,kick_distance,extra_point_result,two_point_conv_result,home_timeouts_remaining,away_timeouts_remaining,timeout,timeout_team,td_team,td_player_name,td_player_id,posteam_timeouts_remaining,defteam_timeouts_remaining,total_home_score,total_away_score,posteam_score,defteam_score,score_differential,posteam_score_post,defteam_score_post,score_differential_post,no_score_prob,opp_fg_prob,opp_safety_prob,opp_td_prob,fg_prob,safety_prob,td_prob,extra_point_prob,two_point_conversion_prob,ep,epa,total_home_epa,total_away_epa,total_home_rush_epa,total_away_rush_epa,total_home_pass_epa,total_away_pass_epa,air_epa,yac_epa,comp_air_epa,comp_yac_epa,total_home_comp_air_epa,total_away_comp_air_epa,total_home_comp_yac_epa,total_away_comp_yac_epa,total_home_raw_air_epa,total_away_raw_air_epa,total_home_raw_yac_epa,total_away_raw_yac_epa,wp,def_wp,home_wp,away_wp,wpa,vegas_wpa,vegas_home_wpa,home_wp_post,away_wp_post,vegas_wp,vegas_home_wp,total_home_rush_wpa,total_away_rush_wpa,total_home_pass_wpa,total_away_pass_wpa,air_wpa,yac_wpa,comp_air_wpa,comp_yac_wpa,total_home_comp_air_wpa,total_away_comp_air_wpa,total_home_comp_yac_wpa,total_away_comp_yac_wpa,total_home_raw_air_wpa,total_away_raw_air_wpa,total_home_raw_yac_wpa,total_away_raw_yac_wpa,punt_blocked,first_down_rush,first_down_pass,first_down_penalty,third_down_converted,third_down_failed,fourth_down_converted,fourth_down_failed,incomplete_pass,touchback,interception,punt_inside_twenty,punt_in_endzone,punt_out_of_bounds,punt_downed,punt_fair_catch,kickoff_inside_twenty,kickoff_in_endzone,kickoff_out_of_bounds,kickoff_downed,kickoff_fair_catch,fumble_forced,fumble_not_forced,fumble_out_of_bounds,solo_tackle,safety,penalty,tackled_for_loss,fumble_lost,own_kickoff_recovery,own_kickoff_recovery_td,qb_hit,rush_attempt,pass_attempt,sack,touchdown,pass_touchdown,rush_touchdown,return_touchdown,extra_point_attempt,two_point_attempt,field_goal_attempt,kickoff_attempt,punt_attempt,fumble,complete_pass,assist_tackle,lateral_reception,lateral_rush,lateral_return,lateral_recovery,passer_player_id,passer_player_name,passing_yards,receiver_player_id,receiver_player_name,receiving_yards,rusher_player_id,rusher_player_name,rushing_yards,lateral_receiver_player_id,lateral_receiver_player_name,lateral_receiving_yards,lateral_rusher_player_id,lateral_rusher_player_name,lateral_rushing_yards,lateral_sack_player_id,lateral_sack_player_name,interception_player_id,interception_player_name,lateral_interception_player_id,lateral_interception_player_name,punt_returner_player_id,punt_returner_player_name,lateral_punt_returner_player_id,lateral_punt_returner_player_name,kickoff_returner_player_name,kickoff_returner_player_id,lateral_kickoff_returner_player_id,lateral_kickoff_returner_player_name,punter_player_id,punter_player_name,kicker_player_name,kicker_player_id,own_kickoff_recovery_player_id,own_kickoff_recovery_player_name,blocked_player_id,blocked_player_name,tackle_for_loss_1_player_id,tackle_for_loss_1_player_name,tackle_for_loss_2_player_id,tackle_for_loss_2_player_name,qb_hit_1_player_id,qb_hit_1_player_name,qb_hit_2_player_id,qb_hit_2_player_name,forced_fumble_player_1_team,forced_fumble_player_1_player_id,forced_fumble_player_1_player_name,forced_fumble_player_2_team,forced_fumble_player_2_player_id,forced_fumble_player_2_player_name,solo_tackle_1_team,solo_tackle_2_team,solo_tackle_1_player_id,solo_tackle_2_player_id,solo_tackle_1_player_name,solo_tackle_2_player_name,assist_tackle_1_player_id,assist_tackle_1_player_name,assist_tackle_1_team,assist_tackle_2_player_id,assist_tackle_2_player_name,assist_tackle_2_team,assist_tackle_3_player_id,assist_tackle_3_player_name,assist_tackle_3_team,assist_tackle_4_player_id,assist_tackle_4_player_name,assist_tackle_4_team,tackle_with_assist,tackle_with_assist_1_player_id,tackle_with_assist_1_player_name,tackle_with_assist_1_team,tackle_with_assist_2_player_id,tackle_with_assist_2_player_name,tackle_with_assist_2_team,pass_defense_1_player_id,pass_defense_1_player_name,pass_defense_2_player_id,pass_defense_2_player_name,fumbled_1_team,fumbled_1_player_id,fumbled_1_player_name,fumbled_2_player_id,fumbled_2_player_name,fumbled_2_team,fumble_recovery_1_team,fumble_recovery_1_yards,fumble_recovery_1_player_id,fumble_recovery_1_player_name,fumble_recovery_2_team,fumble_recovery_2_yards,fumble_recovery_2_player_id,fumble_recovery_2_player_name,sack_player_id,sack_player_name,half_sack_1_player_id,half_sack_1_player_name,half_sack_2_player_id,half_sack_2_player_name,return_team,return_yards,penalty_team,penalty_player_id,penalty_player_name,penalty_yards,replay_or_challenge,replay_or_challenge_result,penalty_type,defensive_two_point_attempt,defensive_two_point_conv,defensive_extra_point_attempt,defensive_extra_point_conv,safety_player_name,safety_player_id,season_x,cp,cpoe,series,series_success,series_result,order_sequence,start_time,time_of_day,stadium,weather,nfl_api_id,play_clock,play_deleted,play_type_nfl,special_teams_play,st_play_type,end_clock_time,end_yard_line,fixed_drive,fixed_drive_result,drive_real_start_time,drive_play_count,drive_time_of_possession,drive_first_downs,drive_inside20,drive_ended_with_score,drive_quarter_start,drive_quarter_end,drive_yards_penalized,drive_start_transition,drive_end_transition,drive_game_clock_start,drive_game_clock_end,drive_start_yard_line,drive_end_yard_line,drive_play_id_started,drive_play_id_ended,away_score,home_score,location,result,total,spread_line,total_line,div_game,roof,surface,temp,wind,home_coach,away_coach,stadium_id,game_stadium,aborted_play,success,passer,passer_jersey_number,rusher,rusher_jersey_number,receiver,receiver_jersey_number,pass,rush,first_down,special,play,passer_id,rusher_id,receiver_id,name,jersey_number,id,fantasy_player_name,fantasy_player_id,fantasy,fantasy_id,out_of_bounds,home_opening_kickoff,qb_epa,xyac_epa,xyac_mean_yardage,xyac_median_yardage,xyac_success,xyac_fd,xpass,pass_oe,date_x,injured_player,season_y,game_type,team,week_y,gsis_id,position,full_name,first_name,last_name,report_primary_injury,report_secondary_injury,report_status,practice_primary_injury,practice_secondary_injury,practice_status,date_modified,date_y
4451,2021_05_CLE_LAC,2021101009,LAC,CLE,REG,5,CLE,away,LAC,CLE,66.0,2021-10-10,53.0,53.0,53.0,Half2,0,23.0,0,4,3.0,0,00:53,CLE 34,1,21.0,"(:53) (No Huddle, Shotgun) 6-B.Mayfield pass short left to 27-K.Hunt to CLE 36 for 2 yards (49-D.Tranquill). LAC-49-D.Tranquill was injured during the play.",pass,2.0,1,1,1.0,0,0,0,short,left,1.0,1.0,,,,,,,2,0,0.0,,,,,0.0,2.0,47,42,42.0,47.0,-5.0,42.0,47.0,-5.0,0.722321152687073,0.0279178023338318,0.0007660263217985,0.0283733475953341,0.119064703583717,0.0003985592338722,0.101158432662487,0.0,0.0,0.782201365043875,-0.0540108766872436,3.58213178026408,-3.58213178026408,-1.11730704801437,1.11730704801437,0.325736004571386,-0.325736004571386,-0.0242664242978208,-0.0297444523894228,-0.0242664242978208,-0.0297444523894228,7.0666808229289,-7.0666808229289,3.39160901092691,-3.39160901092691,12.4396713320166,-12.4396713320166,-10.0806590788383,10.0806590788383,0.222967833280563,0.777032166719437,0.777032166719437,0.222967833280563,-0.032235860824585,-0.0135768502950668,0.0135768502950668,0.809268027544022,0.190731972455978,0.141581788659096,0.858418211340904,-0.285680182785373,0.285680182785373,0.269071532869383,-0.269071532869383,-0.029651090502739,-0.002584770321846,-0.029651090502739,-0.002584770321846,-0.0159590393304825,0.0159590393304825,0.60219765709494,-0.60219765709494,-0.0240201354026794,0.0240201354026794,0.397052968607887,-0.397052968607887,0.0,0.0,1.0,0.0,1.0,0.0,0.0,0.0,0.0,0,0.0,0.0,0.0,0.0,0.0,0.0,0.0,0.0,0.0,0.0,0.0,0.0,0.0,0.0,1.0,0.0,0.0,0.0,0.0,0.0,0.0,0.0,0.0,1.0,0.0,0.0,0.0,0.0,0.0,0.0,0.0,0.0,0.0,0.0,0.0,1.0,0.0,0.0,0.0,0.0,0.0,00-0034855,B.Mayfield,2.0,00-0033923,K.Hunt,2.0,,,,,,,,,,,,,,,,,,,,,,,,,,,,,,,,,,,,,,,,,,,,,,LAC,,00-0035262,,D.Tranquill,,,,,,,,,,,,,,0.0,,,,,,,,,,,,,,,,,,,,,,,,,,,,,,,,0.0,,,,,0,,,0.0,0.0,0.0,0.0,,,2021,0.784246504306793,21.5753495693207,59,1,First down,4451,"10/10/21, 16:05:26",2021-10-10T23:20:07Z,SoFi Stadium,"Sunny Temp: 76° F, Humidity: 39%, Wind: WSW 4 mph",c59db55c-b37c-11eb-a2e3-1893925df770,0,0,PASS,0,,,,23,Turnover on downs,2021-10-10T23:18:36Z,8.0,1:26,2.0,0.0,0.0,4.0,4.0,0.0,KICKOFF,DOWNS,01:31,00:05,CLE 25,CLE 46,4388.0,4597.0,42,47,Home,5,89,2.5,46.5,0,dome,matrixturf,,,Brandon Staley,Kevin Stefanski,LAX01,SoFi Stadium,0,0.0,B.Mayfield,6.0,,,K.Hunt,27.0,1,0,1.0,0,1,00-0034855,,00-0033923,B.Mayfield,6.0,00-0034855,K.Hunt,00-0033923,K.Hunt,00-0033923,0,1,-0.0540108766872436,0.454756144309968,6.50636332580325,4.0,0.881409818830434,0.985976608993951,0.814579486846924,18.5420513153076,2021-10-10,D.Tranquill,2021,REG,LAC,5,00-0035262,LB,Drue Tranquill,Drue,Tranquill,,,,Illness,,Full Participation in Practice,2021-10-08T19:51:11Z,2021-10-08 19:51:11
4378,2021_11_HOU_TEN,2021112108,TEN,HOU,REG,11,HOU,away,TEN,TEN,49.0,2021-11-21,75.0,75.0,75.0,Half2,0,23.0,0,4,3.0,0,01:15,TEN 49,11,-6.0,"(1:15) 28-R.Burkhead left tackle to TEN 49 for no gain (58-H.Landry, 53-D.Cole). TEN-93-T.Tart was injured during the play. His return is Questionable.",run,0.0,0,0,0.0,0,0,0,,,,,left,tackle,,,,,0,2,0.0,,,,,2.0,0.0,13,22,22.0,13.0,9.0,22.0,13.0,9.0,0.775174021720886,0.0397752411663532,0.0006225393153727,0.0280929133296013,0.0911485403776169,0.0011690175160765,0.0640176832675934,0.0,0.0,0.406686243601143,-0.293185504851863,-15.34687705338,15.34687705338,-0.0329682619776577,0.0329682619776577,-9.69234309459425,9.69234309459425,,,0.0,0.0,6.66658072458813,-6.66658072458813,9.70006237720372,-9.70006237720372,22.0868108735303,-22.0868108735303,-29.6653461045105,29.6653461045105,0.993448317050934,0.0065516829490661,0.0065516829490661,0.993448317050934,0.001513659954071,0.0019049644470214,-0.0019049644470214,0.0050380229949951,0.994961977005005,0.994171321392059,0.0058286786079406,-0.142904248922469,0.142904248922469,-0.383405696222055,0.383405696222055,,,0.0,0.0,0.813637179227599,-0.813637179227599,-0.561495420049426,0.561495420049426,0.81203143009735,-0.81203143009735,-1.16697449282884,1.16697449282884,0.0,0.0,0.0,0.0,0.0,1.0,0.0,0.0,0.0,0,0.0,0.0,0.0,0.0,0.0,0.0,0.0,0.0,0.0,0.0,0.0,0.0,0.0,0.0,0.0,0.0,0.0,0.0,0.0,0.0,0.0,0.0,1.0,0.0,0.0,0.0,0.0,0.0,0.0,0.0,0.0,0.0,0.0,0.0,0.0,0.0,1.0,0.0,0.0,0.0,0.0,,,,,,,00-0030288,R.Burkhead,0.0,,,,,,,,,,,,,,,,,,,,,,,,,,,,,,,,,,,,,,,,,,,,,,,,,00-0033765,D.Cole,TEN,,,,,,,,,,1.0,00-0034828,H.Landry,TEN,,,,,,,,,,,,,,,,,,,,,,,,,,,,,0.0,,,,,0,,,0.0,0.0,0.0,0.0,,,2021,,,59,0,Punt,4378,"11/21/21, 13:02:57",2021-11-21T21:03:25Z,Nissan Stadium,"Cloudy Temp: 56° F, Humidity: 71%, Wind: North 10 mph",c59903bf-b37c-11eb-9f7c-7c9249e10b74,0,0,RUSH,0,,,,23,Punt,2021-11-21T20:59:46Z,3.0,1:50,0.0,0.0,0.0,4.0,4.0,-5.0,INTERCEPTION,PUNT,02:07,00:17,TEN 48,HOU 46,4315.0,4432.0,22,13,Home,-9,35,10.5,44.5,1,outdoors,grass ,59.0,8.0,Mike Vrabel,David Culley,NAS00,Nissan Stadium,0,0.0,,,R.Burkhead,28.0,,,0,1,0.0,0,1,,00-0030288,,R.Burkhead,28.0,00-0030288,R.Burkhead,00-0030288,R.Burkhead,00-0030288,0,1,-0.293185504851863,,,,,,0.0599864423274994,-5.99864423274994,2021-11-21,T.Tart,2021,REG,TEN,11,00-0036181,DT,Teair Tart,Teair,Tart,,,,Groin,,Limited Participation in Practice,2021-11-19T20:28:23Z,2021-11-19 20:28:23
4256,2021_12_LV_DAL,2021112501,DAL,LV,REG,12,DAL,home,LV,DAL,65.0,2021-11-25,203.0,203.0,203.0,Half2,0,24.0,0,4,2.0,0,03:23,DAL 35,6,69.0,"(3:23) (No Huddle, Shotgun) 4-D.Prescott pass deep left to 13-M.Gallup pushed ob at LV 33 for 32 yards (29-C.Hayward). LV-91-Y.Ngakoue was injured during the play. His return is Questionable.",pass,32.0,1,1,1.0,0,0,0,deep,left,28.0,4.0,,,,,,,2,2,0.0,,,,,2.0,2.0,22,30,22.0,30.0,-8.0,22.0,30.0,-8.0,0.373541384935379,0.0831948965787888,0.0006837852415628,0.117410399019718,0.181816264986992,0.0041646300815045,0.239188611507416,0.0,0.0,1.15527328231838,2.44117227697279,-10.3679257398968,10.3679257398968,-0.275875480248826,0.275875480248826,-4.44571363807078,4.44571363807078,2.10030531889061,0.340866958082188,2.10030531889061,0.340866958082188,0.0818530538817868,-0.0818530538817868,-4.97793901579773,4.97793901579773,-8.86780823470326,8.86780823470326,4.14840159003036,-4.14840159003036,0.0751168131828308,0.924883186817169,0.0751168131828308,0.924883186817169,0.0609293729066849,0.0807725563645363,0.0807725563645363,0.136046186089516,0.863953813910484,0.118625409901142,0.118625409901142,-0.0161018027913561,0.0161018027913561,-0.180551887864717,0.180551887864717,0.0,0.0609293729066849,0.0,0.0609293729066849,0.0006480365991592,-0.0006480365991592,-0.157165632958063,0.157165632958063,0.0021091848611831,-0.0021091848611831,-0.154234991783746,0.154234991783746,0.0,0.0,1.0,0.0,0.0,0.0,0.0,0.0,0.0,0,0.0,0.0,0.0,0.0,0.0,0.0,0.0,0.0,0.0,0.0,0.0,0.0,0.0,0.0,1.0,0.0,0.0,0.0,0.0,0.0,0.0,0.0,0.0,1.0,0.0,0.0,0.0,0.0,0.0,0.0,0.0,0.0,0.0,0.0,0.0,1.0,0.0,0.0,0.0,0.0,0.0,00-0033077,D.Prescott,32.0,00-0034764,M.Gallup,32.0,,,,,,,,,,,,,,,,,,,,,,,,,,,,,,,,,,,,,,,,,,,,,,LV,,00-0029261,,C.Hayward,,,,,,,,,,,,,,0.0,,,,,,,,,,,,,,,,,,,,,,,,,,,,,,,,0.0,,,,,0,,,0.0,0.0,0.0,0.0,,,2021,0.388544470071793,61.1455529928207,59,1,First down,4256,"11/25/21, 16:35:30",2021-11-26T00:50:01Z,AT&T Stadium,,c598cdcc-b37c-11eb-b396-d1345dd16473,0,0,PASS,0,,,,24,Touchdown,2021-11-26T00:49:42Z,4.0,0:47,2.0,0.0,1.0,4.0,4.0,0.0,PUNT,TOUCHDOWN,03:41,02:54,DAL 31,LV 32,4232.0,4335.0,36,33,Home,-3,69,7.0,51.0,0,closed,matrixturf,,,Mike McCarthy,Rich Bisaccia,DAL00,AT&T Stadium,0,1.0,D.Prescott,4.0,,,M.Gallup,13.0,1,0,1.0,0,1,00-0033077,,00-0034764,D.Prescott,4.0,00-0033077,M.Gallup,00-0034764,M.Gallup,00-0034764,1,1,2.44117227697279,0.825032042990998,9.6163631316449,5.0,1.0,1.0,0.955997109413147,4.4002890586853,2021-11-25,Y.Ngakoue,2021,REG,LV,12,00-0033123,DE,Yannick Ngakoue,Yannick,Ngakoue,,,,Ribs,,Full Participation in Practice,2021-11-24T19:57:43Z,2021-11-24 19:57:43
4248,2021_18_PIT_BAL,2022010901,BAL,PIT,REG,18,PIT,away,BAL,PIT,72.0,2022-01-09,354.0,354.0,354.0,Overtime,0,29.0,0,5,1.0,0,05:54,PIT 28,10,65.0,(5:54) (Shotgun) 22-N.Harris left guard to PIT 31 for 3 yards (93-C.Campbell; 98-B.Williams). BAL-50-J.Houston was injured during the play.,run,3.0,1,0,0.0,0,0,0,,,,,left,guard,,,,,2,2,0.0,,,,,2.0,2.0,13,13,13.0,13.0,0.0,13.0,13.0,0.0,0.34216919541359,0.105799861252308,0.0022008868400007,0.142511814832687,0.168004229664803,0.0013951129512861,0.237918898463249,0.0,0.0,0.852851142873988,-0.100532503100112,-4.89797746640397,4.89797746640397,7.27142220129108,-7.27142220129108,-16.6811989816532,16.6811989816532,,,0.0,0.0,6.44417288448312,-6.44417288448312,-11.9496203383605,11.9496203383605,17.5903223817004,-17.5903223817004,-33.0350099539254,33.0350099539254,0.407318241079338,0.592681758920662,0.592681758920662,0.407318241079338,-0.0144814078230411,-0.0144814078230411,0.0144814078230411,0.607163166743703,0.392836833256297,0.407318241079338,0.592681758920662,0.322466570579251,-0.322466570579251,-0.898438834531536,0.898438834531536,,,0.0,0.0,-0.0600177168380469,0.0600177168380469,-0.261841035161471,0.261841035161471,0.0721191780176014,-0.0721191780176014,-0.90859812003777,0.90859812003777,0.0,0.0,0.0,0.0,0.0,0.0,0.0,0.0,0.0,0,0.0,0.0,0.0,0.0,0.0,0.0,0.0,0.0,0.0,0.0,0.0,0.0,0.0,0.0,0.0,0.0,0.0,0.0,0.0,0.0,0.0,0.0,1.0,0.0,0.0,0.0,0.0,0.0,0.0,0.0,0.0,0.0,0.0,0.0,0.0,0.0,1.0,0.0,0.0,0.0,0.0,,,,,,,00-0036893,N.Harris,3.0,,,,,,,,,,,,,,,,,,,,,,,,,,,,,,,,,,,,,,,,,,,,,,,,,00-0026190,C.Campbell,BAL,00-0030511,B.Williams,BAL,,,,,,,0.0,,,,,,,,,,,,,,,,,,,,,,,,,,,,,,,,0.0,,,,,0,,,0.0,0.0,0.0,0.0,,,2021,,,62,1,First down,4248,"1/9/22, 13:03:01",2022-01-09T21:17:27Z,M&T Bank Stadium,"Cloudy, rain Temp: 38° F, Humidity: 90%, Wind: SW 3 mph",c59762b8-b37c-11eb-a78a-30c5c677cad5,0,0,RUSH,0,,,,29,Field goal,2022-01-09T21:16:46Z,15.0,4:28,5.0,1.0,1.0,5.0,5.0,0.0,PUNT,FIELD_GOAL,06:24,01:56,PIT 17,BAL 18,4224.0,4645.0,16,13,Home,-3,29,3.0,41.0,1,outdoors,grass,36.0,0.0,John Harbaugh,Mike Tomlin,BAL00,M&T Bank Stadium,0,0.0,,,N.Harris,22.0,,,0,1,0.0,0,1,,00-0036893,,N.Harris,22.0,00-0036893,N.Harris,00-0036893,N.Harris,00-0036893,0,0,-0.100532503100112,,,,,,0.541033327579498,-54.1033327579498,2022-01-09,J.Houston,2021,REG,BAL,18,00-0028008,LB,Justin Houston,Justin,Houston,,,,Not injury related - resting player,,Did Not Participate In Practice,2022-01-05T20:59:05Z,2022-01-05 20:59:05
4079,2021_15_DAL_NYG,2021121907,NYG,DAL,REG,15,NYG,home,DAL,DAL,14.0,2021-12-19,93.0,93.0,93.0,Half2,0,20.0,0,4,2.0,0,01:33,DAL 14,10,84.0,(1:33) (Shotgun) 17-J.Fromm pass incomplete short left to 19-K.Golladay. NYG-3-S.Shepard was injured during the play.,pass,0.0,1,0,1.0,0,0,0,short,left,14.0,,,,,,,,1,2,0.0,,,,,1.0,2.0,6,21,6.0,21.0,-15.0,6.0,21.0,-15.0,0.174039408564568,0.0061029279604554,0.0002595242403913,0.0099490815773606,0.348818421363831,0.0017153398366645,0.459115326404572,0.0,0.0,4.17522182519315,-0.727563713735435,-15.6088017229642,15.6088017229642,-5.7581554172144,5.7581554172144,-11.4298755907393,11.4298755907393,2.82477817480685,-3.55234188854229,0.0,0.0,0.559702366481724,-0.559702366481724,-6.4471770527889,6.4471770527889,4.90152903815797,-4.90152903815797,-23.7123872951116,23.7123872951116,0.003656075336039,0.996343924663961,0.003656075336039,0.996343924663961,-0.0016687305178493,-0.0003742831759154,-0.0003742831759154,0.0019873448181897,0.99801265518181,0.0009991261176764,0.0009991261176764,-0.267173996879661,0.267173996879661,-0.416951034075055,0.416951034075055,0.0,-0.0016687305178493,0.0,0.0,-0.144171965049054,0.144171965049054,-0.14943677559495,0.14943677559495,-0.148139429019239,0.148139429019239,-0.368713726871647,0.368713726871647,0.0,0.0,0.0,0.0,0.0,0.0,0.0,0.0,1.0,0,0.0,0.0,0.0,0.0,0.0,0.0,0.0,0.0,0.0,0.0,0.0,0.0,0.0,0.0,0.0,0.0,0.0,0.0,0.0,0.0,0.0,0.0,0.0,1.0,0.0,0.0,0.0,0.0,0.0,0.0,0.0,0.0,0.0,0.0,0.0,0.0,0.0,0.0,0.0,0.0,0.0,00-0036197,J.Fromm,,00-0033932,K.Golladay,,,,,,,,,,,,,,,,,,,,,,,,,,,,,,,,,,,,,,,,,,,,,,,,,,,,,,,,,,,,,,,,,0.0,,,,,,,,,,,,,,,,,,,,,,,,,,,,,,,,0.0,,,,,0,,,0.0,0.0,0.0,0.0,,,2021,0.335882872343063,-33.5882872343063,55,0,Turnover on downs,4079,"12/19/21, 13:02:27",2021-12-19T21:00:00Z,MetLife Stadium,"Cloudy Temp: 40° F, Humidity: 45%, Wind: NNW 17 mph",c5980c9e-b37c-11eb-abac-4f5c371de22e,0,0,PASS,0,,,,20,Turnover on downs,2021-12-19T20:47:29Z,13.0,2:23,4.0,1.0,0.0,4.0,4.0,5.0,PUNT,DOWNS,03:41,01:18,NYG 7,DAL 9,3746.0,4167.0,21,6,Home,-15,27,-11.5,43.0,1,outdoors,fieldturf,37.0,8.0,Joe Judge,Mike McCarthy,NYC01,MetLife Stadium,0,0.0,J.Fromm,17.0,,,K.Golladay,19.0,1,0,0.0,0,1,00-0036197,,00-0033932,J.Fromm,17.0,00-0036197,K.Golladay,00-0033932,K.Golladay,00-0033932,0,0,-0.727563713735435,,,,,,0.96815687417984,3.18431258201599,2021-12-19,S.Shepard,2021,REG,NYG,15,00-0032385,WR,Sterling Shepard,Sterling,Shepard,Calf,,Questionable,Calf,,Limited Participation in Practice,2021-12-17T18:49:52Z,2021-12-17 18:49:52
4048,2021_15_TEN_PIT,2021121909,PIT,TEN,REG,15,TEN,away,PIT,PIT,19.0,2021-12-19,71.0,71.0,71.0,Half2,0,22.0,0,4,1.0,0,01:11,PIT 19,10,65.0,(1:11) (Shotgun) 7-D.Foreman right tackle to PIT 16 for 3 yards (34-Te.Edmunds). PIT-90-T.Watt was injured during the play.,run,3.0,1,0,0.0,0,0,0,,,,,right,tackle,,,,,1,2,0.0,,,,,2.0,1.0,19,13,13.0,19.0,-6.0,13.0,19.0,-6.0,0.204400941729546,0.0081821018829941,0.0003089228412136,0.0102794012054801,0.358039259910584,0.0010859186295419,0.417703449726105,0.0,0.0,3.9030938053038,-0.865406567580067,3.85442523972597,-3.85442523972597,-3.21795253991149,3.21795253991149,5.40021171680684,-5.40021171680684,,,0.0,0.0,-1.47453928145114,1.47453928145114,4.86200434896865,-4.86200434896865,-4.84088280252763,4.84088280252763,9.96754771739127,-9.96754771739127,0.371085315942764,0.628914684057236,0.628914684057236,0.371085315942764,0.0169089138507843,0.127765625715256,-0.127765625715256,0.612005770206451,0.387994229793549,0.388145297765732,0.611854702234268,-0.0836019536601484,0.0836019536601484,0.0044793635606765,-0.0044793635606765,,,0.0,0.0,-0.233632057905197,0.233632057905197,0.301951706409454,-0.301951706409454,-0.233632057905197,0.233632057905197,0.270213216543198,-0.270213216543198,0.0,0.0,0.0,0.0,0.0,0.0,0.0,0.0,0.0,0,0.0,0.0,0.0,0.0,0.0,0.0,0.0,0.0,0.0,0.0,0.0,0.0,0.0,0.0,1.0,0.0,0.0,0.0,0.0,0.0,0.0,0.0,1.0,0.0,0.0,0.0,0.0,0.0,0.0,0.0,0.0,0.0,0.0,0.0,0.0,0.0,0.0,0.0,0.0,0.0,0.0,,,,,,,00-0033925,D.Foreman,3.0,,,,,,,,,,,,,,,,,,,,,,,,,,,,,,,,,,,,,,,,,,,PIT,,00-0034858,,Te.Edmunds,,,,,,,,,,,,,,0.0,,,,,,,,,,,,,,,,,,,,,,,,,,,,,,,,0.0,,,,,0,,,0.0,0.0,0.0,0.0,,,2021,,,53,0,Turnover on downs,4048,"12/19/21, 13:02:28",2021-12-19T21:02:00Z,Acrisure Stadium,"Cloudy Temp: 34° F, Humidity: 63%, Wind: N 10 mph",c5981883-b37c-11eb-8fa9-4082cc76fbb5,0,0,RUSH,0,,,,22,Turnover on downs,2021-12-19T20:49:50Z,13.0,4:02,4.0,1.0,0.0,4.0,4.0,0.0,KICKOFF,DOWNS,04:29,00:27,TEN 25,PIT 16,3795.0,4181.0,13,19,Home,6,32,1.0,44.0,0,outdoors,grass,32.0,11.0,Mike Tomlin,Mike Vrabel,PIT00,Heinz Field,0,0.0,,,D.Foreman,7.0,,,0,1,0.0,0,1,,00-0033925,,D.Foreman,7.0,00-0033925,D.Foreman,00-0033925,D.Foreman,00-0033925,0,1,-0.865406567580067,,,,,,0.877925753593445,-87.7925753593445,2021-12-19,T.Watt,2021,REG,PIT,15,00-0033886,LB,T.J. Watt,T.J.,Watt,,,,Groin,,Full Participation in Practice,2021-12-17T20:56:37Z,2021-12-17 20:56:37
4043,2021_05_GB_CIN,2021101002,CIN,GB,REG,5,GB,away,CIN,CIN,47.0,2021-10-10,153.0,153.0,153.0,Overtime,0,25.0,0,5,3.0,0,02:33,CIN 47,16,29.0,"(2:33) (Shotgun) 12-Aa.Rodgers pass short middle to 18-R.Cobb to CIN 32 for 15 yards (30-J.Bates) [91-T.Hendrickson]. CIN-30-J.Bates was injured during the play. The Replay Official reviewed the short of the line to gain ruling, and the play was Upheld. The ruling on the field stands.",pass,15.0,1,0,1.0,0,0,0,short,middle,15.0,0.0,,,,,,,1,1,0.0,,,,,1.0,1.0,22,22,22.0,22.0,0.0,22.0,22.0,0.0,0.560752630233765,0.0593244954943657,0.0004638247191905,0.0617570728063583,0.147154927253723,0.0028040746692568,0.167742967605591,0.0,0.0,1.01007305877283,0.49288823833619,-7.48052914412669,7.48052914412669,-1.43594900549395,1.43594900549395,-6.28720156466142,6.28720156466142,0.49288823833619,0.0,0.49288823833619,0.0,-6.17811627470559,6.17811627470559,4.8253203452332,-4.8253203452332,-14.2122653746619,14.2122653746619,10.7236542008706,-10.7236542008706,0.317701969528571,0.682298030471429,0.682298030471429,0.317701969528571,0.367250684947404,0.367250684947404,-0.367250684947404,0.315047345524025,0.684952654475975,0.317701969528571,0.682298030471429,-0.0227337928281094,0.0227337928281094,-0.582108555099991,0.582108555099991,0.367250684947404,0.0,0.367250684947404,0.0,-0.266309035444466,0.266309035444466,-0.140224173537686,0.140224173537686,-0.363516693902967,0.363516693902967,-0.39305566657637,0.39305566657637,0.0,0.0,0.0,0.0,0.0,1.0,0.0,0.0,0.0,0,0.0,0.0,0.0,0.0,0.0,0.0,0.0,0.0,0.0,0.0,0.0,0.0,0.0,0.0,1.0,0.0,0.0,0.0,0.0,0.0,0.0,1.0,0.0,1.0,0.0,0.0,0.0,0.0,0.0,0.0,0.0,0.0,0.0,0.0,0.0,1.0,0.0,0.0,0.0,0.0,0.0,00-0023459,Aa.Rodgers,15.0,00-0028002,R.Cobb,15.0,,,,,,,,,,,,,,,,,,,,,,,,,,,,,,,,,,,,00-0033935,T.Hendrickson,,,,,,,,,CIN,,00-0034675,,J.Bates,,,,,,,,,,,,,,0.0,,,,,,,,,,,,,,,,,,,,,,,,,,,,,,,,0.0,,,,,1,upheld,,0.0,0.0,0.0,0.0,,,2021,0.482550740242004,51.7449259757996,59,0,Field goal,4043,"10/10/21, 13:02:27",2021-10-10T20:16:43Z,Paycor Stadium,"Partly sunny Temp: 80° F, Humidity: 57%, Wind: S 8 mph, gusts to 12 mph",c59de6a9-b37c-11eb-9064-a3b8d28903d4,0,0,PASS,0,,,,25,Field goal,2021-10-10T20:12:34Z,6.0,2:19,1.0,0.0,1.0,5.0,5.0,0.0,MISSED_FG,FIELD_GOAL,04:14,01:55,GB 39,CIN 32,3935.0,4092.0,25,22,Home,-3,47,-2.0,50.0,0,outdoors,fieldturf,76.0,12.0,Zac Taylor,Matt LaFleur,CIN00,Paul Brown Stadium,0,1.0,A.Rodgers,12.0,,,R.Cobb,18.0,1,0,0.0,0,1,00-0023459,,00-0028002,A.Rodgers,12.0,00-0023459,R.Cobb,00-0028002,R.Cobb,00-0028002,0,0,0.49288823833619,1.15552345749425,3.26732030085987,1.0,0.998851406766335,0.556396818516078,0.953792631626129,4.62073683738709,2021-10-10,J.Bates,2021,REG,CIN,5,00-0034675,S,Jessie Bates,Jessie,Bates,,,,Neck,,Full Participation in Practice,2021-10-08T19:27:26Z,2021-10-08 19:27:26
4039,2021_08_GB_ARI,2021102800,ARI,GB,REG,8,ARI,home,GB,GB,5.0,2021-10-28,15.0,15.0,15.0,Half2,0,17.0,0,4,2.0,1,00:15,GB 5,5,94.0,(:15) (Shotgun) 1-K.Murray pass short right intended for 18-A.Green INTERCEPTED by 29-R.Douglas at GB -5. Touchback. ARI-1-K.Murray was injured during the play.,pass,0.0,1,0,1.0,0,0,0,short,right,5.0,,,,,,,,0,0,0.0,,,,,0.0,0.0,21,24,21.0,24.0,-3.0,21.0,24.0,-3.0,0.200135558843613,0.0007389013771899,0.0002475984802003,0.0029100577812641,0.359752058982849,0.0005779523053206,0.43563786149025,0.0,0.0,4.10679480643012,-4.10679480643012,-6.38402646942996,6.38402646942996,-2.45999981617206,2.45999981617206,-0.791653259309851,0.791653259309851,2.89320519356988,-7.0,0.0,0.0,7.8193295999663,-7.8193295999663,-4.76469880141667,4.76469880141667,18.5029176943935,-18.5029176943935,-16.3260906668165,16.3260906668165,0.504537343978882,0.495462656021118,0.504537343978882,0.495462656021118,-0.44236946105957,-0.544072806835175,-0.544072806835175,0.0621678829193115,0.937832117080688,0.613603591918945,0.613603591918945,-0.429138352129711,0.429138352129711,0.0443080323180553,-0.0443080323180553,-0.0084397196769714,-0.433929741382599,0.0,0.0,-0.12346008926847,0.12346008926847,0.584818349109376,-0.584818349109376,0.978858614859795,-0.978858614859795,-0.828050791396415,0.828050791396415,0.0,0.0,0.0,0.0,0.0,0.0,0.0,0.0,0.0,1,1.0,0.0,0.0,0.0,0.0,0.0,0.0,0.0,0.0,0.0,0.0,0.0,0.0,0.0,0.0,0.0,0.0,0.0,0.0,0.0,0.0,0.0,0.0,1.0,0.0,0.0,0.0,0.0,0.0,0.0,0.0,0.0,0.0,0.0,0.0,0.0,0.0,0.0,0.0,0.0,0.0,00-0035228,K.Murray,,00-0027942,A.Green,,,,,,,,,,,,,00-0033551,R.Douglas,,,,,,,,,,,,,,,,,,,,,,,,,,,,,,,,,,,,,,,,,,,,,,,,,,,0.0,,,,,,,00-0033551,R.Douglas,,,,,,,,,,,,,,,,,,,,,,,GB,0.0,,,,,0,,,0.0,0.0,0.0,0.0,,,2021,0.457880914211273,-45.7880914211273,57,0,Turnover,4039,"10/28/21, 20:22:35",2021-10-29T03:32:12Z,State Farm Stadium,"Sunny Temp: 86° F, Humidity: 15%, Wind: NE 7 mph",c599c1ec-b37c-11eb-a7ee-a216e0da7aac,0,0,INTERCEPTION,0,,,,17,Turnover,2021-10-29T03:22:53Z,12.0,3:11,5.0,1.0,0.0,4.0,4.0,0.0,DOWNS,INTERCEPTION,03:23,00:12,ARI 1,GB 5,3730.0,4039.0,24,21,Home,-3,45,6.5,51.0,0,open,grass ,,,Kliff Kingsbury,Matt LaFleur,PHO00,State Farm Stadium,0,0.0,K.Murray,1.0,,,A.Green,18.0,1,0,0.0,0,1,00-0035228,,00-0027942,K.Murray,1.0,00-0035228,A.Green,00-0027942,A.Green,00-0027942,0,0,-4.10679480643012,,,,,,0.96229362487793,3.77063751220703,2021-10-28,K.Murray,2021,REG,ARI,8,00-0035228,QB,Kyler Murray,Kyler,Murray,,,,right Finger,,Full Participation in Practice,2021-10-27T20:07:19Z,2021-10-27 20:07:19
3996,2021_10_CAR_ARI,2021111407,ARI,CAR,REG,10,ARI,home,CAR,ARI,85.0,2021-11-14,163.0,163.0,163.0,Half2,0,22.0,0,4,3.0,0,02:43,ARI 15,20,-9.0,"(2:43) (No Huddle, Shotgun) 26-E.Benjamin up the middle to ARI 16 for 1 yard (97-Y.Gross-Matos, 49-F.Luvu). CAR-49-F.Luvu was injured during the play.",run,1.0,1,1,0.0,0,0,0,,,,,middle,,,,,,2,2,0.0,,,,,2.0,2.0,10,34,10.0,34.0,-24.0,10.0,34.0,-24.0,0.411556094884872,0.180844128131866,0.0022516446188092,0.176669225096703,0.108138360083103,0.0021714870817959,0.118369109928608,0.0,0.0,-0.626378425396979,-0.676118793897331,-32.5215762522047,32.5215762522047,-8.33719387424808,8.33719387424808,-24.0992663789227,24.0992663789227,,,0.0,0.0,3.49132225885607,-3.49132225885607,-7.03598320504534,7.03598320504534,15.7385968108041,-15.7385968108041,-27.6034624241202,27.6034624241202,0.0002814659383147,0.999718534061685,0.0002814659383147,0.999718534061685,-6.72391906846315e-05,-4.28679850301705e-05,-4.28679850301705e-05,0.0002142267476301,0.99978577325237,0.0001181327024823,0.0001181327024823,-0.286013376572309,0.286013376572309,-0.286656635104074,0.286656635104074,,,0.0,0.0,0.0329139294298596,-0.0329139294298596,-0.100250042291009,0.100250042291009,0.0329139294298596,-0.0329139294298596,-0.173077161147376,0.173077161147376,0.0,0.0,0.0,0.0,0.0,1.0,0.0,0.0,0.0,0,0.0,0.0,0.0,0.0,0.0,0.0,0.0,0.0,0.0,0.0,0.0,0.0,0.0,0.0,0.0,0.0,0.0,0.0,0.0,0.0,0.0,0.0,1.0,0.0,0.0,0.0,0.0,0.0,0.0,0.0,0.0,0.0,0.0,0.0,0.0,0.0,1.0,0.0,0.0,0.0,0.0,,,,,,,00-0036383,E.Benjamin,1.0,,,,,,,,,,,,,,,,,,,,,,,,,,,,,,,,,,,,,,,,,,,,,,,,,00-0034302,F.Luvu,CAR,,,,,,,,,,1.0,00-0036288,Y.Gross-Matos,CAR,,,,,,,,,,,,,,,,,,,,,,,,,,,,,0.0,,,,,0,,,0.0,0.0,0.0,0.0,,,2021,,,52,0,Punt,3996,"11/14/21, 16:05:24",2021-11-14T23:59:23Z,State Farm Stadium,,c5992c6d-b37c-11eb-9617-afa9727fab42,0,0,RUSH,0,,,,22,Punt,2021-11-14T23:57:33Z,3.0,1:17,0.0,0.0,0.0,4.0,4.0,0.0,KICKOFF,PUNT,03:26,02:09,ARI 25,ARI 16,3940.0,4020.0,34,10,Home,-24,44,7.0,42.0,0,closed,grass ,,,Kliff Kingsbury,Matt Rhule,PHO00,State Farm Stadium,0,0.0,,,E.Benjamin,26.0,,,0,1,0.0,0,1,,00-0036383,,E.Benjamin,26.0,00-0036383,E.Benjamin,00-0036383,E.Benjamin,00-0036383,0,1,-0.676118793897331,,,,,,0.824130475521088,-82.4130475521088,2021-11-14,F.Luvu,2021,REG,CAR,10,00-0034302,LB,Frankie Luvu,Frankie,Luvu,Knee,,Questionable,Knee,,Limited Participation in Practice,2021-11-12T18:17:22Z,2021-11-12 18:17:22
3963,2021_18_NE_MIA,2022010907,MIA,NE,REG,18,MIA,home,NE,MIA,58.0,2022-01-09,116.0,116.0,116.0,Half2,0,18.0,0,4,3.0,0,01:56,MIA 42,8,28.0,"(1:56) (Shotgun) 1-T.Tagovailoa scrambles right end to NE 47 for 11 yards (33-J.Williams, 90-C.Barmore). NE-90-C.Barmore was injured during the play. His return is Probable.",run,11.0,1,0,1.0,0,0,1,,,,,right,end,,,,,0,2,0.0,,,,,0.0,2.0,27,24,27.0,24.0,3.0,27.0,24.0,3.0,0.634950697422028,0.0306844189763069,0.0004407697997521,0.0466536469757557,0.116111636161804,0.001906614867039,0.169252246618271,0.0,0.0,1.11740353918867,1.03804744948866,4.85364231956191,-4.85364231956191,3.76583757047774,-3.76583757047774,-4.2629185506033,4.2629185506033,,,0.0,0.0,-7.11127842572751,7.11127842572751,-7.07159149091754,7.07159149091754,0.235716489260085,-0.235716489260085,-5.54727230118907,5.54727230118907,0.859948992729187,0.140051007270813,0.859948992729187,0.140051007270813,0.0740788578987122,0.0973323583602905,0.0973323583602905,0.934027850627899,0.0659721493721008,0.747076869010925,0.747076869010925,0.0884132832180934,-0.0884132832180934,0.260297490798394,-0.260297490798394,,,0.0,0.0,-0.0283801520023315,0.0283801520023315,0.0724463562749987,-0.0724463562749987,-0.0276621320996253,0.0276621320996253,0.232984977521813,-0.232984977521813,0.0,1.0,0.0,0.0,1.0,0.0,0.0,0.0,0.0,0,0.0,0.0,0.0,0.0,0.0,0.0,0.0,0.0,0.0,0.0,0.0,0.0,0.0,0.0,0.0,0.0,0.0,0.0,0.0,0.0,0.0,0.0,1.0,0.0,0.0,0.0,0.0,0.0,0.0,0.0,0.0,0.0,0.0,0.0,0.0,0.0,1.0,0.0,0.0,0.0,0.0,,,,,,,00-0036212,T.Tagovailoa,11.0,,,,,,,,,,,,,,,,,,,,,,,,,,,,,,,,,,,,,,,,,,,,,,,,,00-0036981,C.Barmore,NE,,,,,,,,,,1.0,00-0035241,J.Williams,NE,,,,,,,,,,,,,,,,,,,,,,,,,,,,,0.0,,,,,0,,,0.0,0.0,0.0,0.0,,,2021,,,56,1,First down,3963,"1/9/22, 16:26:49",2022-01-10T00:21:48Z,Hard Rock Stadium,"Cloudy Temp: 76° F, Humidity: 73%, Wind: E 9 mph",c597373f-b37c-11eb-a4b9-33ea453005d5,0,0,RUSH,0,,,,18,Punt,2022-01-10T00:16:14Z,7.0,2:50,2.0,0.0,0.0,4.0,4.0,-5.0,KICKOFF,PUNT,02:53,00:03,MIA 25,NE 47,3848.0,4107.0,24,33,Home,9,57,-6.0,41.0,1,outdoors,grass,75.0,8.0,Brian Flores,Bill Belichick,MIA00,Hard Rock Stadium,0,1.0,T.Tagovailoa,1.0,,1.0,,,1,0,1.0,0,1,00-0036212,,,T.Tagovailoa,1.0,00-0036212,T.Tagovailoa,00-0036212,T.Tagovailoa,00-0036212,0,1,1.03804744948866,,,,,,0.882999658584595,11.7000341415405,2022-01-09,C.Barmore,2021,REG,NE,18,00-0036981,DT,Christian Barmore,Christian,Barmore,Knee,,Questionable,Knee,,Limited Participation in Practice,2022-01-07T20:51:37Z,2022-01-07 20:51:37
3927,2021_08_CIN_NYJ,2021103107,NYJ,CIN,REG,8,CIN,away,NYJ,CIN,75.0,2021-10-31,225.0,225.0,225.0,Half2,0,23.0,0,4,1.0,0,03:45,CIN 25,10,15.0,(3:45) 28-J.Mixon right tackle to CIN 30 for 5 yards (95-Q.Williams). CIN-79-J.Carman was injured during the play.,run,5.0,0,0,0.0,0,0,0,,,,,right,tackle,,,,,3,3,0.0,,,,,3.0,3.0,34,31,31.0,34.0,-3.0,31.0,34.0,-3.0,0.379970014095306,0.0981840118765831,0.0010889302939176,0.138044968247414,0.143760532140732,0.0023167380131781,0.236634820699692,0.0,0.0,0.829314143396914,0.124826631625183,0.468164719116506,-0.468164719116506,3.10398828872712,-3.10398828872712,0.0200041058520249,-0.0200041058520249,,,0.0,0.0,-8.73127830721205,8.73127830721205,11.8295704233751,-11.8295704233751,-17.9837197897723,17.9837197897723,15.5236013983641,-15.5236013983641,0.306816846132278,0.693183153867722,0.693183153867722,0.306816846132278,-0.0172735154628754,-0.0080816447734832,0.0080816447734832,0.710456669330597,0.289543330669403,0.444405466318131,0.55559453368187,0.0030065639802101,-0.0030065639802101,0.0411797968480862,-0.0411797968480862,,,0.0,0.0,0.175186604446336,-0.175186604446336,-0.151224431755917,0.151224431755917,0.175186604446336,-0.175186604446336,-0.0995077539113928,0.0995077539113928,0.0,0.0,0.0,0.0,0.0,0.0,0.0,0.0,0.0,0,0.0,0.0,0.0,0.0,0.0,0.0,0.0,0.0,0.0,0.0,0.0,0.0,0.0,0.0,1.0,0.0,0.0,0.0,0.0,0.0,0.0,0.0,1.0,0.0,0.0,0.0,0.0,0.0,0.0,0.0,0.0,0.0,0.0,0.0,0.0,0.0,0.0,0.0,0.0,0.0,0.0,,,,,,,00-0033897,J.Mixon,5.0,,,,,,,,,,,,,,,,,,,,,,,,,,,,,,,,,,,,,,,,,,,NYJ,,00-0035718,,Q.Williams,,,,,,,,,,,,,,0.0,,,,,,,,,,,,,,,,,,,,,,,,,,,,,,,,0.0,,,,,0,,,0.0,0.0,0.0,0.0,,,2021,,,62,1,First down,3927,"10/31/21, 13:02:40",2021-10-31T19:59:48Z,MetLife Stadium,"Mid 60s and Partly Cloudy Temp: 64° F, Humidity: 64%, Wind: SW 11 mph",c599748a-b37c-11eb-8717-b15655d15a43,0,0,RUSH,0,,,,23,Punt,2021-10-31T19:59:07Z,5.0,1:36,1.0,0.0,0.0,4.0,4.0,0.0,KICKOFF,PUNT,03:45,02:09,CIN 25,CIN 40,3908.0,4059.0,31,34,Home,3,65,-11.5,43.5,0,outdoors,fieldturf,63.0,11.0,Robert Saleh,Zac Taylor,NYC01,MetLife Stadium,0,1.0,,,J.Mixon,28.0,,,0,1,0.0,0,1,,00-0033897,,J.Mixon,28.0,00-0033897,J.Mixon,00-0033897,J.Mixon,00-0033897,0,1,0.124826631625183,,,,,,0.741129875183106,-74.1129875183106,2021-10-31,J.Carman,2021,REG,CIN,8,00-0036865,G,Jackson Carman,Jackson,Carman,,,,Ankle,,Full Participation in Practice,2021-10-29T18:32:12Z,2021-10-29 18:32:12
3903,2021_04_WAS_ATL,2021100300,ATL,WAS,REG,4,WAS,away,ATL,ATL,7.0,2021-10-03,232.0,232.0,232.0,Half2,0,17.0,0,4,,0,03:52,ATL 7,0,70.0,"TWO-POINT CONVERSION ATTEMPT. 4-T.Heinicke pass to 83-R.Seals-Jones is incomplete. ATTEMPT FAILS. ATL-23-E.Harris was injured during the play. PENALTY on ATL-6-D.Fowler, Defensive Offside, 4 yards, enforced at ATL 7 - No Play.",no_play,0.0,0,0,0.0,0,0,0,,,,,,,,,,,3,2,0.0,,,,,2.0,3.0,30,28,28.0,30.0,-2.0,28.0,30.0,-2.0,0.0,0.0,0.0,0.0,0.0,0.0,0.0,0.0,0.0,0.947,0.0,-1.43416546379728,1.43416546379728,-3.26321719045518,3.26321719045518,1.79183312368838,-1.79183312368838,,,0.0,0.0,8.60908087409916,-8.60908087409916,-1.64641452746582,1.64641452746582,11.0475118946342,-11.0475118946342,-6.88668233824006,6.88668233824006,0.319124760657549,0.680875239342451,0.680875239342451,0.319124760657549,0.0,0.0,0.0,0.680875239342451,0.319124760657549,0.397215347707272,0.602784652292728,-0.0674423713673888,0.0674423713673888,0.0154191659697317,-0.0154191659697317,,,0.0,0.0,-0.349268512771723,0.349268512771723,0.559663766058325,-0.559663766058325,-0.352477686451075,0.352477686451075,0.415981166990637,-0.415981166990637,0.0,0.0,0.0,0.0,0.0,0.0,0.0,0.0,0.0,0,0.0,0.0,0.0,0.0,0.0,0.0,0.0,0.0,0.0,0.0,0.0,0.0,0.0,0.0,0.0,0.0,1.0,0.0,0.0,0.0,0.0,0.0,0.0,0.0,0.0,0.0,0.0,0.0,0.0,0.0,0.0,0.0,0.0,0.0,0.0,0.0,0.0,0.0,0.0,0.0,0.0,,,,,,,,,,,,,,,,,,,,,,,,,,,,,,,,,,,,,,,,,,,,,,,,,,,,,,,,,,,,,,,,,,,,,,0.0,,,,,,,,,,,,,,,,,,,,,,,,,,,,,,,,0.0,ATL,00-0032052,D.Fowler,4.0,0,,Defensive Offside,0.0,0.0,0.0,0.0,,,2021,,,54,1,Touchdown,3903,"10/3/21, 13:02:46",2021-10-03T19:53:44Z,Mercedes-Benz Stadium,"Cloudy Temp: 76° F, Humidity: 76%, Wind: SSW 6 mph",c59e6e09-b37c-11eb-aaa9-9d79bbf40974,0,0,PENALTY,0,,,,17,Touchdown,2021-10-03T19:41:57Z,10.0,6:08,6.0,1.0,1.0,4.0,4.0,-5.0,PUNT,TOUCHDOWN,10:00,03:52,WAS 30,ATL 17,3562.0,3932.0,34,30,Home,-4,64,-1.0,47.5,0,open,fieldturf,,,Arthur Smith,Ron Rivera,ATL97,Mercedes-Benz Stadium,0,0.0,T.Heinicke,4.0,,,R.Seals-Jones,83.0,1,0,0.0,0,1,00-0031800,,00-0033611,T.Heinicke,4.0,00-0031800,,,R.Seals-Jones,00-0033611,0,1,0.0,,,,,,,,2021-10-03,E.Harris,2021,REG,ATL,4,00-0032320,S,Erik Harris,Erik,Harris,,,,Back,,Full Participation in Practice,2021-10-01T17:28:42Z,2021-10-01 17:28:42
3811,2021_04_CLE_MIN,2021100305,MIN,CLE,REG,4,MIN,home,CLE,CLE,33.0,2021-10-03,88.0,88.0,88.0,Half2,0,21.0,0,4,3.0,0,01:28,CLE 33,3,55.0,(1:28) (Shotgun) 8-K.Cousins pass incomplete short right to 19-A.Thielen (97-M.Jackson). CLE-90-J.Clowney was injured during the play.,pass,0.0,1,0,1.0,0,0,0,short,right,3.0,,,,,,,,3,3,0.0,,,,,3.0,3.0,7,14,7.0,14.0,-7.0,7.0,14.0,-7.0,0.222049787640572,0.0439382307231426,0.0003501673054415,0.0329634957015514,0.338408023118973,0.0012235777685418,0.361066699028015,0.0,0.0,3.18187862139894,-1.28258430835558,-7.03669673435611,7.03669673435611,-7.65056235881639,7.65056235881639,1.17732050368392,-1.17732050368392,0.531909758632537,-1.81449406698812,0.0,0.0,7.64441017693025,-7.64441017693025,-7.89101714565186,7.89101714565186,-19.8447403133323,19.8447403133323,19.7825704594831,-19.7825704594831,0.178220674395561,0.821779325604439,0.178220674395561,0.821779325604439,-0.0654231160879135,-0.0484692975878716,-0.0484692975878716,0.112797558307648,0.887202441692352,0.15924060344696,0.15924060344696,-0.462110757870673,0.462110757870673,0.0112946812837109,-0.0112946812837109,0.0,-0.0654231160879135,0.0,0.0,0.0564108476965413,-0.0564108476965413,-0.0381170436739922,0.0381170436739922,-0.364781977144004,0.364781977144004,0.454244546592236,-0.454244546592236,0.0,0.0,0.0,0.0,0.0,1.0,0.0,0.0,1.0,0,0.0,0.0,0.0,0.0,0.0,0.0,0.0,0.0,0.0,0.0,0.0,0.0,0.0,0.0,0.0,0.0,0.0,0.0,0.0,0.0,0.0,0.0,0.0,1.0,0.0,0.0,0.0,0.0,0.0,0.0,0.0,0.0,0.0,0.0,0.0,0.0,0.0,0.0,0.0,0.0,0.0,00-0029604,K.Cousins,,00-0030035,A.Thielen,,,,,,,,,,,,,,,,,,,,,,,,,,,,,,,,,,,,,,,,,,,,,,,,,,,,,,,,,,,,,,,,,0.0,,,,,,,00-0029568,M.Jackson,,,,,,,,,,,,,,,,,,,,,,,,0.0,,,,,0,,,0.0,0.0,0.0,0.0,,,2021,0.715662002563477,-71.5662002563477,53,0,Turnover on downs,3811,"10/3/21, 13:02:22",2021-10-03T19:55:53Z,U.S. Bank Stadium,"N/A (Indoors) Temp: 65° F, Humidity: 66%, Wind: NNW 11 mph",c59e437e-b37c-11eb-b6c4-9047f43b506b,0,0,PASS,0,,,,21,Turnover on downs,2021-10-03T19:50:05Z,8.0,2:24,2.0,0.0,0.0,4.0,4.0,0.0,PUNT,DOWNS,03:45,01:21,MIN 12,CLE 33,3652.0,3853.0,14,7,Home,-7,21,-1.0,52.0,0,dome,sportturf,,,Mike Zimmer,Kevin Stefanski,MIN01,U.S. Bank Stadium,0,0.0,K.Cousins,8.0,,,A.Thielen,19.0,1,0,0.0,0,1,00-0029604,,00-0030035,K.Cousins,8.0,00-0029604,A.Thielen,00-0030035,A.Thielen,00-0030035,0,1,-1.28258430835558,0.297489350765498,5.02582123223692,3.0,0.976725749118486,0.976725749118486,0.945587575435638,5.44124245643616,2021-10-03,J.Clowney,2021,REG,CLE,4,00-0031364,DE,Jadeveon Clowney,Jadeveon,Clowney,,,,Neck,,Full Participation in Practice,2021-10-01T17:36:04Z,2021-10-01 17:36:04
3811,2021_09_CHI_PIT,2021110800,PIT,CHI,REG,9,CHI,away,PIT,CHI,75.0,2021-11-08,167.0,167.0,167.0,Half2,0,22.0,0,4,1.0,0,02:47,CHI 25,10,75.0,(2:47) (Shotgun) 1-J.Fields pass short left to 12-A.Robinson to CHI 34 for 9 yards (35-A.Maulet). PIT-97-C.Heyward was injured during the play.,pass,9.0,1,0,1.0,0,0,0,short,left,10.0,-1.0,,,,,,,1,1,0.0,,,,,1.0,1.0,26,20,20.0,26.0,-6.0,20.0,26.0,-6.0,0.599180996417999,0.0584637895226479,0.0010692240903154,0.064334511756897,0.109389565885067,0.0011838753707706,0.166378080844879,0.0,0.0,0.867311615264043,0.380189435789362,6.30145838028746,-6.30145838028746,-4.46904525088519,4.46904525088519,3.01215379509121,-3.01215379509121,0.417073673568666,-0.0368842377793044,0.417073673568666,-0.0368842377793044,-8.76053844869603,8.76053844869603,8.12880472774438,-8.12880472774438,-18.9129620962194,18.9129620962194,20.090064909295,-20.090064909295,0.173409789800644,0.826590210199356,0.826590210199356,0.173409789800644,0.0238619595766068,0.0235667824745178,-0.0235667824745178,0.802728250622749,0.197271749377251,0.141936361789703,0.858063638210297,-0.0074583857693904,0.0074583857693904,0.158251990788459,-0.158251990788459,0.0,0.0238619595766068,0.0,0.0238619595766068,0.168460686915397,-0.168460686915397,-0.126929059624672,0.126929059624672,0.168460686915397,-0.168460686915397,-0.0877704992890358,0.0877704992890358,0.0,0.0,0.0,0.0,0.0,0.0,0.0,0.0,0.0,0,0.0,0.0,0.0,0.0,0.0,0.0,0.0,0.0,0.0,0.0,0.0,0.0,0.0,0.0,1.0,0.0,0.0,0.0,0.0,0.0,0.0,0.0,0.0,1.0,0.0,0.0,0.0,0.0,0.0,0.0,0.0,0.0,0.0,0.0,0.0,1.0,0.0,0.0,0.0,0.0,0.0,00-0036945,J.Fields,9.0,00-0031428,A.Robinson,9.0,,,,,,,,,,,,,,,,,,,,,,,,,,,,,,,,,,,,,,,,,,,,,,PIT,,00-0033503,,A.Maulet,,,,,,,,,,,,,,0.0,,,,,,,,,,,,,,,,,,,,,,,,,,,,,,,,0.0,,,,,0,,,0.0,0.0,0.0,0.0,,,2021,0.604130148887634,39.5869851112366,49,1,First down,3811,"11/8/21, 20:15:57",2021-11-09T04:10:22Z,Acrisure Stadium,"Clear Temp: 55° F, Humidity: 50%, Wind: South 6 mph",c5994cf9-b37c-11eb-a4b9-33ea453005d5,0,0,PASS,0,,,,21,Touchdown,2021-11-09T04:09:31Z,7.0,1:06,3.0,1.0,1.0,4.0,4.0,0.0,KICKOFF,TOUCHDOWN,02:52,01:46,CHI 25,PIT 16,3784.0,4029.0,27,29,Home,2,56,7.0,40.0,0,outdoors,grass ,55.0,7.0,Mike Tomlin,Matt Nagy,PIT00,Heinz Field,0,1.0,J.Fields,1.0,,,A.Robinson,12.0,1,0,0.0,0,1,00-0036945,,00-0031428,J.Fields,1.0,00-0036945,A.Robinson,00-0031428,A.Robinson,00-0031428,0,0,0.380189435789362,0.154284245057438,3.78647271085356,1.0,1.0,0.955029048607685,0.890296697616577,10.9703302383423,2021-11-08,C.Heyward,2021,REG,PIT,9,00-0027969,DT,Cameron Heyward,Cameron,Heyward,,,,Ankle,,Full Participation in Practice,2021-11-06T18:38:37Z,2021-11-06 18:38:37
3797,2021_09_DEN_DAL,2021110703,DAL,DEN,REG,9,DAL,home,DEN,DEN,46.0,2021-11-07,122.0,122.0,122.0,Half2,0,21.0,0,4,1.0,0,02:02,DEN 46,10,65.0,"(2:02) (No Huddle, Shotgun) 4-D.Prescott pass incomplete deep middle to 88-C.Lamb (21-R.Darby). DEN-21-R.Darby was injured during the play. His return is Questionable.",pass,0.0,1,1,1.0,0,0,0,deep,middle,41.0,,,,,,,,0,2,0.0,,,,,0.0,2.0,8,30,8.0,30.0,-22.0,8.0,30.0,-22.0,0.411409020423889,0.0153451012447476,0.0003239984216634,0.0230675581842661,0.155501142144203,0.0029642176814377,0.391388982534409,0.0,0.0,3.00399853166891,-0.520110002078582,-27.3432880510349,27.3432880510349,-4.90319362920318,4.90319362920318,-21.8944795719485,21.8944795719485,2.49315876790206,-3.01326876998064,0.0,0.0,5.34402496286202,-5.34402496286202,-11.5795321006849,11.5795321006849,28.3848267596622,-28.3848267596622,-52.7953355575559,52.7953355575559,0.0004866535018663,0.999513346498134,0.0004866535018663,0.999513346498134,-0.0001661759451963,-8.53905075928196e-05,-8.53905075928196e-05,0.00032047755667,0.99967952244333,0.0002920575789175,0.0002920575789175,-0.255779143878155,0.255779143878155,-0.250965291361401,0.250965291361401,-6.31151197012514e-05,-0.000103060825495,0.0,0.0,0.0240523840766401,-0.0240523840766401,-0.151690928918808,0.151690928918808,0.0239892689569389,-0.0239892689569389,-0.366562314410087,0.366562314410087,0.0,0.0,0.0,0.0,0.0,0.0,0.0,0.0,1.0,0,0.0,0.0,0.0,0.0,0.0,0.0,0.0,0.0,0.0,0.0,0.0,0.0,0.0,0.0,0.0,0.0,0.0,0.0,0.0,0.0,0.0,0.0,0.0,1.0,0.0,0.0,0.0,0.0,0.0,0.0,0.0,0.0,0.0,0.0,0.0,0.0,0.0,0.0,0.0,0.0,0.0,00-0033077,D.Prescott,,00-0036358,C.Lamb,,,,,,,,,,,,,,,,,,,,,,,,,,,,,,,,,,,,,,,,,,,,,,,,,,,,,,,,,,,,,,,,,0.0,,,,,,,00-0032195,R.Darby,,,,,,,,,,,,,,,,,,,,,,,,0.0,,,,,0,,,0.0,0.0,0.0,0.0,,,2021,0.349183857440949,-34.9183857440949,50,1,First down,3797,"11/7/21, 13:02:53",2021-11-07T20:54:54Z,AT&T Stadium,"T: 66; H: 47%; WS, 9 mph Temp: 68° F, Humidity: 47%, Wind: South 9 mph",c5994245-b37c-11eb-88b5-52a417aac100,0,0,PASS,0,,,,21,Touchdown,2021-11-07T20:53:22Z,11.0,2:08,5.0,1.0,1.0,4.0,4.0,0.0,PUNT,TOUCHDOWN,03:03,00:55,DAL 35,DEN 4,3730.0,4041.0,30,16,Home,-14,46,10.5,50.0,0,closed,matrixturf,,,Mike McCarthy,Vic Fangio,DAL00,AT&T Stadium,0,0.0,D.Prescott,4.0,,,C.Lamb,88.0,1,0,0.0,0,1,00-0033077,,00-0036358,D.Prescott,4.0,00-0033077,C.Lamb,00-0036358,C.Lamb,00-0036358,0,1,-0.520110002078582,1.07339748473782,3.75254042816232,5.0,1.0,1.0,0.872663855552673,12.7336144447327,2021-11-07,R.Darby,2021,REG,DEN,9,00-0032195,CB,Ronald Darby,Ronald,Darby,,,,Shoulder,,Full Participation in Practice,2021-11-05T19:51:34Z,2021-11-05 19:51:34
3744,2021_14_SEA_HOU,2021121203,HOU,SEA,REG,14,HOU,home,SEA,HOU,51.0,2021-12-12,293.0,293.0,293.0,Half2,0,19.0,0,4,1.0,0,04:53,HOU 49,10,27.0,"(4:53) (No Huddle, Shotgun) 10-D.Mills pass incomplete short right to 12-N.Collins (98-A.Robinson). SEA-2-D.Reed was injured during the play. His return is Questionable. HOU-9-B.Jordan was injured during the play. His return is Probable.",pass,0.0,1,1,1.0,0,0,0,short,right,0.0,,,,,,,,3,2,0.0,,,,,3.0,2.0,13,33,13.0,33.0,-20.0,13.0,33.0,-20.0,0.240542709827423,0.0584579557180405,0.0005461772670969,0.0892364531755447,0.232275187969208,0.0028871374670416,0.376054376363754,0.0,0.0,2.53385907947086,-0.485217026318423,-24.2241672443903,24.2241672443903,-12.2924954565532,12.2924954565532,-15.354342641662,15.354342641662,-0.485165068879724,-5.19574386999011e-05,0.0,0.0,-20.9415895397316,20.9415895397316,13.2742117060407,-13.2742117060407,-24.4506120678336,24.4506120678336,12.9124969746218,-12.9124969746218,0.0014996620593592,0.998500337940641,0.0014996620593592,0.998500337940641,-0.0003572832792997,-5.3802301408723e-05,-5.3802301408723e-05,0.0011423787800595,0.99885762121994,0.0004160133539699,0.0004160133539699,-0.40845159501865,0.40845159501865,-0.427775809883504,0.427775809883504,0.0,-0.0003572832792997,0.0,0.0,-0.137650197573992,0.137650197573992,-0.153493355492439,0.153493355492439,-0.173542535134646,0.173542535134646,-0.157851112539257,0.157851112539257,0.0,0.0,0.0,0.0,0.0,0.0,0.0,0.0,1.0,0,0.0,0.0,0.0,0.0,0.0,0.0,0.0,0.0,0.0,0.0,0.0,0.0,0.0,0.0,0.0,0.0,0.0,0.0,0.0,0.0,0.0,0.0,0.0,1.0,0.0,0.0,0.0,0.0,0.0,0.0,0.0,0.0,0.0,0.0,0.0,0.0,0.0,0.0,0.0,0.0,0.0,00-0036898,D.Mills,,00-0036554,N.Collins,,,,,,,,,,,,,,,,,,,,,,,,,,,,,,,,,,,,,,,,,,,,,,,,,,,,,,,,,,,,,,,,,0.0,,,,,,,00-0036426,A.Robinson,,,,,,,,,,,,,,,,,,,,,,,,0.0,,,,,0,,,0.0,0.0,0.0,0.0,,,2021,0.770369112491608,-77.0369112491608,54,0,Turnover on downs,3744,"12/12/21, 13:02:27",2021-12-12T20:55:31Z,NRG Stadium,"Clear Temp: 55° F, Humidity: 46%, Wind: NE 4 mph",c59842b5-b37c-11eb-b268-91616e0aa8ce,0,0,PASS,0,,,,19,Turnover on downs,2021-12-12T20:54:01Z,6.0,1:17,2.0,0.0,0.0,4.0,4.0,0.0,KICKOFF,DOWNS,05:26,04:09,HOU 26,SEA 47,3674.0,3815.0,33,13,Home,-20,46,-10.0,40.5,0,open,astroturf,,,David Culley,Pete Carroll,HOU00,NRG Stadium,0,0.0,D.Mills,10.0,,,N.Collins,12.0,1,0,0.0,0,1,00-0036898,,00-0036554,D.Mills,10.0,00-0036898,N.Collins,00-0036554,N.Collins,00-0036554,0,1,-0.485217026318423,0.829469071434868,7.10468171804678,6.0,0.614582922775298,0.238884527701885,0.881995975971222,11.8004024028778,2021-12-12,D.Reed,2021,REG,SEA,14,00-0034384,CB,D.J. Reed,D.J.,Reed,,,,Shoulder,,Full Participation in Practice,2021-12-10T22:04:20Z,2021-12-10 22:04:20
3698,2021_08_SF_CHI,2021103102,CHI,SF,REG,8,CHI,home,SF,CHI,74.0,2021-10-31,274.0,274.0,274.0,Half2,0,14.0,0,4,4.0,0,04:34,CHI 26,24,1.0,"(4:34) 16-P.O'Donnell punts 44 yards to SF 30, Center-48-P.Scales. 11-B.Aiyuk to SF 37 for 7 yards (81-J.Holtz, 57-C.Jones). CHI-81-J.Holtz was injured during the play.",punt,0.0,0,0,0.0,0,0,0,,,,,,,,44.0,,,3,3,0.0,,,,,3.0,3.0,22,30,22.0,30.0,-8.0,22.0,30.0,-8.0,0.340190500020981,0.168154120445251,0.0028494135476648,0.278477609157562,0.0807656571269035,0.0028463052585721,0.126716434955597,0.0,0.0,-1.32449982594699,-0.365466624032706,-12.3726606490528,12.3726606490528,-3.69626692531165,3.69626692531165,-10.7357579957184,10.7357579957184,,,0.0,0.0,0.85131980321642,-0.85131980321642,-7.55522379444165,7.55522379444165,-0.871033386152312,0.871033386152312,-3.48424765175321,3.48424765175321,0.0545078590512276,0.945492140948772,0.0545078590512276,0.945492140948772,-0.0074489787220954,-0.0091270059347152,-0.0091270059347152,0.0470588803291321,0.952941119670868,0.0480390638113022,0.0480390638113022,-0.178348961226984,0.178348961226984,-0.33552243811021,0.33552243811021,,,0.0,0.0,-0.0152616218564882,0.0152616218564882,-0.196355760097504,0.196355760097504,-0.0313617006776704,0.0313617006776704,-0.0932533740997314,0.0932533740997314,0.0,0.0,0.0,0.0,0.0,0.0,0.0,0.0,0.0,0,0.0,0.0,0.0,0.0,0.0,0.0,0.0,0.0,0.0,0.0,0.0,0.0,0.0,0.0,0.0,0.0,0.0,0.0,0.0,0.0,0.0,0.0,0.0,0.0,0.0,0.0,0.0,0.0,0.0,0.0,0.0,0.0,0.0,1.0,0.0,0.0,1.0,0.0,0.0,0.0,0.0,,,,,,,,,,,,,,,,,,,,,,00-0036261,B.Aiyuk,,,,,,,00-0031079,P.O'Donnell,,,,,,,,,,,,,,,,,,,,,,,,,,,00-0031130,C.Jones,CHI,,,,,,,,,,1.0,00-0032986,J.Holtz,CHI,,,,,,,,,,,,,,,,,,,,,,,,,,,,SF,7.0,,,,,0,,,0.0,0.0,0.0,0.0,,,2021,,,50,0,Punt,3698,"10/31/21, 13:02:31",2021-10-31T19:48:37Z,Soldier Field,"Partly Sunny Temp: 52° F, Humidity: 69%, Wind: SE 13 mph",c5999f18-b37c-11eb-98fb-8728a42333e4,0,0,PUNT,1,,,,14,Punt,2021-10-31T19:44:10Z,4.0,2:10,1.0,0.0,0.0,4.0,4.0,15.0,KICKOFF,PUNT,06:34,04:24,CHI 25,CHI 26,3555.0,3698.0,33,22,Home,-11,55,-4.5,40.0,0,outdoors,grass ,53.0,12.0,Matt Nagy,Kyle Shanahan,CHI98,Soldier Field,0,0.0,,,,,,,0,0,0.0,1,0,,,,,,,,,,,0,0,-0.365466624032706,,,,,,,,2021-10-31,J.Holtz,2021,REG,CHI,8,00-0032986,TE,J.P. Holtz,J.P.,Holtz,,,,Quadricep,,Full Participation in Practice,2021-10-29T18:23:06Z,2021-10-29 18:23:06
3698,2021_06_SEA_PIT,2021101711,PIT,SEA,REG,6,PIT,home,SEA,PIT,54.0,2021-10-17,198.0,198.0,198.0,Half2,0,22.0,0,4,2.0,0,03:18,PIT 46,1,40.0,"(3:18) (Shotgun) 22-N.Harris up the middle to PIT 49 for 3 yards (52-D.Taylor, 99-A.Woods). SEA-52-D.Taylor was injured during the play.",run,3.0,1,0,0.0,0,0,0,,,,,middle,,,,,,3,3,0.0,,,,,3.0,3.0,17,17,17.0,17.0,0.0,17.0,17.0,0.0,0.336998045444489,0.0596418492496014,0.000610519433394,0.0807392373681068,0.190754354000092,0.0038056997582316,0.327450275421143,0.0,0.0,2.1267051412724,0.119166427466553,-0.100469310418703,0.100469310418703,-4.69907141962904,4.69907141962904,5.01050191791822,-5.01050191791822,,,0.0,0.0,9.33535382605623,-9.33535382605623,-1.75808624420083,1.75808624420083,24.8677417814615,-24.8677417814615,-18.5275234736363,18.5275234736363,0.629790127277374,0.370209872722626,0.629790127277374,0.370209872722626,-0.0088043808937072,-0.0148036479949951,-0.0148036479949951,0.620985746383667,0.379014253616333,0.685951769351959,0.685951769351959,-0.260818651095761,0.260818651095761,0.359774758450392,-0.359774758450392,,,0.0,0.0,0.092103898525238,-0.092103898525238,0.282527608208064,-0.282527608208064,0.092103898525238,-0.092103898525238,0.257226755253676,-0.257226755253676,0.0,1.0,0.0,0.0,0.0,0.0,0.0,0.0,0.0,0,0.0,0.0,0.0,0.0,0.0,0.0,0.0,0.0,0.0,0.0,0.0,0.0,0.0,0.0,0.0,0.0,0.0,0.0,0.0,0.0,0.0,0.0,1.0,0.0,0.0,0.0,0.0,0.0,0.0,0.0,0.0,0.0,0.0,0.0,0.0,0.0,1.0,0.0,0.0,0.0,0.0,,,,,,,00-0036893,N.Harris,3.0,,,,,,,,,,,,,,,,,,,,,,,,,,,,,,,,,,,,,,,,,,,,,,,,,00-0027723,A.Woods,SEA,,,,,,,,,,1.0,00-0036413,D.Taylor,SEA,,,,,,,,,,,,,,,,,,,,,,,,,,,,,0.0,,,,,0,,,0.0,0.0,0.0,0.0,,,2021,,,52,1,First down,3698,"10/17/21, 20:22:45",2021-10-18T03:15:05Z,Acrisure Stadium,"Mostly Cloudy Temp: 54° F, Humidity: 63%, Wind: W 7 mph",c599f2d0-b37c-11eb-ac67-82694b975169,0,0,RUSH,0,,,,22,Field goal,2021-10-18T03:13:04Z,9.0,3:49,3.0,0.0,1.0,4.0,4.0,-10.0,PUNT,FIELD_GOAL,05:19,01:30,PIT 26,SEA 34,3632.0,3877.0,20,23,Home,3,43,5.5,43.0,0,outdoors,grass ,49.0,6.0,Mike Tomlin,Pete Carroll,PIT00,Heinz Field,0,1.0,,,N.Harris,22.0,,,0,1,1.0,0,1,,00-0036893,,N.Harris,22.0,00-0036893,N.Harris,00-0036893,N.Harris,00-0036893,0,1,0.119166427466553,,,,,,0.261954963207245,-26.1954963207245,2021-10-17,D.Taylor,2021,REG,SEA,6,00-0036413,DE,Darrell Taylor,Darrell,Taylor,,,,Ankle,,Full Participation in Practice,2021-10-15T21:05:54Z,2021-10-15 21:05:54
3672,2021_13_PHI_NYJ,2021120507,NYJ,PHI,REG,13,PHI,away,NYJ,NYJ,37.0,2021-12-05,134.0,134.0,134.0,Half2,0,16.0,0,4,2.0,0,02:14,NYJ 37,7,6.0,(2:14) (Shotgun) 14-K.Gainwell right guard to NYJ 35 for 2 yards (97-N.Shepherd). PHI-62-J.Kelce was injured during the play.,run,2.0,1,0,0.0,0,0,0,,,,,right,guard,,,,,1,2,0.0,,,,,2.0,1.0,18,33,33.0,18.0,15.0,33.0,18.0,15.0,0.44159808754921,0.0374401360750198,0.0003488081565592,0.0343674644827843,0.239905655384064,0.0021191390696913,0.244220718741417,0.0,0.0,2.07990999956382,-0.0597645966918208,-22.2873638096503,22.2873638096503,-4.53359130761113,4.53359130761113,-12.439021751638,12.439021751638,,,0.0,0.0,8.64859785145382,-8.64859785145382,-10.1018858800115,10.1018858800115,16.0811968362541,-16.0811968362541,-26.3984236959539,26.3984236959539,0.998985588550568,0.0010144114494323,0.0010144114494323,0.998985588550568,-0.0001425147056579,-0.0001072287559509,0.0001072287559509,0.0011569261550903,0.99884307384491,0.999687671661377,0.000312328338623,-0.0647511220322303,0.0647511220322303,-0.293519068907276,0.293519068907276,,,0.0,0.0,0.10975610259457,-0.10975610259457,-0.21199693208775,0.21199693208775,0.573874130654172,-0.573874130654172,-0.794337587936134,0.794337587936134,0.0,0.0,0.0,0.0,0.0,0.0,0.0,0.0,0.0,0,0.0,0.0,0.0,0.0,0.0,0.0,0.0,0.0,0.0,0.0,0.0,0.0,0.0,0.0,1.0,0.0,0.0,0.0,0.0,0.0,0.0,0.0,1.0,0.0,0.0,0.0,0.0,0.0,0.0,0.0,0.0,0.0,0.0,0.0,0.0,0.0,0.0,0.0,0.0,0.0,0.0,,,,,,,00-0036919,K.Gainwell,2.0,,,,,,,,,,,,,,,,,,,,,,,,,,,,,,,,,,,,,,,,,,,NYJ,,00-0034760,,N.Shepherd,,,,,,,,,,,,,,0.0,,,,,,,,,,,,,,,,,,,,,,,,,,,,,,,,0.0,,,,,0,,,0.0,0.0,0.0,0.0,,,2021,,,54,0,Punt,3672,"12/5/21, 13:02:33",2021-12-05T20:58:56Z,MetLife Stadium,"Mostly Sunny and Cool Temp: 47° F, Humidity: 32%, Wind: NNE Calm mph",c59883c9-b37c-11eb-aaaa-3cd93d2e7884,0,0,RUSH,0,,,,16,Punt,2021-12-05T20:54:13Z,7.0,3:35,2.0,0.0,0.0,4.0,4.0,0.0,DOWNS,PUNT,05:23,01:48,PHI 37,PHI 43,3550.0,3740.0,33,18,Home,-15,51,-5.0,44.0,0,outdoors,fieldturf,45.0,0.0,Robert Saleh,Nick Sirianni,NYC01,MetLife Stadium,0,0.0,,,K.Gainwell,14.0,,,0,1,0.0,0,1,,00-0036919,,K.Gainwell,14.0,00-0036919,K.Gainwell,00-0036919,K.Gainwell,00-0036919,0,1,-0.0597645966918208,,,,,,0.0958028882741928,-9.58028882741928,2021-12-05,J.Kelce,2021,REG,PHI,13,00-0028129,C,Jason Kelce,Jason,Kelce,,,,Not injury related - resting player,Knee,Full Participation in Practice,2021-12-03T19:53:42Z,2021-12-03 19:53:42
3667,2021_02_LV_PIT,2021091908,PIT,LV,REG,2,PIT,home,LV,LV,38.0,2021-09-19,232.0,232.0,232.0,Half2,0,19.0,0,4,3.0,0,03:52,LV 38,10,30.0,(3:52) (Shotgun) 7-B.Roethlisberger pass incomplete short middle to 11-C.Claypool (32-D.Leavitt). LV-32-D.Leavitt was injured during the play.,pass,0.0,1,0,1.0,0,0,0,short,middle,11.0,,,,,,,,1,2,0.0,,,,,1.0,2.0,14,23,14.0,23.0,-9.0,14.0,23.0,-9.0,0.343970775604248,0.0553721971809864,0.0003149964904878,0.0684507340192795,0.251352190971375,0.0047391611151397,0.275799930095673,0.0,0.0,2.04823268315522,-1.49442866510166,-11.6081163407517,11.6081163407517,4.08613249706104,-4.08613249706104,-16.3239652046206,16.3239652046206,1.71389013918815,-3.20831880428981,0.0,0.0,-9.02764397766441,9.02764397766441,0.100287034762672,-0.100287034762672,17.0259547565947,-17.0259547565947,-34.2889144035609,34.2889144035609,0.0850005447864533,0.914999455213547,0.0850005447864533,0.914999455213547,-0.0287027694284916,-0.0307398959994316,-0.0307398959994316,0.0562977753579617,0.943702224642038,0.104999780654907,0.104999780654907,-0.0081749144377072,0.0081749144377072,-0.556210349335017,0.556210349335017,0.0,-0.0287027694284916,0.0,0.0,-0.0755705507367616,0.0755705507367616,-0.204063007639613,0.204063007639613,-0.0755705507367616,0.0755705507367616,-0.488978160576786,0.488978160576786,0.0,0.0,0.0,0.0,0.0,1.0,0.0,0.0,1.0,0,0.0,0.0,0.0,0.0,0.0,0.0,0.0,0.0,0.0,0.0,0.0,0.0,0.0,0.0,0.0,0.0,0.0,0.0,0.0,0.0,0.0,0.0,0.0,1.0,0.0,0.0,0.0,0.0,0.0,0.0,0.0,0.0,0.0,0.0,0.0,0.0,0.0,0.0,0.0,0.0,0.0,00-0022924,B.Roethlisberger,,00-0036326,C.Claypool,,,,,,,,,,,,,,,,,,,,,,,,,,,,,,,,,,,,,,,,,,,,,,,,,,,,,,,,,,,,,,,,,0.0,,,,,,,00-0034726,D.Leavitt,,,,,,,,,,,,,,,,,,,,,,,,0.0,,,,,0,,,0.0,0.0,0.0,0.0,,,2021,0.665738105773926,-66.5738105773926,50,0,Field goal,3667,"9/19/21, 13:02:24",2021-09-19T19:53:45Z,Acrisure Stadium,"Sunny Temp: 79° F, Humidity: 52%, Wind: SW 2 mph",c59f1600-b37c-11eb-abac-4f5c371de22e,0,0,PASS,0,,,,19,Field goal,2021-09-19T19:49:09Z,8.0,2:09,2.0,0.0,1.0,4.0,4.0,0.0,PUNT,FIELD_GOAL,05:51,03:42,PIT 32,LV 38,3511.0,3689.0,26,17,Home,-9,43,5.5,46.5,0,outdoors,grass ,77.0,4.0,Mike Tomlin,Jon Gruden,PIT00,Heinz Field,0,0.0,B.Roethlisberger,7.0,,,C.Claypool,11.0,1,0,0.0,0,1,00-0022924,,00-0036326,B.Roethlisberger,7.0,00-0022924,C.Claypool,00-0036326,C.Claypool,00-0036326,0,1,-1.49442866510166,0.291151763209166,3.70986987228389,2.0,0.997730329836486,0.993307090568123,0.99060845375061,0.939154624938965,2021-09-19,D.Leavitt,2021,REG,LV,2,00-0034726,S,Dallin Leavitt,Dallin,Leavitt,,,,Hip,,Full Participation in Practice,2021-09-17T19:32:12Z,2021-09-17 19:32:12
3643,2021_15_CIN_DEN,2021121910,DEN,CIN,REG,15,CIN,away,DEN,CIN,78.0,2021-12-19,220.0,220.0,220.0,Half2,0,21.0,0,4,1.0,0,03:40,CIN 22,10,20.0,(3:40) 28-J.Mixon right tackle to CIN 26 for 4 yards (98-M.Purcell). DEN-98-M.Purcell was injured during the play.,run,4.0,0,0,0.0,0,0,0,,,,,right,tackle,,,,,3,2,0.0,,,,,2.0,3.0,10,15,15.0,10.0,5.0,15.0,10.0,5.0,0.438297122716904,0.100380808115005,0.0011781259672716,0.141641855239868,0.126580446958542,0.0022901534102857,0.189631536602974,0.0,0.0,0.416750740958378,-0.0176119888201356,-8.46234976901864,8.46234976901864,-8.32286013563862,8.32286013563862,1.03365016375153,-1.03365016375153,,,0.0,0.0,7.68142379969388,-7.68142379969388,-3.19146513614537,3.19146513614537,13.7172904857204,-13.7172904857204,-13.4205740734226,13.4205740734226,0.841070353984833,0.158929646015167,0.158929646015167,0.841070353984833,-0.0126294493675232,-0.001989722251892,0.001989722251892,0.17155909538269,0.82844090461731,0.831017434597015,0.168982565402985,-0.350660338997841,0.350660338997841,0.0290533766558044,-0.0290533766558044,,,0.0,0.0,0.0448075830936432,-0.0448075830936432,0.135548566628026,-0.135548566628026,0.0448075830936432,-0.0448075830936432,-0.0765053283686168,0.0765053283686168,0.0,0.0,0.0,0.0,0.0,0.0,0.0,0.0,0.0,0,0.0,0.0,0.0,0.0,0.0,0.0,0.0,0.0,0.0,0.0,0.0,0.0,0.0,0.0,1.0,0.0,0.0,0.0,0.0,0.0,0.0,0.0,1.0,0.0,0.0,0.0,0.0,0.0,0.0,0.0,0.0,0.0,0.0,0.0,0.0,0.0,0.0,0.0,0.0,0.0,0.0,,,,,,,00-0033897,J.Mixon,4.0,,,,,,,,,,,,,,,,,,,,,,,,,,,,,,,,,,,,,,,,,,,DEN,,00-0029890,,M.Purcell,,,,,,,,,,,,,,0.0,,,,,,,,,,,,,,,,,,,,,,,,,,,,,,,,0.0,,,,,0,,,0.0,0.0,0.0,0.0,,,2021,,,49,1,First down,3643,"12/19/21, 16:05:49",2021-12-19T23:57:14Z,Empower Field at Mile High,"Sunny Temp: 61° F, Humidity: 10%, Wind: East 8 mph",c598061f-b37c-11eb-aba9-a0ee1ea0d04b,0,0,RUSH,0,,,,21,Punt,2021-12-19T23:57:14Z,6.0,2:36,1.0,0.0,0.0,4.0,4.0,0.0,PUNT,PUNT,03:40,01:04,CIN 22,CIN 42,3643.0,3898.0,15,10,Home,-5,25,3.0,45.0,0,outdoors,grass,61.0,19.0,Vic Fangio,Zac Taylor,DEN00,Empower Field at Mile High,0,0.0,,,J.Mixon,28.0,,,0,1,0.0,0,1,,00-0033897,,J.Mixon,28.0,00-0033897,J.Mixon,00-0033897,J.Mixon,00-0033897,0,0,-0.0176119888201356,,,,,,0.214219287037849,-21.4219287037849,2021-12-19,M.Purcell,2021,REG,DEN,15,00-0029890,DT,Mike Purcell,Mike,Purcell,,,,Thumb,,Full Participation in Practice,2021-12-17T20:34:35Z,2021-12-17 20:34:35
3606,2021_04_WAS_ATL,2021100300,ATL,WAS,REG,4,WAS,away,ATL,WAS,74.0,2021-10-03,562.0,562.0,562.0,Half2,0,17.0,0,4,2.0,0,09:22,WAS 26,14,70.0,"(9:22) (Shotgun) 4-T.Heinicke pass incomplete short right to 24-A.Gibson (24-A.Terrell). WAS-24-A.Gibson was injured during the play. PENALTY on ATL-24-A.Terrell, Illegal Contact, 5 yards, enforced at WAS 26 - No Play.",no_play,0.0,1,0,0.0,0,0,0,,,,,,,,,,,3,2,0.0,,,,,2.0,3.0,30,22,22.0,30.0,-8.0,22.0,30.0,-8.0,0.109651453793049,0.164916679263115,0.0025141488295048,0.257306277751923,0.182351484894753,0.0032656909897923,0.279994279146194,0.0,0.0,0.212623510975391,1.09365447983146,4.25955654539587,-4.25955654539587,-3.59932270122226,3.59932270122226,8.44332853212979,-8.44332853212979,,,0.0,0.0,12.1639245203987,-12.1639245203987,1.85161126041203,-1.85161126041203,16.0668465008203,-16.0668465008203,-5.25452153598468,5.25452153598468,0.118939377367497,0.881060622632504,0.881060622632504,0.118939377367497,0.0344183966517448,0.0421876758337021,-0.0421876758337021,0.846642225980759,0.153357774019241,0.132953524589539,0.867046475410461,-0.112141913591796,0.112141913591796,0.246274298042896,-0.246274298042896,,,0.0,0.0,-0.220099537984726,0.220099537984726,0.676657349797129,-0.676657349797129,-0.223308711664078,0.223308711664078,0.517667324276804,-0.517667324276804,0.0,0.0,0.0,1.0,0.0,0.0,0.0,0.0,0.0,0,0.0,0.0,0.0,0.0,0.0,0.0,0.0,0.0,0.0,0.0,0.0,0.0,0.0,0.0,0.0,0.0,1.0,0.0,0.0,0.0,0.0,0.0,0.0,0.0,0.0,0.0,0.0,0.0,0.0,0.0,0.0,0.0,0.0,0.0,0.0,0.0,0.0,0.0,0.0,0.0,0.0,,,,,,,,,,,,,,,,,,,,,,,,,,,,,,,,,,,,,,,,,,,,,,,,,,,,,,,,,,,,,,,,,,,,,,0.0,,,,,,,,,,,,,,,,,,,,,,,,,,,,,,,,0.0,ATL,00-0036285,A.Terrell,5.0,0,,Illegal Contact,0.0,0.0,0.0,0.0,,,2021,,,49,1,First down,3606,"10/3/21, 13:02:46",2021-10-03T19:43:13Z,Mercedes-Benz Stadium,"Cloudy Temp: 76° F, Humidity: 76%, Wind: SSW 6 mph",c59e6e09-b37c-11eb-aaa9-9d79bbf40974,0,0,PENALTY,0,,,,17,Touchdown,2021-10-03T19:41:57Z,10.0,6:08,6.0,1.0,1.0,4.0,4.0,-5.0,PUNT,TOUCHDOWN,10:00,03:52,WAS 30,ATL 17,3562.0,3932.0,34,30,Home,-4,64,-1.0,47.5,0,open,fieldturf,,,Arthur Smith,Ron Rivera,ATL97,Mercedes-Benz Stadium,0,1.0,T.Heinicke,4.0,,,A.Gibson,24.0,1,0,1.0,0,1,00-0031800,,00-0036328,T.Heinicke,4.0,00-0031800,,,A.Gibson,00-0036328,0,1,1.09365447983146,,,,,,0.900724232196808,9.92757678031921,2021-10-03,A.Gibson,2021,REG,WAS,4,00-0036328,RB,Antonio Gibson,Antonio,Gibson,Shin,,Questionable,Shin,,Limited Participation in Practice,2021-10-01T17:41:14Z,2021-10-01 17:41:14
3592,2021_06_ARI_CLE,2021101708,CLE,ARI,REG,6,CLE,home,ARI,ARI,7.0,2021-10-17,730.0,730.0,730.0,Half2,0,17.0,0,4,4.0,0,12:10,ARI 7,4,57.0,(12:10) (Shotgun) 6-B.Mayfield pass incomplete short right to 13-O.Beckham (23-R.Alford). CLE-27-K.Hunt was injured during the play. His return is Doubtful.,pass,0.0,1,0,1.0,0,0,0,short,right,4.0,,,,,,,,3,3,0.0,,,,,3.0,3.0,14,30,14.0,30.0,-16.0,14.0,30.0,-16.0,0.0129169085994363,0.0147669287398458,0.0003357806999702,0.0201593842357397,0.884235501289368,0.0006073924014344,0.0669780448079109,0.0,0.0,2.93667956505669,-2.73928956891177,-23.5725750010903,23.5725750010903,-2.452934890287,2.452934890287,-15.3092861074247,15.3092861074247,2.89835520472843,-5.6376447736402,0.0,0.0,2.36353460096871,-2.36353460096871,-0.406839574950147,0.406839574950147,-2.80134770288714,2.80134770288714,-0.191040366510726,0.191040366510726,0.0455633848905563,0.954436615109444,0.0455633848905563,0.954436615109444,-0.022292897105217,-0.0189320296049118,-0.0189320296049118,0.0232704877853394,0.976729512214661,0.0513610690832138,0.0513610690832138,-0.199691466987133,0.199691466987133,-0.29195258424454,0.29195258424454,0.0,-0.022292897105217,0.0,0.0,-0.0202948674567637,0.0202948674567637,-0.0181881155142392,0.0181881155142392,-0.0202948674567637,0.0202948674567637,-0.0538868571886624,0.0538868571886624,0.0,0.0,0.0,0.0,0.0,0.0,0.0,1.0,1.0,0,0.0,0.0,0.0,0.0,0.0,0.0,0.0,0.0,0.0,0.0,0.0,0.0,0.0,0.0,0.0,0.0,0.0,0.0,0.0,0.0,0.0,0.0,0.0,1.0,0.0,0.0,0.0,0.0,0.0,0.0,0.0,0.0,0.0,0.0,0.0,0.0,0.0,0.0,0.0,0.0,0.0,00-0034855,B.Mayfield,,00-0031235,O.Beckham,,,,,,,,,,,,,,,,,,,,,,,,,,,,,,,,,,,,,,,,,,,,,,,,,,,,,,,,,,,,,,,,,0.0,,,,,,,00-0030528,R.Alford,,,,,,,,,,,,,,,,,,,,,,,,0.0,,,,,0,,,0.0,0.0,0.0,0.0,,,2021,0.463889479637146,-46.3889479637146,43,0,Turnover on downs,3592,"10/17/21, 16:05:22",2021-10-17T22:32:41Z,Cleveland Browns Stadium,"Cloudy Temp: 58° F, Humidity: 60%, Wind: West 23 mph",c59a0483-b37c-11eb-abac-4f5c371de22e,0,0,PASS,0,,,,17,Turnover on downs,2021-10-17T22:20:31Z,14.0,5:50,4.0,1.0,0.0,3.0,4.0,0.0,KICKOFF,DOWNS,02:56,12:06,CLE 36,ARI 7,3216.0,3592.0,37,14,Home,-23,51,3.0,48.0,0,outdoors,grass ,58.0,23.0,Kevin Stefanski,Kliff Kingsbury,CLE00,FirstEnergy Stadium,0,0.0,B.Mayfield,6.0,,,O.Beckham,13.0,1,0,0.0,0,1,00-0034855,,00-0031235,B.Mayfield,6.0,00-0034855,O.Beckham,00-0031235,O.Beckham,00-0031235,0,1,-2.73928956891177,0.596024883560469,1.58952844273881,2.0,0.986466991336783,0.986466991336783,0.970557153224945,2.94428467750549,2021-10-17,K.Hunt,2021,REG,CLE,6,00-0033923,RB,Kareem Hunt,Kareem,Hunt,Wrist,Knee,Questionable,Wrist,Knee,Limited Participation in Practice,2021-10-15T18:31:23Z,2021-10-15 18:31:23
3557,2021_10_PHI_DEN,2021111409,DEN,PHI,REG,10,DEN,home,PHI,DEN,88.0,2021-11-14,252.0,252.0,252.0,Half2,0,20.0,0,4,1.0,0,04:12,DEN 12,10,78.0,"(4:12) (Shotgun) 5-T.Bridgewater pass short middle to 10-J.Jeudy to DEN 25 for 13 yards (52-D.Taylor). FUMBLES (52-D.Taylor), recovered by DEN-85-A.Okwuegbunam at DEN 27. 85-A.Okwuegbunam to DEN 29 for 2 yards (57-T.Edwards). PHI-2-D.Slay was injured during the play.",pass,13.0,1,0,1.0,0,0,0,short,middle,8.0,5.0,,,,,,,2,1,0.0,,,,,2.0,1.0,13,30,13.0,30.0,-17.0,13.0,30.0,-17.0,0.479098707437515,0.0961551740765572,0.0031560212373733,0.149096250534058,0.120131075382233,0.0022268218453973,0.150135919451714,0.0,0.0,0.0773469875566661,0.777707266039215,-21.085978862387,21.085978862387,-12.600413581733,12.600413581733,-6.91359744337093,6.91359744337093,0.360754717374221,0.416952548664995,0.360754717374221,0.416952548664995,-9.77525672726915,9.77525672726915,1.0214099115864,-1.0214099115864,-19.2397459249187,19.2397459249187,10.6208045393898,-10.6208045393898,0.0023894305340945,0.997610569465905,0.0023894305340945,0.997610569465905,0.0006303428672254,0.0001503460807725,0.0001503460807725,0.0030197734013199,0.99698022659868,0.0015671708388254,0.0015671708388254,-0.269734772906856,0.269734772906856,-0.191323411184543,0.191323411184543,0.0,0.0006303428672254,0.0,0.0006303428672254,-0.393210005945706,0.393210005945706,0.10970159759745,-0.10970159759745,-0.393210005945706,0.393210005945706,0.155987203586847,-0.155987203586847,0.0,0.0,1.0,0.0,0.0,0.0,0.0,0.0,0.0,0,0.0,0.0,0.0,0.0,0.0,0.0,0.0,0.0,0.0,0.0,0.0,1.0,0.0,0.0,1.0,0.0,0.0,0.0,0.0,0.0,0.0,0.0,0.0,1.0,0.0,0.0,0.0,0.0,0.0,0.0,0.0,0.0,0.0,0.0,1.0,1.0,0.0,0.0,0.0,0.0,0.0,00-0031237,T.Bridgewater,13.0,00-0036407,J.Jeudy,13.0,,,,,,,,,,,,,,,,,,,,,,,,,,,,,,,,,,,,,,,,PHI,00-0036393,D.Taylor,,,,PHI,PHI,00-0036393,00-0035386,D.Taylor,T.Edwards,,,,,,,,,,,,,0.0,,,,,,,,,,,DEN,00-0036407,J.Jeudy,,,,DEN,2.0,00-0036423,A.Okwuegbunam,,,,,,,,,,,,0.0,,,,,0,,,0.0,0.0,0.0,0.0,,,2021,0.753510892391205,24.6489107608795,51,1,First down,3557,"11/14/21, 16:25:24",2021-11-15T00:15:07Z,Empower Field at Mile High,"Partly Cloudy Temp: 65° F, Humidity: 22%, Wind: South West 5 mph",c5991e4b-b37c-11eb-a470-77d96e8dad84,0,0,PASS,0,,,,20,Turnover on downs,2021-11-15T00:15:07Z,7.0,2:07,3.0,1.0,0.0,4.0,4.0,35.0,PUNT,DOWNS,04:12,02:05,DEN 12,PHI 10,3557.0,3767.0,30,13,Home,-17,43,1.0,44.5,0,outdoors,grass ,57.0,19.0,Vic Fangio,Nick Sirianni,DEN00,Empower Field at Mile High,0,1.0,T.Bridgewater,5.0,,,J.Jeudy,10.0,1,0,1.0,0,1,00-0031237,,00-0036407,T.Bridgewater,5.0,00-0031237,J.Jeudy,00-0036407,J.Jeudy,00-0036407,0,0,0.777707266039215,0.211575218788746,4.3509453937877,3.0,0.997654545353726,0.614155095187016,0.85917592048645,14.082407951355,2021-11-14,D.Slay,2021,REG,PHI,10,00-0030062,CB,Darius Slay,Darius,Slay,,,,Hamstring,,Full Participation in Practice,2021-11-12T19:32:25Z,2021-11-12 19:32:25
3549,2021_05_CLE_LAC,2021101009,LAC,CLE,REG,5,LAC,home,CLE,CLE,24.0,2021-10-10,474.0,474.0,474.0,Half2,0,18.0,0,4,3.0,0,07:54,CLE 24,8,75.0,"(7:54) (No Huddle, Shotgun) 10-J.Herbert pass incomplete deep left to 87-J.Cook [97-M.Jackson]. CLE-95-M.Garrett was injured during the play.",pass,0.0,1,1,1.0,0,0,0,deep,left,24.0,,,,,,,,3,3,0.0,,,,,3.0,3.0,28,35,28.0,35.0,-7.0,28.0,35.0,-7.0,0.0409354083240032,0.0306424256414175,0.0008760617347434,0.0475178435444832,0.558252155780792,0.0008029907476156,0.320973128080368,0.0,0.0,3.49687004019506,-1.02690228854772,-7.94640647585038,7.94640647585038,-0.256887555413414,0.256887555413414,-12.1313784883791,12.1313784883791,3.50312995980494,-4.53003224835265,0.0,0.0,1.49405467207544,-1.49405467207544,-3.04579020623351,3.04579020623351,8.94427137338789,-8.94427137338789,-19.0423736131601,19.0423736131601,0.290967524051666,0.709032475948334,0.290967524051666,0.709032475948334,-0.0624577105045319,-0.0595275163650513,-0.0595275163650513,0.228509813547134,0.771490186452866,0.312765836715698,0.312765836715698,-0.216322139117364,0.216322139117364,-0.379559425281391,0.379559425281391,0.0,-0.0624577105045319,0.0,0.0,-0.0425004959106445,0.0425004959106445,0.0154143708105832,-0.0154143708105832,-0.0505615919828415,0.0505615919828415,-0.225036532962725,0.225036532962725,0.0,0.0,0.0,0.0,0.0,1.0,0.0,0.0,1.0,0,0.0,0.0,0.0,0.0,0.0,0.0,0.0,0.0,0.0,0.0,0.0,0.0,0.0,0.0,0.0,0.0,0.0,0.0,0.0,0.0,0.0,1.0,0.0,1.0,0.0,0.0,0.0,0.0,0.0,0.0,0.0,0.0,0.0,0.0,0.0,0.0,0.0,0.0,0.0,0.0,0.0,00-0036355,J.Herbert,,00-0027061,J.Cook,,,,,,,,,,,,,,,,,,,,,,,,,,,,,,,,,,,,,00-0029568,M.Jackson,,,,,,,,,,,,,,,,,,,,,,,,,,,0.0,,,,,,,,,,,,,,,,,,,,,,,,,,,,,,,,0.0,,,,,0,,,0.0,0.0,0.0,0.0,,,2021,0.280020028352737,-28.0020028352737,47,1,First down,3549,"10/10/21, 16:05:26",2021-10-10T22:45:15Z,SoFi Stadium,"Sunny Temp: 76° F, Humidity: 39%, Wind: WSW 4 mph",c59db55c-b37c-11eb-a2e3-1893925df770,0,0,PASS,0,,,,18,Touchdown,2021-10-10T22:36:55Z,11.0,3:16,4.0,1.0,1.0,4.0,4.0,28.0,KICKOFF,TOUCHDOWN,10:40,07:24,LAC 25,CLE 4,3253.0,3631.0,42,47,Home,5,89,2.5,46.5,0,dome,matrixturf,,,Brandon Staley,Kevin Stefanski,LAX01,SoFi Stadium,0,0.0,J.Herbert,10.0,,,J.Cook,87.0,1,0,0.0,0,1,00-0036355,,00-0027061,J.Herbert,10.0,00-0036355,J.Cook,00-0027061,J.Cook,00-0027061,0,1,-1.02690228854772,,,,,,0.984440088272095,1.55599117279053,2021-10-10,M.Garrett,2021,REG,CLE,5,00-0033868,DE,Myles Garrett,Myles,Garrett,Knee,Ankle,Questionable,Knee,Ankle,Did Not Participate In Practice,2021-10-08T17:09:46Z,2021-10-08 17:09:46
3535,2021_07_PHI_LV,2021102407,LV,PHI,REG,7,PHI,away,LV,LV,17.0,2021-10-24,238.0,238.0,238.0,Half2,0,17.0,1,4,3.0,0,03:58,LV 17,10,75.0,"(3:58) (Shotgun) 1-J.Hurts pass short right to 18-J.Reagor for 17 yards, TOUCHDOWN. LV-52-D.Perryman was injured during the play. His return is Questionable.",pass,17.0,1,0,1.0,0,0,0,short,right,12.0,5.0,,,,,,,2,1,0.0,,PHI,J.Reagor,00-0036387,1.0,2.0,33,20,14.0,33.0,-19.0,20.0,33.0,-13.0,0.10924468934536,0.0151558443903923,0.0003635039320215,0.0303605683147907,0.504227638244629,0.0007487979601137,0.339898943901062,0.0,0.0,3.63475459872279,3.36524540127721,15.0689477557938,-15.0689477557938,2.53685664005772,-2.53685664005772,12.0890634910591,-12.0890634910591,2.00195862317923,1.36328677809797,2.00195862317923,1.36328677809797,-12.9620729780872,12.9620729780872,17.3046089795535,-17.3046089795535,-19.8868957953528,19.8868957953528,29.8385396350329,-29.8385396350329,0.0020141226705163,0.997985877329484,0.997985877329484,0.0020141226705163,0.0047523239795119,0.0044783949297853,-0.0044783949297853,0.993233553349972,0.0067664466500283,0.0009222218650393,0.999077778134961,0.010307308612567,-0.010307308612567,0.427600604359557,-0.427600604359557,0.0,0.0047523239795119,0.0,0.0047523239795119,-0.68114327713148,0.68114327713148,1.03585716386887,-1.03585716386887,-0.679606490575236,0.679606490575236,1.04646120002589,-1.04646120002589,0.0,0.0,1.0,0.0,1.0,0.0,0.0,0.0,0.0,0,0.0,0.0,0.0,0.0,0.0,0.0,0.0,0.0,0.0,0.0,0.0,0.0,0.0,0.0,0.0,0.0,0.0,0.0,0.0,0.0,0.0,0.0,0.0,1.0,0.0,1.0,1.0,0.0,0.0,0.0,0.0,0.0,0.0,0.0,0.0,1.0,0.0,0.0,0.0,0.0,0.0,00-0036389,J.Hurts,17.0,00-0036387,J.Reagor,17.0,,,,,,,,,,,,,,,,,,,,,,,,,,,,,,,,,,,,,,,,,,,,,,,,,,,,,,,,,,,,,,,,0.0,,,,,,,,,,,,,,,,,,,,,,,,,,,,,,,,0.0,,,,,0,,,0.0,0.0,0.0,0.0,,,2021,0.44210210442543,55.789789557457,53,1,Touchdown,3535,"10/24/21, 16:05:23",2021-10-24T22:51:11Z,Allegiant Stadium,"Partly Cloudy Temp: 71° F, Humidity: 30%, Wind: South 10 mph",c599cccd-b37c-11eb-b396-d1345dd16473,0,0,PASS,0,,,,17,Touchdown,2021-10-24T22:43:12Z,12.0,3:27,5.0,1.0,1.0,4.0,4.0,0.0,KICKOFF,TOUCHDOWN,07:17,03:50,PHI 25,LV 17,3247.0,3558.0,22,33,Home,11,55,1.0,48.0,0,dome,grass,,,Rich Bisaccia,Nick Sirianni,VEG00,Allegiant Stadium,0,1.0,J.Hurts,1.0,,,J.Reagor,18.0,1,0,1.0,0,1,00-0036389,,00-0036387,J.Hurts,1.0,00-0036389,J.Reagor,00-0036387,J.Reagor,00-0036387,0,0,3.36524540127721,0.45814261654952,1.65044377825689,1.0,0.998993406654336,0.997770172310993,0.985032439231873,1.49675607681274,2021-10-24,D.Perryman,2021,REG,LV,7,00-0032103,LB,Denzel Perryman,Denzel,Perryman,,,,Thumb,,Full Participation in Practice,2021-10-22T19:49:27Z,2021-10-22 19:49:27
3533,2021_16_BAL_CIN,2021122602,CIN,BAL,REG,16,CIN,home,BAL,CIN,51.0,2021-12-26,777.0,777.0,777.0,Half2,0,14.0,0,4,2.0,0,12:57,CIN 49,10,78.0,(12:57) (Shotgun) 9-J.Burrow pass short left to 83-T.Boyd to BAL 39 for 12 yards (25-T.Young) [45-J.Ferguson]. BAL-25-T.Young was injured during the play.,pass,12.0,1,0,1.0,0,0,0,short,left,0.0,12.0,,,,,,,3,3,0.0,,,,,3.0,3.0,34,21,34.0,21.0,13.0,34.0,21.0,13.0,0.0573302134871483,0.0990078672766685,0.0012686537811532,0.167449504137039,0.261914640665054,0.0040399231947958,0.40898922085762,0.0,0.0,2.18504087603651,1.1869826100301,17.0748087737162,-17.0748087737162,6.7067068592587,-6.7067068592587,9.69162202477798,-9.69162202477798,-0.865277912467718,2.05226052249782,-0.865277912467718,2.05226052249782,-1.37406984425616,1.37406984425616,11.1660166177026,-11.1660166177026,-1.56232991517754,1.56232991517754,11.577528666848,-11.577528666848,0.969880402088165,0.0301195979118347,0.969880402088165,0.0301195979118347,0.0085265636444091,0.0054921507835388,0.0054921507835388,0.978406965732574,0.0215930342674255,0.979726672172546,0.979726672172546,0.168706241866238,-0.168706241866238,0.220149199595305,-0.220149199595305,0.0,0.0085265636444091,0.0,0.0085265636444091,0.0609700062895071,-0.0609700062895071,0.136416203680463,-0.136416203680463,0.0609700062895071,-0.0609700062895071,0.155944687652416,-0.155944687652416,0.0,0.0,1.0,0.0,0.0,0.0,0.0,0.0,0.0,0,0.0,0.0,0.0,0.0,0.0,0.0,0.0,0.0,0.0,0.0,0.0,0.0,0.0,0.0,1.0,0.0,0.0,0.0,0.0,0.0,0.0,1.0,0.0,1.0,0.0,0.0,0.0,0.0,0.0,0.0,0.0,0.0,0.0,0.0,0.0,1.0,0.0,0.0,0.0,0.0,0.0,00-0036442,J.Burrow,12.0,00-0033009,T.Boyd,12.0,,,,,,,,,,,,,,,,,,,,,,,,,,,,,,,,,,,,00-0035651,J.Ferguson,,,,,,,,,BAL,,00-0032770,,T.Young,,,,,,,,,,,,,,0.0,,,,,,,,,,,,,,,,,,,,,,,,,,,,,,,,0.0,,,,,0,,,0.0,0.0,0.0,0.0,,,2021,0.376798272132874,62.3201727867127,54,1,First down,3533,"12/26/21, 13:02:34",2021-12-26T20:31:02Z,Paycor Stadium,"Mostly sunny Temp: 53° F, Humidity: 53%, Wind: NNE 5 mph, gusts to 6 mph",c5986fd6-b37c-11eb-ba13-aa7df81873db,0,0,PASS,0,,,,14,Touchdown,2021-12-26T20:28:21Z,8.0,4:50,5.0,1.0,1.0,4.0,4.0,0.0,KICKOFF,TOUCHDOWN,14:55,10:05,CIN 22,BAL 10,3439.0,3680.0,21,41,Home,20,62,7.5,43.0,1,outdoors,fieldturf,52.0,0.0,Zac Taylor,John Harbaugh,CIN00,Paul Brown Stadium,0,1.0,J.Burrow,9.0,,,T.Boyd,83.0,1,0,1.0,0,1,00-0036442,,00-0033009,J.Burrow,9.0,00-0036442,T.Boyd,00-0033009,T.Boyd,00-0033009,0,1,1.1869826100301,0.899188439554054,6.74575738339627,5.0,0.421454538649414,0.229606186097953,0.540957450866699,45.9042549133301,2021-12-26,T.Young,2021,REG,BAL,16,00-0032770,CB,Tavon Young,Tavon,Young,,,,Concussion,,Full Participation in Practice,2021-12-24T19:43:23Z,2021-12-24 19:43:23
3508,2021_03_SEA_MIN,2021092612,MIN,SEA,REG,3,SEA,away,MIN,MIN,43.0,2021-09-26,165.0,165.0,165.0,Half2,0,15.0,0,4,3.0,0,02:45,MIN 43,12,32.0,"(2:45) (No Huddle, Shotgun) 3-R.Wilson pass incomplete deep left to 14-D.Metcalf (23-X.Woods) [97-E.Griffen]. SEA-14-D.Metcalf was injured during the play.",pass,0.0,1,1,1.0,0,0,0,deep,left,35.0,,,,,,,,3,2,0.0,,,,,2.0,3.0,30,17,17.0,30.0,-13.0,17.0,30.0,-13.0,0.342602908611298,0.0796549841761589,0.0004641377308871,0.105904877185822,0.20867021381855,0.0056024044752121,0.257100462913513,0.0,0.0,1.45569132250967,-1.44937949773157,13.063491918818,-13.063491918818,-3.64173305459553,3.64173305459553,15.2811176004578,-15.2811176004578,3.72377692960436,-5.17315642733593,0.0,0.0,8.8096790976706,-8.8096790976706,5.58399702947015,-5.58399702947015,-6.30023133999202,6.30023133999202,20.2674389863294,-20.2674389863294,0.0149416457861662,0.985058354213834,0.985058354213834,0.0149416457861662,-0.0044331653043627,-0.0072146626189351,0.0072146626189351,0.989491519518197,0.0105084804818034,0.0198105964809656,0.980189403519034,-0.027906930134965,0.027906930134965,0.434371771468609,-0.434371771468609,0.0,-0.0044331653043627,0.0,0.0,0.491156748964236,-0.491156748964236,-0.072286984242456,0.072286984242456,0.491156748964236,-0.491156748964236,-0.0674161196797657,0.0674161196797657,0.0,0.0,0.0,0.0,0.0,1.0,0.0,0.0,1.0,0,0.0,0.0,0.0,0.0,0.0,0.0,0.0,0.0,0.0,0.0,0.0,0.0,0.0,0.0,0.0,0.0,0.0,0.0,0.0,0.0,0.0,1.0,0.0,1.0,0.0,0.0,0.0,0.0,0.0,0.0,0.0,0.0,0.0,0.0,0.0,0.0,0.0,0.0,0.0,0.0,0.0,00-0029263,R.Wilson,,00-0035640,D.Metcalf,,,,,,,,,,,,,,,,,,,,,,,,,,,,,,,,,,,,,00-0027701,E.Griffen,,,,,,,,,,,,,,,,,,,,,,,,,,,0.0,,,,,,,00-0033579,X.Woods,,,,,,,,,,,,,,,,,,,,,,,,0.0,,,,,0,,,0.0,0.0,0.0,0.0,,,2021,0.275862962007523,-27.5862962007523,56,0,Turnover on downs,3508,"9/26/21, 16:25:49",2021-09-26T23:08:26Z,U.S. Bank Stadium,"N/A (Indoors) Temp: 77° F, Humidity: 44%, Wind: SSW 7 mph",c59e8a08-b37c-11eb-ad13-0afbcf7ddfa9,0,0,PASS,0,,,,15,Turnover on downs,2021-09-26T23:04:32Z,5.0,2:03,2.0,0.0,0.0,4.0,4.0,15.0,KICKOFF,DOWNS,04:31,02:28,SEA 25,MIN 43,3390.0,3530.0,17,30,Home,13,47,-2.0,53.5,0,dome,sportturf,,,Mike Zimmer,Pete Carroll,MIN01,U.S. Bank Stadium,0,0.0,R.Wilson,3.0,,,D.Metcalf,14.0,1,0,0.0,0,1,00-0029263,,00-0035640,R.Wilson,3.0,00-0029263,D.Metcalf,00-0035640,D.Metcalf,00-0035640,0,0,-1.44937949773157,0.952215664753642,4.55429059569724,5.0,1.0,1.0,0.993122279644012,0.687772035598755,2021-09-26,D.Metcalf,2021,REG,SEA,3,00-0035640,WR,DK Metcalf,DK,Metcalf,,,,Knee,,Full Participation in Practice,2021-09-22T22:48:40Z,2021-09-22 22:48:40
3488,2021_20_CIN_TEN,2022012200,TEN,CIN,POST,20,TEN,home,CIN,TEN,81.0,2022-01-22,120.0,120.0,120.0,Half2,0,22.0,0,4,2.0,0,02:00,TEN 19,7,24.0,"(2:00) (Shotgun) 17-R.Tannehill pass short middle to 2-J.Jones to TEN 35 for 16 yards (20-E.Apple, 55-L.Wilson). CIN-91-T.Hendrickson was injured during the play. His return is Questionable.",pass,16.0,1,0,1.0,0,0,0,short,middle,13.0,3.0,,,,,,,2,3,0.0,,,,,2.0,3.0,16,16,16.0,16.0,0.0,16.0,16.0,0.0,0.528587222099304,0.10866205394268,0.0015876818215474,0.104431584477425,0.132792010903358,0.0018082853639498,0.122131124138832,0.0,0.0,0.196727855596691,0.987428452004679,-1.53508484696783,1.53508484696783,-3.86360232830327,3.86360232830327,3.49089619397301,-3.49089619397301,0.952285238541663,0.0351432134630159,0.952285238541663,0.0351432134630159,10.9476650762372,-10.9476650762372,-15.4504596278022,15.4504596278022,11.2956248515984,-11.2956248515984,-19.8476385166469,19.8476385166469,0.618689894676209,0.381310105323792,0.618689894676209,0.381310105323792,0.0458510518074036,0.0358989834785461,0.0358989834785461,0.664540946483612,0.335459053516388,0.662221252918243,0.662221252918243,-0.0475818070053379,0.0475818070053379,0.383633393476093,-0.383633393476093,0.0,0.0458510518074036,0.0,0.0458510518074036,0.983171570727909,-0.983171570727909,-1.00090050697327,1.00090050697327,0.983171570727909,-0.983171570727909,-1.03272783756256,1.03272783756256,0.0,0.0,1.0,0.0,0.0,0.0,0.0,0.0,0.0,0,0.0,0.0,0.0,0.0,0.0,0.0,0.0,0.0,0.0,0.0,0.0,0.0,0.0,0.0,0.0,0.0,0.0,0.0,0.0,0.0,0.0,0.0,0.0,1.0,0.0,0.0,0.0,0.0,0.0,0.0,0.0,0.0,0.0,0.0,0.0,1.0,1.0,0.0,0.0,0.0,0.0,00-0029701,R.Tannehill,16.0,00-0027944,J.Jones,16.0,,,,,,,,,,,,,,,,,,,,,,,,,,,,,,,,,,,,,,,,,,,,,,,,,,,,00-0036294,L.Wilson,CIN,,,,,,,,,,1.0,00-0032379,E.Apple,CIN,,,,,,,,,,,,,,,,,,,,,,,,,,,,,0.0,,,,,0,,,0.0,0.0,0.0,0.0,,,2021,0.715844750404358,28.4155249595642,50,1,First down,3488,"1/22/22, 16:32:53",2022-01-23T00:23:00Z,Nissan Stadium,"Sunny Temp: 34° F, Humidity: 46%, Wind: 0 mph",ab2d01cc-71ac-11ec-a6f7-85513e732977,0,0,PASS,0,,,,22,Turnover,2022-01-23T00:19:27Z,5.0,2:23,1.0,0.0,0.0,4.0,4.0,0.0,PUNT,INTERCEPTION,02:43,00:20,TEN 16,TEN 40,3450.0,3577.0,19,16,Home,-3,35,4.0,48.5,0,outdoors,grass,35.0,0.0,Mike Vrabel,Zac Taylor,NAS00,Nissan Stadium,0,1.0,R.Tannehill,17.0,,,J.Jones,2.0,1,0,1.0,0,1,00-0029701,,00-0027944,R.Tannehill,17.0,00-0029701,J.Jones,00-0027944,J.Jones,00-0027944,0,1,0.987428452004679,0.19041115296858,4.46343144281127,2.0,1.0,1.0,0.80519825220108,19.480174779892,2022-01-22,T.Hendrickson,2021,DIV,CIN,20,00-0033935,DE,Trey Hendrickson,Trey,Hendrickson,,,,Concussion,,Full Participation in Practice,2022-01-20T20:31:54Z,2022-01-20 20:31:54
3479,2021_01_SF_DET,2021091204,DET,SF,REG,1,DET,home,SF,DET,52.0,2021-09-12,474.0,474.0,474.0,Half2,0,20.0,0,4,2.0,0,07:54,DET 48,10,28.0,(7:54) (Shotgun) 16-J.Goff pass incomplete short left to 17-T.Benson. SF-2-J.Verrett was injured during the play.,pass,0.0,1,0,1.0,0,0,0,short,left,7.0,,,,,,,,3,2,0.0,,,,,3.0,2.0,17,41,17.0,41.0,-24.0,17.0,41.0,-24.0,0.138263255357742,0.079002857208252,0.0014065941795706,0.135495603084564,0.254887819290161,0.0033337466884404,0.387610167264938,0.0,0.0,2.29631114052609,-0.725635708775371,-28.8296475933226,28.8296475933226,3.85640395182428,-3.85640395182428,-34.8137737869655,34.8137737869655,0.136360883479938,-0.861996592255309,0.0,0.0,-14.2906591683277,14.2906591683277,-5.61966889875477,5.61966889875477,-12.5933902827965,12.5933902827965,-19.800711714426,19.800711714426,0.0004332461976446,0.999566753802355,0.0004332461976446,0.999566753802355,-0.0001166095025837,-1.85256139957346e-05,-1.85256139957346e-05,0.0003166366950608,0.999683363304939,9.5757917733863e-05,9.5757917733863e-05,-0.0941158151735257,0.0941158151735257,-0.450447306063856,0.450447306063856,0.0,-0.0001166095025837,0.0,0.0,-0.161810495250393,0.161810495250393,-0.089077226332322,0.089077226332322,-0.161810495250393,0.161810495250393,-0.248274279028542,0.248274279028542,0.0,0.0,0.0,0.0,0.0,0.0,0.0,0.0,1.0,0,0.0,0.0,0.0,0.0,0.0,0.0,0.0,0.0,0.0,0.0,0.0,0.0,0.0,0.0,0.0,0.0,0.0,0.0,0.0,0.0,0.0,0.0,0.0,1.0,0.0,0.0,0.0,0.0,0.0,0.0,0.0,0.0,0.0,0.0,0.0,0.0,0.0,0.0,0.0,0.0,0.0,00-0033106,J.Goff,,00-0034930,T.Benson,,,,,,,,,,,,,,,,,,,,,,,,,,,,,,,,,,,,,,,,,,,,,,,,,,,,,,,,,,,,,,,,,0.0,,,,,,,,,,,,,,,,,,,,,,,,,,,,,,,,0.0,,,,,0,,,0.0,0.0,0.0,0.0,,,2021,0.761791586875916,-76.1791586875916,51,0,Turnover on downs,3479,"9/12/21, 13:06:03",2021-09-12T19:44:19Z,Ford Field,"Controlled Climate Temp: 68° F, Humidity: 70%, Wind: mph",c59f6e42-b37c-11eb-901f-b386dd79c602,0,0,PASS,0,,,,20,Turnover on downs,2021-09-12T19:40:35Z,5.0,2:25,1.0,0.0,0.0,4.0,4.0,-5.0,KICKOFF,DOWNS,09:53,07:28,DET 25,SF 47,3336.0,3533.0,41,33,Home,-8,74,-9.5,46.0,0,dome,fieldturf,,,Dan Campbell,Kyle Shanahan,DET00,Ford Field,0,0.0,J.Goff,16.0,,,T.Benson,17.0,1,0,0.0,0,1,00-0033106,,00-0034930,J.Goff,16.0,00-0033106,T.Benson,00-0034930,T.Benson,00-0034930,0,1,-0.725635708775371,0.561769205786981,3.49873808326083,2.0,0.979610809241422,0.379998334799893,0.839025437831879,16.0974562168121,2021-09-12,J.Verrett,2021,REG,SF,1,00-0031334,CB,Jason Verrett,Jason,Verrett,,,,Foot,,Full Participation in Practice,2021-09-10T20:22:05Z,2021-09-10 20:22:05
3478,2021_12_SEA_WAS,2021112900,WAS,SEA,REG,12,WAS,home,SEA,SEA,30.0,2021-11-29,218.0,218.0,218.0,Half2,0,21.0,0,4,3.0,0,03:38,SEA 30,12,84.0,(3:38) (Shotgun) 4-T.Heinicke pass short middle to 41-J.McKissic to SEA 22 for 8 yards (6-Q.Diggs). WAS-41-J.McKissic was injured during the play.,pass,8.0,1,0,1.0,0,0,0,short,middle,6.0,2.0,,,,,,,3,3,0.0,,,,,3.0,3.0,17,9,17.0,9.0,8.0,17.0,9.0,8.0,0.16860856115818,0.0467711798846722,0.0004383446357678,0.0686328485608101,0.49517434835434,0.0009306867723353,0.219444081187248,0.0,0.0,2.4018728180672,0.0441631942521781,10.262890171187,-10.262890171187,2.23435737173725,-2.23435737173725,10.9350502260159,-10.9350502260159,-0.149867315543816,0.194030509795994,-0.149867315543816,0.194030509795994,-18.0043837144376,18.0043837144376,26.8022213926888,-26.8022213926888,-17.4142417002922,17.4142417002922,27.7132704015821,-27.7132704015821,0.955144047737122,0.0448559522628784,0.955144047737122,0.0448559522628784,0.0034255981445312,0.0050362348556518,0.0050362348556518,0.958569645881653,0.0414303541183472,0.937902569770813,0.937902569770813,0.170879155397415,-0.170879155397415,0.256556046688045,-0.256556046688045,0.0,0.0034255981445312,0.0,0.0034255981445312,-0.201238159110383,0.201238159110383,0.481247545732777,-0.481247545732777,-0.192029107382135,0.192029107382135,0.48277208353452,-0.48277208353452,0.0,0.0,0.0,0.0,0.0,1.0,0.0,0.0,0.0,0,0.0,0.0,0.0,0.0,0.0,0.0,0.0,0.0,0.0,0.0,0.0,0.0,0.0,0.0,1.0,0.0,0.0,0.0,0.0,0.0,0.0,0.0,0.0,1.0,0.0,0.0,0.0,0.0,0.0,0.0,0.0,0.0,0.0,0.0,0.0,1.0,0.0,0.0,0.0,0.0,0.0,00-0031800,T.Heinicke,8.0,00-0032602,J.McKissic,8.0,,,,,,,,,,,,,,,,,,,,,,,,,,,,,,,,,,,,,,,,,,,,,,SEA,,00-0031608,,Q.Diggs,,,,,,,,,,,,,,0.0,,,,,,,,,,,,,,,,,,,,,,,,,,,,,,,,0.0,,,,,0,,,0.0,0.0,0.0,0.0,,,2021,0.762221276760101,23.7778723239899,48,1,First down,3478,"11/29/21, 20:15:35",2021-11-30T03:53:38Z,Commanders Field,"Cloudy Temp: 38° F, Humidity: 55%, Wind: W 3 mph",c5989cd6-b37c-11eb-8717-b15655d15a43,0,0,PASS,0,,,,21,Turnover on downs,2021-11-30T03:45:15Z,16.0,8:37,5.0,1.0,0.0,4.0,4.0,-5.0,PUNT,DOWNS,10:56,02:19,WAS 13,SEA 3,3234.0,3666.0,15,17,Home,2,32,-1.0,47.0,0,outdoors,grass ,41.0,9.0,Ron Rivera,Pete Carroll,WAS00,FedExField,0,1.0,T.Heinicke,4.0,,,J.McKissic,41.0,1,0,0.0,0,1,00-0031800,,00-0032602,T.Heinicke,4.0,00-0031800,J.McKissic,00-0032602,J.McKissic,00-0032602,0,1,0.0441631942521781,0.818193582421679,4.1517488991376,3.0,0.519003748049727,0.249590552499285,0.772490918636322,22.7509081363678,2021-11-29,J.McKissic,2021,REG,WAS,12,00-0032602,RB,J.D. McKissic,J.D.,McKissic,,,,Ankle,,Full Participation in Practice,2021-11-27T18:46:07Z,2021-11-27 18:46:07
3476,2021_15_LV_CLE,2021122001,CLE,LV,REG,15,CLE,home,LV,LV,36.0,2021-12-20,481.0,481.0,481.0,Half2,0,17.0,0,4,1.0,0,08:01,LV 36,10,80.0,(8:01) 24-N.Chubb right guard to LV 24 for 12 yards (25-T.Moehrig; 99-C.Ferrell). LV-24-J.Abram was injured during the play. His return is Probable.,run,12.0,0,0,0.0,0,0,0,,,,,right,guard,,,,,3,2,0.0,,,,,3.0,2.0,7,13,7.0,13.0,-6.0,7.0,13.0,-6.0,0.0932674631476402,0.0446042232215405,0.0008887817384675,0.0702277049422264,0.337662249803543,0.0017101557459682,0.451639413833618,0.0,0.0,3.55069879000075,0.778359243762679,-5.17173686798196,5.17173686798196,-1.75289543401542,1.75289543401542,-0.84445198539387,0.84445198539387,,,0.0,0.0,-6.29160546138883,6.29160546138883,-5.09453674504766,5.09453674504766,-9.47183654212859,9.47183654212859,2.19576392397076,-2.19576392397076,0.302304357290268,0.697695642709732,0.302304357290268,0.697695642709732,0.0771768987178803,0.0408689677715302,0.0408689677715302,0.379481256008148,0.620518743991852,0.283931314945221,0.283931314945221,-0.075517153850066,0.075517153850066,-0.0641919194025017,0.0641919194025017,,,0.0,0.0,-0.117151227430723,0.117151227430723,-0.144695430994034,0.144695430994034,-0.117151227430723,0.117151227430723,-0.0801268219947815,0.0801268219947815,0.0,1.0,0.0,0.0,0.0,0.0,0.0,0.0,0.0,0,0.0,0.0,0.0,0.0,0.0,0.0,0.0,0.0,0.0,0.0,0.0,0.0,0.0,0.0,0.0,0.0,0.0,0.0,0.0,0.0,0.0,0.0,1.0,0.0,0.0,0.0,0.0,0.0,0.0,0.0,0.0,0.0,0.0,0.0,0.0,0.0,1.0,0.0,0.0,0.0,0.0,,,,,,,00-0034791,N.Chubb,12.0,,,,,,,,,,,,,,,,,,,,,,,,,,,,,,,,,,,,,,,,,,,,,,,,,00-0036962,T.Moehrig,LV,00-0035692,C.Ferrell,LV,,,,,,,0.0,,,,,,,,,,,,,,,,,,,,,,,,,,,,,,,,0.0,,,,,0,,,0.0,0.0,0.0,0.0,,,2021,,,41,1,First down,3476,"12/20/21, 17:03:29",2021-12-21T00:37:27Z,Cleveland Browns Stadium,"Clear Temp: 43° F, Humidity: 50%, Wind: SW 12 mph",c598671f-b37c-11eb-a470-77d96e8dad84,0,0,RUSH,0,,,,17,Touchdown,2021-12-21T00:33:17Z,14.0,8:22,5.0,1.0,1.0,4.0,4.0,-10.0,PUNT,TOUCHDOWN,12:07,03:45,CLE 20,LV 6,3338.0,3706.0,16,14,Home,-2,30,-3.0,41.0,0,outdoors,grass,40.0,8.0,Kevin Stefanski,Rich Bisaccia,CLE00,FirstEnergy Stadium,0,1.0,,,N.Chubb,24.0,,,0,1,1.0,0,1,,00-0034791,,N.Chubb,24.0,00-0034791,N.Chubb,00-0034791,N.Chubb,00-0034791,0,1,0.778359243762679,,,,,,0.604733288288117,-60.4733288288117,2021-12-20,J.Abram,2021,REG,LV,15,00-0035693,S,Johnathan Abram,Johnathan,Abram,,,,Illness,,Full Participation in Practice,2021-12-16T21:29:09Z,2021-12-16 21:29:09
3445,2021_08_TEN_IND,2021103106,IND,TEN,REG,8,IND,home,TEN,IND,52.0,2021-10-31,526.0,526.0,526.0,Half2,0,16.0,0,4,1.0,0,08:46,IND 48,10,33.0,(8:46) 2-C.Wentz pass incomplete short left to 13-T.Hilton (51-D.Long). IND-13-T.Hilton was injured during the play.,pass,0.0,0,0,1.0,0,0,0,short,left,15.0,,,,,,,,3,3,0.0,,,,,3.0,3.0,24,24,24.0,24.0,0.0,24.0,24.0,0.0,0.0898727104067802,0.0739190354943276,0.0012421457795426,0.126636996865273,0.279085904359818,0.0032246212940663,0.426018595695496,0.0,0.0,2.71513674943708,-0.507669053506106,-0.74449018179439,0.74449018179439,0.918739610293414,-0.918739610293414,-6.03062642340325,6.03062642340325,0.960828133043833,-1.46849718654994,0.0,0.0,-8.49751988332719,8.49751988332719,7.65908408702575,-7.65908408702575,13.2991840724135,-13.2991840724135,-18.5191912242236,18.5191912242236,0.608900845050812,0.391099154949188,0.608900845050812,0.391099154949188,-0.0241687297821045,-0.0342656970024109,-0.0342656970024109,0.584732115268707,0.415267884731293,0.628240168094635,0.628240168094635,0.0594034194946289,-0.0594034194946289,-0.340627343484088,0.340627343484088,0.0,-0.0241687297821045,0.0,0.0,-0.092418370793319,0.092418370793319,-0.0555761485082589,0.0555761485082589,-0.092418370793319,0.092418370793319,-0.207687172172733,0.207687172172733,0.0,0.0,0.0,0.0,0.0,0.0,0.0,0.0,1.0,0,0.0,0.0,0.0,0.0,0.0,0.0,0.0,0.0,0.0,0.0,0.0,0.0,0.0,0.0,0.0,0.0,0.0,0.0,0.0,0.0,0.0,0.0,0.0,1.0,0.0,0.0,0.0,0.0,0.0,0.0,0.0,0.0,0.0,0.0,0.0,0.0,0.0,0.0,0.0,0.0,0.0,00-0032950,C.Wentz,,00-0029608,T.Hilton,,,,,,,,,,,,,,,,,,,,,,,,,,,,,,,,,,,,,,,,,,,,,,,,,,,,,,,,,,,,,,,,,0.0,,,,,,,00-0035292,D.Long,,,,,,,,,,,,,,,,,,,,,,,,0.0,,,,,0,,,0.0,0.0,0.0,0.0,,,2021,0.627054393291473,-62.7054393291473,44,1,First down,3445,"10/31/21, 13:02:25",2021-10-31T19:42:01Z,Lucas Oil Stadium,"Sunny Temp: 56° F, Humidity: 79%, Wind: WSW 5 mph",c59979aa-b37c-11eb-9545-5d927aa1f09a,0,0,PASS,0,,,,16,Punt,2021-10-31T19:35:29Z,13.0,5:50,4.0,0.0,0.0,4.0,4.0,5.0,KICKOFF,PUNT,11:15,05:25,IND 25,TEN 42,3246.0,3661.0,34,31,Home,-3,65,3.0,51.0,1,open,fieldturf,,,Frank Reich,Mike Vrabel,IND00,Lucas Oil Stadium,0,0.0,C.Wentz,2.0,,,T.Hilton,13.0,1,0,0.0,0,1,00-0032950,,00-0029608,C.Wentz,2.0,00-0032950,T.Hilton,00-0029608,T.Hilton,00-0029608,0,1,-0.507669053506106,0.226002069940088,3.72840601039934,2.0,1.0,1.0,0.504191756248474,49.5808243751526,2021-10-31,T.Hilton,2021,REG,IND,8,00-0029608,WR,T.Y. Hilton,T.Y.,Hilton,Quadricep,,Questionable,Quadricep,,Full Participation in Practice,2021-10-29T18:36:12Z,2021-10-29 18:36:12
3428,2021_06_DAL_NE,2021101710,NE,DAL,REG,6,NE,home,DAL,DAL,4.0,2021-10-17,433.0,433.0,433.0,Half2,0,17.0,0,4,1.0,1,07:13,DAL 4,4,75.0,"(7:13) (Shotgun) 37-D.Harris left tackle to DAL 1 for 3 yards (7-T.Diggs, 27-J.Kearse). NE-37-D.Harris was injured during the play.",run,3.0,1,0,0.0,0,0,0,,,,,left,tackle,,,,,1,3,0.0,,,,,1.0,3.0,14,20,14.0,20.0,-6.0,14.0,20.0,-6.0,0.0317901559174061,0.0109237944707274,0.0002634321863297,0.015087011270225,0.166801482439041,0.0014343610964715,0.773699820041657,0.0,0.0,5.78026458312525,0.234815929550678,-4.76335355738411,4.76335355738411,13.287719645974,-13.287719645974,-17.5567754039529,17.5567754039529,,,0.0,0.0,-6.39393565533101,6.39393565533101,-12.5332087679417,12.5332087679417,-21.3131964626664,21.3131964626664,11.3519534485369,-11.3519534485369,0.414327412843704,0.585672587156296,0.414327412843704,0.585672587156296,0.0991286933422089,0.019803375005722,0.019803375005722,0.513456106185913,0.486543893814087,0.35677033662796,0.35677033662796,0.554189896588497,-0.554189896588497,-0.459776700996493,0.459776700996493,,,0.0,0.0,0.104203207827475,-0.104203207827475,-0.601536989212036,0.601536989212036,0.104203207827475,-0.104203207827475,-0.396430373191834,0.396430373191834,0.0,0.0,0.0,0.0,0.0,0.0,0.0,0.0,0.0,0,0.0,0.0,0.0,0.0,0.0,0.0,0.0,0.0,0.0,0.0,0.0,0.0,0.0,0.0,0.0,0.0,0.0,0.0,0.0,0.0,0.0,0.0,1.0,0.0,0.0,0.0,0.0,0.0,0.0,0.0,0.0,0.0,0.0,0.0,0.0,0.0,1.0,0.0,0.0,0.0,0.0,,,,,,,00-0035657,D.Harris,3.0,,,,,,,,,,,,,,,,,,,,,,,,,,,,,,,,,,,,,,,,,,,,,,,,,00-0032454,J.Kearse,DAL,,,,,,,,,,1.0,00-0036361,T.Diggs,DAL,,,,,,,,,,,,,,,,,,,,,,,,,,,,,0.0,,,,,0,,,0.0,0.0,0.0,0.0,,,2021,,,51,1,Touchdown,3428,"10/17/21, 16:25:45",2021-10-17T23:02:56Z,Gillette Stadium,"Partly Cloudy Temp: 61° F, Humidity: 52%, Wind: West 10 mph",c599fb90-b37c-11eb-aba9-a0ee1ea0d04b,0,0,RUSH,0,,,,17,Touchdown,2021-10-17T22:53:28Z,13.0,6:50,6.0,1.0,1.0,4.0,4.0,5.0,KICKOFF,TOUCHDOWN,13:13,06:23,NE 25,DAL 1,3129.0,3477.0,35,29,Home,-6,64,-3.5,50.5,0,outdoors,fieldturf,62.0,11.0,Bill Belichick,Mike McCarthy,BOS00,Gillette Stadium,0,1.0,,,D.Harris,37.0,,,0,1,0.0,0,1,,00-0035657,,D.Harris,37.0,00-0035657,D.Harris,00-0035657,D.Harris,00-0035657,0,0,0.234815929550678,,,,,,0.464016377925873,-46.4016377925873,2021-10-17,D.Harris,2021,REG,NE,6,00-0035657,RB,Damien Harris,Damien,Harris,Ribs,,Questionable,Ribs,,Limited Participation in Practice,2021-10-15T19:49:34Z,2021-10-15 19:49:34
3419,2021_13_IND_HOU,2021120504,HOU,IND,REG,13,IND,away,HOU,HOU,15.0,2021-12-05,134.0,134.0,134.0,Half2,0,21.0,0,4,1.0,1,02:14,HOU 15,15,40.0,"(2:14) (Shotgun) 35-De.Jackson up the middle to HOU 15 for no gain (54-J.Martin, 37-T.Thomas). HOU-54-J.Martin was injured during the play. His return is Probable.",run,0.0,1,0,0.0,0,0,0,,,,,middle,,,,,,1,3,0.0,,,,,3.0,1.0,0,24,24.0,0.0,24.0,24.0,0.0,24.0,0.122763805091381,0.0084300376474857,0.0003046400961466,0.0132637908682227,0.35562139749527,0.000973570800852,0.49864274263382,0.0,0.0,4.44056460331194,-1.4109931322746,-32.9767375799604,32.9767375799604,-8.65437300293706,8.65437300293706,-27.6907645120112,27.6907645120112,,,0.0,0.0,-7.06738934561145,7.06738934561145,-6.88808310136665,6.88808310136665,-8.36527263541939,8.36527263541939,-17.5210406982981,17.5210406982981,0.999815165996552,0.0001848340034484,0.0001848340034484,0.999815165996552,-3.18288803100586e-05,3.57627868652344e-07,-3.57627868652344e-07,0.0002166628837585,0.999783337116241,0.999983191490173,1.68085098266602e-05,-0.321706880494137,0.321706880494137,-0.328808447787858,0.328808447787858,,,0.0,0.0,0.808718142967584,-0.808718142967584,-0.971439754590392,0.971439754590392,0.808718142967584,-0.808718142967584,-1.10313987469999,1.10313987469999,0.0,0.0,0.0,0.0,0.0,0.0,0.0,0.0,0.0,0,0.0,0.0,0.0,0.0,0.0,0.0,0.0,0.0,0.0,0.0,0.0,0.0,0.0,0.0,0.0,0.0,0.0,0.0,0.0,0.0,0.0,0.0,1.0,0.0,0.0,0.0,0.0,0.0,0.0,0.0,0.0,0.0,0.0,0.0,0.0,0.0,1.0,0.0,0.0,0.0,0.0,,,,,,,00-0036493,De.Jackson,0.0,,,,,,,,,,,,,,,,,,,,,,,,,,,,,,,,,,,,,,,,,,,,,,,,,00-0034488,T.Thomas,HOU,,,,,,,,,,1.0,00-0034163,J.Martin,HOU,,,,,,,,,,,,,,,,,,,,,,,,,,,,,0.0,,,,,0,,,0.0,0.0,0.0,0.0,,,2021,,,50,1,Touchdown,3419,"12/5/21, 13:02:31",2021-12-05T20:46:04Z,NRG Stadium,"Clear Temp: 76° F, Humidity: 90%, Wind: SSE 10 mph",c5988012-b37c-11eb-ba8a-ecb6fe06b3b0,0,0,RUSH,0,,,,21,Touchdown,2021-12-05T20:40:18Z,9.0,3:33,3.0,1.0,1.0,4.0,4.0,-5.0,DOWNS,TOUCHDOWN,05:29,01:56,HOU 40,HOU 3,3224.0,3515.0,31,0,Home,-31,31,-10.0,45.5,1,closed,astroturf,,,David Culley,Frank Reich,HOU00,NRG Stadium,0,0.0,,,De.Jackson,35.0,,,0,1,0.0,0,1,,00-0036493,,De.Jackson,35.0,00-0036493,De.Jackson,00-0036493,De.Jackson,00-0036493,0,1,-1.4109931322746,,,,,,0.0805018916726112,-8.05018916726112,2021-12-05,J.Martin,2021,REG,HOU,13,00-0034163,DE,Jacob Martin,Jacob,Martin,,,,Shin,,Full Participation in Practice,2021-12-03T19:47:06Z,2021-12-03 19:47:06
3382,2021_10_PHI_DEN,2021111409,DEN,PHI,REG,10,DEN,home,PHI,DEN,75.0,2021-11-14,452.0,452.0,452.0,Half2,0,18.0,0,4,2.0,0,07:32,DEN 25,10,0.0,(7:32) (Shotgun) 5-T.Bridgewater pass short middle to 81-T.Patrick to DEN 25 for no gain (29-A.Maddox) [91-F.Cox]. PHI-91-F.Cox was injured during the play.,pass,0.0,1,0,1.0,0,0,0,short,middle,0.0,0.0,,,,,,,2,2,0.0,,,,,2.0,2.0,13,30,13.0,30.0,-17.0,13.0,30.0,-17.0,0.255454808473587,0.127049788832665,0.0016102000372484,0.178009524941444,0.185436621308327,0.0034720404073596,0.24896702170372,0.0,0.0,0.675586655503139,-0.74825211474672,-22.0136985752265,22.0136985752265,-13.5913167248055,13.5913167248055,-6.63515915663153,6.63515915663153,-0.74825211474672,0.0,-0.74825211474672,0.0,-10.1360114446434,10.1360114446434,0.604457362921405,-0.604457362921405,-21.1818733152177,21.1818733152177,12.8413702164282,-12.8413702164282,0.0146136377006769,0.985386362299323,0.0146136377006769,0.985386362299323,-0.0015094466507434,-0.0027287704870104,-0.0027287704870104,0.0131041910499334,0.986895808950067,0.0150429820641875,0.0150429820641875,-0.26913509057577,0.26913509057577,-0.188075664452457,0.188075664452457,-0.0015094466507434,0.0,-0.0015094466507434,0.0,-0.393210005945706,0.393210005945706,0.109071254730225,-0.109071254730225,-0.393210005945706,0.393210005945706,0.159234950318933,-0.159234950318933,0.0,0.0,0.0,0.0,0.0,0.0,0.0,0.0,0.0,0,0.0,0.0,0.0,0.0,0.0,0.0,0.0,0.0,0.0,0.0,0.0,0.0,0.0,0.0,1.0,0.0,0.0,0.0,0.0,0.0,0.0,1.0,0.0,1.0,0.0,0.0,0.0,0.0,0.0,0.0,0.0,0.0,0.0,0.0,0.0,1.0,0.0,0.0,0.0,0.0,0.0,00-0031237,T.Bridgewater,0.0,00-0033375,T.Patrick,0.0,,,,,,,,,,,,,,,,,,,,,,,,,,,,,,,,,,,,00-0029653,F.Cox,,,,,,,,,PHI,,00-0034377,,A.Maddox,,,,,,,,,,,,,,0.0,,,,,,,,,,,,,,,,,,,,,,,,,,,,,,,,0.0,,,,,0,,,0.0,0.0,0.0,0.0,,,2021,0.280119568109512,71.9880431890488,49,0,Punt,3382,"11/14/21, 16:25:24",2021-11-15T00:06:53Z,Empower Field at Mile High,"Partly Cloudy Temp: 65° F, Humidity: 22%, Wind: South West 5 mph",c5991e4b-b37c-11eb-a470-77d96e8dad84,0,0,PASS,0,,,,18,Punt,2021-11-15T00:05:45Z,3.0,0:47,0.0,0.0,0.0,4.0,4.0,0.0,KICKOFF,PUNT,07:36,06:49,DEN 25,DEN 25,3338.0,3431.0,30,13,Home,-17,43,1.0,44.5,0,outdoors,grass ,57.0,19.0,Vic Fangio,Nick Sirianni,DEN00,Empower Field at Mile High,0,0.0,T.Bridgewater,5.0,,,T.Patrick,81.0,1,0,0.0,0,1,00-0031237,,00-0033375,T.Bridgewater,5.0,00-0031237,T.Patrick,00-0033375,T.Patrick,00-0033375,0,0,-0.74825211474672,0.951851386814152,7.25717600420467,6.0,0.529641520814039,0.242444266215898,0.915455400943756,8.45445990562439,2021-11-14,F.Cox,2021,REG,PHI,10,00-0029653,DT,Fletcher Cox,Fletcher,Cox,,,,Not injury related - resting player,,Full Participation in Practice,2021-11-12T19:31:45Z,2021-11-12 19:31:45
