play_id,game_id,old_game_id,home_team,away_team,season_type,week_x,posteam,posteam_type,defteam,side_of_field,yardline_100,game_date,quarter_seconds_remaining,half_seconds_remaining,game_seconds_remaining,game_half,quarter_end,drive,sp,qtr,down,goal_to_go,time,yrdln,ydstogo,ydsnet,desc,play_type,yards_gained,shotgun,no_huddle,qb_dropback,qb_kneel,qb_spike,qb_scramble,pass_length,pass_location,air_yards,yards_after_catch,run_location,run_gap,field_goal_result,kick_distance,extra_point_result,two_point_conv_result,home_timeouts_remaining,away_timeouts_remaining,timeout,timeout_team,td_team,td_player_name,td_player_id,posteam_timeouts_remaining,defteam_timeouts_remaining,total_home_score,total_away_score,posteam_score,defteam_score,score_differential,posteam_score_post,defteam_score_post,score_differential_post,no_score_prob,opp_fg_prob,opp_safety_prob,opp_td_prob,fg_prob,safety_prob,td_prob,extra_point_prob,two_point_conversion_prob,ep,epa,total_home_epa,total_away_epa,total_home_rush_epa,total_away_rush_epa,total_home_pass_epa,total_away_pass_epa,air_epa,yac_epa,comp_air_epa,comp_yac_epa,total_home_comp_air_epa,total_away_comp_air_epa,total_home_comp_yac_epa,total_away_comp_yac_epa,total_home_raw_air_epa,total_away_raw_air_epa,total_home_raw_yac_epa,total_away_raw_yac_epa,wp,def_wp,home_wp,away_wp,wpa,vegas_wpa,vegas_home_wpa,home_wp_post,away_wp_post,vegas_wp,vegas_home_wp,total_home_rush_wpa,total_away_rush_wpa,total_home_pass_wpa,total_away_pass_wpa,air_wpa,yac_wpa,comp_air_wpa,comp_yac_wpa,total_home_comp_air_wpa,total_away_comp_air_wpa,total_home_comp_yac_wpa,total_away_comp_yac_wpa,total_home_raw_air_wpa,total_away_raw_air_wpa,total_home_raw_yac_wpa,total_away_raw_yac_wpa,punt_blocked,first_down_rush,first_down_pass,first_down_penalty,third_down_converted,third_down_failed,fourth_down_converted,fourth_down_failed,incomplete_pass,touchback,interception,punt_inside_twenty,punt_in_endzone,punt_out_of_bounds,punt_downed,punt_fair_catch,kickoff_inside_twenty,kickoff_in_endzone,kickoff_out_of_bounds,kickoff_downed,kickoff_fair_catch,fumble_forced,fumble_not_forced,fumble_out_of_bounds,solo_tackle,safety,penalty,tackled_for_loss,fumble_lost,own_kickoff_recovery,own_kickoff_recovery_td,qb_hit,rush_attempt,pass_attempt,sack,touchdown,pass_touchdown,rush_touchdown,return_touchdown,extra_point_attempt,two_point_attempt,field_goal_attempt,kickoff_attempt,punt_attempt,fumble,complete_pass,assist_tackle,lateral_reception,lateral_rush,lateral_return,lateral_recovery,passer_player_id,passer_player_name,passing_yards,receiver_player_id,receiver_player_name,receiving_yards,rusher_player_id,rusher_player_name,rushing_yards,lateral_receiver_player_id,lateral_receiver_player_name,lateral_receiving_yards,lateral_rusher_player_id,lateral_rusher_player_name,lateral_rushing_yards,lateral_sack_player_id,lateral_sack_player_name,interception_player_id,interception_player_name,lateral_interception_player_id,lateral_interception_player_name,punt_returner_player_id,punt_returner_player_name,lateral_punt_returner_player_id,lateral_punt_returner_player_name,kickoff_returner_player_name,kickoff_returner_player_id,lateral_kickoff_returner_player_id,lateral_kickoff_returner_player_name,punter_player_id,punter_player_name,kicker_player_name,kicker_player_id,own_kickoff_recovery_player_id,own_kickoff_recovery_player_name,blocked_player_id,blocked_player_name,tackle_for_loss_1_player_id,tackle_for_loss_1_player_name,tackle_for_loss_2_player_id,tackle_for_loss_2_player_name,qb_hit_1_player_id,qb_hit_1_player_name,qb_hit_2_player_id,qb_hit_2_player_name,forced_fumble_player_1_team,forced_fumble_player_1_player_id,forced_fumble_player_1_player_name,forced_fumble_player_2_team,forced_fumble_player_2_player_id,forced_fumble_player_2_player_name,solo_tackle_1_team,solo_tackle_2_team,solo_tackle_1_player_id,solo_tackle_2_player_id,solo_tackle_1_player_name,solo_tackle_2_player_name,assist_tackle_1_player_id,assist_tackle_1_player_name,assist_tackle_1_team,assist_tackle_2_player_id,assist_tackle_2_player_name,assist_tackle_2_team,assist_tackle_3_player_id,assist_tackle_3_player_name,assist_tackle_3_team,assist_tackle_4_player_id,assist_tackle_4_player_name,assist_tackle_4_team,tackle_with_assist,tackle_with_assist_1_player_id,tackle_with_assist_1_player_name,tackle_with_assist_1_team,tackle_with_assist_2_player_id,tackle_with_assist_2_player_name,tackle_with_assist_2_team,pass_defense_1_player_id,pass_defense_1_player_name,pass_defense_2_player_id,pass_defense_2_player_name,fumbled_1_team,fumbled_1_player_id,fumbled_1_player_name,fumbled_2_player_id,fumbled_2_player_name,fumbled_2_team,fumble_recovery_1_team,fumble_recovery_1_yards,fumble_recovery_1_player_id,fumble_recovery_1_player_name,fumble_recovery_2_team,fumble_recovery_2_yards,fumble_recovery_2_player_id,fumble_recovery_2_player_name,sack_player_id,sack_player_name,half_sack_1_player_id,half_sack_1_player_name,half_sack_2_player_id,half_sack_2_player_name,return_team,return_yards,penalty_team,penalty_player_id,penalty_player_name,penalty_yards,replay_or_challenge,replay_or_challenge_result,penalty_type,defensive_two_point_attempt,defensive_two_point_conv,defensive_extra_point_attempt,defensive_extra_point_conv,safety_player_name,safety_player_id,season_x,cp,cpoe,series,series_success,series_result,order_sequence,start_time,time_of_day,stadium,weather,nfl_api_id,play_clock,play_deleted,play_type_nfl,special_teams_play,st_play_type,end_clock_time,end_yard_line,fixed_drive,fixed_drive_result,drive_real_start_time,drive_play_count,drive_time_of_possession,drive_first_downs,drive_inside20,drive_ended_with_score,drive_quarter_start,drive_quarter_end,drive_yards_penalized,drive_start_transition,drive_end_transition,drive_game_clock_start,drive_game_clock_end,drive_start_yard_line,drive_end_yard_line,drive_play_id_started,drive_play_id_ended,away_score,home_score,location,result,total,spread_line,total_line,div_game,roof,surface,temp,wind,home_coach,away_coach,stadium_id,game_stadium,aborted_play,success,passer,passer_jersey_number,rusher,rusher_jersey_number,receiver,receiver_jersey_number,pass,rush,first_down,special,play,passer_id,rusher_id,receiver_id,name,jersey_number,id,fantasy_player_name,fantasy_player_id,fantasy,fantasy_id,out_of_bounds,home_opening_kickoff,qb_epa,xyac_epa,xyac_mean_yardage,xyac_median_yardage,xyac_success,xyac_fd,xpass,pass_oe,date_x,injured_player,season_y,game_type,team,week_y,gsis_id,position,full_name,first_name,last_name,report_primary_injury,report_secondary_injury,report_status,practice_primary_injury,practice_secondary_injury,practice_status,date_modified,date_y
5167,2012_03_NYJ_MIA,2012092306,MIA,NYJ,REG,3,NYJ,away,MIA,NYJ,56.0,2012-09-23,467.0,467.0,467.0,Overtime,0,26.0,0,5,2.0,0,07:47,NYJ 44,4,47.0,"(7:47) 6-M.Sanchez pass deep left to 10-S.Holmes to MIA 18 for 38 yards (31-R.Marshall). MIA-31-R.Marshall was injured during the play. His return is Questionable. Penalty on MIA-31-R.Marshall, Defensive Holding, declined.",pass,38.0,0,0,1.0,0,0,0,deep,left,25.0,13.0,,,,,,,1,0,0.0,,,,,0.0,1.0,20,20,20.0,20.0,0.0,20.0,20.0,0.0,0.288564085960388,0.0694684982299805,0.0023811848368495,0.10549196600914,0.199210539460182,0.0030448513571173,0.331838846206665,0.0,0.0,1.97498161811382,2.49031401053071,-6.89464964761282,6.89464964761282,-0.13921413379859,0.13921413379859,1.10955281352205,-1.10955281352205,1.61222767783329,0.878086332697421,1.61222767783329,0.878086332697421,-2.90754832042148,2.90754832042148,-6.42099627083723,6.42099627083723,-12.3803933390882,12.3803933390882,9.81013301178161,-9.81013301178161,0.534094237023965,0.465905762976036,0.465905762976036,0.534094237023965,0.342270795896184,0.342270795896184,-0.342270795896184,0.123634967079852,0.876365032920148,0.534094237023965,0.465905762976036,0.0745865901922084,-0.0745865901922084,-0.445483318554137,0.445483318554137,-0.0211256968323141,0.363396492728498,-0.0211256968323141,0.363396492728498,0.267116474167389,-0.267116474167389,-0.756870837823954,0.756870837823954,0.422723055531216,-0.422723055531216,-0.961751661932871,0.961751661932871,0.0,0.0,1.0,0.0,0.0,0.0,0.0,0.0,0.0,0,0.0,0.0,0.0,0.0,0.0,0.0,0.0,0.0,0.0,0.0,0.0,0.0,0.0,0.0,1.0,0.0,0.0,0.0,0.0,0.0,0.0,0.0,0.0,1.0,0.0,0.0,0.0,0.0,0.0,0.0,0.0,0.0,0.0,0.0,0.0,1.0,0.0,0.0,0.0,0.0,0.0,00-0026898,M.Sanchez,38.0,00-0024240,S.Holmes,38.0,,,,,,,,,,,,,,,,,,,,,,,,,,,,,,,,,,,,,,,,,,,,,,MIA,,00-0024273,,R.Marshall,,,,,,,,,,,,,,0.0,,,,,,,,,,,,,,,,,,,,,,,,,,,,,,,,0.0,,,,,0,,,0.0,0.0,0.0,0.0,,,2012,0.35572537779808,64.427462220192,65,1,First down,5167,"9/23/12, 13:03:34",2012-09-23T20:59:06Z,Hard Rock Stadium,"Mostly Cloudy Temp: 83° F, Humidity: 76%, Wind: NNW 4 mph",10012012-0923-0619-1f54-b4c6641efa03,0,0,PASS,0,,,,26,Field goal,2012-09-23T20:58:28Z,5.0,1:49,1.0,1.0,1.0,5.0,5.0,0.0,MISSED_FG,FIELD_GOAL,07:53,06:04,NYJ 38,MIA 15,5143.0,5272.0,23,20,Home,-3,43,-2.5,40.5,1,outdoors,grass,83.0,4.0,Joe Philbin,Rex Ryan,MIA00,Sun Life Stadium,0,1.0,M.Sanchez,6.0,,,S.Holmes,10.0,1,0,1.0,0,1,00-0026898,,00-0024240,M.Sanchez,6.0,00-0026898,S.Holmes,00-0024240,S.Holmes,00-0024240,0,0,2.49031401053071,0.603810412565067,7.39318811451085,4.0,1.0,1.0,0.453959614038467,54.6040385961533,2012-09-23,R.Marshall,2012,REG,MIA,3,00-0024273,CB,Richard Marshall,Richard,Marshall,Back,,Probable,Back,,Full Participation in Practice,2012-09-21T12:21:09Z,2012-09-21 12:21:09
4808,2012_15_SF_NE,2012121613,NE,SF,REG,15,SF,away,NE,NE,11.0,2012-12-16,133.0,133.0,133.0,Half2,0,31.0,0,4,2.0,0,02:13,NE 11,9,2.0,(2:13) 21-F.Gore up the middle to NE 9 for 2 yards (50-R.Ninkovich; 55-B.Spikes). NE-55-B.Spikes was injured during the play.,run,2.0,0,0,0.0,0,0,0,,,,,middle,,,,,,1,1,0.0,,,,,1.0,1.0,31,38,38.0,31.0,7.0,38.0,31.0,7.0,0.18367500603199,0.0073983063921332,0.0003784789005294,0.014079175889492,0.380393505096436,0.00201788241975,0.412057667970657,0.0,0.0,3.90811384771951,-0.956446223659441,-13.1230972980891,13.1230972980891,-3.53551985031081,3.53551985031081,-10.3682175963199,10.3682175963199,,,0.0,0.0,-3.38233649800532,3.38233649800532,12.3471756920335,-12.3471756920335,-6.62145681388211,6.62145681388211,-1.72891602944583,1.72891602944583,0.979159235954285,0.0208407640457153,0.0208407640457153,0.979159235954285,-0.002682626247406,0.000843346118927,-0.000843346118927,0.0235233902931213,0.976476609706879,0.986448049545288,0.0135519504547119,0.0651077987739495,-0.0651077987739495,-0.522794369993719,0.522794369993719,,,0.0,0.0,0.570493434106734,-0.570493434106734,-0.574484341132245,0.574484341132245,0.569087787082221,-0.569087787082221,-0.967109578598081,0.967109578598081,0.0,0.0,0.0,0.0,0.0,0.0,0.0,0.0,0.0,0,0.0,0.0,0.0,0.0,0.0,0.0,0.0,0.0,0.0,0.0,0.0,0.0,0.0,0.0,0.0,0.0,0.0,0.0,0.0,0.0,0.0,0.0,1.0,0.0,0.0,0.0,0.0,0.0,0.0,0.0,0.0,0.0,0.0,0.0,0.0,0.0,1.0,0.0,0.0,0.0,0.0,,,,,,,00-0023500,F.Gore,2.0,,,,,,,,,,,,,,,,,,,,,,,,,,,,,,,,,,,,,,,,,,,,,,,,,00-0024349,R.Ninkovich,NE,00-0027668,B.Spikes,NE,,,,,,,0.0,,,,,,,,,,,,,,,,,,,,,,,,,,,,,,,,0.0,,,,,0,,,0.0,0.0,0.0,0.0,,,2012,,,70,0,Field goal,4808,"12/16/12, 20:31:13",2012-12-17T04:57:44Z,Gillette Stadium,"Cold and rain Temp: 34° F, Humidity: 100%, Wind: ENE 5 mph",10012012-1216-13d7-5070-12daaaa25c40,0,0,RUSH,0,,,,31,Field goal,2012-12-17T04:56:41Z,4.0,0:24,0.0,1.0,1.0,4.0,4.0,0.0,DOWNS,FIELD_GOAL,02:20,01:56,NE 12,NE 10,4770.0,4888.0,41,34,Home,-7,75,4.0,47.0,0,outdoors,fieldturf,34.0,5.0,Bill Belichick,Jim Harbaugh,BOS00,Gillette Stadium,0,0.0,,,F.Gore,21.0,,,0,1,0.0,0,1,,00-0023500,,F.Gore,21.0,00-0023500,F.Gore,00-0023500,F.Gore,00-0023500,0,1,-0.956446223659441,,,,,,0.142837062478066,-14.2837062478066,2012-12-16,B.Spikes,2012,REG,NE,15,00-0027668,LB,Brandon Spikes,Brandon,Spikes,Knee,Ankle,Questionable,Knee,Ankle,Limited Participation in Practice,2012-12-14T12:58:55Z,2012-12-14 12:58:55
4360,2012_17_GB_MIN,2012123009,MIN,GB,REG,17,MIN,home,GB,MIN,73.0,2012-12-30,120.0,120.0,120.0,Half2,0,20.0,0,4,3.0,0,02:00,MIN 27,11,61.0,(2:00) (Shotgun) 7-C.Ponder pass deep right to 84-M.Jenkins ran ob at GB 48 for 25 yards. GB-99-J.Worthy was injured during the play. GB-99-J.Worthy was injured during the play. His return is Doubtful.,pass,25.0,1,0,1.0,0,0,0,deep,right,25.0,0.0,,,,,,,2,3,0.0,,,,,2.0,3.0,34,34,34.0,34.0,0.0,34.0,34.0,0.0,0.488164395093918,0.136510655283928,0.0011247467482462,0.109714031219482,0.127198457717896,0.0022775437682867,0.135010167956352,0.0,0.0,0.151441958500072,2.17085577745456,-0.13122764439322,0.13122764439322,1.82500091289643,-1.82500091289643,-0.355875931901621,0.355875931901621,2.17085577745456,0.0,2.17085577745456,0.0,1.37304987609969,-1.37304987609969,-9.58501174939377,9.58501174939377,-11.2690323125862,11.2690323125862,2.36526912373351,-2.36526912373351,0.535194218158722,0.464805781841278,0.535194218158722,0.464805781841278,0.16435444355011,0.160506844520569,0.160506844520569,0.699548661708832,0.300451338291168,0.504322409629822,0.504322409629822,0.0579758157193054,-0.0579758157193054,0.147251004272515,-0.147251004272515,0.16435444355011,0.0,0.16435444355011,0.0,-0.0338868744339529,0.0338868744339529,-0.0103631873822088,0.0103631873822088,-0.0338868744339529,0.0338868744339529,-0.0164775063490743,0.0164775063490743,0.0,0.0,1.0,0.0,1.0,0.0,0.0,0.0,0.0,0,0.0,0.0,0.0,0.0,0.0,0.0,0.0,0.0,0.0,0.0,0.0,0.0,0.0,0.0,0.0,0.0,0.0,0.0,0.0,0.0,0.0,0.0,0.0,1.0,0.0,0.0,0.0,0.0,0.0,0.0,0.0,0.0,0.0,0.0,0.0,1.0,0.0,0.0,0.0,0.0,0.0,00-0027950,C.Ponder,25.0,00-0022781,M.Jenkins,25.0,,,,,,,,,,,,,,,,,,,,,,,,,,,,,,,,,,,,,,,,,,,,,,,,,,,,,,,,,,,,,,,,0.0,,,,,,,,,,,,,,,,,,,,,,,,,,,,,,,,0.0,,,,,0,,,0.0,0.0,0.0,0.0,,,2012,0.348083555698395,65.1916444301605,58,1,First down,4360,"12/30/12, 16:25:32",2012-12-31T00:35:38Z,Mall of America Field,"Temp: 65° F, Wind: mph",10012012-1230-0962-9d33-ccbc5695ab7b,0,0,PASS,0,,,,20,Field goal,2012-12-31T00:29:25Z,8.0,2:54,3.0,1.0,1.0,4.0,4.0,0.0,KICKOFF,FIELD_GOAL,02:54,00:00,MIN 28,GB 11,4264.0,4565.0,34,37,Home,3,71,-3.0,45.5,1,dome,sportturf,,,Leslie Frazier,Mike McCarthy,MIN00,Mall of America Field,0,1.0,C.Ponder,7.0,,,M.Jenkins,84.0,1,0,1.0,0,1,00-0027950,,00-0022781,C.Ponder,7.0,00-0027950,M.Jenkins,00-0022781,M.Jenkins,00-0022781,1,1,2.17085577745456,0.428387474045184,5.89868031686638,3.0,1.0,1.0,0.975432574748993,2.45674252510071,2012-12-30,J.Worthy,2012,REG,GB,17,00-0029257,DE,Jerel Worthy,Jerel,Worthy,Hamstring,,Probable,Hamstring,,Full Participation in Practice,2012-12-28T12:01:38Z,2012-12-28 12:01:38
4098,2012_03_HOU_DEN,2012092311,DEN,HOU,REG,3,DEN,home,HOU,HOU,40.0,2012-09-23,297.0,297.0,297.0,Half2,0,26.0,0,4,1.0,0,04:57,HOU 40,10,74.0,(4:57) (Shotgun) 18-P.Manning pass short middle to 14-B.Stokley to HOU 31 for 9 yards (56-B.Cushing). DEN-14-B.Stokley was injured during the play.,pass,9.0,1,0,1.0,0,0,0,short,middle,4.0,5.0,,,,,,,2,3,0.0,,,,,2.0,3.0,18,31,18.0,31.0,-13.0,18.0,31.0,-13.0,0.226812079548836,0.0440682359039784,0.0003452323726378,0.0589723475277424,0.266489207744598,0.0054414891637861,0.397871404886246,0.0,0.0,3.04974883061368,0.5989349859301,-13.7404491746404,13.7404491746404,-1.5986282681115,1.5986282681115,-20.5905207620574,20.5905207620574,-0.14477671822533,0.74371170415543,-0.14477671822533,0.74371170415543,-0.604788045368619,0.604788045368619,-9.36175587238635,9.36175587238635,8.42578865031945,-8.42578865031945,-26.2011246959506,26.2011246959506,0.0621737726032734,0.937826227396727,0.0621737726032734,0.937826227396727,0.0478375591337681,0.00855053961277,0.00855053961277,0.110011331737041,0.889988668262959,0.0367960743606091,0.0367960743606091,-0.195639600977302,0.195639600977302,-0.340852824634495,0.340852824634495,0.0,0.0478375591337681,0.0,0.0478375591337681,-0.0659988550469279,0.0659988550469279,-0.17509054079521,0.17509054079521,-0.0660100607201457,0.0660100607201457,-0.255180007441523,0.255180007441523,0.0,0.0,0.0,0.0,0.0,0.0,0.0,0.0,0.0,0,0.0,0.0,0.0,0.0,0.0,0.0,0.0,0.0,0.0,0.0,0.0,0.0,0.0,0.0,1.0,0.0,0.0,0.0,0.0,0.0,0.0,0.0,0.0,1.0,0.0,0.0,0.0,0.0,0.0,0.0,0.0,0.0,0.0,0.0,0.0,1.0,0.0,0.0,0.0,0.0,0.0,00-0010346,P.Manning,9.0,00-0015754,B.Stokley,9.0,,,,,,,,,,,,,,,,,,,,,,,,,,,,,,,,,,,,,,,,,,,,,,HOU,,00-0026991,,B.Cushing,,,,,,,,,,,,,,0.0,,,,,,,,,,,,,,,,,,,,,,,,,,,,,,,,0.0,,,,,0,,,0.0,0.0,0.0,0.0,,,2012,0.769989132881165,23.0010867118835,61,1,First down,4098,"9/23/12, 16:25:41",2012-09-23T23:30:53Z,Empower Field at Mile High,"Partly Sunny Temp: 84° F, Humidity: 10%, Wind: NW 13 mph",10012012-0923-1192-6c3b-ff5844966068,0,0,PASS,0,,,,26,Touchdown,2012-09-23T23:23:49Z,16.0,5:08,7.0,1.0,1.0,4.0,4.0,31.0,PUNT,TOUCHDOWN,08:08,03:00,DEN 26,HOU 6,3831.0,4329.0,31,25,Home,-6,56,-1.0,43.5,0,outdoors,grass,84.0,13.0,John Fox,Gary Kubiak,DEN00,Sports Authority Field at Mile High,0,1.0,P.Manning,18.0,,,B.Stokley,14.0,1,0,0.0,0,1,00-0010346,,00-0015754,P.Manning,18.0,00-0010346,B.Stokley,00-0015754,B.Stokley,00-0015754,0,1,0.5989349859301,0.538045767809505,4.65601857303409,3.0,0.827352521475405,0.284126018639654,0.912485599517822,8.75144004821777,2012-09-23,B.Stokley,2012,REG,DEN,3,00-0015754,WR,Brandon Stokley,Brandon,Stokley,Shoulder,,Probable,Shoulder,,Full Participation in Practice,2012-09-21T11:16:15Z,2012-09-21 11:16:15
4044,2012_14_DAL_CIN,2012120909,CIN,DAL,REG,14,DAL,away,CIN,CIN,40.0,2012-12-09,131.0,131.0,131.0,Half2,0,20.0,0,4,2.0,0,02:11,CIN 40,3,50.0,(2:11) (Shotgun) 29-D.Murray right tackle to CIN 38 for 2 yards (58-R.Maualuga; 55-V.Burfict). DAL-71-N.Livings was injured during the play.,run,2.0,1,0,0.0,0,0,0,,,,,right,tackle,,,,,0,2,0.0,,,,,2.0,0.0,19,17,17.0,19.0,-2.0,17.0,19.0,-2.0,0.66193288564682,0.026710094884038,0.0004788275982718,0.0263716485351324,0.119000978767872,0.0020577393006533,0.163447812199593,0.0,0.0,1.23956362070749,-0.195190704020206,-1.39078963210773,1.39078963210773,5.76000784547068,-5.76000784547068,-11.2134250718926,11.2134250718926,,,0.0,0.0,-3.09647152904654,3.09647152904654,-1.29238118953072,1.29238118953072,-5.66819936298998,5.66819936298998,-4.81641613449759,4.81641613449759,0.509517788887024,0.490482211112976,0.490482211112976,0.509517788887024,-0.0139432549476624,0.0061765909194946,-0.0061765909194946,0.504425466060638,0.495574533939362,0.611987709999085,0.388012290000916,0.138893906264005,-0.138893906264005,-0.332116022848027,0.332116022848027,,,0.0,0.0,0.0614461302757263,-0.0614461302757263,-0.177455783032315,0.177455783032315,0.0586097091436386,-0.0586097091436386,-0.248897746347325,0.248897746347325,0.0,0.0,0.0,0.0,0.0,0.0,0.0,0.0,0.0,0,0.0,0.0,0.0,0.0,0.0,0.0,0.0,0.0,0.0,0.0,0.0,0.0,0.0,0.0,0.0,0.0,0.0,0.0,0.0,0.0,0.0,0.0,1.0,0.0,0.0,0.0,0.0,0.0,0.0,0.0,0.0,0.0,0.0,0.0,0.0,0.0,1.0,0.0,0.0,0.0,0.0,,,,,,,00-0028009,D.Murray,2.0,,,,,,,,,,,,,,,,,,,,,,,,,,,,,,,,,,,,,,,,,,,,,,,,,00-0027014,R.Maualuga,CIN,00-0028912,V.Burfict,CIN,,,,,,,0.0,,,,,,,,,,,,,,,,,,,,,,,,,,,,,,,,0.0,,,,,0,,,0.0,0.0,0.0,0.0,,,2012,,,54,1,First down,4044,"12/9/12, 13:03:35",2012-12-09T21:07:28Z,Paycor Stadium,"Cloudy Temp: 53° F, Humidity: 96%, Wind: SSE 6 mph",10012012-1209-0986-0934-6513c9a91d88,0,0,RUSH,0,,,,20,Field goal,2012-12-09T21:03:47Z,13.0,3:44,4.0,0.0,1.0,4.0,4.0,0.0,PUNT,FIELD_GOAL,03:44,00:00,DAL 28,CIN 22,3897.0,4230.0,20,19,Home,-1,39,3.5,46.0,0,outdoors,fieldturf,53.0,6.0,Marvin Lewis,Jason Garrett,CIN00,Paul Brown Stadium,0,0.0,,,D.Murray,29.0,,,0,1,0.0,0,1,,00-0028009,,D.Murray,29.0,00-0028009,D.Murray,00-0028009,D.Murray,00-0028009,0,0,-0.195190704020206,,,,,,0.444151222705841,-44.4151222705841,2012-12-09,N.Livings,2012,REG,DAL,14,00-0023958,G,Nate Livings,Nate,Livings,Knee,,Probable,Knee,,Full Participation in Practice,2012-12-07T11:19:50Z,2012-12-07 11:19:50
4015,2012_08_NE_STL,2012102804,LA,NE,REG,8,LA,home,NE,LA,62.0,2012-10-28,179.0,179.0,179.0,Half2,0,19.0,0,4,1.0,0,02:59,LA 38,10,76.0,"(2:59) 10-K.Clemens FUMBLES (Aborted) at LA 38, and recovers at LA 38. 10-K.Clemens to LA 38 for no gain (51-J.Mayo). NE-97-R.Brace was injured during the play. His return is Questionable.",run,0.0,0,0,0.0,0,0,0,,,,,,,,,,,3,3,0.0,,,,,3.0,3.0,7,45,7.0,45.0,-38.0,7.0,45.0,-38.0,0.393654227256775,0.0783766582608223,0.0007544794352725,0.0993375927209854,0.171724051237106,0.0025626784190535,0.253590285778046,0.0,0.0,1.36342742829584,-0.345576342660934,-38.3554337831954,38.3554337831954,-9.76653462948161,9.76653462948161,-27.752570962819,27.752570962819,,,0.0,0.0,-5.49328782589873,5.49328782589873,-15.7221668941784,15.7221668941784,-16.7274754921673,16.7274754921673,-6.36448307748108,6.36448307748108,8.08169861556962e-05,0.999919183013844,8.08169861556962e-05,0.999919183013844,-5.72432327317074e-06,-3.97356507164659e-06,-3.97356507164659e-06,7.50926628825255e-05,0.999924907337117,1.64342327479972e-05,1.64342327479972e-05,-0.178882803874437,0.178882803874437,-0.285467566615901,0.285467566615901,,,0.0,0.0,-0.141093600469756,0.141093600469756,-0.146623544734962,0.146623544734962,-0.141093600469756,0.141093600469756,-0.143860800335301,0.143860800335301,0.0,0.0,0.0,0.0,0.0,0.0,0.0,0.0,0.0,0,0.0,0.0,0.0,0.0,0.0,0.0,0.0,0.0,0.0,0.0,0.0,0.0,1.0,0.0,1.0,0.0,0.0,0.0,0.0,0.0,0.0,0.0,1.0,0.0,0.0,0.0,0.0,0.0,0.0,0.0,0.0,0.0,0.0,0.0,1.0,0.0,0.0,0.0,0.0,0.0,0.0,,,,,,,00-0024264,K.Clemens,0.0,,,,,,,,,,,,,,,,,,,,,,,,,,,,,,,,,,,,,,,,,,,NE,,00-0026150,,J.Mayo,,,,,,,,,,,,,,0.0,,,,,,,,,,,LA,00-0024264,K.Clemens,,,,LA,0.0,00-0024264,K.Clemens,,,,,,,,,,,,0.0,,,,,0,,,0.0,0.0,0.0,0.0,,,2012,,,56,1,First down,4015,"10/28/12, 13:06:36",2012-10-28T20:06:04Z,Wembley Stadium,"Mostly Cloudy Temp: 49° F, Humidity: 84%, Wind: SW 9 mph",10012012-1028-049c-c6a8-a2bcfaa204b8,0,0,RUSH,0,,,,19,Turnover,2012-10-28T20:03:50Z,7.0,3:48,3.0,1.0,0.0,4.0,4.0,0.0,PUNT,INTERCEPTION,05:13,01:25,LA 9,NE 15,3948.0,4117.0,45,7,Neutral,-38,52,-7.5,46.0,0,outdoors,astroplay,49.0,9.0,Jeff Fisher,Bill Belichick,LON00,Wembley Stadium,1,0.0,,,K.Clemens,10.0,,,0,1,0.0,0,1,,00-0024264,,K.Clemens,10.0,00-0024264,K.Clemens,00-0024264,K.Clemens,00-0024264,0,1,-0.345576342660934,,,,,,0.807811141014099,-80.7811141014099,2012-10-28,R.Brace,2012,REG,NE,8,00-0027016,DT,Ron Brace,Ron,Brace,Back,,Questionable,Back,,Limited Participation in Practice,2012-10-26T12:39:29Z,2012-10-26 12:39:29
4010,2012_03_PHI_ARI,2012092309,ARI,PHI,REG,3,ARI,home,PHI,PHI,36.0,2012-09-23,185.0,185.0,185.0,Half2,0,21.0,0,4,1.0,0,03:05,PHI 36,10,14.0,(3:05) 34-R.Williams up the middle to PHI 16 for 20 yards (52-B.Rolle). ARI-34-R.Williams was injured during the play. His return is Questionable.,run,20.0,0,0,0.0,0,0,0,,,,,middle,,,,,,2,1,0.0,,,,,2.0,1.0,27,6,27.0,6.0,21.0,27.0,6.0,21.0,0.331221669912338,0.029452258720994,0.0002800767251756,0.0363997556269169,0.269367218017578,0.0026289643719792,0.33065003156662,0.0,0.0,2.78419458476128,1.50730021618074,25.2161993769516,-25.2161993769516,-7.27719600707078,7.27719600707078,26.2048489547566,-26.2048489547566,,,0.0,0.0,-9.75512914854335,9.75512914854335,8.83271728095133,-8.83271728095133,-28.4092755891033,28.4092755891033,40.6546688247431,-40.6546688247431,0.999506950378418,0.000493049621582,0.999506950378418,0.000493049621582,0.0002567172050476,0.0001205801963806,0.0001205801963806,0.999763667583466,0.0002363324165344,0.99976509809494,0.99976509809494,-0.0591216799803078,0.0591216799803078,0.344819958874916,-0.344819958874916,,,0.0,0.0,-0.106160265393555,0.106160265393555,0.237385506418184,-0.237385506418184,-0.433617137896363,0.433617137896363,0.625970013640006,-0.625970013640006,0.0,1.0,0.0,0.0,0.0,0.0,0.0,0.0,0.0,0,0.0,0.0,0.0,0.0,0.0,0.0,0.0,0.0,0.0,0.0,0.0,0.0,0.0,0.0,1.0,0.0,0.0,0.0,0.0,0.0,0.0,0.0,1.0,0.0,0.0,0.0,0.0,0.0,0.0,0.0,0.0,0.0,0.0,0.0,0.0,0.0,0.0,0.0,0.0,0.0,0.0,,,,,,,00-0027976,R.Williams,20.0,,,,,,,,,,,,,,,,,,,,,,,,,,,,,,,,,,,,,,,,,,,PHI,,00-0028131,,B.Rolle,,,,,,,,,,,,,,0.0,,,,,,,,,,,,,,,,,,,,,,,,,,,,,,,,0.0,,,,,0,,,0.0,0.0,0.0,0.0,,,2012,,,50,1,First down,4010,"9/23/12, 16:05:33",2012-09-23T23:04:45Z,State Farm Stadium,"Temp: ° F, Wind: mph",10012012-0923-0983-16fc-87e5113fe1b7,0,0,RUSH,0,,,,21,Turnover on downs,2012-09-23T23:04:45Z,5.0,2:32,1.0,1.0,0.0,4.0,4.0,0.0,DOWNS,DOWNS,03:05,00:33,PHI 36,PHI 22,4010.0,4117.0,6,27,Home,21,33,-3.0,42.5,0,closed,grass,,,Ken Whisenhunt,Andy Reid,PHO00,University of Phoenix Stadium,0,1.0,,,R.Williams,34.0,,,0,1,1.0,0,1,,00-0027976,,R.Williams,34.0,00-0027976,R.Williams,00-0027976,R.Williams,00-0027976,0,0,1.50730021618074,,,,,,0.0450209341943264,-4.50209341943264,2012-09-23,R.Williams,2012,REG,ARI,3,00-0027976,RB,Ryan Williams,Ryan,Williams,Knee,,Probable,Knee,,Full Participation in Practice,2012-09-21T12:46:36Z,2012-09-21 12:46:36
3938,2012_05_GB_IND,2012100702,IND,GB,REG,5,GB,away,IND,GB,52.0,2012-10-07,752.0,752.0,752.0,Half2,0,23.0,0,4,1.0,0,12:32,GB 48,10,22.0,(12:32) (Run formation) 12-A.Rodgers sacked at GB 42 for -6 yards (98-R.Mathis). IND-98-R.Mathis was injured during the play. His return is Questionable.,pass,-6.0,0,0,1.0,0,0,0,,,,,,,,,,,2,2,0.0,,,,,2.0,2.0,19,21,21.0,19.0,2.0,21.0,19.0,2.0,0.0577019862830639,0.0978778973221779,0.0012241655495017,0.149023458361626,0.305319845676422,0.0016660937108099,0.387186527252197,0.0,0.0,2.29035118361935,-1.30106699466705,-4.54963776576187,4.54963776576187,-1.32371335526113,1.32371335526113,-4.878190877751,4.878190877751,,,0.0,0.0,3.08495724678505,-3.08495724678505,-5.6194844338982,5.6194844338982,7.90481079911115,-7.90481079911115,-14.2416794674993,14.2416794674993,0.708380818367004,0.291619181632996,0.291619181632996,0.708380818367004,-0.0720903277397156,-0.0288938879966736,0.0288938879966736,0.363709509372711,0.636290490627289,0.789257347583771,0.210742652416229,-0.0633262990011545,0.0633262990011545,-0.217100001570272,0.217100001570272,,,0.0,0.0,0.0846558511257172,-0.0846558511257172,-0.0569393161055322,0.0569393161055322,0.0759012475609779,-0.0759012475609779,-0.327159878921198,0.327159878921198,0.0,0.0,0.0,0.0,0.0,0.0,0.0,0.0,0.0,0,0.0,0.0,0.0,0.0,0.0,0.0,0.0,0.0,0.0,0.0,0.0,0.0,0.0,0.0,1.0,0.0,0.0,0.0,0.0,0.0,0.0,1.0,0.0,1.0,1.0,0.0,0.0,0.0,0.0,0.0,0.0,0.0,0.0,0.0,0.0,0.0,0.0,0.0,0.0,0.0,0.0,00-0023459,A.Rodgers,,,,,,,,,,,,,,,,,,,,,,,,,,,,,,,,,,,,00-0022059,R.Mathis,,,00-0022059,R.Mathis,,,,,,,,,IND,,00-0022059,,R.Mathis,,,,,,,,,,,,,,0.0,,,,,,,,,,,,,,,,,,,,,,,,,00-0022059,R.Mathis,,,,,,0.0,,,,,0,,,0.0,0.0,0.0,0.0,,,2012,,,52,0,Punt,3938,"10/7/12, 13:03:39",2012-10-07T19:54:58Z,Lucas Oil Stadium,"Cloudy Temp: 48° F, Humidity: 56%, Wind: W 8 mph",10012012-1007-0285-ba5c-0a7b87ed92cd,0,0,SACK,0,,,,23,Punt,2012-10-07T19:54:12Z,4.0,1:41,1.0,0.0,0.0,4.0,4.0,0.0,INTERCEPTION,PUNT,13:08,11:27,GB 29,IND 49,3917.0,4003.0,27,30,Home,3,57,-6.5,49.5,0,closed,fieldturf,,,Chuck Pagano,Mike McCarthy,IND00,Lucas Oil Stadium,0,0.0,A.Rodgers,12.0,,,,,1,0,0.0,0,1,00-0023459,,,A.Rodgers,12.0,00-0023459,,,,,0,1,-1.30106699466705,,,,,,0.467363059520721,53.2636940479279,2012-10-07,R.Mathis,2012,REG,IND,5,00-0022059,LB,Robert Mathis,Robert,Mathis,Ankle,,Probable,Ankle,,Full Participation in Practice,2012-10-05T11:51:45Z,2012-10-05 11:51:45
3792,2012_13_JAX_BUF,2012120206,BUF,JAX,REG,13,JAX,away,BUF,JAX,74.0,2012-12-02,506.0,506.0,506.0,Half2,0,22.0,0,4,2.0,0,08:26,JAX 26,10,35.0,"(8:26) (Shotgun) 7-C.Henne pass short right to 84-C.Shorts to JAX 31 for 5 yards (33-R.Brooks) [99-M.Dareus]. JAX-84-C.Shorts was injured during the play. He is Out. Caught near sideline at JAX 31, curling back to middle. PENALTY on BUF-33-R.Brooks, Unnecessary Roughness, 15 yards, enforced at JAX 31.",pass,5.0,1,0,1.0,0,0,0,short,right,5.0,0.0,,,,,,,1,3,0.0,,,,,3.0,1.0,34,18,18.0,34.0,-16.0,18.0,34.0,-16.0,0.209161996841431,0.134054318070412,0.003366308286786,0.206183984875679,0.162735611200333,0.0013868645764887,0.283110916614532,0.0,0.0,0.620573514141142,1.54548100475222,13.5738916906686,-13.5738916906686,9.35112734437268,-9.35112734437268,7.84765763912632,-7.84765763912632,-0.193850051844493,1.73933105659671,-0.193850051844493,1.73933105659671,0.362453276716399,-0.362453276716399,-3.01228105893824,3.01228105893824,-14.0285869525804,14.0285869525804,15.9540659928292,-15.9540659928292,0.0219539199024439,0.978046080097556,0.978046080097556,0.0219539199024439,0.014061214402318,0.00770572014153,-0.00770572014153,0.963984865695238,0.0360151343047619,0.0167546458542347,0.983245354145765,0.161224647135587,-0.161224647135587,0.152906511694975,-0.152906511694975,-4.65977936983109e-05,0.0141078121960163,-4.65977936983109e-05,0.0141078121960163,0.0867362003948909,-0.0867362003948909,-0.100610682275146,0.100610682275146,0.0867362003948909,-0.0867362003948909,-0.0611185666639358,0.0611185666639358,0.0,0.0,0.0,1.0,0.0,0.0,0.0,0.0,0.0,0,0.0,0.0,0.0,0.0,0.0,0.0,0.0,0.0,0.0,0.0,0.0,0.0,0.0,0.0,1.0,0.0,1.0,0.0,0.0,0.0,0.0,1.0,0.0,1.0,0.0,0.0,0.0,0.0,0.0,0.0,0.0,0.0,0.0,0.0,0.0,1.0,0.0,0.0,0.0,0.0,0.0,00-0026197,C.Henne,5.0,00-0028052,C.Shorts,5.0,,,,,,,,,,,,,,,,,,,,,,,,,,,,,,,,,,,,00-0027941,M.Dareus,,,,,,,,,BUF,,00-0029280,,R.Brooks,,,,,,,,,,,,,,0.0,,,,,,,,,,,,,,,,,,,,,,,,,,,,,,,,0.0,BUF,00-0029280,R.Brooks,15.0,0,,Unnecessary Roughness,0.0,0.0,0.0,0.0,,,2012,0.425803065299988,57.4196934700012,51,1,First down,3792,"12/2/12, 13:03:01",2012-12-02T20:43:38Z,Highmark Stadium,"Rain Temp: 52° F, Humidity: 87%, Wind: SW 17 mph",10012012-1202-0632-2ed9-89a845317586,0,0,PASS,0,,,,22,Turnover on downs,2012-12-02T20:43:03Z,8.0,2:52,2.0,0.0,0.0,4.0,4.0,5.0,PUNT,DOWNS,08:33,05:41,JAX 26,BUF 39,3766.0,4049.0,18,34,Home,16,52,6.0,41.0,0,outdoors,a_turf,52.0,17.0,Chan Gailey,Mike Mularkey,BUF00,Ralph Wilson Stadium,0,1.0,C.Henne,7.0,,,C.Shorts,84.0,1,0,1.0,0,1,00-0026197,,00-0028052,C.Henne,7.0,00-0026197,C.Shorts,00-0028052,C.Shorts,00-0028052,0,0,1.54548100475222,0.582414675001957,3.76067531068111,2.0,0.731955222028773,0.249023764568847,0.880644202232361,11.9355797767639,2012-12-02,C.Shorts,2012,REG,JAX,13,00-0028052,WR,Cecil Shorts,Cecil,Shorts,Hamstring,,Probable,Hamstring,,Limited Participation in Practice,2012-11-30T10:35:21Z,2012-11-30 10:35:21
3768,2012_13_NO_ATL,2012112900,ATL,NO,REG,13,NO,away,ATL,NO,65.0,2012-11-29,226.0,226.0,226.0,Half2,0,23.0,0,4,1.0,0,03:46,NO 35,10,14.0,(3:46) (Shotgun) 9-D.Brees pass incomplete short left to 16-L.Moore. NO-64-Z.Strief was injured during the play. His return is Probable.,pass,0.0,1,0,1.0,0,0,0,short,left,11.0,,,,,,,,2,2,0.0,,,,,2.0,2.0,23,13,13.0,23.0,-10.0,13.0,23.0,-10.0,0.407362163066864,0.0750909671187401,0.0008473193738609,0.0986959338188171,0.159072712063789,0.0016877679154276,0.257243156433105,0.0,0.0,1.3634566902183,-0.498090554377995,7.94145541823528,-7.94145541823528,0.0770582458353601,-0.0770582458353601,4.40018388295118,-4.40018388295118,0.493887930642813,-0.991978485020809,0.0,0.0,-12.3535898710834,12.3535898710834,1.12582389903729,-1.12582389903729,-8.31810464605223,8.31810464605223,10.9746379815418,-10.9746379815418,0.062304075807333,0.937695924192667,0.937695924192667,0.062304075807333,-0.0095692202448844,-0.0055566281080246,0.0055566281080246,0.947265144437551,0.0527348555624485,0.0639251470565796,0.93607485294342,0.0919047664464559,-0.0919047664464559,0.194045051932335,-0.194045051932335,0.0,-0.0095692202448844,0.0,0.0,-0.0409439504146576,0.0409439504146576,-0.0739783644676209,0.0739783644676209,-0.0475108325481415,0.0475108325481415,0.173546880483627,-0.173546880483627,0.0,0.0,0.0,0.0,0.0,0.0,0.0,0.0,1.0,0,0.0,0.0,0.0,0.0,0.0,0.0,0.0,0.0,0.0,0.0,0.0,0.0,0.0,0.0,0.0,0.0,0.0,0.0,0.0,0.0,0.0,0.0,0.0,1.0,0.0,0.0,0.0,0.0,0.0,0.0,0.0,0.0,0.0,0.0,0.0,0.0,0.0,0.0,0.0,0.0,0.0,00-0020531,D.Brees,,00-0023310,L.Moore,,,,,,,,,,,,,,,,,,,,,,,,,,,,,,,,,,,,,,,,,,,,,,,,,,,,,,,,,,,,,,,,,0.0,,,,,,,,,,,,,,,,,,,,,,,,,,,,,,,,0.0,,,,,0,,,0.0,0.0,0.0,0.0,,,2012,0.631222665309906,-63.1222665309906,57,0,Turnover,3768,"11/29/12, 20:29:57",2012-11-30T04:17:35Z,Georgia Dome,"Temp: ° F, Wind: mph",10012012-1129-007d-3952-d792e369f5eb,0,0,PASS,0,,,,23,Turnover,2012-11-30T04:15:36Z,5.0,0:56,1.0,0.0,0.0,4.0,4.0,0.0,KICKOFF,INTERCEPTION,04:25,03:29,NO 21,NO 35,3700.0,3816.0,13,23,Home,10,36,3.5,54.5,1,dome,fieldturf,,,Mike Smith,Joe Vitt,ATL00,Georgia Dome,0,0.0,D.Brees,9.0,,,L.Moore,16.0,1,0,0.0,0,1,00-0020531,,00-0023310,D.Brees,9.0,00-0020531,L.Moore,00-0023310,L.Moore,00-0023310,0,1,-0.498090554377995,0.221186870769808,3.0519114274357,1.0,1.0,0.991634522855747,0.94330757856369,5.66924214363098,2012-11-29,Z.Strief,2012,REG,NO,13,00-0024424,T,Zach Strief,Zach,Strief,Groin,,Questionable,Groin,,Limited Participation in Practice,2012-11-28T12:00:00Z,2012-11-28 12:00:00
3669,2012_02_TB_NYG,2012091600,NYG,TB,REG,2,NYG,home,TB,NYG,67.0,2012-09-16,343.0,343.0,343.0,Half2,0,24.0,0,4,1.0,0,05:43,NYG 33,10,67.0,(5:43) 10-E.Manning pass incomplete deep right to 88-H.Nicks (25-A.Talib). NYG-88-H.Nicks was injured during the play.,pass,0.0,0,0,1.0,0,0,0,deep,right,22.0,,,,,,,,3,1,0.0,,,,,3.0,1.0,27,27,27.0,27.0,0.0,27.0,27.0,0.0,0.314022392034531,0.0776197016239166,0.0018330017337575,0.131316304206848,0.169804647564888,0.0029843018855899,0.302419632673264,0.0,0.0,1.47658073739149,-0.416711169527844,-1.41664575304582,1.41664575304582,1.32631025345484,-1.32631025345484,-2.20388130850655,2.20388130850655,1.4443285970483,-1.86103976657614,0.0,0.0,8.92243322130526,-8.92243322130526,8.60386340327125,-8.60386340327125,19.8771019119304,-19.8771019119304,-25.2681134432325,25.2681134432325,0.592910766601563,0.407089233398438,0.592910766601563,0.407089233398438,-0.0244565606117249,-0.0253106951713562,-0.0253106951713562,0.568454205989838,0.431545794010162,0.7063227891922,0.7063227891922,0.0814237424813941,-0.0814237424813941,0.0914180700794934,-0.0914180700794934,0.0,-0.0244565606117249,0.0,0.0,-0.0583965927362442,0.0583965927362442,0.70615723501111,-0.70615723501111,-0.0825197547674179,0.0825197547674179,0.0704303358809232,-0.0704303358809232,0.0,0.0,0.0,0.0,0.0,0.0,0.0,0.0,1.0,0,0.0,0.0,0.0,0.0,0.0,0.0,0.0,0.0,0.0,0.0,0.0,0.0,0.0,0.0,0.0,0.0,0.0,0.0,0.0,0.0,0.0,0.0,0.0,1.0,0.0,0.0,0.0,0.0,0.0,0.0,0.0,0.0,0.0,0.0,0.0,0.0,0.0,0.0,0.0,0.0,0.0,00-0022803,E.Manning,,00-0027005,H.Nicks,,,,,,,,,,,,,,,,,,,,,,,,,,,,,,,,,,,,,,,,,,,,,,,,,,,,,,,,,,,,,,,,,0.0,,,,,,,00-0026160,A.Talib,,,,,,,,,,,,,,,,,,,,,,,,0.0,,,,,0,,,0.0,0.0,0.0,0.0,,,2012,0.448293209075928,-44.8293209075928,54,1,First down,3669,"9/16/12, 13:03:05",2012-09-16T19:59:45Z,MetLife Stadium,"Mostly Sunny Temp: 73° F, Humidity: 39%, Wind: West 1 mph",10012012-0916-0041-88b2-42a86850e651,0,0,PASS,0,,,,24,Touchdown,2012-09-16T19:59:45Z,4.0,1:44,3.0,0.0,1.0,4.0,4.0,0.0,PUNT,TOUCHDOWN,05:43,03:59,NYG 33,TB 33,3669.0,3762.0,34,41,Home,7,75,9.0,43.5,0,outdoors,fieldturf,73.0,1.0,Tom Coughlin,Greg Schiano,NYC01,MetLife Stadium,0,0.0,E.Manning,10.0,,,H.Nicks,88.0,1,0,0.0,0,1,00-0022803,,00-0027005,E.Manning,10.0,00-0022803,H.Nicks,00-0027005,H.Nicks,00-0027005,0,1,-0.416711169527844,0.413989002569831,6.19196210525115,3.0,1.0,1.0,0.492264360189438,50.7735639810562,2012-09-16,H.Nicks,2012,REG,NYG,2,00-0027005,WR,Hakeem Nicks,Hakeem,Nicks,Foot,,Questionable,Foot,,Did Not Participate In Practice,2012-09-14T10:21:09Z,2012-09-14 10:21:09
3665,2012_01_WAS_NO,2012090906,NO,WAS,REG,1,NO,home,WAS,NO,77.0,2012-09-09,602.0,602.0,602.0,Half2,0,17.0,0,4,3.0,0,10:02,NO 23,26,-16.0,(10:02) (Shotgun) 9-D.Brees pass incomplete deep left to 12-M.Colston (26-J.Wilson). WAS-26-J.Wilson was injured during the play. His return is Questionable.,pass,0.0,1,0,1.0,0,0,0,deep,left,37.0,,,,,,,,2,2,0.0,,,,,2.0,2.0,17,33,17.0,33.0,-16.0,17.0,33.0,-16.0,0.15842741727829,0.193733394145966,0.0026697071734815,0.296609252691269,0.124939151108265,0.0047101629897952,0.218910932540894,0.0,0.0,-0.746190058533102,-0.576863141730428,-24.7055693148199,24.7055693148199,-0.837350594416953,0.837350594416953,-25.0432720657277,25.0432720657277,4.06356172461528,-4.64042486634571,0.0,0.0,3.55437234655255,-3.55437234655255,-19.0473219765348,19.0473219765348,1.92052950564539,-1.92052950564539,-24.4357575073096,24.4357575073096,0.0199017655104399,0.98009823448956,0.0199017655104399,0.98009823448956,-0.0058611612766981,-0.0054102856665849,-0.0054102856665849,0.0140406042337418,0.985959395766258,0.0245275534689426,0.0245275534689426,-0.0587576525231984,0.0587576525231984,-0.509458783846904,0.509458783846904,0.0,-0.0058611612766981,0.0,0.0,-0.0302599922583563,0.0302599922583563,-0.212890834118131,0.212890834118131,-0.03759037263851,0.03759037263851,-0.447404983024004,0.447404983024004,0.0,0.0,0.0,0.0,0.0,1.0,0.0,0.0,1.0,0,0.0,0.0,0.0,0.0,0.0,0.0,0.0,0.0,0.0,0.0,0.0,0.0,0.0,0.0,0.0,0.0,0.0,0.0,0.0,0.0,0.0,0.0,0.0,1.0,0.0,0.0,0.0,0.0,0.0,0.0,0.0,0.0,0.0,0.0,0.0,0.0,0.0,0.0,0.0,0.0,0.0,00-0020531,D.Brees,,00-0024466,M.Colston,,,,,,,,,,,,,,,,,,,,,,,,,,,,,,,,,,,,,,,,,,,,,,,,,,,,,,,,,,,,,,,,,0.0,,,,,,,00-0025442,J.Wilson,,,,,,,,,,,,,,,,,,,,,,,,0.0,,,,,0,,,0.0,0.0,0.0,0.0,,,2012,0.305767238140106,-30.5767238140106,45,0,Punt,3665,"9/9/12, 13:03:46",2012-09-09T19:59:28Z,Caesars Superdome,"Sunny Temp: 78° F, Humidity: 64%, Wind: NE 12 mph",10012012-0909-0698-35ed-764bb4f40ad3,0,0,PASS,0,,,,17,Punt,2012-09-09T19:50:44Z,3.0,1:22,0.0,0.0,0.0,4.0,4.0,-10.0,KICKOFF,PUNT,10:59,09:37,NO 39,NO 23,3565.0,3687.0,40,32,Home,-8,72,9.5,50.0,0,dome,sportturf,,,Aaron Kromer,Mike Shanahan,NOR00,Mercedes-Benz Superdome,0,0.0,D.Brees,9.0,,,M.Colston,12.0,1,0,0.0,0,1,00-0020531,,00-0024466,D.Brees,9.0,00-0020531,M.Colston,00-0024466,M.Colston,00-0024466,0,1,-0.576863141730428,0.547077606824198,7.31485843949486,3.0,1.0,1.0,0.950228452682495,4.97715473175049,2012-09-09,J.Wilson,2012,REG,WAS,1,00-0025442,CB,Josh Wilson,Josh,Wilson,Abdomen,,Probable,Abdomen,,Full Participation in Practice,2012-09-07T11:15:43Z,2012-09-07 11:15:43
3653,2012_11_ARI_ATL,2012111802,ATL,ARI,REG,11,ATL,home,ARI,ARI,10.0,2012-11-18,434.0,434.0,434.0,Half2,0,26.0,0,4,3.0,0,07:14,ARI 10,5,70.0,(7:14) (Shotgun) 2-M.Ryan pass short right to 88-T.Gonzalez to ARI 1 for 9 yards (28-G.Toler). ARI-28-G.Toler was injured during the play. His return is Probable.,pass,9.0,1,0,1.0,0,0,0,short,right,6.0,3.0,,,,,,,3,2,0.0,,,,,3.0,2.0,16,19,16.0,19.0,-3.0,16.0,19.0,-3.0,0.0362807475030422,0.0171652138233185,0.0006707748980261,0.0267971530556679,0.494093269109726,0.0025302832946181,0.422462522983551,0.0,0.0,4.20416077214759,2.1199204607401,-0.697058043093421,0.697058043093421,-4.89920452979618,4.89920452979618,1.48210342643925,-1.48210342643925,1.43509436945897,0.684826091281138,1.43509436945897,0.684826091281138,6.59997418534476,-6.59997418534476,6.65669343176886,-6.65669343176886,17.5595828382648,-17.5595828382648,-23.8278290661759,23.8278290661759,0.575919687747955,0.424080312252045,0.575919687747955,0.424080312252045,0.0954023599624634,0.133199572563171,0.133199572563171,0.671322047710419,0.328677952289581,0.650324583053589,0.650324583053589,-0.135019451530078,0.135019451530078,0.056222919475065,-0.056222919475065,0.0,0.0954023599624634,0.0,0.0954023599624634,-0.0525998771190643,0.0525998771190643,0.348188251256943,-0.348188251256943,-0.0471773445606232,0.0471773445606232,-0.115259289741516,0.115259289741516,0.0,0.0,1.0,0.0,1.0,0.0,0.0,0.0,0.0,0,0.0,0.0,0.0,0.0,0.0,0.0,0.0,0.0,0.0,0.0,0.0,0.0,0.0,0.0,1.0,0.0,0.0,0.0,0.0,0.0,0.0,0.0,0.0,1.0,0.0,0.0,0.0,0.0,0.0,0.0,0.0,0.0,0.0,0.0,0.0,1.0,0.0,0.0,0.0,0.0,0.0,00-0026143,M.Ryan,9.0,00-0006101,T.Gonzalez,9.0,,,,,,,,,,,,,,,,,,,,,,,,,,,,,,,,,,,,,,,,,,,,,,ARI,,00-0026910,,G.Toler,,,,,,,,,,,,,,0.0,,,,,,,,,,,,,,,,,,,,,,,,,,,,,,,,0.0,,,,,0,,,0.0,0.0,0.0,0.0,,,2012,0.598452985286713,40.1547014713287,49,1,First down,3653,"11/18/12, 13:03:07",2012-11-18T20:53:42Z,Georgia Dome,"Temp: ° F, Wind: mph",10012012-1118-0278-0649-2e2a34a1b886,0,0,PASS,0,,,,26,Touchdown,2012-11-18T20:50:20Z,7.0,3:04,5.0,1.0,1.0,4.0,4.0,0.0,PUNT,TOUCHDOWN,09:44,06:40,ATL 30,ARI 1,3533.0,3700.0,19,23,Home,4,42,9.5,43.0,0,dome,fieldturf,,,Mike Smith,Ken Whisenhunt,ATL00,Georgia Dome,0,1.0,M.Ryan,2.0,,,T.Gonzalez,88.0,1,0,1.0,0,1,00-0026143,,00-0006101,M.Ryan,2.0,00-0026143,T.Gonzalez,00-0006101,T.Gonzalez,00-0006101,0,1,2.1199204607401,0.634483681539058,1.82881451334106,2.0,0.997164600645192,0.997164600645192,0.935691475868225,6.43085241317749,2012-11-18,G.Toler,2012,REG,ARI,11,00-0026910,CB,Gregory Toler,Gregory,Toler,Hamstring,,Questionable,Hamstring,,Limited Participation in Practice,2012-11-16T11:23:33Z,2012-11-16 11:23:33
3638,2012_15_PIT_DAL,2012121611,DAL,PIT,REG,15,DAL,home,PIT,PIT,3.0,2012-12-16,423.0,423.0,423.0,Half2,0,18.0,0,4,2.0,1,07:03,PIT 3,3,44.0,(7:03) (Shotgun) 9-T.Romo pass incomplete short left to 88-D.Bryant (23-K.Lewis). PIT-23-K.Lewis was injured during the play. Pass lofted to the front-left corner of the end zone.,pass,0.0,1,0,1.0,0,0,0,short,left,3.0,,,,,,,,3,3,0.0,,,,,3.0,3.0,17,24,17.0,24.0,-7.0,17.0,24.0,-7.0,0.0248671993613243,0.0113486051559448,0.0003367915051057,0.0137343145906925,0.218592345714569,0.0021283058449626,0.728992462158203,0.0,0.0,5.63212128332816,-0.941241106134839,-4.74930422057884,4.74930422057884,-6.19853652961319,6.19853652961319,1.80334866716956,-1.80334866716956,1.36787871667184,-2.30911982280668,0.0,0.0,-11.0008964196895,11.0008964196895,7.97508390096482,-7.97508390096482,-3.5901394864195,3.5901394864195,6.16680429713531,-6.16680429713531,0.391192972660065,0.608807027339935,0.391192972660065,0.608807027339935,-0.0299599468708038,-0.0372767150402069,-0.0372767150402069,0.361233025789261,0.638766974210739,0.340529829263687,0.340529829263687,-0.231329015578959,0.231329015578959,-0.0728435683256344,0.0728435683256344,0.0,-0.0299599468708038,0.0,0.0,-0.0676855617799738,0.0676855617799738,-0.14119125842726,0.14119125842726,-0.0676855617799738,0.0676855617799738,0.0011707401307843,-0.0011707401307843,0.0,0.0,0.0,0.0,0.0,0.0,0.0,0.0,1.0,0,0.0,0.0,0.0,0.0,0.0,0.0,0.0,0.0,0.0,0.0,0.0,0.0,0.0,0.0,0.0,0.0,0.0,0.0,0.0,0.0,0.0,0.0,0.0,1.0,0.0,0.0,0.0,0.0,0.0,0.0,0.0,0.0,0.0,0.0,0.0,0.0,0.0,0.0,0.0,0.0,0.0,00-0021678,T.Romo,,00-0027902,D.Bryant,,,,,,,,,,,,,,,,,,,,,,,,,,,,,,,,,,,,,,,,,,,,,,,,,,,,,,,,,,,,,,,,,0.0,,,,,,,00-0026903,K.Lewis,,,,,,,,,,,,,,,,,,,,,,,,0.0,,,,,0,,,0.0,0.0,0.0,0.0,,,2012,0.446781367063522,-44.6781367063522,51,1,Touchdown,3638,"12/16/12, 16:25:34",2012-12-17T00:09:19Z,AT&T Stadium,"Clear Skies Temp: 72° F, Humidity: 23%, Wind: North/Northeast 12 mph",10012012-1216-1163-d5ad-32aae3af1685,0,0,PASS,0,,,,18,Touchdown,2012-12-17T00:05:40Z,7.0,3:08,4.0,1.0,1.0,4.0,4.0,0.0,FUMBLE,TOUCHDOWN,10:03,06:55,PIT 44,PIT 3,3511.0,3686.0,24,27,Home,3,51,-1.0,45.5,0,closed,matrixturf,,,Jason Garrett,Mike Tomlin,DAL00,Cowboys Stadium,0,0.0,T.Romo,9.0,,,D.Bryant,88.0,1,0,0.0,0,1,00-0021678,,00-0027902,T.Romo,9.0,00-0021678,D.Bryant,00-0027902,D.Bryant,00-0027902,0,0,-0.941241106134839,,,,,,0.56427800655365,43.572199344635,2012-12-16,K.Lewis,2012,REG,PIT,15,00-0026903,CB,Keenan Lewis,Keenan,Lewis,Hip,,Probable,Hip,,Full Participation in Practice,2012-12-14T10:08:10Z,2012-12-14 10:08:10
3630,2012_10_DET_MIN,2012111107,MIN,DET,REG,10,MIN,home,DET,MIN,61.0,2012-11-11,497.0,497.0,497.0,Half2,0,22.0,1,4,1.0,0,08:17,MIN 39,15,75.0,"(8:17) 28-A.Peterson right end for 61 yards, TOUCHDOWN. DET-23-C.Houston was injured during the play. His return is Probable.",run,61.0,0,0,0.0,0,0,0,,,,,right,end,,,,,3,2,0.0,,MIN,A.Peterson,00-0025394,3.0,2.0,30,17,24.0,17.0,7.0,30.0,17.0,13.0,0.147943004965782,0.097897581756115,0.0021136230789125,0.152797102928162,0.227753832936287,0.004326572176069,0.367168307304382,0.0,0.0,1.89459308236837,5.10540691763163,11.8958985321749,-11.8958985321749,9.15882710348535,-9.15882710348535,-0.700205853208396,0.700205853208396,,,0.0,0.0,-6.76665180914555,6.76665180914555,0.399690311705828,-0.399690311705828,-4.80264540696502,4.80264540696502,4.32283719519726,-4.32283719519726,0.900369465351105,0.0996305346488953,0.900369465351105,0.0996305346488953,0.0698549133826734,0.0997114813082343,0.0997114813082343,0.970224378733778,0.0297756212662219,0.857772648334503,0.857772648334503,0.249708115639979,-0.249708115639979,0.140235594346161,-0.140235594346161,,,0.0,0.0,0.010308556544567,-0.010308556544567,-0.0561838685013354,0.0561838685013354,0.0092310833809622,-0.0092310833809622,0.0807061554454267,-0.0807061554454267,0.0,1.0,0.0,0.0,0.0,0.0,0.0,0.0,0.0,0,0.0,0.0,0.0,0.0,0.0,0.0,0.0,0.0,0.0,0.0,0.0,0.0,0.0,0.0,0.0,0.0,0.0,0.0,0.0,0.0,0.0,0.0,1.0,0.0,0.0,1.0,0.0,1.0,0.0,0.0,0.0,0.0,0.0,0.0,0.0,0.0,0.0,0.0,0.0,0.0,0.0,,,,,,,00-0025394,A.Peterson,61.0,,,,,,,,,,,,,,,,,,,,,,,,,,,,,,,,,,,,,,,,,,,,,,,,,,,,,,,,,,,,,0.0,,,,,,,,,,,,,,,,,,,,,,,,,,,,,,,,0.0,,,,,0,,,0.0,0.0,0.0,0.0,,,2012,,,49,1,Touchdown,3630,"11/11/12, 13:02:56",2012-11-11T20:37:35Z,Mall of America Field,"Temp: 64° F, Wind: mph",10012012-1111-073a-fe8e-60e72e2d14d2,0,0,RUSH,0,,,,22,Touchdown,2012-11-11T20:36:10Z,2.0,1:07,2.0,0.0,1.0,4.0,4.0,-5.0,PUNT,TOUCHDOWN,09:13,08:06,MIN 25,MIN 39,3585.0,3648.0,24,34,Home,10,58,-3.0,46.0,1,dome,sportturf,,,Leslie Frazier,Jim Schwartz,MIN00,Mall of America Field,0,1.0,,,A.Peterson,28.0,,,0,1,1.0,0,1,,00-0025394,,A.Peterson,28.0,00-0025394,A.Peterson,00-0025394,A.Peterson,00-0025394,0,0,5.10540691763163,,,,,,0.513059794902802,-51.3059794902802,2012-11-11,C.Houston,2012,REG,DET,10,00-0025428,CB,Chris Houston,Chris,Houston,Illness,,Probable,Illness,,Full Participation in Practice,2012-11-09T12:50:07Z,2012-11-09 12:50:07
3605,2012_07_ARI_MIN,2012102101,MIN,ARI,REG,7,MIN,home,ARI,MIN,54.0,2012-10-21,376.0,376.0,376.0,Half2,0,23.0,0,4,1.0,0,06:16,MIN 46,10,9.0,(6:16) 28-A.Peterson up the middle to MIN 49 for 3 yards (24-A.Wilson). ARI-51-P.Lenon was injured during the play. His return is Probable.,run,3.0,0,0,0.0,0,0,0,,,,,middle,,,,,,3,2,0.0,,,,,3.0,2.0,21,7,21.0,7.0,14.0,21.0,7.0,14.0,0.202059686183929,0.0715138465166092,0.0013482982758432,0.101021893322468,0.218097254633904,0.0043611330911517,0.401597887277603,0.0,0.0,2.54980785166845,-0.417707650922239,15.5322487007187,-15.5322487007187,2.92646975530079,-2.92646975530079,6.52799393034623,-6.52799393034623,,,0.0,0.0,1.34918323886814,-1.34918323886814,-11.0109165695612,11.0109165695612,-4.97298989922274,4.97298989922274,-0.159747872426277,0.159747872426277,0.995200991630554,0.0047990083694458,0.995200991630554,0.0047990083694458,-0.0026741027832031,-0.0002083778381347,-0.0002083778381347,0.992526888847351,0.0074731111526489,0.996708631515503,0.996708631515503,0.165125129935078,-0.165125129935078,0.0253673434905902,-0.0253673434905902,,,0.0,0.0,0.0324305891990662,-0.0324305891990662,-0.19106620971994,0.19106620971994,0.0352024510502815,-0.0352024510502815,-0.186283277655373,0.186283277655373,0.0,0.0,0.0,0.0,0.0,0.0,0.0,0.0,0.0,0,0.0,0.0,0.0,0.0,0.0,0.0,0.0,0.0,0.0,0.0,0.0,0.0,0.0,0.0,1.0,0.0,0.0,0.0,0.0,0.0,0.0,0.0,1.0,0.0,0.0,0.0,0.0,0.0,0.0,0.0,0.0,0.0,0.0,0.0,0.0,0.0,0.0,0.0,0.0,0.0,0.0,,,,,,,00-0025394,A.Peterson,3.0,,,,,,,,,,,,,,,,,,,,,,,,,,,,,,,,,,,,,,,,,,,ARI,,00-0020505,,A.Wilson,,,,,,,,,,,,,,0.0,,,,,,,,,,,,,,,,,,,,,,,,,,,,,,,,0.0,,,,,0,,,0.0,0.0,0.0,0.0,,,2012,,,47,0,Punt,3605,"10/21/12, 13:03:00",2012-10-21T19:40:32Z,Mall of America Field,"Temp: 64° F, Wind: mph",10012012-1021-016f-ff4a-0fa6d9cd0ac8,0,0,RUSH,0,,,,23,Punt,2012-10-21T19:40:32Z,3.0,2:20,0.0,0.0,0.0,4.0,4.0,0.0,DOWNS,PUNT,06:16,03:56,MIN 46,ARI 45,3605.0,3673.0,14,21,Home,7,35,7.0,38.5,0,dome,sportturf,,,Leslie Frazier,Ken Whisenhunt,MIN00,Mall of America Field,0,0.0,,,A.Peterson,28.0,,,0,1,0.0,0,1,,00-0025394,,A.Peterson,28.0,00-0025394,A.Peterson,00-0025394,A.Peterson,00-0025394,0,1,-0.417707650922239,,,,,,0.134537309408188,-13.4537309408188,2012-10-21,P.Lenon,2012,REG,ARI,7,00-0019104,LB,Paris Lenon,Paris,Lenon,Knee,,Probable,Knee,,Full Participation in Practice,2012-10-19T12:54:05Z,2012-10-19 12:54:05
3554,2012_18_IND_BAL,2013010600,BAL,IND,POST,18,IND,away,BAL,IND,59.0,2013-01-06,495.0,495.0,495.0,Half2,0,19.0,0,4,2.0,0,08:15,IND 41,5,62.0,"(8:15) (Shotgun) 33-V.Ballard left guard to IND 43 for 2 yards (59-D.Ellerbe, 29-C.Williams). BAL-59-D.Ellerbe was injured during the play.",run,2.0,1,0,0.0,0,0,0,,,,,left,guard,,,,,2,3,0.0,,,,,3.0,2.0,24,9,9.0,24.0,-15.0,9.0,24.0,-15.0,0.193131119012833,0.104208402335644,0.0022220218088477,0.151395305991173,0.219955429434776,0.0020801767241209,0.327007532119751,0.0,0.0,1.57624297402799,-0.262023290153593,12.6593629787806,-12.6593629787806,-4.97776497842278,4.97776497842278,15.8567158969091,-15.8567158969091,,,0.0,0.0,11.7350270910587,-11.7350270910587,-5.31480247671739,5.31480247671739,16.186494626459,-16.186494626459,-6.38225623129018,6.38225623129018,0.0347098857164383,0.965290114283562,0.965290114283562,0.0347098857164383,0.0050132013857364,0.001719357445836,-0.001719357445836,0.960276912897825,0.0397230871021748,0.0207889880985022,0.979211011901498,-0.184234096759503,0.184234096759503,0.615559329763725,-0.615559329763725,,,0.0,0.0,0.316804624976871,-0.316804624976871,-0.101686589749141,0.101686589749141,0.345288090290783,-0.345288090290783,0.0700932570234103,-0.0700932570234103,0.0,0.0,0.0,0.0,0.0,0.0,0.0,0.0,0.0,0,0.0,0.0,0.0,0.0,0.0,0.0,0.0,0.0,0.0,0.0,0.0,0.0,0.0,0.0,0.0,0.0,0.0,0.0,0.0,0.0,0.0,0.0,1.0,0.0,0.0,0.0,0.0,0.0,0.0,0.0,0.0,0.0,0.0,0.0,0.0,0.0,1.0,0.0,0.0,0.0,0.0,,,,,,,00-0029547,V.Ballard,2.0,,,,,,,,,,,,,,,,,,,,,,,,,,,,,,,,,,,,,,,,,,,,,,,,,00-0026369,C.Williams,BAL,,,,,,,,,,1.0,00-0026857,D.Ellerbe,BAL,,,,,,,,,,,,,,,,,,,,,,,,,,,,,0.0,,,,,0,,,0.0,0.0,0.0,0.0,,,2012,,,53,1,First down,3554,"12/31/69, 19:00:00",2013-01-06T20:47:32Z,M&T Bank Stadium,"Partly Cloudy Temp: 49° F, Humidity: 36%, Wind: WSW 8 mph",10012013-0106-0060-81a5-8a51820827bf,0,0,RUSH,0,,,,19,Turnover,,12.0,3:50,3.0,1.0,0.0,4.0,4.0,5.0,KICKOFF,INTERCEPTION,09:14,05:24,IND 20,BAL 18,3443.0,3759.0,9,24,Home,15,33,7.5,47.5,0,outdoors,sportturf,49.0,8.0,John Harbaugh,Chuck Pagano,BAL00,M&T Bank Stadium,0,0.0,,,V.Ballard,33.0,,,0,1,0.0,0,1,,00-0029547,,V.Ballard,33.0,00-0029547,V.Ballard,00-0029547,V.Ballard,00-0029547,0,0,-0.262023290153593,,,,,,0.841048538684845,-84.1048538684845,2013-01-06,D.Ellerbe,2012,WC,BAL,18,00-0026857,LB,Dannell Ellerbe,Dannell,Ellerbe,Ankle,,Probable,Ankle,,Full Participation in Practice,2013-01-04T14:00:29Z,2013-01-04 14:00:29
3551,2012_16_NO_DAL,2012122306,DAL,NO,REG,16,NO,away,DAL,NO,86.0,2012-12-23,826.0,826.0,826.0,Half2,0,17.0,0,4,2.0,0,13:46,NO 14,12,98.0,(13:46) 23-P.Thomas left tackle to NO 19 for 5 yards (98-B.Poppinga). NO-23-P.Thomas was injured during the play.,run,5.0,0,0,0.0,0,0,0,,,,,left,tackle,,,,,3,3,0.0,,,,,3.0,3.0,17,24,24.0,17.0,7.0,24.0,17.0,7.0,0.0473275594413281,0.213837653398514,0.0058393096551299,0.336922913789749,0.162186667323113,0.0027229322586208,0.231162950396538,0.0,0.0,-0.901505456771702,0.0634501036256552,-8.01983335535994,8.01983335535994,0.278568197883532,-0.278568197883532,-12.3809901709277,12.3809901709277,,,0.0,0.0,3.03511521487962,-3.03511521487962,-16.106204299198,16.106204299198,5.12201262440067,-5.12201262440067,-14.982561713255,14.982561713255,0.766433477401733,0.233566522598267,0.233566522598267,0.766433477401733,0.022079348564148,0.0123884677886963,-0.0123884677886963,0.211487174034119,0.788512825965881,0.773643016815186,0.226356983184814,-0.0679154456299455,0.0679154456299455,-0.345586343052446,0.345586343052446,,,0.0,0.0,0.031043529510498,-0.031043529510498,-0.466640724184572,0.466640724184572,0.031043529510498,-0.031043529510498,-0.318144364597856,0.318144364597856,0.0,0.0,0.0,0.0,0.0,0.0,0.0,0.0,0.0,0,0.0,0.0,0.0,0.0,0.0,0.0,0.0,0.0,0.0,0.0,0.0,0.0,0.0,0.0,1.0,0.0,0.0,0.0,0.0,0.0,0.0,0.0,1.0,0.0,0.0,0.0,0.0,0.0,0.0,0.0,0.0,0.0,0.0,0.0,0.0,0.0,0.0,0.0,0.0,0.0,0.0,,,,,,,00-0024813,P.Thomas,5.0,,,,,,,,,,,,,,,,,,,,,,,,,,,,,,,,,,,,,,,,,,,DAL,,00-0023559,,B.Poppinga,,,,,,,,,,,,,,0.0,,,,,,,,,,,,,,,,,,,,,,,,,,,,,,,,0.0,,,,,0,,,0.0,0.0,0.0,0.0,,,2012,,,46,1,First down,3551,"12/23/12, 13:03:19",2012-12-23T20:36:49Z,AT&T Stadium,"Clear Temp: 63° F, Humidity: 55%, Wind: Southwest 12 mph",10012012-1223-068f-fb3b-d7d161101f6f,0,0,RUSH,0,,,,17,Touchdown,2012-12-23T20:31:58Z,10.0,4:53,4.0,1.0,1.0,3.0,4.0,0.0,PUNT,TOUCHDOWN,01:03,11:10,NO 2,DAL 3,3444.0,3725.0,34,31,Home,-3,65,1.0,55.0,0,closed,matrixturf,,,Jason Garrett,Joe Vitt,DAL00,Cowboys Stadium,0,1.0,,,P.Thomas,23.0,,,0,1,0.0,0,1,,00-0024813,,P.Thomas,23.0,00-0024813,P.Thomas,00-0024813,P.Thomas,00-0024813,0,0,0.0634501036256552,,,,,,0.728579998016357,-72.8579998016357,2012-12-23,P.Thomas,2012,REG,NO,16,00-0024813,RB,Pierre Thomas,Pierre,Thomas,Knee,,Probable,Knee,,Limited Participation in Practice,2012-12-21T11:03:19Z,2012-12-21 11:03:19
3513,2012_16_IND_KC,2012122305,KC,IND,REG,16,IND,away,KC,IND,56.0,2012-12-23,553.0,553.0,553.0,Half2,0,21.0,0,4,1.0,0,09:13,IND 44,10,73.0,(9:13) 12-A.Luck pass short right to 11-D.Avery to IND 43 for -1 yards (24-B.Flowers). KC-24-B.Flowers was injured during the play.,pass,-1.0,0,0,1.0,0,0,0,short,right,-1.0,0.0,,,,,,,2,3,0.0,,,,,3.0,2.0,13,13,13.0,13.0,0.0,13.0,13.0,0.0,0.153623029589653,0.102865383028984,0.0021251856815069,0.14173124730587,0.235216990113258,0.0019021367188543,0.362535983324051,0.0,0.0,1.94224187545478,-0.645720429718494,-3.27644109877292,3.27644109877292,8.72071718409923,-8.72071718409923,-2.97515691889313,2.97515691889313,-0.645720429718494,0.0,-0.645720429718494,0.0,-0.10093746916391,0.10093746916391,1.76559752423782,-1.76559752423782,-12.9209749161382,12.9209749161382,8.64906210458074,-8.64906210458074,0.517930090427399,0.482069909572601,0.482069909572601,0.517930090427399,-0.0414194464683533,-0.0343070030212402,0.0343070030212402,0.523489356040955,0.476510643959045,0.652277171611786,0.347722828388214,0.284741286264332,-0.284741286264332,-0.0631732942922365,0.0631732942922365,-0.0414194464683533,0.0,-0.0414194464683533,0.0,0.119271159172058,-0.119271159172058,-0.102499306201935,0.102499306201935,0.114071249961853,-0.114071249961853,-0.230326563344742,0.230326563344742,0.0,0.0,0.0,0.0,0.0,0.0,0.0,0.0,0.0,0,0.0,0.0,0.0,0.0,0.0,0.0,0.0,0.0,0.0,0.0,0.0,0.0,0.0,0.0,1.0,0.0,0.0,0.0,0.0,0.0,0.0,0.0,0.0,1.0,0.0,0.0,0.0,0.0,0.0,0.0,0.0,0.0,0.0,0.0,0.0,1.0,0.0,0.0,0.0,0.0,0.0,00-0029668,A.Luck,-1.0,00-0026173,D.Avery,-1.0,,,,,,,,,,,,,,,,,,,,,,,,,,,,,,,,00-0026175,B.Flowers,,,,,,,,,,,,,KC,,00-0026175,,B.Flowers,,,,,,,,,,,,,,0.0,,,,,,,,,,,,,,,,,,,,,,,,,,,,,,,,0.0,,,,,0,,,0.0,0.0,0.0,0.0,,,2012,0.834277272224426,16.5722727775574,52,1,First down,3513,"12/23/12, 13:02:51",2012-12-23T20:42:45Z,GEHA Field at Arrowhead Stadium,"Sunny Temp: 25° F, Humidity: 74%, Wind: North 6-8 mph mph",10012012-1223-0567-2b4a-ae252c27fe66,0,0,PASS,0,,,,21,Touchdown,2012-12-23T20:40:59Z,13.0,6:05,6.0,1.0,1.0,4.0,4.0,5.0,DOWNS,TOUCHDOWN,10:13,04:08,IND 27,KC 7,3441.0,3805.0,20,13,Home,-7,33,-4.5,41.5,0,outdoors,grass,25.0,6.0,Romeo Crennel,Chuck Pagano,KAN00,Arrowhead Stadium,0,0.0,A.Luck,12.0,,,D.Avery,11.0,1,0,0.0,0,1,00-0029668,,00-0026173,A.Luck,12.0,00-0029668,D.Avery,00-0026173,D.Avery,00-0026173,0,0,-0.645720429718494,0.885642315351867,7.54305056332669,6.0,0.557174927496817,0.217952883744147,0.472569316625595,52.7430683374405,2012-12-23,B.Flowers,2012,REG,KC,16,00-0026175,CB,Brandon Flowers,Brandon,Flowers,Illness,,Probable,Illness,,Full Participation in Practice,2012-12-21T11:38:08Z,2012-12-21 11:38:08
3402,2012_12_HOU_DET,2012112200,DET,HOU,REG,12,DET,home,HOU,HOU,41.0,2012-11-22,685.0,685.0,685.0,Half2,0,20.0,0,4,1.0,0,11:25,HOU 41,10,10.0,(11:25) (Shotgun) 25-M.Leshoure left tackle to HOU 36 for 5 yards (53-B.James; 27-Q.Demps). HOU-53-B.James was injured during the play. He is Out.,run,5.0,1,0,0.0,0,0,0,,,,,left,tackle,,,,,2,3,0.0,,,,,2.0,3.0,31,24,31.0,24.0,7.0,31.0,24.0,7.0,0.0628921389579773,0.0614253431558609,0.0010102903470397,0.0988745242357254,0.316893607378006,0.0057808402925729,0.453123301267624,0.0,0.0,3.25568733178079,0.0864393913652748,7.89758748630121,-7.89758748630121,-4.58347113587661,4.58347113587661,12.258231739993,-12.258231739993,,,0.0,0.0,12.422834814759,-12.422834814759,6.22132433620116,-6.22132433620116,27.6547731466708,-27.6547731466708,-16.0452641011078,16.0452641011078,0.895480692386627,0.104519307613373,0.895480692386627,0.104519307613373,0.0057749152183532,0.003570020198822,0.003570020198822,0.90125560760498,0.0987443923950195,0.845628559589386,0.845628559589386,-0.0565119026867758,0.0565119026867758,0.418270876134291,-0.418270876134291,,,0.0,0.0,0.328303908346985,-0.328303908346985,0.208083242263358,-0.208083242263358,0.328303908346985,-0.328303908346985,0.0471462757249288,-0.0471462757249288,0.0,0.0,0.0,0.0,0.0,0.0,0.0,0.0,0.0,0,0.0,0.0,0.0,0.0,0.0,0.0,0.0,0.0,0.0,0.0,0.0,0.0,0.0,0.0,0.0,0.0,0.0,0.0,0.0,0.0,0.0,0.0,1.0,0.0,0.0,0.0,0.0,0.0,0.0,0.0,0.0,0.0,0.0,0.0,0.0,0.0,1.0,0.0,0.0,0.0,0.0,,,,,,,00-0027995,M.Leshoure,5.0,,,,,,,,,,,,,,,,,,,,,,,,,,,,,,,,,,,,,,,,,,,,,,,,,00-0022137,B.James,HOU,00-0026257,Q.Demps,HOU,,,,,,,0.0,,,,,,,,,,,,,,,,,,,,,,,,,,,,,,,,0.0,,,,,0,,,0.0,0.0,0.0,0.0,,,2012,,,47,0,Punt,3402,"11/22/12, 12:39:01",2012-11-22T20:22:37Z,Ford Field,"Controlled Climate Temp: 60° F, Humidity: 70%, Wind: mph",10012012-1122-002f-6e7e-8d701bc31ebe,0,0,RUSH,0,,,,20,Punt,2012-11-22T20:21:58Z,4.0,1:57,1.0,0.0,0.0,4.0,4.0,0.0,PUNT,PUNT,12:03,10:06,DET 46,HOU 44,3378.0,3469.0,34,31,Home,-3,65,-3.5,48.5,0,dome,fieldturf,,,Jim Schwartz,Gary Kubiak,DET00,Ford Field,0,1.0,,,M.Leshoure,25.0,,,0,1,0.0,0,1,,00-0027995,,M.Leshoure,25.0,00-0027995,M.Leshoure,00-0027995,M.Leshoure,00-0027995,0,1,0.0864393913652748,,,,,,0.367462396621704,-36.7462396621704,2012-11-22,B.James,2012,REG,HOU,12,00-0022137,LB,Bradie James,Bradie,James,Thumb,,Probable,Thumb,,Full Participation in Practice,2012-11-21T07:00:04Z,2012-11-21 07:00:04
3380,2012_09_MIA_IND,2012110407,IND,MIA,REG,9,MIA,away,IND,MIA,65.0,2012-11-04,103.0,1003.0,1003.0,Half2,0,15.0,0,3,1.0,0,01:43,MIA 35,10,52.0,(1:43) (Run formation) 33-D.Thomas left end to MIA 38 for 3 yards (53-K.Conner). MIA-51-M.Pouncey was injured during the play.,run,3.0,0,0,0.0,0,0,0,,,,,left,end,,,,,2,3,0.0,,,,,3.0,2.0,20,17,17.0,20.0,-3.0,17.0,20.0,-3.0,0.0311333723366261,0.137280106544495,0.0029276690911501,0.221026048064232,0.249931156635284,0.0020710164681077,0.355630606412888,0.0,0.0,1.27847175346687,-0.148875715676695,0.175556018686621,-0.175556018686621,-5.69100637472002,5.69100637472002,14.1326620802714,-14.1326620802714,,,0.0,0.0,17.0800189122965,-17.0800189122965,1.28686159651622,-1.28686159651622,30.9511808464013,-30.9511808464013,-16.4289235565089,16.4289235565089,0.375454932451248,0.624545067548752,0.624545067548752,0.375454932451248,-0.0087368190288543,-0.0008491575717926,0.0008491575717926,0.633281886577606,0.366718113422394,0.477916210889816,0.522083789110184,-0.197613634627638,0.197613634627638,0.419950878012226,-0.419950878012226,,,0.0,0.0,0.266282224591249,-0.266282224591249,0.419304084233812,-0.419304084233812,0.247559451992983,-0.247559451992983,0.262822341374926,-0.262822341374926,0.0,0.0,0.0,0.0,0.0,0.0,0.0,0.0,0.0,0,0.0,0.0,0.0,0.0,0.0,0.0,0.0,0.0,0.0,0.0,0.0,0.0,0.0,0.0,1.0,0.0,0.0,0.0,0.0,0.0,0.0,0.0,1.0,0.0,0.0,0.0,0.0,0.0,0.0,0.0,0.0,0.0,0.0,0.0,0.0,0.0,0.0,0.0,0.0,0.0,0.0,,,,,,,00-0028000,D.Thomas,3.0,,,,,,,,,,,,,,,,,,,,,,,,,,,,,,,,,,,,,,,,,,,IND,,00-0027831,,K.Conner,,,,,,,,,,,,,,0.0,,,,,,,,,,,,,,,,,,,,,,,,,,,,,,,,0.0,,,,,0,,,0.0,0.0,0.0,0.0,,,2012,,,47,1,First down,3380,"11/4/12, 13:02:34",2012-11-04T20:28:45Z,Lucas Oil Stadium,"Partly Cloudy Temp: 44° F, Humidity: 64%, Wind: N 9 mph",10012012-1104-0774-af70-21fb5f59718a,0,0,RUSH,0,,,,15,Field goal,2012-11-04T20:27:37Z,10.0,3:37,3.0,1.0,1.0,3.0,4.0,0.0,KICKOFF,FIELD_GOAL,01:49,13:12,MIA 35,IND 13,3347.0,3602.0,20,23,Home,3,43,-2.5,44.0,0,closed,fieldturf,,,Chuck Pagano,Joe Philbin,IND00,Lucas Oil Stadium,0,0.0,,,D.Thomas,33.0,,,0,1,0.0,0,1,,00-0028000,,D.Thomas,33.0,00-0028000,D.Thomas,00-0028000,D.Thomas,00-0028000,0,1,-0.148875715676695,,,,,,0.513703286647797,-51.3703286647797,2012-11-04,M.Pouncey,2012,REG,MIA,9,00-0027953,C,Mike Pouncey,Mike,Pouncey,Achilles,,Probable,Achilles,,Limited Participation in Practice,2012-11-02T10:49:06Z,2012-11-02 10:49:06
3373,2012_03_TB_DAL,2012092300,DAL,TB,REG,3,DAL,home,TB,TB,14.0,2012-09-23,754.0,754.0,754.0,Half2,0,18.0,0,4,2.0,0,12:34,TB 14,12,72.0,(12:34) (Shotgun) 9-T.Romo sacked at TB 21 for -7 yards (93-G.McCoy). TB-94-A.Clayborn was injured during the play. His return is Probable.,pass,-7.0,1,0,1.0,0,0,0,,,,,,,,,,,3,3,0.0,,,,,3.0,3.0,10,7,10.0,7.0,3.0,10.0,7.0,3.0,0.0131928939372301,0.0180772114545107,0.0005099086556583,0.025638634338975,0.516124606132507,0.0014756139134988,0.42498117685318,0.0,0.0,4.29147139214911,-1.20198588632047,5.42549207247794,-5.42549207247794,-4.46864087902941,4.46864087902941,8.15421125678836,-8.15421125678836,,,0.0,0.0,4.58632018376375,-4.58632018376375,10.8997081432608,-10.8997081432608,26.6150027295225,-26.6150027295225,-7.61387019299877,7.61387019299877,0.805824816226959,0.194175183773041,0.805824816226959,0.194175183773041,-0.0273700952529907,-0.0232522487640381,-0.0232522487640381,0.778454720973969,0.221545279026032,0.842635273933411,0.842635273933411,-0.149084751822237,0.149084751822237,0.0973301884909183,-0.0973301884909183,,,0.0,0.0,-0.0817508342484921,0.0817508342484921,0.478115409612656,-0.478115409612656,-0.70238747622771,0.70238747622771,1.2126307785511,-1.2126307785511,0.0,0.0,0.0,0.0,0.0,0.0,0.0,0.0,0.0,0,0.0,0.0,0.0,0.0,0.0,0.0,0.0,0.0,0.0,0.0,0.0,0.0,0.0,0.0,1.0,0.0,0.0,0.0,0.0,0.0,0.0,1.0,0.0,1.0,1.0,0.0,0.0,0.0,0.0,0.0,0.0,0.0,0.0,0.0,0.0,0.0,0.0,0.0,0.0,0.0,0.0,00-0021678,T.Romo,,,,,,,,,,,,,,,,,,,,,,,,,,,,,,,,,,,,00-0027856,G.McCoy,,,00-0027856,G.McCoy,,,,,,,,,TB,,00-0027856,,G.McCoy,,,,,,,,,,,,,,0.0,,,,,,,,,,,,,,,,,,,,,,,,,00-0027856,G.McCoy,,,,,,0.0,,,,,0,,,0.0,0.0,0.0,0.0,,,2012,,,38,0,Field goal,3373,"9/23/12, 13:05:12",2012-09-23T19:40:16Z,AT&T Stadium,"85 d; 35 h; Temp: ° F, Wind: mph",10012012-0923-00d3-2329-8617bcab6dba,0,0,SACK,0,,,,18,Field goal,2012-09-23T19:32:22Z,9.0,5:26,2.0,1.0,1.0,3.0,4.0,-15.0,PUNT,FIELD_GOAL,01:36,11:10,DAL 20,TB 8,3138.0,3419.0,10,16,Home,6,26,7.0,45.5,0,closed,matrixturf,,,Jason Garrett,Greg Schiano,DAL00,Cowboys Stadium,0,0.0,T.Romo,9.0,,,,,1,0,0.0,0,1,00-0021678,,,T.Romo,9.0,00-0021678,,,,,0,1,-1.20198588632047,,,,,,0.813040196895599,18.6959803104401,2012-09-23,A.Clayborn,2012,REG,TB,3,00-0027958,DE,Adrian Clayborn,Adrian,Clayborn,Not Injury Related,,Probable,Not Injury Related,,Full Participation in Practice,2012-09-21T12:08:53Z,2012-09-21 12:08:53
3344,2012_14_DET_GB,2012120913,GB,DET,REG,14,GB,home,DET,GB,63.0,2012-12-09,424.0,424.0,424.0,Half2,0,17.0,0,4,2.0,0,07:04,GB 37,10,40.0,(7:04) 26-D.Harris right end to GB 36 for -1 yards (55-S.Tulloch; 52-J.Durant). DET-21-J.Lacey was injured during the play.,run,-1.0,0,0,0.0,0,0,0,,,,,right,end,,,,,2,3,0.0,,,,,2.0,3.0,24,17,24.0,17.0,7.0,24.0,17.0,7.0,0.257389158010483,0.0938194319605827,0.0013066586107015,0.157045289874077,0.198736935853958,0.0053297788836062,0.286372750997543,0.0,0.0,1.2280909800902,-1.00506574916653,5.17470028915409,-5.17470028915409,4.44036293699173,-4.44036293699173,-4.47275054782381,4.47275054782381,,,0.0,0.0,-0.848101505311206,0.848101505311206,-11.8732420644956,11.8732420644956,-12.1401934658061,12.1401934658061,4.85014231617515,-4.85014231617515,0.891746640205383,0.108253359794617,0.891746640205383,0.108253359794617,-0.0152084827423096,-0.0113554000854492,-0.0113554000854492,0.876538157463074,0.123461842536926,0.912644743919373,0.912644743919373,0.240852073352144,-0.240852073352144,-0.181254039603155,0.181254039603155,,,0.0,0.0,-0.0092093348503112,0.0092093348503112,-0.400920659303665,0.400920659303665,-0.0189590454101563,0.0189590454101563,-0.216065876185894,0.216065876185894,0.0,0.0,0.0,0.0,0.0,0.0,0.0,0.0,0.0,0,0.0,0.0,0.0,0.0,0.0,0.0,0.0,0.0,0.0,0.0,0.0,0.0,0.0,0.0,0.0,0.0,0.0,1.0,0.0,0.0,0.0,0.0,1.0,0.0,0.0,0.0,0.0,0.0,0.0,0.0,0.0,0.0,0.0,0.0,0.0,0.0,1.0,0.0,0.0,0.0,0.0,,,,,,,00-0028409,D.Harris,-1.0,,,,,,,,,,,,,,,,,,,,,,,,,,,,,,,,,,,,,,,,,,,,,,,,,00-0024331,S.Tulloch,DET,00-0025435,J.Durant,DET,,,,,,,0.0,,,,,,,,,,,,,,,,,,,,,,,,,,,,,,,,0.0,,,,,0,,,0.0,0.0,0.0,0.0,,,2012,,,47,1,First down,3344,"12/9/12, 20:30:48",2012-12-10T04:04:47Z,Lambeau Field,"Snow Temp: 33° F, Humidity: 92%, Wind: East 10 mph",10012012-1209-135f-2d3d-db10b87fa42e,0,0,RUSH,0,,,,17,Field goal,2012-12-10T04:01:43Z,7.0,3:09,1.0,0.0,1.0,4.0,4.0,0.0,PUNT,FIELD_GOAL,07:11,04:02,GB 37,DET 23,3303.0,3473.0,20,27,Home,7,47,6.0,49.5,1,outdoors,grass,33.0,10.0,Mike McCarthy,Jim Schwartz,GNB00,Lambeau Field,0,0.0,,,D.Harris,26.0,,,0,1,0.0,0,1,,00-0028409,,D.Harris,26.0,00-0028409,D.Harris,00-0028409,D.Harris,00-0028409,0,0,-1.00506574916653,,,,,,0.478917717933655,-47.8917717933655,2012-12-09,J.Lacey,2012,REG,DET,14,00-0026674,CB,Jacob Lacey,Jacob,Lacey,Foot,Achilles,Questionable,Foot,Achilles,Limited Participation in Practice,2012-12-07T13:07:11Z,2012-12-07 13:07:11
3314,2012_03_NYJ_MIA,2012092306,MIA,NYJ,REG,3,MIA,home,NYJ,MIA,55.0,2012-09-23,722.0,722.0,722.0,Half2,0,16.0,0,4,1.0,0,12:02,MIA 45,10,50.0,"(12:02) 17-R.Tannehill pass incomplete deep right to 82-B.Hartline. NYJ-31-A.Cromartie was injured during the play. His return is Probable. PENALTY on NYJ-31-A.Cromartie, Defensive Pass Interference, 24 yards, enforced at MIA 45 - No Play. Penalty on NYJ-94-M.Dixon, Defensive Offside, declined.",no_play,0.0,0,0,0.0,0,0,0,,,,,,,,,,,3,2,0.0,,,,,3.0,2.0,17,13,17.0,13.0,4.0,17.0,13.0,4.0,0.0892610028386116,0.098079651594162,0.0014029085868969,0.13604673743248,0.26281949877739,0.0036461388226598,0.408744037151337,0.0,0.0,2.40758710005321,1.37914297403768,5.73758685833741,-5.73758685833741,1.41892030426471,-1.41892030426471,7.25003492246489,-7.25003492246489,,,0.0,0.0,2.13594814809039,-2.13594814809039,-4.42897842405364,4.42897842405364,-9.40328428609064,9.40328428609064,12.9735060677269,-12.9735060677269,0.798420011997223,0.201579988002777,0.798420011997223,0.201579988002777,0.0320881009101868,0.0525898337364197,0.0525898337364197,0.83050811290741,0.16949188709259,0.714417338371277,0.714417338371277,0.0586623942079358,-0.0586623942079358,0.280294086289283,-0.280294086289283,,,0.0,0.0,0.115501940250397,-0.115501940250397,-0.0963099300861359,0.0963099300861359,0.115501940250397,-0.115501940250397,0.071246858191367,-0.071246858191367,0.0,0.0,0.0,1.0,0.0,0.0,0.0,0.0,0.0,0,0.0,0.0,0.0,0.0,0.0,0.0,0.0,0.0,0.0,0.0,0.0,0.0,0.0,0.0,0.0,0.0,1.0,0.0,0.0,0.0,0.0,0.0,0.0,0.0,0.0,0.0,0.0,0.0,0.0,0.0,0.0,0.0,0.0,0.0,0.0,0.0,0.0,0.0,0.0,0.0,0.0,,,,,,,,,,,,,,,,,,,,,,,,,,,,,,,,,,,,,,,,,,,,,,,,,,,,,,,,,,,,,,,,,,,,,,0.0,,,,,,,,,,,,,,,,,,,,,,,,,,,,,,,,0.0,NYJ,00-0024234,A.Cromartie,24.0,0,,Defensive Pass Interference,0.0,0.0,0.0,0.0,,,2012,,,44,1,First down,3314,"9/23/12, 13:03:34",2012-09-23T19:43:05Z,Hard Rock Stadium,"Mostly Cloudy Temp: 83° F, Humidity: 76%, Wind: NNW 4 mph",10012012-0923-0619-1f54-b4c6641efa03,0,0,PENALTY,0,,,,16,Missed field goal,2012-09-23T19:40:38Z,7.0,2:48,2.0,0.0,0.0,4.0,4.0,9.0,KICKOFF,MISSED_FG,13:29,10:41,MIA 21,NYJ 29,3216.0,3483.0,23,20,Home,-3,43,-2.5,40.5,1,outdoors,grass,83.0,4.0,Joe Philbin,Rex Ryan,MIA00,Sun Life Stadium,0,1.0,R.Tannehill,17.0,,,B.Hartline,82.0,1,0,1.0,0,1,00-0029701,,00-0027077,R.Tannehill,17.0,00-0029701,,,B.Hartline,00-0027077,0,0,1.37914297403768,,,,,,0.378677219152451,62.1322780847549,2012-09-23,A.Cromartie,2012,REG,NYJ,3,00-0024234,CB,Antonio Cromartie,Antonio,Cromartie,Shoulder,,Probable,Shoulder,,Full Participation in Practice,2012-09-21T11:51:07Z,2012-09-21 11:51:07
3308,2012_12_BUF_IND,2012112502,IND,BUF,REG,12,BUF,away,IND,IND,15.0,2012-11-25,813.0,813.0,813.0,Half2,0,17.0,0,4,1.0,0,13:33,IND 15,10,78.0,(13:33) (Run formation) 28-C.Spiller right end to IND 13 for 2 yards (50-J.Freeman). BUF-38-C.McIntyre was injured during the play. He is Out.,run,2.0,0,0,0.0,0,0,0,,,,,right,end,,,,,3,3,0.0,,,,,3.0,3.0,20,6,6.0,20.0,-14.0,6.0,20.0,-14.0,0.0115029662847519,0.0194920431822538,0.0004632381605915,0.0308020357042551,0.360705852508545,0.0008996650576591,0.576134145259857,0.0,0.0,4.84183904866222,-0.351543412311003,8.19770091836847,-8.19770091836847,-0.26486564567848,0.26486564567848,2.99908986455615,-2.99908986455615,,,0.0,0.0,7.67695981834443,-7.67695981834443,0.415336228936212,-0.415336228936212,11.6403320334783,-11.6403320334783,-7.50969298575927,7.50969298575927,0.12099426984787,0.87900573015213,0.87900573015213,0.12099426984787,-0.0087134689092636,-0.0089551210403442,0.0089551210403442,0.887719199061394,0.112280800938606,0.108983188867569,0.891016811132431,0.0758265033364296,-0.0758265033364296,0.181813081573676,-0.181813081573676,,,0.0,0.0,0.110374526899289,-0.110374526899289,0.120499946177006,-0.120499946177006,0.106158034723233,-0.106158034723233,0.0376385487616062,-0.0376385487616062,0.0,0.0,0.0,0.0,0.0,0.0,0.0,0.0,0.0,0,0.0,0.0,0.0,0.0,0.0,0.0,0.0,0.0,0.0,0.0,0.0,0.0,0.0,0.0,1.0,0.0,0.0,0.0,0.0,0.0,0.0,0.0,1.0,0.0,0.0,0.0,0.0,0.0,0.0,0.0,0.0,0.0,0.0,0.0,0.0,0.0,0.0,0.0,0.0,0.0,0.0,,,,,,,00-0027861,C.Spiller,2.0,,,,,,,,,,,,,,,,,,,,,,,,,,,,,,,,,,,,,,,,,,,IND,,00-0025920,,J.Freeman,,,,,,,,,,,,,,0.0,,,,,,,,,,,,,,,,,,,,,,,,,,,,,,,,0.0,,,,,0,,,0.0,0.0,0.0,0.0,,,2012,,,46,1,First down,3308,"11/25/12, 13:03:44",2012-11-25T20:34:24Z,Lucas Oil Stadium,"Partly cloudy Temp: 45° F, Humidity: 51%, Wind: SW 10 mph",10012012-1125-027b-b687-944441c01f8d,0,0,RUSH,0,,,,17,Touchdown,2012-11-25T20:29:04Z,8.0,4:36,4.0,1.0,1.0,3.0,4.0,0.0,PUNT,TOUCHDOWN,01:06,11:30,BUF 22,IND 1,3195.0,3406.0,13,20,Home,7,33,2.0,51.0,0,closed,fieldturf,,,Chuck Pagano,Chan Gailey,IND00,Lucas Oil Stadium,0,0.0,,,C.Spiller,28.0,,,0,1,0.0,0,1,,00-0027861,,C.Spiller,28.0,00-0027861,C.Spiller,00-0027861,C.Spiller,00-0027861,0,1,-0.351543412311003,,,,,,0.576374769210815,-57.6374769210815,2012-11-25,C.McIntyre,2012,REG,BUF,12,00-0020804,RB,Corey McIntyre,Corey,McIntyre,Knee,,Questionable,Knee,,Limited Participation in Practice,2012-11-23T09:22:53Z,2012-11-23 09:22:53
3304,2012_10_IND_JAX,2012110800,JAX,IND,REG,10,JAX,home,IND,IND,44.0,2012-11-08,810.0,810.0,810.0,Half2,0,19.0,0,4,1.0,0,13:30,IND 44,10,81.0,(13:30) (Shotgun) 11-B.Gabbert sacked at IND 45 for -1 yards (41-A.Bethea). JAX-11-B.Gabbert was injured during the play. His return is Probable.,pass,-1.0,1,0,1.0,0,0,0,,,,,,,,,,,3,3,0.0,,,,,3.0,3.0,3,24,3.0,24.0,-21.0,3.0,24.0,-21.0,0.0556465052068234,0.0789399221539497,0.0011546327732503,0.112768486142159,0.309700042009354,0.0036615030840039,0.438128858804703,0.0,0.0,2.97481670882553,-0.721414560684934,-21.8046536292952,21.8046536292952,-9.69318296154961,9.69318296154961,-8.48585282314006,8.48585282314006,,,0.0,0.0,0.343041623476893,-0.343041623476893,-4.86160334790475,4.86160334790475,6.50326917963685,-6.50326917963685,-16.5181484993335,16.5181484993335,0.0186043195426464,0.981395680457354,0.0186043195426464,0.981395680457354,-0.0031106695532798,-0.0019324580207467,-0.0019324580207467,0.0154936499893665,0.984506350010633,0.012834626249969,0.012834626249969,-0.215289137494077,0.215289137494077,-0.0447398628153063,0.0447398628153063,,,0.0,0.0,-0.0408631563186646,0.0408631563186646,0.100797335617244,-0.100797335617244,-0.0428341627120972,0.0428341627120972,-0.0103835350878693,0.0103835350878693,0.0,0.0,0.0,0.0,0.0,0.0,0.0,0.0,0.0,0,0.0,0.0,0.0,0.0,0.0,0.0,0.0,0.0,0.0,0.0,0.0,0.0,0.0,0.0,1.0,0.0,0.0,0.0,0.0,0.0,0.0,1.0,0.0,1.0,1.0,0.0,0.0,0.0,0.0,0.0,0.0,0.0,0.0,0.0,0.0,0.0,0.0,0.0,0.0,0.0,0.0,00-0027948,B.Gabbert,,,,,,,,,,,,,,,,,,,,,,,,,,,,,,,,,,,,00-0024421,A.Bethea,,,00-0024421,A.Bethea,,,,,,,,,IND,,00-0024421,,A.Bethea,,,,,,,,,,,,,,0.0,,,,,,,,,,,,,,,,,,,,,,,,,00-0024421,A.Bethea,,,,,,0.0,,,,,0,,,0.0,0.0,0.0,0.0,,,2012,,,51,1,First down,3304,"11/8/12, 20:30:09",2012-11-09T03:55:54Z,EverBank Stadium,"0% Chance of Rain Temp: 50° F, Wind: 0 mph",10012012-1108-00b0-d6e0-2f79b6d33a6c,0,0,SACK,0,,,,19,Touchdown,2012-11-09T03:53:00Z,14.0,5:36,7.0,1.0,1.0,4.0,4.0,20.0,FUMBLE,TOUCHDOWN,14:52,09:16,JAX 19,IND 4,3199.0,3667.0,27,10,Home,-17,37,-3.0,43.5,1,outdoors,grass,50.0,0.0,Mike Mularkey,Chuck Pagano,JAX00,EverBank Field,0,0.0,B.Gabbert,11.0,,,,,1,0,0.0,0,1,00-0027948,,,B.Gabbert,11.0,00-0027948,,,,,0,0,-0.721414560684934,,,,,,0.782827138900757,21.7172861099243,2012-11-08,B.Gabbert,2012,REG,JAX,10,00-0027948,QB,Blaine Gabbert,Blaine,Gabbert,left Shoulder,,Probable,left Shoulder,,Full Participation in Practice,2012-11-07T11:02:28Z,2012-11-07 11:02:28
3281,2012_04_TEN_HOU,2012093001,HOU,TEN,REG,4,TEN,away,HOU,TEN,80.0,2012-09-30,338.0,338.0,338.0,Half2,0,22.0,0,4,1.0,0,05:38,TEN 20,10,38.0,(5:38) (Shotgun) 8-M.Hasselbeck pass short left to 13-K.Wright to TEN 40 for 20 yards (92-E.Mitchell). HOU-31-S.Keo was injured during the play.,pass,20.0,1,0,1.0,0,0,0,short,left,-2.0,22.0,,,,,,,3,2,0.0,,,,,2.0,3.0,31,7,7.0,31.0,-24.0,7.0,31.0,-24.0,0.290097415447235,0.117017701268196,0.0021471437066793,0.188210889697075,0.153087273240089,0.0020259749144315,0.247413620352745,0.0,0.0,0.522385492920876,1.17382240202278,22.7560257037223,-22.7560257037223,-3.85641588752583,3.85641588752583,23.8466711802175,-23.8466711802175,-0.916878405492753,2.09070080751553,-0.916878405492753,2.09070080751553,-3.14872238071985,3.14872238071985,4.66370122958324,-4.66370122958324,-2.13600561241037,2.13600561241037,14.9220652997901,-14.9220652997901,0.0004012090212199,0.99959879097878,0.99959879097878,0.0004012090212199,-2.07198900170624e-06,1.46026068250649e-05,-1.46026068250649e-05,0.999600862967782,0.0003991370322182,7.23096236470155e-05,0.999927690376353,-0.0485575085384753,0.0485575085384753,0.390352237811393,-0.390352237811393,0.0,-2.07198900170624e-06,0.0,-2.07198900170624e-06,-0.0039901733398437,0.0039901733398437,0.0591832512268461,-0.0591832512268461,-0.0039901733398437,0.0039901733398437,0.265381801831617,-0.265381801831617,0.0,0.0,1.0,0.0,0.0,0.0,0.0,0.0,0.0,0,0.0,0.0,0.0,0.0,0.0,0.0,0.0,0.0,0.0,0.0,0.0,0.0,0.0,0.0,1.0,0.0,0.0,0.0,0.0,0.0,0.0,0.0,0.0,1.0,0.0,0.0,0.0,0.0,0.0,0.0,0.0,0.0,0.0,0.0,0.0,1.0,0.0,0.0,0.0,0.0,0.0,00-0007091,M.Hasselbeck,20.0,00-0029708,K.Wright,20.0,,,,,,,,,,,,,,,,,,,,,,,,,,,,,,,,,,,,,,,,,,,,,,HOU,,00-0027684,,E.Mitchell,,,,,,,,,,,,,,0.0,,,,,,,,,,,,,,,,,,,,,,,,,,,,,,,,0.0,,,,,0,,,0.0,0.0,0.0,0.0,,,2012,0.854671776294708,14.5328223705292,44,1,First down,3281,"9/30/12, 13:02:49",2012-09-30T19:39:51Z,NRG Stadium,"Cloudy Temp: 71° F, Humidity: 91%, Wind: NNW 15 mph",10012012-0930-01cb-4324-857259d3d53e,0,0,PASS,0,,,,22,Opp touchdown,2012-09-30T19:39:03Z,5.0,1:41,2.0,0.0,1.0,4.0,4.0,0.0,KICKOFF,INTERCEPTION,05:38,03:57,TEN 20,HOU 42,3263.0,3375.0,14,38,Home,24,52,13.0,44.5,1,closed,grass,,,Gary Kubiak,Mike Munchak,HOU00,Reliant Stadium,0,1.0,M.Hasselbeck,8.0,,,K.Wright,13.0,1,0,1.0,0,1,00-0007091,,00-0029708,M.Hasselbeck,8.0,00-0007091,K.Wright,00-0029708,K.Wright,00-0029708,0,1,1.17382240202278,1.03459276360184,8.54802552438923,7.0,0.47671524353791,0.214722215314396,0.699702143669128,30.0297856330872,2012-09-30,S.Keo,2012,REG,HOU,4,00-0028082,S,Shiloh Keo,Shiloh,Keo,Thumb,,Probable,Thumb,,Full Participation in Practice,2012-09-28T11:33:59Z,2012-09-28 11:33:59
3256,2012_18_SEA_WAS,2013010601,WAS,SEA,POST,18,WAS,home,SEA,WAS,88.0,2013-01-06,385.0,385.0,385.0,Half2,0,16.0,0,4,2.0,0,06:25,WAS 12,22,-19.0,"(6:25) (Shotgun) 10-R.Griffin FUMBLES (Aborted) at WAS 5, RECOVERED by SEA-69-C.McDonald at WAS 5. 69-C.McDonald to WAS 5 for no gain (67-J.LeRibeus). WAS-10-R.Griffin was injured during the play. His return is Doubtful. RGIII knee",run,0.0,1,0,0.0,0,0,0,,,,,,,,,,,3,3,0.0,,,,,3.0,3.0,14,21,14.0,21.0,-7.0,14.0,21.0,-7.0,0.259474903345108,0.187116757035255,0.0096573196351528,0.253113090991974,0.11516660451889,0.0019815044943243,0.173489809036255,0.0,0.0,-0.788565061520785,-4.70802901673596,-14.7234601847989,14.7234601847989,-11.1566174949403,11.1566174949403,-3.28798993196808,3.28798993196808,,,0.0,0.0,5.01051240065135,-5.01051240065135,-10.5965676641836,10.5965676641836,0.19135165901389,-0.19135165901389,-9.76255387631063,9.76255387631063,0.146146818995476,0.853853181004524,0.146146818995476,0.853853181004524,-0.0914559215307236,-0.0721743181347847,-0.0721743181347847,0.0546908974647522,0.945309102535248,0.106579013168812,0.106579013168812,-0.235797997549176,0.235797997549176,-0.279490101669594,0.279490101669594,,,0.0,0.0,0.0557266160489426,-0.0557266160489426,-0.467253630889947,0.467253630889947,0.0523049518109665,-0.0523049518109665,-0.488749688400323,0.488749688400323,0.0,0.0,0.0,0.0,0.0,0.0,0.0,0.0,0.0,0,0.0,0.0,0.0,0.0,0.0,0.0,0.0,0.0,0.0,0.0,0.0,0.0,1.0,0.0,1.0,0.0,0.0,0.0,1.0,0.0,0.0,0.0,1.0,0.0,0.0,0.0,0.0,0.0,0.0,0.0,0.0,0.0,0.0,0.0,1.0,0.0,0.0,0.0,0.0,0.0,1.0,,,,,,,00-0029665,R.Griffin,0.0,,,,,,,,,,,,,,,,,,,,,,,,,,,,,,,,,,,,,,,,,,,WAS,,00-0029666,,J.LeRibeus,,,,,,,,,,,,,,0.0,,,,,,,,,,,WAS,00-0029665,R.Griffin,,,,SEA,0.0,00-0026964,C.McDonald,,,,,,,,,,,,0.0,,,,,0,,,0.0,0.0,0.0,0.0,,,2012,,,46,0,Turnover,3256,"1/6/13, 16:40:51",2013-01-07T00:06:55Z,Commanders Field,"Cloudy Temp: 52° F, Humidity: 44%, Wind: SW 3 mph",10012013-0106-0188-dfcb-b0424ede0b61,0,0,RUSH,0,,,,16,Turnover,2013-01-07T00:05:18Z,2.0,0:49,0.0,0.0,0.0,4.0,4.0,0.0,KICKOFF,FUMBLE,07:08,06:19,WAS 24,WAS 12,3215.0,3256.0,24,14,Home,-10,38,-3.0,44.5,0,outdoors,grass,52.0,3.0,Mike Shanahan,Pete Carroll,WAS00,FedExField,1,0.0,,,R.Griffin,10.0,,,0,1,0.0,0,1,,00-0029665,,R.Griffin,10.0,00-0029665,R.Griffin,00-0029665,R.Griffin,00-0029665,0,1,-4.70802901673596,,,,,,0.849398612976074,-84.9398612976074,2013-01-06,R.Griffin,2012,WC,WAS,18,00-0029665,QB,Robert Griffin,Robert,Griffin,Knee,,Probable,Knee,,Full Participation in Practice,2013-01-04T12:24:48Z,2013-01-04 12:24:48
3201,2012_16_TEN_GB,2012122300,GB,TEN,REG,16,TEN,away,GB,TEN,84.0,2012-12-23,772.0,772.0,772.0,Half2,0,21.0,0,4,4.0,0,12:52,TEN 16,17,-7.0,"(12:52) 6-B.Kern punts 49 yards to GB 35, Center-48-B.Brinkley. 10-J.Ross pushed ob at TEN 7 for 58 yards (59-T.Shaw). TEN-92-W.Witherspoon was injured during the play. GB-31-D.House was injured during the play. His return is Questionable.",punt,0.0,0,0,0.0,0,0,0,,,,,,,,49.0,,,3,3,0.0,,,,,3.0,3.0,41,0,0.0,41.0,-41.0,0.0,41.0,-41.0,0.0824238955974579,0.280248820781708,0.0066446424461901,0.401703149080277,0.0897511020302773,0.0026233221869915,0.136605098843575,0.0,0.0,-2.4352221484296,-2.91867237078259,47.2523925948988,-47.2523925948988,5.84060294966912,-5.84060294966912,35.5813276683859,-35.5813276683859,,,0.0,0.0,0.22422183281742,-0.22422183281742,20.7328277432243,-20.7328277432243,15.5029835682944,-15.5029835682944,13.649648002751,-13.649648002751,9.50905596255325e-05,0.999904909440374,0.999904909440374,9.50905596255325e-05,5.16445288667455e-06,-9.53206381382188e-07,9.53206381382188e-07,0.999899744987488,0.0001002550125122,6.55604299026891e-06,0.99999344395701,0.148746910936459,-0.148746910936459,0.266570126426891,-0.266570126426891,,,0.0,0.0,0.0407915756150807,-0.0407915756150807,0.0991607965115691,-0.0991607965115691,0.0863469176038827,-0.0863469176038827,0.13883596604137,-0.13883596604137,0.0,0.0,0.0,0.0,0.0,0.0,0.0,0.0,0.0,0,0.0,0.0,0.0,0.0,0.0,0.0,0.0,0.0,0.0,0.0,0.0,0.0,0.0,0.0,1.0,0.0,0.0,0.0,0.0,0.0,0.0,0.0,0.0,0.0,0.0,0.0,0.0,0.0,0.0,0.0,0.0,0.0,0.0,1.0,0.0,0.0,0.0,0.0,0.0,0.0,0.0,,,,,,,,,,,,,,,,,,,,,,00-0028249,J.Ross,,,,,,,00-0025825,B.Kern,,,,,,,,,,,,,,,,,,,,,TEN,,00-0025551,,T.Shaw,,,,,,,,,,,,,,0.0,,,,,,,,,,,,,,,,,,,,,,,,,,,,,,,GB,58.0,,,,,0,,,0.0,0.0,0.0,0.0,,,2012,,,47,0,Punt,3201,"12/23/12, 13:02:29",2012-12-23T20:28:52Z,Lambeau Field,"Mostly Sunny Temp: 24° F, Humidity: 68%, Wind: Northwest 9 mph",10012012-1223-006f-a763-a49d8584c195,0,0,PUNT,1,,,,21,Punt,2012-12-23T20:26:09Z,3.0,1:36,0.0,0.0,0.0,4.0,4.0,0.0,KICKOFF,PUNT,14:11,12:35,TEN 23,TEN 16,3117.0,3201.0,7,55,Home,48,62,10.5,44.0,0,outdoors,grass,24.0,9.0,Mike McCarthy,Mike Munchak,GNB00,Lambeau Field,0,0.0,,,,,,,0,0,0.0,1,0,,,,,,,,,,,1,0,-2.91867237078259,,,,,,,,2012-12-23,W.Witherspoon,2012,REG,TEN,16,00-0021085,LB,Will Witherspoon,Will,Witherspoon,Hamstring,,Probable,Hamstring,,Full Participation in Practice,2012-12-21T11:15:21Z,2012-12-21 11:15:21
3128,2012_21_BAL_SF,2013020300,SF,BAL,POST,21,BAL,away,SF,SF,26.0,2013-02-03,16.0,916.0,916.0,Half2,0,20.0,0,3,3.0,0,00:16,SF 26,1,71.0,(:16) 30-B.Pierce left end pushed ob at SF 18 for 8 yards (38-D.Goldson). BAL-30-B.Pierce was injured during the play.,run,8.0,0,0,0.0,0,0,0,,,,,left,end,,,,,2,3,0.0,,,,,3.0,2.0,23,28,28.0,23.0,5.0,28.0,23.0,5.0,0.0129205845296383,0.0513697192072868,0.0010644589783623,0.0746687948703766,0.420509725809097,0.0009583837236277,0.438508361577988,0.0,0.0,3.65408483624924,1.01536226843018,-9.68385255009054,9.68385255009054,-1.02506918861764,1.02506918861764,-2.53637135473499,2.53637135473499,,,0.0,0.0,3.91594652563799,-3.91594652563799,-4.14333304087631,4.14333304087631,0.153609013184905,-0.153609013184905,-2.54394448653329,2.54394448653329,0.824977576732636,0.175022423267365,0.175022423267365,0.824977576732636,0.0149697661399841,0.0138636231422424,-0.0138636231422424,0.16005265712738,0.83994734287262,0.77001017332077,0.22998982667923,-0.264843389279043,0.264843389279043,-0.157028697491033,0.157028697491033,,,0.0,0.0,0.0250429889459403,-0.0250429889459403,-0.0479097857080325,0.0479097857080325,0.0243387004632742,-0.0243387004632742,-0.113914272462569,0.113914272462569,0.0,1.0,0.0,0.0,1.0,0.0,0.0,0.0,0.0,0,0.0,0.0,0.0,0.0,0.0,0.0,0.0,0.0,0.0,0.0,0.0,0.0,0.0,0.0,1.0,0.0,0.0,0.0,0.0,0.0,0.0,0.0,1.0,0.0,0.0,0.0,0.0,0.0,0.0,0.0,0.0,0.0,0.0,0.0,0.0,0.0,0.0,0.0,0.0,0.0,0.0,,,,,,,00-0029264,B.Pierce,8.0,,,,,,,,,,,,,,,,,,,,,,,,,,,,,,,,,,,,,,,,,,,SF,,00-0025513,,D.Goldson,,,,,,,,,,,,,,0.0,,,,,,,,,,,,,,,,,,,,,,,,,,,,,,,,0.0,,,,,0,,,0.0,0.0,0.0,0.0,,,2012,,,46,1,First down,3128,"2/3/13, 18:31:52",2013-02-04T02:49:46Z,Caesars Superdome,"Partly Cloudy Temp: 71° F, Humidity: 37%, Wind: WNW 6 mph",10012013-0203-00bb-9d76-3f7dbeaf2a5e,0,0,RUSH,0,,,,20,Field goal,2013-02-04T02:45:49Z,12.0,5:16,3.0,1.0,1.0,3.0,4.0,0.0,KICKOFF,FIELD_GOAL,03:10,12:54,BAL 28,SF 1,2987.0,3282.0,34,31,Neutral,-3,65,4.5,47.5,0,dome,astroturf,,,Jim Harbaugh,John Harbaugh,NOR00,Mercedes-Benz Superdome,0,1.0,,,B.Pierce,30.0,,,0,1,1.0,0,1,,00-0029264,,B.Pierce,30.0,00-0029264,B.Pierce,00-0029264,B.Pierce,00-0029264,1,1,1.01536226843018,,,,,,0.207478135824204,-20.7478135824204,2013-02-03,B.Pierce,2012,SB,BAL,21,00-0029264,RB,Bernard Pierce,Bernard,Pierce,Knee,Thigh,Probable,Knee,Thigh,Full Participation in Practice,2013-02-01T13:05:19Z,2013-02-01 13:05:19
2963,2012_04_MIN_DET,2012093003,DET,MIN,REG,4,DET,home,MIN,DET,53.0,2012-09-30,722.0,722.0,722.0,Half2,0,18.0,0,4,1.0,0,12:02,DET 47,10,47.0,"(12:02) (No Huddle, Shotgun) 9-M.Stafford pass incomplete short left to 81-C.Johnson. DET-81-C.Johnson was injured during the play. His return is Probable. PENALTY on MIN-52-C.Greenway, Unnecessary Roughness, 15 yards, enforced at DET 47.",pass,0.0,1,1,1.0,0,0,0,short,left,14.0,,,,,,,,3,3,0.0,,,,,3.0,3.0,6,20,6.0,20.0,-14.0,6.0,20.0,-14.0,0.0623029805719852,0.0884458348155022,0.0014461316168308,0.133450001478195,0.28165128827095,0.0047764778137207,0.427927225828171,0.0,0.0,2.64761762320995,0.861027280800045,-15.0358704178187,15.0358704178187,-13.9321233851369,13.9321233851369,11.6049208557017,-11.6049208557017,0.760691698407754,0.10033558239229,0.0,0.0,9.26818441606813,-9.26818441606813,4.28220917453291,-4.28220917453291,26.3563086462229,-26.3563086462229,-14.3789562001531,14.3789562001531,0.0658409744501114,0.934159025549889,0.0658409744501114,0.934159025549889,0.0254800394177437,0.0191211923956871,0.0191211923956871,0.0913210138678551,0.908678986132145,0.0841575413942337,0.0841575413942337,-0.287010975182056,0.287010975182056,0.158825367689133,-0.158825367689133,0.0,0.0254800394177437,0.0,0.0,0.0866837650537491,-0.0866837650537491,0.141678526997566,-0.141678526997566,0.0866837650537491,-0.0866837650537491,0.0762232393026352,-0.0762232393026352,0.0,0.0,0.0,1.0,0.0,0.0,0.0,0.0,1.0,0,0.0,0.0,0.0,0.0,0.0,0.0,0.0,0.0,0.0,0.0,0.0,0.0,0.0,0.0,0.0,0.0,1.0,0.0,0.0,0.0,0.0,0.0,0.0,1.0,0.0,0.0,0.0,0.0,0.0,0.0,0.0,0.0,0.0,0.0,0.0,0.0,0.0,0.0,0.0,0.0,0.0,00-0026498,M.Stafford,,00-0025389,C.Johnson,,,,,,,,,,,,,,,,,,,,,,,,,,,,,,,,,,,,,,,,,,,,,,,,,,,,,,,,,,,,,,,,,0.0,,,,,,,,,,,,,,,,,,,,,,,,,,,,,,,,0.0,MIN,00-0024232,C.Greenway,15.0,0,,Unnecessary Roughness,0.0,0.0,0.0,0.0,,,2012,0.602037250995636,-60.2037250995636,44,1,First down,2963,"9/30/12, 13:03:27",2012-09-30T19:21:35Z,Ford Field,"Controlled Climate Temp: 68° F, Humidity: 70%, Wind: mph",10012012-0930-03f5-71d6-87b20f335c24,0,0,PASS,0,,,,18,Turnover on downs,2012-09-30T19:19:19Z,10.0,3:27,4.0,1.0,0.0,4.0,4.0,15.0,MISSED_FG,DOWNS,13:15,09:48,DET 36,MIN 7,2886.0,3111.0,20,13,Home,-7,33,3.5,48.0,1,dome,fieldturf,,,Jim Schwartz,Leslie Frazier,DET00,Ford Field,0,1.0,M.Stafford,9.0,,,C.Johnson,81.0,1,0,1.0,0,1,00-0026498,,00-0025389,M.Stafford,9.0,00-0026498,C.Johnson,00-0025389,C.Johnson,00-0025389,0,0,0.861027280800045,0.222549330367417,3.19893081652117,1.0,1.0,0.999026247649454,0.766066253185272,23.3933746814728,2012-09-30,C.Johnson,2012,REG,DET,4,00-0025389,WR,Calvin Johnson,Calvin,Johnson,Ankle,,Probable,Ankle,,Full Participation in Practice,2012-09-28T13:03:36Z,2012-09-28 13:03:36
2956,2012_03_BUF_CLE,2012092307,CLE,BUF,REG,3,CLE,home,BUF,BUF,35.0,2012-09-23,216.0,1116.0,1116.0,Half2,0,16.0,0,3,2.0,0,03:36,BUF 35,10,80.0,(3:36) (Shotgun) 3-B.Weeden pass short right to 13-J.Gordon to BUF 27 for 8 yards (31-J.Byrd). BUF-31-J.Byrd was injured during the play. His return is Questionable.,pass,8.0,1,0,1.0,0,0,0,short,right,5.0,3.0,,,,,,,3,3,0.0,,,,,3.0,3.0,7,17,7.0,17.0,-10.0,7.0,17.0,-10.0,0.0169291943311691,0.0605913586914539,0.0009604853694327,0.10399229824543,0.385467767715454,0.0026787333190441,0.429380178451538,0.0,0.0,3.25578088441398,0.341548509546556,-9.14629050915096,9.14629050915096,-4.44892793660983,4.44892793660983,-4.85498139223135,4.85498139223135,-0.14721233129967,0.488760840846226,-0.14721233129967,0.488760840846226,-6.8191942385165,6.8191942385165,-0.90162202558713,0.90162202558713,0.542554510117043,-0.542554510117043,-7.53411582207125,7.53411582207125,0.230855420231819,0.769144579768181,0.230855420231819,0.769144579768181,0.012884795665741,0.0025984048843383,0.0025984048843383,0.24374021589756,0.75625978410244,0.175455585122108,0.175455585122108,-0.204451580017869,0.204451580017869,-0.281760292160388,0.281760292160388,0.0,0.012884795665741,0.0,0.012884795665741,-0.119788020849228,0.119788020849228,-0.115064384448405,0.115064384448405,-0.135487273335457,0.135487273335457,-0.168047862160083,0.168047862160083,0.0,0.0,0.0,0.0,0.0,0.0,0.0,0.0,0.0,0,0.0,0.0,0.0,0.0,0.0,0.0,0.0,0.0,0.0,0.0,0.0,0.0,0.0,0.0,1.0,0.0,0.0,0.0,0.0,0.0,0.0,0.0,0.0,1.0,0.0,0.0,0.0,0.0,0.0,0.0,0.0,0.0,0.0,0.0,0.0,1.0,0.0,0.0,0.0,0.0,0.0,00-0029677,B.Weeden,8.0,00-0029664,J.Gordon,8.0,,,,,,,,,,,,,,,,,,,,,,,,,,,,,,,,,,,,,,,,,,,,,,BUF,,00-0027018,,J.Byrd,,,,,,,,,,,,,,0.0,,,,,,,,,,,,,,,,,,,,,,,,,,,,,,,,0.0,,,,,0,,,0.0,0.0,0.0,0.0,,,2012,0.725850522518158,27.4149477481842,38,1,First down,2956,"9/23/12, 13:02:58",2012-09-23T19:15:29Z,Cleveland Browns Stadium,"Rain Temp: 53° F, Humidity: 79%, Wind: sw 9 mph",10012012-0923-0760-bd8d-8d8822d68b52,0,0,PASS,0,,,,16,Touchdown,2012-09-23T19:10:53Z,13.0,4:38,5.0,0.0,1.0,3.0,3.0,0.0,PUNT,TOUCHDOWN,07:05,02:27,CLE 20,BUF 22,2771.0,3088.0,24,14,Home,-10,38,-2.5,45.0,0,outdoors,grass,53.0,9.0,Pat Shurmur,Chan Gailey,CLE00,Cleveland Browns Stadium,0,1.0,B.Weeden,3.0,,,J.Gordon,13.0,1,0,0.0,0,1,00-0029677,,00-0029664,B.Weeden,3.0,00-0029677,J.Gordon,00-0029664,J.Gordon,00-0029664,0,1,0.341548509546556,0.613235516450833,3.85336801881203,2.0,0.72978700773092,0.267204821866471,0.626681327819824,37.3318672180176,2012-09-23,J.Byrd,2012,REG,BUF,3,00-0027018,S,Jairus Byrd,Jairus,Byrd,Ankle,,Questionable,Ankle,,Limited Participation in Practice,2012-09-21T09:25:45Z,2012-09-21 09:25:45
2913,2012_09_DEN_CIN,2012110404,CIN,DEN,REG,9,DEN,away,CIN,DEN,99.0,2012-11-04,76.0,976.0,976.0,Half2,0,16.0,0,3,1.0,0,01:16,DEN 1,10,2.0,(1:16) 23-W.McGahee left guard to DEN 3 for 2 yards (96-C.Dunlap). DEN-73-C.Kuper was injured during the play. He is Out.,run,2.0,0,0,0.0,0,0,0,,,,,left,guard,,,,,3,3,0.0,,,,,3.0,3.0,13,17,17.0,13.0,4.0,17.0,13.0,4.0,0.0479462072253227,0.206742122769356,0.0833474695682526,0.323634624481201,0.143661350011826,0.0012593771098181,0.193408831954002,0.0,0.0,-1.26499905087985,-0.162181077059358,-5.0103858279806,5.0103858279806,2.92605189123786,-2.92605189123786,-5.90742425853198,5.90742425853198,,,0.0,0.0,-1.69362173572881,1.69362173572881,-2.16376524540829,2.16376524540829,-8.7280380189768,8.7280380189768,7.81782634154661,-7.81782634154661,0.644246637821198,0.355753362178803,0.355753362178803,0.644246637821198,-0.0250265002250671,0.0155162811279297,-0.0155162811279297,0.38077986240387,0.61922013759613,0.728141129016876,0.271858870983124,-0.0270365253090858,0.0270365253090858,-0.290678100423239,0.290678100423239,,,0.0,0.0,0.113225087866539,-0.113225087866539,-0.268028320850509,0.268028320850509,0.100830927834267,-0.100830927834267,-0.204213040055411,0.204213040055411,0.0,0.0,0.0,0.0,0.0,0.0,0.0,0.0,0.0,0,0.0,0.0,0.0,0.0,0.0,0.0,0.0,0.0,0.0,0.0,0.0,0.0,0.0,0.0,1.0,0.0,0.0,0.0,0.0,0.0,0.0,0.0,1.0,0.0,0.0,0.0,0.0,0.0,0.0,0.0,0.0,0.0,0.0,0.0,0.0,0.0,0.0,0.0,0.0,0.0,0.0,,,,,,,00-0022178,W.McGahee,2.0,,,,,,,,,,,,,,,,,,,,,,,,,,,,,,,,,,,,,,,,,,,CIN,,00-0027662,,C.Dunlap,,,,,,,,,,,,,,0.0,,,,,,,,,,,,,,,,,,,,,,,,,,,,,,,,0.0,,,,,0,,,0.0,0.0,0.0,0.0,,,2012,,,42,0,Turnover,2913,"11/4/12, 13:02:26",2012-11-04T20:09:53Z,Paycor Stadium,"Partly Cloudy Temp: 48° F, Humidity: 59%, Wind: N 1 mph",10012012-1104-04b5-fa08-3e6d0d9fae38,0,0,RUSH,0,,,,16,Turnover,2012-11-04T20:07:12Z,3.0,1:16,0.0,0.0,0.0,3.0,3.0,0.0,KICKOFF,INTERCEPTION,01:17,00:01,DEN 1,DEN 3,2891.0,2970.0,31,23,Home,-8,54,-5.0,47.5,0,outdoors,fieldturf,48.0,1.0,Marvin Lewis,John Fox,CIN00,Paul Brown Stadium,0,0.0,,,W.McGahee,23.0,,,0,1,0.0,0,1,,00-0022178,,W.McGahee,23.0,00-0022178,W.McGahee,00-0022178,W.McGahee,00-0022178,0,1,-0.162181077059358,,,,,,0.285998195409775,-28.5998195409775,2012-11-04,C.Kuper,2012,REG,DEN,9,00-0024375,G,Chris Kuper,Chris,Kuper,Forearm,,Probable,Forearm,,Full Participation in Practice,2012-11-02T11:20:34Z,2012-11-02 11:20:34
2886,2012_17_CLE_PIT,2012123003,PIT,CLE,REG,17,CLE,away,PIT,PIT,45.0,2012-12-30,711.0,711.0,711.0,Half2,0,17.0,0,4,1.0,0,11:51,PIT 45,10,5.0,(11:51) 20-M.Hardesty up the middle to PIT 42 for 3 yards (43-T.Polamalu). CLE-77-J.Greco was injured during the play.,run,3.0,0,0,0.0,0,0,0,,,,,middle,,,,,,3,3,0.0,,,,,3.0,3.0,17,10,10.0,17.0,-7.0,10.0,17.0,-7.0,0.0771764442324638,0.0824234187602997,0.0012385457521304,0.132799029350281,0.30963721871376,0.0033264586236327,0.393398880958557,0.0,0.0,2.51001618686132,-0.24478956614621,3.41296322877019,-3.41296322877019,-7.01924960260884,7.01924960260884,4.31645591457087,-4.31645591457087,,,0.0,0.0,0.339438913739286,-0.339438913739286,-1.92905001307372,1.92905001307372,-0.21391283639241,0.21391283639241,4.39443037568367,-4.39443037568367,0.214789554476738,0.785210445523262,0.785210445523262,0.214789554476738,-0.0155300945043564,-0.0039249956607818,0.0039249956607818,0.800740540027618,0.199259459972382,0.130307003855705,0.869692996144295,-0.0979163646697998,0.0979163646697998,0.123961831174583,-0.123961831174583,,,0.0,0.0,0.235871809250306,-0.235871809250306,-0.28439367560933,0.28439367560933,0.235871809250306,-0.235871809250306,-0.119928680344323,0.119928680344323,0.0,0.0,0.0,0.0,0.0,0.0,0.0,0.0,0.0,0,0.0,0.0,0.0,0.0,0.0,0.0,0.0,0.0,0.0,0.0,0.0,0.0,0.0,0.0,1.0,0.0,0.0,0.0,0.0,0.0,0.0,0.0,1.0,0.0,0.0,0.0,0.0,0.0,0.0,0.0,0.0,0.0,0.0,0.0,0.0,0.0,0.0,0.0,0.0,0.0,0.0,,,,,,,00-0027666,M.Hardesty,3.0,,,,,,,,,,,,,,,,,,,,,,,,,,,,,,,,,,,,,,,,,,,PIT,,00-0022119,,T.Polamalu,,,,,,,,,,,,,,0.0,,,,,,,,,,,,,,,,,,,,,,,,,,,,,,,,0.0,,,,,0,,,0.0,0.0,0.0,0.0,,,2012,,,43,0,Punt,2886,"12/30/12, 13:02:54",2012-12-30T20:21:56Z,Acrisure Stadium,"Cloudy Temp: 28° F, Humidity: 78%, Wind: From WSW 12 mph",10012012-1230-0335-2b91-607e49d2f412,0,0,RUSH,0,,,,17,Punt,2012-12-30T20:21:56Z,3.0,2:04,0.0,0.0,0.0,4.0,4.0,0.0,PUNT,PUNT,11:51,09:47,PIT 45,PIT 40,2886.0,2955.0,10,24,Home,14,34,10.0,36.5,1,outdoors,grass,28.0,12.0,Mike Tomlin,Pat Shurmur,PIT00,Heinz Field,0,0.0,,,M.Hardesty,20.0,,,0,1,0.0,0,1,,00-0027666,,M.Hardesty,20.0,00-0027666,M.Hardesty,00-0027666,M.Hardesty,00-0027666,0,1,-0.24478956614621,,,,,,0.564429223537445,-56.4429223537445,2012-12-30,J.Greco,2012,REG,CLE,17,00-0026205,C,John Greco,John,Greco,Thumb,,Probable,Thumb,,Full Participation in Practice,2012-12-28T13:04:18Z,2012-12-28 13:04:18
2798,2012_11_PHI_WAS,2012111800,WAS,PHI,REG,11,PHI,away,WAS,WAS,35.0,2012-11-18,290.0,1190.0,1190.0,Half2,0,16.0,0,3,,0,04:50,WAS 35,0,1.0,2-K.Forbath kicks 53 yards from WAS 35 to PHI 12. 14-R.Cooper to PHI 26 for 14 yards (11-A.Robinson). PHI-14-R.Cooper was injured during the play.,kickoff,0.0,0,0,0.0,0,0,0,,,,,,,,53.0,,,2,3,0.0,,,,,3.0,2.0,24,6,6.0,24.0,-18.0,6.0,24.0,-18.0,0.0300724972039461,0.180512323975563,0.0105155389755964,0.268599539995194,0.202685743570328,0.001631139894016,0.305983185768127,0.0,0.0,0.310436981031671,0.392825294751674,15.7761942673371,-15.7761942673371,5.22815835938673,-5.22815835938673,11.3424761797418,-11.3424761797418,,,0.0,0.0,6.49353454710217,-6.49353454710217,-9.50593616697006,9.50593616697006,-4.5775204487727,4.5775204487727,14.7477923153805,-14.7477923153805,0.0311927273869514,0.968807272613049,0.968807272613049,0.0311927273869514,0.0027842298150062,0.0016274601221084,-0.0016274601221084,0.966023042798042,0.0339769572019577,0.0295975636690855,0.970402436330914,0.156899899244308,-0.156899899244308,0.253333463446814,-0.253333463446814,,,0.0,0.0,0.0903337775694655,-0.0903337775694655,-0.209997896081422,0.209997896081422,0.0903337775694655,-0.0903337775694655,0.122638944560077,-0.122638944560077,0.0,0.0,0.0,0.0,0.0,0.0,0.0,0.0,0.0,0,0.0,0.0,0.0,0.0,0.0,0.0,0.0,0.0,0.0,0.0,0.0,0.0,0.0,0.0,1.0,0.0,0.0,0.0,0.0,0.0,0.0,0.0,0.0,0.0,0.0,0.0,0.0,0.0,0.0,0.0,0.0,0.0,1.0,0.0,0.0,0.0,0.0,0.0,0.0,0.0,0.0,,,,,,,,,,,,,,,,,,,,,,,,,,R.Cooper,00-0027758,,,,,K.Forbath,00-0028787,,,,,,,,,,,,,,,,,,,WAS,,00-0028116,,A.Robinson,,,,,,,,,,,,,,0.0,,,,,,,,,,,,,,,,,,,,,,,,,,,,,,,PHI,14.0,,,,,0,,,0.0,0.0,0.0,0.0,,,2012,,,30,0,Punt,2798,"11/18/12, 13:03:12",,Commanders Field,"Cloudy Temp: 52° F, Humidity: 55%, Wind: ENE 9 mph",10012012-1118-0014-0123-78584b7296d0,0,0,KICK_OFF,1,,,,16,Punt,,3.0,1:27,0.0,0.0,0.0,3.0,3.0,0.0,KICKOFF,PUNT,04:50,03:23,PHI 26,PHI 27,2798.0,2886.0,6,31,Home,25,37,3.5,46.0,1,outdoors,grass,52.0,9.0,Mike Shanahan,Andy Reid,WAS00,FedExField,0,1.0,,,,,,,0,0,0.0,1,0,,,,,,,,,,,0,0,0.392825294751674,,,,,,,,2012-11-18,R.Cooper,2012,REG,PHI,11,00-0027758,WR,Riley Cooper,Riley,Cooper,Knee,,Probable,Knee,,Full Participation in Practice,2012-11-16T11:17:20Z,2012-11-16 11:17:20
2749,2012_21_BAL_SF,2013020300,SF,BAL,POST,21,SF,home,BAL,BAL,6.0,2013-02-03,305.0,1205.0,1205.0,Half2,0,17.0,1,3,1.0,1,05:05,BAL 6,6,20.0,"(5:05) (Shotgun) 21-F.Gore right end for 6 yards, TOUCHDOWN. BAL-92-H.Ngata was injured during the play. His return is Doubtful.",run,6.0,1,0,0.0,0,0,0,,,,,right,end,,,,,2,3,0.0,,SF,F.Gore,00-0023500,2.0,3.0,19,28,13.0,28.0,-15.0,19.0,28.0,-9.0,0.002701764460653,0.0131595656275749,0.0007579651428386,0.0208520330488682,0.251623928546906,0.0016527922125533,0.709251940250397,0.0,0.0,5.53598209330812,1.46401790669188,-9.10501233963008,9.10501233963008,-0.632490131363738,0.632490131363738,-2.17738162891427,2.17738162891427,,,0.0,0.0,0.262095251469873,-0.262095251469873,-1.4864773057634,1.4864773057634,-7.24554548831657,7.24554548831657,5.2141997407889,-5.2141997407889,0.143911704421043,0.856088295578957,0.143911704421043,0.856088295578957,0.0331442552815922,0.0348792380050611,0.0348792380050611,0.177055959702636,0.822944040297364,0.223123326897621,0.223123326897621,-0.231654479986822,0.231654479986822,-0.126987226367338,0.126987226367338,,,0.0,0.0,-0.0925125399332254,0.0925125399332254,0.0397533283628598,-0.0397533283628598,-0.0932168284158914,0.0932168284158914,0.0336827275402919,-0.0336827275402919,0.0,1.0,0.0,0.0,0.0,0.0,0.0,0.0,0.0,0,0.0,0.0,0.0,0.0,0.0,0.0,0.0,0.0,0.0,0.0,0.0,0.0,0.0,0.0,0.0,0.0,0.0,0.0,0.0,0.0,0.0,0.0,1.0,0.0,0.0,1.0,0.0,1.0,0.0,0.0,0.0,0.0,0.0,0.0,0.0,0.0,0.0,0.0,0.0,0.0,0.0,,,,,,,00-0023500,F.Gore,6.0,,,,,,,,,,,,,,,,,,,,,,,,,,,,,,,,,,,,,,,,,,,,,,,,,,,,,,,,,,,,,0.0,,,,,,,,,,,,,,,,,,,,,,,,,,,,,,,,0.0,,,,,0,,,0.0,0.0,0.0,0.0,,,2012,,,42,1,Touchdown,2749,"2/3/13, 18:31:52",2013-02-04T02:32:38Z,Caesars Superdome,"Partly Cloudy Temp: 71° F, Humidity: 37%, Wind: WNW 6 mph",10012013-0203-00bb-9d76-3f7dbeaf2a5e,0,0,RUSH,0,,,,17,Touchdown,2013-02-04T02:31:45Z,2.0,0:48,2.0,1.0,1.0,3.0,3.0,0.0,PUNT,TOUCHDOWN,05:47,04:59,BAL 20,BAL 6,2725.0,2772.0,34,31,Neutral,-3,65,4.5,47.5,0,dome,astroturf,,,Jim Harbaugh,John Harbaugh,NOR00,Mercedes-Benz Superdome,0,1.0,,,F.Gore,21.0,,,0,1,1.0,0,1,,00-0023500,,F.Gore,21.0,00-0023500,F.Gore,00-0023500,F.Gore,00-0023500,0,1,1.46401790669188,,,,,,0.481911152601242,-48.1911152601242,2013-02-03,H.Ngata,2012,SB,BAL,21,00-0024227,DT,Haloti Ngata,Haloti,Ngata,Knee,,Probable,Knee,,Full Participation in Practice,2013-02-01T13:05:19Z,2013-02-01 13:05:19
2712,2012_03_NYJ_MIA,2012092306,MIA,NYJ,REG,3,MIA,home,NYJ,MIA,57.0,2012-09-23,266.0,1166.0,1166.0,Half2,0,14.0,0,3,3.0,0,04:26,MIA 43,9,80.0,"(4:26) (No Huddle, Shotgun) 17-R.Tannehill pass short left to 33-D.Thomas to NYJ 46 for 11 yards (52-D.Harris). NYJ-24-D.Revis was injured during the play. He is Out.",pass,11.0,1,1,1.0,0,0,0,short,left,-1.0,12.0,,,,,,,3,3,0.0,,,,,3.0,3.0,10,10,10.0,10.0,0.0,10.0,10.0,0.0,0.0257544666528702,0.154960155487061,0.0019618461374193,0.225175887346268,0.232071965932846,0.0051322784274816,0.354943424463272,0.0,0.0,1.14604905573651,1.90039808978327,1.72870584228076,-1.72870584228076,0.746852537035011,-0.746852537035011,5.38592745651132,-5.38592745651132,-1.51835824549198,3.41875633527525,-1.51835824549198,3.41875633527525,-2.17402742931154,2.17402742931154,-1.47975062474143,1.47975062474143,-12.5942207785556,12.5942207785556,14.3003350942383,-14.3003350942383,0.536342024803162,0.463657975196838,0.536342024803162,0.463657975196838,0.0653469562530518,0.0775735378265381,0.0775735378265381,0.601688981056213,0.398311018943787,0.433275640010834,0.433275640010834,-0.0440924477378046,0.0440924477378046,0.159859325241919,-0.159859325241919,0.0,0.0653469562530518,0.0,0.0653469562530518,0.0068379640579223,-0.0068379640579223,-0.0870275795459747,0.0870275795459747,0.0068379640579223,-0.0068379640579223,0.0594760733364781,-0.0594760733364781,0.0,0.0,1.0,0.0,1.0,0.0,0.0,0.0,0.0,0,0.0,0.0,0.0,0.0,0.0,0.0,0.0,0.0,0.0,0.0,0.0,0.0,0.0,0.0,1.0,0.0,0.0,0.0,0.0,0.0,0.0,0.0,0.0,1.0,0.0,0.0,0.0,0.0,0.0,0.0,0.0,0.0,0.0,0.0,0.0,1.0,0.0,0.0,0.0,0.0,0.0,00-0029701,R.Tannehill,11.0,00-0028000,D.Thomas,11.0,,,,,,,,,,,,,,,,,,,,,,,,,,,,,,,,,,,,,,,,,,,,,,NYJ,,00-0025434,,D.Harris,,,,,,,,,,,,,,0.0,,,,,,,,,,,,,,,,,,,,,,,,,,,,,,,,0.0,,,,,0,,,0.0,0.0,0.0,0.0,,,2012,0.814697444438934,18.5302555561066,36,1,First down,2712,"9/23/12, 13:03:34",2012-09-23T19:14:56Z,Hard Rock Stadium,"Mostly Cloudy Temp: 83° F, Humidity: 76%, Wind: NNW 4 mph",10012012-0923-0619-1f54-b4c6641efa03,0,0,PASS,0,,,,14,Touchdown,2012-09-23T19:11:27Z,11.0,4:21,6.0,1.0,1.0,3.0,3.0,15.0,PUNT,TOUCHDOWN,06:06,01:45,MIA 20,NYJ 1,2623.0,2947.0,23,20,Home,-3,43,-2.5,40.5,1,outdoors,grass,83.0,4.0,Joe Philbin,Rex Ryan,MIA00,Sun Life Stadium,0,1.0,R.Tannehill,17.0,,,D.Thomas,33.0,1,0,1.0,0,1,00-0029701,,00-0028000,R.Tannehill,17.0,00-0029701,D.Thomas,00-0028000,D.Thomas,00-0028000,0,0,1.90039808978327,1.29989602376762,7.71518933909829,6.0,0.272352381667588,0.272352381667588,0.975967764854431,2.40322351455689,2012-09-23,D.Revis,2012,REG,NYJ,3,00-0025401,CB,Darrelle Revis,Darrelle,Revis,Concussion,,Probable,Concussion,,Full Participation in Practice,2012-09-21T11:51:07Z,2012-09-21 11:51:07
