play_id,game_id,old_game_id,home_team,away_team,season_type,week_x,posteam,posteam_type,defteam,side_of_field,yardline_100,game_date,quarter_seconds_remaining,half_seconds_remaining,game_seconds_remaining,game_half,quarter_end,drive,sp,qtr,down,goal_to_go,time,yrdln,ydstogo,ydsnet,desc,play_type,yards_gained,shotgun,no_huddle,qb_dropback,qb_kneel,qb_spike,qb_scramble,pass_length,pass_location,air_yards,yards_after_catch,run_location,run_gap,field_goal_result,kick_distance,extra_point_result,two_point_conv_result,home_timeouts_remaining,away_timeouts_remaining,timeout,timeout_team,td_team,td_player_name,td_player_id,posteam_timeouts_remaining,defteam_timeouts_remaining,total_home_score,total_away_score,posteam_score,defteam_score,score_differential,posteam_score_post,defteam_score_post,score_differential_post,no_score_prob,opp_fg_prob,opp_safety_prob,opp_td_prob,fg_prob,safety_prob,td_prob,extra_point_prob,two_point_conversion_prob,ep,epa,total_home_epa,total_away_epa,total_home_rush_epa,total_away_rush_epa,total_home_pass_epa,total_away_pass_epa,air_epa,yac_epa,comp_air_epa,comp_yac_epa,total_home_comp_air_epa,total_away_comp_air_epa,total_home_comp_yac_epa,total_away_comp_yac_epa,total_home_raw_air_epa,total_away_raw_air_epa,total_home_raw_yac_epa,total_away_raw_yac_epa,wp,def_wp,home_wp,away_wp,wpa,vegas_wpa,vegas_home_wpa,home_wp_post,away_wp_post,vegas_wp,vegas_home_wp,total_home_rush_wpa,total_away_rush_wpa,total_home_pass_wpa,total_away_pass_wpa,air_wpa,yac_wpa,comp_air_wpa,comp_yac_wpa,total_home_comp_air_wpa,total_away_comp_air_wpa,total_home_comp_yac_wpa,total_away_comp_yac_wpa,total_home_raw_air_wpa,total_away_raw_air_wpa,total_home_raw_yac_wpa,total_away_raw_yac_wpa,punt_blocked,first_down_rush,first_down_pass,first_down_penalty,third_down_converted,third_down_failed,fourth_down_converted,fourth_down_failed,incomplete_pass,touchback,interception,punt_inside_twenty,punt_in_endzone,punt_out_of_bounds,punt_downed,punt_fair_catch,kickoff_inside_twenty,kickoff_in_endzone,kickoff_out_of_bounds,kickoff_downed,kickoff_fair_catch,fumble_forced,fumble_not_forced,fumble_out_of_bounds,solo_tackle,safety,penalty,tackled_for_loss,fumble_lost,own_kickoff_recovery,own_kickoff_recovery_td,qb_hit,rush_attempt,pass_attempt,sack,touchdown,pass_touchdown,rush_touchdown,return_touchdown,extra_point_attempt,two_point_attempt,field_goal_attempt,kickoff_attempt,punt_attempt,fumble,complete_pass,assist_tackle,lateral_reception,lateral_rush,lateral_return,lateral_recovery,passer_player_id,passer_player_name,passing_yards,receiver_player_id,receiver_player_name,receiving_yards,rusher_player_id,rusher_player_name,rushing_yards,lateral_receiver_player_id,lateral_receiver_player_name,lateral_receiving_yards,lateral_rusher_player_id,lateral_rusher_player_name,lateral_rushing_yards,lateral_sack_player_id,lateral_sack_player_name,interception_player_id,interception_player_name,lateral_interception_player_id,lateral_interception_player_name,punt_returner_player_id,punt_returner_player_name,lateral_punt_returner_player_id,lateral_punt_returner_player_name,kickoff_returner_player_name,kickoff_returner_player_id,lateral_kickoff_returner_player_id,lateral_kickoff_returner_player_name,punter_player_id,punter_player_name,kicker_player_name,kicker_player_id,own_kickoff_recovery_player_id,own_kickoff_recovery_player_name,blocked_player_id,blocked_player_name,tackle_for_loss_1_player_id,tackle_for_loss_1_player_name,tackle_for_loss_2_player_id,tackle_for_loss_2_player_name,qb_hit_1_player_id,qb_hit_1_player_name,qb_hit_2_player_id,qb_hit_2_player_name,forced_fumble_player_1_team,forced_fumble_player_1_player_id,forced_fumble_player_1_player_name,forced_fumble_player_2_team,forced_fumble_player_2_player_id,forced_fumble_player_2_player_name,solo_tackle_1_team,solo_tackle_2_team,solo_tackle_1_player_id,solo_tackle_2_player_id,solo_tackle_1_player_name,solo_tackle_2_player_name,assist_tackle_1_player_id,assist_tackle_1_player_name,assist_tackle_1_team,assist_tackle_2_player_id,assist_tackle_2_player_name,assist_tackle_2_team,assist_tackle_3_player_id,assist_tackle_3_player_name,assist_tackle_3_team,assist_tackle_4_player_id,assist_tackle_4_player_name,assist_tackle_4_team,tackle_with_assist,tackle_with_assist_1_player_id,tackle_with_assist_1_player_name,tackle_with_assist_1_team,tackle_with_assist_2_player_id,tackle_with_assist_2_player_name,tackle_with_assist_2_team,pass_defense_1_player_id,pass_defense_1_player_name,pass_defense_2_player_id,pass_defense_2_player_name,fumbled_1_team,fumbled_1_player_id,fumbled_1_player_name,fumbled_2_player_id,fumbled_2_player_name,fumbled_2_team,fumble_recovery_1_team,fumble_recovery_1_yards,fumble_recovery_1_player_id,fumble_recovery_1_player_name,fumble_recovery_2_team,fumble_recovery_2_yards,fumble_recovery_2_player_id,fumble_recovery_2_player_name,sack_player_id,sack_player_name,half_sack_1_player_id,half_sack_1_player_name,half_sack_2_player_id,half_sack_2_player_name,return_team,return_yards,penalty_team,penalty_player_id,penalty_player_name,penalty_yards,replay_or_challenge,replay_or_challenge_result,penalty_type,defensive_two_point_attempt,defensive_two_point_conv,defensive_extra_point_attempt,defensive_extra_point_conv,safety_player_name,safety_player_id,season_x,cp,cpoe,series,series_success,series_result,order_sequence,start_time,time_of_day,stadium,weather,nfl_api_id,play_clock,play_deleted,play_type_nfl,special_teams_play,st_play_type,end_clock_time,end_yard_line,fixed_drive,fixed_drive_result,drive_real_start_time,drive_play_count,drive_time_of_possession,drive_first_downs,drive_inside20,drive_ended_with_score,drive_quarter_start,drive_quarter_end,drive_yards_penalized,drive_start_transition,drive_end_transition,drive_game_clock_start,drive_game_clock_end,drive_start_yard_line,drive_end_yard_line,drive_play_id_started,drive_play_id_ended,away_score,home_score,location,result,total,spread_line,total_line,div_game,roof,surface,temp,wind,home_coach,away_coach,stadium_id,game_stadium,aborted_play,success,passer,passer_jersey_number,rusher,rusher_jersey_number,receiver,receiver_jersey_number,pass,rush,first_down,special,play,passer_id,rusher_id,receiver_id,name,jersey_number,id,fantasy_player_name,fantasy_player_id,fantasy,fantasy_id,out_of_bounds,home_opening_kickoff,qb_epa,xyac_epa,xyac_mean_yardage,xyac_median_yardage,xyac_success,xyac_fd,xpass,pass_oe,date_x,injured_player,season_y,game_type,team,week_y,gsis_id,position,full_name,first_name,last_name,report_primary_injury,report_secondary_injury,report_status,practice_primary_injury,practice_secondary_injury,practice_status,date_modified,date_y
5347,2018_01_PIT_CLE,2018090901,CLE,PIT,REG,1,PIT,away,CLE,PIT,62.0,2018-09-09,52.0,52.0,52.0,Overtime,0,36.0,0,5,1.0,0,00:52,PIT 38,10,12.0,"(:52) (No Huddle, Shotgun) 7-B.Roethlisberger pass incomplete deep left to 19-J.Smith-Schuster (23-D.Randall). CLE-23-D.Randall was injured during the play. His return is Doubtful.",pass,0.0,1,1,1.0,0,0,0,deep,left,18.0,,,,,,,,0,1,0.0,,,,,1.0,0.0,21,21,21.0,21.0,0.0,21.0,21.0,0.0,0.736207365989685,0.0194458067417145,0.0011560972779989,0.0161287561058998,0.161813274025917,0.0003566146478988,0.0648920983076096,0.0,0.0,0.766846832004376,-0.320697683258913,-3.70475458435249,3.70475458435249,11.1576506187557,-11.1576506187557,-15.2655125837651,15.2655125837651,0.796498852840159,-1.11719653609907,0.0,0.0,0.428411556989886,-0.428411556989886,-13.8390016100189,13.8390016100189,5.90206779443543,-5.90206779443543,-21.0537349945103,21.0537349945103,0.227061986981425,0.772938013018575,0.772938013018575,0.227061986981425,-0.0617697146371938,-0.0617697146371938,0.0617697146371938,0.834707727655768,0.165292272344232,0.227061986981425,0.772938013018575,-0.0156136734755084,0.0156136734755084,-0.951778456650653,0.951778456650653,0.340378999651875,-0.402148714289069,0.0,0.0,-0.343798239932997,0.343798239932997,-0.580010405082098,0.580010405082098,0.441361000485582,-0.441361000485582,-1.50569215304389,1.50569215304389,0.0,0.0,0.0,0.0,0.0,0.0,0.0,0.0,1.0,0,0.0,0.0,0.0,0.0,0.0,0.0,0.0,0.0,0.0,0.0,0.0,0.0,0.0,0.0,0.0,0.0,0.0,0.0,0.0,0.0,0.0,0.0,0.0,1.0,0.0,0.0,0.0,0.0,0.0,0.0,0.0,0.0,0.0,0.0,0.0,0.0,0.0,0.0,0.0,0.0,0.0,00-0022924,B.Roethlisberger,,00-0033857,J.Smith-Schuster,,,,,,,,,,,,,,,,,,,,,,,,,,,,,,,,,,,,,,,,,,,,,,,,,,,,,,,,,,,,,,,,,0.0,,,,,,,00-0032251,D.Randall,,,,,,,,,,,,,,,,,,,,,,,,0.0,,,,,0,,,0.0,0.0,0.0,0.0,,,2018,0.578944981098175,-57.8944981098175,77,0,Turnover,5347,"9/9/18, 13:02:36",2018-09-09T20:50:02Z,Cleveland Browns Stadium,"Rain Temp: 58° F, Humidity: 84%, Wind: East 11 mph",10012018-0909-01ae-bf47-aa9830fe3163,0,0,PASS,0,,,,36,Turnover,2018-09-09T20:49:38Z,3.0,0:41,1.0,0.0,0.0,5.0,5.0,0.0,PUNT,FUMBLE,01:17,00:36,PIT 26,PIT 38,5323.0,5369.0,21,21,Home,0,42,-3.5,41.0,1,outdoors,grass,58.0,11.0,Hue Jackson,Mike Tomlin,CLE00,FirstEnergy Stadium,0,0.0,B.Roethlisberger,7.0,,,J.Smith-Schuster,19.0,1,0,0.0,0,1,00-0022924,,00-0033857,B.Roethlisberger,7.0,00-0022924,J.Smith-Schuster,00-0033857,J.Smith-Schuster,00-0033857,0,0,-0.320697683258913,0.195247428995353,4.07819037570152,2.0,1.0,1.0,0.967520177364349,3.24798226356506,2018-09-09,D.Randall,2018,REG,CLE,1,00-0032251,CB,Damarious Randall,Damarious,Randall,,,,Knee,,Full Participation in Practice,2018-09-07T11:54:22Z,2018-09-07 11:54:22
4848,2018_08_NE_BUF,2018102900,BUF,NE,REG,8,BUF,home,NE,NE,47.0,2018-10-29,120.0,120.0,120.0,Half2,0,22.0,0,4,2.0,0,02:00,NE 47,22,36.0,(2:00) (Shotgun) 3-D.Anderson sacked at BUF 43 for -10 yards (53-K.Van Noy). BUF-3-D.Anderson was injured during the play.,pass,-10.0,1,0,1.0,0,0,0,,,,,,,,,,,0,2,0.0,,,,,0.0,2.0,6,25,6.0,25.0,-19.0,6.0,25.0,-19.0,0.559674084186554,0.0217549335211515,0.0003286337596364,0.0283685009926558,0.146929800510407,0.0041459058411419,0.238798156380653,0.0,0.0,1.85616673284676,-1.28708561207168,-22.3457720256708,22.3457720256708,-4.04084147739148,4.04084147739148,-23.5191103696412,23.5191103696412,,,0.0,0.0,-2.9502666235494,2.9502666235494,-2.49268876093378,2.49268876093378,5.36953319938039,-5.36953319938039,-23.7275905325509,23.7275905325509,0.0005980212590657,0.999401978740934,0.0005980212590657,0.999401978740934,-0.0001243563892785,-0.0001278274648939,-0.0001278274648939,0.0004736648697871,0.999526335130213,0.0001908512058435,0.0001908512058435,-0.211205956511199,0.211205956511199,-0.689252348346686,0.689252348346686,,,0.0,0.0,-0.004518661298789,0.004518661298789,-0.573123555048369,0.573123555048369,-0.0046266727149486,0.0046266727149486,-0.580288072326504,0.580288072326504,0.0,0.0,0.0,0.0,0.0,0.0,0.0,0.0,0.0,0,0.0,0.0,0.0,0.0,0.0,0.0,0.0,0.0,0.0,0.0,0.0,0.0,0.0,0.0,1.0,0.0,0.0,0.0,0.0,0.0,0.0,1.0,0.0,1.0,1.0,0.0,0.0,0.0,0.0,0.0,0.0,0.0,0.0,0.0,0.0,0.0,0.0,0.0,0.0,0.0,0.0,00-0023645,D.Anderson,,,,,,,,,,,,,,,,,,,,,,,,,,,,,,,,,,,,00-0031360,K.Van Noy,,,00-0031360,K.Van Noy,,,,,,,,,NE,,00-0031360,,K.Van Noy,,,,,,,,,,,,,,0.0,,,,,,,,,,,,,,,,,,,,,,,,,00-0031360,K.Van Noy,,,,,,0.0,,,,,0,,,0.0,0.0,0.0,0.0,,,2018,,,59,0,Turnover on downs,4848,"10/29/18, 20:15:28",2018-10-30T03:25:13Z,Highmark Stadium,"Partly cloudy Temp: 46° F, Humidity: 58%, Wind: W 16 mph",10012018-1029-0072-2093-be98f2cc0480,0,0,SACK,0,,,,22,Turnover on downs,2018-10-30T03:20:25Z,7.0,2:06,2.0,0.0,0.0,4.0,4.0,0.0,PUNT,DOWNS,02:54,00:48,BUF 30,NE 43,4720.0,4928.0,25,6,Home,-19,31,-13.5,44.0,1,outdoors,a_turf,46.0,16.0,Sean McDermott,Bill Belichick,BUF00,New Era Field,0,0.0,D.Anderson,3.0,,,,,1,0,0.0,0,1,00-0023645,,,D.Anderson,3.0,00-0023645,,,,,0,0,-1.28708561207168,,,,,,0.914194226264954,8.58057737350464,2018-10-29,D.Anderson,2018,REG,BUF,8,00-0023645,QB,Derek Anderson,Derek,Anderson,,,,Back,Calf,Full Participation in Practice,2018-10-27T10:39:13Z,2018-10-27 10:39:13
4615,2018_02_DET_SF,2018091610,SF,DET,REG,2,DET,away,SF,DET,84.0,2018-09-16,68.0,68.0,68.0,Half2,0,24.0,0,4,1.0,0,01:08,DET 16,10,23.0,(1:08) (Shotgun) 9-M.Stafford pass short middle to 15-G.Tate to DET 22 for 6 yards (48-F.Warner). SF-29-J.Tartt was injured during the play. Caught at 21. 1-YAC,pass,6.0,1,0,1.0,0,0,0,short,middle,5.0,1.0,,,,,,,0,0,0.0,,,,,0.0,0.0,30,27,27.0,30.0,-3.0,27.0,30.0,-3.0,0.86207127571106,0.018677044659853,0.0025207977741956,0.0223661046475172,0.0568230152130127,0.0004269340715836,0.037114854902029,0.0,0.0,0.213491436035838,0.0535722948261537,4.31861412333092,-4.31861412333092,6.30727542584369,-6.30727542584369,-4.89667998035281,4.89667998035281,0.046385531721171,0.0071867631049826,0.046385531721171,0.0071867631049826,-5.50927547589527,5.50927547589527,-4.65479432593565,4.65479432593565,-25.5449703515915,25.5449703515915,20.5436142883563,-20.5436142883563,0.242408946156502,0.757591053843498,0.757591053843498,0.242408946156502,-0.0409407019615173,0.0121675729751587,-0.0121675729751587,0.798531755805016,0.201468244194984,0.192832142114639,0.807167857885361,0.171615452130081,-0.171615452130081,0.140269081344313,-0.140269081344313,0.0,-0.0409407019615173,0.0,-0.0409407019615173,-0.145118283078085,0.145118283078085,0.0663424480906303,-0.0663424480906303,-0.145118283078085,0.145118283078085,0.217832115685063,-0.217832115685063,0.0,0.0,0.0,0.0,0.0,0.0,0.0,0.0,0.0,0,0.0,0.0,0.0,0.0,0.0,0.0,0.0,0.0,0.0,0.0,0.0,0.0,0.0,0.0,1.0,0.0,0.0,0.0,0.0,0.0,0.0,0.0,0.0,1.0,0.0,0.0,0.0,0.0,0.0,0.0,0.0,0.0,0.0,0.0,0.0,1.0,0.0,0.0,0.0,0.0,0.0,00-0026498,M.Stafford,6.0,00-0027891,G.Tate,6.0,,,,,,,,,,,,,,,,,,,,,,,,,,,,,,,,,,,,,,,,,,,,,,SF,,00-0034815,,F.Warner,,,,,,,,,,,,,,0.0,,,,,,,,,,,,,,,,,,,,,,,,,,,,,,,,0.0,,,,,0,,,0.0,0.0,0.0,0.0,,,2018,0.800080418586731,19.9919581413269,65,1,First down,4615,"9/16/18, 16:05:22",2018-09-16T23:17:22Z,Levi's® Stadium,"Clear Temp: 73° F, Wind: NW 12 mph",10012018-0916-107e-be14-3d3408ed0f0e,0,0,PASS,0,,,,24,Turnover on downs,2018-09-16T23:17:22Z,7.0,0:54,1.0,0.0,0.0,4.0,4.0,0.0,PUNT,DOWNS,01:08,00:14,DET 16,DET 39,4615.0,4819.0,27,30,Home,3,57,6.0,48.5,0,outdoors,grass,73.0,12.0,Kyle Shanahan,Matt Patricia,SFO01,Levi's Stadium,0,1.0,M.Stafford,9.0,,,G.Tate,15.0,1,0,0.0,0,1,00-0026498,,00-0027891,M.Stafford,9.0,00-0026498,G.Tate,00-0027891,G.Tate,00-0027891,0,0,0.0535722948261537,0.116606511421837,4.36457125339075,3.0,0.991750351735391,0.300476163276471,0.97329843044281,2.67015695571899,2018-09-16,J.Tartt,2018,REG,SF,2,00-0032057,S,Jaquiski Tartt,Jaquiski,Tartt,,,,Shoulder,,Limited Participation in Practice,2018-09-14T12:57:44Z,2018-09-14 12:57:44
4497,2018_09_CHI_BUF,2018110401,BUF,CHI,REG,9,CHI,away,BUF,BUF,2.0,2018-11-04,286.0,286.0,286.0,Half2,0,24.0,0,4,1.0,1,04:46,BUF 2,2,50.0,"(4:46) 10-M.Trubisky pass incomplete short right to 33-T.Mizzell (23-M.Hyde) [90-S.Lawson]. CHI-18-T.Gabriel was injured during the play. Receiver and coverage at goal line, nearing sideline. T.Gabriel walks off.",pass,0.0,0,0,1.0,0,0,0,short,right,2.0,,,,,,,,2,2,0.0,,,,,2.0,2.0,9,34,34.0,9.0,25.0,34.0,9.0,25.0,0.0431940145790577,0.0062146042473614,0.0001712833618512,0.0106484293937683,0.0887995213270187,0.0009901985758915,0.849981963634491,0.0,0.0,6.12472732135211,-0.377125478669768,-35.1304494800445,35.1304494800445,-1.75068892925628,1.75068892925628,-18.9185566557196,18.9185566557196,0.875272678647889,-1.25239815731766,0.0,0.0,-26.1057842095033,26.1057842095033,12.8018935820887,-12.8018935820887,-21.7362486939237,21.7362486939237,1.00152954403268,-1.00152954403268,0.999828219413757,0.0001717805862426,0.0001717805862426,0.999828219413757,-2.52127647399902e-05,-3.57627868652344e-06,3.57627868652344e-06,0.0001969933509826,0.999803006649017,0.999989867210388,1.01327896118164e-05,-0.167255778680045,0.167255778680045,0.502000771342803,-0.502000771342803,0.0,-2.52127647399902e-05,0.0,0.0,-0.326072439551353,0.326072439551353,-0.151527065529081,0.151527065529081,-0.326412783935666,0.326412783935666,0.736800320735461,-0.736800320735461,0.0,0.0,0.0,0.0,0.0,0.0,0.0,0.0,1.0,0,0.0,0.0,0.0,0.0,0.0,0.0,0.0,0.0,0.0,0.0,0.0,0.0,0.0,0.0,0.0,0.0,0.0,0.0,0.0,0.0,0.0,1.0,0.0,1.0,0.0,0.0,0.0,0.0,0.0,0.0,0.0,0.0,0.0,0.0,0.0,0.0,0.0,0.0,0.0,0.0,0.0,00-0033869,M.Trubisky,,00-0033373,T.Mizzell,,,,,,,,,,,,,,,,,,,,,,,,,,,,,,,,,,,,,00-0033096,S.Lawson,,,,,,,,,,,,,,,,,,,,,,,,,,,0.0,,,,,,,00-0030090,M.Hyde,,,,,,,,,,,,,,,,,,,,,,,,0.0,,,,,0,,,0.0,0.0,0.0,0.0,,,2018,0.369079977273941,-36.9079977273941,49,1,Touchdown,4497,"11/4/18, 13:03:12",2018-11-04T20:56:11Z,Highmark Stadium,"Mostly sunny Temp: 49° F, Humidity: 56%, Wind: E 12 mph",10012018-1104-0158-90e1-d4871e802169,0,0,PASS,0,,,,23,Touchdown,2018-11-04T20:52:47Z,4.0,1:05,2.0,1.0,1.0,4.0,4.0,43.0,KICKOFF,TOUCHDOWN,05:41,04:36,50,BUF 2,4373.0,4560.0,41,9,Home,-32,50,-10.5,38.0,0,outdoors,a_turf,49.0,12.0,Sean McDermott,Matt Nagy,BUF00,New Era Field,0,0.0,M.Trubisky,10.0,,,T.Mizzell,33.0,1,0,0.0,0,1,00-0033869,,00-0033373,M.Trubisky,10.0,00-0033869,T.Mizzell,00-0033373,T.Mizzell,00-0033373,0,0,-0.377125478669768,,,,,,0.239146202802658,76.0853797197342,2018-11-04,T.Gabriel,2018,REG,CHI,9,00-0031228,WR,Taylor Gabriel,Taylor,Gabriel,,,,Knee,,Full Participation in Practice,2018-11-01T14:13:16Z,2018-11-01 14:13:16
4389,2018_07_MIN_NYJ,2018102107,NYJ,MIN,REG,7,NYJ,home,MIN,MIN,45.0,2018-10-21,132.0,132.0,132.0,Half2,0,33.0,0,4,3.0,0,02:12,MIN 45,1,64.0,"(2:12) (No Huddle, Shotgun) 14-S.Darnold pass incomplete short right to 40-T.Cannon. NYJ-61-S.Long was injured during the play.",pass,0.0,1,1,1.0,0,0,0,short,right,5.0,,,,,,,,1,3,0.0,,,,,1.0,3.0,17,37,17.0,37.0,-20.0,17.0,37.0,-20.0,0.418462574481964,0.0392971448600292,0.0003534714633133,0.0450647994875908,0.181443080306053,0.0059993006289005,0.309379607439041,0.0,0.0,2.2879331203294,-1.33976906258613,-25.5811757769272,25.5811757769272,-3.51817064597019,3.51817064597019,-27.2981104812198,27.2981104812198,0.484007081540767,-1.8237761441269,0.0,0.0,-6.07726196869141,6.07726196869141,0.440347649938119,-0.440347649938119,-5.06358584610377,5.06358584610377,-21.0940348866697,21.0940348866697,0.0006548010860569,0.999345198913943,0.0006548010860569,0.999345198913943,-0.0001955693878699,-0.0001316318230237,-0.0001316318230237,0.000459231698187,0.999540768301813,0.0003644356038421,0.0003644356038421,-0.352769805362541,0.352769805362541,-0.531103103295834,0.531103103295834,0.0,-0.0001955693878699,0.0,0.0,-0.1797295054036,0.1797295054036,-0.06994095077971,0.06994095077971,-0.179771246873941,0.179771246873941,-0.282233927719062,0.282233927719062,0.0,0.0,0.0,0.0,0.0,1.0,0.0,0.0,1.0,0,0.0,0.0,0.0,0.0,0.0,0.0,0.0,0.0,0.0,0.0,0.0,0.0,0.0,0.0,0.0,0.0,0.0,0.0,0.0,0.0,0.0,0.0,0.0,1.0,0.0,0.0,0.0,0.0,0.0,0.0,0.0,0.0,0.0,0.0,0.0,0.0,0.0,0.0,0.0,0.0,0.0,00-0034869,S.Darnold,,00-0034164,T.Cannon,,,,,,,,,,,,,,,,,,,,,,,,,,,,,,,,,,,,,,,,,,,,,,,,,,,,,,,,,,,,,,,,,0.0,,,,,,,,,,,,,,,,,,,,,,,,,,,,,,,,0.0,,,,,0,,,0.0,0.0,0.0,0.0,,,2018,0.742075562477112,-74.2075562477112,56,1,First down,4389,"10/21/18, 13:02:52",2018-10-21T20:22:53Z,MetLife Stadium,"Cloudy Temp: 46° F, Humidity: 48%, Wind: NW 16 mph",10012018-1021-0750-5bc4-529f2d108472,0,0,PASS,0,,,,33,Turnover on downs,2018-10-21T20:18:47Z,11.0,2:40,3.0,1.0,0.0,4.0,4.0,0.0,KICKOFF,DOWNS,03:22,00:42,NYJ 24,MIN 23,4229.0,4558.0,37,17,Home,-20,54,-3.5,45.0,0,outdoors,fieldturf,46.0,16.0,Todd Bowles,Mike Zimmer,NYC01,MetLife Stadium,0,0.0,S.Darnold,14.0,,,T.Cannon,40.0,1,0,0.0,0,1,00-0034869,,00-0034164,S.Darnold,14.0,00-0034869,T.Cannon,00-0034164,T.Cannon,00-0034164,0,0,-1.33976906258613,0.295448630465759,4.02904996473808,2.0,0.99943620961858,0.99943620961858,0.426634073257446,57.3365926742554,2018-10-21,S.Long,2018,REG,NYJ,7,00-0031047,C,Spencer Long,Spencer,Long,,,,Knee,Finger,Full Participation in Practice,2018-10-19T10:57:05Z,2018-10-19 10:57:05
4098,2018_03_DEN_BAL,2018092301,BAL,DEN,REG,3,DEN,away,BAL,BAL,15.0,2018-09-23,264.0,264.0,264.0,Half2,0,22.0,0,4,1.0,0,04:24,BAL 15,10,59.0,"(4:24) (No Huddle, Shotgun) 4-C.Keenum pass short middle to 23-D.Booker to BAL 6 for 9 yards (41-A.Levine Sr.). BAL-99-M.Judon was injured during the play.",pass,9.0,1,1,1.0,0,0,0,short,middle,5.0,4.0,,,,,,,2,2,0.0,,,,,2.0,2.0,27,14,14.0,27.0,-13.0,14.0,27.0,-13.0,0.0904199928045273,0.0122055569663644,0.0002734916342888,0.0222235154360533,0.311543166637421,0.0008753951988182,0.562458872795105,0.0,0.0,4.68086413765559,0.941865840461105,6.75241696047359,-6.75241696047359,-5.83663713687565,5.83663713687565,10.5206157259194,-10.5206157259194,0.0823299062321894,0.859535934228916,0.0823299062321894,0.859535934228916,0.688261157801387,-0.688261157801387,1.00480795232415,-1.00480795232415,14.2967080599603,-14.2967080599603,-6.56126611455857,6.56126611455857,0.0766925662755966,0.923307433724403,0.923307433724403,0.0766925662755966,-0.0025601983070373,0.0069332756102085,-0.0069332756102085,0.925867632031441,0.0741323679685593,0.0516224876046181,0.948377512395382,-0.0887480915837804,0.0887480915837804,0.450925818470648,-0.450925818470648,0.0,-0.0025601983070373,0.0,-0.0025601983070373,0.119000397622585,-0.119000397622585,0.169440357772044,-0.169440357772044,0.119000397622585,-0.119000397622585,0.191269515839747,-0.191269515839747,0.0,0.0,0.0,0.0,0.0,0.0,0.0,0.0,0.0,0,0.0,0.0,0.0,0.0,0.0,0.0,0.0,0.0,0.0,0.0,0.0,0.0,0.0,0.0,1.0,0.0,0.0,0.0,0.0,0.0,0.0,0.0,0.0,1.0,0.0,0.0,0.0,0.0,0.0,0.0,0.0,0.0,0.0,0.0,0.0,1.0,0.0,0.0,0.0,0.0,0.0,00-0028986,C.Keenum,9.0,00-0032972,D.Booker,9.0,,,,,,,,,,,,,,,,,,,,,,,,,,,,,,,,,,,,,,,,,,,,,,BAL,,00-0027539,,A.Levine Sr.,,,,,,,,,,,,,,0.0,,,,,,,,,,,,,,,,,,,,,,,,,,,,,,,,0.0,,,,,0,,,0.0,0.0,0.0,0.0,,,2018,0.77906209230423,22.093790769577,54,0,Turnover on downs,4098,"9/23/18, 13:02:34",2018-09-23T20:00:51Z,M&T Bank Stadium,"Light Rain Temp: 61° F, Humidity: 91%, Wind: NNE 5 mph",10012018-0923-01d4-50fc-ec5add6c4c73,0,0,PASS,0,,,,22,Turnover on downs,2018-09-23T19:54:05Z,11.0,4:25,4.0,1.0,0.0,4.0,4.0,2.0,PUNT,DOWNS,07:22,02:57,DEN 30,BAL 11,3844.0,4191.0,14,27,Home,13,41,5.5,46.0,0,outdoors,grass,61.0,5.0,John Harbaugh,Vance Joseph,BAL00,M&T Bank Stadium,0,1.0,C.Keenum,4.0,,,D.Booker,23.0,1,0,0.0,0,1,00-0028986,,00-0032972,C.Keenum,4.0,00-0028986,D.Booker,00-0032972,D.Booker,00-0032972,0,1,0.941865840461105,0.627235224439116,3.36220271605998,3.0,0.98834709226503,0.288268150383374,0.869271397590637,13.0728602409363,2018-09-23,M.Judon,2018,REG,BAL,3,00-0032415,LB,Matt Judon,Matt,Judon,Hamstring,,Questionable,Hamstring,,Full Participation in Practice,2018-09-21T12:11:31Z,2018-09-21 12:11:31
4002,2018_05_ARI_SF,2018100710,SF,ARI,REG,5,SF,home,ARI,SF,64.0,2018-10-07,249.0,249.0,249.0,Half2,0,23.0,0,4,2.0,0,04:09,SF 36,10,2.0,"(4:09) (Shotgun) 3-C.Beathard sacked at SF 27 for -9 yards (36-B.Baker). SF-58-W.Richburg was injured during the play. His return is Questionable. Penalty on SF-75-L.Tomlinson, Offensive Holding, declined.",pass,-9.0,1,0,1.0,0,0,0,,,,,,,,,,,3,2,0.0,,,,,3.0,2.0,12,21,12.0,21.0,-9.0,12.0,21.0,-9.0,0.379027754068375,0.0775012224912643,0.0007761757588014,0.124822154641151,0.165250614285469,0.0030576100107282,0.249564424157143,0.0,0.0,1.14100693049841,-1.46014014002867,-11.8617692813145,11.8617692813145,-6.2418609359446,6.2418609359446,-2.16154361614707,2.16154361614707,,,0.0,0.0,-8.94050399816479,8.94050399816479,25.9908812434878,-25.9908812434878,-14.8833122493816,14.8833122493816,31.1003941401334,-31.1003941401334,0.0675717443227768,0.932428255677223,0.0675717443227768,0.932428255677223,-0.0206349566578865,-0.0314107500016689,-0.0314107500016689,0.0469367876648903,0.95306321233511,0.0834539532661438,0.0834539532661438,-0.595255850044833,0.595255850044833,-0.168523354458311,0.168523354458311,,,0.0,0.0,0.209409147724509,-0.209409147724509,0.527257672531813,-0.527257672531813,0.202182091996074,-0.202182091996074,0.317363417728155,-0.317363417728155,0.0,0.0,0.0,0.0,0.0,0.0,0.0,0.0,0.0,0,0.0,0.0,0.0,0.0,0.0,0.0,0.0,0.0,0.0,0.0,0.0,0.0,0.0,0.0,1.0,0.0,0.0,0.0,0.0,0.0,0.0,1.0,0.0,1.0,1.0,0.0,0.0,0.0,0.0,0.0,0.0,0.0,0.0,0.0,0.0,0.0,0.0,0.0,0.0,0.0,0.0,00-0033936,C.Beathard,,,,,,,,,,,,,,,,,,,,,,,,,,,,,,,,,,,,00-0033890,B.Baker,,,00-0033890,B.Baker,,,,,,,,,ARI,,00-0033890,,B.Baker,,,,,,,,,,,,,,0.0,,,,,,,,,,,,,,,,,,,,,,,,,00-0033890,B.Baker,,,,,,0.0,,,,,0,,,0.0,0.0,0.0,0.0,,,2018,,,54,0,Turnover,4002,"10/7/18, 16:25:58",2018-10-07T23:19:27Z,Levi's® Stadium,"Clear Temp: 79° F, Humidity: 19%, Wind: North 15 mph",10012018-1007-10e5-621f-12ce53e4fc48,0,0,SACK,0,,,,23,Turnover,2018-10-07T23:16:54Z,5.0,0:45,1.0,0.0,0.0,4.0,4.0,0.0,KICKOFF,INTERCEPTION,04:33,03:48,SF 25,SF 27,3920.0,4057.0,28,18,Home,-10,46,3.0,40.5,1,outdoors,grass,79.0,15.0,Kyle Shanahan,Steve Wilks,SFO01,Levi's Stadium,0,0.0,C.Beathard,3.0,,,,,1,0,0.0,0,1,00-0033936,,,C.Beathard,3.0,00-0033936,,,,,0,1,-1.46014014002867,,,,,,0.95797199010849,4.202800989151,2018-10-07,W.Richburg,2018,REG,SF,5,00-0031238,C,Weston Richburg,Weston,Richburg,Knee,,Questionable,Knee,,Full Participation in Practice,2018-10-05T13:34:17Z,2018-10-05 13:34:17
4001,2018_15_GB_CHI,2018121603,CHI,GB,REG,15,GB,away,CHI,CHI,9.0,2018-12-16,194.0,194.0,194.0,Half2,0,19.0,0,4,3.0,1,03:14,CHI 9,9,66.0,(3:14) (Shotgun) 12-A.Rodgers pass short middle intended for 80-J.Graham INTERCEPTED by 39-E.Jackson (58-R.Smith) at CHI -5. 39-E.Jackson to CHI 8 for 13 yards (65-L.Taylor). CHI-39-E.Jackson was injured during the play.,pass,0.0,1,0,1.0,0,0,0,short,middle,9.0,,,,,,,,2,3,0.0,,,,,3.0,2.0,24,14,14.0,24.0,-10.0,14.0,24.0,-10.0,0.0885138288140297,0.0140055371448398,0.0003428759227972,0.0245176814496517,0.535422205924988,0.0013469693949446,0.335850924253464,0.0,0.0,3.74559089291142,-3.75172271282645,8.88279075417234,-8.88279075417234,-7.80022420251044,7.80022420251044,14.0755344837806,-14.0755344837806,3.25440910708858,-7.00613181991503,0.0,0.0,0.294504214427434,-0.294504214427434,2.69608290185636,-2.69608290185636,-22.4155417818984,22.4155417818984,31.4922447457493,-31.4922447457493,0.111391395330429,0.888608604669571,0.888608604669571,0.111391395330429,-0.0878938138484955,-0.0833574309945107,0.0833574309945107,0.976502418518066,0.0234975814819336,0.100009955465794,0.899990044534206,-0.243599519420004,0.243599519420004,0.635997963008023,-0.635997963008023,0.0,-0.0878938138484955,0.0,0.0,0.13514195532998,-0.13514195532998,0.218381873948108,-0.218381873948108,0.327024610354508,-0.327024610354508,0.257530606967937,-0.257530606967937,0.0,0.0,0.0,0.0,0.0,1.0,0.0,0.0,0.0,0,1.0,0.0,0.0,0.0,0.0,0.0,0.0,0.0,0.0,0.0,0.0,0.0,0.0,0.0,1.0,0.0,0.0,0.0,0.0,0.0,0.0,0.0,0.0,1.0,0.0,0.0,0.0,0.0,0.0,0.0,0.0,0.0,0.0,0.0,0.0,0.0,0.0,0.0,0.0,0.0,0.0,00-0023459,A.Rodgers,,00-0027696,J.Graham,,,,,,,,,,,,,00-0033784,E.Jackson,,,,,,,,,,,,,,,,,,,,,,,,,,,,,,,,,GB,,00-0030273,,L.Taylor,,,,,,,,,,,,,,0.0,,,,,,,00-0034874,R.Smith,00-0033784,E.Jackson,,,,,,,,,,,,,,,,,,,,,CHI,13.0,,,,,0,,,0.0,0.0,0.0,0.0,,,2018,0.433533787727356,-43.3533787727356,50,0,Turnover,4001,"12/16/18, 13:02:45",2018-12-16T20:41:01Z,Soldier Field,"Fair Temp: 45° F, Humidity: 63%, Wind: W 10 mph",10012018-1216-0334-baff-b531e1cc3dfe,0,0,INTERCEPTION,0,,,,19,Turnover,2018-12-16T20:34:49Z,9.0,3:39,3.0,1.0,0.0,4.0,4.0,0.0,KICKOFF,INTERCEPTION,06:43,03:04,GB 25,CHI 9,3778.0,4001.0,17,24,Home,7,41,6.0,46.5,1,outdoors,grass,45.0,10.0,Matt Nagy,Joe Philbin,CHI98,Soldier Field,0,0.0,A.Rodgers,12.0,,,J.Graham,80.0,1,0,0.0,0,1,00-0023459,,00-0027696,A.Rodgers,12.0,00-0023459,J.Graham,00-0027696,J.Graham,00-0027696,0,1,-3.75172271282645,,,,,,0.986909687519073,1.30903124809265,2018-12-16,E.Jackson,2018,REG,CHI,15,00-0033784,S,Eddie Jackson,Eddie,Jackson,Shin,,Questionable,Shin,,Did Not Participate In Practice,2018-12-14T11:05:56Z,2018-12-14 11:05:56
3937,2018_16_KC_SEA,2018122314,SEA,KC,REG,16,KC,away,SEA,SEA,47.0,2018-12-23,369.0,369.0,369.0,Half2,0,20.0,0,4,2.0,0,06:09,SEA 47,3,72.0,"(6:09) (No Huddle, Shotgun) 15-P.Mahomes pass incomplete short middle to 10-T.Hill [55-F.Clark]. SEA-90-J.Reed was injured during the play.",pass,0.0,1,1,1.0,0,0,0,short,middle,8.0,,,,,,,,2,3,0.0,,,,,3.0,2.0,31,20,20.0,31.0,-11.0,20.0,31.0,-11.0,0.200359269976616,0.0653877481818199,0.0009881588630378,0.0813444033265114,0.21917237341404,0.0017642073798924,0.430983871221542,0.0,0.0,2.91038224799559,-0.681552332825959,7.52757372378362,-7.52757372378362,4.62654809749802,-4.62654809749802,1.45346214230595,-1.45346214230595,0.530178518267348,-1.21173085109331,0.0,0.0,2.77562357563875,-2.77562357563875,-3.19446659312234,3.19446659312234,-6.40826841050875,6.40826841050875,9.26078735095289,-9.26078735095289,0.0993128195405006,0.900687180459499,0.900687180459499,0.0993128195405006,-0.0136128589510918,-0.0161451250314713,0.0161451250314713,0.914300039410591,0.0856999605894089,0.116177417337894,0.883822582662106,0.164391240324186,-0.164391240324186,0.187995830136171,-0.187995830136171,0.0,-0.0136128589510918,0.0,0.0,0.0603593905534614,-0.0603593905534614,0.0521057391971388,-0.0521057391971388,0.0603593905534614,-0.0603593905534614,0.189423836252097,-0.189423836252097,0.0,0.0,0.0,0.0,0.0,0.0,0.0,0.0,1.0,0,0.0,0.0,0.0,0.0,0.0,0.0,0.0,0.0,0.0,0.0,0.0,0.0,0.0,0.0,0.0,0.0,0.0,0.0,0.0,0.0,0.0,1.0,0.0,1.0,0.0,0.0,0.0,0.0,0.0,0.0,0.0,0.0,0.0,0.0,0.0,0.0,0.0,0.0,0.0,0.0,0.0,00-0033873,P.Mahomes,,00-0033040,T.Hill,,,,,,,,,,,,,,,,,,,,,,,,,,,,,,,,,,,,,00-0032210,F.Clark,,,,,,,,,,,,,,,,,,,,,,,,,,,0.0,,,,,,,,,,,,,,,,,,,,,,,,,,,,,,,,0.0,,,,,0,,,0.0,0.0,0.0,0.0,,,2018,0.536679267883301,-53.6679267883301,59,1,First down,3937,"12/23/18, 20:22:47",2018-12-24T04:13:52Z,Lumen Field,"Cloudy Temp: 43° F, Humidity: 82%, Wind: SSE 8 mph",10012018-1223-14e8-fef9-912afbc290c2,0,0,PASS,0,,,,20,Touchdown,2018-12-24T04:11:51Z,9.0,2:55,4.0,1.0,1.0,4.0,4.0,0.0,KICKOFF,TOUCHDOWN,07:31,04:36,KC 28,SEA 11,3835.0,4089.0,31,38,Home,7,69,-1.0,54.0,0,outdoors,fieldturf,43.0,8.0,Pete Carroll,Andy Reid,SEA00,CenturyLink Field,0,0.0,P.Mahomes,15.0,,,T.Hill,10.0,1,0,0.0,0,1,00-0033873,,00-0033040,P.Mahomes,15.0,00-0033873,T.Hill,00-0033040,T.Hill,00-0033040,0,0,-0.681552332825959,0.229317318810978,4.31026902562007,2.0,1.0,1.0,0.802293241024017,19.7706758975983,2018-12-23,J.Reed,2018,REG,SEA,16,00-0032387,DT,Jarran Reed,Jarran,Reed,Groin,Oblique,Questionable,Groin,Oblique,Did Not Participate In Practice,2018-12-21T13:04:53Z,2018-12-21 13:04:53
3913,2018_14_NYJ_BUF,2018120900,BUF,NYJ,REG,14,BUF,home,NYJ,BUF,80.0,2018-12-09,371.0,371.0,371.0,Half2,0,19.0,0,4,2.0,0,06:11,BUF 20,10,62.0,(6:11) (Shotgun) 17-J.Allen pass short left to 19-I.McKenzie to BUF 28 for 8 yards (21-M.Claiborne). NYJ-21-M.Claiborne was injured during the play. Caught along sideline at BUF 27. M.Claiborne walks off.,pass,8.0,1,0,1.0,0,0,0,short,left,7.0,1.0,,,,,,,2,3,0.0,,,,,2.0,3.0,20,20,20.0,20.0,0.0,20.0,20.0,0.0,0.280775845050812,0.139033019542694,0.0016934976447373,0.216541200876236,0.143329575657845,0.0033006048761308,0.215326234698296,0.0,0.0,0.0075991195626556,0.183899533934891,-1.59062915551476,1.59062915551476,13.6078343599761,-13.6078343599761,-10.3823513739732,10.3823513739732,0.0962253483012319,0.0876741856336594,0.0962253483012319,0.0876741856336594,-5.16649372283546,5.16649372283546,7.36994463839801,-7.36994463839801,-7.71541977820862,7.71541977820862,4.17107140220984,-4.17107140220984,0.531771063804627,0.468228936195374,0.531771063804627,0.468228936195374,0.0066646933555603,-0.0038615465164184,-0.0038615465164184,0.538435757160187,0.461564242839813,0.575268089771271,0.575268089771271,0.31436100120047,-0.31436100120047,-0.51767305975246,0.51767305975246,0.0,0.0066646933555603,0.0,0.0066646933555603,-0.456326320221897,0.456326320221897,0.334644868969917,-0.334644868969917,-0.467375650456424,0.467375650456424,0.119107335805893,-0.119107335805893,0.0,0.0,0.0,0.0,0.0,0.0,0.0,0.0,0.0,0,0.0,0.0,0.0,0.0,0.0,0.0,0.0,0.0,0.0,0.0,0.0,0.0,0.0,0.0,1.0,0.0,0.0,0.0,0.0,0.0,0.0,0.0,0.0,1.0,0.0,0.0,0.0,0.0,0.0,0.0,0.0,0.0,0.0,0.0,0.0,1.0,0.0,0.0,0.0,0.0,0.0,00-0034857,J.Allen,8.0,00-0033466,I.McKenzie,8.0,,,,,,,,,,,,,,,,,,,,,,,,,,,,,,,,,,,,,,,,,,,,,,NYJ,,00-0029676,,M.Claiborne,,,,,,,,,,,,,,0.0,,,,,,,,,,,,,,,,,,,,,,,,,,,,,,,,0.0,,,,,0,,,0.0,0.0,0.0,0.0,,,2018,0.72077876329422,27.922123670578,47,1,First down,3913,"12/9/18, 13:02:42",2018-12-09T20:47:05Z,Highmark Stadium,"Fair Temp: 31° F, Humidity: 63%, Wind: WSW 12 mph",10012018-1209-005d-c629-c81d3b21e91e,0,0,PASS,0,,,,18,Field goal,2018-12-09T20:46:29Z,9.0,3:45,2.0,1.0,1.0,4.0,4.0,0.0,PUNT,FIELD_GOAL,06:16,02:31,BUF 20,NYJ 18,3887.0,4123.0,27,23,Home,-4,50,4.5,37.0,1,outdoors,a_turf,31.0,12.0,Sean McDermott,Todd Bowles,BUF00,New Era Field,0,1.0,J.Allen,17.0,,,I.McKenzie,19.0,1,0,0.0,0,1,00-0034857,,00-0033466,J.Allen,17.0,00-0034857,I.McKenzie,00-0033466,I.McKenzie,00-0033466,0,1,0.183899533934891,0.641676411308323,3.48076890065568,2.0,0.995342624024488,0.367829238646664,0.679052352905273,32.0947647094727,2018-12-09,M.Claiborne,2018,REG,NYJ,14,00-0029676,CB,Morris Claiborne,Morris,Claiborne,,,,Shoulder,Neck,Full Participation in Practice,2018-12-07T10:56:46Z,2018-12-07 10:56:46
3910,2018_03_LAC_LA,2018092310,LA,LAC,REG,3,LA,home,LAC,LA,59.0,2018-09-23,151.0,151.0,151.0,Half2,0,18.0,0,4,2.0,0,02:31,LA 41,4,35.0,(2:31) 34-M.Brown right tackle to LA 44 for 3 yards (46-C.Landrum; 52-D.Perryman). LA-77-A.Whitworth was injured during the play. His return is Questionable.,run,3.0,0,0,0.0,0,0,0,,,,,right,tackle,,,,,2,0,0.0,,,,,2.0,0.0,35,23,35.0,23.0,12.0,35.0,23.0,12.0,0.670354008674622,0.0503552556037903,0.000690656073857,0.0530770234763622,0.104528523981571,0.0034240190871059,0.117570504546165,0.0,0.0,0.619440898648463,-0.10778648708947,12.8185026667499,-12.8185026667499,-0.971810568531509,0.971810568531509,14.3672714740216,-14.3672714740216,,,0.0,0.0,3.59912827207815,-3.59912827207815,7.41219211186399,-7.41219211186399,-6.44874319424046,6.44874319424046,19.4227944122958,-19.4227944122958,0.99168199300766,0.00831800699234,0.99168199300766,0.00831800699234,0.0032030344009399,0.0009875297546386,0.0009875297546386,0.9948850274086,0.0051149725914001,0.998218238353729,0.998218238353729,0.174893903379628,-0.174893903379628,0.334994970022433,-0.334994970022433,,,0.0,0.0,-0.508529332115102,0.508529332115102,0.778043816579024,-0.778043816579024,-0.508529332115102,0.508529332115102,0.822357604993026,-0.822357604993026,0.0,0.0,0.0,0.0,0.0,0.0,0.0,0.0,0.0,0,0.0,0.0,0.0,0.0,0.0,0.0,0.0,0.0,0.0,0.0,0.0,0.0,0.0,0.0,0.0,0.0,0.0,0.0,0.0,0.0,0.0,0.0,1.0,0.0,0.0,0.0,0.0,0.0,0.0,0.0,0.0,0.0,0.0,0.0,0.0,0.0,1.0,0.0,0.0,0.0,0.0,,,,,,,00-0031806,M.Brown,3.0,,,,,,,,,,,,,,,,,,,,,,,,,,,,,,,,,,,,,,,,,,,,,,,,,00-0032905,C.Landrum,LAC,00-0032103,D.Perryman,LAC,,,,,,,0.0,,,,,,,,,,,,,,,,,,,,,,,,,,,,,,,,0.0,,,,,0,,,0.0,0.0,0.0,0.0,,,2018,,,59,1,First down,3910,"9/23/18, 16:05:38",2018-09-23T22:57:13Z,Los Angeles Memorial Coliseum,"Sunny Temp: 80° F, Humidity: 50%, Wind: SW 5 mph",10012018-0923-105f-06e7-3af474ef0c42,0,0,RUSH,0,,,,18,End of half,2018-09-23T22:50:39Z,9.0,4:23,3.0,0.0,0.0,4.0,4.0,0.0,FUMBLE,END_GAME,04:23,00:00,LA 12,LA 48,3754.0,4015.0,23,35,Home,12,58,7.5,49.0,0,outdoors,grass,80.0,5.0,Sean McVay,Anthony Lynn,LAX99,Los Angeles Memorial Coliseum,0,0.0,,,M.Brown,34.0,,,0,1,0.0,0,1,,00-0031806,,M.Brown,34.0,00-0031806,M.Brown,00-0031806,M.Brown,00-0031806,0,1,-0.10778648708947,,,,,,0.0747305303812027,-7.47305303812027,2018-09-23,A.Whitworth,2018,REG,LA,3,00-0024270,T,Andrew Whitworth,Andrew,Whitworth,,,,Not Injury Related,,Full Participation in Practice,2018-09-21T12:46:38Z,2018-09-21 12:46:38
3835,2018_13_WAS_PHI,2018120300,PHI,WAS,REG,13,PHI,home,WAS,PHI,75.0,2018-12-03,190.0,190.0,190.0,Half2,0,21.0,0,4,1.0,0,03:10,PHI 25,10,14.0,(3:10) 33-J.Adams left guard to PHI 28 for 3 yards (20-H.Clinton-Dix). PHI-71-J.Peters was injured during the play.,run,3.0,0,0,0.0,0,0,0,,,,,left,guard,,,,,3,2,0.0,,,,,3.0,2.0,28,13,28.0,13.0,15.0,28.0,13.0,15.0,0.426468223333359,0.0910342112183571,0.0009885859908536,0.10765041410923,0.151053458452225,0.0020989729091525,0.220706075429916,0.0,0.0,0.973668144783005,-0.238237913232297,16.7544185839367,-16.7544185839367,-7.07346486227471,7.07346486227471,21.8604384749813,-21.8604384749813,,,0.0,0.0,3.84174067794811,-3.84174067794811,22.0294338883422,-22.0294338883422,2.96518733995617,-2.96518733995617,14.9996810565242,-14.9996810565242,0.99880063533783,0.0011993646621704,0.99880063533783,0.0011993646621704,0.0001340508460998,5.2034854888916e-05,5.2034854888916e-05,0.998934686183929,0.0010653138160705,0.999382376670837,0.999382376670837,-0.134184540477425,0.134184540477425,0.596426074694488,-0.596426074694488,,,0.0,0.0,0.0612788953330549,-0.0612788953330549,0.624084599781781,-0.624084599781781,0.0595987596061262,-0.0595987596061262,0.449579329695553,-0.449579329695553,0.0,0.0,0.0,0.0,0.0,0.0,0.0,0.0,0.0,0,0.0,0.0,0.0,0.0,0.0,0.0,0.0,0.0,0.0,0.0,0.0,0.0,0.0,0.0,1.0,0.0,0.0,0.0,0.0,0.0,0.0,0.0,1.0,0.0,0.0,0.0,0.0,0.0,0.0,0.0,0.0,0.0,0.0,0.0,0.0,0.0,0.0,0.0,0.0,0.0,0.0,,,,,,,00-0034457,J.Adams,3.0,,,,,,,,,,,,,,,,,,,,,,,,,,,,,,,,,,,,,,,,,,,WAS,,00-0031333,,H.Clinton-Dix,,,,,,,,,,,,,,0.0,,,,,,,,,,,,,,,,,,,,,,,,,,,,,,,,0.0,,,,,0,,,0.0,0.0,0.0,0.0,,,2018,,,54,1,First down,3835,"12/3/18, 20:15:33",2018-12-04T04:04:58Z,Lincoln Financial Field,"Cloudy Temp: 36° F, Humidity: 58%, Wind: WNW 15 mph",10012018-1203-00ba-f2c7-0cfb9a9aaa03,0,0,RUSH,0,,,,21,End of half,2018-12-04T04:04:58Z,6.0,3:10,1.0,0.0,0.0,4.0,4.0,0.0,PUNT,END_GAME,03:10,00:00,PHI 25,PHI 40,3835.0,4013.0,13,28,Home,15,41,5.5,45.0,1,outdoors,grass,36.0,15.0,Doug Pederson,Jay Gruden,PHI00,Lincoln Financial Field,0,0.0,,,J.Adams,33.0,,,0,1,0.0,0,1,,00-0034457,,J.Adams,33.0,00-0034457,J.Adams,00-0034457,J.Adams,00-0034457,0,1,-0.238237913232297,,,,,,0.056842751801014,-5.6842751801014,2018-12-03,J.Peters,2018,REG,PHI,13,00-0022531,T,Jason Peters,Jason,Peters,,,,Not Injury Related,,Did Not Participate In Practice,2018-12-01T12:18:19Z,2018-12-01 12:18:19
3822,2018_14_CIN_LAC,2018120909,LAC,CIN,REG,14,LAC,home,CIN,CIN,35.0,2018-12-09,110.0,110.0,110.0,Half2,0,19.0,0,4,,0,01:50,CIN 35,0,7.0,"4-R.Bullock kicks onside 9 yards from CIN 35 to CIN 44. 31-A.Phillips (didn't try to advance) to CIN 44 for no gain. LAC-30-A.Ekeler was injured during the play. PENALTY on CIN-42-C.Fejedelem, Illegal Block Above the Waist, 10 yards, enforced at CIN 44. Penalty on CIN-4-R.Bullock, Illegal Touch Kick, declined.",kickoff,0.0,0,0,0.0,0,0,0,,,,,,,,9.0,,,3,2,0.0,,,,,3.0,2.0,23,21,23.0,21.0,2.0,23.0,21.0,2.0,0.513339936733246,0.0836336240172386,0.0009904818143695,0.0672848224639893,0.185773283243179,0.0010412139818072,0.147936627268791,0.0,0.0,0.871083075646311,2.29255967040081,3.68254109070487,-3.68254109070487,2.74055627157213,-2.74055627157213,0.0282111559903069,-0.0282111559903069,,,0.0,0.0,3.40988027281128,-3.40988027281128,-3.37391041925082,3.37391041925082,13.3692213336471,-13.3692213336471,-14.3965699573195,14.3965699573195,0.894641399383545,0.105358600616455,0.894641399383545,0.105358600616455,0.0372021198272705,0.0349993705749512,0.0349993705749512,0.931843519210815,0.0681564807891846,0.913094341754913,0.913094341754913,0.17950438178671,-0.17950438178671,0.263002851116494,-0.263002851116494,,,0.0,0.0,-0.655389021974965,0.655389021974965,0.779072333335876,-0.779072333335876,-0.654405187708303,0.654405187708303,0.756952543020248,-0.756952543020248,0.0,0.0,0.0,0.0,0.0,0.0,0.0,0.0,0.0,0,0.0,0.0,0.0,0.0,0.0,0.0,0.0,0.0,0.0,0.0,0.0,0.0,0.0,0.0,0.0,0.0,1.0,0.0,0.0,0.0,0.0,0.0,0.0,0.0,0.0,0.0,0.0,0.0,0.0,0.0,0.0,0.0,1.0,0.0,0.0,0.0,0.0,0.0,0.0,0.0,0.0,,,,,,,,,,,,,,,,,,,,,,,,,,,,,,,,R.Bullock,00-0029421,,,,,,,,,,,,,,,,,,,,,,,,,,,,,,,,,,,,,0.0,,,,,,,,,,,,,,,,,,,,,,,,,,,,,,,,0.0,CIN,00-0032807,C.Fejedelem,10.0,0,,Illegal Block Above the Waist,0.0,0.0,0.0,0.0,,,2018,,,51,0,Field goal,3822,"12/9/18, 16:05:33",2018-12-09T23:54:04Z,ROKiT Field - Dignity Health Sports Park,"Temp: 71° F, Humidity: 42%, Wind: NNE 2 mph",10012018-1209-0926-5099-79f74869fca4,0,0,KICK_OFF,1,,,,19,Field goal,2018-12-09T23:54:04Z,4.0,1:01,0.0,0.0,1.0,4.0,4.0,0.0,KICKOFF,FIELD_GOAL,01:50,00:49,CIN 34,CIN 27,3822.0,3982.0,21,26,Home,5,47,17.0,48.5,0,outdoors,grass,,,Anthony Lynn,Marvin Lewis,LAX97,StubHub Center,0,1.0,,,,,,,0,0,0.0,1,0,,,,,,,,,,,0,1,2.29255967040081,,,,,,,,2018-12-09,A.Ekeler,2018,REG,LAC,14,00-0033699,RB,Austin Ekeler,Austin,Ekeler,,,,Ankle,,Full Participation in Practice,2018-12-07T13:22:26Z,2018-12-07 13:22:26
3810,2018_03_SF_KC,2018092305,KC,SF,REG,3,SF,away,KC,SF,75.0,2018-09-23,827.0,827.0,827.0,Half2,0,17.0,0,4,1.0,0,13:47,SF 25,10,58.0,(13:47) 46-A.Morris up the middle to SF 33 for 8 yards (53-A.Hitchens). SF-68-M.Person was injured during the play.,run,8.0,0,0,0.0,0,0,0,,,,,middle,,,,,,2,3,0.0,,,,,3.0,2.0,38,24,24.0,38.0,-14.0,24.0,38.0,-14.0,0.0707795545458794,0.139908522367477,0.0038662056904286,0.219270661473274,0.210535764694214,0.001629565260373,0.354009687900543,0.0,0.0,1.15058163111098,0.567426054738462,14.1484179075065,-14.1484179075065,-2.98712737756432,2.98712737756432,9.99877123817859,-9.99877123817859,,,0.0,0.0,0.558488492679317,-0.558488492679317,16.1167115356366,-16.1167115356366,11.5045786147821,-11.5045786147821,0.175087273027859,-0.175087273027859,0.0565432906150818,0.943456709384918,0.943456709384918,0.0565432906150818,0.0083138048648834,0.0055265799164772,-0.0055265799164772,0.935142904520035,0.0648570954799652,0.0397809110581875,0.960219088941813,0.0837930613175501,-0.0837930613175501,0.184483644307816,-0.184483644307816,,,0.0,0.0,0.0070590798571696,-0.0070590798571696,0.260832775795499,-0.260832775795499,0.0070590798571696,-0.0070590798571696,0.186409730642701,-0.186409730642701,0.0,0.0,0.0,0.0,0.0,0.0,0.0,0.0,0.0,0,0.0,0.0,0.0,0.0,0.0,0.0,0.0,0.0,0.0,0.0,0.0,0.0,0.0,0.0,1.0,0.0,0.0,0.0,0.0,0.0,0.0,0.0,1.0,0.0,0.0,0.0,0.0,0.0,0.0,0.0,0.0,0.0,0.0,0.0,0.0,0.0,0.0,0.0,0.0,0.0,0.0,,,,,,,00-0029141,A.Morris,8.0,,,,,,,,,,,,,,,,,,,,,,,,,,,,,,,,,,,,,,,,,,,KC,,00-0031348,,A.Hitchens,,,,,,,,,,,,,,0.0,,,,,,,,,,,,,,,,,,,,,,,,,,,,,,,,0.0,,,,,0,,,0.0,0.0,0.0,0.0,,,2018,,,57,1,First down,3810,"9/23/18, 13:02:58",2018-09-23T19:47:56Z,GEHA Field at Arrowhead Stadium,"Clear and sunny Temp: 70° F, Humidity: 64%, Wind: East Southeast 4 mph",10012018-0923-0572-9722-daaf7971ab8a,0,0,RUSH,0,,,,17,Field goal,2018-09-23T19:47:14Z,17.0,8:30,6.0,1.0,1.0,4.0,4.0,-10.0,KICKOFF,FIELD_GOAL,13:47,05:17,SF 25,KC 17,3795.0,4231.0,27,38,Home,11,65,6.0,53.0,0,outdoors,grass,70.0,4.0,Andy Reid,Kyle Shanahan,KAN00,Arrowhead Stadium,0,1.0,,,A.Morris,46.0,,,0,1,0.0,0,1,,00-0029141,,A.Morris,46.0,00-0029141,A.Morris,00-0029141,A.Morris,00-0029141,0,0,0.567426054738462,,,,,,0.700341582298279,-70.0341582298279,2018-09-23,M.Person,2018,REG,SF,3,00-0028177,G,Mike Person,Mike,Person,,,,Foot,,Limited Participation in Practice,2018-09-21T12:57:46Z,2018-09-21 12:57:46
3780,2018_05_GB_DET,2018100704,DET,GB,REG,5,DET,home,GB,DET,75.0,2018-10-07,541.0,541.0,541.0,Half2,0,19.0,0,4,1.0,0,09:01,DET 25,10,-11.0,(9:01) (Shotgun) 9-M.Stafford pass short right to 15-G.Tate to DET 25 for no gain (50-B.Martinez). GB-20-K.King was injured during the play. His return is Questionable.,pass,0.0,1,0,1.0,0,0,0,short,right,2.0,-2.0,,,,,,,3,3,0.0,,,,,3.0,3.0,31,20,31.0,20.0,11.0,31.0,20.0,11.0,0.107503853738308,0.117951847612858,0.0021672768052667,0.197975650429726,0.203167796134949,0.0023357877507805,0.368897825479507,0.0,0.0,1.45244009280577,-0.574000447522849,10.9543640741088,-10.9543640741088,-4.47646189748775,4.47646189748775,-0.400267192347521,0.400267192347521,-0.538468624930829,-0.03553182259202,-0.538468624930829,-0.03553182259202,-15.5965316645452,15.5965316645452,0.591145264676655,-0.591145264676655,-15.5348744857474,15.5348744857474,7.66949933332662,-7.66949933332662,0.965810596942902,0.0341894030570984,0.965810596942902,0.0341894030570984,-0.0075368285179138,-0.0051657557487487,-0.0051657557487487,0.958273768424988,0.0417262315750122,0.963030278682709,0.963030278682709,-0.0066693040157063,0.0066693040157063,0.0434762922250178,-0.0434762922250178,0.0,-0.0075368285179138,0.0,-0.0075368285179138,-0.027764827927406,0.027764827927406,-0.0635986846310398,0.0635986846310398,-0.027764827927406,0.027764827927406,0.0229375794159868,-0.0229375794159868,0.0,0.0,0.0,0.0,0.0,0.0,0.0,0.0,0.0,0,0.0,0.0,0.0,0.0,0.0,0.0,0.0,0.0,0.0,0.0,0.0,0.0,0.0,0.0,1.0,0.0,0.0,0.0,0.0,0.0,0.0,0.0,0.0,1.0,0.0,0.0,0.0,0.0,0.0,0.0,0.0,0.0,0.0,0.0,0.0,1.0,0.0,0.0,0.0,0.0,0.0,00-0026498,M.Stafford,0.0,00-0027891,G.Tate,0.0,,,,,,,,,,,,,,,,,,,,,,,,,,,,,,,,,,,,,,,,,,,,,,GB,,00-0032408,,B.Martinez,,,,,,,,,,,,,,0.0,,,,,,,,,,,,,,,,,,,,,,,,,,,,,,,,0.0,,,,,0,,,0.0,0.0,0.0,0.0,,,2018,0.841780185699463,15.8219814300537,53,0,Punt,3780,"10/7/18, 13:02:46",2018-10-07T19:52:27Z,Ford Field,"Controlled Climate Temp: 68° F, Humidity: 70%, Wind: mph",10012018-1007-046a-e12a-9dd4f6642d7e,0,0,PASS,0,,,,19,Punt,2018-10-07T19:51:39Z,3.0,3:14,0.0,0.0,0.0,4.0,4.0,-15.0,KICKOFF,PUNT,09:01,05:47,DET 25,DET 14,3761.0,3913.0,23,31,Home,8,54,1.0,50.0,1,dome,fieldturf,,,Matt Patricia,Mike McCarthy,DET00,Ford Field,0,0.0,M.Stafford,9.0,,,G.Tate,15.0,1,0,0.0,0,1,00-0026498,,00-0027891,M.Stafford,9.0,00-0026498,G.Tate,00-0027891,G.Tate,00-0027891,0,1,-0.574000447522849,0.680445187667078,5.58966402582155,4.0,0.555992041365244,0.237657625810243,0.256969392299652,74.3030607700348,2018-10-07,K.King,2018,REG,GB,5,00-0033524,CB,Kevin King,Kevin,King,,,,Groin,,Full Participation in Practice,2018-10-05T12:32:18Z,2018-10-05 12:32:18
3733,2018_07_MIN_NYJ,2018102107,NYJ,MIN,REG,7,NYJ,home,MIN,NYJ,57.0,2018-10-21,528.0,528.0,528.0,Half2,0,29.0,0,4,1.0,0,08:48,NYJ 43,10,0.0,(8:48) (Shotgun) 14-S.Darnold pass incomplete deep left to 11-R.Anderson. NYJ-11-R.Anderson was injured during the play. MIN-29-X.Rhodes was injured during the play.,pass,0.0,1,0,1.0,0,0,0,deep,left,41.0,,,,,,,,3,3,0.0,,,,,3.0,3.0,17,27,17.0,27.0,-10.0,17.0,27.0,-10.0,0.136853933334351,0.084961898624897,0.0016166372224688,0.139443442225456,0.238665536046028,0.0035562932025641,0.394902229309082,0.0,0.0,2.25320173380896,-0.464788870885968,-12.9283544594515,12.9283544594515,-6.15027722614468,6.15027722614468,-10.6014437995464,10.6014437995464,2.52809607464587,-2.99288494553184,0.0,0.0,-0.356297673425683,0.356297673425683,0.533726338961786,-0.533726338961786,-6.2581440893128,6.2581440893128,-3.20280996178731,3.20280996178731,0.13565830886364,0.86434169113636,0.13565830886364,0.86434169113636,-0.0182643458247185,-0.0077227279543876,-0.0077227279543876,0.117393963038921,0.882606036961079,0.104604914784431,0.104604914784431,-0.365975393226463,0.365975393226463,-0.4008953597272,0.4008953597272,0.0,-0.0182643458247185,0.0,0.0,-0.123568656655605,0.123568656655605,-0.0562889762222767,0.0562889762222767,-0.123568656655605,0.123568656655605,-0.208228774368763,0.208228774368763,0.0,0.0,0.0,0.0,0.0,0.0,0.0,0.0,1.0,0,0.0,0.0,0.0,0.0,0.0,0.0,0.0,0.0,0.0,0.0,0.0,0.0,0.0,0.0,0.0,0.0,0.0,0.0,0.0,0.0,0.0,0.0,0.0,1.0,0.0,0.0,0.0,0.0,0.0,0.0,0.0,0.0,0.0,0.0,0.0,0.0,0.0,0.0,0.0,0.0,0.0,00-0034869,S.Darnold,,00-0032688,R.Anderson,,,,,,,,,,,,,,,,,,,,,,,,,,,,,,,,,,,,,,,,,,,,,,,,,,,,,,,,,,,,,,,,,0.0,,,,,,,,,,,,,,,,,,,,,,,,,,,,,,,,0.0,,,,,0,,,0.0,0.0,0.0,0.0,,,2018,0.299846827983856,-29.9846827983856,49,0,Turnover,3733,"10/21/18, 13:02:52",2018-10-21T19:59:36Z,MetLife Stadium,"Cloudy Temp: 46° F, Humidity: 48%, Wind: NW 16 mph",10012018-1021-0750-5bc4-529f2d108472,0,0,PASS,0,,,,29,Turnover,2018-10-21T19:59:36Z,2.0,0:15,0.0,0.0,0.0,4.0,4.0,0.0,PUNT,INTERCEPTION,08:48,08:33,NYJ 43,NYJ 43,3733.0,3761.0,37,17,Home,-20,54,-3.5,45.0,0,outdoors,fieldturf,46.0,16.0,Todd Bowles,Mike Zimmer,NYC01,MetLife Stadium,0,0.0,S.Darnold,14.0,,,R.Anderson,11.0,1,0,0.0,0,1,00-0034869,,00-0032688,S.Darnold,14.0,00-0034869,R.Anderson,00-0032688,R.Anderson,00-0032688,0,0,-0.464788870885968,0.800620247182552,7.1960907621542,5.0,1.0,1.0,0.732061445713043,26.7938554286957,2018-10-21,R.Anderson,2018,REG,NYJ,7,00-0032688,WR,Robby Anderson,Robby,Anderson,,,,Hamstring,,Full Participation in Practice,2018-10-19T10:57:05Z,2018-10-19 10:57:05
3719,2018_05_JAX_KC,2018100705,KC,JAX,REG,5,JAX,away,KC,JAX,56.0,2018-10-07,556.0,556.0,556.0,Half2,0,19.0,0,4,3.0,0,09:16,JAX 44,8,58.0,(9:16) (Shotgun) 5-B.Bortles pass short right to 81-N.Paul to KC 49 for 7 yards (48-Te.Smith; 53-A.Hitchens). KC-55-D.Ford was injured during the play.,pass,7.0,1,0,1.0,0,0,0,short,right,5.0,2.0,,,,,,,2,3,0.0,,,,,3.0,2.0,30,7,7.0,30.0,-23.0,7.0,30.0,-23.0,0.149454057216644,0.145724162459373,0.0021005177404731,0.18579925596714,0.202937245368958,0.0021312185563147,0.311853587627411,0.0,0.0,1.05408097198233,-0.14666028181091,24.981429124223,-24.981429124223,-5.49727217180651,5.49727217180651,28.7558082523334,-28.7558082523334,-0.789475015131757,0.642814733320847,-0.789475015131757,0.642814733320847,-3.03710377478274,3.03710377478274,5.85824186686659,-5.85824186686659,-20.4353980667947,20.4353980667947,42.6813647965291,-42.6813647965291,0.0007339693256653,0.999266030674335,0.999266030674335,0.0007339693256653,-0.000293351302389,-0.0002459814422763,0.0002459814422763,0.999559381976724,0.0004406180232763,0.0005695033469237,0.999430496653076,-0.00034398255156,0.00034398255156,0.414038177953142,-0.414038177953142,0.0,-0.000293351302389,0.0,-0.000293351302389,-0.893704403383466,0.893704403383466,1.07459827041021,-1.07459827041021,-0.906035095179262,0.906035095179262,1.21983007607687,-1.21983007607687,0.0,0.0,0.0,0.0,0.0,1.0,0.0,0.0,0.0,0,0.0,0.0,0.0,0.0,0.0,0.0,0.0,0.0,0.0,0.0,0.0,0.0,0.0,0.0,0.0,0.0,0.0,0.0,0.0,0.0,0.0,0.0,0.0,1.0,0.0,0.0,0.0,0.0,0.0,0.0,0.0,0.0,0.0,0.0,0.0,1.0,1.0,0.0,0.0,0.0,0.0,00-0031407,B.Bortles,7.0,00-0028093,N.Paul,7.0,,,,,,,,,,,,,,,,,,,,,,,,,,,,,,,,,,,,,,,,,,,,,,,,,,,,00-0032820,Te.Smith,KC,00-0031348,A.Hitchens,KC,,,,,,,0.0,,,,,,,,,,,,,,,,,,,,,,,,,,,,,,,,0.0,,,,,0,,,0.0,0.0,0.0,0.0,,,2018,0.692867696285248,30.7132303714752,57,1,First down,3719,"10/7/18, 13:02:24",2018-10-07T19:45:27Z,GEHA Field at Arrowhead Stadium,"Cloudy Temp: 58° F, Humidity: 90%, Wind: Northeast 5 mph",10012018-1007-054d-fd7a-14449dc3fb57,0,0,PASS,0,,,,19,Touchdown,2018-10-07T19:44:19Z,14.0,4:02,4.0,0.0,1.0,4.0,4.0,15.0,INTERCEPTION,TOUCHDOWN,09:48,05:46,JAX 42,KC 21,3672.0,3999.0,14,30,Home,16,44,3.0,48.0,0,outdoors,grass,58.0,5.0,Andy Reid,Doug Marrone,KAN00,Arrowhead Stadium,0,0.0,B.Bortles,5.0,,,N.Paul,81.0,1,0,0.0,0,1,00-0031407,,00-0028093,B.Bortles,5.0,00-0031407,N.Paul,00-0028093,N.Paul,00-0028093,0,0,-0.14666028181091,1.36420318673023,3.96726877242327,2.0,0.425046981661581,0.425046981661581,0.983236968517303,1.67630314826965,2018-10-07,D.Ford,2018,REG,KC,5,00-0031297,LB,Dee Ford,Dee,Ford,Groin,,Questionable,Groin,,Limited Participation in Practice,2018-10-05T12:40:36Z,2018-10-05 12:40:36
3673,2018_11_TB_NYG,2018111805,NYG,TB,REG,11,NYG,home,TB,TB,5.0,2018-11-18,241.0,241.0,241.0,Half2,0,18.0,0,4,2.0,0,04:01,TB 5,4,67.0,"(4:01) 26-S.Barkley up the middle to TB 2 for 3 yards (53-A.Taylor, 90-J.Pierre-Paul). TB-90-J.Pierre-Paul was injured during the play.",run,3.0,0,0,0.0,0,0,0,,,,,middle,,,,,,1,1,0.0,,,,,1.0,1.0,31,28,31.0,28.0,3.0,31.0,28.0,3.0,0.0889951661229134,0.0079132802784442,0.0002248852106276,0.0124477632343769,0.270209401845932,0.0011071275221183,0.619102418422699,0.0,0.0,5.0352354356437,-0.077725243230816,8.65395764703862,-8.65395764703862,-0.686840952170314,0.686840952170314,6.42977146771376,-6.42977146771376,,,0.0,0.0,-4.42470585426781,4.42470585426781,-0.540238955969802,0.540238955969802,-7.7722661770531,7.7722661770531,19.692978303841,-19.692978303841,0.906242370605469,0.0937576293945312,0.906242370605469,0.0937576293945312,0.0052800774574279,0.0178381204605103,0.0178381204605103,0.911522448062897,0.0884775519371033,0.912833869457245,0.912833869457245,0.0052917655879171,-0.0052917655879171,0.39206027629254,-0.39206027629254,,,0.0,0.0,-0.0019909364608236,0.0019909364608236,0.0919163433043517,-0.0919163433043517,-0.0050281507399984,0.0050281507399984,0.487894337560244,-0.487894337560244,0.0,0.0,0.0,0.0,0.0,0.0,0.0,0.0,0.0,0,0.0,0.0,0.0,0.0,0.0,0.0,0.0,0.0,0.0,0.0,0.0,0.0,0.0,0.0,0.0,0.0,0.0,0.0,0.0,0.0,0.0,0.0,1.0,0.0,0.0,0.0,0.0,0.0,0.0,0.0,0.0,0.0,0.0,0.0,0.0,0.0,1.0,0.0,0.0,0.0,0.0,,,,,,,00-0034844,S.Barkley,3.0,,,,,,,,,,,,,,,,,,,,,,,,,,,,,,,,,,,,,,,,,,,,,,,,,00-0027867,J.Pierre-Paul,TB,,,,,,,,,,1.0,00-0031120,A.Taylor,TB,,,,,,,,,,,,,,,,,,,,,,,,,,,,,0.0,,,,,0,,,0.0,0.0,0.0,0.0,,,2018,,,57,1,Touchdown,3673,"11/18/18, 13:02:52",2018-11-18T20:44:50Z,MetLife Stadium,"Cloudy Temp: 42° F, Humidity: 54%, Wind: 1 SE mph",10012018-1118-051d-1366-014caf998a27,0,0,RUSH,0,,,,18,Touchdown,2018-11-18T20:41:18Z,5.0,1:19,2.0,1.0,1.0,4.0,4.0,0.0,KICKOFF,TOUCHDOWN,05:11,03:52,NYG 33,TB 2,3547.0,3738.0,35,38,Home,3,73,3.0,54.5,0,outdoors,fieldturf,42.0,1.0,Pat Shurmur,Dirk Koetter,NYC01,MetLife Stadium,0,0.0,,,S.Barkley,26.0,,,0,1,0.0,0,1,,00-0034844,,S.Barkley,26.0,00-0034844,S.Barkley,00-0034844,S.Barkley,00-0034844,0,1,-0.077725243230816,,,,,,0.279149264097214,-27.9149264097214,2018-11-18,J.Pierre-Paul,2018,REG,TB,11,00-0027867,DE,Jason Pierre-Paul,Jason,Pierre-Paul,,,,Hand,,Full Participation in Practice,2018-11-16T10:21:41Z,2018-11-16 10:21:41
3667,2018_02_IND_WAS,2018091608,WAS,IND,REG,2,WAS,home,IND,IND,36.0,2018-09-16,328.0,328.0,328.0,Half2,0,21.0,0,4,2.0,0,05:28,IND 36,5,22.0,"(5:28) (No Huddle, Shotgun) 11-A.Smith pass short middle to 85-V.Davis to IND 29 for 7 yards (53-D.Leonard; 26-C.Geathers) [51-J.Ward]. WAS-71-T.Williams was injured during the play. His return is Questionable. 71 - has a knee injury",pass,7.0,1,1,1.0,0,0,0,short,middle,6.0,1.0,,,,,,,3,3,0.0,,,,,3.0,3.0,9,21,9.0,21.0,-12.0,9.0,21.0,-12.0,0.144452854990959,0.0452561788260937,0.0006409760098904,0.0693698152899742,0.309763491153717,0.0019915432203561,0.428525120019913,0.0,0.0,3.31031020451337,0.579237191821449,-9.85607816880089,9.85607816880089,-6.85993666184368,6.85993666184368,-1.31802545939509,1.31802545939509,0.519937117467634,0.0593000743538141,0.519937117467634,0.0593000743538141,6.02512583546923,-6.02512583546923,-9.42123936470067,9.42123936470067,15.5945290532836,-15.5945290532836,-14.0926401644881,14.0926401644881,0.0649836510419846,0.935016348958015,0.0649836510419846,0.935016348958015,0.0114412605762482,0.0078374668955802,0.0078374668955802,0.0764249116182327,0.923575088381767,0.0933832600712776,0.0933832600712776,-0.249789207356193,0.249789207356193,-0.277870568128944,0.277870568128944,0.0,0.0114412605762482,0.0,0.0114412605762482,-0.0552014572314739,0.0552014572314739,-0.220254683199811,0.220254683199811,-0.0481287104777812,0.0481287104777812,-0.109492899182725,0.109492899182725,0.0,0.0,1.0,0.0,0.0,0.0,0.0,0.0,0.0,0,0.0,0.0,0.0,0.0,0.0,0.0,0.0,0.0,0.0,0.0,0.0,0.0,0.0,0.0,0.0,0.0,0.0,0.0,0.0,0.0,0.0,1.0,0.0,1.0,0.0,0.0,0.0,0.0,0.0,0.0,0.0,0.0,0.0,0.0,0.0,1.0,1.0,0.0,0.0,0.0,0.0,00-0023436,A.Smith,7.0,00-0024221,V.Davis,7.0,,,,,,,,,,,,,,,,,,,,,,,,,,,,,,,,,,,,00-0033046,J.Ward,,,,,,,,,,,,,,,00-0034846,D.Leonard,IND,00-0031571,C.Geathers,IND,,,,,,,0.0,,,,,,,,,,,,,,,,,,,,,,,,,,,,,,,,0.0,,,,,0,,,0.0,0.0,0.0,0.0,,,2018,0.576303839683533,42.3696160316467,48,1,First down,3667,"9/16/18, 13:04:00",2018-09-16T19:35:57Z,Commanders Field,"Cloudy Temp: 71° F, Humidity: 88%, Wind: ENE 5 mph",10012018-0916-081b-593a-5095c01288ed,0,0,PASS,0,,,,20,Turnover,2018-09-16T19:40:18Z,4.0,1:12,1.0,0.0,0.0,4.0,4.0,-5.0,FUMBLE,PUNT,04:59,03:47,IND 19,IND 41,3735.0,3900.0,21,9,Home,-12,30,6.0,48.0,0,outdoors,grass,71.0,5.0,Jay Gruden,Frank Reich,WAS00,FedExField,0,1.0,A.Smith,11.0,,,V.Davis,85.0,1,0,1.0,0,1,00-0023436,,00-0024221,A.Smith,11.0,00-0023436,V.Davis,00-0024221,V.Davis,00-0024221,0,0,0.579237191821449,0.337468669894055,4.53736972616753,2.0,0.998188276891597,0.995978358783759,0.907307624816895,9.26923751831055,2018-09-16,T.Williams,2018,REG,WAS,2,00-0027857,T,Trent Williams,Trent,Williams,,,,Knee,,Full Participation in Practice,2018-09-14T11:49:15Z,2018-09-14 11:49:15
3667,2018_12_GB_MIN,2018112510,MIN,GB,REG,12,GB,away,MIN,GB,65.0,2018-11-25,166.0,166.0,166.0,Half2,0,21.0,0,4,3.0,0,02:46,GB 35,10,73.0,"(2:46) (No Huddle, Shotgun) 12-A.Rodgers pass deep right to 17-D.Adams pushed ob at MIN 29 for 36 yards (29-X.Rhodes). MIN-29-X.Rhodes was injured during the play.",pass,36.0,1,1,1.0,0,0,0,deep,right,30.0,6.0,,,,,,,3,1,0.0,,,,,1.0,3.0,24,14,14.0,24.0,-10.0,14.0,24.0,-10.0,0.410186350345612,0.0837440639734268,0.0008290468831546,0.13939493894577,0.125152811408043,0.002616916084662,0.238075897097588,0.0,0.0,0.818568687769584,2.85690581187373,7.440460236163,-7.440460236163,-4.39685690791212,4.39685690791212,13.8732779794517,-13.8732779794517,2.46071558131371,0.396190230560023,2.46071558131371,0.396190230560023,-2.01390933914809,2.01390933914809,13.2730328013422,-13.2730328013422,-8.33001634525135,8.33001634525135,20.1754179087002,-20.1754179087002,0.0248933732509613,0.975106626749039,0.975106626749039,0.0248933732509613,0.0334854610264301,0.031979413703084,-0.031979413703084,0.941621165722609,0.0583788342773914,0.0280330199748278,0.971966980025172,-0.147136435347046,0.147136435347046,0.726908045588255,-0.726908045588255,0.0,0.0334854610264301,0.0,0.0334854610264301,0.0074930563569068,-0.0074930563569068,0.550364690600157,-0.550364690600157,-0.719972871243954,0.719972871243954,1.38320831465554,-1.38320831465554,0.0,0.0,1.0,0.0,1.0,0.0,0.0,0.0,0.0,0,0.0,0.0,0.0,0.0,0.0,0.0,0.0,0.0,0.0,0.0,0.0,0.0,0.0,0.0,1.0,0.0,0.0,0.0,0.0,0.0,0.0,0.0,0.0,1.0,0.0,0.0,0.0,0.0,0.0,0.0,0.0,0.0,0.0,0.0,0.0,1.0,0.0,0.0,0.0,0.0,0.0,00-0023459,A.Rodgers,36.0,00-0031381,D.Adams,36.0,,,,,,,,,,,,,,,,,,,,,,,,,,,,,,,,,,,,,,,,,,,,,,MIN,,00-0030575,,X.Rhodes,,,,,,,,,,,,,,0.0,,,,,,,,,,,,,,,,,,,,,,,,,,,,,,,,0.0,,,,,0,,,0.0,0.0,0.0,0.0,,,2018,0.348258703947067,65.1741296052933,50,1,First down,3667,"11/25/18, 20:22:25",2018-11-26T04:16:02Z,U.S. Bank Stadium,"N/A (Indoors) Temp: ° F, Wind: mph",10012018-1125-1056-f567-ec715f814598,0,0,PASS,0,,,,21,Field goal,2018-11-26T04:13:56Z,9.0,2:31,2.0,0.0,1.0,4.0,4.0,0.0,DOWNS,FIELD_GOAL,04:51,02:20,GB 7,MIN 20,3572.0,3777.0,17,24,Home,7,41,4.0,48.5,1,dome,sportturf,,,Mike Zimmer,Mike McCarthy,MIN01,U.S. Bank Stadium,0,1.0,A.Rodgers,12.0,,,D.Adams,17.0,1,0,1.0,0,1,00-0023459,,00-0031381,A.Rodgers,12.0,00-0023459,D.Adams,00-0031381,D.Adams,00-0031381,1,1,2.85690581187373,0.584293235537552,7.27608656531083,4.0,1.0,1.0,0.994427680969238,0.557231903076172,2018-11-25,X.Rhodes,2018,REG,MIN,12,00-0030575,CB,Xavier Rhodes,Xavier,Rhodes,,,,Foot,,Full Participation in Practice,2018-11-23T10:49:39Z,2018-11-23 10:49:39
3643,2018_09_TB_CAR,2018110402,CAR,TB,REG,9,TB,away,CAR,TB,65.0,2018-11-04,428.0,428.0,428.0,Half2,0,22.0,0,4,2.0,0,07:08,TB 35,10,14.0,(7:08) (Shotgun) 25-P.Barber left tackle to TB 43 for 8 yards (25-E.Reid). TB-25-P.Barber was injured during the play.,run,8.0,1,0,0.0,0,0,0,,,,,left,tackle,,,,,0,2,0.0,,,,,2.0,0.0,42,28,28.0,42.0,-14.0,28.0,42.0,-14.0,0.355743885040283,0.0991857647895813,0.0046188989654183,0.143604651093483,0.161223292350769,0.0016348611097782,0.233988672494888,0.0,0.0,0.812832656782121,0.0171556761488318,13.2622406535967,-13.2622406535967,13.7237888574018,-13.7237888574018,2.03205906777293,-2.03205906777293,,,0.0,0.0,-0.716787483659573,0.716787483659573,-8.38918510111398,8.38918510111398,-14.6369204688235,14.6369204688235,17.5095102168561,-17.5095102168561,0.0406390801072121,0.959360919892788,0.959360919892788,0.0406390801072121,0.007687758654356,0.0034050066024065,-0.0034050066024065,0.951673161238432,0.0483268387615681,0.028008384630084,0.971991615369916,0.140154414839029,-0.140154414839029,0.289342533785021,-0.289342533785021,,,0.0,0.0,-1.67352316130254,1.67352316130254,1.67745675352434,-1.67745675352434,-1.67347666758414,1.67347666758414,1.91153209419953,-1.91153209419953,0.0,0.0,0.0,0.0,0.0,0.0,0.0,0.0,0.0,0,0.0,0.0,0.0,0.0,0.0,0.0,0.0,0.0,0.0,0.0,0.0,0.0,0.0,0.0,1.0,0.0,0.0,0.0,0.0,0.0,0.0,0.0,1.0,0.0,0.0,0.0,0.0,0.0,0.0,0.0,0.0,0.0,0.0,0.0,0.0,0.0,0.0,0.0,0.0,0.0,0.0,,,,,,,00-0032741,P.Barber,8.0,,,,,,,,,,,,,,,,,,,,,,,,,,,,,,,,,,,,,,,,,,,CAR,,00-0030548,,E.Reid,,,,,,,,,,,,,,0.0,,,,,,,,,,,,,,,,,,,,,,,,,,,,,,,,0.0,,,,,0,,,0.0,0.0,0.0,0.0,,,2018,,,53,1,First down,3643,"11/4/18, 13:02:57",2018-11-04T20:58:26Z,Bank of America Stadium,"Sunny Temp: 62° F, Humidity: 47%, Wind: East 8 mph",10012018-1104-02a7-3681-b74f12cc0606,0,0,RUSH,0,,,,22,Punt,2018-11-04T20:55:11Z,8.0,4:12,2.0,0.0,0.0,4.0,4.0,1.0,KICKOFF,PUNT,09:04,04:52,TB 25,TB 39,3537.0,3781.0,28,42,Home,14,70,6.0,55.5,1,outdoors,grass,62.0,8.0,Ron Rivera,Dirk Koetter,CAR00,Bank of America Stadium,0,1.0,,,P.Barber,25.0,,,0,1,0.0,0,1,,00-0032741,,P.Barber,25.0,00-0032741,P.Barber,00-0032741,P.Barber,00-0032741,0,0,0.0171556761488318,,,,,,0.906090617179871,-90.6090617179871,2018-11-04,P.Barber,2018,REG,TB,9,00-0032741,RB,Peyton Barber,Peyton,Barber,,,,Ankle,,Full Participation in Practice,2018-11-02T11:18:13Z,2018-11-02 11:18:13
3631,2018_06_LAC_CLE,2018101402,CLE,LAC,REG,6,LAC,away,CLE,CLE,32.0,2018-10-14,568.0,568.0,568.0,Half2,0,22.0,0,4,2.0,0,09:28,CLE 32,1,64.0,"(9:28) 28-M.Gordon left guard to CLE 17 for 15 yards (23-D.Randall). CLE-52-J.Burgess was injured during the play. His return is Questionable. PENALTY on CLE-23-D.Randall, Face Mask (15 Yards), 9 yards, enforced at CLE 17. Penalty on CLE-90-E.Ogbah, Face Mask (15 Yards), declined.",run,15.0,0,0,0.0,0,0,0,,,,,left,guard,,,,,3,2,0.0,,,,,2.0,3.0,14,35,35.0,14.0,21.0,35.0,14.0,21.0,0.0699972733855248,0.0511784330010414,0.000565149995964,0.0688439607620239,0.330429404973984,0.0013739707646891,0.477611780166626,0.0,0.0,3.70074529328849,1.43380782112945,-31.9964676539556,31.9964676539556,-19.1366202640929,19.1366202640929,-21.2939131129434,21.2939131129434,,,0.0,0.0,-4.48226740013342,4.48226740013342,5.45778220152715,-5.45778220152715,19.2230058271962,-19.2230058271962,-36.5690740124021,36.5690740124021,0.999115288257599,0.0008847117424011,0.0008847117424011,0.999115288257599,0.0001626014709472,0.0002302527427673,-0.0002302527427673,0.0007221102714538,0.999277889728546,0.999266088008881,0.0007339119911193,-0.21284483091678,0.21284483091678,-0.412718227473663,0.412718227473663,,,0.0,0.0,-0.0761445480365001,0.0761445480365001,0.102065729122842,-0.102065729122842,-0.0764935034293376,0.0764935034293376,-0.169010469486238,0.169010469486238,0.0,1.0,0.0,1.0,0.0,0.0,0.0,0.0,0.0,0,0.0,0.0,0.0,0.0,0.0,0.0,0.0,0.0,0.0,0.0,0.0,0.0,0.0,0.0,1.0,0.0,1.0,0.0,0.0,0.0,0.0,0.0,1.0,0.0,0.0,0.0,0.0,0.0,0.0,0.0,0.0,0.0,0.0,0.0,0.0,0.0,0.0,0.0,0.0,0.0,0.0,,,,,,,00-0032144,M.Gordon,15.0,,,,,,,,,,,,,,,,,,,,,,,,,,,,,,,,,,,,,,,,,,,CLE,,00-0032251,,D.Randall,,,,,,,,,,,,,,0.0,,,,,,,,,,,,,,,,,,,,,,,,,,,,,,,,0.0,CLE,00-0032251,D.Randall,9.0,0,,Face Mask,0.0,0.0,0.0,0.0,,,2018,,,53,1,First down,3631,"10/14/18, 13:02:26",2018-10-14T19:46:39Z,Cleveland Browns Stadium,"Sunny Temp: 51° F, Humidity: 61%, Wind: South 9 mph",10012018-1014-0267-c3a4-bcc1422a3fd6,0,0,RUSH,0,,,,22,Turnover,2018-10-14T19:42:54Z,8.0,5:02,4.0,1.0,0.0,4.0,4.0,9.0,KICKOFF,INTERCEPTION,12:26,07:24,LAC 27,CLE 9,3525.0,3708.0,38,14,Home,-24,52,1.0,47.0,0,outdoors,grass,51.0,9.0,Hue Jackson,Anthony Lynn,CLE00,FirstEnergy Stadium,0,1.0,,,M.Gordon,28.0,,,0,1,1.0,0,1,,00-0032144,,M.Gordon,28.0,00-0032144,M.Gordon,00-0032144,M.Gordon,00-0032144,0,1,1.43380782112945,,,,,,0.105443179607391,-10.5443179607391,2018-10-14,J.Burgess,2018,REG,CLE,6,00-0032627,LB,James Burgess,James,Burgess,Knee,,Questionable,Knee,,Limited Participation in Practice,2018-10-12T12:41:58Z,2018-10-12 12:41:58
3606,2018_12_MIA_IND,2018112504,IND,MIA,REG,12,MIA,away,IND,MIA,75.0,2018-11-25,496.0,496.0,496.0,Half2,0,21.0,0,4,3.0,0,08:16,MIA 25,10,-5.0,(8:16) (Shotgun) 32-K.Drake up the middle to MIA 20 for -5 yards (92-M.Hunt). MIA-32-K.Drake was injured during the play. His return is Questionable.,run,-5.0,1,0,0.0,0,0,0,,,,,middle,,,,,,3,2,0.0,,,,,2.0,3.0,17,24,24.0,17.0,7.0,24.0,17.0,7.0,0.136492609977722,0.166364371776581,0.0020079552195966,0.27383479475975,0.166858047246933,0.0028438786976039,0.251598387956619,0.0,0.0,-0.152501974254847,-1.57717336760834,-8.4002616200599,8.4002616200599,-1.19085249729687,1.19085249729687,-3.26759001040084,3.26759001040084,,,0.0,0.0,8.17478407312592,-8.17478407312592,-8.26073331064254,8.26073331064254,13.6475885809195,-13.6475885809195,-16.5990927340823,16.5990927340823,0.844379425048828,0.155620574951172,0.155620574951172,0.844379425048828,-0.0479056835174561,-0.0935581922531128,0.0935581922531128,0.203526258468628,0.796473741531372,0.794227659702301,0.205772340297699,-0.0150687080533909,0.0150687080533909,-0.208576877275847,0.208576877275847,,,0.0,0.0,0.240689618700361,-0.240689618700361,-0.333922396275757,0.333922396275757,0.240926308744764,-0.240926308744764,-0.379088344845531,0.379088344845531,0.0,0.0,0.0,0.0,0.0,1.0,0.0,0.0,0.0,0,0.0,0.0,0.0,0.0,0.0,0.0,0.0,0.0,0.0,0.0,0.0,0.0,0.0,0.0,1.0,0.0,0.0,1.0,0.0,0.0,0.0,0.0,1.0,0.0,0.0,0.0,0.0,0.0,0.0,0.0,0.0,0.0,0.0,0.0,0.0,0.0,0.0,0.0,0.0,0.0,0.0,,,,,,,00-0033118,K.Drake,-5.0,,,,,,,,,,,,,,,,,,,,,,,,,,,,,00-0030449,M.Hunt,,,,,,,,,,,,,IND,,00-0030449,,M.Hunt,,,,,,,,,,,,,,0.0,,,,,,,,,,,,,,,,,,,,,,,,,,,,,,,,0.0,,,,,0,,,0.0,0.0,0.0,0.0,,,2018,,,50,0,Punt,3606,"11/25/18, 16:25:39",2018-11-25T23:55:05Z,Lucas Oil Stadium,"Mostly cloudy Temp: 57° F, Humidity: 74%, Wind: SE 11 mph",10012018-1125-04cd-b525-dbf877d78c42,0,0,RUSH,0,,,,21,Punt,2018-11-25T23:50:46Z,3.0,0:43,0.0,0.0,0.0,4.0,4.0,0.0,KICKOFF,PUNT,08:26,07:43,MIA 25,MIA 20,3537.0,3631.0,24,27,Home,3,51,9.0,52.5,0,closed,fieldturf,,,Frank Reich,Adam Gase,IND00,Lucas Oil Stadium,0,0.0,,,K.Drake,32.0,,,0,1,0.0,0,1,,00-0033118,,K.Drake,32.0,00-0033118,K.Drake,00-0033118,K.Drake,00-0033118,0,0,-1.57717336760834,,,,,,0.962677478790283,-96.2677478790283,2018-11-25,K.Drake,2018,REG,MIA,12,00-0033118,RB,Kenyan Drake,Kenyan,Drake,,,,Shoulder,,Limited Participation in Practice,2018-11-23T08:10:49Z,2018-11-23 08:10:49
3599,2018_14_NE_MIA,2018120906,MIA,NE,REG,14,MIA,home,NE,NE,35.0,2018-12-09,405.0,405.0,405.0,Half2,0,20.0,0,4,,0,06:45,NE 35,0,18.0,3-S.Gostkowski kicks 65 yards from NE 35 to MIA 0. 32-K.Drake to MIA 22 for 22 yards (36-B.King; 59-A.McClellan). MIA-32-K.Drake was injured during the play. His return is Questionable.,kickoff,0.0,0,0,0.0,0,0,0,,,,,,,,65.0,,,3,3,0.0,,,,,3.0,3.0,28,30,28.0,30.0,-2.0,28.0,30.0,-2.0,0.234600707888603,0.11460454761982,0.0022340146824717,0.174382492899895,0.175229519605637,0.0025045608635991,0.296444177627564,0.0,0.0,1.03684780141339,-0.352650000248104,-3.98027753969655,3.98027753969655,16.2594143148745,-16.2594143148745,-16.0899617240712,16.0899617240712,,,0.0,0.0,-12.2188098200131,12.2188098200131,-9.84480556100607,9.84480556100607,-21.3642776392517,21.3642776392517,6.51557830283937,-6.51557830283937,0.453665971755981,0.546334028244019,0.453665971755981,0.546334028244019,-0.0021101236343383,-0.004394382238388,-0.004394382238388,0.451555848121643,0.548444151878357,0.298915833234787,0.298915833234787,0.531992026281398,-0.531992026281398,-0.408553240862814,0.408553240862814,,,0.0,0.0,0.0901424888815193,-0.0901424888815193,-0.792953698408502,0.792953698408502,0.0879720751489906,-0.0879720751489906,-0.526844440472025,0.526844440472025,0.0,0.0,0.0,0.0,0.0,0.0,0.0,0.0,0.0,0,0.0,0.0,0.0,0.0,0.0,0.0,0.0,1.0,0.0,0.0,0.0,0.0,0.0,0.0,0.0,0.0,0.0,0.0,0.0,0.0,0.0,0.0,0.0,0.0,0.0,0.0,0.0,0.0,0.0,0.0,0.0,0.0,1.0,0.0,0.0,0.0,1.0,0.0,0.0,0.0,0.0,,,,,,,,,,,,,,,,,,,,,,,,,,K.Drake,00-0033118,,,,,S.Gostkowski,00-0024333,,,,,,,,,,,,,,,,,,,,,,,,,00-0031856,B.King,NE,00-0027560,A.McClellan,NE,,,,,,,0.0,,,,,,,,,,,,,,,,,,,,,,,,,,,,,,,MIA,22.0,,,,,0,,,0.0,0.0,0.0,0.0,,,2018,,,55,1,First down,3599,"12/9/18, 13:02:33",2018-12-09T20:43:13Z,Hard Rock Stadium,"Mostly Cloudy Temp: 82° F, Humidity: 79%, Wind: SSW 13 mph",10012018-1209-067b-89ca-d4e91090bbb1,0,0,KICK_OFF,1,,,,20,Punt,2018-12-09T20:43:13Z,4.0,2:19,1.0,0.0,0.0,4.0,4.0,0.0,KICKOFF,PUNT,06:45,04:26,MIA 22,MIA 40,3599.0,3735.0,33,34,Home,1,67,-8.5,49.5,1,outdoors,grass,82.0,13.0,Adam Gase,Bill Belichick,MIA00,Hard Rock Stadium,0,0.0,,,,,,,0,0,0.0,1,0,,,,,,,,,,,0,0,-0.352650000248104,,,,,,,,2018-12-09,K.Drake,2018,REG,MIA,14,00-0033118,RB,Kenyan Drake,Kenyan,Drake,,,,Shoulder,,Limited Participation in Practice,2018-12-07T10:40:15Z,2018-12-07 10:40:15
3588,2018_15_SEA_SF,2018121609,SF,SEA,REG,15,SEA,away,SF,SEA,59.0,2018-12-16,543.0,543.0,543.0,Half2,0,18.0,0,4,2.0,0,09:03,SEA 41,9,45.0,"(9:03) 74-G.Fant reported in as eligible. 3-R.Wilson pass short right to 32-C.Carson to SEA 43 for 2 yards (48-F.Warner, 25-R.Sherman). SEA-32-C.Carson was injured during the play. Caught at SEA 37. 6-YAC",pass,2.0,0,0,1.0,0,0,0,short,right,-4.0,6.0,,,,,,,3,3,0.0,,,,,3.0,3.0,23,20,20.0,23.0,-3.0,20.0,23.0,-3.0,0.13472381234169,0.109947636723518,0.0018571865512058,0.182395413517952,0.230315938591957,0.0038938045036047,0.336866170167923,0.0,0.0,1.44647343805991,-0.502177608199418,1.15369085031799,-1.15369085031799,-10.7151618971868,10.7151618971868,5.45135480596825,-5.45135480596825,-1.38778503728099,0.885607429081574,-1.38778503728099,0.885607429081574,-1.06004012495396,1.06004012495396,2.12064090615604,-2.12064090615604,0.521102851256728,-0.521102851256728,0.207232193678169,-0.207232193678169,0.337061315774918,0.662938684225082,0.662938684225082,0.337061315774918,-0.014992892742157,-0.0240219533443451,0.0240219533443451,0.677931576967239,0.322068423032761,0.427244126796722,0.572755873203278,-0.199845663522681,0.199845663522681,0.0086086031608188,-0.0086086031608188,0.0,-0.014992892742157,0.0,-0.014992892742157,-0.1648068041924,0.1648068041924,0.106951340847786,-0.106951340847786,-0.1648068041924,0.1648068041924,0.028018876725014,-0.028018876725014,0.0,0.0,0.0,0.0,0.0,0.0,0.0,0.0,0.0,0,0.0,0.0,0.0,0.0,0.0,0.0,0.0,0.0,0.0,0.0,0.0,0.0,0.0,0.0,0.0,0.0,0.0,0.0,0.0,0.0,0.0,0.0,0.0,1.0,0.0,0.0,0.0,0.0,0.0,0.0,0.0,0.0,0.0,0.0,0.0,1.0,1.0,0.0,0.0,0.0,0.0,00-0029263,R.Wilson,2.0,00-0033594,C.Carson,2.0,,,,,,,,,,,,,,,,,,,,,,,,,,,,,,,,,,,,,,,,,,,,,,,,,,,,00-0028092,R.Sherman,SF,,,,,,,,,,1.0,00-0034815,F.Warner,SF,,,,,,,,,,,,,,,,,,,,,,,,,,,,,0.0,,,,,0,,,0.0,0.0,0.0,0.0,,,2018,0.876255631446838,12.3744368553162,46,1,First down,3588,"12/16/18, 16:05:25",2018-12-16T23:39:00Z,Levi's® Stadium,"Cloudy Temp: 61° F, Humidity: 68%, Wind: South 11 mph",10012018-1216-091b-a5f1-0ae9e0518d18,0,0,PASS,0,,,,18,Field goal,2018-12-16T23:36:21Z,7.0,4:30,2.0,0.0,1.0,4.0,4.0,5.0,KICKOFF,FIELD_GOAL,09:51,05:21,SEA 25,SF 30,3509.0,3768.0,23,26,Home,3,49,-3.5,44.0,1,outdoors,grass,61.0,11.0,Kyle Shanahan,Pete Carroll,SFO01,Levi's Stadium,0,0.0,R.Wilson,3.0,,,C.Carson,32.0,1,0,0.0,0,1,00-0029263,,00-0033594,R.Wilson,3.0,00-0029263,C.Carson,00-0033594,C.Carson,00-0033594,0,1,-0.502177608199418,1.48849086286161,9.99018929660087,9.0,0.436834965483286,0.262022808776237,0.800324976444244,19.9675023555756,2018-12-16,C.Carson,2018,REG,SEA,15,00-0033594,RB,Chris Carson,Chris,Carson,,,,Not Injury Related,,Full Participation in Practice,2018-12-14T14:57:42Z,2018-12-14 14:57:42
3587,2018_04_SEA_ARI,2018093008,ARI,SEA,REG,4,ARI,home,SEA,SEA,22.0,2018-09-30,547.0,547.0,547.0,Half2,0,19.0,1,4,2.0,0,09:07,SEA 22,13,80.0,"(9:07) 3-J.Rosen pass deep left to 10-C.Williams for 22 yards, TOUCHDOWN. SEA-29-E.Thomas was injured during the play.",pass,22.0,0,0,1.0,0,0,0,deep,left,22.0,0.0,,,,,,,3,1,0.0,,ARI,C.Williams,00-0033933,3.0,1.0,16,17,10.0,17.0,-7.0,16.0,17.0,-1.0,0.0306361205875874,0.0263026896864176,0.0009810684714466,0.0391629971563816,0.571159064769745,0.0007371074170805,0.33102098107338,0.0,0.0,3.67708709056024,3.32291290943977,-3.24390326170282,3.24390326170282,-12.6267630616156,12.6267630616156,1.71117691212801,-1.71117691212801,3.32291290943977,0.0,3.32291290943977,0.0,5.56086235542898,-5.56086235542898,0.708749701102202,-0.708749701102202,15.953282732371,-15.953282732371,-15.3993095935124,15.3993095935124,0.314838230609894,0.685161769390106,0.314838230609894,0.685161769390106,0.215158776313476,0.163416028839673,0.163416028839673,0.529997006923369,0.470002993076631,0.239723086357117,0.239723086357117,-0.35283227760179,0.35283227760179,0.159723238021545,-0.159723238021545,0.215158776313476,0.0,0.215158776313476,0.0,0.317318872481994,-0.317318872481994,-0.14326773583889,0.14326773583889,0.3148585715596,-0.3148585715596,-0.297356188297272,0.297356188297272,0.0,0.0,1.0,0.0,0.0,0.0,0.0,0.0,0.0,0,0.0,0.0,0.0,0.0,0.0,0.0,0.0,0.0,0.0,0.0,0.0,0.0,0.0,0.0,0.0,0.0,0.0,0.0,0.0,0.0,0.0,0.0,0.0,1.0,0.0,1.0,1.0,0.0,0.0,0.0,0.0,0.0,0.0,0.0,0.0,1.0,0.0,0.0,0.0,0.0,0.0,00-0034343,J.Rosen,22.0,00-0033933,C.Williams,22.0,,,,,,,,,,,,,,,,,,,,,,,,,,,,,,,,,,,,,,,,,,,,,,,,,,,,,,,,,,,,,,,,0.0,,,,,,,,,,,,,,,,,,,,,,,,,,,,,,,,0.0,,,,,0,,,0.0,0.0,0.0,0.0,,,2018,0.320225715637207,67.9774284362793,47,1,Touchdown,3587,"9/30/18, 16:05:29",2018-09-30T22:45:03Z,State Farm Stadium,"N/A Indoor Temp: ° F, Wind: mph",10012018-0930-0839-f14d-e689e9245db6,0,0,PASS,0,,,,19,Touchdown,2018-09-30T22:41:53Z,5.0,2:39,3.0,1.0,1.0,4.0,4.0,0.0,PUNT,TOUCHDOWN,11:38,08:59,ARI 20,SEA 22,3482.0,3607.0,20,17,Home,-3,37,-3.5,40.0,1,closed,grass,,,Steve Wilks,Pete Carroll,PHO00,State Farm Stadium,0,1.0,J.Rosen,3.0,,,C.Williams,10.0,1,0,1.0,0,1,00-0034343,,00-0033933,J.Rosen,3.0,00-0034343,C.Williams,00-0033933,C.Williams,00-0033933,0,0,3.32291290943977,,,,,,0.914763689041138,8.52363109588623,2018-09-30,E.Thomas,2018,REG,SEA,4,00-0027866,S,Earl Thomas,Earl,Thomas,,,,Not Injury Related,,Full Participation in Practice,2018-09-28T14:49:41Z,2018-09-28 14:49:41
3562,2018_04_PHI_TEN,2018093007,TEN,PHI,REG,4,PHI,away,TEN,TEN,34.0,2018-09-30,77.0,77.0,77.0,Half2,0,21.0,0,4,2.0,0,01:17,TEN 34,5,27.0,(1:17) (Shotgun) 11-C.Wentz pass short left to 17-A.Jeffery to TEN 19 for 15 yards (28-K.Lewis). TEN-28-K.Lewis was injured during the play. His return is Questionable.,pass,15.0,1,0,1.0,0,0,0,short,left,-2.0,17.0,,,,,,,3,2,0.0,,,,,2.0,3.0,20,17,17.0,20.0,-3.0,17.0,20.0,-3.0,0.299170017242432,0.034821942448616,0.0002852901525329,0.0275413747876883,0.304266750812531,0.0014056507498025,0.332508981227875,0.0,0.0,2.94534839136759,1.24570744589437,-0.326745364756789,0.326745364756789,-1.7336569637333,1.7336569637333,1.08342451402308,-1.08342451402308,-0.754381714621559,2.00008916051593,-0.754381714621559,2.00008916051593,-8.46103544370271,8.46103544370271,2.9844299882204,-2.9844299882204,-4.21194158832077,4.21194158832077,0.392530886494515,-0.392530886494515,0.432709127664566,0.567290872335434,0.567290872335434,0.432709127664566,0.132385164499283,0.121472299098969,-0.121472299098969,0.434905707836151,0.565094292163849,0.517017126083374,0.482982873916626,-0.0361140277608611,0.0361140277608611,-0.119603518016433,0.119603518016433,0.0,0.132385164499283,0.0,0.132385164499283,0.0623201018899701,-0.0623201018899701,-0.369758866230942,0.369758866230942,0.059699047240617,-0.059699047240617,-0.313711754481293,0.313711754481293,0.0,0.0,1.0,0.0,0.0,0.0,0.0,0.0,0.0,0,0.0,0.0,0.0,0.0,0.0,0.0,0.0,0.0,0.0,0.0,0.0,0.0,0.0,0.0,1.0,0.0,0.0,0.0,0.0,0.0,0.0,0.0,0.0,1.0,0.0,0.0,0.0,0.0,0.0,0.0,0.0,0.0,0.0,0.0,0.0,1.0,0.0,0.0,0.0,0.0,0.0,00-0032950,C.Wentz,15.0,00-0029137,A.Jeffery,15.0,,,,,,,,,,,,,,,,,,,,,,,,,,,,,,,,,,,,,,,,,,,,,,TEN,,00-0027736,,K.Lewis,,,,,,,,,,,,,,0.0,,,,,,,,,,,,,,,,,,,,,,,,,,,,,,,,0.0,,,,,0,,,0.0,0.0,0.0,0.0,,,2018,0.868540823459625,13.1459176540375,53,1,First down,3562,"9/30/18, 13:02:45",2018-09-30T19:59:35Z,Nissan Stadium,"Sunny Temp: 80° F, Humidity: 56%, Wind: NW 4 mph",10012018-0930-07e4-b28f-a2df7bdbfa93,0,0,PASS,0,,,,21,Field goal,2018-09-30T19:57:11Z,6.0,1:25,1.0,1.0,1.0,4.0,4.0,0.0,PUNT,FIELD_GOAL,01:41,00:16,TEN 39,TEN 12,3538.0,3718.0,23,26,Home,3,49,-3.0,41.5,0,outdoors,grass,80.0,4.0,Mike Vrabel,Doug Pederson,NAS00,Nissan Stadium,0,1.0,C.Wentz,11.0,,,A.Jeffery,17.0,1,0,1.0,0,1,00-0032950,,00-0029137,C.Wentz,11.0,00-0032950,A.Jeffery,00-0029137,A.Jeffery,00-0029137,0,1,1.24570744589437,1.05077120561,7.91032669576816,6.0,0.576018921827199,0.494109555875184,0.865343451499939,13.4656548500061,2018-09-30,K.Lewis,2018,REG,TEN,4,00-0027736,S,Kendrick Lewis,Kendrick,Lewis,,,,Foot,,Full Participation in Practice,2018-09-28T12:33:28Z,2018-09-28 12:33:28
3552,2018_08_MIA_HOU,2018102500,HOU,MIA,REG,8,HOU,home,MIA,MIA,46.0,2018-10-25,543.0,543.0,543.0,Half2,0,21.0,0,4,2.0,0,09:03,MIA 46,7,75.0,"(9:03) (Shotgun) 4-D.Watson pass incomplete deep right to 15-W.Fuller. HOU-15-W.Fuller was injured during the play. His return is Probable. PENALTY on MIA-28-B.McCain, Defensive Pass Interference, 38 yards, enforced at MIA 46 - No Play. Penalty on MIA-25-X.Howard, Illegal Contact, declined. Penalty on MIA-28-B.McCain, Defensive Holding, declined.",no_play,0.0,1,0,0.0,0,0,0,,,,,,,,,,,1,2,0.0,,,,,1.0,2.0,35,23,35.0,23.0,12.0,35.0,23.0,12.0,0.090958833694458,0.0774507001042366,0.0008701146580278,0.109265044331551,0.307458698749542,0.004259729757905,0.409736841917038,0.0,0.0,2.80010580923408,2.5315991131356,15.074015633367,-15.074015633367,4.68451200413983,-4.68451200413983,15.3616441232351,-15.3616441232351,,,0.0,0.0,1.01820906100329,-1.01820906100329,-2.32341473398265,2.32341473398265,-7.9480561769451,7.9480561769451,21.3193733002607,-21.3193733002607,0.965656280517578,0.0343437194824219,0.965656280517578,0.0343437194824219,0.0096879601478576,0.0077821016311645,0.0077821016311645,0.975344240665436,0.0246557593345642,0.981581568717957,0.981581568717957,0.153837214384386,-0.153837214384386,0.570841699805117,-0.570841699805117,,,0.0,0.0,0.078377650201645,-0.078377650201645,-0.0470728102366827,0.0470728102366827,0.0343386690023805,-0.0343386690023805,0.439991219784746,-0.439991219784746,0.0,0.0,0.0,1.0,0.0,0.0,0.0,0.0,0.0,0,0.0,0.0,0.0,0.0,0.0,0.0,0.0,0.0,0.0,0.0,0.0,0.0,0.0,0.0,0.0,0.0,1.0,0.0,0.0,0.0,0.0,0.0,0.0,0.0,0.0,0.0,0.0,0.0,0.0,0.0,0.0,0.0,0.0,0.0,0.0,0.0,0.0,0.0,0.0,0.0,0.0,,,,,,,,,,,,,,,,,,,,,,,,,,,,,,,,,,,,,,,,,,,,,,,,,,,,,,,,,,,,,,,,,,,,,,0.0,,,,,,,,,,,,,,,,,,,,,,,,,,,,,,,,0.0,MIA,00-0031587,B.McCain,38.0,0,,Defensive Pass Interference,0.0,0.0,0.0,0.0,,,2018,,,44,1,First down,3552,"10/25/18, 20:22:48",2018-10-26T03:13:32Z,NRG Stadium,"Cloudy Temp: 66° F, Humidity: 70%, Wind: NNW 6 mph",10012018-1025-008d-3997-8e3b45fb4607,0,0,PENALTY,0,,,,21,Touchdown,2018-10-26T03:10:05Z,6.0,3:52,3.0,1.0,1.0,4.0,4.0,43.0,KICKOFF,TOUCHDOWN,11:26,07:34,HOU 25,MIA 2,3436.0,3672.0,23,42,Home,19,65,7.5,45.0,0,closed,astroturf,,,Bill O'Brien,Adam Gase,HOU00,NRG Stadium,0,1.0,D.Watson,4.0,,,W.Fuller,15.0,1,0,1.0,0,1,00-0033537,,00-0033127,D.Watson,4.0,00-0033537,,,W.Fuller,00-0033127,0,0,2.5315991131356,,,,,,0.511440515518189,48.8559484481812,2018-10-25,W.Fuller,2018,REG,HOU,8,00-0033127,WR,Will Fuller,Will,Fuller,,,,Hip,,Full Participation in Practice,2018-10-24T14:04:22Z,2018-10-24 14:04:22
3541,2018_06_SF_GB,2018101500,GB,SF,REG,6,GB,home,SF,SF,20.0,2018-10-15,129.0,129.0,129.0,Half2,0,22.0,0,4,2.0,0,02:09,SF 20,10,58.0,(2:09) (Shotgun) 12-A.Rodgers pass short right to 80-J.Graham to SF 16 for 4 yards (29-J.Tartt). SF-29-J.Tartt was injured during the play.,pass,4.0,1,0,1.0,0,0,0,short,right,5.0,-1.0,,,,,,,0,3,0.0,,,,,0.0,3.0,23,30,23.0,30.0,-7.0,23.0,30.0,-7.0,0.258515208959579,0.0059663970023393,0.0002626037166919,0.0184829831123352,0.276407450437546,0.0018390831537544,0.438526302576065,0.0,0.0,3.75477935542585,-0.216449969331734,-6.66915251004738,6.66915251004738,-4.8069434861675,4.8069434861675,-5.66772955090258,5.66772955090258,0.0514977846760303,-0.267947754007764,0.0514977846760303,-0.267947754007764,-1.0993449134985,1.0993449134985,7.56477651148452,-7.56477651148452,12.5259488722077,-12.5259488722077,-16.3918719944077,16.3918719944077,0.209969028830528,0.790030971169472,0.209969028830528,0.790030971169472,-0.0091897696256637,-0.0065027028322219,-0.0065027028322219,0.200779259204865,0.799220740795136,0.239281222224236,0.239281222224236,-0.0488953878629407,0.0488953878629407,-0.232584010882622,0.232584010882622,0.0,-0.0091897696256637,0.0,-0.0091897696256637,0.0027279814477254,-0.0027279814477254,0.0714972765614644,-0.0714972765614644,0.0027279814477254,-0.0027279814477254,-0.224693462116514,0.224693462116514,0.0,0.0,0.0,0.0,0.0,0.0,0.0,0.0,0.0,0,0.0,0.0,0.0,0.0,0.0,0.0,0.0,0.0,0.0,0.0,0.0,0.0,0.0,0.0,1.0,0.0,0.0,0.0,0.0,0.0,0.0,0.0,0.0,1.0,0.0,0.0,0.0,0.0,0.0,0.0,0.0,0.0,0.0,0.0,0.0,1.0,0.0,0.0,0.0,0.0,0.0,00-0023459,A.Rodgers,4.0,00-0027696,J.Graham,4.0,,,,,,,,,,,,,,,,,,,,,,,,,,,,,,,,,,,,,,,,,,,,,,SF,,00-0032057,,J.Tartt,,,,,,,,,,,,,,0.0,,,,,,,,,,,,,,,,,,,,,,,,,,,,,,,,0.0,,,,,0,,,0.0,0.0,0.0,0.0,,,2018,0.750151336193085,24.9848663806915,54,1,Touchdown,3541,"10/15/18, 20:15:19",2018-10-16T03:07:56Z,Lambeau Field,"Clear Temp: 37° F, Humidity: 55%, Wind: W 5 mph",10012018-1015-0055-3d37-3dc9a5c73b15,0,0,PASS,0,,,,21,Touchdown,2018-10-16T03:06:26Z,4.0,1:05,2.0,1.0,1.0,4.0,4.0,0.0,PUNT,TOUCHDOWN,03:00,01:55,GB 42,SF 16,3495.0,3606.0,30,33,Home,3,63,9.0,46.5,0,outdoors,grass,37.0,5.0,Mike McCarthy,Kyle Shanahan,GNB00,Lambeau Field,0,0.0,A.Rodgers,12.0,,,J.Graham,80.0,1,0,0.0,0,1,00-0023459,,00-0027696,A.Rodgers,12.0,00-0023459,J.Graham,00-0027696,J.Graham,00-0027696,0,0,-0.216449969331734,0.619358726824866,3.34883144916967,2.0,0.984306054306217,0.267662966740318,0.922995924949646,7.7004075050354,2018-10-15,J.Tartt,2018,REG,SF,6,00-0032057,S,Jaquiski Tartt,Jaquiski,Tartt,,,,Shoulder,,Full Participation in Practice,2018-10-13T13:11:13Z,2018-10-13 13:11:13
3534,2018_06_LA_DEN,2018101409,DEN,LA,REG,6,LA,away,DEN,LA,75.0,2018-10-14,534.0,534.0,534.0,Half2,0,20.0,0,4,1.0,0,08:54,LA 25,10,72.0,(8:54) 30-T.Gurley left end to LA 34 for 9 yards (51-T.Davis). LA-77-A.Whitworth was injured during the play. His return is Probable.,run,9.0,0,0,0.0,0,0,0,,,,,left,end,,,,,3,3,0.0,,,,,3.0,3.0,13,20,20.0,13.0,7.0,20.0,13.0,7.0,0.159027129411697,0.121992707252502,0.002247930271551,0.201905146241188,0.189435735344887,0.0024126190692186,0.32297870516777,0.0,0.0,1.05017337435856,0.649382277391851,-12.2865757987462,12.2865757987462,-16.9152410166571,16.9152410166571,2.3736350710084,-2.3736350710084,,,0.0,0.0,-0.706886522006244,0.706886522006244,2.51956796756713,-2.51956796756713,10.1204171425197,-10.1204171425197,-7.98091780368427,7.98091780368427,0.876721024513245,0.123278975486755,0.123278975486755,0.876721024513245,0.0162906646728516,0.0084955692291259,-0.0084955692291259,0.106988310813904,0.893011689186096,0.932452142238617,0.0675478577613831,-0.386595829683902,0.386595829683902,-0.142131181241845,0.142131181241845,,,0.0,0.0,-0.0553253367543221,0.0553253367543221,0.0033286346179496,-0.0033286346179496,-0.0587428882718086,0.0587428882718086,-0.0708355249780167,0.0708355249780167,0.0,0.0,0.0,0.0,0.0,0.0,0.0,0.0,0.0,0,0.0,0.0,0.0,0.0,0.0,0.0,0.0,0.0,0.0,0.0,0.0,0.0,0.0,0.0,1.0,0.0,0.0,0.0,0.0,0.0,0.0,0.0,1.0,0.0,0.0,0.0,0.0,0.0,0.0,0.0,0.0,0.0,0.0,0.0,0.0,0.0,0.0,0.0,0.0,0.0,0.0,,,,,,,00-0032241,T.Gurley,9.0,,,,,,,,,,,,,,,,,,,,,,,,,,,,,,,,,,,,,,,,,,,DEN,,00-0031427,,T.Davis,,,,,,,,,,,,,,0.0,,,,,,,,,,,,,,,,,,,,,,,,,,,,,,,,0.0,,,,,0,,,0.0,0.0,0.0,0.0,,,2018,,,51,1,First down,3534,"10/14/18, 16:05:31",2018-10-14T22:53:01Z,Empower Field at Mile High,"Mostly Cloudy Temp: 25° F, Humidity: 76%, Wind: North East 6 mph",10012018-1014-0912-6041-c0b629ce8fe1,0,0,RUSH,0,,,,20,Field goal,2018-10-14T22:52:18Z,13.0,5:39,4.0,1.0,1.0,4.0,4.0,0.0,KICKOFF,FIELD_GOAL,08:54,03:15,LA 25,DEN 3,3509.0,3865.0,23,20,Home,-3,43,-7.0,50.0,0,outdoors,grass,25.0,6.0,Vance Joseph,Sean McVay,DEN00,Sports Authority Field at Mile High,0,1.0,,,T.Gurley,30.0,,,0,1,0.0,0,1,,00-0032241,,T.Gurley,30.0,00-0032241,T.Gurley,00-0032241,T.Gurley,00-0032241,0,1,0.649382277391851,,,,,,0.375106066465378,-37.5106066465378,2018-10-14,A.Whitworth,2018,REG,LA,6,00-0024270,T,Andrew Whitworth,Andrew,Whitworth,,,,Not Injury Related,,Full Participation in Practice,2018-10-12T12:41:04Z,2018-10-12 12:41:04
3481,2018_01_HOU_NE,2018090905,NE,HOU,REG,1,NE,home,HOU,HOU,17.0,2018-09-09,621.0,621.0,621.0,Half2,0,22.0,0,4,3.0,0,10:21,HOU 17,14,58.0,(10:21) 84-C.Patterson left end to HOU 17 for no gain (25-K.Jackson). HOU-30-K.Johnson was injured during the play. He is Out.,run,0.0,0,0,0.0,0,0,0,,,,,left,end,,,,,1,3,0.0,,,,,1.0,3.0,24,13,24.0,13.0,11.0,24.0,13.0,11.0,0.0357253961265087,0.0227289292961359,0.0004562452377285,0.041193712502718,0.702049612998962,0.0011810940923169,0.196665018796921,0.0,0.0,3.12771089287708,-0.482238753341057,12.5456656813717,-12.5456656813717,1.08000274335182,-1.08000274335182,10.1531567954594,-10.1531567954594,,,0.0,0.0,5.81663854193175,-5.81663854193175,2.65351215354167,-2.65351215354167,-1.2987946101639,1.2987946101639,10.2257023911976,-10.2257023911976,0.951177895069122,0.0488221049308777,0.951177895069122,0.0488221049308777,-0.002546489238739,-0.0070938467979431,-0.0070938467979431,0.948631405830383,0.0513685941696167,0.973595499992371,0.973595499992371,0.16760004684329,-0.16760004684329,0.199521489783064,-0.199521489783064,,,0.0,0.0,0.0120141874361415,-0.0120141874361415,0.0920817934305447,-0.0920817934305447,0.0146103869486232,-0.0146103869486232,0.108036414566733,-0.108036414566733,0.0,0.0,0.0,0.0,0.0,1.0,0.0,0.0,0.0,0,0.0,0.0,0.0,0.0,0.0,0.0,0.0,0.0,0.0,0.0,0.0,0.0,0.0,0.0,1.0,0.0,0.0,0.0,0.0,0.0,0.0,0.0,1.0,0.0,0.0,0.0,0.0,0.0,0.0,0.0,0.0,0.0,0.0,0.0,0.0,0.0,0.0,0.0,0.0,0.0,0.0,,,,,,,00-0030578,C.Patterson,0.0,,,,,,,,,,,,,,,,,,,,,,,,,,,,,,,,,,,,,,,,,,,HOU,,00-0027872,,K.Jackson,,,,,,,,,,,,,,0.0,,,,,,,,,,,,,,,,,,,,,,,,,,,,,,,,0.0,,,,,0,,,0.0,0.0,0.0,0.0,,,2018,,,54,0,Field goal,3481,"9/9/18, 13:02:33",2018-09-09T19:33:24Z,Gillette Stadium,"Cloudy and Cool Temp: 62° F, Humidity: 61%, Wind: NE 10 mph",10012018-0909-05bf-3b8a-9544f79f2631,0,0,RUSH,0,,,,22,Field goal,,13.0,7:04,5.0,1.0,1.0,3.0,4.0,0.0,KICKOFF,FIELD_GOAL,01:52,09:48,NE 25,HOU 17,3182.0,3505.0,20,27,Home,7,47,6.0,49.5,0,outdoors,fieldturf,62.0,10.0,Bill Belichick,Bill O'Brien,BOS00,Gillette Stadium,0,0.0,,,C.Patterson,84.0,,,0,1,0.0,0,1,,00-0030578,,C.Patterson,84.0,00-0030578,C.Patterson,00-0030578,C.Patterson,00-0030578,0,1,-0.482238753341057,,,,,,0.917351901531219,-91.7351901531219,2018-09-09,K.Johnson,2018,REG,HOU,1,00-0031548,CB,Kevin Johnson,Kevin,Johnson,,,,Concussion,,Full Participation in Practice,2018-09-07T12:46:24Z,2018-09-07 12:46:24
3480,2018_05_GB_DET,2018100704,DET,GB,REG,5,DET,home,GB,GB,8.0,2018-10-07,821.0,821.0,821.0,Half2,0,17.0,0,4,1.0,1,13:41,GB 8,8,75.0,(13:41) 29-L.Blount up the middle to GB 5 for 3 yards (44-A.Morrison). GB-29-K.Brice was injured during the play.,run,3.0,0,0,0.0,0,0,0,,,,,middle,,,,,,3,3,0.0,,,,,3.0,3.0,24,14,24.0,14.0,10.0,24.0,14.0,10.0,0.0067193880677223,0.0121612185612321,0.0005160653963685,0.0158518739044666,0.259196996688843,0.0006381929852068,0.70491623878479,0.0,0.0,5.56480214372277,-0.0727370787644759,14.7720408677763,-14.7720408677763,-3.75812874303665,3.75812874303665,3.69907644686886,-3.69907644686886,,,0.0,0.0,-13.8259208943346,13.8259208943346,3.38576128240011,-3.38576128240011,-14.2523674450931,14.2523674450931,10.4863359318887,-10.4863359318887,0.942094147205353,0.0579058527946472,0.942094147205353,0.0579058527946472,-0.0063562393188476,-0.002698004245758,-0.002698004245758,0.935737907886505,0.0642620921134949,0.94998437166214,0.94998437166214,-0.0089234510982735,0.0089234510982735,0.04416632124157,-0.04416632124157,,,0.0,0.0,-0.0677602510961767,0.0677602510961767,-0.0193473361432552,0.0193473361432552,-0.0677602510961767,0.0677602510961767,0.0636230316013098,-0.0636230316013098,0.0,0.0,0.0,0.0,0.0,0.0,0.0,0.0,0.0,0,0.0,0.0,0.0,0.0,0.0,0.0,0.0,0.0,0.0,0.0,0.0,0.0,0.0,0.0,1.0,0.0,0.0,0.0,0.0,0.0,0.0,0.0,1.0,0.0,0.0,0.0,0.0,0.0,0.0,0.0,0.0,0.0,0.0,0.0,0.0,0.0,0.0,0.0,0.0,0.0,0.0,,,,,,,00-0027325,L.Blount,3.0,,,,,,,,,,,,,,,,,,,,,,,,,,,,,,,,,,,,,,,,,,,GB,,00-0032406,,A.Morrison,,,,,,,,,,,,,,0.0,,,,,,,,,,,,,,,,,,,,,,,,,,,,,,,,0.0,,,,,0,,,0.0,0.0,0.0,0.0,,,2018,,,47,1,Touchdown,3480,"10/7/18, 13:02:46",2018-10-07T19:37:43Z,Ford Field,"Controlled Climate Temp: 68° F, Humidity: 70%, Wind: mph",10012018-1007-046a-e12a-9dd4f6642d7e,0,0,RUSH,0,,,,17,Touchdown,2018-10-07T19:28:56Z,8.0,3:19,5.0,1.0,1.0,3.0,4.0,19.0,KICKOFF,TOUCHDOWN,01:14,12:55,DET 25,GB 5,3268.0,3525.0,23,31,Home,8,54,1.0,50.0,1,dome,fieldturf,,,Matt Patricia,Mike McCarthy,DET00,Ford Field,0,0.0,,,L.Blount,29.0,,,0,1,0.0,0,1,,00-0027325,,L.Blount,29.0,00-0027325,L.Blount,00-0027325,L.Blount,00-0027325,0,1,-0.0727370787644759,,,,,,0.342989146709442,-34.2989146709442,2018-10-07,K.Brice,2018,REG,GB,5,00-0032628,S,Kentrell Brice,Kentrell,Brice,Ankle,,Questionable,Ankle,,Limited Participation in Practice,2018-10-05T12:33:49Z,2018-10-05 12:33:49
3466,2018_03_OAK_MIA,2018092306,MIA,LV,REG,3,LV,away,MIA,MIA,24.0,2018-09-23,212.0,212.0,212.0,Half2,0,19.0,0,4,1.0,0,03:32,MIA 24,10,77.0,(3:32) (Shotgun) 28-D.Martin left guard to MIA 18 for 6 yards (47-K.Alonso; 28-B.McCain). MIA-28-B.McCain was injured during the play.,run,6.0,1,0,0.0,0,0,0,,,,,left,guard,,,,,3,2,0.0,,,,,2.0,3.0,21,17,17.0,21.0,-4.0,17.0,21.0,-4.0,0.15482322871685,0.0209610145539045,0.0003309250168967,0.0360197871923447,0.347445547580719,0.0009796478552743,0.439439862966538,0.0,0.0,3.80469157517655,0.575733795238193,-2.01570996841421,2.01570996841421,0.799160046648467,-0.799160046648467,-3.91658773566888,3.91658773566888,,,0.0,0.0,5.54861430433812,-5.54861430433812,-15.7490082318516,15.7490082318516,5.04555824500858,-5.04555824500858,-8.73170536494291,8.73170536494291,0.482346087694168,0.517653912305832,0.517653912305832,0.482346087694168,0.0138107538223267,-0.0001721680164337,0.0001721680164337,0.503843158483505,0.496156841516495,0.451074212789536,0.548925787210465,-0.044785807458291,0.044785807458291,-0.124877281665605,0.124877281665605,,,0.0,0.0,0.192584965293217,-0.192584965293217,-0.467584412638754,0.467584412638754,0.200764391486454,-0.200764391486454,-0.26250274116239,0.26250274116239,0.0,0.0,0.0,0.0,0.0,0.0,0.0,0.0,0.0,0,0.0,0.0,0.0,0.0,0.0,0.0,0.0,0.0,0.0,0.0,0.0,0.0,0.0,0.0,0.0,0.0,0.0,0.0,0.0,0.0,0.0,0.0,1.0,0.0,0.0,0.0,0.0,0.0,0.0,0.0,0.0,0.0,0.0,0.0,0.0,0.0,1.0,0.0,0.0,0.0,0.0,,,,,,,00-0029613,D.Martin,6.0,,,,,,,,,,,,,,,,,,,,,,,,,,,,,,,,,,,,,,,,,,,,,,,,,00-0030401,K.Alonso,MIA,00-0031587,B.McCain,MIA,,,,,,,0.0,,,,,,,,,,,,,,,,,,,,,,,,,,,,,,,,0.0,,,,,0,,,0.0,0.0,0.0,0.0,,,2018,,,47,1,First down,3466,"9/23/18, 13:02:32",2018-09-23T19:50:47Z,Hard Rock Stadium,"Partly Cloudy Temp: 90° F, Humidity: 58%, Wind: E 7 mph",10012018-0923-0698-3e53-2e8914a81231,0,0,RUSH,0,,,,19,Turnover,2018-09-23T19:43:47Z,9.0,4:24,5.0,1.0,0.0,4.0,4.0,18.0,KICKOFF,INTERCEPTION,07:18,02:54,LV 10,MIA 13,3232.0,3510.0,20,28,Home,8,48,3.0,46.0,0,outdoors,grass,90.0,7.0,Adam Gase,Jon Gruden,MIA00,Hard Rock Stadium,0,1.0,,,D.Martin,28.0,,,0,1,0.0,0,1,,00-0029613,,D.Martin,28.0,00-0029613,D.Martin,00-0029613,D.Martin,00-0029613,0,0,0.575733795238193,,,,,,0.575715065002441,-57.5715065002441,2018-09-23,B.McCain,2018,REG,MIA,3,00-0031587,CB,Bobby McCain,Bobby,McCain,,,,Knee,,Full Participation in Practice,2018-09-21T09:48:35Z,2018-09-21 09:48:35
3449,2018_15_ARI_ATL,2018121600,ATL,ARI,REG,15,ATL,home,ARI,ARI,8.0,2018-12-16,756.0,756.0,756.0,Half2,0,21.0,0,4,1.0,1,12:36,ARI 8,8,76.0,(12:36) 63-B.Garland reported in as eligible. 25-I.Smith left tackle to ARI 14 for -6 yards (91-B.Mayowa). ATL-25-I.Smith was injured during the play. His return is Questionable.,run,-6.0,0,0,0.0,0,0,0,,,,,left,tackle,,,,,3,2,0.0,,,,,3.0,2.0,33,7,33.0,7.0,26.0,33.0,7.0,26.0,0.0088855503126978,0.0152535764500499,0.0003142748610116,0.0151568166911602,0.273547947406769,0.0006932997494004,0.686148583889008,0.0,0.0,5.47258353303187,-1.31494452105835,33.2929893517263,-33.2929893517263,14.658576767426,-14.658576767426,22.5935093144237,-22.5935093144237,,,0.0,0.0,9.96813495259266,-9.96813495259266,-0.313332803780213,0.313332803780213,19.6624937853194,-19.6624937853194,-3.7576781795632,3.7576781795632,0.999905824661255,9.41753387451172e-05,0.999905824661255,9.41753387451172e-05,-9.30428504943848e-05,-5.84125518798828e-06,-5.84125518798828e-06,0.99981278181076,0.0001872181892395,0.9999920129776,0.9999920129776,0.190488352983795,-0.190488352983795,0.278051719018395,-0.278051719018395,,,0.0,0.0,0.0299711467232555,-0.0299711467232555,-0.0092239002040587,0.0092239002040587,0.0299711467232555,-0.0299711467232555,0.182304777452393,-0.182304777452393,0.0,0.0,0.0,0.0,0.0,0.0,0.0,0.0,0.0,0,0.0,0.0,0.0,0.0,0.0,0.0,0.0,0.0,0.0,0.0,0.0,0.0,0.0,0.0,1.0,0.0,0.0,1.0,0.0,0.0,0.0,0.0,1.0,0.0,0.0,0.0,0.0,0.0,0.0,0.0,0.0,0.0,0.0,0.0,0.0,0.0,0.0,0.0,0.0,0.0,0.0,,,,,,,00-0034378,I.Smith,-6.0,,,,,,,,,,,,,,,,,,,,,,,,,,,,,00-0030380,B.Mayowa,,,,,,,,,,,,,ARI,,00-0030380,,B.Mayowa,,,,,,,,,,,,,,0.0,,,,,,,,,,,,,,,,,,,,,,,,,,,,,,,,0.0,,,,,0,,,0.0,0.0,0.0,0.0,,,2018,,,51,1,Touchdown,3449,"12/16/18, 13:02:29",2018-12-16T20:33:15Z,Mercedes-Benz Stadium,"Temp: ° F, Wind: mph",10012018-1216-007d-cec8-6b562b9ad26d,0,0,RUSH,0,,,,21,Touchdown,2018-12-16T20:23:16Z,12.0,6:32,5.0,1.0,1.0,3.0,4.0,-10.0,PUNT,TOUCHDOWN,02:46,11:14,ATL 24,ARI 5,3209.0,3539.0,14,40,Home,26,54,10.0,43.5,0,closed,fieldturf,,,Dan Quinn,Steve Wilks,ATL97,Mercedes-Benz Stadium,0,0.0,,,I.Smith,25.0,,,0,1,0.0,0,1,,00-0034378,,I.Smith,25.0,00-0034378,I.Smith,00-0034378,I.Smith,00-0034378,0,1,-1.31494452105835,,,,,,0.327449023723602,-32.7449023723602,2018-12-16,I.Smith,2018,REG,ATL,15,00-0034378,RB,Ito Smith,Ito,Smith,Back,Knee,Questionable,Back,Knee,Limited Participation in Practice,2018-12-14T11:00:54Z,2018-12-14 11:00:54
3390,2018_05_IND_NE,2018100400,NE,IND,REG,5,IND,away,NE,NE,34.0,2018-10-04,864.0,864.0,864.0,Half2,0,19.0,0,4,3.0,0,14:24,NE 34,5,80.0,(14:24) (Shotgun) 12-A.Luck pass deep left to 85-E.Ebron to NE 16 for 18 yards (32-D.McCourty). IND-85-E.Ebron was injured during the play.,pass,18.0,1,0,1.0,0,0,0,deep,left,16.0,2.0,,,,,,,3,3,0.0,,,,,3.0,3.0,24,10,10.0,24.0,-14.0,10.0,24.0,-14.0,0.0259311199188232,0.0737947002053261,0.0008576211403124,0.143146112561226,0.390205532312393,0.0014824223471805,0.364582508802414,0.0,0.0,2.50053687242325,2.25047032645671,8.92558216897412,-8.92558216897412,1.38825940410607,-1.38825940410607,6.27651832838776,-6.27651832838776,2.20938473078422,0.0410855956724845,2.20938473078422,0.0410855956724845,-17.6443880040024,17.6443880040024,24.3340273804316,-24.3340273804316,-24.7514541485871,24.7514541485871,28.7921613645263,-28.7921613645263,0.0747297406196594,0.925270259380341,0.925270259380341,0.0747297406196594,0.0462645292282105,0.018162053078413,-0.018162053078413,0.87900573015213,0.12099426984787,0.0300195626914501,0.96998043730855,0.0074928253889083,-0.0074928253889083,0.261327065525703,-0.261327065525703,0.0,0.0462645292282105,0.0,0.0462645292282105,0.0029934053631175,-0.0029934053631175,0.179512641824382,-0.179512641824382,0.0025023822994578,-0.0025023822994578,0.229281283415455,-0.229281283415455,0.0,0.0,1.0,0.0,1.0,0.0,0.0,0.0,0.0,0,0.0,0.0,0.0,0.0,0.0,0.0,0.0,0.0,0.0,0.0,0.0,0.0,0.0,0.0,1.0,0.0,0.0,0.0,0.0,0.0,0.0,0.0,0.0,1.0,0.0,0.0,0.0,0.0,0.0,0.0,0.0,0.0,0.0,0.0,0.0,1.0,0.0,0.0,0.0,0.0,0.0,00-0029668,A.Luck,18.0,00-0031387,E.Ebron,18.0,,,,,,,,,,,,,,,,,,,,,,,,,,,,,,,,,,,,,,,,,,,,,,NE,,00-0027647,,D.McCourty,,,,,,,,,,,,,,0.0,,,,,,,,,,,,,,,,,,,,,,,,,,,,,,,,0.0,,,,,0,,,0.0,0.0,0.0,0.0,,,2018,0.487549781799316,51.2450218200684,50,1,First down,3390,"10/4/18, 20:22:32",2018-10-05T02:50:44Z,Gillette Stadium,"Mostly Cloudy Temp: 66° F, Humidity: 96%, Wind: SSW 6 mph",10012018-1004-00c0-953d-318746b17f05,0,0,PASS,0,,,,19,Touchdown,2018-10-05T02:43:16Z,10.0,4:38,4.0,1.0,1.0,3.0,4.0,0.0,INTERCEPTION,TOUCHDOWN,02:26,12:48,IND 20,NE 13,3199.0,3462.0,24,38,Home,14,62,10.5,49.5,0,outdoors,fieldturf,66.0,6.0,Bill Belichick,Frank Reich,BOS00,Gillette Stadium,0,1.0,A.Luck,12.0,,,E.Ebron,85.0,1,0,1.0,0,1,00-0029668,,00-0031387,A.Luck,12.0,00-0029668,E.Ebron,00-0031387,E.Ebron,00-0031387,0,1,2.25047032645671,0.336629944917036,4.16548068250995,2.0,1.0,1.0,0.938482284545898,6.15177154541016,2018-10-04,E.Ebron,2018,REG,IND,5,00-0031387,TE,Eric Ebron,Eric,Ebron,,,,Knee,,Full Participation in Practice,2018-10-03T12:48:28Z,2018-10-03 12:48:28
3367,2018_11_CIN_BAL,2018111801,BAL,CIN,REG,11,BAL,home,CIN,CIN,38.0,2018-11-18,798.0,798.0,798.0,Half2,0,19.0,0,4,2.0,0,13:18,CIN 38,9,55.0,"(13:18) (No Huddle, Shotgun) 8-L.Jackson scrambles right end pushed ob at CIN 34 for 4 yards (50-J.Evans). BAL-79-R.Stanley was injured during the play. His return is Probable.",run,4.0,1,1,1.0,0,0,1,,,,,right,end,,,,,2,2,0.0,,,,,2.0,2.0,21,21,21.0,21.0,0.0,21.0,21.0,0.0,0.0422431379556656,0.0765299499034882,0.0008435320341959,0.112764798104763,0.359959423542023,0.0052085178904235,0.402450650930405,0.0,0.0,2.88681936240755,-0.234846031991765,-0.145030732194796,0.145030732194796,10.2639930757433,-10.2639930757433,-7.63210890124312,7.63210890124312,,,0.0,0.0,2.92144305998227,-2.92144305998227,-7.33221789776413,7.33221789776413,-6.44162339845207,6.44162339845207,1.18631498047623,-1.18631498047623,0.633708119392395,0.366291880607605,0.633708119392395,0.366291880607605,-0.0137345790863037,-0.0095307230949401,-0.0095307230949401,0.619973540306091,0.380026459693909,0.683997392654419,0.683997392654419,0.274049719447995,-0.274049719447995,0.0082806989269321,-0.0082806989269321,,,0.0,0.0,-0.154111976949685,0.154111976949685,0.153245583176613,-0.153245583176613,-0.15199976715278,0.15199976715278,0.191330581903458,-0.191330581903458,0.0,0.0,0.0,0.0,0.0,0.0,0.0,0.0,0.0,0,0.0,0.0,0.0,0.0,0.0,0.0,0.0,0.0,0.0,0.0,0.0,0.0,0.0,0.0,1.0,0.0,0.0,0.0,0.0,0.0,0.0,0.0,1.0,0.0,0.0,0.0,0.0,0.0,0.0,0.0,0.0,0.0,0.0,0.0,0.0,0.0,0.0,0.0,0.0,0.0,0.0,,,,,,,00-0034796,L.Jackson,4.0,,,,,,,,,,,,,,,,,,,,,,,,,,,,,,,,,,,,,,,,,,,CIN,,00-0033790,,J.Evans,,,,,,,,,,,,,,0.0,,,,,,,,,,,,,,,,,,,,,,,,,,,,,,,,0.0,,,,,0,,,0.0,0.0,0.0,0.0,,,2018,,,47,1,First down,3367,"11/18/18, 13:02:41",2018-11-18T20:29:10Z,M&T Bank Stadium,"Cloudy Temp: 48° F, Humidity: 58%, Wind: SE 8 mph",10012018-1118-01fe-d083-4c01806b06c8,0,0,RUSH,0,,,,19,Field goal,2018-11-18T20:24:12Z,13.0,6:56,3.0,1.0,1.0,3.0,4.0,0.0,PUNT,FIELD_GOAL,00:08,08:12,BAL 39,CIN 6,3253.0,3566.0,21,24,Home,3,45,6.5,44.0,1,outdoors,grass,48.0,8.0,John Harbaugh,Marvin Lewis,BAL00,M&T Bank Stadium,0,0.0,L.Jackson,8.0,,8.0,,,1,0,0.0,0,1,00-0034796,,,L.Jackson,8.0,00-0034796,L.Jackson,00-0034796,L.Jackson,00-0034796,1,0,-0.234846031991765,,,,,,0.747080683708191,25.2919316291809,2018-11-18,R.Stanley,2018,REG,BAL,11,00-0032965,T,Ronnie Stanley,Ronnie,Stanley,Ankle,,Questionable,Ankle,,Full Participation in Practice,2018-11-16T11:39:21Z,2018-11-16 11:39:21
