play_id,game_id,old_game_id,home_team,away_team,season_type,week_x,posteam,posteam_type,defteam,side_of_field,yardline_100,game_date,quarter_seconds_remaining,half_seconds_remaining,game_seconds_remaining,game_half,quarter_end,drive,sp,qtr,down,goal_to_go,time,yrdln,ydstogo,ydsnet,desc,play_type,yards_gained,shotgun,no_huddle,qb_dropback,qb_kneel,qb_spike,qb_scramble,pass_length,pass_location,air_yards,yards_after_catch,run_location,run_gap,field_goal_result,kick_distance,extra_point_result,two_point_conv_result,home_timeouts_remaining,away_timeouts_remaining,timeout,timeout_team,td_team,td_player_name,td_player_id,posteam_timeouts_remaining,defteam_timeouts_remaining,total_home_score,total_away_score,posteam_score,defteam_score,score_differential,posteam_score_post,defteam_score_post,score_differential_post,no_score_prob,opp_fg_prob,opp_safety_prob,opp_td_prob,fg_prob,safety_prob,td_prob,extra_point_prob,two_point_conversion_prob,ep,epa,total_home_epa,total_away_epa,total_home_rush_epa,total_away_rush_epa,total_home_pass_epa,total_away_pass_epa,air_epa,yac_epa,comp_air_epa,comp_yac_epa,total_home_comp_air_epa,total_away_comp_air_epa,total_home_comp_yac_epa,total_away_comp_yac_epa,total_home_raw_air_epa,total_away_raw_air_epa,total_home_raw_yac_epa,total_away_raw_yac_epa,wp,def_wp,home_wp,away_wp,wpa,vegas_wpa,vegas_home_wpa,home_wp_post,away_wp_post,vegas_wp,vegas_home_wp,total_home_rush_wpa,total_away_rush_wpa,total_home_pass_wpa,total_away_pass_wpa,air_wpa,yac_wpa,comp_air_wpa,comp_yac_wpa,total_home_comp_air_wpa,total_away_comp_air_wpa,total_home_comp_yac_wpa,total_away_comp_yac_wpa,total_home_raw_air_wpa,total_away_raw_air_wpa,total_home_raw_yac_wpa,total_away_raw_yac_wpa,punt_blocked,first_down_rush,first_down_pass,first_down_penalty,third_down_converted,third_down_failed,fourth_down_converted,fourth_down_failed,incomplete_pass,touchback,interception,punt_inside_twenty,punt_in_endzone,punt_out_of_bounds,punt_downed,punt_fair_catch,kickoff_inside_twenty,kickoff_in_endzone,kickoff_out_of_bounds,kickoff_downed,kickoff_fair_catch,fumble_forced,fumble_not_forced,fumble_out_of_bounds,solo_tackle,safety,penalty,tackled_for_loss,fumble_lost,own_kickoff_recovery,own_kickoff_recovery_td,qb_hit,rush_attempt,pass_attempt,sack,touchdown,pass_touchdown,rush_touchdown,return_touchdown,extra_point_attempt,two_point_attempt,field_goal_attempt,kickoff_attempt,punt_attempt,fumble,complete_pass,assist_tackle,lateral_reception,lateral_rush,lateral_return,lateral_recovery,passer_player_id,passer_player_name,passing_yards,receiver_player_id,receiver_player_name,receiving_yards,rusher_player_id,rusher_player_name,rushing_yards,lateral_receiver_player_id,lateral_receiver_player_name,lateral_receiving_yards,lateral_rusher_player_id,lateral_rusher_player_name,lateral_rushing_yards,lateral_sack_player_id,lateral_sack_player_name,interception_player_id,interception_player_name,lateral_interception_player_id,lateral_interception_player_name,punt_returner_player_id,punt_returner_player_name,lateral_punt_returner_player_id,lateral_punt_returner_player_name,kickoff_returner_player_name,kickoff_returner_player_id,lateral_kickoff_returner_player_id,lateral_kickoff_returner_player_name,punter_player_id,punter_player_name,kicker_player_name,kicker_player_id,own_kickoff_recovery_player_id,own_kickoff_recovery_player_name,blocked_player_id,blocked_player_name,tackle_for_loss_1_player_id,tackle_for_loss_1_player_name,tackle_for_loss_2_player_id,tackle_for_loss_2_player_name,qb_hit_1_player_id,qb_hit_1_player_name,qb_hit_2_player_id,qb_hit_2_player_name,forced_fumble_player_1_team,forced_fumble_player_1_player_id,forced_fumble_player_1_player_name,forced_fumble_player_2_team,forced_fumble_player_2_player_id,forced_fumble_player_2_player_name,solo_tackle_1_team,solo_tackle_2_team,solo_tackle_1_player_id,solo_tackle_2_player_id,solo_tackle_1_player_name,solo_tackle_2_player_name,assist_tackle_1_player_id,assist_tackle_1_player_name,assist_tackle_1_team,assist_tackle_2_player_id,assist_tackle_2_player_name,assist_tackle_2_team,assist_tackle_3_player_id,assist_tackle_3_player_name,assist_tackle_3_team,assist_tackle_4_player_id,assist_tackle_4_player_name,assist_tackle_4_team,tackle_with_assist,tackle_with_assist_1_player_id,tackle_with_assist_1_player_name,tackle_with_assist_1_team,tackle_with_assist_2_player_id,tackle_with_assist_2_player_name,tackle_with_assist_2_team,pass_defense_1_player_id,pass_defense_1_player_name,pass_defense_2_player_id,pass_defense_2_player_name,fumbled_1_team,fumbled_1_player_id,fumbled_1_player_name,fumbled_2_player_id,fumbled_2_player_name,fumbled_2_team,fumble_recovery_1_team,fumble_recovery_1_yards,fumble_recovery_1_player_id,fumble_recovery_1_player_name,fumble_recovery_2_team,fumble_recovery_2_yards,fumble_recovery_2_player_id,fumble_recovery_2_player_name,sack_player_id,sack_player_name,half_sack_1_player_id,half_sack_1_player_name,half_sack_2_player_id,half_sack_2_player_name,return_team,return_yards,penalty_team,penalty_player_id,penalty_player_name,penalty_yards,replay_or_challenge,replay_or_challenge_result,penalty_type,defensive_two_point_attempt,defensive_two_point_conv,defensive_extra_point_attempt,defensive_extra_point_conv,safety_player_name,safety_player_id,season_x,cp,cpoe,series,series_success,series_result,order_sequence,start_time,time_of_day,stadium,weather,nfl_api_id,play_clock,play_deleted,play_type_nfl,special_teams_play,st_play_type,end_clock_time,end_yard_line,fixed_drive,fixed_drive_result,drive_real_start_time,drive_play_count,drive_time_of_possession,drive_first_downs,drive_inside20,drive_ended_with_score,drive_quarter_start,drive_quarter_end,drive_yards_penalized,drive_start_transition,drive_end_transition,drive_game_clock_start,drive_game_clock_end,drive_start_yard_line,drive_end_yard_line,drive_play_id_started,drive_play_id_ended,away_score,home_score,location,result,total,spread_line,total_line,div_game,roof,surface,temp,wind,home_coach,away_coach,stadium_id,game_stadium,aborted_play,success,passer,passer_jersey_number,rusher,rusher_jersey_number,receiver,receiver_jersey_number,pass,rush,first_down,special,play,passer_id,rusher_id,receiver_id,name,jersey_number,id,fantasy_player_name,fantasy_player_id,fantasy,fantasy_id,out_of_bounds,home_opening_kickoff,qb_epa,xyac_epa,xyac_mean_yardage,xyac_median_yardage,xyac_success,xyac_fd,xpass,pass_oe,date_x,injured_player,season_y,game_type,team,week_y,gsis_id,position,full_name,first_name,last_name,report_primary_injury,report_secondary_injury,report_status,practice_primary_injury,practice_secondary_injury,practice_status,date_modified,date_y
4878,2015_07_NO_IND,2015102507,IND,NO,REG,7,NO,away,IND,NO,58.0,2015-10-25,172.0,172.0,172.0,Half2,0,33.0,0,4,2.0,0,02:52,NO 42,15,23.0,(2:52) (Shotgun) 9-D.Brees pass short left to 83-W.Snead to IND 47 for 11 yards (21-V.Davis; 32-C.Anderson). IND-21-V.Davis was injured during the play.,pass,11.0,1,0,1.0,0,0,0,short,left,7.0,4.0,,,,,,,0,2,0.0,,,,,2.0,0.0,21,27,27.0,21.0,6.0,27.0,21.0,6.0,0.688590049743652,0.0461403802037239,0.0010149837471544,0.0645895302295685,0.105758525431156,0.0015111399115994,0.0923954099416733,0.0,0.0,0.37448790599592,0.303050079499371,-10.4636363392699,10.4636363392699,-5.0718491509906,5.0718491509906,-7.03459091193508,7.03459091193508,-0.219287806423381,0.522337885922752,-0.219287806423381,0.522337885922752,12.0113458558917,-12.0113458558917,-8.26425666440628,8.26425666440628,10.9577760883549,-10.9577760883549,-14.6369711875159,14.6369711875159,0.888221681118012,0.111778318881989,0.111778318881989,0.888221681118012,0.0669476985931397,0.0650967955589294,-0.0650967955589294,0.0448306202888489,0.955169379711151,0.89896023273468,0.10103976726532,0.0024334960851054,-0.0024334960851054,-0.463317079496003,0.463317079496003,0.0012652277946472,0.0656824707984924,0.0012652277946472,0.0656824707984924,-0.0728165563195944,0.0728165563195944,-0.288533164214707,0.288533164214707,-0.0542060490697622,0.0542060490697622,-0.384920936569936,0.384920936569936,0.0,0.0,0.0,0.0,0.0,0.0,0.0,0.0,0.0,0,0.0,0.0,0.0,0.0,0.0,0.0,0.0,0.0,0.0,0.0,0.0,0.0,0.0,0.0,0.0,0.0,0.0,0.0,0.0,0.0,0.0,0.0,0.0,1.0,0.0,0.0,0.0,0.0,0.0,0.0,0.0,0.0,0.0,0.0,0.0,1.0,1.0,0.0,0.0,0.0,0.0,00-0020531,D.Brees,11.0,00-0030663,W.Snead,11.0,,,,,,,,,,,,,,,,,,,,,,,,,,,,,,,,,,,,,,,,,,,,,,,,,,,,00-0027001,V.Davis,IND,00-0026578,C.Anderson,IND,,,,,,,0.0,,,,,,,,,,,,,,,,,,,,,,,,,,,,,,,,0.0,,,,,0,,,0.0,0.0,0.0,0.0,,,2015,0.724894464015961,27.5105535984039,61,1,First down,4878,"10/25/15, 13:03:00",2015-10-25T20:29:43Z,Lucas Oil Stadium,"Mostly cloudy Temp: 55° F, Humidity: 56%, Wind: NNE 12 mph",10012015-1025-0792-1af1-054486f404ef,0,0,PASS,0,,,,32,End of half,2015-10-25T20:26:14Z,6.0,3:05,1.0,0.0,0.0,4.0,4.0,-5.0,KICKOFF,END_GAME,03:05,00:00,NO 47,IND 29,4774.0,5027.0,27,21,Home,-6,48,5.5,52.5,0,open,fieldturf,,,Chuck Pagano,Sean Payton,IND00,Lucas Oil Stadium,0,1.0,D.Brees,9.0,,,W.Snead,83.0,1,0,0.0,0,1,00-0020531,,00-0030663,D.Brees,9.0,00-0020531,W.Snead,00-0030663,W.Snead,00-0030663,0,0,0.303050079499371,0.403035827536173,3.68489262655203,2.0,0.442352204350755,0.123021068749949,0.301868289709091,69.8131710290909,2015-10-25,V.Davis,2015,REG,IND,7,00-0027001,CB,Vontae Davis,Vontae,Davis,,,,Not Injury Related,,Full Participation in Practice,2015-10-23T11:50:00Z,2015-10-23 11:50:00
4722,2015_06_CHI_DET,2015101800,DET,CHI,REG,6,CHI,away,DET,CHI,79.0,2015-10-18,639.0,639.0,639.0,Overtime,0,23.0,0,5,3.0,0,10:39,CHI 21,10,9.0,"(10:39) (Shotgun) 6-J.Cutler pass short middle to 83-M.Bennett to CHI 31 for 10 yards (57-J.Bynes). The Replay Official reviewed the first down ruling, and the play was REVERSED. (Shotgun) 6-J.Cutler pass short middle to 83-M.Bennett to CHI 30 for 9 yards (57-J.Bynes). CHI-83-M.Bennett was injured during the play.",pass,9.0,1,0,1.0,0,0,0,short,middle,4.0,5.0,,,,,,,2,2,0.0,,,,,2.0,2.0,34,34,34.0,34.0,0.0,34.0,34.0,0.0,0.113959938287735,0.201887428760529,0.0040162662044167,0.274960398674011,0.16226752102375,0.001455764984712,0.241452634334564,0.0,0.0,-0.358535076025873,-0.063968293601647,-5.21931563272281,5.21931563272281,7.78719644677094,-7.78719644677094,-3.08234737272622,3.08234737272622,-1.01555929379538,0.95159100019373,-1.01555929379538,0.95159100019373,10.405559133098,-10.405559133098,-10.2578130974725,10.2578130974725,-4.66026731996681,4.66026731996681,7.17616840476226,-7.17616840476226,0.405175920343027,0.594824079656974,0.594824079656974,0.405175920343027,-0.0234191926429048,-0.0234191926429048,0.0234191926429048,0.618243272299878,0.381756727700122,0.405175920343027,0.594824079656974,0.200813456910523,-0.200813456910523,-0.0754841845238794,0.0754841845238794,0.0093934873584657,-0.0328126800013706,0.0093934873584657,-0.0328126800013706,0.24685622423345,-0.24685622423345,0.236573729547672,-0.236573729547672,0.119178255879485,-0.119178255879485,0.107291351188906,-0.107291351188906,0.0,0.0,0.0,0.0,0.0,1.0,0.0,0.0,0.0,0,0.0,0.0,0.0,0.0,0.0,0.0,0.0,0.0,0.0,0.0,0.0,0.0,0.0,0.0,1.0,0.0,0.0,0.0,0.0,0.0,0.0,0.0,0.0,1.0,0.0,0.0,0.0,0.0,0.0,0.0,0.0,0.0,0.0,0.0,0.0,1.0,0.0,0.0,0.0,0.0,0.0,00-0024226,J.Cutler,9.0,00-0026201,M.Bennett,9.0,,,,,,,,,,,,,,,,,,,,,,,,,,,,,,,,,,,,,,,,,,,,,,DET,,00-0028278,,J.Bynes,,,,,,,,,,,,,,0.0,,,,,,,,,,,,,,,,,,,,,,,,,,,,,,,,0.0,,,,,1,reversed,,0.0,0.0,0.0,0.0,,,2015,0.782563447952271,21.743655204773,63,0,Punt,4722,"10/18/15, 13:02:56",2015-10-18T20:37:27Z,Ford Field,"Controlled Climate Temp: 68° F, Humidity: 70%, Wind: mph",10012015-1018-0079-6d6c-e0a083d5cbb0,0,0,PASS,0,,,,23,Punt,2015-10-18T20:33:14Z,3.0,1:16,0.0,0.0,0.0,5.0,5.0,0.0,PUNT,PUNT,11:18,10:02,CHI 21,CHI 30,4617.0,4792.0,34,37,Home,3,71,3.5,45.0,1,dome,fieldturf,,,Jim Caldwell,John Fox,DET00,Ford Field,0,0.0,J.Cutler,6.0,,,M.Bennett,83.0,1,0,0.0,0,1,00-0024226,,00-0026201,J.Cutler,6.0,00-0024226,M.Bennett,00-0026201,M.Bennett,00-0026201,0,1,-0.063968293601647,1.11377452139195,5.0556098021334,3.0,0.292733006586786,0.292733006586786,0.978857457637787,2.11425423622131,2015-10-18,M.Bennett,2015,REG,CHI,6,00-0026201,TE,Martellus Bennett,Martellus,Bennett,Quadricep,,Questionable,Quadricep,,Did Not Participate In Practice,2015-10-16T12:13:02Z,2015-10-16 12:13:02
4639,2015_07_NO_IND,2015102507,IND,NO,REG,7,IND,home,NO,NO,41.0,2015-10-25,211.0,211.0,211.0,Half2,0,32.0,0,4,1.0,0,03:31,NO 41,10,80.0,(3:31) (Shotgun) 12-A.Luck pass incomplete short right to 44-A.Bradshaw (94-C.Jordan). NO-59-D.Ellerbe was injured during the play.,pass,0.0,1,0,1.0,0,0,0,short,right,1.0,,,,,,,,1,2,0.0,,,,,1.0,2.0,14,27,14.0,27.0,-13.0,14.0,27.0,-13.0,0.332313239574432,0.0328813381493092,0.0002842014073394,0.038557693362236,0.243291676044464,0.0033826895523816,0.349289149045944,0.0,0.0,2.81254817976151,-0.404570146056358,-15.0513074490131,15.0513074490131,-6.11606388940709,6.11606388940709,-11.3235627987306,11.3235627987306,-0.453673644340597,0.0491034982842393,0.0,0.0,8.38748589914758,-8.38748589914758,-9.3889760224265,9.3889760224265,5.14973607508,-5.14973607508,-13.1179030610365,13.1179030610365,0.0425885021686554,0.957411497831345,0.0425885021686554,0.957411497831345,-0.0111762061715126,-0.0074043087661266,-0.0074043087661266,0.0314122959971428,0.968587704002857,0.0509989224374294,0.0509989224374294,-0.0069566792574543,0.0069566792574543,-0.476510104293979,0.476510104293979,0.0,-0.0111762061715126,0.0,0.0,-0.0597966481000185,0.0597966481000185,-0.322684783990539,0.322684783990539,-0.0411861408501864,0.0411861408501864,-0.411133869587488,0.411133869587488,0.0,0.0,0.0,0.0,0.0,0.0,0.0,0.0,1.0,0,0.0,0.0,0.0,0.0,0.0,0.0,0.0,0.0,0.0,0.0,0.0,0.0,0.0,0.0,0.0,0.0,0.0,0.0,0.0,0.0,0.0,0.0,0.0,1.0,0.0,0.0,0.0,0.0,0.0,0.0,0.0,0.0,0.0,0.0,0.0,0.0,0.0,0.0,0.0,0.0,0.0,00-0029668,A.Luck,,00-0025637,A.Bradshaw,,,,,,,,,,,,,,,,,,,,,,,,,,,,,,,,,,,,,,,,,,,,,,,,,,,,,,,,,,,,,,,,,0.0,,,,,,,00-0027962,C.Jordan,,,,,,,,,,,,,,,,,,,,,,,,0.0,,,,,0,,,0.0,0.0,0.0,0.0,,,2015,0.817149043083191,-81.7149043083191,59,1,First down,4639,"10/25/15, 13:03:00",2015-10-25T20:20:37Z,Lucas Oil Stadium,"Mostly cloudy Temp: 55° F, Humidity: 56%, Wind: NNE 12 mph",10012015-1025-0792-1af1-054486f404ef,0,0,PASS,0,,,,31,Touchdown,2015-10-25T20:18:59Z,7.0,0:54,3.0,1.0,1.0,4.0,4.0,0.0,PUNT,TOUCHDOWN,03:59,03:05,IND 20,NO 8,4574.0,4757.0,27,21,Home,-6,48,5.5,52.5,0,open,fieldturf,,,Chuck Pagano,Sean Payton,IND00,Lucas Oil Stadium,0,0.0,A.Luck,12.0,,,A.Bradshaw,44.0,1,0,0.0,0,1,00-0029668,,00-0025637,A.Luck,12.0,00-0029668,A.Bradshaw,00-0025637,A.Bradshaw,00-0025637,0,0,-0.404570146056358,0.781147477158329,6.35275649093092,5.0,0.604691040527541,0.253226862114389,0.96657782793045,3.34221720695496,2015-10-25,D.Ellerbe,2015,REG,NO,7,00-0026857,LB,Dannell Ellerbe,Dannell,Ellerbe,Hip,,Probable,Hip,,Limited Participation in Practice,2015-10-23T12:53:05Z,2015-10-23 12:53:05
4533,2015_18_PIT_CIN,2016010901,CIN,PIT,POST,18,PIT,away,CIN,PIT,91.0,2016-01-09,83.0,83.0,83.0,Half2,0,28.0,0,4,1.0,0,01:23,PIT 9,10,74.0,(1:23) PIT Ro (Shotgun) 7-B.Roethlisberger pass short right to 10-M.Bryant to PIT 17 for 8 yards (57-V.Rey; 37-C.Lewis-Harris). CIN-29-L.Hall was injured during the play.,pass,8.0,1,0,1.0,0,0,0,short,right,-3.0,11.0,,,,,,,2,3,0.0,,,,,3.0,2.0,16,15,15.0,16.0,-1.0,15.0,16.0,-1.0,0.574154317378998,0.110100008547306,0.0271259006112814,0.0664185136556625,0.15686360001564,0.0008141522994264,0.0645235404372215,0.0,0.0,0.0744024652522057,0.330368161201477,-1.43385835301834,1.43385835301834,-7.38355536731239,7.38355536731239,1.01093176322761,-1.01093176322761,-0.579832983785309,0.910201144986786,-0.579832983785309,0.910201144986786,11.2464318034763,-11.2464318034763,-5.40922193008439,5.40922193008439,3.99809104253654,-3.99809104253654,-0.793400965488233,0.793400965488233,0.360512614250183,0.639487385749817,0.639487385749817,0.360512614250183,0.0512705743312836,0.0404641330242157,-0.0404641330242157,0.588216811418533,0.411783188581467,0.403939723968506,0.596060276031494,-0.425721319546645,0.425721319546645,0.251723966985941,-0.251723966985941,0.0080942809581756,0.0431762933731079,0.0080942809581756,0.0431762933731079,0.253283979577944,-0.253283979577944,0.0466953212916851,-0.0466953212916851,0.287015380544588,-0.287015380544588,0.112020559102297,-0.112020559102297,0.0,0.0,0.0,0.0,0.0,0.0,0.0,0.0,0.0,0,0.0,0.0,0.0,0.0,0.0,0.0,0.0,0.0,0.0,0.0,0.0,0.0,0.0,0.0,0.0,0.0,0.0,0.0,0.0,0.0,0.0,0.0,0.0,1.0,0.0,0.0,0.0,0.0,0.0,0.0,0.0,0.0,0.0,0.0,0.0,1.0,1.0,0.0,0.0,0.0,0.0,00-0022924,B.Roethlisberger,8.0,00-0031373,M.Bryant,8.0,,,,,,,,,,,,,,,,,,,,,,,,,,,,,,,,,,,,,,,,,,,,,,,,,,,,00-0027245,V.Rey,CIN,00-0029696,C.Lewis-Harris,CIN,,,,,,,0.0,,,,,,,,,,,,,,,,,,,,,,,,,,,,,,,,0.0,,,,,0,,,0.0,0.0,0.0,0.0,,,2015,0.865783751010895,13.4216248989105,59,1,First down,4533,"1/9/16, 20:15:38",2016-01-10T04:39:16Z,Paycor Stadium,"Light Drizzle Temp: 51° F, Humidity: 82%, Wind: SE 5 mph",10012016-0109-011b-b01b-f0cc372d3e51,0,0,PASS,0,,,,28,Field goal,2016-01-10T04:39:16Z,9.0,1:09,5.0,1.0,1.0,4.0,4.0,30.0,FUMBLE,FIELD_GOAL,01:23,00:14,PIT 9,CIN 17,4533.0,4886.0,18,16,Home,-2,34,-2.0,46.0,1,outdoors,fieldturf,51.0,5.0,Marvin Lewis,Mike Tomlin,CIN00,Paul Brown Stadium,0,1.0,B.Roethlisberger,7.0,,,M.Bryant,10.0,1,0,0.0,0,1,00-0022924,,00-0031373,B.Roethlisberger,7.0,00-0022924,M.Bryant,00-0031373,M.Bryant,00-0031373,0,0,0.330368161201477,0.724517384613063,9.56975501896522,8.0,0.568539353087544,0.225875848904252,0.803659379482269,19.6340620517731,2016-01-09,L.Hall,2015,WC,CIN,18,00-0025405,CB,Leon Hall,Leon,Hall,Concussion,Back,Probable,Concussion,Back,Full Participation in Practice,2016-01-08T08:41:46Z,2016-01-08 08:41:46
4451,2015_10_DET_GB,2015111501,GB,DET,REG,10,GB,home,DET,DET,23.0,2015-11-15,40.0,40.0,40.0,Half2,0,25.0,0,4,2.0,0,00:40,DET 23,10,73.0,"(:40) (No Huddle, Shotgun) 12-A.Rodgers pass incomplete short right to 82-R.Rodgers [94-E.Ansah]. DET-30-J.Wilson was injured during the play. PENALTY on DET-94-E.Ansah, Roughing the Passer, 12 yards, enforced at DET 23 - No Play.",no_play,0.0,1,1,0.0,0,0,0,,,,,,,,,,,1,0,0.0,,,,,1.0,0.0,10,18,10.0,18.0,-8.0,10.0,18.0,-8.0,0.320602864027023,0.0123573131859303,0.0002992499503307,0.0063352640718221,0.457744181156158,0.0005553786759264,0.202105715870857,0.0,0.0,2.70706602395512,1.22211971576326,-6.04289350549569,6.04289350549569,5.44011993403547,-5.44011993403547,-5.02132217621205,5.02132217621205,,,0.0,0.0,1.30876866780454,-1.30876866780454,4.96121463808219,-4.96121463808219,22.975805726106,-22.975805726106,-24.246346129427,24.246346129427,0.146781846880913,0.853218153119087,0.146781846880913,0.853218153119087,0.0538688898086548,0.0836164057254791,0.0836164057254791,0.200650736689568,0.799349263310432,0.272679775953293,0.272679775953293,0.002851516008377,-0.002851516008377,-0.370485904997951,0.370485904997951,,,0.0,0.0,-0.366321961766846,0.366321961766846,0.31480760872364,-0.31480760872364,-0.36560232508815,0.36560232508815,0.091331921517849,-0.091331921517849,0.0,0.0,0.0,1.0,0.0,0.0,0.0,0.0,0.0,0,0.0,0.0,0.0,0.0,0.0,0.0,0.0,0.0,0.0,0.0,0.0,0.0,0.0,0.0,0.0,0.0,1.0,0.0,0.0,0.0,0.0,0.0,0.0,0.0,0.0,0.0,0.0,0.0,0.0,0.0,0.0,0.0,0.0,0.0,0.0,0.0,0.0,0.0,0.0,0.0,0.0,,,,,,,,,,,,,,,,,,,,,,,,,,,,,,,,,,,,,,,,,,,,,,,,,,,,,,,,,,,,,,,,,,,,,,0.0,,,,,,,,,,,,,,,,,,,,,,,,,,,,,,,,0.0,DET,00-0030059,E.Ansah,12.0,0,,Roughing the Passer,0.0,0.0,0.0,0.0,,,2015,,,57,1,First down,4451,"11/15/15, 13:04:45",2015-11-15T21:26:10Z,Lambeau Field,"Temp: 55° F, Humidity: 59%, Wind: South 7 mph",10012015-1115-0179-bf6b-a76203df3377,0,0,PENALTY,0,,,,25,Touchdown,2015-11-15T21:12:30Z,8.0,1:25,5.0,1.0,1.0,4.0,4.0,12.0,KICKOFF,TOUCHDOWN,01:57,00:32,GB 27,DET 11,4163.0,4539.0,18,16,Home,-2,34,10.5,50.0,1,outdoors,grass,55.0,7.0,Mike McCarthy,Jim Caldwell,GNB00,Lambeau Field,0,1.0,A.Rodgers,12.0,,,R.Rodgers,82.0,1,0,1.0,0,1,00-0023459,,00-0031384,A.Rodgers,12.0,00-0023459,,,R.Rodgers,00-0031384,0,1,1.22211971576326,,,,,,0.981697738170624,1.83022618293762,2015-11-15,J.Wilson,2015,REG,DET,10,00-0025442,CB,Josh Wilson,Josh,Wilson,Neck,,Probable,Neck,,Full Participation in Practice,2015-11-13T12:57:19Z,2015-11-13 12:57:19
4419,2015_07_HOU_MIA,2015102502,MIA,HOU,REG,7,HOU,away,MIA,MIA,5.0,2015-10-25,249.0,249.0,249.0,Half2,0,27.0,0,4,1.0,1,04:09,MIA 5,5,80.0,(4:09) (Shotgun) 7-B.Hoyer pass incomplete short right to 85-N.Washington. HOU-23-A.Foster was injured during the play. He is Out.,pass,0.0,1,0,1.0,0,0,0,short,right,-3.0,,,,,,,,3,1,0.0,,,,,1.0,3.0,44,20,20.0,44.0,-24.0,20.0,44.0,-24.0,0.0650371536612511,0.0068652434274554,0.0002135048271156,0.0111088724806905,0.193592578172684,0.0011409049620851,0.722041726112366,0.0,0.0,5.53856677992735,-0.436992801289307,18.5904114034363,-18.5904114034363,5.95341737417039,-5.95341737417039,15.9230562991435,-15.9230562991435,-1.01891172892647,0.581918927637162,0.0,0.0,-21.9288342311047,21.9288342311047,15.752339218976,-15.752339218976,-31.5576487821527,31.5576487821527,51.0348626317429,-51.0348626317429,0.0020059309899807,0.997994069010019,0.997994069010019,0.0020059309899807,0.0005096092354506,-4.91818063892424e-05,4.91818063892424e-05,0.997484459774569,0.0025155402254313,0.0004671594651881,0.999532840534812,0.100881089589695,-0.100881089589695,0.335299218070031,-0.335299218070031,0.0,0.0005096092354506,0.0,0.0,0.0007928307433765,-0.0007928307433765,0.213998028458701,-0.213998028458701,0.0007636410275161,-0.0007636410275161,0.336432759358102,-0.336432759358102,0.0,0.0,0.0,0.0,0.0,0.0,0.0,0.0,1.0,0,0.0,0.0,0.0,0.0,0.0,0.0,0.0,0.0,0.0,0.0,0.0,0.0,0.0,0.0,0.0,0.0,0.0,0.0,0.0,0.0,0.0,0.0,0.0,1.0,0.0,0.0,0.0,0.0,0.0,0.0,0.0,0.0,0.0,0.0,0.0,0.0,0.0,0.0,0.0,0.0,0.0,00-0026625,B.Hoyer,,00-0023367,N.Washington,,,,,,,,,,,,,,,,,,,,,,,,,,,,,,,,,,,,,,,,,,,,,,,,,,,,,,,,,,,,,,,,,0.0,,,,,,,,,,,,,,,,,,,,,,,,,,,,,,,,0.0,,,,,0,,,0.0,0.0,0.0,0.0,,,2015,0.832117319107056,-83.2117319107056,61,1,Touchdown,4419,"10/25/15, 13:02:51",2015-10-25T20:07:36Z,Hard Rock Stadium,"Cloudy Temp: 84° F, Humidity: 62%, Wind: ESE 13 mph",10012015-1025-027f-2acd-5b3d86a08dad,0,0,PASS,0,,,,27,Touchdown,2015-10-25T19:58:53Z,12.0,3:41,6.0,1.0,1.0,4.0,4.0,5.0,KICKOFF,TOUCHDOWN,07:41,04:00,HOU 20,MIA 5,4075.0,4464.0,26,44,Home,18,70,4.5,46.5,0,outdoors,grass,84.0,13.0,Joe Philbin,Bill O'Brien,MIA00,Sun Life Stadium,0,0.0,B.Hoyer,7.0,,,N.Washington,85.0,1,0,0.0,0,1,00-0026625,,00-0023367,B.Hoyer,7.0,00-0026625,N.Washington,00-0023367,N.Washington,00-0023367,0,0,-0.436992801289307,1.45362664216535,5.44349815341411,7.0,0.587418279843405,0.426126322941855,0.743101477622986,25.6898522377014,2015-10-25,A.Foster,2015,REG,HOU,7,00-0026796,RB,Arian Foster,Arian,Foster,Groin,,Probable,Groin,,Full Participation in Practice,2015-10-23T11:11:44Z,2015-10-23 11:11:44
4152,2015_07_NYJ_NE,2015102503,NE,NYJ,REG,7,NYJ,away,NE,NYJ,59.0,2015-10-25,60.0,60.0,60.0,Half2,0,20.0,0,4,1.0,0,01:00,NYJ 41,10,43.0,(1:00) (Shotgun) 14-R.Fitzpatrick pass short right to 15-B.Marshall pushed ob at NE 47 for 12 yards (26-L.Ryan). NYJ-66-W.Colon was injured during the play. NYJ-74-N.Mangold was injured during the play.,pass,12.0,1,0,1.0,0,0,0,short,right,12.0,0.0,,,,,,,3,2,0.0,,,,,2.0,3.0,30,20,20.0,30.0,-10.0,20.0,30.0,-10.0,0.517244398593903,0.0404863208532333,0.0005742447683587,0.0274289008229971,0.273386180400848,0.0006044549518264,0.140275537967682,0.0,0.0,1.48868645902257,0.799689593433868,6.46343257433963,-6.46343257433963,3.47194695967482,-3.47194695967482,-2.92964801671347,2.92964801671347,0.799689593433868,0.0,0.799689593433868,0.0,-2.83881680556806,2.83881680556806,-0.831298992387019,0.831298992387019,-11.6875020124717,11.6875020124717,9.11981614209234,-9.11981614209234,0.0274020023643971,0.972597997635603,0.972597997635603,0.0274020023643971,0.012096107006073,0.0071580205112695,-0.0071580205112695,0.96050189062953,0.03949810937047,0.016864376142621,0.983135623857379,0.15909964674786,-0.15909964674786,0.127418934934594,-0.127418934934594,0.012096107006073,0.0,0.012096107006073,0.0,0.0360786161437108,-0.0360786161437108,0.0250826985605664,-0.0250826985605664,0.034246415929444,-0.034246415929444,0.069574563301415,-0.069574563301415,0.0,0.0,1.0,0.0,0.0,0.0,0.0,0.0,0.0,0,0.0,0.0,0.0,0.0,0.0,0.0,0.0,0.0,0.0,0.0,0.0,0.0,0.0,0.0,1.0,0.0,0.0,0.0,0.0,0.0,0.0,0.0,0.0,1.0,0.0,0.0,0.0,0.0,0.0,0.0,0.0,0.0,0.0,0.0,0.0,1.0,0.0,0.0,0.0,0.0,0.0,00-0023682,R.Fitzpatrick,12.0,00-0024334,B.Marshall,12.0,,,,,,,,,,,,,,,,,,,,,,,,,,,,,,,,,,,,,,,,,,,,,,NE,,00-0030411,,L.Ryan,,,,,,,,,,,,,,0.0,,,,,,,,,,,,,,,,,,,,,,,,,,,,,,,,0.0,,,,,0,,,0.0,0.0,0.0,0.0,,,2015,0.609119892120361,39.0880107879639,57,1,First down,4152,"10/25/15, 13:02:45",,Gillette Stadium,"Cloudy Temp: 58° F, Humidity: 80%, Wind: SW 9 mph",10012015-1025-0386-dab6-14b831453467,0,0,PASS,0,,,,20,Field goal,2015-10-25T20:04:31Z,6.0,0:55,3.0,0.0,1.0,4.0,4.0,-5.0,KICKOFF,FIELD_GOAL,01:13,00:18,NYJ 20,NE 37,4069.0,4293.0,23,30,Home,7,53,7.0,47.0,1,outdoors,fieldturf,58.0,9.0,Bill Belichick,Todd Bowles,BOS00,Gillette Stadium,0,1.0,R.Fitzpatrick,14.0,,,B.Marshall,15.0,1,0,1.0,0,1,00-0023682,,00-0024334,R.Fitzpatrick,14.0,00-0023682,B.Marshall,00-0024334,B.Marshall,00-0024334,1,0,0.799689593433868,0.202999485643933,2.99053937019198,1.0,1.0,0.997862452117261,0.98990672826767,1.00932717323303,2015-10-25,W.Colon,2015,REG,NYJ,7,00-0024193,G,Willie Colon,Willie,Colon,Knee,,Questionable,Knee,,Limited Participation in Practice,2015-10-23T12:41:39Z,2015-10-23 12:41:39
4124,2015_06_CHI_DET,2015101800,DET,CHI,REG,6,DET,home,CHI,CHI,6.0,2015-10-18,77.0,77.0,77.0,Half2,0,20.0,0,4,1.0,1,01:17,CHI 6,6,66.0,(1:17) (Shotgun) 25-T.Riddick up the middle to CHI 2 for 4 yards (90-J.Ratliff). CHI-90-J.Ratliff was injured during the play.,run,4.0,1,0,0.0,0,0,0,,,,,middle,,,,,,0,3,0.0,,,,,0.0,3.0,27,31,27.0,31.0,-4.0,27.0,31.0,-4.0,0.146466210484505,0.0030073807574808,0.0002329817361896,0.0188767742365599,0.125692486763001,0.0012331305770203,0.704491019248962,0.0,0.0,5.16935533078504,0.380171856842935,-3.15447940277041,3.15447940277041,7.92807859447985,-7.92807859447985,-0.568076515371358,0.568076515371358,,,0.0,0.0,7.90238706348464,-7.90238706348464,-10.0425946512551,10.0425946512551,-11.2611515928293,11.2611515928293,14.2947149468335,-14.2947149468335,0.586930394172669,0.413069605827332,0.586930394172669,0.413069605827332,0.0441712141036987,0.0323720574378967,0.0323720574378967,0.631101608276367,0.368898391723633,0.546290874481201,0.546290874481201,0.217403683817806,-0.217403683817806,0.0571830869678447,-0.0571830869678447,,,0.0,0.0,-0.0842385398682168,0.0842385398682168,0.291840419173241,-0.291840419173241,-0.0842385398682168,0.0842385398682168,0.243915997445583,-0.243915997445583,0.0,0.0,0.0,0.0,0.0,0.0,0.0,0.0,0.0,0,0.0,0.0,0.0,0.0,0.0,0.0,0.0,0.0,0.0,0.0,0.0,0.0,0.0,0.0,1.0,0.0,0.0,0.0,0.0,0.0,0.0,0.0,1.0,0.0,0.0,0.0,0.0,0.0,0.0,0.0,0.0,0.0,0.0,0.0,0.0,0.0,0.0,0.0,0.0,0.0,0.0,,,,,,,00-0030107,T.Riddick,4.0,,,,,,,,,,,,,,,,,,,,,,,,,,,,,,,,,,,,,,,,,,,CHI,,00-0023656,,J.Ratliff,,,,,,,,,,,,,,0.0,,,,,,,,,,,,,,,,,,,,,,,,,,,,,,,,0.0,,,,,0,,,0.0,0.0,0.0,0.0,,,2015,,,54,1,First down,4124,"10/18/15, 13:02:56",2015-10-18T20:09:43Z,Ford Field,"Controlled Climate Temp: 68° F, Humidity: 70%, Wind: mph",10012015-1018-0079-6d6c-e0a083d5cbb0,0,0,RUSH,0,,,,20,Touchdown,2015-10-18T20:06:14Z,5.0,2:02,4.0,1.0,1.0,4.0,4.0,-4.0,PUNT,TOUCHDOWN,02:23,00:21,DET 34,CHI 6,4059.0,4253.0,34,37,Home,3,71,3.5,45.0,1,dome,fieldturf,,,Jim Caldwell,John Fox,DET00,Ford Field,0,1.0,,,T.Riddick,25.0,,,0,1,0.0,0,1,,00-0030107,,T.Riddick,25.0,00-0030107,T.Riddick,00-0030107,T.Riddick,00-0030107,0,1,0.380171856842935,,,,,,0.672425270080566,-67.2425270080566,2015-10-18,J.Ratliff,2015,REG,CHI,6,00-0023656,DT,Jay Ratliff,Jay,Ratliff,Ankle,,Questionable,Ankle,,Limited Participation in Practice,2015-10-16T12:13:44Z,2015-10-16 12:13:44
4071,2015_03_BUF_MIA,2015092712,MIA,BUF,REG,3,MIA,home,BUF,BUF,30.0,2015-09-27,148.0,148.0,148.0,Half2,0,22.0,0,4,1.0,0,02:28,BUF 30,10,81.0,(2:28) (Shotgun) 29-J.Gray left tackle to BUF 19 for 11 yards (20-C.Graham). MIA-51-M.Pouncey was injured during the play. His return is Probable.,run,11.0,1,0,0.0,0,0,0,,,,,left,tackle,,,,,3,2,0.0,,,,,3.0,2.0,14,41,14.0,41.0,-27.0,14.0,41.0,-27.0,0.195054352283478,0.0295706894248724,0.0002633298863656,0.0293850116431713,0.328265964984894,0.0028412761166691,0.414619356393814,0.0,0.0,3.59788213239517,0.734041402931325,-28.0716104938349,28.0716104938349,8.34276143121518,-8.34276143121518,-32.7105973829331,32.7105973829331,,,0.0,0.0,-0.0194437092503317,0.0194437092503317,-7.11665880229918,7.11665880229918,8.05221320727302,-8.05221320727302,-40.0330744096813,40.0330744096813,0.0001034936722135,0.999896506327786,0.0001034936722135,0.999896506327786,2.33111786656082e-05,6.03158696321771e-06,6.03158696321771e-06,0.0001268048508791,0.999873195149121,5.82337597734295e-05,5.82337597734295e-05,-0.0441112830449129,0.0441112830449129,-0.548193315134812,0.548193315134812,,,0.0,0.0,0.0175814008675517,-0.0175814008675517,-0.334132801173109,0.334132801173109,0.016574425097555,-0.016574425097555,-0.566906775264032,0.566906775264032,0.0,1.0,0.0,0.0,0.0,0.0,0.0,0.0,0.0,0,0.0,0.0,0.0,0.0,0.0,0.0,0.0,0.0,0.0,0.0,0.0,0.0,0.0,0.0,1.0,0.0,0.0,0.0,0.0,0.0,0.0,0.0,1.0,0.0,0.0,0.0,0.0,0.0,0.0,0.0,0.0,0.0,0.0,0.0,0.0,0.0,0.0,0.0,0.0,0.0,0.0,,,,,,,00-0029104,J.Gray,11.0,,,,,,,,,,,,,,,,,,,,,,,,,,,,,,,,,,,,,,,,,,,BUF,,00-0025555,,C.Graham,,,,,,,,,,,,,,0.0,,,,,,,,,,,,,,,,,,,,,,,,,,,,,,,,0.0,,,,,0,,,0.0,0.0,0.0,0.0,,,2015,,,56,1,First down,4071,"9/27/15, 16:25:40",2015-09-27T23:24:43Z,Hard Rock Stadium,"Mostly Cloudy Temp: 87° F, Humidity: 65%, Wind: SE 6 mph",10012015-0927-12d5-5263-d525fdd2eaec,0,0,RUSH,0,,,,22,Turnover on downs,2015-09-27T23:18:26Z,14.0,6:27,5.0,1.0,0.0,4.0,4.0,-5.0,KICKOFF,DOWNS,06:46,00:19,MIA 13,BUF 6,3866.0,4221.0,41,14,Home,-27,55,1.0,43.5,1,outdoors,grass,87.0,6.0,Joe Philbin,Rex Ryan,MIA00,Sun Life Stadium,0,1.0,,,J.Gray,29.0,,,0,1,1.0,0,1,,00-0029104,,J.Gray,29.0,00-0029104,J.Gray,00-0029104,J.Gray,00-0029104,0,1,0.734041402931325,,,,,,0.770472407341003,-77.0472407341003,2015-09-27,M.Pouncey,2015,REG,MIA,3,00-0027953,C,Mike Pouncey,Mike,Pouncey,Elbow,,Probable,Elbow,,Limited Participation in Practice,2015-09-25T10:34:21Z,2015-09-25 10:34:21
3989,2015_12_SD_JAX,2015112906,JAX,LAC,REG,12,JAX,home,LAC,LAC,43.0,2015-11-29,231.0,231.0,231.0,Half2,0,21.0,0,4,1.0,0,03:51,LAC 43,10,60.0,"(3:51) (Shotgun) 5-B.Bortles pass incomplete deep left to 88-A.Hurns. JAX-88-A.Hurns was injured during the play. He is Out. San Diego challenged the incomplete pass ruling, and the play was Upheld. The ruling on the field stands. (Timeout #2.)",pass,0.0,1,0,1.0,0,0,0,deep,left,17.0,,,,,,,,2,1,1.0,LAC,,,,2.0,1.0,19,31,19.0,31.0,-12.0,19.0,31.0,-12.0,0.330698579549789,0.0452528148889542,0.0002970925415866,0.0494142509996891,0.237320736050606,0.00484234187752,0.332174152135849,0.0,0.0,2.56461357010994,-0.46909062913619,-9.72162264796658,9.72162264796658,-3.19755204445571,3.19755204445571,-10.3112772857481,10.3112772857481,1.15720806579338,-1.62629869492957,0.0,0.0,-14.0250029779841,14.0250029779841,5.60715249011992,-5.60715249011992,-9.91902325599087,9.91902325599087,-2.8157335878423,2.8157335878423,0.0688048973679543,0.931195102632046,0.0688048973679543,0.931195102632046,-0.0105055905878544,-0.010319784283638,-0.010319784283638,0.0582993067800999,0.9417006932199,0.0813273265957832,0.0813273265957832,-0.102692782878876,0.102692782878876,-0.179877279569231,0.179877279569231,0.0,-0.0105055905878544,0.0,0.0,-0.297482986973459,0.297482986973459,0.266604135540338,-0.266604135540338,-0.292195876167948,0.292195876167948,0.133369928953262,-0.133369928953262,0.0,0.0,0.0,0.0,0.0,0.0,0.0,0.0,1.0,0,0.0,0.0,0.0,0.0,0.0,0.0,0.0,0.0,0.0,0.0,0.0,0.0,0.0,0.0,0.0,0.0,0.0,0.0,0.0,0.0,0.0,0.0,0.0,1.0,0.0,0.0,0.0,0.0,0.0,0.0,0.0,0.0,0.0,0.0,0.0,0.0,0.0,0.0,0.0,0.0,0.0,00-0031407,B.Bortles,,00-0030821,A.Hurns,,,,,,,,,,,,,,,,,,,,,,,,,,,,,,,,,,,,,,,,,,,,,,,,,,,,,,,,,,,,,,,,,0.0,,,,,,,,,,,,,,,,,,,,,,,,,,,,,,,,0.0,,,,,1,upheld,,0.0,0.0,0.0,0.0,,,2015,0.561550855636597,-56.1550855636597,57,1,First down,3989,"11/29/15, 13:03:03",2015-11-29T20:53:51Z,EverBank Stadium,"Temp: 75° F, Humidity: 60%, Wind: NE 8 mph",10012015-1129-069c-06d3-0dad881b31ba,0,0,PASS,0,,,,21,Turnover on downs,2015-11-29T20:51:53Z,11.0,2:44,3.0,0.0,0.0,4.0,4.0,0.0,KICKOFF,DOWNS,04:45,02:01,JAX 20,LAC 29,3902.0,4189.0,31,25,Home,-6,56,5.0,47.0,0,outdoors,grass,75.0,8.0,Gus Bradley,Mike McCoy,JAX00,EverBank Field,0,0.0,B.Bortles,5.0,,,A.Hurns,88.0,1,0,0.0,0,1,00-0031407,,00-0030821,B.Bortles,5.0,00-0031407,A.Hurns,00-0030821,A.Hurns,00-0030821,0,0,-0.46909062913619,0.304395928319852,3.4815963387955,2.0,1.0,1.0,0.944967865943909,5.50321340560913,2015-11-29,A.Hurns,2015,REG,JAX,12,00-0030821,WR,Allen Hurns,Allen,Hurns,Thigh,Foot,Probable,Thigh,Foot,Limited Participation in Practice,2015-11-27T08:15:30Z,2015-11-27 08:15:30
3947,2015_06_NYG_PHI,2015101900,PHI,NYG,REG,6,PHI,home,NYG,NYG,44.0,2015-10-19,682.0,682.0,682.0,Half2,0,25.0,0,4,2.0,0,11:22,NYG 44,7,40.0,"(11:22) (No Huddle, Shotgun) 29-D.Murray up the middle to NYG 42 for 2 yards (78-M.Kuhn; 54-J.Casillas). NYG-54-J.Casillas was injured during the play. He is Out.",run,2.0,1,1,0.0,0,0,0,,,,,middle,,,,,,3,2,0.0,,,,,3.0,2.0,24,7,24.0,7.0,17.0,24.0,7.0,17.0,0.0680492222309113,0.0900177210569382,0.0011142721632495,0.114517048001289,0.308321833610535,0.0037988796830177,0.414181023836136,0.0,0.0,2.75792938354425,-0.529993494041264,18.6520606435159,-18.6520606435159,6.35734068154125,-6.35734068154125,11.7102224427565,-11.7102224427565,,,0.0,0.0,7.19235707930056,-7.19235707930056,-0.530156332883053,0.530156332883053,22.4144284353242,-22.4144284353242,-15.154363028123,15.154363028123,0.99149078130722,0.0085092186927795,0.99149078130722,0.0085092186927795,5.7220458984375e-05,0.0001766085624694,0.0001766085624694,0.991548001766205,0.0084519982337951,0.992348313331604,0.992348313331604,0.17951508510732,-0.17951508510732,0.271185089574336,-0.271185089574336,,,0.0,0.0,0.127835589052044,-0.127835589052044,-0.104453682013255,0.104453682013255,0.126299458146893,-0.126299458146893,0.0513955225798252,-0.0513955225798252,0.0,0.0,0.0,0.0,0.0,0.0,0.0,0.0,0.0,0,0.0,0.0,0.0,0.0,0.0,0.0,0.0,0.0,0.0,0.0,0.0,0.0,0.0,0.0,0.0,0.0,0.0,0.0,0.0,0.0,0.0,0.0,1.0,0.0,0.0,0.0,0.0,0.0,0.0,0.0,0.0,0.0,0.0,0.0,0.0,0.0,1.0,0.0,0.0,0.0,0.0,,,,,,,00-0028009,D.Murray,2.0,,,,,,,,,,,,,,,,,,,,,,,,,,,,,,,,,,,,,,,,,,,,,,,,,00-0029312,M.Kuhn,NYG,00-0026832,J.Casillas,NYG,,,,,,,0.0,,,,,,,,,,,,,,,,,,,,,,,,,,,,,,,,0.0,,,,,0,,,0.0,0.0,0.0,0.0,,,2015,,,58,1,First down,3947,"10/19/15, 20:30:33",2015-10-20T03:10:28Z,Lincoln Financial Field,"Clear Temp: 44° F, Humidity: 49%, Wind: SSW 6 mph",10012015-1019-0028-3da4-ea0c5b8c7af5,0,0,RUSH,0,,,,25,Field goal,2015-10-20T03:08:14Z,10.0,5:16,2.0,0.0,1.0,4.0,4.0,0.0,PUNT,FIELD_GOAL,13:35,08:19,PHI 40,NYG 20,3863.0,4061.0,7,27,Home,20,34,3.5,50.5,1,outdoors,grass,44.0,6.0,Chip Kelly,Tom Coughlin,PHI00,Lincoln Financial Field,0,0.0,,,D.Murray,29.0,,,0,1,0.0,0,1,,00-0028009,,D.Murray,29.0,00-0028009,D.Murray,00-0028009,D.Murray,00-0028009,0,0,-0.529993494041264,,,,,,0.505305469036102,-50.5305469036102,2015-10-19,J.Casillas,2015,REG,NYG,6,00-0026832,LB,Jonathan Casillas,Jonathan,Casillas,Calf,,Questionable,Calf,,Limited Participation in Practice,2015-10-17T09:52:43Z,2015-10-17 09:52:43
3919,2015_17_NE_MIA,2016010301,MIA,NE,REG,17,MIA,home,NE,NE,27.0,2016-01-03,153.0,153.0,153.0,Half2,0,22.0,0,4,1.0,0,02:33,NE 27,10,44.0,(2:33) (Shotgun) 23-J.Ajayi right end to NE 29 for -2 yards (91-J.Collins). MIA-75-J.Douglas was injured during the play. His return is Questionable.,run,-2.0,1,0,0.0,0,0,0,,,,,right,end,,,,,3,3,0.0,,,,,3.0,3.0,17,10,17.0,10.0,7.0,17.0,10.0,7.0,0.173186182975769,0.0268938578665257,0.00027579269954,0.0289141181856394,0.337640374898911,0.0020694329869002,0.4310202896595,0.0,0.0,3.7505700319889,-0.692225221719127,8.67230163356052,-8.67230163356052,-5.220033008546,5.220033008546,17.3852379981287,-17.3852379981287,,,0.0,0.0,20.2541041205404,-20.2541041205404,0.594216364901513,-0.594216364901513,28.1961035415297,-28.1961035415297,-12.1148761416228,12.1148761416228,0.958047151565552,0.0419528484344482,0.958047151565552,0.0419528484344482,-0.0109295845031738,-0.0176087021827698,-0.0176087021827698,0.947117567062378,0.0528824329376221,0.934616029262543,0.934616029262543,-0.190348317340945,0.190348317340945,0.632827437547592,-0.632827437547592,,,0.0,0.0,0.391946508613972,-0.391946508613972,0.365120768547058,-0.365120768547058,0.387221290794758,-0.387221290794758,0.212591201066971,-0.212591201066971,0.0,0.0,0.0,0.0,0.0,0.0,0.0,0.0,0.0,0,0.0,0.0,0.0,0.0,0.0,0.0,0.0,0.0,0.0,0.0,0.0,0.0,0.0,0.0,1.0,0.0,0.0,1.0,0.0,0.0,0.0,0.0,1.0,0.0,0.0,0.0,0.0,0.0,0.0,0.0,0.0,0.0,0.0,0.0,0.0,0.0,0.0,0.0,0.0,0.0,0.0,,,,,,,00-0031590,J.Ajayi,-2.0,,,,,,,,,,,,,,,,,,,,,,,,,,,,,00-0030421,J.Collins,,,,,,,,,,,,,NE,,00-0030421,,J.Collins,,,,,,,,,,,,,,0.0,,,,,,,,,,,,,,,,,,,,,,,,,,,,,,,,0.0,,,,,0,,,0.0,0.0,0.0,0.0,,,2015,,,50,1,First down,3919,"1/3/16, 13:02:52",2016-01-03T20:52:12Z,Hard Rock Stadium,"Cloudy Temp: 80° F, Humidity: 65%, Wind: North 7 mph",10012016-0103-01bf-f74d-c8c2d7203c16,0,0,RUSH,0,,,,22,Field goal,2016-01-03T20:50:01Z,9.0,2:45,2.0,1.0,1.0,4.0,4.0,0.0,PUNT,FIELD_GOAL,04:41,01:56,NE 45,NE 1,3849.0,4098.0,10,20,Home,10,30,-10.0,46.5,1,outdoors,grass,80.0,7.0,Joe Philbin,Bill Belichick,MIA00,Sun Life Stadium,0,0.0,,,J.Ajayi,23.0,,,0,1,0.0,0,1,,00-0031590,,J.Ajayi,23.0,00-0031590,J.Ajayi,00-0031590,J.Ajayi,00-0031590,0,1,-0.692225221719127,,,,,,0.091649703681469,-9.1649703681469,2016-01-03,J.Douglas,2015,REG,MIA,17,00-0031575,G,Jamil Douglas,Jamil,Douglas,Ankle,,Questionable,Ankle,,Limited Participation in Practice,2016-01-01T11:32:30Z,2016-01-01 11:32:30
3913,2015_15_GB_OAK,2015122009,LV,GB,REG,15,GB,away,LV,LV,8.0,2015-12-20,322.0,322.0,322.0,Half2,0,22.0,0,4,1.0,1,05:22,LV 8,8,21.0,(5:22) 44-J.Starks left tackle to LV 5 for 3 yards (92-S.McGee). GB-69-D.Bakhtiari was injured during the play. His return is Questionable.,run,3.0,0,0,0.0,0,0,0,,,,,left,tackle,,,,,2,1,0.0,,,,,1.0,2.0,20,27,27.0,20.0,7.0,27.0,20.0,7.0,0.0551585033535957,0.0079988436773419,0.0003103815251961,0.0123757384717464,0.311680763959885,0.0009349784813821,0.611540794372559,0.0,0.0,5.10645034606569,-0.0164820242207497,-16.3783238374604,16.3783238374604,8.66312423499767,-8.66312423499767,-12.5293890357618,12.5293890357618,,,0.0,0.0,1.60953031943063,-1.60953031943063,-0.327941263967659,0.327941263967659,0.978179705038201,-0.978179705038201,-13.6482221710515,13.6482221710515,0.946467220783234,0.0535327792167664,0.0535327792167664,0.946467220783234,0.0026946067810058,0.0054951310157775,-0.0054951310157775,0.0508381724357605,0.94916182756424,0.967622101306915,0.0323778986930847,0.112685822308141,-0.112685822308141,-0.355819326358776,0.355819326358776,,,0.0,0.0,0.114410640398402,-0.114410640398402,-0.0016441206535402,0.0016441206535402,0.112417997518916,-0.112417997518916,-0.42238379847753,0.42238379847753,0.0,0.0,0.0,0.0,0.0,0.0,0.0,0.0,0.0,0,0.0,0.0,0.0,0.0,0.0,0.0,0.0,0.0,0.0,0.0,0.0,0.0,0.0,0.0,1.0,0.0,0.0,0.0,0.0,0.0,0.0,0.0,1.0,0.0,0.0,0.0,0.0,0.0,0.0,0.0,0.0,0.0,0.0,0.0,0.0,0.0,0.0,0.0,0.0,0.0,0.0,,,,,,,00-0027791,J.Starks,3.0,,,,,,,,,,,,,,,,,,,,,,,,,,,,,,,,,,,,,,,,,,,LV,,00-0030515,,S.McGee,,,,,,,,,,,,,,0.0,,,,,,,,,,,,,,,,,,,,,,,,,,,,,,,,0.0,,,,,0,,,0.0,0.0,0.0,0.0,,,2015,,,54,0,Field goal,3913,"12/20/15, 16:05:18",2015-12-21T00:07:49Z,Oakland-Alameda County Stadium,"Cloudy Temp: 54° F, Humidity: 70%, Wind: SSE 18 mph",10012015-1220-09b6-a21a-ff512bee5b67,0,0,RUSH,0,,,,22,Field goal,2015-12-21T00:06:16Z,6.0,2:29,1.0,1.0,1.0,4.0,4.0,-10.0,PUNT,FIELD_GOAL,06:54,04:25,LV 36,LV 15,3871.0,4024.0,30,20,Home,-10,50,-4.0,47.0,0,outdoors,grass,54.0,18.0,Jack Del Rio,Mike McCarthy,OAK00,O.co Coliseum,0,0.0,,,J.Starks,44.0,,,0,1,0.0,0,1,,00-0027791,,J.Starks,44.0,00-0027791,J.Starks,00-0027791,J.Starks,00-0027791,0,1,-0.0164820242207497,,,,,,0.171927213668823,-17.1927213668823,2015-12-20,D.Bakhtiari,2015,REG,GB,15,00-0030074,T,David Bakhtiari,David,Bakhtiari,Knee,,Probable,Knee,,Limited Participation in Practice,2015-12-18T11:11:37Z,2015-12-18 11:11:37
3905,2015_12_MIA_NYJ,2015112905,NYJ,MIA,REG,12,MIA,away,NYJ,NYJ,45.0,2015-11-29,455.0,455.0,455.0,Half2,0,23.0,0,4,1.0,0,07:35,NYJ 45,10,80.0,(7:35) (Shotgun) 17-R.Tannehill pass short middle to 14-J.Landry to NYJ 23 for 22 yards (52-D.Harris). MIA-14-J.Landry was injured during the play.,pass,22.0,1,0,1.0,0,0,0,short,middle,8.0,14.0,,,,,,,2,3,0.0,,,,,3.0,2.0,35,7,7.0,35.0,-28.0,7.0,35.0,-28.0,0.140799388289452,0.0617961436510086,0.0013168753357604,0.0875379517674446,0.30769482254982,0.0017254299018532,0.399129450321198,0.0,0.0,2.91965363570489,1.33593717106851,24.5844138421547,-24.5844138421547,3.67993595378357,-3.67993595378357,18.1888838107407,-18.1888838107407,0.542442851932719,0.793494319135789,0.542442851932719,0.793494319135789,13.033430207026,-13.033430207026,-4.37234875134891,4.37234875134891,15.4271237895882,-15.4271237895882,2.92202254530275,-2.92202254530275,8.97618156159297e-05,0.999910238184384,0.999910238184384,8.97618156159297e-05,6.27949339104816e-06,1.15739167085849e-05,-1.15739167085849e-05,0.999903958690993,9.60413090069778e-05,3.50334084942006e-05,0.999964966591506,0.0525960924496758,-0.0525960924496758,0.350363725478371,-0.350363725478371,0.0,6.27949339104816e-06,0.0,6.27949339104816e-06,0.232341021139544,-0.232341021139544,-0.0130239128756243,0.0130239128756243,0.227203517992419,-0.227203517992419,0.0738034190891171,-0.0738034190891171,0.0,0.0,1.0,0.0,0.0,0.0,0.0,0.0,0.0,0,0.0,0.0,0.0,0.0,0.0,0.0,0.0,0.0,0.0,0.0,0.0,0.0,0.0,0.0,1.0,0.0,0.0,0.0,0.0,0.0,0.0,0.0,0.0,1.0,0.0,0.0,0.0,0.0,0.0,0.0,0.0,0.0,0.0,0.0,0.0,1.0,0.0,0.0,0.0,0.0,0.0,00-0029701,R.Tannehill,22.0,00-0031382,J.Landry,22.0,,,,,,,,,,,,,,,,,,,,,,,,,,,,,,,,,,,,,,,,,,,,,,NYJ,,00-0025434,,D.Harris,,,,,,,,,,,,,,0.0,,,,,,,,,,,,,,,,,,,,,,,,,,,,,,,,0.0,,,,,0,,,0.0,0.0,0.0,0.0,,,2015,0.718204319477081,28.1795680522919,53,1,First down,3905,"11/29/15, 13:02:39",2015-11-29T21:00:52Z,MetLife Stadium,"Temp: 45° F, Humidity: 44%, Wind: NNE 5 MPH mph",10012015-1129-0538-2b3f-53a18b56938b,0,0,PASS,0,,,,23,Touchdown,2015-11-29T20:56:24Z,14.0,4:38,6.0,1.0,1.0,4.0,4.0,0.0,KICKOFF,TOUCHDOWN,09:29,04:51,MIA 20,NYJ 5,3748.0,4094.0,20,38,Home,18,58,4.5,44.0,1,outdoors,fieldturf,45.0,5.0,Todd Bowles,Joe Philbin,NYC01,MetLife Stadium,0,1.0,R.Tannehill,17.0,,,J.Landry,14.0,1,0,1.0,0,1,00-0029701,,00-0031382,R.Tannehill,17.0,00-0029701,J.Landry,00-0031382,J.Landry,00-0031382,0,1,1.33593717106851,0.248475552444803,4.18335251795361,2.0,0.998695819056593,0.585721256444231,0.811319828033447,18.8680171966553,2015-11-29,J.Landry,2015,REG,MIA,12,00-0031382,WR,Jarvis Landry,Jarvis,Landry,Knee,,Questionable,Knee,,Did Not Participate In Practice,2015-11-27T11:11:09Z,2015-11-27 11:11:09
3901,2015_02_NYJ_IND,2015092100,IND,NYJ,REG,2,NYJ,away,IND,IND,28.0,2015-09-21,112.0,112.0,112.0,Half2,0,21.0,0,4,3.0,0,01:52,IND 28,12,34.0,(1:52) (Run formation) 29-B.Powell up the middle to IND 28 for no gain (96-H.Anderson). IND-52-D.Jackson was injured during the play.,run,0.0,0,0,0.0,0,0,0,,,,,middle,,,,,,0,2,0.0,,,,,2.0,0.0,7,17,17.0,7.0,10.0,17.0,7.0,10.0,0.408239752054215,0.0229297820478678,0.000355342781404,0.0242663137614727,0.475629329681397,0.0013050594134256,0.0672743692994118,0.0,0.0,1.6610544649302,0.553010090854175,-14.8351276051784,14.8351276051784,-2.46026208628156,2.46026208628156,-9.46054441472759,9.46054441472759,,,0.0,0.0,-5.41401007509558,5.41401007509558,3.83363313105656,-3.83363313105656,-4.80232394690393,4.80232394690393,-5.6915546373605,5.6915546373605,0.995882868766785,0.0041171312332153,0.0041171312332153,0.995882868766785,0.0017164349555969,0.001514732837677,-0.001514732837677,0.0024006962776184,0.997599303722382,0.99569571018219,0.00430428981781,-0.148887619376183,0.148887619376183,-0.31669912745982,0.31669912745982,,,0.0,0.0,0.0160023446228861,-0.0160023446228861,-0.0994353047400435,0.0994353047400435,0.012811827197349,-0.012811827197349,-0.353542057314487,0.353542057314487,0.0,0.0,0.0,0.0,0.0,1.0,0.0,0.0,0.0,0,0.0,0.0,0.0,0.0,0.0,0.0,0.0,0.0,0.0,0.0,0.0,0.0,0.0,0.0,1.0,0.0,0.0,0.0,0.0,0.0,0.0,0.0,1.0,0.0,0.0,0.0,0.0,0.0,0.0,0.0,0.0,0.0,0.0,0.0,0.0,0.0,0.0,0.0,0.0,0.0,0.0,,,,,,,00-0028064,B.Powell,0.0,,,,,,,,,,,,,,,,,,,,,,,,,,,,,,,,,,,,,,,,,,,IND,,00-0032269,,H.Anderson,,,,,,,,,,,,,,0.0,,,,,,,,,,,,,,,,,,,,,,,,,,,,,,,,0.0,,,,,0,,,0.0,0.0,0.0,0.0,,,2015,,,54,0,Field goal,3901,"9/21/15, 20:30:30",2015-09-22T03:26:32Z,Lucas Oil Stadium,"Clear Temp: 69° F, Humidity: 41%, Wind: NNE 7 mph",10012015-0921-008a-d4ab-0fa5e613a25a,0,0,RUSH,0,,,,21,Field goal,2015-09-22T03:18:14Z,8.0,3:38,2.0,0.0,1.0,4.0,4.0,-5.0,INTERCEPTION,FIELD_GOAL,04:35,00:57,NYJ 38,IND 28,3681.0,3947.0,20,7,Home,-13,27,6.0,45.5,0,closed,fieldturf,,,Chuck Pagano,Todd Bowles,IND00,Lucas Oil Stadium,0,1.0,,,B.Powell,29.0,,,0,1,0.0,0,1,,00-0028064,,B.Powell,29.0,00-0028064,B.Powell,00-0028064,B.Powell,00-0028064,0,0,0.553010090854175,,,,,,0.0661896243691444,-6.61896243691444,2015-09-21,D.Jackson,2015,REG,IND,2,00-0024249,LB,D'Qwell Jackson,D'Qwell,Jackson,Toe,,Probable,Toe,,Full Participation in Practice,2015-09-19T11:06:59Z,2015-09-19 11:06:59
3887,2015_08_NYG_NO,2015110106,NO,NYG,REG,8,NYG,away,NO,NO,9.0,2015-11-01,744.0,744.0,744.0,Half2,0,18.0,1,4,4.0,0,12:24,NO 9,5,80.0,"(12:24) (Shotgun) 10-E.Manning pass short middle to 17-D.Harris for 9 yards, TOUCHDOWN. NO-27-D.Swann was injured during the play. His return is Questionable. Pass 9, YAC 0",pass,9.0,1,0,1.0,0,0,0,short,middle,9.0,0.0,,,,,,,3,3,0.0,,NYG,D.Harris,00-0028114,3.0,3.0,42,34,28.0,42.0,-14.0,34.0,42.0,-8.0,0.0102449301630259,0.0144178261980414,0.0005121534341014,0.0192616451531649,0.896755337715149,0.0010858612367883,0.0577222816646099,0.0,0.0,2.91738440573681,4.08261559426319,5.93860405974952,-5.93860405974952,2.01107729645446,-2.01107729645446,11.6871989746578,-11.6871989746578,4.08261559426319,0.0,4.08261559426319,0.0,4.64473149797414,-4.64473149797414,1.73099862190429,-1.73099862190429,2.8421993983211,-2.8421993983211,4.0758025633404,-4.0758025633404,0.0815522521734238,0.918447747826576,0.918447747826576,0.0815522521734238,0.0569797840899132,0.079607614452464,-0.079607614452464,0.861467963736663,0.138532036263337,0.0626643821597099,0.93733561784029,0.156383939087391,-0.156383939087391,0.258774929312144,-0.258774929312144,0.0569797840899132,0.0,0.0569797840899132,0.0,0.247870274748472,-0.247870274748472,-0.114805549679988,0.114805549679988,0.247870274748472,-0.247870274748472,-0.102860942779773,0.102860942779773,0.0,0.0,1.0,0.0,0.0,0.0,1.0,0.0,0.0,0,0.0,0.0,0.0,0.0,0.0,0.0,0.0,0.0,0.0,0.0,0.0,0.0,0.0,0.0,0.0,0.0,0.0,0.0,0.0,0.0,0.0,0.0,0.0,1.0,0.0,1.0,1.0,0.0,0.0,0.0,0.0,0.0,0.0,0.0,0.0,1.0,0.0,0.0,0.0,0.0,0.0,00-0022803,E.Manning,9.0,00-0028114,D.Harris,9.0,,,,,,,,,,,,,,,,,,,,,,,,,,,,,,,,,,,,,,,,,,,,,,,,,,,,,,,,,,,,,,,,0.0,,,,,,,,,,,,,,,,,,,,,,,,,,,,,,,,0.0,,,,,0,,,0.0,0.0,0.0,0.0,,,2015,0.481202572584152,51.8797427415848,61,1,Touchdown,3887,"11/1/15, 13:02:43",2015-11-01T20:42:36Z,Caesars Superdome,"Rain Temp: 69° F, Humidity: 95%, Wind: E 13 mph",10012015-1101-0689-ea3a-3c00d2dacd59,0,0,PASS,0,,,,18,Touchdown,2015-11-01T20:30:43Z,11.0,3:14,6.0,1.0,1.0,3.0,4.0,28.0,KICKOFF,TOUCHDOWN,00:29,12:15,NYG 20,NO 9,3504.0,3911.0,49,52,Home,3,101,3.0,51.5,0,dome,sportturf,,,Sean Payton,Tom Coughlin,NOR00,Mercedes-Benz Superdome,0,1.0,E.Manning,10.0,,,D.Harris,17.0,1,0,1.0,0,1,00-0022803,,00-0028114,E.Manning,10.0,00-0022803,D.Harris,00-0028114,D.Harris,00-0028114,0,1,4.08261559426319,,,,,,0.97485888004303,2.51411199569702,2015-11-01,D.Swann,2015,REG,NO,8,00-0031949,CB,Damian Swann,Damian,Swann,Concussion,,Probable,Concussion,,Full Participation in Practice,2015-10-30T12:56:15Z,2015-10-30 12:56:15
3871,2015_09_WAS_NE,2015110802,NE,WAS,REG,9,WAS,away,NE,NE,19.0,2015-11-08,60.0,60.0,60.0,Half2,0,19.0,0,4,1.0,0,01:00,NE 19,10,83.0,"(1:00) (No Huddle, Shotgun) 8-K.Cousins pass short left to 25-C.Thompson to NE 6 for 13 yards (30-D.Harmon; 21-M.Butler). NE-30-D.Harmon was injured during the play.",pass,13.0,1,1,1.0,0,0,0,short,left,-2.0,15.0,,,,,,,2,2,0.0,,,,,2.0,2.0,27,3,3.0,27.0,-24.0,3.0,27.0,-24.0,0.169931039214134,0.0098675787448883,0.0003255891788285,0.0095683094114065,0.363932907581329,0.0005924779106862,0.445782095193863,0.0,0.0,4.11622626445023,1.01085515593877,20.6602155385933,-20.6602155385933,8.95932821519252,-8.95932821519252,11.656388148231,-11.656388148231,-0.660185992077459,1.67104114801623,-0.660185992077459,1.67104114801623,-5.12773333596903,5.12773333596903,11.6662424415653,-11.6662424415653,-11.9342441948471,11.9342441948471,21.6773166117445,-21.6773166117445,0.0005118662375025,0.999488133762497,0.999488133762497,0.0005118662375025,0.0004048015689477,0.000197246146854,-0.000197246146854,0.99908333219355,0.0009166678064502,0.0001776729477569,0.999822327052243,0.0990236103534698,-0.0990236103534698,0.270321454353084,-0.270321454353084,0.0,0.0004048015689477,0.0,0.0004048015689477,0.0121845148721603,-0.0121845148721603,0.19253114022084,-0.19253114022084,0.0171333693185715,-0.0171333693185715,0.206793774142884,-0.206793774142884,0.0,0.0,1.0,0.0,0.0,0.0,0.0,0.0,0.0,0,0.0,0.0,0.0,0.0,0.0,0.0,0.0,0.0,0.0,0.0,0.0,0.0,0.0,0.0,0.0,0.0,0.0,0.0,0.0,0.0,0.0,0.0,0.0,1.0,0.0,0.0,0.0,0.0,0.0,0.0,0.0,0.0,0.0,0.0,0.0,1.0,1.0,0.0,0.0,0.0,0.0,00-0029604,K.Cousins,13.0,00-0030404,C.Thompson,13.0,,,,,,,,,,,,,,,,,,,,,,,,,,,,,,,,,,,,,,,,,,,,,,,,,,,,00-0030383,D.Harmon,NE,00-0031218,M.Butler,NE,,,,,,,0.0,,,,,,,,,,,,,,,,,,,,,,,,,,,,,,,,0.0,,,,,0,,,0.0,0.0,0.0,0.0,,,2015,0.851571679115295,14.8428320884705,55,1,First down,3871,"11/8/15, 13:03:34",2015-11-08T20:51:27Z,Gillette Stadium,"Sunny Temp: 54° F, Humidity: 34%, Wind: WNW 12 mph",10012015-1108-02d8-f737-57df21a87989,0,0,PASS,0,,,,19,Touchdown,2015-11-08T20:44:51Z,12.0,3:26,7.0,1.0,1.0,4.0,4.0,3.0,PUNT,TOUCHDOWN,03:51,00:25,WAS 17,NE 3,3650.0,4015.0,10,27,Home,17,37,13.5,51.5,0,outdoors,fieldturf,54.0,12.0,Bill Belichick,Jay Gruden,BOS00,Gillette Stadium,0,1.0,K.Cousins,8.0,,,C.Thompson,25.0,1,0,1.0,0,1,00-0029604,,00-0030404,K.Cousins,8.0,00-0029604,C.Thompson,00-0030404,C.Thompson,00-0030404,0,1,1.01085515593877,1.14021694454622,8.4845380281331,7.0,0.638362565485295,0.250841469911393,0.923595011234283,7.64049887657166,2015-11-08,D.Harmon,2015,REG,NE,9,00-0030383,S,Duron Harmon,Duron,Harmon,,,,Not Injury Related,,Did Not Participate In Practice,2015-11-05T12:56:10Z,2015-11-05 12:56:10
3799,2015_14_NYG_MIA,2015121400,MIA,NYG,REG,14,NYG,away,MIA,NYG,97.0,2015-12-14,438.0,438.0,438.0,Half2,0,22.0,0,4,1.0,0,07:18,NYG 3,10,5.0,(7:18) 23-R.Jennings right guard to NYG 5 for 2 yards (79-D.Shelby). MIA-53-J.Jenkins was injured during the play. His return is Questionable.,run,2.0,0,0,0.0,0,0,0,,,,,right,guard,,,,,2,2,0.0,,,,,2.0,2.0,24,31,31.0,24.0,7.0,31.0,24.0,7.0,0.244004741311073,0.171215146780014,0.0528027899563313,0.209469169378281,0.13539083302021,0.0008024834096431,0.186314776539803,0.0,0.0,-0.373554304242134,-0.45496030873619,-9.28740341459396,9.28740341459396,14.5784682545345,-14.5784682545345,-23.6782323116822,23.6782323116822,,,0.0,0.0,-5.78604531331101,5.78604531331101,-10.1475176420707,10.1475176420707,13.9975329749065,-13.9975329749065,-37.4145050073091,37.4145050073091,0.82909768819809,0.17090231180191,0.17090231180191,0.82909768819809,-0.0113643407821655,-0.0066393017768859,0.0066393017768859,0.182266652584076,0.817733347415924,0.880004048347473,0.119995951652527,0.412071058487809,-0.412071058487809,-0.884621795358591,0.884621795358591,,,0.0,0.0,-0.169628786377752,0.169628786377752,-0.38624281586179,0.38624281586179,-0.169628786377752,0.169628786377752,-0.66965425909528,0.66965425909528,0.0,0.0,0.0,0.0,0.0,0.0,0.0,0.0,0.0,0,0.0,0.0,0.0,0.0,0.0,0.0,0.0,0.0,0.0,0.0,0.0,0.0,0.0,0.0,1.0,0.0,0.0,0.0,0.0,0.0,0.0,0.0,1.0,0.0,0.0,0.0,0.0,0.0,0.0,0.0,0.0,0.0,0.0,0.0,0.0,0.0,0.0,0.0,0.0,0.0,0.0,,,,,,,00-0027155,R.Jennings,2.0,,,,,,,,,,,,,,,,,,,,,,,,,,,,,,,,,,,,,,,,,,,MIA,,00-0029111,,D.Shelby,,,,,,,,,,,,,,0.0,,,,,,,,,,,,,,,,,,,,,,,,,,,,,,,,0.0,,,,,0,,,0.0,0.0,0.0,0.0,,,2015,,,52,0,Punt,3799,"12/14/15, 20:30:48",2015-12-15T04:21:59Z,Hard Rock Stadium,"Clear Temp: 77° F, Humidity: 78%, Wind: 6 SSE mph",10012015-1214-00bd-caed-a93113327388,0,0,RUSH,0,,,,22,Punt,2015-12-15T04:21:59Z,3.0,1:28,0.0,0.0,0.0,4.0,4.0,0.0,PUNT,PUNT,07:18,05:50,NYG 3,NYG 8,3799.0,3866.0,31,24,Home,-7,55,-2.5,47.5,0,outdoors,grass,77.0,6.0,Joe Philbin,Tom Coughlin,MIA00,Sun Life Stadium,0,0.0,,,R.Jennings,23.0,,,0,1,0.0,0,1,,00-0027155,,R.Jennings,23.0,00-0027155,R.Jennings,00-0027155,R.Jennings,00-0027155,0,1,-0.45496030873619,,,,,,0.196194842457771,-19.6194842457771,2015-12-14,J.Jenkins,2015,REG,MIA,14,00-0030384,LB,Jelani Jenkins,Jelani,Jenkins,Ankle,,Probable,Ankle,,Full Participation in Practice,2015-12-12T13:16:44Z,2015-12-12 13:16:44
3741,2015_12_MIN_ATL,2015112901,ATL,MIN,REG,12,ATL,home,MIN,MIN,2.0,2015-11-29,98.0,98.0,98.0,Half2,0,17.0,0,4,4.0,1,01:38,MIN 2,2,80.0,"(1:38) (No Huddle, Shotgun) 2-M.Ryan pass incomplete short middle to 83-J.Tamme. MIN-55-A.Barr was injured during the play. PENALTY on MIN-32-A.Exum, Defensive Holding, 1 yard, enforced at MIN 2 - No Play.",no_play,0.0,1,1,0.0,0,0,0,,,,,,,,,,,0,2,0.0,,,,,0.0,2.0,3,20,3.0,20.0,-17.0,3.0,20.0,-17.0,0.26504984498024,0.0062208361923694,0.0003680684312712,0.0148147558793426,0.455980658531189,0.0189557317644358,0.238610059022903,0.0,0.0,2.95302191568771,3.19017744850135,-15.809398228423,15.809398228423,-15.4433448939491,15.4433448939491,-2.63494416911369,2.63494416911369,,,0.0,0.0,19.0171570121893,-19.0171570121893,-13.1610537260416,13.1610537260416,19.9155566848349,-19.9155566848349,-16.2702954247662,16.2702954247662,0.0033459551632404,0.99665404483676,0.0033459551632404,0.99665404483676,0.0021681361831724,0.0012488393113017,0.0012488393113017,0.0055140913464129,0.994485908653587,0.0010262907017022,0.0010262907017022,-0.205436565339391,0.205436565339391,-0.293453852646053,0.293453852646053,,,0.0,0.0,0.101858410402201,-0.101858410402201,-0.162895093089901,0.162895093089901,0.101858410402201,-0.101858410402201,-0.291649023420177,0.291649023420177,0.0,0.0,0.0,1.0,0.0,0.0,0.0,0.0,0.0,0,0.0,0.0,0.0,0.0,0.0,0.0,0.0,0.0,0.0,0.0,0.0,0.0,0.0,0.0,0.0,0.0,1.0,0.0,0.0,0.0,0.0,0.0,0.0,0.0,0.0,0.0,0.0,0.0,0.0,0.0,0.0,0.0,0.0,0.0,0.0,0.0,0.0,0.0,0.0,0.0,0.0,,,,,,,,,,,,,,,,,,,,,,,,,,,,,,,,,,,,,,,,,,,,,,,,,,,,,,,,,,,,,,,,,,,,,,0.0,,,,,,,,,,,,,,,,,,,,,,,,,,,,,,,,0.0,MIN,00-0031267,A.Exum,1.0,0,,Defensive Holding,0.0,0.0,0.0,0.0,,,2015,,,59,1,First down,3741,"11/29/15, 13:02:44",2015-11-29T20:49:22Z,Georgia Dome,"Temp: ° F, Wind: mph",10012015-1129-011c-e84e-607a6cac9c6f,0,0,PENALTY,0,,,,17,Touchdown,2015-11-29T20:43:42Z,9.0,2:47,6.0,1.0,1.0,4.0,4.0,1.0,KICKOFF,TOUCHDOWN,04:15,01:28,ATL 20,MIN 1,3523.0,3819.0,20,10,Home,-10,30,2.0,45.0,0,dome,fieldturf,,,Dan Quinn,Mike Zimmer,ATL00,Georgia Dome,0,1.0,M.Ryan,2.0,,,J.Tamme,83.0,1,0,1.0,0,1,00-0026143,,00-0026267,M.Ryan,2.0,00-0026143,,,J.Tamme,00-0026267,0,0,3.19017744850135,,,,,,0.905929505825043,9.40704941749573,2015-11-29,A.Barr,2015,REG,MIN,12,00-0031256,LB,Anthony Barr,Anthony,Barr,Hand,,Probable,Hand,,Full Participation in Practice,2015-11-27T10:34:26Z,2015-11-27 10:34:26
3708,2015_04_NYJ_MIA,2015100400,MIA,NYJ,REG,4,MIA,home,NYJ,NYJ,20.0,2015-10-04,422.0,422.0,422.0,Half2,0,24.0,0,4,1.0,0,07:02,NYJ 20,10,31.0,(7:02) (Shotgun) 17-R.Tannehill pass incomplete deep right to 85-G.Jennings. NYJ-52-D.Harris was injured during the play. His return is Doubtful.,pass,0.0,1,0,1.0,0,0,0,deep,right,20.0,,,,,,,,3,3,0.0,,,,,3.0,3.0,14,27,14.0,27.0,-13.0,14.0,27.0,-13.0,0.0488979928195477,0.0231797657907009,0.0004089729627594,0.0370393954217434,0.369760781526566,0.0009722240502014,0.519740879535675,0.0,0.0,4.41977993818,-0.416706221061759,-9.80833838063753,9.80833838063753,-6.16989464667859,6.16989464667859,-20.1220418412626,20.1220418412626,2.58022006182,-2.99692628288176,0.0,0.0,-6.3565475297153,6.3565475297153,-7.23576805420453,7.23576805420453,-6.17357952152887,6.17357952152887,-8.98787780938315,8.98787780938315,0.0749942660331726,0.925005733966827,0.0749942660331726,0.925005733966827,-0.007899172604084,-0.0052005052566528,-0.0052005052566528,0.0670950934290886,0.932904906570911,0.0477299094200134,0.0477299094200134,-0.219957627809634,0.219957627809634,-0.420082366857965,0.420082366857965,0.0,-0.007899172604084,0.0,0.0,0.0479896051620057,-0.0479896051620057,-0.330662958323956,0.330662958323956,0.0478376729224732,-0.0478376729224732,-0.39160720538348,0.39160720538348,0.0,0.0,0.0,0.0,0.0,0.0,0.0,0.0,1.0,0,0.0,0.0,0.0,0.0,0.0,0.0,0.0,0.0,0.0,0.0,0.0,0.0,0.0,0.0,0.0,0.0,0.0,0.0,0.0,0.0,0.0,0.0,0.0,1.0,0.0,0.0,0.0,0.0,0.0,0.0,0.0,0.0,0.0,0.0,0.0,0.0,0.0,0.0,0.0,0.0,0.0,00-0029701,R.Tannehill,,00-0024267,G.Jennings,,,,,,,,,,,,,,,,,,,,,,,,,,,,,,,,,,,,,,,,,,,,,,,,,,,,,,,,,,,,,,,,,0.0,,,,,,,,,,,,,,,,,,,,,,,,,,,,,,,,0.0,,,,,0,,,0.0,0.0,0.0,0.0,,,2015,0.29484549164772,-29.484549164772,54,1,First down,3708,"10/4/15, 09:37:10",2015-10-04T16:31:30Z,Wembley Stadium,"Sunny Temp: 59° F, Humidity: 63%, Wind: SSE 5 mph",10012015-1004-00a2-316b-87491f4c4b5a,0,0,PASS,0,,,,24,Turnover,2015-10-04T16:27:01Z,11.0,3:02,4.0,1.0,0.0,4.0,4.0,-3.0,PUNT,INTERCEPTION,08:01,04:59,NYJ 40,NYJ 9,3628.0,3977.0,27,14,Neutral,-13,41,-2.5,42.0,1,outdoors,grass,59.0,5.0,Joe Philbin,Todd Bowles,LON00,Wembley Stadium,0,0.0,R.Tannehill,17.0,,,G.Jennings,85.0,1,0,0.0,0,1,00-0029701,,00-0024267,R.Tannehill,17.0,00-0029701,G.Jennings,00-0024267,G.Jennings,00-0024267,0,1,-0.416706221061759,,,,,,0.859102964401245,14.0897035598755,2015-10-04,D.Harris,2015,REG,NYJ,4,00-0025434,LB,David Harris,David,Harris,Finger,,Probable,Finger,,Full Participation in Practice,2015-10-02T09:28:10Z,2015-10-02 09:28:10
3694,2015_11_SF_SEA,2015112210,SEA,SF,REG,11,SEA,home,SF,SEA,56.0,2015-11-22,293.0,293.0,293.0,Half2,0,19.0,0,4,1.0,0,04:53,SEA 44,10,20.0,(4:53) (Shotgun) 3-R.Wilson pass short left to 89-D.Baldwin to 50 for 6 yards (92-Q.Dial). SEA-89-D.Baldwin was injured during the play.,pass,6.0,1,0,1.0,0,0,0,short,left,-3.0,9.0,,,,,,,3,3,0.0,,,,,3.0,3.0,29,13,29.0,13.0,16.0,29.0,13.0,16.0,0.25560474395752,0.0691082552075386,0.0007088850834406,0.0996462404727936,0.217560067772865,0.0039126593619585,0.353459119796753,0.0,0.0,2.22845314152073,0.318497050437145,18.3318119103949,-18.3318119103949,9.29139719094383,-9.29139719094383,14.0953673456571,-14.0953673456571,-0.965448829927482,1.28394588036463,-0.965448829927482,1.28394588036463,-7.69886691564644,7.69886691564644,15.1464645080644,-15.1464645080644,-12.9913961736504,12.9913961736504,24.5280818020486,-24.5280818020486,0.998376846313477,0.0016231536865234,0.998376846313477,0.0016231536865234,-3.42130661010742e-05,1.09672546386719e-05,1.09672546386719e-05,0.998342633247375,0.0016573667526245,0.999548494815826,0.999548494815826,0.085230524733533,-0.085230524733533,0.302697210055837,-0.302697210055837,0.0,-3.42130661010742e-05,0.0,-3.42130661010742e-05,-0.0051312390714883,0.0051312390714883,0.196352354665348,-0.196352354665348,-0.0051312390714883,0.0051312390714883,0.260441444297382,-0.260441444297382,0.0,0.0,0.0,0.0,0.0,0.0,0.0,0.0,0.0,0,0.0,0.0,0.0,0.0,0.0,0.0,0.0,0.0,0.0,0.0,0.0,0.0,0.0,0.0,1.0,0.0,0.0,0.0,0.0,0.0,0.0,0.0,0.0,1.0,0.0,0.0,0.0,0.0,0.0,0.0,0.0,0.0,0.0,0.0,0.0,1.0,0.0,0.0,0.0,0.0,0.0,00-0029263,R.Wilson,6.0,00-0028434,D.Baldwin,6.0,,,,,,,,,,,,,,,,,,,,,,,,,,,,,,,,,,,,,,,,,,,,,,SF,,00-0030088,,Q.Dial,,,,,,,,,,,,,,0.0,,,,,,,,,,,,,,,,,,,,,,,,,,,,,,,,0.0,,,,,0,,,0.0,0.0,0.0,0.0,,,2015,0.86230593919754,13.769406080246,54,0,Punt,3694,"11/22/15, 16:26:48",2015-11-23T00:14:27Z,Lumen Field,"Sunny Temp: 46° F, Humidity: 60%, Wind: N 6 mph",10012015-1122-1012-439c-6dc2db760d41,0,0,PASS,0,,,,19,Punt,2015-11-23T00:13:43Z,4.0,2:07,1.0,0.0,0.0,4.0,4.0,0.0,PUNT,PUNT,05:34,03:27,SEA 33,SF 47,3673.0,3781.0,13,29,Home,16,42,14.0,40.0,1,outdoors,fieldturf,46.0,6.0,Pete Carroll,Jim Tomsula,SEA00,CenturyLink Field,0,1.0,R.Wilson,3.0,,,D.Baldwin,89.0,1,0,0.0,0,1,00-0029263,,00-0028434,R.Wilson,3.0,00-0029263,D.Baldwin,00-0028434,D.Baldwin,00-0028434,0,0,0.318497050437145,1.17569533928645,9.62445901468163,8.0,0.545210641110316,0.253447655821219,0.0973252579569817,90.2674742043018,2015-11-22,D.Baldwin,2015,REG,SEA,11,00-0028434,WR,Doug Baldwin,Doug,Baldwin,Toe,,Probable,Toe,,Limited Participation in Practice,2015-11-20T13:18:43Z,2015-11-20 13:18:43
3649,2015_07_TB_WAS,2015102505,WAS,TB,REG,7,TB,away,WAS,TB,54.0,2015-10-25,250.0,250.0,250.0,Half2,0,17.0,0,4,1.0,0,04:10,TB 46,10,91.0,(4:10) 22-D.Martin right end pushed ob at WAS 5 for 49 yards (26-B.Breeland). WAS-26-B.Breeland was injured during the play. He is Out. 26- Breeland was reported as having a hamstring injury,run,49.0,0,0,0.0,0,0,0,,,,,right,end,,,,,3,0,0.0,,,,,0.0,3.0,24,27,27.0,24.0,3.0,27.0,24.0,3.0,0.421706825494766,0.0400700345635414,0.0005611804081127,0.0739316567778587,0.158454611897469,0.0040907892398536,0.301184952259064,0.0,0.0,1.9529860180337,3.52720573308761,-12.4358233420353,12.4358233420353,-3.68208130862331,3.68208130862331,-17.6399774094823,17.6399774094823,,,0.0,0.0,-11.986887571984,11.986887571984,1.66708605370605,-1.66708605370605,-10.0213510144968,10.0213510144968,-0.0415597981552303,0.0415597981552303,0.781218528747559,0.218781471252441,0.218781471252441,0.781218528747559,0.0938624739646912,0.130194127559662,-0.130194127559662,0.12491899728775,0.87508100271225,0.736034035682678,0.263965964317322,-0.262280110559916,0.262280110559916,-0.31214726716084,0.31214726716084,,,0.0,0.0,-0.157075574758432,0.157075574758432,-0.0726377034643682,0.0726377034643682,-0.157075574758432,0.157075574758432,-0.102828432069162,0.102828432069162,0.0,1.0,0.0,0.0,0.0,0.0,0.0,0.0,0.0,0,0.0,0.0,0.0,0.0,0.0,0.0,0.0,0.0,0.0,0.0,0.0,0.0,0.0,0.0,1.0,0.0,0.0,0.0,0.0,0.0,0.0,0.0,1.0,0.0,0.0,0.0,0.0,0.0,0.0,0.0,0.0,0.0,0.0,0.0,0.0,0.0,0.0,0.0,0.0,0.0,0.0,,,,,,,00-0029613,D.Martin,49.0,,,,,,,,,,,,,,,,,,,,,,,,,,,,,,,,,,,,,,,,,,,WAS,,00-0031052,,B.Breeland,,,,,,,,,,,,,,0.0,,,,,,,,,,,,,,,,,,,,,,,,,,,,,,,,0.0,,,,,0,,,0.0,0.0,0.0,0.0,,,2015,,,50,1,First down,3649,"10/25/15, 13:03:46",2015-10-25T19:53:19Z,Commanders Field,"Sunny Temp: 64° F, Humidity: 87%, Wind: W 5 mph",10012015-1025-05db-6bdb-87d15c861321,0,0,RUSH,0,,,,17,Field goal,2015-10-25T19:42:58Z,11.0,5:05,3.0,1.0,1.0,4.0,4.0,0.0,KICKOFF,FIELD_GOAL,07:29,02:24,TB 6,WAS 3,3440.0,3760.0,30,31,Home,1,61,3.0,42.0,0,outdoors,grass,64.0,5.0,Jay Gruden,Lovie Smith,WAS00,FedExField,0,1.0,,,D.Martin,22.0,,,0,1,1.0,0,1,,00-0029613,,D.Martin,22.0,00-0029613,D.Martin,00-0029613,D.Martin,00-0029613,1,1,3.52720573308761,,,,,,0.213669493794441,-21.3669493794441,2015-10-25,B.Breeland,2015,REG,WAS,7,00-0031052,CB,Bashaud Breeland,Bashaud,Breeland,Knee,,Probable,Knee,,Full Participation in Practice,2015-10-23T11:57:31Z,2015-10-23 11:57:31
3646,2015_09_STL_MIN,2015110800,MIN,LA,REG,9,LA,away,MIN,LA,80.0,2015-11-08,464.0,464.0,464.0,Half2,0,21.0,0,4,1.0,0,07:44,LA 20,10,7.0,(7:44) 30-T.Gurley left end to LA 23 for 3 yards (29-X.Rhodes). MIN-57-A.Cole was injured during the play.,run,3.0,0,0,0.0,0,0,0,,,,,left,end,,,,,3,3,0.0,,,,,3.0,3.0,18,15,15.0,18.0,-3.0,15.0,18.0,-3.0,0.182390734553337,0.134406670928001,0.0033340873196721,0.199693247675896,0.184769719839096,0.0023520421236753,0.293053507804871,0.0,0.0,0.802646877244115,-0.326014361809939,0.067948434604283,-0.067948434604283,3.86124372854829,-3.86124372854829,-0.790899516087247,0.790899516087247,,,0.0,0.0,-0.0242509311647154,0.0242509311647154,2.18390036271223,-2.18390036271223,10.1979883853346,-10.1979883853346,-12.2643141243646,12.2643141243646,0.329109281301498,0.670890718698502,0.670890718698502,0.329109281301498,-0.0100947022438049,0.0146932601928711,-0.0146932601928711,0.680985420942307,0.319014579057694,0.315623790025711,0.684376209974289,0.03411921776336,-0.03411921776336,0.263285398483276,-0.263285398483276,,,0.0,0.0,0.0349726676940918,-0.0349726676940918,0.20072615146637,-0.20072615146637,0.0384597778320313,-0.0384597778320313,0.178791463375092,-0.178791463375092,0.0,0.0,0.0,0.0,0.0,0.0,0.0,0.0,0.0,0,0.0,0.0,0.0,0.0,0.0,0.0,0.0,0.0,0.0,0.0,0.0,0.0,0.0,0.0,1.0,0.0,0.0,0.0,0.0,0.0,0.0,0.0,1.0,0.0,0.0,0.0,0.0,0.0,0.0,0.0,0.0,0.0,0.0,0.0,0.0,0.0,0.0,0.0,0.0,0.0,0.0,,,,,,,00-0032241,T.Gurley,3.0,,,,,,,,,,,,,,,,,,,,,,,,,,,,,,,,,,,,,,,,,,,MIN,,00-0030575,,X.Rhodes,,,,,,,,,,,,,,0.0,,,,,,,,,,,,,,,,,,,,,,,,,,,,,,,,0.0,,,,,0,,,0.0,0.0,0.0,0.0,,,2015,,,52,0,Punt,3646,"11/8/15, 13:03:15",2015-11-08T20:52:44Z,TCF Bank Stadium,"Sunny Temp: 51° F, Wind: South 14 mph, Gusting to 26 mph",10012015-1108-00e2-d5a9-5d00529788df,0,0,RUSH,0,,,,21,Punt,2015-11-08T20:52:44Z,3.0,0:56,0.0,0.0,0.0,4.0,4.0,0.0,PUNT,PUNT,07:44,06:48,LA 20,LA 27,3646.0,3727.0,18,21,Home,3,39,2.0,40.0,0,outdoors,fieldturf,51.0,14.0,Mike Zimmer,Jeff Fisher,MIN98,TCF Bank Stadium,0,0.0,,,T.Gurley,30.0,,,0,1,0.0,0,1,,00-0032241,,T.Gurley,30.0,00-0032241,T.Gurley,00-0032241,T.Gurley,00-0032241,0,0,-0.326014361809939,,,,,,0.605367541313171,-60.5367541313171,2015-11-08,A.Cole,2015,REG,MIN,9,00-0029578,LB,Audie Cole,Audie,Cole,Finger,,Probable,Finger,,Full Participation in Practice,2015-11-06T11:01:31Z,2015-11-06 11:01:31
3640,2015_15_CAR_NYG,2015122000,NYG,CAR,REG,15,CAR,away,NYG,CAR,64.0,2015-12-20,758.0,758.0,758.0,Half2,0,24.0,0,4,1.0,0,12:38,CAR 36,10,62.0,(12:38) (Shotgun) 34-C.Artis-Payne left tackle to NYG 38 for 26 yards (20-P.Amukamara). CAR-67-R.Kalil was injured during the play.,run,26.0,1,0,0.0,0,0,0,,,,,left,tackle,,,,,3,2,0.0,,,,,2.0,3.0,21,35,35.0,21.0,14.0,35.0,21.0,14.0,0.0861933529376984,0.114021375775337,0.0020503208506852,0.19785463809967,0.257924228906631,0.0036938753910362,0.33826220035553,0.0,0.0,1.4178486042656,1.76403858233243,-20.7506963098141,20.7506963098141,0.71089931827737,-0.71089931827737,-19.6940789821674,19.6940789821674,,,0.0,0.0,-9.44607097248081,9.44607097248081,-15.1786481147865,15.1786481147865,-29.0052652840386,29.0052652840386,3.46064232371282,-3.46064232371282,0.972771644592285,0.0272283554077148,0.0272283554077148,0.972771644592285,0.0013738870620727,0.0009584426879882,-0.0009584426879882,0.0258544683456421,0.974145531654358,0.984013497829437,0.0159865021705627,-0.20919604148354,0.20919604148354,-0.330052258912886,0.330052258912886,,,0.0,0.0,-0.126454757971119,0.126454757971119,-0.238152725177867,0.238152725177867,-0.126454757971119,0.126454757971119,-0.294681265971674,0.294681265971674,0.0,1.0,0.0,0.0,0.0,0.0,0.0,0.0,0.0,0,0.0,0.0,0.0,0.0,0.0,0.0,0.0,0.0,0.0,0.0,0.0,0.0,0.0,0.0,1.0,0.0,0.0,0.0,0.0,0.0,0.0,0.0,1.0,0.0,0.0,0.0,0.0,0.0,0.0,0.0,0.0,0.0,0.0,0.0,0.0,0.0,0.0,0.0,0.0,0.0,0.0,,,,,,,00-0031599,C.Artis-Payne,26.0,,,,,,,,,,,,,,,,,,,,,,,,,,,,,,,,,,,,,,,,,,,NYG,,00-0027957,,P.Amukamara,,,,,,,,,,,,,,0.0,,,,,,,,,,,,,,,,,,,,,,,,,,,,,,,,0.0,,,,,0,,,0.0,0.0,0.0,0.0,,,2015,,,53,1,First down,3640,"12/20/15, 13:02:29",2015-12-20T20:43:36Z,MetLife Stadium,"Sunny Temp: 41° F, Humidity: 37%, Wind: WNW 8 mph",10012015-1220-00fa-3ca7-26b387ce04e9,0,0,RUSH,0,,,,24,Missed field goal,2015-12-20T20:41:58Z,9.0,4:32,3.0,1.0,0.0,4.0,4.0,0.0,KICKOFF,BLOCKED_FG,13:24,08:52,CAR 22,NYG 16,3594.0,3802.0,38,35,Home,-3,73,-4.5,46.5,0,outdoors,fieldturf,41.0,8.0,Tom Coughlin,Ron Rivera,NYC01,MetLife Stadium,0,1.0,,,C.Artis-Payne,34.0,,,0,1,1.0,0,1,,00-0031599,,C.Artis-Payne,34.0,00-0031599,C.Artis-Payne,00-0031599,C.Artis-Payne,00-0031599,0,1,1.76403858233243,,,,,,0.281064540147781,-28.1064540147781,2015-12-20,R.Kalil,2015,REG,CAR,15,00-0025446,C,Ryan Kalil,Ryan,Kalil,Not Injury Related,,Probable,Not Injury Related,,Full Participation in Practice,2015-12-18T11:04:23Z,2015-12-18 11:04:23
3639,2015_14_MIN_ARI,2015121000,ARI,MIN,REG,14,ARI,home,MIN,MIN,35.0,2015-12-10,295.0,295.0,295.0,Half2,0,17.0,0,4,,0,04:55,MIN 35,0,55.0,3-B.Walsh kicks 72 yards from MIN 35 to ARI -7. 33-K.Williams to ARI 16 for 23 yards (19-A.Thielen). MIN-95-S.Crichton was injured during the play.,kickoff,0.0,0,0,0.0,0,0,0,,,,,,,,72.0,,,3,3,0.0,,,,,3.0,3.0,20,20,20.0,20.0,0.0,20.0,20.0,0.0,0.304209440946579,0.115874022245407,0.0015127398073673,0.161493733525276,0.173141807317734,0.0031104299705475,0.240657836198807,0.0,0.0,0.729147454258055,-0.2647625785321,-0.995612932369113,0.995612932369113,8.0966202202253,-8.0966202202253,-3.04380629817614,3.04380629817614,,,0.0,0.0,10.3103614994274,-10.3103614994274,-9.83334343304159,9.83334343304159,10.9949119311008,-10.9949119311008,-10.1161849571107,10.1161849571107,0.556897640228272,0.443102359771729,0.556897640228272,0.443102359771729,-0.0047749876976013,-0.0065976381301879,-0.0065976381301879,0.55212265253067,0.44787734746933,0.67739862203598,0.67739862203598,0.166233233666894,-0.166233233666894,-0.143531433654413,0.143531433654413,,,0.0,0.0,-0.0663038767058843,0.0663038767058843,-0.0565356406019783,0.0565356406019783,-0.0680043376166815,0.0680043376166815,-0.0455428304718589,0.0455428304718589,0.0,0.0,0.0,0.0,0.0,0.0,0.0,0.0,0.0,0,0.0,0.0,0.0,0.0,0.0,0.0,1.0,1.0,0.0,0.0,0.0,0.0,0.0,0.0,1.0,0.0,0.0,0.0,0.0,0.0,0.0,0.0,0.0,0.0,0.0,0.0,0.0,0.0,0.0,0.0,0.0,0.0,1.0,0.0,0.0,0.0,0.0,0.0,0.0,0.0,0.0,,,,,,,,,,,,,,,,,,,,,,,,,,K.Williams,00-0030117,,,,,B.Walsh,00-0029576,,,,,,,,,,,,,,,,,,,MIN,,00-0030035,,A.Thielen,,,,,,,,,,,,,,0.0,,,,,,,,,,,,,,,,,,,,,,,,,,,,,,,ARI,23.0,,,,,0,,,0.0,0.0,0.0,0.0,,,2015,,,51,1,First down,3639,"12/10/15, 20:26:32",2015-12-11T04:01:27Z,State Farm Stadium,"Temp: 68° F, Humidity: 26%, Wind: West 1 mph",10012015-1210-00c3-daf9-c1a5d393647b,0,0,KICK_OFF,1,,,,17,Field goal,2015-12-11T04:01:27Z,11.0,3:32,4.0,0.0,1.0,4.0,4.0,5.0,KICKOFF,FIELD_GOAL,04:55,01:23,ARI 16,MIN 29,3639.0,4002.0,20,23,Home,3,43,10.0,46.5,0,open,grass,,,Bruce Arians,Mike Zimmer,PHO00,University of Phoenix Stadium,0,0.0,,,,,,,0,0,0.0,1,0,,,,,,,,,,,0,1,-0.2647625785321,,,,,,,,2015-12-10,S.Crichton,2015,REG,MIN,14,00-0031283,DE,Scott Crichton,Scott,Crichton,Ankle,,Probable,Ankle,,Full Participation in Practice,2015-12-09T13:41:41Z,2015-12-09 13:41:41
3603,2015_12_CHI_GB,2015112602,GB,CHI,REG,12,GB,home,CHI,GB,58.0,2015-11-26,521.0,521.0,521.0,Half2,0,19.0,0,4,3.0,0,08:41,GB 42,10,18.0,"(8:41) (Shotgun) 12-A.Rodgers sacked at GB 38 for -4 yards (97-W.Young). GB-75-B.Bulaga was injured during the play. Penalty on GB-70-T.Lang, Offensive Holding, declined.",pass,-4.0,1,0,1.0,0,0,0,,,,,,,,,,,3,2,0.0,,,,,3.0,2.0,13,17,13.0,17.0,-4.0,13.0,17.0,-4.0,0.163114815950394,0.132181257009506,0.0018570063402876,0.179621368646622,0.204422399401665,0.0044933510944247,0.314309805631638,0.0,0.0,1.16481517557986,-1.8053781457711,-6.38869118205965,6.38869118205965,-1.47664411008009,1.47664411008009,-11.3984197089056,11.3984197089056,,,0.0,0.0,-8.91709588380763,8.91709588380763,-4.40863660932519,4.40863660932519,-8.94391280016862,8.94391280016862,-0.0055563051326743,0.0055563051326743,0.318411409854889,0.681588590145111,0.318411409854889,0.681588590145111,-0.0582065284252167,-0.0722627341747284,-0.0722627341747284,0.260204881429672,0.739795118570328,0.394609838724136,0.394609838724136,-0.0361044077443216,0.0361044077443216,-0.525996182385115,0.525996182385115,,,0.0,0.0,-0.283672705904196,0.283672705904196,-0.107848990368324,0.107848990368324,-0.283450112358282,0.283450112358282,-0.162697601723152,0.162697601723152,0.0,0.0,0.0,0.0,0.0,1.0,0.0,0.0,0.0,0,0.0,0.0,0.0,0.0,0.0,0.0,0.0,0.0,0.0,0.0,0.0,0.0,0.0,0.0,1.0,0.0,0.0,0.0,0.0,0.0,0.0,1.0,0.0,1.0,1.0,0.0,0.0,0.0,0.0,0.0,0.0,0.0,0.0,0.0,0.0,0.0,0.0,0.0,0.0,0.0,0.0,00-0023459,A.Rodgers,,,,,,,,,,,,,,,,,,,,,,,,,,,,,,,,,,,,00-0027808,W.Young,,,00-0027808,W.Young,,,,,,,,,CHI,,00-0027808,,W.Young,,,,,,,,,,,,,,0.0,,,,,,,,,,,,,,,,,,,,,,,,,00-0027808,W.Young,,,,,,0.0,,,,,0,,,0.0,0.0,0.0,0.0,,,2015,,,48,0,Punt,3603,"11/26/15, 20:30:40",2015-11-27T04:12:59Z,Lambeau Field,"Rain Temp: 39° F, Humidity: 92%, Wind: North 19 mph",10012015-1126-025a-51bf-794eb6e09a01,0,0,SACK,0,,,,19,Punt,2015-11-27T04:02:38Z,8.0,3:52,2.0,0.0,0.0,4.0,4.0,5.0,KICKOFF,PUNT,12:15,08:23,GB 20,GB 38,3380.0,3636.0,17,13,Home,-4,30,7.5,45.0,1,outdoors,grass,39.0,19.0,Mike McCarthy,John Fox,GNB00,Lambeau Field,0,0.0,A.Rodgers,12.0,,,,,1,0,0.0,0,1,00-0023459,,,A.Rodgers,12.0,00-0023459,,,,,0,1,-1.8053781457711,,,,,,0.983874082565308,1.61259174346924,2015-11-26,B.Bulaga,2015,REG,GB,12,00-0027875,T,Bryan Bulaga,Bryan,Bulaga,Knee,,Probable,Knee,,Limited Participation in Practice,2015-11-25T12:26:54Z,2015-11-25 12:26:54
3585,2015_09_GB_CAR,2015110801,CAR,GB,REG,9,GB,away,CAR,GB,79.0,2015-11-08,548.0,548.0,548.0,Half2,0,25.0,0,4,3.0,0,09:08,GB 21,10,79.0,(9:08) (Shotgun) 12-A.Rodgers pass short right to 17-D.Adams to GB 34 for 13 yards (24-J.Norman). CAR-24-J.Norman was injured during the play. His return is Probable.,pass,13.0,1,0,1.0,0,0,0,short,right,12.0,1.0,,,,,,,2,2,0.0,,,,,2.0,2.0,37,14,14.0,37.0,-23.0,14.0,37.0,-23.0,0.169557303190231,0.198000103235245,0.0044144554995,0.25412729382515,0.168545603752136,0.0014216006966307,0.203933641314507,0.0,0.0,-0.445704775629565,1.81830853712745,22.1576880085933,-22.1576880085933,3.20748747737608,-3.20748747737608,16.0700218401962,-16.0700218401962,1.78044020826928,0.0378683288581669,1.78044020826928,0.0378683288581669,10.2610353269847,-10.2610353269847,-0.994394329958595,0.994394329958595,12.7273328413139,-12.7273328413139,-5.65109898519037,5.65109898519037,0.0005816823686473,0.999418317631353,0.999418317631353,0.0005816823686473,-0.0001016066817101,-0.0001227691536769,0.0001227691536769,0.999519924313063,0.0004800756869371,0.0006736342911608,0.999326365708839,0.160456196316152,-0.160456196316152,0.236569547999594,-0.236569547999594,0.0,-0.0001016066817101,0.0,-0.0001016066817101,-0.100134704289,0.100134704289,0.305736952403943,-0.305736952403943,-0.100388363030712,0.100388363030712,0.250501578674569,-0.250501578674569,0.0,0.0,1.0,0.0,1.0,0.0,0.0,0.0,0.0,0,0.0,0.0,0.0,0.0,0.0,0.0,0.0,0.0,0.0,0.0,0.0,0.0,0.0,0.0,1.0,0.0,0.0,0.0,0.0,0.0,0.0,0.0,0.0,1.0,0.0,0.0,0.0,0.0,0.0,0.0,0.0,0.0,0.0,0.0,0.0,1.0,0.0,0.0,0.0,0.0,0.0,00-0023459,A.Rodgers,13.0,00-0031381,D.Adams,13.0,,,,,,,,,,,,,,,,,,,,,,,,,,,,,,,,,,,,,,,,,,,,,,CAR,,00-0029285,,J.Norman,,,,,,,,,,,,,,0.0,,,,,,,,,,,,,,,,,,,,,,,,,,,,,,,,0.0,,,,,0,,,0.0,0.0,0.0,0.0,,,2015,0.548826277256012,45.1173722743988,52,1,First down,3585,"11/8/15, 13:11:33",2015-11-08T20:58:47Z,Bank of America Stadium,"Cloudy Temp: 57° F, Humidity: 50%, Wind: ENE 10 mph",10012015-1108-01ec-db6e-83fb09bbc850,0,0,PASS,0,,,,25,Touchdown,2015-11-08T20:53:17Z,6.0,1:28,3.0,0.0,1.0,4.0,4.0,0.0,KICKOFF,TOUCHDOWN,09:22,07:54,GB 21,CAR 29,3515.0,3704.0,29,37,Home,8,66,-2.0,45.5,0,outdoors,grass,57.0,10.0,Ron Rivera,Mike McCarthy,CAR00,Bank of America Stadium,0,1.0,A.Rodgers,12.0,,,D.Adams,17.0,1,0,1.0,0,1,00-0023459,,00-0031381,A.Rodgers,12.0,00-0023459,D.Adams,00-0031381,D.Adams,00-0031381,0,1,1.81830853712745,0.185845706818953,2.84995062224334,1.0,0.997167313646059,0.997167313646059,0.983858525753021,1.61414742469788,2015-11-08,J.Norman,2015,REG,CAR,9,00-0029285,CB,Josh Norman,Josh,Norman,Illness,,Probable,Illness,,Full Participation in Practice,2015-11-06T12:38:08Z,2015-11-06 12:38:08
3553,2015_20_NE_DEN,2016012400,DEN,NE,POST,20,NE,away,DEN,DEN,44.0,2016-01-24,503.0,503.0,503.0,Half2,0,25.0,0,4,1.0,0,08:23,DEN 44,10,63.0,(8:23) (Shotgun) 12-T.Brady pass incomplete deep right to 87-R.Gronkowski. DEN-43-T.Ward was injured during the play. His return is Questionable.,pass,0.0,1,0,1.0,0,0,0,deep,right,16.0,,,,,,,,3,3,0.0,,,,,3.0,3.0,20,12,12.0,20.0,-8.0,12.0,20.0,-8.0,0.0955957025289536,0.0684555023908615,0.0011963049182668,0.10953263938427,0.312309086322784,0.0031872438266873,0.409723550081253,0.0,0.0,2.83687900449149,-0.352494046324864,3.56368772928598,-3.56368772928598,-8.16969548014458,8.16969548014458,10.613800797963,-10.613800797963,1.12828138528857,-1.48077543161344,0.0,0.0,10.6976999420149,-10.6976999420149,-7.85391808740678,7.85391808740678,20.135836178466,-20.135836178466,-10.35675957487,10.35675957487,0.175256088376045,0.824743911623955,0.824743911623955,0.175256088376045,-0.0174131989479065,-0.0195083022117615,0.0195083022117615,0.842157110571861,0.157842889428139,0.218663975596428,0.781336024403572,-0.129624250367652,0.129624250367652,0.394895617496927,-0.394895617496927,0.0,-0.0174131989479065,0.0,0.0,0.248225908698126,-0.248225908698126,-0.176739967753018,0.176739967753018,0.240841638268515,-0.240841638268515,0.0567827156290166,-0.0567827156290166,0.0,0.0,0.0,0.0,0.0,0.0,0.0,0.0,1.0,0,0.0,0.0,0.0,0.0,0.0,0.0,0.0,0.0,0.0,0.0,0.0,0.0,0.0,0.0,0.0,0.0,0.0,0.0,0.0,0.0,0.0,0.0,0.0,1.0,0.0,0.0,0.0,0.0,0.0,0.0,0.0,0.0,0.0,0.0,0.0,0.0,0.0,0.0,0.0,0.0,0.0,00-0019596,T.Brady,,00-0027656,R.Gronkowski,,,,,,,,,,,,,,,,,,,,,,,,,,,,,,,,,,,,,,,,,,,,,,,,,,,,,,,,,,,,,,,,,0.0,,,,,,,,,,,,,,,,,,,,,,,,,,,,,,,,0.0,,,,,0,,,0.0,0.0,0.0,0.0,,,2015,0.551889419555664,-55.1889419555664,47,1,First down,3553,"1/24/16, 15:05:58",2016-01-24T22:52:24Z,Empower Field at Mile High,"Mostly Sunny - Gusts to 12 mph Temp: 46° F, Humidity: 36%, Wind: N 6 mph",10012016-0124-00ea-aa58-a072fa25eaef,0,0,PASS,0,,,,25,Turnover on downs,2016-01-24T22:48:00Z,11.0,4:06,3.0,1.0,0.0,4.0,4.0,15.0,KICKOFF,DOWNS,10:02,05:56,NE 20,DEN 16,3435.0,3709.0,18,20,Home,2,38,-2.5,45.0,0,outdoors,grass,46.0,6.0,Gary Kubiak,Bill Belichick,DEN00,Sports Authority Field at Mile High,0,0.0,T.Brady,12.0,,,R.Gronkowski,87.0,1,0,0.0,0,1,00-0019596,,00-0027656,T.Brady,12.0,00-0019596,R.Gronkowski,00-0027656,R.Gronkowski,00-0027656,0,0,-0.352494046324864,0.217377856224892,3.25181467790389,1.0,1.0,1.0,0.648017585277557,35.1982414722443,2016-01-24,T.Ward,2015,CON,DEN,20,00-0027653,S,T.J. Ward,T.J.,Ward,Ankle,,Probable,Ankle,,Full Participation in Practice,2016-01-22T12:17:55Z,2016-01-22 12:17:55
3550,2015_16_SF_DET,2015122705,DET,SF,REG,16,SF,away,DET,SF,80.0,2015-12-27,544.0,544.0,544.0,Half2,0,18.0,0,4,1.0,0,09:04,SF 20,10,20.0,(9:04) (Shotgun) 2-B.Gabbert pass short middle to 89-V.McDonald to SF 26 for 6 yards (42-I.Abdul-Quddus; 57-J.Bynes). DET-57-J.Bynes was injured during the play.,pass,6.0,1,0,1.0,0,0,0,short,middle,4.0,2.0,,,,,,,3,3,0.0,,,,,3.0,3.0,29,17,17.0,29.0,-12.0,17.0,29.0,-12.0,0.131364405155182,0.141545087099075,0.0039956364780664,0.218092694878578,0.182723000645638,0.0021152673289179,0.320163935422897,0.0,0.0,0.834271686151624,0.22525915177539,10.6640732243396,-10.6640732243396,-0.324424989987165,0.324424989987165,4.2333728369553,-4.2333728369553,-0.251753064803779,0.477012216579169,-0.251753064803779,0.477012216579169,-6.4759070519649,6.4759070519649,9.40819003348588,-9.40819003348588,-5.56514678584063,5.56514678584063,6.24900789714529,-6.24900789714529,0.039870660752058,0.960129339247942,0.960129339247942,0.039870660752058,0.0025643110275268,0.0030718315392732,-0.0030718315392732,0.957565028220415,0.0424349717795849,0.026831615716219,0.973168384283781,0.0144833229496639,-0.0144833229496639,0.247868872892382,-0.247868872892382,0.0,0.0025643110275268,0.0,0.0025643110275268,-0.0172953236098364,0.0172953236098364,0.174639781255076,-0.174639781255076,-0.0172953236098364,0.0172953236098364,0.196076740760157,-0.196076740760157,0.0,0.0,0.0,0.0,0.0,0.0,0.0,0.0,0.0,0,0.0,0.0,0.0,0.0,0.0,0.0,0.0,0.0,0.0,0.0,0.0,0.0,0.0,0.0,0.0,0.0,0.0,0.0,0.0,0.0,0.0,0.0,0.0,1.0,0.0,0.0,0.0,0.0,0.0,0.0,0.0,0.0,0.0,0.0,0.0,1.0,1.0,0.0,0.0,0.0,0.0,00-0027948,B.Gabbert,6.0,00-0030470,V.McDonald,6.0,,,,,,,,,,,,,,,,,,,,,,,,,,,,,,,,,,,,,,,,,,,,,,,,,,,,00-0028564,I.Abdul-Quddus,DET,00-0028278,J.Bynes,DET,,,,,,,0.0,,,,,,,,,,,,,,,,,,,,,,,,,,,,,,,,0.0,,,,,0,,,0.0,0.0,0.0,0.0,,,2015,0.815660238265991,18.4339761734009,55,1,First down,3550,"12/27/15, 13:03:06",2015-12-27T20:47:48Z,Ford Field,"Controlled Climate Temp: 68° F, Humidity: 70%, Wind: mph",10012015-1227-05ff-caca-ef436ea0727d,0,0,PASS,0,,,,18,Turnover on downs,2015-12-27T20:45:12Z,6.0,2:14,1.0,0.0,0.0,4.0,4.0,0.0,KICKOFF,DOWNS,09:04,06:50,SF 20,SF 38,3531.0,3675.0,17,32,Home,15,49,8.5,42.5,0,dome,fieldturf,,,Jim Caldwell,Jim Tomsula,DET00,Ford Field,0,1.0,B.Gabbert,2.0,,,V.McDonald,89.0,1,0,0.0,0,1,00-0027948,,00-0030470,B.Gabbert,2.0,00-0027948,V.McDonald,00-0030470,V.McDonald,00-0030470,0,0,0.22525915177539,0.601472513842371,4.75519196013192,3.0,0.841681365098339,0.278734889056068,0.836306154727936,16.3693845272064,2015-12-27,J.Bynes,2015,REG,DET,16,00-0028278,LB,Josh Bynes,Josh,Bynes,Foot,,Questionable,Foot,,Limited Participation in Practice,2015-12-25T12:58:21Z,2015-12-25 12:58:21
3540,2015_17_NE_MIA,2016010301,MIA,NE,REG,17,MIA,home,NE,MIA,70.0,2016-01-03,523.0,523.0,523.0,Half2,0,20.0,0,4,2.0,0,08:43,MIA 30,9,82.0,(8:43) (Shotgun) 17-R.Tannehill pass short middle to 14-J.Landry to MIA 48 for 18 yards (21-M.Butler). NE-23-P.Chung was injured during the play. His return is Probable.,pass,18.0,1,0,1.0,0,0,0,short,middle,11.0,7.0,,,,,,,3,3,0.0,,,,,3.0,3.0,10,10,10.0,10.0,0.0,10.0,10.0,0.0,0.151529386639595,0.132417097687721,0.0024038767442107,0.1938646286726,0.199404299259186,0.0029960358515381,0.317384719848633,0.0,0.0,1.06678656116128,1.63701874320395,0.504671840870287,-0.504671840870287,-6.01204650197074,6.01204650197074,10.7513107657757,-10.7513107657757,1.17939861631021,0.457620126893744,1.17939861631021,0.457620126893744,16.8484606622369,-16.8484606622369,-0.0418609324260615,0.0418609324260615,24.7904600832262,-24.7904600832262,-12.7509534389504,12.7509534389504,0.549567878246307,0.450432121753693,0.549567878246307,0.450432121753693,0.0626722574234009,0.0907115936279297,0.0907115936279297,0.612240135669708,0.387759864330292,0.383175492286682,0.383175492286682,-0.228058201686476,0.228058201686476,0.35504460759985,-0.35504460759985,0.0,0.0626722574234009,0.0,0.0626722574234009,0.297484491547222,-0.297484491547222,0.254043102264404,-0.254043102264404,0.292759273728008,-0.292759273728008,0.101513534784317,-0.101513534784317,0.0,0.0,1.0,0.0,0.0,0.0,0.0,0.0,0.0,0,0.0,0.0,0.0,0.0,0.0,0.0,0.0,0.0,0.0,0.0,0.0,0.0,0.0,0.0,1.0,0.0,0.0,0.0,0.0,0.0,0.0,0.0,0.0,1.0,0.0,0.0,0.0,0.0,0.0,0.0,0.0,0.0,0.0,0.0,0.0,1.0,0.0,0.0,0.0,0.0,0.0,00-0029701,R.Tannehill,18.0,00-0031382,J.Landry,18.0,,,,,,,,,,,,,,,,,,,,,,,,,,,,,,,,,,,,,,,,,,,,,,NE,,00-0031218,,M.Butler,,,,,,,,,,,,,,0.0,,,,,,,,,,,,,,,,,,,,,,,,,,,,,,,,0.0,,,,,0,,,0.0,0.0,0.0,0.0,,,2015,0.704109311103821,29.5890688896179,45,1,First down,3540,"1/3/16, 13:02:52",2016-01-03T20:34:50Z,Hard Rock Stadium,"Cloudy Temp: 80° F, Humidity: 65%, Wind: North 7 mph",10012016-0103-01bf-f74d-c8c2d7203c16,0,0,PASS,0,,,,20,Touchdown,2016-01-03T20:33:39Z,6.0,2:52,4.0,1.0,1.0,4.0,4.0,0.0,PUNT,TOUCHDOWN,09:50,06:58,MIA 18,NE 2,3494.0,3649.0,10,20,Home,10,30,-10.0,46.5,1,outdoors,grass,80.0,7.0,Joe Philbin,Bill Belichick,MIA00,Sun Life Stadium,0,1.0,R.Tannehill,17.0,,,J.Landry,14.0,1,0,1.0,0,1,00-0029701,,00-0031382,R.Tannehill,17.0,00-0029701,J.Landry,00-0031382,J.Landry,00-0031382,0,1,1.63701874320395,0.251030795819214,4.03249694459373,2.0,1.0,0.996221875888295,0.751482903957367,24.8517096042633,2016-01-03,P.Chung,2015,REG,NE,17,00-0027010,S,Patrick Chung,Patrick,Chung,Foot,,Questionable,Foot,,Limited Participation in Practice,2016-01-01T13:06:50Z,2016-01-01 13:06:50
3501,2015_17_JAX_HOU,2016010304,HOU,JAX,REG,17,JAX,away,HOU,JAX,70.0,2016-01-03,645.0,645.0,645.0,Half2,0,23.0,0,4,1.0,0,10:45,JAX 30,20,40.0,(10:45) (Shotgun) 5-B.Bortles pass short left to 89-M.Lewis to HOU 25 for 45 yards (29-A.Hal). HOU-30-K.Johnson was injured during the play. His return is Probable.,pass,45.0,1,0,1.0,0,0,0,short,left,-6.0,51.0,,,,,,,1,3,0.0,,,,,3.0,1.0,20,6,6.0,20.0,-14.0,6.0,20.0,-14.0,0.12594436109066,0.144585683941841,0.0035518633667379,0.201998054981232,0.200877994298935,0.0017712938133627,0.321270734071732,0.0,0.0,1.00022454559803,3.18017286027316,8.93886620383772,-8.93886620383772,11.3043678599061,-11.3043678599061,10.2687895578362,-10.2687895578362,-1.05050976085477,4.23068262112793,-1.05050976085477,4.23068262112793,1.76054759375984,-1.76054759375984,7.68791662983614,-7.68791662983614,5.44504104199586,-5.44504104199586,-2.42284301193341,2.42284301193341,0.0497368387877941,0.950263161212206,0.950263161212206,0.0497368387877941,0.032130803912878,0.0129480008035898,-0.0129480008035898,0.918132357299328,0.0818676427006722,0.0288535859435797,0.97114641405642,0.230704616750193,-0.230704616750193,0.226615233512524,-0.226615233512524,-0.0039630122482776,0.0360938161611557,-0.0039630122482776,0.0360938161611557,0.0447407625615597,-0.0447407625615597,0.0968138409572867,-0.0968138409572867,-0.723145220428705,0.723145220428705,0.812608597965839,-0.812608597965839,0.0,0.0,1.0,0.0,0.0,0.0,0.0,0.0,0.0,0,0.0,0.0,0.0,0.0,0.0,0.0,0.0,0.0,0.0,0.0,0.0,0.0,0.0,0.0,1.0,0.0,0.0,0.0,0.0,0.0,0.0,0.0,0.0,1.0,0.0,0.0,0.0,0.0,0.0,0.0,0.0,0.0,0.0,0.0,0.0,1.0,0.0,0.0,0.0,0.0,0.0,00-0031407,B.Bortles,45.0,00-0024243,M.Lewis,45.0,,,,,,,,,,,,,,,,,,,,,,,,,,,,,,,,,,,,,,,,,,,,,,HOU,,00-0031087,,A.Hal,,,,,,,,,,,,,,0.0,,,,,,,,,,,,,,,,,,,,,,,,,,,,,,,,0.0,,,,,0,,,0.0,0.0,0.0,0.0,,,2015,0.870803892612457,12.9196107387543,47,1,First down,3501,"1/3/16, 13:02:35",2016-01-03T20:38:07Z,NRG Stadium,"Cloudy Temp: 55° F, Humidity: 49%, Wind: NW 6 mph",10012016-0103-0489-0406-1d94dd28a239,0,0,PASS,0,,,,23,Turnover,2016-01-03T20:37:10Z,3.0,1:58,2.0,1.0,0.0,4.0,4.0,-10.0,MISSED_FG,FUMBLE,11:14,09:16,JAX 40,HOU 14,3464.0,3553.0,6,30,Home,24,36,5.0,45.0,1,closed,fieldturf,,,Bill O'Brien,Gus Bradley,HOU00,NRG Stadium,0,1.0,B.Bortles,5.0,,,M.Lewis,89.0,1,0,1.0,0,1,00-0031407,,00-0024243,B.Bortles,5.0,00-0031407,M.Lewis,00-0024243,M.Lewis,00-0024243,0,0,3.18017286027316,0.980836150371674,11.5079677097237,10.0,0.325702464964706,0.0622551527922042,0.898818671703339,10.1181328296661,2016-01-03,K.Johnson,2015,REG,HOU,17,00-0031548,CB,Kevin Johnson,Kevin,Johnson,Foot,,Probable,Foot,,Full Participation in Practice,2016-01-01T12:21:27Z,2016-01-01 12:21:27
3477,2015_07_BUF_JAX,2015102500,JAX,BUF,REG,7,BUF,away,JAX,JAX,26.0,2015-10-25,724.0,724.0,724.0,Half2,0,18.0,0,4,1.0,0,12:04,JAX 26,10,56.0,"(12:04) (Shotgun) 3-E.Manuel pass short middle to 25-L.McCoy to JAX 1 for 25 yards (37-J.Cyprien). FUMBLES (37-J.Cyprien), RECOVERED by JAX-26-J.Evans at JAX 4. 26-J.Evans to JAX 4 for no gain (89-C.Gragg). BUF-25-L.McCoy was injured during the play. PENALTY on BUF-10-R.Woods, Illegal Blindside Block, 15 yards, enforced at JAX 4.",pass,22.0,1,0,1.0,0,0,0,short,middle,2.0,20.0,,,,,,,2,3,0.0,,,,,3.0,2.0,27,16,16.0,27.0,-11.0,16.0,27.0,-11.0,0.024267952889204,0.037473052740097,0.0006832675426267,0.0566262379288673,0.397388011217117,0.0008449076558463,0.48271656036377,0.0,0.0,4.06270041270182,-4.43979067448527,12.5558726562465,-12.5558726562465,-3.26743170106784,3.26743170106784,19.0631873899395,-19.0631873899395,-0.259468268719502,-4.18032240576576,-0.259468268719502,-4.18032240576576,-4.1390695036971,4.1390695036971,5.03477468079655,-5.03477468079655,-5.85726066859206,5.85726066859206,17.5093220191914,-17.5093220191914,0.150450184941292,0.849549815058708,0.849549815058708,0.150450184941292,-0.080412283539772,-0.139774113893509,0.139774113893509,0.92996209859848,0.0700379014015198,0.247103661298752,0.752896338701248,-0.0209930562088818,0.0209930562088818,0.503359168301272,-0.503359168301272,0.0,-0.080412283539772,0.0,-0.080412283539772,-0.0249123896480875,0.0249123896480875,0.203735946765103,-0.203735946765103,-0.0249123896480875,0.0249123896480875,0.382638301063814,-0.382638301063814,0.0,0.0,0.0,0.0,0.0,0.0,0.0,0.0,0.0,0,0.0,0.0,0.0,0.0,0.0,0.0,0.0,0.0,0.0,0.0,0.0,1.0,0.0,0.0,1.0,0.0,1.0,0.0,1.0,0.0,0.0,0.0,0.0,1.0,0.0,0.0,0.0,0.0,0.0,0.0,0.0,0.0,0.0,0.0,1.0,1.0,0.0,0.0,0.0,0.0,0.0,00-0030526,E.Manuel,22.0,00-0027029,L.McCoy,22.0,,,,,,,,,,,,,,,,,,,,,,,,,,,,,,,,,,,,,,,,JAX,00-0030538,J.Cyprien,,,,JAX,BUF,00-0030538,00-0030049,J.Cyprien,C.Gragg,,,,,,,,,,,,,0.0,,,,,,,,,,,BUF,00-0027029,L.McCoy,,,,JAX,0.0,00-0030557,J.Evans,,,,,,,,,,,,0.0,BUF,00-0030431,R.Woods,15.0,0,,Illegal Blindside Block,0.0,0.0,0.0,0.0,,,2015,0.7886843085289,21.13156914711,51,0,Turnover,3477,"10/25/15, 09:35:23",2015-10-25T15:58:10Z,Wembley Stadium,"Sunny Intervals Temp: 48° F, Humidity: 74%, Wind: NNW 2 mph",10012015-1025-001b-337d-0995f0f3554f,0,0,PASS,0,,,,18,Turnover,2015-10-25T15:54:44Z,4.0,2:25,2.0,0.0,0.0,4.0,4.0,10.0,PUNT,FUMBLE,14:18,11:53,BUF 40,JAX 26,3333.0,3477.0,31,34,Neutral,3,65,-3.5,41.0,0,outdoors,grass,48.0,2.0,Gus Bradley,Rex Ryan,LON00,Wembley Stadium,0,0.0,E.Manuel,3.0,,,L.McCoy,25.0,1,0,0.0,0,1,00-0030526,,00-0027029,E.Manuel,3.0,00-0030526,L.McCoy,00-0027029,L.McCoy,00-0027029,0,0,1.81023799016839,0.624693520903843,5.5537674697116,4.0,0.667547401913907,0.250848789641168,0.650045692920685,34.9954307079315,2015-10-25,L.McCoy,2015,REG,BUF,7,00-0027029,RB,LeSean McCoy,LeSean,McCoy,Hamstring,,Probable,Hamstring,,Limited Participation in Practice,2015-10-23T07:01:00Z,2015-10-23 07:01:00
3473,2015_14_NYG_MIA,2015121400,MIA,NYG,REG,14,NYG,away,MIA,NYG,84.0,2015-12-14,688.0,688.0,688.0,Half2,0,20.0,1,4,1.0,0,11:28,NYG 16,10,96.0,"(11:28) (No Huddle, Shotgun) 10-E.Manning pass deep middle to 13-O.Beckham Jr. for 84 yards, TOUCHDOWN. NYG-76-E.Flowers was injured during the play. His return is Questionable.",pass,84.0,1,1,1.0,0,0,0,deep,middle,30.0,54.0,,,,,,,2,2,0.0,,NYG,O.Beckham Jr.,00-0031235,2.0,2.0,24,30,24.0,24.0,0.0,30.0,24.0,6.0,0.123544298112392,0.164003640413284,0.0063885231502354,0.233176276087761,0.208545863628387,0.001640303642489,0.262701123952866,0.0,0.0,0.330804165685549,6.66919583431445,-9.15003778203391,9.15003778203391,14.4959218113218,-14.4959218113218,-24.1334701458145,24.1334701458145,1.94789913878776,4.72129669552669,1.94789913878776,4.72129669552669,-7.51264752443993,7.51264752443993,-11.6077758924282,11.6077758924282,6.08401055643455,-6.08401055643455,-29.9562204229694,29.9562204229694,0.458095580339432,0.541904419660568,0.541904419660568,0.458095580339432,0.348134171977516,0.26154510665811,-0.26154510665811,0.193770247683053,0.806229752316947,0.584247589111328,0.415752410888672,0.409497136211312,-0.409497136211312,-0.875020217242174,0.875020217242174,0.0,0.348134171977516,0.0,0.348134171977516,-0.241793247394407,0.241793247394407,-0.391148874173253,0.391148874173253,-0.241793247394407,0.241793247394407,-0.587888219962208,0.587888219962208,0.0,0.0,1.0,0.0,0.0,0.0,0.0,0.0,0.0,0,0.0,0.0,0.0,0.0,0.0,0.0,0.0,0.0,0.0,0.0,0.0,0.0,0.0,0.0,0.0,0.0,0.0,0.0,0.0,0.0,0.0,0.0,0.0,1.0,0.0,1.0,1.0,0.0,0.0,0.0,0.0,0.0,0.0,0.0,0.0,1.0,0.0,0.0,0.0,0.0,0.0,00-0022803,E.Manning,84.0,00-0031235,O.Beckham Jr.,84.0,,,,,,,,,,,,,,,,,,,,,,,,,,,,,,,,,,,,,,,,,,,,,,,,,,,,,,,,,,,,,,,,0.0,,,,,,,,,,,,,,,,,,,,,,,,,,,,,,,,0.0,,,,,0,,,0.0,0.0,0.0,0.0,,,2015,0.368332743644714,63.1667256355286,48,1,Touchdown,3473,"12/14/15, 20:30:48",2015-12-15T04:06:53Z,Hard Rock Stadium,"Clear Temp: 77° F, Humidity: 78%, Wind: 6 SSE mph",10012015-1214-00bd-caed-a93113327388,0,0,PASS,0,,,,20,Touchdown,2015-12-15T04:06:22Z,2.0,0:45,2.0,0.0,1.0,4.0,4.0,0.0,PUNT,TOUCHDOWN,11:58,11:13,NYG 4,NYG 16,3452.0,3497.0,31,24,Home,-7,55,-2.5,47.5,0,outdoors,grass,77.0,6.0,Joe Philbin,Tom Coughlin,MIA00,Sun Life Stadium,0,1.0,E.Manning,10.0,,,O.Beckham Jr.,13.0,1,0,1.0,0,1,00-0022803,,00-0031235,E.Manning,10.0,00-0022803,O.Beckham Jr.,00-0031235,O.Beckham Jr.,00-0031235,0,1,6.66919583431445,1.57267689538064,19.7217875556089,7.0,1.0,1.0,0.495882302522659,50.4117697477341,2015-12-14,E.Flowers,2015,REG,NYG,14,00-0032259,T,Ereck Flowers,Ereck,Flowers,Ankle,,Questionable,Ankle,,Limited Participation in Practice,2015-12-12T09:49:29Z,2015-12-12 09:49:29
3455,2015_09_PHI_DAL,2015110810,DAL,PHI,REG,9,PHI,away,DAL,DAL,11.0,2015-11-08,481.0,481.0,481.0,Half2,0,16.0,0,4,2.0,0,08:01,DAL 11,3,67.0,(8:01) (Shotgun) 29-D.Murray left end to DAL 13 for -2 yards (42-B.Church; 90-D.Lawrence). DAL-90-D.Lawrence was injured during the play. His return is Questionable.,run,-2.0,1,0,0.0,0,0,0,,,,,left,end,,,,,3,3,0.0,,,,,3.0,3.0,21,21,21.0,21.0,0.0,21.0,21.0,0.0,0.0259397979825735,0.0137578258290887,0.000370016467059,0.0154745671898127,0.34672799706459,0.0010219638934359,0.596707820892334,0.0,0.0,5.06884718447691,-0.87014422606444,-6.52574802562594,6.52574802562594,-4.62958730524406,4.62958730524406,1.26142105984036,-1.26142105984036,,,0.0,0.0,3.72360337793361,-3.72360337793361,10.4561846112483,-10.4561846112483,11.5815493947594,-11.5815493947594,-6.2952699084999,6.2952699084999,0.641545712947846,0.358454287052155,0.358454287052155,0.641545712947846,-0.0437740683555603,-0.0604615807533264,0.0604615807533264,0.402228355407715,0.597771644592285,0.770869374275208,0.229130625724793,-0.201294927774458,0.201294927774458,0.0956100270805783,-0.0956100270805783,,,0.0,0.0,0.254050590494435,-0.254050590494435,0.302936492305009,-0.302936492305009,0.254050590494435,-0.254050590494435,-0.0524776909086689,0.0524776909086689,0.0,0.0,0.0,0.0,0.0,0.0,0.0,0.0,0.0,0,0.0,0.0,0.0,0.0,0.0,0.0,0.0,0.0,0.0,0.0,0.0,0.0,0.0,0.0,0.0,0.0,0.0,1.0,0.0,0.0,0.0,0.0,1.0,0.0,0.0,0.0,0.0,0.0,0.0,0.0,0.0,0.0,0.0,0.0,0.0,0.0,1.0,0.0,0.0,0.0,0.0,,,,,,,00-0028009,D.Murray,-2.0,,,,,,,,,,,,,,,,,,,,,,,,,,,,,,,,,,,,,,,,,,,,,,,,,00-0027416,B.Church,DAL,00-0031411,D.Lawrence,DAL,,,,,,,0.0,,,,,,,,,,,,,,,,,,,,,,,,,,,,,,,,0.0,,,,,0,,,0.0,0.0,0.0,0.0,,,2015,,,49,0,Field goal,3455,"11/8/15, 20:31:00",2015-11-09T04:07:38Z,AT&T Stadium,"Clear skies Temp: 60° F, Humidity: 43%, Wind: ENE 5 mph",10012015-1108-1045-103d-72ad468df376,0,0,RUSH,0,,,,16,Field goal,2015-11-09T04:01:16Z,10.0,3:30,4.0,1.0,1.0,4.0,4.0,0.0,KICKOFF,FIELD_GOAL,10:52,07:22,PHI 20,DAL 13,3272.0,3505.0,33,27,Home,-6,60,-3.0,43.5,1,closed,matrixturf,,,Jason Garrett,Chip Kelly,DAL00,AT&T Stadium,0,0.0,,,D.Murray,29.0,,,0,1,0.0,0,1,,00-0028009,,D.Murray,29.0,00-0028009,D.Murray,00-0028009,D.Murray,00-0028009,0,0,-0.87014422606444,,,,,,0.344633936882019,-34.4633936882019,2015-11-08,D.Lawrence,2015,REG,DAL,9,00-0031411,DE,Demarcus Lawrence,Demarcus,Lawrence,Back,,Probable,Back,,Full Participation in Practice,2015-11-06T11:22:40Z,2015-11-06 11:22:40
3446,2015_18_GB_WAS,2016011001,WAS,GB,POST,18,WAS,home,GB,WAS,59.0,2016-01-10,629.0,629.0,629.0,Half2,0,19.0,0,4,1.0,0,10:29,WAS 41,10,34.0,(10:29) (Shotgun) 8-K.Cousins pass deep middle to 86-J.Reed to GB 37 for 22 yards (23-D.Randall). GB-23-D.Randall was injured during the play.,pass,22.0,1,0,1.0,0,0,0,deep,middle,21.0,1.0,,,,,,,3,2,0.0,,,,,3.0,2.0,18,32,18.0,32.0,-14.0,18.0,32.0,-14.0,0.101479724049568,0.108032338321209,0.0015584466746076,0.133473232388496,0.247716382145882,0.0036567680072039,0.404083132743835,0.0,0.0,2.31751807662658,1.34202135517262,-14.9725675139641,14.9725675139641,-4.54201206247672,4.54201206247672,-11.061010720185,11.061010720185,1.2659101979807,0.0761111571919173,1.2659101979807,0.0761111571919173,-3.45758119091624,3.45758119091624,-0.109343522664858,0.109343522664858,-15.6536889441777,15.6536889441777,13.7920424621058,-13.7920424621058,0.0563926324248314,0.943607367575169,0.0563926324248314,0.943607367575169,0.0230752602219582,0.0161524452269077,0.0161524452269077,0.0794678926467896,0.92053210735321,0.0619400851428509,0.0619400851428509,-0.238914876231191,0.238914876231191,-0.235628500665223,0.235628500665223,0.0,0.0230752602219582,0.0,0.0230752602219582,-0.104739847422262,0.104739847422262,-0.113920714706182,0.113920714706182,-0.107552113772055,0.107552113772055,-0.0042318664491176,0.0042318664491176,0.0,0.0,1.0,0.0,0.0,0.0,0.0,0.0,0.0,0,0.0,0.0,0.0,0.0,0.0,0.0,0.0,0.0,0.0,0.0,0.0,0.0,0.0,0.0,1.0,0.0,0.0,0.0,0.0,0.0,0.0,0.0,0.0,1.0,0.0,0.0,0.0,0.0,0.0,0.0,0.0,0.0,0.0,0.0,0.0,1.0,0.0,0.0,0.0,0.0,0.0,00-0029604,K.Cousins,22.0,00-0030472,J.Reed,22.0,,,,,,,,,,,,,,,,,,,,,,,,,,,,,,,,,,,,,,,,,,,,,,GB,,00-0032251,,D.Randall,,,,,,,,,,,,,,0.0,,,,,,,,,,,,,,,,,,,,,,,,,,,,,,,,0.0,,,,,0,,,0.0,0.0,0.0,0.0,,,2015,0.590861737728119,40.9138262271881,50,1,First down,3446,"1/10/16, 16:41:34",2016-01-11T00:26:19Z,Commanders Field,"Cloudy Temp: 61° F, Humidity: 47%, Wind: SW 14 mph",10012016-0110-01a6-7952-00d6d4e83288,0,0,PASS,0,,,,19,Punt,2016-01-11T00:23:39Z,7.0,3:27,2.0,0.0,0.0,4.0,4.0,0.0,KICKOFF,PUNT,12:23,08:56,WAS 20,GB 46,3357.0,3537.0,35,18,Home,-17,53,2.0,47.0,0,outdoors,grass,61.0,14.0,Jay Gruden,Mike McCarthy,WAS00,FedExField,0,1.0,K.Cousins,8.0,,,J.Reed,86.0,1,0,1.0,0,1,00-0029604,,00-0030472,K.Cousins,8.0,00-0029604,J.Reed,00-0030472,J.Reed,00-0030472,0,0,1.34202135517262,0.63377102829419,8.80091183271725,4.0,1.0,1.0,0.808743059635162,19.1256940364838,2016-01-10,D.Randall,2015,WC,GB,18,00-0032251,CB,Damarious Randall,Damarious,Randall,Groin,,Probable,Groin,,Limited Participation in Practice,2016-01-08T12:57:13Z,2016-01-08 12:57:13
3434,2015_15_TEN_NE,2015122005,NE,TEN,REG,15,TEN,away,NE,TEN,57.0,2015-12-20,424.0,424.0,424.0,Half2,0,21.0,1,4,1.0,0,07:04,TEN 43,10,57.0,"(7:04) (Shotgun) 7-Z.Mettenberger pass short middle to 82-D.Walker for 57 yards, TOUCHDOWN. NE-23-P.Chung was injured during the play.",pass,57.0,1,0,1.0,0,0,0,short,middle,4.0,53.0,,,,,,,3,2,0.0,,TEN,D.Walker,00-0024389,2.0,3.0,27,16,10.0,27.0,-17.0,16.0,27.0,-11.0,0.196442648768425,0.0796859934926033,0.0015634690644219,0.120963349938393,0.257102191448212,0.0036191795952618,0.340623170137405,0.0,0.0,2.07397875632159,4.92602124367841,9.84060518231233,-9.84060518231233,6.54147380175453,-6.54147380175453,14.6392440109013,-14.6392440109013,-0.0705573491286486,4.99657859280706,-0.0705573491286486,4.99657859280706,-6.98298161325511,6.98298161325511,9.15574470668798,-9.15574470668798,-15.7715396558051,15.7715396558051,21.2946515435428,-21.2946515435428,0.0177719481289387,0.982228051871061,0.982228051871061,0.0177719481289387,0.0209562078876135,0.010031081381463,-0.010031081381463,0.961271843983448,0.0387281560165522,0.0074520683847367,0.992547931615263,0.181803023442626,-0.181803023442626,0.292883267378457,-0.292883267378457,0.0,0.0209562078876135,0.0,0.0209562078876135,0.0841351232036702,-0.0841351232036702,0.024129308303648,-0.024129308303648,0.0833953699573629,-0.0833953699573629,0.0520544960254965,-0.0520544960254965,0.0,0.0,1.0,0.0,0.0,0.0,0.0,0.0,0.0,0,0.0,0.0,0.0,0.0,0.0,0.0,0.0,0.0,0.0,0.0,0.0,0.0,0.0,0.0,0.0,0.0,0.0,0.0,0.0,0.0,0.0,0.0,0.0,1.0,0.0,1.0,1.0,0.0,0.0,0.0,0.0,0.0,0.0,0.0,0.0,1.0,0.0,0.0,0.0,0.0,0.0,00-0031266,Z.Mettenberger,57.0,00-0024389,D.Walker,57.0,,,,,,,,,,,,,,,,,,,,,,,,,,,,,,,,,,,,,,,,,,,,,,,,,,,,,,,,,,,,,,,,0.0,,,,,,,,,,,,,,,,,,,,,,,,,,,,,,,,0.0,,,,,0,,,0.0,0.0,0.0,0.0,,,2015,0.786608159542084,21.3391840457916,43,1,Touchdown,3434,"12/20/15, 13:02:47",2015-12-20T20:41:38Z,Gillette Stadium,"Sunny Temp: 40° F, Humidity: 41%, Wind: West 12 mph",10012015-1220-0566-e7c9-23a1acd69224,0,0,PASS,0,,,,21,Touchdown,2015-12-20T20:41:38Z,1.0,0:12,1.0,0.0,1.0,4.0,4.0,0.0,PUNT,TOUCHDOWN,07:04,06:52,TEN 43,TEN 43,3434.0,3457.0,16,33,Home,17,49,14.5,48.0,0,outdoors,fieldturf,40.0,12.0,Bill Belichick,Ken Whisenhunt,BOS00,Gillette Stadium,0,1.0,Z.Mettenberger,7.0,,,D.Walker,82.0,1,0,1.0,0,1,00-0031266,,00-0024389,Z.Mettenberger,7.0,00-0031266,D.Walker,00-0024389,D.Walker,00-0024389,0,0,4.92602124367841,0.513773804653658,4.7879168161453,3.0,0.830866889969911,0.278344253019895,0.897290825843811,10.2709174156189,2015-12-20,P.Chung,2015,REG,NE,15,00-0027010,S,Patrick Chung,Patrick,Chung,Foot,,Questionable,Foot,,Limited Participation in Practice,2015-12-18T13:20:19Z,2015-12-18 13:20:19
