play_id,game_id,old_game_id,home_team,away_team,season_type,week_x,posteam,posteam_type,defteam,side_of_field,yardline_100,game_date,quarter_seconds_remaining,half_seconds_remaining,game_seconds_remaining,game_half,quarter_end,drive,sp,qtr,down,goal_to_go,time,yrdln,ydstogo,ydsnet,desc,play_type,yards_gained,shotgun,no_huddle,qb_dropback,qb_kneel,qb_spike,qb_scramble,pass_length,pass_location,air_yards,yards_after_catch,run_location,run_gap,field_goal_result,kick_distance,extra_point_result,two_point_conv_result,home_timeouts_remaining,away_timeouts_remaining,timeout,timeout_team,td_team,td_player_name,td_player_id,posteam_timeouts_remaining,defteam_timeouts_remaining,total_home_score,total_away_score,posteam_score,defteam_score,score_differential,posteam_score_post,defteam_score_post,score_differential_post,no_score_prob,opp_fg_prob,opp_safety_prob,opp_td_prob,fg_prob,safety_prob,td_prob,extra_point_prob,two_point_conversion_prob,ep,epa,total_home_epa,total_away_epa,total_home_rush_epa,total_away_rush_epa,total_home_pass_epa,total_away_pass_epa,air_epa,yac_epa,comp_air_epa,comp_yac_epa,total_home_comp_air_epa,total_away_comp_air_epa,total_home_comp_yac_epa,total_away_comp_yac_epa,total_home_raw_air_epa,total_away_raw_air_epa,total_home_raw_yac_epa,total_away_raw_yac_epa,wp,def_wp,home_wp,away_wp,wpa,vegas_wpa,vegas_home_wpa,home_wp_post,away_wp_post,vegas_wp,vegas_home_wp,total_home_rush_wpa,total_away_rush_wpa,total_home_pass_wpa,total_away_pass_wpa,air_wpa,yac_wpa,comp_air_wpa,comp_yac_wpa,total_home_comp_air_wpa,total_away_comp_air_wpa,total_home_comp_yac_wpa,total_away_comp_yac_wpa,total_home_raw_air_wpa,total_away_raw_air_wpa,total_home_raw_yac_wpa,total_away_raw_yac_wpa,punt_blocked,first_down_rush,first_down_pass,first_down_penalty,third_down_converted,third_down_failed,fourth_down_converted,fourth_down_failed,incomplete_pass,touchback,interception,punt_inside_twenty,punt_in_endzone,punt_out_of_bounds,punt_downed,punt_fair_catch,kickoff_inside_twenty,kickoff_in_endzone,kickoff_out_of_bounds,kickoff_downed,kickoff_fair_catch,fumble_forced,fumble_not_forced,fumble_out_of_bounds,solo_tackle,safety,penalty,tackled_for_loss,fumble_lost,own_kickoff_recovery,own_kickoff_recovery_td,qb_hit,rush_attempt,pass_attempt,sack,touchdown,pass_touchdown,rush_touchdown,return_touchdown,extra_point_attempt,two_point_attempt,field_goal_attempt,kickoff_attempt,punt_attempt,fumble,complete_pass,assist_tackle,lateral_reception,lateral_rush,lateral_return,lateral_recovery,passer_player_id,passer_player_name,passing_yards,receiver_player_id,receiver_player_name,receiving_yards,rusher_player_id,rusher_player_name,rushing_yards,lateral_receiver_player_id,lateral_receiver_player_name,lateral_receiving_yards,lateral_rusher_player_id,lateral_rusher_player_name,lateral_rushing_yards,lateral_sack_player_id,lateral_sack_player_name,interception_player_id,interception_player_name,lateral_interception_player_id,lateral_interception_player_name,punt_returner_player_id,punt_returner_player_name,lateral_punt_returner_player_id,lateral_punt_returner_player_name,kickoff_returner_player_name,kickoff_returner_player_id,lateral_kickoff_returner_player_id,lateral_kickoff_returner_player_name,punter_player_id,punter_player_name,kicker_player_name,kicker_player_id,own_kickoff_recovery_player_id,own_kickoff_recovery_player_name,blocked_player_id,blocked_player_name,tackle_for_loss_1_player_id,tackle_for_loss_1_player_name,tackle_for_loss_2_player_id,tackle_for_loss_2_player_name,qb_hit_1_player_id,qb_hit_1_player_name,qb_hit_2_player_id,qb_hit_2_player_name,forced_fumble_player_1_team,forced_fumble_player_1_player_id,forced_fumble_player_1_player_name,forced_fumble_player_2_team,forced_fumble_player_2_player_id,forced_fumble_player_2_player_name,solo_tackle_1_team,solo_tackle_2_team,solo_tackle_1_player_id,solo_tackle_2_player_id,solo_tackle_1_player_name,solo_tackle_2_player_name,assist_tackle_1_player_id,assist_tackle_1_player_name,assist_tackle_1_team,assist_tackle_2_player_id,assist_tackle_2_player_name,assist_tackle_2_team,assist_tackle_3_player_id,assist_tackle_3_player_name,assist_tackle_3_team,assist_tackle_4_player_id,assist_tackle_4_player_name,assist_tackle_4_team,tackle_with_assist,tackle_with_assist_1_player_id,tackle_with_assist_1_player_name,tackle_with_assist_1_team,tackle_with_assist_2_player_id,tackle_with_assist_2_player_name,tackle_with_assist_2_team,pass_defense_1_player_id,pass_defense_1_player_name,pass_defense_2_player_id,pass_defense_2_player_name,fumbled_1_team,fumbled_1_player_id,fumbled_1_player_name,fumbled_2_player_id,fumbled_2_player_name,fumbled_2_team,fumble_recovery_1_team,fumble_recovery_1_yards,fumble_recovery_1_player_id,fumble_recovery_1_player_name,fumble_recovery_2_team,fumble_recovery_2_yards,fumble_recovery_2_player_id,fumble_recovery_2_player_name,sack_player_id,sack_player_name,half_sack_1_player_id,half_sack_1_player_name,half_sack_2_player_id,half_sack_2_player_name,return_team,return_yards,penalty_team,penalty_player_id,penalty_player_name,penalty_yards,replay_or_challenge,replay_or_challenge_result,penalty_type,defensive_two_point_attempt,defensive_two_point_conv,defensive_extra_point_attempt,defensive_extra_point_conv,safety_player_name,safety_player_id,season_x,cp,cpoe,series,series_success,series_result,order_sequence,start_time,time_of_day,stadium,weather,nfl_api_id,play_clock,play_deleted,play_type_nfl,special_teams_play,st_play_type,end_clock_time,end_yard_line,fixed_drive,fixed_drive_result,drive_real_start_time,drive_play_count,drive_time_of_possession,drive_first_downs,drive_inside20,drive_ended_with_score,drive_quarter_start,drive_quarter_end,drive_yards_penalized,drive_start_transition,drive_end_transition,drive_game_clock_start,drive_game_clock_end,drive_start_yard_line,drive_end_yard_line,drive_play_id_started,drive_play_id_ended,away_score,home_score,location,result,total,spread_line,total_line,div_game,roof,surface,temp,wind,home_coach,away_coach,stadium_id,game_stadium,aborted_play,success,passer,passer_jersey_number,rusher,rusher_jersey_number,receiver,receiver_jersey_number,pass,rush,first_down,special,play,passer_id,rusher_id,receiver_id,name,jersey_number,id,fantasy_player_name,fantasy_player_id,fantasy,fantasy_id,out_of_bounds,home_opening_kickoff,qb_epa,xyac_epa,xyac_mean_yardage,xyac_median_yardage,xyac_success,xyac_fd,xpass,pass_oe,date_x,injured_player,season_y,game_type,team,week_y,gsis_id,position,full_name,first_name,last_name,report_primary_injury,report_secondary_injury,report_status,practice_primary_injury,practice_secondary_injury,practice_status,date_modified,date_y
4655,2017_04_JAX_NYJ,2017100108,NYJ,JAX,REG,4,JAX,away,NYJ,JAX,98.0,2017-10-01,110.0,110.0,110.0,Overtime,0,28.0,0,5,4.0,0,01:50,JAX 2,11,-1.0,"(1:50) 3-B.Nortman punts 45 yards to JAX 47, Center-43-M.Overton. 14-J.Kerley ran ob at JAX 40 for 7 yards. NYJ-49-D.Donahue was injured during the play. PENALTY on JAX-51-P.Posluszny, Unsportsmanlike Conduct, 15 yards, enforced at JAX 40.",punt,0.0,0,0,0.0,0,0,0,,,,,,,,45.0,,,0,1,0.0,,,,,1.0,0.0,20,20,20.0,20.0,0.0,20.0,20.0,0.0,0.489490836858749,0.170210048556328,0.0963013991713524,0.190255910158157,0.0333583168685436,0.0004899477353319,0.0198935829102993,0.0,0.0,-1.7947143886704,-1.68310377676971,2.31977453001309,-2.31977453001309,-5.41846768125137,5.41846768125137,10.6865011342765,-10.6865011342765,,,0.0,0.0,2.12936237128451,-2.12936237128451,3.35847341239663,-3.35847341239663,-4.35550467448775,4.35550467448775,20.2898763259022,-20.2898763259022,0.0537418475141749,0.946258152485825,0.946258152485825,0.0537418475141749,0.291421063826419,0.291421063826419,-0.291421063826419,0.654837088659406,0.345162911340594,0.0537418475141749,0.946258152485825,0.150488600735202,-0.150488600735202,0.338276264623431,-0.338276264623431,,,0.0,0.0,0.64923562342301,-0.64923562342301,-0.423169008730753,0.423169008730753,1.19610800460214,-1.19610800460214,-0.455485530588619,0.455485530588619,0.0,0.0,0.0,0.0,0.0,0.0,0.0,0.0,0.0,0,0.0,0.0,0.0,0.0,0.0,0.0,0.0,0.0,0.0,0.0,0.0,0.0,0.0,0.0,0.0,0.0,1.0,0.0,0.0,0.0,0.0,0.0,0.0,0.0,0.0,0.0,0.0,0.0,0.0,0.0,0.0,0.0,0.0,1.0,0.0,0.0,0.0,0.0,0.0,0.0,0.0,,,,,,,,,,,,,,,,,,,,,,00-0028091,J.Kerley,,,,,,,00-0029304,B.Nortman,,,,,,,,,,,,,,,,,,,,,,,,,,,,,,,,,,,,,,,0.0,,,,,,,,,,,,,,,,,,,,,,,,,,,,,,,NYJ,7.0,JAX,00-0025421,P.Posluszny,15.0,0,,Unsportsmanlike Conduct,0.0,0.0,0.0,0.0,,,2017,,,63,0,Punt,4655,"10/1/17, 13:02:45",2017-10-01T20:30:50Z,MetLife Stadium,"Sunny Temp: 64° F, Humidity: 44%, Wind: NNE 5 mph",10012017-1001-0858-ba27-fd76853f12c3,0,0,PUNT,1,,,,28,Punt,2017-10-01T20:27:31Z,3.0,0:28,0.0,0.0,0.0,5.0,5.0,0.0,PUNT,PUNT,02:06,01:38,JAX 3,JAX 2,4557.0,4655.0,20,23,Home,3,43,-4.0,38.5,0,outdoors,fieldturf,64.0,5.0,Todd Bowles,Doug Marrone,NYC01,MetLife Stadium,0,0.0,,,,,,,0,0,0.0,1,0,,,,,,,,,,,1,1,-1.68310377676971,,,,,,,,2017-10-01,D.Donahue,2017,REG,NYJ,4,00-0033961,LB,Dylan Donahue,Dylan,Donahue,,,,Elbow,,Full Participation in Practice,2017-09-29T11:14:36Z,2017-09-29 11:14:36
4634,2017_14_BAL_PIT,2017121013,PIT,BAL,REG,14,BAL,away,PIT,BAL,75.0,2017-12-10,42.0,42.0,42.0,Half2,0,23.0,0,4,1.0,0,00:42,BAL 25,10,6.0,"(:42) (Shotgun) 5-J.Flacco pass incomplete deep right to 18-J.Maclin (54-L.Fort). BAL-18-J.Maclin was injured during the play. Penalty on BAL-86-N.Boyle, Illegal Motion, declined.",pass,0.0,1,0,1.0,0,0,0,deep,right,17.0,,,,,,,,2,1,0.0,,,,,1.0,2.0,39,38,38.0,39.0,-1.0,38.0,39.0,-1.0,0.722642362117767,0.0399787984788418,0.0011878194054588,0.022292472422123,0.173067703843117,0.0003417704429011,0.0404890775680542,0.0,0.0,0.524950854189228,-0.259525947796647,-2.15021148951295,2.15021148951295,-8.92417610487598,8.92417610487598,8.2307250215845,-8.2307250215845,0.62429285433609,-0.883818802132737,0.0,0.0,4.12341001871391,-4.12341001871391,7.50388240395114,-7.50388240395114,21.7358903234708,-21.7358903234708,-10.6330027529447,10.6330027529447,0.39393812417984,0.60606187582016,0.60606187582016,0.39393812417984,-0.0563823580741882,-0.079854279756546,0.079854279756546,0.662444233894348,0.337555766105652,0.326134473085403,0.673865526914597,-0.325182237665178,0.325182237665178,0.332340065154888,-0.332340065154888,0.0,-0.0563823580741882,0.0,0.0,0.0616724033412931,-0.0616724033412931,0.552813467470505,-0.552813467470505,0.065721704488754,-0.065721704488754,0.382678856042721,-0.382678856042721,0.0,0.0,0.0,0.0,0.0,0.0,0.0,0.0,1.0,0,0.0,0.0,0.0,0.0,0.0,0.0,0.0,0.0,0.0,0.0,0.0,0.0,0.0,0.0,0.0,0.0,0.0,0.0,0.0,0.0,0.0,0.0,0.0,1.0,0.0,0.0,0.0,0.0,0.0,0.0,0.0,0.0,0.0,0.0,0.0,0.0,0.0,0.0,0.0,0.0,0.0,00-0026158,J.Flacco,,00-0026995,J.Maclin,,,,,,,,,,,,,,,,,,,,,,,,,,,,,,,,,,,,,,,,,,,,,,,,,,,,,,,,,,,,,,,,,0.0,,,,,,,00-0028932,L.Fort,,,,,,,,,,,,,,,,,,,,,,,,0.0,,,,,0,,,0.0,0.0,0.0,0.0,,,2017,0.569303154945374,-56.9303154945374,69,1,First down,4634,"12/10/17, 20:30:50",2017-12-11T04:53:59Z,Acrisure Stadium,"Cloudy Temp: 33° F, Humidity: 55%, Wind: From SW 12 mph",10012017-1210-13a5-9013-fdd7fe6214a2,0,0,PASS,0,,,,23,End of half,2017-12-11T04:53:15Z,5.0,0:42,1.0,0.0,0.0,4.0,4.0,0.0,KICKOFF,END_GAME,00:42,00:00,BAL 25,BAL 39,4619.0,4826.0,38,39,Home,1,77,6.0,43.0,1,outdoors,grass,33.0,12.0,Mike Tomlin,John Harbaugh,PIT00,Heinz Field,0,0.0,J.Flacco,5.0,,,J.Maclin,18.0,1,0,0.0,0,1,00-0026158,,00-0026995,J.Flacco,5.0,00-0026158,J.Maclin,00-0026995,J.Maclin,00-0026995,0,0,-0.259525947796647,0.259323116372784,3.80026548207388,2.0,1.0,1.0,0.930357873439789,6.96421265602112,2017-12-10,J.Maclin,2017,REG,BAL,14,00-0026995,WR,Jeremy Maclin,Jeremy,Maclin,Back,,Questionable,Back,,Full Participation in Practice,2017-12-08T12:44:49Z,2017-12-08 12:44:49
4195,2017_16_NYG_ARI,2017122410,ARI,NYG,REG,16,NYG,away,ARI,NYG,80.0,2017-12-24,440.0,440.0,440.0,Half2,0,25.0,0,4,1.0,0,07:20,NYG 20,10,45.0,(7:20) (Shotgun) 22-W.Gallman up the middle to NYG 21 for 1 yard (41-A.Bethea). ARI-41-A.Bethea was injured during the play.,run,1.0,1,0,0.0,0,0,0,,,,,middle,,,,,,3,3,0.0,,,,,3.0,3.0,23,0,0.0,23.0,-23.0,0.0,23.0,-23.0,0.196774140000343,0.131613940000534,0.0035059528890997,0.184235855937004,0.192026063799858,0.0022970815189182,0.289546936750412,0.0,0.0,0.915996194351465,-0.667417163960636,25.4706371823451,-25.4706371823451,8.84343235682254,-8.84343235682254,10.4911113643316,-10.4911113643316,,,0.0,0.0,3.30309455518727,-3.30309455518727,0.926778332883259,-0.926778332883259,5.02479783259332,-5.02479783259332,-2.05727063241687,2.05727063241687,0.0004429855034686,0.999557014496531,0.999557014496531,0.0004429855034686,-0.0001030625717248,-1.63646691362374e-05,1.63646691362374e-05,0.999660077068256,0.0003399229317437,0.0001382911286782,0.999861708871322,0.193169126083376,-0.193169126083376,0.137693770598088,-0.137693770598088,,,0.0,0.0,0.0284434486757534,-0.0284434486757534,0.0220730308172987,-0.0220730308172987,0.0261449445616024,-0.0261449445616024,0.108401855159062,-0.108401855159062,0.0,0.0,0.0,0.0,0.0,0.0,0.0,0.0,0.0,0,0.0,0.0,0.0,0.0,0.0,0.0,0.0,0.0,0.0,0.0,0.0,0.0,0.0,0.0,1.0,0.0,0.0,0.0,0.0,0.0,0.0,0.0,1.0,0.0,0.0,0.0,0.0,0.0,0.0,0.0,0.0,0.0,0.0,0.0,0.0,0.0,0.0,0.0,0.0,0.0,0.0,,,,,,,00-0033950,W.Gallman,1.0,,,,,,,,,,,,,,,,,,,,,,,,,,,,,,,,,,,,,,,,,,,ARI,,00-0024421,,A.Bethea,,,,,,,,,,,,,,0.0,,,,,,,,,,,,,,,,,,,,,,,,,,,,,,,,0.0,,,,,0,,,0.0,0.0,0.0,0.0,,,2017,,,51,1,First down,4195,"12/24/17, 16:25:35",2017-12-25T00:16:19Z,State Farm Stadium,"Clear Temp: 71° F, Humidity: 14%, Wind: SE 3 mph",10012017-1224-108e-4741-54f1bddc4b6e,0,0,RUSH,0,,,,25,Turnover on downs,2017-12-25T00:16:19Z,8.0,3:23,2.0,0.0,0.0,4.0,4.0,0.0,PUNT,DOWNS,07:20,03:57,NYG 20,ARI 35,4195.0,4365.0,0,23,Home,23,23,3.0,39.0,0,closed,grass,,,Bruce Arians,Steve Spagnuolo,PHO00,University of Phoenix Stadium,0,0.0,,,W.Gallman,22.0,,,0,1,0.0,0,1,,00-0033950,,W.Gallman,22.0,00-0033950,W.Gallman,00-0033950,W.Gallman,00-0033950,0,0,-0.667417163960636,,,,,,0.714342534542084,-71.4342534542084,2017-12-24,A.Bethea,2017,REG,ARI,16,00-0024421,S,Antoine Bethea,Antoine,Bethea,Knee,,Questionable,Knee,,Limited Participation in Practice,2017-12-22T12:50:00Z,2017-12-22 12:50:00
4095,2017_05_LAC_NYG,2017100805,NYG,LAC,REG,5,NYG,home,LAC,NYG,77.0,2017-10-08,247.0,247.0,247.0,Half2,0,25.0,0,4,2.0,0,04:07,NYG 23,7,-9.0,(4:07) (No Huddle) 10-E.Manning pass incomplete short left to 13-O.Beckham. NYG-13-O.Beckham was injured during the play.,pass,0.0,0,1,1.0,0,0,0,short,left,6.0,,,,,,,,3,3,0.0,,,,,3.0,3.0,22,20,22.0,20.0,2.0,22.0,20.0,2.0,0.337691217660904,0.117134071886539,0.0013211962068453,0.177994564175606,0.14381018280983,0.0033046214375644,0.218744143843651,0.0,0.0,0.369242240907624,-0.556689842604101,-1.93322955026804,1.93322955026804,2.92651863774518,-2.92651863774518,-6.276812151125,6.276812151125,0.659910242306069,-1.21660008491017,0.0,0.0,-2.16051970067201,2.16051970067201,-6.57647635787725,6.57647635787725,-8.03376858588308,8.03376858588308,11.5958410289825,-11.5958410289825,0.758713245391846,0.241286754608154,0.758713245391846,0.241286754608154,-0.0280520915985107,-0.0360216498374939,-0.0360216498374939,0.730661153793335,0.269338846206665,0.748625993728638,0.748625993728638,0.0644655343924448,-0.0644655343924448,-0.0487198764768469,0.0487198764768469,0.0,-0.0280520915985107,0.0,0.0,-0.161652939814994,0.161652939814994,-0.0812703579118382,0.0812703579118382,-0.161652939814994,0.161652939814994,0.377647066170918,-0.377647066170918,0.0,0.0,0.0,0.0,0.0,0.0,0.0,0.0,1.0,0,0.0,0.0,0.0,0.0,0.0,0.0,0.0,0.0,0.0,0.0,0.0,0.0,0.0,0.0,0.0,0.0,0.0,0.0,0.0,0.0,0.0,0.0,0.0,1.0,0.0,0.0,0.0,0.0,0.0,0.0,0.0,0.0,0.0,0.0,0.0,0.0,0.0,0.0,0.0,0.0,0.0,00-0022803,E.Manning,,00-0031235,O.Beckham,,,,,,,,,,,,,,,,,,,,,,,,,,,,,,,,,,,,,,,,,,,,,,,,,,,,,,,,,,,,,,,,,0.0,,,,,,,,,,,,,,,,,,,,,,,,,,,,,,,,0.0,,,,,0,,,0.0,0.0,0.0,0.0,,,2017,0.718344688415527,-71.8344688415527,55,0,Turnover,4095,"10/8/17, 13:02:22",2017-10-08T20:08:32Z,MetLife Stadium,"Cloudy Temp: 76° F, Humidity: 90%, Wind: WSW 7 mph",10012017-1008-057c-fcfe-c87ab56ff0d4,0,0,PASS,0,,,,25,Turnover,2017-10-08T20:07:06Z,3.0,1:04,0.0,0.0,0.0,4.0,4.0,0.0,KICKOFF,FUMBLE,04:50,03:46,NYG 20,NYG 23,4052.0,4120.0,27,22,Home,-5,49,3.0,45.5,0,outdoors,fieldturf,76.0,7.0,Ben McAdoo,Anthony Lynn,NYC01,MetLife Stadium,0,0.0,E.Manning,10.0,,,O.Beckham,13.0,1,0,0.0,0,1,00-0022803,,00-0031235,E.Manning,10.0,00-0022803,O.Beckham,00-0031235,O.Beckham,00-0031235,0,0,-0.556689842604101,0.349329322415125,3.24168438381457,1.0,0.996709115657723,0.580409259855514,0.534980654716492,46.5019345283508,2017-10-08,O.Beckham,2017,REG,NYG,5,00-0031235,WR,Odell Beckham,Odell,Beckham,,,,Finger,Ankle,Limited Participation in Practice,2017-10-06T10:05:18Z,2017-10-06 10:05:18
4047,2017_10_CIN_TEN,2017111206,TEN,CIN,REG,10,TEN,home,CIN,CIN,7.0,2017-11-12,50.0,50.0,50.0,Half2,0,25.0,0,4,1.0,1,00:50,CIN 7,7,73.0,(:50) (Shotgun) 8-M.Mariota pass incomplete short middle to 82-D.Walker (59-N.Vigil). TEN-82-D.Walker was injured during the play. His return is Questionable.,pass,0.0,1,0,1.0,0,0,0,short,middle,7.0,,,,,,,,1,2,0.0,,,,,1.0,2.0,17,20,17.0,20.0,-3.0,17.0,20.0,-3.0,0.11502568423748,0.0047403243370354,0.000226959833526,0.0047982120886445,0.239023298025131,0.0003677075437735,0.63581782579422,0.0,0.0,5.12026771242381,-0.666373991465662,-1.38229462040234,1.38229462040234,9.09014981926885,-9.09014981926885,-10.4353643683956,10.4353643683956,1.87973228757619,-2.54610627904185,0.0,0.0,4.71260974323377,-4.71260974323377,-8.74317273773552,8.74317273773552,7.91457010470913,-7.91457010470913,-16.7792983552739,16.7792983552739,0.66524612903595,0.33475387096405,0.66524612903595,0.33475387096405,-0.0746400356292725,-0.102998018264771,-0.102998018264771,0.590606093406677,0.409393906593323,0.703162550926209,0.703162550926209,0.193827953896841,-0.193827953896841,-0.306131099482241,0.306131099482241,0.0,-0.0746400356292725,0.0,0.0,-0.606324478983879,0.606324478983879,0.610858063082037,-0.610858063082037,-0.611243173480034,0.611243173480034,0.365915457586584,-0.365915457586584,0.0,0.0,0.0,0.0,0.0,0.0,0.0,0.0,1.0,0,0.0,0.0,0.0,0.0,0.0,0.0,0.0,0.0,0.0,0.0,0.0,0.0,0.0,0.0,0.0,0.0,0.0,0.0,0.0,0.0,0.0,0.0,0.0,1.0,0.0,0.0,0.0,0.0,0.0,0.0,0.0,0.0,0.0,0.0,0.0,0.0,0.0,0.0,0.0,0.0,0.0,00-0032268,M.Mariota,,00-0024389,D.Walker,,,,,,,,,,,,,,,,,,,,,,,,,,,,,,,,,,,,,,,,,,,,,,,,,,,,,,,,,,,,,,,,,0.0,,,,,,,00-0032892,N.Vigil,,,,,,,,,,,,,,,,,,,,,,,,0.0,,,,,0,,,0.0,0.0,0.0,0.0,,,2017,0.447695583105087,-44.7695583105087,60,1,Touchdown,4047,"11/12/17, 13:02:32",2017-11-12T21:04:46Z,Nissan Stadium,"Cloudy Temp: 53° F, Humidity: 88%, Wind: SSW 4 mph",10012017-1112-0630-7ebe-b165f6951230,0,0,PASS,0,,,,25,Touchdown,2017-11-12T20:52:02Z,12.0,4:27,6.0,1.0,1.0,4.0,4.0,5.0,KICKOFF,TOUCHDOWN,05:03,00:36,TEN 27,CIN 7,3714.0,4135.0,20,24,Home,4,44,4.5,40.5,0,outdoors,grass,53.0,4.0,Mike Mularkey,Marvin Lewis,NAS00,Nissan Stadium,0,0.0,M.Mariota,8.0,,,D.Walker,82.0,1,0,0.0,0,1,00-0032268,,00-0024389,M.Mariota,8.0,00-0032268,D.Walker,00-0024389,D.Walker,00-0024389,0,0,-0.666373991465662,,,,,,0.696498930454254,30.3501069545746,2017-11-12,D.Walker,2017,REG,TEN,10,00-0024389,TE,Delanie Walker,Delanie,Walker,Ankle,,Questionable,Ankle,,Limited Participation in Practice,2017-11-10T11:35:23Z,2017-11-10 11:35:23
3999,2017_06_SF_WAS,2017101506,WAS,SF,REG,6,WAS,home,SF,SF,11.0,2017-10-15,247.0,247.0,247.0,Half2,0,20.0,0,4,1.0,0,04:07,SF 11,10,84.0,(4:07) (Shotgun) 25-C.Thompson right guard to SF 12 for -1 yards (90-E.Mitchell). SF-54-R.Armstrong was injured during the play.,run,-1.0,1,0,0.0,0,0,0,,,,,right,guard,,,,,3,2,0.0,,,,,3.0,2.0,20,17,20.0,17.0,3.0,20.0,17.0,3.0,0.0672920644283295,0.0104057341814041,0.000226692209253,0.0143622774630785,0.30691796541214,0.0013652724446728,0.599430024623871,0.0,0.0,4.98728808428859,-0.758168097992893,7.06935472227633,-7.06935472227633,-12.1670187233249,12.1670187233249,15.9900595643148,-15.9900595643148,,,0.0,0.0,-4.75232428783784,4.75232428783784,13.6325451334415,-13.6325451334415,-0.273634881072212,0.273634881072212,11.6592313343217,-11.6592313343217,0.894837915897369,0.105162084102631,0.894837915897369,0.105162084102631,-0.0130617618560791,-0.0094748139381408,-0.0094748139381408,0.88177615404129,0.11822384595871,0.943231523036957,0.943231523036957,-0.279618496762684,0.279618496762684,0.627701949435309,-0.627701949435309,,,0.0,0.0,-0.0103997102798663,0.0103997102798663,0.416850663721561,-0.416850663721561,-0.0110999828995906,0.0110999828995906,0.45763723552227,-0.45763723552227,0.0,0.0,0.0,0.0,0.0,0.0,0.0,0.0,0.0,0,0.0,0.0,0.0,0.0,0.0,0.0,0.0,0.0,0.0,0.0,0.0,0.0,0.0,0.0,1.0,0.0,0.0,1.0,0.0,0.0,0.0,0.0,1.0,0.0,0.0,0.0,0.0,0.0,0.0,0.0,0.0,0.0,0.0,0.0,0.0,0.0,0.0,0.0,0.0,0.0,0.0,,,,,,,00-0030404,C.Thompson,-1.0,,,,,,,,,,,,,,,,,,,,,,,,,,,,,00-0027684,E.Mitchell,,,,,,,,,,,,,SF,,00-0027684,,E.Mitchell,,,,,,,,,,,,,,0.0,,,,,,,,,,,,,,,,,,,,,,,,,,,,,,,,0.0,,,,,0,,,0.0,0.0,0.0,0.0,,,2017,,,55,1,First down,3999,"10/15/17, 13:02:27",2017-10-15T20:00:48Z,Commanders Field,"Cloudy Temp: 68° F, Humidity: 85%, Wind: South 4 mph",10012017-1015-0677-2205-69028ec23825,0,0,RUSH,0,,,,20,Touchdown,2017-10-15T19:54:00Z,9.0,4:54,5.0,1.0,1.0,4.0,4.0,5.0,PUNT,TOUCHDOWN,08:22,03:28,WAS 16,SF 7,3827.0,4074.0,24,26,Home,2,50,12.0,46.0,0,outdoors,grass,68.0,4.0,Jay Gruden,Kyle Shanahan,WAS00,FedExField,0,0.0,,,C.Thompson,25.0,,,0,1,0.0,0,1,,00-0030404,,C.Thompson,25.0,00-0030404,C.Thompson,00-0030404,C.Thompson,00-0030404,0,1,-0.758168097992893,,,,,,0.155230775475502,-15.5230775475502,2017-10-15,R.Armstrong,2017,REG,SF,6,00-0030050,LB,Ray-Ray Armstrong,Ray-Ray,Armstrong,,,,Shoulder,,Full Participation in Practice,2017-10-13T13:10:05Z,2017-10-13 13:10:05
3988,2017_07_TEN_CLE,2017102202,CLE,TEN,REG,7,TEN,away,CLE,TEN,64.0,2017-10-22,545.0,545.0,545.0,Overtime,0,22.0,0,5,1.0,0,09:05,TEN 36,10,20.0,(9:05) 8-M.Mariota pass short right to 82-D.Walker pushed ob at CLE 48 for 16 yards (58-C.Kirksey). TEN-82-D.Walker was injured during the play. His return is Questionable.,pass,16.0,0,0,1.0,0,0,0,short,right,13.0,3.0,,,,,,,2,2,0.0,,,,,2.0,2.0,9,9,9.0,9.0,0.0,9.0,9.0,0.0,0.164983615279198,0.103459380567074,0.0023118162062019,0.152107909321785,0.258302122354507,0.001769489957951,0.317065626382828,0.0,0.0,1.6181475922931,0.94441190129146,-6.13084373535821,6.13084373535821,1.49207851843676,-1.49207851843676,-5.165498491068,5.165498491068,0.804977651918307,0.139434249373153,0.804977651918307,0.139434249373153,-5.79702882092861,5.79702882092861,15.596630398413,-15.596630398413,-6.56007239548089,6.56007239548089,0.78232887298413,-0.78232887298413,0.577137238695286,0.422862761304714,0.422862761304714,0.577137238695286,0.106064485153183,0.106064485153183,-0.106064485153183,0.31679827615153,0.68320172384847,0.577137238695286,0.422862761304714,-0.15953215258196,0.15953215258196,-0.252605175366625,0.252605175366625,-0.0724231073400006,0.178487592493184,-0.0724231073400006,0.178487592493184,0.447117663337849,-0.447117663337849,0.0458159212721512,-0.0458159212721512,0.592900188989006,-0.592900188989006,-0.832580961403437,0.832580961403437,0.0,0.0,1.0,0.0,0.0,0.0,0.0,0.0,0.0,0,0.0,0.0,0.0,0.0,0.0,0.0,0.0,0.0,0.0,0.0,0.0,0.0,0.0,0.0,1.0,0.0,0.0,0.0,0.0,0.0,0.0,0.0,0.0,1.0,0.0,0.0,0.0,0.0,0.0,0.0,0.0,0.0,0.0,0.0,0.0,1.0,0.0,0.0,0.0,0.0,0.0,00-0032268,M.Mariota,16.0,00-0024389,D.Walker,16.0,,,,,,,,,,,,,,,,,,,,,,,,,,,,,,,,,,,,,,,,,,,,,,CLE,,00-0031361,,C.Kirksey,,,,,,,,,,,,,,0.0,,,,,,,,,,,,,,,,,,,,,,,,,,,,,,,,0.0,,,,,0,,,0.0,0.0,0.0,0.0,,,2017,0.608781754970551,39.1218245029449,55,1,First down,3988,"10/22/17, 13:02:21",2017-10-22T20:00:20Z,Cleveland Browns Stadium,"Sunny Temp: 74° F, Humidity: 56%, Wind: South 12 mph",10012017-1022-02d5-acbc-1c4675a40881,0,0,PASS,0,,,,22,Punt,2017-10-22T20:00:20Z,4.0,1:35,1.0,0.0,0.0,5.0,5.0,-10.0,PUNT,PUNT,09:05,07:30,TEN 36,CLE 44,3988.0,4132.0,12,9,Home,-3,21,-5.5,42.5,0,outdoors,grass,74.0,12.0,Hue Jackson,Mike Mularkey,CLE00,FirstEnergy Stadium,0,1.0,M.Mariota,8.0,,,D.Walker,82.0,1,0,1.0,0,1,00-0032268,,00-0024389,M.Mariota,8.0,00-0032268,D.Walker,00-0024389,D.Walker,00-0024389,1,0,0.94441190129146,0.211863597476984,3.25569146944326,1.0,1.0,0.998762342031114,0.474805325269699,52.5194674730301,2017-10-22,D.Walker,2017,REG,TEN,7,00-0024389,TE,Delanie Walker,Delanie,Walker,Calf,,Questionable,Calf,,Did Not Participate In Practice,2017-10-20T11:47:02Z,2017-10-20 11:47:02
3915,2017_07_TEN_CLE,2017102202,CLE,TEN,REG,7,CLE,home,TEN,CLE,75.0,2017-10-22,565.0,565.0,565.0,Overtime,0,21.0,0,5,2.0,0,09:25,CLE 25,10,0.0,(9:25) 6-C.Kessler pass incomplete deep right to 18-K.Britt [98-B.Orakpo]. CLE-18-K.Britt was injured during the play. His return is Questionable.,pass,0.0,0,0,1.0,0,0,0,deep,right,28.0,,,,,,,,2,2,0.0,,,,,2.0,2.0,9,9,9.0,9.0,0.0,9.0,9.0,0.0,0.173581525683403,0.156361237168312,0.001874519046396,0.194566071033478,0.194382011890411,0.0044026360847055,0.27483195066452,0.0,0.0,0.680979715660214,-0.681800094433129,-3.56910462054657,3.56910462054657,1.49207851843676,-1.49207851843676,-3.05408137167674,3.05408137167674,2.18699013732839,-2.86879023176152,0.0,0.0,-4.9920511690103,4.9920511690103,15.7360646477862,-15.7360646477862,-4.58808952546278,4.58808952546278,0.921763122357283,-0.921763122357283,0.473616598639637,0.526383401360363,0.473616598639637,0.526383401360363,-0.0640654191374779,-0.0640654191374779,-0.0640654191374779,0.409551179502159,0.590448820497841,0.473616598639637,0.473616598639637,-0.15953215258196,0.15953215258196,-0.0314973220229149,0.0314973220229149,0.0654553188942373,-0.129520738031715,0.0,0.0,0.374694555997849,-0.374694555997849,0.224303513765335,-0.224303513765335,0.425619245972484,-0.425619245972484,-0.444192165043205,0.444192165043205,0.0,0.0,0.0,0.0,0.0,0.0,0.0,0.0,1.0,0,0.0,0.0,0.0,0.0,0.0,0.0,0.0,0.0,0.0,0.0,0.0,0.0,0.0,0.0,0.0,0.0,0.0,0.0,0.0,0.0,0.0,1.0,0.0,1.0,0.0,0.0,0.0,0.0,0.0,0.0,0.0,0.0,0.0,0.0,0.0,0.0,0.0,0.0,0.0,0.0,0.0,00-0033104,C.Kessler,,00-0027006,K.Britt,,,,,,,,,,,,,,,,,,,,,,,,,,,,,,,,,,,,,00-0026989,B.Orakpo,,,,,,,,,,,,,,,,,,,,,,,,,,,0.0,,,,,,,,,,,,,,,,,,,,,,,,,,,,,,,,0.0,,,,,0,,,0.0,0.0,0.0,0.0,,,2017,0.252701699733734,-25.2701699733734,54,0,Punt,3915,"10/22/17, 13:02:21",2017-10-22T19:57:48Z,Cleveland Browns Stadium,"Sunny Temp: 74° F, Humidity: 56%, Wind: South 12 mph",10012017-1022-02d5-acbc-1c4675a40881,0,0,PASS,0,,,,21,Punt,2017-10-22T19:56:33Z,3.0,0:55,0.0,0.0,0.0,5.0,5.0,0.0,KICKOFF,PUNT,10:00,09:05,CLE 25,CLE 25,3872.0,3963.0,12,9,Home,-3,21,-5.5,42.5,0,outdoors,grass,74.0,12.0,Hue Jackson,Mike Mularkey,CLE00,FirstEnergy Stadium,0,0.0,C.Kessler,6.0,,,K.Britt,18.0,1,0,0.0,0,1,00-0033104,,00-0027006,C.Kessler,6.0,00-0033104,K.Britt,00-0027006,K.Britt,00-0027006,0,0,-0.681800094433129,0.530731053690603,8.00657408565166,3.0,1.0,1.0,0.63905942440033,36.094057559967,2017-10-22,K.Britt,2017,REG,CLE,7,00-0027006,WR,Kenny Britt,Kenny,Britt,Knee,Groin,Questionable,Knee,Glute,Limited Participation in Practice,2017-10-20T11:01:08Z,2017-10-20 11:01:08
3893,2017_02_MIN_PIT,2017091706,PIT,MIN,REG,2,PIT,home,MIN,MIN,33.0,2017-09-17,284.0,284.0,284.0,Half2,0,20.0,0,4,1.0,0,04:44,MIN 33,10,64.0,"(4:44) (No Huddle) 26-L.Bell up the middle to MIN 28 for 5 yards (29-X.Rhodes, 34-A.Sendejo). MIN-29-X.Rhodes was injured during the play.",run,5.0,0,1,0.0,0,0,0,,,,,middle,,,,,,0,3,0.0,,,,,0.0,3.0,20,9,20.0,9.0,11.0,20.0,9.0,11.0,0.187767997384071,0.0280144903808832,0.0003090443206019,0.0381423868238926,0.32342129945755,0.0025758310221135,0.419768899679184,0.0,0.0,3.56213959062006,0.0568879888742231,14.1997722191817,-14.1997722191817,-1.36443242261885,1.36443242261885,11.1318481407509,-11.1318481407509,,,0.0,0.0,-3.86940475838492,3.86940475838492,9.12288217915921,-9.12288217915921,6.14121800972498,-6.14121800972498,3.81808809686224,-3.81808809686224,0.986847698688507,0.0131523013114929,0.986847698688507,0.0131523013114929,-0.0019665360450744,0.0009397268295288,0.0009397268295288,0.984881162643433,0.0151188373565674,0.991895854473114,0.991895854473114,0.0600354432957745,-0.0600354432957745,0.0996409672796726,-0.0996409672796726,,,0.0,0.0,-0.0169866755604744,0.0169866755604744,0.025618607133627,-0.025618607133627,-0.71329902857542,0.71329902857542,0.795588506340981,-0.795588506340981,0.0,0.0,0.0,0.0,0.0,0.0,0.0,0.0,0.0,0,0.0,0.0,0.0,0.0,0.0,0.0,0.0,0.0,0.0,0.0,0.0,0.0,0.0,0.0,0.0,0.0,0.0,0.0,0.0,0.0,0.0,0.0,1.0,0.0,0.0,0.0,0.0,0.0,0.0,0.0,0.0,0.0,0.0,0.0,0.0,0.0,1.0,0.0,0.0,0.0,0.0,,,,,,,00-0030496,L.Bell,5.0,,,,,,,,,,,,,,,,,,,,,,,,,,,,,,,,,,,,,,,,,,,,,,,,,00-0027914,A.Sendejo,MIN,,,,,,,,,,1.0,00-0030575,X.Rhodes,MIN,,,,,,,,,,,,,,,,,,,,,,,,,,,,,0.0,,,,,0,,,0.0,0.0,0.0,0.0,,,2017,,,51,1,First down,3893,"9/17/17, 13:02:48",2017-09-17T19:46:13Z,Acrisure Stadium,"Sunny Temp: 78° F, Humidity: 64%, Wind: From S 1 mph",10012017-0917-06cb-f11e-c7b61a8b6f42,0,0,RUSH,0,,,,20,Field goal,2017-09-17T19:42:42Z,11.0,4:44,4.0,1.0,1.0,4.0,4.0,0.0,PUNT,FIELD_GOAL,08:02,03:18,PIT 17,MIN 19,3772.0,4011.0,9,26,Home,17,35,8.5,43.0,0,outdoors,grass,78.0,1.0,Mike Tomlin,Mike Zimmer,PIT00,Heinz Field,0,1.0,,,L.Bell,26.0,,,0,1,0.0,0,1,,00-0030496,,L.Bell,26.0,00-0030496,L.Bell,00-0030496,L.Bell,00-0030496,0,1,0.0568879888742231,,,,,,0.0674500167369843,-6.74500167369843,2017-09-17,X.Rhodes,2017,REG,MIN,2,00-0030575,CB,Xavier Rhodes,Xavier,Rhodes,Hip,,Questionable,Hip,,Limited Participation in Practice,2017-09-15T11:08:59Z,2017-09-15 11:08:59
3801,2017_02_WAS_LA,2017091711,LA,WAS,REG,2,WAS,away,LA,LA,17.0,2017-09-17,138.0,138.0,138.0,Half2,0,20.0,0,4,1.0,0,02:18,LA 17,10,70.0,(2:18) 32-S.Perine up the middle to LA 16 for 1 yard (31-M.Alexander). LA-31-M.Alexander was injured during the play. His return is Probable.,run,1.0,0,0,0.0,0,0,0,,,,,middle,,,,,,2,1,0.0,,,,,1.0,2.0,20,20,20.0,20.0,0.0,20.0,20.0,0.0,0.163124322891235,0.0085844965651631,0.0003096139989793,0.0149781545624137,0.309751361608505,0.0019474601140245,0.501304566860199,0.0,0.0,4.31106117344461,-0.478810000815429,-5.37843936437275,5.37843936437275,-12.6640481708455,12.6640481708455,7.63168272545282,-7.63168272545282,,,0.0,0.0,7.59146734143643,-7.59146734143643,-4.10660804072052,4.10660804072052,11.297639778145,-11.297639778145,-6.01725805500838,6.01725805500838,0.723292946815491,0.276707053184509,0.276707053184509,0.723292946815491,0.0037484169006347,-0.0163089632987976,0.0163089632987976,0.272958636283875,0.727041363716126,0.788327574729919,0.211672425270081,-0.229608150289175,0.229608150289175,-0.116044021129907,0.116044021129907,,,0.0,0.0,-0.115253284573555,0.115253284573555,-0.0915034924748551,0.0915034924748551,-0.115253284573555,0.115253284573555,-0.111758938908876,0.111758938908876,0.0,0.0,0.0,0.0,0.0,0.0,0.0,0.0,0.0,0,0.0,0.0,0.0,0.0,0.0,0.0,0.0,0.0,0.0,0.0,0.0,0.0,0.0,0.0,1.0,0.0,0.0,0.0,0.0,0.0,0.0,0.0,1.0,0.0,0.0,0.0,0.0,0.0,0.0,0.0,0.0,0.0,0.0,0.0,0.0,0.0,0.0,0.0,0.0,0.0,0.0,,,,,,,00-0033526,S.Perine,1.0,,,,,,,,,,,,,,,,,,,,,,,,,,,,,,,,,,,,,,,,,,,LA,,00-0031393,,M.Alexander,,,,,,,,,,,,,,0.0,,,,,,,,,,,,,,,,,,,,,,,,,,,,,,,,0.0,,,,,0,,,0.0,0.0,0.0,0.0,,,2017,,,50,1,Touchdown,3801,"9/17/17, 16:25:33",2017-09-17T23:22:30Z,Los Angeles Memorial Coliseum,"Cloudy Temp: 76° F, Humidity: 59%, Wind: SW 3 mph",10012017-0917-1169-5d6c-f23c9f5bccfa,0,0,RUSH,0,,,,20,Touchdown,2017-09-17T23:12:20Z,10.0,5:27,4.0,1.0,1.0,4.0,4.0,-10.0,KICKOFF,TOUCHDOWN,07:16,01:49,WAS 30,LA 11,3563.0,3900.0,27,20,Home,-7,47,3.0,45.5,0,outdoors,grass,74.0,3.0,Sean McVay,Jay Gruden,LAX99,Los Angeles Memorial Coliseum,0,0.0,,,S.Perine,32.0,,,0,1,0.0,0,1,,00-0033526,,S.Perine,32.0,00-0033526,S.Perine,00-0033526,S.Perine,00-0033526,0,1,-0.478810000815429,,,,,,0.213583499193192,-21.3583499193192,2017-09-17,M.Alexander,2017,REG,LA,2,00-0031393,S,Maurice Alexander,Maurice,Alexander,,,,Shoulder,,Full Participation in Practice,2017-09-15T12:39:09Z,2017-09-15 12:39:09
3784,2017_14_IND_BUF,2017121000,BUF,IND,REG,14,BUF,home,IND,BUF,63.0,2017-12-10,443.0,443.0,443.0,Overtime,0,23.0,0,5,2.0,0,07:23,BUF 37,9,35.0,(7:23) (Shotgun) 14-J.Webb up the middle to BUF 41 for 4 yards (57-J.Bostic). IND-95-J.Hankins was injured during the play. J.Hankins assisted off.,run,4.0,1,0,0.0,0,0,0,,,,,middle,,,,,,2,2,0.0,,,,,2.0,2.0,7,7,7.0,7.0,0.0,7.0,7.0,0.0,0.229687497019768,0.104047760367393,0.0012913850368931,0.140758067369461,0.226184278726578,0.0052136480808258,0.292817384004593,0.0,0.0,1.43866929761134,-0.320057508768514,-0.891656102756662,0.891656102756662,-3.45408928807953,3.45408928807953,-3.90468710556161,3.90468710556161,,,0.0,0.0,0.64382555015618,-0.64382555015618,-3.22160986304516,3.22160986304516,-4.15912564401515,4.15912564401515,-0.794028597534634,0.794028597534634,0.524215310811997,0.475784689188004,0.524215310811997,0.475784689188004,-0.0394080146215856,-0.0394080146215856,-0.0394080146215856,0.484807296190411,0.515192703809589,0.524215310811997,0.524215310811997,-0.0364765217527747,0.0364765217527747,-0.402342448522199,0.402342448522199,,,0.0,0.0,0.0413516413077224,-0.0413516413077224,-0.0845372428297997,0.0845372428297997,0.0413516413077224,-0.0413516413077224,-0.477120836555958,0.477120836555958,0.0,0.0,0.0,0.0,0.0,0.0,0.0,0.0,0.0,0,0.0,0.0,0.0,0.0,0.0,0.0,0.0,0.0,0.0,0.0,0.0,0.0,0.0,0.0,1.0,0.0,0.0,0.0,0.0,0.0,0.0,0.0,1.0,0.0,0.0,0.0,0.0,0.0,0.0,0.0,0.0,0.0,0.0,0.0,0.0,0.0,0.0,0.0,0.0,0.0,0.0,,,,,,,00-0027796,J.Webb,4.0,,,,,,,,,,,,,,,,,,,,,,,,,,,,,,,,,,,,,,,,,,,IND,,00-0030064,,J.Bostic,,,,,,,,,,,,,,0.0,,,,,,,,,,,,,,,,,,,,,,,,,,,,,,,,0.0,,,,,0,,,0.0,0.0,0.0,0.0,,,2017,,,46,1,First down,3784,"12/10/17, 13:02:12",2017-12-10T20:59:41Z,Highmark Stadium,"Heavy lake effect snow Temp: 32° F, Humidity: 69%, Wind: W 15 mph",10012017-1210-001e-f6ef-698bf0088ba8,0,0,RUSH,0,,,,23,Punt,2017-12-10T20:56:25Z,9.0,5:53,2.0,0.0,0.0,5.0,5.0,0.0,KICKOFF,PUNT,10:00,04:07,BUF 24,IND 41,3678.0,3919.0,7,13,Home,6,20,3.5,36.5,0,outdoors,a_turf,32.0,15.0,Sean McDermott,Chuck Pagano,BUF00,New Era Field,0,0.0,,,J.Webb,14.0,,,0,1,0.0,0,1,,00-0027796,,J.Webb,14.0,00-0027796,J.Webb,00-0027796,J.Webb,00-0027796,0,1,-0.320057508768514,,,,,,0.755322694778442,-75.5322694778442,2017-12-10,J.Hankins,2017,REG,IND,14,00-0030063,DT,Johnathan Hankins,Johnathan,Hankins,,,,Chest,,Full Participation in Practice,2017-12-08T12:37:50Z,2017-12-08 12:37:50
3697,2017_03_TB_MIN,2017092406,MIN,TB,REG,3,MIN,home,TB,MIN,81.0,2017-09-24,292.0,292.0,292.0,Half2,0,21.0,0,4,3.0,0,04:52,MIN 19,2,55.0,(4:52) 7-C.Keenum pass short right to 33-D.Cook to TB 45 for 36 yards (37-K.Tandy). TB-93-G.McCoy was injured during the play.,pass,36.0,0,0,1.0,0,0,0,short,right,0.0,36.0,,,,,,,3,2,0.0,,,,,3.0,2.0,34,17,34.0,17.0,17.0,34.0,17.0,17.0,0.315695941448212,0.145073518157005,0.0023573765065521,0.172303140163422,0.140707731246948,0.0027469180058687,0.221115365624428,0.0,0.0,0.329367300495505,2.63408749952214,19.8030702691798,-19.8030702691798,-0.846929146209732,0.846929146209732,21.1457642641094,-21.1457642641094,-1.306020708289,3.94010820781114,-1.306020708289,3.94010820781114,-8.4873451210442,8.4873451210442,11.0124493123504,-11.0124493123504,-19.7805885039852,19.7805885039852,37.3475671167312,-37.3475671167312,0.998770654201508,0.0012293457984924,0.998770654201508,0.0012293457984924,0.0004018545150756,0.000299334526062,0.000299334526062,0.999172508716583,0.0008274912834167,0.99928218126297,0.99928218126297,-0.0420868694089832,0.0420868694089832,0.480043880957728,-0.480043880957728,0.0,0.0004018545150756,0.0,0.0004018545150756,0.144739738123556,-0.144739738123556,0.189255904333219,-0.189255904333219,0.144178962724348,-0.144178962724348,0.308667521850691,-0.308667521850691,0.0,0.0,1.0,0.0,1.0,0.0,0.0,0.0,0.0,0,0.0,0.0,0.0,0.0,0.0,0.0,0.0,0.0,0.0,0.0,0.0,0.0,0.0,0.0,1.0,0.0,0.0,0.0,0.0,0.0,0.0,0.0,0.0,1.0,0.0,0.0,0.0,0.0,0.0,0.0,0.0,0.0,0.0,0.0,0.0,1.0,0.0,0.0,0.0,0.0,0.0,00-0028986,C.Keenum,36.0,00-0033893,D.Cook,36.0,,,,,,,,,,,,,,,,,,,,,,,,,,,,,,,,,,,,,,,,,,,,,,TB,,00-0029422,,K.Tandy,,,,,,,,,,,,,,0.0,,,,,,,,,,,,,,,,,,,,,,,,,,,,,,,,0.0,,,,,0,,,0.0,0.0,0.0,0.0,,,2017,0.671378970146179,32.8621029853821,58,1,First down,3697,"9/24/17, 13:02:29",2017-09-24T19:49:46Z,U.S. Bank Stadium,"Indoor Temp: ° F, Wind: mph",10012017-0924-06d1-e09c-91f209aa93aa,0,0,PASS,0,,,,21,End of half,2017-09-24T19:47:57Z,9.0,5:41,2.0,0.0,0.0,4.0,4.0,0.0,INTERCEPTION,END_GAME,05:41,00:00,MIN 11,TB 33,3638.0,3887.0,17,34,Home,17,51,0.0,41.0,0,dome,sportturf,,,Mike Zimmer,Dirk Koetter,MIN01,U.S. Bank Stadium,0,1.0,C.Keenum,7.0,,,D.Cook,33.0,1,0,1.0,0,1,00-0028986,,00-0033893,C.Keenum,7.0,00-0028986,D.Cook,00-0033893,D.Cook,00-0033893,0,1,2.63408749952214,1.89562519841752,7.57668444568117,5.0,0.795014953706414,0.795014953706414,0.514327466487885,48.5672533512116,2017-09-24,G.McCoy,2017,REG,TB,3,00-0027856,DT,Gerald McCoy,Gerald,McCoy,Ankle,,Questionable,Ankle,,Full Participation in Practice,2017-09-22T11:22:48Z,2017-09-22 11:22:48
3677,2017_04_WAS_KC,2017100200,KC,WAS,REG,4,KC,home,WAS,KC,71.0,2017-10-02,42.0,42.0,42.0,Half2,0,18.0,0,4,2.0,0,00:42,KC 29,6,50.0,(:42) (Shotgun) 11-A.Smith pass deep left to 12-A.Wilson pushed ob at WAS 34 for 37 yards (35-M.Nicholson). WAS-95-J.Allen was injured during the play.,pass,37.0,1,0,1.0,0,0,0,deep,left,31.0,6.0,,,,,,,2,2,0.0,,,,,2.0,2.0,20,20,20.0,20.0,0.0,20.0,20.0,0.0,0.698423624038696,0.0503559410572052,0.0007086009136401,0.0314387902617455,0.175262495875359,0.0004930474096909,0.0433175154030323,0.0,0.0,0.45743963343557,2.26279060263187,0.391204868676141,-0.391204868676141,5.43167576324121,-5.43167576324121,-2.21515176975317,2.21515176975317,1.93068448276608,0.332106119865784,1.93068448276608,0.332106119865784,-7.42556524365992,7.42556524365992,8.18699303594556,-8.18699303594556,-10.0786014914242,10.0786014914242,15.2282492729875,-15.2282492729875,0.626165628433228,0.373834371566772,0.626165628433228,0.373834371566772,0.161033451557159,0.185790538787842,0.185790538787842,0.787199079990387,0.212800920009613,0.680882394313812,0.680882394313812,0.139244756810139,-0.139244756810139,-0.0225204676695617,0.0225204676695617,0.0,0.161033451557159,0.0,0.161033451557159,-0.101896405250624,0.101896405250624,0.102252095937729,-0.102252095937729,-0.0848760903187545,0.0848760903187545,0.25510585308075,-0.25510585308075,0.0,0.0,1.0,0.0,0.0,0.0,0.0,0.0,0.0,0,0.0,0.0,0.0,0.0,0.0,0.0,0.0,0.0,0.0,0.0,0.0,0.0,0.0,0.0,1.0,0.0,0.0,0.0,0.0,0.0,0.0,0.0,0.0,1.0,0.0,0.0,0.0,0.0,0.0,0.0,0.0,0.0,0.0,0.0,0.0,1.0,0.0,0.0,0.0,0.0,0.0,00-0023436,A.Smith,37.0,00-0030669,A.Wilson,37.0,,,,,,,,,,,,,,,,,,,,,,,,,,,,,,,,,,,,,,,,,,,,,,WAS,,00-0033527,,M.Nicholson,,,,,,,,,,,,,,0.0,,,,,,,,,,,,,,,,,,,,,,,,,,,,,,,,0.0,,,,,0,,,0.0,0.0,0.0,0.0,,,2017,0.314603924751282,68.5396075248718,55,1,First down,3677,"10/2/17, 20:30:14",2017-10-03T03:33:01Z,GEHA Field at Arrowhead Stadium,"Clear Temp: 82° F, Humidity: 55%, Wind: South Southeast 14 mph",10012017-1002-00cc-2b93-23934e39de2e,0,0,PASS,0,,,,18,Field goal,2017-10-03T03:31:25Z,6.0,0:43,2.0,0.0,1.0,4.0,4.0,0.0,KICKOFF,FIELD_GOAL,00:47,00:04,KC 25,WAS 25,3638.0,3842.0,20,29,Home,9,49,6.5,48.0,0,outdoors,grass,82.0,14.0,Andy Reid,Jay Gruden,KAN00,Arrowhead Stadium,0,1.0,A.Smith,11.0,,,A.Wilson,12.0,1,0,1.0,0,1,00-0023436,,00-0030669,A.Smith,11.0,00-0023436,A.Wilson,00-0030669,A.Wilson,00-0030669,1,0,2.26279060263187,1.00175849626328,10.1013613772229,5.0,1.0,1.0,0.905989468097687,9.40105319023132,2017-10-02,J.Allen,2017,REG,WAS,4,00-0033523,DE,Jonathan Allen,Jonathan,Allen,,,,Shoulder,,Full Participation in Practice,2017-09-30T11:07:50Z,2017-09-30 11:07:50
3645,2017_18_CAR_NO,2018010701,NO,CAR,POST,18,CAR,away,NO,CAR,56.0,2018-01-07,267.0,267.0,267.0,Half2,0,19.0,0,4,1.0,0,04:27,CAR 44,10,75.0,(4:27) (Shotgun) 1-C.Newton pass incomplete deep left to 17-D.Funchess. CAR-17-D.Funchess was injured during the play.,pass,0.0,1,0,1.0,0,0,0,deep,left,26.0,,,,,,,,2,3,0.0,,,,,3.0,2.0,31,19,19.0,31.0,-12.0,19.0,31.0,-12.0,0.286132365465164,0.0688246861100197,0.0008720576879568,0.0903962999582291,0.209746956825256,0.0021750966552645,0.341852515935898,0.0,0.0,2.18556640192401,-0.516249951790087,8.00650691305648,-8.00650691305648,-2.95832943043206,2.95832943043206,11.7133238484436,-11.7133238484436,1.72131653618999,-2.23756648798008,0.0,0.0,6.4934906627168,-6.4934906627168,1.73770390420222,-1.73770390420222,2.30480017582886,-2.30480017582886,6.4302193606164,-6.4302193606164,0.0493821501731873,0.950617849826813,0.950617849826813,0.0493821501731873,-0.0071091242134571,-0.0094876885414123,0.0094876885414123,0.95772697404027,0.0422730259597302,0.0431166626513004,0.9568833373487,-0.0347151557443712,0.0347151557443712,0.500190585267658,-0.500190585267658,0.0,-0.0071091242134571,0.0,0.0,-0.0055853952383744,0.0055853952383744,0.319433431927055,-0.319433431927055,-0.0081642796015488,0.0081642796015488,0.376603484008402,-0.376603484008402,0.0,0.0,0.0,0.0,0.0,0.0,0.0,0.0,1.0,0,0.0,0.0,0.0,0.0,0.0,0.0,0.0,0.0,0.0,0.0,0.0,0.0,0.0,0.0,0.0,0.0,0.0,0.0,0.0,0.0,0.0,0.0,0.0,1.0,0.0,0.0,0.0,0.0,0.0,0.0,0.0,0.0,0.0,0.0,0.0,0.0,0.0,0.0,0.0,0.0,0.0,00-0027939,C.Newton,,00-0032055,D.Funchess,,,,,,,,,,,,,,,,,,,,,,,,,,,,,,,,,,,,,,,,,,,,,,,,,,,,,,,,,,,,,,,,,0.0,,,,,,,,,,,,,,,,,,,,,,,,,,,,,,,,0.0,,,,,0,,,0.0,0.0,0.0,0.0,,,2017,0.382622510194778,-38.2622510194778,53,1,Touchdown,3645,"1/7/18, 16:40:43",2018-01-08T00:30:00Z,Caesars Superdome,"Cloudy Temp: 63° F, Humidity: 60%, Wind: ESE 12 mph",10012018-0107-0124-d89f-fab5ec67ec2c,0,0,PASS,0,,,,19,Touchdown,2018-01-08T00:27:19Z,3.0,0:59,2.0,0.0,1.0,4.0,4.0,0.0,KICKOFF,TOUCHDOWN,05:08,04:09,CAR 25,CAR 44,3569.0,3696.0,26,31,Home,5,57,6.5,47.5,1,dome,sportturf,,,Sean Payton,Ron Rivera,NOR00,Mercedes-Benz Superdome,0,0.0,C.Newton,1.0,,,D.Funchess,17.0,1,0,0.0,0,1,00-0027939,,00-0032055,C.Newton,1.0,00-0027939,D.Funchess,00-0032055,D.Funchess,00-0032055,0,1,-0.516249951790087,0.492786109194479,7.01274532196112,4.0,1.0,1.0,0.944488406181335,5.55115938186646,2018-01-07,D.Funchess,2017,WC,CAR,18,00-0032055,WR,Devin Funchess,Devin,Funchess,Shoulder,,Questionable,Shoulder,,Limited Participation in Practice,2018-01-05T10:49:06Z,2018-01-05 10:49:06
3598,2017_12_BUF_KC,2017112603,KC,BUF,REG,12,KC,home,BUF,BUF,46.0,2017-11-26,174.0,174.0,174.0,Half2,0,23.0,0,4,4.0,0,02:54,BUF 46,4,42.0,(2:54) (Shotgun) 11-A.Smith pass incomplete deep left to 10-T.Hill. KC-10-T.Hill was injured during the play.,pass,0.0,1,0,1.0,0,0,0,deep,left,19.0,,,,,,,,3,3,0.0,,,,,3.0,3.0,10,16,10.0,16.0,-6.0,10.0,16.0,-6.0,0.43871009349823,0.108826898038387,0.0004667468601837,0.132520064711571,0.139365583658218,0.0087746912613511,0.171335890889168,0.0,0.0,0.379942728905007,-2.38698242651299,-11.301460016286,11.301460016286,-0.390195794936087,0.390195794936087,-8.90528610094622,8.90528610094622,3.37158538412768,-5.75856781064067,0.0,0.0,-6.99336050603884,6.99336050603884,-0.39587603033178,0.39587603033178,-17.4882011302572,17.4882011302572,7.04071601322793,-7.04071601322793,0.160650432109833,0.839349567890167,0.160650432109833,0.839349567890167,-0.0706735849380493,-0.0632515996694565,-0.0632515996694565,0.0899768471717835,0.910023152828217,0.179969415068626,0.179969415068626,-0.112950474023819,0.112950474023819,-0.342403296544635,0.342403296544635,0.0,-0.0706735849380493,0.0,0.0,-0.0957106034613278,0.0957106034613278,-0.196914112417718,0.196914112417718,-0.0957106034613278,0.0957106034613278,-0.289147770254632,0.289147770254632,0.0,0.0,0.0,0.0,0.0,0.0,0.0,1.0,1.0,0,0.0,0.0,0.0,0.0,0.0,0.0,0.0,0.0,0.0,0.0,0.0,0.0,0.0,0.0,0.0,0.0,0.0,0.0,0.0,0.0,0.0,0.0,0.0,1.0,0.0,0.0,0.0,0.0,0.0,0.0,0.0,0.0,0.0,0.0,0.0,0.0,0.0,0.0,0.0,0.0,0.0,00-0023436,A.Smith,,00-0033040,T.Hill,,,,,,,,,,,,,,,,,,,,,,,,,,,,,,,,,,,,,,,,,,,,,,,,,,,,,,,,,,,,,,,,,0.0,,,,,,,,,,,,,,,,,,,,,,,,,,,,,,,,0.0,,,,,0,,,0.0,0.0,0.0,0.0,,,2017,0.398179620504379,-39.8179620504379,47,0,Turnover on downs,3598,"11/26/17, 13:02:21",2017-11-26T20:42:16Z,GEHA Field at Arrowhead Stadium,"Partly Cloudy Temp: 62° F, Humidity: 36%, Wind: South Southwest 9 mph",10012017-1126-0366-9b25-c18a99a18070,0,0,PASS,0,,,,23,Turnover on downs,2017-11-26T20:37:22Z,8.0,4:20,3.0,0.0,0.0,4.0,4.0,0.0,PUNT,DOWNS,07:09,02:49,KC 12,BUF 46,3420.0,3598.0,16,10,Home,-6,26,8.5,47.5,0,outdoors,grass,62.0,9.0,Andy Reid,Sean McDermott,KAN00,Arrowhead Stadium,0,0.0,A.Smith,11.0,,,T.Hill,10.0,1,0,0.0,0,1,00-0023436,,00-0033040,A.Smith,11.0,00-0023436,T.Hill,00-0033040,T.Hill,00-0033040,0,0,-2.38698242651299,0.50041305030826,5.722079905594,3.0,1.0,1.0,0.977452516555786,2.25474834442139,2017-11-26,T.Hill,2017,REG,KC,12,00-0033040,WR,Tyreek Hill,Tyreek,Hill,,,,Glute,,Full Participation in Practice,2017-11-24T12:49:27Z,2017-11-24 12:49:27
3598,2017_06_CLE_HOU,2017101502,HOU,CLE,REG,6,HOU,home,CLE,HOU,80.0,2017-10-15,573.0,573.0,573.0,Half2,0,23.0,0,4,1.0,0,09:33,HOU 20,10,6.0,(9:33) (Shotgun) 27-D.Foreman left guard to HOU 21 for 1 yard (99-C.Brantley). HOU-27-D.Foreman was injured during the play. His return is Probable.,run,1.0,1,0,0.0,0,0,0,,,,,left,guard,,,,,2,3,0.0,,,,,2.0,3.0,33,10,33.0,10.0,23.0,33.0,10.0,23.0,0.143542543053627,0.134000420570374,0.0020113757345825,0.185406193137169,0.215538740158081,0.0027750974986702,0.316725611686707,0.0,0.0,1.16537833213806,-0.501668210141361,23.1985215436413,-23.1985215436413,-7.33978015952744,7.33978015952744,25.7278882248465,-25.7278882248465,,,0.0,0.0,5.85201527053141,-5.85201527053141,11.0945777282177,-11.0945777282177,-0.15834186351276,0.15834186351276,24.9171915936131,-24.9171915936131,0.999835133552551,0.0001648664474487,0.999835133552551,0.0001648664474487,-0.0001531839370727,2.98023223876953e-06,2.98023223876953e-06,0.999681949615479,0.0003180503845214,0.999969363212585,0.999969363212585,-0.0520397385116667,0.0520397385116667,0.42631852123568,-0.42631852123568,,,0.0,0.0,-0.0532614828740381,0.0532614828740381,0.207038043233749,-0.207038043233749,-0.0525011026953481,0.0525011026953481,0.468344629152395,-0.468344629152395,0.0,0.0,0.0,0.0,0.0,0.0,0.0,0.0,0.0,0,0.0,0.0,0.0,0.0,0.0,0.0,0.0,0.0,0.0,0.0,0.0,0.0,0.0,0.0,1.0,0.0,0.0,0.0,0.0,0.0,0.0,0.0,1.0,0.0,0.0,0.0,0.0,0.0,0.0,0.0,0.0,0.0,0.0,0.0,0.0,0.0,0.0,0.0,0.0,0.0,0.0,,,,,,,00-0033925,D.Foreman,1.0,,,,,,,,,,,,,,,,,,,,,,,,,,,,,,,,,,,,,,,,,,,CLE,,00-0033962,,C.Brantley,,,,,,,,,,,,,,0.0,,,,,,,,,,,,,,,,,,,,,,,,,,,,,,,,0.0,,,,,0,,,0.0,0.0,0.0,0.0,,,2017,,,49,0,Punt,3598,"10/15/17, 13:02:17",2017-10-15T19:36:34Z,NRG Stadium,"Partly Cloudy Temp: 85° F, Humidity: 62%, Wind: N 7 mph",10012017-1015-0293-8919-c455966fbc65,0,0,RUSH,0,,,,23,Punt,2017-10-15T19:36:34Z,3.0,1:36,0.0,0.0,0.0,4.0,4.0,0.0,PUNT,PUNT,09:33,07:57,HOU 20,HOU 26,3598.0,3667.0,17,33,Home,16,50,7.5,46.0,0,closed,astroturf,,,Bill O'Brien,Hue Jackson,HOU00,NRG Stadium,0,0.0,,,D.Foreman,27.0,,,0,1,0.0,0,1,,00-0033925,,D.Foreman,27.0,00-0033925,D.Foreman,00-0033925,D.Foreman,00-0033925,0,1,-0.501668210141361,,,,,,0.229521781206131,-22.9521781206131,2017-10-15,D.Foreman,2017,REG,HOU,6,00-0033925,RB,D'Onta Foreman,D'Onta,Foreman,,,,Hip,,Full Participation in Practice,2017-10-13T11:44:48Z,2017-10-13 11:44:48
3588,2017_14_NO_ATL,2017120700,ATL,NO,REG,14,NO,away,ATL,ATL,45.0,2017-12-07,211.0,211.0,211.0,Half2,0,19.0,0,4,2.0,0,03:31,ATL 45,10,69.0,(3:31) (Shotgun) 9-D.Brees pass short left to 22-M.Ingram to ATL 33 for 12 yards (23-R.Alford; 59-D.Campbell). NO-22-M.Ingram was injured during the play.,pass,12.0,1,0,1.0,0,0,0,short,left,0.0,12.0,,,,,,,3,3,0.0,,,,,3.0,3.0,20,17,17.0,20.0,-3.0,17.0,20.0,-3.0,0.284605026245117,0.0577271357178688,0.0004971385933458,0.0796447098255158,0.258831679821014,0.0032801013439893,0.315414220094681,0.0,0.0,2.25926612969488,1.21176002494758,-1.11929540050915,1.11929540050915,2.80870705423877,-2.80870705423877,-10.5747606445655,10.5747606445655,-0.563118362100795,1.77487838704837,-0.563118362100795,1.77487838704837,6.22864842630224,-6.22864842630224,-4.77234944424708,4.77234944424708,16.1684866168071,-16.1684866168071,-28.9029191256121,28.9029191256121,0.387499362230301,0.612500637769699,0.612500637769699,0.387499362230301,0.0829192399978638,0.0899673402309418,-0.0899673402309418,0.529581397771835,0.470418602228165,0.36296471953392,0.63703528046608,0.102355831073025,-0.102355831073025,-0.291146646680394,0.291146646680394,0.0,0.0829192399978638,0.0,0.0829192399978638,0.143100694605545,-0.143100694605545,-0.0319688881742902,0.0319688881742902,0.143100694605545,-0.143100694605545,-0.543554839025731,0.543554839025731,0.0,0.0,1.0,0.0,0.0,0.0,0.0,0.0,0.0,0,0.0,0.0,0.0,0.0,0.0,0.0,0.0,0.0,0.0,0.0,0.0,0.0,0.0,0.0,0.0,0.0,0.0,0.0,0.0,0.0,0.0,0.0,0.0,1.0,0.0,0.0,0.0,0.0,0.0,0.0,0.0,0.0,0.0,0.0,0.0,1.0,1.0,0.0,0.0,0.0,0.0,00-0020531,D.Brees,12.0,00-0027966,M.Ingram,12.0,,,,,,,,,,,,,,,,,,,,,,,,,,,,,,,,,,,,,,,,,,,,,,,,,,,,00-0030528,R.Alford,ATL,00-0032401,D.Campbell,ATL,,,,,,,0.0,,,,,,,,,,,,,,,,,,,,,,,,,,,,,,,,0.0,,,,,0,,,0.0,0.0,0.0,0.0,,,2017,0.715899586677551,28.4100413322449,55,1,First down,3588,"12/7/17, 20:26:33",2017-12-08T04:10:39Z,Mercedes-Benz Stadium,"Cloudy Temp: ° F, Wind: mph",10012017-1207-00c6-bcda-fafe4368005b,0,0,PASS,0,,,,19,Turnover,2017-12-08T04:08:01Z,10.0,2:24,4.0,1.0,0.0,4.0,4.0,0.0,KICKOFF,INTERCEPTION,03:49,01:25,NO 20,ATL 11,3508.0,3843.0,17,20,Home,3,37,2.5,51.5,1,closed,fieldturf,,,Dan Quinn,Sean Payton,ATL97,Mercedes-Benz Stadium,0,1.0,D.Brees,9.0,,,M.Ingram,22.0,1,0,1.0,0,1,00-0020531,,00-0027966,D.Brees,9.0,00-0020531,M.Ingram,00-0027966,M.Ingram,00-0027966,0,0,1.21176002494758,0.849136014980922,6.92492980704992,6.0,0.592598667542916,0.228434121410828,0.757004737854004,24.2995262145996,2017-12-07,M.Ingram,2017,REG,NO,14,00-0027966,RB,Mark Ingram,Mark,Ingram,Toe,,Questionable,Toe,,Did Not Participate In Practice,2017-12-06T12:21:35Z,2017-12-06 12:21:35
3582,2017_06_DET_NO,2017101504,NO,DET,REG,6,DET,away,NO,NO,15.0,2017-10-15,112.0,1012.0,1012.0,Half2,0,20.0,0,3,2.0,0,01:52,NO 15,10,61.0,(1:52) (Shotgun) 9-M.Stafford sacked at NO 22 for -7 yards (94-C.Jordan). DET-73-G.Robinson was injured during the play. His return is Probable.,pass,-7.0,1,0,1.0,0,0,0,,,,,,,,,,,3,3,0.0,,,,,3.0,3.0,45,17,17.0,45.0,-28.0,17.0,45.0,-28.0,0.0051145241595804,0.0188622754067183,0.0007809625240042,0.0342079401016235,0.434554278850555,0.0010008396347984,0.505479156970978,0.0,0.0,4.54641428263858,-1.55653501639608,26.3805679882679,-26.3805679882679,11.2042123095548,-11.2042123095548,12.1412489309061,-12.1412489309061,,,0.0,0.0,-7.00581175624393,7.00581175624393,-7.66851534740999,7.66851534740999,-4.16207756457152,4.16207756457152,0.67963707938019,-0.67963707938019,0.0009490783559158,0.999050921644084,0.999050921644084,0.0009490783559158,-0.0001671331119723,-9.35980933718383e-05,9.35980933718383e-05,0.999218054756057,0.0007819452439434,0.0003131330595351,0.999686866940465,0.167406772841181,-0.167406772841181,0.282335519182233,-0.282335519182233,,,0.0,0.0,-0.678997200641272,0.678997200641272,0.677921657315291,-0.677921657315291,-0.67712479895675,0.67712479895675,0.726103630072739,-0.726103630072739,0.0,0.0,0.0,0.0,0.0,0.0,0.0,0.0,0.0,0,0.0,0.0,0.0,0.0,0.0,0.0,0.0,0.0,0.0,0.0,0.0,0.0,0.0,0.0,1.0,0.0,0.0,0.0,0.0,0.0,0.0,1.0,0.0,1.0,1.0,0.0,0.0,0.0,0.0,0.0,0.0,0.0,0.0,0.0,0.0,0.0,0.0,0.0,0.0,0.0,0.0,00-0026498,M.Stafford,,,,,,,,,,,,,,,,,,,,,,,,,,,,,,,,,,,,00-0027962,C.Jordan,,,00-0027962,C.Jordan,,,,,,,,,NO,,00-0027962,,C.Jordan,,,,,,,,,,,,,,0.0,,,,,,,,,,,,,,,,,,,,,,,,,00-0027962,C.Jordan,,,,,,0.0,,,,,0,,,0.0,0.0,0.0,0.0,,,2017,,,48,1,Touchdown,3582,"10/15/17, 13:02:41",2017-10-15T19:40:11Z,Caesars Superdome,"Cloudy Temp: 84° F, Humidity: 80%, Wind: SE 2 mph",10012017-1015-0461-6d8b-f1d283ecdb58,0,0,SACK,0,,,,20,Touchdown,2017-10-15T19:33:23Z,11.0,3:16,4.0,1.0,1.0,3.0,3.0,0.0,FUMBLE,TOUCHDOWN,04:37,01:21,DET 39,NO 22,3363.0,3629.0,38,52,Home,14,90,6.0,50.5,0,dome,sportturf,,,Sean Payton,Jim Caldwell,NOR00,Mercedes-Benz Superdome,0,0.0,M.Stafford,9.0,,,,,1,0,0.0,0,1,00-0026498,,,M.Stafford,9.0,00-0026498,,,,,0,1,-1.55653501639608,,,,,,0.777482748031616,22.2517251968384,2017-10-15,G.Robinson,2017,REG,DET,6,00-0031386,T,Greg Robinson,Greg,Robinson,,,,Not Injury Related,,Full Participation in Practice,2017-10-13T12:47:00Z,2017-10-13 12:47:00
3562,2017_09_WAS_SEA,2017110508,SEA,WAS,REG,9,WAS,away,SEA,WAS,80.0,2017-11-05,895.0,895.0,895.0,Half2,0,20.0,0,4,4.0,0,14:55,WAS 20,14,-4.0,"(14:55) 5-T.Way punts 36 yards to SEA 44, Center-57-N.Sundberg. 16-T.Lockett pushed ob at SEA 44 for no gain (55-C.Carter; 50-M.Spaight). WAS-50-M.Spaight was injured during the play. PENALTY on SEA-57-M.Wilhoite, Illegal Block Above the Waist, 10 yards, enforced at SEA 44.",punt,0.0,0,0,0.0,0,0,0,,,,,,,,36.0,,,3,3,0.0,,,,,3.0,3.0,2,10,10.0,2.0,8.0,10.0,2.0,8.0,0.0472759529948235,0.263451933860779,0.0067593599669635,0.420960932970047,0.103790573775768,0.0026612284127622,0.155100017786026,0.0,0.0,-2.34820674965158,0.523005053633824,-11.0350100581499,11.0350100581499,11.2190161754261,-11.2190161754261,-6.71135249209495,6.71135249209495,,,0.0,0.0,1.87746349479415,-1.87746349479415,0.335019924369072,-0.335019924369072,12.8414028909639,-12.8414028909639,-22.5580385901094,22.5580385901094,0.759075701236725,0.240924298763275,0.240924298763275,0.759075701236725,0.0352453887462616,0.0644007325172424,-0.0644007325172424,0.205678910017014,0.794321089982987,0.643530428409576,0.356469571590424,0.318338425589742,-0.318338425589742,-0.205615177750587,0.205615177750587,,,0.0,0.0,0.0627435296773911,-0.0627435296773911,-0.116525575518608,0.116525575518608,0.0643926411867142,-0.0643926411867142,-0.431479170918465,0.431479170918465,0.0,0.0,0.0,0.0,0.0,0.0,0.0,0.0,0.0,0,0.0,0.0,0.0,0.0,0.0,0.0,0.0,0.0,0.0,0.0,0.0,0.0,0.0,0.0,0.0,0.0,1.0,0.0,0.0,0.0,0.0,0.0,0.0,0.0,0.0,0.0,0.0,0.0,0.0,0.0,0.0,0.0,0.0,1.0,0.0,0.0,1.0,0.0,0.0,0.0,0.0,,,,,,,,,,,,,,,,,,,,,,00-0032211,T.Lockett,,,,,,,00-0030140,T.Way,,,,,,,,,,,,,,,,,,,,,,,,,,,00-0028100,C.Carter,WAS,00-0031945,M.Spaight,WAS,,,,,,,0.0,,,,,,,,,,,,,,,,,,,,,,,,,,,,,,,SEA,0.0,SEA,00-0028836,M.Wilhoite,10.0,0,,Illegal Block Above the Waist,0.0,0.0,0.0,0.0,,,2017,,,43,0,Punt,3562,"11/5/17, 16:05:27",2017-11-05T23:32:48Z,Lumen Field,"Rain Temp: 36° F, Humidity: 86%, Wind: NNW 11 mph",10012017-1105-0864-c399-9f9faf7f46c5,0,0,PUNT,1,,,,20,Punt,2017-11-05T23:28:12Z,3.0,1:29,0.0,0.0,0.0,3.0,4.0,0.0,PUNT,PUNT,01:11,14:42,WAS 24,WAS 20,3478.0,3562.0,17,14,Home,-3,31,8.0,44.5,0,outdoors,fieldturf,36.0,11.0,Pete Carroll,Jay Gruden,SEA00,CenturyLink Field,0,1.0,,,,,,,0,0,0.0,1,0,,,,,,,,,,,1,0,0.523005053633824,,,,,,,,2017-11-05,M.Spaight,2017,REG,WAS,9,00-0031945,LB,Martrell Spaight,Martrell,Spaight,Shoulder,,Questionable,Shoulder,,Limited Participation in Practice,2017-11-03T11:05:40Z,2017-11-03 11:05:40
3554,2017_11_TB_MIA,2017111911,MIA,TB,REG,11,TB,away,MIA,TB,99.0,2017-11-19,539.0,539.0,539.0,Half2,0,20.0,0,4,4.0,0,08:59,TB 1,24,0.0,"(8:59) (Punt formation) 9-B.Anger punts 45 yards to TB 46, Center-65-G.Sanborn. 14-J.Landry to TB 33 for 13 yards (53-A.Glanton). MIA-14-J.Landry was injured during the play. His return is Questionable. PENALTY on MIA-31-M.Thomas, Offensive Holding, 10 yards, enforced at TB 33.",punt,0.0,0,0,0.0,0,0,0,,,,,,,,45.0,,,2,1,0.0,,,,,1.0,2.0,13,20,20.0,13.0,7.0,20.0,13.0,7.0,0.145313695073128,0.259591490030289,0.0404266715049744,0.438890784978867,0.0540116243064404,0.0007532432791776,0.061012513935566,0.0,0.0,-3.34123435092624,0.306349525810219,-6.91165463310662,6.91165463310662,2.21692465530941,-2.21692465530941,-8.51507909853508,8.51507909853508,,,0.0,0.0,8.16685342829442,-8.16685342829442,-2.31891822397887,2.31891822397887,13.6856960274745,-13.6856960274745,-22.9223575340727,22.9223575340727,0.760097682476044,0.239902317523956,0.239902317523956,0.760097682476044,-0.0028253495693206,0.0786185413599014,-0.0786185413599014,0.242727667093277,0.757272332906723,0.719011902809143,0.280988097190857,-0.122975498437881,0.122975498437881,-0.455020634954952,0.455020634954952,,,0.0,0.0,0.0397431715073356,-0.0397431715073356,0.022767685353756,-0.022767685353756,0.0276807113232384,-0.0276807113232384,-0.488654389977455,0.488654389977455,0.0,0.0,0.0,0.0,0.0,0.0,0.0,0.0,0.0,0,0.0,0.0,0.0,0.0,0.0,0.0,0.0,0.0,0.0,0.0,0.0,0.0,0.0,0.0,1.0,0.0,1.0,0.0,0.0,0.0,0.0,0.0,0.0,0.0,0.0,0.0,0.0,0.0,0.0,0.0,0.0,0.0,0.0,1.0,0.0,0.0,0.0,0.0,0.0,0.0,0.0,,,,,,,,,,,,,,,,,,,,,,00-0031382,J.Landry,,,,,,,00-0029692,B.Anger,,,,,,,,,,,,,,,,,,,,,TB,,00-0031120,,A.Glanton,,,,,,,,,,,,,,0.0,,,,,,,,,,,,,,,,,,,,,,,,,,,,,,,MIA,13.0,MIA,00-0028908,M.Thomas,10.0,0,,Offensive Holding,0.0,0.0,0.0,0.0,,,2017,,,47,0,Punt,3554,"11/19/17, 13:02:35",2017-11-19T20:48:45Z,Hard Rock Stadium,"Sunny Temp: 81° F, Humidity: 51%, Wind: W 9 mph",10012017-1119-1136-a9db-08262cd7dde8,0,0,PUNT,1,,,,20,Punt,2017-11-19T20:40:00Z,5.0,3:34,1.0,0.0,0.0,4.0,4.0,-8.0,PUNT,PUNT,12:22,08:48,TB 1,TB 1,3348.0,3554.0,30,20,Home,-10,50,-1.0,44.0,0,outdoors,grass,81.0,9.0,Adam Gase,Dirk Koetter,MIA00,Hard Rock Stadium,0,1.0,,,,,,,0,0,0.0,1,0,,,,,,,,,,,0,0,0.306349525810219,,,,,,,,2017-11-19,J.Landry,2017,REG,MIA,11,00-0031382,WR,Jarvis Landry,Jarvis,Landry,,,,Chest,,Full Participation in Practice,2017-11-17T12:15:38Z,2017-11-17 12:15:38
3543,2017_14_CHI_CIN,2017121002,CIN,CHI,REG,14,CIN,home,CHI,CIN,75.0,2017-12-10,558.0,558.0,558.0,Half2,0,18.0,0,4,1.0,0,09:18,CIN 25,10,39.0,(9:18) (Shotgun) 14-A.Dalton pass incomplete short middle to 18-A.Green (44-N.Kwiatkoski). CHI-37-B.Callahan was injured during the play. {tipped at the line of scrimmage},pass,0.0,1,0,1.0,0,0,0,short,middle,0.0,,,,,,,,3,3,0.0,,,,,3.0,3.0,7,33,7.0,33.0,-26.0,7.0,33.0,-26.0,0.138628885149956,0.129797771573067,0.0024439869448542,0.177971616387367,0.20743316411972,0.0029241347219795,0.340800434350967,0.0,0.0,1.37366819893941,-0.506869290024042,-33.6616005826088,33.6616005826088,-10.0769940156606,10.0769940156606,-24.1733721536582,24.1733721536582,-0.506869290024042,0.0,0.0,0.0,-5.36658553007874,5.36658553007874,-12.0333190323458,12.0333190323458,-1.81284535696614,1.81284535696614,-24.3337256230004,24.3337256230004,8.96154815563932e-05,0.999910384518444,8.96154815563932e-05,0.999910384518444,-3.85985185857862e-06,-8.49502248456702e-06,-8.49502248456702e-06,8.57556296978146e-05,0.999914244370302,4.28245475632139e-05,4.28245475632139e-05,-0.172834989808532,0.172834989808532,-0.39546573541464,0.39546573541464,0.0,-3.85985185857862e-06,0.0,0.0,0.0419061597536863,-0.0419061597536863,-0.339720955118537,0.339720955118537,0.845577996606714,-0.845577996606714,-1.25750748858263,1.25750748858263,0.0,0.0,0.0,0.0,0.0,0.0,0.0,0.0,1.0,0,0.0,0.0,0.0,0.0,0.0,0.0,0.0,0.0,0.0,0.0,0.0,0.0,0.0,0.0,0.0,0.0,0.0,0.0,0.0,0.0,0.0,0.0,0.0,1.0,0.0,0.0,0.0,0.0,0.0,0.0,0.0,0.0,0.0,0.0,0.0,0.0,0.0,0.0,0.0,0.0,0.0,00-0027973,A.Dalton,,00-0027942,A.Green,,,,,,,,,,,,,,,,,,,,,,,,,,,,,,,,,,,,,,,,,,,,,,,,,,,,,,,,,,,,,,,,,0.0,,,,,,,00-0032773,N.Kwiatkoski,,,,,,,,,,,,,,,,,,,,,,,,0.0,,,,,0,,,0.0,0.0,0.0,0.0,,,2017,0.567371368408203,-56.7371368408203,50,1,First down,3543,"12/10/17, 13:02:29",2017-12-10T20:41:38Z,Paycor Stadium,"Partly Cloudy Temp: 31° F, Humidity: 64%, Wind: SSW 11 mph",10012017-1210-02a1-1a11-95541359c823,0,0,PASS,0,,,,18,Turnover on downs,2017-12-10T20:40:54Z,9.0,2:59,3.0,0.0,0.0,4.0,4.0,5.0,KICKOFF,DOWNS,09:18,06:19,CIN 25,CHI 36,3528.0,3785.0,33,7,Home,-26,40,6.0,40.5,0,outdoors,fieldturf,31.0,11.0,Marvin Lewis,John Fox,CIN00,Paul Brown Stadium,0,0.0,A.Dalton,14.0,,,A.Green,18.0,1,0,0.0,0,1,00-0027973,,00-0027942,A.Dalton,14.0,00-0027973,A.Green,00-0027942,A.Green,00-0027942,0,1,-0.506869290024042,0.683980951001717,7.45686275779735,6.0,0.553767159173731,0.241614654252771,0.681133925914764,31.8866074085236,2017-12-10,B.Callahan,2017,REG,CHI,14,00-0031904,CB,Bryce Callahan,Bryce,Callahan,,,,Knee,,Full Participation in Practice,2017-12-06T12:23:54Z,2017-12-06 12:23:54
3540,2017_15_CIN_MIN,2017121704,MIN,CIN,REG,15,CIN,away,MIN,MIN,44.0,2017-12-17,126.0,126.0,126.0,Half2,0,25.0,0,4,4.0,0,02:06,MIN 44,5,32.0,(2:06) (Shotgun) 5-A.McCarron pass incomplete deep left to 80-J.Malone. CIN-71-A.Smith was injured during the play.,pass,0.0,1,0,1.0,0,0,0,deep,left,22.0,,,,,,,,2,2,0.0,,,,,2.0,2.0,34,7,7.0,34.0,-27.0,7.0,34.0,-27.0,0.532519280910492,0.102320730686188,0.0005306685343384,0.0920181423425674,0.129399806261063,0.0042425636202096,0.138968780636787,0.0,0.0,0.417315484955907,-0.417315484955907,30.8254840514333,-30.8254840514333,9.60222618741682,-9.60222618741682,18.929017330348,-18.929017330348,3.79832433041884,-4.21563981537474,0.0,0.0,0.0945217731059529,-0.0945217731059529,1.9879661813639,-1.9879661813639,-14.3094414597144,14.3094414597144,30.4019586904352,-30.4019586904352,7.04296762705781e-05,0.999929570323729,0.999929570323729,7.04296762705781e-05,-1.08250314951874e-05,1.24586586025544e-06,-1.24586586025544e-06,0.999940395355225,5.96046447753906e-05,1.16287374112289e-05,0.999988371262589,0.0994994395697476,-0.0994994395697476,0.270422884903383,-0.270422884903383,-9.1375331976451e-06,-1.68749829754233e-06,0.0,0.0,-0.924818525287264,0.924818525287264,1.03987704103929,-1.03987704103929,-0.924808344134362,0.924808344134362,1.21156815064023,-1.21156815064023,0.0,0.0,0.0,0.0,0.0,0.0,0.0,1.0,1.0,0,0.0,0.0,0.0,0.0,0.0,0.0,0.0,0.0,0.0,0.0,0.0,0.0,0.0,0.0,0.0,0.0,0.0,0.0,0.0,0.0,0.0,0.0,0.0,1.0,0.0,0.0,0.0,0.0,0.0,0.0,0.0,0.0,0.0,0.0,0.0,0.0,0.0,0.0,0.0,0.0,0.0,00-0031288,A.McCarron,,00-0033859,J.Malone,,,,,,,,,,,,,,,,,,,,,,,,,,,,,,,,,,,,,,,,,,,,,,,,,,,,,,,,,,,,,,,,,0.0,,,,,,,,,,,,,,,,,,,,,,,,,,,,,,,,0.0,,,,,0,,,0.0,0.0,0.0,0.0,,,2017,0.356406360864639,-35.6406360864639,46,0,Turnover on downs,3540,"12/17/17, 13:02:25",2017-12-17T20:57:52Z,U.S. Bank Stadium,"N/A (Indoors) Temp: ° F, Wind: mph",10012017-1217-0490-2368-0aa9aa90238e,0,0,PASS,0,,,,25,Turnover on downs,2017-12-17T20:52:28Z,7.0,2:44,2.0,0.0,0.0,4.0,4.0,15.0,PUNT,DOWNS,04:44,02:00,CIN 24,MIN 44,3393.0,3540.0,7,34,Home,27,41,12.5,42.5,0,dome,sportturf,,,Mike Zimmer,Marvin Lewis,MIN01,U.S. Bank Stadium,0,0.0,A.McCarron,5.0,,,J.Malone,80.0,1,0,0.0,0,1,00-0031288,,00-0033859,A.McCarron,5.0,00-0031288,J.Malone,00-0033859,J.Malone,00-0033859,0,1,-0.417315484955907,0.400348020794939,5.20059687743196,3.0,1.0,1.0,0.973860025405884,2.61399745941162,2017-12-17,A.Smith,2017,REG,CIN,15,00-0026982,T,Andre Smith,Andre,Smith,,,,Not Injury Related,,Full Participation in Practice,2017-12-15T10:53:54Z,2017-12-15 10:53:54
3529,2017_12_SEA_SF,2017112608,SF,SEA,REG,12,SF,home,SEA,SF,75.0,2017-11-26,897.0,897.0,897.0,Half2,0,22.0,0,4,1.0,0,14:57,SF 25,10,23.0,"(14:57) (Shotgun) 3-C.Beathard sacked at SF 18 for -7 yards (72-M.Bennett). SF-74-J.Staley was injured during the play. His return is Probable. PENALTY on SEA-72-M.Bennett, Defensive Offside, 5 yards, enforced at SF 25 - No Play.",no_play,0.0,1,0,0.0,0,0,0,,,,,,,,,,,3,2,0.0,,,,,3.0,2.0,6,21,6.0,21.0,-15.0,6.0,21.0,-15.0,0.0516454912722111,0.151414379477501,0.0024923526216298,0.203470811247826,0.22550942003727,0.0032623428851366,0.362205237150192,0.0,0.0,1.33496608352289,0.545191951096058,-17.5433539990206,17.5433539990206,-1.27357031252932,1.27357031252932,-18.3970503949725,18.3970503949725,,,0.0,0.0,-5.74552801641403,5.74552801641403,-6.30837457941379,6.30837457941379,-18.2905222494737,18.2905222494737,3.74595547478626,-3.74595547478626,0.057027067989111,0.942972932010889,0.057027067989111,0.942972932010889,0.0139065720140934,0.0002360623329877,0.0002360623329877,0.0709336400032044,0.929066359996796,0.0246630143374205,0.0246630143374205,0.0980527420186375,-0.0980527420186375,-0.56392908627916,0.56392908627916,,,0.0,0.0,-0.290952479194886,0.290952479194886,-0.0812587141990662,0.0812587141990662,-0.284674083542115,0.284674083542115,-0.17251268029213,0.17251268029213,0.0,0.0,0.0,0.0,0.0,0.0,0.0,0.0,0.0,0,0.0,0.0,0.0,0.0,0.0,0.0,0.0,0.0,0.0,0.0,0.0,0.0,0.0,0.0,0.0,0.0,1.0,0.0,0.0,0.0,0.0,0.0,0.0,0.0,0.0,0.0,0.0,0.0,0.0,0.0,0.0,0.0,0.0,0.0,0.0,0.0,0.0,0.0,0.0,0.0,0.0,,,,,,,,,,,,,,,,,,,,,,,,,,,,,,,,,,,,,,,,,,,,,,,,,,,,,,,,,,,,,,,,,,,,,,0.0,,,,,,,,,,,,,,,,,,,,,,,,,,,,,,,,0.0,SEA,00-0026618,M.Bennett,5.0,0,,Defensive Offside,0.0,0.0,0.0,0.0,,,2017,,,45,1,First down,3529,"11/26/17, 16:06:26",2017-11-26T23:30:52Z,Levi's® Stadium,"cloudy Temp: 66° F, Humidity: 68%, Wind: Southeast 12 mph",10012017-1126-081d-dce0-990731708de1,0,0,PENALTY,0,,,,22,Punt,2017-11-26T23:30:09Z,5.0,3:10,1.0,0.0,0.0,4.0,4.0,5.0,KICKOFF,PUNT,14:57,11:47,SF 25,SF 48,3514.0,3685.0,24,13,Home,-11,37,-7.0,45.0,1,outdoors,grass,66.0,12.0,Kyle Shanahan,Pete Carroll,SFO01,Levi's Stadium,0,1.0,C.Beathard,3.0,,,,,1,0,0.0,0,1,00-0033936,,,C.Beathard,3.0,00-0033936,,,,,0,0,0.545191951096058,,,,,,0.710160970687866,28.9839029312134,2017-11-26,J.Staley,2017,REG,SF,12,00-0025415,T,Joe Staley,Joe,Staley,,,,Not Injury Related,,Full Participation in Practice,2017-11-24T13:58:56Z,2017-11-24 13:58:56
3521,2017_18_CAR_NO,2018010701,NO,CAR,POST,18,NO,home,CAR,CAR,2.0,2018-01-07,312.0,312.0,312.0,Half2,0,18.0,1,4,2.0,1,05:12,CAR 2,2,62.0,"(5:12) 61-J.LeRibeus reported in as eligible. 41-A.Kamara right guard for 2 yards, TOUCHDOWN. NO-65-S.Kelemete was injured during the play. His return is Probable.",run,2.0,0,0,0.0,0,0,0,,,,,right,guard,,,,,2,3,0.0,,NO,A.Kamara,00-0033906,2.0,3.0,30,19,24.0,19.0,5.0,30.0,19.0,11.0,0.0372261479496956,0.0077646975405514,0.0002685053623281,0.008975408039987,0.158457651734352,0.0033719062339514,0.78393566608429,0.0,0.0,5.88300747063477,1.11699252936523,8.62708088476607,-8.62708088476607,-2.95832943043206,2.95832943043206,12.4297885777247,-12.4297885777247,,,0.0,0.0,7.43035656731809,-7.43035656731809,2.03355268067216,-2.03355268067216,4.96298261662014,-4.96298261662014,4.48850164910627,-4.48850164910627,0.920784950256348,0.0792150497436523,0.920784950256348,0.0792150497436523,0.0393056771689675,0.0200712334581988,0.0200712334581988,0.960090627425315,0.0399093725746849,0.94689404964447,0.94689404964447,-0.0347151557443712,0.0347151557443712,0.503463938248272,-0.503463938248272,,,0.0,0.0,-0.0055853952383744,0.0055853952383744,0.329815909121126,-0.329815909121126,-0.0081642796015488,0.0081642796015488,0.379876836989015,-0.379876836989015,0.0,1.0,0.0,0.0,0.0,0.0,0.0,0.0,0.0,0,0.0,0.0,0.0,0.0,0.0,0.0,0.0,0.0,0.0,0.0,0.0,0.0,0.0,0.0,0.0,0.0,0.0,0.0,0.0,0.0,0.0,0.0,1.0,0.0,0.0,1.0,0.0,1.0,0.0,0.0,0.0,0.0,0.0,0.0,0.0,0.0,0.0,0.0,0.0,0.0,0.0,,,,,,,00-0033906,A.Kamara,2.0,,,,,,,,,,,,,,,,,,,,,,,,,,,,,,,,,,,,,,,,,,,,,,,,,,,,,,,,,,,,,0.0,,,,,,,,,,,,,,,,,,,,,,,,,,,,,,,,0.0,,,,,0,,,0.0,0.0,0.0,0.0,,,2017,,,51,1,Touchdown,3521,"1/7/18, 16:40:43",2018-01-08T00:24:39Z,Caesars Superdome,"Cloudy Temp: 63° F, Humidity: 60%, Wind: ESE 12 mph",10012018-0107-0124-d89f-fab5ec67ec2c,0,0,RUSH,0,,,,18,Touchdown,2018-01-08T00:21:41Z,5.0,3:02,3.0,1.0,1.0,4.0,4.0,0.0,PUNT,TOUCHDOWN,08:10,05:08,NO 38,CAR 2,3421.0,3545.0,26,31,Home,5,57,6.5,47.5,1,dome,sportturf,,,Sean Payton,Ron Rivera,NOR00,Mercedes-Benz Superdome,0,1.0,,,A.Kamara,41.0,,,0,1,1.0,0,1,,00-0033906,,A.Kamara,41.0,00-0033906,A.Kamara,00-0033906,A.Kamara,00-0033906,0,1,1.11699252936523,,,,,,0.37238222360611,-37.238222360611,2018-01-07,S.Kelemete,2017,WC,NO,18,00-0029546,G,Senio Kelemete,Senio,Kelemete,,,,Knee,,Full Participation in Practice,2018-01-04T12:56:09Z,2018-01-04 12:56:09
3472,2017_09_BUF_NYJ,2017110200,NYJ,BUF,REG,9,BUF,away,NYJ,BUF,81.0,2017-11-02,710.0,710.0,710.0,Half2,0,20.0,0,4,2.0,0,11:50,BUF 19,11,8.0,"(11:50) (No Huddle, Shotgun) 5-T.Taylor pass short left to 35-M.Tolbert to BUF 20 for 1 yard (41-B.Skrine). BUF-11-Z.Jones was injured during the play.",pass,1.0,1,1,1.0,0,0,0,short,left,-3.0,4.0,,,,,,,1,3,0.0,,,,,3.0,1.0,24,7,7.0,24.0,-17.0,7.0,24.0,-17.0,0.110668540000916,0.192535430192947,0.0068358657881617,0.247390612959862,0.172416403889656,0.0015269583091139,0.268626153469086,0.0,0.0,0.0776738896965981,-0.372229048982263,18.6663020162097,-18.6663020162097,11.9110518256202,-11.9110518256202,11.4651438896221,-11.4651438896221,-1.10998570220545,0.737756653223187,-1.10998570220545,0.737756653223187,-4.74969697755296,4.74969697755296,11.0084113736197,-11.0084113736197,-7.06923984084278,7.06923984084278,13.4543946458984,-13.4543946458984,0.0201682318001986,0.979831768199801,0.979831768199801,0.0201682318001986,-0.0009376425296068,-0.0019908249378204,0.0019908249378204,0.980769410729408,0.0192305892705917,0.0346586853265762,0.965341314673424,0.226246610208622,-0.226246610208622,0.247565957366504,-0.247565957366504,0.0,-0.0009376425296068,0.0,-0.0009376425296068,-0.104667100475154,0.104667100475154,0.214290535077453,-0.214290535077453,-0.104667100475154,0.104667100475154,0.20837608538568,-0.20837608538568,0.0,0.0,0.0,0.0,0.0,0.0,0.0,0.0,0.0,0,0.0,0.0,0.0,0.0,0.0,0.0,0.0,0.0,0.0,0.0,0.0,0.0,0.0,0.0,1.0,0.0,0.0,0.0,0.0,0.0,0.0,0.0,0.0,1.0,0.0,0.0,0.0,0.0,0.0,0.0,0.0,0.0,0.0,0.0,0.0,1.0,0.0,0.0,0.0,0.0,0.0,00-0028118,T.Taylor,1.0,00-0026069,M.Tolbert,1.0,,,,,,,,,,,,,,,,,,,,,,,,,,,,,,,,,,,,,,,,,,,,,,NYJ,,00-0028075,,B.Skrine,,,,,,,,,,,,,,0.0,,,,,,,,,,,,,,,,,,,,,,,,,,,,,,,,0.0,,,,,0,,,0.0,0.0,0.0,0.0,,,2017,0.863851487636566,13.6148512363434,44,0,Turnover,3472,"11/2/17, 20:28:11",2017-11-03T03:02:25Z,MetLife Stadium,"Clear Temp: 68° F, Humidity: 70%, Wind: South 11 mph",10012017-1102-0079-64f1-6ff1021d59bd,0,0,PASS,0,,,,20,Turnover,2017-11-03T03:01:14Z,5.0,1:35,1.0,0.0,0.0,4.0,4.0,0.0,PUNT,FUMBLE,13:01,11:26,BUF 9,BUF 20,3403.0,3496.0,21,34,Home,13,55,-3.0,42.0,1,outdoors,fieldturf,68.0,11.0,Todd Bowles,Sean McDermott,NYC01,MetLife Stadium,0,0.0,T.Taylor,5.0,,,M.Tolbert,35.0,1,0,0.0,0,1,00-0028118,,00-0026069,T.Taylor,5.0,00-0028118,M.Tolbert,00-0026069,M.Tolbert,00-0026069,0,1,-0.372229048982263,1.33390792693033,9.46215391205624,8.0,0.472988541005179,0.190450052497908,0.930143296718597,6.98567032814026,2017-11-02,Z.Jones,2017,REG,BUF,9,00-0033891,WR,Zay Jones,Zay,Jones,,,,Shoulder,,Full Participation in Practice,2017-11-01T09:18:39Z,2017-11-01 09:18:39
3452,2017_17_SF_LA,2017123114,LA,SF,REG,17,LA,home,SF,SF,35.0,2017-12-31,544.0,544.0,544.0,Half2,0,21.0,0,4,1.0,0,09:04,SF 35,10,72.0,(9:04) 14-S.Mannion pass short middle to 86-D.Carrier to SF 28 for 7 yards (24-K.Williams; 56-R.Foster). SF-56-R.Foster was injured during the play. His return is Questionable. SF-24-K.Williams was injured during the play. His return is Probable.,pass,7.0,0,0,1.0,0,0,0,short,middle,1.0,6.0,,,,,,,3,3,0.0,,,,,3.0,3.0,6,34,6.0,34.0,-28.0,6.0,34.0,-28.0,0.0539513640105724,0.0467244908213615,0.000879707513377,0.0646800175309181,0.360866844654083,0.0021760233212262,0.470721542835236,0.0,0.0,3.78731037024409,0.26267755869776,-31.4638974635767,31.4638974635767,-8.70394706353545,8.70394706353545,-22.0183558014913,22.0183558014913,-0.463733569835313,0.726411128533073,-0.463733569835313,0.726411128533073,-9.79238092782907,9.79238092782907,-13.8376725086378,13.8376725086378,-10.8312036541756,10.8312036541756,-6.46030418472292,6.46030418472292,8.91617455636151e-05,0.999910838254436,8.91617455636151e-05,0.999910838254436,3.39649632223882e-05,1.50209234561771e-06,1.50209234561771e-06,0.000123126708786,0.999876873291214,2.45632418227615e-05,2.45632418227615e-05,-0.187188832520312,0.187188832520312,-0.411654132503296,0.411654132503296,0.0,3.39649632223882e-05,0.0,3.39649632223882e-05,-0.0529011343710661,0.0529011343710661,-0.420840763386776,0.420840763386776,-0.0519839977019072,0.0519839977019072,-0.2558193975873,0.2558193975873,0.0,0.0,0.0,0.0,0.0,0.0,0.0,0.0,0.0,0,0.0,0.0,0.0,0.0,0.0,0.0,0.0,0.0,0.0,0.0,0.0,0.0,0.0,0.0,0.0,0.0,0.0,0.0,0.0,0.0,0.0,0.0,0.0,1.0,0.0,0.0,0.0,0.0,0.0,0.0,0.0,0.0,0.0,0.0,0.0,1.0,1.0,0.0,0.0,0.0,0.0,00-0032245,S.Mannion,7.0,00-0029119,D.Carrier,7.0,,,,,,,,,,,,,,,,,,,,,,,,,,,,,,,,,,,,,,,,,,,,,,,,,,,,00-0031253,K.Williams,SF,00-0033887,R.Foster,SF,,,,,,,0.0,,,,,,,,,,,,,,,,,,,,,,,,,,,,,,,,0.0,,,,,0,,,0.0,0.0,0.0,0.0,,,2017,0.800444722175598,19.9555277824402,52,1,First down,3452,"12/31/17, 16:25:28",2018-01-01T00:01:01Z,Los Angeles Memorial Coliseum,"Sunny Temp: 67° F, Humidity: 43%, Wind: ESE 3 mph",10012017-1231-1456-be05-3d6cf8f0dab2,0,0,PASS,0,,,,21,Touchdown,2017-12-31T23:53:07Z,15.0,8:14,6.0,1.0,1.0,4.0,4.0,5.0,KICKOFF,TOUCHDOWN,14:54,06:40,LA 28,SF 8,3191.0,3611.0,34,13,Home,-21,47,-6.5,44.5,1,outdoors,grass,67.0,3.0,Sean McVay,Kyle Shanahan,LAX99,Los Angeles Memorial Coliseum,0,1.0,S.Mannion,14.0,,,D.Carrier,86.0,1,0,0.0,0,1,00-0032245,,00-0029119,S.Mannion,14.0,00-0032245,D.Carrier,00-0029119,D.Carrier,00-0029119,0,0,0.26267755869776,0.702196519113902,6.54479121166514,5.0,0.546747545187827,0.260864565556403,0.769991934299469,23.0008065700531,2017-12-31,R.Foster,2017,REG,SF,17,00-0033887,LB,Reuben Foster,Reuben,Foster,,,,Neck,,Full Participation in Practice,2017-12-29T12:55:49Z,2017-12-29 12:55:49
3414,2017_14_DAL_NYG,2017121012,NYG,DAL,REG,14,DAL,away,NYG,DAL,74.0,2017-12-10,487.0,487.0,487.0,Half2,0,19.0,0,4,3.0,0,08:07,DAL 26,2,82.0,(8:07) (Shotgun) 4-D.Prescott pass short left to 11-C.Beasley pushed ob at NYG 20 for 54 yards (21-L.Collins). NYG-21-L.Collins was injured during the play.,pass,54.0,1,0,1.0,0,0,0,short,left,4.0,50.0,,,,,,,3,2,0.0,,,,,2.0,3.0,10,10,10.0,10.0,0.0,10.0,10.0,0.0,0.190006196498871,0.147848710417748,0.0025988302659243,0.210101589560509,0.192241281270981,0.0025512613356113,0.254652142524719,0.0,0.0,0.444936445448548,3.88502765004523,-5.91385442507453,5.91385442507453,-2.69565494940616,2.69565494940616,-7.2976527676511,7.2976527676511,0.813690695445985,3.07133695459925,0.813690695445985,3.07133695459925,-5.4087639072095,5.4087639072095,-2.35884769558507,2.35884769558507,-6.11118303798139,6.11118303798139,-1.18646972966971,1.18646972966971,0.433972746133804,0.566027253866196,0.566027253866196,0.433972746133804,0.189797133207321,0.173916161060333,-0.173916161060333,0.376230120658875,0.623769879341126,0.576292157173157,0.423707842826843,-0.10328420996666,0.10328420996666,-0.324246412373074,0.324246412373074,0.005295991897583,0.184501141309738,0.005295991897583,0.184501141309738,-0.049166256442111,0.049166256442111,-0.275216680369821,0.275216680369821,-0.049166256442111,0.049166256442111,-0.275080155930963,0.275080155930963,0.0,0.0,1.0,0.0,1.0,0.0,0.0,0.0,0.0,0,0.0,0.0,0.0,0.0,0.0,0.0,0.0,0.0,0.0,0.0,0.0,0.0,0.0,0.0,1.0,0.0,0.0,0.0,0.0,0.0,0.0,0.0,0.0,1.0,0.0,0.0,0.0,0.0,0.0,0.0,0.0,0.0,0.0,0.0,0.0,1.0,0.0,0.0,0.0,0.0,0.0,00-0033077,D.Prescott,54.0,00-0029000,C.Beasley,54.0,,,,,,,,,,,,,,,,,,,,,,,,,,,,,,,,,,,,,,,,,,,,,,NYG,,00-0032262,,L.Collins,,,,,,,,,,,,,,0.0,,,,,,,,,,,,,,,,,,,,,,,,,,,,,,,,0.0,,,,,0,,,0.0,0.0,0.0,0.0,,,2017,0.687768042087555,31.2231957912445,48,1,First down,3414,"12/10/17, 13:02:49",2017-12-10T20:33:04Z,MetLife Stadium,"Fair Temp: 39° F, Humidity: 55%, Wind: West 11 mph",10012017-1210-1297-d4ec-5dbd0a0af2b9,0,0,PASS,0,,,,19,Touchdown,2017-12-10T20:31:42Z,4.0,1:51,2.0,0.0,1.0,4.0,4.0,0.0,PUNT,TOUCHDOWN,09:29,07:38,DAL 18,NYG 20,3369.0,3465.0,30,10,Home,-20,40,-4.0,42.0,1,outdoors,fieldturf,39.0,11.0,Steve Spagnuolo,Jason Garrett,NYC01,MetLife Stadium,0,1.0,D.Prescott,4.0,,,C.Beasley,11.0,1,0,1.0,0,1,00-0033077,,00-0029000,D.Prescott,4.0,00-0033077,C.Beasley,00-0029000,C.Beasley,00-0029000,1,0,3.88502765004523,0.240905639025238,4.27306649278034,2.0,0.998463784810156,0.998463784810156,0.806443750858307,19.3556249141693,2017-12-10,L.Collins,2017,REG,DAL,14,00-0031534,T,La'el Collins,La'el,Collins,Back,,Questionable,Back,,Did Not Participate In Practice,2017-12-08T11:43:41Z,2017-12-08 11:43:41
3390,2017_17_CIN_BAL,2017123101,BAL,CIN,REG,17,BAL,home,CIN,BAL,65.0,2017-12-31,215.0,1115.0,1115.0,Half2,0,23.0,0,3,1.0,0,03:35,BAL 35,10,62.0,(3:35) 37-J.Allen left tackle to BAL 30 for -5 yards (92-P.Sims). CIN-36-S.Williams was injured during the play.,run,-5.0,0,0,0.0,0,0,0,,,,,left,tackle,,,,,3,1,0.0,,,,,3.0,1.0,17,24,17.0,24.0,-7.0,17.0,24.0,-7.0,0.0307185649871826,0.1163060516119,0.0016456447774544,0.166185587644577,0.243215188384056,0.0037107679527252,0.438218206167221,0.0,0.0,2.28908598632552,-1.07216104795225,-9.31002628065524,9.31002628065524,5.05564308265457,-5.05564308265457,-23.0534527753785,23.0534527753785,,,0.0,0.0,-6.14235502964584,6.14235502964584,-1.1200995661784,1.1200995661784,-7.67882607749198,7.67882607749198,-15.3746266978865,15.3746266978865,0.276013791561127,0.723986208438873,0.276013791561127,0.723986208438873,-0.0396532416343689,-0.0577505826950073,-0.0577505826950073,0.236360549926758,0.763639450073242,0.38346067070961,0.38346067070961,-0.045830701327519,0.045830701327519,-0.513447731128136,0.513447731128136,,,0.0,0.0,0.0447948251983583,-0.0447948251983583,-0.189061388373375,0.189061388373375,0.0435265575668276,-0.0435265575668276,-0.556974288694964,0.556974288694964,0.0,0.0,0.0,0.0,0.0,0.0,0.0,0.0,0.0,0,0.0,0.0,0.0,0.0,0.0,0.0,0.0,0.0,0.0,0.0,0.0,0.0,0.0,0.0,1.0,0.0,0.0,1.0,0.0,0.0,0.0,0.0,1.0,0.0,0.0,0.0,0.0,0.0,0.0,0.0,0.0,0.0,0.0,0.0,0.0,0.0,0.0,0.0,0.0,0.0,0.0,,,,,,,00-0031577,J.Allen,-5.0,,,,,,,,,,,,,,,,,,,,,,,,,,,,,00-0026217,P.Sims,,,,,,,,,,,,,CIN,,00-0026217,,P.Sims,,,,,,,,,,,,,,0.0,,,,,,,,,,,,,,,,,,,,,,,,,,,,,,,,0.0,,,,,0,,,0.0,0.0,0.0,0.0,,,2017,,,46,1,First down,3390,"12/31/17, 16:25:51",2017-12-31T23:55:56Z,M&T Bank Stadium,"Cloudy Temp: 19° F, Humidity: 36%, Wind: NW 12 mph",10012017-1231-0153-dbd0-8d0ed68a5ebc,0,0,RUSH,0,,,,23,Field goal,2017-12-31T23:53:34Z,14.0,5:55,4.0,1.0,1.0,3.0,4.0,10.0,PUNT,FIELD_GOAL,04:03,13:08,BAL 22,CIN 16,3325.0,3725.0,31,27,Home,-4,58,8.0,40.0,1,outdoors,grass,19.0,12.0,John Harbaugh,Marvin Lewis,BAL00,M&T Bank Stadium,0,0.0,,,J.Allen,37.0,,,0,1,0.0,0,1,,00-0031577,,J.Allen,37.0,00-0031577,J.Allen,00-0031577,J.Allen,00-0031577,0,0,-1.07216104795225,,,,,,0.567328035831451,-56.7328035831451,2017-12-31,S.Williams,2017,REG,CIN,17,00-0030471,S,Shawn Williams,Shawn,Williams,,,,Concussion,,Full Participation in Practice,2017-12-29T09:54:04Z,2017-12-29 09:54:04
3384,2017_06_DET_NO,2017101504,NO,DET,REG,6,DET,away,NO,DET,56.0,2017-10-15,248.0,1148.0,1148.0,Half2,0,20.0,0,3,2.0,0,04:08,DET 44,5,61.0,(4:08) (Shotgun) 9-M.Stafford pass incomplete short left to 13-T.Jones (32-K.Vaccaro). DET-71-R.Wagner was injured during the play. His return is Probable.,pass,0.0,1,0,1.0,0,0,0,short,left,0.0,,,,,,,,3,3,0.0,,,,,3.0,3.0,45,17,17.0,45.0,-28.0,17.0,45.0,-28.0,0.0133685199543834,0.112781628966331,0.0023609681520611,0.204733803868294,0.256843030452728,0.0043602609075605,0.405551820993423,0.0,0.0,1.8419089098461,-0.896320442669094,28.4248587873334,-28.4248587873334,11.2042123095548,-11.2042123095548,14.1855397299716,-14.1855397299716,-0.894345336128026,-0.0019751065410673,0.0,0.0,-8.30670591944363,8.30670591944363,-0.470981099409983,0.470981099409983,-4.8227559410152,4.8227559410152,4.94114127128545,-4.94114127128545,0.0009769733296707,0.999023026670329,0.999023026670329,0.0009769733296707,7.41903204470873e-06,-7.08712032064796e-05,7.08712032064796e-05,0.999015607638285,0.0009843923617154,0.0004044064844492,0.999595593515551,0.167406772841181,-0.167406772841181,0.282133072064462,-0.282133072064462,0.0,7.41903204470873e-06,0.0,0.0,-0.679225402611731,0.679225402611731,0.677965258112944,-0.677965258112944,-0.677353000927208,0.677353000927208,0.726296518037397,-0.726296518037397,0.0,0.0,0.0,0.0,0.0,0.0,0.0,0.0,1.0,0,0.0,0.0,0.0,0.0,0.0,0.0,0.0,0.0,0.0,0.0,0.0,0.0,0.0,0.0,0.0,0.0,0.0,0.0,0.0,0.0,0.0,0.0,0.0,1.0,0.0,0.0,0.0,0.0,0.0,0.0,0.0,0.0,0.0,0.0,0.0,0.0,0.0,0.0,0.0,0.0,0.0,00-0026498,M.Stafford,,00-0031189,T.Jones,,,,,,,,,,,,,,,,,,,,,,,,,,,,,,,,,,,,,,,,,,,,,,,,,,,,,,,,,,,,,,,,,0.0,,,,,,,00-0030060,K.Vaccaro,,,,,,,,,,,,,,,,,,,,,,,,0.0,,,,,0,,,0.0,0.0,0.0,0.0,,,2017,0.717824161052704,-71.7824161052704,45,1,First down,3384,"10/15/17, 13:02:41",2017-10-15T19:33:52Z,Caesars Superdome,"Cloudy Temp: 84° F, Humidity: 80%, Wind: SE 2 mph",10012017-1015-0461-6d8b-f1d283ecdb58,0,0,PASS,0,,,,20,Touchdown,2017-10-15T19:33:23Z,11.0,3:16,4.0,1.0,1.0,3.0,3.0,0.0,FUMBLE,TOUCHDOWN,04:37,01:21,DET 39,NO 22,3363.0,3629.0,38,52,Home,14,90,6.0,50.5,0,dome,sportturf,,,Sean Payton,Jim Caldwell,NOR00,Mercedes-Benz Superdome,0,0.0,M.Stafford,9.0,,,T.Jones,13.0,1,0,0.0,0,1,00-0026498,,00-0031189,M.Stafford,9.0,00-0026498,T.Jones,00-0031189,T.Jones,00-0031189,0,1,-0.896320442669094,1.28504134962783,6.78917331594857,5.0,0.667741640936583,0.558466061484069,0.735650658607483,26.4349341392517,2017-10-15,R.Wagner,2017,REG,DET,6,00-0029893,T,Rick Wagner,Rick,Wagner,Shoulder,,Questionable,Shoulder,,Limited Participation in Practice,2017-10-13T12:47:19Z,2017-10-13 12:47:19
3343,2017_11_KC_NYG,2017111906,NYG,KC,REG,11,KC,away,NYG,KC,95.0,2017-11-19,248.0,248.0,248.0,Half2,0,19.0,0,4,1.0,0,04:08,KC 5,10,13.0,"(4:08) 27-K.Hunt left tackle to KC 8 for 3 yards (37-R.Cockrell, 98-D.Harrison). NYG-98-D.Harrison was injured during the play.",run,3.0,0,0,0.0,0,0,0,,,,,left,tackle,,,,,1,3,0.0,,,,,3.0,1.0,6,6,6.0,6.0,0.0,6.0,6.0,0.0,0.393769294023514,0.119425319135189,0.0383522361516953,0.167000308632851,0.113027729094028,0.0010080569190904,0.167417019605637,0.0,0.0,-0.0909641517791897,-0.321715596946888,-1.62609540043869,1.62609540043869,-3.6629840428941,3.6629840428941,1.69177234776364,-1.69177234776364,,,0.0,0.0,2.6871400065138,-2.6871400065138,-1.89713090920122,1.89713090920122,-8.97255914431298,8.97255914431298,9.25296651331521,-9.25296651331521,0.420342296361923,0.579657703638077,0.579657703638077,0.420342296361923,-0.0176416635513306,0.0188530087471008,-0.0188530087471008,0.597299367189407,0.402700632810593,0.59532356262207,0.40467643737793,-0.222811938905515,0.222811938905515,-0.0270985960960388,0.0270985960960388,,,0.0,0.0,-0.05184006690979,0.05184006690979,0.0507416427135468,-0.0507416427135468,-0.34000688791275,0.34000688791275,0.247740387916565,-0.247740387916565,0.0,0.0,0.0,0.0,0.0,0.0,0.0,0.0,0.0,0,0.0,0.0,0.0,0.0,0.0,0.0,0.0,0.0,0.0,0.0,0.0,0.0,0.0,0.0,0.0,0.0,0.0,0.0,0.0,0.0,0.0,0.0,1.0,0.0,0.0,0.0,0.0,0.0,0.0,0.0,0.0,0.0,0.0,0.0,0.0,0.0,1.0,0.0,0.0,0.0,0.0,,,,,,,00-0033923,K.Hunt,3.0,,,,,,,,,,,,,,,,,,,,,,,,,,,,,,,,,,,,,,,,,,,,,,,,,00-0029040,D.Harrison,NYG,,,,,,,,,,1.0,00-0031016,R.Cockrell,NYG,,,,,,,,,,,,,,,,,,,,,,,,,,,,,0.0,,,,,0,,,0.0,0.0,0.0,0.0,,,2017,,,49,1,First down,3343,"11/19/17, 13:02:28",2017-11-19T20:39:24Z,MetLife Stadium,"Mostly Cloudy Temp: 50° F, Humidity: 44%, Wind: WNW 23 mph",10012017-1119-0666-7ea7-977ae09e3401,0,0,RUSH,0,,,,19,Turnover,2017-11-19T20:39:24Z,4.0,2:01,1.0,0.0,0.0,4.0,4.0,0.0,PUNT,INTERCEPTION,04:08,02:07,KC 5,KC 18,3343.0,3409.0,9,12,Home,3,21,-10.0,44.5,0,outdoors,fieldturf,50.0,23.0,Ben McAdoo,Andy Reid,NYC01,MetLife Stadium,0,0.0,,,K.Hunt,27.0,,,0,1,0.0,0,1,,00-0033923,,K.Hunt,27.0,00-0033923,K.Hunt,00-0033923,K.Hunt,00-0033923,0,0,-0.321715596946888,,,,,,0.452942907810211,-45.2942907810211,2017-11-19,D.Harrison,2017,REG,NYG,11,00-0029040,DT,Damon Harrison,Damon,Harrison,Ankle,,Questionable,Ankle,,Limited Participation in Practice,2017-11-17T11:14:26Z,2017-11-17 11:14:26
3336,2017_03_PIT_CHI,2017092403,CHI,PIT,REG,3,CHI,home,PIT,CHI,91.0,2017-09-24,615.0,615.0,615.0,Half2,0,18.0,0,4,1.0,0,10:15,CHI 9,10,3.0,(10:15) 24-Jo.Howard left guard to CHI 9 for no gain (50-R.Shazier). CHI-24-Jo.Howard was injured during the play.,run,0.0,0,0,0.0,0,0,0,,,,,left,guard,,,,,3,3,0.0,,,,,3.0,3.0,17,14,17.0,14.0,3.0,17.0,14.0,3.0,0.137790009379387,0.177811339497566,0.0115013010799885,0.231485769152641,0.156459540128708,0.0011160933645442,0.283835917711258,0.0,0.0,0.281625226372853,-0.49937371048145,0.807382117316593,-0.807382117316593,-6.3185313025206,6.3185313025206,-3.73084637781881,3.73084637781881,,,0.0,0.0,-7.86142483368167,7.86142483368167,-6.12375236716048,6.12375236716048,-36.3088117825391,36.3088117825391,28.3379841013796,-28.3379841013796,0.745876252651215,0.254123747348785,0.745876252651215,0.254123747348785,-0.026911735534668,-0.0175039172172546,-0.0175039172172546,0.718964517116547,0.281035482883453,0.608838737010956,0.608838737010956,-0.118512828271033,0.118512828271033,-0.0485966951008078,0.0485966951008078,,,0.0,0.0,-0.0821862731323989,0.0821862731323989,-0.248549902082392,0.248549902082392,-0.0821862731323989,0.0821862731323989,-0.098840885997721,0.098840885997721,0.0,0.0,0.0,0.0,0.0,0.0,0.0,0.0,0.0,0,0.0,0.0,0.0,0.0,0.0,0.0,0.0,0.0,0.0,0.0,0.0,0.0,0.0,0.0,1.0,0.0,0.0,0.0,0.0,0.0,0.0,0.0,1.0,0.0,0.0,0.0,0.0,0.0,0.0,0.0,0.0,0.0,0.0,0.0,0.0,0.0,0.0,0.0,0.0,0.0,0.0,,,,,,,00-0032780,Jo.Howard,0.0,,,,,,,,,,,,,,,,,,,,,,,,,,,,,,,,,,,,,,,,,,,PIT,,00-0031365,,R.Shazier,,,,,,,,,,,,,,0.0,,,,,,,,,,,,,,,,,,,,,,,,,,,,,,,,0.0,,,,,0,,,0.0,0.0,0.0,0.0,,,2017,,,45,0,Turnover,3336,"9/24/17, 13:02:59",2017-09-24T19:38:05Z,Soldier Field,"Sunny, highs to upper 80's Temp: 89° F, Humidity: 48%, Wind: S 5 mph",10012017-0924-0338-9418-30f8d136fc4a,0,0,RUSH,0,,,,18,Turnover,2017-09-24T19:38:05Z,3.0,1:18,0.0,0.0,0.0,4.0,4.0,0.0,PUNT,INTERCEPTION,10:15,08:57,CHI 9,CHI 12,3336.0,3381.0,17,23,Home,6,40,-7.0,43.5,0,outdoors,grass,89.0,5.0,John Fox,Mike Tomlin,CHI98,Soldier Field,0,0.0,,,Jo.Howard,24.0,,,0,1,0.0,0,1,,00-0032780,,Jo.Howard,24.0,00-0032780,Jo.Howard,00-0032780,Jo.Howard,00-0032780,0,0,-0.49937371048145,,,,,,0.321763664484024,-32.1763664484024,2017-09-24,Jo.Howard,2017,REG,CHI,3,00-0032780,RB,Jordan Howard,Jordan,Howard,,,,Shoulder,,Full Participation in Practice,2017-09-22T11:36:50Z,2017-09-22 11:36:50
3332,2017_18_CAR_NO,2018010701,NO,CAR,POST,18,CAR,away,NO,CAR,80.0,2018-01-07,552.0,552.0,552.0,Half2,0,17.0,0,4,2.0,0,09:12,CAR 20,7,-7.0,(9:12) (Shotgun) 1-C.Newton sacked at CAR 10 for -10 yards (95-T.Davison). CAR-1-C.Newton was injured during the play. His return is Probable.,pass,-10.0,1,0,1.0,0,0,0,,,,,,,,,,,2,3,0.0,,,,,3.0,2.0,24,19,19.0,24.0,-5.0,19.0,24.0,-5.0,0.135472297668457,0.172174125909805,0.0048961625434458,0.224261984229088,0.172251343727112,0.001275670598261,0.289668411016464,0.0,0.0,0.450835657073185,-1.94002537964843,3.11627060734131,-3.11627060734131,-3.4925742901396,3.4925742901396,7.25656216359278,-7.25656216359278,,,0.0,0.0,5.28048874507658,-5.28048874507658,-0.0971892262040468,0.0971892262040468,1.74263998208335,-1.74263998208335,2.53561786951113,-2.53561786951113,0.225005492568016,0.774994507431984,0.774994507431984,0.225005492568016,-0.0743825435638428,-0.0611630007624626,0.0611630007624626,0.849377050995827,0.150622949004173,0.18138188123703,0.81861811876297,-0.0671831668786402,0.0671831668786402,0.357946663510914,-0.357946663510914,,,0.0,0.0,-0.0055853952383744,0.0055853952383744,0.222362741682619,-0.222362741682619,-0.0081642796015488,0.0081642796015488,0.234359562251657,-0.234359562251657,0.0,0.0,0.0,0.0,0.0,0.0,0.0,0.0,0.0,0,0.0,0.0,0.0,0.0,0.0,0.0,0.0,0.0,0.0,0.0,0.0,0.0,0.0,0.0,1.0,0.0,0.0,0.0,0.0,0.0,0.0,1.0,0.0,1.0,1.0,0.0,0.0,0.0,0.0,0.0,0.0,0.0,0.0,0.0,0.0,0.0,0.0,0.0,0.0,0.0,0.0,00-0027939,C.Newton,,,,,,,,,,,,,,,,,,,,,,,,,,,,,,,,,,,,00-0031947,T.Davison,,,00-0031947,T.Davison,,,,,,,,,NO,,00-0031947,,T.Davison,,,,,,,,,,,,,,0.0,,,,,,,,,,,,,,,,,,,,,,,,,00-0031947,T.Davison,,,,,,0.0,,,,,0,,,0.0,0.0,0.0,0.0,,,2017,,,48,0,Punt,3332,"1/7/18, 16:40:43",2018-01-08T00:15:03Z,Caesars Superdome,"Cloudy Temp: 63° F, Humidity: 60%, Wind: ESE 12 mph",10012018-0107-0124-d89f-fab5ec67ec2c,0,0,SACK,0,,,,17,Punt,2018-01-08T00:14:32Z,3.0,1:33,0.0,0.0,0.0,4.0,4.0,0.0,PUNT,PUNT,09:43,08:10,CAR 17,CAR 10,3311.0,3381.0,26,31,Home,5,57,6.5,47.5,1,dome,sportturf,,,Sean Payton,Ron Rivera,NOR00,Mercedes-Benz Superdome,0,0.0,C.Newton,1.0,,,,,1,0,0.0,0,1,00-0027939,,,C.Newton,1.0,00-0027939,,,,,0,1,-1.94002537964843,,,,,,0.78081339597702,21.918660402298,2018-01-07,C.Newton,2017,WC,CAR,18,00-0027939,QB,Cam Newton,Cam,Newton,,,,right Shoulder,,Full Participation in Practice,2018-01-05T10:48:22Z,2018-01-05 10:48:22
3320,2017_13_SF_CHI,2017120303,CHI,SF,REG,13,SF,away,CHI,SF,73.0,2017-12-03,257.0,257.0,257.0,Half2,0,15.0,0,4,2.0,0,04:17,SF 27,4,86.0,(4:17) (No Huddle) 10-J.Garoppolo pass short left to 44-K.Juszczyk to SF 30 for 3 yards (59-D.Trevathan). CHI-59-D.Trevathan was injured during the play.,pass,3.0,0,1,1.0,0,0,0,short,left,3.0,0.0,,,,,,,3,2,0.0,,,,,2.0,3.0,14,12,12.0,14.0,-2.0,12.0,14.0,-2.0,0.358407706022263,0.105714805424213,0.0011832282179966,0.143940791487694,0.164268746972084,0.0027847688179463,0.223699942231178,0.0,0.0,0.737178961047903,0.0918203569017351,-2.26891014233008,2.26891014233008,-3.60393203038257,3.60393203038257,-7.18878194612528,7.18878194612528,0.0918203569017351,0.0,0.0918203569017351,0.0,-6.60436357156141,6.60436357156141,-5.6730276094279,5.6730276094279,-20.9062636319432,20.9062636319432,15.1434757483813,-15.1434757483813,0.358482748270035,0.641517251729965,0.641517251729965,0.358482748270035,-0.023159921169281,-0.0049021542072296,0.0049021542072296,0.664677172899246,0.335322827100754,0.354852735996246,0.645147264003754,0.105749204754829,-0.105749204754829,-0.209923338865994,0.209923338865994,-0.023159921169281,0.0,-0.023159921169281,0.0,0.0225575000288498,-0.0225575000288498,-0.520794630050659,0.520794630050659,0.0225575000288498,-0.0225575000288498,-0.231570169329643,0.231570169329643,0.0,0.0,0.0,0.0,0.0,0.0,0.0,0.0,0.0,0,0.0,0.0,0.0,0.0,0.0,0.0,0.0,0.0,0.0,0.0,0.0,0.0,0.0,0.0,1.0,0.0,0.0,0.0,0.0,0.0,0.0,0.0,0.0,1.0,0.0,0.0,0.0,0.0,0.0,0.0,0.0,0.0,0.0,0.0,0.0,1.0,0.0,0.0,0.0,0.0,0.0,00-0031345,J.Garoppolo,3.0,00-0029892,K.Juszczyk,3.0,,,,,,,,,,,,,,,,,,,,,,,,,,,,,,,,,,,,,,,,,,,,,,CHI,,00-0029577,,D.Trevathan,,,,,,,,,,,,,,0.0,,,,,,,,,,,,,,,,,,,,,,,,,,,,,,,,0.0,,,,,0,,,0.0,0.0,0.0,0.0,,,2017,0.737168371677399,26.2831628322601,42,1,First down,3320,"12/3/17, 13:02:19",2017-12-03T20:31:57Z,Soldier Field,"Sunny Temp: 54° F, Humidity: 44%, Wind: SSW 6 mph",10012017-1203-0310-44f1-b04b94bdcddf,0,0,PASS,0,,,,15,Field goal,2017-12-03T20:30:47Z,14.0,5:23,4.0,1.0,1.0,4.0,4.0,0.0,PUNT,FIELD_GOAL,05:27,00:04,SF 8,CHI 6,3275.0,3686.0,15,14,Home,-1,29,2.5,42.0,0,outdoors,grass,54.0,6.0,John Fox,Kyle Shanahan,CHI98,Soldier Field,0,1.0,J.Garoppolo,10.0,,,K.Juszczyk,44.0,1,0,0.0,0,1,00-0031345,,00-0029892,J.Garoppolo,10.0,00-0031345,K.Juszczyk,00-0029892,K.Juszczyk,00-0029892,0,0,0.0918203569017351,0.423602085540701,4.27365204910893,2.0,0.99027729142108,0.698747963790083,0.579735279083252,42.0264720916748,2017-12-03,D.Trevathan,2017,REG,CHI,13,00-0029577,LB,Danny Trevathan,Danny,Trevathan,,,,Calf,,Full Participation in Practice,2017-11-30T13:30:14Z,2017-11-30 13:30:14
3320,2017_17_NYJ_NE,2017123106,NE,NYJ,REG,17,NYJ,away,NE,NYJ,96.0,2017-12-31,811.0,811.0,811.0,Half2,0,21.0,0,4,1.0,0,13:31,NYJ 4,10,79.0,"(13:31) 79-B.Qvale reported in as eligible. 9-B.Petty pass incomplete short right to 11-R.Anderson. NYJ-11-R.Anderson was injured during the play. PENALTY on NE-24-S.Gilmore, Unnecessary Roughness, 15 yards, enforced at NYJ 4.",pass,0.0,0,0,1.0,0,0,0,short,right,0.0,,,,,,,,2,2,0.0,,,,,2.0,2.0,24,3,3.0,24.0,-21.0,3.0,24.0,-21.0,0.0820277780294418,0.205899104475975,0.0474406145513058,0.276224553585053,0.169807076454163,0.0009812319185584,0.217619642615318,0.0,0.0,-0.611429226119071,1.09697381895967,20.9742475263936,-20.9742475263936,6.74549981995369,-6.74549981995369,1.18289807873258,-1.18289807873258,-0.501474967109971,1.59844878606964,0.0,0.0,8.47404727892717,-8.47404727892717,2.79727160089533,-2.79727160089533,15.7290936070494,-15.7290936070494,-11.6101750655431,11.6101750655431,0.008216249756515,0.991783750243485,0.991783750243485,0.008216249756515,0.0031457645818591,0.0006246068514883,-0.0006246068514883,0.988637985661626,0.0113620143383741,0.0029993352945894,0.997000664705411,0.236925162482099,-0.236925162482099,-0.215203045799499,0.215203045799499,0.0,0.0031457645818591,0.0,0.0,0.0408180869750296,-0.0408180869750296,-0.0657000589071478,0.0657000589071478,0.0408180869750296,-0.0408180869750296,-0.164241125889,0.164241125889,0.0,0.0,0.0,1.0,0.0,0.0,0.0,0.0,1.0,0,0.0,0.0,0.0,0.0,0.0,0.0,0.0,0.0,0.0,0.0,0.0,0.0,0.0,0.0,0.0,0.0,1.0,0.0,0.0,0.0,0.0,0.0,0.0,1.0,0.0,0.0,0.0,0.0,0.0,0.0,0.0,0.0,0.0,0.0,0.0,0.0,0.0,0.0,0.0,0.0,0.0,00-0031568,B.Petty,,00-0032688,R.Anderson,,,,,,,,,,,,,,,,,,,,,,,,,,,,,,,,,,,,,,,,,,,,,,,,,,,,,,,,,,,,,,,,,0.0,,,,,,,,,,,,,,,,,,,,,,,,,,,,,,,,0.0,NE,00-0029542,S.Gilmore,15.0,0,,Unnecessary Roughness,0.0,0.0,0.0,0.0,,,2017,0.735821485519409,-73.5821485519409,49,1,First down,3320,"12/31/17, 13:02:24",2017-12-31T20:33:26Z,Gillette Stadium,"Cloudy and cold Temp: 13° F, Humidity: 42%, Wind: WNW 14 mph",10012017-1231-065d-0b94-73f5a6bbd140,0,0,PASS,0,,,,21,Field goal,2017-12-31T20:33:26Z,8.0,3:03,3.0,1.0,1.0,4.0,4.0,15.0,PUNT,FIELD_GOAL,13:31,10:28,NYJ 4,NE 17,3320.0,3498.0,6,26,Home,20,32,17.0,43.5,1,outdoors,fieldturf,13.0,14.0,Bill Belichick,Todd Bowles,BOS00,Gillette Stadium,0,1.0,B.Petty,9.0,,,R.Anderson,11.0,1,0,1.0,0,1,00-0031568,,00-0032688,B.Petty,9.0,00-0031568,R.Anderson,00-0032688,R.Anderson,00-0032688,0,1,1.09697381895967,0.728161711471027,6.77062315979129,6.0,0.579700638423674,0.214073725859635,0.593901932239533,40.6098067760468,2017-12-31,R.Anderson,2017,REG,NYJ,17,00-0032688,WR,Robby Anderson,Robby,Anderson,,,,Illness,,Full Participation in Practice,2017-12-29T12:54:11Z,2017-12-29 12:54:11
3306,2017_15_PHI_NYG,2017121706,NYG,PHI,REG,15,PHI,away,NYG,PHI,69.0,2017-12-17,111.0,1011.0,1011.0,Half2,0,19.0,0,3,1.0,0,01:51,PHI 31,10,3.0,"(1:51) 36-J.Ajayi left end to PHI 34 for 3 yards (54-O.Vernon, 93-B.Goodson). NYG-93-B.Goodson was injured during the play.",run,3.0,0,0,0.0,0,0,0,,,,,left,end,,,,,3,3,0.0,,,,,3.0,3.0,29,31,31.0,29.0,2.0,31.0,29.0,2.0,0.0353218354284763,0.13826747238636,0.0032665848266333,0.236624628305435,0.240470856428146,0.0029552169144153,0.343093425035477,0.0,0.0,1.05126899341121,-0.256239538546652,-6.59676916693612,6.59676916693612,-0.0420290302135982,0.0420290302135982,-2.83636504159645,2.83636504159645,,,0.0,0.0,1.07839075714583,-1.07839075714583,6.83388089272194,-6.83388089272194,-1.39431403361959,1.39431403361959,-0.979100436929714,0.979100436929714,0.621595680713654,0.378404319286346,0.378404319286346,0.621595680713654,-0.00358247756958,-0.0084455609321594,0.0084455609321594,0.381986796855927,0.618013203144074,0.772832036018372,0.227167963981628,-0.137547146421834,0.137547146421834,0.0801530453860679,-0.0801530453860679,,,0.0,0.0,-0.154889137826593,0.154889137826593,0.557467814631485,-0.557467814631485,-0.174566001973779,0.174566001973779,0.283789884395622,-0.283789884395622,0.0,0.0,0.0,0.0,0.0,0.0,0.0,0.0,0.0,0,0.0,0.0,0.0,0.0,0.0,0.0,0.0,0.0,0.0,0.0,0.0,0.0,0.0,0.0,0.0,0.0,0.0,0.0,0.0,0.0,0.0,0.0,1.0,0.0,0.0,0.0,0.0,0.0,0.0,0.0,0.0,0.0,0.0,0.0,0.0,0.0,1.0,0.0,0.0,0.0,0.0,,,,,,,00-0031590,J.Ajayi,3.0,,,,,,,,,,,,,,,,,,,,,,,,,,,,,,,,,,,,,,,,,,,,,,,,,00-0033121,B.Goodson,NYG,,,,,,,,,,1.0,00-0029693,O.Vernon,NYG,,,,,,,,,,,,,,,,,,,,,,,,,,,,,0.0,,,,,0,,,0.0,0.0,0.0,0.0,,,2017,,,48,0,Punt,3306,"12/17/17, 13:02:30",2017-12-17T20:34:00Z,MetLife Stadium,"Cloudy Temp: 35° F, Humidity: 58%, Wind: Calm mph",10012017-1217-064e-ce49-709c64446d3d,0,0,RUSH,0,,,,19,Punt,2017-12-17T20:33:09Z,3.0,1:03,0.0,0.0,0.0,3.0,3.0,0.0,KICKOFF,PUNT,01:57,00:54,PHI 31,PHI 34,3284.0,3374.0,34,29,Home,-5,63,-7.5,40.5,1,outdoors,fieldturf,35.0,0.0,Steve Spagnuolo,Doug Pederson,NYC01,MetLife Stadium,0,0.0,,,J.Ajayi,36.0,,,0,1,0.0,0,1,,00-0031590,,J.Ajayi,36.0,00-0031590,J.Ajayi,00-0031590,J.Ajayi,00-0031590,0,1,-0.256239538546652,,,,,,0.481555312871933,-48.1555312871933,2017-12-17,B.Goodson,2017,REG,NYG,15,00-0033121,LB,B.J. Goodson,B.J.,Goodson,,,,Ankle,,Limited Participation in Practice,2017-12-15T10:08:55Z,2017-12-15 10:08:55
3278,2017_01_ARI_DET,2017091004,DET,ARI,REG,1,ARI,away,DET,ARI,67.0,2017-09-10,146.0,1046.0,1046.0,Half2,0,19.0,0,3,2.0,0,02:26,ARI 33,2,9.0,(2:26) 33-K.Williams left tackle to ARI 34 for 1 yard (79-A.Barrett; 59-T.Whitehead). DET-92-H.Ngata was injured during the play.,run,1.0,0,0,0.0,0,0,0,,,,,left,tackle,,,,,3,3,0.0,,,,,3.0,3.0,15,17,17.0,15.0,2.0,17.0,15.0,2.0,0.0192266870290041,0.128594785928726,0.0039073643274605,0.228709042072296,0.226200506091118,0.0034790222998708,0.389882564544678,0.0,0.0,1.42017513373867,-0.267115786671639,-7.34162681669486,7.34162681669486,4.29402222820511,-4.29402222820511,-9.50128661226296,9.50128661226296,,,0.0,0.0,-1.09614468802465,1.09614468802465,-2.71396531926703,2.71396531926703,-14.0583213610225,14.0583213610225,7.28047581202582,-7.28047581202582,0.618970453739166,0.381029546260834,0.381029546260834,0.618970453739166,-0.0368107557296753,-0.0180699825286865,0.0180699825286865,0.417840301990509,0.582159698009491,0.720037460327148,0.279962539672852,0.0178617909469087,-0.0178617909469087,-0.3342348345611,0.3342348345611,,,0.0,0.0,-0.0895406053960323,0.0895406053960323,0.0022377239763736,-0.0022377239763736,-0.0878770695626735,0.0878770695626735,-0.140367323646297,0.140367323646297,0.0,0.0,0.0,0.0,0.0,0.0,0.0,0.0,0.0,0,0.0,0.0,0.0,0.0,0.0,0.0,0.0,0.0,0.0,0.0,0.0,0.0,0.0,0.0,0.0,0.0,0.0,0.0,0.0,0.0,0.0,0.0,1.0,0.0,0.0,0.0,0.0,0.0,0.0,0.0,0.0,0.0,0.0,0.0,0.0,0.0,1.0,0.0,0.0,0.0,0.0,,,,,,,00-0030117,K.Williams,1.0,,,,,,,,,,,,,,,,,,,,,,,,,,,,,,,,,,,,,,,,,,,,,,,,,00-0033746,A.Barrett,DET,00-0029212,T.Whitehead,DET,,,,,,,0.0,,,,,,,,,,,,,,,,,,,,,,,,,,,,,,,,0.0,,,,,0,,,0.0,0.0,0.0,0.0,,,2017,,,42,1,First down,3278,"9/10/17, 13:03:06",2017-09-10T19:32:30Z,Ford Field,"Controlled Climate Temp: 68° F, Humidity: 70%, Wind: mph",10012017-0910-04e6-82e0-b5888d13894c,0,0,RUSH,0,,,,19,Punt,2017-09-10T19:30:54Z,6.0,3:51,1.0,0.0,0.0,3.0,4.0,-5.0,KICKOFF,PUNT,03:07,14:16,ARI 25,ARI 34,3233.0,3428.0,23,35,Home,12,58,-2.5,48.5,0,dome,fieldturf,,,Jim Caldwell,Bruce Arians,DET00,Ford Field,0,0.0,,,K.Williams,33.0,,,0,1,0.0,0,1,,00-0030117,,K.Williams,33.0,00-0030117,K.Williams,00-0030117,K.Williams,00-0030117,0,0,-0.267115786671639,,,,,,0.323643654584885,-32.3643654584885,2017-09-10,H.Ngata,2017,REG,DET,1,00-0024227,DT,Haloti Ngata,Haloti,Ngata,,,,Not Injury Related,,Did Not Participate In Practice,2017-09-08T13:02:19Z,2017-09-08 13:02:19
3258,2017_05_CAR_DET,2017100802,DET,CAR,REG,5,CAR,away,DET,CAR,70.0,2017-10-08,550.0,550.0,550.0,Half2,0,20.0,0,4,3.0,0,09:10,CAR 30,12,11.0,(9:10) (Shotgun) 1-C.Newton pass incomplete short middle to 22-C.McCaffrey. CAR-75-M.Kalil was injured during the play.,pass,0.0,1,0,1.0,0,0,0,short,middle,3.0,,,,,,,,3,2,0.0,,,,,2.0,3.0,10,27,27.0,10.0,17.0,27.0,10.0,17.0,0.14171938598156,0.168130576610565,0.0033531854860484,0.275431901216507,0.165931060910225,0.0022781251464039,0.243155732750893,0.0,0.0,-0.23468184703961,-1.01533730980009,-22.2502935596316,22.2502935596316,5.50828248844482,-5.50828248844482,-35.072241143116,35.072241143116,-0.782737367320806,-0.232599942479283,0.0,0.0,-6.00710812257603,6.00710812257603,-16.7256426753356,16.7256426753356,5.4121293934295,-5.4121293934295,-32.2504181697424,32.2504181697424,0.991843640804291,0.0081563591957092,0.0081563591957092,0.991843640804291,-0.0023608803749084,-0.0021289587020874,0.0021289587020874,0.0105172395706177,0.989482760429382,0.990401566028595,0.009598433971405,0.218667391542286,-0.218667391542286,-1.04135327025511,1.04135327025511,0.0,-0.0023608803749084,0.0,0.0,-0.233251122046775,0.233251122046775,-0.504597200635393,0.504597200635393,-0.233251122046775,0.233251122046775,-0.697069887626489,0.697069887626489,0.0,0.0,0.0,0.0,0.0,1.0,0.0,0.0,1.0,0,0.0,0.0,0.0,0.0,0.0,0.0,0.0,0.0,0.0,0.0,0.0,0.0,0.0,0.0,0.0,0.0,0.0,0.0,0.0,0.0,0.0,0.0,0.0,1.0,0.0,0.0,0.0,0.0,0.0,0.0,0.0,0.0,0.0,0.0,0.0,0.0,0.0,0.0,0.0,0.0,0.0,00-0027939,C.Newton,,00-0033280,C.McCaffrey,,,,,,,,,,,,,,,,,,,,,,,,,,,,,,,,,,,,,,,,,,,,,,,,,,,,,,,,,,,,,,,,,0.0,,,,,,,,,,,,,,,,,,,,,,,,,,,,,,,,0.0,,,,,0,,,0.0,0.0,0.0,0.0,,,2017,0.809165298938751,-80.9165298938751,43,0,Punt,3258,"10/8/17, 13:03:01",2017-10-08T19:40:16Z,Ford Field,"Controlled Climate Temp: 68° F, Humidity: 70%, Wind: mph",10012017-1008-02d8-e382-750e7d3d6913,0,0,PASS,0,,,,20,Punt,2017-10-08T19:36:37Z,6.0,3:12,1.0,0.0,0.0,4.0,4.0,0.0,PUNT,PUNT,12:10,08:58,CAR 19,CAR 30,3147.0,3283.0,27,24,Home,-3,51,2.0,42.0,0,dome,fieldturf,,,Jim Caldwell,Ron Rivera,DET00,Ford Field,0,0.0,C.Newton,1.0,,,C.McCaffrey,22.0,1,0,0.0,0,1,00-0027939,,00-0033280,C.Newton,1.0,00-0027939,C.McCaffrey,00-0033280,C.McCaffrey,00-0033280,0,1,-1.01533730980009,0.900964751843639,5.62983717575844,4.0,0.243133630778175,0.184838891203981,0.877514541149139,12.2485458850861,2017-10-08,M.Kalil,2017,REG,CAR,5,00-0029687,T,Matt Kalil,Matt,Kalil,Groin,,Questionable,Groin,,Did Not Participate In Practice,2017-10-06T12:37:11Z,2017-10-06 12:37:11
