play_id,game_id,old_game_id,home_team,away_team,season_type,week_x,posteam,posteam_type,defteam,side_of_field,yardline_100,game_date,quarter_seconds_remaining,half_seconds_remaining,game_seconds_remaining,game_half,quarter_end,drive,sp,qtr,down,goal_to_go,time,yrdln,ydstogo,ydsnet,desc,play_type,yards_gained,shotgun,no_huddle,qb_dropback,qb_kneel,qb_spike,qb_scramble,pass_length,pass_location,air_yards,yards_after_catch,run_location,run_gap,field_goal_result,kick_distance,extra_point_result,two_point_conv_result,home_timeouts_remaining,away_timeouts_remaining,timeout,timeout_team,td_team,td_player_name,td_player_id,posteam_timeouts_remaining,defteam_timeouts_remaining,total_home_score,total_away_score,posteam_score,defteam_score,score_differential,posteam_score_post,defteam_score_post,score_differential_post,no_score_prob,opp_fg_prob,opp_safety_prob,opp_td_prob,fg_prob,safety_prob,td_prob,extra_point_prob,two_point_conversion_prob,ep,epa,total_home_epa,total_away_epa,total_home_rush_epa,total_away_rush_epa,total_home_pass_epa,total_away_pass_epa,air_epa,yac_epa,comp_air_epa,comp_yac_epa,total_home_comp_air_epa,total_away_comp_air_epa,total_home_comp_yac_epa,total_away_comp_yac_epa,total_home_raw_air_epa,total_away_raw_air_epa,total_home_raw_yac_epa,total_away_raw_yac_epa,wp,def_wp,home_wp,away_wp,wpa,vegas_wpa,vegas_home_wpa,home_wp_post,away_wp_post,vegas_wp,vegas_home_wp,total_home_rush_wpa,total_away_rush_wpa,total_home_pass_wpa,total_away_pass_wpa,air_wpa,yac_wpa,comp_air_wpa,comp_yac_wpa,total_home_comp_air_wpa,total_away_comp_air_wpa,total_home_comp_yac_wpa,total_away_comp_yac_wpa,total_home_raw_air_wpa,total_away_raw_air_wpa,total_home_raw_yac_wpa,total_away_raw_yac_wpa,punt_blocked,first_down_rush,first_down_pass,first_down_penalty,third_down_converted,third_down_failed,fourth_down_converted,fourth_down_failed,incomplete_pass,touchback,interception,punt_inside_twenty,punt_in_endzone,punt_out_of_bounds,punt_downed,punt_fair_catch,kickoff_inside_twenty,kickoff_in_endzone,kickoff_out_of_bounds,kickoff_downed,kickoff_fair_catch,fumble_forced,fumble_not_forced,fumble_out_of_bounds,solo_tackle,safety,penalty,tackled_for_loss,fumble_lost,own_kickoff_recovery,own_kickoff_recovery_td,qb_hit,rush_attempt,pass_attempt,sack,touchdown,pass_touchdown,rush_touchdown,return_touchdown,extra_point_attempt,two_point_attempt,field_goal_attempt,kickoff_attempt,punt_attempt,fumble,complete_pass,assist_tackle,lateral_reception,lateral_rush,lateral_return,lateral_recovery,passer_player_id,passer_player_name,passing_yards,receiver_player_id,receiver_player_name,receiving_yards,rusher_player_id,rusher_player_name,rushing_yards,lateral_receiver_player_id,lateral_receiver_player_name,lateral_receiving_yards,lateral_rusher_player_id,lateral_rusher_player_name,lateral_rushing_yards,lateral_sack_player_id,lateral_sack_player_name,interception_player_id,interception_player_name,lateral_interception_player_id,lateral_interception_player_name,punt_returner_player_id,punt_returner_player_name,lateral_punt_returner_player_id,lateral_punt_returner_player_name,kickoff_returner_player_name,kickoff_returner_player_id,lateral_kickoff_returner_player_id,lateral_kickoff_returner_player_name,punter_player_id,punter_player_name,kicker_player_name,kicker_player_id,own_kickoff_recovery_player_id,own_kickoff_recovery_player_name,blocked_player_id,blocked_player_name,tackle_for_loss_1_player_id,tackle_for_loss_1_player_name,tackle_for_loss_2_player_id,tackle_for_loss_2_player_name,qb_hit_1_player_id,qb_hit_1_player_name,qb_hit_2_player_id,qb_hit_2_player_name,forced_fumble_player_1_team,forced_fumble_player_1_player_id,forced_fumble_player_1_player_name,forced_fumble_player_2_team,forced_fumble_player_2_player_id,forced_fumble_player_2_player_name,solo_tackle_1_team,solo_tackle_2_team,solo_tackle_1_player_id,solo_tackle_2_player_id,solo_tackle_1_player_name,solo_tackle_2_player_name,assist_tackle_1_player_id,assist_tackle_1_player_name,assist_tackle_1_team,assist_tackle_2_player_id,assist_tackle_2_player_name,assist_tackle_2_team,assist_tackle_3_player_id,assist_tackle_3_player_name,assist_tackle_3_team,assist_tackle_4_player_id,assist_tackle_4_player_name,assist_tackle_4_team,tackle_with_assist,tackle_with_assist_1_player_id,tackle_with_assist_1_player_name,tackle_with_assist_1_team,tackle_with_assist_2_player_id,tackle_with_assist_2_player_name,tackle_with_assist_2_team,pass_defense_1_player_id,pass_defense_1_player_name,pass_defense_2_player_id,pass_defense_2_player_name,fumbled_1_team,fumbled_1_player_id,fumbled_1_player_name,fumbled_2_player_id,fumbled_2_player_name,fumbled_2_team,fumble_recovery_1_team,fumble_recovery_1_yards,fumble_recovery_1_player_id,fumble_recovery_1_player_name,fumble_recovery_2_team,fumble_recovery_2_yards,fumble_recovery_2_player_id,fumble_recovery_2_player_name,sack_player_id,sack_player_name,half_sack_1_player_id,half_sack_1_player_name,half_sack_2_player_id,half_sack_2_player_name,return_team,return_yards,penalty_team,penalty_player_id,penalty_player_name,penalty_yards,replay_or_challenge,replay_or_challenge_result,penalty_type,defensive_two_point_attempt,defensive_two_point_conv,defensive_extra_point_attempt,defensive_extra_point_conv,safety_player_name,safety_player_id,season_x,cp,cpoe,series,series_success,series_result,order_sequence,start_time,time_of_day,stadium,weather,nfl_api_id,play_clock,play_deleted,play_type_nfl,special_teams_play,st_play_type,end_clock_time,end_yard_line,fixed_drive,fixed_drive_result,drive_real_start_time,drive_play_count,drive_time_of_possession,drive_first_downs,drive_inside20,drive_ended_with_score,drive_quarter_start,drive_quarter_end,drive_yards_penalized,drive_start_transition,drive_end_transition,drive_game_clock_start,drive_game_clock_end,drive_start_yard_line,drive_end_yard_line,drive_play_id_started,drive_play_id_ended,away_score,home_score,location,result,total,spread_line,total_line,div_game,roof,surface,temp,wind,home_coach,away_coach,stadium_id,game_stadium,aborted_play,success,passer,passer_jersey_number,rusher,rusher_jersey_number,receiver,receiver_jersey_number,pass,rush,first_down,special,play,passer_id,rusher_id,receiver_id,name,jersey_number,id,fantasy_player_name,fantasy_player_id,fantasy,fantasy_id,out_of_bounds,home_opening_kickoff,qb_epa,xyac_epa,xyac_mean_yardage,xyac_median_yardage,xyac_success,xyac_fd,xpass,pass_oe,date_x,injured_player,season_y,game_type,team,week_y,gsis_id,position,full_name,first_name,last_name,report_primary_injury,report_secondary_injury,report_status,practice_primary_injury,practice_secondary_injury,practice_status,date_modified,date_y
4414,2009_18_PHI_DAL,2010010900,DAL,PHI,POST,18,DAL,home,PHI,PHI,35.0,2010-01-09,152.0,152.0,152.0,Half2,0,25.0,0,4,3.0,0,02:32,PHI 35,29,-4.0,(2:32) 23-T.Choice right end to PHI 30 for 5 yards (98-M.Patterson; 57-C.Gocong). DAL-23-T.Choice was injured during the play. His return is Probable.,run,5.0,0,0,0.0,0,0,0,,,,,right,end,,,,,2,0,0.0,,,,,2.0,0.0,34,14,34.0,14.0,20.0,34.0,14.0,20.0,0.533731997013092,0.0288632269948721,0.0003332152555231,0.0531199984252453,0.322477608919144,0.0019187185680493,0.05955521017313,0.0,0.0,0.929060634633061,0.292372577066999,21.0889153587124,-21.0889153587124,5.46072390858899,-5.46072390858899,18.1590751977806,-18.1590751977806,,,0.0,0.0,-0.69788344055648,0.69788344055648,8.8676345141721,-8.8676345141721,-9.56153428231134,9.56153428231134,22.0792120403918,-22.0792120403918,0.999126136302948,0.000873863697052,0.999126136302948,0.000873863697052,0.0002698302268981,3.1590461730957e-05,3.1590461730957e-05,0.999395966529846,0.0006040334701538,0.999749362468719,0.999749362468719,0.0874114485840702,-0.0874114485840702,0.352686046725238,-0.352686046725238,,,0.0,0.0,-0.012470300776003,0.012470300776003,0.427596431445479,-0.427596431445479,-0.0191589725446459,0.0191589725446459,0.43297092591986,-0.43297092591986,0.0,0.0,0.0,0.0,0.0,1.0,0.0,0.0,0.0,0,0.0,0.0,0.0,0.0,0.0,0.0,0.0,0.0,0.0,0.0,0.0,0.0,0.0,0.0,0.0,0.0,0.0,0.0,0.0,0.0,0.0,0.0,1.0,0.0,0.0,0.0,0.0,0.0,0.0,0.0,0.0,0.0,0.0,0.0,0.0,0.0,1.0,0.0,0.0,0.0,0.0,,,,,,,00-0026262,T.Choice,5.0,,,,,,,,,,,,,,,,,,,,,,,,,,,,,,,,,,,,,,,,,,,,,,,,,00-0023466,M.Patterson,PHI,00-0024286,C.Gocong,PHI,,,,,,,0.0,,,,,,,,,,,,,,,,,,,,,,,,,,,,,,,,0.0,,,,,0,,,0.0,0.0,0.0,0.0,,,2009,,,59,0,Punt,4414,"1/9/10, 20:05:59",2010-01-10T04:19:02Z,AT&T Stadium,"Temp: ° F, Wind: mph",10012010-0109-00bc-0de9-6cb12e16d685,0,0,RUSH,0,,,,25,Punt,2010-01-10T04:10:25Z,6.0,2:05,1.0,1.0,0.0,4.0,4.0,-25.0,FUMBLE,PUNT,03:59,01:54,PHI 26,PHI 30,4203.0,4456.0,14,34,Home,20,48,3.5,45.5,1,closed,fieldturf,,,Wade Phillips,Andy Reid,DAL00,Cowboys Stadium,0,1.0,,,T.Choice,23.0,,,0,1,0.0,0,1,,00-0026262,,T.Choice,23.0,00-0026262,T.Choice,00-0026262,T.Choice,00-0026262,0,1,0.292372577066999,,,,,,0.20188020169735,-20.188020169735,2010-01-09,T.Choice,2009,WC,DAL,18,00-0026262,RB,Tashard Choice,Tashard,Choice,Concussion,,Probable,Concussion,,Full Participation in Practice,,
4388,2009_06_BUF_NYJ,2009101811,NYJ,BUF,REG,6,NYJ,home,BUF,BUF,29.0,2009-10-18,764.0,764.0,764.0,Overtime,0,24.0,0,5,1.0,0,12:44,BUF 29,10,53.0,"(12:44) 29-L.Washington right guard to BUF 24 for 5 yards (90-C.Kelsay, 56-K.Ellison). BUF-51-P.Posluszny was injured during the play.",run,5.0,0,0,0.0,0,0,0,,,,,right,guard,,,,,2,2,0.0,,,,,2.0,2.0,13,13,13.0,13.0,0.0,13.0,13.0,0.0,0.0361144579946995,0.0394383370876312,0.0004917740589007,0.0585736706852913,0.407084316015244,0.0025235502980649,0.455773890018463,0.0,0.0,3.88740302459337,0.239474433008581,1.80492814374156,-1.80492814374156,16.0934608656682,-16.0934608656682,-15.4818370679908,15.4818370679908,,,0.0,0.0,-0.711276108878967,0.711276108878967,-2.3973832524986,2.3973832524986,2.85703146869519,-2.85703146869519,-17.5306070602289,17.5306070602289,0.865381756331772,0.134618243668228,0.865381756331772,0.134618243668228,0.0351059506647289,0.0351059506647289,0.0351059506647289,0.900487706996501,0.0995122930034995,0.865381756331772,0.865381756331772,0.513141901421273,-0.513141901421273,-0.368477106625933,0.368477106625933,,,0.0,0.0,0.0477449269965291,-0.0477449269965291,-0.0332356519724916,0.0332356519724916,0.0477449269965291,-0.0477449269965291,-0.335065690400798,0.335065690400798,0.0,0.0,0.0,0.0,0.0,0.0,0.0,0.0,0.0,0,0.0,0.0,0.0,0.0,0.0,0.0,0.0,0.0,0.0,0.0,0.0,0.0,0.0,0.0,0.0,0.0,0.0,0.0,0.0,0.0,0.0,0.0,1.0,0.0,0.0,0.0,0.0,0.0,0.0,0.0,0.0,0.0,0.0,0.0,0.0,0.0,1.0,0.0,0.0,0.0,0.0,,,,,,,00-0024332,L.Washington,5.0,,,,,,,,,,,,,,,,,,,,,,,,,,,,,,,,,,,,,,,,,,,,,,,,,00-0024392,K.Ellison,BUF,,,,,,,,,,1.0,00-0021995,C.Kelsay,BUF,,,,,,,,,,,,,,,,,,,,,,,,,,,,,0.0,,,,,0,,,0.0,0.0,0.0,0.0,,,2009,,,55,0,Turnover,4388,"10/18/09, 16:15:40",2009-10-18T23:42:29Z,Giants Stadium,"Cloudy Temp: 44° F, Humidity: 37%, Wind: North 18 mph",10012009-1018-114c-80c1-2e7abc97fe41,0,0,RUSH,0,,,,24,Turnover,2009-10-18T23:38:20Z,8.0,3:59,2.0,0.0,0.0,5.0,5.0,-10.0,KICKOFF,INTERCEPTION,15:00,11:01,NYJ 15,BUF 32,4285.0,4499.0,16,13,Home,-3,29,9.5,35.5,1,outdoors,fieldturf,44.0,18.0,Rex Ryan,Dick Jauron,NYC00,Giants Stadium,0,1.0,,,L.Washington,29.0,,,0,1,0.0,0,1,,00-0024332,,L.Washington,29.0,00-0024332,L.Washington,00-0024332,L.Washington,00-0024332,0,1,0.239474433008581,,,,,,0.168183922767639,-16.8183922767639,2009-10-18,P.Posluszny,2009,REG,BUF,6,00-0025421,LB,Paul Posluszny,Paul,Posluszny,Forearm,,Probable,Forearm,,Full Participation in Practice,,
4250,2009_08_ATL_NO,2009110200,NO,ATL,REG,8,NO,home,ATL,ATL,46.0,2009-11-02,102.0,102.0,102.0,Half2,0,22.0,0,4,1.0,0,01:42,ATL 46,10,0.0,"(1:42) The ball moves to the 46 on the change of possession. 21-M.Bell right guard to ATL 46 for no gain (50-C.Lofton, 26-E.Coleman). NO-76-J.Goodwin was injured during the play. He is Out.",run,0.0,0,0,0.0,0,0,0,,,,,right,guard,,,,,2,1,0.0,,,,,2.0,1.0,35,24,35.0,24.0,11.0,35.0,24.0,11.0,0.459680497646332,0.0370386242866516,0.0003031540836673,0.0242976285517216,0.208039879798889,0.0020717899315059,0.268568396568298,0.0,0.0,2.22643641434843,-0.279609841411002,10.716206645961,-10.716206645961,-5.51889911593753,5.51889911593753,16.3633067576499,-16.3633067576499,,,0.0,0.0,2.34845305260387,-2.34845305260387,4.96535728342133,-4.96535728342133,-9.21581060413155,9.21581060413155,33.3794569467188,-33.3794569467188,0.998417377471924,0.0015826225280761,0.998417377471924,0.0015826225280761,-0.0004406571388244,-0.000219702720642,-0.000219702720642,0.997976720333099,0.0020232796669006,0.999310374259949,0.999310374259949,-0.15620746543086,0.15620746543086,0.638573581991781,-0.638573581991781,,,0.0,0.0,0.241068018600345,-0.241068018600345,0.0489097211713557,-0.0489097211713557,0.252540240064263,-0.252540240064263,0.577323047617913,-0.577323047617913,0.0,0.0,0.0,0.0,0.0,0.0,0.0,0.0,0.0,0,0.0,0.0,0.0,0.0,0.0,0.0,0.0,0.0,0.0,0.0,0.0,0.0,0.0,0.0,0.0,0.0,0.0,0.0,0.0,0.0,0.0,0.0,1.0,0.0,0.0,0.0,0.0,0.0,0.0,0.0,0.0,0.0,0.0,0.0,0.0,0.0,1.0,0.0,0.0,0.0,0.0,,,,,,,00-0024011,M.Bell,0.0,,,,,,,,,,,,,,,,,,,,,,,,,,,,,,,,,,,,,,,,,,,,,,,,,00-0022218,E.Coleman,ATL,,,,,,,,,,1.0,00-0026177,C.Lofton,ATL,,,,,,,,,,,,,,,,,,,,,,,,,,,,,0.0,,,,,0,,,0.0,0.0,0.0,0.0,,,2009,,,57,0,Turnover,4250,"11/2/09, 20:40:47",2009-11-03T04:56:52Z,Caesars Superdome,"N/A (Indoors) Temp: 61° F, Humidity: 78%, Wind: N 5 mph",10012009-1102-00f3-f7bc-efa36c347a61,0,0,RUSH,0,,,,22,Turnover,2009-11-03T04:56:52Z,3.0,0:19,0.0,0.0,0.0,4.0,4.0,0.0,DOWNS,FUMBLE,01:42,01:23,ATL 46,ATL 46,4250.0,4338.0,27,35,Home,8,62,11.0,56.0,1,dome,fieldturf,,,Sean Payton,Mike Smith,NOR00,Louisiana Superdome,0,0.0,,,M.Bell,21.0,,,0,1,0.0,0,1,,00-0024011,,M.Bell,21.0,00-0024011,M.Bell,00-0024011,M.Bell,00-0024011,0,0,-0.279609841411002,,,,,,0.0248163864016533,-2.48163864016533,2009-11-02,J.Goodwin,2009,REG,NO,8,00-0021267,C,Jonathan Goodwin,Jonathan,Goodwin,Ankle,,Probable,Ankle,,Full Participation in Practice,,
3996,2009_08_ATL_NO,2009110200,NO,ATL,REG,8,ATL,away,NO,NO,30.0,2009-11-02,183.0,183.0,183.0,Half2,0,21.0,0,4,,0,03:03,NO 30,0,13.0,6-T.Morstead kicks 62 yards from NO 30 to ATL 8. 14-E.Weems to ATL 34 for 26 yards (31-P.Prioleau). NO-52-J.Casillas was injured during the play. His return is Questionable.,kickoff,0.0,0,0,0.0,0,0,0,,,,,,,,62.0,,,2,1,0.0,,,,,1.0,2.0,35,24,24.0,35.0,-11.0,24.0,35.0,-11.0,0.497176051139832,0.0766069665551186,0.0018990929238498,0.0974601581692696,0.109853729605675,0.001223481609486,0.21578049659729,0.0,0.0,0.926631435519084,0.654271120671183,7.18847751683333,-7.18847751683333,-4.42138786936994,4.42138786936994,11.7380663819546,-11.7380663819546,,,0.0,0.0,2.34385131092859,-2.34385131092859,5.13994313060539,-5.13994313060539,-4.58962977331248,4.58962977331248,24.1280357402044,-24.1280357402044,0.0260539799928665,0.973946020007133,0.973946020007133,0.0260539799928665,0.0081754922866821,0.0033879913389682,-0.0033879913389682,0.965770527720451,0.0342294722795486,0.0184864494949579,0.981513550505042,-0.156870585730438,0.156870585730438,0.607030509678711,-0.607030509678711,,,0.0,0.0,0.239375062286854,-0.239375062286854,0.0521330658550029,-0.0521330658550029,0.246693678200245,-0.246693678200245,0.551626537168861,-0.551626537168861,0.0,0.0,0.0,0.0,0.0,0.0,0.0,0.0,0.0,0,0.0,0.0,0.0,0.0,0.0,0.0,0.0,0.0,0.0,0.0,0.0,0.0,0.0,0.0,1.0,0.0,0.0,0.0,0.0,0.0,0.0,0.0,0.0,0.0,0.0,0.0,0.0,0.0,0.0,0.0,0.0,0.0,1.0,0.0,0.0,0.0,0.0,0.0,0.0,0.0,0.0,,,,,,,,,,,,,,,,,,,,,,,,,,E.Weems,00-0024535,,,,,T.Morstead,00-0027114,,,,,,,,,,,,,,,,,,,NO,,00-0013255,,P.Prioleau,,,,,,,,,,,,,,0.0,,,,,,,,,,,,,,,,,,,,,,,,,,,,,,,ATL,26.0,,,,,0,,,0.0,0.0,0.0,0.0,,,2009,,,55,1,First down,3996,"11/2/09, 20:40:47",2009-11-03T04:44:10Z,Caesars Superdome,"N/A (Indoors) Temp: 61° F, Humidity: 78%, Wind: N 5 mph",10012009-1102-00f3-f7bc-efa36c347a61,0,0,KICK_OFF,1,,,,21,Turnover on downs,2009-11-03T04:44:10Z,7.0,1:21,1.0,0.0,0.0,4.0,4.0,0.0,KICKOFF,DOWNS,03:03,01:42,ATL 34,ATL 47,3996.0,4226.0,27,35,Home,8,62,11.0,56.0,1,dome,fieldturf,,,Sean Payton,Mike Smith,NOR00,Louisiana Superdome,0,1.0,,,,,,,0,0,0.0,1,0,,,,,,,,,,,0,0,0.654271120671183,,,,,,,,2009-11-02,J.Casillas,2009,REG,NO,8,00-0026832,LB,Jonathan Casillas,Jonathan,Casillas,Hip,,Probable,Hip,,Full Participation in Practice,,
3875,2009_13_NO_WAS,2009120608,WAS,NO,REG,13,NO,away,WAS,NO,80.0,2009-12-06,112.0,112.0,112.0,Half2,0,19.0,0,4,1.0,0,01:52,NO 20,10,80.0,"(1:52) (Shotgun) 9-D.Brees pass short left to 23-P.Thomas to NO 24 for 4 yards (37-R.Doughty, 59-L.Fletcher). WAS-92-A.Haynesworth was injured during the play.",pass,4.0,1,0,1.0,0,0,0,short,left,4.0,0.0,,,,,,,3,0,0.0,,,,,0.0,3.0,30,23,23.0,30.0,-7.0,23.0,30.0,-7.0,0.720142483711243,0.0358523912727833,0.0012692317832261,0.0664862841367722,0.0745519548654556,0.0008004445116966,0.100897237658501,0.0,0.0,0.356037790887058,0.180409694672562,4.84808701958241,-4.84808701958241,6.55711374786791,-6.55711374786791,2.00609314948863,-2.00609314948863,0.180409694672562,0.0,0.180409694672562,0.0,-1.41731324925786,1.41731324925786,10.8927500151761,-10.8927500151761,-12.0613534946751,12.0613534946751,12.557947606118,-12.557947606118,0.0843398422002792,0.915660157799721,0.915660157799721,0.0843398422002792,-0.0025864467024803,0.0160354748368263,-0.0160354748368263,0.918246604502201,0.0817533954977989,0.105375349521637,0.894624650478363,0.337553173303604,-0.337553173303604,0.13736974040038,-0.13736974040038,-0.0025864467024803,0.0,-0.0025864467024803,0.0,-0.114285054541323,0.114285054541323,0.472877104559475,-0.472877104559475,-0.118767681456301,0.118767681456301,0.226017898450653,-0.226017898450653,0.0,0.0,0.0,0.0,0.0,0.0,0.0,0.0,0.0,0,0.0,0.0,0.0,0.0,0.0,0.0,0.0,0.0,0.0,0.0,0.0,0.0,0.0,0.0,0.0,0.0,0.0,0.0,0.0,0.0,0.0,0.0,0.0,1.0,0.0,0.0,0.0,0.0,0.0,0.0,0.0,0.0,0.0,0.0,0.0,1.0,1.0,0.0,0.0,0.0,0.0,00-0020531,D.Brees,4.0,00-0024813,P.Thomas,4.0,,,,,,,,,,,,,,,,,,,,,,,,,,,,,,,,,,,,,,,,,,,,,,,,,,,,00-0005322,L.Fletcher,WAS,,,,,,,,,,1.0,00-0024387,R.Doughty,WAS,,,,,,,,,,,,,,,,,,,,,,,,,,,,,0.0,,,,,0,,,0.0,0.0,0.0,0.0,,,2009,0.739137530326843,26.0862469673157,57,1,First down,3875,"12/6/09, 13:03:22",2009-12-06T21:11:09Z,Commanders Field,"Sunny Temp: 36° F, Humidity: 52%, Wind: NW 9 mph",10012009-1206-0847-139a-f40204aa8301,0,0,PASS,0,,,,19,Touchdown,2009-12-06T21:11:09Z,5.0,0:33,3.0,0.0,1.0,4.0,4.0,0.0,MISSED_FG,TOUCHDOWN,01:52,01:19,NO 20,NO 47,3875.0,4024.0,33,30,Home,-3,63,-9.0,46.5,0,outdoors,grass,36.0,9.0,Jim Zorn,Sean Payton,WAS00,FedExField,0,1.0,D.Brees,9.0,,,P.Thomas,23.0,1,0,0.0,0,1,00-0020531,,00-0024813,D.Brees,9.0,00-0020531,P.Thomas,00-0024813,P.Thomas,00-0024813,0,0,0.180409694672562,0.0771360477348229,4.1587867263006,2.0,0.779366692760959,0.229542372981086,0.977510392665863,2.2489607334137,2009-12-06,A.Haynesworth,2009,REG,WAS,13,00-0021149,DT,Albert Haynesworth,Albert,Haynesworth,Ankle,,Questionable,Ankle,,Limited Participation in Practice,,
3822,2009_06_BAL_MIN,2009101803,MIN,BAL,REG,6,MIN,home,BAL,BAL,30.0,2009-10-18,312.0,312.0,312.0,Half2,0,23.0,0,4,,0,05:12,BAL 30,0,-8.0,6-S.Hauschka kicks 70 yards from BAL 30 to MIN 0. 12-P.Harvin to MIN 14 for 14 yards (32-M.Lawrence). MIN-12-P.Harvin was injured during the play. His return is Questionable.,kickoff,0.0,0,0,0.0,0,0,0,,,,,,,,70.0,,,2,2,0.0,,,,,2.0,2.0,30,24,30.0,24.0,6.0,30.0,24.0,6.0,0.316418796777725,0.116957567632198,0.0015797532396391,0.16172268986702,0.150145649909973,0.003646959317848,0.249528616666794,0.0,0.0,0.718340146588162,-0.431735377060249,5.50770083937096,-5.50770083937096,5.92660261021229,-5.92660261021229,-6.72708186375763,6.72708186375763,,,0.0,0.0,-8.1179014935174,8.1179014935174,-2.7426020658731,2.7426020658731,-20.4667063962684,20.4667063962684,11.1880962845062,-11.1880962845062,0.872355163097382,0.127644836902618,0.872355163097382,0.127644836902618,-0.0039122700691223,-0.0048002004623413,-0.0048002004623413,0.868442893028259,0.131557106971741,0.881544947624207,0.881544947624207,0.150124102226274,-0.150124102226274,0.103407596761838,-0.103407596761838,,,0.0,0.0,0.044636341711756,-0.044636341711756,-0.0154384601896216,0.0154384601896216,0.0438003269641364,-0.0438003269641364,0.0382578201556991,-0.0382578201556991,0.0,0.0,0.0,0.0,0.0,0.0,0.0,0.0,0.0,0,0.0,0.0,0.0,0.0,0.0,0.0,1.0,1.0,0.0,0.0,0.0,0.0,0.0,0.0,1.0,0.0,0.0,0.0,0.0,0.0,0.0,0.0,0.0,0.0,0.0,0.0,0.0,0.0,0.0,0.0,0.0,0.0,1.0,0.0,0.0,0.0,0.0,0.0,0.0,0.0,0.0,,,,,,,,,,,,,,,,,,,,,,,,,,P.Harvin,00-0026998,,,,,S.Hauschka,00-0025944,,,,,,,,,,,,,,,,,,,BAL,,00-0026132,,M.Lawrence,,,,,,,,,,,,,,0.0,,,,,,,,,,,,,,,,,,,,,,,,,,,,,,,MIN,14.0,,,,,0,,,0.0,0.0,0.0,0.0,,,2009,,,51,0,Punt,3822,"10/18/09, 13:02:38",2009-10-18T19:55:48Z,Mall of America Field,"Temp: 67° F, Wind: mph",10012009-1018-03f2-6332-b512c8dad370,0,0,KICK_OFF,1,,,,23,Punt,2009-10-18T19:55:48Z,3.0,1:28,0.0,0.0,0.0,4.0,4.0,0.0,KICKOFF,PUNT,05:12,03:44,MIN 14,MIN 6,3822.0,3919.0,31,33,Home,2,64,3.0,45.5,0,dome,fieldturf,,,Brad Childress,John Harbaugh,MIN00,Hubert H. Humphrey Metrodome,0,0.0,,,,,,,0,0,0.0,1,0,,,,,,,,,,,0,1,-0.431735377060249,,,,,,,,2009-10-18,P.Harvin,2009,REG,MIN,6,00-0026998,WR,Percy Harvin,Percy,Harvin,Shoulder,,Questionable,Shoulder,,Limited Participation in Practice,,
3751,2009_11_WAS_DAL,2009112201,DAL,WAS,REG,11,WAS,away,DAL,WAS,85.0,2009-11-22,155.0,155.0,155.0,Half2,0,20.0,0,4,2.0,0,02:35,WAS 15,3,25.0,"(2:35) (No Huddle, Shotgun) 17-J.Campbell pass short left to 82-A.Randle El ran ob at WAS 22 for 7 yards. DAL-21-M.Jenkins was injured during the play. His return is Questionable.",pass,7.0,1,1,1.0,0,0,0,short,left,0.0,7.0,,,,,,,3,1,0.0,,,,,1.0,3.0,7,6,6.0,7.0,-1.0,6.0,7.0,-1.0,0.488676607608795,0.0901113897562027,0.0030819240491837,0.128034457564354,0.106090001761913,0.0014105879236012,0.182595014572144,0.0,0.0,0.426517062820494,0.463034140178934,-1.75114216978176,1.75114216978176,3.63367480991087,-3.63367480991087,-6.49069257231342,6.49069257231342,-0.505300495307893,0.968334635486826,-0.505300495307893,0.968334635486826,14.118949313066,-14.118949313066,-16.1955839342238,16.1955839342238,24.6420134870568,-24.6420134870568,-32.2110888591214,32.2110888591214,0.411306291818619,0.588693708181381,0.588693708181381,0.411306291818619,0.0230221450328827,0.0458461046218872,-0.0458461046218872,0.565671563148499,0.434328436851501,0.303088784217834,0.696911215782166,0.0735922455787659,-0.0735922455787659,-0.144473099352691,0.144473099352691,0.0,0.0230221450328827,0.0,0.0230221450328827,0.150833359716561,-0.150833359716561,-0.158064320683479,0.158064320683479,0.150833359716561,-0.150833359716561,-0.318098694086075,0.318098694086075,0.0,0.0,1.0,0.0,0.0,0.0,0.0,0.0,0.0,0,0.0,0.0,0.0,0.0,0.0,0.0,0.0,0.0,0.0,0.0,0.0,0.0,0.0,0.0,0.0,0.0,0.0,0.0,0.0,0.0,0.0,0.0,0.0,1.0,0.0,0.0,0.0,0.0,0.0,0.0,0.0,0.0,0.0,0.0,0.0,1.0,0.0,0.0,0.0,0.0,0.0,00-0023460,J.Campbell,7.0,00-0021190,A.Randle El,7.0,,,,,,,,,,,,,,,,,,,,,,,,,,,,,,,,,,,,,,,,,,,,,,,,,,,,,,,,,,,,,,,,0.0,,,,,,,,,,,,,,,,,,,,,,,,,,,,,,,,0.0,,,,,0,,,0.0,0.0,0.0,0.0,,,2009,0.655353009700775,34.4646990299225,48,1,First down,3751,"11/22/09, 13:03:03",,AT&T Stadium,"Temp: 61° F, Humidity: 62%, Wind: south 9 mph",10012009-1122-01b1-b568-9c3a3c7e1909,0,0,PASS,0,,,,20,Turnover,2009-11-22T20:53:49Z,4.0,0:55,2.0,0.0,0.0,4.0,4.0,0.0,KICKOFF,INTERCEPTION,02:41,01:46,WAS 8,WAS 33,3689.0,3831.0,6,7,Home,1,13,11.0,41.5,1,closed,fieldturf,,,Wade Phillips,Jim Zorn,DAL00,Cowboys Stadium,0,1.0,J.Campbell,17.0,,,A.Randle,82.0,1,0,1.0,0,1,00-0023460,,00-0021190,J.Campbell,17.0,00-0023460,A.Randle El,00-0021190,A.Randle,00-0021190,1,1,0.463034140178934,0.861730271836144,6.83901723474992,5.0,0.738024596357718,0.738024596357718,0.649954795837402,35.0045204162598,2009-11-22,M.Jenkins,2009,REG,DAL,11,00-0026165,CB,Mike Jenkins,Mike,Jenkins,Elbow,,Probable,Elbow,,Full Participation in Practice,,
3751,2009_11_CLE_DET,2009112202,DET,CLE,REG,11,CLE,away,DET,DET,39.0,2009-11-22,418.0,418.0,418.0,Half2,0,22.0,0,4,2.0,0,06:58,DET 39,10,75.0,"(6:58) (No Huddle, Shotgun) 10-B.Quinn pass short left to 16-J.Cribbs pushed ob at DET 4 for 35 yards (55-L.Foote). DET-31-P.Buchanon was injured during the play.",pass,35.0,1,1,1.0,0,0,0,short,left,-2.0,37.0,,,,,,,2,2,0.0,,,,,2.0,2.0,31,29,29.0,31.0,-2.0,29.0,31.0,-2.0,0.163121372461319,0.0590685084462166,0.0008497999515384,0.0956680774688721,0.291869640350342,0.0017537557287141,0.387668818235397,0.0,0.0,2.7442164926324,3.00437708949903,-6.01684829651785,6.01684829651785,0.908940951980185,-0.908940951980185,-7.37822819218039,7.37822819218039,-1.28423389187083,4.28861098136986,-1.28423389187083,4.28861098136986,5.0372432571894,-5.0372432571894,-2.49741109600649,2.49741109600649,1.30898920321488,-1.30898920321488,-8.22474983933265,8.22474983933265,0.492855399847031,0.507144600152969,0.507144600152969,0.492855399847031,0.136338323354721,0.147834599018097,-0.147834599018097,0.370806276798248,0.629193723201752,0.480828166007996,0.519171833992004,-0.021572470664978,0.021572470664978,-0.217178125319423,0.217178125319423,0.0,0.136338323354721,0.0,0.136338323354721,0.0504163779334119,-0.0504163779334119,-0.147252978771062,0.147252978771062,0.0504163779334119,-0.0504163779334119,-0.290221022456021,0.290221022456021,0.0,0.0,1.0,0.0,0.0,0.0,0.0,0.0,0.0,0,0.0,0.0,0.0,0.0,0.0,0.0,0.0,0.0,0.0,0.0,0.0,0.0,0.0,0.0,1.0,0.0,0.0,0.0,0.0,0.0,0.0,0.0,0.0,1.0,0.0,0.0,0.0,0.0,0.0,0.0,0.0,0.0,0.0,0.0,0.0,1.0,0.0,0.0,0.0,0.0,0.0,00-0025409,B.Quinn,35.0,00-0023176,J.Cribbs,35.0,,,,,,,,,,,,,,,,,,,,,,,,,,,,,,,,,,,,,,,,,,,,,,DET,,00-0021246,,L.Foote,,,,,,,,,,,,,,0.0,,,,,,,,,,,,,,,,,,,,,,,,,,,,,,,,0.0,,,,,0,,,0.0,0.0,0.0,0.0,,,2009,0.856456637382507,14.3543362617493,52,1,First down,3751,"11/22/09, 13:02:35",2009-11-22T20:54:28Z,Ford Field,"Controlled Climate Temp: 68° F, Humidity: 70%, Wind: mph",10012009-1122-02b5-48d4-5ce6effecb5b,0,0,PASS,0,,,,22,Touchdown,2009-11-22T20:42:27Z,14.0,6:47,5.0,1.0,1.0,4.0,4.0,-4.0,PUNT,TOUCHDOWN,12:31,05:44,CLE 25,DET 2,3437.0,3846.0,37,38,Home,1,75,3.5,37.5,0,dome,fieldturf,,,Jim Schwartz,Eric Mangini,DET00,Ford Field,0,1.0,B.Quinn,10.0,,,J.Cribbs,16.0,1,0,1.0,0,1,00-0025409,,00-0023176,B.Quinn,10.0,00-0025409,J.Cribbs,00-0023176,J.Cribbs,00-0023176,1,0,3.00437708949903,1.4214645333771,8.74975164391799,7.0,0.485139461059589,0.240027090359945,0.653978884220123,34.6021115779877,2009-11-22,P.Buchanon,2009,REG,DET,11,00-0021151,CB,Phillip Buchanon,Phillip,Buchanon,Knee,Shoulder,Probable,Knee,Shoulder,Limited Participation in Practice,,
3686,2009_12_WAS_PHI,2009112906,PHI,WAS,REG,12,WAS,away,PHI,WAS,61.0,2009-11-29,420.0,420.0,420.0,Half2,0,23.0,0,4,1.0,0,07:00,WAS 39,10,30.0,(7:00) 31-R.Cartwright left end to WAS 41 for 2 yards (24-S.Brown). WAS-45-M.Sellers was injured during the play. His return is Questionable.,run,2.0,0,0,0.0,0,0,0,,,,,left,end,,,,,2,2,0.0,,,,,2.0,2.0,24,24,24.0,24.0,0.0,24.0,24.0,0.0,0.276619791984558,0.0872568115592003,0.001864883233793,0.120992407202721,0.215190395712852,0.0016945310635492,0.296381205320358,0.0,0.0,1.61118163494393,-0.41493120091036,-4.32221104190955,4.32221104190955,7.41905692894943,-7.41905692894943,-6.66196101414226,6.66196101414226,,,0.0,0.0,-5.35196395037929,5.35196395037929,-3.98959567227629,3.98959567227629,5.00009749212768,-5.00009749212768,-12.0524301419572,12.0524301419572,0.509552597999573,0.490447402000427,0.490447402000427,0.509552597999573,-0.0251098871231079,-0.0002239644527435,0.0002239644527435,0.515557289123535,0.484442710876465,0.487274616956711,0.512725383043289,0.285355654366435,-0.285355654366435,-0.0569804840918579,0.0569804840918579,,,0.0,0.0,0.105100061733549,-0.105100061733549,-0.494245559943363,0.494245559943363,0.10249915345413,-0.10249915345413,-0.366121829522297,0.366121829522297,0.0,0.0,0.0,0.0,0.0,0.0,0.0,0.0,0.0,0,0.0,0.0,0.0,0.0,0.0,0.0,0.0,0.0,0.0,0.0,0.0,0.0,0.0,0.0,1.0,0.0,0.0,0.0,0.0,0.0,0.0,0.0,1.0,0.0,0.0,0.0,0.0,0.0,0.0,0.0,0.0,0.0,0.0,0.0,0.0,0.0,0.0,0.0,0.0,0.0,0.0,,,,,,,00-0021357,R.Cartwright,2.0,,,,,,,,,,,,,,,,,,,,,,,,,,,,,,,,,,,,,,,,,,,PHI,,00-0021186,,S.Brown,,,,,,,,,,,,,,0.0,,,,,,,,,,,,,,,,,,,,,,,,,,,,,,,,0.0,,,,,0,,,0.0,0.0,0.0,0.0,,,2009,,,47,0,Punt,3686,"11/29/09, 13:03:23",2009-11-29T20:55:17Z,Lincoln Financial Field,"Sunny Temp: 56° F, Humidity: 52%, Wind: SSW 10 mph",10012009-1129-06f8-1aee-6e007b9a6ed7,0,0,RUSH,0,,,,23,Punt,2009-11-29T20:53:56Z,4.0,1:49,1.0,0.0,0.0,4.0,4.0,0.0,KICKOFF,PUNT,07:24,05:35,WAS 16,WAS 46,3640.0,3767.0,24,27,Home,3,51,9.5,40.5,1,outdoors,grass,56.0,10.0,Andy Reid,Jim Zorn,PHI00,Lincoln Financial Field,0,0.0,,,R.Cartwright,31.0,,,0,1,0.0,0,1,,00-0021357,,R.Cartwright,31.0,00-0021357,R.Cartwright,00-0021357,R.Cartwright,00-0021357,0,0,-0.41493120091036,,,,,,0.487489938735962,-48.7489938735962,2009-11-29,M.Sellers,2009,REG,WAS,12,00-0014655,RB,Mike Sellers,Mike,Sellers,Hamstring,,Questionable,Hamstring,,Limited Participation in Practice,,
3682,2009_13_DET_CIN,2009120603,CIN,DET,REG,13,DET,away,CIN,CIN,28.0,2009-12-06,221.0,221.0,221.0,Half2,0,22.0,0,4,4.0,0,03:41,CIN 28,3,24.0,(3:41) (Shotgun) 9-M.Stafford pass incomplete short left to 86-D.Northcutt [57-Dh.Jones]. DET-9-M.Stafford was injured during the play.,pass,0.0,1,0,1.0,0,0,0,short,left,3.0,,,,,,,,3,3,0.0,,,,,3.0,3.0,23,7,7.0,23.0,-16.0,7.0,23.0,-16.0,0.200605526566505,0.0551920346915722,0.0003685822885017,0.0713454261422157,0.559311330318451,0.0012521827593445,0.111924879252911,0.0,0.0,1.79818125959719,-2.74895280291094,17.1241338186708,-17.1241338186708,0.730493097042199,-0.730493097042199,12.6101852775764,-12.6101852775764,1.96748533187201,-4.71643813478295,0.0,0.0,-1.4890835225815,1.4890835225815,6.50765003473498,-6.50765003473498,-4.86767745047109,4.86767745047109,19.6958454174319,-19.6958454174319,0.0046716276556253,0.995328372344375,0.995328372344375,0.0046716276556253,-0.0036157313734293,-0.0012465204345062,0.0012465204345062,0.998944103717804,0.001055896282196,0.00160641327966,0.99839358672034,0.162538258358836,-0.162538258358836,0.243232209035168,-0.243232209035168,0.0,-0.0036157313734293,0.0,0.0,-0.141153801325512,0.141153801325512,0.162619465962052,-0.162619465962052,-0.140059042814922,0.140059042814922,0.4253188202947,-0.4253188202947,0.0,0.0,0.0,0.0,0.0,0.0,0.0,1.0,1.0,0,0.0,0.0,0.0,0.0,0.0,0.0,0.0,0.0,0.0,0.0,0.0,0.0,0.0,0.0,0.0,0.0,0.0,0.0,0.0,0.0,0.0,1.0,0.0,1.0,0.0,0.0,0.0,0.0,0.0,0.0,0.0,0.0,0.0,0.0,0.0,0.0,0.0,0.0,0.0,0.0,0.0,00-0026498,M.Stafford,,00-0019650,D.Northcutt,,,,,,,,,,,,,,,,,,,,,,,,,,,,,,,,,,,,,00-0019635,Dh.Jones,,,,,,,,,,,,,,,,,,,,,,,,,,,0.0,,,,,,,,,,,,,,,,,,,,,,,,,,,,,,,,0.0,,,,,0,,,0.0,0.0,0.0,0.0,,,2009,0.361598432064056,-36.1598432064056,53,0,Turnover on downs,3682,"12/6/09, 13:02:54",2009-12-06T20:45:31Z,Paycor Stadium,"Partly Cloudy Temp: 34° F, Humidity: 49%, Wind: SSE 7 mph",10012009-1206-0336-7ca1-40875b502271,0,0,PASS,0,,,,22,Turnover on downs,2009-12-06T20:43:05Z,5.0,2:27,1.0,0.0,0.0,4.0,4.0,0.0,INTERCEPTION,DOWNS,06:03,03:36,DET 48,CIN 28,3594.0,3682.0,13,23,Home,10,36,13.5,42.0,0,outdoors,fieldturf,34.0,7.0,Marvin Lewis,Jim Schwartz,CIN00,Paul Brown Stadium,0,0.0,M.Stafford,9.0,,,D.Northcutt,86.0,1,0,0.0,0,1,00-0026498,,00-0019650,M.Stafford,9.0,00-0026498,D.Northcutt,00-0019650,D.Northcutt,00-0019650,0,0,-2.74895280291094,0.242452812312296,4.43938165117288,3.0,0.972726147039793,0.972726147039793,0.971108257770538,2.88917422294617,2009-12-06,M.Stafford,2009,REG,DET,13,00-0026498,QB,Matthew Stafford,Matthew,Stafford,left Shoulder,,Probable,left Shoulder,,Full Participation in Practice,,
3644,2009_18_BAL_NE,2010011001,NE,BAL,POST,18,BAL,away,NE,NE,32.0,2010-01-10,174.0,174.0,174.0,Half2,0,24.0,0,4,2.0,0,02:54,NE 32,8,31.0,"(2:54) 23-W.McGahee left tackle to NE 29 for 3 yards (96-A.Thomas, 95-T.Banta-Cain). BAL-86-T.Heap was injured during the play.",run,3.0,0,0,0.0,0,0,0,,,,,left,tackle,,,,,2,2,0.0,,,,,2.0,2.0,14,33,33.0,14.0,19.0,33.0,14.0,19.0,0.310097545385361,0.0375221446156502,0.0003505427448544,0.0411218851804733,0.316662430763245,0.0022393127437681,0.292006134986877,0.0,0.0,2.59738814708544,0.067101942608133,-26.8684978298742,26.8684978298742,-10.2441837499705,10.2441837499705,-18.5606578004407,18.5606578004407,,,0.0,0.0,2.11539016105235,-2.11539016105235,4.86715872504283,-4.86715872504283,6.85043029644294,-6.85043029644294,-19.4449989979365,19.4449989979365,0.999167799949646,0.000832200050354,0.000832200050354,0.999167799949646,5.59091567993164e-05,-2.07424163818359e-05,2.07424163818359e-05,0.0007762908935546,0.999223709106445,0.999356806278229,0.0006431937217712,-0.324854999051486,0.324854999051486,-0.261493920283102,0.261493920283102,,,0.0,0.0,0.012349103642918,-0.012349103642918,-0.0113979345187545,0.0113979345187545,0.0102981152667774,-0.0102981152667774,-0.180754523724318,0.180754523724318,0.0,0.0,0.0,0.0,0.0,0.0,0.0,0.0,0.0,0,0.0,0.0,0.0,0.0,0.0,0.0,0.0,0.0,0.0,0.0,0.0,0.0,0.0,0.0,0.0,0.0,0.0,0.0,0.0,0.0,0.0,0.0,1.0,0.0,0.0,0.0,0.0,0.0,0.0,0.0,0.0,0.0,0.0,0.0,0.0,0.0,1.0,0.0,0.0,0.0,0.0,,,,,,,00-0022178,W.McGahee,3.0,,,,,,,,,,,,,,,,,,,,,,,,,,,,,,,,,,,,,,,,,,,,,,,,,00-0022038,T.Banta-Cain,NE,,,,,,,,,,1.0,00-0019593,A.Thomas,NE,,,,,,,,,,,,,,,,,,,,,,,,,,,,,0.0,,,,,0,,,0.0,0.0,0.0,0.0,,,2009,,,48,0,Punt,3644,"1/10/10, 13:03:58",2010-01-10T20:57:04Z,Gillette Stadium,"Sunny and cold Temp: 20° F, Humidity: 36%, Wind: NNW 12 mph",10012010-0110-0175-2916-3604db328998,0,0,RUSH,0,,,,24,Punt,2010-01-10T20:52:39Z,8.0,5:12,2.0,0.0,0.0,4.0,4.0,-5.0,MISSED_FG,PUNT,07:19,02:07,BAL 34,NE 35,3512.0,3734.0,33,14,Home,-19,47,3.5,43.5,0,outdoors,fieldturf,20.0,12.0,Bill Belichick,John Harbaugh,BOS00,Gillette Stadium,0,1.0,,,W.McGahee,23.0,,,0,1,0.0,0,1,,00-0022178,,W.McGahee,23.0,00-0022178,W.McGahee,00-0022178,W.McGahee,00-0022178,0,0,0.067101942608133,,,,,,0.109379217028618,-10.9379217028618,2010-01-10,T.Heap,2009,WC,BAL,18,00-0020516,TE,Todd Heap,Todd,Heap,Neck,,Probable,Neck,,Full Participation in Practice,,
3631,2009_08_SF_IND,2009110106,IND,SF,REG,8,IND,home,SF,SF,46.0,2009-11-01,564.0,564.0,564.0,Half2,0,24.0,0,4,2.0,0,09:24,SF 46,9,51.0,(9:24) (Shotgun) 18-P.Manning pass short right to 87-R.Wayne pushed ob at SF 39 for 7 yards (36-S.Spencer). SF-51-T.Spikes was injured during the play.,pass,7.0,1,0,1.0,0,0,0,short,right,3.0,4.0,,,,,,,3,2,0.0,,,,,3.0,2.0,18,14,18.0,14.0,4.0,18.0,14.0,4.0,0.10209771245718,0.0887290611863136,0.0009778442326933,0.125775426626205,0.282425969839096,0.0044454159215092,0.395548522472382,0.0,0.0,2.47643754025921,0.253204500419088,6.26808307893953,-6.26808307893953,-6.7258493415397,6.7258493415397,12.4639027001721,-12.4639027001721,-0.499522406607866,0.752726907026954,-0.499522406607866,0.752726907026954,2.54893619252834,-2.54893619252834,12.6958072716518,-12.6958072716518,30.5915480615222,-30.5915480615222,-16.1328863380762,16.1328863380762,0.797187805175781,0.202812194824219,0.797187805175781,0.202812194824219,0.0291542410850525,0.0166682600975037,0.0166682600975037,0.826342046260834,0.173657953739166,0.901947319507599,0.901947319507599,-0.242789140407434,0.242789140407434,0.505798036135779,-0.505798036135779,0.0,0.0291542410850525,0.0,0.0291542410850525,0.127732607588172,-0.127732607588172,0.449019217766868,-0.449019217766868,0.127803924545646,-0.127803924545646,0.464053625144111,-0.464053625144111,0.0,0.0,0.0,0.0,0.0,0.0,0.0,0.0,0.0,0,0.0,0.0,0.0,0.0,0.0,0.0,0.0,0.0,0.0,0.0,0.0,0.0,0.0,0.0,1.0,0.0,0.0,0.0,0.0,0.0,0.0,0.0,0.0,1.0,0.0,0.0,0.0,0.0,0.0,0.0,0.0,0.0,0.0,0.0,0.0,1.0,0.0,0.0,0.0,0.0,0.0,00-0010346,P.Manning,7.0,00-0020498,R.Wayne,7.0,,,,,,,,,,,,,,,,,,,,,,,,,,,,,,,,,,,,,,,,,,,,,,SF,,00-0022843,,S.Spencer,,,,,,,,,,,,,,0.0,,,,,,,,,,,,,,,,,,,,,,,,,,,,,,,,0.0,,,,,0,,,0.0,0.0,0.0,0.0,,,2009,0.759464025497437,24.0535974502564,50,0,Punt,3631,"11/1/09, 13:02:55",2009-11-01T20:44:23Z,Lucas Oil Stadium,"Sunny Temp: 49° F, Humidity: 49%, Wind: ESE 1 mph",10012009-1101-06c6-56bd-e555e5063585,0,0,PASS,0,,,,24,Punt,2009-11-01T20:42:30Z,5.0,2:41,1.0,0.0,0.0,4.0,4.0,0.0,PUNT,PUNT,11:17,08:36,IND 10,SF 39,3565.0,3681.0,14,18,Home,4,32,13.0,45.0,0,open,fieldturf,,,Jim Caldwell,Mike Singletary,IND00,Lucas Oil Stadium,0,1.0,P.Manning,18.0,,,R.Wayne,87.0,1,0,0.0,0,1,00-0010346,,00-0020498,P.Manning,18.0,00-0010346,R.Wayne,00-0020498,R.Wayne,00-0020498,1,0,0.253204500419088,0.839332936633701,4.67975063173799,3.0,0.561187888961285,0.281099121551961,0.715085566043854,28.4914433956146,2009-11-01,T.Spikes,2009,REG,SF,8,00-0015474,LB,Takeo Spikes,Takeo,Spikes,Shoulder,,Questionable,Shoulder,,Limited Participation in Practice,,
3596,2009_12_CLE_CIN,2009112902,CIN,CLE,REG,12,CIN,home,CLE,CIN,71.0,2009-11-29,224.0,224.0,224.0,Half2,0,19.0,0,4,2.0,0,03:44,CIN 29,10,4.0,(3:44) 27-L.Johnson left guard to CIN 32 for 3 yards (69-C.Mosley). CLE-92-S.Rogers was injured during the play.,run,3.0,0,0,0.0,0,0,0,,,,,left,guard,,,,,3,2,0.0,,,,,3.0,2.0,16,7,16.0,7.0,9.0,16.0,7.0,9.0,0.426087856292725,0.0976528897881508,0.0008205768535844,0.12826569378376,0.132820993661881,0.0023530793841928,0.211998894810677,0.0,0.0,0.694701723870821,-0.305966148735024,8.56251978094224,-8.56251978094224,0.737889633967495,-0.737889633967495,8.47057259423164,-8.47057259423164,,,0.0,0.0,4.68749965380994,-4.68749965380994,0.520003381854622,-0.520003381854622,-1.9069717573002,1.9069717573002,8.80067168240005,-8.80067168240005,0.956285715103149,0.0437142848968506,0.956285715103149,0.0437142848968506,0.0018004775047302,-0.0028800964355468,-0.0028800964355468,0.95808619260788,0.0419138073921204,0.975800216197968,0.975800216197968,0.133455701298919,-0.133455701298919,0.300355795193835,-0.300355795193835,,,0.0,0.0,0.156895674188062,-0.156895674188062,0.0215601101517677,-0.0215601101517677,0.161874107439443,-0.161874107439443,0.081124734133482,-0.081124734133482,0.0,0.0,0.0,0.0,0.0,0.0,0.0,0.0,0.0,0,0.0,0.0,0.0,0.0,0.0,0.0,0.0,0.0,0.0,0.0,0.0,0.0,0.0,0.0,1.0,0.0,0.0,0.0,0.0,0.0,0.0,0.0,1.0,0.0,0.0,0.0,0.0,0.0,0.0,0.0,0.0,0.0,0.0,0.0,0.0,0.0,0.0,0.0,0.0,0.0,0.0,,,,,,,00-0021976,L.Johnson,3.0,,,,,,,,,,,,,,,,,,,,,,,,,,,,,,,,,,,,,,,,,,,CLE,,00-0023624,,C.Mosley,,,,,,,,,,,,,,0.0,,,,,,,,,,,,,,,,,,,,,,,,,,,,,,,,0.0,,,,,0,,,0.0,0.0,0.0,0.0,,,2009,,,47,0,Punt,3596,"11/29/09, 13:02:40",2009-11-29T20:50:16Z,Paycor Stadium,"Partly Cloudy Temp: 59° F, Humidity: 41%, Wind: SW 15 mph",10012009-1129-0243-70f5-4e5212e1cc35,0,0,RUSH,0,,,,19,Punt,2009-11-29T20:49:11Z,3.0,0:45,0.0,0.0,0.0,4.0,4.0,0.0,PUNT,PUNT,03:49,03:04,CIN 29,CIN 33,3558.0,3659.0,7,16,Home,9,23,12.0,39.5,1,outdoors,fieldturf,59.0,15.0,Marvin Lewis,Eric Mangini,CIN00,Paul Brown Stadium,0,0.0,,,L.Johnson,27.0,,,0,1,0.0,0,1,,00-0021976,,L.Johnson,27.0,00-0021976,L.Johnson,00-0021976,L.Johnson,00-0021976,0,0,-0.305966148735024,,,,,,0.260509997606277,-26.0509997606277,2009-11-29,S.Rogers,2009,REG,CLE,12,00-0020528,DT,Shaun Rogers,Shaun,Rogers,Ankle,,Questionable,Ankle,,Limited Participation in Practice,,
3516,2009_07_MIN_PIT,2009102504,PIT,MIN,REG,7,MIN,away,PIT,PIT,21.0,2009-10-25,519.0,519.0,519.0,Half2,0,19.0,0,4,1.0,0,08:39,PIT 21,10,74.0,(8:39) 4-B.Favre pass short right to 28-A.Peterson to PIT 10 for 11 yards (25-R.Clark). PIT-90-T.Kirschke was injured during the play. His return is Questionable.,pass,11.0,0,0,1.0,0,0,0,short,right,0.0,11.0,,,,,,,3,3,0.0,,,,,3.0,3.0,13,10,10.0,13.0,-3.0,10.0,13.0,-3.0,0.0427373014390469,0.0237382017076015,0.000539204920642,0.0456717982888222,0.377526700496674,0.0010179999517276,0.508768796920776,0.0,0.0,4.30400207685307,0.494591518829111,-3.77719008192071,3.77719008192071,-1.49240569863468,1.49240569863468,-7.17237245371668,7.17237245371668,-0.41106052394025,0.905652042769361,-0.41106052394025,0.905652042769361,-4.93184089101851,4.93184089101851,-4.7729160093586,4.7729160093586,-17.6218554839143,17.6218554839143,10.1317342324743,-10.1317342324743,0.521100223064423,0.478899776935577,0.478899776935577,0.521100223064423,0.0304857492446899,0.0505501925945282,-0.0505501925945282,0.448414027690887,0.551585972309113,0.411943823099136,0.588056176900864,-0.0556269392436388,0.0556269392436388,-0.250791343926736,0.250791343926736,0.0,0.0304857492446899,0.0,0.0304857492446899,-0.150178790092468,0.150178790092468,-0.180668952941248,0.180668952941248,-0.14779070019722,0.14779070019722,-0.119948568820306,0.119948568820306,0.0,0.0,1.0,0.0,0.0,0.0,0.0,0.0,0.0,0,0.0,0.0,0.0,0.0,0.0,0.0,0.0,0.0,0.0,0.0,0.0,0.0,0.0,0.0,1.0,0.0,0.0,0.0,0.0,0.0,0.0,0.0,0.0,1.0,0.0,0.0,0.0,0.0,0.0,0.0,0.0,0.0,0.0,0.0,0.0,1.0,0.0,0.0,0.0,0.0,0.0,00-0005106,B.Favre,11.0,00-0025394,A.Peterson,11.0,,,,,,,,,,,,,,,,,,,,,,,,,,,,,,,,,,,,,,,,,,,,,,PIT,,00-0020840,,R.Clark,,,,,,,,,,,,,,0.0,,,,,,,,,,,,,,,,,,,,,,,,,,,,,,,,0.0,,,,,0,,,0.0,0.0,0.0,0.0,,,2009,0.660913646221161,33.9086353778839,44,1,First down,3516,"10/25/09, 13:03:08",2009-10-25T19:39:19Z,Acrisure Stadium,"Sunny Temp: 52° F, Humidity: 57%, Wind: From W 5 mph",10012009-1025-043b-9a74-70f5a5dcf24a,0,0,PASS,0,,,,19,Opp touchdown,2009-10-25T19:24:58Z,15.0,7:45,5.0,1.0,1.0,4.0,4.0,-30.0,FUMBLE,FUMBLE,14:08,06:23,MIN 3,PIT 8,3128.0,3622.0,17,27,Home,10,44,6.0,46.5,0,outdoors,dessograss,52.0,5.0,Mike Tomlin,Brad Childress,PIT00,Heinz Field,0,1.0,B.Favre,4.0,,,A.Peterson,28.0,1,0,1.0,0,1,00-0005106,,00-0025394,B.Favre,4.0,00-0005106,A.Peterson,00-0025394,A.Peterson,00-0025394,0,0,0.494591518829111,0.660230804234532,6.34943968255539,5.0,0.594826424960047,0.214243727270514,0.424200117588043,57.5799882411957,2009-10-25,T.Kirschke,2009,REG,PIT,7,00-0009305,DE,Travis Kirschke,Travis,Kirschke,,,,Not Injury Related,,Did Not Participate In Practice,,
3473,2009_02_NE_NYJ,2009092005,NYJ,NE,REG,2,NE,away,NYJ,NE,71.0,2009-09-20,513.0,513.0,513.0,Half2,0,18.0,0,4,2.0,0,08:33,NE 29,10,17.0,"(8:33) (Shotgun) 12-T.Brady pass short left to 11-J.Edelman to NE 38 for 9 yards (25-K.Rhodes, 30-D.Coleman) [52-D.Harris]. NYJ-77-K.Jenkins was injured during the play.",pass,9.0,1,0,1.0,0,0,0,short,left,6.0,3.0,,,,,,,2,2,0.0,,,,,2.0,2.0,16,9,9.0,16.0,-7.0,9.0,16.0,-7.0,0.231314644217491,0.133155554533005,0.002853165147826,0.198535695672035,0.175353556871414,0.0014433113392442,0.257344096899033,0.0,0.0,0.535433107987046,0.746043766150251,4.53640117944883,-4.53640117944883,-9.26468103282302,9.26468103282302,6.68316825879526,-6.68316825879526,-0.139009967446327,0.885053733596578,-0.139009967446327,0.885053733596578,3.60046903300099,-3.60046903300099,-1.50579958372178,1.50579958372178,-0.32401997980196,0.32401997980196,9.24091247834519,-9.24091247834519,0.154796868562698,0.845203131437302,0.845203131437302,0.154796868562698,0.0217966586351395,0.0140752792358398,-0.0140752792358398,0.823406472802162,0.176593527197838,0.202579766511917,0.797420233488083,-0.331627249717712,0.331627249717712,0.353587620204844,-0.353587620204844,0.0,0.0217966586351395,0.0,0.0217966586351395,0.173930682486452,-0.173930682486452,-0.0139187425374985,0.0139187425374985,0.173930682486452,-0.173930682486452,0.208773091435432,-0.208773091435432,0.0,0.0,0.0,0.0,0.0,0.0,0.0,0.0,0.0,0,0.0,0.0,0.0,0.0,0.0,0.0,0.0,0.0,0.0,0.0,0.0,0.0,0.0,0.0,0.0,0.0,0.0,0.0,0.0,0.0,0.0,1.0,0.0,1.0,0.0,0.0,0.0,0.0,0.0,0.0,0.0,0.0,0.0,0.0,0.0,1.0,1.0,0.0,0.0,0.0,0.0,00-0019596,T.Brady,9.0,00-0027150,J.Edelman,9.0,,,,,,,,,,,,,,,,,,,,,,,,,,,,,,,,,,,,00-0025434,D.Harris,,,,,,,,,,,,,,,00-0024403,D.Coleman,NYJ,,,,,,,,,,1.0,00-0023557,K.Rhodes,NYJ,,,,,,,,,,,,,,,,,,,,,,,,,,,,,0.0,,,,,0,,,0.0,0.0,0.0,0.0,,,2009,0.41805425286293,58.194574713707,46,0,Punt,3473,"9/20/09, 13:02:43",2009-09-20T19:39:33Z,Giants Stadium,"Clear Temp: 69° F, Humidity: 41%, Wind: SSW 5 mph",10012009-0920-0582-6632-6551eef4347d,0,0,PASS,0,,,,18,Punt,2009-09-20T19:34:25Z,5.0,3:09,1.0,0.0,0.0,4.0,4.0,0.0,KICKOFF,PUNT,09:48,06:39,NE 15,NE 32,3351.0,3548.0,9,16,Home,7,25,-3.5,45.0,1,outdoors,fieldturf,69.0,5.0,Rex Ryan,Bill Belichick,NYC00,Giants Stadium,0,1.0,T.Brady,12.0,,,J.Edelman,11.0,1,0,0.0,0,1,00-0019596,,00-0027150,T.Brady,12.0,00-0019596,J.Edelman,00-0027150,J.Edelman,00-0027150,0,0,0.746043766150251,0.628928109794305,3.65911352014518,2.0,0.694767709181178,0.300180140242446,0.756275117397308,24.3724882602692,2009-09-20,K.Jenkins,2009,REG,NYJ,2,00-0020380,DT,Kris Jenkins,Kris,Jenkins,Back,,Questionable,Back,,Limited Participation in Practice,,
3433,2009_13_DET_CIN,2009120603,CIN,DET,REG,13,DET,away,CIN,DET,75.0,2009-12-06,485.0,485.0,485.0,Half2,0,20.0,0,4,1.0,0,08:05,DET 25,10,26.0,(8:05) 9-M.Stafford pass short middle to 82-C.Fitzsimmons to DET 34 for 9 yards (55-K.Rivers). CIN-99-T.Johnson was injured during the play. DET-82-C.Fitzsimmons was injured during the play.,pass,9.0,0,0,1.0,0,0,0,short,middle,4.0,5.0,,,,,,,3,3,0.0,,,,,3.0,3.0,23,7,7.0,23.0,-16.0,7.0,23.0,-16.0,0.197944238781929,0.120039351284504,0.0027366310823708,0.196887403726578,0.185593798756599,0.0024128768127411,0.294385671615601,0.0,0.0,0.878503709100187,0.695347591303289,14.5995109749535,-14.5995109749535,3.26235223026015,-3.26235223026015,7.55370330064122,-7.55370330064122,-0.0776585550047457,0.773006146308035,-0.0776585550047457,0.773006146308035,-2.598558763857,2.598558763857,9.02843578375177,-9.02843578375177,-5.61208660854027,5.61208660854027,17.3682724270484,-17.3682724270484,0.0238982122391462,0.976101787760854,0.976101787760854,0.0238982122391462,0.0015549696981906,0.0026036249473691,-0.0026036249473691,0.974546818062663,0.0254531819373369,0.0099256346002221,0.990074365399778,0.160754352807999,-0.160754352807999,0.220618828930865,-0.220618828930865,0.0041932538151741,-0.0026382841169834,0.0041932538151741,-0.0026382841169834,-0.141153801325512,0.141153801325512,0.156648326665163,-0.156648326665163,-0.140059042814922,0.140059042814922,0.409701008242331,-0.409701008242331,0.0,0.0,0.0,0.0,0.0,0.0,0.0,0.0,0.0,0,0.0,0.0,0.0,0.0,0.0,0.0,0.0,0.0,0.0,0.0,0.0,0.0,0.0,0.0,1.0,0.0,0.0,0.0,0.0,0.0,0.0,0.0,0.0,1.0,0.0,0.0,0.0,0.0,0.0,0.0,0.0,0.0,0.0,0.0,0.0,1.0,0.0,0.0,0.0,0.0,0.0,00-0026498,M.Stafford,9.0,00-0021525,C.Fitzsimmons,9.0,,,,,,,,,,,,,,,,,,,,,,,,,,,,,,,,,,,,,,,,,,,,,,CIN,,00-0026149,,K.Rivers,,,,,,,,,,,,,,0.0,,,,,,,,,,,,,,,,,,,,,,,,,,,,,,,,0.0,,,,,0,,,0.0,0.0,0.0,0.0,,,2009,0.768667340278626,23.1332659721375,49,1,First down,3433,"12/6/09, 13:02:54",2009-12-06T20:34:18Z,Paycor Stadium,"Partly Cloudy Temp: 34° F, Humidity: 49%, Wind: SSE 7 mph",10012009-1206-0336-7ca1-40875b502271,0,0,PASS,0,,,,20,Turnover,2009-12-06T20:31:56Z,3.0,1:08,1.0,0.0,0.0,4.0,4.0,0.0,KICKOFF,INTERCEPTION,08:11,07:03,DET 25,CIN 49,3411.0,3485.0,13,23,Home,10,36,13.5,42.0,0,outdoors,fieldturf,34.0,7.0,Marvin Lewis,Jim Schwartz,CIN00,Paul Brown Stadium,0,1.0,M.Stafford,9.0,,,C.Fitzsimmons,82.0,1,0,0.0,0,1,00-0026498,,00-0021525,M.Stafford,9.0,00-0026498,C.Fitzsimmons,00-0021525,C.Fitzsimmons,00-0021525,0,0,0.695347591303289,0.446903858025005,4.64411197957816,3.0,0.83603000768926,0.265648768632673,0.856013953685761,14.398604631424,2009-12-06,T.Johnson,2009,REG,CIN,13,00-0022696,DT,Tank Johnson,Tank,Johnson,Knee,,Probable,Knee,,Limited Participation in Practice,,
3413,2009_13_TEN_IND,2009120604,IND,TEN,REG,13,IND,home,TEN,IND,86.0,2009-12-06,637.0,637.0,637.0,Half2,0,17.0,0,4,1.0,0,10:37,IND 14,10,69.0,(10:37) 29-J.Addai right end pushed ob at IND 20 for 6 yards (53-K.Bulluck). TEN-33-M.Griffin was injured during the play.,run,6.0,0,0,0.0,0,0,0,,,,,right,end,,,,,2,2,0.0,,,,,2.0,2.0,24,10,24.0,10.0,14.0,24.0,10.0,14.0,0.120129898190498,0.160324409604073,0.0024152451660484,0.229554638266563,0.195686414837837,0.0029359648469835,0.288953453302383,0.0,0.0,0.522919160313904,0.365520126186311,14.3898254507877,-14.3898254507877,2.70008618723572,-2.70008618723572,17.7234437986433,-17.7234437986433,,,0.0,0.0,-1.34896149943233,1.34896149943233,5.80002758103513,-5.80002758103513,-19.3733302509354,19.3733302509354,34.7755352119082,-34.7755352119082,0.972885727882385,0.0271142721176147,0.972885727882385,0.0271142721176147,-0.0060435533523559,-0.0001056194305419,-0.0001056194305419,0.966842174530029,0.0331578254699707,0.98194545507431,0.98194545507431,0.0546947148638912,-0.0546947148638912,0.450657770259811,-0.450657770259811,,,0.0,0.0,-0.0347253174930977,0.0347253174930977,0.290839156119675,-0.290839156119675,-0.0354268567115235,0.0354268567115235,0.436322020350546,-0.436322020350546,0.0,0.0,0.0,0.0,0.0,0.0,0.0,0.0,0.0,0,0.0,0.0,0.0,0.0,0.0,0.0,0.0,0.0,0.0,0.0,0.0,0.0,0.0,0.0,1.0,0.0,0.0,0.0,0.0,0.0,0.0,0.0,1.0,0.0,0.0,0.0,0.0,0.0,0.0,0.0,0.0,0.0,0.0,0.0,0.0,0.0,0.0,0.0,0.0,0.0,0.0,,,,,,,00-0024245,J.Addai,6.0,,,,,,,,,,,,,,,,,,,,,,,,,,,,,,,,,,,,,,,,,,,TEN,,00-0019648,,K.Bulluck,,,,,,,,,,,,,,0.0,,,,,,,,,,,,,,,,,,,,,,,,,,,,,,,,0.0,,,,,0,,,0.0,0.0,0.0,0.0,,,2009,,,53,1,First down,3413,"12/6/09, 13:02:54",2009-12-06T20:36:33Z,Lucas Oil Stadium,"Partly cloudy Temp: 34° F, Humidity: 56%, Wind: S 8 mph",10012009-1206-0462-8c1a-26657100576c,0,0,RUSH,0,,,,17,Field goal,2009-12-06T20:36:33Z,15.0,7:23,4.0,1.0,1.0,4.0,4.0,0.0,DOWNS,FIELD_GOAL,10:37,03:14,IND 14,TEN 17,3413.0,3780.0,17,27,Home,10,44,6.0,47.0,1,closed,fieldturf,,,Jim Caldwell,Jeff Fisher,IND00,Lucas Oil Stadium,0,1.0,,,J.Addai,29.0,,,0,1,0.0,0,1,,00-0024245,,J.Addai,29.0,00-0024245,J.Addai,00-0024245,J.Addai,00-0024245,1,1,0.365520126186311,,,,,,0.23580165207386,-23.580165207386,2009-12-06,M.Griffin,2009,REG,TEN,13,00-0025406,S,Michael Griffin,Michael,Griffin,Shoulder,,Questionable,Shoulder,,Full Participation in Practice,,
3393,2009_03_MIA_SD,2009092713,LAC,MIA,REG,3,MIA,away,LAC,MIA,59.0,2009-09-27,250.0,250.0,250.0,Half2,0,17.0,0,4,3.0,0,04:10,MIA 41,4,76.0,(4:10) (Shotgun) 7-C.Henne pass incomplete deep left to 19-T.Ginn. MIA-72-V.Carey was injured during the play.,pass,0.0,1,0,1.0,0,0,0,deep,left,34.0,,,,,,,,2,3,0.0,,,,,3.0,2.0,23,6,6.0,23.0,-17.0,6.0,23.0,-17.0,0.389283150434494,0.09340550750494,0.0008848443976603,0.134427040815353,0.155087530612946,0.0032981522381305,0.223613739013672,0.0,0.0,0.814179572393186,-1.25790567428339,17.2333820127037,-17.2333820127037,0.85463323351654,-0.85463323351654,16.3965721297242,-16.3965721297242,3.05846336676041,-4.3163690410438,0.0,0.0,14.6619114581263,-14.6619114581263,1.87221906453487,-1.87221906453487,14.9903929483844,-14.9903929483844,6.6029857013306,-6.6029857013306,0.0021429832559078,0.997857016744092,0.997857016744092,0.0021429832559078,6.54864124953747e-05,-0.0003674334147945,0.0003674334147945,0.997791530331597,0.0022084696684032,0.0014446588465943,0.998555341153406,0.0540941132847186,-0.0540941132847186,0.35983389665916,-0.35983389665916,0.0,6.54864124953747e-05,0.0,0.0,0.431080773938447,-0.431080773938447,0.22312564169988,-0.22312564169988,0.431080773938447,-0.431080773938447,0.0913030952548929,-0.0913030952548929,0.0,0.0,0.0,0.0,0.0,1.0,0.0,0.0,1.0,0,0.0,0.0,0.0,0.0,0.0,0.0,0.0,0.0,0.0,0.0,0.0,0.0,0.0,0.0,0.0,0.0,0.0,0.0,0.0,0.0,0.0,0.0,0.0,1.0,0.0,0.0,0.0,0.0,0.0,0.0,0.0,0.0,0.0,0.0,0.0,0.0,0.0,0.0,0.0,0.0,0.0,00-0026197,C.Henne,,00-0025396,T.Ginn,,,,,,,,,,,,,,,,,,,,,,,,,,,,,,,,,,,,,,,,,,,,,,,,,,,,,,,,,,,,,,,,,0.0,,,,,,,,,,,,,,,,,,,,,,,,,,,,,,,,0.0,,,,,0,,,0.0,0.0,0.0,0.0,,,2009,0.304763555526733,-30.4763555526733,48,1,First down,3393,"9/27/09, 16:15:37",2009-09-27T22:51:32Z,Qualcomm Stadium,"Sunny Temp: 80° F, Humidity: 58%, Wind: WSW 11 mph",10012009-0927-13a6-353d-534205eadffd,0,0,PASS,0,,,,17,Touchdown,2009-09-27T22:47:07Z,10.0,2:54,4.0,1.0,1.0,4.0,4.0,-5.0,KICKOFF,TOUCHDOWN,05:45,02:51,MIA 24,LAC 14,3232.0,3544.0,13,23,Home,10,36,5.5,45.0,0,outdoors,grass,80.0,11.0,Norv Turner,Tony Sparano,SDG00,Qualcomm Stadium,0,0.0,C.Henne,7.0,,,T.Ginn,19.0,1,0,0.0,0,1,00-0026197,,00-0025396,C.Henne,7.0,00-0026197,T.Ginn,00-0025396,T.Ginn,00-0025396,0,1,-1.25790567428339,0.903708590005475,8.9793689167127,5.0,1.0,1.0,0.958576261997223,4.14237380027771,2009-09-27,V.Carey,2009,REG,MIA,3,00-0022890,T,Vernon Carey,Vernon,Carey,Knee,,Probable,Knee,,Limited Participation in Practice,,
3382,2009_02_HOU_TEN,2009092007,TEN,HOU,REG,2,TEN,home,HOU,TEN,57.0,2009-09-20,4.0,904.0,904.0,Half2,0,20.0,0,3,4.0,0,00:04,TEN 43,1,9.0,"(:04) (Punt formation) 15-C.Hentrich punts 48 yards to HOU 9, Center-58-K.Amato. 12-J.Jones MUFFS catch, declared dead at HOU 9. TEN-15-C.Hentrich was injured during the play. His return is Questionable. PENALTY on TEN-30-J.McCourty, Interference with Opportunity to Catch, 15 yards, enforced at HOU 9.",punt,0.0,0,0,0.0,0,0,0,,,,,,,,48.0,,,3,1,0.0,,,,,3.0,1.0,31,31,31.0,31.0,0.0,31.0,31.0,0.0,0.061524610966444,0.179552957415581,0.0024881463032215,0.245609894394875,0.167993992567062,0.0068509872071445,0.335979402065277,0.0,0.0,0.606635340955108,-0.878350406419486,-4.10333567752969,4.10333567752969,23.010991985735,-23.010991985735,-24.9617431944521,24.9617431944521,,,0.0,0.0,-16.5364315163461,16.5364315163461,-6.2802823788612,6.2802823788612,-14.9565772644128,14.9565772644128,-8.79822500569804,8.79822500569804,0.521239578723908,0.478760421276093,0.521239578723908,0.478760421276093,0.0186638236045837,-0.0163573026657105,-0.0163573026657105,0.539903402328491,0.460096597671509,0.612090885639191,0.612090885639191,0.635675185059206,-0.635675185059206,-0.72041296626064,0.72041296626064,,,0.0,0.0,-0.42289608502042,0.42289608502042,-0.14211276055655,0.14211276055655,-0.42289608502042,0.42289608502042,-0.161294250501008,0.161294250501008,0.0,0.0,0.0,0.0,0.0,0.0,0.0,0.0,0.0,0,0.0,1.0,0.0,0.0,0.0,0.0,0.0,0.0,0.0,0.0,0.0,0.0,1.0,0.0,0.0,0.0,1.0,0.0,0.0,0.0,0.0,0.0,0.0,0.0,0.0,0.0,0.0,0.0,0.0,0.0,0.0,0.0,0.0,1.0,1.0,0.0,0.0,0.0,0.0,0.0,0.0,,,,,,,,,,,,,,,,,,,,,,00-0025460,J.Jones,,,,,,,00-0007308,C.Hentrich,,,,,,,,,,,,,,,,,,,,,,,,,,,,,,,,,,,,,,,0.0,,,,,,,,,,,HOU,00-0025460,J.Jones,,,,,,,,,,,,,,,,,,HOU,0.0,TEN,00-0027136,J.McCourty,15.0,0,,Interference with Opportunity to Catch,0.0,0.0,0.0,0.0,,,2009,,,44,0,Punt,3382,"9/20/09, 13:03:12",2009-09-20T19:42:32Z,Nissan Stadium,"Cloudy Temp: 77° F, Humidity: 83%, Wind: S 13 mph",10012009-0920-07a9-7fa3-d461a71f4626,0,0,PUNT,1,,,,20,Punt,2009-09-20T19:38:55Z,3.0,1:15,0.0,0.0,0.0,3.0,3.0,0.0,KICKOFF,PUNT,01:15,00:00,TEN 34,TEN 43,3268.0,3382.0,34,31,Home,-3,65,7.0,40.5,1,outdoors,grass,77.0,13.0,Jeff Fisher,Gary Kubiak,NAS00,LP Field,0,0.0,,,,,,,0,0,0.0,1,0,,,,,,,,,,,0,0,-0.878350406419486,,,,,,,,2009-09-20,C.Hentrich,2009,REG,TEN,2,00-0007308,P,Craig Hentrich,Craig,Hentrich,Back,,Probable,Back,,Full Participation in Practice,,
3373,2009_13_DEN_KC,2009120606,KC,DEN,REG,13,KC,home,DEN,KC,63.0,2009-12-06,64.0,964.0,964.0,Half2,0,23.0,0,3,4.0,0,01:04,KC 37,13,15.0,"(1:04) 2-D.Colquitt punts 55 yards to DEN 8, Center-43-T.Gafford. 19-E.Royal to DEN 4 for -4 yards (46-T.Castille). DEN-19-E.Royal was injured during the play. Penalty on DEN-33-A.Smith, Defensive Offside, declined.",punt,0.0,0,0,0.0,0,0,0,,,,,,,,55.0,,,2,2,0.0,,,,,2.0,2.0,6,34,6.0,34.0,-28.0,6.0,34.0,-28.0,0.0617543309926987,0.224064141511917,0.002027835464105,0.314351350069046,0.150865748524666,0.0073845344595611,0.239552021026611,0.0,0.0,-0.732477084267885,1.60290242498741,-32.9458117393251,32.9458117393251,-16.6568148850347,16.6568148850347,-16.9233397920003,16.9233397920003,,,0.0,0.0,5.4484189680079,-5.4484189680079,-8.90962324175052,8.90962324175052,7.66663460445125,-7.66663460445125,-26.3586793499386,26.3586793499386,0.0006996368174441,0.999300363182556,0.0006996368174441,0.999300363182556,-5.51317934878171e-05,5.16145664732903e-05,5.16145664732903e-05,0.0006445050239562,0.999355494976044,0.0001295239489991,0.0001295239489991,-0.218719839386726,0.218719839386726,-0.368169906447429,0.368169906447429,,,0.0,0.0,0.0264264239231125,-0.0264264239231125,-0.23968948559209,0.23968948559209,0.584743168787099,-0.584743168787099,-1.01799323818718,1.01799323818718,0.0,0.0,0.0,0.0,0.0,0.0,0.0,0.0,0.0,0,0.0,1.0,0.0,0.0,0.0,0.0,0.0,0.0,0.0,0.0,0.0,0.0,0.0,0.0,1.0,0.0,0.0,0.0,0.0,0.0,0.0,0.0,0.0,0.0,0.0,0.0,0.0,0.0,0.0,0.0,0.0,0.0,0.0,1.0,0.0,0.0,0.0,0.0,0.0,0.0,0.0,,,,,,,,,,,,,,,,,,,,,,00-0026182,E.Royal,,,,,,,00-0023534,D.Colquitt,,,,,,,,,,,,,,,,,,,,,KC,,00-0025672,,T.Castille,,,,,,,,,,,,,,0.0,,,,,,,,,,,,,,,,,,,,,,,,,,,,,,,DEN,-4.0,,,,,0,,,0.0,0.0,0.0,0.0,,,2009,,,48,0,Punt,3373,"12/6/09, 13:02:43",2009-12-06T20:23:41Z,GEHA Field at Arrowhead Stadium,"Overcast Temp: 37° F, Humidity: 45%, Wind: SE 6 mph",10012009-1206-064a-34f1-f7fcf8a199dd,0,0,PUNT,1,,,,23,Punt,2009-12-06T20:19:23Z,5.0,1:50,1.0,0.0,0.0,3.0,3.0,0.0,KICKOFF,PUNT,02:41,00:51,KC 22,KC 37,3226.0,3373.0,44,13,Home,-31,57,-6.0,39.0,1,outdoors,grass,37.0,6.0,Todd Haley,Josh McDaniels,KAN00,Arrowhead Stadium,0,1.0,,,,,,,0,0,0.0,1,0,,,,,,,,,,,0,0,1.60290242498741,,,,,,,,2009-12-06,E.Royal,2009,REG,DEN,13,00-0026182,WR,Eddie Royal,Eddie,Royal,Thigh,,Probable,Thigh,,Full Participation in Practice,,
3363,2009_14_CAR_NE,2009121308,NE,CAR,REG,14,NE,home,CAR,CAR,36.0,2009-12-13,518.0,518.0,518.0,Half2,0,20.0,0,4,2.0,0,08:38,CAR 36,1,46.0,"(8:38) 39-L.Maroney right tackle to CAR 34 for 2 yards (50-J.Anderson, 30-C.Godfrey). NE-77-N.Kaczur was injured during the play. PENALTY on CAR-98-N.Hayden, Illegal Use of Hands, 5 yards, enforced at CAR 34.",run,2.0,0,0,0.0,0,0,0,,,,,right,tackle,,,,,2,3,0.0,,,,,2.0,3.0,14,10,14.0,10.0,4.0,14.0,10.0,4.0,0.0871158614754677,0.0481423512101173,0.0008031428442336,0.0750187784433365,0.327506929636002,0.0047423904761672,0.456670552492142,0.0,0.0,3.51753464888316,0.270749518414959,6.31924822181895,-6.31924822181895,-2.29029931404511,2.29029931404511,1.31983067874282,-1.31983067874282,,,0.0,0.0,-1.03820474224631,1.03820474224631,2.61880007843138,-2.61880007843138,-9.40410761453677,9.40410761453677,10.7239382932796,-10.7239382932796,0.845086216926575,0.154913783073425,0.845086216926575,0.154913783073425,-0.0163345336914063,0.0033344626426696,0.0033344626426696,0.828751683235169,0.171248316764832,0.919896423816681,0.919896423816681,-0.0840485226684148,0.0840485226684148,0.102857372498208,-0.102857372498208,,,0.0,0.0,0.282430699801141,-0.282430699801141,-0.202312380075455,0.202312380075455,0.282430699801141,-0.282430699801141,-0.179573327302933,0.179573327302933,0.0,1.0,0.0,1.0,0.0,0.0,0.0,0.0,0.0,0,0.0,0.0,0.0,0.0,0.0,0.0,0.0,0.0,0.0,0.0,0.0,0.0,0.0,0.0,0.0,0.0,1.0,0.0,0.0,0.0,0.0,0.0,1.0,0.0,0.0,0.0,0.0,0.0,0.0,0.0,0.0,0.0,0.0,0.0,0.0,0.0,1.0,0.0,0.0,0.0,0.0,,,,,,,00-0024236,L.Maroney,2.0,,,,,,,,,,,,,,,,,,,,,,,,,,,,,,,,,,,,,,,,,,,,,,,,,00-0026207,C.Godfrey,CAR,,,,,,,,,,1.0,00-0024303,J.Anderson,CAR,,,,,,,,,,,,,,,,,,,,,,,,,,,,,0.0,CAR,00-0026321,N.Hayden,5.0,0,,Illegal Use of Hands,0.0,0.0,0.0,0.0,,,2009,,,52,1,First down,3363,"12/13/09, 13:03:01",2009-12-13T20:35:05Z,Gillette Stadium,"Cloudy Temp: 40° F, Humidity: 59%, Wind: South 4 mph",10012009-1213-08ec-5ef5-c11fee204f3d,0,0,RUSH,0,,,,20,Field goal,2009-12-13T20:30:52Z,10.0,4:54,4.0,0.0,1.0,4.0,4.0,5.0,KICKOFF,FIELD_GOAL,12:14,07:20,NE 24,CAR 30,3226.0,3483.0,10,20,Home,10,30,12.5,43.5,0,outdoors,fieldturf,40.0,4.0,Bill Belichick,John Fox,BOS00,Gillette Stadium,0,1.0,,,L.Maroney,39.0,,,0,1,1.0,0,1,,00-0024236,,L.Maroney,39.0,00-0024236,L.Maroney,00-0024236,L.Maroney,00-0024236,0,0,0.270749518414959,,,,,,0.131959304213524,-13.1959304213524,2009-12-13,N.Kaczur,2009,REG,NE,14,00-0023535,T,Nick Kaczur,Nick,Kaczur,Ankle,,Questionable,Ankle,,Limited Participation in Practice,,
3359,2009_05_NYJ_MIA,2009101200,MIA,NYJ,REG,5,NYJ,away,MIA,NYJ,80.0,2009-10-12,609.0,609.0,609.0,Half2,0,16.0,0,4,1.0,0,10:09,NYJ 20,10,6.0,(10:09) 29-L.Washington right tackle to NYJ 26 for 6 yards (28-G.Wilson). NYJ-87-D.Clowney was injured during the play.,run,6.0,0,0,0.0,0,0,0,,,,,right,tackle,,,,,2,3,0.0,,,,,3.0,2.0,24,20,20.0,24.0,-4.0,20.0,24.0,-4.0,0.168353512883186,0.155859410762787,0.0049791103228926,0.213664695620537,0.172467723488808,0.0013618051307275,0.283313721418381,0.0,0.0,0.53013350837864,0.243653278099373,1.64515142632149,-1.64515142632149,-1.99445060477269,1.99445060477269,8.21594000579104,-8.21594000579104,,,0.0,0.0,-7.05700205071945,7.05700205071945,10.2126401059016,-10.2126401059016,-14.1082330217806,14.1082330217806,21.6439831041884,-21.6439831041884,0.292784631252289,0.707215368747711,0.707215368747711,0.292784631252289,-0.0078144967555999,0.0080483257770538,-0.0080483257770538,0.715029865503311,0.284970134496689,0.355803370475769,0.644196629524231,0.0900561014034684,-0.0900561014034684,0.190671561380426,-0.190671561380426,,,0.0,0.0,-0.334737310627287,0.334737310627287,0.312607355951652,-0.312607355951652,-0.332601199367827,0.332601199367827,0.492723741173134,-0.492723741173134,0.0,0.0,0.0,0.0,0.0,0.0,0.0,0.0,0.0,0,0.0,0.0,0.0,0.0,0.0,0.0,0.0,0.0,0.0,0.0,0.0,0.0,0.0,0.0,1.0,0.0,0.0,0.0,0.0,0.0,0.0,0.0,1.0,0.0,0.0,0.0,0.0,0.0,0.0,0.0,0.0,0.0,0.0,0.0,0.0,0.0,0.0,0.0,0.0,0.0,0.0,,,,,,,00-0024332,L.Washington,6.0,,,,,,,,,,,,,,,,,,,,,,,,,,,,,,,,,,,,,,,,,,,MIA,,00-0022815,,G.Wilson,,,,,,,,,,,,,,0.0,,,,,,,,,,,,,,,,,,,,,,,,,,,,,,,,0.0,,,,,0,,,0.0,0.0,0.0,0.0,,,2009,,,46,0,Punt,3359,"10/12/09, 20:38:34",2009-10-13T03:09:40Z,Hard Rock Stadium,"Clear Temp: 83° F, Humidity: 69%, Wind: East 7 mph",10012009-1012-0057-2718-22f5fb90a3d2,0,0,RUSH,0,,,,16,Punt,2009-10-13T03:08:54Z,3.0,1:24,0.0,0.0,0.0,4.0,4.0,0.0,KICKOFF,PUNT,10:10,08:46,NYJ 20,NYJ 26,3341.0,3430.0,27,31,Home,4,58,-3.0,36.0,1,outdoors,grass,83.0,7.0,Tony Sparano,Rex Ryan,MIA00,Dolphin Stadium,0,1.0,,,L.Washington,29.0,,,0,1,0.0,0,1,,00-0024332,,L.Washington,29.0,00-0024332,L.Washington,00-0024332,L.Washington,00-0024332,0,1,0.243653278099373,,,,,,0.591422140598297,-59.1422140598297,2009-10-12,D.Clowney,2009,REG,NYJ,5,00-0025544,WR,David Clowney,David,Clowney,,,,Not Injury Related,,Limited Participation in Practice,,
3356,2009_01_DET_NO,2009091307,NO,DET,REG,1,NO,home,DET,DET,30.0,2009-09-13,89.0,989.0,989.0,Half2,0,24.0,0,3,,0,01:29,DET 30,0,78.0,4-J.Hanson kicks 67 yards from DET 30 to NO 3. 17-R.Meachem pushed ob at NO 22 for 19 yards (32-A.Henry). DET-16-Y.Figurs was injured during the play. His return is Probable.,kickoff,0.0,0,0,0.0,0,0,0,,,,,,,,67.0,,,3,2,0.0,,,,,3.0,2.0,38,27,38.0,27.0,11.0,38.0,27.0,11.0,0.0315609350800514,0.1668661236763,0.0031861872412264,0.217281848192215,0.200601175427437,0.0035093880724161,0.37699431180954,0.0,0.0,1.21983880223706,0.0342635787092149,8.59892978075079,-8.59892978075079,-8.8448543349232,8.8448543349232,28.0302671197446,-28.0302671197446,,,0.0,0.0,15.6582997516962,-15.6582997516962,-0.444967188115697,0.444967188115697,17.6975045655854,-17.6975045655854,9.32088410701765,-9.32088410701765,0.930943310260773,0.0690566897392273,0.930943310260773,0.0690566897392273,0.0,5.18560409545898e-05,5.18560409545898e-05,0.930943310260773,0.0690566897392273,0.982265472412109,0.982265472412109,0.032428626556315,-0.032428626556315,0.481142591935975,-0.481142591935975,,,0.0,0.0,0.129118600864324,-0.129118600864324,0.22353504995353,-0.22353504995353,0.145860599357995,-0.145860599357995,0.314918572329948,-0.314918572329948,0.0,0.0,0.0,0.0,0.0,0.0,0.0,0.0,0.0,0,0.0,0.0,0.0,0.0,0.0,0.0,0.0,0.0,0.0,0.0,0.0,0.0,0.0,0.0,1.0,0.0,0.0,0.0,0.0,0.0,0.0,0.0,0.0,0.0,0.0,0.0,0.0,0.0,0.0,0.0,0.0,0.0,1.0,0.0,0.0,0.0,0.0,0.0,0.0,0.0,0.0,,,,,,,,,,,,,,,,,,,,,,,,,,R.Meachem,00-0025414,,,,,J.Hanson,00-0006800,,,,,,,,,,,,,,,,,,,DET,,00-0020329,,A.Henry,,,,,,,,,,,,,,0.0,,,,,,,,,,,,,,,,,,,,,,,,,,,,,,,NO,19.0,,,,,0,,,0.0,0.0,0.0,0.0,,,2009,,,47,1,First down,3356,"9/13/09, 13:03:33",2009-09-13T19:52:23Z,Caesars Superdome,"Rain Temp: 81° F, Humidity: 73%, Wind: SE 11 mph",10012009-0913-0711-bc1f-3f3d798ebf91,0,0,KICK_OFF,1,,,,24,Touchdown,2009-09-13T19:52:23Z,13.0,8:00,6.0,1.0,1.0,3.0,4.0,-5.0,KICKOFF,TOUCHDOWN,01:29,08:29,NO 22,DET 13,3356.0,3738.0,27,45,Home,18,72,14.0,50.0,0,dome,fieldturf,,,Sean Payton,Jim Schwartz,NOR00,Louisiana Superdome,0,1.0,,,,,,,0,0,0.0,1,0,,,,,,,,,,,1,1,0.0342635787092149,,,,,,,,2009-09-13,Y.Figurs,2009,REG,DET,1,00-0025461,WR,Yamon Figurs,Yamon,Figurs,Finger,,Questionable,Finger,,Limited Participation in Practice,,
3334,2009_12_TB_ATL,2009112900,ATL,TB,REG,12,ATL,home,TB,TB,34.0,2009-11-29,441.0,441.0,441.0,Half2,0,21.0,0,4,4.0,0,07:21,TB 34,4,15.0,(7:21) (Shotgun) 8-C.Redman pass short middle to 88-T.Gonzalez to TB 25 for 9 yards (36-T.Jackson). TB-27-T.Cox was injured during the play. He is Out.,pass,9.0,1,0,1.0,0,0,0,short,middle,7.0,2.0,,,,,,,2,3,0.0,,,,,2.0,3.0,13,17,13.0,17.0,-4.0,13.0,17.0,-4.0,0.127502858638763,0.087034747004509,0.0008729482651688,0.151557326316834,0.459113657474518,0.0034489722456783,0.170469462871552,0.0,0.0,1.25377373525407,2.91896825522417,-1.32636243307789,1.32636243307789,-5.8267790102982,5.8267790102982,-0.193263368273301,0.193263368273301,2.82423320109956,0.0947350541246124,2.82423320109956,0.0947350541246124,2.43305244954536,-2.43305244954536,0.0611046636776802,-0.0611046636776802,4.29622239625314,-4.29622239625314,1.66510499417286,-1.66510499417286,0.343562841415405,0.656437158584595,0.343562841415405,0.656437158584595,0.186909019947052,0.157836973667145,0.157836973667145,0.530471861362457,0.469528138637543,0.479096949100494,0.479096949100494,-0.244902014732361,0.244902014732361,0.0993111518200063,-0.0993111518200063,0.0,0.186909019947052,0.0,0.186909019947052,0.0487493276596069,-0.0487493276596069,0.115120851713004,-0.115120851713004,0.0373207330703735,-0.0373207330703735,0.226233312207045,-0.226233312207045,0.0,0.0,1.0,0.0,0.0,0.0,1.0,0.0,0.0,0,0.0,0.0,0.0,0.0,0.0,0.0,0.0,0.0,0.0,0.0,0.0,0.0,0.0,0.0,1.0,0.0,0.0,0.0,0.0,0.0,0.0,0.0,0.0,1.0,0.0,0.0,0.0,0.0,0.0,0.0,0.0,0.0,0.0,0.0,0.0,1.0,0.0,0.0,0.0,0.0,0.0,00-0019709,C.Redman,9.0,00-0006101,T.Gonzalez,9.0,,,,,,,,,,,,,,,,,,,,,,,,,,,,,,,,,,,,,,,,,,,,,,TB,,00-0025493,,T.Jackson,,,,,,,,,,,,,,0.0,,,,,,,,,,,,,,,,,,,,,,,,,,,,,,,,0.0,,,,,0,,,0.0,0.0,0.0,0.0,,,2009,0.692328035831451,30.7671964168549,43,1,First down,3334,"11/29/09, 13:03:20",2009-11-29T20:48:55Z,Georgia Dome,"Temp: 61° F, Wind: mph",10012009-1129-00ff-346e-d62bb7c10d01,0,0,PASS,0,,,,21,Missed field goal,2009-11-29T20:46:49Z,8.0,1:48,1.0,0.0,0.0,4.0,4.0,0.0,PUNT,MISSED_FG,08:26,06:38,TB 40,TB 25,3251.0,3427.0,17,20,Home,3,37,12.0,46.0,1,dome,fieldturf,,,Mike Smith,Raheem Morris,ATL00,Georgia Dome,0,1.0,C.Redman,8.0,,,T.Gonzalez,88.0,1,0,1.0,0,1,00-0019709,,00-0006101,C.Redman,8.0,00-0019709,T.Gonzalez,00-0006101,T.Gonzalez,00-0006101,0,1,2.91896825522417,0.310108063435675,4.24813413550146,2.0,0.99872345715994,0.99872345715994,0.953287661075592,4.6712338924408,2009-11-29,T.Cox,2009,REG,TB,12,00-0022029,CB,Torrie Cox,Torrie,Cox,Knee,,Probable,Knee,,Full Participation in Practice,,
3333,2009_06_CHI_ATL,2009101812,ATL,CHI,REG,6,CHI,away,ATL,ATL,2.0,2009-10-18,382.0,382.0,382.0,Half2,0,19.0,0,4,2.0,1,06:22,ATL 2,2,92.0,(6:22) 6-J.Cutler pass incomplete short left to 82-G.Olsen (29-B.Williams). ATL-29-B.Williams was injured during the play. He is Out.,pass,0.0,0,0,1.0,0,0,0,short,left,2.0,,,,,,,,2,2,0.0,,,,,2.0,2.0,14,7,7.0,14.0,-7.0,7.0,14.0,-7.0,0.0404580943286419,0.0118774948641658,0.0003826230531558,0.0163024608045816,0.162587389349937,0.00191868445836,0.766473233699799,0.0,0.0,5.70639721653424,-0.855317374691367,0.832215292661577,-0.832215292661577,3.54604625643697,-3.54604625643697,-3.14853008353384,3.14853008353384,1.29360278346576,-2.14892015815713,0.0,0.0,-11.0298112392193,11.0298112392193,6.84077983925818,-6.84077983925818,-9.5178137847688,9.5178137847688,5.32894960854901,-5.32894960854901,0.392363160848618,0.607636839151382,0.607636839151382,0.392363160848618,-0.0347318053245544,-0.0393904745578766,0.0393904745578766,0.642368644475937,0.357631355524063,0.347957044839859,0.652042955160141,0.0984726995229721,-0.0984726995229721,-0.0865556291824048,0.0865556291824048,0.0,-0.0347318053245544,0.0,0.0,-0.144637308841271,0.144637308841271,-0.0945217528772593,0.0945217528772593,-0.146809719329399,0.146809719329399,0.0314322045612097,-0.0314322045612097,0.0,0.0,0.0,0.0,0.0,0.0,0.0,0.0,1.0,0,0.0,0.0,0.0,0.0,0.0,0.0,0.0,0.0,0.0,0.0,0.0,0.0,0.0,0.0,0.0,0.0,0.0,0.0,0.0,0.0,0.0,0.0,0.0,1.0,0.0,0.0,0.0,0.0,0.0,0.0,0.0,0.0,0.0,0.0,0.0,0.0,0.0,0.0,0.0,0.0,0.0,00-0024226,J.Cutler,,00-0025418,G.Olsen,,,,,,,,,,,,,,,,,,,,,,,,,,,,,,,,,,,,,,,,,,,,,,,,,,,,,,,,,,,,,,,,,0.0,,,,,,,00-0021229,B.Williams,,,,,,,,,,,,,,,,,,,,,,,,0.0,,,,,0,,,0.0,0.0,0.0,0.0,,,2009,0.513724803924561,-51.3724803924561,45,1,Touchdown,3333,"10/18/09, 21:08:20",2009-10-19T02:57:50Z,Georgia Dome,"Indoors Temp: 72° F, Wind: mph",10012009-1018-1232-780a-14b0dfb5b9d1,0,0,PASS,0,,,,19,Touchdown,2009-10-19T02:49:09Z,8.0,3:34,4.0,1.0,1.0,4.0,4.0,13.0,INTERCEPTION,TOUCHDOWN,09:48,06:14,CHI 8,ATL 2,3114.0,3378.0,14,21,Home,7,35,4.0,46.0,0,dome,fieldturf,,,Mike Smith,Lovie Smith,ATL00,Georgia Dome,0,0.0,J.Cutler,6.0,,,G.Olsen,82.0,1,0,0.0,0,1,00-0024226,,00-0025418,J.Cutler,6.0,00-0024226,G.Olsen,00-0025418,G.Olsen,00-0025418,0,1,-0.855317374691367,,,,,,0.480872333049774,51.9127666950226,2009-10-18,B.Williams,2009,REG,ATL,6,00-0021229,CB,Brian Williams,Brian,Williams,Eye,,Questionable,Eye,,Did Not Participate In Practice,,
3292,2009_10_DET_MIN,2009111502,MIN,DET,REG,10,MIN,home,DET,MIN,62.0,2009-11-15,132.0,1032.0,1032.0,Half2,0,19.0,0,3,3.0,0,02:12,MIN 38,2,20.0,(2:12) 4-B.Favre pass incomplete short right to 18-S.Rice. DET-60-J.Cohen was injured during the play. His return is Probable.,pass,0.0,0,0,1.0,0,0,0,short,right,0.0,,,,,,,,3,1,0.0,,,,,3.0,1.0,17,10,17.0,10.0,7.0,17.0,10.0,7.0,0.0293105058372021,0.128440007567406,0.0018554697744548,0.198164507746696,0.216748982667923,0.0049292403273284,0.420551300048828,0.0,0.0,1.82778201252222,-1.7988781244494,6.20417705119181,-6.20417705119181,0.868439002815277,-0.868439002815277,5.94516602938171,-5.94516602938171,-1.78887459542602,-0.0100035290233791,0.0,0.0,9.17753492743941,-9.17753492743941,-4.44533396023684,4.44533396023684,8.53961780376267,-8.53961780376267,-2.59218903538198,2.59218903538198,0.836355984210968,0.163644015789032,0.836355984210968,0.163644015789032,-0.042755663394928,-0.0112228393554688,-0.0112228393554688,0.79360032081604,0.20639967918396,0.957333505153656,0.957333505153656,0.13870005536746,-0.13870005536746,0.159689840732881,-0.159689840732881,0.0092538595199585,-0.0520095229148865,0.0,0.0,-0.0778284966945648,0.0778284966945648,0.234491181432077,-0.234491181432077,-0.0631811320781708,0.0631811320781708,0.227402266918489,-0.227402266918489,0.0,0.0,0.0,0.0,0.0,1.0,0.0,0.0,1.0,0,0.0,0.0,0.0,0.0,0.0,0.0,0.0,0.0,0.0,0.0,0.0,0.0,0.0,0.0,0.0,0.0,0.0,0.0,0.0,0.0,0.0,0.0,0.0,1.0,0.0,0.0,0.0,0.0,0.0,0.0,0.0,0.0,0.0,0.0,0.0,0.0,0.0,0.0,0.0,0.0,0.0,00-0005106,B.Favre,,00-0025431,S.Rice,,,,,,,,,,,,,,,,,,,,,,,,,,,,,,,,,,,,,,,,,,,,,,,,,,,,,,,,,,,,,,,,,0.0,,,,,,,,,,,,,,,,,,,,,,,,,,,,,,,,0.0,,,,,0,,,0.0,0.0,0.0,0.0,,,2009,0.624821245670319,-62.4821245670319,43,0,Punt,3292,"11/15/09, 13:02:59",,Mall of America Field,"Temp: 67° F, Wind: mph",10012009-1115-0237-e39c-55e03134eca4,0,0,PASS,0,,,,19,Punt,,5.0,2:48,1.0,0.0,0.0,3.0,3.0,0.0,PUNT,PUNT,04:46,01:58,MIN 18,MIN 38,3191.0,3318.0,10,27,Home,17,37,17.0,47.5,1,dome,fieldturf,,,Brad Childress,Jim Schwartz,MIN00,Hubert H. Humphrey Metrodome,0,0.0,B.Favre,4.0,,,S.Rice,18.0,1,0,0.0,0,1,00-0005106,,00-0025431,B.Favre,4.0,00-0005106,S.Rice,00-0025431,S.Rice,00-0025431,0,1,-1.7988781244494,2.3155951581524,7.01901169395569,5.0,0.789312394917943,0.789312394917943,0.743231296539307,25.6768703460693,2009-11-15,J.Cohen,2009,REG,DET,10,00-0025522,DT,Joe Cohen,Joe,Cohen,Ankle,,Probable,Ankle,,Full Participation in Practice,,
3225,2009_12_GB_DET,2009112600,DET,GB,REG,12,DET,home,GB,GB,6.0,2009-11-26,642.0,642.0,642.0,Half2,0,19.0,0,4,1.0,1,10:42,GB 6,6,74.0,"(10:42) (Shotgun) 34-K.Smith up the middle to GB 1 for 5 yards (38-T.Williams, 56-N.Barnett). DET-34-K.Smith was injured during the play. His return is Probable.",run,5.0,1,0,0.0,0,0,0,,,,,middle,,,,,,2,3,0.0,,,,,2.0,3.0,7,27,7.0,27.0,-20.0,7.0,27.0,-20.0,0.0168427005410194,0.011945934034884,0.0004824699717573,0.0162005443125963,0.232238814234734,0.0024172633420676,0.719872295856476,0.0,0.0,5.59045048814733,0.480150533898268,-19.2326316915394,19.2326316915394,-1.61348903243197,1.61348903243197,-30.9520336791396,30.9520336791396,,,0.0,0.0,-3.57742935954593,3.57742935954593,-14.9621668674538,14.9621668674538,-7.96587668679422,7.96587668679422,-25.4975687018235,25.4975687018235,0.0192448031157255,0.980755196884274,0.0192448031157255,0.980755196884274,-0.0005411859601736,-0.0003450377844274,-0.0003450377844274,0.0187036171555519,0.981296382844448,0.0073436815291643,0.0073436815291643,-0.100983839482069,0.100983839482069,-0.768836844978393,0.768836844978393,,,0.0,0.0,-0.122567388758072,0.122567388758072,-0.437372757790141,0.437372757790141,-0.121497962221511,0.121497962221511,-0.729210600925141,0.729210600925141,0.0,0.0,0.0,0.0,0.0,0.0,0.0,0.0,0.0,0,0.0,0.0,0.0,0.0,0.0,0.0,0.0,0.0,0.0,0.0,0.0,0.0,0.0,0.0,0.0,0.0,0.0,0.0,0.0,0.0,0.0,0.0,1.0,0.0,0.0,0.0,0.0,0.0,0.0,0.0,0.0,0.0,0.0,0.0,0.0,0.0,1.0,0.0,0.0,0.0,0.0,,,,,,,00-0026204,K.Smith,5.0,,,,,,,,,,,,,,,,,,,,,,,,,,,,,,,,,,,,,,,,,,,,,,,,,00-0021990,N.Barnett,GB,,,,,,,,,,1.0,00-0024061,T.Williams,GB,,,,,,,,,,,,,,,,,,,,,,,,,,,,,0.0,,,,,0,,,0.0,0.0,0.0,0.0,,,2009,,,46,0,Turnover on downs,3225,"11/26/09, 12:35:33",2009-11-26T20:10:01Z,Ford Field,"Controlled Climate Temp: 68° F, Humidity: 70%, Wind: mph",10012009-1126-00bf-c88d-b69eaf7a5366,0,0,RUSH,0,,,,19,Turnover on downs,2009-11-26T20:08:06Z,7.0,2:20,2.0,1.0,0.0,4.0,4.0,0.0,PUNT,DOWNS,12:25,10:05,DET 25,GB 1,3156.0,3294.0,34,12,Home,-22,46,-11.0,48.0,1,dome,fieldturf,,,Jim Schwartz,Mike McCarthy,DET00,Ford Field,0,1.0,,,K.Smith,34.0,,,0,1,0.0,0,1,,00-0026204,,K.Smith,34.0,00-0026204,K.Smith,00-0026204,K.Smith,00-0026204,0,0,0.480150533898268,,,,,,0.730142772197723,-73.0142772197723,2009-11-26,K.Smith,2009,REG,DET,12,00-0026204,RB,Kevin Smith,Kevin,Smith,Hip,,Probable,Hip,,Limited Participation in Practice,,
3220,2009_02_CAR_ATL,2009092000,ATL,CAR,REG,2,CAR,away,ATL,ATL,23.0,2009-09-20,564.0,564.0,564.0,Half2,0,15.0,0,4,1.0,0,09:24,ATL 23,10,80.0,"(9:24) 17-J.Delhomme pass short right to 89-S.Smith to ATL 13 for 10 yards (29-B.Williams). ATL-94-P.Jerry was injured during the play. He is Out. PENALTY on CAR-89-S.Smith, Offensive Pass Interference, 10 yards, enforced at ATL 23 - No Play.",no_play,0.0,0,0,0.0,0,0,0,,,,,,,,,,,3,3,0.0,,,,,3.0,3.0,28,13,13.0,28.0,-15.0,13.0,28.0,-15.0,0.0349766798317432,0.0274113863706589,0.000836334307678,0.0431620143353939,0.387269914150238,0.0010492327855899,0.505294442176819,0.0,0.0,4.31492837518454,-1.15756782796234,9.82659786774023,-9.82659786774023,-0.0545197182800621,0.0545197182800621,6.53733251909398,-6.53733251909398,,,0.0,0.0,7.34128048358252,-7.34128048358252,-3.30456747254357,3.30456747254357,-2.64774475077866,2.64774475077866,7.34433421383983,-7.34433421383983,0.0560604892671108,0.943939510732889,0.943939510732889,0.0560604892671108,-0.0105943195521832,-0.0140974968671799,0.0140974968671799,0.954533830285072,0.0454661697149277,0.0370169505476952,0.962983049452305,0.0543555734723354,-0.0543555734723354,0.340393968703372,-0.340393968703372,,,0.0,0.0,0.195061969594678,-0.195061969594678,0.0170354897235854,-0.0170354897235854,0.393135639862736,-0.393135639862736,-0.0921515470291154,0.0921515470291154,0.0,0.0,0.0,0.0,0.0,0.0,0.0,0.0,0.0,0,0.0,0.0,0.0,0.0,0.0,0.0,0.0,0.0,0.0,0.0,0.0,0.0,0.0,0.0,0.0,0.0,1.0,0.0,0.0,0.0,0.0,0.0,0.0,0.0,0.0,0.0,0.0,0.0,0.0,0.0,0.0,0.0,0.0,0.0,0.0,0.0,0.0,0.0,0.0,0.0,0.0,,,,,,,,,,,,,,,,,,,,,,,,,,,,,,,,,,,,,,,,,,,,,,,,,,,,,,,,,,,,,,,,,,,,,,0.0,,,,,,,,,,,,,,,,,,,,,,,,,,,,,,,,0.0,CAR,00-0020337,S.Smith,10.0,0,,Offensive Pass Interference,0.0,0.0,0.0,0.0,,,2009,,,49,1,First down,3220,"9/20/09, 13:02:56",2009-09-20T19:37:45Z,Georgia Dome,"Temp: ° F, Wind: mph",10012009-0920-0030-3633-fdd22db9166b,0,0,PENALTY,0,,,,15,Touchdown,2009-09-20T19:31:37Z,10.0,5:38,4.0,1.0,1.0,4.0,4.0,-5.0,KICKOFF,TOUCHDOWN,12:23,06:45,CAR 20,ATL 11,3084.0,3431.0,20,28,Home,8,48,5.5,43.5,1,dome,fieldturf,,,Mike Smith,John Fox,ATL00,Georgia Dome,0,0.0,J.Delhomme,17.0,,,S.Smith,89.0,1,0,0.0,0,1,00-0004161,,00-0020337,J.Delhomme,17.0,00-0004161,,,S.Smith,00-0020337,0,0,-1.15756782796234,,,,,,0.698224425315857,30.1775574684143,2009-09-20,P.Jerry,2009,REG,ATL,2,00-0027000,DT,Peria Jerry,Peria,Jerry,Chest,,Probable,Chest,,Full Participation in Practice,,
3212,2009_16_OAK_CLE,2009122702,CLE,LV,REG,16,LV,away,CLE,CLE,47.0,2009-12-27,852.0,852.0,852.0,Half2,0,19.0,0,4,1.0,0,14:12,CLE 47,10,56.0,(14:12) 20-D.McFadden left tackle to CLE 39 for 8 yards (95-K.Wimbley). CLE-90-K.Coleman was injured during the play. His return is Questionable.,run,8.0,0,0,0.0,0,0,0,,,,,left,tackle,,,,,3,3,0.0,,,,,3.0,3.0,20,9,9.0,20.0,-11.0,9.0,20.0,-11.0,0.0557888187468052,0.0951258316636086,0.0012748017907142,0.146837383508682,0.30092516541481,0.0033823351841419,0.396665632724762,0.0,0.0,2.37041081255302,0.483387196902186,6.42148648127613,-6.42148648127613,-5.83258066450095,5.83258066450095,8.49233880220802,-8.49233880220802,,,0.0,0.0,3.77504269240308,-3.77504269240308,-4.2712837050352,4.2712837050352,2.5994561232219,-2.5994561232219,5.71284156767975,-5.71284156767975,0.152050316333771,0.847949683666229,0.847949683666229,0.152050316333771,0.0029773712158203,0.0070700496435165,-0.0070700496435165,0.844972312450409,0.155027687549591,0.133263498544693,0.866736501455307,0.0566045555671537,-0.0566045555671537,0.230445928060995,-0.230445928060995,,,0.0,0.0,0.0504900581478938,-0.0504900581478938,-0.0574006363749504,0.0574006363749504,0.0504900581478938,-0.0504900581478938,0.140747278928757,-0.140747278928757,0.0,0.0,0.0,0.0,0.0,0.0,0.0,0.0,0.0,0,0.0,0.0,0.0,0.0,0.0,0.0,0.0,0.0,0.0,0.0,0.0,0.0,0.0,0.0,1.0,0.0,0.0,0.0,0.0,0.0,0.0,0.0,1.0,0.0,0.0,0.0,0.0,0.0,0.0,0.0,0.0,0.0,0.0,0.0,0.0,0.0,0.0,0.0,0.0,0.0,0.0,,,,,,,00-0026144,D.McFadden,8.0,,,,,,,,,,,,,,,,,,,,,,,,,,,,,,,,,,,,,,,,,,,CLE,,00-0024228,,K.Wimbley,,,,,,,,,,,,,,0.0,,,,,,,,,,,,,,,,,,,,,,,,,,,,,,,,0.0,,,,,0,,,0.0,0.0,0.0,0.0,,,2009,,,43,1,First down,3212,"12/27/09, 13:02:00",2009-12-27T20:33:02Z,Cleveland Browns Stadium,"Cloudy Temp: 34° F, Humidity: 84%, Wind: sw 6-12 mph",10012009-1227-02e9-cdf1-9f2ec57e462d,0,0,RUSH,0,,,,19,Turnover,2009-12-27T20:32:20Z,7.0,3:22,3.0,0.0,0.0,4.0,4.0,0.0,PUNT,INTERCEPTION,14:53,11:31,LV 20,CLE 24,3188.0,3333.0,9,23,Home,14,32,3.0,37.0,0,outdoors,grass,34.0,6.0,Eric Mangini,Tom Cable,CLE00,Cleveland Browns Stadium,0,1.0,,,D.McFadden,20.0,,,0,1,0.0,0,1,,00-0026144,,D.McFadden,20.0,00-0026144,D.McFadden,00-0026144,D.McFadden,00-0026144,0,0,0.483387196902186,,,,,,0.614050447940826,-61.4050447940826,2009-12-27,K.Coleman,2009,REG,CLE,16,00-0021262,DE,Kenyon Coleman,Kenyon,Coleman,Illness,Knee,Probable,Illness,Knee,Limited Participation in Practice,,
3207,2009_09_SD_NYG,2009110809,NYG,LAC,REG,9,LAC,away,NYG,NYG,43.0,2009-11-08,423.0,423.0,423.0,Half2,0,17.0,0,4,3.0,0,07:03,NYG 43,5,6.0,"(7:03) (Shotgun) 83-V.Jackson left end to NYG 47 for -4 yards (91-J.Tuck, 94-M.Kiwanuka). NYG-52-M.Boley was injured during the play. Double reverse involving #43 D.Sproles.",run,-4.0,1,0,0.0,0,0,0,,,,,left,end,,,,,3,3,0.0,,,,,3.0,3.0,17,14,14.0,17.0,-3.0,14.0,17.0,-3.0,0.18502177298069,0.0873981416225433,0.0010325234616175,0.141755059361458,0.247311621904373,0.0039293984882533,0.333551496267319,0.0,0.0,1.82810924923979,-1.99617907358333,1.90096008498222,-1.90096008498222,0.801468834339175,-0.801468834339175,10.3683399948757,-10.3683399948757,,,0.0,0.0,5.0646541917813,-5.0646541917813,1.39874368405435,-1.39874368405435,-13.2834808024345,13.2834808024345,22.8555140456417,-22.8555140456417,0.392818540334702,0.607181459665299,0.607181459665299,0.392818540334702,-0.0950426459312439,-0.0831750333309174,0.0831750333309174,0.702224105596542,0.297775894403458,0.359695553779602,0.640304446220398,0.0273242890834808,-0.0273242890834808,0.269183901308682,-0.269183901308682,,,0.0,0.0,-0.0186795442818547,0.0186795442818547,0.216835362027686,-0.216835362027686,0.502265110659704,-0.502265110659704,-0.280657547403771,0.280657547403771,0.0,0.0,0.0,0.0,0.0,1.0,0.0,0.0,0.0,0,0.0,0.0,0.0,0.0,0.0,0.0,0.0,0.0,0.0,0.0,0.0,0.0,0.0,0.0,0.0,0.0,0.0,1.0,0.0,0.0,0.0,0.0,1.0,0.0,0.0,0.0,0.0,0.0,0.0,0.0,0.0,0.0,0.0,0.0,0.0,0.0,1.0,0.0,0.0,0.0,0.0,,,,,,,00-0023496,V.Jackson,-4.0,,,,,,,,,,,,,,,,,,,,,,,,,,,,,00-0023509,J.Tuck,,,,,,,,,,,,,,,,,,,00-0024247,M.Kiwanuka,NYG,,,,,,,,,,1.0,00-0023509,J.Tuck,NYG,,,,,,,,,,,,,,,,,,,,,,,,,,,,,0.0,,,,,0,,,0.0,0.0,0.0,0.0,,,2009,,,43,0,Punt,3207,"11/8/09, 16:15:49",2009-11-08T23:45:40Z,Giants Stadium,"Sunny Temp: 71° F, Humidity: 39%, Wind: SW 2 mph",10012009-1108-09c5-d9d9-176594a80bd1,0,0,RUSH,0,,,,17,Punt,2009-11-08T23:43:08Z,4.0,2:41,1.0,0.0,0.0,4.0,4.0,-10.0,KICKOFF,PUNT,08:58,06:17,LAC 37,LAC 43,3122.0,3266.0,21,20,Home,-1,41,5.0,48.5,0,outdoors,fieldturf,71.0,2.0,Tom Coughlin,Norv Turner,NYC00,Giants Stadium,0,0.0,,,V.Jackson,83.0,,,0,1,0.0,0,1,,00-0023496,,V.Jackson,83.0,00-0023496,V.Jackson,00-0023496,V.Jackson,00-0023496,0,1,-1.99617907358333,,,,,,0.948577642440796,-94.8577642440796,2009-11-08,M.Boley,2009,REG,NYG,9,00-0023593,LB,Michael Boley,Michael,Boley,Knee,,Questionable,Knee,,Limited Participation in Practice,,
3193,2009_16_MIN_CHI,2009122800,CHI,MIN,REG,16,MIN,away,CHI,CHI,40.0,2009-12-28,808.0,808.0,808.0,Half2,0,18.0,0,4,2.0,0,13:28,CHI 40,20,30.0,"(13:28) 4-B.Favre pass short right to 81-V.Shiancoe to CHI 22 for 18 yards (33-C.Tillman, 20-C.Steltz). CHI-33-C.Tillman was injured during the play.",pass,18.0,0,0,1.0,0,0,0,short,right,15.0,3.0,,,,,,,3,3,0.0,,,,,3.0,3.0,23,13,13.0,23.0,-10.0,13.0,23.0,-10.0,0.0623956248164177,0.103753350675106,0.0015259167412295,0.154756799340248,0.362237840890884,0.0048752282746136,0.310455292463303,0.0,0.0,1.87204154557548,1.80368691752665,4.84918793989345,-4.84918793989345,0.829639797513714,-0.829639797513714,-2.41760795987854,2.41760795987854,1.30320251337253,0.500484404154122,1.30320251337253,0.500484404154122,-4.14710027037654,4.14710027037654,0.972251199185848,-0.972251199185848,-0.550805140810553,0.550805140810553,-6.325650940644,6.325650940644,0.1584412753582,0.8415587246418,0.8415587246418,0.1584412753582,0.0905314981937408,0.0879030227661133,-0.0879030227661133,0.751027226448059,0.248972773551941,0.286321699619293,0.713678300380707,0.113486170768738,-0.113486170768738,-0.0872212384032707,0.0872212384032707,0.0,0.0905314981937408,0.0,0.0905314981937408,0.0144221339238186,-0.0144221339238186,-0.0470243729650974,0.0470243729650974,0.0144221339238186,-0.0144221339238186,-0.238469142466784,0.238469142466784,0.0,0.0,0.0,0.0,0.0,0.0,0.0,0.0,0.0,0,0.0,0.0,0.0,0.0,0.0,0.0,0.0,0.0,0.0,0.0,0.0,0.0,0.0,0.0,0.0,0.0,0.0,0.0,0.0,0.0,0.0,0.0,0.0,1.0,0.0,0.0,0.0,0.0,0.0,0.0,0.0,0.0,0.0,0.0,0.0,1.0,1.0,0.0,0.0,0.0,0.0,00-0005106,B.Favre,18.0,00-0022054,V.Shiancoe,18.0,,,,,,,,,,,,,,,,,,,,,,,,,,,,,,,,,,,,,,,,,,,,,,,,,,,,00-0026260,C.Steltz,CHI,,,,,,,,,,1.0,00-0022123,C.Tillman,CHI,,,,,,,,,,,,,,,,,,,,,,,,,,,,,0.0,,,,,0,,,0.0,0.0,0.0,0.0,,,2009,0.531587779521942,46.8412220478058,45,0,Field goal,3193,"12/28/09, 20:40:42",2009-12-29T03:58:35Z,Soldier Field,"Partly Cloudy Temp: 26° F, Humidity: 54%, Wind: WNW 9 mph",10012009-1228-005c-fbe4-a46c808f489a,0,0,PASS,0,,,,18,Field goal,2009-12-29T03:53:05Z,7.0,2:53,2.0,0.0,1.0,3.0,4.0,-10.0,INTERCEPTION,FIELD_GOAL,00:03,12:10,MIN 47,CHI 23,3078.0,3271.0,30,36,Home,6,66,-9.0,41.0,1,outdoors,grass,26.0,9.0,Lovie Smith,Brad Childress,CHI98,Soldier Field,0,1.0,B.Favre,4.0,,,V.Shiancoe,81.0,1,0,0.0,0,1,00-0005106,,00-0022054,B.Favre,4.0,00-0005106,V.Shiancoe,00-0022054,V.Shiancoe,00-0022054,0,1,1.80368691752665,0.466538457040783,2.87336605196469,1.0,1.0,0.201898772415007,0.877813220024109,12.2186779975891,2009-12-28,C.Tillman,2009,REG,CHI,16,00-0022123,CB,Charles Tillman,Charles,Tillman,,,,Not Injury Related,,Did Not Participate In Practice,,
3180,2009_16_KC_CIN,2009122701,CIN,KC,REG,16,CIN,home,KC,CIN,71.0,2009-12-27,849.0,849.0,849.0,Half2,0,19.0,0,4,2.0,0,14:09,CIN 29,7,19.0,(14:09) 9-C.Palmer pass short left to 85-C.Ochocinco to CIN 44 for 15 yards (91-T.Hali). KC-24-B.Flowers was injured during the play.,pass,15.0,0,0,1.0,0,0,0,short,left,7.0,8.0,,,,,,,3,3,0.0,,,,,3.0,3.0,10,10,10.0,10.0,0.0,10.0,10.0,0.0,0.0683870315551758,0.150159284472466,0.0024890433996915,0.224525168538094,0.212327480316162,0.003202024847269,0.338909953832626,0.0,0.0,0.988624047487974,1.30053946468979,1.43546506777057,-1.43546506777057,5.8356318246806,-5.8356318246806,-2.91857760531129,2.91857760531129,0.840894487919286,0.459644976770505,0.840894487919286,0.459644976770505,-7.79796259728028,7.79796259728028,2.21339484368218,-2.21339484368218,-18.2456766077667,18.2456766077667,14.9068664093735,-14.9068664093735,0.552681922912598,0.447318077087402,0.552681922912598,0.447318077087402,0.0502748489379883,0.0410126447677612,0.0410126447677612,0.602956771850586,0.397043228149414,0.707540810108185,0.707540810108185,0.112415596842766,-0.112415596842766,-0.066423701420542,0.066423701420542,0.0,0.0502748489379883,0.0,0.0502748489379883,-0.193860336061588,0.193860336061588,-0.0183962168880758,0.0183962168880758,-0.192494972463718,0.192494972463718,0.0885816780141535,-0.0885816780141535,0.0,0.0,1.0,0.0,0.0,0.0,0.0,0.0,0.0,0,0.0,0.0,0.0,0.0,0.0,0.0,0.0,0.0,0.0,0.0,0.0,0.0,0.0,0.0,1.0,0.0,0.0,0.0,0.0,0.0,0.0,0.0,0.0,1.0,0.0,0.0,0.0,0.0,0.0,0.0,0.0,0.0,0.0,0.0,0.0,1.0,0.0,0.0,0.0,0.0,0.0,00-0021429,C.Palmer,15.0,00-0020397,C.Ochocinco,15.0,,,,,,,,,,,,,,,,,,,,,,,,,,,,,,,,,,,,,,,,,,,,,,KC,,00-0024235,,T.Hali,,,,,,,,,,,,,,0.0,,,,,,,,,,,,,,,,,,,,,,,,,,,,,,,,0.0,,,,,0,,,0.0,0.0,0.0,0.0,,,2009,0.629489362239838,37.0510637760162,39,1,First down,3180,"12/27/09, 13:03:53",2009-12-27T20:24:55Z,Paycor Stadium,"Partly Cloudy Temp: 41° F, Humidity: 50%, Wind: SSW 14 mph",10012009-1227-01e4-cbb0-f5bfbc201ed7,0,0,PASS,0,,,,19,Punt,2009-12-27T20:21:42Z,5.0,2:50,1.0,0.0,0.0,4.0,4.0,0.0,KICKOFF,PUNT,14:52,12:02,CIN 26,CIN 45,3137.0,3276.0,10,17,Home,7,27,13.0,39.5,0,outdoors,fieldturf,41.0,14.0,Marvin Lewis,Todd Haley,CIN00,Paul Brown Stadium,0,1.0,C.Palmer,9.0,,,C.Ochocinco,85.0,1,0,1.0,0,1,00-0021429,,00-0020397,C.Palmer,9.0,00-0021429,C.Ochocinco,00-0020397,C.Ochocinco,00-0020397,0,0,1.30053946468979,0.183273331313853,3.85782583143009,2.0,0.997903754992876,0.972696377022658,0.673827409744263,32.6172590255737,2009-12-27,B.Flowers,2009,REG,KC,16,00-0026175,CB,Brandon Flowers,Brandon,Flowers,Shoulder,,Probable,Shoulder,,Full Participation in Practice,,
3161,2009_14_CAR_NE,2009121308,NE,CAR,REG,14,CAR,away,NE,NE,19.0,2009-12-13,777.0,777.0,777.0,Half2,0,19.0,0,4,2.0,0,12:57,NE 19,9,57.0,(12:57) 34-D.Williams up the middle to NE 18 for 1 yard (94-T.Warren). NE-94-T.Warren was injured during the play.,run,1.0,0,0,0.0,0,0,0,,,,,middle,,,,,,2,3,0.0,,,,,3.0,2.0,14,7,7.0,14.0,-7.0,7.0,14.0,-7.0,0.0201364476233721,0.0272655580192804,0.0006226440309546,0.0570638105273247,0.472236543893814,0.0008822190575301,0.421792805194855,0.0,0.0,3.88853507034946,-0.485247292206623,2.80306129611995,-2.80306129611995,-2.67676004240639,2.67676004240639,-2.16519356618113,2.16519356618113,,,0.0,0.0,-2.01071054697968,2.01071054697968,1.02949835083564,-1.02949835083564,-11.2388256005361,11.2388256005361,9.07363203435494,-9.07363203435494,0.283440411090851,0.716559588909149,0.716559588909149,0.283440411090851,-0.0252332389354706,-0.011666014790535,0.011666014790535,0.74179282784462,0.25820717215538,0.131222948431969,0.868777051568031,-0.0731318127685124,0.0731318127685124,-0.0403335478547273,0.0403335478547273,,,0.0,0.0,0.282430699801141,-0.282430699801141,-0.2878158390522,0.2878158390522,0.282430699801141,-0.282430699801141,-0.322764247655869,0.322764247655869,0.0,0.0,0.0,0.0,0.0,0.0,0.0,0.0,0.0,0,0.0,0.0,0.0,0.0,0.0,0.0,0.0,0.0,0.0,0.0,0.0,0.0,0.0,0.0,1.0,0.0,0.0,0.0,0.0,0.0,0.0,0.0,1.0,0.0,0.0,0.0,0.0,0.0,0.0,0.0,0.0,0.0,0.0,0.0,0.0,0.0,0.0,0.0,0.0,0.0,0.0,,,,,,,00-0024242,D.Williams,1.0,,,,,,,,,,,,,,,,,,,,,,,,,,,,,,,,,,,,,,,,,,,NE,,00-0021989,,T.Warren,,,,,,,,,,,,,,0.0,,,,,,,,,,,,,,,,,,,,,,,,,,,,,,,,0.0,,,,,0,,,0.0,0.0,0.0,0.0,,,2009,,,49,0,Field goal,3161,"12/13/09, 13:03:01",2009-12-13T20:24:50Z,Gillette Stadium,"Cloudy Temp: 40° F, Humidity: 59%, Wind: South 4 mph",10012009-1213-08ec-5ef5-c11fee204f3d,0,0,RUSH,0,,,,19,Field goal,2009-12-13T20:16:09Z,9.0,3:52,3.0,1.0,1.0,3.0,4.0,0.0,KICKOFF,FIELD_GOAL,01:06,12:14,CAR 25,NE 18,2988.0,3207.0,10,20,Home,10,30,12.5,43.5,0,outdoors,fieldturf,40.0,4.0,Bill Belichick,John Fox,BOS00,Gillette Stadium,0,0.0,,,D.Williams,34.0,,,0,1,0.0,0,1,,00-0024242,,D.Williams,34.0,00-0024242,D.Williams,00-0024242,D.Williams,00-0024242,0,0,-0.485247292206623,,,,,,0.728939235210419,-72.8939235210419,2009-12-13,T.Warren,2009,REG,NE,14,00-0021989,DE,Ty Warren,Ty,Warren,Ankle,,Questionable,Ankle,,Limited Participation in Practice,,
3099,2009_08_SEA_DAL,2009110103,DAL,SEA,REG,8,SEA,away,DAL,SEA,76.0,2009-11-01,118.0,1018.0,1018.0,Half2,0,15.0,0,3,3.0,0,01:58,SEA 24,6,9.0,(1:58) (Shotgun) 8-M.Hasselbeck pass short middle to 83-D.Branch to SEA 29 for 5 yards (56-B.James) [97-J.Hatcher]. SEA-8-M.Hasselbeck was injured during the play. His return is Probable.,pass,5.0,1,0,1.0,0,0,0,short,middle,5.0,0.0,,,,,,,3,3,0.0,,,,,3.0,3.0,28,10,10.0,28.0,-18.0,10.0,28.0,-18.0,0.0263632517307997,0.191956162452698,0.0043325861915946,0.331132292747498,0.185071989893913,0.0028541642241179,0.25828954577446,0.0,0.0,-0.533508590422571,-0.506104610394687,17.8890424252424,-17.8890424252424,5.44454330025474,-5.44454330025474,8.37778119662941,-8.37778119662941,-0.506104610394687,0.0,-0.506104610394687,0.0,-2.31611082423478,2.31611082423478,10.8801689382526,-10.8801689382526,6.61226519430056,-6.61226519430056,1.09946825543117,-1.09946825543117,0.0255224201828241,0.974477579817176,0.974477579817176,0.0255224201828241,-0.005559217184782,-0.0040512131527066,0.0040512131527066,0.980036797001958,0.0199632029980421,0.0112784085795283,0.988721591420472,0.225581383509844,-0.225581383509844,0.0669818512097381,-0.0669818512097381,-0.005559217184782,0.0,-0.005559217184782,0.0,-0.0646675370905747,0.0646675370905747,0.178971788214577,-0.178971788214577,-0.0646675370905747,0.0646675370905747,0.10879449390067,-0.10879449390067,0.0,0.0,0.0,0.0,0.0,1.0,0.0,0.0,0.0,0,0.0,0.0,0.0,0.0,0.0,0.0,0.0,0.0,0.0,0.0,0.0,0.0,0.0,0.0,1.0,0.0,0.0,0.0,0.0,0.0,0.0,1.0,0.0,1.0,0.0,0.0,0.0,0.0,0.0,0.0,0.0,0.0,0.0,0.0,0.0,1.0,0.0,0.0,0.0,0.0,0.0,00-0007091,M.Hasselbeck,5.0,00-0021192,D.Branch,5.0,,,,,,,,,,,,,,,,,,,,,,,,,,,,,,,,,,,,00-0024307,J.Hatcher,,,,,,,,,DAL,,00-0022137,,B.James,,,,,,,,,,,,,,0.0,,,,,,,,,,,,,,,,,,,,,,,,,,,,,,,,0.0,,,,,0,,,0.0,0.0,0.0,0.0,,,2009,0.449951082468033,55.0048917531967,43,0,Opp touchdown,3099,"11/1/09, 13:03:34",2009-11-01T20:19:10Z,AT&T Stadium,"Temp: ° F, Wind: mph",10012009-1101-032d-fd4a-d75078882aea,0,0,PASS,0,,,,15,Opp touchdown,2009-11-01T20:17:24Z,3.0,1:28,0.0,0.0,1.0,3.0,3.0,0.0,KICKOFF,PUNT,02:39,01:11,SEA 20,SEA 29,3030.0,3127.0,17,38,Home,21,55,10.0,46.0,0,closed,fieldturf,,,Wade Phillips,Jim Mora,DAL00,Cowboys Stadium,0,0.0,M.Hasselbeck,8.0,,,D.Branch,83.0,1,0,0.0,0,1,00-0007091,,00-0021192,M.Hasselbeck,8.0,00-0007091,D.Branch,00-0021192,D.Branch,00-0021192,0,1,-0.506104610394687,1.74883370859016,4.63718354022421,2.0,0.737389981019078,0.737389981019078,0.978332579135895,2.16674208641052,2009-11-01,M.Hasselbeck,2009,REG,SEA,8,00-0007091,QB,Matt Hasselbeck,Matt,Hasselbeck,Rib,,Probable,Rib,,Full Participation in Practice,,
3074,2009_04_DET_CHI,2009100400,CHI,DET,REG,4,CHI,home,DET,DET,8.0,2009-10-04,262.0,1162.0,1162.0,Half2,0,19.0,0,3,1.0,1,04:22,DET 8,8,15.0,"(4:22) 22-M.Forte right guard to DET 4 for 4 yards (28-M.Morris, 54-D.Levy). DET-50-E.Sims was injured during the play.",run,4.0,0,0,0.0,0,0,0,,,,,right,guard,,,,,3,2,0.0,,,,,3.0,2.0,31,21,31.0,21.0,10.0,31.0,21.0,10.0,0.0036039112601429,0.0144645674154162,0.000418026727857,0.0195400379598141,0.306786894798279,0.0016851041000336,0.653501451015472,0.0,0.0,5.31723102828255,0.106262477464043,13.7859918652146,-13.7859918652146,3.27551749526174,-3.27551749526174,-3.93034729724958,3.93034729724958,,,0.0,0.0,-5.1524103943666,5.1524103943666,-8.09349525242204,8.09349525242204,-8.47148562828079,8.47148562828079,-1.79925310637544,1.79925310637544,0.919971644878387,0.0800283551216126,0.919971644878387,0.0800283551216126,0.0015033483505249,-0.00150728225708,-0.00150728225708,0.921474993228912,0.0785250067710877,0.9702308177948,0.9702308177948,0.0635190973897534,-0.0635190973897534,-0.0837891673619841,0.0837891673619841,,,0.0,0.0,0.021282667857876,-0.021282667857876,-0.344822190701962,0.344822190701962,-0.55256820227457,0.55256820227457,0.331553094089031,-0.331553094089031,0.0,0.0,0.0,0.0,0.0,0.0,0.0,0.0,0.0,0,0.0,0.0,0.0,0.0,0.0,0.0,0.0,0.0,0.0,0.0,0.0,0.0,0.0,0.0,0.0,0.0,0.0,0.0,0.0,0.0,0.0,0.0,1.0,0.0,0.0,0.0,0.0,0.0,0.0,0.0,0.0,0.0,0.0,0.0,0.0,0.0,1.0,0.0,0.0,0.0,0.0,,,,,,,00-0026184,M.Forte,4.0,,,,,,,,,,,,,,,,,,,,,,,,,,,,,,,,,,,,,,,,,,,,,,,,,00-0027050,D.Levy,DET,,,,,,,,,,1.0,00-0021182,M.Morris,DET,,,,,,,,,,,,,,,,,,,,,,,,,,,,,0.0,,,,,0,,,0.0,0.0,0.0,0.0,,,2009,,,38,0,Field goal,3074,"10/4/09, 13:02:34",2009-10-04T19:18:37Z,Soldier Field,"Partly Cloudy, temps to upper 50's. Temp: 53° F, Humidity: 70%, Wind: WSW 14 mph",10012009-1004-00f1-32e7-fa834b48214e,0,0,RUSH,0,,,,19,Field goal,2009-10-04T19:17:19Z,6.0,3:07,1.0,1.0,1.0,3.0,3.0,0.0,FUMBLE,FIELD_GOAL,05:40,02:33,DET 19,DET 4,3029.0,3154.0,24,48,Home,24,72,9.5,43.0,1,outdoors,grass,53.0,14.0,Lovie Smith,Jim Schwartz,CHI98,Soldier Field,0,1.0,,,M.Forte,22.0,,,0,1,0.0,0,1,,00-0026184,,M.Forte,22.0,00-0026184,M.Forte,00-0026184,M.Forte,00-0026184,0,0,0.106262477464043,,,,,,0.34317672252655,-34.317672252655,2009-10-04,E.Sims,2009,REG,DET,4,00-0024224,LB,Ernie Sims,Ernie,Sims,Shoulder,,Questionable,Shoulder,,Limited Participation in Practice,,
3029,2009_06_CLE_PIT,2009101805,PIT,CLE,REG,6,CLE,away,PIT,CLE,68.0,2009-10-18,26.0,926.0,926.0,Half2,0,19.0,0,3,2.0,0,00:26,CLE 32,8,8.0,(:26) 3-D.Anderson pass incomplete short middle to 31-J.Lewis. CLE-84-R.Royal was injured during the play.,pass,0.0,0,0,1.0,0,0,0,short,middle,3.0,,,,,,,,2,3,0.0,,,,,3.0,2.0,24,14,14.0,24.0,-10.0,14.0,24.0,-10.0,0.0594571605324745,0.161350324749947,0.0059645548462867,0.240882858633995,0.221780732274055,0.001670476864092,0.308893859386444,0.0,0.0,0.648780071875081,-0.681411147117615,9.18366946746096,-9.18366946746096,-7.52348499273649,7.52348499273649,27.5206011473242,-27.5206011473242,-0.425978993298486,-0.255432153819129,0.0,0.0,4.18301025760593,-4.18301025760593,17.0772222811647,-17.0772222811647,24.5374480016762,-24.5374480016762,1.07400747773175,-1.07400747773175,0.142148777842522,0.857851222157478,0.857851222157478,0.142148777842522,-0.0106901377439499,-0.0051870308816433,0.0051870308816433,0.868541359901428,0.131458640098572,0.0551926307380199,0.94480736926198,-0.161009559696153,0.161009559696153,0.64985354109464,-0.64985354109464,0.0,-0.0106901377439499,0.0,0.0,-0.05233858660998,0.05233858660998,0.59376135468483,-0.59376135468483,-0.05233858660998,0.05233858660998,0.757370606064796,-0.757370606064796,0.0,0.0,0.0,0.0,0.0,0.0,0.0,0.0,1.0,0,0.0,0.0,0.0,0.0,0.0,0.0,0.0,0.0,0.0,0.0,0.0,0.0,0.0,0.0,0.0,0.0,0.0,0.0,0.0,0.0,0.0,0.0,0.0,1.0,0.0,0.0,0.0,0.0,0.0,0.0,0.0,0.0,0.0,0.0,0.0,0.0,0.0,0.0,0.0,0.0,0.0,00-0023645,D.Anderson,,00-0019693,J.Lewis,,,,,,,,,,,,,,,,,,,,,,,,,,,,,,,,,,,,,,,,,,,,,,,,,,,,,,,,,,,,,,,,,0.0,,,,,,,,,,,,,,,,,,,,,,,,,,,,,,,,0.0,,,,,0,,,0.0,0.0,0.0,0.0,,,2009,0.76190322637558,-76.190322637558,44,0,Turnover,3029,"10/18/09, 13:02:47",2009-10-18T19:24:42Z,Acrisure Stadium,"Cloudy Temp: 41° F, Humidity: 77%, Wind: from NNW 9 mph",10012009-1018-05a6-a86a-d7472ff19b22,0,0,PASS,0,,,,19,Turnover,2009-10-18T19:23:24Z,4.0,1:29,1.0,0.0,0.0,3.0,3.0,0.0,FUMBLE,FUMBLE,01:43,00:14,CLE 16,CLE 32,2980.0,3054.0,14,27,Home,13,41,14.0,37.5,1,outdoors,dessograss,41.0,9.0,Mike Tomlin,Eric Mangini,PIT00,Heinz Field,0,0.0,D.Anderson,3.0,,,J.Lewis,31.0,1,0,0.0,0,1,00-0023645,,00-0019693,D.Anderson,3.0,00-0023645,J.Lewis,00-0019693,J.Lewis,00-0019693,0,1,-0.681411147117615,0.923756593617896,5.04535716616374,3.0,0.588548985251691,0.36539819551399,0.737079501152039,26.2920498847961,2009-10-18,R.Royal,2009,REG,CLE,6,00-0021273,TE,Robert Royal,Robert,Royal,Foot,Finger,Probable,Foot,Finger,Full Participation in Practice,,
3015,2009_05_PIT_DET,2009101103,DET,PIT,REG,5,PIT,away,DET,PIT,67.0,2009-10-11,724.0,724.0,724.0,Half2,0,14.0,0,4,4.0,0,12:04,PIT 33,21,11.0,"(12:04) 9-D.Sepulveda punts 49 yards to DET 18, Center-60-G.Warren. 86-D.Northcutt to DET 27 for 9 yards (54-A.Frazier; 94-L.Timmons). PIT-54-A.Frazier was injured during the play. His return is Probable. PIT-94-L.Timmons was injured during the play. His return is Probable.",punt,0.0,0,0,0.0,0,0,0,,,,,,,,49.0,,,2,3,0.0,,,,,3.0,2.0,13,28,28.0,13.0,15.0,28.0,13.0,15.0,0.0901861637830734,0.217868506908417,0.0068645891733467,0.342606574296951,0.125518798828125,0.0022296914830803,0.214725658297539,0.0,0.0,-1.1814853316173,-0.279719833517447,-16.9513532934682,16.9513532934682,0.6563385251211,-0.6563385251211,-15.8171674583759,15.8171674583759,,,0.0,0.0,0.302051561477128,-0.302051561477128,-11.1117059266564,11.1117059266564,-1.16398008196848,1.16398008196848,-11.095492356941,11.095492356941,0.960131227970123,0.0398687720298767,0.0398687720298767,0.960131227970123,0.0034741163253784,-0.0014867484569549,0.0014867484569549,0.0363946557044983,0.963605344295502,0.98758465051651,0.01241534948349,-0.113091285583459,0.113091285583459,-0.36845659496955,0.36845659496955,,,0.0,0.0,-0.102312114775307,0.102312114775307,-0.281160330902596,0.281160330902596,-0.105864611208565,0.105864611208565,-0.18959199973503,0.18959199973503,0.0,0.0,0.0,0.0,0.0,0.0,0.0,0.0,0.0,0,0.0,0.0,0.0,0.0,0.0,0.0,0.0,0.0,0.0,0.0,0.0,0.0,0.0,0.0,0.0,0.0,0.0,0.0,0.0,0.0,0.0,0.0,0.0,0.0,0.0,0.0,0.0,0.0,0.0,0.0,0.0,0.0,0.0,1.0,0.0,0.0,1.0,0.0,0.0,0.0,0.0,,,,,,,,,,,,,,,,,,,,,,00-0019650,D.Northcutt,,,,,,,00-0025499,D.Sepulveda,,,,,,,,,,,,,,,,,,,,,,,,,,,00-0022997,A.Frazier,PIT,00-0025402,L.Timmons,PIT,,,,,,,0.0,,,,,,,,,,,,,,,,,,,,,,,,,,,,,,,DET,9.0,,,,,0,,,0.0,0.0,0.0,0.0,,,2009,,,42,0,Punt,3015,"10/11/09, 13:02:43",2009-10-11T19:25:18Z,Ford Field,"Controlled Climate Temp: 68° F, Humidity: 70%, Wind: mph",10012009-1011-033b-c83e-8b67ab3f9413,0,0,PUNT,1,,,,14,Punt,2009-10-11T19:18:00Z,6.0,3:46,2.0,0.0,0.0,3.0,4.0,-5.0,INTERCEPTION,PUNT,00:38,11:52,PIT 22,PIT 33,2822.0,3015.0,28,20,Home,-8,48,-11.0,44.0,0,dome,fieldturf,,,Jim Schwartz,Mike Tomlin,DET00,Ford Field,0,0.0,,,,,,,0,0,0.0,1,0,,,,,,,,,,,0,0,-0.279719833517447,,,,,,,,2009-10-11,A.Frazier,2009,REG,PIT,5,00-0022997,LB,Andre Frazier,Andre,Frazier,Shoulder,,Probable,Shoulder,,Full Participation in Practice,,
3005,2009_06_BUF_NYJ,2009101811,NYJ,BUF,REG,6,NYJ,home,BUF,NYJ,75.0,2009-10-18,432.0,1332.0,1332.0,Half2,0,18.0,0,3,2.0,0,07:12,NYJ 25,5,21.0,"(7:12) 20-T.Jones left tackle to NYJ 30 for 5 yards (90-C.Kelsay, 37-G.Wilson). NYJ-67-D.Woody was injured during the play. His return is Questionable.",run,5.0,0,0,0.0,0,0,0,,,,,left,tackle,,,,,2,3,0.0,,,,,2.0,3.0,13,6,13.0,6.0,7.0,13.0,6.0,7.0,0.0196805745363235,0.162126496434212,0.0021289405412972,0.248198077082634,0.222040623426437,0.0072353831492364,0.338589936494827,0.0,0.0,0.822698282077909,0.584376882296056,7.46509564330768,-7.46509564330768,11.7086976698174,-11.7086976698174,-6.29045439442175,6.29045439442175,,,0.0,0.0,-0.708352243658458,0.708352243658458,-0.680042525161899,0.680042525161899,-3.11399042951206,3.11399042951206,-4.1691285954345,4.1691285954345,0.795887351036072,0.204112648963928,0.795887351036072,0.204112648963928,0.0143869519233704,-0.0007277727127075,-0.0007277727127075,0.810274302959442,0.189725697040558,0.911299765110016,0.911299765110016,0.356739128663117,-0.356739128663117,-0.127551019191742,0.127551019191742,,,0.0,0.0,-0.0395243763923645,0.0395243763923645,0.0481371879577637,-0.0481371879577637,-0.0395243763923645,0.0395243763923645,-0.0978986918926239,0.0978986918926239,0.0,1.0,0.0,0.0,0.0,0.0,0.0,0.0,0.0,0,0.0,0.0,0.0,0.0,0.0,0.0,0.0,0.0,0.0,0.0,0.0,0.0,0.0,0.0,0.0,0.0,0.0,0.0,0.0,0.0,0.0,0.0,1.0,0.0,0.0,0.0,0.0,0.0,0.0,0.0,0.0,0.0,0.0,0.0,0.0,0.0,1.0,0.0,0.0,0.0,0.0,,,,,,,00-0019641,T.Jones,5.0,,,,,,,,,,,,,,,,,,,,,,,,,,,,,,,,,,,,,,,,,,,,,,,,,00-0022341,G.Wilson,BUF,,,,,,,,,,1.0,00-0021995,C.Kelsay,BUF,,,,,,,,,,,,,,,,,,,,,,,,,,,,,0.0,,,,,0,,,0.0,0.0,0.0,0.0,,,2009,,,35,1,First down,3005,"10/18/09, 16:15:40",2009-10-18T22:42:01Z,Giants Stadium,"Cloudy Temp: 44° F, Humidity: 37%, Wind: North 18 mph",10012009-1018-114c-80c1-2e7abc97fe41,0,0,RUSH,0,,,,18,Turnover,2009-10-18T22:40:40Z,5.0,2:31,2.0,0.0,0.0,3.0,3.0,0.0,KICKOFF,INTERCEPTION,07:45,05:14,NYJ 20,NYJ 41,2962.0,3078.0,16,13,Home,-3,29,9.5,35.5,1,outdoors,fieldturf,44.0,18.0,Rex Ryan,Dick Jauron,NYC00,Giants Stadium,0,1.0,,,T.Jones,20.0,,,0,1,1.0,0,1,,00-0019641,,T.Jones,20.0,00-0019641,T.Jones,00-0019641,T.Jones,00-0019641,0,1,0.584376882296056,,,,,,0.450755387544632,-45.0755387544632,2009-10-18,D.Woody,2009,REG,NYJ,6,00-0018234,T,Damien Woody,Damien,Woody,Foot,,Questionable,Foot,,Did Not Participate In Practice,,
