play_id,game_id,old_game_id,home_team,away_team,season_type,week_x,posteam,posteam_type,defteam,side_of_field,yardline_100,game_date,quarter_seconds_remaining,half_seconds_remaining,game_seconds_remaining,game_half,quarter_end,drive,sp,qtr,down,goal_to_go,time,yrdln,ydstogo,ydsnet,desc,play_type,yards_gained,shotgun,no_huddle,qb_dropback,qb_kneel,qb_spike,qb_scramble,pass_length,pass_location,air_yards,yards_after_catch,run_location,run_gap,field_goal_result,kick_distance,extra_point_result,two_point_conv_result,home_timeouts_remaining,away_timeouts_remaining,timeout,timeout_team,td_team,td_player_name,td_player_id,posteam_timeouts_remaining,defteam_timeouts_remaining,total_home_score,total_away_score,posteam_score,defteam_score,score_differential,posteam_score_post,defteam_score_post,score_differential_post,no_score_prob,opp_fg_prob,opp_safety_prob,opp_td_prob,fg_prob,safety_prob,td_prob,extra_point_prob,two_point_conversion_prob,ep,epa,total_home_epa,total_away_epa,total_home_rush_epa,total_away_rush_epa,total_home_pass_epa,total_away_pass_epa,air_epa,yac_epa,comp_air_epa,comp_yac_epa,total_home_comp_air_epa,total_away_comp_air_epa,total_home_comp_yac_epa,total_away_comp_yac_epa,total_home_raw_air_epa,total_away_raw_air_epa,total_home_raw_yac_epa,total_away_raw_yac_epa,wp,def_wp,home_wp,away_wp,wpa,vegas_wpa,vegas_home_wpa,home_wp_post,away_wp_post,vegas_wp,vegas_home_wp,total_home_rush_wpa,total_away_rush_wpa,total_home_pass_wpa,total_away_pass_wpa,air_wpa,yac_wpa,comp_air_wpa,comp_yac_wpa,total_home_comp_air_wpa,total_away_comp_air_wpa,total_home_comp_yac_wpa,total_away_comp_yac_wpa,total_home_raw_air_wpa,total_away_raw_air_wpa,total_home_raw_yac_wpa,total_away_raw_yac_wpa,punt_blocked,first_down_rush,first_down_pass,first_down_penalty,third_down_converted,third_down_failed,fourth_down_converted,fourth_down_failed,incomplete_pass,touchback,interception,punt_inside_twenty,punt_in_endzone,punt_out_of_bounds,punt_downed,punt_fair_catch,kickoff_inside_twenty,kickoff_in_endzone,kickoff_out_of_bounds,kickoff_downed,kickoff_fair_catch,fumble_forced,fumble_not_forced,fumble_out_of_bounds,solo_tackle,safety,penalty,tackled_for_loss,fumble_lost,own_kickoff_recovery,own_kickoff_recovery_td,qb_hit,rush_attempt,pass_attempt,sack,touchdown,pass_touchdown,rush_touchdown,return_touchdown,extra_point_attempt,two_point_attempt,field_goal_attempt,kickoff_attempt,punt_attempt,fumble,complete_pass,assist_tackle,lateral_reception,lateral_rush,lateral_return,lateral_recovery,passer_player_id,passer_player_name,passing_yards,receiver_player_id,receiver_player_name,receiving_yards,rusher_player_id,rusher_player_name,rushing_yards,lateral_receiver_player_id,lateral_receiver_player_name,lateral_receiving_yards,lateral_rusher_player_id,lateral_rusher_player_name,lateral_rushing_yards,lateral_sack_player_id,lateral_sack_player_name,interception_player_id,interception_player_name,lateral_interception_player_id,lateral_interception_player_name,punt_returner_player_id,punt_returner_player_name,lateral_punt_returner_player_id,lateral_punt_returner_player_name,kickoff_returner_player_name,kickoff_returner_player_id,lateral_kickoff_returner_player_id,lateral_kickoff_returner_player_name,punter_player_id,punter_player_name,kicker_player_name,kicker_player_id,own_kickoff_recovery_player_id,own_kickoff_recovery_player_name,blocked_player_id,blocked_player_name,tackle_for_loss_1_player_id,tackle_for_loss_1_player_name,tackle_for_loss_2_player_id,tackle_for_loss_2_player_name,qb_hit_1_player_id,qb_hit_1_player_name,qb_hit_2_player_id,qb_hit_2_player_name,forced_fumble_player_1_team,forced_fumble_player_1_player_id,forced_fumble_player_1_player_name,forced_fumble_player_2_team,forced_fumble_player_2_player_id,forced_fumble_player_2_player_name,solo_tackle_1_team,solo_tackle_2_team,solo_tackle_1_player_id,solo_tackle_2_player_id,solo_tackle_1_player_name,solo_tackle_2_player_name,assist_tackle_1_player_id,assist_tackle_1_player_name,assist_tackle_1_team,assist_tackle_2_player_id,assist_tackle_2_player_name,assist_tackle_2_team,assist_tackle_3_player_id,assist_tackle_3_player_name,assist_tackle_3_team,assist_tackle_4_player_id,assist_tackle_4_player_name,assist_tackle_4_team,tackle_with_assist,tackle_with_assist_1_player_id,tackle_with_assist_1_player_name,tackle_with_assist_1_team,tackle_with_assist_2_player_id,tackle_with_assist_2_player_name,tackle_with_assist_2_team,pass_defense_1_player_id,pass_defense_1_player_name,pass_defense_2_player_id,pass_defense_2_player_name,fumbled_1_team,fumbled_1_player_id,fumbled_1_player_name,fumbled_2_player_id,fumbled_2_player_name,fumbled_2_team,fumble_recovery_1_team,fumble_recovery_1_yards,fumble_recovery_1_player_id,fumble_recovery_1_player_name,fumble_recovery_2_team,fumble_recovery_2_yards,fumble_recovery_2_player_id,fumble_recovery_2_player_name,sack_player_id,sack_player_name,half_sack_1_player_id,half_sack_1_player_name,half_sack_2_player_id,half_sack_2_player_name,return_team,return_yards,penalty_team,penalty_player_id,penalty_player_name,penalty_yards,replay_or_challenge,replay_or_challenge_result,penalty_type,defensive_two_point_attempt,defensive_two_point_conv,defensive_extra_point_attempt,defensive_extra_point_conv,safety_player_name,safety_player_id,season_x,cp,cpoe,series,series_success,series_result,order_sequence,start_time,time_of_day,stadium,weather,nfl_api_id,play_clock,play_deleted,play_type_nfl,special_teams_play,st_play_type,end_clock_time,end_yard_line,fixed_drive,fixed_drive_result,drive_real_start_time,drive_play_count,drive_time_of_possession,drive_first_downs,drive_inside20,drive_ended_with_score,drive_quarter_start,drive_quarter_end,drive_yards_penalized,drive_start_transition,drive_end_transition,drive_game_clock_start,drive_game_clock_end,drive_start_yard_line,drive_end_yard_line,drive_play_id_started,drive_play_id_ended,away_score,home_score,location,result,total,spread_line,total_line,div_game,roof,surface,temp,wind,home_coach,away_coach,stadium_id,game_stadium,aborted_play,success,passer,passer_jersey_number,rusher,rusher_jersey_number,receiver,receiver_jersey_number,pass,rush,first_down,special,play,passer_id,rusher_id,receiver_id,name,jersey_number,id,fantasy_player_name,fantasy_player_id,fantasy,fantasy_id,out_of_bounds,home_opening_kickoff,qb_epa,xyac_epa,xyac_mean_yardage,xyac_median_yardage,xyac_success,xyac_fd,xpass,pass_oe,date_x,injured_player,season_y,game_type,team,week_y,gsis_id,position,full_name,first_name,last_name,report_primary_injury,report_secondary_injury,report_status,practice_primary_injury,practice_secondary_injury,practice_status,date_modified,date_y
4335,2013_06_DET_CLE,2013101302,CLE,DET,REG,6,CLE,home,DET,DET,21.0,2013-10-13,17.0,17.0,17.0,Half2,0,24.0,0,4,1.0,0,00:17,DET 21,10,72.0,(:17) (Shotgun) 3-B.Weeden pass incomplete deep right to 18-G.Little. DET-27-G.Quin was injured during the play. His return is Doubtful.,pass,0.0,1,0,1.0,0,0,0,deep,right,21.0,,,,,,,,0,2,0.0,,,,,0.0,2.0,17,31,17.0,31.0,-14.0,17.0,31.0,-14.0,0.354491204023361,0.0016644420102238,0.0002997728879563,0.0056771514937281,0.446839064359665,0.0004900348139926,0.190538331866264,0.0,0.0,2.62993265350815,-0.333798833948094,-15.6884042231336,15.6884042231336,1.22036197158741,-1.22036197158741,-12.3908524967385,12.3908524967385,4.37006734649185,-4.70386618043995,0.0,0.0,-2.42636720612063,2.42636720612063,-9.50737867538747,9.50737867538747,-3.14368915720843,3.14368915720843,-6.35121410562463,6.35121410562463,0.0016053825384005,0.998394617461599,0.0016053825384005,0.998394617461599,-0.0001183715648949,-6.92146713845432e-05,-6.92146713845432e-05,0.0014870109735056,0.998512989026494,0.0005878403899259,0.0005878403899259,-0.0696922360220924,0.0696922360220924,-0.367558231489391,0.367558231489391,-1.49745028465986e-05,-0.0001033970620483,0.0,0.0,-0.0211650077079165,0.0211650077079165,-0.511440586053636,0.511440586053636,-0.0211799822107631,0.0211799822107631,-0.305291591199916,0.305291591199916,0.0,0.0,0.0,0.0,0.0,0.0,0.0,0.0,1.0,0,0.0,0.0,0.0,0.0,0.0,0.0,0.0,0.0,0.0,0.0,0.0,0.0,0.0,0.0,0.0,0.0,0.0,0.0,0.0,0.0,0.0,0.0,0.0,1.0,0.0,0.0,0.0,0.0,0.0,0.0,0.0,0.0,0.0,0.0,0.0,0.0,0.0,0.0,0.0,0.0,0.0,00-0029677,B.Weeden,,00-0027997,G.Little,,,,,,,,,,,,,,,,,,,,,,,,,,,,,,,,,,,,,,,,,,,,,,,,,,,,,,,,,,,,,,,,,0.0,,,,,,,,,,,,,,,,,,,,,,,,,,,,,,,,0.0,,,,,0,,,0.0,0.0,0.0,0.0,,,2013,0.290176391601563,-29.0176391601563,64,1,First down,4335,"10/13/13, 13:02:54",2013-10-13T20:13:48Z,Cleveland Browns Stadium,"Cloudy Temp: 66° F, Humidity: 78%, Wind: West 8 mph mph",10012013-1013-0298-dd50-baed013d21a1,0,0,PASS,0,,,,24,End of half,2013-10-13T20:05:36Z,12.0,2:01,5.0,1.0,0.0,4.0,4.0,0.0,KICKOFF,END_GAME,02:01,00:00,CLE 20,DET 9,4088.0,4420.0,31,17,Home,-14,48,-1.0,44.0,0,outdoors,grass,66.0,8.0,Rob Chudzinski,Jim Schwartz,CLE00,FirstEnergy Stadium,0,0.0,B.Weeden,3.0,,,G.Little,18.0,1,0,0.0,0,1,00-0029677,,00-0027997,B.Weeden,3.0,00-0029677,G.Little,00-0027997,G.Little,00-0027997,0,0,-0.333798833948094,,,,,,0.970348358154297,2.96516418457031,2013-10-13,G.Quin,2013,REG,DET,6,00-0027081,S,Glover Quin,Glover,Quin,Ankle,,Probable,Ankle,,Full Participation in Practice,2013-10-11T13:04:06Z,2013-10-11 13:04:06
4312,2013_11_CLE_CIN,2013111702,CIN,CLE,REG,11,CLE,away,CIN,CIN,14.0,2013-11-17,228.0,228.0,228.0,Half2,0,32.0,0,4,2.0,0,03:48,CIN 14,10,76.0,"(3:48) (Shotgun) 17-J.Campbell pass incomplete short middle to 85-B.Tyms (55-V.Burfict). CIN-55-V.Burfict was injured during the play. PENALTY on CIN-94-D.Peko, Unnecessary Roughness, 7 yards, enforced at CIN 14.",pass,0.0,1,0,1.0,0,0,0,short,middle,6.0,,,,,,,,3,2,0.0,,,,,2.0,3.0,41,20,20.0,41.0,-21.0,20.0,41.0,-21.0,0.112444676458836,0.012845984660089,0.0003185534733347,0.0281579829752445,0.382646322250366,0.0011422280222177,0.462444245815277,0.0,0.0,4.15105220174883,0.972242851101328,14.8954105844734,-14.8954105844734,-5.08935720764754,5.08935720764754,5.47972761043002,-5.47972761043002,-0.0528473597369157,1.02509021083824,0.0,0.0,4.71942670454155,-4.71942670454155,-8.41692006622907,8.41692006622907,12.1175563339493,-12.1175563339493,-14.3632071567618,14.3632071567618,0.0022194182965904,0.99778058170341,0.99778058170341,0.0022194182965904,0.001310758292675,0.0004164803540334,-0.0004164803540334,0.996469823410735,0.0035301765892654,0.0011173535604029,0.998882646439597,-0.138030669069849,0.138030669069849,0.0867046808536518,-0.0867046808536518,0.0,0.001310758292675,0.0,0.0,-0.518332250426209,0.518332250426209,0.657401319818885,-0.657401319818885,-0.51868043677943,0.51868043677943,0.513709897575714,-0.513709897575714,0.0,0.0,0.0,1.0,0.0,0.0,0.0,0.0,1.0,0,0.0,0.0,0.0,0.0,0.0,0.0,0.0,0.0,0.0,0.0,0.0,0.0,0.0,0.0,0.0,0.0,1.0,0.0,0.0,0.0,0.0,0.0,0.0,1.0,0.0,0.0,0.0,0.0,0.0,0.0,0.0,0.0,0.0,0.0,0.0,0.0,0.0,0.0,0.0,0.0,0.0,00-0023460,J.Campbell,,00-0028984,B.Tyms,,,,,,,,,,,,,,,,,,,,,,,,,,,,,,,,,,,,,,,,,,,,,,,,,,,,,,,,,,,,,,,,,0.0,,,,,,,00-0028912,V.Burfict,,,,,,,,,,,,,,,,,,,,,,,,0.0,CIN,00-0024338,D.Peko,7.0,0,,Unnecessary Roughness,0.0,0.0,0.0,0.0,,,2013,0.7344651222229,-73.44651222229,52,1,First down,4312,"11/17/13, 13:02:43",2013-11-17T21:16:58Z,Paycor Stadium,"Cloudy Temp: 62° F, Humidity: 92%, Wind: S 7 mph",10012013-1117-0230-c08f-401759b48826,0,0,PASS,0,,,,32,Turnover on downs,2013-11-17T21:07:50Z,19.0,5:09,6.0,1.0,0.0,4.0,4.0,7.0,KICKOFF,DOWNS,08:04,02:55,CLE 20,CIN 4,3970.0,4433.0,20,41,Home,21,61,4.0,40.0,1,outdoors,fieldturf,62.0,7.0,Marvin Lewis,Rob Chudzinski,CIN00,Paul Brown Stadium,0,1.0,J.Campbell,17.0,,,B.Tyms,85.0,1,0,1.0,0,1,00-0023460,,00-0028984,J.Campbell,17.0,00-0023460,B.Tyms,00-0028984,B.Tyms,00-0028984,0,1,0.972242851101328,1.01688033423196,3.221540423634,3.0,0.8055767644546,0.375843652000185,0.888557851314545,11.1442148685455,2013-11-17,V.Burfict,2013,REG,CIN,11,00-0028912,LB,Vontaze Burfict,Vontaze,Burfict,Knee,,Probable,Knee,,Full Participation in Practice,2013-11-15T10:15:54Z,2013-11-15 10:15:54
4291,2013_06_NO_NE,2013101310,NE,NO,REG,6,NE,home,NO,NE,80.0,2013-10-13,144.0,144.0,144.0,Half2,0,23.0,0,4,1.0,0,02:24,NE 20,10,0.0,(2:24) (Shotgun) 12-T.Brady pass deep right intended for 11-J.Edelman INTERCEPTED by 28-K.Lewis at NO 30. 28-K.Lewis to NO 30 for no gain. NO-97-G.Foster was injured during the play.,pass,0.0,1,0,1.0,0,0,0,deep,right,50.0,,,,,,,,1,0,0.0,,,,,1.0,0.0,23,27,23.0,27.0,-4.0,23.0,27.0,-4.0,0.705032229423523,0.0446152575314045,0.001867561484687,0.0496527440845966,0.073821134865284,0.0019519004272297,0.123059190809727,0.0,0.0,0.601631436962634,-1.65712753357366,-7.83038460529351,7.83038460529351,-6.1025069411977,6.1025069411977,-8.9450220673933,8.9450220673933,1.58783910947386,-3.24496664304752,0.0,0.0,-7.00424235360697,7.00424235360697,-0.578660897341898,0.578660897341898,-16.782541127468,16.782541127468,13.4885825882402,-13.4885825882402,0.283287942409515,0.716712057590485,0.283287942409515,0.716712057590485,-0.136505484580994,-0.185936003923416,-0.185936003923416,0.146782457828522,0.853217542171478,0.349423617124558,0.349423617124558,-0.184695811484262,0.184695811484262,-0.550391035011971,0.550391035011971,0.0,-0.136505484580994,0.0,0.0,-0.236841147711552,0.236841147711552,-0.0446157566317791,0.0446157566317791,-0.969228452017582,0.969228452017582,0.595369208692623,-0.595369208692623,0.0,0.0,0.0,0.0,0.0,0.0,0.0,0.0,0.0,0,1.0,0.0,0.0,0.0,0.0,0.0,0.0,0.0,0.0,0.0,0.0,0.0,0.0,0.0,0.0,0.0,0.0,0.0,0.0,0.0,0.0,0.0,0.0,1.0,0.0,0.0,0.0,0.0,0.0,0.0,0.0,0.0,0.0,0.0,0.0,0.0,0.0,0.0,0.0,0.0,0.0,00-0019596,T.Brady,,00-0027150,J.Edelman,,,,,,,,,,,,,00-0026903,K.Lewis,,,,,,,,,,,,,,,,,,,,,,,,,,,,,,,,,,,,,,,,,,,,,,,,,,,0.0,,,,,,,00-0026903,K.Lewis,,,,,,,,,,,,,,,,,,,,,,,NO,0.0,,,,,0,,,0.0,0.0,0.0,0.0,,,2013,0.284873962402344,-28.4873962402344,60,0,Turnover,4291,"10/13/13, 16:25:31",2013-10-13T23:27:11Z,Gillette Stadium,"Partly Cloudy Temp: 59° F, Humidity: 57%, Wind: ENE 7 mph",10012013-1013-10c2-27fa-d1c1f51d57b8,0,0,INTERCEPTION,0,,,,23,Turnover,2013-10-13T23:26:32Z,1.0,0:08,0.0,0.0,0.0,4.0,4.0,0.0,KICKOFF,INTERCEPTION,02:24,02:16,NE 20,NE 20,4276.0,4291.0,27,30,Home,3,57,2.5,51.5,0,outdoors,fieldturf,59.0,7.0,Bill Belichick,Sean Payton,BOS00,Gillette Stadium,0,0.0,T.Brady,12.0,,,J.Edelman,11.0,1,0,0.0,0,1,00-0019596,,00-0027150,T.Brady,12.0,00-0019596,J.Edelman,00-0027150,J.Edelman,00-0027150,0,1,-1.65712753357366,1.36901672439639,10.5076175365248,5.0,1.0,1.0,0.890128672122955,10.9871327877045,2013-10-13,G.Foster,2013,REG,NO,6,00-0030215,DE,Glenn Foster,Glenn,Foster,Ankle,,Probable,Ankle,,Full Participation in Practice,2013-10-11T12:45:55Z,2013-10-11 12:45:55
4223,2013_01_TB_NYJ,2013090807,NYJ,TB,REG,1,TB,away,NYJ,NYJ,19.0,2013-09-08,50.0,50.0,50.0,Half2,0,25.0,0,4,3.0,0,00:50,NYJ 19,3,61.0,(:50) 22-D.Martin right guard to NYJ 19 for no gain (94-D.Harrison; 56-D.Davis). NYJ-94-D.Harrison was injured during the play.,run,0.0,0,0,0.0,0,0,0,,,,,right,guard,,,,,1,1,0.0,,,,,1.0,1.0,15,14,14.0,15.0,-1.0,14.0,15.0,-1.0,0.24300779402256,0.0079296920448541,0.0003500104066915,0.0078656570985913,0.435086011886597,0.0003974869323428,0.305363327264786,0.0,0.0,3.36404760373989,-0.846546870491904,-3.87454003054292,3.87454003054292,3.32057466242553,-3.32057466242553,-7.96407559680833,7.96407559680833,,,0.0,0.0,-7.74532953163725,7.74532953163725,6.95081502581079,-6.95081502581079,-7.10283217430697,7.10283217430697,7.8999858894878,-7.8999858894878,0.669874310493469,0.330125689506531,0.330125689506531,0.669874310493469,-0.0575611591339111,0.0217883586883545,-0.0217883586883545,0.387686848640442,0.612313151359558,0.750862181186676,0.249137818813324,0.315901449918028,-0.315901449918028,-0.195922937378285,0.195922937378285,,,0.0,0.0,0.247999965055309,-0.247999965055309,-0.367045353142937,0.367045353142937,0.247999965055309,-0.247999965055309,-0.198463405458649,0.198463405458649,0.0,0.0,0.0,0.0,0.0,1.0,0.0,0.0,0.0,0,0.0,0.0,0.0,0.0,0.0,0.0,0.0,0.0,0.0,0.0,0.0,0.0,0.0,0.0,0.0,0.0,0.0,0.0,0.0,0.0,0.0,0.0,1.0,0.0,0.0,0.0,0.0,0.0,0.0,0.0,0.0,0.0,0.0,0.0,0.0,0.0,1.0,0.0,0.0,0.0,0.0,,,,,,,00-0029613,D.Martin,0.0,,,,,,,,,,,,,,,,,,,,,,,,,,,,,,,,,,,,,,,,,,,,,,,,,00-0029040,D.Harrison,NYJ,00-0029607,D.Davis,NYJ,,,,,,,0.0,,,,,,,,,,,,,,,,,,,,,,,,,,,,,,,,0.0,,,,,0,,,0.0,0.0,0.0,0.0,,,2013,,,52,0,Field goal,4223,"9/8/13, 13:03:16",2013-09-08T20:13:15Z,MetLife Stadium,"Temp: 82° F, Humidity: 50%, Wind: WNW 9 mph",10012013-0908-07b9-a60c-9606054e01be,0,0,RUSH,0,,,,25,Field goal,2013-09-08T20:05:23Z,9.0,1:40,2.0,1.0,1.0,4.0,4.0,0.0,PUNT,FIELD_GOAL,02:14,00:34,TB 20,NYJ 19,4019.0,4264.0,17,18,Home,1,35,-4.0,40.0,0,outdoors,fieldturf,82.0,9.0,Rex Ryan,Greg Schiano,NYC01,MetLife Stadium,0,0.0,,,D.Martin,22.0,,,0,1,0.0,0,1,,00-0029613,,D.Martin,22.0,00-0029613,D.Martin,00-0029613,D.Martin,00-0029613,0,0,-0.846546870491904,,,,,,0.616028666496277,-61.6028666496277,2013-09-08,D.Harrison,2013,REG,NYJ,1,00-0029040,DT,Damon Harrison,Damon,Harrison,Knee,,Probable,Knee,,Full Participation in Practice,2013-09-06T12:49:31Z,2013-09-06 12:49:31
4159,2013_18_KC_IND,2014010400,IND,KC,POST,18,IND,home,KC,IND,75.0,2014-01-04,298.0,298.0,298.0,Half2,0,24.0,0,4,3.0,0,04:58,IND 25,5,80.0,"(4:58) (No Huddle, Shotgun) 12-A.Luck pass short right to 80-C.Fleener to IND 36 for 11 yards (29-E.Berry). KC-50-J.Houston was injured during the play.",pass,11.0,1,1,1.0,0,0,0,short,right,10.0,1.0,,,,,,,2,1,0.0,,,,,2.0,1.0,38,44,38.0,44.0,-6.0,38.0,44.0,-6.0,0.360408574342728,0.122581958770752,0.0019180302042514,0.206459268927574,0.138734474778175,0.0035074870102107,0.166390210390091,0.0,0.0,-0.228846948128194,1.66809015150648,-9.39589851663914,9.39589851663914,-3.9134361282405,3.9134361282405,-3.38124200129599,3.38124200129599,1.47484220203478,0.193247949471697,1.47484220203478,0.193247949471697,18.1189969620384,-18.1189969620384,-16.4707122737891,16.4707122737891,13.6461416813029,-13.6461416813029,-22.5481992242756,22.5481992242756,0.170949622988701,0.829050377011299,0.170949622988701,0.829050377011299,0.0639708042144775,0.0565463602542877,0.0565463602542877,0.234920427203178,0.765079572796822,0.149080321192741,0.149080321192741,-0.121745995210142,0.121745995210142,-0.272505915178048,0.272505915178048,0.0,0.0639708042144775,0.0,0.0639708042144775,0.0752346467556104,-0.0752346467556104,-0.245098986895226,0.245098986895226,1.0195185195984,-1.0195185195984,-1.31596643594041,1.31596643594041,0.0,0.0,1.0,0.0,1.0,0.0,0.0,0.0,0.0,0,0.0,0.0,0.0,0.0,0.0,0.0,0.0,0.0,0.0,0.0,0.0,0.0,0.0,0.0,1.0,0.0,0.0,0.0,0.0,0.0,0.0,0.0,0.0,1.0,0.0,0.0,0.0,0.0,0.0,0.0,0.0,0.0,0.0,0.0,0.0,1.0,0.0,0.0,0.0,0.0,0.0,00-0029668,A.Luck,11.0,00-0029697,C.Fleener,11.0,,,,,,,,,,,,,,,,,,,,,,,,,,,,,,,,,,,,,,,,,,,,,,KC,,00-0027858,,E.Berry,,,,,,,,,,,,,,0.0,,,,,,,,,,,,,,,,,,,,,,,,,,,,,,,,0.0,,,,,0,,,0.0,0.0,0.0,0.0,,,2013,0.552115321159363,44.7884678840637,68,1,First down,4159,"1/4/14, 16:35:28",2014-01-05T00:47:19Z,Lucas Oil Stadium,"Partly cloudy Temp: 38° F, Humidity: 47%, Wind: S 14 mph",10012014-0104-0028-6699-808a652b2b43,0,0,PASS,0,,,,24,Touchdown,2014-01-05T00:43:54Z,4.0,1:15,2.0,0.0,1.0,4.0,4.0,0.0,KICKOFF,TOUCHDOWN,05:36,04:21,IND 20,IND 36,4095.0,4206.0,44,45,Home,1,89,-2.0,48.0,0,closed,fieldturf,,,Chuck Pagano,Andy Reid,IND00,Lucas Oil Stadium,0,1.0,A.Luck,12.0,,,C.Fleener,80.0,1,0,1.0,0,1,00-0029668,,00-0029697,A.Luck,12.0,00-0029668,C.Fleener,00-0029697,C.Fleener,00-0029697,0,0,1.66809015150648,0.301879783884007,4.14418069597741,1.0,1.0,1.0,0.983224034309387,1.67759656906128,2014-01-04,J.Houston,2013,WC,KC,18,00-0028008,LB,Justin Houston,Justin,Houston,Elbow,,Probable,Elbow,,Full Participation in Practice,2014-01-03T09:10:00Z,2014-01-03 09:10:00
4150,2013_02_NYJ_NE,2013091200,NE,NYJ,REG,2,NE,home,NYJ,NE,64.0,2013-09-12,223.0,223.0,223.0,Half2,0,29.0,0,4,2.0,0,03:43,NE 36,5,14.0,(3:43) 12-T.Brady pass short right to 11-J.Edelman to NE 36 for no gain (56-D.Davis). NYJ-91-S.Richardson was injured during the play.,pass,0.0,0,0,1.0,0,0,0,short,right,-5.0,5.0,,,,,,,3,1,0.0,,,,,3.0,1.0,13,10,13.0,10.0,3.0,13.0,10.0,3.0,0.459061235189438,0.0641871243715286,0.0005428299773484,0.101204410195351,0.144571498036385,0.0026793447323143,0.227753549814224,0.0,0.0,1.13127012783661,-0.583745511830784,1.64209810236935,-1.64209810236935,-6.99260485493036,6.99260485493036,3.8178122560213,-3.8178122560213,-0.842235214426182,0.258489702595398,-0.842235214426182,0.258489702595398,-11.2155209241319,11.2155209241319,12.4827808568371,-12.4827808568371,-4.8305527290795,4.8305527290795,5.94976836795208,-5.94976836795208,0.803603172302246,0.196396827697754,0.803603172302246,0.196396827697754,-0.0161507129669189,-0.0287290215492249,-0.0287290215492249,0.787452459335327,0.212547540664673,0.8780437707901,0.8780437707901,-0.0634653824929805,0.0634653824929805,0.342922492289673,-0.342922492289673,0.0,-0.0161507129669189,0.0,-0.0161507129669189,-0.0540455132722855,0.0540455132722855,0.136032550001274,-0.136032550001274,-0.0570517927408218,0.0570517927408218,0.322137205267082,-0.322137205267082,0.0,0.0,0.0,0.0,0.0,0.0,0.0,0.0,0.0,0,0.0,0.0,0.0,0.0,0.0,0.0,0.0,0.0,0.0,0.0,0.0,0.0,0.0,0.0,1.0,0.0,0.0,0.0,0.0,0.0,0.0,0.0,0.0,1.0,0.0,0.0,0.0,0.0,0.0,0.0,0.0,0.0,0.0,0.0,0.0,1.0,0.0,0.0,0.0,0.0,0.0,00-0019596,T.Brady,0.0,00-0027150,J.Edelman,0.0,,,,,,,,,,,,,,,,,,,,,,,,,,,,,,,,,,,,,,,,,,,,,,NYJ,,00-0029607,,D.Davis,,,,,,,,,,,,,,0.0,,,,,,,,,,,,,,,,,,,,,,,,,,,,,,,,0.0,,,,,0,,,0.0,0.0,0.0,0.0,,,2013,0.834439098834992,16.5560901165009,49,1,First down,4150,"9/12/13, 20:29:46",2013-09-13T03:34:44Z,Gillette Stadium,"Cloudy, warm and humid Temp: 72° F, Humidity: 89%, Wind: South 8 mph",10012013-0912-00bb-64d6-4e618bce25b4,0,0,PASS,0,,,,29,Punt,2013-09-13T03:34:04Z,6.0,3:27,1.0,0.0,0.0,4.0,4.0,0.0,INTERCEPTION,PUNT,04:23,00:56,NE 31,NE 45,4129.0,4326.0,10,13,Home,3,23,10.5,43.0,1,outdoors,fieldturf,72.0,8.0,Bill Belichick,Rex Ryan,BOS00,Gillette Stadium,0,0.0,T.Brady,12.0,,,J.Edelman,11.0,1,0,0.0,0,1,00-0019596,,00-0027150,T.Brady,12.0,00-0019596,J.Edelman,00-0027150,J.Edelman,00-0027150,0,1,-0.583745511830784,0.94363087277467,10.3623936189688,9.0,0.515769858204294,0.436384428583551,0.289276868104935,71.0723131895065,2013-09-12,S.Richardson,2013,REG,NYJ,2,00-0030573,DT,Sheldon Richardson,Sheldon,Richardson,Shoulder,,Probable,Shoulder,,Limited Participation in Practice,2013-09-11T10:11:42Z,2013-09-11 10:11:42
4138,2013_14_CLE_NE,2013120802,NE,CLE,REG,14,CLE,away,NE,NE,5.0,2013-12-08,168.0,168.0,168.0,Half2,0,22.0,0,4,1.0,1,02:48,NE 5,5,80.0,(2:48) 26-W.McGahee up the middle to NE 4 for 1 yard (72-J.Vellano; 54-D.Hightower). CLE-26-W.McGahee was injured during the play.,run,1.0,0,0,0.0,0,0,0,,,,,middle,,,,,,2,1,0.0,,,,,1.0,2.0,14,19,19.0,14.0,5.0,19.0,14.0,5.0,0.0961506441235542,0.0059418226592242,0.0002277216408401,0.0106019293889403,0.163755670189857,0.0016997440252453,0.721622467041016,0.0,0.0,5.45352935092524,-0.415437398420181,-14.0831692846884,14.0831692846884,6.81862026201598,-6.81862026201598,-22.3678334645604,22.3678334645604,,,0.0,0.0,-2.8286135813687,2.8286135813687,-6.91660897433758,6.91660897433758,-7.12467938440386,7.12467938440386,-8.17409201068406,8.17409201068406,0.928899466991425,0.0711005330085754,0.0711005330085754,0.928899466991425,0.0041492581367492,-0.0060829520225524,0.0060829520225524,0.0669512748718262,0.933048725128174,0.921223938465118,0.0787760615348816,0.1076159639135,-0.1076159639135,-0.738797601854946,0.738797601854946,,,0.0,0.0,-0.147443681955338,0.147443681955338,-0.208772681719209,0.208772681719209,-0.149035379290581,0.149035379290581,-0.402844458884145,0.402844458884145,0.0,0.0,0.0,0.0,0.0,0.0,0.0,0.0,0.0,0,0.0,0.0,0.0,0.0,0.0,0.0,0.0,0.0,0.0,0.0,0.0,0.0,0.0,0.0,0.0,0.0,0.0,0.0,0.0,0.0,0.0,0.0,1.0,0.0,0.0,0.0,0.0,0.0,0.0,0.0,0.0,0.0,0.0,0.0,0.0,0.0,1.0,0.0,0.0,0.0,0.0,,,,,,,00-0022178,W.McGahee,1.0,,,,,,,,,,,,,,,,,,,,,,,,,,,,,,,,,,,,,,,,,,,,,,,,,00-0030001,J.Vellano,NE,00-0029669,D.Hightower,NE,,,,,,,0.0,,,,,,,,,,,,,,,,,,,,,,,,,,,,,,,,0.0,,,,,0,,,0.0,0.0,0.0,0.0,,,2013,,,62,1,Touchdown,4138,"12/8/13, 13:03:00",2013-12-08T21:11:58Z,Gillette Stadium,"Cloudy and cold Temp: 30° F, Humidity: 46%, Wind: NNW 5 mph",10012013-1208-028f-2fc0-db25047ff300,0,0,RUSH,0,,,,22,Touchdown,2013-12-08T20:58:41Z,8.0,3:04,5.0,1.0,1.0,4.0,4.0,-10.0,KICKOFF,TOUCHDOWN,05:43,02:39,CLE 20,NE 4,3939.0,4208.0,26,27,Home,1,53,9.5,47.5,0,outdoors,fieldturf,30.0,5.0,Bill Belichick,Rob Chudzinski,BOS00,Gillette Stadium,0,0.0,,,W.McGahee,26.0,,,0,1,0.0,0,1,,00-0022178,,W.McGahee,26.0,00-0022178,W.McGahee,00-0022178,W.McGahee,00-0022178,0,0,-0.415437398420181,,,,,,0.0939088612794876,-9.39088612794876,2013-12-08,W.McGahee,2013,REG,CLE,14,00-0022178,RB,Willis McGahee,Willis,McGahee,Knee,,Probable,Knee,,Full Participation in Practice,2013-12-06T10:07:50Z,2013-12-06 10:07:50
4097,2013_12_CAR_MIA,2013112406,MIA,CAR,REG,12,CAR,away,MIA,CAR,80.0,2013-11-24,153.0,153.0,153.0,Half2,0,25.0,0,4,4.0,0,02:33,CAR 20,10,80.0,(2:33) (Shotgun) 1-C.Newton pass short left to 89-S.Smith to CAR 39 for 19 yards (20-R.Jones). MIA-30-C.Clemons was injured during the play. His return is Probable.,pass,19.0,1,0,1.0,0,0,0,short,left,12.0,7.0,,,,,,,3,1,0.0,,,,,1.0,3.0,16,13,13.0,16.0,-3.0,13.0,16.0,-3.0,0.504238605499268,0.132472977042198,0.0021692120935767,0.201583474874496,0.0623233616352081,0.0013888253597542,0.0958234965801239,0.0,0.0,-0.952329467749223,2.45543092233129,-0.146870615135413,0.146870615135413,-8.1742566373858,8.1742566373858,6.67134778935692,-6.67134778935692,2.25899458595086,0.19643633638043,2.25899458595086,0.19643633638043,1.55018540825328,-1.55018540825328,-0.21703208522905,0.21703208522905,-3.10518950376794,3.10518950376794,9.4168017255365,-9.4168017255365,0.178949400782585,0.821050599217415,0.821050599217415,0.178949400782585,0.143535330891609,0.208837524056435,-0.208837524056435,0.677515268325806,0.322484731674194,0.207174822688103,0.792825177311897,-0.0414129909129355,0.0414129909129355,0.40587789949133,-0.40587789949133,0.0,0.143535330891609,0.0,0.143535330891609,0.0519866868853569,-0.0519866868853569,0.155785333477993,-0.155785333477993,0.0418090149760246,-0.0418090149760246,0.382016141080399,-0.382016141080399,0.0,0.0,1.0,0.0,0.0,0.0,1.0,0.0,0.0,0,0.0,0.0,0.0,0.0,0.0,0.0,0.0,0.0,0.0,0.0,0.0,0.0,0.0,0.0,1.0,0.0,0.0,0.0,0.0,0.0,0.0,0.0,0.0,1.0,0.0,0.0,0.0,0.0,0.0,0.0,0.0,0.0,0.0,0.0,0.0,1.0,0.0,0.0,0.0,0.0,0.0,00-0027939,C.Newton,19.0,00-0020337,S.Smith,19.0,,,,,,,,,,,,,,,,,,,,,,,,,,,,,,,,,,,,,,,,,,,,,,MIA,,00-0027762,,R.Jones,,,,,,,,,,,,,,0.0,,,,,,,,,,,,,,,,,,,,,,,,,,,,,,,,0.0,,,,,0,,,0.0,0.0,0.0,0.0,,,2013,0.543972611427307,45.6027388572693,50,1,First down,4097,"11/24/13, 13:03:14",2013-11-24T21:05:58Z,Hard Rock Stadium,"Cloudy Temp: 82° F, Humidity: 55%, Wind: NNE 13 mph",10012013-1124-0688-a61b-96c302977395,0,0,PASS,0,,,,25,Touchdown,2013-11-24T21:02:42Z,12.0,3:30,5.0,1.0,1.0,4.0,4.0,10.0,PUNT,TOUCHDOWN,04:13,00:43,CAR 20,MIA 1,3995.0,4386.0,20,16,Home,-4,36,-4.5,40.0,0,outdoors,grass,82.0,13.0,Joe Philbin,Ron Rivera,MIA00,Sun Life Stadium,0,1.0,C.Newton,1.0,,,S.Smith,89.0,1,0,1.0,0,1,00-0027939,,00-0020337,C.Newton,1.0,00-0027939,S.Smith,00-0020337,S.Smith,00-0020337,0,1,2.45543092233129,0.0609788803050129,2.82063549243321,1.0,0.992258192389272,0.992258192389272,0.985296785831451,1.47032141685486,2013-11-24,C.Clemons,2013,REG,MIA,12,00-0027115,S,Chris Clemons,Chris,Clemons,Knee,Shoulder,Probable,Knee,Shoulder,Full Participation in Practice,2013-11-22T11:49:55Z,2013-11-22 11:49:55
4060,2013_17_SF_ARI,2013122912,ARI,SF,REG,17,ARI,home,SF,ARI,79.0,2013-12-29,83.0,83.0,83.0,Half2,0,25.0,0,4,2.0,0,01:23,ARI 21,9,55.0,(1:23) (Shotgun) 3-C.Palmer pass deep middle to 84-R.Housler to ARI 45 for 24 yards (35-E.Reid). ARI-84-R.Housler was injured during the play. Timeout ARI due to injury to avoid 10-second run-off.,pass,24.0,1,0,1.0,0,0,0,deep,middle,24.0,0.0,,,,,,,2,2,0.0,,,,,2.0,2.0,17,20,17.0,20.0,-3.0,17.0,20.0,-3.0,0.589346289634705,0.0947331860661507,0.0013309561181813,0.055992603302002,0.167717173695564,0.001279711141251,0.0896001085639,0.0,0.0,0.454102009767667,1.21679868642241,-4.16409420385025,4.16409420385025,7.0052889117454,-7.0052889117454,-2.06067811905591,2.06067811905591,1.21679868642241,0.0,1.21679868642241,0.0,17.2258595920284,-17.2258595920284,-9.62637677611201,9.62637677611201,26.7067807696876,-26.7067807696876,-30.2762303306786,30.2762303306786,0.281940191984177,0.718059808015823,0.281940191984177,0.718059808015823,0.126060783863068,0.0896576344966888,0.0896576344966888,0.408000975847244,0.591999024152756,0.296637415885925,0.296637415885925,-0.0189725905656815,0.0189725905656815,0.166138642105004,-0.166138642105004,0.126060783863068,0.0,0.126060783863068,0.0,0.381541424068352,-0.381541424068352,0.0458799451589584,-0.0458799451589584,0.380223654779336,-0.380223654779336,-0.183475628495216,0.183475628495216,0.0,0.0,1.0,0.0,0.0,0.0,0.0,0.0,0.0,0,0.0,0.0,0.0,0.0,0.0,0.0,0.0,0.0,0.0,0.0,0.0,0.0,0.0,0.0,1.0,0.0,0.0,0.0,0.0,0.0,0.0,0.0,0.0,1.0,0.0,0.0,0.0,0.0,0.0,0.0,0.0,0.0,0.0,0.0,0.0,1.0,0.0,0.0,0.0,0.0,0.0,00-0021429,C.Palmer,24.0,00-0028007,R.Housler,24.0,,,,,,,,,,,,,,,,,,,,,,,,,,,,,,,,,,,,,,,,,,,,,,SF,,00-0030548,,E.Reid,,,,,,,,,,,,,,0.0,,,,,,,,,,,,,,,,,,,,,,,,,,,,,,,,0.0,,,,,0,,,0.0,0.0,0.0,0.0,,,2013,0.47303107380867,52.696892619133,54,1,First down,4060,"12/29/13, 16:25:26",2013-12-30T00:27:49Z,State Farm Stadium,"Sunny Temp: 64° F, Humidity: 28%, Wind: North 5 mph",10012013-1229-12c5-6139-e9295973a335,0,0,PASS,0,,,,25,Field goal,2013-12-30T00:26:35Z,8.0,1:16,2.0,0.0,1.0,4.0,4.0,5.0,KICKOFF,FIELD_GOAL,01:45,00:29,ARI 20,SF 25,4018.0,4253.0,23,20,Home,-3,43,3.0,41.0,1,closed,grass,,,Bruce Arians,Jim Harbaugh,PHO00,University of Phoenix Stadium,0,1.0,C.Palmer,3.0,,,R.Housler,84.0,1,0,1.0,0,1,00-0021429,,00-0028007,C.Palmer,3.0,00-0021429,R.Housler,00-0028007,R.Housler,00-0028007,0,1,1.21679868642241,0.630437087132541,8.35137112412485,4.0,1.0,1.0,0.974055767059326,2.59442329406738,2013-12-29,R.Housler,2013,REG,ARI,17,00-0028007,TE,Rob Housler,Rob,Housler,Groin,,Probable,Groin,,Full Participation in Practice,2013-12-27T12:55:22Z,2013-12-27 12:55:22
4020,2013_07_NE_NYJ,2013102007,NYJ,NE,REG,7,NE,away,NYJ,NE,75.0,2013-10-20,497.0,497.0,497.0,Half2,0,22.0,0,4,2.0,0,08:17,NE 25,10,16.0,(8:17) (Shotgun) 12-T.Brady pass short left to 85-K.Thompkins to NE 30 for 5 yards (27-D.Milliner). NYJ-27-D.Milliner was injured during the play.,pass,5.0,1,0,1.0,0,0,0,short,left,4.0,1.0,,,,,,,3,3,0.0,,,,,3.0,3.0,27,24,24.0,27.0,-3.0,24.0,27.0,-3.0,0.185156524181366,0.138649702072144,0.00308557623066,0.23287433385849,0.167795285582542,0.0023728217929601,0.270065784454346,0.0,0.0,0.346351395826787,-0.0214360486716032,-0.075053564272821,0.075053564272821,-2.52909271328826,2.52909271328826,5.01479466289624,-5.01479466289624,-0.194312993902713,0.17287694523111,-0.194312993902713,0.17287694523111,4.21279336989392,-4.21279336989392,7.14207187079592,-7.14207187079592,5.74553927103989,-5.74553927103989,-0.670376753249512,0.670376753249512,0.307060718536377,0.692939281463623,0.692939281463623,0.307060718536377,-0.0006686747074127,-0.0244377255439758,0.0244377255439758,0.693607956171036,0.306392043828964,0.386533975601196,0.613466024398804,0.0519454941100132,-0.0519454941100132,0.100809961149181,-0.100809961149181,0.0,-0.0006686747074127,0.0,-0.0006686747074127,0.195049165153633,-0.195049165153633,0.085679367184639,-0.085679367184639,0.193823693657051,-0.193823693657051,-0.0720382768661235,0.0720382768661235,0.0,0.0,0.0,0.0,0.0,0.0,0.0,0.0,0.0,0,0.0,0.0,0.0,0.0,0.0,0.0,0.0,0.0,0.0,0.0,0.0,0.0,0.0,0.0,1.0,0.0,0.0,0.0,0.0,0.0,0.0,0.0,0.0,1.0,0.0,0.0,0.0,0.0,0.0,0.0,0.0,0.0,0.0,0.0,0.0,1.0,0.0,0.0,0.0,0.0,0.0,00-0019596,T.Brady,5.0,00-0030000,K.Thompkins,5.0,,,,,,,,,,,,,,,,,,,,,,,,,,,,,,,,,,,,,,,,,,,,,,NYJ,,00-0030592,,D.Milliner,,,,,,,,,,,,,,0.0,,,,,,,,,,,,,,,,,,,,,,,,,,,,,,,,0.0,,,,,0,,,0.0,0.0,0.0,0.0,,,2013,0.733435094356537,26.6564905643463,54,1,First down,4020,"10/20/13, 13:03:29",2013-10-20T19:44:39Z,MetLife Stadium,"Sunny Temp: 63° F, Humidity: 36%, Wind: WNW 11 mph",10012013-1020-0733-0aa9-115641417dc7,0,0,PASS,0,,,,22,Punt,2013-10-20T19:44:09Z,6.0,1:56,1.0,0.0,0.0,4.0,4.0,0.0,PUNT,PUNT,08:21,06:25,NE 25,NE 41,3998.0,4139.0,27,30,Home,3,57,-3.5,43.0,1,outdoors,fieldturf,63.0,11.0,Rex Ryan,Bill Belichick,NYC01,MetLife Stadium,0,0.0,T.Brady,12.0,,,K.Thompkins,85.0,1,0,0.0,0,1,00-0019596,,00-0030000,T.Brady,12.0,00-0019596,K.Thompkins,00-0030000,K.Thompkins,00-0030000,0,1,-0.0214360486716032,0.548502670177675,4.08772108539415,2.0,0.613584516395349,0.222231460560579,0.688396692276001,31.1603307723999,2013-10-20,D.Milliner,2013,REG,NYJ,7,00-0030592,CB,Dee Milliner,Dee,Milliner,Hamstring,,Probable,Hamstring,,Full Participation in Practice,2013-10-18T12:52:38Z,2013-10-18 12:52:38
3950,2013_06_NO_NE,2013101310,NE,NO,REG,6,NO,away,NE,NE,34.0,2013-10-13,221.0,221.0,221.0,Half2,0,20.0,0,4,2.0,0,03:41,NE 34,20,81.0,(3:41) (Shotgun) 9-D.Brees pass incomplete short middle to 43-D.Sproles (28-S.Gregory). NE-51-J.Mayo was injured during the play. NO-43-D.Sproles was injured during the play.,pass,0.0,1,0,1.0,0,0,0,short,middle,6.0,,,,,,,,3,1,0.0,,,,,1.0,3.0,23,17,17.0,23.0,-6.0,17.0,23.0,-6.0,0.25835520029068,0.046598132699728,0.0004855985171161,0.0623906031250954,0.398025631904602,0.001758549362421,0.232386320829392,0.0,0.0,2.2467984232353,-0.518382994807325,2.79537443320291,-2.79537443320291,-6.82666339505397,6.82666339505397,1.69173738914525,-1.69173738914525,0.0726887136115693,-0.591071708418895,0.0,0.0,-1.36877377703786,1.36877377703786,-0.649994199294007,0.649994199294007,-9.08412108634366,9.08412108634366,16.4269220036544,-16.4269220036544,0.229660823941231,0.770339176058769,0.770339176058769,0.229660823941231,-0.0298966318368912,-0.0257869064807892,0.0257869064807892,0.80023580789566,0.19976419210434,0.209753885865211,0.790246114134789,-0.197616548750803,0.197616548750803,0.112606201409412,-0.112606201409412,0.0,-0.0298966318368912,0.0,0.0,0.0512907952070236,-0.0512907952070236,-0.0361598542937511,0.0361598542937511,-0.769978776574135,0.769978776574135,1.05911676967056,-1.05911676967056,0.0,0.0,0.0,0.0,0.0,0.0,0.0,0.0,1.0,0,0.0,0.0,0.0,0.0,0.0,0.0,0.0,0.0,0.0,0.0,0.0,0.0,0.0,0.0,0.0,0.0,0.0,0.0,0.0,0.0,0.0,0.0,0.0,1.0,0.0,0.0,0.0,0.0,0.0,0.0,0.0,0.0,0.0,0.0,0.0,0.0,0.0,0.0,0.0,0.0,0.0,00-0020531,D.Brees,,00-0023564,D.Sproles,,,,,,,,,,,,,,,,,,,,,,,,,,,,,,,,,,,,,,,,,,,,,,,,,,,,,,,,,,,,,,,,,0.0,,,,,,,00-0023998,S.Gregory,,,,,,,,,,,,,,,,,,,,,,,,0.0,,,,,0,,,0.0,0.0,0.0,0.0,,,2013,0.777926564216614,-77.7926564216614,57,1,Touchdown,3950,"10/13/13, 16:25:31",2013-10-13T23:10:11Z,Gillette Stadium,"Partly Cloudy Temp: 59° F, Humidity: 57%, Wind: ENE 7 mph",10012013-1013-10c2-27fa-d1c1f51d57b8,0,0,PASS,0,,,,20,Touchdown,2013-10-13T22:58:53Z,10.0,5:05,5.0,0.0,1.0,4.0,4.0,-10.0,KICKOFF,TOUCHDOWN,08:34,03:29,NO 19,NE 34,3696.0,4019.0,27,30,Home,3,57,2.5,51.5,0,outdoors,fieldturf,59.0,7.0,Bill Belichick,Sean Payton,BOS00,Gillette Stadium,0,0.0,D.Brees,9.0,,,D.Sproles,43.0,1,0,0.0,0,1,00-0020531,,00-0023564,D.Brees,9.0,00-0020531,D.Sproles,00-0023564,D.Sproles,00-0023564,0,1,-0.518382994807325,0.503658913401326,4.1360384861473,3.0,0.977406438614707,0.0531144954147749,0.910709083080292,8.92909169197083,2013-10-13,J.Mayo,2013,REG,NE,6,00-0026150,LB,Jerod Mayo,Jerod,Mayo,Ankle,,Probable,Ankle,,Full Participation in Practice,2013-10-11T12:24:39Z,2013-10-11 12:24:39
3927,2013_10_PHI_GB,2013111003,GB,PHI,REG,10,PHI,away,GB,GB,48.0,2013-11-10,254.0,254.0,254.0,Half2,0,21.0,0,4,2.0,0,04:14,GB 48,2,70.0,"(4:14) (No Huddle, Shotgun) 34-B.Brown right tackle to GB 45 for 3 yards (43-M.Jennings). GB-53-N.Perry was injured during the play.",run,3.0,1,1,0.0,0,0,0,,,,,right,tackle,,,,,1,3,0.0,,,,,3.0,1.0,13,27,27.0,13.0,14.0,27.0,13.0,14.0,0.329811781644821,0.0549205057322979,0.0007759142899885,0.0718512237071991,0.19684936106205,0.0026585434097796,0.343132615089417,0.0,0.0,2.32852156390436,-0.0099465576931834,-20.2835045611805,20.2835045611805,-8.08753410276854,8.08753410276854,-14.2038491507497,14.2038491507497,,,0.0,0.0,-5.80098010453369,5.80098010453369,5.98647574364441,-5.98647574364441,4.05625881430021,-4.05625881430021,-25.2482394683916,25.2482394683916,0.995198905467987,0.0048010945320129,0.0048010945320129,0.995198905467987,0.0030596256256103,0.0014247298240661,-0.0014247298240661,0.0017414689064025,0.998258531093597,0.997865974903107,0.0021340250968933,-0.217704866081476,0.217704866081476,-0.277024430718334,0.277024430718334,,,0.0,0.0,0.150206953287125,-0.150206953287125,-0.0962726376318054,0.0962726376318054,0.147631138563156,-0.147631138563156,-0.550781955506714,0.550781955506714,0.0,1.0,0.0,0.0,0.0,0.0,0.0,0.0,0.0,0,0.0,0.0,0.0,0.0,0.0,0.0,0.0,0.0,0.0,0.0,0.0,0.0,0.0,0.0,1.0,0.0,0.0,0.0,0.0,0.0,0.0,0.0,1.0,0.0,0.0,0.0,0.0,0.0,0.0,0.0,0.0,0.0,0.0,0.0,0.0,0.0,0.0,0.0,0.0,0.0,0.0,,,,,,,00-0029429,B.Brown,3.0,,,,,,,,,,,,,,,,,,,,,,,,,,,,,,,,,,,,,,,,,,,GB,,00-0028598,,M.Jennings,,,,,,,,,,,,,,0.0,,,,,,,,,,,,,,,,,,,,,,,,,,,,,,,,0.0,,,,,0,,,0.0,0.0,0.0,0.0,,,2013,,,56,1,First down,3927,"11/10/13, 13:03:25",2013-11-10T21:04:25Z,Lambeau Field,"Mostly sunny Temp: 45° F, Humidity: 48%, Wind: West 12 mph",10012013-1110-0336-29a2-404147b76677,0,0,RUSH,0,,,,21,End of half,2013-11-10T20:58:41Z,15.0,9:32,6.0,1.0,0.0,4.0,4.0,-5.0,DOWNS,END_GAME,09:32,00:00,PHI 8,GB 21,3741.0,4133.0,27,13,Home,-14,40,-1.0,47.0,0,outdoors,grass,45.0,12.0,Mike McCarthy,Chip Kelly,GNB00,Lambeau Field,0,0.0,,,B.Brown,34.0,,,0,1,1.0,0,1,,00-0029429,,B.Brown,34.0,00-0029429,B.Brown,00-0029429,B.Brown,00-0029429,0,0,-0.0099465576931834,,,,,,0.0730409398674965,-7.30409398674965,2013-11-10,N.Perry,2013,REG,GB,10,00-0029408,LB,Nick Perry,Nick,Perry,Foot,,Questionable,Foot,,Limited Participation in Practice,2013-11-08T12:11:36Z,2013-11-08 12:11:36
3862,2013_17_TB_NO,2013122908,NO,TB,REG,17,NO,home,TB,50,50.0,2013-12-29,300.0,300.0,300.0,Half2,0,21.0,0,4,3.0,0,05:00,MID 50,12,1.0,(5:00) 29-K.Robinson left guard to TB 47 for 3 yards (94-A.Clayborn). TB-97-A.Spence was injured during the play. His return is Doubtful.,run,3.0,0,0,0.0,0,0,0,,,,,left,guard,,,,,1,2,0.0,,,,,1.0,2.0,42,17,42.0,17.0,25.0,42.0,17.0,25.0,0.322897553443909,0.0856543853878975,0.0018236832693219,0.131192564964294,0.19384391605854,0.0066220858134329,0.25796577334404,0.0,0.0,1.22157785575837,-0.883599284454249,24.8712478652248,-24.8712478652248,1.62986250693211,-1.62986250693211,26.7843676075666,-26.7843676075666,,,0.0,0.0,-1.12075714903767,1.12075714903767,16.4143440520078,-16.4143440520078,-11.2889565534715,11.2889565534715,40.6658211669804,-40.6658211669804,0.999709784984589,0.0002902150154113,0.999709784984589,0.0002902150154113,-3.9517879486084e-05,-1.54972076416016e-06,-1.54972076416016e-06,0.999670267105103,0.0003297328948974,0.99997866153717,0.99997866153717,0.0252502980944479,-0.0252502980944479,0.510853224516229,-0.510853224516229,,,0.0,0.0,-0.150217532519756,0.150217532519756,0.619284719592313,-0.619284719592313,-0.795737057332454,0.795737057332454,1.38729340625264,-1.38729340625264,0.0,0.0,0.0,0.0,0.0,1.0,0.0,0.0,0.0,0,0.0,0.0,0.0,0.0,0.0,0.0,0.0,0.0,0.0,0.0,0.0,0.0,0.0,0.0,1.0,0.0,0.0,0.0,0.0,0.0,0.0,0.0,1.0,0.0,0.0,0.0,0.0,0.0,0.0,0.0,0.0,0.0,0.0,0.0,0.0,0.0,0.0,0.0,0.0,0.0,0.0,,,,,,,00-0030348,K.Robinson,3.0,,,,,,,,,,,,,,,,,,,,,,,,,,,,,,,,,,,,,,,,,,,TB,,00-0027958,,A.Clayborn,,,,,,,,,,,,,,0.0,,,,,,,,,,,,,,,,,,,,,,,,,,,,,,,,0.0,,,,,0,,,0.0,0.0,0.0,0.0,,,2013,,,51,0,Punt,3862,"12/29/13, 16:25:25",2013-12-30T00:17:28Z,Caesars Superdome,"Mostly Cloudy Temp: 56° F, Humidity: 64%, Wind: NNW 7 mph",10012013-1229-08ec-8316-8f6df7b9243b,0,0,RUSH,0,,,,21,Punt,2013-12-30T00:16:07Z,3.0,2:30,0.0,0.0,0.0,4.0,4.0,0.0,PUNT,PUNT,06:32,04:02,TB 48,TB 47,3819.0,3883.0,17,42,Home,25,59,11.0,47.0,1,dome,sportturf,,,Sean Payton,Greg Schiano,NOR00,Mercedes-Benz Superdome,0,0.0,,,K.Robinson,29.0,,,0,1,0.0,0,1,,00-0030348,,K.Robinson,29.0,00-0030348,K.Robinson,00-0030348,K.Robinson,00-0030348,0,1,-0.883599284454249,,,,,,0.663290560245514,-66.3290560245514,2013-12-29,A.Spence,2013,REG,TB,17,00-0030402,DT,Akeem Spence,Akeem,Spence,Wrist,,Probable,Wrist,,Full Participation in Practice,2013-12-27T11:59:02Z,2013-12-27 11:59:02
3859,2013_16_ARI_SEA,2013122211,SEA,ARI,REG,16,ARI,away,SEA,ARI,56.0,2013-12-22,346.0,346.0,346.0,Half2,0,27.0,0,4,1.0,0,05:46,ARI 44,10,80.0,(5:46) 38-A.Ellington left guard to ARI 49 for 5 yards (53-M.Smith; 91-C.Clemons). SEA-20-J.Lane was injured during the play.,run,5.0,0,0,0.0,0,0,0,,,,,left,guard,,,,,1,2,0.0,,,,,2.0,1.0,10,9,9.0,10.0,-1.0,9.0,10.0,-1.0,0.319410592317581,0.0690236240625382,0.0021926937624812,0.10192795842886,0.199951305985451,0.0018089395016431,0.305684894323349,0.0,0.0,1.81831408850849,0.0235575782135129,-2.76107808006764,2.76107808006764,1.24017974415533,-1.24017974415533,3.83004175907299,-3.83004175907299,,,0.0,0.0,3.63550084305462,-3.63550084305462,-4.2939141386305,4.2939141386305,14.9513529050746,-14.9513529050746,-7.75189339787867,7.75189339787867,0.50546407699585,0.49453592300415,0.49453592300415,0.50546407699585,0.0236781239509583,0.0044943690299987,-0.0044943690299987,0.470857799053192,0.529142200946808,0.431864589452744,0.568135410547257,-0.0489733666181564,0.0489733666181564,0.283860332203059,-0.283860332203059,,,0.0,0.0,0.189330688548236,-0.189330688548236,-0.122814938426018,0.122814938426018,0.189330688548236,-0.189330688548236,0.255151852965355,-0.255151852965355,0.0,0.0,0.0,0.0,0.0,0.0,0.0,0.0,0.0,0,0.0,0.0,0.0,0.0,0.0,0.0,0.0,0.0,0.0,0.0,0.0,0.0,0.0,0.0,0.0,0.0,0.0,0.0,0.0,0.0,0.0,0.0,1.0,0.0,0.0,0.0,0.0,0.0,0.0,0.0,0.0,0.0,0.0,0.0,0.0,0.0,1.0,0.0,0.0,0.0,0.0,,,,,,,00-0030287,A.Ellington,5.0,,,,,,,,,,,,,,,,,,,,,,,,,,,,,,,,,,,,,,,,,,,,,,,,,00-0028180,M.Smith,SEA,00-0021577,C.Clemons,SEA,,,,,,,0.0,,,,,,,,,,,,,,,,,,,,,,,,,,,,,,,,0.0,,,,,0,,,0.0,0.0,0.0,0.0,,,2013,,,47,1,First down,3859,"12/22/13, 16:05:49",2013-12-22T23:58:36Z,Lumen Field,"Cloudy Temp: 48° F, Humidity: 94%, Wind: SSE 6 mph",10012013-1222-1125-7984-000a1a8eaee3,0,0,RUSH,0,,,,26,Touchdown,2013-12-22T23:54:49Z,10.0,5:13,4.0,0.0,1.0,4.0,4.0,5.0,KICKOFF,TOUCHDOWN,07:26,02:13,ARI 20,SEA 31,3743.0,4093.0,17,10,Home,-7,27,8.0,42.5,1,outdoors,fieldturf,48.0,6.0,Pete Carroll,Bruce Arians,SEA00,CenturyLink Field,0,1.0,,,A.Ellington,38.0,,,0,1,0.0,0,1,,00-0030287,,A.Ellington,38.0,00-0030287,A.Ellington,00-0030287,A.Ellington,00-0030287,0,0,0.0235575782135129,,,,,,0.557202637195587,-55.7202637195587,2013-12-22,J.Lane,2013,REG,SEA,16,00-0029295,CB,Jeremy Lane,Jeremy,Lane,Ankle,,Probable,Ankle,,Full Participation in Practice,2013-12-20T13:16:47Z,2013-12-20 13:16:47
3837,2013_16_PIT_GB,2013122212,GB,PIT,REG,16,PIT,away,GB,GB,46.0,2013-12-22,282.0,282.0,282.0,Half2,0,23.0,0,4,1.0,0,04:42,GB 46,10,48.0,(4:42) 26-L.Bell right guard to GB 45 for 1 yard (96-M.Neal). GB-96-M.Neal was injured during the play.,run,1.0,0,0,0.0,0,0,0,,,,,right,guard,,,,,3,2,0.0,,,,,2.0,3.0,31,31,31.0,31.0,0.0,31.0,31.0,0.0,0.274145185947418,0.0522363968193531,0.0004770643427036,0.0817039832472801,0.228282675147057,0.0031657691579312,0.359988987445831,0.0,0.0,2.48151127400342,-0.600336216855794,-4.42626528310939,4.42626528310939,8.07961986993905,-8.07961986993905,-13.3015111226035,13.3015111226035,,,0.0,0.0,-7.31282901467057,7.31282901467057,5.74559703707928,-5.74559703707928,-5.05568419257179,5.05568419257179,-6.86813563410248,6.86813563410248,0.546446204185486,0.453553795814514,0.453553795814514,0.546446204185486,-0.0249949097633362,-0.0209416747093201,0.0209416747093201,0.47854870557785,0.52145129442215,0.655661165714264,0.344338834285736,0.309840788217303,-0.309840788217303,-0.357519699907362,0.357519699907362,,,0.0,0.0,-0.0351626115161444,0.0351626115161444,0.0060784369707107,-0.0060784369707107,-0.0351626115161444,0.0351626115161444,-0.264292568032179,0.264292568032179,0.0,0.0,0.0,0.0,0.0,0.0,0.0,0.0,0.0,0,0.0,0.0,0.0,0.0,0.0,0.0,0.0,0.0,0.0,0.0,0.0,0.0,0.0,0.0,1.0,0.0,0.0,0.0,0.0,0.0,0.0,0.0,1.0,0.0,0.0,0.0,0.0,0.0,0.0,0.0,0.0,0.0,0.0,0.0,0.0,0.0,0.0,0.0,0.0,0.0,0.0,,,,,,,00-0030496,L.Bell,1.0,,,,,,,,,,,,,,,,,,,,,,,,,,,,,,,,,,,,,,,,,,,GB,,00-0027664,,M.Neal,,,,,,,,,,,,,,0.0,,,,,,,,,,,,,,,,,,,,,,,,,,,,,,,,0.0,,,,,0,,,0.0,0.0,0.0,0.0,,,2013,,,58,0,Punt,3837,"12/22/13, 16:26:01",2013-12-23T00:24:02Z,Lambeau Field,"Snow Temp: 23° F, Humidity: 78%, Wind: North 13 mph",10012013-1222-12e6-4b8e-a0f0536858e0,0,0,RUSH,0,,,,23,Punt,2013-12-23T00:17:28Z,9.0,4:14,2.0,0.0,0.0,4.0,4.0,0.0,KICKOFF,PUNT,07:14,03:00,PIT 11,GB 41,3650.0,3904.0,38,31,Home,-7,69,-1.0,43.5,0,outdoors,grass,23.0,13.0,Mike McCarthy,Mike Tomlin,GNB00,Lambeau Field,0,0.0,,,L.Bell,26.0,,,0,1,0.0,0,1,,00-0030496,,L.Bell,26.0,00-0030496,L.Bell,00-0030496,L.Bell,00-0030496,0,1,-0.600336216855794,,,,,,0.46708482503891,-46.708482503891,2013-12-22,M.Neal,2013,REG,GB,16,00-0027664,DE,Mike Neal,Mike,Neal,Abdomen,,Probable,Abdomen,,Limited Participation in Practice,2013-12-20T11:30:38Z,2013-12-20 11:30:38
3811,2013_02_DEN_NYG,2013091511,NYG,DEN,REG,2,NYG,home,DEN,DEN,45.0,2013-09-15,478.0,478.0,478.0,Half2,0,23.0,0,4,2.0,0,07:58,DEN 45,10,35.0,(7:58) (Shotgun) 10-E.Manning pass incomplete short right to 83-B.Myers [25-C.Harris]. DEN-33-D.Ihenacho was injured during the play.,pass,0.0,1,0,1.0,0,0,0,short,right,3.0,,,,,,,,3,2,0.0,,,,,3.0,2.0,16,38,16.0,38.0,-22.0,16.0,38.0,-22.0,0.167194843292236,0.0713725835084915,0.001196811790578,0.108916588127613,0.268488794565201,0.0037408841308206,0.379089444875717,0.0,0.0,2.48764677508734,-0.666409634752199,-23.6242411496523,23.6242411496523,-0.843921627907548,0.843921627907548,-24.6723636910095,24.6723636910095,-0.504725037608296,-0.161684597143903,0.0,0.0,-4.15461026527919,4.15461026527919,-9.21223958325572,9.21223958325572,9.5289055845351,-9.5289055845351,-32.5182282608361,32.5182282608361,0.0005393223254941,0.999460677674506,0.0005393223254941,0.999460677674506,-0.000145149155287,-6.39111967757344e-05,-6.39111967757344e-05,0.000394173170207,0.999605826829793,0.0003598482871893,0.0003598482871893,-0.0415208712161328,0.0415208712161328,-0.679067887660557,0.679067887660557,0.0,-0.000145149155287,0.0,0.0,-0.240774677880354,0.240774677880354,-0.19388430436138,0.19388430436138,-0.240692299953907,0.240692299953907,-0.406816120390976,0.406816120390976,0.0,0.0,0.0,0.0,0.0,0.0,0.0,0.0,1.0,0,0.0,0.0,0.0,0.0,0.0,0.0,0.0,0.0,0.0,0.0,0.0,0.0,0.0,0.0,0.0,0.0,0.0,0.0,0.0,0.0,0.0,1.0,0.0,1.0,0.0,0.0,0.0,0.0,0.0,0.0,0.0,0.0,0.0,0.0,0.0,0.0,0.0,0.0,0.0,0.0,0.0,00-0022803,E.Manning,,00-0027135,B.Myers,,,,,,,,,,,,,,,,,,,,,,,,,,,,,,,,,,,,,00-0028224,C.Harris,,,,,,,,,,,,,,,,,,,,,,,,,,,0.0,,,,,,,,,,,,,,,,,,,,,,,,,,,,,,,,0.0,,,,,0,,,0.0,0.0,0.0,0.0,,,2013,0.452840715646744,-45.2840715646744,61,0,Turnover,3811,"9/15/13, 16:25:44",2013-09-15T23:14:39Z,MetLife Stadium,"Mosty Sunny Temp: 70° F, Humidity: 33%, Wind: SSW 3 mph",10012013-0915-1119-fecd-22dac630f38b,0,0,PASS,0,,,,23,Turnover,2013-09-15T23:09:06Z,8.0,2:40,2.0,0.0,0.0,4.0,4.0,0.0,KICKOFF,INTERCEPTION,10:13,07:33,NYG 20,DEN 45,3674.0,3858.0,41,23,Home,-18,64,-3.5,52.5,0,outdoors,fieldturf,70.0,3.0,Tom Coughlin,John Fox,NYC01,MetLife Stadium,0,0.0,E.Manning,10.0,,,B.Myers,83.0,1,0,0.0,0,1,00-0022803,,00-0027135,E.Manning,10.0,00-0022803,B.Myers,00-0027135,B.Myers,00-0027135,0,0,-0.666409634752199,0.695551414469909,4.54221249133116,3.0,0.434837747423444,0.230406526534352,0.830757856369019,16.9242143630981,2013-09-15,D.Ihenacho,2013,REG,DEN,2,00-0028942,S,Duke Ihenacho,Duke,Ihenacho,Thigh,,Probable,Thigh,,Full Participation in Practice,2013-09-13T12:16:26Z,2013-09-13 12:16:26
3790,2013_17_BUF_NE,2013122907,NE,BUF,REG,17,BUF,away,NE,BUF,52.0,2013-12-29,303.0,303.0,303.0,Half2,0,20.0,0,4,1.0,0,05:03,BUF 48,10,33.0,(5:03) (Shotgun) 9-T.Lewis pass short right to 28-C.Spiller ran ob at NE 36 for 16 yards. NE-55-B.Spikes was injured during the play.,pass,16.0,1,0,1.0,0,0,0,short,right,1.0,15.0,,,,,,,2,1,0.0,,,,,1.0,2.0,27,17,17.0,27.0,-10.0,17.0,27.0,-10.0,0.31177094578743,0.0572557039558888,0.0018007371108979,0.0787635743618012,0.217461496591568,0.0019512155558913,0.330996304750443,0.0,0.0,2.24654744751751,0.86843769880943,5.57409987788867,-5.57409987788867,10.1621821792796,-10.1621821792796,-10.1812024665847,10.1812024665847,-0.591601554886438,1.46003925369587,-0.591601554886438,1.46003925369587,-14.182058632141,14.182058632141,-0.458497476663467,0.458497476663467,-14.5427038358757,14.5427038358757,-0.0259559914281506,0.0259559914281506,0.0719122812151909,0.928087718784809,0.928087718784809,0.0719122812151909,0.0298322215676308,0.017519187182188,-0.017519187182188,0.898255497217178,0.101744502782822,0.0605135299265385,0.939486470073462,0.311928071488526,-0.311928071488526,-0.255046936140329,0.255046936140329,0.0,0.0298322215676308,0.0,0.0298322215676308,-0.161734035626918,0.161734035626918,-0.134759181402624,0.134759181402624,-0.162277331964046,0.162277331964046,-0.18633097153157,0.18633097153157,0.0,0.0,1.0,0.0,0.0,0.0,0.0,0.0,0.0,0,0.0,0.0,0.0,0.0,0.0,0.0,0.0,0.0,0.0,0.0,0.0,0.0,0.0,0.0,0.0,0.0,0.0,0.0,0.0,0.0,0.0,0.0,0.0,1.0,0.0,0.0,0.0,0.0,0.0,0.0,0.0,0.0,0.0,0.0,0.0,1.0,0.0,0.0,0.0,0.0,0.0,00-0027253,T.Lewis,16.0,00-0027861,C.Spiller,16.0,,,,,,,,,,,,,,,,,,,,,,,,,,,,,,,,,,,,,,,,,,,,,,,,,,,,,,,,,,,,,,,,0.0,,,,,,,,,,,,,,,,,,,,,,,,,,,,,,,,0.0,,,,,0,,,0.0,0.0,0.0,0.0,,,2013,0.774584591388702,22.5415408611298,54,1,First down,3790,"12/29/13, 16:25:36",2013-12-30T00:07:31Z,Gillette Stadium,"Rain Temp: 39° F, Humidity: 100%, Wind: ESE 8 mph",10012013-1229-075b-1713-a87f05d4faeb,0,0,PASS,0,,,,20,Field goal,2013-12-30T00:07:31Z,7.0,1:37,2.0,1.0,1.0,4.0,4.0,0.0,INTERCEPTION,FIELD_GOAL,05:03,03:26,BUF 48,NE 19,3790.0,3945.0,20,34,Home,14,54,7.5,46.5,1,outdoors,fieldturf,39.0,8.0,Bill Belichick,Doug Marrone,BOS00,Gillette Stadium,0,1.0,T.Lewis,9.0,,,C.Spiller,28.0,1,0,1.0,0,1,00-0027253,,00-0027861,T.Lewis,9.0,00-0027253,C.Spiller,00-0027861,C.Spiller,00-0027861,1,1,0.86843769880943,0.756782955380795,6.11487555700296,5.0,0.593624728615396,0.234845577622764,0.931956052780151,6.80439472198486,2013-12-29,B.Spikes,2013,REG,NE,17,00-0027668,LB,Brandon Spikes,Brandon,Spikes,Knee,,Questionable,Knee,,Limited Participation in Practice,2013-12-27T12:42:09Z,2013-12-27 12:42:09
3732,2013_11_KC_DEN,2013111709,DEN,KC,REG,11,DEN,home,KC,DEN,78.0,2013-11-17,682.0,682.0,682.0,Half2,0,22.0,0,4,2.0,0,11:22,DEN 22,8,62.0,"(11:22) (No Huddle, Shotgun) 18-P.Manning pass short right to 83-W.Welker to DEN 42 for 20 yards (97-A.Bailey). DEN-83-W.Welker was injured during the play.",pass,20.0,1,1,1.0,0,0,0,short,right,4.0,16.0,,,,,,,3,3,0.0,,,,,3.0,3.0,24,10,24.0,10.0,14.0,24.0,10.0,14.0,0.114722587168217,0.163446098566055,0.0027470991481095,0.248737275600433,0.189175367355347,0.0031626112759113,0.278008967638016,0.0,0.0,0.282920674886555,1.83713678247295,15.2649085433309,-15.2649085433309,-3.29936394264979,3.29936394264979,19.6402814319712,-19.6402814319712,0.0835140747949481,1.75362270767801,0.0835140747949481,1.75362270767801,1.83906865020981,-1.83906865020981,12.9660188547568,-12.9660188547568,-3.89491754904157,3.89491754904157,18.6800822808704,-18.6800822808704,0.965799808502197,0.0342001914978027,0.965799808502197,0.0342001914978027,0.0108663439750671,0.0067492127418518,0.0067492127418518,0.976666152477264,0.0233338475227356,0.979637801647186,0.979637801647186,-0.048017110112581,0.048017110112581,0.487623111783288,-0.487623111783288,0.0,0.0108663439750671,0.0,0.0108663439750671,-0.0342642971959911,0.0342642971959911,0.421584519036156,-0.421584519036156,-0.0370884546724163,0.0370884546724163,0.407411354072434,-0.407411354072434,0.0,0.0,1.0,0.0,0.0,0.0,0.0,0.0,0.0,0,0.0,0.0,0.0,0.0,0.0,0.0,0.0,0.0,0.0,0.0,0.0,0.0,0.0,0.0,1.0,0.0,0.0,0.0,0.0,0.0,0.0,0.0,0.0,1.0,0.0,0.0,0.0,0.0,0.0,0.0,0.0,0.0,0.0,0.0,0.0,1.0,0.0,0.0,0.0,0.0,0.0,00-0010346,P.Manning,20.0,00-0022427,W.Welker,20.0,,,,,,,,,,,,,,,,,,,,,,,,,,,,,,,,,,,,,,,,,,,,,,KC,,00-0028024,,A.Bailey,,,,,,,,,,,,,,0.0,,,,,,,,,,,,,,,,,,,,,,,,,,,,,,,,0.0,,,,,0,,,0.0,0.0,0.0,0.0,,,2013,0.734079122543335,26.5920877456665,56,1,First down,3732,"11/17/13, 20:30:46",2013-11-18T04:14:34Z,Empower Field at Mile High,"Clear Temp: 43° F, Humidity: 34%, Wind: E 6 mph",10012013-1117-0972-a4f1-66d18261a38c,0,0,PASS,0,,,,22,Field goal,2013-11-18T04:14:08Z,10.0,4:42,3.0,1.0,1.0,4.0,4.0,0.0,PUNT,FIELD_GOAL,11:48,07:06,DEN 20,KC 18,3711.0,3935.0,17,27,Home,10,44,7.5,48.5,1,outdoors,grass,43.0,6.0,John Fox,Andy Reid,DEN00,Sports Authority Field at Mile High,0,1.0,P.Manning,18.0,,,W.Welker,83.0,1,0,1.0,0,1,00-0010346,,00-0022427,P.Manning,18.0,00-0010346,W.Welker,00-0022427,W.Welker,00-0022427,0,0,1.83713678247295,0.677370095326615,4.16003103441471,2.0,0.989113381452626,0.37663113171584,0.591250777244568,40.8749222755432,2013-11-17,W.Welker,2013,REG,DEN,11,00-0022427,WR,Wes Welker,Wes,Welker,Ankle,,Probable,Ankle,,Full Participation in Practice,2013-11-15T11:42:35Z,2013-11-15 11:42:35
3712,2013_06_PIT_NYJ,2013101306,NYJ,PIT,REG,6,NYJ,home,PIT,PIT,12.0,2013-10-13,188.0,188.0,188.0,Half2,0,22.0,0,4,1.0,0,03:08,PIT 12,10,54.0,(3:08) (Shotgun) 7-G.Smith pass short left intended for 84-S.Hill INTERCEPTED by 94-L.Timmons [95-J.Jones] at PIT 3. 94-L.Timmons to PIT 26 for 23 yards (23-M.Goodson). NYJ-23-M.Goodson was injured during the play.,pass,0.0,1,0,1.0,0,0,0,short,left,9.0,,,,,,,,2,1,0.0,,,,,2.0,1.0,6,19,6.0,19.0,-13.0,6.0,19.0,-13.0,0.12826731801033,0.0075614983215928,0.0002544048475101,0.0140918707475066,0.300067096948624,0.0023670676164329,0.547390699386597,0.0,0.0,4.61483392189257,-5.5362346386537,-17.37383295014,17.37383295014,0.870167529967148,-0.870167529967148,-21.1859789899171,21.1859789899171,1.04569367624936,-6.58192831490305,0.0,0.0,1.36591448281426,-1.36591448281426,-10.6052416361509,10.6052416361509,7.26806372507592,-7.26806372507592,-30.3705089635105,30.3705089635105,0.0698054358363152,0.930194564163685,0.0698054358363152,0.930194564163685,-0.0658886954188347,-0.0388027988374233,-0.0388027988374233,0.0039167404174804,0.99608325958252,0.0411710105836391,0.0411710105836391,0.0734349377453327,-0.0734349377453327,-0.754511652613997,0.754511652613997,-0.0187651552259922,-0.0471235401928425,0.0,0.0,-0.0146363824605942,0.0146363824605942,-0.513889310981154,0.513889310981154,-0.037450049072504,0.037450049072504,-0.741250867123723,0.741250867123723,0.0,0.0,0.0,0.0,0.0,0.0,0.0,0.0,0.0,0,1.0,0.0,0.0,0.0,0.0,0.0,0.0,0.0,0.0,0.0,0.0,0.0,0.0,0.0,1.0,0.0,0.0,0.0,0.0,0.0,0.0,1.0,0.0,1.0,0.0,0.0,0.0,0.0,0.0,0.0,0.0,0.0,0.0,0.0,0.0,0.0,0.0,0.0,0.0,0.0,0.0,00-0030565,G.Smith,,00-0028995,S.Hill,,,,,,,,,,,,,00-0025402,L.Timmons,,,,,,,,,,,,,,,,,,,,,,,00-0030499,J.Jones,,,,,,,,,NYJ,,00-0027080,,M.Goodson,,,,,,,,,,,,,,0.0,,,,,,,00-0025402,L.Timmons,,,,,,,,,,,,,,,,,,,,,,,PIT,23.0,,,,,0,,,0.0,0.0,0.0,0.0,,,2013,0.308268696069717,-30.8268696069717,54,0,Turnover,3712,"10/13/13, 13:02:48",2013-10-13T19:51:47Z,MetLife Stadium,"Temp: 62° F, Humidity: 68%, Wind: NE 10 - 18 mph",10012013-1013-062f-c66a-d1c31494e82c,0,0,INTERCEPTION,0,,,,22,Turnover,2013-10-13T19:48:48Z,6.0,1:50,4.0,1.0,0.0,4.0,4.0,0.0,PUNT,INTERCEPTION,04:49,02:59,NYJ 34,PIT 12,3594.0,3712.0,19,6,Home,-13,25,-1.0,40.5,0,outdoors,fieldturf,62.0,10.0,Rex Ryan,Mike Tomlin,NYC01,MetLife Stadium,0,0.0,G.Smith,7.0,,,S.Hill,84.0,1,0,0.0,0,1,00-0030565,,00-0028995,G.Smith,7.0,00-0030565,S.Hill,00-0028995,S.Hill,00-0028995,0,0,-5.5362346386537,0.558148638213178,1.40092320431722,1.0,0.999090179626364,0.586278910108376,0.913648009300232,8.63519906997681,2013-10-13,M.Goodson,2013,REG,NYJ,6,00-0027080,RB,Mike Goodson,Mike,Goodson,Illness,,Probable,Illness,,Full Participation in Practice,2013-10-11T12:11:13Z,2013-10-11 12:11:13
3576,2013_11_BAL_CHI,2013111701,CHI,BAL,REG,11,CHI,home,BAL,BAL,13.0,2013-11-17,674.0,674.0,674.0,Half2,0,16.0,0,4,1.0,0,11:14,BAL 13,10,83.0,(11:14) 12-J.McCown sacked at BAL 14 for -1 yards (93-D.Tyson). BAL-22-J.Smith was injured during the play. His return is Questionable.,pass,-1.0,0,0,1.0,0,0,0,,,,,,,,,,,3,2,0.0,,,,,3.0,2.0,13,17,13.0,17.0,-4.0,13.0,17.0,-4.0,0.0203378796577454,0.0153371673077345,0.0004352058167569,0.0280772503465414,0.351257145404816,0.0015476094558835,0.583007752895355,0.0,0.0,4.89449825941119,-0.745295312604867,-2.13599320326898,2.13599320326898,0.670116624736693,-0.670116624736693,4.51988784245252,-4.51988784245252,,,0.0,0.0,-2.5012769154564,2.5012769154564,-1.90552067013859,1.90552067013859,4.47236754363985,-4.47236754363985,-3.77954564434556,3.77954564434556,0.554734110832214,0.445265889167786,0.554734110832214,0.445265889167786,-0.0460729598999023,-0.0405166745185852,-0.0405166745185852,0.508661150932312,0.491338849067688,0.576748788356781,0.576748788356781,-0.0397105313602351,0.0397105313602351,0.14234703050238,-0.14234703050238,,,0.0,0.0,-0.126884769909932,0.126884769909932,0.0779708027839661,-0.0779708027839661,-0.135155272000386,0.135155272000386,0.209718827580586,-0.209718827580586,0.0,0.0,0.0,0.0,0.0,0.0,0.0,0.0,0.0,0,0.0,0.0,0.0,0.0,0.0,0.0,0.0,0.0,0.0,0.0,0.0,0.0,0.0,0.0,1.0,0.0,0.0,0.0,0.0,0.0,0.0,1.0,0.0,1.0,1.0,0.0,0.0,0.0,0.0,0.0,0.0,0.0,0.0,0.0,0.0,0.0,0.0,0.0,0.0,0.0,0.0,00-0021206,J.McCown,,,,,,,,,,,,,,,,,,,,,,,,,,,,,,,,,,,,00-0029309,D.Tyson,,,00-0029309,D.Tyson,,,,,,,,,BAL,,00-0029309,,D.Tyson,,,,,,,,,,,,,,0.0,,,,,,,,,,,,,,,,,,,,,,,,,00-0029309,D.Tyson,,,,,,0.0,,,,,0,,,0.0,0.0,0.0,0.0,,,2013,,,43,1,Touchdown,3576,"11/17/13, 13:02:34",2013-11-17T22:20:49Z,Soldier Field,"Cloudy, Wind Gusts to 34 mph, Showers and Thunderstorms Expected Temp: 68° F, Humidity: 82%, Wind: S 17 mph",10012013-1117-01a9-88aa-cc1d490ca671,0,0,SACK,0,,,,16,Touchdown,2013-11-17T22:05:39Z,11.0,5:59,5.0,1.0,1.0,3.0,4.0,-5.0,PUNT,TOUCHDOWN,01:32,10:33,CHI 17,BAL 14,3238.0,3620.0,20,23,Home,3,43,4.0,41.0,0,outdoors,grass,68.0,17.0,Marc Trestman,John Harbaugh,CHI98,Soldier Field,0,0.0,J.McCown,12.0,,,,,1,0,0.0,0,1,00-0021206,,,J.McCown,12.0,00-0021206,,,,,0,1,-0.745295312604867,,,,,,0.398264616727829,60.1735383272171,2013-11-17,J.Smith,2013,REG,BAL,11,00-0027965,CB,Jimmy Smith,Jimmy,Smith,Groin,,Questionable,Groin,,Limited Participation in Practice,2013-11-15T11:04:38Z,2013-11-15 11:04:38
3550,2013_04_NYJ_TEN,2013092908,TEN,NYJ,REG,4,NYJ,away,TEN,NYJ,67.0,2013-09-29,631.0,631.0,631.0,Half2,0,24.0,0,4,3.0,0,10:31,NYJ 33,10,82.0,"(10:31) (No Huddle, Shotgun) 7-G.Smith pass deep left to 11-J.Kerley to 50 for 17 yards (24-C.Sensabaugh). NYJ-10-S.Holmes was injured during the play. His return is Questionable.",pass,17.0,1,1,1.0,0,0,0,deep,left,16.0,1.0,,,,,,,3,3,0.0,,,,,3.0,3.0,31,6,6.0,31.0,-25.0,6.0,31.0,-25.0,0.129897490143776,0.161274164915085,0.0035144756548106,0.271127641201019,0.169949263334274,0.0032331831753253,0.261003822088242,0.0,0.0,-0.0454040234908462,2.28655300335959,21.59035960444,-21.59035960444,1.86065611965023,-1.86065611965023,17.1667398515966,-17.1667398515966,2.20615317928605,0.0803998240735382,2.20615317928605,0.0803998240735382,-0.440165936074518,0.440165936074518,2.69995879860372,-2.69995879860372,4.36315009382011,-4.36315009382011,3.42288439198175,-3.42288439198175,0.0006122785271145,0.999387721472885,0.999387721472885,0.0006122785271145,-0.000156693655299,-1.54126319102943e-05,1.54126319102943e-05,0.999544415128184,0.0004555848718155,0.0002996589173562,0.999700341082644,0.077670194208622,-0.077670194208622,0.271682489994887,-0.271682489994887,0.0,-0.000156693655299,0.0,-0.000156693655299,-0.109478386877553,0.109478386877553,0.153796785584083,-0.153796785584083,-0.105264655141608,0.105264655141608,0.341223941374003,-0.341223941374003,0.0,0.0,1.0,0.0,1.0,0.0,0.0,0.0,0.0,0,0.0,0.0,0.0,0.0,0.0,0.0,0.0,0.0,0.0,0.0,0.0,0.0,0.0,0.0,1.0,0.0,0.0,0.0,0.0,0.0,0.0,0.0,0.0,1.0,0.0,0.0,0.0,0.0,0.0,0.0,0.0,0.0,0.0,0.0,0.0,1.0,0.0,0.0,0.0,0.0,0.0,00-0030565,G.Smith,17.0,00-0028091,J.Kerley,17.0,,,,,,,,,,,,,,,,,,,,,,,,,,,,,,,,,,,,,,,,,,,,,,TEN,,00-0029529,,C.Sensabaugh,,,,,,,,,,,,,,0.0,,,,,,,,,,,,,,,,,,,,,,,,,,,,,,,,0.0,,,,,0,,,0.0,0.0,0.0,0.0,,,2013,0.484502702951431,51.5497297048569,46,1,First down,3550,"9/29/13, 16:05:47",2013-09-29T22:47:53Z,Nissan Stadium,"Cloudy Temp: 74° F, Humidity: 51%, Wind: SW 4 mph",10012013-0929-087d-7dd7-ad25a988ed63,0,0,PASS,0,,,,24,Touchdown,2013-09-29T22:45:24Z,8.0,2:56,4.0,0.0,1.0,4.0,4.0,0.0,KICKOFF,TOUCHDOWN,11:45,08:49,NYJ 18,TEN 34,3458.0,3667.0,13,38,Home,25,51,3.5,40.5,0,outdoors,grass,74.0,4.0,Mike Munchak,Rex Ryan,NAS00,LP Field,0,1.0,G.Smith,7.0,,,J.Kerley,11.0,1,0,1.0,0,1,00-0030565,,00-0028091,G.Smith,7.0,00-0030565,J.Kerley,00-0028091,J.Kerley,00-0028091,0,0,2.28655300335959,0.243564719169071,3.50291773496429,1.0,1.0,1.0,0.975555777549744,2.44442224502564,2013-09-29,S.Holmes,2013,REG,NYJ,4,00-0024240,WR,Santonio Holmes,Santonio,Holmes,Foot,,Probable,Foot,,Limited Participation in Practice,2013-09-27T11:57:50Z,2013-09-27 11:57:50
3536,2013_08_CLE_KC,2013102702,KC,CLE,REG,8,KC,home,CLE,CLE,49.0,2013-10-27,250.0,250.0,250.0,Half2,0,20.0,0,4,3.0,0,04:10,CLE 49,18,-6.0,(4:10) (Shotgun) 11-A.Smith sacked at KC 41 for -10 yards (52-D.Jackson). KC-71-J.Allen was injured during the play.,pass,-10.0,1,0,1.0,0,0,0,,,,,,,,,,,3,1,0.0,,,,,3.0,1.0,20,17,20.0,17.0,3.0,20.0,17.0,3.0,0.408059507608414,0.0752315148711205,0.0006597032188437,0.129951551556587,0.170710235834122,0.0046963053755462,0.210691213607788,0.0,0.0,0.859687001560815,-1.47833458508831,1.18280429183506,-1.18280429183506,4.96767469495535,-4.96767469495535,-6.67677032460165,6.67677032460165,,,0.0,0.0,-1.94091086031403,1.94091086031403,7.61354995390866,-7.61354995390866,-12.4596942404751,12.4596942404751,12.2076296154692,-12.2076296154692,0.776698410511017,0.223301589488983,0.776698410511017,0.223301589488983,-0.0626474618911743,-0.0495593547821045,-0.0495593547821045,0.714050948619843,0.285949051380157,0.799779295921326,0.799779295921326,0.292026102542877,-0.292026102542877,-0.315372070504766,0.315372070504766,,,0.0,0.0,0.101263031363487,-0.101263031363487,-0.0412823168769884,0.0412823168769884,0.100224360823631,-0.100224360823631,-0.173983281685452,0.173983281685452,0.0,0.0,0.0,0.0,0.0,1.0,0.0,0.0,0.0,0,0.0,0.0,0.0,0.0,0.0,0.0,0.0,0.0,0.0,0.0,0.0,0.0,0.0,0.0,1.0,0.0,0.0,0.0,0.0,0.0,0.0,1.0,0.0,1.0,1.0,0.0,0.0,0.0,0.0,0.0,0.0,0.0,0.0,0.0,0.0,0.0,0.0,0.0,0.0,0.0,0.0,00-0023436,A.Smith,,,,,,,,,,,,,,,,,,,,,,,,,,,,,,,,,,,,00-0024249,D.Jackson,,,00-0024249,D.Jackson,,,,,,,,,CLE,,00-0024249,,D.Jackson,,,,,,,,,,,,,,0.0,,,,,,,,,,,,,,,,,,,,,,,,,00-0024249,D.Jackson,,,,,,0.0,,,,,0,,,0.0,0.0,0.0,0.0,,,2013,,,47,0,Punt,3536,"10/27/13, 13:02:43",2013-10-27T19:48:58Z,GEHA Field at Arrowhead Stadium,"Sunny, clear Temp: 52° F, Humidity: 46%, Wind: Southwest 4 mph",10012013-1027-0231-e2d0-090198b76b67,0,0,SACK,0,,,,20,Punt,2013-10-27T19:41:34Z,6.0,3:07,1.0,0.0,0.0,4.0,4.0,-10.0,MUFFED_PUNT,PUNT,07:02,03:55,KC 47,KC 41,3371.0,3575.0,17,23,Home,6,40,7.0,39.0,0,outdoors,grass,52.0,4.0,Andy Reid,Rob Chudzinski,KAN00,Arrowhead Stadium,0,0.0,A.Smith,11.0,,,,,1,0,0.0,0,1,00-0023436,,,A.Smith,11.0,00-0023436,,,,,0,1,-1.47833458508831,,,,,,0.885375678539276,11.4624321460724,2013-10-27,J.Allen,2013,REG,KC,8,00-0029524,G,Jeff Allen,Jeff,Allen,Knee,Groin,Probable,Knee,Groin,Full Participation in Practice,2013-10-25T13:12:10Z,2013-10-25 13:12:10
3473,2013_16_ATL_SF,2013122300,SF,ATL,REG,16,ATL,away,SF,ATL,72.0,2013-12-23,242.0,242.0,242.0,Half2,0,18.0,0,4,4.0,0,04:02,ATL 28,2,80.0,(4:02) (Shotgun) 2-M.Ryan pass short right to 84-R.White to ATL 34 for 6 yards (31-D.Whitner). SF-25-T.Brown was injured during the play. Caught at ATL 32. 2-yds YAC,pass,6.0,1,0,1.0,0,0,0,short,right,4.0,2.0,,,,,,,2,3,0.0,,,,,3.0,2.0,27,17,17.0,27.0,-10.0,17.0,27.0,-10.0,0.429642230272293,0.153893694281578,0.0021355759818106,0.21172297000885,0.0800584033131599,0.0021889933850616,0.120358169078827,0.0,0.0,-0.860952644608915,2.10685164225288,7.53568194738764,-7.53568194738764,11.3538321127497,-11.3538321127497,-5.33702010543007,5.33702010543007,2.11030592536554,-0.00345428311266,2.11030592536554,-0.00345428311266,0.735628095746506,-0.735628095746506,-0.611133676542533,0.611133676542533,3.78404273750493,-3.78404273750493,-3.63835246517193,3.63835246517193,0.0372356325387955,0.962764367461205,0.962764367461205,0.0372356325387955,0.0265201255679131,0.0140905287116766,-0.0140905287116766,0.936244241893291,0.0637557581067085,0.0181071367114782,0.981892863288522,0.379420628689871,-0.379420628689871,-0.109219356947297,0.109219356947297,0.0,0.0265201255679131,0.0,0.0265201255679131,-0.130090029644899,0.130090029644899,0.158823797637998,-0.158823797637998,-0.135339351105623,0.135339351105623,0.14165471696335,-0.14165471696335,0.0,0.0,1.0,0.0,0.0,0.0,1.0,0.0,0.0,0,0.0,0.0,0.0,0.0,0.0,0.0,0.0,0.0,0.0,0.0,0.0,0.0,0.0,0.0,1.0,0.0,0.0,0.0,0.0,0.0,0.0,0.0,0.0,1.0,0.0,0.0,0.0,0.0,0.0,0.0,0.0,0.0,0.0,0.0,0.0,1.0,0.0,0.0,0.0,0.0,0.0,00-0026143,M.Ryan,6.0,00-0023462,R.White,6.0,,,,,,,,,,,,,,,,,,,,,,,,,,,,,,,,,,,,,,,,,,,,,,SF,,00-0024223,,D.Whitner,,,,,,,,,,,,,,0.0,,,,,,,,,,,,,,,,,,,,,,,,,,,,,,,,0.0,,,,,0,,,0.0,0.0,0.0,0.0,,,2013,0.663651823997498,33.6348176002502,47,1,First down,3473,"12/23/13, 20:40:59",2013-12-24T04:21:05Z,Candlestick Park,"Clear Temp: 60° F, Humidity: 49%, Wind: 0 mph",10012013-1223-004f-98fb-a300294735f5,0,0,PASS,0,,,,18,Touchdown,2013-12-24T04:16:19Z,11.0,2:55,6.0,1.0,1.0,4.0,4.0,5.0,KICKOFF,TOUCHDOWN,05:04,02:09,ATL 20,SF 2,3370.0,3754.0,24,34,Home,10,58,15.5,46.0,0,outdoors,grass,60.0,0.0,Jim Harbaugh,Mike Smith,SFO00,Candlestick Park,0,1.0,M.Ryan,2.0,,,R.White,84.0,1,0,1.0,0,1,00-0026143,,00-0023462,M.Ryan,2.0,00-0026143,R.White,00-0023462,R.White,00-0023462,0,0,2.10685164225288,0.164407031162305,3.97486554562056,2.0,0.998147069767583,0.998147069767583,0.907880306243896,9.21196937561035,2013-12-23,T.Brown,2013,REG,SF,16,00-0025534,CB,Tarell Brown,Tarell,Brown,Ribs,,Probable,Ribs,,Full Participation in Practice,2013-12-21T14:44:24Z,2013-12-21 14:44:24
3437,2013_02_JAX_OAK,2013091512,LV,JAX,REG,2,JAX,away,LV,JAX,77.0,2013-09-15,321.0,321.0,321.0,Half2,0,19.0,0,4,3.0,0,05:21,JAX 23,6,-3.0,(5:21) (Shotgun) 7-C.Henne sacked at JAX 16 for -7 yards (26-U.Young). JAX-77-U.Nwaneri was injured during the play. His return is Doubtful.,pass,-7.0,1,0,1.0,0,0,0,,,,,,,,,,,1,2,0.0,,,,,2.0,1.0,19,3,3.0,19.0,-16.0,3.0,19.0,-16.0,0.379492282867432,0.133470252156258,0.0024872680660337,0.204138442873955,0.114167578518391,0.0014076791703701,0.164836466312408,0.0,0.0,-0.335181034635752,-1.47867589280941,17.481958500405,-17.481958500405,5.71592913435583,-5.71592913435583,7.73892467512167,-7.73892467512167,,,0.0,0.0,8.28445241146255,-8.28445241146255,-3.68003662388431,3.68003662388431,10.4968427936547,-10.4968427936547,-2.3427622018836,2.3427622018836,0.0117369703948498,0.98826302960515,0.98826302960515,0.0117369703948498,-0.0052804397419095,-0.0041429409757256,0.0041429409757256,0.99354346934706,0.0064565306529402,0.008445531129837,0.991554468870163,0.175441285932194,-0.175441285932194,0.0972083760425448,-0.0972083760425448,,,0.0,0.0,0.118716977536678,-0.118716977536678,0.0222568213939667,-0.0222568213939667,0.118716977536678,-0.118716977536678,0.0429088454693556,-0.0429088454693556,0.0,0.0,0.0,0.0,0.0,1.0,0.0,0.0,0.0,0,0.0,0.0,0.0,0.0,0.0,0.0,0.0,0.0,0.0,0.0,0.0,0.0,0.0,0.0,1.0,0.0,0.0,0.0,0.0,0.0,0.0,1.0,0.0,1.0,1.0,0.0,0.0,0.0,0.0,0.0,0.0,0.0,0.0,0.0,0.0,0.0,0.0,0.0,0.0,0.0,0.0,00-0026197,C.Henne,,,,,,,,,,,,,,,,,,,,,,,,,,,,,,,,,,,,00-0025453,U.Young,,,00-0025453,U.Young,,,,,,,,,LV,,00-0025453,,U.Young,,,,,,,,,,,,,,0.0,,,,,,,,,,,,,,,,,,,,,,,,,00-0025453,U.Young,,,,,,0.0,,,,,0,,,0.0,0.0,0.0,0.0,,,2013,,,42,0,Punt,3437,"9/15/13, 16:25:53",2013-09-15T22:58:46Z,Oakland-Alameda County Stadium,"Sunny Temp: 76° F, Humidity: 52%, Wind: West 10 mph",10012013-0915-12a7-15d3-d3c0de8bb91d,0,0,SACK,0,,,,19,Punt,2013-09-15T22:56:51Z,3.0,1:02,0.0,0.0,0.0,4.0,4.0,0.0,KICKOFF,PUNT,06:00,04:58,JAX 19,JAX 16,3366.0,3456.0,9,19,Home,10,28,3.5,40.5,0,outdoors,grass,76.0,10.0,Dennis Allen,Gus Bradley,OAK00,O.co Coliseum,0,0.0,C.Henne,7.0,,,,,1,0,0.0,0,1,00-0026197,,,C.Henne,7.0,00-0026197,,,,,0,1,-1.47867589280941,,,,,,0.98618757724762,1.38124227523804,2013-09-15,U.Nwaneri,2013,REG,JAX,2,00-0025536,G,Uche Nwaneri,Uche,Nwaneri,Knee,,Probable,Knee,,Limited Participation in Practice,2013-09-13T10:21:34Z,2013-09-13 10:21:34
3363,2013_05_HOU_SF,2013100611,SF,HOU,REG,5,HOU,away,SF,HOU,80.0,2013-10-06,646.0,646.0,646.0,Half2,0,20.0,0,4,1.0,0,10:46,HOU 20,10,36.0,(10:46) 13-T.Yates pass short left to 23-A.Foster to HOU 25 for 5 yards (83-D.Dobbs). SF-83-D.Dobbs was injured during the play. Caught at HOU 15. 10-yds YAC,pass,5.0,0,0,1.0,0,0,0,short,left,-5.0,10.0,,,,,,,3,2,0.0,,,,,2.0,3.0,34,3,3.0,34.0,-31.0,3.0,34.0,-31.0,0.140396282076836,0.150558158755302,0.0029101143591105,0.250882506370544,0.18079024553299,0.0025380398146808,0.271924644708633,0.0,0.0,0.237247079610825,0.172395285684615,30.1112090028064,-30.1112090028064,4.38478473841678,-4.38478473841678,17.3442979335368,-17.3442979335368,-1.18629827955738,1.35869356524199,-1.18629827955738,1.35869356524199,3.56617910036584,-3.56617910036584,-3.80748960791122,3.80748960791122,1.68639547284693,-1.68639547284693,16.1905924062293,-16.1905924062293,7.74596992414445e-05,0.999922540300759,0.999922540300759,7.74596992414445e-05,-1.90721839317121e-05,-3.23096173815429e-07,3.23096173815429e-07,0.99994161248469,5.83875153097324e-05,1.58022012328729e-05,0.999984197798767,-0.0044732340261315,0.0044732340261315,0.250577294378985,-0.250577294378985,0.0,-1.90721839317121e-05,0.0,-1.90721839317121e-05,0.0283943004906178,-0.0283943004906178,-4.18421085074394e-05,4.18421085074394e-05,0.0329611264169216,-0.0329611264169216,0.229914005025733,-0.229914005025733,0.0,0.0,0.0,0.0,0.0,0.0,0.0,0.0,0.0,0,0.0,0.0,0.0,0.0,0.0,0.0,0.0,0.0,0.0,0.0,0.0,0.0,0.0,0.0,1.0,0.0,0.0,0.0,0.0,0.0,0.0,0.0,0.0,1.0,0.0,0.0,0.0,0.0,0.0,0.0,0.0,0.0,0.0,0.0,0.0,1.0,0.0,0.0,0.0,0.0,0.0,00-0028090,T.Yates,5.0,00-0026796,A.Foster,5.0,,,,,,,,,,,,,,,,,,,,,,,,,,,,,,,,,,,,,,,,,,,,,,SF,,00-0028479,,D.Dobbs,,,,,,,,,,,,,,0.0,,,,,,,,,,,,,,,,,,,,,,,,,,,,,,,,0.0,,,,,0,,,0.0,0.0,0.0,0.0,,,2013,0.827322900295258,17.2677099704742,46,1,First down,3363,"10/6/13, 20:31:05",2013-10-07T03:00:35Z,Candlestick Park,"Sunny Temp: 76° F, Humidity: 40%, Wind: Northerly 9 mph",10012013-1006-1126-eb9c-87f141ded9bc,0,0,PASS,0,,,,20,Turnover on downs,2013-10-07T02:58:17Z,10.0,4:45,2.0,0.0,0.0,4.0,4.0,5.0,KICKOFF,DOWNS,10:46,06:01,HOU 20,SF 35,3344.0,3631.0,3,34,Home,31,37,4.0,43.0,0,outdoors,grass,76.0,9.0,Jim Harbaugh,Gary Kubiak,SFO00,Candlestick Park,0,1.0,T.Yates,13.0,,,A.Foster,23.0,1,0,0.0,0,1,00-0028090,,00-0026796,T.Yates,13.0,00-0028090,A.Foster,00-0026796,A.Foster,00-0026796,0,0,0.172395285684615,1.22086608983341,10.7068033467804,10.0,0.503268970322097,0.218167523067677,0.76057243347168,23.942756652832,2013-10-06,D.Dobbs,2013,REG,SF,5,00-0028479,TE,Demarcus Dobbs,Demarcus,Dobbs,Calf,,Probable,Calf,,Full Participation in Practice,2013-10-04T12:56:18Z,2013-10-04 12:56:18
3362,2013_12_MIN_GB,2013112403,GB,MIN,REG,12,GB,home,MIN,MIN,10.0,2013-11-24,279.0,279.0,279.0,Half2,0,19.0,0,4,1.0,1,04:39,MIN 10,10,76.0,"(4:39) 27-E.Lacy right tackle to MIN 10 for no gain (36-R.Blanton, 69-J.Allen). MIN-98-L.Guion was injured during the play.",run,0.0,0,0,0.0,0,0,0,,,,,right,tackle,,,,,2,3,0.0,,,,,2.0,3.0,13,23,13.0,23.0,-10.0,13.0,23.0,-10.0,0.0741105079650879,0.0094764064997434,0.0002543791779316,0.0198682490736246,0.320064961910248,0.0025968323461711,0.573628604412079,0.0,0.0,4.81277305993717,-0.404156875098124,-9.1455315269601,9.1455315269601,1.67817895754706,-1.67817895754706,-10.3364214204522,10.3364214204522,,,0.0,0.0,-11.2934713117429,11.2934713117429,6.7648445729268,-6.7648445729268,-5.16996926200227,5.16996926200227,-6.12328671744018,6.12328671744018,0.173339992761612,0.826660007238388,0.173339992761612,0.826660007238388,-0.0165015012025833,-0.0313308238983154,-0.0313308238983154,0.156838491559029,0.843161508440971,0.20828577876091,0.20828577876091,0.0475231883134936,-0.0475231883134936,-0.389099159906628,0.389099159906628,,,0.0,0.0,-0.101628594100475,0.101628594100475,-0.130661612550738,0.130661612550738,-0.101628594100475,0.101628594100475,-0.350866226653578,0.350866226653578,0.0,0.0,0.0,0.0,0.0,0.0,0.0,0.0,0.0,0,0.0,0.0,0.0,0.0,0.0,0.0,0.0,0.0,0.0,0.0,0.0,0.0,0.0,0.0,0.0,0.0,0.0,0.0,0.0,0.0,0.0,0.0,1.0,0.0,0.0,0.0,0.0,0.0,0.0,0.0,0.0,0.0,0.0,0.0,0.0,0.0,1.0,0.0,0.0,0.0,0.0,,,,,,,00-0030485,E.Lacy,0.0,,,,,,,,,,,,,,,,,,,,,,,,,,,,,,,,,,,,,,,,,,,,,,,,,00-0022740,J.Allen,MIN,,,,,,,,,,1.0,00-0029575,R.Blanton,MIN,,,,,,,,,,,,,,,,,,,,,,,,,,,,,0.0,,,,,0,,,0.0,0.0,0.0,0.0,,,2013,,,56,1,Touchdown,3362,"11/24/13, 13:03:14",2013-11-24T20:41:39Z,Lambeau Field,"Mostly cloudy Temp: 19° F, Humidity: 52%, Wind: SW 10 mph",10012013-1124-03a3-1638-98289d0b28f4,0,0,RUSH,0,,,,19,Touchdown,2013-11-24T20:35:06Z,12.0,5:10,6.0,1.0,1.0,4.0,4.0,0.0,PUNT,TOUCHDOWN,08:40,03:30,GB 24,MIN 6,3135.0,3432.0,26,26,Home,0,52,6.0,44.5,1,outdoors,grass,19.0,10.0,Mike McCarthy,Leslie Frazier,GNB00,Lambeau Field,0,0.0,,,E.Lacy,27.0,,,0,1,0.0,0,1,,00-0030485,,E.Lacy,27.0,00-0030485,E.Lacy,00-0030485,E.Lacy,00-0030485,0,1,-0.404156875098124,,,,,,0.730614364147186,-73.0614364147186,2013-11-24,L.Guion,2013,REG,MIN,12,00-0026292,DT,Letroy Guion,Letroy,Guion,Chest,,Probable,Chest,,Full Participation in Practice,2013-11-22T11:02:31Z,2013-11-22 11:02:31
3317,2013_11_GB_NYG,2013111712,NYG,GB,REG,11,GB,away,NYG,NYG,49.0,2013-11-17,152.0,152.0,152.0,Half2,0,20.0,0,4,1.0,0,02:32,NYG 49,10,49.0,"(2:32) (No Huddle, Shotgun) 16-S.Tolzien pass short left to 27-E.Lacy to NYG 44 for 5 yards (52-J.Beason, 24-T.Thomas). NYG-24-T.Thomas was injured during the play.",pass,5.0,1,1,1.0,0,0,0,short,left,-1.0,6.0,,,,,,,3,2,0.0,,,,,2.0,3.0,27,13,13.0,27.0,-14.0,13.0,27.0,-14.0,0.40638267993927,0.0506657771766186,0.0004410917754285,0.0620267279446125,0.196402326226234,0.0029320374596864,0.281149357557297,0.0,0.0,1.97604994580615,0.127422302437481,10.5565369652554,-10.5565369652554,9.93833390163491,-9.93833390163491,-0.454387690732721,0.454387690732721,-0.504078650148585,0.631500952586066,-0.504078650148585,0.631500952586066,-4.25649895968311,4.25649895968311,2.65876093745646,-2.65876093745646,-2.32622628284664,2.32622628284664,7.52879355289507,-7.52879355289507,0.0066247778013348,0.993375222198665,0.993375222198665,0.0066247778013348,-0.0003974917344748,-0.0005905744619667,0.0005905744619667,0.99377271393314,0.0062272860668599,0.0044325087219476,0.995567491278052,0.394044108767946,-0.394044108767946,0.0246068296410246,-0.0246068296410246,0.0,-0.0003974917344748,0.0,-0.0003974917344748,0.0588490357622504,-0.0588490357622504,-0.0392052215791732,0.0392052215791732,0.0588490357622504,-0.0588490357622504,0.0490852660887046,-0.0490852660887046,0.0,0.0,0.0,0.0,0.0,0.0,0.0,0.0,0.0,0,0.0,0.0,0.0,0.0,0.0,0.0,0.0,0.0,0.0,0.0,0.0,0.0,0.0,0.0,0.0,0.0,0.0,0.0,0.0,0.0,0.0,0.0,0.0,1.0,0.0,0.0,0.0,0.0,0.0,0.0,0.0,0.0,0.0,0.0,0.0,1.0,1.0,0.0,0.0,0.0,0.0,00-0028595,S.Tolzien,5.0,00-0030485,E.Lacy,5.0,,,,,,,,,,,,,,,,,,,,,,,,,,,,,,,,,,,,,,,,,,,,,,,,,,,,00-0026203,T.Thomas,NYG,,,,,,,,,,1.0,00-0025412,J.Beason,NYG,,,,,,,,,,,,,,,,,,,,,,,,,,,,,0.0,,,,,0,,,0.0,0.0,0.0,0.0,,,2013,0.833605408668518,16.6394591331482,49,1,First down,3317,"11/17/13, 16:25:28",2013-11-17T23:58:20Z,MetLife Stadium,"Mostly Cloudy Temp: 59° F, Humidity: 100%, Wind: SE 2 mph",10012013-1117-1221-b9b0-f8ec00c7de10,0,0,PASS,0,,,,20,Turnover,2013-11-17T23:56:13Z,8.0,2:43,4.0,0.0,0.0,4.0,4.0,0.0,PUNT,INTERCEPTION,04:32,01:49,GB 17,NYG 34,3203.0,3385.0,13,27,Home,14,40,3.5,41.0,0,outdoors,fieldturf,59.0,2.0,Tom Coughlin,Mike McCarthy,NYC01,MetLife Stadium,0,1.0,S.Tolzien,16.0,,,E.Lacy,27.0,1,0,0.0,0,1,00-0028595,,00-0030485,S.Tolzien,16.0,00-0028595,E.Lacy,00-0030485,E.Lacy,00-0030485,0,1,0.127422302437481,0.710286023480853,7.56000288284849,6.0,0.561284380441066,0.222559983318206,0.961010873317719,3.89891266822815,2013-11-17,T.Thomas,2013,REG,NYG,11,00-0026203,CB,Terrell Thomas,Terrell,Thomas,Knee,,Probable,Knee,,Limited Participation in Practice,2013-11-15T10:32:16Z,2013-11-15 10:32:16
3286,2013_07_SF_TEN,2013102010,TEN,SF,REG,7,TEN,home,SF,TEN,86.0,2013-10-20,462.0,462.0,462.0,Half2,0,19.0,0,4,1.0,0,07:42,TEN 14,10,86.0,(7:42) (Shotgun) 10-J.Locker pass short left to 13-K.Wright to TEN 34 for 20 yards (35-E.Reid; 27-C.Spillman). SF-35-E.Reid was injured during the play. His return is Questionable.,pass,20.0,1,0,1.0,0,0,0,short,left,-2.0,22.0,,,,,,,3,1,0.0,,,,,3.0,1.0,3,24,3.0,24.0,-21.0,3.0,24.0,-21.0,0.245619013905525,0.123913384974003,0.0038399850018322,0.205179184675217,0.151110425591469,0.002488081343472,0.267849951982498,0.0,0.0,0.517582685686648,1.22401761100627,-23.0091999437557,23.0091999437557,-3.76269934357078,3.76269934357078,-16.2956302259865,16.2956302259865,-0.873048291075975,2.09706590208225,-0.873048291075975,2.09706590208225,-7.58072923665168,7.58072923665168,0.511727907054592,-0.511727907054592,-1.65087324375054,1.65087324375054,-11.3226105706417,11.3226105706417,0.0018991449614986,0.998100855038501,0.0018991449614986,0.998100855038501,-0.000273116864264,-0.0003882081364281,-0.0003882081364281,0.0016260280972346,0.998373971902765,0.0012974278070032,0.0012974278070032,-0.165216954741198,0.165216954741198,-0.282567504327744,0.282567504327744,0.0,-0.000273116864264,0.0,-0.000273116864264,-0.0699938023462892,0.0699938023462892,-0.0541527322493494,0.0541527322493494,-0.0699938023462892,0.0699938023462892,-0.205611586105078,0.205611586105078,0.0,0.0,1.0,0.0,0.0,0.0,0.0,0.0,0.0,0,0.0,0.0,0.0,0.0,0.0,0.0,0.0,0.0,0.0,0.0,0.0,0.0,0.0,0.0,0.0,0.0,0.0,0.0,0.0,0.0,0.0,0.0,0.0,1.0,0.0,0.0,0.0,0.0,0.0,0.0,0.0,0.0,0.0,0.0,0.0,1.0,1.0,0.0,0.0,0.0,0.0,00-0027946,J.Locker,20.0,00-0029708,K.Wright,20.0,,,,,,,,,,,,,,,,,,,,,,,,,,,,,,,,,,,,,,,,,,,,,,,,,,,,00-0030548,E.Reid,SF,00-0026758,C.Spillman,SF,,,,,,,0.0,,,,,,,,,,,,,,,,,,,,,,,,,,,,,,,,0.0,,,,,0,,,0.0,0.0,0.0,0.0,,,2013,0.841717183589935,15.8282816410065,42,1,First down,3286,"10/20/13, 16:06:00",2013-10-20T22:50:31Z,Nissan Stadium,"Sunny Temp: 68° F, Humidity: 32%, Wind: N 3 mph",10012013-1020-1013-0784-3784a503b781,0,0,PASS,0,,,,19,Touchdown,2013-10-20T22:50:31Z,2.0,0:35,2.0,0.0,1.0,4.0,4.0,0.0,PUNT,TOUCHDOWN,07:42,07:07,TEN 14,TEN 34,3286.0,3334.0,31,17,Home,-14,48,-3.0,41.0,0,outdoors,grass,68.0,3.0,Mike Munchak,Jim Harbaugh,NAS00,LP Field,0,1.0,J.Locker,10.0,,,K.Wright,13.0,1,0,1.0,0,1,00-0027946,,00-0029708,J.Locker,10.0,00-0027946,K.Wright,00-0029708,K.Wright,00-0029708,0,1,1.22401761100627,1.09831697673213,8.51083538054809,7.0,0.55022982659284,0.215976537787355,0.792562544345856,20.7437455654144,2013-10-20,E.Reid,2013,REG,SF,7,00-0030548,S,Eric Reid,Eric,Reid,Hip,Ankle,Probable,Hip,Ankle,Full Participation in Practice,2013-10-18T12:51:53Z,2013-10-18 12:51:53
3150,2013_10_DAL_NO,2013111011,NO,DAL,REG,10,DAL,away,NO,DAL,89.0,2013-11-10,119.0,1019.0,1019.0,Half2,0,16.0,0,3,2.0,0,01:59,DAL 11,10,89.0,"(1:59) (Shotgun) 9-T.Romo pass short left to 82-J.Witten pushed ob at DAL 30 for 19 yards (32-K.Vaccaro). NO-32-K.Vaccaro was injured during the play. His return is Probable. Pass 11, YAC 8",pass,19.0,1,0,1.0,0,0,0,short,left,11.0,8.0,,,,,,,2,2,0.0,,,,,2.0,2.0,35,10,10.0,35.0,-25.0,10.0,35.0,-25.0,0.0338011048734188,0.211290538311005,0.014921891503036,0.321190565824509,0.167963325977325,0.0015799084212631,0.249252662062645,0.0,0.0,-0.660230929497629,1.76851967978291,22.8319773108466,-22.8319773108466,8.85943955881521,-8.85943955881521,24.1045446252034,-24.1045446252034,1.27979989163578,0.488719788147137,1.27979989163578,0.488719788147137,-0.196747732290532,0.196747732290532,21.3443457352433,-21.3443457352433,-0.354509655211587,0.354509655211587,24.1172629831641,-24.1172629831641,0.0031555360183119,0.996844463981688,0.996844463981688,0.0031555360183119,0.0014131991192698,0.0003650434082373,-0.0003650434082373,0.995431264862418,0.0045687351375818,0.0014517805539071,0.998548219446093,0.0092180225372147,-0.0092180225372147,0.571671923905515,-0.571671923905515,0.0,0.0014131991192698,0.0,0.0014131991192698,0.0186655968427658,-0.0186655968427658,0.508966520246022,-0.508966520246022,0.0186655968427658,-0.0186655968427658,0.600978574067258,-0.600978574067258,0.0,0.0,1.0,0.0,0.0,0.0,0.0,0.0,0.0,0,0.0,0.0,0.0,0.0,0.0,0.0,0.0,0.0,0.0,0.0,0.0,0.0,0.0,0.0,1.0,0.0,0.0,0.0,0.0,0.0,0.0,0.0,0.0,1.0,0.0,0.0,0.0,0.0,0.0,0.0,0.0,0.0,0.0,0.0,0.0,1.0,0.0,0.0,0.0,0.0,0.0,00-0021678,T.Romo,19.0,00-0022127,J.Witten,19.0,,,,,,,,,,,,,,,,,,,,,,,,,,,,,,,,,,,,,,,,,,,,,,NO,,00-0030060,,K.Vaccaro,,,,,,,,,,,,,,0.0,,,,,,,,,,,,,,,,,,,,,,,,,,,,,,,,0.0,,,,,0,,,0.0,0.0,0.0,0.0,,,2013,0.619334399700165,38.0665600299835,46,1,First down,3150,"11/10/13, 20:30:50",2013-11-11T03:56:12Z,Caesars Superdome,"Clear Temp: 69° F, Humidity: 65%, Wind: NNE 2 mph",10012013-1110-1136-58b4-db6d95e5f9e1,0,0,PASS,0,,,,16,Touchdown,2013-11-11T03:50:17Z,5.0,1:31,3.0,0.0,1.0,3.0,3.0,5.0,KICKOFF,TOUCHDOWN,02:12,00:41,DAL 11,NO 21,3082.0,3290.0,17,49,Home,32,66,6.0,54.0,0,dome,sportturf,,,Sean Payton,Jason Garrett,NOR00,Mercedes-Benz Superdome,0,1.0,T.Romo,9.0,,,J.Witten,82.0,1,0,1.0,0,1,00-0021678,,00-0022127,T.Romo,9.0,00-0021678,J.Witten,00-0022127,J.Witten,00-0022127,1,1,1.76851967978291,0.214236999109863,3.42157756607776,1.0,1.0,0.99201201624237,0.701988995075226,29.8011004924774,2013-11-10,K.Vaccaro,2013,REG,NO,10,00-0030060,S,Kenny Vaccaro,Kenny,Vaccaro,Chest,,Probable,Chest,,Full Participation in Practice,2013-11-08T12:50:55Z,2013-11-08 12:50:55
3143,2013_06_PIT_NYJ,2013101306,NYJ,PIT,REG,6,NYJ,home,PIT,NYJ,53.0,2013-10-13,641.0,641.0,641.0,Half2,0,18.0,0,4,1.0,0,10:41,NYJ 47,10,27.0,"(10:41) (No Huddle, Shotgun) 7-G.Smith pass incomplete short left to 19-E.Gates. NYJ-19-E.Gates was injured during the play.",pass,0.0,1,1,1.0,0,0,0,short,left,8.0,,,,,,,,2,2,0.0,,,,,2.0,2.0,6,19,6.0,19.0,-13.0,6.0,19.0,-13.0,0.11814321577549,0.0898249447345734,0.0010335331317037,0.117789886891842,0.284195512533188,0.005730589851737,0.38328230381012,0.0,0.0,2.45095273526385,-0.484684381168336,-14.4861638792834,14.4861638792834,-1.04964638099773,1.04964638099773,-16.5028262254635,16.5028262254635,0.457411400624551,-0.942095781792887,0.0,0.0,-1.92642280021216,1.92642280021216,-11.353568833658,11.353568833658,-0.188884110697543,0.188884110697543,-17.2573049893899,17.2573049893899,0.0597366876900196,0.94026331230998,0.0597366876900196,0.94026331230998,-0.0085194669663906,-0.0048341490328311,-0.0048341490328311,0.051217220723629,0.948782779276371,0.0492709167301655,0.0492709167301655,0.0614485368132591,-0.0614485368132591,-0.677373742784381,0.677373742784381,0.0,-0.0085194669663906,0.0,0.0,-0.0483510382473469,0.0483510382473469,-0.511126859213233,0.511126859213233,-0.0523995496332645,0.0523995496332645,-0.651289912040352,0.651289912040352,0.0,0.0,0.0,0.0,0.0,0.0,0.0,0.0,1.0,0,0.0,0.0,0.0,0.0,0.0,0.0,0.0,0.0,0.0,0.0,0.0,0.0,0.0,0.0,0.0,0.0,0.0,0.0,0.0,0.0,0.0,0.0,0.0,1.0,0.0,0.0,0.0,0.0,0.0,0.0,0.0,0.0,0.0,0.0,0.0,0.0,0.0,0.0,0.0,0.0,0.0,00-0030565,G.Smith,,00-0028049,E.Gates,,,,,,,,,,,,,,,,,,,,,,,,,,,,,,,,,,,,,,,,,,,,,,,,,,,,,,,,,,,,,,,,,0.0,,,,,,,,,,,,,,,,,,,,,,,,,,,,,,,,0.0,,,,,0,,,0.0,0.0,0.0,0.0,,,2013,0.659862399101257,-65.9862399101257,45,0,Punt,3143,"10/13/13, 13:02:48",2013-10-13T19:30:21Z,MetLife Stadium,"Temp: 62° F, Humidity: 68%, Wind: NE 10 - 18 mph",10012013-1013-062f-c66a-d1c31494e82c,0,0,PASS,0,,,,18,Punt,2013-10-13T19:28:02Z,6.0,1:48,2.0,0.0,0.0,4.0,4.0,0.0,KICKOFF,PUNT,12:09,10:21,NYJ 20,NYJ 47,3058.0,3213.0,19,6,Home,-13,25,-1.0,40.5,0,outdoors,fieldturf,62.0,10.0,Rex Ryan,Mike Tomlin,NYC01,MetLife Stadium,0,0.0,G.Smith,7.0,,,E.Gates,19.0,1,0,0.0,0,1,00-0030565,,00-0028049,G.Smith,7.0,00-0030565,E.Gates,00-0028049,E.Gates,00-0028049,0,0,-0.484684381168336,0.196363213858467,3.39621317616547,1.0,0.99716100806836,0.479330864618532,0.788167417049408,21.1832582950592,2013-10-13,E.Gates,2013,REG,NYJ,6,00-0028049,WR,Edmond Gates,Edmond,Gates,Knee,,Probable,Knee,,Limited Participation in Practice,2013-10-11T12:11:13Z,2013-10-11 12:11:13
3142,2013_20_SF_SEA,2014011901,SEA,SF,POST,20,SEA,home,SF,SF,10.0,2014-01-19,534.0,534.0,534.0,Half2,0,18.0,0,4,3.0,1,08:54,SF 10,10,-9.0,"(8:54) (Shotgun) 3-R.Wilson pass short middle to 15-J.Kearse to SF 1 for 9 yards (53-N.Bowman). FUMBLES (53-N.Bowman), recovered by SEA-24-M.Lynch at SF 1. 24-M.Lynch to SF 1 for no gain (35-E.Reid). SF-53-N.Bowman was injured during the play.",pass,9.0,1,0,1.0,0,0,0,short,middle,7.0,2.0,,,,,,,2,3,0.0,,,,,2.0,3.0,20,17,20.0,17.0,3.0,20.0,17.0,3.0,0.0393432714045048,0.0177987981587648,0.0004558989894576,0.0328951925039291,0.58819991350174,0.0030025870073586,0.318304300308228,0.0,0.0,3.71416047669482,0.319167289650068,4.77827287872788,-4.77827287872788,-2.11343469069104,2.11343469069104,1.81704369069807,-1.81704369069807,-0.786123131110799,1.10529042076087,-0.786123131110799,1.10529042076087,1.37643508793553,-1.37643508793553,6.06511937762843,-6.06511937762843,1.34501767135225,-1.34501767135225,3.95837153208008,-3.95837153208008,0.828494489192963,0.171505510807037,0.828494489192963,0.171505510807037,0.0101250410079956,0.0048279762268066,0.0048279762268066,0.838619530200958,0.161380469799042,0.840553760528565,0.840553760528565,-0.0884190712092297,0.0884190712092297,0.136795628446536,-0.136795628446536,0.0,0.0101250410079956,0.0,0.0101250410079956,0.134333002942996,-0.134333002942996,0.233944326639175,-0.233944326639175,0.559367704767184,-0.559367704767184,-0.368838906288147,0.368838906288147,0.0,0.0,0.0,0.0,0.0,1.0,0.0,0.0,0.0,0,0.0,0.0,0.0,0.0,0.0,0.0,0.0,0.0,0.0,0.0,0.0,1.0,0.0,0.0,1.0,0.0,0.0,0.0,0.0,0.0,0.0,0.0,0.0,1.0,0.0,0.0,0.0,0.0,0.0,0.0,0.0,0.0,0.0,0.0,1.0,1.0,0.0,0.0,0.0,0.0,0.0,00-0029263,R.Wilson,9.0,00-0029159,J.Kearse,9.0,,,,,,,,,,,,,,,,,,,,,,,,,,,,,,,,,,,,,,,,SF,00-0027894,N.Bowman,,,,SF,SF,00-0027894,00-0030548,N.Bowman,E.Reid,,,,,,,,,,,,,0.0,,,,,,,,,,,SEA,00-0029159,J.Kearse,,,,SEA,0.0,00-0025399,M.Lynch,,,,,,,,,,,,0.0,,,,,0,,,0.0,0.0,0.0,0.0,,,2013,0.638720810413361,36.1279189586639,39,0,Turnover on downs,3142,"1/19/14, 18:41:34",2014-01-20T02:19:39Z,Lumen Field,"Cloudy Temp: 43° F, Humidity: 88%, Wind: NE 1 mph",10012014-0119-0153-949b-c4b575af5f4c,0,0,PASS,0,,,,18,Turnover on downs,2014-01-20T02:17:22Z,4.0,1:49,0.0,1.0,0.0,4.0,4.0,-5.0,FUMBLE,DOWNS,10:07,08:18,SF 6,SF 1,3076.0,3180.0,17,23,Home,6,40,4.0,40.0,1,outdoors,fieldturf,43.0,1.0,Pete Carroll,Jim Harbaugh,SEA00,CenturyLink Field,0,1.0,R.Wilson,3.0,,,J.Kearse,15.0,1,0,0.0,0,1,00-0029263,,00-0029159,R.Wilson,3.0,00-0029263,J.Kearse,00-0029159,J.Kearse,00-0029159,0,1,0.319167289650068,1.61607770624552,1.65458354918519,2.0,0.598905057879165,0.314800561638549,0.908186316490173,9.18136835098267,2014-01-19,N.Bowman,2013,CON,SF,20,00-0027894,LB,Navorro Bowman,Navorro,Bowman,Wrist,,Probable,Wrist,,Full Participation in Practice,2014-01-17T15:33:52Z,2014-01-17 15:33:52
3126,2013_12_CAR_MIA,2013112406,MIA,CAR,REG,12,MIA,home,CAR,CAR,48.0,2013-11-24,46.0,946.0,946.0,Half2,0,20.0,0,3,1.0,0,00:46,CAR 48,20,5.0,(:46) (Shotgun) 17-R.Tannehill pass short right to 33-D.Thomas to CAR 48 for no gain (41-C.Munnerlyn) [97-M.Addison]. MIA-33-D.Thomas was injured during the play. His return is Questionable.,pass,0.0,1,0,1.0,0,0,0,short,right,-7.0,7.0,,,,,,,3,3,0.0,,,,,3.0,3.0,16,13,16.0,13.0,3.0,16.0,13.0,3.0,0.0455428548157215,0.100136198103428,0.0015318453079089,0.141328260302544,0.29754450917244,0.0048244814388454,0.409091860055923,0.0,0.0,2.47315540374257,-0.552696588914841,3.27668965427438,-3.27668965427438,-10.6519149320084,10.6519149320084,9.85778578266731,-9.85778578266731,-0.743573053972796,0.190876465057954,-0.743573053972796,0.190876465057954,4.9234773038617,-4.9234773038617,-0.414909108481709,0.414909108481709,10.4288087128508,-10.4288087128508,-2.83528219731626,2.83528219731626,0.754718661308289,0.245281338691711,0.754718661308289,0.245281338691711,-0.0239161849021912,-0.0243696570396423,-0.0243696570396423,0.730802476406097,0.269197523593903,0.616001784801483,0.616001784801483,-0.218277048692248,0.218277048692248,0.38302017387106,-0.38302017387106,0.0,-0.0239161849021912,0.0,-0.0239161849021912,-0.0582445934414864,0.0582445934414864,0.324424605929394,-0.324424605929394,-0.0629608407616615,0.0629608407616615,0.412205208205719,-0.412205208205719,0.0,0.0,0.0,0.0,0.0,0.0,0.0,0.0,0.0,0,0.0,0.0,0.0,0.0,0.0,0.0,0.0,0.0,0.0,0.0,0.0,0.0,0.0,0.0,1.0,0.0,0.0,0.0,0.0,0.0,0.0,1.0,0.0,1.0,0.0,0.0,0.0,0.0,0.0,0.0,0.0,0.0,0.0,0.0,0.0,1.0,0.0,0.0,0.0,0.0,0.0,00-0029701,R.Tannehill,0.0,00-0028000,D.Thomas,0.0,,,,,,,,,,,,,,,,,,,,,,,,,,,,,,,,,,,,00-0028339,M.Addison,,,,,,,,,CAR,,00-0026944,,C.Munnerlyn,,,,,,,,,,,,,,0.0,,,,,,,,,,,,,,,,,,,,,,,,,,,,,,,,0.0,,,,,0,,,0.0,0.0,0.0,0.0,,,2013,0.488700360059738,51.1299639940262,41,0,Punt,3126,"11/24/13, 13:03:14",2013-11-24T20:23:36Z,Hard Rock Stadium,"Cloudy Temp: 82° F, Humidity: 55%, Wind: NNE 13 mph",10012013-1124-0688-a61b-96c302977395,0,0,PASS,0,,,,20,Punt,2013-11-24T20:21:20Z,5.0,3:23,1.0,0.0,0.0,3.0,4.0,-10.0,PUNT,PUNT,02:33,14:10,CAR 50,CAR 45,3046.0,3217.0,20,16,Home,-4,36,-4.5,40.0,0,outdoors,grass,82.0,13.0,Joe Philbin,Ron Rivera,MIA00,Sun Life Stadium,0,0.0,R.Tannehill,17.0,,,D.Thomas,33.0,1,0,0.0,0,1,00-0029701,,00-0028000,R.Tannehill,17.0,00-0029701,D.Thomas,00-0028000,D.Thomas,00-0028000,0,1,-0.552696588914841,0.723334138690248,11.6464654273586,10.0,0.28245711553609,0.0649883285514079,0.691392481327057,30.8607518672943,2013-11-24,D.Thomas,2013,REG,MIA,12,00-0028000,RB,Daniel Thomas,Daniel,Thomas,Ribs,,Probable,Ribs,,Full Participation in Practice,2013-11-22T11:49:55Z,2013-11-22 11:49:55
3125,2013_09_MIN_DAL,2013110302,DAL,MIN,REG,9,MIN,away,DAL,MIN,71.0,2013-11-03,831.0,831.0,831.0,Half2,0,16.0,0,4,2.0,0,13:51,MIN 29,5,20.0,(13:51) 28-A.Peterson up the middle to MIN 30 for 1 yard (50-S.Lee; 97-J.Hatcher). DAL-97-J.Hatcher was injured during the play. His return is Questionable.,run,1.0,0,0,0.0,0,0,0,,,,,middle,,,,,,3,3,0.0,,,,,3.0,3.0,20,17,17.0,20.0,-3.0,17.0,20.0,-3.0,0.0466923899948597,0.151666730642319,0.0036031170748174,0.249748229980469,0.213807940483093,0.0028242256958037,0.331657379865646,0.0,0.0,0.75822989596054,-0.598680046852678,1.06307460879907,-1.06307460879907,-1.62837963640856,1.62837963640856,1.65731794102023,-1.65731794102023,,,0.0,0.0,5.03837364315405,-5.03837364315405,-2.59516226153937,2.59516226153937,9.74766383002861,-9.74766383002861,-10.6843479822992,10.6843479822992,0.349476486444473,0.650523513555527,0.650523513555527,0.349476486444473,-0.0327546894550324,-0.0346019864082336,0.0346019864082336,0.683278203010559,0.316721796989441,0.249608591198921,0.750391408801079,0.0833629094774575,-0.0833629094774575,0.0455033998979946,-0.0455033998979946,,,0.0,0.0,-0.0673979818820953,0.0673979818820953,0.159205632985621,-0.159205632985621,-0.0650629699230194,0.0650629699230194,0.0532247002730659,-0.0532247002730659,0.0,0.0,0.0,0.0,0.0,0.0,0.0,0.0,0.0,0,0.0,0.0,0.0,0.0,0.0,0.0,0.0,0.0,0.0,0.0,0.0,0.0,0.0,0.0,0.0,0.0,0.0,0.0,0.0,0.0,0.0,0.0,1.0,0.0,0.0,0.0,0.0,0.0,0.0,0.0,0.0,0.0,0.0,0.0,0.0,0.0,1.0,0.0,0.0,0.0,0.0,,,,,,,00-0025394,A.Peterson,1.0,,,,,,,,,,,,,,,,,,,,,,,,,,,,,,,,,,,,,,,,,,,,,,,,,00-0027663,S.Lee,DAL,00-0024307,J.Hatcher,DAL,,,,,,,0.0,,,,,,,,,,,,,,,,,,,,,,,,,,,,,,,,0.0,,,,,0,,,0.0,0.0,0.0,0.0,,,2013,,,44,0,Turnover,3125,"11/3/13, 13:02:54",2013-11-03T20:18:05Z,AT&T Stadium,"Temp: 61° F, Humidity: 40%, Wind: Southeast 6 mph",10012013-1103-023d-ee1b-bea14693d3d6,0,0,RUSH,0,,,,16,Turnover,2013-11-03T20:14:19Z,5.0,2:10,1.0,0.0,0.0,3.0,4.0,0.0,PUNT,INTERCEPTION,00:18,13:08,MIN 10,MIN 30,3042.0,3149.0,23,27,Home,4,50,10.0,51.0,0,closed,matrixturf,,,Jason Garrett,Leslie Frazier,DAL00,AT&T Stadium,0,0.0,,,A.Peterson,28.0,,,0,1,0.0,0,1,,00-0025394,,A.Peterson,28.0,00-0025394,A.Peterson,00-0025394,A.Peterson,00-0025394,0,0,-0.598680046852678,,,,,,0.505684614181519,-50.5684614181519,2013-11-03,J.Hatcher,2013,REG,DAL,9,00-0024307,DT,Jason Hatcher,Jason,Hatcher,Neck,,Probable,Neck,,Limited Participation in Practice,2013-11-01T11:07:12Z,2013-11-01 11:07:12
3114,2013_06_NO_NE,2013101310,NE,NO,REG,6,NE,home,NO,NO,32.0,2013-10-13,178.0,1078.0,1078.0,Half2,0,15.0,0,3,2.0,0,02:58,NO 32,10,55.0,"(2:58) 80-D.Amendola left end to NO 23 for 9 yards. NE-80-D.Amendola was injured during the play. reverse PENALTY on NE, Offensive Holding, 10 yards, enforced at NO 31.",run,1.0,0,0,0.0,0,0,0,,,,,left,end,,,,,3,2,0.0,,,,,3.0,2.0,17,17,17.0,17.0,0.0,17.0,17.0,0.0,0.0159296970814466,0.057274978607893,0.0007224507280625,0.0825117230415344,0.407497972249985,0.0023299066815525,0.433733284473419,0.0,0.0,3.51243482285645,-1.17757017153781,0.372722937651222,-0.372722937651222,-1.25914289843058,1.25914289843058,-1.22990158675082,1.22990158675082,,,0.0,0.0,-0.471612530294806,0.471612530294806,-0.247249540232588,0.247249540232588,-1.82732200337341,1.82732200337341,5.90816067844763,-5.90816067844763,0.641958117485046,0.358041882514954,0.641958117485046,0.358041882514954,-0.0503839254379273,-0.0481173992156982,-0.0481173992156982,0.591574192047119,0.408425807952881,0.656445801258087,0.656445801258087,-0.0219825371245593,0.0219825371245593,-0.0387046298989528,0.0387046298989528,,,0.0,0.0,0.0512907952070236,-0.0512907952070236,-0.0332705787429088,0.0332705787429088,-0.772078767418861,0.772078767418861,0.907755512832714,-0.907755512832714,0.0,0.0,0.0,0.0,0.0,0.0,0.0,0.0,0.0,0,0.0,0.0,0.0,0.0,0.0,0.0,0.0,0.0,0.0,0.0,0.0,0.0,0.0,0.0,0.0,0.0,1.0,0.0,0.0,0.0,0.0,0.0,1.0,0.0,0.0,0.0,0.0,0.0,0.0,0.0,0.0,0.0,0.0,0.0,0.0,0.0,0.0,0.0,0.0,0.0,0.0,,,,,,,00-0026035,D.Amendola,1.0,,,,,,,,,,,,,,,,,,,,,,,,,,,,,,,,,,,,,,,,,,,,,,,,,,,,,,,,,,,,,0.0,,,,,,,,,,,,,,,,,,,,,,,,,,,,,,,,0.0,NE,,,10.0,0,,Offensive Holding,0.0,0.0,0.0,0.0,,,2013,,,47,0,Field goal,3114,"10/13/13, 16:25:31",2013-10-13T22:36:22Z,Gillette Stadium,"Partly Cloudy Temp: 59° F, Humidity: 57%, Wind: ENE 7 mph",10012013-1013-10c2-27fa-d1c1f51d57b8,0,0,RUSH,0,,,,15,Field goal,2013-10-13T22:26:35Z,12.0,4:43,3.0,0.0,1.0,3.0,3.0,5.0,KICKOFF,FIELD_GOAL,06:19,01:36,NE 8,NO 37,2891.0,3200.0,27,30,Home,3,57,2.5,51.5,0,outdoors,fieldturf,59.0,7.0,Bill Belichick,Sean Payton,BOS00,Gillette Stadium,0,0.0,,,D.Amendola,80.0,,,0,1,0.0,0,1,,00-0026035,,D.Amendola,80.0,00-0026035,D.Amendola,00-0026035,D.Amendola,00-0026035,0,1,-1.17757017153781,,,,,,0.571482121944428,-57.1482121944428,2013-10-13,D.Amendola,2013,REG,NE,6,00-0026035,WR,Danny Amendola,Danny,Amendola,Groin,,Questionable,Groin,,Limited Participation in Practice,2013-10-11T12:25:07Z,2013-10-11 12:25:07
3104,2013_01_TB_NYJ,2013090807,NYJ,TB,REG,1,NYJ,home,TB,NYJ,75.0,2013-09-08,82.0,982.0,982.0,Half2,0,20.0,0,3,1.0,0,01:22,NYJ 25,10,8.0,(1:22) (Shotgun) 7-G.Smith pass short left to 84-S.Hill to NYJ 31 for 6 yards (38-D.Goldson). NYJ-84-S.Hill was injured during the play.,pass,6.0,1,0,1.0,0,0,0,short,left,5.0,1.0,,,,,,,3,3,0.0,,,,,3.0,3.0,12,14,12.0,14.0,-2.0,12.0,14.0,-2.0,0.0465183034539223,0.148080796003342,0.0025771560613066,0.214847564697266,0.222058087587357,0.003193796146661,0.362724334001541,0.0,0.0,1.25830254005268,0.163948663044721,-3.31242404116051,3.31242404116051,4.7248583107139,-4.7248583107139,-8.74193886223742,8.74193886223742,0.0121099194511771,0.151838743593544,0.0121099194511771,0.151838743593544,-2.39579608725035,2.39579608725035,3.04893443352194,-3.04893443352194,1.58021200497751,-1.58021200497751,-2.06026098052184,2.06026098052184,0.478550434112549,0.521449565887451,0.478550434112549,0.521449565887451,-0.002869427204132,-0.0027200579643249,-0.0027200579643249,0.475681006908417,0.524318993091583,0.333601027727127,0.333601027727127,0.388680270909544,-0.388680270909544,-0.361014288052915,0.361014288052915,0.0,-0.002869427204132,0.0,-0.002869427204132,0.116224019630275,-0.116224019630275,-0.136670927493294,0.136670927493294,0.116224019630275,-0.116224019630275,-0.157177160470208,0.157177160470208,0.0,0.0,0.0,0.0,0.0,0.0,0.0,0.0,0.0,0,0.0,0.0,0.0,0.0,0.0,0.0,0.0,0.0,0.0,0.0,0.0,0.0,0.0,0.0,1.0,0.0,0.0,0.0,0.0,0.0,0.0,0.0,0.0,1.0,0.0,0.0,0.0,0.0,0.0,0.0,0.0,0.0,0.0,0.0,0.0,1.0,0.0,0.0,0.0,0.0,0.0,00-0030565,G.Smith,6.0,00-0028995,S.Hill,6.0,,,,,,,,,,,,,,,,,,,,,,,,,,,,,,,,,,,,,,,,,,,,,,TB,,00-0025513,,D.Goldson,,,,,,,,,,,,,,0.0,,,,,,,,,,,,,,,,,,,,,,,,,,,,,,,,0.0,,,,,0,,,0.0,0.0,0.0,0.0,,,2013,0.729861676692963,27.0138323307037,40,0,Punt,3104,"9/8/13, 13:03:16",2013-09-08T19:24:45Z,MetLife Stadium,"Temp: 82° F, Humidity: 50%, Wind: WNW 9 mph",10012013-0908-07b9-a60c-9606054e01be,0,0,PASS,0,,,,20,Punt,2013-09-08T19:24:45Z,3.0,2:08,0.0,0.0,0.0,3.0,4.0,-5.0,PUNT,PUNT,01:22,14:14,NYJ 25,NYJ 33,3104.0,3212.0,17,18,Home,1,35,-4.0,40.0,0,outdoors,fieldturf,82.0,9.0,Rex Ryan,Greg Schiano,NYC01,MetLife Stadium,0,1.0,G.Smith,7.0,,,S.Hill,84.0,1,0,0.0,0,1,00-0030565,,00-0028995,G.Smith,7.0,00-0030565,S.Hill,00-0028995,S.Hill,00-0028995,0,0,0.163948663044721,0.430737361182061,3.94554521131067,2.0,0.986865733226296,0.264674764533993,0.490482538938522,50.9517461061478,2013-09-08,S.Hill,2013,REG,NYJ,1,00-0028995,WR,Stephen Hill,Stephen,Hill,Knee,,Probable,Knee,,Full Participation in Practice,2013-09-06T12:49:31Z,2013-09-06 12:49:31
3069,2013_16_TEN_JAX,2013122204,JAX,TEN,REG,16,JAX,home,TEN,JAX,53.0,2013-12-22,722.0,722.0,722.0,Half2,0,16.0,0,4,2.0,0,12:02,JAX 47,11,15.0,(12:02) 32-M.Jones-Drew up the middle to JAX 48 for 1 yard (91-D.Morgan). TEN-99-J.Casey was injured during the play.,run,1.0,0,0,0.0,0,0,0,,,,,middle,,,,,,3,3,0.0,,,,,3.0,3.0,16,20,16.0,20.0,-4.0,16.0,20.0,-4.0,0.0845774337649345,0.111787103116512,0.0017939117969945,0.164575845003128,0.269204944372177,0.0042910696938633,0.363769680261612,0.0,0.0,1.87160468637012,-0.55655126622878,-4.27414151682751,4.27414151682751,-11.0779929768178,11.0779929768178,3.98519204369211,-3.98519204369211,,,0.0,0.0,-9.75548828140018,9.75548828140018,10.5753197313065,-10.5753197313065,-17.2187545537308,17.2187545537308,21.2146469040786,-21.2146469040786,0.36085045337677,0.63914954662323,0.36085045337677,0.63914954662323,-0.0248492658138275,-0.0101592242717743,-0.0101592242717743,0.336001187562943,0.663998812437058,0.280574768781662,0.280574768781662,-0.309151534684803,0.309151534684803,0.116123047800147,-0.116123047800147,,,0.0,0.0,-0.0881950766769896,0.0881950766769896,-0.0042999054749126,0.0042999054749126,-0.0980728180138121,0.0980728180138121,0.114643875185717,-0.114643875185717,0.0,0.0,0.0,0.0,0.0,0.0,0.0,0.0,0.0,0,0.0,0.0,0.0,0.0,0.0,0.0,0.0,0.0,0.0,0.0,0.0,0.0,0.0,0.0,1.0,0.0,0.0,0.0,0.0,0.0,0.0,0.0,1.0,0.0,0.0,0.0,0.0,0.0,0.0,0.0,0.0,0.0,0.0,0.0,0.0,0.0,0.0,0.0,0.0,0.0,0.0,,,,,,,00-0024275,M.Jones-Drew,1.0,,,,,,,,,,,,,,,,,,,,,,,,,,,,,,,,,,,,,,,,,,,TEN,,00-0027868,,D.Morgan,,,,,,,,,,,,,,0.0,,,,,,,,,,,,,,,,,,,,,,,,,,,,,,,,0.0,,,,,0,,,0.0,0.0,0.0,0.0,,,2013,,,43,0,Punt,3069,"12/22/13, 13:02:49",2013-12-22T20:20:20Z,EverBank Stadium,"Temp: 79° F, Wind: SW 13 mph",10012013-1222-045a-0d08-f484287851fe,0,0,RUSH,0,,,,16,Punt,2013-12-22T20:17:16Z,6.0,3:42,1.0,0.0,0.0,4.0,4.0,0.0,KICKOFF,PUNT,14:25,10:43,JAX 36,TEN 49,2951.0,3119.0,20,16,Home,-4,36,-4.0,44.0,1,outdoors,grass,79.0,13.0,Gus Bradley,Mike Munchak,JAX00,EverBank Field,0,0.0,,,M.Jones-Drew,32.0,,,0,1,0.0,0,1,,00-0024275,,M.Jones-Drew,32.0,00-0024275,M.Jones-Drew,00-0024275,M.Jones-Drew,00-0024275,0,0,-0.55655126622878,,,,,,0.830588281154633,-83.0588281154633,2013-12-22,J.Casey,2013,REG,TEN,16,00-0028015,DT,Jurrell Casey,Jurrell,Casey,Shoulder,,Probable,Shoulder,,Full Participation in Practice,2013-12-20T11:02:09Z,2013-12-20 11:02:09
