play_id,game_id,old_game_id,home_team,away_team,season_type,week_x,posteam,posteam_type,defteam,side_of_field,yardline_100,game_date,quarter_seconds_remaining,half_seconds_remaining,game_seconds_remaining,game_half,quarter_end,drive,sp,qtr,down,goal_to_go,time,yrdln,ydstogo,ydsnet,desc,play_type,yards_gained,shotgun,no_huddle,qb_dropback,qb_kneel,qb_spike,qb_scramble,pass_length,pass_location,air_yards,yards_after_catch,run_location,run_gap,field_goal_result,kick_distance,extra_point_result,two_point_conv_result,home_timeouts_remaining,away_timeouts_remaining,timeout,timeout_team,td_team,td_player_name,td_player_id,posteam_timeouts_remaining,defteam_timeouts_remaining,total_home_score,total_away_score,posteam_score,defteam_score,score_differential,posteam_score_post,defteam_score_post,score_differential_post,no_score_prob,opp_fg_prob,opp_safety_prob,opp_td_prob,fg_prob,safety_prob,td_prob,extra_point_prob,two_point_conversion_prob,ep,epa,total_home_epa,total_away_epa,total_home_rush_epa,total_away_rush_epa,total_home_pass_epa,total_away_pass_epa,air_epa,yac_epa,comp_air_epa,comp_yac_epa,total_home_comp_air_epa,total_away_comp_air_epa,total_home_comp_yac_epa,total_away_comp_yac_epa,total_home_raw_air_epa,total_away_raw_air_epa,total_home_raw_yac_epa,total_away_raw_yac_epa,wp,def_wp,home_wp,away_wp,wpa,vegas_wpa,vegas_home_wpa,home_wp_post,away_wp_post,vegas_wp,vegas_home_wp,total_home_rush_wpa,total_away_rush_wpa,total_home_pass_wpa,total_away_pass_wpa,air_wpa,yac_wpa,comp_air_wpa,comp_yac_wpa,total_home_comp_air_wpa,total_away_comp_air_wpa,total_home_comp_yac_wpa,total_away_comp_yac_wpa,total_home_raw_air_wpa,total_away_raw_air_wpa,total_home_raw_yac_wpa,total_away_raw_yac_wpa,punt_blocked,first_down_rush,first_down_pass,first_down_penalty,third_down_converted,third_down_failed,fourth_down_converted,fourth_down_failed,incomplete_pass,touchback,interception,punt_inside_twenty,punt_in_endzone,punt_out_of_bounds,punt_downed,punt_fair_catch,kickoff_inside_twenty,kickoff_in_endzone,kickoff_out_of_bounds,kickoff_downed,kickoff_fair_catch,fumble_forced,fumble_not_forced,fumble_out_of_bounds,solo_tackle,safety,penalty,tackled_for_loss,fumble_lost,own_kickoff_recovery,own_kickoff_recovery_td,qb_hit,rush_attempt,pass_attempt,sack,touchdown,pass_touchdown,rush_touchdown,return_touchdown,extra_point_attempt,two_point_attempt,field_goal_attempt,kickoff_attempt,punt_attempt,fumble,complete_pass,assist_tackle,lateral_reception,lateral_rush,lateral_return,lateral_recovery,passer_player_id,passer_player_name,passing_yards,receiver_player_id,receiver_player_name,receiving_yards,rusher_player_id,rusher_player_name,rushing_yards,lateral_receiver_player_id,lateral_receiver_player_name,lateral_receiving_yards,lateral_rusher_player_id,lateral_rusher_player_name,lateral_rushing_yards,lateral_sack_player_id,lateral_sack_player_name,interception_player_id,interception_player_name,lateral_interception_player_id,lateral_interception_player_name,punt_returner_player_id,punt_returner_player_name,lateral_punt_returner_player_id,lateral_punt_returner_player_name,kickoff_returner_player_name,kickoff_returner_player_id,lateral_kickoff_returner_player_id,lateral_kickoff_returner_player_name,punter_player_id,punter_player_name,kicker_player_name,kicker_player_id,own_kickoff_recovery_player_id,own_kickoff_recovery_player_name,blocked_player_id,blocked_player_name,tackle_for_loss_1_player_id,tackle_for_loss_1_player_name,tackle_for_loss_2_player_id,tackle_for_loss_2_player_name,qb_hit_1_player_id,qb_hit_1_player_name,qb_hit_2_player_id,qb_hit_2_player_name,forced_fumble_player_1_team,forced_fumble_player_1_player_id,forced_fumble_player_1_player_name,forced_fumble_player_2_team,forced_fumble_player_2_player_id,forced_fumble_player_2_player_name,solo_tackle_1_team,solo_tackle_2_team,solo_tackle_1_player_id,solo_tackle_2_player_id,solo_tackle_1_player_name,solo_tackle_2_player_name,assist_tackle_1_player_id,assist_tackle_1_player_name,assist_tackle_1_team,assist_tackle_2_player_id,assist_tackle_2_player_name,assist_tackle_2_team,assist_tackle_3_player_id,assist_tackle_3_player_name,assist_tackle_3_team,assist_tackle_4_player_id,assist_tackle_4_player_name,assist_tackle_4_team,tackle_with_assist,tackle_with_assist_1_player_id,tackle_with_assist_1_player_name,tackle_with_assist_1_team,tackle_with_assist_2_player_id,tackle_with_assist_2_player_name,tackle_with_assist_2_team,pass_defense_1_player_id,pass_defense_1_player_name,pass_defense_2_player_id,pass_defense_2_player_name,fumbled_1_team,fumbled_1_player_id,fumbled_1_player_name,fumbled_2_player_id,fumbled_2_player_name,fumbled_2_team,fumble_recovery_1_team,fumble_recovery_1_yards,fumble_recovery_1_player_id,fumble_recovery_1_player_name,fumble_recovery_2_team,fumble_recovery_2_yards,fumble_recovery_2_player_id,fumble_recovery_2_player_name,sack_player_id,sack_player_name,half_sack_1_player_id,half_sack_1_player_name,half_sack_2_player_id,half_sack_2_player_name,return_team,return_yards,penalty_team,penalty_player_id,penalty_player_name,penalty_yards,replay_or_challenge,replay_or_challenge_result,penalty_type,defensive_two_point_attempt,defensive_two_point_conv,defensive_extra_point_attempt,defensive_extra_point_conv,safety_player_name,safety_player_id,season_x,cp,cpoe,series,series_success,series_result,order_sequence,start_time,time_of_day,stadium,weather,nfl_api_id,play_clock,play_deleted,play_type_nfl,special_teams_play,st_play_type,end_clock_time,end_yard_line,fixed_drive,fixed_drive_result,drive_real_start_time,drive_play_count,drive_time_of_possession,drive_first_downs,drive_inside20,drive_ended_with_score,drive_quarter_start,drive_quarter_end,drive_yards_penalized,drive_start_transition,drive_end_transition,drive_game_clock_start,drive_game_clock_end,drive_start_yard_line,drive_end_yard_line,drive_play_id_started,drive_play_id_ended,away_score,home_score,location,result,total,spread_line,total_line,div_game,roof,surface,temp,wind,home_coach,away_coach,stadium_id,game_stadium,aborted_play,success,passer,passer_jersey_number,rusher,rusher_jersey_number,receiver,receiver_jersey_number,pass,rush,first_down,special,play,passer_id,rusher_id,receiver_id,name,jersey_number,id,fantasy_player_name,fantasy_player_id,fantasy,fantasy_id,out_of_bounds,home_opening_kickoff,qb_epa,xyac_epa,xyac_mean_yardage,xyac_median_yardage,xyac_success,xyac_fd,xpass,pass_oe,date_x,injured_player,season_y,game_type,team,week_y,gsis_id,position,full_name,first_name,last_name,report_primary_injury,report_secondary_injury,report_status,practice_primary_injury,practice_secondary_injury,practice_status,date_modified,date_y
4082,2010_05_GB_WAS,2010101003,WAS,GB,REG,5,WAS,home,GB,WAS,57.0,2010-10-10,1.0,1.0,1.0,Half2,0,26.0,0,4,1.0,0,00:01,WAS 43,10,0.0,(:01) (Shotgun) 5-D.McNabb pass deep right intended for 13-A.Armstrong INTERCEPTED by 38-T.Williams at GB 3. 38-T.Williams to WAS 33 for 64 yards (71-T.Williams). WAS-71-T.Williams was injured during the play. His return is Questionable. Left knee,pass,0.0,1,0,1.0,0,0,0,deep,right,54.0,,,,,,,,1,0,0.0,,,,,1.0,0.0,13,13,13.0,13.0,0.0,13.0,13.0,0.0,0.962897300720215,0.0009107693913392,0.0006117859156802,0.0036938772536814,0.0262666866183281,0.0002126061590388,0.00540701020509,0.0,0.0,0.0872613228275441,-0.0872613228275441,-2.4193010579038,2.4193010579038,-10.2095589678502,10.2095589678502,0.934489171371069,-0.934489171371069,-0.0872613228275441,0.0,0.0,0.0,-0.161517199303489,0.161517199303489,5.18719229300041,-5.18719229300041,20.1261159291898,-20.1261159291898,-17.9627334520368,17.9627334520368,0.648124814033508,0.351875185966492,0.648124814033508,0.351875185966492,-0.174222838599235,-0.188015174586326,-0.188015174586326,0.473901975434274,0.526098024565727,0.661917150020599,0.661917150020599,-0.383973732590675,0.383973732590675,-0.227551765792173,0.227551765792173,-0.648124814033508,0.473901975434274,0.0,0.0,0.175976757373559,-0.175976757373559,0.0948220193386078,-0.0948220193386078,0.231430236663568,-0.231430236663568,-0.458489623386413,0.458489623386413,0.0,0.0,0.0,0.0,0.0,0.0,0.0,0.0,0.0,0,1.0,0.0,0.0,0.0,0.0,0.0,0.0,0.0,0.0,0.0,0.0,0.0,0.0,0.0,1.0,0.0,0.0,0.0,0.0,0.0,0.0,0.0,0.0,1.0,0.0,0.0,0.0,0.0,0.0,0.0,0.0,0.0,0.0,0.0,0.0,0.0,0.0,0.0,0.0,0.0,0.0,00-0011022,D.McNabb,,00-0026465,A.Armstrong,,,,,,,,,,,,,00-0024061,T.Williams,,,,,,,,,,,,,,,,,,,,,,,,,,,,,,,,,WAS,,00-0027857,,T.Williams,,,,,,,,,,,,,,0.0,,,,,,,00-0024061,T.Williams,,,,,,,,,,,,,,,,,,,,,,,GB,64.0,,,,,0,,,0.0,0.0,0.0,0.0,,,2010,0.263642460107803,-26.3642460107803,58,0,Turnover,4082,"10/10/10, 13:02:55",2010-10-10T20:11:37Z,Commanders Field,"Sunny Temp: 72° F, Humidity: 46%, Wind: Calm mph",10012010-1010-03c9-144a-ddffa43694d4,0,0,INTERCEPTION,0,,,,26,Turnover,2010-10-10T20:11:37Z,1.0,0:01,0.0,0.0,0.0,4.0,4.0,0.0,MISSED_FG,INTERCEPTION,00:01,00:00,WAS 43,WAS 43,4082.0,4082.0,13,16,Home,3,29,-2.5,45.5,0,outdoors,grass,72.0,0.0,Mike Shanahan,Mike McCarthy,WAS00,FedExField,0,0.0,D.McNabb,5.0,,,A.Armstrong,13.0,1,0,0.0,0,1,00-0011022,,00-0026465,D.McNabb,5.0,00-0011022,A.Armstrong,00-0026465,A.Armstrong,00-0026465,0,0,-0.0872613228275441,5.37168618943435,1.93037592690962,3.0,1.0,1.0,0.87589818239212,12.410181760788,2010-10-10,T.Williams,2010,REG,WAS,5,00-0027857,T,Trent Williams,Trent,Williams,Toe,,Questionable,Toe,,Limited Participation in Practice,2010-10-08T11:53:24Z,2010-10-08 11:53:24
4080,2010_11_WAS_TEN,2010112108,TEN,WAS,REG,11,TEN,home,WAS,TEN,67.0,2010-11-21,893.0,893.0,893.0,Overtime,0,21.0,0,5,1.0,0,14:53,TEN 33,10,15.0,(14:53) 28-C.Johnson right tackle to TEN 48 for 15 yards (37-R.Doughty). WAS-64-K.Golston was injured during the play. His return is Questionable.,run,15.0,0,0,0.0,0,0,0,,,,,right,tackle,,,,,2,2,0.0,,,,,2.0,2.0,16,16,16.0,16.0,0.0,16.0,16.0,0.0,0.0749478489160538,0.139885917305946,0.0015034375246614,0.18067966401577,0.252446681261063,0.0057703242637217,0.344766110181808,0.0,0.0,1.49482118850574,1.0359836674761,-0.368162132101133,0.368162132101133,6.13619764550822,-6.13619764550822,-10.7079647939066,10.7079647939066,,,0.0,0.0,-0.540413374044413,0.540413374044413,-14.3045092910955,14.3045092910955,1.5995268809279,-1.5995268809279,-13.6604733870175,13.6604733870175,0.602983115706593,0.397016884293407,0.602983115706593,0.397016884293407,0.106565761845559,0.106565761845559,0.106565761845559,0.709548877552152,0.290451122447848,0.602983115706593,0.602983115706593,0.545332628767937,-0.545332628767937,-0.653472695194981,0.653472695194981,,,0.0,0.0,-0.338860083066723,0.338860083066723,-0.610555693507195,0.610555693507195,-0.294847596132061,0.294847596132061,-0.427139148116112,0.427139148116112,0.0,1.0,0.0,0.0,0.0,0.0,0.0,0.0,0.0,0,0.0,0.0,0.0,0.0,0.0,0.0,0.0,0.0,0.0,0.0,0.0,0.0,0.0,0.0,1.0,0.0,0.0,0.0,0.0,0.0,0.0,0.0,1.0,0.0,0.0,0.0,0.0,0.0,0.0,0.0,0.0,0.0,0.0,0.0,0.0,0.0,0.0,0.0,0.0,0.0,0.0,,,,,,,00-0026164,C.Johnson,15.0,,,,,,,,,,,,,,,,,,,,,,,,,,,,,,,,,,,,,,,,,,,WAS,,00-0024387,,R.Doughty,,,,,,,,,,,,,,0.0,,,,,,,,,,,,,,,,,,,,,,,,,,,,,,,,0.0,,,,,0,,,0.0,0.0,0.0,0.0,,,2010,,,61,1,First down,4080,"11/21/10, 13:03:56",2010-11-21T21:07:44Z,Nissan Stadium,"Sunny Temp: 66° F, Humidity: 53%, Wind: SW 12 mph",10012010-1121-08a1-7832-48c1464dc18c,0,0,RUSH,0,,,,21,Punt,2010-11-21T21:06:59Z,4.0,1:34,1.0,0.0,0.0,5.0,5.0,0.0,KICKOFF,PUNT,15:00,13:26,TEN 33,TEN 48,4058.0,4170.0,19,16,Home,-3,35,7.0,44.0,0,outdoors,grass,66.0,12.0,Jeff Fisher,Mike Shanahan,NAS00,LP Field,0,1.0,,,C.Johnson,28.0,,,0,1,1.0,0,1,,00-0026164,,C.Johnson,28.0,00-0026164,C.Johnson,00-0026164,C.Johnson,00-0026164,0,0,1.0359836674761,,,,,,0.506736874580383,-50.6736874580383,2010-11-21,K.Golston,2010,REG,WAS,11,00-0024410,DE,Kedric Golston,Kedric,Golston,Elbow,,Questionable,Elbow,,Limited Participation in Practice,2010-11-19T11:23:20Z,2010-11-19 11:23:20
3994,2010_16_DET_MIA,2010122607,MIA,DET,REG,16,MIA,home,DET,DET,30.0,2010-12-26,131.0,131.0,131.0,Half2,0,24.0,0,4,,0,02:11,DET 30,0,64.0,"3-D.Rayner kicks 62 yards from DET 30 to MIA 8. 38-P.Cobbs to MIA 16 for 8 yards (38-P.Miller). DET-52-V.Ciurciu was injured during the play. PENALTY on MIA-53-A.Spitler, Illegal Block Above the Waist, 8 yards, enforced at MIA 16.",kickoff,0.0,0,0,0.0,0,0,0,,,,,,,,62.0,,,1,1,0.0,,,,,1.0,1.0,27,34,27.0,34.0,-7.0,27.0,34.0,-7.0,0.63833886384964,0.0552566647529602,0.0014039725065231,0.0580207593739033,0.10639289021492,0.0021060190629214,0.138480797410011,0.0,0.0,0.718033035751432,-0.45911943144165,-10.307661489064,10.307661489064,5.27100886955113,-5.27100886955113,-8.45336173337527,8.45336173337527,,,0.0,0.0,-1.35015803447459,1.35015803447459,0.613961475406541,-0.613961475406541,-0.96186988503905,0.96186988503905,-7.87129196484201,7.87129196484201,0.122274160385132,0.877725839614868,0.122274160385132,0.877725839614868,-0.0305874571204186,-0.0215935036540031,-0.0215935036540031,0.0916867032647133,0.908313296735287,0.125874027609825,0.125874027609825,0.207998718976462,-0.207998718976462,-0.355348957146274,0.355348957146274,,,0.0,0.0,0.0942820304510683,-0.0942820304510683,0.0010815162667189,-0.0010815162667189,0.145976483213672,-0.145976483213672,-0.548357528401251,0.548357528401251,0.0,0.0,0.0,0.0,0.0,0.0,0.0,0.0,0.0,0,0.0,0.0,0.0,0.0,0.0,0.0,1.0,0.0,0.0,0.0,0.0,0.0,0.0,0.0,1.0,0.0,1.0,0.0,0.0,0.0,0.0,0.0,0.0,0.0,0.0,0.0,0.0,0.0,0.0,0.0,0.0,0.0,1.0,0.0,0.0,0.0,0.0,0.0,0.0,0.0,0.0,,,,,,,,,,,,,,,,,,,,,,,,,,P.Cobbs,00-0024172,,,,,D.Rayner,00-0023635,,,,,,,,,,,,,,,,,,,DET,,00-0027562,,P.Miller,,,,,,,,,,,,,,0.0,,,,,,,,,,,,,,,,,,,,,,,,,,,,,,,MIA,8.0,MIA,00-0027843,A.Spitler,8.0,0,,Illegal Block Above the Waist,0.0,0.0,0.0,0.0,,,2010,,,55,1,First down,3994,"12/26/10, 13:03:04",2010-12-26T20:57:51Z,Hard Rock Stadium,"Sunny Temp: 69° F, Humidity: 47%, Wind: WNW 22 mph",10012010-1226-073a-28eb-30baa4fc2f45,0,0,KICK_OFF,1,,,,24,End of half,2010-12-26T20:57:51Z,10.0,2:11,4.0,0.0,0.0,4.0,4.0,4.0,KICKOFF,END_GAME,02:11,00:00,MIA 8,DET 28,3994.0,4382.0,34,27,Home,-7,61,3.5,41.0,0,outdoors,grass,69.0,22.0,Tony Sparano,Jim Schwartz,MIA00,Sun Life Stadium,0,0.0,,,,,,,0,0,0.0,1,0,,,,,,,,,,,0,0,-0.45911943144165,,,,,,,,2010-12-26,V.Ciurciu,2010,REG,DET,16,00-0021493,LB,Vinny Ciurciu,Vinny,Ciurciu,Concussion,,Probable,Concussion,,Full Participation in Practice,2010-12-24T12:49:24Z,2010-12-24 12:49:24
3973,2010_06_BAL_NE,2010101702,NE,BAL,REG,6,BAL,away,NE,BAL,76.0,2010-10-17,59.0,59.0,59.0,Half2,0,20.0,0,4,4.0,0,00:59,BAL 24,6,4.0,"(:59) 4-S.Koch punts 51 yards to NE 25, Center-46-M.Cox. 83-W.Welker to NE 47 for 22 yards (11-M.Smith). BAL-50-E.Jones was injured during the play.",punt,0.0,0,0,0.0,0,0,0,,,,,,,,51.0,,,2,2,0.0,,,,,2.0,2.0,20,20,20.0,20.0,0.0,20.0,20.0,0.0,0.754593849182129,0.121557265520096,0.0020831038709729,0.0461892113089562,0.0423458777368069,0.0005369962309487,0.0326936542987824,0.0,0.0,-0.335195277701132,-1.05870097549632,-1.81799024913926,1.81799024913926,9.21631476914631,-9.21631476914631,-12.1397661100798,12.1397661100798,,,0.0,0.0,-3.86393488827162,3.86393488827162,-0.456980195292887,0.456980195292887,4.60128738271305,-4.60128738271305,-17.8993984308634,17.8993984308634,0.449355989694595,0.550644010305405,0.550644010305405,0.449355989694595,-0.135822504758835,-0.204391658306122,0.204391658306122,0.68646651506424,0.313533484935761,0.471765577793121,0.528234422206879,0.213875072266341,-0.213875072266341,-0.269264770753045,0.269264770753045,,,0.0,0.0,-0.297032862687173,0.297032862687173,0.214378522413178,-0.214378522413178,-0.300098389172616,0.300098389172616,-0.0123982264824671,0.0123982264824671,0.0,0.0,0.0,0.0,0.0,0.0,0.0,0.0,0.0,0,0.0,0.0,0.0,0.0,0.0,0.0,0.0,0.0,0.0,0.0,0.0,0.0,0.0,0.0,1.0,0.0,0.0,0.0,0.0,0.0,0.0,0.0,0.0,0.0,0.0,0.0,0.0,0.0,0.0,0.0,0.0,0.0,0.0,1.0,0.0,0.0,0.0,0.0,0.0,0.0,0.0,,,,,,,,,,,,,,,,,,,,,,00-0022427,W.Welker,,,,,,,00-0024417,S.Koch,,,,,,,,,,,,,,,,,,,,,BAL,,00-0026246,,M.Smith,,,,,,,,,,,,,,0.0,,,,,,,,,,,,,,,,,,,,,,,,,,,,,,,NE,22.0,,,,,0,,,0.0,0.0,0.0,0.0,,,2010,,,56,0,Punt,3973,"10/17/10, 13:02:41",2010-10-17T19:58:23Z,Gillette Stadium,"Sunny Temp: 57° F, Wind: WNW 14 mph",10012010-1017-02d3-d0cd-8b20d88ab4a2,0,0,PUNT,1,,,,20,Punt,2010-10-17T19:55:32Z,3.0,1:06,0.0,0.0,0.0,4.0,4.0,0.0,KICKOFF,PUNT,01:51,00:45,BAL 20,BAL 24,3890.0,3973.0,20,23,Home,3,43,3.0,44.5,0,outdoors,fieldturf,57.0,14.0,Bill Belichick,John Harbaugh,BOS00,Gillette Stadium,0,0.0,,,,,,,0,0,0.0,1,0,,,,,,,,,,,0,0,-1.05870097549632,,,,,,,,2010-10-17,E.Jones,2010,REG,BAL,6,00-0024714,TE,Edgar Jones,Edgar,Jones,Thigh,,Probable,Thigh,,Limited Participation in Practice,2010-10-15T11:56:08Z,2010-10-15 11:56:08
3873,2010_10_NE_PIT,2010111411,PIT,NE,REG,10,PIT,home,NE,NE,23.0,2010-11-14,437.0,437.0,437.0,Half2,0,20.0,0,4,1.0,0,07:17,NE 23,10,53.0,"(7:17) (No Huddle, Shotgun) 7-B.Roethlisberger pass short left to 88-E.Sanders to NE 15 for 8 yards (25-P.Chung). NE-25-P.Chung was injured during the play. Penalty on NE-95-T.Banta-Cain, Defensive Offside, declined.",pass,8.0,1,1,1.0,0,0,0,short,left,3.0,5.0,,,,,,,3,3,0.0,,,,,3.0,3.0,10,29,10.0,29.0,-19.0,10.0,29.0,-19.0,0.058870442211628,0.0228591021150351,0.0004678571713157,0.0359078794717789,0.378994166851044,0.0015626912936568,0.501337826251984,0.0,0.0,4.32860448991414,0.536655919218902,-18.2582697167469,18.2582697167469,-0.415483636257704,0.415483636257704,-26.6605181304103,26.6605181304103,-0.217333666107152,0.753989585326053,-0.217333666107152,0.753989585326053,-5.29881227918668,5.29881227918668,-6.67632383084361,6.67632383084361,9.4262253533816,-9.4262253533816,-30.1066448191039,30.1066448191039,0.0089419642463326,0.991058035753667,0.0089419642463326,0.991058035753667,0.0006266990676522,0.0017184587195515,0.0017184587195515,0.0095686633139848,0.990431336686015,0.0082429945468902,0.0082429945468902,-0.0571921374595792,0.0571921374595792,-0.674505243751412,0.674505243751412,0.0,0.0006266990676522,0.0,0.0006266990676522,-0.0316046936800657,0.0316046936800657,-0.320405925888765,0.320405925888765,-0.268155963568944,0.268155963568944,-0.28771109784193,0.28771109784193,0.0,0.0,0.0,0.0,0.0,0.0,0.0,0.0,0.0,0,0.0,0.0,0.0,0.0,0.0,0.0,0.0,0.0,0.0,0.0,0.0,0.0,0.0,0.0,1.0,0.0,0.0,0.0,0.0,0.0,0.0,0.0,0.0,1.0,0.0,0.0,0.0,0.0,0.0,0.0,0.0,0.0,0.0,0.0,0.0,1.0,0.0,0.0,0.0,0.0,0.0,00-0022924,B.Roethlisberger,8.0,00-0027685,E.Sanders,8.0,,,,,,,,,,,,,,,,,,,,,,,,,,,,,,,,,,,,,,,,,,,,,,NE,,00-0027010,,P.Chung,,,,,,,,,,,,,,0.0,,,,,,,,,,,,,,,,,,,,,,,,,,,,,,,,0.0,,,,,0,,,0.0,0.0,0.0,0.0,,,2010,0.742526769638062,25.7473230361939,58,1,Touchdown,3873,"11/14/10, 20:42:09",2010-11-15T04:26:50Z,Acrisure Stadium,"Cloudy Temp: 49° F, Humidity: 86%, Wind: From SW 8 mph",10012010-1114-1124-465a-6bf121fde33b,0,0,PASS,0,,,,20,Touchdown,2010-11-15T04:23:49Z,5.0,1:48,3.0,1.0,1.0,4.0,4.0,0.0,KICKOFF,TOUCHDOWN,08:32,06:44,PIT 47,NE 15,3767.0,3931.0,39,26,Home,-13,65,4.5,44.5,0,outdoors,grass,49.0,8.0,Mike Tomlin,Bill Belichick,PIT00,Heinz Field,0,1.0,B.Roethlisberger,7.0,,,E.Sanders,88.0,1,0,0.0,0,1,00-0022924,,00-0027685,B.Roethlisberger,7.0,00-0022924,E.Sanders,00-0027685,E.Sanders,00-0027685,0,1,0.536655919218902,0.540379779040419,4.39662044774741,3.0,0.670664617617149,0.232003422279377,0.895030200481415,10.4969799518585,2010-11-14,P.Chung,2010,REG,NE,10,00-0027010,S,Patrick Chung,Patrick,Chung,Knee,,Questionable,Knee,,Limited Participation in Practice,2010-11-12T12:52:32Z,2010-11-12 12:52:32
3860,2010_16_WAS_JAX,2010122608,JAX,WAS,REG,16,JAX,home,WAS,WAS,40.0,2010-12-26,205.0,205.0,205.0,Half2,0,25.0,0,4,2.0,0,03:25,WAS 40,8,42.0,(3:25) 9-D.Garrard pass deep left to 83-J.Hill to WAS 20 for 20 yards (31-P.Buchanon). WAS-76-A.Bryant was injured during the play. His return is Questionable.,pass,20.0,0,0,1.0,0,0,0,deep,left,20.0,0.0,,,,,,,3,3,0.0,,,,,3.0,3.0,10,17,10.0,17.0,-7.0,10.0,17.0,-7.0,0.297176629304886,0.0522415898740292,0.000310839357553,0.0686819329857826,0.256273537874222,0.0042907656170427,0.321024745702744,0.0,0.0,2.38645538553828,1.77386735531036,-5.52650012885419,5.52650012885419,-6.86685548193054,6.86685548193054,7.51823182954025,-7.51823182954025,1.77386735531036,0.0,1.77386735531036,0.0,1.39489380256133,-1.39489380256133,10.7394220585707,-10.7394220585707,2.23475364051852,-2.23475364051852,10.8932939473837,-10.8932939473837,0.216020092368126,0.783979907631874,0.216020092368126,0.783979907631874,0.103511705994606,0.101189091801643,0.101189091801643,0.319531798362732,0.680468201637268,0.249942377209663,0.249942377209663,-0.33241512903392,0.33241512903392,0.117391592268576,-0.117391592268576,0.103511705994606,0.0,0.103511705994606,0.0,0.0864711682059916,-0.0864711682059916,0.171341427165841,-0.171341427165841,0.0864711682059916,-0.0864711682059916,0.256996818382119,-0.256996818382119,0.0,0.0,1.0,0.0,0.0,0.0,0.0,0.0,0.0,0,0.0,0.0,0.0,0.0,0.0,0.0,0.0,0.0,0.0,0.0,0.0,0.0,0.0,0.0,1.0,0.0,0.0,0.0,0.0,0.0,0.0,0.0,0.0,1.0,0.0,0.0,0.0,0.0,0.0,0.0,0.0,0.0,0.0,0.0,0.0,1.0,0.0,0.0,0.0,0.0,0.0,00-0021231,D.Garrard,20.0,00-0025463,J.Hill,20.0,,,,,,,,,,,,,,,,,,,,,,,,,,,,,,,,,,,,,,,,,,,,,,WAS,,00-0021151,,P.Buchanon,,,,,,,,,,,,,,0.0,,,,,,,,,,,,,,,,,,,,,,,,,,,,,,,,0.0,,,,,0,,,0.0,0.0,0.0,0.0,,,2010,0.442767888307571,55.7232111692429,47,1,First down,3860,"12/26/10, 13:03:43",2010-12-26T20:56:13Z,EverBank Stadium,"Temp: 38° F, Humidity: 64%, Wind: NW 18 Gusting to 29 mph",10012010-1226-0883-f450-210107857ce1,0,0,PASS,0,,,,25,Touchdown,2010-12-26T20:55:37Z,4.0,1:16,2.0,0.0,1.0,4.0,4.0,0.0,PUNT,TOUCHDOWN,04:00,02:44,WAS 42,WAS 20,3839.0,3931.0,20,17,Home,-3,37,7.0,45.5,0,outdoors,grass,38.0,18.0,Jack Del Rio,Mike Shanahan,JAX00,EverBank Field,0,1.0,D.Garrard,9.0,,,J.Hill,83.0,1,0,1.0,0,1,00-0021231,,00-0025463,D.Garrard,9.0,00-0021231,J.Hill,00-0025463,J.Hill,00-0025463,0,0,1.77386735531036,0.615801740991349,4.88187739695422,2.0,1.0,1.0,0.86446487903595,13.553512096405,2010-12-26,A.Bryant,2010,REG,WAS,16,00-0023611,DT,Anthony Bryant,Anthony,Bryant,,,,Back,,Limited Participation in Practice,2010-12-22T12:19:07Z,2010-12-22 12:19:07
3853,2010_06_ATL_PHI,2010101706,PHI,ATL,REG,6,PHI,home,ATL,ATL,15.0,2010-10-17,232.0,232.0,232.0,Half2,0,23.0,0,4,3.0,0,03:52,ATL 15,8,32.0,(3:52) 34-E.Buckley right guard to ATL 12 for 3 yards (91-C.Peters). ATL-50-C.Lofton was injured during the play. His return is Probable.,run,3.0,0,0,0.0,0,0,0,,,,,right,guard,,,,,3,0,0.0,,,,,3.0,0.0,28,17,28.0,17.0,11.0,28.0,17.0,11.0,0.225649744272232,0.0093988869339227,0.0002976725518237,0.0294557176530361,0.500835299491882,0.0019338156562298,0.232428848743439,0.0,0.0,2.89839344151551,-0.147454981959416,12.6671610990048,-12.6671610990048,2.51070861996556,-2.51070861996556,12.9880225740763,-12.9880225740763,,,0.0,0.0,1.63366866233991,-1.63366866233991,2.64647804334393,-2.64647804334393,-17.8427889339218,17.8427889339218,28.5076609966327,-28.5076609966327,0.989522039890289,0.0104779601097107,0.989522039890289,0.0104779601097107,0.0057582259178161,0.0025839209556579,0.0025839209556579,0.995280265808105,0.0047197341918945,0.994931399822235,0.994931399822235,0.141566472818502,-0.141566472818502,0.244716899608436,-0.244716899608436,,,0.0,0.0,0.0289473357082749,-0.0289473357082749,0.0329113231094957,-0.0329113231094957,0.0343218418241883,-0.0343218418241883,0.129219797538447,-0.129219797538447,0.0,0.0,0.0,0.0,0.0,1.0,0.0,0.0,0.0,0,0.0,0.0,0.0,0.0,0.0,0.0,0.0,0.0,0.0,0.0,0.0,0.0,0.0,0.0,1.0,0.0,0.0,0.0,0.0,0.0,0.0,0.0,1.0,0.0,0.0,0.0,0.0,0.0,0.0,0.0,0.0,0.0,0.0,0.0,0.0,0.0,0.0,0.0,0.0,0.0,0.0,,,,,,,00-0024738,E.Buckley,3.0,,,,,,,,,,,,,,,,,,,,,,,,,,,,,,,,,,,,,,,,,,,ATL,,00-0027686,,C.Peters,,,,,,,,,,,,,,0.0,,,,,,,,,,,,,,,,,,,,,,,,,,,,,,,,0.0,,,,,0,,,0.0,0.0,0.0,0.0,,,2010,,,58,0,Field goal,3853,"10/17/10, 13:02:29",2010-10-17T20:03:09Z,Lincoln Financial Field,"Sunny Temp: 66° F, Humidity: 45%, Wind: WSW 12 mph",10012010-1017-067d-7005-572acb2a1968,0,0,RUSH,0,,,,23,Field goal,2010-10-17T19:56:35Z,7.0,2:39,1.0,1.0,1.0,4.0,4.0,0.0,KICKOFF,FIELD_GOAL,05:40,03:01,ATL 44,ATL 12,3664.0,3895.0,17,31,Home,14,48,1.0,43.0,0,outdoors,grass,66.0,12.0,Andy Reid,Mike Smith,PHI00,Lincoln Financial Field,0,0.0,,,E.Buckley,34.0,,,0,1,0.0,0,1,,00-0024738,,E.Buckley,34.0,00-0024738,E.Buckley,00-0024738,E.Buckley,00-0024738,0,0,-0.147454981959416,,,,,,0.316652297973633,-31.6652297973633,2010-10-17,C.Lofton,2010,REG,ATL,6,00-0026177,LB,Curtis Lofton,Curtis,Lofton,Knee,,Probable,Knee,,Full Participation in Practice,2010-10-15T11:51:12Z,2010-10-15 11:51:12
3734,2010_10_MIN_CHI,2010111404,CHI,MIN,REG,10,MIN,away,CHI,CHI,30.0,2010-11-14,517.0,517.0,517.0,Half2,0,23.0,0,4,,0,08:37,CHI 30,0,4.0,"9-R.Gould kicks 66 yards from CHI 30 to MIN 4. 12-P.Harvin to MIN 29 for 25 yards (21-C.Graham). FUMBLES (21-C.Graham), RECOVERED by CHI-21-C.Graham at MIN 29. 21-C.Graham to MIN 29 for no gain (12-P.Harvin). MIN-12-P.Harvin was injured during the play. Minnesota challenged the fumble ruling, and the play was REVERSED. 9-R.Gould kicks 66 yards from CHI 30 to MIN 4. 12-P.Harvin to MIN 28 for 24 yards (21-C.Graham). MIN-12-P.Harvin was injured during the play.",kickoff,0.0,0,0,0.0,0,0,0,,,,,,,,66.0,,,3,3,0.0,,,,,3.0,3.0,27,13,13.0,27.0,-14.0,13.0,27.0,-14.0,0.180628597736359,0.139720052480698,0.0033239698968827,0.224349319934845,0.168994873762131,0.0022098186891526,0.280773371458054,0.0,0.0,0.480564522091299,0.398932824376971,11.8376321401533,-11.8376321401533,1.33201234486634,-1.33201234486634,11.6562882031407,-11.6562882031407,,,0.0,0.0,16.8576286756106,-16.8576286756106,0.12667183787562,-0.12667183787562,33.2753650033519,-33.2753650033519,-20.7981322820111,20.7981322820111,0.0322739854454994,0.967726014554501,0.967726014554501,0.0322739854454994,0.0066169314086437,0.0028169304132461,-0.0028169304132461,0.961109083145857,0.0388909168541431,0.0347542017698288,0.965245798230171,0.0518377274274826,-0.0518377274274826,0.550373883827696,-0.550373883827696,,,0.0,0.0,0.165235415695728,-0.165235415695728,0.421743245110461,-0.421743245110461,0.163629517553867,-0.163629517553867,0.37005244313235,-0.37005244313235,0.0,0.0,0.0,0.0,0.0,0.0,0.0,0.0,0.0,0,0.0,0.0,0.0,0.0,0.0,0.0,0.0,0.0,0.0,0.0,0.0,0.0,0.0,0.0,1.0,0.0,0.0,0.0,0.0,0.0,0.0,0.0,0.0,0.0,0.0,0.0,0.0,0.0,0.0,0.0,0.0,0.0,1.0,0.0,0.0,0.0,0.0,0.0,0.0,0.0,0.0,,,,,,,,,,,,,,,,,,,,,,,,,,P.Harvin,00-0026998,,,,,R.Gould,00-0023252,,,,,,,,,,,,,,,,,,,CHI,,00-0025555,,C.Graham,,,,,,,,,,,,,,0.0,,,,,,,,,,,,,,,,,,,,,,,,,,,,,,,MIN,24.0,,,,,1,reversed,,0.0,0.0,0.0,0.0,,,2010,,,46,0,Turnover,3734,"11/14/10, 13:02:55",2010-11-14T20:40:17Z,Soldier Field,"Partly Cloudy, wind gusts up to 29 mph Temp: 44° F, Humidity: 57%, Wind: WSW 22 mph",10012010-1114-048b-441a-e456fe93fd08,0,0,KICK_OFF,1,,,,23,Turnover,2010-11-14T20:40:17Z,2.0,0:36,0.0,0.0,0.0,4.0,4.0,0.0,KICKOFF,INTERCEPTION,08:37,08:01,MIN 28,MIN 32,3734.0,3857.0,13,27,Home,14,40,1.0,41.0,1,outdoors,grass,44.0,22.0,Lovie Smith,Brad Childress,CHI98,Soldier Field,0,1.0,,,,,,,0,0,0.0,1,0,,,,,,,,,,,0,1,0.398932824376971,,,,,,,,2010-11-14,P.Harvin,2010,REG,MIN,10,00-0026998,WR,Percy Harvin,Percy,Harvin,Ankle,Illness,Questionable,Ankle,Illness,Limited Participation in Practice,2010-11-12T11:48:29Z,2010-11-12 11:48:29
3673,2010_13_SF_GB,2010120506,GB,SF,REG,13,SF,away,GB,SF,56.0,2010-12-05,124.0,124.0,124.0,Half2,0,21.0,0,4,3.0,0,02:04,SF 44,10,28.0,(2:04) (Shotgun) 1-T.Smith pass incomplete short left to 19-T.Ginn (37-S.Shields). GB-77-C.Jenkins was injured during the play.,pass,0.0,1,0,1.0,0,0,0,short,left,13.0,,,,,,,,1,0,0.0,,,,,0.0,1.0,34,16,16.0,34.0,-18.0,16.0,34.0,-18.0,0.704363882541657,0.0280240718275309,0.0006729302112944,0.0483512058854103,0.0758812949061394,0.0014576674439013,0.14124895632267,0.0,0.0,0.795425396761857,-0.595933277974837,16.1959905699025,-16.1959905699025,10.4864273770514,-10.4864273770514,8.48821848863139,-8.48821848863139,1.19575223734137,-1.7916855153162,0.0,0.0,-1.95439423438172,1.95439423438172,7.35896281928268,-7.35896281928268,-9.23378174575289,9.23378174575289,17.9386533457768,-17.9386533457768,0.0005555861280299,0.99944441387197,0.99944441387197,0.0005555861280299,-0.0001533655449748,-6.04814995313063e-05,6.04814995313063e-05,0.999597779416945,0.0004022205830551,0.0002163411991205,0.999783658800879,0.292993879599895,-0.292993879599895,0.212953143211975,-0.212953143211975,-7.20508105587214e-05,-8.13147344160825e-05,0.0,0.0,0.0748951940967182,-0.0748951940967182,0.121853832074641,-0.121853832074641,0.0749672449072769,-0.0749672449072769,0.166581800330398,-0.166581800330398,0.0,0.0,0.0,0.0,0.0,1.0,0.0,0.0,1.0,0,0.0,0.0,0.0,0.0,0.0,0.0,0.0,0.0,0.0,0.0,0.0,0.0,0.0,0.0,0.0,0.0,0.0,0.0,0.0,0.0,0.0,0.0,0.0,1.0,0.0,0.0,0.0,0.0,0.0,0.0,0.0,0.0,0.0,0.0,0.0,0.0,0.0,0.0,0.0,0.0,0.0,00-0025561,T.Smith,,00-0025396,T.Ginn,,,,,,,,,,,,,,,,,,,,,,,,,,,,,,,,,,,,,,,,,,,,,,,,,,,,,,,,,,,,,,,,,0.0,,,,,,,00-0027440,S.Shields,,,,,,,,,,,,,,,,,,,,,,,,0.0,,,,,0,,,0.0,0.0,0.0,0.0,,,2010,0.535737037658691,-53.5737037658691,47,1,First down,3673,"12/5/10, 13:03:08",2010-12-05T21:01:57Z,Lambeau Field,"Cloudy Temp: 26° F, Humidity: 60%, Wind: N/W 16 mph",10012010-1205-0652-3324-e2c9dc8aa937,0,0,PASS,0,,,,21,Turnover,2010-12-05T20:57:34Z,9.0,1:57,2.0,0.0,0.0,4.0,4.0,0.0,KICKOFF,INTERCEPTION,03:10,01:13,SF 26,GB 46,3524.0,3760.0,16,34,Home,18,50,9.0,41.0,0,outdoors,grass,26.0,16.0,Mike McCarthy,Mike Singletary,GNB00,Lambeau Field,0,0.0,T.Smith,1.0,,,T.Ginn,19.0,1,0,0.0,0,1,00-0025561,,00-0025396,T.Smith,1.0,00-0025561,T.Ginn,00-0025396,T.Ginn,00-0025396,0,0,-0.595933277974837,0.226785586921852,2.94841903063934,1.0,0.998733194370288,0.998733194370288,0.96593850851059,3.40614914894104,2010-12-05,C.Jenkins,2010,REG,GB,13,00-0021706,DE,Cullen Jenkins,Cullen,Jenkins,Calf,,Probable,Calf,,Full Participation in Practice,2010-12-03T12:02:19Z,2010-12-03 12:02:19
3629,2010_03_GB_CHI,2010092700,CHI,GB,REG,3,CHI,home,GB,GB,15.0,2010-09-27,281.0,281.0,281.0,Half2,0,15.0,0,4,3.0,0,04:41,GB 15,12,67.0,(4:41) 6-J.Cutler pass short middle to 80-E.Bennett to GB 7 for 8 yards (21-C.Woodson). GB-77-C.Jenkins was injured during the play.,pass,8.0,0,0,1.0,0,0,0,short,middle,6.0,2.0,,,,,,,1,3,0.0,,,,,1.0,3.0,14,17,14.0,17.0,-3.0,14.0,17.0,-3.0,0.113777838647366,0.0126707693561912,0.0002929180627688,0.0302848424762487,0.612876653671265,0.0020163243170827,0.228080615401268,0.0,0.0,3.18863487592898,-0.309894716910713,-2.59628642844262,2.59628642844262,1.16551505884854,-1.16551505884854,-18.0547648101454,18.0547648101454,-0.47208203288028,0.162187315969567,-0.47208203288028,0.162187315969567,-6.38804955448776,6.38804955448776,-1.26055139310044,1.26055139310044,-4.16204706693005,4.16204706693005,-8.96124998029988,8.96124998029988,0.519930481910706,0.480069518089294,0.519930481910706,0.480069518089294,0.010338306427002,-0.0217532813549042,-0.0217532813549042,0.530268788337708,0.469731211662293,0.413950532674789,0.413950532674789,-0.0788849537840877,0.0788849537840877,-0.430925401829528,0.430925401829528,0.0,0.010338306427002,0.0,0.010338306427002,-0.251294208441437,0.251294208441437,0.056157017838372,-0.056157017838372,0.433715807523071,-0.433715807523071,-0.716178675401794,0.716178675401794,0.0,0.0,0.0,0.0,0.0,1.0,0.0,0.0,0.0,0,0.0,0.0,0.0,0.0,0.0,0.0,0.0,0.0,0.0,0.0,0.0,0.0,0.0,0.0,1.0,0.0,0.0,0.0,0.0,0.0,0.0,0.0,0.0,1.0,0.0,0.0,0.0,0.0,0.0,0.0,0.0,0.0,0.0,0.0,0.0,1.0,0.0,0.0,0.0,0.0,0.0,00-0024226,J.Cutler,8.0,00-0026210,E.Bennett,8.0,,,,,,,,,,,,,,,,,,,,,,,,,,,,,,,,,,,,,,,,,,,,,,GB,,00-0018227,,C.Woodson,,,,,,,,,,,,,,0.0,,,,,,,,,,,,,,,,,,,,,,,,,,,,,,,,0.0,,,,,0,,,0.0,0.0,0.0,0.0,,,2010,0.731447041034699,26.8552958965302,47,0,Field goal,3629,"9/27/10, 20:40:48",2010-09-28T03:18:28Z,Soldier Field,"Mostly Clear Temp: 56° F, Humidity: 75%, Wind: E 6 mph",10012010-0927-00c7-a46b-2b6eeb257b97,0,0,PASS,0,,,,15,Field goal,2010-09-28T03:12:34Z,7.0,2:53,4.0,1.0,1.0,4.0,4.0,30.0,KICKOFF,FIELD_GOAL,06:52,03:59,CHI 26,GB 7,3419.0,3654.0,17,20,Home,3,37,-3.0,45.5,1,outdoors,grass,56.0,6.0,Lovie Smith,Mike McCarthy,CHI98,Soldier Field,0,0.0,J.Cutler,6.0,,,E.Bennett,80.0,1,0,0.0,0,1,00-0024226,,00-0026210,J.Cutler,6.0,00-0024226,E.Bennett,00-0026210,E.Bennett,00-0026210,0,1,-0.309894716910713,0.850332597630356,3.10045292403083,2.0,0.274108412442729,0.195844235597178,0.952289938926697,4.77100610733032,2010-09-27,C.Jenkins,2010,REG,GB,3,00-0021706,DE,Cullen Jenkins,Cullen,Jenkins,Hand,,Probable,Hand,,Full Participation in Practice,2010-09-25T12:07:03Z,2010-09-25 12:07:03
3568,2010_09_NO_CAR,2010110707,CAR,NO,REG,9,NO,away,CAR,CAR,47.0,2010-11-07,777.0,777.0,777.0,Half2,0,22.0,0,4,2.0,0,12:57,CAR 47,5,52.0,"(12:57) 29-C.Ivory left tackle to CAR 36 for 11 yards (30-C.Godfrey, 59-N.Harris). NO-29-C.Ivory was injured during the play. He is Out.",run,11.0,0,0,0.0,0,0,0,,,,,left,tackle,,,,,3,2,0.0,,,,,2.0,3.0,3,27,27.0,3.0,24.0,27.0,3.0,24.0,0.0712534859776497,0.0986217707395554,0.0011832698946818,0.162651941180229,0.287218242883682,0.003994052298367,0.375077188014984,0.0,0.0,2.05838770908304,1.00475308252499,-31.1816367773702,31.1816367773702,-5.17878871801077,5.17878871801077,-24.4873219740047,24.4873219740047,,,0.0,0.0,-15.9020447868946,15.9020447868946,-4.90264372031982,4.90264372031982,-20.0618211533268,20.0618211533268,0.446191998377268,-0.446191998377268,0.999281585216522,0.0007184147834777,0.0007184147834777,0.999281585216522,-8.38041305541992e-05,8.57710838317871e-05,-8.57710838317871e-05,0.0008022189140319,0.999197781085968,0.999817907810211,0.0001820921897888,-0.232277848757803,0.232277848757803,-0.320436256472915,0.320436256472915,,,0.0,0.0,-0.226716322119538,0.226716322119538,-0.238061465322971,0.238061465322971,-0.226716322119538,0.226716322119538,0.0066394200476305,-0.0066394200476305,0.0,1.0,0.0,0.0,0.0,0.0,0.0,0.0,0.0,0,0.0,0.0,0.0,0.0,0.0,0.0,0.0,0.0,0.0,0.0,0.0,0.0,0.0,0.0,0.0,0.0,0.0,0.0,0.0,0.0,0.0,0.0,1.0,0.0,0.0,0.0,0.0,0.0,0.0,0.0,0.0,0.0,0.0,0.0,0.0,0.0,1.0,0.0,0.0,0.0,0.0,,,,,,,00-0027531,C.Ivory,11.0,,,,,,,,,,,,,,,,,,,,,,,,,,,,,,,,,,,,,,,,,,,,,,,,,00-0027107,N.Harris,CAR,,,,,,,,,,1.0,00-0026207,C.Godfrey,CAR,,,,,,,,,,,,,,,,,,,,,,,,,,,,,0.0,,,,,0,,,0.0,0.0,0.0,0.0,,,2010,,,48,1,First down,3568,"11/7/10, 13:05:08",2010-11-07T20:43:06Z,Bank of America Stadium,"Sunny Temp: 50° F, Humidity: 33%, Wind: North 7 mph",10012010-1107-076a-03d7-edd3de354f15,0,0,RUSH,0,,,,22,Touchdown,2010-11-07T20:42:30Z,10.0,5:20,5.0,1.0,1.0,4.0,4.0,9.0,PUNT,TOUCHDOWN,13:32,08:12,NO 48,CAR 1,3547.0,3824.0,34,3,Home,-31,37,-5.5,40.0,1,outdoors,grass,50.0,7.0,John Fox,Sean Payton,CAR00,Bank of America Stadium,0,1.0,,,C.Ivory,29.0,,,0,1,1.0,0,1,,00-0027531,,C.Ivory,29.0,00-0027531,C.Ivory,00-0027531,C.Ivory,00-0027531,0,0,1.00475308252499,,,,,,0.305967956781387,-30.5967956781387,2010-11-07,C.Ivory,2010,REG,NO,9,00-0027531,RB,Chris Ivory,Chris,Ivory,Concussion,,Probable,Concussion,,Full Participation in Practice,2010-11-05T11:46:17Z,2010-11-05 11:46:17
3510,2010_08_TEN_SD,2010103107,LAC,TEN,REG,8,TEN,away,LAC,TEN,64.0,2010-10-31,370.0,370.0,370.0,Half2,0,21.0,0,4,1.0,0,06:10,TEN 36,10,23.0,(6:10) 10-V.Young scrambles up the middle to TEN 40 for 4 yards (54-S.Cooper). TEN-10-V.Young was injured during the play.,run,4.0,0,0,1.0,0,0,1,,,,,middle,,,,,,3,2,0.0,,,,,2.0,3.0,33,25,25.0,33.0,-8.0,25.0,33.0,-8.0,0.279193639755249,0.0890482068061829,0.0019190585007891,0.142583549022675,0.182441800832748,0.0029762769117951,0.30183744430542,0.0,0.0,1.39707248588093,-0.262254280503839,4.65606979335405,-4.65606979335405,2.86344836300487,-2.86344836300487,6.63903021062652,-6.63903021062652,,,0.0,0.0,-19.5728391953744,19.5728391953744,23.390124484722,-23.390124484722,-41.1856059911952,41.1856059911952,48.1691935234389,-48.1691935234389,0.129082098603249,0.870917901396751,0.870917901396751,0.129082098603249,-0.0280093774199486,0.0028027147054672,-0.0028027147054672,0.8989272788167,0.1010727211833,0.106516771018505,0.893483228981495,0.220451803076139,-0.220451803076139,0.0794052741588358,-0.0794052741588358,,,0.0,0.0,-0.0773606629611651,0.0773606629611651,0.220740789354126,-0.220740789354126,-0.0773606629611651,0.0773606629611651,0.164524355709831,-0.164524355709831,0.0,0.0,0.0,0.0,0.0,0.0,0.0,0.0,0.0,0,0.0,0.0,0.0,0.0,0.0,0.0,0.0,0.0,0.0,0.0,0.0,0.0,0.0,0.0,1.0,0.0,0.0,0.0,0.0,0.0,0.0,0.0,1.0,0.0,0.0,0.0,0.0,0.0,0.0,0.0,0.0,0.0,0.0,0.0,0.0,0.0,0.0,0.0,0.0,0.0,0.0,,,,,,,00-0024218,V.Young,4.0,,,,,,,,,,,,,,,,,,,,,,,,,,,,,,,,,,,,,,,,,,,LAC,,00-0021544,,S.Cooper,,,,,,,,,,,,,,0.0,,,,,,,,,,,,,,,,,,,,,,,,,,,,,,,,0.0,,,,,0,,,0.0,0.0,0.0,0.0,,,2010,,,49,1,First down,3510,"10/31/10, 16:05:41",2010-10-31T22:51:42Z,Qualcomm Stadium,"Sunny Temp: 65° F, Humidity: 65%, Wind: NW 10 mph",10012010-1031-0783-39ff-1f47202fea59,0,0,RUSH,0,,,,21,Punt,2010-10-31T22:50:12Z,6.0,3:06,2.0,0.0,0.0,4.0,4.0,0.0,KICKOFF,PUNT,06:51,03:45,TEN 26,TEN 49,3467.0,3689.0,25,33,Home,8,58,6.0,45.0,0,outdoors,grass,65.0,10.0,Norv Turner,Jeff Fisher,SDG00,Qualcomm Stadium,0,0.0,V.Young,10.0,,10.0,,,1,0,0.0,0,1,00-0024218,,,V.Young,10.0,00-0024218,V.Young,00-0024218,V.Young,00-0024218,0,1,-0.262254280503839,,,,,,0.741131544113159,25.8868455886841,2010-10-31,V.Young,2010,REG,TEN,8,00-0024218,QB,Vince Young,Vince,Young,Knee,Ankle,Probable,Knee,Ankle,Full Participation in Practice,2010-10-29T12:06:37Z,2010-10-29 12:06:37
3506,2010_12_SD_IND,2010112811,IND,LAC,REG,12,IND,home,LAC,IND,66.0,2010-11-28,175.0,175.0,175.0,Half2,0,22.0,0,4,1.0,0,02:55,IND 34,10,42.0,(2:55) (Shotgun) 18-P.Manning pass incomplete deep left to 87-R.Wayne. IND-87-R.Wayne was injured during the play.,pass,0.0,1,0,1.0,0,0,0,deep,left,36.0,,,,,,,,1,3,0.0,,,,,1.0,3.0,14,36,14.0,36.0,-22.0,14.0,36.0,-22.0,0.441801279783249,0.0547018013894558,0.0006295787170529,0.0717525258660317,0.16184164583683,0.0031025041826069,0.266170650720596,0.0,0.0,1.68729225825518,-0.434416104340926,-28.1385138946681,28.1385138946681,-4.37879242686902,4.37879242686902,-23.10558852383,23.10558852383,1.81211464240914,-2.24653074675007,0.0,0.0,-3.18302662461065,3.18302662461065,3.60704873138457,-3.60704873138457,14.6282528859156,-14.6282528859156,-40.9445156846619,40.9445156846619,0.0005380017682909,0.999461998231709,0.0005380017682909,0.999461998231709,-0.0001309019571635,-4.4771601096727e-05,-4.4771601096727e-05,0.0004070998111274,0.999592900188873,0.0001754592522047,0.0001754592522047,-0.203810991719365,0.203810991719365,-0.172088597037403,0.172088597037403,0.0,-0.0001309019571635,0.0,0.0,0.0241252827399876,-0.0241252827399876,0.282656172096341,-0.282656172096341,0.0241252827399876,-0.0241252827399876,-0.315511965347726,0.315511965347726,0.0,0.0,0.0,0.0,0.0,0.0,0.0,0.0,1.0,0,0.0,0.0,0.0,0.0,0.0,0.0,0.0,0.0,0.0,0.0,0.0,0.0,0.0,0.0,0.0,0.0,0.0,0.0,0.0,0.0,0.0,0.0,0.0,1.0,0.0,0.0,0.0,0.0,0.0,0.0,0.0,0.0,0.0,0.0,0.0,0.0,0.0,0.0,0.0,0.0,0.0,00-0010346,P.Manning,,00-0020498,R.Wayne,,,,,,,,,,,,,,,,,,,,,,,,,,,,,,,,,,,,,,,,,,,,,,,,,,,,,,,,,,,,,,,,,0.0,,,,,,,,,,,,,,,,,,,,,,,,,,,,,,,,0.0,,,,,0,,,0.0,0.0,0.0,0.0,,,2010,0.323498219251633,-32.3498219251633,50,1,First down,3506,"11/28/10, 20:30:52",2010-11-29T04:10:22Z,Lucas Oil Stadium,"Clear Temp: 38° F, Humidity: 67%, Wind: ESE 8 mph",10012010-1128-1175-541b-be51120d33bc,0,0,PASS,0,,,,22,Turnover,2010-11-29T04:10:22Z,8.0,2:05,3.0,0.0,0.0,4.0,4.0,0.0,PUNT,INTERCEPTION,02:55,00:50,IND 34,LAC 24,3506.0,3689.0,36,14,Home,-22,50,2.0,50.0,0,closed,fieldturf,,,Jim Caldwell,Norv Turner,IND00,Lucas Oil Stadium,0,0.0,P.Manning,18.0,,,R.Wayne,87.0,1,0,0.0,0,1,00-0010346,,00-0020498,P.Manning,18.0,00-0010346,R.Wayne,00-0020498,R.Wayne,00-0020498,0,1,-0.434416104340926,1.59325210994803,15.3322550599405,11.0,1.0,1.0,0.851427018642426,14.8572981357574,2010-11-28,R.Wayne,2010,REG,IND,12,00-0020498,WR,Reggie Wayne,Reggie,Wayne,Knee,,Questionable,Knee,,Full Participation in Practice,2010-11-26T12:38:34Z,2010-11-26 12:38:34
3493,2010_20_NYJ_PIT,2011012300,PIT,NYJ,POST,20,NYJ,away,PIT,PIT,36.0,2011-01-23,410.0,410.0,410.0,Half2,0,17.0,0,4,1.0,0,06:50,PIT 36,10,58.0,"(6:50) 6-M.Sanchez right guard to PIT 36 for no gain (99-B.Keisel, 92-J.Harrison). NYJ-74-N.Mangold was injured during the play.",run,0.0,0,0,0.0,0,0,0,,,,,right,guard,,,,,3,3,0.0,,,,,3.0,3.0,24,12,12.0,24.0,-12.0,12.0,24.0,-12.0,0.123981505632401,0.0435699224472046,0.0006940354942344,0.075465127825737,0.328015267848969,0.0023064154665917,0.425967693328857,0.0,0.0,3.31007875467185,-0.43213114340324,9.83431274468012,-9.83431274468012,7.80188516620547,-7.80188516620547,-0.824264168320637,0.824264168320637,,,0.0,0.0,-5.01445600029547,5.01445600029547,0.9988266043365,-0.9988266043365,-16.7138183197822,16.7138183197822,10.9059678058951,-10.9059678058951,0.0832203403115273,0.916779659688473,0.916779659688473,0.0832203403115273,-0.0048540234565734,-0.0067600756883621,0.0067600756883621,0.921633683145046,0.0783663168549538,0.0785712376236916,0.921428762376308,0.233531761381607,-0.233531761381607,0.120059068401448,-0.120059068401448,,,0.0,0.0,-0.0291238430598962,0.0291238430598962,0.101034145802259,-0.101034145802259,-0.520066440449118,0.520066440449118,0.59539433196187,-0.59539433196187,0.0,0.0,0.0,0.0,0.0,0.0,0.0,0.0,0.0,0,0.0,0.0,0.0,0.0,0.0,0.0,0.0,0.0,0.0,0.0,0.0,0.0,0.0,0.0,0.0,0.0,0.0,0.0,0.0,0.0,0.0,0.0,1.0,0.0,0.0,0.0,0.0,0.0,0.0,0.0,0.0,0.0,0.0,0.0,0.0,0.0,1.0,0.0,0.0,0.0,0.0,,,,,,,00-0026898,M.Sanchez,0.0,,,,,,,,,,,,,,,,,,,,,,,,,,,,,,,,,,,,,,,,,,,,,,,,,00-0020712,J.Harrison,PIT,,,,,,,,,,1.0,00-0021344,B.Keisel,PIT,,,,,,,,,,,,,,,,,,,,,,,,,,,,,0.0,,,,,0,,,0.0,0.0,0.0,0.0,,,2010,,,48,1,First down,3493,"1/23/11, 18:41:49",,Acrisure Stadium,"Partly Cloudy Temp: 17° F, Humidity: 44%, Wind: From NW 10 mph",10012011-0123-005e-4598-50c258927c88,0,0,RUSH,0,,,,17,Touchdown,2011-01-24T02:27:28Z,10.0,4:32,4.0,1.0,1.0,4.0,4.0,0.0,KICKOFF,TOUCHDOWN,07:38,03:06,NYJ 42,PIT 4,3425.0,3712.0,19,24,Home,5,43,4.0,38.0,0,outdoors,grass,17.0,10.0,Mike Tomlin,Rex Ryan,PIT00,Heinz Field,0,0.0,,,M.Sanchez,6.0,,,0,1,0.0,0,1,,00-0026898,,M.Sanchez,6.0,00-0026898,M.Sanchez,00-0026898,M.Sanchez,00-0026898,0,1,-0.43213114340324,,,,,,0.849200487136841,-84.9200487136841,2011-01-23,N.Mangold,2010,CON,NYJ,20,00-0024244,C,Nick Mangold,Nick,Mangold,Shoulder,,Probable,Shoulder,,Full Participation in Practice,2011-01-21T12:29:12Z,2011-01-21 12:29:12
3427,2010_15_DEN_OAK,2010121912,LV,DEN,REG,15,DEN,away,LV,LV,32.0,2010-12-19,685.0,685.0,685.0,Half2,0,24.0,0,4,1.0,0,11:25,LV 32,10,49.0,(11:25) 35-L.Ball right guard to LV 30 for 2 yards (79-J.Henderson). DEN-46-S.Larsen was injured during the play. His return is Questionable.,run,2.0,0,0,0.0,0,0,0,,,,,right,guard,,,,,3,2,0.0,,,,,2.0,3.0,30,20,20.0,30.0,-10.0,20.0,30.0,-10.0,0.0567923225462437,0.0522462800145149,0.0006574422004632,0.0830323696136475,0.381355106830597,0.001784861437045,0.424131631851196,0.0,0.0,3.37727615458425,-0.311717826756649,3.852495312679,-3.852495312679,3.47482364915327,-3.47482364915327,-5.77187059425827,5.77187059425827,,,0.0,0.0,-7.45791045494843,7.45791045494843,6.73966425436083,-6.73966425436083,-7.30292964668479,7.30292964668479,0.68013235726781,-0.68013235726781,0.180216521024704,0.819783478975296,0.819783478975296,0.180216521024704,-0.016735166311264,-0.0051172599196434,0.0051172599196434,0.83651864528656,0.16348135471344,0.103640869259834,0.896359130740166,0.199781165867184,-0.199781165867184,-0.24705005076083,0.24705005076083,,,0.0,0.0,-0.143173106748834,0.143173106748834,0.124671910577467,-0.124671910577467,-0.154236980516687,0.154236980516687,-0.114094998068163,0.114094998068163,0.0,0.0,0.0,0.0,0.0,0.0,0.0,0.0,0.0,0,0.0,0.0,0.0,0.0,0.0,0.0,0.0,0.0,0.0,0.0,0.0,0.0,0.0,0.0,1.0,0.0,0.0,0.0,0.0,0.0,0.0,0.0,1.0,0.0,0.0,0.0,0.0,0.0,0.0,0.0,0.0,0.0,0.0,0.0,0.0,0.0,0.0,0.0,0.0,0.0,0.0,,,,,,,00-0026432,L.Ball,2.0,,,,,,,,,,,,,,,,,,,,,,,,,,,,,,,,,,,,,,,,,,,LV,,00-0021144,,J.Henderson,,,,,,,,,,,,,,0.0,,,,,,,,,,,,,,,,,,,,,,,,,,,,,,,,0.0,,,,,0,,,0.0,0.0,0.0,0.0,,,2010,,,42,0,Field goal,3427,"12/19/10, 16:14:39",2010-12-19T23:54:28Z,Oakland-Alameda County Stadium,"Cloudy / Rainy Temp: ° F, Wind: mph",10012010-1219-127f-217b-95dc01b2288a,0,0,RUSH,0,,,,24,Field goal,2010-12-19T23:48:10Z,9.0,4:28,2.0,0.0,1.0,4.0,4.0,0.0,KICKOFF,FIELD_GOAL,14:32,10:04,DEN 24,LV 27,3278.0,3495.0,23,39,Home,16,62,9.0,41.5,1,outdoors,grass,55.0,0.0,Tom Cable,Eric Studesville,OAK00,Oakland-Alameda County Coliseum,0,0.0,,,L.Ball,35.0,,,0,1,0.0,0,1,,00-0026432,,L.Ball,35.0,00-0026432,L.Ball,00-0026432,L.Ball,00-0026432,0,1,-0.311717826756649,,,,,,0.591886222362518,-59.1886222362518,2010-12-19,S.Larsen,2010,REG,DEN,15,00-0026323,RB,Spencer Larsen,Spencer,Larsen,Hamstring,,Probable,Hamstring,,Full Participation in Practice,2010-12-17T12:29:20Z,2010-12-17 12:29:20
3404,2010_19_NYJ_NE,2011011600,NE,NYJ,POST,19,NE,home,NYJ,NYJ,34.0,2011-01-16,330.0,330.0,330.0,Half2,0,19.0,0,4,3.0,0,05:30,NYJ 34,13,48.0,(5:30) (Shotgun) 12-T.Brady pass incomplete short right to 39-D.Woodhead. NYJ-24-D.Revis was injured during the play.,pass,0.0,1,0,1.0,0,0,0,short,right,9.0,,,,,,,,3,2,0.0,,,,,3.0,2.0,11,21,11.0,21.0,-10.0,11.0,21.0,-10.0,0.162158340215683,0.0597871504724026,0.000880368577782,0.0960259512066841,0.452628344297409,0.0023014766629785,0.226218432188034,0.0,0.0,2.09271316451486,-1.09365306783002,-11.3862068309373,11.3862068309373,6.07326302340355,-6.07326302340355,-21.4228903842499,21.4228903842499,0.0764098668005317,-1.17006293463055,0.0,0.0,-8.40101271617459,8.40101271617459,2.76899060897995,-2.76899060897995,-14.2560085589648,14.2560085589648,1.68214337265817,-1.68214337265817,0.0879819616675377,0.912018038332462,0.0879819616675377,0.912018038332462,-0.0265548005700111,-0.0309171602129936,-0.0309171602129936,0.0614271610975266,0.938572838902473,0.146554753184319,0.146554753184319,0.0949674886763096,-0.0949674886763096,-0.727808267497299,0.727808267497299,0.0,-0.0265548005700111,0.0,0.0,-0.0804234324192218,0.0804234324192218,-0.167360601617651,0.167360601617651,-0.0770614026283435,0.0770614026283435,-0.462583398117381,0.462583398117381,0.0,0.0,0.0,0.0,0.0,1.0,0.0,0.0,1.0,0,0.0,0.0,0.0,0.0,0.0,0.0,0.0,0.0,0.0,0.0,0.0,0.0,0.0,0.0,0.0,0.0,0.0,0.0,0.0,0.0,0.0,0.0,0.0,1.0,0.0,0.0,0.0,0.0,0.0,0.0,0.0,0.0,0.0,0.0,0.0,0.0,0.0,0.0,0.0,0.0,0.0,00-0019596,T.Brady,,00-0026019,D.Woodhead,,,,,,,,,,,,,,,,,,,,,,,,,,,,,,,,,,,,,,,,,,,,,,,,,,,,,,,,,,,,,,,,,0.0,,,,,,,,,,,,,,,,,,,,,,,,,,,,,,,,0.0,,,,,0,,,0.0,0.0,0.0,0.0,,,2010,0.602939486503601,-60.2939486503601,48,0,Turnover on downs,3404,"1/16/11, 16:41:10",2011-01-17T00:13:01Z,Gillette Stadium,"Clear and Cold Temp: 30° F, Wind: WNW 14 mph",10012011-0116-0046-96ea-fe2fa40ab53d,0,0,PASS,0,,,,19,Turnover on downs,2011-01-17T00:03:20Z,14.0,7:45,4.0,0.0,0.0,4.0,4.0,-5.0,KICKOFF,DOWNS,13:00,05:15,NE 18,NYJ 34,3084.0,3426.0,28,21,Home,-7,49,9.5,45.0,1,outdoors,fieldturf,30.0,14.0,Bill Belichick,Rex Ryan,BOS00,Gillette Stadium,0,0.0,T.Brady,12.0,,,D.Woodhead,39.0,1,0,0.0,0,1,00-0019596,,00-0026019,T.Brady,12.0,00-0019596,D.Woodhead,00-0026019,D.Woodhead,00-0026019,0,0,-1.09365306783002,0.908778492666842,3.14500871577184,1.0,0.978558808419621,0.284330524358666,0.982977628707886,1.70223712921143,2011-01-16,D.Revis,2010,DIV,NYJ,19,00-0025401,CB,Darrelle Revis,Darrelle,Revis,Hamstring,,Probable,Hamstring,,Limited Participation in Practice,2011-01-14T13:13:53Z,2011-01-14 13:13:53
3389,2010_04_CIN_CLE,2010100301,CLE,CIN,REG,4,CIN,away,CLE,CLE,7.0,2010-10-03,654.0,654.0,654.0,Half2,0,18.0,0,4,3.0,1,10:54,CLE 7,7,80.0,"(10:54) (Shotgun) 9-C.Palmer pass incomplete short middle to 11-J.Shipley. CIN-11-J.Shipley was injured during the play. His return is Questionable. PENALTY on CLE-43-T.Ward, Personal Foul, 4 yards, enforced at CLE 7 - No Play.",no_play,0.0,1,0,0.0,0,0,0,,,,,,,,,,,2,2,0.0,,,,,2.0,2.0,23,13,13.0,23.0,-10.0,13.0,23.0,-10.0,0.0288157798349857,0.0184895675629377,0.0005235868156887,0.0309439487755299,0.57264518737793,0.0014506974257528,0.347131192684174,0.0,0.0,3.87763178802561,1.97720732167363,2.93484301655985,-2.93484301655985,7.30688870422176,-7.30688870422176,-7.81976714053788,7.81976714053788,,,0.0,0.0,-4.98465410698224,4.98465410698224,-7.45171268342529,7.45171268342529,1.79702610863354,-1.79702610863354,-15.4154907018726,15.4154907018726,0.218060910701752,0.781939089298248,0.781939089298248,0.218060910701752,0.054629921913147,0.0701527297496796,-0.0701527297496796,0.727309167385101,0.272690832614899,0.258098661899567,0.741901338100433,0.191249912288003,-0.191249912288003,-0.204054853209075,0.204054853209075,,,0.0,0.0,0.0187303051352501,-0.0187303051352501,-0.316115191467819,0.316115191467819,0.0187303051352501,-0.0187303051352501,-0.298780551441726,0.298780551441726,0.0,0.0,0.0,1.0,0.0,0.0,0.0,0.0,0.0,0,0.0,0.0,0.0,0.0,0.0,0.0,0.0,0.0,0.0,0.0,0.0,0.0,0.0,0.0,0.0,0.0,1.0,0.0,0.0,0.0,0.0,0.0,0.0,0.0,0.0,0.0,0.0,0.0,0.0,0.0,0.0,0.0,0.0,0.0,0.0,0.0,0.0,0.0,0.0,0.0,0.0,,,,,,,,,,,,,,,,,,,,,,,,,,,,,,,,,,,,,,,,,,,,,,,,,,,,,,,,,,,,,,,,,,,,,,0.0,,,,,,,,,,,,,,,,,,,,,,,,,,,,,,,,0.0,CLE,00-0027653,T.Ward,4.0,0,,Personal Foul,0.0,0.0,0.0,0.0,,,2010,,,47,1,First down,3389,"10/3/10, 13:02:30",2010-10-03T19:30:05Z,Cleveland Browns Stadium,"Cloudy Temp: 50° F, Wind: NE 10-20 mph",10012010-1003-0139-2c20-3103c9a1e19f,0,0,PENALTY,0,,,,18,Touchdown,2010-10-03T19:24:25Z,9.0,4:05,6.0,1.0,1.0,4.0,4.0,9.0,PUNT,TOUCHDOWN,14:49,10:44,CIN 20,CLE 3,3177.0,3449.0,20,23,Home,3,43,-1.5,36.5,1,outdoors,grass,50.0,10.0,Eric Mangini,Marvin Lewis,CLE00,Cleveland Browns Stadium,0,1.0,C.Palmer,9.0,,,J.Shipley,11.0,1,0,1.0,0,1,00-0021429,,00-0027687,C.Palmer,9.0,00-0021429,,,J.Shipley,00-0027687,0,0,1.97720732167363,,,,,,0.954050600528717,4.5949399471283,2010-10-03,J.Shipley,2010,REG,CIN,4,00-0027687,WR,Jordan Shipley,Jordan,Shipley,Shoulder,,Questionable,Shoulder,,Limited Participation in Practice,2010-10-01T09:57:38Z,2010-10-01 09:57:38
3383,2010_06_IND_WAS,2010101712,WAS,IND,REG,6,IND,away,WAS,WAS,23.0,2010-10-17,875.0,875.0,875.0,Half2,0,21.0,0,4,1.0,0,14:35,WAS 23,10,58.0,"(14:35) (No Huddle) 29-J.Addai right end to WAS 17 for 6 yards (59-L.Fletcher). FUMBLES (59-L.Fletcher), RECOVERED by WAS-30-L.Landry at WAS 17. 30-L.Landry to WAS 17 for no gain (85-P.Garcon). IND-29-J.Addai was injured during the play. His return is Questionable. 29- Shoulder Injury",run,6.0,0,1,0.0,0,0,0,,,,,right,end,,,,,3,3,0.0,,,,,3.0,3.0,17,24,24.0,17.0,7.0,24.0,17.0,7.0,0.0171478390693665,0.0327423885464668,0.0005662928451783,0.054287750273943,0.416873514652252,0.0010657388484105,0.477316439151764,0.0,0.0,4.11459309246857,-4.6857847754145,-10.1410926979777,10.1410926979777,-2.59685307684183,2.59685307684183,-16.9827414546817,16.9827414546817,,,0.0,0.0,-10.7893061822419,10.7893061822419,-0.941541368083563,0.941541368083563,-8.8689986987469,8.8689986987469,-9.62726678883393,9.62726678883393,0.86766904592514,0.13233095407486,0.13233095407486,0.86766904592514,-0.0703491717576981,-0.0713994652032852,0.0713994652032852,0.202680125832558,0.797319874167442,0.907139778137207,0.092860221862793,-0.0589154871107358,0.0589154871107358,-0.557041705938814,0.557041705938814,,,0.0,0.0,-0.18495804177353,0.18495804177353,-0.14643952272966,0.14643952272966,-0.187462807760927,0.187462807760927,-0.372285992131973,0.372285992131973,0.0,0.0,0.0,0.0,0.0,0.0,0.0,0.0,0.0,0,0.0,0.0,0.0,0.0,0.0,0.0,0.0,0.0,0.0,0.0,0.0,1.0,0.0,0.0,1.0,0.0,0.0,0.0,1.0,0.0,0.0,0.0,1.0,0.0,0.0,0.0,0.0,0.0,0.0,0.0,0.0,0.0,0.0,0.0,1.0,0.0,0.0,0.0,0.0,0.0,0.0,,,,,,,00-0024245,J.Addai,6.0,,,,,,,,,,,,,,,,,,,,,,,,,,,,,,,,,,,,,WAS,00-0005322,L.Fletcher,,,,WAS,IND,00-0005322,00-0026345,L.Fletcher,P.Garcon,,,,,,,,,,,,,0.0,,,,,,,,,,,IND,00-0024245,J.Addai,,,,WAS,0.0,00-0025393,L.Landry,,,,,,,,,,,,0.0,,,,,0,,,0.0,0.0,0.0,0.0,,,2010,,,52,0,Turnover,3383,"10/17/10, 20:31:09",2010-10-18T02:50:01Z,Commanders Field,"Sunny Temp: 70° F, Humidity: 46%, Wind: West 7 mph",10012010-1017-1245-b107-2558132ddec1,0,0,RUSH,0,,,,21,Turnover,2010-10-18T02:40:13Z,9.0,4:30,4.0,0.0,0.0,3.0,4.0,-5.0,KICKOFF,FUMBLE,03:53,14:23,IND 25,WAS 23,3142.0,3383.0,27,24,Home,-3,51,-3.0,44.5,0,outdoors,grass,70.0,7.0,Mike Shanahan,Jim Caldwell,WAS00,FedExField,0,0.0,,,J.Addai,29.0,,,0,1,0.0,0,1,,00-0024245,,J.Addai,29.0,00-0024245,J.Addai,00-0024245,J.Addai,00-0024245,0,0,-4.6857847754145,,,,,,0.329226672649384,-32.9226672649384,2010-10-17,J.Addai,2010,REG,IND,6,00-0024245,RB,Joseph Addai,Joseph,Addai,Neck,,Questionable,Neck,,Full Participation in Practice,2010-10-15T12:51:25Z,2010-10-15 12:51:25
3269,2010_07_MIN_GB,2010102412,GB,MIN,REG,7,MIN,away,GB,MIN,78.0,2010-10-24,329.0,329.0,329.0,Half2,0,20.0,0,4,2.0,0,05:29,MIN 22,5,63.0,(5:29) 28-A.Peterson right tackle to MIN 33 for 11 yards (36-N.Collins). MIN-12-P.Harvin was injured during the play.,run,11.0,0,0,0.0,0,0,0,,,,,right,tackle,,,,,3,3,0.0,,,,,3.0,3.0,28,24,24.0,28.0,-4.0,24.0,28.0,-4.0,0.299184203147888,0.133820369839668,0.0021729338914156,0.201442271471024,0.139453411102295,0.0023873718455433,0.221539467573166,0.0,0.0,0.158008372411132,1.03554673609324,-0.246103926673869,0.246103926673869,-12.0097513661603,12.0097513661603,13.1311028825048,-13.1311028825048,,,0.0,0.0,5.53499287739396,-5.53499287739396,8.23739970952738,-8.23739970952738,17.7491085575894,-17.7491085575894,-4.61800567508452,4.61800567508452,0.249186336994171,0.750813663005829,0.750813663005829,0.249186336994171,0.0442850887775421,0.0191353559494019,-0.0191353559494019,0.706528574228287,0.293471425771713,0.264830648899078,0.735169351100922,-0.341994260554831,0.341994260554831,0.439575825789248,-0.439575825789248,,,0.0,0.0,0.0799947048646524,-0.0799947048646524,0.419397608387398,-0.419397608387398,0.0799947048646524,-0.0799947048646524,0.359581120924595,-0.359581120924595,0.0,1.0,0.0,0.0,0.0,0.0,0.0,0.0,0.0,0,0.0,0.0,0.0,0.0,0.0,0.0,0.0,0.0,0.0,0.0,0.0,0.0,0.0,0.0,1.0,0.0,0.0,0.0,0.0,0.0,0.0,0.0,1.0,0.0,0.0,0.0,0.0,0.0,0.0,0.0,0.0,0.0,0.0,0.0,0.0,0.0,0.0,0.0,0.0,0.0,0.0,,,,,,,00-0025394,A.Peterson,11.0,,,,,,,,,,,,,,,,,,,,,,,,,,,,,,,,,,,,,,,,,,,GB,,00-0023486,,N.Collins,,,,,,,,,,,,,,0.0,,,,,,,,,,,,,,,,,,,,,,,,,,,,,,,,0.0,,,,,0,,,0.0,0.0,0.0,0.0,,,2010,,,50,1,First down,3269,"10/24/10, 20:30:48",2010-10-25T03:09:17Z,Lambeau Field,"Temp: 58° F, Humidity: 96%, Wind: South 4 mph",10012010-1024-1215-9725-bbfa8e243cc8,0,0,RUSH,0,,,,20,Turnover on downs,2010-10-25T03:08:39Z,16.0,5:47,4.0,1.0,0.0,4.0,4.0,-20.0,PUNT,DOWNS,06:07,00:20,MIN 17,GB 20,3248.0,3745.0,24,28,Home,4,52,2.5,43.5,1,outdoors,grass,58.0,4.0,Mike McCarthy,Brad Childress,GNB00,Lambeau Field,0,1.0,,,A.Peterson,28.0,,,0,1,1.0,0,1,,00-0025394,,A.Peterson,28.0,00-0025394,A.Peterson,00-0025394,A.Peterson,00-0025394,0,0,1.03554673609324,,,,,,0.653646051883698,-65.3646051883698,2010-10-24,P.Harvin,2010,REG,MIN,7,00-0026998,WR,Percy Harvin,Percy,Harvin,Hamstring,,Probable,Hamstring,,Limited Participation in Practice,2010-10-22T11:31:43Z,2010-10-22 11:31:43
3258,2010_13_STL_ARI,2010120511,ARI,LA,REG,13,ARI,home,LA,ARI,59.0,2010-12-05,737.0,737.0,737.0,Half2,0,19.0,0,4,1.0,0,12:17,ARI 41,10,40.0,"(12:17) 6-M.Hall sacked at ARI 35 for -6 yards (98-F.Robbins). FUMBLES (98-F.Robbins), and recovers at ARI 36. 6-M.Hall to ARI 36 for no gain (55-J.Laurinaitis). ARI-6-M.Hall was injured during the play. He is Out.",pass,-5.0,0,0,1.0,0,0,0,,,,,,,,,,,3,3,0.0,,,,,3.0,3.0,6,19,6.0,19.0,-13.0,6.0,19.0,-13.0,0.05250034481287,0.104605451226234,0.00141175405588,0.160820305347443,0.271217733621597,0.0045443819835782,0.404900044202805,0.0,0.0,2.21466027502902,-0.982819794444367,-15.946680426514,15.946680426514,2.90882288103604,-2.90882288103604,-11.3081309901295,11.3081309901295,,,0.0,0.0,7.38835587163304,-7.38835587163304,-10.7897117048269,10.7897117048269,6.50222389012889,-6.50222389012889,-17.627949643732,17.627949643732,0.085055023431778,0.914944976568222,0.085055023431778,0.914944976568222,-0.0151071846485138,-0.0125103704631329,-0.0125103704631329,0.0699478387832642,0.930052161216736,0.0598326399922371,0.0598326399922371,-0.0467358616657977,0.0467358616657977,-0.379047006368637,0.379047006368637,,,0.0,0.0,0.120994299650192,-0.120994299650192,-0.267965108156204,0.267965108156204,0.120994299650192,-0.120994299650192,-0.488942697644234,0.488942697644234,0.0,0.0,0.0,0.0,0.0,0.0,0.0,0.0,0.0,0,0.0,0.0,0.0,0.0,0.0,0.0,0.0,0.0,0.0,0.0,0.0,1.0,0.0,0.0,1.0,0.0,0.0,0.0,0.0,0.0,0.0,0.0,0.0,1.0,1.0,0.0,0.0,0.0,0.0,0.0,0.0,0.0,0.0,0.0,1.0,0.0,0.0,0.0,0.0,0.0,0.0,00-0027347,M.Hall,,,,,,,,,,,,,,,,,,,,,,,,,,,,,,,,,,,,00-0027011,J.Laurinaitis,,,,,,,LA,00-0019706,F.Robbins,,,,LA,LA,00-0019706,00-0027011,F.Robbins,J.Laurinaitis,,,,,,,,,,,,,0.0,,,,,,,,,,,ARI,00-0027347,M.Hall,,,,ARI,0.0,00-0027347,M.Hall,,,,,00-0019706,F.Robbins,,,,,,0.0,,,,,0,,,0.0,0.0,0.0,0.0,,,2010,,,44,1,First down,3258,"12/5/10, 16:16:15",2010-12-05T23:39:07Z,State Farm Stadium,"Temp: 67° F, Humidity: 20%, Wind: calm mph",10012010-1205-112f-3023-6fc1a1dccc4f,0,0,SACK,0,,,,19,Punt,2010-12-05T23:35:49Z,11.0,6:14,4.0,0.0,0.0,4.0,4.0,-20.0,KICKOFF,PUNT,14:55,08:41,ARI 16,LA 44,3149.0,3522.0,19,6,Home,-13,25,-3.0,43.5,1,closed,grass,,,Ken Whisenhunt,Steve Spagnuolo,PHO00,University of Phoenix Stadium,0,0.0,M.Hall,6.0,,,,,1,0,0.0,0,1,00-0027347,,,M.Hall,6.0,00-0027347,,,,,0,1,-0.982819794444367,,,,,,0.73815381526947,26.184618473053,2010-12-05,M.Hall,2010,REG,ARI,13,00-0027347,QB,Max Hall,Max,Hall,Illness,,Probable,Illness,,Did Not Participate In Practice,2010-12-03T11:53:27Z,2010-12-03 11:53:27
3209,2010_11_ARI_KC,2010112109,KC,ARI,REG,11,KC,home,ARI,ARI,28.0,2010-11-21,655.0,655.0,655.0,Half2,0,19.0,0,4,1.0,0,10:55,ARI 28,10,57.0,(10:55) 20-T.Jones up the middle to ARI 24 for 4 yards (78-A.Branch; 54-G.Hayes). ARI-59-W.Davis was injured during the play.,run,4.0,0,0,0.0,0,0,0,,,,,middle,,,,,,2,2,0.0,,,,,2.0,2.0,21,6,21.0,6.0,15.0,21.0,6.0,15.0,0.0559291243553162,0.034801721572876,0.0004846159135922,0.0536061450839043,0.398583948612213,0.0023784462828189,0.454215943813324,0.0,0.0,3.8994029329624,0.0892374175600708,17.5113523317398,-17.5113523317398,6.82703957290505,-6.82703957290505,5.42593744980591,-5.42593744980591,,,0.0,0.0,-10.8064123277436,10.8064123277436,7.1065066474257,-7.1065066474257,-34.30646800471,34.30646800471,39.0993736689114,-39.0993736689114,0.985867202281952,0.0141327977180481,0.985867202281952,0.0141327977180481,-0.000525951385498,0.0010100603103637,0.0010100603103637,0.985341250896454,0.0146587491035461,0.991948366165161,0.991948366165161,0.103307488081313,-0.103307488081313,0.222302017875639,-0.222302017875639,,,0.0,0.0,-0.0685783120313013,0.0685783120313013,0.0535522140562534,-0.0535522140562534,-0.900384230397018,0.900384230397018,1.09294260665774,-1.09294260665774,0.0,0.0,0.0,0.0,0.0,0.0,0.0,0.0,0.0,0,0.0,0.0,0.0,0.0,0.0,0.0,0.0,0.0,0.0,0.0,0.0,0.0,0.0,0.0,0.0,0.0,0.0,0.0,0.0,0.0,0.0,0.0,1.0,0.0,0.0,0.0,0.0,0.0,0.0,0.0,0.0,0.0,0.0,0.0,0.0,0.0,1.0,0.0,0.0,0.0,0.0,,,,,,,00-0019641,T.Jones,4.0,,,,,,,,,,,,,,,,,,,,,,,,,,,,,,,,,,,,,,,,,,,,,,,,,00-0025420,A.Branch,ARI,00-0021941,G.Hayes,ARI,,,,,,,0.0,,,,,,,,,,,,,,,,,,,,,,,,,,,,,,,,0.0,,,,,0,,,0.0,0.0,0.0,0.0,,,2010,,,42,1,First down,3209,"11/21/10, 13:13:27",2010-11-21T20:41:16Z,GEHA Field at Arrowhead Stadium,"Cloudy Temp: 66° F, Humidity: 65%, Wind: SW 20-30 mph",10012010-1121-091b-fa93-4395b93dec2b,0,0,RUSH,0,,,,19,Field goal,2010-11-21T20:36:17Z,10.0,5:23,3.0,1.0,1.0,4.0,4.0,0.0,PUNT,FIELD_GOAL,13:35,08:12,KC 38,ARI 5,3113.0,3321.0,13,31,Home,18,44,7.0,45.0,0,outdoors,grass,66.0,20.0,Todd Haley,Ken Whisenhunt,KAN00,Arrowhead Stadium,0,1.0,,,T.Jones,20.0,,,0,1,0.0,0,1,,00-0019641,,T.Jones,20.0,00-0019641,T.Jones,00-0019641,T.Jones,00-0019641,0,0,0.0892374175600708,,,,,,0.218284294009209,-21.8284294009209,2010-11-21,W.Davis,2010,REG,ARI,11,00-0026939,LB,Will Davis,Will,Davis,Knee,,Probable,Knee,,Full Participation in Practice,2010-11-19T11:33:13Z,2010-11-19 11:33:13
3206,2010_11_CHI_MIA,2010111800,MIA,CHI,REG,11,MIA,home,CHI,MIA,64.0,2010-11-18,405.0,405.0,405.0,Half2,0,18.0,0,4,2.0,0,06:45,MIA 36,7,16.0,(6:45) 16-T.Thigpen pass short left to 23-R.Brown to MIA 45 for 9 yards (33-C.Tillman). MIA-72-V.Carey was injured during the play. His return is Probable.,pass,9.0,0,0,1.0,0,0,0,short,left,2.0,7.0,,,,,,,3,1,0.0,,,,,3.0,1.0,0,16,0.0,16.0,-16.0,0.0,16.0,-16.0,0.273670852184296,0.0851175114512444,0.0018001905409619,0.143377155065537,0.178514987230301,0.0032779700122773,0.314241290092468,0.0,0.0,1.47919693146832,0.816652191337198,-17.9001363116593,17.9001363116593,-5.19561273030248,5.19561273030248,-14.1552468810675,14.1552468810675,-0.450780401704833,1.26743259304203,-0.450780401704833,1.26743259304203,2.95317690091906,-2.95317690091906,-11.4535399067681,11.4535399067681,-0.66331440488284,0.66331440488284,-9.13392692230821,9.13392692230821,0.0224635861814022,0.977536413818598,0.0224635861814022,0.977536413818598,0.0088000446557998,-0.000167854130268,-0.000167854130268,0.0312636308372021,0.968736369162798,0.0277102813124657,0.0277102813124657,-0.204514681787594,0.204514681787594,-0.288328415714204,0.288328415714204,0.0,0.0088000446557998,0.0,0.0088000446557998,-0.0491870529949665,0.0491870529949665,-0.12375595420599,0.12375595420599,-0.0540207512676716,0.0540207512676716,-0.118931722827256,0.118931722827256,0.0,0.0,1.0,0.0,0.0,0.0,0.0,0.0,0.0,0,0.0,0.0,0.0,0.0,0.0,0.0,0.0,0.0,0.0,0.0,0.0,0.0,0.0,0.0,1.0,0.0,0.0,0.0,0.0,0.0,0.0,0.0,0.0,1.0,0.0,0.0,0.0,0.0,0.0,0.0,0.0,0.0,0.0,0.0,0.0,1.0,0.0,0.0,0.0,0.0,0.0,00-0025604,T.Thigpen,9.0,00-0023437,R.Brown,9.0,,,,,,,,,,,,,,,,,,,,,,,,,,,,,,,,,,,,,,,,,,,,,,CHI,,00-0022123,,C.Tillman,,,,,,,,,,,,,,0.0,,,,,,,,,,,,,,,,,,,,,,,,,,,,,,,,0.0,,,,,0,,,0.0,0.0,0.0,0.0,,,2010,0.753251016139984,24.6748983860016,41,1,First down,3206,"11/18/10, 20:29:44",2010-11-19T04:01:05Z,Hard Rock Stadium,"Clear Temp: 75° F, Humidity: 77%, Wind: N 8 mph",10012010-1118-00de-8c50-5fc5fbe0075d,0,0,PASS,0,,,,18,Turnover on downs,2010-11-19T04:00:23Z,6.0,3:15,1.0,0.0,0.0,4.0,4.0,0.0,PUNT,DOWNS,07:14,03:59,MIA 33,MIA 49,3185.0,3301.0,16,0,Home,-16,16,2.5,40.0,0,outdoors,grass,75.0,8.0,Tony Sparano,Lovie Smith,MIA00,Sun Life Stadium,0,1.0,T.Thigpen,16.0,,,R.Brown,23.0,1,0,1.0,0,1,00-0025604,,00-0023437,T.Thigpen,16.0,00-0025604,R.Brown,00-0023437,R.Brown,00-0023437,0,1,0.816652191337198,0.804061507256569,5.25353847944643,4.0,0.608708053885493,0.401464067457709,0.93257611989975,6.74238801002502,2010-11-18,V.Carey,2010,REG,MIA,11,00-0022890,T,Vernon Carey,Vernon,Carey,Knee,,Probable,Knee,,Full Participation in Practice,2010-11-17T11:18:05Z,2010-11-17 11:18:05
3159,2010_15_WAS_DAL,2010121905,DAL,WAS,REG,15,WAS,away,DAL,DAL,21.0,2010-12-19,29.0,929.0,929.0,Half2,0,17.0,0,3,1.0,0,00:29,DAL 21,10,78.0,(:29) (Shotgun) 46-R.Torain up the middle to DAL 6 for 15 yards (41-T.Newman). DAL-41-T.Newman was injured during the play. His return is Probable.,run,15.0,1,0,0.0,0,0,0,,,,,middle,,,,,,2,3,0.0,,,,,3.0,2.0,30,14,14.0,30.0,-16.0,14.0,30.0,-16.0,0.010223220102489,0.0313385464251041,0.0005476287333294,0.0482927113771439,0.38633331656456,0.0007217761012725,0.522542834281921,0.0,0.0,4.3850834654877,1.12646313069854,10.4161293250837,-10.4161293250837,-2.90045729363919,2.90045729363919,12.1153632565241,-12.1153632565241,,,0.0,0.0,-3.43468376123928,3.43468376123928,3.94300792571917,-3.94300792571917,10.2897779187479,-10.2897779187479,-3.3551127857641,3.3551127857641,0.0860979929566383,0.913902007043362,0.913902007043362,0.0860979929566383,0.0105837434530258,0.0056506916880607,-0.0056506916880607,0.903318263590336,0.0966817364096642,0.0290769413113594,0.970923058688641,-0.0719579593452107,0.0719579593452107,0.339644561858657,-0.339644561858657,,,0.0,0.0,0.0903159716853048,-0.0903159716853048,0.0914642989524486,-0.0914642989524486,0.0903159716853048,-0.0903159716853048,0.207346170384515,-0.207346170384515,0.0,1.0,0.0,0.0,0.0,0.0,0.0,0.0,0.0,0,0.0,0.0,0.0,0.0,0.0,0.0,0.0,0.0,0.0,0.0,0.0,0.0,0.0,0.0,1.0,0.0,0.0,0.0,0.0,0.0,0.0,0.0,1.0,0.0,0.0,0.0,0.0,0.0,0.0,0.0,0.0,0.0,0.0,0.0,0.0,0.0,0.0,0.0,0.0,0.0,0.0,,,,,,,00-0026279,R.Torain,15.0,,,,,,,,,,,,,,,,,,,,,,,,,,,,,,,,,,,,,,,,,,,DAL,,00-0022045,,T.Newman,,,,,,,,,,,,,,0.0,,,,,,,,,,,,,,,,,,,,,,,,,,,,,,,,0.0,,,,,0,,,0.0,0.0,0.0,0.0,,,2010,,,47,1,First down,3159,"12/19/10, 13:03:00",2010-12-19T20:15:41Z,AT&T Stadium,"Sunny skies Temp: 51° F, Humidity: 43%, Wind: mph",10012010-1219-057b-4493-7660afb57494,0,0,RUSH,0,,,,17,Touchdown,2010-12-19T20:09:30Z,14.0,5:42,6.0,1.0,1.0,3.0,4.0,1.0,KICKOFF,TOUCHDOWN,04:26,13:44,WAS 22,DAL 5,2924.0,3381.0,30,33,Home,3,63,9.5,43.5,1,open,matrixturf,,,Jason Garrett,Mike Shanahan,DAL00,Cowboys Stadium,0,1.0,,,R.Torain,46.0,,,0,1,1.0,0,1,,00-0026279,,R.Torain,46.0,00-0026279,R.Torain,00-0026279,R.Torain,00-0026279,0,1,1.12646313069854,,,,,,0.498294591903687,-49.8294591903687,2010-12-19,T.Newman,2010,REG,DAL,15,00-0022045,CB,Terence Newman,Terence,Newman,Illness,,Probable,Illness,,Full Participation in Practice,2010-12-17T11:57:47Z,2010-12-17 11:57:47
3146,2010_05_JAX_BUF,2010101000,BUF,JAX,REG,5,JAX,away,BUF,JAX,54.0,2010-10-10,887.0,887.0,887.0,Half2,0,17.0,0,4,1.0,0,14:47,JAX 46,10,37.0,"(14:47) 32-M.Jones-Drew up the middle to BUF 37 for 17 yards (20-D.Whitner, 54-A.Davis). JAX-32-M.Jones-Drew was injured during the play. His return is Questionable.",run,17.0,0,0,0.0,0,0,0,,,,,middle,,,,,,3,3,0.0,,,,,3.0,3.0,20,27,27.0,20.0,7.0,27.0,20.0,7.0,0.0628994777798653,0.1103730276227,0.0016090313438326,0.175440534949303,0.269818305969238,0.0035344869829714,0.376325130462647,0.0,0.0,1.8883789149113,1.23652700521052,-13.3626334295302,13.3626334295302,1.97206997248577,-1.97206997248577,-10.4285917491685,10.4285917491685,,,0.0,0.0,-4.82591412021855,4.82591412021855,-5.62971330510887,5.62971330510887,1.90097704299416,-1.90097704299416,-10.7331654233971,10.7331654233971,0.833295524120331,0.166704475879669,0.166704475879669,0.833295524120331,0.0249492526054382,0.0391226410865784,-0.0391226410865784,0.141755223274231,0.858244776725769,0.81883841753006,0.18116158246994,0.0902163237333298,-0.0902163237333298,-0.484128453923831,0.484128453923831,,,0.0,0.0,-0.230834074743727,0.230834074743727,-0.241864070957333,0.241864070957333,-0.230834074743727,0.230834074743727,-0.20950491792503,0.20950491792503,0.0,1.0,0.0,0.0,0.0,0.0,0.0,0.0,0.0,0,0.0,0.0,0.0,0.0,0.0,0.0,0.0,0.0,0.0,0.0,0.0,0.0,0.0,0.0,0.0,0.0,0.0,0.0,0.0,0.0,0.0,0.0,1.0,0.0,0.0,0.0,0.0,0.0,0.0,0.0,0.0,0.0,0.0,0.0,0.0,0.0,1.0,0.0,0.0,0.0,0.0,,,,,,,00-0024275,M.Jones-Drew,17.0,,,,,,,,,,,,,,,,,,,,,,,,,,,,,,,,,,,,,,,,,,,,,,,,,00-0021257,A.Davis,BUF,,,,,,,,,,1.0,00-0024223,D.Whitner,BUF,,,,,,,,,,,,,,,,,,,,,,,,,,,,,0.0,,,,,0,,,0.0,0.0,0.0,0.0,,,2010,,,39,1,First down,3146,"10/10/10, 13:02:25",2010-10-10T19:15:17Z,Highmark Stadium,"Sunny Temp: 62° F, Humidity: 52%, Wind: WSW 10 mph",10012010-1010-00a7-63dc-f6237f656352,0,0,RUSH,0,,,,17,Field goal,2010-10-10T19:15:17Z,6.0,3:03,2.0,1.0,1.0,4.0,4.0,0.0,PUNT,FIELD_GOAL,14:47,11:44,JAX 46,BUF 17,3146.0,3264.0,36,26,Home,-10,62,2.5,41.5,0,outdoors,astroplay,62.0,10.0,Chan Gailey,Jack Del Rio,BUF00,Ralph Wilson Stadium,0,1.0,,,M.Jones-Drew,32.0,,,0,1,1.0,0,1,,00-0024275,,M.Jones-Drew,32.0,00-0024275,M.Jones-Drew,00-0024275,M.Jones-Drew,00-0024275,0,1,1.23652700521052,,,,,,0.384969264268875,-38.4969264268875,2010-10-10,M.Jones-Drew,2010,REG,JAX,5,00-0024275,RB,Maurice Jones-Drew,Maurice,Jones-Drew,Ankle,,Probable,Ankle,,Full Participation in Practice,2010-10-08T10:06:31Z,2010-10-08 10:06:31
3130,2010_08_MIN_NE,2010103108,NE,MIN,REG,8,MIN,away,NE,NE,3.0,2010-10-31,455.0,455.0,455.0,Half2,0,18.0,0,4,3.0,1,07:35,NE 3,3,80.0,"(7:35) (Shotgun) 4-B.Favre pass incomplete short left to 84-R.Moss [91-M.Pryor]. MIN-4-B.Favre was injured during the play. PENALTY on NE-24-J.Wilhite, Illegal Contact, 2 yards, enforced at NE 3 - No Play.",no_play,0.0,1,0,0.0,0,0,0,,,,,,,,,,,2,3,0.0,,,,,3.0,2.0,21,10,10.0,21.0,-11.0,10.0,21.0,-11.0,0.038381215184927,0.0152879804372787,0.0004591787874232,0.0238651093095541,0.429579943418503,0.002057897625491,0.490368634462357,0.0,0.0,4.51159800268943,1.72804381215246,3.41063867801267,-3.41063867801267,6.68981446366524,-6.68981446366524,5.45058033427771,-5.45058033427771,,,0.0,0.0,1.84775264607742,-1.84775264607742,-3.69349182385486,3.69349182385486,-5.33742083905963,5.33742083905963,10.7880011733373,-10.7880011733373,0.123172760009766,0.876827239990234,0.876827239990234,0.123172760009766,0.0422342717647553,0.0401939153671265,-0.0401939153671265,0.834592968225479,0.165407031774521,0.0879618972539902,0.91203810274601,0.145458759669784,-0.145458759669784,0.147923934022109,-0.147923934022109,,,0.0,0.0,0.131041750311852,-0.131041750311852,-0.189368141135057,0.189368141135057,0.128621786832809,-0.128621786832809,0.0193021471892996,-0.0193021471892996,0.0,0.0,0.0,1.0,0.0,0.0,0.0,0.0,0.0,0,0.0,0.0,0.0,0.0,0.0,0.0,0.0,0.0,0.0,0.0,0.0,0.0,0.0,0.0,0.0,0.0,1.0,0.0,0.0,0.0,0.0,0.0,0.0,0.0,0.0,0.0,0.0,0.0,0.0,0.0,0.0,0.0,0.0,0.0,0.0,0.0,0.0,0.0,0.0,0.0,0.0,,,,,,,,,,,,,,,,,,,,,,,,,,,,,,,,,,,,,,,,,,,,,,,,,,,,,,,,,,,,,,,,,,,,,,0.0,,,,,,,,,,,,,,,,,,,,,,,,,,,,,,,,0.0,NE,00-0026269,J.Wilhite,2.0,0,,Illegal Contact,0.0,0.0,0.0,0.0,,,2010,,,44,1,First down,3130,"10/31/10, 16:15:27",2010-10-31T22:43:38Z,Gillette Stadium,"Partly Cloudy Temp: 49° F, Wind: NW, gusts to 29 16 mph",10012010-1031-0844-2b78-ba0b87f59dc5,0,0,PENALTY,0,,,,18,Touchdown,2010-10-31T22:33:59Z,9.0,3:34,5.0,1.0,1.0,4.0,4.0,16.0,PUNT,TOUCHDOWN,11:00,07:26,MIN 20,NE 1,2869.0,3191.0,18,28,Home,10,46,5.0,44.5,0,outdoors,fieldturf,49.0,16.0,Bill Belichick,Brad Childress,BOS00,Gillette Stadium,0,1.0,B.Favre,4.0,,,R.Moss,84.0,1,0,1.0,0,1,00-0005106,,00-0011754,B.Favre,4.0,00-0005106,,,R.Moss,00-0011754,0,1,1.72804381215246,,,,,,0.863956868648529,13.6043131351471,2010-10-31,B.Favre,2010,REG,MIN,8,00-0005106,QB,Brett Favre,Brett,Favre,Foot,Ankle,Questionable,Foot,Ankle,Limited Participation in Practice,2010-10-29T12:11:54Z,2010-10-29 12:11:54
3043,2010_13_DAL_IND,2010120510,IND,DAL,REG,13,DAL,away,IND,IND,30.0,2010-12-05,776.0,776.0,776.0,Half2,0,17.0,0,4,,0,12:56,IND 30,0,81.0,1-P.McAfee kicks 72 yards from IND 30 to DAL -2. 88-D.Bryant to DAL 19 for 21 yards (53-K.Conner). DAL-88-D.Bryant was injured during the play. He is Out.,kickoff,0.0,0,0,0.0,0,0,0,,,,,,,,72.0,,,2,3,0.0,,,,,3.0,2.0,28,27,27.0,28.0,-1.0,27.0,28.0,-1.0,0.0591932833194733,0.164080366492271,0.0044862143695354,0.250847309827805,0.199503540992737,0.0015993046108633,0.320289969444275,0.0,0.0,0.586594321299344,-0.123274753103033,-3.18254013821928,3.18254013821928,-6.71783203076003,6.71783203076003,-1.41521421155326,1.41521421155326,,,0.0,0.0,8.57027672219556,-8.57027672219556,1.89226737999707,-1.89226737999707,10.5761628502223,-10.5761628502223,-15.3623968892104,15.3623968892104,0.447984039783478,0.552015960216522,0.552015960216522,0.447984039783478,0.0,-0.0005570948123931,0.0005570948123931,0.552015960216522,0.447984039783478,0.384869068861008,0.615130931138992,-0.315773953088818,0.315773953088818,-0.0358194893212783,0.0358194893212783,,,0.0,0.0,-0.0026172386646318,0.0026172386646318,0.074039490868114,-0.074039490868114,-0.0026172386646318,0.0026172386646318,-0.163425763306183,0.163425763306183,0.0,0.0,0.0,0.0,0.0,0.0,0.0,0.0,0.0,0,0.0,0.0,0.0,0.0,0.0,0.0,1.0,1.0,0.0,0.0,0.0,0.0,0.0,0.0,1.0,0.0,0.0,0.0,0.0,0.0,0.0,0.0,0.0,0.0,0.0,0.0,0.0,0.0,0.0,0.0,0.0,0.0,1.0,0.0,0.0,0.0,0.0,0.0,0.0,0.0,0.0,,,,,,,,,,,,,,,,,,,,,,,,,,D.Bryant,00-0027902,,,,,P.McAfee,00-0027145,,,,,,,,,,,,,,,,,,,IND,,00-0027831,,K.Conner,,,,,,,,,,,,,,0.0,,,,,,,,,,,,,,,,,,,,,,,,,,,,,,,DAL,21.0,,,,,0,,,0.0,0.0,0.0,0.0,,,2010,,,46,1,First down,3043,"12/5/10, 16:15:20",2010-12-05T23:32:10Z,Lucas Oil Stadium,"Cloudy Temp: 25° F, Humidity: 72%, Wind: WNW 17 mph",10012010-1205-103f-7c25-3f3c06be07a6,0,0,KICK_OFF,1,,,,17,Touchdown,2010-12-05T23:32:10Z,18.0,10:18,7.0,1.0,1.0,4.0,4.0,-2.0,KICKOFF,TOUCHDOWN,12:56,02:38,DAL 19,IND 2,3043.0,3536.0,38,35,Home,-3,73,5.5,47.5,0,closed,fieldturf,,,Jim Caldwell,Jason Garrett,IND00,Lucas Oil Stadium,0,0.0,,,,,,,0,0,0.0,1,0,,,,,,,,,,,0,0,-0.123274753103033,,,,,,,,2010-12-05,D.Bryant,2010,REG,DAL,13,00-0027902,WR,Dez Bryant,Dez,Bryant,Back,,Probable,Back,,Limited Participation in Practice,2010-12-03T11:08:50Z,2010-12-03 11:08:50
3029,2010_08_PIT_NO,2010103111,NO,PIT,REG,8,PIT,away,NO,NO,30.0,2010-10-31,775.0,775.0,775.0,Half2,0,17.0,0,4,,0,12:55,NO 30,0,68.0,5-G.Hartley kicks 58 yards from NO 30 to PIT 12. 33-I.Redman to PIT 32 for 20 yards (15-C.Roby). NO-24-L.Torrence was injured during the play. His return is Questionable.,kickoff,0.0,0,0,0.0,0,0,0,,,,,,,,58.0,,,3,2,0.0,,,,,2.0,3.0,13,3,3.0,13.0,-10.0,3.0,13.0,-10.0,0.0642747506499291,0.149282351136208,0.0035419603809714,0.263516575098038,0.1927789747715,0.0024726171977818,0.324132740497589,0.0,0.0,0.552664342336357,0.668568028137088,8.9207399972057,-8.9207399972057,-2.31318287008148,2.31318287008148,7.45325763610179,-7.45325763610179,,,0.0,0.0,-1.4815021615359,1.4815021615359,6.71072427305626,-6.71072427305626,-6.8014467448229,6.8014467448229,12.3957053430424,-12.3957053430424,0.129978254437447,0.870021745562553,0.870021745562553,0.129978254437447,0.0186848193407059,0.0160569697618485,-0.0160569697618485,0.851336926221848,0.148663073778152,0.128571361303329,0.871428638696671,-0.0945392847061157,0.0945392847061157,0.340623302788337,-0.340623302788337,,,0.0,0.0,0.110451877117157,-0.110451877117157,0.0724496975847087,-0.0724496975847087,0.109592795372009,-0.109592795372009,0.177668882937034,-0.177668882937034,0.0,0.0,0.0,0.0,0.0,0.0,0.0,0.0,0.0,0,0.0,0.0,0.0,0.0,0.0,0.0,0.0,0.0,0.0,0.0,0.0,0.0,0.0,0.0,1.0,0.0,0.0,0.0,0.0,0.0,0.0,0.0,0.0,0.0,0.0,0.0,0.0,0.0,0.0,0.0,0.0,0.0,1.0,0.0,0.0,0.0,0.0,0.0,0.0,0.0,0.0,,,,,,,,,,,,,,,,,,,,,,,,,,I.Redman,00-0026566,,,,,G.Hartley,00-0025824,,,,,,,,,,,,,,,,,,,NO,,00-0023503,,C.Roby,,,,,,,,,,,,,,0.0,,,,,,,,,,,,,,,,,,,,,,,,,,,,,,,PIT,20.0,,,,,0,,,0.0,0.0,0.0,0.0,,,2010,,,39,1,First down,3029,"10/31/10, 20:30:52",2010-11-01T02:51:06Z,Caesars Superdome,"Partly Cloudy Temp: 74° F, Humidity: 65%, Wind: NE 3 mph",10012010-1031-1190-a5a4-805f85867330,0,0,KICK_OFF,1,,,,17,Touchdown,2010-11-01T02:51:06Z,4.0,2:07,2.0,0.0,1.0,4.0,4.0,0.0,KICKOFF,TOUCHDOWN,12:55,10:48,PIT 32,NO 38,3029.0,3157.0,10,20,Home,10,30,1.0,45.0,0,dome,sportturf,,,Sean Payton,Mike Tomlin,NOR00,Louisiana Superdome,0,1.0,,,,,,,0,0,0.0,1,0,,,,,,,,,,,0,0,0.668568028137088,,,,,,,,2010-10-31,L.Torrence,2010,REG,NO,8,00-0023186,CB,Leigh Torrence,Leigh,Torrence,Shoulder,,Probable,Shoulder,,Full Participation in Practice,2010-10-29T12:08:10Z,2010-10-29 12:08:10
2977,2010_16_CAR_PIT,2010122300,PIT,CAR,REG,16,CAR,away,PIT,CAR,78.0,2010-12-23,263.0,1163.0,1163.0,Half2,0,18.0,0,3,3.0,0,04:23,CAR 22,20,-7.0,(4:23) (Shotgun) 2-J.Clausen pass short middle to 88-D.Rosario to CAR 25 for 3 yards (51-J.Farrior). CAR-33-M.Goodson was injured during the play.,pass,3.0,1,0,1.0,0,0,0,short,middle,-3.0,6.0,,,,,,,2,1,0.0,,,,,1.0,2.0,27,0,0.0,27.0,-27.0,0.0,27.0,-27.0,0.0376242883503437,0.246685653924942,0.0083626313135027,0.339921891689301,0.151583030819893,0.0021059804130345,0.213716551661491,0.0,0.0,-1.18125855131075,-0.72551546478644,29.3135334144592,-29.3135334144592,-0.471414741768967,0.471414741768967,21.8195622066547,-21.8195622066547,-1.24467668449506,0.519161219708622,-1.24467668449506,0.519161219708622,7.93341263884213,-7.93341263884213,6.46503682222101,-6.46503682222101,17.3205490305554,-17.3205490305554,-0.233288986995357,0.233288986995357,0.001348762307316,0.998651237692684,0.998651237692684,0.001348762307316,-0.0003060610033571,-2.70798627752811e-05,2.70798627752811e-05,0.998957298696041,0.0010427013039588,0.0001397011947119,0.999860298805288,-0.0008588387527188,0.0008588387527188,0.346295019158512,-0.346295019158512,0.0,-0.0003060610033571,0.0,-0.0003060610033571,-0.0861249472945929,0.0861249472945929,0.25013767475111,-0.25013767475111,-0.0861249472945929,0.0861249472945929,0.331604508346296,-0.331604508346296,0.0,0.0,0.0,0.0,0.0,1.0,0.0,0.0,0.0,0,0.0,0.0,0.0,0.0,0.0,0.0,0.0,0.0,0.0,0.0,0.0,0.0,0.0,0.0,1.0,0.0,0.0,0.0,0.0,0.0,0.0,0.0,0.0,1.0,0.0,0.0,0.0,0.0,0.0,0.0,0.0,0.0,0.0,0.0,0.0,1.0,0.0,0.0,0.0,0.0,0.0,00-0027659,J.Clausen,3.0,00-0025542,D.Rosario,3.0,,,,,,,,,,,,,,,,,,,,,,,,,,,,,,,,,,,,,,,,,,,,,,PIT,,00-0005082,,J.Farrior,,,,,,,,,,,,,,0.0,,,,,,,,,,,,,,,,,,,,,,,,,,,,,,,,0.0,,,,,0,,,0.0,0.0,0.0,0.0,,,2010,0.805451273918152,19.4548726081848,37,0,Punt,2977,"12/23/10, 20:29:58",2010-12-24T03:47:53Z,Acrisure Stadium,"Cloudy Temp: 27° F, Humidity: 70%, Wind: From NW 11 mph",10012010-1223-006b-5e0a-374ba3f3e653,0,0,PASS,0,,,,17,Punt,2010-12-24T03:44:13Z,3.0,1:21,0.0,0.0,0.0,3.0,3.0,0.0,KICKOFF,PUNT,05:05,03:44,CAR 32,CAR 25,2914.0,3004.0,3,27,Home,24,30,14.0,37.5,0,outdoors,grass,27.0,11.0,Mike Tomlin,John Fox,PIT00,Heinz Field,0,0.0,J.Clausen,2.0,,,D.Rosario,88.0,1,0,0.0,0,1,00-0027659,,00-0025542,J.Clausen,2.0,00-0027659,D.Rosario,00-0025542,D.Rosario,00-0025542,0,0,-0.72551546478644,0.961340605231452,10.6684333636949,9.0,0.165023703710176,0.0454637185903266,0.83841335773468,16.158664226532,2010-12-23,M.Goodson,2010,REG,CAR,16,00-0027080,RB,Mike Goodson,Mike,Goodson,Illness,,Probable,Illness,,Full Participation in Practice,2010-12-22T10:28:27Z,2010-12-22 10:28:27
2738,2010_04_WAS_PHI,2010100310,PHI,WAS,REG,4,WAS,away,PHI,WAS,84.0,2010-10-03,891.0,891.0,891.0,Half2,0,15.0,0,4,1.0,0,14:51,WAS 16,10,7.0,(14:51) 26-C.Portis up the middle to WAS 18 for 2 yards (27-Q.Mikell). WAS-26-C.Portis was injured during the play. His return is Probable.,run,2.0,0,0,0.0,0,0,0,,,,,middle,,,,,,3,1,0.0,,,,,1.0,3.0,6,17,17.0,6.0,11.0,17.0,6.0,11.0,0.0778031274676323,0.175942987203598,0.0040790964849293,0.296700060367584,0.17204661667347,0.0026684345211833,0.270759671926498,0.0,0.0,-0.196093154605478,-0.419106166344136,-13.3965923822921,13.3965923822921,-10.0198294000399,10.0198294000399,1.0323661532108,-1.0323661532108,,,0.0,0.0,-11.5603041622671,11.5603041622671,10.1913018052379,-10.1913018052379,-17.0780370926659,17.0780370926659,18.9880903385144,-18.9880903385144,0.909223318099976,0.0907766819000244,0.0907766819000244,0.909223318099976,-0.0110315680503845,-0.0034067630767822,0.0034067630767822,0.101808249950409,0.898191750049591,0.88559877872467,0.11440122127533,-0.320538351661291,0.320538351661291,-0.0687728819067772,0.0687728819067772,,,0.0,0.0,-0.020150437951088,0.020150437951088,0.0090907442753021,-0.0090907442753021,-0.020150437951088,0.020150437951088,0.0078969824497405,-0.0078969824497405,0.0,0.0,0.0,0.0,0.0,0.0,0.0,0.0,0.0,0,0.0,0.0,0.0,0.0,0.0,0.0,0.0,0.0,0.0,0.0,0.0,0.0,0.0,0.0,1.0,0.0,0.0,0.0,0.0,0.0,0.0,0.0,1.0,0.0,0.0,0.0,0.0,0.0,0.0,0.0,0.0,0.0,0.0,0.0,0.0,0.0,0.0,0.0,0.0,0.0,0.0,,,,,,,00-0021179,C.Portis,2.0,,,,,,,,,,,,,,,,,,,,,,,,,,,,,,,,,,,,,,,,,,,PHI,,00-0021512,,Q.Mikell,,,,,,,,,,,,,,0.0,,,,,,,,,,,,,,,,,,,,,,,,,,,,,,,,0.0,,,,,0,,,0.0,0.0,0.0,0.0,,,2010,,,37,0,Punt,2738,"10/3/10, 16:15:32",2010-10-03T22:34:15Z,Lincoln Financial Field,"Cloudy Temp: 63° F, Humidity: 57%, Wind: NNE 13 mph",10012010-1003-101e-30d7-923c159b4672,0,0,RUSH,0,,,,15,Punt,2010-10-03T22:34:15Z,3.0,1:21,0.0,0.0,0.0,4.0,4.0,0.0,PUNT,PUNT,14:51,13:30,WAS 16,WAS 23,2738.0,2813.0,17,12,Home,-5,29,5.0,44.0,1,outdoors,grass,63.0,13.0,Andy Reid,Mike Shanahan,PHI00,Lincoln Financial Field,0,0.0,,,C.Portis,26.0,,,0,1,0.0,0,1,,00-0021179,,C.Portis,26.0,00-0021179,C.Portis,00-0021179,C.Portis,00-0021179,0,1,-0.419106166344136,,,,,,0.313065975904465,-31.3065975904465,2010-10-03,C.Portis,2010,REG,WAS,4,00-0021179,RB,Clinton Portis,Clinton,Portis,Wrist,,Questionable,Wrist,,Full Participation in Practice,2010-10-01T11:49:53Z,2010-10-01 11:49:53
2719,2010_12_PHI_CHI,2010112804,CHI,PHI,REG,12,CHI,home,PHI,PHI,31.0,2010-11-28,367.0,1267.0,1267.0,Half2,0,16.0,0,3,1.0,0,06:07,PHI 31,10,83.0,(6:07) 6-J.Cutler right guard to PHI 34 for -3 yards (27-Q.Mikell). PHI-50-E.Sims was injured during the play.,run,-3.0,0,0,0.0,0,0,0,,,,,right,guard,,,,,2,2,0.0,,,,,2.0,2.0,28,13,28.0,13.0,15.0,28.0,13.0,15.0,0.0077004968188703,0.0472582206130028,0.0005343605880625,0.0699119046330452,0.397731602191925,0.0027213525027036,0.474142014980316,0.0,0.0,3.88540490099695,-1.0353415380232,15.4163999195573,-15.4163999195573,1.43999657256063,-1.43999657256063,19.4955243330245,-19.4955243330245,,,0.0,0.0,4.40241480592522,-4.40241480592522,3.90455381089123,-3.90455381089123,-0.964077055075904,0.964077055075904,18.4217128733093,-18.4217128733093,0.964792668819427,0.0352073311805725,0.964792668819427,0.0352073311805725,-0.0032232999801635,-0.0055161714553833,-0.0055161714553833,0.961569368839264,0.0384306311607361,0.928942918777466,0.928942918777466,0.108517684042454,-0.108517684042454,0.408600865406539,-0.408600865406539,,,0.0,0.0,0.0584342038754345,-0.0584342038754345,-0.121991241484509,0.121991241484509,0.0584342038754345,-0.0584342038754345,0.263987740368023,-0.263987740368023,0.0,0.0,0.0,0.0,0.0,0.0,0.0,0.0,0.0,0,0.0,0.0,0.0,0.0,0.0,0.0,0.0,0.0,0.0,0.0,0.0,0.0,0.0,0.0,1.0,0.0,0.0,1.0,0.0,0.0,0.0,0.0,1.0,0.0,0.0,0.0,0.0,0.0,0.0,0.0,0.0,0.0,0.0,0.0,0.0,0.0,0.0,0.0,0.0,0.0,0.0,,,,,,,00-0024226,J.Cutler,-3.0,,,,,,,,,,,,,,,,,,,,,,,,,,,,,00-0021512,Q.Mikell,,,,,,,,,,,,,PHI,,00-0021512,,Q.Mikell,,,,,,,,,,,,,,0.0,,,,,,,,,,,,,,,,,,,,,,,,,,,,,,,,0.0,,,,,0,,,0.0,0.0,0.0,0.0,,,2010,,,38,1,First down,2719,"11/28/10, 16:15:43",2010-11-28T23:17:56Z,Soldier Field,"Partly Cloudy Temp: 45° F, Humidity: 57%, Wind: SSE 16 mph",10012010-1128-04cb-86cf-cb6dcad53980,0,0,RUSH,0,,,,16,Field goal,2010-11-28T23:08:54Z,17.0,10:05,6.0,1.0,1.0,3.0,3.0,-6.0,PUNT,FIELD_GOAL,11:31,01:26,CHI 12,PHI 5,2481.0,2916.0,26,31,Home,5,57,-3.0,41.5,0,outdoors,grass,45.0,16.0,Lovie Smith,Andy Reid,CHI98,Soldier Field,0,0.0,,,J.Cutler,6.0,,,0,1,0.0,0,1,,00-0024226,,J.Cutler,6.0,00-0024226,J.Cutler,00-0024226,J.Cutler,00-0024226,0,0,-1.0353415380232,,,,,,0.350840121507645,-35.0840121507645,2010-11-28,E.Sims,2010,REG,PHI,12,00-0024224,LB,Ernie Sims,Ernie,Sims,Ankle,,Probable,Ankle,,Full Participation in Practice,2010-11-26T11:08:26Z,2010-11-26 11:08:26
2652,2010_15_CLE_CIN,2010121902,CIN,CLE,REG,15,CIN,home,CLE,CIN,80.0,2010-12-19,840.0,840.0,840.0,Half2,0,13.0,0,4,1.0,0,14:00,CIN 20,10,77.0,(14:00) 28-B.Scott left guard to CIN 27 for 7 yards (71-A.Rubin). CLE-21-E.Wright was injured during the play.,run,7.0,0,0,0.0,0,0,0,,,,,left,guard,,,,,2,2,0.0,,,,,2.0,2.0,16,10,16.0,10.0,6.0,16.0,10.0,6.0,0.0922299176454544,0.174667358398438,0.0022648242302238,0.213275656104088,0.217536643147469,0.0048998268321156,0.295125812292099,0.0,0.0,0.706828952766955,0.332928937394172,5.99608343327418,-5.99608343327418,7.96068203163245,-7.96068203163245,-2.7510156116336,2.7510156116336,,,0.0,0.0,-1.31442677602172,1.31442677602172,1.21966823155526,-1.21966823155526,6.80332721024752,-6.80332721024752,-12.7427215279899,12.7427215279899,0.796950459480286,0.203049540519714,0.796950459480286,0.203049540519714,0.0195600986480713,0.0101277828216553,0.0101277828216553,0.816510558128357,0.183489441871643,0.812772691249847,0.812772691249847,0.342832993608676,-0.342832993608676,-0.0578723246693673,0.0578723246693673,,,0.0,0.0,0.0209812527060447,-0.0209812527060447,-0.0557205826044083,0.0557205826044083,0.0209812527060447,-0.0209812527060447,-0.202879413962364,0.202879413962364,0.0,0.0,0.0,0.0,0.0,0.0,0.0,0.0,0.0,0,0.0,0.0,0.0,0.0,0.0,0.0,0.0,0.0,0.0,0.0,0.0,0.0,0.0,0.0,1.0,0.0,0.0,0.0,0.0,0.0,0.0,0.0,1.0,0.0,0.0,0.0,0.0,0.0,0.0,0.0,0.0,0.0,0.0,0.0,0.0,0.0,0.0,0.0,0.0,0.0,0.0,,,,,,,00-0026941,B.Scott,7.0,,,,,,,,,,,,,,,,,,,,,,,,,,,,,,,,,,,,,,,,,,,CLE,,00-0026330,,A.Rubin,,,,,,,,,,,,,,0.0,,,,,,,,,,,,,,,,,,,,,,,,,,,,,,,,0.0,,,,,0,,,0.0,0.0,0.0,0.0,,,2010,,,39,1,First down,2652,"12/19/10, 13:02:49",2010-12-19T20:14:18Z,Paycor Stadium,"Partly Cloudy Temp: 28° F, Humidity: 59%, Wind: WSW 8 mph",10012010-1219-02d5-9df6-c3fdc7bf009c,0,0,RUSH,0,,,,13,Field goal,2010-12-19T20:13:29Z,9.0,4:08,2.0,1.0,1.0,4.0,4.0,0.0,KICKOFF,FIELD_GOAL,14:06,09:58,CIN 20,CLE 3,2630.0,2843.0,17,19,Home,2,36,1.0,41.5,1,outdoors,fieldturf,28.0,8.0,Marvin Lewis,Eric Mangini,CIN00,Paul Brown Stadium,0,1.0,,,B.Scott,28.0,,,0,1,0.0,0,1,,00-0026941,,B.Scott,28.0,00-0026941,B.Scott,00-0026941,B.Scott,00-0026941,0,0,0.332928937394172,,,,,,0.396536082029343,-39.6536082029343,2010-12-19,E.Wright,2010,REG,CLE,15,00-0025440,CB,Eric Wright,Eric,Wright,Knee,,Probable,Knee,,Full Participation in Practice,2010-12-17T11:44:26Z,2010-12-17 11:44:26
2631,2010_03_DAL_HOU,2010092608,HOU,DAL,REG,3,HOU,home,DAL,DAL,45.0,2010-09-26,29.0,929.0,929.0,Half2,0,12.0,0,3,1.0,0,00:29,DAL 45,10,64.0,(:29) 32-D.Ward left tackle to DAL 42 for 3 yards (51-K.Brooking). DAL-90-J.Ratliff was injured during the play.,run,3.0,0,0,0.0,0,0,0,,,,,left,tackle,,,,,3,3,0.0,,,,,3.0,3.0,3,17,3.0,17.0,-14.0,3.0,17.0,-14.0,0.0236684028059244,0.0780224800109863,0.0009255651384592,0.115146636962891,0.325254142284393,0.0041517773643136,0.452830940485001,0.0,0.0,3.1119375359267,-0.264171601273119,-12.9672872445736,12.9672872445736,0.264456511329627,-0.264456511329627,-12.7752652290473,12.7752652290473,,,0.0,0.0,-12.5487373320502,12.5487373320502,2.17919072363663,-2.17919072363663,-14.331287707435,14.331287707435,7.60224016639775,-7.60224016639775,0.105932980775833,0.894067019224167,0.105932980775833,0.894067019224167,-0.0110920369625092,-0.0039643421769142,-0.0039643421769142,0.094840943813324,0.905159056186676,0.100068770349026,0.100068770349026,-0.0350977123363008,0.0350977123363008,-0.427238045805113,0.427238045805113,,,0.0,0.0,-0.0685106800729199,0.0685106800729199,-0.210358649492264,0.210358649492264,-0.0717658685380384,0.0717658685380384,-0.183418989181519,0.183418989181519,0.0,0.0,0.0,0.0,0.0,0.0,0.0,0.0,0.0,0,0.0,0.0,0.0,0.0,0.0,0.0,0.0,0.0,0.0,0.0,0.0,0.0,0.0,0.0,1.0,0.0,0.0,0.0,0.0,0.0,0.0,0.0,1.0,0.0,0.0,0.0,0.0,0.0,0.0,0.0,0.0,0.0,0.0,0.0,0.0,0.0,0.0,0.0,0.0,0.0,0.0,,,,,,,00-0022770,D.Ward,3.0,,,,,,,,,,,,,,,,,,,,,,,,,,,,,,,,,,,,,,,,,,,DAL,,00-0001820,,K.Brooking,,,,,,,,,,,,,,0.0,,,,,,,,,,,,,,,,,,,,,,,,,,,,,,,,0.0,,,,,0,,,0.0,0.0,0.0,0.0,,,2010,,,41,1,First down,2631,"9/26/10, 13:03:12",2010-09-26T19:07:48Z,NRG Stadium,"Clear Temp: 81° F, Humidity: 76%, Wind: NW 8 mph",10012010-0926-087a-7979-3ba0b16149fb,0,0,RUSH,0,,,,12,Field goal,2010-09-26T19:05:27Z,9.0,4:31,4.0,1.0,1.0,3.0,4.0,5.0,KICKOFF,FIELD_GOAL,01:34,12:03,HOU 24,DAL 12,2553.0,2859.0,27,13,Home,-14,40,1.5,47.5,0,closed,grass,,,Gary Kubiak,Wade Phillips,HOU00,Reliant Stadium,0,0.0,,,D.Ward,32.0,,,0,1,0.0,0,1,,00-0022770,,D.Ward,32.0,00-0022770,D.Ward,00-0022770,D.Ward,00-0022770,0,0,-0.264171601273119,,,,,,0.614455342292786,-61.4455342292786,2010-09-26,J.Ratliff,2010,REG,DAL,3,00-0023656,DT,Jay Ratliff,Jay,Ratliff,,,,Not Injury Related,,Did Not Participate In Practice,2010-09-23T12:52:41Z,2010-09-23 12:52:41
2604,2010_04_IND_JAX,2010100308,JAX,IND,REG,4,IND,away,JAX,JAX,26.0,2010-10-03,900.0,900.0,900.0,Half2,0,13.0,0,4,3.0,0,15:00,JAX 26,2,64.0,(15:00) 29-J.Addai up the middle to JAX 19 for 7 yards (50-R.Allen). IND-29-J.Addai was injured during the play. His return is Probable.,run,7.0,0,0,0.0,0,0,0,,,,,middle,,,,,,3,3,0.0,,,,,3.0,3.0,21,14,14.0,21.0,-7.0,14.0,21.0,-7.0,0.018019825220108,0.0517593659460545,0.0006143230129964,0.0811626389622688,0.469155788421631,0.0010460051707923,0.378242075443268,0.0,0.0,3.33260868710931,0.989289374789223,0.679260231325997,-0.679260231325997,7.82873823808041,-7.82873823808041,-2.41314865124878,2.41314865124878,,,0.0,0.0,-1.60749764816137,1.60749764816137,-10.2029617713997,10.2029617713997,-2.7919314946339,2.7919314946339,0.378782843385125,-0.378782843385125,0.28798246383667,0.71201753616333,0.71201753616333,0.28798246383667,0.0330275297164917,0.0111367702484131,-0.0111367702484131,0.678990006446838,0.321009993553162,0.440976232290268,0.559023767709732,0.211897205275104,-0.211897205275104,0.0078864687793607,-0.0078864687793607,,,0.0,0.0,0.035736489219286,-0.035736489219286,-0.283104646714034,0.283104646714034,0.035736489219286,-0.035736489219286,-0.0278500204399252,0.0278500204399252,0.0,1.0,0.0,0.0,1.0,0.0,0.0,0.0,0.0,0,0.0,0.0,0.0,0.0,0.0,0.0,0.0,0.0,0.0,0.0,0.0,0.0,0.0,0.0,1.0,0.0,0.0,0.0,0.0,0.0,0.0,0.0,1.0,0.0,0.0,0.0,0.0,0.0,0.0,0.0,0.0,0.0,0.0,0.0,0.0,0.0,0.0,0.0,0.0,0.0,0.0,,,,,,,00-0024245,J.Addai,7.0,,,,,,,,,,,,,,,,,,,,,,,,,,,,,,,,,,,,,,,,,,,JAX,,00-0026605,,R.Allen,,,,,,,,,,,,,,0.0,,,,,,,,,,,,,,,,,,,,,,,,,,,,,,,,0.0,,,,,0,,,0.0,0.0,0.0,0.0,,,2010,,,39,1,First down,2604,"10/3/10, 16:05:40",2010-10-03T22:07:30Z,EverBank Stadium,"0% Chance of rain Temp: 80° F, Humidity: 30%, Wind: North 10 mph",10012010-1003-088c-88dc-a92c58901af1,0,0,RUSH,0,,,,13,Turnover,2010-10-03T21:56:55Z,11.0,5:54,4.0,1.0,0.0,3.0,4.0,0.0,KICKOFF,FUMBLE,04:37,13:43,IND 26,JAX 23,2375.0,2647.0,28,31,Home,3,59,-7.0,45.5,1,outdoors,grass,80.0,10.0,Jack Del Rio,Jim Caldwell,JAX00,EverBank Field,0,1.0,,,J.Addai,29.0,,,0,1,1.0,0,1,,00-0024245,,J.Addai,29.0,00-0024245,J.Addai,00-0024245,J.Addai,00-0024245,0,0,0.989289374789223,,,,,,0.589050829410553,-58.9050829410553,2010-10-03,J.Addai,2010,REG,IND,4,00-0024245,RB,Joseph Addai,Joseph,Addai,Knee,,Questionable,Knee,,Did Not Participate In Practice,2010-10-01T11:21:10Z,2010-10-01 11:21:10
2525,2010_08_PIT_NO,2010103111,NO,PIT,REG,8,PIT,away,NO,PIT,60.0,2010-10-31,492.0,1392.0,1392.0,Half2,0,15.0,0,3,1.0,0,08:12,PIT 40,10,20.0,(8:12) 34-R.Mendenhall right guard to PIT 40 for no gain (96-A.Brown). PIT-71-F.Adams was injured during the play. His return is Questionable.,run,0.0,0,0,0.0,0,0,0,,,,,right,guard,,,,,3,3,0.0,,,,,3.0,3.0,6,3,3.0,6.0,-3.0,3.0,6.0,-3.0,0.0091207651421427,0.113875299692154,0.0028446721844375,0.223506644368172,0.269118130207062,0.0046980464830994,0.376836448907852,0.0,0.0,1.54274387191981,-0.465487581212074,1.49487708431089,-1.49487708431089,-0.893096594760977,0.893096594760977,-1.02018637309795,1.02018637309795,,,0.0,0.0,-4.60788767616032,4.60788767616032,4.80485270853387,-4.80485270853387,-7.45240748196375,7.45240748196375,4.57322207098349,-4.57322207098349,0.385449051856995,0.614550948143005,0.614550948143005,0.385449051856995,-0.0183299779891968,-0.0169002115726471,0.0169002115726471,0.632880926132202,0.367119073867798,0.418586283922195,0.581413716077805,-0.0371039807796478,0.0371039807796478,0.107740074396133,-0.107740074396133,,,0.0,0.0,0.0426763296127319,-0.0426763296127319,0.0667439699172974,-0.0667439699172974,0.0418172478675842,-0.0418172478675842,0.0125612020492554,-0.0125612020492554,0.0,0.0,0.0,0.0,0.0,0.0,0.0,0.0,0.0,0,0.0,0.0,0.0,0.0,0.0,0.0,0.0,0.0,0.0,0.0,0.0,0.0,0.0,0.0,1.0,0.0,0.0,0.0,0.0,0.0,0.0,0.0,1.0,0.0,0.0,0.0,0.0,0.0,0.0,0.0,0.0,0.0,0.0,0.0,0.0,0.0,0.0,0.0,0.0,0.0,0.0,,,,,,,00-0026163,R.Mendenhall,0.0,,,,,,,,,,,,,,,,,,,,,,,,,,,,,,,,,,,,,,,,,,,NO,,00-0021228,,A.Brown,,,,,,,,,,,,,,0.0,,,,,,,,,,,,,,,,,,,,,,,,,,,,,,,,0.0,,,,,0,,,0.0,0.0,0.0,0.0,,,2010,,,33,1,First down,2525,"10/31/10, 20:30:52",2010-11-01T02:26:30Z,Caesars Superdome,"Partly Cloudy Temp: 74° F, Humidity: 65%, Wind: NE 3 mph",10012010-1031-1190-a5a4-805f85867330,0,0,RUSH,0,,,,15,Turnover on downs,2010-11-01T02:23:46Z,7.0,4:16,1.0,0.0,0.0,3.0,3.0,-10.0,KICKOFF,DOWNS,08:24,04:08,PIT 40,NO 40,2492.0,2719.0,10,20,Home,10,30,1.0,45.0,0,dome,sportturf,,,Sean Payton,Mike Tomlin,NOR00,Louisiana Superdome,0,0.0,,,R.Mendenhall,34.0,,,0,1,0.0,0,1,,00-0026163,,R.Mendenhall,34.0,00-0026163,R.Mendenhall,00-0026163,R.Mendenhall,00-0026163,0,0,-0.465487581212074,,,,,,0.47221177816391,-47.221177816391,2010-10-31,F.Adams,2010,REG,PIT,8,00-0000045,T,Flozell Adams,Flozell,Adams,Ankle,,Probable,Ankle,,Full Participation in Practice,2010-10-29T10:41:44Z,2010-10-29 10:41:44
2522,2010_16_NYJ_CHI,2010122600,CHI,NYJ,REG,16,NYJ,away,CHI,NYJ,73.0,2010-12-26,742.0,1642.0,1642.0,Half2,0,15.0,0,3,4.0,0,12:22,NYJ 27,10,0.0,"(12:22) 9-S.Weatherford punts 43 yards to CHI 30, Center-46-T.Purdum. 23-D.Hester pushed ob at NYJ 32 for 38 yards. NYJ-44-J.Ihedigbo was injured during the play.",punt,0.0,0,0,0.0,0,0,0,,,,,,,,43.0,,,3,3,0.0,,,,,3.0,3.0,24,24,24.0,24.0,0.0,24.0,24.0,0.0,0.0074736652895808,0.248375087976456,0.0073666111566126,0.404588162899017,0.139201298356056,0.0034732045605778,0.189521938562393,0.0,0.0,-1.84077175240964,-2.10707683849614,2.82118763786275,-2.82118763786275,4.42316006697365,-4.42316006697365,-5.63513559365164,5.63513559365164,,,0.0,0.0,2.29108310228912,-2.29108310228912,-4.06332214657487,4.06332214657487,3.127855271101,-3.127855271101,-6.94514899148124,6.94514899148124,0.374563932418823,0.625436067581177,0.625436067581177,0.374563932418823,-0.0250481367111206,-0.0719276666641235,0.0719276666641235,0.650484204292297,0.349515795707703,0.411806344985962,0.588193655014038,0.0718531490978374,-0.0718531490978374,-0.121819373981169,0.121819373981169,,,0.0,0.0,0.170230854180786,-0.170230854180786,-0.136556670069695,0.136556670069695,0.516062248376342,-0.516062248376342,-0.574015930934095,0.574015930934095,0.0,0.0,0.0,0.0,0.0,0.0,0.0,0.0,0.0,0,0.0,0.0,0.0,0.0,0.0,0.0,0.0,0.0,0.0,0.0,0.0,0.0,0.0,0.0,0.0,0.0,0.0,0.0,0.0,0.0,0.0,0.0,0.0,0.0,0.0,0.0,0.0,0.0,0.0,0.0,0.0,0.0,0.0,1.0,0.0,0.0,0.0,0.0,0.0,0.0,0.0,,,,,,,,,,,,,,,,,,,,,,00-0024272,D.Hester,,,,,,,00-0024110,S.Weatherford,,,,,,,,,,,,,,,,,,,,,,,,,,,,,,,,,,,,,,,0.0,,,,,,,,,,,,,,,,,,,,,,,,,,,,,,,CHI,38.0,,,,,0,,,0.0,0.0,0.0,0.0,,,2010,,,33,0,Punt,2522,"12/26/10, 13:02:43",2010-12-26T19:54:37Z,Soldier Field,"Cloudy, occasional flurries, steady temps. Temp: 33° F, Humidity: 85%, Wind: N 9 mph",10012010-1226-00bc-9ab5-a1695a078185,0,0,PUNT,1,,,,15,Punt,2010-12-26T19:51:45Z,3.0,1:14,0.0,0.0,0.0,3.0,3.0,0.0,KICKOFF,PUNT,13:20,12:06,NYJ 27,NYJ 27,2435.0,2522.0,34,38,Home,4,72,1.5,36.0,0,outdoors,grass,33.0,9.0,Lovie Smith,Rex Ryan,CHI98,Soldier Field,0,0.0,,,,,,,0,0,0.0,1,0,,,,,,,,,,,1,1,-2.10707683849614,,,,,,,,2010-12-26,J.Ihedigbo,2010,REG,NYJ,16,00-0025753,S,James Ihedigbo,James,Ihedigbo,Knee,Ankle,Questionable,Knee,Ankle,Limited Participation in Practice,2010-12-24T12:20:34Z,2010-12-24 12:20:34
2515,2010_05_ATL_CLE,2010101007,CLE,ATL,REG,5,CLE,home,ATL,CLE,59.0,2010-10-10,361.0,1261.0,1261.0,Half2,0,15.0,0,3,3.0,0,06:01,CLE 41,7,33.0,"(6:01) (Shotgun) 17-J.Delhomme pass short middle intended for 11-M.Massaquoi INTERCEPTED by 28-T.DeCoud at CLE 40. 28-T.DeCoud to CLE 46 for -6 yards. CLE-40-P.Hillis was injured during the play. His return is Questionable. PENALTY on ATL-23-D.Robinson, Defensive Pass Interference, 15 yards, enforced at CLE 41 - No Play.",no_play,0.0,1,0,0.0,0,0,0,,,,,,,,,,,3,3,0.0,,,,,3.0,3.0,10,13,10.0,13.0,-3.0,10.0,13.0,-3.0,0.0209479331970215,0.154917597770691,0.0019861089531332,0.231278911232948,0.229176849126816,0.0052372454665601,0.356455326080322,0.0,0.0,1.10551493102685,2.05895330081694,-2.15014426829293,2.15014426829293,-14.2842668224199,14.2842668224199,6.59154697446482,-6.59154697446482,,,0.0,0.0,-0.610334693745244,0.610334693745244,-3.31268557283329,3.31268557283329,-2.61346263898304,2.61346263898304,4.58303401604624,-4.58303401604624,0.407235026359558,0.592764973640442,0.407235026359558,0.592764973640442,0.116851449012756,0.075422078371048,0.075422078371048,0.524086475372315,0.475913524627686,0.301524966955185,0.301524966955185,-0.506784409284592,0.506784409284592,0.164482039117401,-0.164482039117401,,,0.0,0.0,-0.0989284813404083,0.0989284813404083,0.0022456466193848,-0.0022456466193848,-0.0989284813404083,0.0989284813404083,0.161441069745606,-0.161441069745606,0.0,0.0,0.0,1.0,0.0,0.0,0.0,0.0,0.0,0,0.0,0.0,0.0,0.0,0.0,0.0,0.0,0.0,0.0,0.0,0.0,0.0,0.0,0.0,0.0,0.0,1.0,0.0,0.0,0.0,0.0,0.0,0.0,0.0,0.0,0.0,0.0,0.0,0.0,0.0,0.0,0.0,0.0,0.0,0.0,0.0,0.0,0.0,0.0,0.0,0.0,,,,,,,,,,,,,,,,,,,,,,,,,,,,,,,,,,,,,,,,,,,,,,,,,,,,,,,,,,,,,,,,,,,,,,0.0,,,,,,,,,,,,,,,,,,,,,,,,,,,,,,,,0.0,ATL,00-0022735,D.Robinson,15.0,0,,Defensive Pass Interference,0.0,0.0,0.0,0.0,,,2010,,,35,1,First down,2515,"10/10/10, 13:03:18",2010-10-10T19:04:05Z,Cleveland Browns Stadium,"Sunny Temp: 71° F, Wind: west 9 mph",10012010-1010-072f-bd0c-54a9b3fd7a24,0,0,PENALTY,0,,,,15,Punt,2010-10-10T18:55:40Z,8.0,3:11,2.0,0.0,0.0,3.0,3.0,15.0,KICKOFF,PUNT,07:57,04:46,CLE 23,ATL 44,2354.0,2632.0,20,10,Home,-10,30,-3.0,41.5,0,outdoors,grass,71.0,9.0,Eric Mangini,Mike Smith,CLE00,Cleveland Browns Stadium,0,1.0,J.Delhomme,17.0,,,M.Massaquoi,11.0,1,0,1.0,0,1,00-0004161,,00-0027026,J.Delhomme,17.0,00-0004161,,,M.Massaquoi,00-0027026,0,1,2.05895330081694,,,,,,0.977531552314758,2.24684476852417,2010-10-10,P.Hillis,2010,REG,CLE,5,00-0026367,RB,Peyton Hillis,Peyton,Hillis,Thigh,,Questionable,Thigh,,Did Not Participate In Practice,2010-10-08T12:28:44Z,2010-10-08 12:28:44
2503,2010_11_OAK_PIT,2010112103,PIT,LV,REG,11,PIT,home,LV,PIT,88.0,2010-11-21,696.0,1596.0,1596.0,Half2,0,14.0,0,3,3.0,0,11:36,PIT 12,26,0.0,"(11:36) (Shotgun) 7-B.Roethlisberger pass short middle to 21-M.Moore to PIT 28 for 16 yards (24-M.Huff; 33-T.Branch). PIT-68-C.Kemoeatu was injured during the play. Penalty on PIT-68-C.Kemoeatu, Offensive Holding, declined.",pass,16.0,1,0,1.0,0,0,0,short,middle,1.0,15.0,,,,,,,3,3,0.0,,,,,3.0,3.0,21,3,21.0,3.0,18.0,21.0,3.0,18.0,0.0067581296898424,0.298939883708954,0.0087311770766973,0.36250975728035,0.106637358665466,0.0035422875080257,0.212881416082382,0.0,0.0,-1.63468374265358,0.511589888017625,16.1453165373662,-16.1453165373662,5.36395338264993,-5.36395338264993,16.336004789322,-16.336004789322,-0.756463346537203,1.26805323455483,-0.756463346537203,1.26805323455483,7.89573294324503,-7.89573294324503,4.4183276751719,-4.4183276751719,7.72800149516837,-7.72800149516837,5.02577665119316,-5.02577665119316,0.935390055179596,0.0646099448204041,0.935390055179596,0.0646099448204041,-0.008367896080017,0.0002814531326293,0.0002814531326293,0.927022159099579,0.0729778409004211,0.976433575153351,0.976433575153351,0.0597537960749134,-0.0597537960749134,0.337022545968596,-0.337022545968596,0.0,-0.008367896080017,0.0,-0.008367896080017,0.176804333925247,-0.176804333925247,0.0579558380296868,-0.0579558380296868,0.176804333925247,-0.176804333925247,0.107846073096101,-0.107846073096101,0.0,0.0,0.0,0.0,0.0,1.0,0.0,0.0,0.0,0,0.0,0.0,0.0,0.0,0.0,0.0,0.0,0.0,0.0,0.0,0.0,0.0,0.0,0.0,0.0,0.0,0.0,0.0,0.0,0.0,0.0,0.0,0.0,1.0,0.0,0.0,0.0,0.0,0.0,0.0,0.0,0.0,0.0,0.0,0.0,1.0,1.0,0.0,0.0,0.0,0.0,00-0022924,B.Roethlisberger,16.0,00-0022217,M.Moore,16.0,,,,,,,,,,,,,,,,,,,,,,,,,,,,,,,,,,,,,,,,,,,,,,,,,,,,00-0024222,M.Huff,LV,00-0026240,T.Branch,LV,,,,,,,0.0,,,,,,,,,,,,,,,,,,,,,,,,,,,,,,,,0.0,,,,,0,,,0.0,0.0,0.0,0.0,,,2010,0.832301080226898,16.7698919773102,29,0,Punt,2503,"11/21/10, 13:02:45",2010-11-21T19:56:29Z,Acrisure Stadium,"Partly Cloudy Temp: 57° F, Humidity: 62%, Wind: From SSE 9 mph",10012010-1121-03c4-9983-12e23d7e50a1,0,0,PASS,0,,,,14,Punt,2010-11-21T19:53:52Z,3.0,1:30,0.0,0.0,0.0,3.0,3.0,-10.0,PUNT,PUNT,12:43,11:13,PIT 28,PIT 28,2410.0,2541.0,3,35,Home,32,38,7.0,41.0,0,outdoors,grass,57.0,9.0,Mike Tomlin,Tom Cable,PIT00,Heinz Field,0,1.0,B.Roethlisberger,7.0,,,M.Moore,21.0,1,0,0.0,0,1,00-0022924,,00-0022217,B.Roethlisberger,7.0,00-0022924,M.Moore,00-0022217,M.Moore,00-0022217,0,1,0.511589888017625,0.672983267878573,8.10534889260453,7.0,0.223221055348404,0.0195916258962825,0.538995265960693,46.1004734039307,2010-11-21,C.Kemoeatu,2010,REG,PIT,11,00-0023362,G,Chris Kemoeatu,Chris,Kemoeatu,Ankle,,Probable,Ankle,,Full Participation in Practice,2010-11-19T10:13:15Z,2010-11-19 10:13:15
