play_id,game_id,old_game_id,home_team,away_team,season_type,week_x,posteam,posteam_type,defteam,side_of_field,yardline_100,game_date,quarter_seconds_remaining,half_seconds_remaining,game_seconds_remaining,game_half,quarter_end,drive,sp,qtr,down,goal_to_go,time,yrdln,ydstogo,ydsnet,desc,play_type,yards_gained,shotgun,no_huddle,qb_dropback,qb_kneel,qb_spike,qb_scramble,pass_length,pass_location,air_yards,yards_after_catch,run_location,run_gap,field_goal_result,kick_distance,extra_point_result,two_point_conv_result,home_timeouts_remaining,away_timeouts_remaining,timeout,timeout_team,td_team,td_player_name,td_player_id,posteam_timeouts_remaining,defteam_timeouts_remaining,total_home_score,total_away_score,posteam_score,defteam_score,score_differential,posteam_score_post,defteam_score_post,score_differential_post,no_score_prob,opp_fg_prob,opp_safety_prob,opp_td_prob,fg_prob,safety_prob,td_prob,extra_point_prob,two_point_conversion_prob,ep,epa,total_home_epa,total_away_epa,total_home_rush_epa,total_away_rush_epa,total_home_pass_epa,total_away_pass_epa,air_epa,yac_epa,comp_air_epa,comp_yac_epa,total_home_comp_air_epa,total_away_comp_air_epa,total_home_comp_yac_epa,total_away_comp_yac_epa,total_home_raw_air_epa,total_away_raw_air_epa,total_home_raw_yac_epa,total_away_raw_yac_epa,wp,def_wp,home_wp,away_wp,wpa,vegas_wpa,vegas_home_wpa,home_wp_post,away_wp_post,vegas_wp,vegas_home_wp,total_home_rush_wpa,total_away_rush_wpa,total_home_pass_wpa,total_away_pass_wpa,air_wpa,yac_wpa,comp_air_wpa,comp_yac_wpa,total_home_comp_air_wpa,total_away_comp_air_wpa,total_home_comp_yac_wpa,total_away_comp_yac_wpa,total_home_raw_air_wpa,total_away_raw_air_wpa,total_home_raw_yac_wpa,total_away_raw_yac_wpa,punt_blocked,first_down_rush,first_down_pass,first_down_penalty,third_down_converted,third_down_failed,fourth_down_converted,fourth_down_failed,incomplete_pass,touchback,interception,punt_inside_twenty,punt_in_endzone,punt_out_of_bounds,punt_downed,punt_fair_catch,kickoff_inside_twenty,kickoff_in_endzone,kickoff_out_of_bounds,kickoff_downed,kickoff_fair_catch,fumble_forced,fumble_not_forced,fumble_out_of_bounds,solo_tackle,safety,penalty,tackled_for_loss,fumble_lost,own_kickoff_recovery,own_kickoff_recovery_td,qb_hit,rush_attempt,pass_attempt,sack,touchdown,pass_touchdown,rush_touchdown,return_touchdown,extra_point_attempt,two_point_attempt,field_goal_attempt,kickoff_attempt,punt_attempt,fumble,complete_pass,assist_tackle,lateral_reception,lateral_rush,lateral_return,lateral_recovery,passer_player_id,passer_player_name,passing_yards,receiver_player_id,receiver_player_name,receiving_yards,rusher_player_id,rusher_player_name,rushing_yards,lateral_receiver_player_id,lateral_receiver_player_name,lateral_receiving_yards,lateral_rusher_player_id,lateral_rusher_player_name,lateral_rushing_yards,lateral_sack_player_id,lateral_sack_player_name,interception_player_id,interception_player_name,lateral_interception_player_id,lateral_interception_player_name,punt_returner_player_id,punt_returner_player_name,lateral_punt_returner_player_id,lateral_punt_returner_player_name,kickoff_returner_player_name,kickoff_returner_player_id,lateral_kickoff_returner_player_id,lateral_kickoff_returner_player_name,punter_player_id,punter_player_name,kicker_player_name,kicker_player_id,own_kickoff_recovery_player_id,own_kickoff_recovery_player_name,blocked_player_id,blocked_player_name,tackle_for_loss_1_player_id,tackle_for_loss_1_player_name,tackle_for_loss_2_player_id,tackle_for_loss_2_player_name,qb_hit_1_player_id,qb_hit_1_player_name,qb_hit_2_player_id,qb_hit_2_player_name,forced_fumble_player_1_team,forced_fumble_player_1_player_id,forced_fumble_player_1_player_name,forced_fumble_player_2_team,forced_fumble_player_2_player_id,forced_fumble_player_2_player_name,solo_tackle_1_team,solo_tackle_2_team,solo_tackle_1_player_id,solo_tackle_2_player_id,solo_tackle_1_player_name,solo_tackle_2_player_name,assist_tackle_1_player_id,assist_tackle_1_player_name,assist_tackle_1_team,assist_tackle_2_player_id,assist_tackle_2_player_name,assist_tackle_2_team,assist_tackle_3_player_id,assist_tackle_3_player_name,assist_tackle_3_team,assist_tackle_4_player_id,assist_tackle_4_player_name,assist_tackle_4_team,tackle_with_assist,tackle_with_assist_1_player_id,tackle_with_assist_1_player_name,tackle_with_assist_1_team,tackle_with_assist_2_player_id,tackle_with_assist_2_player_name,tackle_with_assist_2_team,pass_defense_1_player_id,pass_defense_1_player_name,pass_defense_2_player_id,pass_defense_2_player_name,fumbled_1_team,fumbled_1_player_id,fumbled_1_player_name,fumbled_2_player_id,fumbled_2_player_name,fumbled_2_team,fumble_recovery_1_team,fumble_recovery_1_yards,fumble_recovery_1_player_id,fumble_recovery_1_player_name,fumble_recovery_2_team,fumble_recovery_2_yards,fumble_recovery_2_player_id,fumble_recovery_2_player_name,sack_player_id,sack_player_name,half_sack_1_player_id,half_sack_1_player_name,half_sack_2_player_id,half_sack_2_player_name,return_team,return_yards,penalty_team,penalty_player_id,penalty_player_name,penalty_yards,replay_or_challenge,replay_or_challenge_result,penalty_type,defensive_two_point_attempt,defensive_two_point_conv,defensive_extra_point_attempt,defensive_extra_point_conv,safety_player_name,safety_player_id,season_x,cp,cpoe,series,series_success,series_result,order_sequence,start_time,time_of_day,stadium,weather,nfl_api_id,play_clock,play_deleted,play_type_nfl,special_teams_play,st_play_type,end_clock_time,end_yard_line,fixed_drive,fixed_drive_result,drive_real_start_time,drive_play_count,drive_time_of_possession,drive_first_downs,drive_inside20,drive_ended_with_score,drive_quarter_start,drive_quarter_end,drive_yards_penalized,drive_start_transition,drive_end_transition,drive_game_clock_start,drive_game_clock_end,drive_start_yard_line,drive_end_yard_line,drive_play_id_started,drive_play_id_ended,away_score,home_score,location,result,total,spread_line,total_line,div_game,roof,surface,temp,wind,home_coach,away_coach,stadium_id,game_stadium,aborted_play,success,passer,passer_jersey_number,rusher,rusher_jersey_number,receiver,receiver_jersey_number,pass,rush,first_down,special,play,passer_id,rusher_id,receiver_id,name,jersey_number,id,fantasy_player_name,fantasy_player_id,fantasy,fantasy_id,out_of_bounds,home_opening_kickoff,qb_epa,xyac_epa,xyac_mean_yardage,xyac_median_yardage,xyac_success,xyac_fd,xpass,pass_oe,date_x,injured_player,season_y,game_type,team,week_y,gsis_id,position,full_name,first_name,last_name,report_primary_injury,report_secondary_injury,report_status,practice_primary_injury,practice_secondary_injury,practice_status,date_modified,date_y
5506,2016_08_WAS_CIN,2016103000,CIN,WAS,REG,8,WAS,away,CIN,WAS,57.0,2016-10-30,46.0,46.0,46.0,Overtime,0,26.0,0,5,2.0,0,00:46,WAS 43,20,-1.0,(:46) (Shotgun) 8-K.Cousins pass short right to 80-J.Crowder to WAS 44 for 1 yard (21-D.Dennard). CIN-55-V.Burfict was injured during the play.,pass,1.0,1,0,1.0,0,0,0,short,right,-3.0,4.0,,,,,,,0,2,0.0,,,,,2.0,0.0,27,27,27.0,27.0,0.0,27.0,27.0,0.0,0.744723975658417,0.0286512020975351,0.0016040959162637,0.019632063806057,0.160520166158676,0.0004728070343844,0.0443957112729549,0.0,0.0,0.56668984668795,-0.182564791641198,-0.414062672308695,0.414062672308695,10.2013757157985,-10.2013757157985,-19.6431840746415,19.6431840746415,-0.385773463989608,0.20320867234841,-0.385773463989608,0.20320867234841,-4.6645987028851,4.6645987028851,-11.9878167516576,11.9878167516576,-4.33747618560575,4.33747618560575,-13.0710086830747,13.0710086830747,0.205388684466016,0.794611315533985,0.794611315533985,0.205388684466016,-0.071731680596713,-0.071731680596713,0.071731680596713,0.866342996130697,0.133657003869303,0.205388684466016,0.794611315533985,0.726387603966741,-0.726387603966741,-1.06539867436831,1.06539867436831,0.390462260053027,-0.46219394064974,0.390462260053027,-0.46219394064974,1.23028358785413,-1.23028358785413,-2.11056260945105,2.11056260945105,1.50363613796398,-1.50363613796398,-2.1830115609925,2.1830115609925,0.0,0.0,0.0,0.0,0.0,0.0,0.0,0.0,0.0,0,0.0,0.0,0.0,0.0,0.0,0.0,0.0,0.0,0.0,0.0,0.0,0.0,0.0,0.0,1.0,0.0,0.0,0.0,0.0,0.0,0.0,0.0,0.0,1.0,0.0,0.0,0.0,0.0,0.0,0.0,0.0,0.0,0.0,0.0,0.0,1.0,0.0,0.0,0.0,0.0,0.0,00-0029604,K.Cousins,1.0,00-0031941,J.Crowder,1.0,,,,,,,,,,,,,,,,,,,,,,,,,,,,,,,,,,,,,,,,,,,,,,CIN,,00-0031380,,D.Dennard,,,,,,,,,,,,,,0.0,,,,,,,,,,,,,,,,,,,,,,,,,,,,,,,,0.0,,,,,0,,,0.0,0.0,0.0,0.0,,,2016,0.877481281757355,12.2518718242645,82,0,Turnover on downs,5506,"10/30/16, 09:36:04",2016-10-30T17:29:19Z,Wembley Stadium,"Cloudy Temp: 54° F, Humidity: 90%, Wind: W 2 mph",10012016-1030-0024-6fe8-b218b986cfc5,0,0,PASS,0,,,,26,Turnover on downs,2016-10-30T17:27:32Z,4.0,1:02,0.0,0.0,0.0,5.0,5.0,-10.0,FUMBLE,DOWNS,01:02,00:00,CIN 47,CIN 48,5449.0,5592.0,27,27,Neutral,0,54,3.0,49.0,0,outdoors,grass,54.0,2.0,Marvin Lewis,Jay Gruden,LON00,Wembley Stadium,0,0.0,K.Cousins,8.0,,,J.Crowder,80.0,1,0,0.0,0,1,00-0029604,,00-0031941,K.Cousins,8.0,00-0029604,J.Crowder,00-0031941,J.Crowder,00-0031941,0,0,-0.182564791641198,0.527140130740277,9.96833277550468,8.0,0.432816763117444,0.059459020558279,0.943556487560272,5.64435124397278,2016-10-30,V.Burfict,2016,REG,CIN,8,00-0028912,LB,Vontaze Burfict,Vontaze,Burfict,,,,Not Injury Related,,Did Not Participate In Practice,2016-10-28T06:55:53Z,2016-10-28 06:55:53
4552,2016_11_NE_SF,2016112009,SF,NE,REG,11,NE,away,SF,SF,18.0,2016-11-20,100.0,100.0,100.0,Half2,0,23.0,0,4,1.0,0,01:40,SF 18,10,44.0,(1:40) 29-L.Blount right end to SF 7 for 11 yards (35-E.Reid). SF-35-E.Reid was injured during the play.,run,11.0,0,0,0.0,0,0,0,,,,,right,end,,,,,2,2,0.0,,,,,2.0,2.0,17,30,30.0,17.0,13.0,30.0,17.0,13.0,0.159338742494583,0.0099096745252609,0.0003145012306049,0.0122476667165756,0.331054151058197,0.0019256977830082,0.485209584236145,0.0,0.0,4.2773892453406,0.703531494014897,-23.264226753353,23.264226753353,-6.06220859213499,6.06220859213499,-9.51041033921938,9.51041033921938,,,0.0,0.0,2.54850016720593,-2.54850016720593,-6.64756831560139,6.64756831560139,0.279898320673965,-0.279898320673965,-4.07106069404021,4.07106069404021,0.999287903308868,0.0007120966911315,0.0007120966911315,0.999287903308868,0.0004148483276367,8.56518745422363e-05,-8.56518745422363e-05,0.0002972483634948,0.999702751636505,0.99975723028183,0.0002427697181701,-0.266552086512093,0.266552086512093,-0.187527474216381,0.187527474216381,,,0.0,0.0,0.574955441354187,-0.574955441354187,-0.63090017021967,0.63090017021967,0.570182018278511,-0.570182018278511,-0.581267614414523,0.581267614414523,0.0,1.0,0.0,0.0,0.0,0.0,0.0,0.0,0.0,0,0.0,0.0,0.0,0.0,0.0,0.0,0.0,0.0,0.0,0.0,0.0,0.0,0.0,0.0,1.0,0.0,0.0,0.0,0.0,0.0,0.0,0.0,1.0,0.0,0.0,0.0,0.0,0.0,0.0,0.0,0.0,0.0,0.0,0.0,0.0,0.0,0.0,0.0,0.0,0.0,0.0,,,,,,,00-0027325,L.Blount,11.0,,,,,,,,,,,,,,,,,,,,,,,,,,,,,,,,,,,,,,,,,,,SF,,00-0030548,,E.Reid,,,,,,,,,,,,,,0.0,,,,,,,,,,,,,,,,,,,,,,,,,,,,,,,,0.0,,,,,0,,,0.0,0.0,0.0,0.0,,,2016,,,62,1,First down,4552,"11/20/16, 16:49:40",,Levi's® Stadium,"Cloudy with rain Temp: 64° F, Humidity: 64%, Wind: South to SouthEast 6 MPH mph",10012016-1120-09e1-bb76-83f8c593fe19,0,0,RUSH,0,,,,23,End of half,2016-11-21T19:19:32Z,7.0,2:06,4.0,1.0,0.0,4.0,4.0,8.0,KICKOFF,END_GAME,02:06,00:00,SF 48,SF 3,4418.0,4708.0,30,17,Home,-13,47,-10.5,51.5,0,outdoors,grass,64.0,6.0,Chip Kelly,Bill Belichick,SFO01,Levi's Stadium,0,1.0,,,L.Blount,29.0,,,0,1,1.0,0,1,,00-0027325,,L.Blount,29.0,00-0027325,L.Blount,00-0027325,L.Blount,00-0027325,0,1,0.703531494014897,,,,,,0.0241773910820484,-2.41773910820484,2016-11-20,E.Reid,2016,REG,SF,11,00-0030548,S,Eric Reid,Eric,Reid,,,,Knee,,Full Participation in Practice,2016-11-18T12:47:12Z,2016-11-18 12:47:12
4324,2016_06_JAX_CHI,2016101601,CHI,JAX,REG,6,CHI,home,JAX,CHI,54.0,2016-10-16,79.0,79.0,79.0,Half2,0,22.0,0,4,3.0,0,01:19,CHI 46,16,27.0,(1:19) (Shotgun) 2-B.Hoyer pass short right to 81-C.Meredith to JAX 48 for 6 yards (22-A.Colvin). CHI-71-J.Sitton was injured during the play.,pass,6.0,1,0,1.0,0,0,0,short,right,5.0,1.0,,,,,,,3,3,0.0,,,,,3.0,3.0,16,17,16.0,17.0,-1.0,16.0,17.0,-1.0,0.493312776088715,0.0917874202132225,0.0007096678018569,0.0518411695957184,0.189483016729355,0.0020601011347025,0.170805901288986,0.0,0.0,1.12854077806696,-0.781983245746233,-1.62924442299171,1.62924442299171,0.661668897126219,-0.661668897126219,5.16003552026723,-5.16003552026723,-0.928272594115697,0.146289348369464,-0.928272594115697,0.146289348369464,-10.3751765057677,10.3751765057677,7.06732216305678,-7.06732216305678,-10.0808283166261,10.0808283166261,11.283966292363,-11.283966292363,0.430486679077148,0.569513320922852,0.430486679077148,0.569513320922852,-0.0218765139579773,-0.0216240584850311,-0.0216240584850311,0.408610165119171,0.591389834880829,0.424790143966675,0.424790143966675,0.0097349162598434,-0.0097349162598434,0.0217937997796234,-0.0217937997796234,-0.0105501711368561,-0.0113263428211212,-0.0105501711368561,-0.0113263428211212,-0.0496036410331726,0.0496036410331726,-0.0909994446418587,0.0909994446418587,-0.0539591908454895,0.0539591908454895,-0.0158850677988831,0.0158850677988831,0.0,0.0,0.0,0.0,0.0,1.0,0.0,0.0,0.0,0,0.0,0.0,0.0,0.0,0.0,0.0,0.0,0.0,0.0,0.0,0.0,0.0,0.0,0.0,1.0,0.0,0.0,0.0,0.0,0.0,0.0,0.0,0.0,1.0,0.0,0.0,0.0,0.0,0.0,0.0,0.0,0.0,0.0,0.0,0.0,1.0,0.0,0.0,0.0,0.0,0.0,00-0026625,B.Hoyer,6.0,00-0031912,C.Meredith,6.0,,,,,,,,,,,,,,,,,,,,,,,,,,,,,,,,,,,,,,,,,,,,,,JAX,,00-0031259,,A.Colvin,,,,,,,,,,,,,,0.0,,,,,,,,,,,,,,,,,,,,,,,,,,,,,,,,0.0,,,,,0,,,0.0,0.0,0.0,0.0,,,2016,0.759473741054535,24.0526258945465,61,0,Turnover on downs,4324,"10/16/16, 13:02:31",2016-10-16T19:58:56Z,Soldier Field,"Cloudy Temp: 69° F, Humidity: 93%, Wind: SSW 7 mph",10012016-1016-0143-c91c-28a4b4dbb26a,0,0,PASS,0,,,,22,Turnover on downs,2016-10-16T19:51:17Z,8.0,1:52,2.0,0.0,0.0,4.0,4.0,-10.0,KICKOFF,DOWNS,02:49,00:57,CHI 25,JAX 48,4112.0,4369.0,17,16,Home,-1,33,2.5,46.0,0,outdoors,grass,69.0,7.0,John Fox,Gus Bradley,CHI98,Soldier Field,0,0.0,B.Hoyer,2.0,,,C.Meredith,81.0,1,0,0.0,0,1,00-0026625,,00-0031912,B.Hoyer,2.0,00-0026625,C.Meredith,00-0031912,C.Meredith,00-0031912,0,1,-0.781983245746233,0.491183620318612,4.45777632977115,3.0,0.10748421138851,0.0869876883807592,0.973126709461212,2.68732905387878,2016-10-16,J.Sitton,2016,REG,CHI,6,00-0026275,G,Josh Sitton,Josh,Sitton,Shoulder,,Questionable,Shoulder,,Limited Participation in Practice,2016-10-14T11:50:09Z,2016-10-14 11:50:09
4312,2016_08_KC_IND,2016103005,IND,KC,REG,8,IND,home,KC,KC,40.0,2016-10-30,7.0,7.0,7.0,Half2,0,25.0,0,4,4.0,0,00:07,KC 40,15,35.0,(:07) (Shotgun) 12-A.Luck pass incomplete short left to 81-D.Street (20-S.Nelson). IND-15-P.Dorsett was injured during the play.,pass,0.0,1,0,1.0,0,0,0,short,left,0.0,,,,,,,,0,1,0.0,,,,,0.0,1.0,14,30,14.0,30.0,-16.0,14.0,30.0,-16.0,0.869356095790863,0.0015293641481548,0.0003011930384673,0.0060363025404512,0.10637878626585,0.0006908847135491,0.0157074313610792,0.0,0.0,0.383025551447645,-0.383025551447645,-22.0727136798439,22.0727136798439,1.64124276225478,-1.64124276225478,-22.7401378925437,22.7401378925437,-0.467927733116085,0.0849021816684399,0.0,0.0,-5.05329095991328,5.05329095991328,-12.9741694345721,12.9741694345721,-18.7288985512278,18.7288985512278,-0.38002019469863,0.38002019469863,0.0004567485011648,0.999543251498835,0.0004567485011648,0.999543251498835,6.34212337899953e-05,-2.88187511614524e-05,-2.88187511614524e-05,0.0005201697349548,0.999479830265045,0.0001052319057635,0.0001052319057635,-0.0895897686714307,0.0895897686714307,-0.537144158362289,0.537144158362289,0.167994918330805,-0.167931497097015,0.0,0.0,-0.076254848483178,0.076254848483178,-0.355643390388412,0.355643390388412,0.0917400698476274,-0.0917400698476274,-0.595074383077862,0.595074383077862,0.0,0.0,0.0,0.0,0.0,0.0,0.0,1.0,1.0,0,0.0,0.0,0.0,0.0,0.0,0.0,0.0,0.0,0.0,0.0,0.0,0.0,0.0,0.0,0.0,0.0,0.0,0.0,0.0,0.0,0.0,0.0,0.0,1.0,0.0,0.0,0.0,0.0,0.0,0.0,0.0,0.0,0.0,0.0,0.0,0.0,0.0,0.0,0.0,0.0,0.0,00-0029668,A.Luck,,00-0031310,D.Street,,,,,,,,,,,,,,,,,,,,,,,,,,,,,,,,,,,,,,,,,,,,,,,,,,,,,,,,,,,,,,,,,0.0,,,,,,,00-0032150,S.Nelson,,,,,,,,,,,,,,,,,,,,,,,,0.0,,,,,0,,,0.0,0.0,0.0,0.0,,,2016,0.646476030349731,-64.6476030349731,58,0,Turnover on downs,4312,"10/30/16, 13:02:27",2016-10-30T20:18:19Z,Lucas Oil Stadium,"Partly sunny Temp: 68° F, Humidity: 69%, Wind: NW 9 mph",10012016-1030-05f3-4e9b-a800caaea997,0,0,PASS,0,,,,25,Turnover on downs,2016-10-30T20:06:36Z,12.0,3:33,3.0,0.0,0.0,4.0,4.0,-10.0,KICKOFF,DOWNS,03:35,00:02,IND 25,KC 40,3985.0,4312.0,30,14,Home,-16,44,-3.0,50.5,0,closed,fieldturf,,,Chuck Pagano,Andy Reid,IND00,Lucas Oil Stadium,0,0.0,A.Luck,12.0,,,D.Street,81.0,1,0,0.0,0,1,00-0029668,,00-0031310,A.Luck,12.0,00-0029668,D.Street,00-0031310,D.Street,00-0031310,0,0,-0.383025551447645,0.329129127081497,7.92336909702863,7.0,0.132479056890588,0.132479056890588,0.967778444290161,3.22215557098389,2016-10-30,P.Dorsett,2016,REG,IND,8,00-0032208,WR,Phillip Dorsett,Phillip,Dorsett,,,,Hamstring,,Full Participation in Practice,2016-10-28T12:06:40Z,2016-10-28 12:06:40
4303,2016_09_NO_SF,2016110608,SF,NO,REG,9,NO,away,SF,NO,92.0,2016-11-06,365.0,365.0,365.0,Half2,0,23.0,0,4,1.0,0,06:05,NO 8,10,22.0,(6:05) 68-T.Lelito reported in as eligible. 34-T.Hightower left guard to NO 17 for 9 yards (50-N.Bellore; 90-G.Dorsey). SF-50-N.Bellore was injured during the play. His return is Probable.,run,9.0,0,0,0.0,0,0,0,,,,,left,guard,,,,,2,2,0.0,,,,,2.0,2.0,23,41,41.0,23.0,18.0,41.0,23.0,18.0,0.277681648731232,0.158142134547234,0.0297978315502405,0.196105197072029,0.155578836798668,0.0007896914030425,0.181904643774033,0.0,0.0,-0.165110046626069,0.596054214402102,-23.067698104265,23.067698104265,-20.6065859127266,20.6065859127266,-12.4671731497381,12.4671731497381,,,0.0,0.0,-3.30816080747172,3.30816080747172,3.62206547392998,-3.62206547392998,-2.10042232289561,2.10042232289561,-9.34860017687772,9.34860017687772,0.997800648212433,0.0021993517875671,0.0021993517875671,0.997800648212433,0.0005640983581542,0.0004495978355407,-0.0004495978355407,0.0016352534294128,0.998364746570587,0.999011158943176,0.0009888410568237,-0.437461064512724,0.437461064512724,-0.265476240476745,0.265476240476745,,,0.0,0.0,-0.0717315207337523,0.0717315207337523,0.082624339249721,-0.082624339249721,-0.0715632158433581,0.0715632158433581,-0.171149116723994,0.171149116723994,0.0,0.0,0.0,0.0,0.0,0.0,0.0,0.0,0.0,0,0.0,0.0,0.0,0.0,0.0,0.0,0.0,0.0,0.0,0.0,0.0,0.0,0.0,0.0,0.0,0.0,0.0,0.0,0.0,0.0,0.0,0.0,1.0,0.0,0.0,0.0,0.0,0.0,0.0,0.0,0.0,0.0,0.0,0.0,0.0,0.0,1.0,0.0,0.0,0.0,0.0,,,,,,,00-0026289,T.Hightower,9.0,,,,,,,,,,,,,,,,,,,,,,,,,,,,,,,,,,,,,,,,,,,,,,,,,00-0028292,N.Bellore,SF,00-0026145,G.Dorsey,SF,,,,,,,0.0,,,,,,,,,,,,,,,,,,,,,,,,,,,,,,,,0.0,,,,,0,,,0.0,0.0,0.0,0.0,,,2016,,,62,1,First down,4303,"11/6/16, 16:08:02",2016-11-07T00:05:16Z,Levi's® Stadium,"Mostly Sunny Temp: 70° F, Humidity: 60%, Wind: Calm 0 mph",10012016-1106-084d-6e2e-70ec1c617bd3,0,0,RUSH,0,,,,23,Punt,2016-11-07T00:05:16Z,5.0,3:11,1.0,0.0,0.0,4.0,4.0,0.0,FUMBLE,PUNT,06:05,02:54,NO 8,NO 30,4303.0,4475.0,41,23,Home,-18,64,-5.0,53.0,0,outdoors,grass,70.0,0.0,Chip Kelly,Sean Payton,SFO01,Levi's Stadium,0,1.0,,,T.Hightower,34.0,,,0,1,0.0,0,1,,00-0026289,,T.Hightower,34.0,00-0026289,T.Hightower,00-0026289,T.Hightower,00-0026289,0,0,0.596054214402102,,,,,,0.0849724560976028,-8.49724560976028,2016-11-06,N.Bellore,2016,REG,SF,9,00-0028292,LB,Nick Bellore,Nick,Bellore,,,,Shoulder,,Full Participation in Practice,2016-11-04T12:19:41Z,2016-11-04 12:19:41
4170,2016_04_LA_ARI,2016100209,ARI,LA,REG,4,ARI,home,LA,ARI,54.0,2016-10-02,56.0,56.0,56.0,Half2,0,24.0,0,4,1.0,0,00:56,ARI 46,10,32.0,(:56) (Shotgun) 5-D.Stanton pass short left to 85-D.Fells to ARI 48 for 2 yards (33-E.Gaines). ARI-85-D.Fells was injured during the play.,pass,2.0,1,0,1.0,0,0,0,short,left,1.0,1.0,,,,,,,0,1,0.0,,,,,0.0,1.0,13,17,13.0,17.0,-4.0,13.0,17.0,-4.0,0.706537902355194,0.0109235066920519,0.0003909387160092,0.011672499589622,0.145804986357689,0.0004537624481599,0.12421640753746,0.0,0.0,1.19257744209608,-0.435514207521919,-5.64208979998397,5.64208979998397,3.69095463590929,-3.69095463590929,-7.11451457480415,7.11451457480415,-0.240848115296103,-0.194666092225816,-0.240848115296103,-0.194666092225816,10.7295131009887,-10.7295131009887,-9.30709630170407,9.30709630170407,12.0765246515512,-12.0765246515512,-17.5948320745838,17.5948320745838,0.293233752250671,0.706766247749329,0.293233752250671,0.706766247749329,-0.0681557655334473,-0.0784603804349899,-0.0784603804349899,0.225077986717224,0.774922013282776,0.300340741872788,0.300340741872788,0.0601551234722138,-0.0601551234722138,-0.502926372514088,0.502926372514088,-0.0159132778644562,-0.0522424876689911,-0.0159132778644562,-0.0522424876689911,0.271738049083087,-0.271738049083087,-0.288093199053459,0.288093199053459,0.264118727736804,-0.264118727736804,-0.582923759737663,0.582923759737663,0.0,0.0,0.0,0.0,0.0,0.0,0.0,0.0,0.0,0,0.0,0.0,0.0,0.0,0.0,0.0,0.0,0.0,0.0,0.0,0.0,0.0,0.0,0.0,1.0,0.0,0.0,0.0,0.0,0.0,0.0,0.0,0.0,1.0,0.0,0.0,0.0,0.0,0.0,0.0,0.0,0.0,0.0,0.0,0.0,1.0,0.0,0.0,0.0,0.0,0.0,00-0025430,D.Stanton,2.0,00-0029738,D.Fells,2.0,,,,,,,,,,,,,,,,,,,,,,,,,,,,,,,,,,,,,,,,,,,,,,LA,,00-0031394,,E.Gaines,,,,,,,,,,,,,,0.0,,,,,,,,,,,,,,,,,,,,,,,,,,,,,,,,0.0,,,,,0,,,0.0,0.0,0.0,0.0,,,2016,0.818323910236359,18.1676089763641,57,1,First down,4170,"10/2/16, 16:25:53",2016-10-02T23:29:26Z,State Farm Stadium,"Temp: ° F, Wind: mph",10012016-1002-0914-92e5-63c70d3be16b,0,0,PASS,0,,,,24,Turnover,,6.0,1:01,2.0,0.0,0.0,4.0,4.0,15.0,PUNT,INTERCEPTION,01:01,00:00,ARI 31,LA 37,4137.0,4342.0,17,13,Home,-4,30,10.0,43.5,1,closed,grass,,,Bruce Arians,Jeff Fisher,PHO00,University of Phoenix Stadium,0,0.0,D.Stanton,5.0,,,D.Fells,85.0,1,0,0.0,0,1,00-0025430,,00-0029738,D.Stanton,5.0,00-0025430,D.Fells,00-0029738,D.Fells,00-0029738,0,1,-0.435514207521919,0.505714878188764,6.36188449412293,5.0,0.60213312113774,0.245601545815589,0.991139352321625,0.886064767837524,2016-10-02,D.Fells,2016,REG,ARI,4,00-0029738,TE,Darren Fells,Darren,Fells,,,,Back,,Full Participation in Practice,2016-09-30T13:21:01Z,2016-09-30 13:21:01
4078,2016_05_CHI_IND,2016100903,IND,CHI,REG,5,CHI,away,IND,IND,47.0,2016-10-09,138.0,138.0,138.0,Half2,0,21.0,0,4,1.0,0,02:18,IND 47,10,47.0,(2:18) (Shotgun) 2-B.Hoyer pass short middle to 86-Z.Miller to IND 30 for 17 yards (20-D.Butler). IND-20-D.Butler was injured during the play.,pass,17.0,1,0,1.0,0,0,0,short,middle,2.0,15.0,,,,,,,2,2,0.0,,,,,2.0,2.0,29,23,23.0,29.0,-6.0,23.0,29.0,-6.0,0.39700385928154,0.0429340861737728,0.0004559575754683,0.0410746559500694,0.219810962677002,0.0017030832823365,0.297017365694046,0.0,0.0,2.32472384913126,1.14919241744792,0.49055892979959,-0.49055892979959,-4.93995962574263,4.93995962574263,-9.41452036987152,9.41452036987152,-0.384246621513739,1.53343903896166,-0.384246621513739,1.53343903896166,14.2493155849807,-14.2493155849807,-10.9857468751725,10.9857468751725,13.5657926544372,-13.5657926544372,-14.0011559452762,14.0011559452762,0.24409855902195,0.75590144097805,0.75590144097805,0.24409855902195,0.0272461920976639,0.0486663281917572,-0.0486663281917572,0.728655248880386,0.271344751119614,0.232701390981674,0.767298609018326,-0.129860430955887,0.129860430955887,-0.106404573582634,0.106404573582634,0.0,0.0272461920976639,0.0,0.0272461920976639,-0.0041962317620375,0.0041962317620375,0.182402719394804,-0.182402719394804,-0.0041962317620375,0.0041962317620375,0.161149655120016,-0.161149655120016,0.0,0.0,1.0,0.0,0.0,0.0,0.0,0.0,0.0,0,0.0,0.0,0.0,0.0,0.0,0.0,0.0,0.0,0.0,0.0,0.0,0.0,0.0,0.0,1.0,0.0,0.0,0.0,0.0,0.0,0.0,0.0,0.0,1.0,0.0,0.0,0.0,0.0,0.0,0.0,0.0,0.0,0.0,0.0,0.0,1.0,0.0,0.0,0.0,0.0,0.0,00-0026625,B.Hoyer,17.0,00-0027125,Z.Miller,17.0,,,,,,,,,,,,,,,,,,,,,,,,,,,,,,,,,,,,,,,,,,,,,,IND,,00-0027017,,D.Butler,,,,,,,,,,,,,,0.0,,,,,,,,,,,,,,,,,,,,,,,,,,,,,,,,0.0,,,,,0,,,0.0,0.0,0.0,0.0,,,2016,0.807195246219635,19.2804753780365,59,1,First down,4078,"10/9/16, 13:02:51",2016-10-09T20:00:04Z,Lucas Oil Stadium,"Mostly Sunny Temp: 60° F, Humidity: 59%, Wind: N 5 mph",10012016-1009-037b-4da5-253318b1edf5,0,0,PASS,0,,,,21,Turnover on downs,2016-10-09T19:58:04Z,7.0,1:31,3.0,0.0,0.0,4.0,4.0,-10.0,KICKOFF,DOWNS,02:28,00:57,CHI 25,IND 28,4011.0,4243.0,23,29,Home,6,52,4.0,47.5,0,open,fieldturf,,,Chuck Pagano,John Fox,IND00,Lucas Oil Stadium,0,1.0,B.Hoyer,2.0,,,Z.Miller,86.0,1,0,1.0,0,1,00-0026625,,00-0027125,B.Hoyer,2.0,00-0026625,Z.Miller,00-0027125,Z.Miller,00-0027125,0,0,1.14919241744792,0.684768667937847,5.78991164627951,4.0,0.671922785724746,0.255530191148864,0.862656474113464,13.7343525886536,2016-10-09,D.Butler,2016,REG,IND,5,00-0027017,CB,Darius Butler,Darius,Butler,Hamstring,,Questionable,Hamstring,,Full Participation in Practice,2016-10-07T12:09:50Z,2016-10-07 12:09:50
4003,2016_02_TB_ARI,2016091808,ARI,TB,REG,2,ARI,home,TB,ARI,75.0,2016-09-18,373.0,373.0,373.0,Half2,0,23.0,0,4,3.0,0,06:13,ARI 25,3,22.0,(6:13) (Shotgun) 5-D.Stanton pass short middle to 85-D.Fells to ARI 36 for 11 yards (28-V.Hargreaves). ARI-69-E.Mathis was injured during the play.,pass,11.0,1,0,1.0,0,0,0,short,middle,5.0,6.0,,,,,,,3,3,0.0,,,,,3.0,3.0,40,7,40.0,7.0,33.0,40.0,7.0,33.0,0.219368457794189,0.151003256440163,0.003057254012674,0.191731214523315,0.174020037055016,0.0034795885439962,0.257340222597122,0.0,0.0,0.52915806742385,1.34900018852204,38.8247006977863,-38.8247006977863,0.158031134225894,-0.158031134225894,31.5897490647865,-31.5897490647865,1.08668333571404,0.262316852807999,1.08668333571404,0.262316852807999,-2.59678005496971,2.59678005496971,8.38239409518428,-8.38239409518428,-6.61713487876114,6.61713487876114,34.5335893065343,-34.5335893065343,0.999917984008789,8.20159912109375e-05,0.999917984008789,8.20159912109375e-05,-2.46763229370117e-05,3.69548797607422e-06,3.69548797607422e-06,0.999893307685852,0.0001066923141479,0.99997878074646,0.99997878074646,0.0607429030824278,-0.0607429030824278,0.360577380944926,-0.360577380944926,0.0,-2.46763229370117e-05,0.0,-2.46763229370117e-05,-0.142939390352911,0.142939390352911,0.267080315092426,-0.267080315092426,-0.14295052301917,0.14295052301917,0.384111536701494,-0.384111536701494,0.0,0.0,1.0,0.0,1.0,0.0,0.0,0.0,0.0,0,0.0,0.0,0.0,0.0,0.0,0.0,0.0,0.0,0.0,0.0,0.0,0.0,0.0,0.0,1.0,0.0,0.0,0.0,0.0,0.0,0.0,0.0,0.0,1.0,0.0,0.0,0.0,0.0,0.0,0.0,0.0,0.0,0.0,0.0,0.0,1.0,0.0,0.0,0.0,0.0,0.0,00-0025430,D.Stanton,11.0,00-0029738,D.Fells,11.0,,,,,,,,,,,,,,,,,,,,,,,,,,,,,,,,,,,,,,,,,,,,,,TB,,00-0032758,,V.Hargreaves,,,,,,,,,,,,,,0.0,,,,,,,,,,,,,,,,,,,,,,,,,,,,,,,,0.0,,,,,0,,,0.0,0.0,0.0,0.0,,,2016,0.735476613044739,26.4523386955261,57,1,First down,4003,"9/18/16, 16:05:31",2016-09-18T23:01:24Z,State Farm Stadium,"Temp: ° F, Wind: mph",10012016-0918-08fe-449a-bafa1eae5041,0,0,PASS,0,,,,23,Punt,2016-09-18T23:00:02Z,6.0,3:47,1.0,0.0,0.0,4.0,4.0,0.0,PUNT,PUNT,07:35,03:48,ARI 18,ARI 40,3961.0,4095.0,7,40,Home,33,47,7.5,49.5,0,closed,grass,,,Bruce Arians,Dirk Koetter,PHO00,University of Phoenix Stadium,0,1.0,D.Stanton,5.0,,,D.Fells,85.0,1,0,1.0,0,1,00-0025430,,00-0029738,D.Stanton,5.0,00-0025430,D.Fells,00-0029738,D.Fells,00-0029738,0,1,1.34900018852204,0.291507115361799,4.98257114228909,3.0,0.998350497451611,0.998350497451611,0.731346309185028,26.8653690814972,2016-09-18,E.Mathis,2016,REG,ARI,2,00-0023514,G,Evan Mathis,Evan,Mathis,Foot,,Questionable,Foot,,Limited Participation in Practice,2016-09-16T13:42:33Z,2016-09-16 13:42:33
3974,2016_07_TB_SF,2016102310,SF,TB,REG,7,TB,away,SF,TB,66.0,2016-10-23,356.0,356.0,356.0,Half2,0,22.0,0,4,1.0,0,05:56,TB 34,10,77.0,"(5:56) 32-J.Rodgers left guard to TB 36 for 2 yards (99-D.Buckner, 41-A.Bethea). TB-68-J.Hawley was injured during the play.",run,2.0,0,0,0.0,0,0,0,,,,,left,guard,,,,,3,2,0.0,,,,,2.0,3.0,17,27,27.0,17.0,10.0,27.0,17.0,10.0,0.263434052467346,0.0905419215559959,0.0021003617439419,0.140316724777222,0.217093005776405,0.0032375222072005,0.283276408910751,0.0,0.0,1.38264536252245,-0.338103943737224,-15.166023587794,15.166023587794,8.88468627131078,-8.88468627131078,-25.748775594831,25.748775594831,,,0.0,0.0,-11.0104451947263,11.0104451947263,-6.29041793502212,6.29041793502212,-13.6669179142336,13.6669179142336,-8.45401210386584,8.45401210386584,0.962297141551971,0.0377028584480286,0.0377028584480286,0.962297141551971,-0.0082745552062988,-0.0033652186393737,0.0033652186393737,0.0459774136543274,0.954022586345673,0.946786940097809,0.0532130599021912,0.173957113283709,-0.173957113283709,-0.562578175251087,0.562578175251087,,,0.0,0.0,-0.37758053470095,0.37758053470095,-0.11024684458971,0.11024684458971,-0.393897783045372,0.393897783045372,-0.15712358802557,0.15712358802557,0.0,0.0,0.0,0.0,0.0,0.0,0.0,0.0,0.0,0,0.0,0.0,0.0,0.0,0.0,0.0,0.0,0.0,0.0,0.0,0.0,0.0,0.0,0.0,0.0,0.0,0.0,0.0,0.0,0.0,0.0,0.0,1.0,0.0,0.0,0.0,0.0,0.0,0.0,0.0,0.0,0.0,0.0,0.0,0.0,0.0,1.0,0.0,0.0,0.0,0.0,,,,,,,00-0028083,J.Rodgers,2.0,,,,,,,,,,,,,,,,,,,,,,,,,,,,,,,,,,,,,,,,,,,,,,,,,00-0024421,A.Bethea,SF,,,,,,,,,,1.0,00-0032378,D.Buckner,SF,,,,,,,,,,,,,,,,,,,,,,,,,,,,,0.0,,,,,0,,,0.0,0.0,0.0,0.0,,,2016,,,57,1,First down,3974,"10/23/16, 16:05:42",2016-10-23T22:59:00Z,Levi's® Stadium,"Clear Temp: 68° F, Humidity: 49%, Wind: W 5 mph",10012016-1023-107e-91e4-cc6feb4e8c81,0,0,RUSH,0,,,,22,Touchdown,2016-10-23T22:55:54Z,6.0,3:26,3.0,0.0,1.0,4.0,4.0,0.0,KICKOFF,TOUCHDOWN,08:08,04:42,TB 23,SF 44,3878.0,4051.0,34,17,Home,-17,51,1.0,45.0,0,outdoors,grass,68.0,5.0,Chip Kelly,Dirk Koetter,SFO01,Levi's Stadium,0,0.0,,,J.Rodgers,32.0,,,0,1,0.0,0,1,,00-0028083,,J.Rodgers,32.0,00-0028083,J.Rodgers,00-0028083,J.Rodgers,00-0028083,0,1,-0.338103943737224,,,,,,0.152118250727654,-15.2118250727654,2016-10-23,J.Hawley,2016,REG,TB,7,00-0027717,C,Joe Hawley,Joe,Hawley,Knee,,Questionable,Knee,,Full Participation in Practice,2016-10-21T11:35:51Z,2016-10-21 11:35:51
3857,2016_06_BAL_NYG,2016101606,NYG,BAL,REG,6,NYG,home,BAL,BAL,33.0,2016-10-16,493.0,493.0,493.0,Half2,0,21.0,0,4,2.0,0,08:13,BAL 33,11,61.0,"(8:13) (No Huddle, Shotgun) 10-E.Manning pass short middle to 84-L.Donnell to BAL 20 for 13 yards (54-Z.Orr, 32-E.Weddle). BAL-24-S.Wright was injured during the play. BAL-90-Z.Smith was injured during the play.",pass,13.0,1,1,1.0,0,0,0,short,middle,2.0,11.0,,,,,,,3,3,0.0,,,,,3.0,3.0,17,16,17.0,16.0,1.0,17.0,16.0,1.0,0.0706286057829857,0.0517532750964165,0.0010552627500146,0.0715311542153359,0.445500314235687,0.001865039113909,0.357666313648224,0.0,0.0,3.18580678617582,1.38884178409353,1.69962465284387,-1.69962465284387,-2.95755203935551,2.95755203935551,5.24375777495313,-5.24375777495313,-0.324474095948972,1.7133158800425,-0.324474095948972,1.7133158800425,-1.06608138105366,1.06608138105366,7.85454322167862,-7.85454322167862,7.51080764102517,-7.51080764102517,-5.25570990661638,5.25570990661638,0.729872465133667,0.270127534866333,0.729872465133667,0.270127534866333,0.0872695446014404,0.0816780924797058,0.0816780924797058,0.817142009735107,0.182857990264893,0.731981158256531,0.731981158256531,0.0868062829596163,-0.0868062829596163,0.242578277323347,-0.242578277323347,0.0,0.0872695446014404,0.0,0.0872695446014404,-0.0247897369407172,0.0247897369407172,0.250037367749172,-0.250037367749172,-0.0247897369407172,0.0247897369407172,0.165184910702663,-0.165184910702663,0.0,0.0,1.0,0.0,0.0,0.0,0.0,0.0,0.0,0,0.0,0.0,0.0,0.0,0.0,0.0,0.0,0.0,0.0,0.0,0.0,0.0,0.0,0.0,0.0,0.0,0.0,0.0,0.0,0.0,0.0,0.0,0.0,1.0,0.0,0.0,0.0,0.0,0.0,0.0,0.0,0.0,0.0,0.0,0.0,1.0,1.0,0.0,0.0,0.0,0.0,00-0022803,E.Manning,13.0,00-0028838,L.Donnell,13.0,,,,,,,,,,,,,,,,,,,,,,,,,,,,,,,,,,,,,,,,,,,,,,,,,,,,00-0025424,E.Weddle,BAL,,,,,,,,,,1.0,00-0030700,Z.Orr,BAL,,,,,,,,,,,,,,,,,,,,,,,,,,,,,0.0,,,,,0,,,0.0,0.0,0.0,0.0,,,2016,0.797168970108032,20.2831029891968,50,1,First down,3857,"10/16/16, 13:02:49",2016-10-16T19:50:34Z,MetLife Stadium,"Partly Cloudy Temp: 66° F, Humidity: 65%, Wind: SSW 6 mph",10012016-1016-0646-ad67-88f3723dab6c,0,0,PASS,0,,,,21,Field goal,2016-10-16T19:46:58Z,7.0,3:20,2.0,1.0,1.0,4.0,4.0,0.0,KICKOFF,FIELD_GOAL,09:14,05:54,NYG 25,BAL 14,3797.0,3951.0,23,27,Home,4,50,3.5,42.5,0,outdoors,fieldturf,66.0,6.0,Ben McAdoo,John Harbaugh,NYC01,MetLife Stadium,0,1.0,E.Manning,10.0,,,L.Donnell,84.0,1,0,1.0,0,1,00-0022803,,00-0028838,E.Manning,10.0,00-0022803,L.Donnell,00-0028838,L.Donnell,00-0028838,0,0,1.38884178409353,0.745332580717257,5.53174888069043,4.0,0.663100928475615,0.208592851122376,0.804133594036102,19.5866405963898,2016-10-16,S.Wright,2016,REG,BAL,6,00-0028027,CB,Shareece Wright,Shareece,Wright,Back,,Questionable,Back,,Full Participation in Practice,2016-10-14T11:10:56Z,2016-10-14 11:10:56
3784,2016_06_IND_HOU,2016101612,HOU,IND,REG,6,HOU,home,IND,IND,26.0,2016-10-16,54.0,54.0,54.0,Half2,0,21.0,1,4,1.0,0,00:54,IND 26,10,53.0,"(:54) (Shotgun) 17-B.Osweiler pass deep middle to 87-C.Fiedorowicz for 26 yards, TOUCHDOWN. IND-29-M.Adams was injured during the play. His return is Probable.",pass,26.0,1,0,1.0,0,0,0,deep,middle,22.0,4.0,,,,,,,0,2,0.0,,HOU,C.Fiedorowicz,00-0031302,0.0,2.0,22,23,16.0,23.0,-7.0,22.0,23.0,-1.0,0.354203075170517,0.0109921507537365,0.0002901924890466,0.0079223485663533,0.257447242736816,0.0004007496754638,0.368744224309921,0.0,0.0,3.26533952052705,3.73466047947295,-5.01282166026067,5.01282166026067,-0.309954337972076,0.309954337972076,-1.59350704100515,1.59350704100515,1.851947639836,1.88271283963695,1.851947639836,1.88271283963695,2.0803103033104,-2.0803103033104,-1.64354990341214,1.64354990341214,4.89787417906337,-4.89787417906337,-9.03358861875321,9.03358861875321,0.152588441967964,0.847411558032036,0.152588441967964,0.847411558032036,0.258234507483157,0.12377361050552,0.12377361050552,0.410822949451121,0.589177050548879,0.17560812830925,0.17560812830925,-0.105130839954084,0.105130839954084,-0.0139287108130852,0.0139287108130852,0.0,0.258234507483157,0.0,0.258234507483157,-0.0270876958966255,0.0270876958966255,0.146841537808617,-0.146841537808617,-0.0408042594790459,0.0408042594790459,-0.0622918972320954,0.0622918972320954,0.0,0.0,1.0,0.0,0.0,0.0,0.0,0.0,0.0,0,0.0,0.0,0.0,0.0,0.0,0.0,0.0,0.0,0.0,0.0,0.0,0.0,0.0,0.0,0.0,0.0,0.0,0.0,0.0,0.0,0.0,0.0,0.0,1.0,0.0,1.0,1.0,0.0,0.0,0.0,0.0,0.0,0.0,0.0,0.0,1.0,0.0,0.0,0.0,0.0,0.0,00-0029682,B.Osweiler,26.0,00-0031302,C.Fiedorowicz,26.0,,,,,,,,,,,,,,,,,,,,,,,,,,,,,,,,,,,,,,,,,,,,,,,,,,,,,,,,,,,,,,,,0.0,,,,,,,,,,,,,,,,,,,,,,,,,,,,,,,,0.0,,,,,0,,,0.0,0.0,0.0,0.0,,,2016,0.452290177345276,54.7709822654724,57,1,Touchdown,3784,"10/16/16, 20:32:53",2016-10-17T03:35:57Z,NRG Stadium,"Clear Temp: 84° F, Humidity: 68%, Wind: SE 11 mph",10012016-1016-1290-f71d-f662a2b3fe5c,0,0,PASS,0,,,,21,Touchdown,2016-10-17T03:35:01Z,3.0,1:01,3.0,0.0,1.0,4.0,4.0,0.0,PUNT,TOUCHDOWN,01:50,00:49,HOU 47,IND 26,3736.0,3804.0,23,26,Home,3,49,3.0,47.5,1,closed,fieldturf,,,Bill O'Brien,Chuck Pagano,HOU00,NRG Stadium,0,1.0,B.Osweiler,17.0,,,C.Fiedorowicz,87.0,1,0,1.0,0,1,00-0029682,,00-0031302,B.Osweiler,17.0,00-0029682,C.Fiedorowicz,00-0031302,C.Fiedorowicz,00-0031302,0,1,3.73466047947295,1.47807691160478,3.14215194055578,4.0,1.0,1.0,0.983952820301056,1.60471796989441,2016-10-16,M.Adams,2016,REG,IND,6,00-0022247,S,Mike Adams,Mike,Adams,,,,Not Injury Related,,Full Participation in Practice,2016-10-14T11:43:27Z,2016-10-14 11:43:27
3740,2016_14_OAK_KC,2016120800,KC,LV,REG,14,LV,away,KC,LV,71.0,2016-12-08,385.0,385.0,385.0,Half2,0,24.0,0,4,1.0,0,06:25,LV 29,10,66.0,(6:25) (Shotgun) 30-J.Richard up the middle to LV 33 for 4 yards (98-K.Reyes). KC-98-K.Reyes was injured during the play.,run,4.0,1,0,0.0,0,0,0,,,,,middle,,,,,,3,3,0.0,,,,,3.0,3.0,21,13,13.0,21.0,-8.0,13.0,21.0,-8.0,0.220633238554001,0.116028591990471,0.0026317455340176,0.154919564723969,0.195877715945244,0.0025506450328975,0.307358473539352,0.0,0.0,1.30645753256977,-0.182831276208162,6.31360054484792,-6.31360054484792,-4.41602567047812,4.41602567047812,12.0958486986623,-12.0958486986623,,,0.0,0.0,6.8837264162139,-6.8837264162139,5.98309920806787,-5.98309920806787,-12.1707226732397,12.1707226732397,27.7127355568504,-27.7127355568504,0.122130930423737,0.877869069576263,0.877869069576263,0.122130930423737,-0.0158824175596237,-0.0036405771970748,0.0036405771970748,0.893751487135887,0.106248512864113,0.122337557375431,0.877662442624569,-0.0590386362647332,0.0590386362647332,0.64893322738433,-0.64893322738433,,,0.0,0.0,0.0843463316559792,-0.0843463316559792,0.474520760798694,-0.474520760798694,0.0843463316559792,-0.0843463316559792,0.618940937543155,-0.618940937543155,0.0,0.0,0.0,0.0,0.0,0.0,0.0,0.0,0.0,0,0.0,0.0,0.0,0.0,0.0,0.0,0.0,0.0,0.0,0.0,0.0,0.0,0.0,0.0,1.0,0.0,0.0,0.0,0.0,0.0,0.0,0.0,1.0,0.0,0.0,0.0,0.0,0.0,0.0,0.0,0.0,0.0,0.0,0.0,0.0,0.0,0.0,0.0,0.0,0.0,0.0,,,,,,,00-0033025,J.Richard,4.0,,,,,,,,,,,,,,,,,,,,,,,,,,,,,,,,,,,,,,,,,,,KC,,00-0029256,,K.Reyes,,,,,,,,,,,,,,0.0,,,,,,,,,,,,,,,,,,,,,,,,,,,,,,,,0.0,,,,,0,,,0.0,0.0,0.0,0.0,,,2016,,,49,1,First down,3740,"12/8/16, 20:26:19",2016-12-09T04:20:55Z,GEHA Field at Arrowhead Stadium,"Clear Temp: 21° F, Humidity: 57%, Wind: West Northwest 7 mph",10012016-1208-0097-2d79-21d4ad002cf8,0,0,RUSH,0,,,,24,Turnover on downs,2016-12-09T04:19:55Z,13.0,5:29,4.0,1.0,0.0,4.0,4.0,14.0,PUNT,DOWNS,07:25,01:56,LV 15,KC 19,3695.0,4036.0,13,21,Home,8,34,3.5,46.0,1,outdoors,grass,21.0,7.0,Andy Reid,Jack Del Rio,KAN00,Arrowhead Stadium,0,0.0,,,J.Richard,30.0,,,0,1,0.0,0,1,,00-0033025,,J.Richard,30.0,00-0033025,J.Richard,00-0033025,J.Richard,00-0033025,0,0,-0.182831276208162,,,,,,0.765208899974823,-76.5208899974823,2016-12-08,K.Reyes,2016,REG,KC,14,00-0029256,DE,Kendall Reyes,Kendall,Reyes,Knee,,Questionable,Knee,,Full Participation in Practice,2016-12-07T12:28:34Z,2016-12-07 12:28:34
3651,2016_15_IND_MIN,2016121806,MIN,IND,REG,15,MIN,home,IND,MIN,71.0,2016-12-18,77.0,77.0,77.0,Half2,0,20.0,0,4,2.0,0,01:17,MIN 29,8,59.0,"(1:17) (No Huddle, Shotgun) 8-S.Bradford pass short left to 21-J.McKinnon to MIN 44 for 15 yards (41-M.Farley). IND-32-T.Green was injured during the play.",pass,15.0,1,1,1.0,0,0,0,short,left,0.0,15.0,,,,,,,3,3,0.0,,,,,3.0,3.0,6,34,6.0,34.0,-28.0,6.0,34.0,-28.0,0.518568992614746,0.0836892798542976,0.0009521615575067,0.0560145974159241,0.213583379983902,0.0015060348669067,0.125685513019562,0.0,0.0,0.878486456233077,0.974148608511314,-32.680150779787,32.680150779787,-3.55074036170582,3.55074036170582,-25.929883568156,25.929883568156,-0.323427330818959,1.29757593933027,-0.323427330818959,1.29757593933027,-19.7452818873571,19.7452818873571,10.7318923338898,-10.7318923338898,-19.9666179983178,19.9666179983178,5.69098612439399,-5.69098612439399,7.2060851380229e-05,0.99992793914862,7.2060851380229e-05,0.99992793914862,6.91856985213235e-06,1.54484187078197e-05,1.54484187078197e-05,7.89794212323614e-05,0.999921020578768,2.02988703676965e-05,2.02988703676965e-05,-0.170309695958969,0.170309695958969,-0.31840909572483,0.31840909572483,-3.04433342535049e-06,9.96290327748284e-06,-3.04433342535049e-06,9.96290327748284e-06,-0.0912184221524512,0.0912184221524512,-0.271698490595638,0.271698490595638,-0.0513319922465598,0.0513319922465598,-0.265334869563132,0.265334869563132,0.0,0.0,1.0,0.0,0.0,0.0,0.0,0.0,0.0,0,0.0,0.0,0.0,0.0,0.0,0.0,0.0,0.0,0.0,0.0,0.0,0.0,0.0,0.0,1.0,0.0,0.0,0.0,0.0,0.0,0.0,0.0,0.0,1.0,0.0,0.0,0.0,0.0,0.0,0.0,0.0,0.0,0.0,0.0,0.0,1.0,0.0,0.0,0.0,0.0,0.0,00-0027854,S.Bradford,15.0,00-0031376,J.McKinnon,15.0,,,,,,,,,,,,,,,,,,,,,,,,,,,,,,,,,,,,,,,,,,,,,,IND,,00-0032496,,M.Farley,,,,,,,,,,,,,,0.0,,,,,,,,,,,,,,,,,,,,,,,,,,,,,,,,0.0,,,,,0,,,0.0,0.0,0.0,0.0,,,2016,0.733796417713165,26.6203582286835,60,1,First down,3651,"12/18/16, 13:02:28",2016-12-18T20:45:16Z,U.S. Bank Stadium,"Indoors Temp: ° F, Wind: mph",10012016-1218-063f-4fbf-140ed20e6126,0,0,PASS,0,,,,20,End of half,2016-12-18T20:44:32Z,8.0,2:00,4.0,1.0,0.0,4.0,4.0,0.0,DOWNS,END_GAME,02:00,00:00,MIN 14,IND 13,3603.0,3823.0,34,6,Home,-28,40,5.0,44.5,0,dome,sportturf,,,Mike Zimmer,Chuck Pagano,MIN01,U.S. Bank Stadium,0,1.0,S.Bradford,8.0,,,J.McKinnon,21.0,1,0,1.0,0,1,00-0027854,,00-0031376,S.Bradford,8.0,00-0027854,J.McKinnon,00-0031376,J.McKinnon,00-0031376,0,0,0.974148608511314,0.647120136485498,7.0522252097071,6.0,0.606663267069962,0.337308841699269,0.745064973831177,25.4935026168823,2016-12-18,T.Green,2016,REG,IND,15,00-0033059,S,T.J. Green,T.J.,Green,Ankle,,Questionable,Ankle,,Did Not Participate In Practice,2016-12-16T10:40:15Z,2016-12-16 10:40:15
3643,2016_03_SD_IND,2016092511,IND,LAC,REG,3,LAC,away,IND,LAC,71.0,2016-09-25,251.0,251.0,251.0,Half2,0,17.0,0,4,2.0,0,04:11,LAC 29,10,29.0,(4:11) (Shotgun) 17-P.Rivers pass short left to 16-Ty.Williams to LAC 40 for 11 yards (21-V.Davis). IND-21-V.Davis was injured during the play.,pass,11.0,1,0,1.0,0,0,0,short,left,6.0,5.0,,,,,,,3,3,0.0,,,,,3.0,3.0,20,22,22.0,20.0,2.0,22.0,20.0,2.0,0.355618566274643,0.104355812072754,0.001356916851364,0.149599552154541,0.154307425022125,0.0025543621741235,0.232207387685776,0.0,0.0,0.730504578212276,0.900354555458762,-7.36406009260099,7.36406009260099,4.06625874585006,-4.06625874585006,-18.8661264408228,18.8661264408228,-0.0981520358473063,0.998506591306068,-0.0981520358473063,0.998506591306068,5.20765083964216,-5.20765083964216,-12.7592397342669,12.7592397342669,7.21507212443976,-7.21507212443976,-20.1180923159666,20.1180923159666,0.706705331802368,0.293294668197632,0.293294668197632,0.706705331802368,0.0633382797241211,0.0654492378234863,-0.0654492378234863,0.229956388473511,0.770043611526489,0.691843569278717,0.308156430721283,0.0395310192949397,-0.0395310192949397,-0.515762305960883,0.515762305960883,0.0,0.0633382797241211,0.0,0.0633382797241211,0.122478544712067,-0.122478544712067,-0.378374829888344,0.378374829888344,0.118101000785828,-0.118101000785828,-0.481444761157036,0.481444761157036,0.0,0.0,1.0,0.0,0.0,0.0,0.0,0.0,0.0,0,0.0,0.0,0.0,0.0,0.0,0.0,0.0,0.0,0.0,0.0,0.0,0.0,0.0,0.0,1.0,0.0,0.0,0.0,0.0,0.0,0.0,0.0,0.0,1.0,0.0,0.0,0.0,0.0,0.0,0.0,0.0,0.0,0.0,0.0,0.0,1.0,0.0,0.0,0.0,0.0,0.0,00-0022942,P.Rivers,11.0,00-0032160,Ty.Williams,11.0,,,,,,,,,,,,,,,,,,,,,,,,,,,,,,,,,,,,,,,,,,,,,,IND,,00-0027001,,V.Davis,,,,,,,,,,,,,,0.0,,,,,,,,,,,,,,,,,,,,,,,,,,,,,,,,0.0,,,,,0,,,0.0,0.0,0.0,0.0,,,2016,0.751327335834503,24.8672664165497,52,1,First down,3643,"9/25/16, 16:25:42",2016-09-25T23:18:24Z,Lucas Oil Stadium,"Cloudy Temp: 85° F, Humidity: 52%, Wind: SSW 8 mph",10012016-0925-119a-93e3-c0a692557c3d,0,0,PASS,0,,,,17,Punt,2016-09-25T23:15:45Z,8.0,4:09,2.0,0.0,0.0,4.0,4.0,0.0,PUNT,PUNT,06:38,02:29,LAC 18,LAC 47,3551.0,3751.0,22,26,Home,4,48,1.5,51.5,0,closed,fieldturf,,,Chuck Pagano,Mike McCoy,IND00,Lucas Oil Stadium,0,1.0,P.Rivers,17.0,,,Ty.Williams,16.0,1,0,1.0,0,1,00-0022942,,00-0032160,P.Rivers,17.0,00-0022942,Ty.Williams,00-0032160,Ty.Williams,00-0032160,0,1,0.900354555458762,0.57766149641689,3.78052674385253,2.0,0.737624892673921,0.314559796534013,0.551915526390076,44.8084473609924,2016-09-25,V.Davis,2016,REG,IND,3,00-0027001,CB,Vontae Davis,Vontae,Davis,Ankle,,Questionable,Ankle,,Full Participation in Practice,2016-09-23T10:35:12Z,2016-09-23 10:35:12
3638,2016_07_WAS_DET,2016102302,DET,WAS,REG,7,WAS,away,DET,WAS,75.0,2016-10-23,10.0,10.0,10.0,Half2,0,17.0,0,4,2.0,0,00:10,WAS 25,10,2.0,(:10) (Shotgun) 8-K.Cousins pass incomplete deep right to 11-D.Jackson. WAS-71-T.Williams was injured during the play.,pass,0.0,1,0,1.0,0,0,0,deep,right,45.0,,,,,,,,1,2,0.0,,,,,2.0,1.0,20,17,17.0,20.0,-3.0,17.0,20.0,-3.0,0.929669618606567,0.0051730605773627,0.0011870780726894,0.0078120534308254,0.034566804766655,0.0002022267144639,0.0213891752064228,0.0,0.0,0.181251382280607,-0.115908276377013,2.64041709923185,-2.64041709923185,5.26396746408655,-5.26396746408655,-3.54333735500406,3.54333735500406,1.98955147556262,-2.10545975193963,0.0,0.0,-3.01881532677958,3.01881532677958,3.30137285607315,-3.30137285607315,-4.90916132945727,4.90916132945727,1.86577103446919,-1.86577103446919,0.10745944827795,0.89254055172205,0.89254055172205,0.10745944827795,-0.0196695625782013,-0.0064146444201469,0.0064146444201469,0.912210114300251,0.087789885699749,0.0853040143847466,0.914695985615253,0.152090086472625,-0.152090086472625,0.0592686293148502,-0.0592686293148502,0.0,-0.0196695625782013,0.0,0.0,-0.0697897819526241,0.0697897819526241,0.29927629038401,-0.29927629038401,-0.145441040182833,0.145441040182833,0.211721023467258,-0.211721023467258,0.0,0.0,0.0,0.0,0.0,0.0,0.0,0.0,1.0,0,0.0,0.0,0.0,0.0,0.0,0.0,0.0,0.0,0.0,0.0,0.0,0.0,0.0,0.0,0.0,0.0,0.0,0.0,0.0,0.0,0.0,0.0,0.0,1.0,0.0,0.0,0.0,0.0,0.0,0.0,0.0,0.0,0.0,0.0,0.0,0.0,0.0,0.0,0.0,0.0,0.0,00-0029604,K.Cousins,,00-0026189,D.Jackson,,,,,,,,,,,,,,,,,,,,,,,,,,,,,,,,,,,,,,,,,,,,,,,,,,,,,,,,,,,,,,,,,0.0,,,,,,,,,,,,,,,,,,,,,,,,,,,,,,,,0.0,,,,,0,,,0.0,0.0,0.0,0.0,,,2016,0.282760560512543,-28.2760560512543,57,0,End of half,3638,"10/23/16, 13:02:52",2016-10-23T19:55:14Z,Ford Field,"Controlled Climate Temp: 68° F, Humidity: 70%, Wind: mph",10012016-1023-021e-b323-55a6d95e7509,0,0,PASS,0,,,,17,End of half,2016-10-23T19:53:42Z,3.0,0:16,0.0,0.0,0.0,4.0,4.0,0.0,KICKOFF,END_GAME,00:16,00:00,WAS 25,WAS 25,3597.0,3726.0,17,20,Home,3,37,-1.0,50.0,0,dome,fieldturf,,,Jim Caldwell,Jay Gruden,DET00,Ford Field,0,0.0,K.Cousins,8.0,,,D.Jackson,11.0,1,0,0.0,0,1,00-0029604,,00-0026189,K.Cousins,8.0,00-0029604,D.Jackson,00-0026189,D.Jackson,00-0026189,0,1,-0.115908276377013,1.69106584243625,13.7937050871551,8.0,1.0,1.0,0.947404265403748,5.25957345962524,2016-10-23,T.Williams,2016,REG,WAS,7,00-0027857,T,Trent Williams,Trent,Williams,,,,Knee,,Full Participation in Practice,2016-10-21T11:10:29Z,2016-10-21 11:10:29
3630,2016_03_MIN_CAR,2016092501,CAR,MIN,REG,3,CAR,home,MIN,MIN,41.0,2016-09-25,206.0,206.0,206.0,Half2,0,21.0,0,4,2.0,0,03:26,MIN 41,16,51.0,"(3:26) (No Huddle, Shotgun) 1-C.Newton pass short right to 19-T.Ginn to MIN 39 for 2 yards (26-T.Waynes). MIN-54-E.Kendricks was injured during the play. PENALTY on CAR-88-G.Olsen, Offensive Pass Interference, 10 yards, enforced at MIN 41 - No Play.",no_play,0.0,1,1,0.0,0,0,0,,,,,,,,,,,3,1,0.0,,,,,3.0,1.0,10,22,10.0,22.0,-12.0,10.0,22.0,-12.0,0.344561278820038,0.0543726123869419,0.0004034193698316,0.0621168166399002,0.261241614818573,0.0041950158774852,0.273109287023544,0.0,0.0,2.10513749299571,-0.673393816337921,-14.2858164124629,14.2858164124629,1.34444246017654,-1.34444246017654,-7.72188208511648,7.72188208511648,,,0.0,0.0,-3.99954707175493,3.99954707175493,4.67766362189132,-4.67766362189132,6.42835319024744,-6.42835319024744,-8.63784975136947,8.63784975136947,0.0579234585165978,0.942076541483402,0.0579234585165978,0.942076541483402,-0.0129471980035305,-0.0136193297803402,-0.0136193297803402,0.0449762605130672,0.955023739486933,0.0703069195151329,0.0703069195151329,-0.182375872172773,0.182375872172773,-0.179840044632554,0.179840044632554,,,0.0,0.0,-0.0267912089377642,0.0267912089377642,0.0789486803114414,-0.0789486803114414,-0.0236983239203692,0.0236983239203692,-0.0370751395821571,0.0370751395821571,0.0,0.0,0.0,0.0,0.0,0.0,0.0,0.0,0.0,0,0.0,0.0,0.0,0.0,0.0,0.0,0.0,0.0,0.0,0.0,0.0,0.0,0.0,0.0,0.0,0.0,1.0,0.0,0.0,0.0,0.0,0.0,0.0,0.0,0.0,0.0,0.0,0.0,0.0,0.0,0.0,0.0,0.0,0.0,0.0,0.0,0.0,0.0,0.0,0.0,0.0,,,,,,,,,,,,,,,,,,,,,,,,,,,,,,,,,,,,,,,,,,,,,,,,,,,,,,,,,,,,,,,,,,,,,,0.0,,,,,,,,,,,,,,,,,,,,,,,,,,,,,,,,0.0,CAR,00-0025418,G.Olsen,10.0,0,,Offensive Pass Interference,0.0,0.0,0.0,0.0,,,2016,,,48,1,First down,3630,"9/25/16, 13:10:53",2016-09-25T19:49:32Z,Bank of America Stadium,"Partly Cloudy Temp: 80° F, Humidity: 63%, Wind: N 0 mph",10012016-0925-0162-0609-5c1f702a2a22,0,0,PENALTY,0,,,,21,Turnover,2016-09-25T19:43:25Z,11.0,2:46,3.0,0.0,0.0,4.0,4.0,-15.0,KICKOFF,INTERCEPTION,05:07,02:21,CAR 25,MIN 24,3455.0,3785.0,22,10,Home,-12,32,6.0,43.0,0,outdoors,grass,80.0,0.0,Ron Rivera,Mike Zimmer,CAR00,Bank of America Stadium,0,0.0,C.Newton,1.0,,,T.Ginn,19.0,1,0,0.0,0,1,00-0027939,,00-0025396,C.Newton,1.0,00-0027939,,,T.Ginn,00-0025396,0,1,-0.673393816337921,,,,,,0.974241018295288,2.57589817047119,2016-09-25,E.Kendricks,2016,REG,MIN,3,00-0031554,LB,Eric Kendricks,Eric,Kendricks,,,,Ankle,,Full Participation in Practice,2016-09-23T10:55:52Z,2016-09-23 10:55:52
3579,2016_11_NE_SF,2016112009,SF,NE,REG,11,NE,away,SF,NE,70.0,2016-11-20,713.0,713.0,713.0,Half2,0,19.0,0,4,2.0,0,11:53,NE 30,10,70.0,(11:53) (Shotgun) 12-T.Brady pass short right to 28-J.White to NE 37 for 7 yards (98-R.Blair). SF-92-Q.Dial was injured during the play. 11-yds YAC,pass,7.0,1,0,1.0,0,0,0,short,right,-4.0,11.0,,,,,,,3,3,0.0,,,,,3.0,3.0,10,20,20.0,10.0,10.0,20.0,10.0,10.0,0.0870715901255608,0.147411853075027,0.0035012618172913,0.247663676738739,0.203050330281258,0.0029353334102779,0.308365941047668,0.0,0.0,0.59069942496717,0.150476483162493,-14.3035536736435,14.3035536736435,-3.09732836397598,3.09732836397598,-7.65243772988993,7.65243772988993,-1.27746141701937,1.42793790018186,-1.27746141701937,1.42793790018186,3.05025832800311,-3.05025832800311,-7.32652034857892,7.32652034857892,-5.17041946822428,5.17041946822428,3.23722970418748,-3.23722970418748,0.889856696128845,0.110143303871155,0.110143303871155,0.889856696128845,0.0208322405815125,0.0019230246543884,-0.0019230246543884,0.0893110632896423,0.910688936710358,0.958198726177216,0.0418012738227844,-0.262631617486477,0.262631617486477,-0.122460676188766,0.122460676188766,0.0,0.0208322405815125,0.0,0.0208322405815125,0.581188165937429,-0.581188165937429,-0.577618762105767,0.577618762105767,0.582152405177122,-0.582152405177122,-0.528171203285519,0.528171203285519,0.0,0.0,0.0,0.0,0.0,0.0,0.0,0.0,0.0,0,0.0,0.0,0.0,0.0,0.0,0.0,0.0,0.0,0.0,0.0,0.0,0.0,0.0,0.0,1.0,0.0,0.0,0.0,0.0,0.0,0.0,0.0,0.0,1.0,0.0,0.0,0.0,0.0,0.0,0.0,0.0,0.0,0.0,0.0,0.0,1.0,0.0,0.0,0.0,0.0,0.0,00-0019596,T.Brady,7.0,00-0031062,J.White,7.0,,,,,,,,,,,,,,,,,,,,,,,,,,,,,,,,,,,,,,,,,,,,,,SF,,00-0032413,,R.Blair,,,,,,,,,,,,,,0.0,,,,,,,,,,,,,,,,,,,,,,,,,,,,,,,,0.0,,,,,0,,,0.0,0.0,0.0,0.0,,,2016,0.863182187080383,13.6817812919617,48,1,First down,3579,"11/20/16, 16:49:40",2016-11-20T23:49:43Z,Levi's® Stadium,"Cloudy with rain Temp: 64° F, Humidity: 64%, Wind: South to SouthEast 6 MPH mph",10012016-1120-09e1-bb76-83f8c593fe19,0,0,PASS,0,,,,19,Touchdown,,5.0,1:55,2.0,0.0,1.0,4.0,4.0,5.0,PUNT,TOUCHDOWN,12:01,10:06,NE 30,NE 44,3557.0,3713.0,30,17,Home,-13,47,-10.5,51.5,0,outdoors,grass,64.0,6.0,Chip Kelly,Bill Belichick,SFO01,Levi's Stadium,0,1.0,T.Brady,12.0,,,J.White,28.0,1,0,0.0,0,1,00-0019596,,00-0031062,T.Brady,12.0,00-0019596,J.White,00-0031062,J.White,00-0031062,0,1,0.150476483162493,1.33128697136785,10.1357104327035,9.0,0.444625131320208,0.2208027462475,0.565013408660889,43.4986591339111,2016-11-20,Q.Dial,2016,REG,SF,11,00-0030088,DT,Quinton Dial,Quinton,Dial,,,,Knee,Neck,Full Participation in Practice,2016-11-18T12:47:26Z,2016-11-18 12:47:26
3527,2016_07_SEA_ARI,2016102312,ARI,SEA,REG,7,SEA,away,ARI,SEA,99.0,2016-10-23,472.0,472.0,472.0,Half2,0,18.0,0,4,3.0,0,07:52,SEA 1,29,-6.0,(7:52) (Shotgun) 3-R.Wilson pass short middle to 89-D.Baldwin to SEA 14 for 13 yards (41-M.Cooper). SEA-78-B.Sowell was injured during the play.,pass,13.0,1,0,1.0,0,0,0,short,middle,13.0,0.0,,,,,,,3,2,0.0,,,,,2.0,3.0,3,0,0.0,3.0,-3.0,0.0,3.0,-3.0,0.174600467085838,0.17791086435318,0.110735818743706,0.356489598751068,0.099991537630558,0.0008019661763682,0.0794697850942612,0.0,0.0,-2.39276438090019,0.477349250810221,4.98533310508356,-4.98533310508356,-1.33828156453092,1.33828156453092,4.78863689938673,-4.78863689938673,0.477349250810221,0.0,0.477349250810221,0.0,-0.0488625684182655,0.0488625684182655,9.17432674882002,-9.17432674882002,6.40417020931374,-6.40417020931374,0.314483512196425,-0.314483512196425,0.20757769048214,0.79242230951786,0.79242230951786,0.20757769048214,0.0024319440126419,0.0226759016513824,-0.0226759016513824,0.789990365505219,0.210009634494782,0.151792883872986,0.848207116127014,-0.0455083250999451,0.0455083250999451,0.266489163041115,-0.266489163041115,0.0024319440126419,0.0,0.0024319440126419,0.0,-0.0084929019212722,0.0084929019212722,0.417283073067665,-0.417283073067665,-0.0053260177373886,0.0053260177373886,0.30978961288929,-0.30978961288929,0.0,0.0,0.0,0.0,0.0,1.0,0.0,0.0,0.0,0,0.0,0.0,0.0,0.0,0.0,0.0,0.0,0.0,0.0,0.0,0.0,0.0,0.0,0.0,1.0,0.0,0.0,0.0,0.0,0.0,0.0,0.0,0.0,1.0,0.0,0.0,0.0,0.0,0.0,0.0,0.0,0.0,0.0,0.0,0.0,1.0,0.0,0.0,0.0,0.0,0.0,00-0029263,R.Wilson,13.0,00-0028434,D.Baldwin,13.0,,,,,,,,,,,,,,,,,,,,,,,,,,,,,,,,,,,,,,,,,,,,,,ARI,,00-0030127,,M.Cooper,,,,,,,,,,,,,,0.0,,,,,,,,,,,,,,,,,,,,,,,,,,,,,,,,0.0,,,,,0,,,0.0,0.0,0.0,0.0,,,2016,0.731213212013245,26.8786787986755,39,0,Punt,3527,"10/23/16, 20:31:01",2016-10-24T03:02:33Z,State Farm Stadium,"Temp: ° F, Wind: mph",10012016-1023-1280-1566-50b9d76d14f3,0,0,PASS,0,,,,18,Punt,2016-10-24T03:01:17Z,3.0,1:56,0.0,0.0,0.0,4.0,4.0,0.0,PUNT,PUNT,09:07,07:11,SEA 20,SEA 14,3477.0,3554.0,6,6,Home,0,12,2.5,43.0,1,closed,grass,,,Bruce Arians,Pete Carroll,PHO00,University of Phoenix Stadium,0,1.0,R.Wilson,3.0,,,D.Baldwin,89.0,1,0,0.0,0,1,00-0029263,,00-0028434,R.Wilson,3.0,00-0029263,D.Baldwin,00-0028434,D.Baldwin,00-0028434,0,1,0.477349250810221,0.343348021390306,4.43818522055517,3.0,1.0,0.0394378089113161,0.643514335155487,35.6485664844513,2016-10-23,B.Sowell,2016,REG,SEA,7,00-0029091,T,Bradley Sowell,Bradley,Sowell,,,,Back,,Full Participation in Practice,2016-10-21T14:35:51Z,2016-10-21 14:35:51
3497,2016_04_NYG_MIN,2016100300,MIN,NYG,REG,4,NYG,away,MIN,NYG,57.0,2016-10-03,494.0,494.0,494.0,Half2,0,21.0,0,4,2.0,0,08:14,NYG 43,10,39.0,"(8:14) (No Huddle, Shotgun) 43-B.Rainey left guard to MIN 49 for 8 yards (34-A.Sendejo). MIN-29-X.Rhodes was injured during the play.",run,8.0,1,1,0.0,0,0,0,,,,,left,guard,,,,,2,3,0.0,,,,,3.0,2.0,24,10,10.0,24.0,-14.0,10.0,24.0,-14.0,0.148475855588913,0.105199031531811,0.002175178611651,0.151920348405838,0.234249785542488,0.0019613413605839,0.356018453836441,0.0,0.0,1.81541132554412,0.350215393351391,13.4846813953521,-13.4846813953521,-2.82033542782301,2.82033542782301,11.1660379437749,-11.1660379437749,,,0.0,0.0,1.75982786831446,-1.75982786831446,6.59339417738374,-6.59339417738374,-2.86625246040057,2.86625246040057,14.0322904041754,-14.0322904041754,0.0410672053694725,0.958932794630527,0.958932794630527,0.0410672053694725,0.0030950903892517,-0.007639467716217,0.007639467716217,0.955837704241276,0.0441622957587242,0.0408008396625519,0.959199160337448,-0.0179699760163967,0.0179699760163967,0.162913390458979,-0.162913390458979,,,0.0,0.0,-0.0342688513682704,0.0342688513682704,0.0898103155195713,-0.0898103155195713,-0.0128757459805827,0.0128757459805827,0.175789136439562,-0.175789136439562,0.0,0.0,0.0,0.0,0.0,0.0,0.0,0.0,0.0,0,0.0,0.0,0.0,0.0,0.0,0.0,0.0,0.0,0.0,0.0,0.0,0.0,0.0,0.0,1.0,0.0,0.0,0.0,0.0,0.0,0.0,0.0,1.0,0.0,0.0,0.0,0.0,0.0,0.0,0.0,0.0,0.0,0.0,0.0,0.0,0.0,0.0,0.0,0.0,0.0,0.0,,,,,,,00-0029384,B.Rainey,8.0,,,,,,,,,,,,,,,,,,,,,,,,,,,,,,,,,,,,,,,,,,,MIN,,00-0027914,,A.Sendejo,,,,,,,,,,,,,,0.0,,,,,,,,,,,,,,,,,,,,,,,,,,,,,,,,0.0,,,,,0,,,0.0,0.0,0.0,0.0,,,2016,,,51,1,First down,3497,"10/3/16, 20:30:52",2016-10-04T03:05:10Z,U.S. Bank Stadium,"Indoors Temp: ° F, Wind: mph",10012016-1003-002a-e742-7a200b1b1e5a,0,0,RUSH,0,,,,21,Turnover on downs,2016-10-04T03:02:55Z,9.0,3:09,2.0,0.0,0.0,4.0,4.0,0.0,KICKOFF,DOWNS,09:20,06:11,NYG 25,MIN 36,3404.0,3611.0,10,24,Home,14,34,3.5,42.5,0,dome,sportturf,,,Mike Zimmer,Ben McAdoo,MIN01,U.S. Bank Stadium,0,1.0,,,B.Rainey,43.0,,,0,1,0.0,0,1,,00-0029384,,B.Rainey,43.0,00-0029384,B.Rainey,00-0029384,B.Rainey,00-0029384,0,0,0.350215393351391,,,,,,0.901472747325897,-90.1472747325897,2016-10-03,X.Rhodes,2016,REG,MIN,4,00-0030575,CB,Xavier Rhodes,Xavier,Rhodes,,,,Knee,,Full Participation in Practice,2016-10-01T10:45:17Z,2016-10-01 10:45:17
3493,2016_14_SEA_GB,2016121111,GB,SEA,REG,14,GB,home,SEA,SEA,19.0,2016-12-11,350.0,350.0,350.0,Half2,0,25.0,1,4,1.0,0,05:50,SEA 19,10,19.0,"(5:50) 83-J.Janis left end for 19 yards, TOUCHDOWN. SEA-72-M.Bennett was injured during the play. PENALTY on GB-21-H.Clinton-Dix, Unsportsmanlike Conduct, 15 yards, enforced between downs.",run,19.0,0,0,0.0,0,0,0,,,,,left,end,,,,,2,2,0.0,,GB,J.Janis,00-0031001,2.0,2.0,37,10,31.0,10.0,21.0,37.0,10.0,27.0,0.0756110027432442,0.0200495570898056,0.0003149855183437,0.0278317518532276,0.359405308961868,0.0015165219083428,0.515270888805389,0.0,0.0,4.43254428706132,2.56745571293868,29.1211590695473,-29.1211590695473,-5.72657479489763,5.72657479489763,36.6253596130836,-36.6253596130836,,,0.0,0.0,-0.0989022547146305,0.0989022547146305,4.80385234579444,-4.80385234579444,-10.1047273054137,10.1047273054137,43.6941843033264,-43.6941843033264,0.999530434608459,0.0004695653915405,0.999530434608459,0.0004695653915405,0.000389221975638,0.0002798692512442,0.0002798692512442,0.999919656584098,8.03434159024619e-05,0.999672889709473,0.999672889709473,-0.0155546562394931,0.0155546562394931,0.552720670455502,-0.552720670455502,,,0.0,0.0,0.0309599952101978,-0.0309599952101978,0.223164450475878,-0.223164450475878,0.0301530312076481,-0.0301530312076481,0.498558651659977,-0.498558651659977,0.0,1.0,0.0,0.0,0.0,0.0,0.0,0.0,0.0,0,0.0,0.0,0.0,0.0,0.0,0.0,0.0,0.0,0.0,0.0,0.0,0.0,0.0,0.0,0.0,0.0,1.0,0.0,0.0,0.0,0.0,0.0,1.0,0.0,0.0,1.0,0.0,1.0,0.0,0.0,0.0,0.0,0.0,0.0,0.0,0.0,0.0,0.0,0.0,0.0,0.0,,,,,,,00-0031001,J.Janis,19.0,,,,,,,,,,,,,,,,,,,,,,,,,,,,,,,,,,,,,,,,,,,,,,,,,,,,,,,,,,,,,0.0,,,,,,,,,,,,,,,,,,,,,,,,,,,,,,,,0.0,GB,00-0031333,H.Clinton-Dix,15.0,0,,Unsportsmanlike Conduct,0.0,0.0,0.0,0.0,,,2016,,,54,1,Touchdown,3493,"12/11/16, 16:25:41",2016-12-12T00:19:12Z,Lambeau Field,"Temp: 26° F, Humidity: 85%, Wind: W 5 mph",10012016-1211-112e-3c4a-80afa1f8e61b,0,0,RUSH,0,,,,25,Touchdown,2016-12-12T00:19:12Z,1.0,0:07,1.0,1.0,1.0,4.0,4.0,0.0,INTERCEPTION,TOUCHDOWN,05:50,05:43,SEA 19,SEA 19,3493.0,3511.0,10,38,Home,28,48,-3.0,47.0,0,outdoors,grass,26.0,5.0,Mike McCarthy,Pete Carroll,GNB00,Lambeau Field,0,1.0,,,J.Janis,83.0,,,0,1,1.0,0,1,,00-0031001,,J.Janis,83.0,00-0031001,J.Janis,00-0031001,J.Janis,00-0031001,0,1,2.56745571293868,,,,,,0.103174738585949,-10.3174738585949,2016-12-11,M.Bennett,2016,REG,SEA,14,00-0026618,DE,Michael Bennett,Michael,Bennett,,,,Knee,Not Injury Related,Did Not Participate In Practice,2016-12-09T14:45:15Z,2016-12-09 14:45:15
3485,2016_13_WAS_ARI,2016120409,ARI,WAS,REG,13,ARI,home,WAS,WAS,30.0,2016-12-04,698.0,698.0,698.0,Half2,0,16.0,0,4,1.0,0,11:38,WAS 30,10,75.0,(11:38) (Shotgun) 3-C.Palmer pass short right to 11-L.Fitzgerald to WAS 25 for 5 yards (26-B.Breeland; 54-M.Foster). WAS-41-W.Blackmon was injured during the play.,pass,5.0,1,0,1.0,0,0,0,short,right,-1.0,6.0,,,,,,,3,3,0.0,,,,,3.0,3.0,17,20,17.0,20.0,-3.0,17.0,20.0,-3.0,0.0291958674788475,0.0379198528826237,0.0005030417232774,0.0531068928539753,0.387911409139633,0.0013281360734254,0.490034759044647,0.0,0.0,4.11011992080603,0.0829950182233006,-3.30613083919161,3.30613083919161,-4.52286548062693,4.52286548062693,6.11675880940005,-6.11675880940005,-0.703800875460729,0.78679589368403,-0.703800875460729,0.78679589368403,-7.68849337298889,7.68849337298889,9.43679537784192,-9.43679537784192,2.1240468226024,-2.1240468226024,-1.0278458460664,1.0278458460664,0.529493272304535,0.470506727695465,0.529493272304535,0.470506727695465,0.0335044860839844,0.00913667678833,0.00913667678833,0.562997758388519,0.437002241611481,0.555383622646332,0.555383622646332,-0.265518052082679,0.265518052082679,0.301827584878177,-0.301827584878177,0.0,0.0335044860839844,0.0,0.0335044860839844,0.0317593812942505,-0.0317593812942505,0.219879393950672,-0.219879393950672,0.0317593812942505,-0.0317593812942505,0.126989637986392,-0.126989637986392,0.0,0.0,0.0,0.0,0.0,0.0,0.0,0.0,0.0,0,0.0,0.0,0.0,0.0,0.0,0.0,0.0,0.0,0.0,0.0,0.0,0.0,0.0,0.0,0.0,0.0,0.0,0.0,0.0,0.0,0.0,0.0,0.0,1.0,0.0,0.0,0.0,0.0,0.0,0.0,0.0,0.0,0.0,0.0,0.0,1.0,1.0,0.0,0.0,0.0,0.0,00-0021429,C.Palmer,5.0,00-0022921,L.Fitzgerald,5.0,,,,,,,,,,,,,,,,,,,,,,,,,,,,,,,,,,,,,,,,,,,,,,,,,,,,00-0031052,B.Breeland,WAS,00-0028022,M.Foster,WAS,,,,,,,0.0,,,,,,,,,,,,,,,,,,,,,,,,,,,,,,,,0.0,,,,,0,,,0.0,0.0,0.0,0.0,,,2016,0.866815984249115,13.3184015750885,45,1,Touchdown,3485,"12/4/16, 16:25:36",2016-12-04T23:55:32Z,State Farm Stadium,"Temp: 68° F, Humidity: 13%, Wind: 0 mph",10012016-1204-0961-3e1a-5fe7bc47d355,0,0,PASS,0,,,,16,Touchdown,2016-12-04T23:45:34Z,10.0,4:57,5.0,0.0,1.0,3.0,4.0,-10.0,KICKOFF,TOUCHDOWN,01:06,11:09,ARI 25,WAS 25,3217.0,3532.0,23,31,Home,8,54,2.5,48.5,0,closed,grass,,,Bruce Arians,Jay Gruden,PHO00,University of Phoenix Stadium,0,1.0,C.Palmer,3.0,,,L.Fitzgerald,11.0,1,0,0.0,0,1,00-0021429,,00-0022921,C.Palmer,3.0,00-0021429,L.Fitzgerald,00-0022921,L.Fitzgerald,00-0022921,0,1,0.0829950182233006,0.911986704808348,7.47899120283546,6.0,0.572682698722929,0.224182096775621,0.500096380710602,49.9903619289398,2016-12-04,W.Blackmon,2016,REG,WAS,13,00-0024330,S,Will Blackmon,Will,Blackmon,,,,Thumb,,Full Participation in Practice,2016-12-02T10:53:43Z,2016-12-02 10:53:43
3470,2016_08_MIN_CHI,2016103100,CHI,MIN,REG,8,MIN,away,CHI,CHI,39.0,2016-10-31,436.0,436.0,436.0,Half2,0,18.0,0,4,1.0,0,07:16,CHI 39,10,83.0,(7:16) (Shotgun) 8-S.Bradford pass short middle to 33-R.Hillman to CHI 35 for 4 yards (50-J.Freeman). CHI-21-T.Porter was injured during the play.,pass,4.0,1,0,1.0,0,0,0,short,middle,2.0,2.0,,,,,,,3,2,0.0,,,,,2.0,3.0,20,3,3.0,20.0,-17.0,3.0,20.0,-17.0,0.124962918460369,0.0485752709209919,0.0007910662679933,0.0736707597970963,0.341627240180969,0.0030959565192461,0.407276719808579,0.0,0.0,3.21900740836281,-0.0648149214684963,16.3131754426005,-16.3131754426005,2.93736295291455,-2.93736295291455,10.6968329473514,-10.6968329473514,-0.323861380689777,0.259046459221281,-0.323861380689777,0.259046459221281,-0.917677742196247,0.917677742196247,8.77400613576174,-8.77400613576174,13.1915906543145,-13.1915906543145,-6.36918963031485,6.36918963031485,0.019414309412241,0.980585690587759,0.980585690587759,0.019414309412241,-0.0044742422178387,-0.005701757967472,0.005701757967472,0.985059932805598,0.0149400671944022,0.0327034406363964,0.967296559363604,0.106950533520346,-0.106950533520346,0.280190326864479,-0.280190326864479,0.0,-0.0044742422178387,0.0,-0.0044742422178387,0.0262612734312397,-0.0262612734312397,0.150609505362809,-0.150609505362809,-0.87289553542191,0.87289553542191,1.03575729485601,-1.03575729485601,0.0,0.0,0.0,0.0,0.0,0.0,0.0,0.0,0.0,0,0.0,0.0,0.0,0.0,0.0,0.0,0.0,0.0,0.0,0.0,0.0,0.0,0.0,0.0,1.0,0.0,0.0,0.0,0.0,0.0,0.0,0.0,0.0,1.0,0.0,0.0,0.0,0.0,0.0,0.0,0.0,0.0,0.0,0.0,0.0,1.0,0.0,0.0,0.0,0.0,0.0,00-0027854,S.Bradford,4.0,00-0029683,R.Hillman,4.0,,,,,,,,,,,,,,,,,,,,,,,,,,,,,,,,,,,,,,,,,,,,,,CHI,,00-0025920,,J.Freeman,,,,,,,,,,,,,,0.0,,,,,,,,,,,,,,,,,,,,,,,,,,,,,,,,0.0,,,,,0,,,0.0,0.0,0.0,0.0,,,2016,0.791388273239136,20.8611726760864,43,1,First down,3470,"10/31/16, 20:31:33",2016-11-01T03:04:11Z,Soldier Field,"Cloudy Temp: 58° F, Humidity: 71%, Wind: SSE 12 mph",10012016-1031-0032-eb29-e009a42b8686,0,0,PASS,0,,,,18,Touchdown,2016-11-01T03:01:55Z,10.0,3:10,4.0,0.0,1.0,4.0,4.0,0.0,PUNT,TOUCHDOWN,08:51,05:41,MIN 17,CHI 25,3376.0,3628.0,10,20,Home,10,30,-5.5,39.5,1,outdoors,grass,58.0,12.0,John Fox,Mike Zimmer,CHI98,Soldier Field,0,0.0,S.Bradford,8.0,,,R.Hillman,33.0,1,0,0.0,0,1,00-0027854,,00-0029683,S.Bradford,8.0,00-0027854,R.Hillman,00-0029683,R.Hillman,00-0029683,0,0,-0.0648149214684963,0.613844039154515,5.65774793265155,4.0,0.666048513550777,0.253927016456146,0.892734587192535,10.7265412807465,2016-10-31,T.Porter,2016,REG,CHI,8,00-0026180,CB,Tracy Porter,Tracy,Porter,Knee,,Questionable,Knee,,Limited Participation in Practice,2016-10-29T11:36:47Z,2016-10-29 11:36:47
3456,2016_13_SF_CHI,2016120402,CHI,SF,REG,13,CHI,home,SF,CHI,59.0,2016-12-04,629.0,629.0,629.0,Half2,0,20.0,0,4,1.0,0,10:29,CHI 41,10,17.0,(10:29) 24-J.Howard right tackle to CHI 45 for 4 yards (55-A.Brooks). SF-92-Q.Dial was injured during the play.,run,4.0,0,0,0.0,0,0,0,,,,,right,tackle,,,,,3,3,0.0,,,,,3.0,3.0,24,6,24.0,6.0,18.0,24.0,6.0,18.0,0.0920508801937103,0.104683734476566,0.0016866887453943,0.141118034720421,0.24902306497097,0.0039323046803474,0.407505244016647,0.0,0.0,2.3022196884267,-0.119432909647003,20.2646363027905,-20.2646363027905,0.947394597270966,-0.947394597270966,20.7015449932508,-20.7015449932508,,,0.0,0.0,11.2836036101799,-11.2836036101799,3.31311285722964,-3.31311285722964,9.93633687880356,-9.93633687880356,5.09925079328437,-5.09925079328437,0.996331393718719,0.0036686062812805,0.996331393718719,0.0036686062812805,-0.000702679157257,0.0009297728538513,0.0009297728538513,0.995628714561462,0.0043712854385376,0.996704638004303,0.996704638004303,-0.0599843707076856,0.0599843707076856,0.519838907755911,-0.519838907755911,,,0.0,0.0,0.159842293709517,-0.159842293709517,0.245787918567657,-0.245787918567657,0.159842293709517,-0.159842293709517,0.208616272546351,-0.208616272546351,0.0,0.0,0.0,0.0,0.0,0.0,0.0,0.0,0.0,0,0.0,0.0,0.0,0.0,0.0,0.0,0.0,0.0,0.0,0.0,0.0,0.0,0.0,0.0,1.0,0.0,0.0,0.0,0.0,0.0,0.0,0.0,1.0,0.0,0.0,0.0,0.0,0.0,0.0,0.0,0.0,0.0,0.0,0.0,0.0,0.0,0.0,0.0,0.0,0.0,0.0,,,,,,,00-0032780,J.Howard,4.0,,,,,,,,,,,,,,,,,,,,,,,,,,,,,,,,,,,,,,,,,,,SF,,00-0024495,,A.Brooks,,,,,,,,,,,,,,0.0,,,,,,,,,,,,,,,,,,,,,,,,,,,,,,,,0.0,,,,,0,,,0.0,0.0,0.0,0.0,,,2016,,,43,0,Punt,3456,"12/4/16, 13:02:46",2016-12-04T20:31:46Z,Soldier Field,"Snow Showers, 3 to 5 inches expected. Temp: 33° F, Humidity: 91%, Wind: SE 5 mph",10012016-1204-02c8-b3e4-bdc796966fb1,0,0,RUSH,0,,,,19,Punt,2016-12-04T20:29:37Z,5.0,3:49,1.0,0.0,0.0,4.0,4.0,0.0,PUNT,PUNT,11:54,08:05,CHI 31,CHI 48,3405.0,3522.0,6,26,Home,20,32,0.0,44.0,0,outdoors,grass,33.0,5.0,John Fox,Chip Kelly,CHI98,Soldier Field,0,0.0,,,J.Howard,24.0,,,0,1,0.0,0,1,,00-0032780,,J.Howard,24.0,00-0032780,J.Howard,00-0032780,J.Howard,00-0032780,0,0,-0.119432909647003,,,,,,0.253807723522186,-25.3807723522186,2016-12-04,Q.Dial,2016,REG,SF,13,00-0030088,DT,Quinton Dial,Quinton,Dial,,,,Knee,Neck,Full Participation in Practice,2016-12-02T11:54:54Z,2016-12-02 11:54:54
3388,2016_11_ARI_MIN,2016112006,MIN,ARI,REG,11,ARI,away,MIN,MIN,27.0,2016-11-20,550.0,550.0,550.0,Half2,0,19.0,0,4,1.0,0,09:10,MIN 27,10,27.0,(9:10) (Shotgun) 3-C.Palmer pass short right to 38-A.Ellington to MIN 25 for 2 yards (26-T.Waynes). MIN-54-E.Kendricks was injured during the play.,pass,2.0,1,0,1.0,0,0,0,short,right,-6.0,8.0,,,,,,,2,2,0.0,,,,,2.0,2.0,30,17,17.0,30.0,-13.0,17.0,30.0,-13.0,0.0463518016040325,0.0345745570957661,0.0007511179428547,0.0459780432283878,0.397444516420364,0.000755411630962,0.474144548177719,0.0,0.0,4.08578399999533,-0.352598562138155,9.19928220147663,-9.19928220147663,-5.23954118223628,5.23954118223628,11.3488304266908,-11.3488304266908,-1.15727253479417,0.804673972656019,-1.15727253479417,0.804673972656019,-10.7359792641946,10.7359792641946,9.27274919301271,-9.27274919301271,-14.755206154543,14.755206154543,28.7009644666655,-28.7009644666655,0.0755866393446922,0.924413360655308,0.924413360655308,0.0755866393446922,-0.0026682019233703,0.0019980743527412,-0.0019980743527412,0.927081562578678,0.0729184374213219,0.0665214881300926,0.933478511869907,-0.166396522068234,0.166396522068234,0.451577240772312,-0.451577240772312,0.0,-0.0026682019233703,0.0,-0.0026682019233703,-0.0229539050892389,0.0229539050892389,0.0803876593455509,-0.0803876593455509,-0.0229539050892389,0.0229539050892389,0.539148720076486,-0.539148720076486,0.0,0.0,0.0,0.0,0.0,0.0,0.0,0.0,0.0,0,0.0,0.0,0.0,0.0,0.0,0.0,0.0,0.0,0.0,0.0,0.0,0.0,0.0,0.0,1.0,0.0,0.0,0.0,0.0,0.0,0.0,0.0,0.0,1.0,0.0,0.0,0.0,0.0,0.0,0.0,0.0,0.0,0.0,0.0,0.0,1.0,0.0,0.0,0.0,0.0,0.0,00-0021429,C.Palmer,2.0,00-0030287,A.Ellington,2.0,,,,,,,,,,,,,,,,,,,,,,,,,,,,,,,,,,,,,,,,,,,,,,MIN,,00-0031546,,T.Waynes,,,,,,,,,,,,,,0.0,,,,,,,,,,,,,,,,,,,,,,,,,,,,,,,,0.0,,,,,0,,,0.0,0.0,0.0,0.0,,,2016,0.863679826259613,13.6320173740387,49,1,First down,3388,"11/20/16, 13:02:26",2016-11-20T20:44:05Z,U.S. Bank Stadium,"Indoors Temp: ° F, Wind: mph",10012016-1120-061f-61e3-c44fc2929b39,0,0,PASS,0,,,,19,Touchdown,2016-11-20T20:44:05Z,6.0,1:46,2.0,1.0,1.0,4.0,4.0,0.0,FUMBLE,TOUCHDOWN,09:10,07:24,MIN 27,MIN 4,3388.0,3545.0,24,30,Home,6,54,2.0,39.5,0,dome,sportturf,,,Mike Zimmer,Bruce Arians,MIN01,U.S. Bank Stadium,0,0.0,C.Palmer,3.0,,,A.Ellington,38.0,1,0,0.0,0,1,00-0021429,,00-0030287,C.Palmer,3.0,00-0021429,A.Ellington,00-0030287,A.Ellington,00-0030287,0,0,-0.352598562138155,1.1843937331745,11.0078466304694,10.0,0.458670519234147,0.229313250572886,0.756534695625305,24.3465304374695,2016-11-20,E.Kendricks,2016,REG,MIN,11,00-0031554,LB,Eric Kendricks,Eric,Kendricks,Hip,,Questionable,Hip,,Full Participation in Practice,2016-11-18T11:44:59Z,2016-11-18 11:44:59
3327,2016_07_TB_SF,2016102310,SF,TB,REG,7,TB,away,SF,SF,39.0,2016-10-23,50.0,950.0,950.0,Half2,0,20.0,0,3,1.0,0,00:50,SF 39,10,59.0,(:50) (No Huddle) 32-J.Rodgers left tackle to SF 31 for 8 yards (57-M.Wilhoite). SF-33-R.Robinson was injured during the play. He is Out.,run,8.0,0,1,0.0,0,0,0,,,,,left,tackle,,,,,3,3,0.0,,,,,3.0,3.0,14,27,27.0,14.0,13.0,27.0,14.0,13.0,0.028378376737237,0.0659061595797539,0.0010785702615976,0.107233211398125,0.346413016319275,0.0032719983719289,0.447718650102615,0.0,0.0,3.22930549737066,0.513718755100854,-21.8767693330161,21.8767693330161,6.55884541280102,-6.55884541280102,-23.9394571620294,23.9394571620294,,,0.0,0.0,-11.3172159464448,11.3172159464448,-5.7753320575463,5.7753320575463,-13.9479384285514,13.9479384285514,-6.36367315674645,6.36367315674645,0.965207874774933,0.0347921252250671,0.0347921252250671,0.965207874774933,-0.0019334554672241,0.0012416839599609,-0.0012416839599609,0.0367255806922913,0.963274419307709,0.962998628616333,0.037001371383667,0.163493339079455,-0.163493339079455,-0.501572910730442,0.501572910730442,,,0.0,0.0,-0.366994392160972,0.366994392160972,-0.112562112510204,0.112562112510204,-0.383311640505394,0.383311640505394,-0.106704466044903,0.106704466044903,0.0,0.0,0.0,0.0,0.0,0.0,0.0,0.0,0.0,0,0.0,0.0,0.0,0.0,0.0,0.0,0.0,0.0,0.0,0.0,0.0,0.0,0.0,0.0,1.0,0.0,0.0,0.0,0.0,0.0,0.0,0.0,1.0,0.0,0.0,0.0,0.0,0.0,0.0,0.0,0.0,0.0,0.0,0.0,0.0,0.0,0.0,0.0,0.0,0.0,0.0,,,,,,,00-0028083,J.Rodgers,8.0,,,,,,,,,,,,,,,,,,,,,,,,,,,,,,,,,,,,,,,,,,,SF,,00-0028836,,M.Wilhoite,,,,,,,,,,,,,,0.0,,,,,,,,,,,,,,,,,,,,,,,,,,,,,,,,0.0,,,,,0,,,0.0,0.0,0.0,0.0,,,2016,,,51,0,Missed field goal,3327,"10/23/16, 16:05:42",2016-10-23T22:27:48Z,Levi's® Stadium,"Clear Temp: 68° F, Humidity: 49%, Wind: W 5 mph",10012016-1023-107e-91e4-cc6feb4e8c81,0,0,RUSH,0,,,,20,Missed field goal,2016-10-23T22:22:34Z,10.0,4:52,3.0,0.0,0.0,3.0,4.0,-10.0,PUNT,MISSED_FG,04:04,14:12,TB 9,SF 32,3168.0,3456.0,34,17,Home,-17,51,1.0,45.0,0,outdoors,grass,68.0,5.0,Chip Kelly,Dirk Koetter,SFO01,Levi's Stadium,0,1.0,,,J.Rodgers,32.0,,,0,1,0.0,0,1,,00-0028083,,J.Rodgers,32.0,00-0028083,J.Rodgers,00-0028083,J.Rodgers,00-0028083,0,1,0.513718755100854,,,,,,0.354931831359863,-35.4931831359863,2016-10-23,R.Robinson,2016,REG,SF,7,00-0032410,CB,Rashard Robinson,Rashard,Robinson,Concussion,,Questionable,Concussion,,Limited Participation in Practice,2016-10-21T11:43:08Z,2016-10-21 11:43:08
3307,2016_14_HOU_IND,2016121104,IND,HOU,REG,14,IND,home,HOU,HOU,35.0,2016-12-11,713.0,713.0,713.0,Half2,0,19.0,0,4,,0,11:53,HOU 35,0,83.0,8-N.Novak kicks 66 yards from HOU 35 to IND -1. 28-J.Todman to IND 17 for 18 yards (52-B.Peters). IND-92-C.Maggitt was injured during the play. His return is Doubtful.,kickoff,0.0,0,0,0.0,0,0,0,,,,,,,,66.0,,,3,3,0.0,,,,,3.0,3.0,10,19,10.0,19.0,-9.0,10.0,19.0,-9.0,0.07386614382267,0.129437774419785,0.0023306289222091,0.190812855958939,0.234176516532898,0.0037702845875173,0.365605771541595,0.0,0.0,1.54064594674855,-0.591159927658737,-12.7223245194764,12.7223245194764,-1.32881511684203,1.32881511684203,-4.86518780195012,4.86518780195012,,,0.0,0.0,-3.20097896750667,3.20097896750667,7.08168615680188,-7.08168615680188,-7.21646938109188,7.21646938109188,4.19457191318532,-4.19457191318532,0.167945116758347,0.832054883241653,0.167945116758347,0.832054883241653,-0.0040330737829208,-0.002187356352806,-0.002187356352806,0.163912042975426,0.836087957024574,0.213303774595261,0.213303774595261,-0.0821144647365113,0.0821144647365113,-0.358367744810365,0.358367744810365,,,0.0,0.0,0.0739635303616524,-0.0739635303616524,-0.0098020247886399,0.0098020247886399,0.0701288059353828,-0.0701288059353828,-0.330146562285207,0.330146562285207,0.0,0.0,0.0,0.0,0.0,0.0,0.0,0.0,0.0,0,0.0,0.0,0.0,0.0,0.0,0.0,1.0,1.0,0.0,0.0,0.0,0.0,0.0,0.0,1.0,0.0,0.0,0.0,0.0,0.0,0.0,0.0,0.0,0.0,0.0,0.0,0.0,0.0,0.0,0.0,0.0,0.0,1.0,0.0,0.0,0.0,0.0,0.0,0.0,0.0,0.0,,,,,,,,,,,,,,,,,,,,,,,,,,J.Todman,00-0028121,,,,,N.Novak,00-0023096,,,,,,,,,,,,,,,,,,,HOU,,00-0031491,,B.Peters,,,,,,,,,,,,,,0.0,,,,,,,,,,,,,,,,,,,,,,,,,,,,,,,IND,18.0,,,,,0,,,0.0,0.0,0.0,0.0,,,2016,,,48,1,First down,3307,"12/11/16, 13:02:29",2016-12-11T20:33:42Z,Lucas Oil Stadium,"Cloudy Temp: 34° F, Humidity: 63%, Wind: S 12 mph",10012016-1211-04c0-7283-41d556dae843,0,0,KICK_OFF,1,,,,19,Touchdown,2016-12-11T20:33:42Z,8.0,2:47,4.0,0.0,1.0,4.0,4.0,15.0,KICKOFF,TOUCHDOWN,11:53,09:06,IND 17,HOU 35,3307.0,3556.0,22,17,Home,-5,39,6.5,47.5,1,closed,fieldturf,,,Chuck Pagano,Bill O'Brien,IND00,Lucas Oil Stadium,0,0.0,,,,,,,0,0,0.0,1,0,,,,,,,,,,,0,0,-0.591159927658737,,,,,,,,2016-12-11,C.Maggitt,2016,REG,IND,14,00-0032361,LB,Curt Maggitt,Curt,Maggitt,Concussion,,Questionable,Concussion,,Full Participation in Practice,2016-12-09T12:48:11Z,2016-12-09 12:48:11
3293,2016_19_PIT_KC,2017011500,KC,PIT,POST,19,KC,home,PIT,PIT,12.0,2017-01-15,287.0,287.0,287.0,Half2,0,18.0,0,4,1.0,0,04:47,PIT 12,10,75.0,(4:47) (Shotgun) 11-A.Smith pass short left to 35-C.West to PIT 6 for 6 yards (23-M.Mitchell; 28-S.Davis). PIT-28-S.Davis was injured during the play.,pass,6.0,1,0,1.0,0,0,0,short,left,-6.0,12.0,,,,,,,2,3,0.0,,,,,2.0,3.0,10,18,10.0,18.0,-8.0,10.0,18.0,-8.0,0.0665842369198799,0.0103761376813054,0.00024441149435,0.0151047362014651,0.326017320156097,0.0016072936123237,0.580065846443176,0.0,0.0,4.9043770833523,0.324283326423029,-8.91263807406305,8.91263807406305,-7.20476764492923,7.20476764492923,-0.129120739341358,0.129120739341358,-1.22098935575923,1.54527268218226,-1.22098935575923,1.54527268218226,0.993352816339994,-0.993352816339994,1.93779998106277,-1.93779998106277,0.281947355500834,-0.281947355500834,0.581276342664571,-0.581276342664571,0.236420020461082,0.763579979538918,0.236420020461082,0.763579979538918,-0.0055690705776214,-0.0264310836791992,-0.0264310836791992,0.230850949883461,0.769149050116539,0.282379031181335,0.282379031181335,-0.326863721013069,0.326863721013069,-0.161168798936106,0.161168798936106,0.0,-0.0055690705776214,0.0,-0.0055690705776214,0.907516941296361,-0.907516941296361,-1.06547218561172,1.06547218561172,0.907516941296361,-0.907516941296361,-1.07913480699062,1.07913480699062,0.0,0.0,0.0,0.0,0.0,0.0,0.0,0.0,0.0,0,0.0,0.0,0.0,0.0,0.0,0.0,0.0,0.0,0.0,0.0,0.0,0.0,0.0,0.0,0.0,0.0,0.0,0.0,0.0,0.0,0.0,0.0,0.0,1.0,0.0,0.0,0.0,0.0,0.0,0.0,0.0,0.0,0.0,0.0,0.0,1.0,1.0,0.0,0.0,0.0,0.0,00-0023436,A.Smith,6.0,00-0030668,C.West,6.0,,,,,,,,,,,,,,,,,,,,,,,,,,,,,,,,,,,,,,,,,,,,,,,,,,,,00-0027023,M.Mitchell,PIT,00-0033053,S.Davis,PIT,,,,,,,0.0,,,,,,,,,,,,,,,,,,,,,,,,,,,,,,,,0.0,,,,,0,,,0.0,0.0,0.0,0.0,,,2016,0.835307240486145,16.4692759513855,50,1,First down,3293,"1/15/17, 20:20:20",2017-01-16T03:59:27Z,GEHA Field at Arrowhead Stadium,"Cloudy with patches of fog Temp: 33° F, Humidity: 96%, Wind: East 9 mph",10012017-0115-0077-30e1-367c1c075e4b,0,0,PASS,0,,,,18,Touchdown,2017-01-16T03:47:10Z,13.0,7:06,6.0,1.0,1.0,4.0,4.0,-2.0,KICKOFF,TOUCHDOWN,09:49,02:43,KC 25,PIT 1,3022.0,3477.0,18,16,Home,-2,34,2.5,45.5,0,outdoors,grass,33.0,9.0,Andy Reid,Mike Tomlin,KAN00,Arrowhead Stadium,0,1.0,A.Smith,11.0,,,C.West,35.0,1,0,0.0,0,1,00-0023436,,00-0030668,A.Smith,11.0,00-0023436,C.West,00-0030668,C.West,00-0030668,0,0,0.324283326423029,1.26745782517905,9.16645850904752,9.0,0.401041441480629,0.171450572903268,0.684382736682892,31.5617263317108,2017-01-15,S.Davis,2016,DIV,PIT,19,00-0033053,S,Sean Davis,Sean,Davis,,,,Shoulder,,Full Participation in Practice,2017-01-13T10:25:07Z,2017-01-13 10:25:07
3249,2016_17_GB_DET,2017010102,DET,GB,REG,17,GB,away,DET,DET,22.0,2017-01-01,688.0,688.0,688.0,Half2,0,15.0,0,4,1.0,0,11:28,DET 22,10,81.0,(11:28) 12-A.Rodgers pass short right to 87-J.Nelson to DET 11 for 11 yards (23-D.Slay). DET-23-D.Slay was injured during the play.,pass,11.0,0,0,1.0,0,0,0,short,right,0.0,11.0,,,,,,,3,3,0.0,,,,,3.0,3.0,14,17,17.0,14.0,3.0,17.0,14.0,3.0,0.0186711214482784,0.0284634474664927,0.0007257894612848,0.0410841926932335,0.364741533994675,0.0009480923181399,0.545365810394287,0.0,0.0,4.53925018920563,0.632494453690015,-11.2218370428309,11.2218370428309,-4.87660984491231,4.87660984491231,-3.48829620524424,3.48829620524424,-0.475425196462311,1.10791965015233,-0.475425196462311,1.10791965015233,3.81442662063637,-3.81442662063637,-3.23806603799737,3.23806603799737,11.2408775121148,-11.2408775121148,-12.3352572198864,12.3352572198864,0.779221594333649,0.220778405666351,0.220778405666351,0.779221594333649,0.0135230422019959,0.0129895806312561,-0.0129895806312561,0.207255363464355,0.792744636535645,0.837980091571808,0.162019908428192,-0.174616442366637,0.174616442366637,-0.239335258795283,0.239335258795283,0.0,0.0135230422019959,0.0,0.0135230422019959,0.147137820720673,-0.147137820720673,-0.242234130693934,0.242234130693934,0.138053089380264,-0.138053089380264,-0.313959558798335,0.313959558798335,0.0,0.0,1.0,0.0,0.0,0.0,0.0,0.0,0.0,0,0.0,0.0,0.0,0.0,0.0,0.0,0.0,0.0,0.0,0.0,0.0,0.0,0.0,0.0,1.0,0.0,0.0,0.0,0.0,0.0,0.0,0.0,0.0,1.0,0.0,0.0,0.0,0.0,0.0,0.0,0.0,0.0,0.0,0.0,0.0,1.0,0.0,0.0,0.0,0.0,0.0,00-0023459,A.Rodgers,11.0,00-0026176,J.Nelson,11.0,,,,,,,,,,,,,,,,,,,,,,,,,,,,,,,,,,,,,,,,,,,,,,DET,,00-0030062,,D.Slay,,,,,,,,,,,,,,0.0,,,,,,,,,,,,,,,,,,,,,,,,,,,,,,,,0.0,,,,,0,,,0.0,0.0,0.0,0.0,,,2016,0.729312717914581,27.0687282085419,49,1,First down,3249,"1/1/17, 20:30:56",2017-01-02T03:59:35Z,Ford Field,"Controlled Climate Temp: 68° F, Humidity: 70%, Wind: mph",10012017-0101-0237-ee7d-c46c451a22d5,0,0,PASS,0,,,,15,Touchdown,2017-01-02T03:54:36Z,10.0,4:37,5.0,1.0,1.0,4.0,4.0,-10.0,PUNT,TOUCHDOWN,14:39,10:02,GB 19,DET 10,3102.0,3339.0,31,24,Home,-7,55,-3.5,50.0,1,dome,fieldturf,,,Jim Caldwell,Mike McCarthy,DET00,Ford Field,0,1.0,A.Rodgers,12.0,,,J.Nelson,87.0,1,0,1.0,0,1,00-0023459,,00-0026176,A.Rodgers,12.0,00-0023459,J.Nelson,00-0026176,J.Nelson,00-0026176,0,1,0.632494453690015,0.676560393626705,6.41474209871376,6.0,0.60425729630515,0.216352134477347,0.360270828008652,63.9729171991348,2017-01-01,D.Slay,2016,REG,DET,17,00-0030062,CB,Darius Slay,Darius,Slay,Hamstring,,Questionable,Hamstring,,Limited Participation in Practice,2016-12-30T12:56:26Z,2016-12-30 12:56:26
3239,2016_08_KC_IND,2016103005,IND,KC,REG,8,IND,home,KC,IND,86.0,2016-10-30,877.0,877.0,877.0,Half2,0,21.0,0,4,2.0,0,14:37,IND 14,10,6.0,(14:37) (Shotgun) 12-A.Luck sacked at IND 7 for -7 yards (95-C.Jones). IND-76-J.Reitz was injured during the play. He is Out.,pass,-7.0,1,0,1.0,0,0,0,,,,,,,,,,,3,3,0.0,,,,,3.0,3.0,14,24,14.0,24.0,-10.0,14.0,24.0,-10.0,0.0414719171822071,0.202321797609329,0.0047557479701936,0.272623658180237,0.18710070848465,0.0031827315688133,0.288543432950974,0.0,0.0,0.0626291232183576,-1.70230608689599,-15.2470264007341,15.2470264007341,-3.30059531354345,3.30059531354345,-16.1486307110462,16.1486307110462,,,0.0,0.0,-5.70776618842501,5.70776618842501,-8.9194163432112,8.9194163432112,-18.3862848818535,18.3862848818535,2.96563956041492,-2.96563956041492,0.141798660159111,0.858201339840889,0.141798660159111,0.858201339840889,-0.0279823243618011,-0.0295107886195183,-0.0295107886195183,0.11381633579731,0.88618366420269,0.109661050140858,0.109661050140858,-0.0821949541568756,0.0821949541568756,-0.479297617660713,0.479297617660713,,,0.0,0.0,-0.0760641742722794,0.0760641742722794,-0.303479869851561,0.303479869851561,-0.0760641742722794,0.0760641742722794,-0.370480303654166,0.370480303654166,0.0,0.0,0.0,0.0,0.0,0.0,0.0,0.0,0.0,0,0.0,0.0,0.0,0.0,0.0,0.0,0.0,0.0,0.0,0.0,0.0,0.0,0.0,0.0,1.0,0.0,0.0,0.0,0.0,0.0,0.0,1.0,0.0,1.0,1.0,0.0,0.0,0.0,0.0,0.0,0.0,0.0,0.0,0.0,0.0,0.0,0.0,0.0,0.0,0.0,0.0,00-0029668,A.Luck,,,,,,,,,,,,,,,,,,,,,,,,,,,,,,,,,,,,00-0032762,C.Jones,,,00-0032762,C.Jones,,,,,,,,,KC,,00-0032762,,C.Jones,,,,,,,,,,,,,,0.0,,,,,,,,,,,,,,,,,,,,,,,,,00-0032762,C.Jones,,,,,,0.0,,,,,0,,,0.0,0.0,0.0,0.0,,,2016,,,46,0,Punt,3239,"10/30/16, 13:02:27",2016-10-30T19:33:53Z,Lucas Oil Stadium,"Partly sunny Temp: 68° F, Humidity: 69%, Wind: NW 9 mph",10012016-1030-05f3-4e9b-a800caaea997,0,0,SACK,0,,,,21,Punt,2016-10-30T19:33:13Z,3.0,1:37,0.0,0.0,0.0,4.0,4.0,0.0,PUNT,PUNT,14:42,13:05,IND 14,IND 20,3217.0,3282.0,30,14,Home,-16,44,-3.0,50.5,0,closed,fieldturf,,,Chuck Pagano,Andy Reid,IND00,Lucas Oil Stadium,0,0.0,A.Luck,12.0,,,,,1,0,0.0,0,1,00-0029668,,,A.Luck,12.0,00-0029668,,,,,0,0,-1.70230608689599,,,,,,0.697574377059937,30.2425622940064,2016-10-30,J.Reitz,2016,REG,IND,8,00-0026408,T,Joe Reitz,Joe,Reitz,,,,Back,,Full Participation in Practice,2016-10-28T12:06:40Z,2016-10-28 12:06:40
3237,2016_14_NYJ_SF,2016121110,SF,NYJ,REG,14,NYJ,away,SF,SF,46.0,2016-12-11,595.0,595.0,595.0,Half2,0,20.0,0,4,3.0,0,09:55,SF 46,11,66.0,"(9:55) (Shotgun) 9-B.Petty pass short left to 15-B.Marshall pushed ob at SF 37 for 9 yards (57-M.Wilhoite, 41-A.Bethea). NYJ-15-B.Marshall was injured during the play. Caught at SF 40 3-yds YAC",pass,9.0,1,0,1.0,0,0,0,short,left,6.0,3.0,,,,,,,3,3,0.0,,,,,3.0,3.0,17,6,6.0,17.0,-11.0,6.0,17.0,-11.0,0.104599229991436,0.134591430425644,0.0017082534031942,0.19773505628109,0.266096115112305,0.0044615138322114,0.290808409452438,0.0,0.0,1.05153404711746,0.0674579101614654,8.64147188791064,-8.64147188791064,8.20344639819814,-8.20344639819814,2.33395422671488,-2.33395422671488,-0.856825890252367,0.924283800413832,-0.856825890252367,0.924283800413832,-8.82916590198875,8.82916590198875,0.20654400235077,-0.20654400235077,-11.9098564842716,11.9098564842716,6.80822740651404,-6.80822740651404,0.0817578732967377,0.918242126703262,0.918242126703262,0.0817578732967377,-0.0077673345804214,-0.0001004636287689,0.0001004636287689,0.926009461283684,0.0739905387163162,0.0837555378675461,0.916244462132454,0.149289858853622,-0.149289858853622,0.208396455492185,-0.208396455492185,0.0,-0.0077673345804214,0.0,-0.0077673345804214,-0.0458244830369949,0.0458244830369949,-0.0001045332892672,0.0001045332892672,-0.0422248318791389,0.0422248318791389,0.146133629824327,-0.146133629824327,0.0,0.0,0.0,0.0,0.0,1.0,0.0,0.0,0.0,0,0.0,0.0,0.0,0.0,0.0,0.0,0.0,0.0,0.0,0.0,0.0,0.0,0.0,0.0,0.0,0.0,0.0,0.0,0.0,0.0,0.0,0.0,0.0,1.0,0.0,0.0,0.0,0.0,0.0,0.0,0.0,0.0,0.0,0.0,0.0,1.0,1.0,0.0,0.0,0.0,0.0,00-0031568,B.Petty,9.0,00-0024334,B.Marshall,9.0,,,,,,,,,,,,,,,,,,,,,,,,,,,,,,,,,,,,,,,,,,,,,,,,,,,,00-0024421,A.Bethea,SF,,,,,,,,,,1.0,00-0028836,M.Wilhoite,SF,,,,,,,,,,,,,,,,,,,,,,,,,,,,,0.0,,,,,0,,,0.0,0.0,0.0,0.0,,,2016,0.67975389957428,32.024610042572,47,1,First down,3237,"12/11/16, 16:05:31",2016-12-11T23:36:04Z,Levi's® Stadium,"Mostly Cloudy Temp: 54° F, Humidity: 62%, Wind: NW 8 mph",10012016-1211-10ba-f014-07cfa8bc0085,0,0,PASS,0,,,,20,Touchdown,2016-12-11T23:31:14Z,15.0,8:23,6.0,1.0,1.0,4.0,4.0,0.0,PUNT,TOUCHDOWN,13:27,05:04,NYJ 34,SF 5,3079.0,3433.0,23,17,Home,-6,40,3.0,42.5,0,outdoors,grass,54.0,8.0,Chip Kelly,Todd Bowles,SFO01,Levi's Stadium,0,1.0,B.Petty,9.0,,,B.Marshall,15.0,1,0,0.0,0,1,00-0031568,,00-0024334,B.Petty,9.0,00-0031568,B.Marshall,00-0024334,B.Marshall,00-0024334,1,0,0.0674579101614654,1.20698285169479,3.7756675631972,2.0,0.348255785938818,0.251729505893309,0.989138305187225,1.08616948127747,2016-12-11,B.Marshall,2016,REG,NYJ,14,00-0024334,WR,Brandon Marshall,Brandon,Marshall,,,,Knee,Foot,Full Participation in Practice,2016-12-09T11:03:25Z,2016-12-09 11:03:25
3235,2016_11_HOU_OAK,2016112100,LV,HOU,REG,11,HOU,away,LV,HOU,51.0,2016-11-21,604.0,604.0,604.0,Half2,0,18.0,0,4,2.0,0,10:04,HOU 49,5,41.0,(10:04) 17-B.Osweiler pass short middle to 87-C.Fiedorowicz to LV 37 for 14 yards (51-B.Irvin). HOU-87-C.Fiedorowicz was injured during the play.,pass,14.0,0,0,1.0,0,0,0,short,middle,6.0,8.0,,,,,,,3,3,0.0,,,,,3.0,3.0,20,20,20.0,20.0,0.0,20.0,20.0,0.0,0.0958676859736443,0.10261719673872,0.0013183436822146,0.146877452731133,0.267246335744858,0.0038007583934813,0.382272243499756,0.0,0.0,2.14661578182131,1.31507565034553,-3.7430122976657,3.7430122976657,-5.41042284789728,5.41042284789728,-6.58446996039411,6.58446996039411,0.647419386776164,0.66765626356937,0.647419386776164,0.66765626356937,-10.989509785024,10.989509785024,4.68513490469195,-4.68513490469195,-5.30696898145834,5.30696898145834,-1.50077697917286,1.50077697917286,0.514174997806549,0.485825002193451,0.485825002193451,0.514174997806549,0.0801052451133728,0.0642068684101105,-0.0642068684101105,0.405719757080078,0.594280242919922,0.48780682682991,0.51219317317009,-0.116641893563062,0.116641893563062,-0.264924428042175,0.264924428042175,0.0,0.0801052451133728,0.0,0.0801052451133728,-0.0983108208449273,0.0983108208449273,-0.134769497900449,0.134769497900449,-0.0983108208449273,0.0983108208449273,-0.140726922541104,0.140726922541104,0.0,0.0,1.0,0.0,0.0,0.0,0.0,0.0,0.0,0,0.0,0.0,0.0,0.0,0.0,0.0,0.0,0.0,0.0,0.0,0.0,0.0,0.0,0.0,1.0,0.0,0.0,0.0,0.0,0.0,0.0,0.0,0.0,1.0,0.0,0.0,0.0,0.0,0.0,0.0,0.0,0.0,0.0,0.0,0.0,1.0,0.0,0.0,0.0,0.0,0.0,00-0029682,B.Osweiler,14.0,00-0031302,C.Fiedorowicz,14.0,,,,,,,,,,,,,,,,,,,,,,,,,,,,,,,,,,,,,,,,,,,,,,LV,,00-0029193,,B.Irvin,,,,,,,,,,,,,,0.0,,,,,,,,,,,,,,,,,,,,,,,,,,,,,,,,0.0,,,,,0,,,0.0,0.0,0.0,0.0,,,2016,0.755106747150421,24.4893252849579,42,1,First down,3235,"11/21/16, 20:31:27",2016-11-22T04:17:53Z,Estadio Azteca (Mexico City),"Clear Temp: 63° F, Humidity: 39%, Wind: N 6 mph",10012016-1121-00de-466d-a54369009314,0,0,PASS,0,,,,18,Turnover on downs,2016-11-22T04:14:14Z,9.0,4:29,2.0,1.0,0.0,4.0,4.0,0.0,KICKOFF,DOWNS,10:44,06:15,HOU 44,LV 15,3189.0,3434.0,20,27,Neutral,7,47,6.5,45.5,0,outdoors,grass,63.0,6.0,Jack Del Rio,Bill O'Brien,MEX00,Azteca Stadium,0,1.0,B.Osweiler,17.0,,,C.Fiedorowicz,87.0,1,0,1.0,0,1,00-0029682,,00-0031302,B.Osweiler,17.0,00-0029682,C.Fiedorowicz,00-0031302,C.Fiedorowicz,00-0031302,0,0,1.31507565034553,0.286123592061766,4.30261205910938,2.0,0.998223602829967,0.996568326547276,0.509108185768127,49.0891814231873,2016-11-21,C.Fiedorowicz,2016,REG,HOU,11,00-0031302,TE,C.J. Fiedorowicz,C.J.,Fiedorowicz,,,,Neck,,Full Participation in Practice,2016-11-19T11:40:27Z,2016-11-19 11:40:27
3177,2016_14_SEA_GB,2016121111,GB,SEA,REG,14,SEA,away,GB,SEA,75.0,2016-12-11,631.0,631.0,631.0,Half2,0,22.0,0,4,1.0,0,10:31,SEA 25,10,75.0,(10:31) 16-T.Lockett right end to SEA 38 for 13 yards (42-M.Burnett). GB-23-D.Randall was injured during the play.,run,13.0,0,0,0.0,0,0,0,,,,,right,end,,,,,2,2,0.0,,,,,2.0,2.0,31,3,3.0,31.0,-28.0,3.0,31.0,-28.0,0.137159273028374,0.134983330965042,0.0032903074752539,0.194978550076485,0.241299733519554,0.0017033470794558,0.286585450172424,0.0,0.0,0.957023587543517,0.688683077460155,28.742758688228,-28.742758688228,-3.64259309011586,3.64259309011586,35.887405829605,-35.887405829605,,,0.0,0.0,1.97012008388992,-1.97012008388992,8.4646457855124,-8.4646457855124,-7.5740754964645,7.5740754964645,40.4255787108986,-40.4255787108986,7.48375896364451e-05,0.999925162410364,0.999925162410364,7.48375896364451e-05,-6.96916686138138e-06,4.38782080891542e-06,-4.38782080891542e-06,0.999932131577225,6.78684227750637e-05,4.00348944822326e-05,0.999959965105518,-0.0154425604281471,0.0154425604281471,0.55261755620856,-0.55261755620856,,,0.0,0.0,0.0314522570697591,-0.0314522570697591,0.22315154436771,-0.22315154436771,0.0306452930672094,-0.0306452930672094,0.497963275553474,-0.497963275553474,0.0,1.0,0.0,0.0,0.0,0.0,0.0,0.0,0.0,0,0.0,0.0,0.0,0.0,0.0,0.0,0.0,0.0,0.0,0.0,0.0,0.0,0.0,0.0,1.0,0.0,0.0,0.0,0.0,0.0,0.0,0.0,1.0,0.0,0.0,0.0,0.0,0.0,0.0,0.0,0.0,0.0,0.0,0.0,0.0,0.0,0.0,0.0,0.0,0.0,0.0,,,,,,,00-0032211,T.Lockett,13.0,,,,,,,,,,,,,,,,,,,,,,,,,,,,,,,,,,,,,,,,,,,GB,,00-0027676,,M.Burnett,,,,,,,,,,,,,,0.0,,,,,,,,,,,,,,,,,,,,,,,,,,,,,,,,0.0,,,,,0,,,0.0,0.0,0.0,0.0,,,2016,,,47,1,First down,3177,"12/11/16, 16:25:41",2016-12-12T00:05:59Z,Lambeau Field,"Temp: 26° F, Humidity: 85%, Wind: W 5 mph",10012016-1211-112e-3c4a-80afa1f8e61b,0,0,RUSH,0,,,,22,Touchdown,2016-12-12T00:05:17Z,7.0,2:10,5.0,0.0,1.0,4.0,4.0,0.0,KICKOFF,TOUCHDOWN,10:31,08:21,SEA 25,GB 21,3162.0,3341.0,10,38,Home,28,48,-3.0,47.0,0,outdoors,grass,26.0,5.0,Mike McCarthy,Pete Carroll,GNB00,Lambeau Field,0,1.0,,,T.Lockett,16.0,,,0,1,1.0,0,1,,00-0032211,,T.Lockett,16.0,00-0032211,T.Lockett,00-0032211,T.Lockett,00-0032211,0,1,0.688683077460155,,,,,,0.81721442937851,-81.721442937851,2016-12-11,D.Randall,2016,REG,GB,14,00-0032251,CB,Damarious Randall,Damarious,Randall,Groin,Illness,Questionable,Groin,Illness,Limited Participation in Practice,2016-12-09T13:06:52Z,2016-12-09 13:06:52
3141,2016_16_MIA_BUF,2016122400,BUF,MIA,REG,16,BUF,home,MIA,MIA,18.0,2016-12-24,78.0,978.0,978.0,Half2,0,17.0,1,3,2.0,0,01:18,MIA 18,4,78.0,"(1:18) (Shotgun) 5-T.Taylor pass deep right to 85-C.Clay for 18 yards, TOUCHDOWN. MIA-24-I.Abdul-Quddus was injured during the play. His return is Questionable. Caught at MIA 2, slanting to middle. I.Abdul-Quddus assisted off.",pass,18.0,1,0,1.0,0,0,0,deep,right,16.0,2.0,,,,,,,3,3,0.0,,BUF,C.Clay,00-0028112,3.0,3.0,20,28,14.0,28.0,-14.0,20.0,28.0,-8.0,0.0076822875998914,0.0215557422488928,0.0004544772964436,0.0327425934374332,0.382564246654511,0.0010706661269068,0.55392998456955,0.0,0.0,4.73256962880259,2.26743037119741,-12.2136309926583,12.2136309926583,-6.14015873649623,6.14015873649623,2.01987374570893,-2.01987374570893,1.24341814348008,1.02401222771732,1.24341814348008,1.02401222771732,3.0866440840764,-3.0866440840764,-4.41781717390547,4.41781717390547,5.50784662348451,-5.50784662348451,-1.95942544992574,1.95942544992574,0.152435302734375,0.847564697265625,0.152435302734375,0.847564697265625,0.0440956809830726,0.0614276801780933,0.0614276801780933,0.196530983717448,0.803469016282552,0.193979635834694,0.193979635834694,-0.146222010286425,0.146222010286425,0.274838384515047,-0.274838384515047,0.0,0.0440956809830726,0.0,0.0440956809830726,-0.332693871292889,0.332693871292889,0.571953870812476,-0.571953870812476,-0.332693871292889,0.332693871292889,0.662035830775321,-0.662035830775321,0.0,0.0,1.0,0.0,0.0,0.0,0.0,0.0,0.0,0,0.0,0.0,0.0,0.0,0.0,0.0,0.0,0.0,0.0,0.0,0.0,0.0,0.0,0.0,0.0,0.0,0.0,0.0,0.0,0.0,0.0,0.0,0.0,1.0,0.0,1.0,1.0,0.0,0.0,0.0,0.0,0.0,0.0,0.0,0.0,1.0,0.0,0.0,0.0,0.0,0.0,00-0028118,T.Taylor,18.0,00-0028112,C.Clay,18.0,,,,,,,,,,,,,,,,,,,,,,,,,,,,,,,,,,,,,,,,,,,,,,,,,,,,,,,,,,,,,,,,0.0,,,,,,,,,,,,,,,,,,,,,,,,,,,,,,,,0.0,,,,,0,,,0.0,0.0,0.0,0.0,,,2016,0.385599941015244,61.4400058984757,41,1,Touchdown,3141,"12/24/16, 13:02:48",2016-12-24T20:08:25Z,Highmark Stadium,"Cloudy Temp: 38° F, Humidity: 86%, Wind: W 13 mph",10012016-1224-006c-9f20-4fe161ac8ae2,0,0,PASS,0,,,,17,Touchdown,2016-12-24T20:05:46Z,4.0,2:02,2.0,1.0,1.0,3.0,3.0,0.0,KICKOFF,TOUCHDOWN,03:14,01:12,BUF 22,MIA 18,3044.0,3166.0,34,31,Home,-3,65,4.5,44.5,1,outdoors,a_turf,38.0,13.0,Rex Ryan,Adam Gase,BUF00,New Era Field,0,1.0,T.Taylor,5.0,,,C.Clay,85.0,1,0,1.0,0,1,00-0028118,,00-0028112,T.Taylor,5.0,00-0028118,C.Clay,00-0028112,C.Clay,00-0028112,0,1,2.26743037119741,0.786896438703691,1.38689211203018,2.0,1.0,1.0,0.472762018442154,52.7237981557846,2016-12-24,I.Abdul-Quddus,2016,REG,MIA,16,00-0028564,S,Isa Abdul-Quddus,Isa,Abdul-Quddus,Ankle,,Questionable,Ankle,,Full Participation in Practice,2016-12-23T08:10:01Z,2016-12-23 08:10:01
3132,2016_12_CAR_OAK,2016112710,LV,CAR,REG,12,CAR,away,LV,CAR,66.0,2016-11-27,28.0,928.0,928.0,Half2,0,22.0,0,3,1.0,0,00:28,CAR 34,10,76.0,"(:28) 28-J.Stewart up the middle to CAR 36 for 2 yards (52-K.Mack, 78-J.Ellis). CAR-66-G.Gradkowski was injured during the play. His return is Doubtful.",run,2.0,0,0,0.0,0,0,0,,,,,middle,,,,,,3,3,0.0,,,,,3.0,3.0,24,25,25.0,24.0,1.0,25.0,24.0,1.0,0.0408043228089809,0.132206365466118,0.0026801936328411,0.22205813229084,0.250689744949341,0.0035885861143469,0.34797266125679,0.0,0.0,1.23866862617433,-0.332245882134885,-5.73155475633364,5.73155475633364,-14.980572068016,14.980572068016,8.73350725349732,-8.73350725349732,,,0.0,0.0,-1.08819651399972,1.08819651399972,6.82670179463457,-6.82670179463457,-3.67025387083413,3.67025387083413,9.40146242484352,-9.40146242484352,0.575489699840546,0.424510300159454,0.424510300159454,0.575489699840546,-0.0184785127639771,-0.0116973519325256,0.0116973519325256,0.442988812923431,0.557011187076569,0.546708524227142,0.453291475772858,-0.163718210973229,0.163718210973229,0.0157415089038894,-0.0157415089038894,,,0.0,0.0,-0.067946511911827,0.067946511911827,0.10113251760602,-0.10113251760602,-0.0653767768616256,0.0653767768616256,-0.0193045062966485,0.0193045062966485,0.0,0.0,0.0,0.0,0.0,0.0,0.0,0.0,0.0,0,0.0,0.0,0.0,0.0,0.0,0.0,0.0,0.0,0.0,0.0,0.0,0.0,0.0,0.0,0.0,0.0,0.0,0.0,0.0,0.0,0.0,0.0,1.0,0.0,0.0,0.0,0.0,0.0,0.0,0.0,0.0,0.0,0.0,0.0,0.0,0.0,1.0,0.0,0.0,0.0,0.0,,,,,,,00-0026153,J.Stewart,2.0,,,,,,,,,,,,,,,,,,,,,,,,,,,,,,,,,,,,,,,,,,,,,,,,,00-0031346,J.Ellis,LV,,,,,,,,,,1.0,00-0031040,K.Mack,LV,,,,,,,,,,,,,,,,,,,,,,,,,,,,,0.0,,,,,0,,,0.0,0.0,0.0,0.0,,,2016,,,44,1,First down,3132,"11/27/16, 16:25:09",2016-11-27T23:53:54Z,Oakland-Alameda County Stadium,"Partly Cloudy Temp: 59° F, Humidity: 55%, Wind: WNW 12 mph",10012016-1127-103c-15ba-ce5f5250994a,0,0,RUSH,0,,,,22,Touchdown,2016-11-27T23:51:16Z,7.0,2:57,3.0,0.0,1.0,3.0,4.0,5.0,PUNT,TOUCHDOWN,01:23,13:26,CAR 24,LV 44,3056.0,3267.0,32,35,Home,3,67,3.5,48.5,0,outdoors,grass,59.0,12.0,Jack Del Rio,Ron Rivera,OAK00,Oakland-Alameda County Coliseum,0,0.0,,,J.Stewart,28.0,,,0,1,0.0,0,1,,00-0026153,,J.Stewart,28.0,00-0026153,J.Stewart,00-0026153,J.Stewart,00-0026153,0,1,-0.332245882134885,,,,,,0.467974931001663,-46.7974931001663,2016-11-27,G.Gradkowski,2016,REG,CAR,12,00-0029268,C,Gino Gradkowski,Gino,Gradkowski,Knee,,Questionable,Knee,,Full Participation in Practice,2016-11-25T10:52:00Z,2016-11-25 10:52:00
3125,2016_12_ARI_ATL,2016112700,ATL,ARI,REG,12,ATL,home,ARI,ARI,26.0,2016-11-27,576.0,576.0,576.0,Half2,0,16.0,0,4,1.0,0,09:36,ARI 26,10,60.0,(9:36) 24-D.Freeman right end to ARI 25 for 1 yard (98-C.Peters). ARI-98-C.Peters was injured during the play.,run,1.0,0,0,0.0,0,0,0,,,,,right,end,,,,,3,2,0.0,,,,,3.0,2.0,24,13,24.0,13.0,11.0,24.0,13.0,11.0,0.0398957766592503,0.0329084470868111,0.0007635005749762,0.0402613170444965,0.355788767337799,0.0013237987877801,0.529058396816254,0.0,0.0,4.39134111558087,-0.434623175417073,14.7884375390171,-14.7884375390171,3.36778002388288,-3.36778002388288,-0.467307677641447,0.467307677641447,,,0.0,0.0,-4.92804776813136,4.92804776813136,5.20188687697758,-5.20188687697758,-9.2021871432662,9.2021871432662,12.40669246329,-12.40669246329,0.967696964740753,0.0323030352592468,0.967696964740753,0.0323030352592468,-0.003615379333496,0.0009023547172546,0.0009023547172546,0.964081585407257,0.0359184145927429,0.974083662033081,0.974083662033081,0.188565835634493,-0.188565835634493,-0.0432250348560205,0.0432250348560205,,,0.0,0.0,0.228591701819019,-0.228591701819019,-0.243806927121417,0.243806927121417,0.22135635359438,-0.22135635359438,-0.189699939108626,0.189699939108626,0.0,0.0,0.0,0.0,0.0,0.0,0.0,0.0,0.0,0,0.0,0.0,0.0,0.0,0.0,0.0,0.0,0.0,0.0,0.0,0.0,0.0,0.0,0.0,1.0,0.0,0.0,0.0,0.0,0.0,0.0,0.0,1.0,0.0,0.0,0.0,0.0,0.0,0.0,0.0,0.0,0.0,0.0,0.0,0.0,0.0,0.0,0.0,0.0,0.0,0.0,,,,,,,00-0031285,D.Freeman,1.0,,,,,,,,,,,,,,,,,,,,,,,,,,,,,,,,,,,,,,,,,,,ARI,,00-0027686,,C.Peters,,,,,,,,,,,,,,0.0,,,,,,,,,,,,,,,,,,,,,,,,,,,,,,,,0.0,,,,,0,,,0.0,0.0,0.0,0.0,,,2016,,,51,1,Touchdown,3125,"11/27/16, 13:03:43",2016-11-27T20:27:04Z,Georgia Dome,"Temp: ° F, Wind: mph",10012016-1127-00c3-ec54-bc1463b44959,0,0,RUSH,0,,,,16,Touchdown,2016-11-27T20:20:05Z,10.0,5:29,4.0,0.0,1.0,4.0,4.0,-5.0,DOWNS,TOUCHDOWN,14:17,08:48,ATL 40,ARI 25,2897.0,3170.0,19,38,Home,19,57,3.5,49.0,0,dome,fieldturf,,,Dan Quinn,Bruce Arians,ATL00,Georgia Dome,0,0.0,,,D.Freeman,24.0,,,0,1,0.0,0,1,,00-0031285,,D.Freeman,24.0,00-0031285,D.Freeman,00-0031285,D.Freeman,00-0031285,0,0,-0.434623175417073,,,,,,0.267617285251617,-26.7617285251617,2016-11-27,C.Peters,2016,REG,ARI,12,00-0027686,DT,Corey Peters,Corey,Peters,Foot,,Questionable,Foot,,Limited Participation in Practice,2016-11-25T12:06:23Z,2016-11-25 12:06:23
3093,2016_08_GB_ATL,2016103001,ATL,GB,REG,8,GB,away,ATL,ATL,37.0,2016-10-30,472.0,472.0,472.0,Half2,0,15.0,0,4,3.0,0,07:52,ATL 37,3,86.0,(7:52) (Shotgun) 12-A.Rodgers scrambles right end ran ob at ATL 24 for 13 yards (29-C.Goodwin). GB-70-T.Lang was injured during the play.,run,13.0,1,0,1.0,0,0,1,,,,,right,end,,,,,2,2,0.0,,,,,2.0,2.0,26,24,24.0,26.0,-2.0,24.0,26.0,-2.0,0.0977399796247482,0.072298176586628,0.0011843797983601,0.101277075707912,0.35784375667572,0.0018900344148278,0.367766618728638,0.0,0.0,2.72347485064529,1.50348952761851,-3.08575942881184,3.08575942881184,-0.66432145984868,0.66432145984868,-4.41327782084152,4.41327782084152,,,0.0,0.0,-11.3360085162503,11.3360085162503,3.50438131579339,-3.50438131579339,-17.0107858812489,17.0107858812489,9.70915259899247,-9.70915259899247,0.487299025058746,0.512700974941254,0.512700974941254,0.487299025058746,0.0953444838523865,0.0900185108184815,-0.0900185108184815,0.417356491088867,0.582643508911133,0.476399064064026,0.523600935935974,0.0500927752378583,-0.0500927752378583,-0.245689854685101,0.245689854685101,,,0.0,0.0,-0.516857536217107,0.516857536217107,0.230504677610497,-0.230504677610497,-0.516857536217107,0.516857536217107,0.211422369794945,-0.211422369794945,0.0,1.0,0.0,0.0,1.0,0.0,0.0,0.0,0.0,0,0.0,0.0,0.0,0.0,0.0,0.0,0.0,0.0,0.0,0.0,0.0,0.0,0.0,0.0,1.0,0.0,0.0,0.0,0.0,0.0,0.0,0.0,1.0,0.0,0.0,0.0,0.0,0.0,0.0,0.0,0.0,0.0,0.0,0.0,0.0,0.0,0.0,0.0,0.0,0.0,0.0,,,,,,,00-0023459,A.Rodgers,13.0,,,,,,,,,,,,,,,,,,,,,,,,,,,,,,,,,,,,,,,,,,,ATL,,00-0031357,,C.Goodwin,,,,,,,,,,,,,,0.0,,,,,,,,,,,,,,,,,,,,,,,,,,,,,,,,0.0,,,,,0,,,0.0,0.0,0.0,0.0,,,2016,,,50,1,First down,3093,"10/30/16, 16:25:46",2016-10-30T22:53:01Z,Georgia Dome,"Temp: ° F, Wind: mph",10012016-1030-01e1-c3ca-6862852d2658,0,0,RUSH,0,,,,15,Touchdown,2016-10-30T22:47:35Z,13.0,8:33,6.0,1.0,1.0,4.0,4.0,5.0,PUNT,TOUCHDOWN,12:31,03:58,GB 14,ATL 7,2915.0,3335.0,32,33,Home,1,65,3.0,51.0,0,dome,fieldturf,,,Dan Quinn,Mike McCarthy,ATL00,Georgia Dome,0,1.0,A.Rodgers,12.0,,12.0,,,1,0,1.0,0,1,00-0023459,,,A.Rodgers,12.0,00-0023459,A.Rodgers,00-0023459,A.Rodgers,00-0023459,1,1,1.50348952761851,,,,,,0.890361726284027,10.9638273715973,2016-10-30,T.Lang,2016,REG,GB,8,00-0027078,G,T.J. Lang,T.J.,Lang,Hip,,Questionable,Hip,,Limited Participation in Practice,2016-10-28T11:41:24Z,2016-10-28 11:41:24
