play_id,game_id,old_game_id,home_team,away_team,season_type,week_x,posteam,posteam_type,defteam,side_of_field,yardline_100,game_date,quarter_seconds_remaining,half_seconds_remaining,game_seconds_remaining,game_half,quarter_end,drive,sp,qtr,down,goal_to_go,time,yrdln,ydstogo,ydsnet,desc,play_type,yards_gained,shotgun,no_huddle,qb_dropback,qb_kneel,qb_spike,qb_scramble,pass_length,pass_location,air_yards,yards_after_catch,run_location,run_gap,field_goal_result,kick_distance,extra_point_result,two_point_conv_result,home_timeouts_remaining,away_timeouts_remaining,timeout,timeout_team,td_team,td_player_name,td_player_id,posteam_timeouts_remaining,defteam_timeouts_remaining,total_home_score,total_away_score,posteam_score,defteam_score,score_differential,posteam_score_post,defteam_score_post,score_differential_post,no_score_prob,opp_fg_prob,opp_safety_prob,opp_td_prob,fg_prob,safety_prob,td_prob,extra_point_prob,two_point_conversion_prob,ep,epa,total_home_epa,total_away_epa,total_home_rush_epa,total_away_rush_epa,total_home_pass_epa,total_away_pass_epa,air_epa,yac_epa,comp_air_epa,comp_yac_epa,total_home_comp_air_epa,total_away_comp_air_epa,total_home_comp_yac_epa,total_away_comp_yac_epa,total_home_raw_air_epa,total_away_raw_air_epa,total_home_raw_yac_epa,total_away_raw_yac_epa,wp,def_wp,home_wp,away_wp,wpa,vegas_wpa,vegas_home_wpa,home_wp_post,away_wp_post,vegas_wp,vegas_home_wp,total_home_rush_wpa,total_away_rush_wpa,total_home_pass_wpa,total_away_pass_wpa,air_wpa,yac_wpa,comp_air_wpa,comp_yac_wpa,total_home_comp_air_wpa,total_away_comp_air_wpa,total_home_comp_yac_wpa,total_away_comp_yac_wpa,total_home_raw_air_wpa,total_away_raw_air_wpa,total_home_raw_yac_wpa,total_away_raw_yac_wpa,punt_blocked,first_down_rush,first_down_pass,first_down_penalty,third_down_converted,third_down_failed,fourth_down_converted,fourth_down_failed,incomplete_pass,touchback,interception,punt_inside_twenty,punt_in_endzone,punt_out_of_bounds,punt_downed,punt_fair_catch,kickoff_inside_twenty,kickoff_in_endzone,kickoff_out_of_bounds,kickoff_downed,kickoff_fair_catch,fumble_forced,fumble_not_forced,fumble_out_of_bounds,solo_tackle,safety,penalty,tackled_for_loss,fumble_lost,own_kickoff_recovery,own_kickoff_recovery_td,qb_hit,rush_attempt,pass_attempt,sack,touchdown,pass_touchdown,rush_touchdown,return_touchdown,extra_point_attempt,two_point_attempt,field_goal_attempt,kickoff_attempt,punt_attempt,fumble,complete_pass,assist_tackle,lateral_reception,lateral_rush,lateral_return,lateral_recovery,passer_player_id,passer_player_name,passing_yards,receiver_player_id,receiver_player_name,receiving_yards,rusher_player_id,rusher_player_name,rushing_yards,lateral_receiver_player_id,lateral_receiver_player_name,lateral_receiving_yards,lateral_rusher_player_id,lateral_rusher_player_name,lateral_rushing_yards,lateral_sack_player_id,lateral_sack_player_name,interception_player_id,interception_player_name,lateral_interception_player_id,lateral_interception_player_name,punt_returner_player_id,punt_returner_player_name,lateral_punt_returner_player_id,lateral_punt_returner_player_name,kickoff_returner_player_name,kickoff_returner_player_id,lateral_kickoff_returner_player_id,lateral_kickoff_returner_player_name,punter_player_id,punter_player_name,kicker_player_name,kicker_player_id,own_kickoff_recovery_player_id,own_kickoff_recovery_player_name,blocked_player_id,blocked_player_name,tackle_for_loss_1_player_id,tackle_for_loss_1_player_name,tackle_for_loss_2_player_id,tackle_for_loss_2_player_name,qb_hit_1_player_id,qb_hit_1_player_name,qb_hit_2_player_id,qb_hit_2_player_name,forced_fumble_player_1_team,forced_fumble_player_1_player_id,forced_fumble_player_1_player_name,forced_fumble_player_2_team,forced_fumble_player_2_player_id,forced_fumble_player_2_player_name,solo_tackle_1_team,solo_tackle_2_team,solo_tackle_1_player_id,solo_tackle_2_player_id,solo_tackle_1_player_name,solo_tackle_2_player_name,assist_tackle_1_player_id,assist_tackle_1_player_name,assist_tackle_1_team,assist_tackle_2_player_id,assist_tackle_2_player_name,assist_tackle_2_team,assist_tackle_3_player_id,assist_tackle_3_player_name,assist_tackle_3_team,assist_tackle_4_player_id,assist_tackle_4_player_name,assist_tackle_4_team,tackle_with_assist,tackle_with_assist_1_player_id,tackle_with_assist_1_player_name,tackle_with_assist_1_team,tackle_with_assist_2_player_id,tackle_with_assist_2_player_name,tackle_with_assist_2_team,pass_defense_1_player_id,pass_defense_1_player_name,pass_defense_2_player_id,pass_defense_2_player_name,fumbled_1_team,fumbled_1_player_id,fumbled_1_player_name,fumbled_2_player_id,fumbled_2_player_name,fumbled_2_team,fumble_recovery_1_team,fumble_recovery_1_yards,fumble_recovery_1_player_id,fumble_recovery_1_player_name,fumble_recovery_2_team,fumble_recovery_2_yards,fumble_recovery_2_player_id,fumble_recovery_2_player_name,sack_player_id,sack_player_name,half_sack_1_player_id,half_sack_1_player_name,half_sack_2_player_id,half_sack_2_player_name,return_team,return_yards,penalty_team,penalty_player_id,penalty_player_name,penalty_yards,replay_or_challenge,replay_or_challenge_result,penalty_type,defensive_two_point_attempt,defensive_two_point_conv,defensive_extra_point_attempt,defensive_extra_point_conv,safety_player_name,safety_player_id,season_x,cp,cpoe,series,series_success,series_result,order_sequence,start_time,time_of_day,stadium,weather,nfl_api_id,play_clock,play_deleted,play_type_nfl,special_teams_play,st_play_type,end_clock_time,end_yard_line,fixed_drive,fixed_drive_result,drive_real_start_time,drive_play_count,drive_time_of_possession,drive_first_downs,drive_inside20,drive_ended_with_score,drive_quarter_start,drive_quarter_end,drive_yards_penalized,drive_start_transition,drive_end_transition,drive_game_clock_start,drive_game_clock_end,drive_start_yard_line,drive_end_yard_line,drive_play_id_started,drive_play_id_ended,away_score,home_score,location,result,total,spread_line,total_line,div_game,roof,surface,temp,wind,home_coach,away_coach,stadium_id,game_stadium,aborted_play,success,passer,passer_jersey_number,rusher,rusher_jersey_number,receiver,receiver_jersey_number,pass,rush,first_down,special,play,passer_id,rusher_id,receiver_id,name,jersey_number,id,fantasy_player_name,fantasy_player_id,fantasy,fantasy_id,out_of_bounds,home_opening_kickoff,qb_epa,xyac_epa,xyac_mean_yardage,xyac_median_yardage,xyac_success,xyac_fd,xpass,pass_oe,date_x,injured_player,season_y,game_type,team,week_y,gsis_id,position,full_name,first_name,last_name,report_primary_injury,report_secondary_injury,report_status,practice_primary_injury,practice_secondary_injury,practice_status,date_modified,date_y
4639,2011_13_DEN_MIN,2011120409,MIN,DEN,REG,13,DEN,away,MIN,MIN,3.0,2011-12-04,13.0,13.0,13.0,Half2,0,29.0,0,4,3.0,1,00:13,MIN 3,3,10.0,(:13) 15-T.Tebow left guard to MIN 5 for -2 yards (50-E.Henderson). DEN-78-R.Clady was injured during the play.,run,-2.0,0,0,0.0,0,0,0,,,,,left,guard,,,,,0,2,0.0,,,,,2.0,0.0,32,32,32.0,32.0,0.0,32.0,32.0,0.0,0.176161780953407,0.001592478598468,0.0005175837432034,0.002849141601473,0.538333117961884,0.0011401561787352,0.279405742883682,0.0,0.0,3.54736327193677,-0.617995138483818,-7.53093479569373,7.53093479569373,4.32850414443225,-4.32850414443225,-10.7598153909888,10.7598153909888,,,0.0,0.0,-7.15239371563075,7.15239371563075,22.2722306766469,-22.2722306766469,3.11612421361497,-3.11612421361497,-10.0934036039501,10.0934036039501,0.821567952632904,0.178432047367096,0.178432047367096,0.821567952632904,-0.0064047574996948,-0.0150917768478394,0.0150917768478394,0.184836804866791,0.815163195133209,0.90551221370697,0.0944877862930298,0.0990003347396851,-0.0990003347396851,-0.63630284099221,0.63630284099221,,,0.0,0.0,-0.136740668116202,0.136740668116202,0.527282874753159,-0.527282874753159,-0.134213133154502,0.134213133154502,-0.441123409853585,0.441123409853585,0.0,0.0,0.0,0.0,0.0,1.0,0.0,0.0,0.0,0,0.0,0.0,0.0,0.0,0.0,0.0,0.0,0.0,0.0,0.0,0.0,0.0,0.0,0.0,1.0,0.0,0.0,1.0,0.0,0.0,0.0,0.0,1.0,0.0,0.0,0.0,0.0,0.0,0.0,0.0,0.0,0.0,0.0,0.0,0.0,0.0,0.0,0.0,0.0,0.0,0.0,,,,,,,00-0027876,T.Tebow,-2.0,,,,,,,,,,,,,,,,,,,,,,,,,,,,,00-0025945,E.Henderson,,,,,,,,,,,,,MIN,,00-0025945,,E.Henderson,,,,,,,,,,,,,,0.0,,,,,,,,,,,,,,,,,,,,,,,,,,,,,,,,0.0,,,,,0,,,0.0,0.0,0.0,0.0,,,2011,,,63,0,Field goal,4639,"12/4/11, 13:02:52",2011-12-04T21:16:52Z,Mall of America Field,"Temp: 65° F, Wind: mph",10012011-1204-097f-a5ac-547819b59304,0,0,RUSH,0,,,,29,Field goal,2011-12-04T21:13:06Z,6.0,1:25,1.0,1.0,1.0,4.0,4.0,0.0,INTERCEPTION,FIELD_GOAL,01:25,00:00,MIN 15,MIN 5,4499.0,4684.0,35,32,Home,-3,67,1.0,37.5,0,dome,sportturf,,,Leslie Frazier,John Fox,MIN00,Mall of America Field,0,0.0,,,T.Tebow,15.0,,,0,1,0.0,0,1,,00-0027876,,T.Tebow,15.0,00-0027876,T.Tebow,00-0027876,T.Tebow,00-0027876,0,1,-0.617995138483818,,,,,,0.218472838401794,-21.8472838401794,2011-12-04,R.Clady,2011,REG,DEN,13,00-0026152,T,Ryan Clady,Ryan,Clady,Knee,,Probable,Knee,,Full Participation in Practice,2011-12-02T11:57:20Z,2011-12-02 11:57:20
4485,2011_09_CIN_TEN,2011110608,TEN,CIN,REG,9,TEN,home,CIN,TEN,55.0,2011-11-06,19.0,19.0,19.0,Half2,0,24.0,0,4,2.0,0,00:19,TEN 45,15,48.0,(:19) (Shotgun) 8-M.Hasselbeck sacked at TEN 38 for -7 yards (96-C.Dunlap). CIN-96-C.Dunlap was injured during the play. His return is Questionable.,pass,-7.0,1,0,1.0,0,0,0,,,,,,,,,,,0,2,0.0,,,,,0.0,2.0,17,24,17.0,24.0,-7.0,17.0,24.0,-7.0,0.868454158306122,0.0054000066593289,0.0002507915487512,0.0065159499645233,0.0991425588726997,0.0003056832938455,0.0199308786541224,0.0,0.0,0.375241940957494,-0.329451535653789,-10.4992554777461,10.4992554777461,-3.71062427706245,3.71062427706245,-7.35612829813243,7.35612829813243,,,0.0,0.0,-1.86476881249109,1.86476881249109,-7.02986561225469,7.02986561225469,5.8273593102931,-5.8273593102931,-11.8919255342705,11.8919255342705,0.0411580838263035,0.958841916173697,0.0411580838263035,0.958841916173697,-0.012461407110095,-0.011462951079011,-0.011462951079011,0.0286966767162085,0.971303323283792,0.021895993500948,0.021895993500948,-0.231829136610031,0.231829136610031,-0.24481771321051,0.24481771321051,,,0.0,0.0,-0.146284852111863,0.146284852111863,-0.0831239260733128,0.0831239260733128,-0.164687581295299,0.164687581295299,-0.0499142594635487,0.0499142594635487,0.0,0.0,0.0,0.0,0.0,0.0,0.0,0.0,0.0,0,0.0,0.0,0.0,0.0,0.0,0.0,0.0,0.0,0.0,0.0,0.0,0.0,0.0,0.0,1.0,0.0,0.0,0.0,0.0,0.0,0.0,1.0,0.0,1.0,1.0,0.0,0.0,0.0,0.0,0.0,0.0,0.0,0.0,0.0,0.0,0.0,0.0,0.0,0.0,0.0,0.0,00-0007091,M.Hasselbeck,,,,,,,,,,,,,,,,,,,,,,,,,,,,,,,,,,,,00-0027662,C.Dunlap,,,00-0027662,C.Dunlap,,,,,,,,,CIN,,00-0027662,,C.Dunlap,,,,,,,,,,,,,,0.0,,,,,,,,,,,,,,,,,,,,,,,,,00-0027662,C.Dunlap,,,,,,0.0,,,,,0,,,0.0,0.0,0.0,0.0,,,2011,,,57,1,First down,4485,"11/6/11, 16:05:43",2011-11-07T00:20:50Z,Nissan Stadium,"Sunny Temp: 68° F, Humidity: 39%, Wind: S 13 mph",10012011-1106-081b-1a2f-9970e66d0b31,0,0,SACK,0,,,,24,End of half,2011-11-07T00:15:29Z,8.0,1:55,3.0,0.0,0.0,4.0,4.0,-5.0,KICKOFF,END_GAME,01:55,00:00,TEN 20,TEN 38,4280.0,4532.0,24,17,Home,-7,41,1.5,41.5,0,outdoors,grass,68.0,13.0,Mike Munchak,Marvin Lewis,NAS00,LP Field,0,0.0,M.Hasselbeck,8.0,,,,,1,0,0.0,0,1,00-0007091,,,M.Hasselbeck,8.0,00-0007091,,,,,0,1,-0.329451535653789,,,,,,0.995896816253662,0.410318374633789,2011-11-06,C.Dunlap,2011,REG,CIN,9,00-0027662,DE,Carlos Dunlap,Carlos,Dunlap,Groin,,Probable,Groin,,Full Participation in Practice,2011-11-04T10:50:25Z,2011-11-04 10:50:25
4369,2011_09_NYG_NE,2011110609,NE,NYG,REG,9,NYG,away,NE,NYG,80.0,2011-11-06,96.0,96.0,96.0,Half2,0,27.0,0,4,1.0,0,01:36,NYG 20,10,80.0,(1:36) (Shotgun) 10-E.Manning pass deep middle to 80-V.Cruz to NYG 39 for 19 yards (32-D.McCourty). NE-30-J.Barrett was injured during the play.,pass,19.0,1,0,1.0,0,0,0,deep,middle,18.0,1.0,,,,,,,2,2,0.0,,,,,2.0,2.0,20,17,17.0,20.0,-3.0,17.0,20.0,-3.0,0.616953790187836,0.0823690518736839,0.0019943439401686,0.0567958056926727,0.142061546444893,0.0009733217884786,0.098852127790451,0.0,0.0,0.471429694094695,0.613566340412945,0.167018201276417,-0.167018201276417,2.016085176263,-2.016085176263,2.57850714731375,-2.57850714731375,0.766427464201115,-0.152861123788171,0.766427464201115,-0.152861123788171,3.62496861573891,-3.62496861573891,5.23051313834731,-5.23051313834731,8.65312453580555,-8.65312453580555,-0.855450364245376,0.855450364245376,0.258691400289536,0.741308599710465,0.741308599710465,0.258691400289536,0.0538865923881531,0.0591540336608887,-0.0591540336608887,0.687422007322311,0.312577992677689,0.207715481519699,0.792284518480301,0.117465743549061,-0.117465743549061,0.264348073822612,-0.264348073822612,0.0,0.0538865923881531,0.0,0.0538865923881531,0.350456392261218,-0.350456392261218,0.302207195291444,-0.302207195291444,0.35229272195978,-0.35229272195978,0.0905103768204887,-0.0905103768204887,0.0,0.0,1.0,0.0,0.0,0.0,0.0,0.0,0.0,0,0.0,0.0,0.0,0.0,0.0,0.0,0.0,0.0,0.0,0.0,0.0,0.0,0.0,0.0,1.0,0.0,0.0,0.0,0.0,0.0,0.0,0.0,0.0,1.0,0.0,0.0,0.0,0.0,0.0,0.0,0.0,0.0,0.0,0.0,0.0,1.0,0.0,0.0,0.0,0.0,0.0,00-0022803,E.Manning,19.0,00-0027265,V.Cruz,19.0,,,,,,,,,,,,,,,,,,,,,,,,,,,,,,,,,,,,,,,,,,,,,,NE,,00-0027647,,D.McCourty,,,,,,,,,,,,,,0.0,,,,,,,,,,,,,,,,,,,,,,,,,,,,,,,,0.0,,,,,0,,,0.0,0.0,0.0,0.0,,,2011,0.66690331697464,33.309668302536,64,1,First down,4369,"11/6/11, 16:15:28",2011-11-07T00:20:32Z,Gillette Stadium,"Sunny and Cool Temp: 54° F, Wind: SSW 9 mph",10012011-1106-0933-43db-5b81c1c6b37b,0,0,PASS,0,,,,27,Touchdown,2011-11-07T00:19:42Z,8.0,1:21,5.0,1.0,1.0,4.0,4.0,20.0,KICKOFF,TOUCHDOWN,01:36,00:15,NYG 20,NE 1,4355.0,4669.0,24,20,Home,-4,44,9.5,51.5,0,outdoors,fieldturf,54.0,9.0,Bill Belichick,Tom Coughlin,BOS00,Gillette Stadium,0,1.0,E.Manning,10.0,,,V.Cruz,80.0,1,0,1.0,0,1,00-0022803,,00-0027265,E.Manning,10.0,00-0022803,V.Cruz,00-0027265,V.Cruz,00-0027265,0,0,0.613566340412945,0.412241055399702,6.00324034882942,2.0,1.0,1.0,0.953886449337006,4.61135506629944,2011-11-06,J.Barrett,2011,REG,NE,9,00-0026360,S,Josh Barrett,Josh,Barrett,Thumb,,Questionable,Thumb,,Limited Participation in Practice,2011-11-04T12:55:40Z,2011-11-04 12:55:40
4319,2011_01_CIN_CLE,2011091101,CLE,CIN,REG,1,CLE,home,CIN,CLE,60.0,2011-09-11,66.0,66.0,66.0,Half2,0,27.0,0,4,1.0,0,01:06,CLE 40,10,12.0,"(1:06) (No Huddle, Shotgun) 12-C.McCoy pass intended for 40-P.Hillis INTERCEPTED by 93-M.Johnson at CLE 33. 93-M.Johnson to CLE 33 for no gain (73-J.Thomas). CIN-96-C.Dunlap was injured during the play. His return is Doubtful.",pass,0.0,1,1,1.0,0,0,0,,,-7.0,,,,,,,,0,2,0.0,,,,,0.0,2.0,17,27,17.0,27.0,-10.0,17.0,27.0,-10.0,0.722920477390289,0.0144189093261957,0.0003656634653452,0.0208546463400126,0.134534433484077,0.0005178566789254,0.106387980282307,0.0,0.0,0.959384296496864,-2.73417831200641,-15.5443628389082,15.5443628389082,-5.04058300916222,5.04058300916222,-8.44792148235212,8.44792148235212,-0.639056441548746,-2.09512187045766,0.0,0.0,-3.65352355520008,3.65352355520008,2.83281074147089,-2.83281074147089,-9.46219766995637,9.46219766995637,-0.517721205979628,0.517721205979628,0.0153504805639386,0.984649519436061,0.0153504805639386,0.984649519436061,-0.0134456949308515,-0.0182548500597477,-0.0182548500597477,0.0019047856330871,0.998095214366913,0.0191471911966801,0.0191471911966801,-0.0786866954532198,0.0786866954532198,-0.534582926026332,0.534582926026332,0.0,-0.0134456949308515,0.0,0.0,-0.0521607364455429,0.0521607364455429,-0.205455617772927,0.205455617772927,0.220070484753493,-0.220070484753493,-0.855705918537965,0.855705918537965,0.0,0.0,0.0,0.0,0.0,0.0,0.0,0.0,0.0,0,1.0,0.0,0.0,0.0,0.0,0.0,0.0,0.0,0.0,0.0,0.0,0.0,0.0,0.0,1.0,0.0,0.0,0.0,0.0,0.0,0.0,0.0,0.0,1.0,0.0,0.0,0.0,0.0,0.0,0.0,0.0,0.0,0.0,0.0,0.0,0.0,0.0,0.0,0.0,0.0,0.0,00-0027688,C.McCoy,,00-0026367,P.Hillis,,,,,,,,,,,,,00-0027044,M.Johnson,,,,,,,,,,,,,,,,,,,,,,,,,,,,,,,,,CLE,,00-0025390,,J.Thomas,,,,,,,,,,,,,,0.0,,,,,,,00-0027044,M.Johnson,,,,,,,,,,,,,,,,,,,,,,,CIN,0.0,,,,,0,,,0.0,0.0,0.0,0.0,,,2011,,,56,0,Turnover,4319,"9/11/11, 13:06:30",2011-09-11T20:25:19Z,Cleveland Browns Stadium,"Sunny Temp: 72° F, Wind: Variable 9 mph",10012011-0911-0179-ec30-9c05d3937fed,0,0,INTERCEPTION,0,,,,27,Turnover,2011-09-11T20:21:19Z,5.0,0:46,1.0,0.0,0.0,4.0,4.0,0.0,KICKOFF,INTERCEPTION,01:49,01:03,CLE 28,CLE 40,4201.0,4319.0,27,17,Home,-10,44,6.5,36.5,1,outdoors,grass,72.0,9.0,Pat Shurmur,Marvin Lewis,CLE00,Cleveland Browns Stadium,0,0.0,C.McCoy,12.0,,,P.Hillis,40.0,1,0,0.0,0,1,00-0027688,,00-0026367,C.McCoy,12.0,00-0027688,P.Hillis,00-0026367,P.Hillis,00-0026367,0,1,-2.73417831200641,,,,,,0.993749737739563,0.625026226043701,2011-09-11,C.Dunlap,2011,REG,CIN,1,00-0027662,DE,Carlos Dunlap,Carlos,Dunlap,Knee,,Probable,Knee,,Full Participation in Practice,2011-09-09T10:07:27Z,2011-09-09 10:07:27
4256,2011_17_BUF_NE,2012010101,NE,BUF,REG,17,BUF,away,NE,BUF,59.0,2012-01-01,116.0,116.0,116.0,Half2,0,22.0,0,4,2.0,0,01:56,BUF 41,5,36.0,"(1:56) (Shotgun) 14-R.Fitzpatrick pass deep left intended for 82-R.Martin INTERCEPTED by 24-K.Arrington [95-M.Anderson] at NE 30. 24-K.Arrington to BUF 11 for 59 yards. NE-32-D.McCourty was injured during the play. PENALTY on NE-32-D.McCourty, Personal Foul, 15 yards, enforced at BUF 41 - No Play.",no_play,0.0,1,0,0.0,0,0,0,,,,,,,,,,,2,1,0.0,,,,,1.0,2.0,49,21,21.0,49.0,-28.0,21.0,49.0,-28.0,0.554238140583038,0.0525849089026451,0.00062852865085,0.0460942685604096,0.156112417578697,0.0014267117949202,0.188915029168129,0.0,0.0,1.31192421657033,0.93625628890004,25.6483210865932,-25.6483210865932,1.52308690479561,-1.52308690479561,21.0021545310144,-21.0021545310144,,,0.0,0.0,-6.91887976170983,6.91887976170983,13.7666167661373,-13.7666167661373,-14.1867126840516,14.1867126840516,38.8648746776431,-38.8648746776431,7.73404972278513e-05,0.999922659502772,0.999922659502772,7.73404972278513e-05,6.17696787230671e-06,6.31380862614606e-06,-6.31380862614606e-06,0.9999164825349,8.3517465100158e-05,1.35634873004165e-05,0.9999864365127,-0.135363599299029,0.135363599299029,0.484825697995002,-0.484825697995002,,,0.0,0.0,0.0210979061119044,-0.0210979061119044,0.230735242965561,-0.230735242965561,0.0242695251397574,-0.0242695251397574,0.540458359845029,-0.540458359845029,0.0,0.0,0.0,1.0,0.0,0.0,0.0,0.0,0.0,0,0.0,0.0,0.0,0.0,0.0,0.0,0.0,0.0,0.0,0.0,0.0,0.0,0.0,0.0,0.0,0.0,1.0,0.0,0.0,0.0,0.0,0.0,0.0,0.0,0.0,0.0,0.0,0.0,0.0,0.0,0.0,0.0,0.0,0.0,0.0,0.0,0.0,0.0,0.0,0.0,0.0,,,,,,,,,,,,,,,,,,,,,,,,,,,,,,,,,,,,,,,,,,,,,,,,,,,,,,,,,,,,,,,,,,,,,,0.0,,,,,,,,,,,,,,,,,,,,,,,,,,,,,,,,0.0,NE,00-0027647,D.McCourty,15.0,0,,Personal Foul,0.0,0.0,0.0,0.0,,,2011,,,66,1,First down,4256,"1/1/12, 13:02:34",2012-01-01T20:58:52Z,Gillette Stadium,"Sunny and warm Temp: 51° F, Wind: SW 5 mph",10012012-0101-0116-f764-42f48f1dcd2d,0,0,PENALTY,0,,,,22,Turnover,2012-01-01T20:54:39Z,4.0,1:25,2.0,0.0,0.0,4.0,4.0,15.0,KICKOFF,INTERCEPTION,02:55,01:30,BUF 20,NE 44,4143.0,4301.0,21,49,Home,28,70,10.0,49.5,1,outdoors,fieldturf,51.0,5.0,Bill Belichick,Chan Gailey,BOS00,Gillette Stadium,0,1.0,R.Fitzpatrick,14.0,,,R.Martin,82.0,1,0,1.0,0,1,00-0023682,,00-0022421,R.Fitzpatrick,14.0,00-0023682,,,R.Martin,00-0022421,0,0,0.93625628890004,,,,,,0.887137234210968,11.2862765789032,2012-01-01,D.McCourty,2011,REG,NE,17,00-0027647,CB,Devin McCourty,Devin,McCourty,Shoulder,,Questionable,Shoulder,,Limited Participation in Practice,2011-12-30T12:41:51Z,2011-12-30 12:41:51
4064,2011_13_ATL_HOU,2011120408,HOU,ATL,REG,13,ATL,away,HOU,ATL,67.0,2011-12-04,59.0,59.0,59.0,Half2,0,22.0,0,4,1.0,0,00:59,ATL 33,10,37.0,(:59) (Shotgun) 2-M.Ryan pass short left to 22-J.Rodgers pushed ob at ATL 38 for 5 yards (30-J.Allen) [98-C.Barwin]. HOU-30-J.Allen was injured during the play.,pass,5.0,1,0,1.0,0,0,0,short,left,2.0,3.0,,,,,,,2,0,0.0,,,,,0.0,2.0,17,10,10.0,17.0,-7.0,10.0,17.0,-7.0,0.786042094230652,0.0182309988886118,0.0007623736746609,0.0227135811001062,0.107132002711296,0.0003669218567665,0.0647520497441292,0.0,0.0,0.560181388340425,0.117153004568536,5.72402624602916,-5.72402624602916,-1.19816728471778,1.19816728471778,9.8040948902715,-9.8040948902715,-0.103319312969688,0.220472317538224,-0.103319312969688,0.220472317538224,-7.63323267555097,7.63323267555097,3.42949619842693,-3.42949619842693,-30.0026689307415,30.0026689307415,47.50213107987,-47.50213107987,0.077539823949337,0.922460176050663,0.922460176050663,0.077539823949337,-0.0034616664052009,0.0038890615105629,-0.0038890615105629,0.925921842455864,0.0740781575441361,0.06370859593153,0.93629140406847,0.176690128549113,-0.176690128549113,0.223290483152965,-0.223290483152965,0.0,-0.0034616664052009,0.0,-0.0034616664052009,-0.117266221119181,0.117266221119181,-0.0750920243369384,0.0750920243369384,-0.108178882075564,0.108178882075564,0.524927803148146,-0.524927803148146,0.0,0.0,0.0,0.0,0.0,0.0,0.0,0.0,0.0,0,0.0,0.0,0.0,0.0,0.0,0.0,0.0,0.0,0.0,0.0,0.0,0.0,0.0,0.0,1.0,0.0,0.0,0.0,0.0,0.0,0.0,1.0,0.0,1.0,0.0,0.0,0.0,0.0,0.0,0.0,0.0,0.0,0.0,0.0,0.0,1.0,0.0,0.0,0.0,0.0,0.0,00-0026143,M.Ryan,5.0,00-0028083,J.Rodgers,5.0,,,,,,,,,,,,,,,,,,,,,,,,,,,,,,,,,,,,00-0027022,C.Barwin,,,,,,,,,HOU,,00-0024231,,J.Allen,,,,,,,,,,,,,,0.0,,,,,,,,,,,,,,,,,,,,,,,,,,,,,,,,0.0,,,,,0,,,0.0,0.0,0.0,0.0,,,2011,0.489539921283722,51.0460078716278,55,1,First down,4064,"12/4/11, 13:03:45",2011-12-04T21:07:48Z,NRG Stadium,"Cloudy Temp: 72° F, Humidity: 82%, Wind: SSE 22 mph",10012011-1204-0897-90ce-42d87f942fe3,0,0,PASS,0,,,,22,End of half,2011-12-04T21:07:48Z,7.0,0:59,2.0,0.0,0.0,4.0,4.0,-5.0,PUNT,END_GAME,00:59,00:00,ATL 33,HOU 30,4064.0,4261.0,10,17,Home,7,27,-1.0,38.5,0,closed,grass,,,Gary Kubiak,Mike Smith,HOU00,Reliant Stadium,0,1.0,M.Ryan,2.0,,,J.Rodgers,22.0,1,0,0.0,0,1,00-0026143,,00-0028083,M.Ryan,2.0,00-0026143,J.Rodgers,00-0028083,J.Rodgers,00-0028083,1,0,0.117153004568536,0.438060771009153,5.53802904125041,4.0,0.849629192554858,0.234569854044821,0.988688409328461,1.13115906715393,2011-12-04,J.Allen,2011,REG,HOU,13,00-0024231,CB,Jason Allen,Jason,Allen,Thumb,,Probable,Thumb,,Full Participation in Practice,2011-12-02T12:03:10Z,2011-12-02 12:03:10
3933,2011_13_GB_NYG,2011120410,NYG,GB,REG,13,NYG,home,GB,GB,35.0,2011-12-04,214.0,214.0,214.0,Half2,0,23.0,0,4,,0,03:34,GB 35,0,69.0,2-M.Crosby kicks 49 yards from GB 35 to NYG 16. 45-H.Hynoski to NYG 31 for 15 yards (83-T.Crabtree). GB-81-A.Quarless was injured during the play.,kickoff,0.0,0,0,0.0,0,0,0,,,,,,,,49.0,,,1,1,0.0,,,,,1.0,1.0,27,35,27.0,35.0,-8.0,27.0,35.0,-8.0,0.549626171588898,0.0655205994844437,0.0014972572680562,0.0981212630867958,0.108877062797546,0.0029946144204586,0.173363074660301,0.0,0.0,0.659756785258651,0.504609878058545,-8.90413308959387,8.90413308959387,5.70953949072282,-5.70953949072282,-16.1627534469361,16.1627534469361,,,0.0,0.0,-11.1954430663027,11.1954430663027,-2.52957358865493,2.52957358865493,-16.601969230338,16.601969230338,0.618206425243597,-0.618206425243597,0.0733094587922096,0.92669054120779,0.0733094587922096,0.92669054120779,0.0106559172272682,0.0043016001582145,0.0043016001582145,0.0839653760194778,0.916034623980522,0.0528045520186424,0.0528045520186424,0.0329869356785728,-0.0329869356785728,-0.618705859838935,0.618705859838935,,,0.0,0.0,-0.506067215945853,0.506067215945853,0.100024979779546,-0.100024979779546,-0.518101512935294,0.518101512935294,-0.0623897229755706,0.0623897229755706,0.0,0.0,0.0,0.0,0.0,0.0,0.0,0.0,0.0,0,0.0,0.0,0.0,0.0,0.0,0.0,0.0,0.0,0.0,0.0,0.0,0.0,0.0,0.0,1.0,0.0,0.0,0.0,0.0,0.0,0.0,0.0,0.0,0.0,0.0,0.0,0.0,0.0,0.0,0.0,0.0,0.0,1.0,0.0,0.0,0.0,0.0,0.0,0.0,0.0,0.0,,,,,,,,,,,,,,,,,,,,,,,,,,H.Hynoski,00-0028492,,,,,M.Crosby,00-0025580,,,,,,,,,,,,,,,,,,,GB,,00-0026878,,T.Crabtree,,,,,,,,,,,,,,0.0,,,,,,,,,,,,,,,,,,,,,,,,,,,,,,,NYG,15.0,,,,,0,,,0.0,0.0,0.0,0.0,,,2011,,,61,1,First down,3933,"12/4/11, 16:15:48",2011-12-05T00:27:31Z,MetLife Stadium,"Fair Temp: 52° F, Humidity: 67%, Wind: South 9 mph",10012011-1204-10b7-4c08-f05b81c47b2f,0,0,KICK_OFF,1,,,,23,Touchdown,2011-12-05T00:27:31Z,9.0,2:36,5.0,1.0,1.0,4.0,4.0,0.0,KICKOFF,TOUCHDOWN,03:34,00:58,NYG 31,GB 2,3933.0,4178.0,38,35,Home,-3,73,-7.0,53.5,0,outdoors,fieldturf,52.0,9.0,Tom Coughlin,Mike McCarthy,NYC01,MetLife Stadium,0,1.0,,,,,,,0,0,0.0,1,0,,,,,,,,,,,0,1,0.504609878058545,,,,,,,,2011-12-04,A.Quarless,2011,REG,GB,13,00-0027753,TE,Andrew Quarless,Andrew,Quarless,Groin,,Probable,Groin,,Did Not Participate In Practice,2011-12-02T11:02:27Z,2011-12-02 11:02:27
3918,2011_14_NE_WAS,2011121100,WAS,NE,REG,14,WAS,home,NE,NE,44.0,2011-12-11,209.0,209.0,209.0,Half2,0,19.0,0,4,3.0,0,03:29,NE 44,2,71.0,"(3:29) (Shotgun) 8-R.Grossman pass deep right to 10-J.Gaffney to NE 21 for 23 yards (44-J.Ihedigbo, 50-R.Ninkovich). NE-44-J.Ihedigbo was injured during the play.",pass,23.0,1,0,1.0,0,0,0,deep,right,18.0,5.0,,,,,,,2,3,0.0,,,,,2.0,3.0,27,34,27.0,34.0,-7.0,27.0,34.0,-7.0,0.343376070261002,0.0590189173817635,0.0003215192409697,0.0855331346392632,0.202228382229805,0.0070759425871074,0.302446067333221,0.0,0.0,1.96152777009411,1.98931128229015,-4.48969668004861,4.48969668004861,-3.0589999249205,3.0589999249205,-1.19476156383874,1.19476156383874,1.75741764024133,0.231893642048817,1.75741764024133,0.231893642048817,14.4771190577012,-14.4771190577012,-15.7699851802628,15.7699851802628,6.05582788269385,-6.05582788269385,-2.22237761116825,2.22237761116825,0.198646679520607,0.801353320479393,0.198646679520607,0.801353320479393,0.108233138918877,0.0704006403684616,0.0704006403684616,0.306879818439484,0.693120181560516,0.115147918462753,0.115147918462753,-0.153290241956711,0.153290241956711,-0.075380423042411,0.075380423042411,0.0,0.108233138918877,0.0,0.108233138918877,0.165608689615742,-0.165608689615742,-0.257765190620068,0.257765190620068,0.619060472080723,-0.619060472080723,-0.54676842125142,0.54676842125142,0.0,0.0,1.0,0.0,1.0,0.0,0.0,0.0,0.0,0,0.0,0.0,0.0,0.0,0.0,0.0,0.0,0.0,0.0,0.0,0.0,0.0,0.0,0.0,0.0,0.0,0.0,0.0,0.0,0.0,0.0,0.0,0.0,1.0,0.0,0.0,0.0,0.0,0.0,0.0,0.0,0.0,0.0,0.0,0.0,1.0,1.0,0.0,0.0,0.0,0.0,00-0022121,R.Grossman,23.0,00-0021163,J.Gaffney,23.0,,,,,,,,,,,,,,,,,,,,,,,,,,,,,,,,,,,,,,,,,,,,,,,,,,,,00-0024349,R.Ninkovich,NE,,,,,,,,,,1.0,00-0025753,J.Ihedigbo,NE,,,,,,,,,,,,,,,,,,,,,,,,,,,,,0.0,,,,,0,,,0.0,0.0,0.0,0.0,,,2011,0.489688515663147,51.0311484336853,58,1,First down,3918,"12/11/11, 13:02:50",2011-12-11T20:55:22Z,Commanders Field,"Sunny Temp: 40° F, Humidity: 33%, Wind: North Calm mph",10012011-1211-002a-8c04-9e9612f2f123,0,0,PASS,0,,,,19,Turnover,2011-12-11T20:49:26Z,12.0,6:10,4.0,1.0,0.0,4.0,4.0,-10.0,INTERCEPTION,INTERCEPTION,06:30,00:20,WAS 20,NE 9,3771.0,4096.0,34,27,Home,-7,61,-7.5,46.5,0,outdoors,grass,40.0,0.0,Mike Shanahan,Bill Belichick,WAS00,FedExField,0,1.0,R.Grossman,8.0,,,J.Gaffney,10.0,1,0,1.0,0,1,00-0022121,,00-0021163,R.Grossman,8.0,00-0022121,J.Gaffney,00-0021163,J.Gaffney,00-0021163,0,0,1.98931128229015,0.501620181071243,5.47489475744078,3.0,1.0,1.0,0.752078592777252,24.7921407222748,2011-12-11,J.Ihedigbo,2011,REG,NE,14,00-0025753,S,James Ihedigbo,James,Ihedigbo,Shoulder,,Questionable,Shoulder,,Limited Participation in Practice,2011-12-09T12:35:57Z,2011-12-09 12:35:57
3734,2011_06_DAL_NE,2011101610,NE,DAL,REG,6,DAL,away,NE,NE,22.0,2011-10-16,420.0,420.0,420.0,Half2,0,18.0,0,4,1.0,0,07:00,NE 22,10,60.0,(7:00) (Shotgun) 9-T.Romo pass short middle to 85-K.Ogletree to NE 10 for 12 yards (25-P.Chung). NE-25-P.Chung was injured during the play.,pass,12.0,1,0,1.0,0,0,0,short,middle,12.0,0.0,,,,,,,3,2,0.0,,,,,2.0,3.0,13,13,13.0,13.0,0.0,13.0,13.0,0.0,0.0721098408102989,0.0235888082534075,0.0004104622057639,0.0422184653580189,0.373348474502564,0.001060948241502,0.487263083457947,0.0,0.0,4.16589229751844,0.557304599671625,-6.26392802223563,6.26392802223563,6.15466004301794,-6.15466004301794,-14.264684289735,14.264684289735,0.557304599671625,0.0,0.557304599671625,0.0,-7.48164105595788,7.48164105595788,-2.51204305596659,2.51204305596659,-9.26741620490793,9.26741620490793,-3.51748675463498,3.51748675463498,0.629148006439209,0.370851993560791,0.370851993560791,0.629148006439209,0.062381386756897,0.0464495420455933,-0.0464495420455933,0.308470606803894,0.691529393196106,0.618983685970306,0.381016314029694,0.203842476010323,-0.203842476010323,-0.570548432597582,0.570548432597582,0.062381386756897,0.0,0.062381386756897,0.0,-0.141237914562225,0.141237914562225,-0.277161377200548,0.277161377200548,-0.141237914562225,0.141237914562225,-0.418019341954653,0.418019341954653,0.0,0.0,1.0,0.0,0.0,0.0,0.0,0.0,0.0,0,0.0,0.0,0.0,0.0,0.0,0.0,0.0,0.0,0.0,0.0,0.0,0.0,0.0,0.0,1.0,0.0,0.0,0.0,0.0,0.0,0.0,0.0,0.0,1.0,0.0,0.0,0.0,0.0,0.0,0.0,0.0,0.0,0.0,0.0,0.0,1.0,0.0,0.0,0.0,0.0,0.0,00-0021678,T.Romo,12.0,00-0026780,K.Ogletree,12.0,,,,,,,,,,,,,,,,,,,,,,,,,,,,,,,,,,,,,,,,,,,,,,NE,,00-0027010,,P.Chung,,,,,,,,,,,,,,0.0,,,,,,,,,,,,,,,,,,,,,,,,,,,,,,,,0.0,,,,,0,,,0.0,0.0,0.0,0.0,,,2011,0.614354968070984,38.5645031929016,52,1,First down,3734,"10/16/11, 16:15:39",2011-10-16T22:51:04Z,Gillette Stadium,"Partly Cloudy Temp: 63° F, Wind: WSW 8 with gusts to 17 mph",10012011-1016-10e4-fd59-6ed463b27ffa,0,0,PASS,0,,,,17,Field goal,2011-10-16T22:47:19Z,9.0,3:55,3.0,1.0,1.0,4.0,4.0,-10.0,INTERCEPTION,FIELD_GOAL,09:08,05:13,DAL 32,NE 8,3597.0,3839.0,16,20,Home,4,36,6.5,54.5,0,outdoors,fieldturf,63.0,8.0,Bill Belichick,Jason Garrett,BOS00,Gillette Stadium,0,1.0,T.Romo,9.0,,,K.Ogletree,85.0,1,0,1.0,0,1,00-0021678,,00-0026780,T.Romo,9.0,00-0021678,K.Ogletree,00-0026780,K.Ogletree,00-0026780,0,0,0.557304599671625,0.619375137551584,3.28551656618947,2.0,1.0,0.997581400501076,0.371760308742523,62.8239691257477,2011-10-16,P.Chung,2011,REG,NE,6,00-0027010,S,Patrick Chung,Patrick,Chung,Hand,,Probable,Hand,,Full Participation in Practice,2011-10-14T12:49:40Z,2011-10-14 12:49:40
3663,2011_17_CHI_MIN,2012010109,MIN,CHI,REG,17,MIN,home,CHI,CHI,23.0,2012-01-01,321.0,321.0,321.0,Half2,0,25.0,0,4,3.0,0,05:21,CHI 23,13,-9.0,(5:21) (Shotgun) 14-J.Webb pass incomplete deep middle to 12-P.Harvin. CHI-54-B.Urlacher was injured during the play. He is Out.,pass,0.0,1,0,1.0,0,0,0,deep,middle,23.0,,,,,,,,2,3,0.0,,,,,2.0,3.0,13,17,13.0,17.0,-4.0,13.0,17.0,-4.0,0.0870045199990273,0.0195996444672346,0.0004156052309554,0.0405055209994316,0.639126539230347,0.0019119381904602,0.211436241865158,0.0,0.0,3.05808839626843,-0.574319670209661,-4.16491325786629,4.16491325786629,-0.700087794654305,0.700087794654305,-0.386111830887286,0.386111830887286,3.94191160373157,-4.51623127394123,0.0,0.0,-1.31438448694104,1.31438448694104,4.78256820655007,-4.78256820655007,-0.460449416663381,0.460449416663381,-7.3027968518967,7.3027968518967,0.4630047082901,0.5369952917099,0.4630047082901,0.5369952917099,-0.0919330418109894,-0.0727066993713379,-0.0727066993713379,0.371071666479111,0.628928333520889,0.471707731485367,0.471707731485367,-0.0910115073264252,0.0910115073264252,0.0763588674366584,-0.0763588674366584,0.0,-0.0919330418109894,0.0,0.0,0.104405981661825,-0.104405981661825,0.213902175426483,-0.213902175426483,0.102568757893591,-0.102568757893591,-0.239813163491028,0.239813163491028,0.0,0.0,0.0,0.0,0.0,1.0,0.0,0.0,1.0,0,0.0,0.0,0.0,0.0,0.0,0.0,0.0,0.0,0.0,0.0,0.0,0.0,0.0,0.0,0.0,0.0,0.0,0.0,0.0,0.0,0.0,0.0,0.0,1.0,0.0,0.0,0.0,0.0,0.0,0.0,0.0,0.0,0.0,0.0,0.0,0.0,0.0,0.0,0.0,0.0,0.0,00-0027796,J.Webb,,00-0026998,P.Harvin,,,,,,,,,,,,,,,,,,,,,,,,,,,,,,,,,,,,,,,,,,,,,,,,,,,,,,,,,,,,,,,,,0.0,,,,,,,,,,,,,,,,,,,,,,,,,,,,,,,,0.0,,,,,0,,,0.0,0.0,0.0,0.0,,,2011,0.36805647611618,-36.805647611618,46,0,Turnover on downs,3663,"1/1/12, 13:02:30",2012-01-01T20:44:44Z,Mall of America Field,"Temp: 65° F, Wind: mph",10012012-0101-0919-661c-385b6151278f,0,0,PASS,0,,,,25,Turnover on downs,2012-01-01T20:43:20Z,4.0,0:55,0.0,0.0,0.0,4.0,4.0,0.0,INTERCEPTION,DOWNS,06:05,05:10,CHI 20,CHI 23,3620.0,3689.0,17,13,Home,-4,30,1.5,41.5,1,dome,sportturf,,,Leslie Frazier,Lovie Smith,MIN00,Mall of America Field,0,0.0,J.Webb,14.0,,,P.Harvin,12.0,1,0,0.0,0,1,00-0027796,,00-0026998,J.Webb,14.0,00-0027796,P.Harvin,00-0026998,P.Harvin,00-0026998,0,1,-0.574319670209661,,,,,,0.954509258270264,4.54907417297363,2012-01-01,B.Urlacher,2011,REG,CHI,17,00-0019456,LB,Brian Urlacher,Brian,Urlacher,Knee,,Questionable,Knee,,Limited Participation in Practice,2011-12-30T11:24:18Z,2011-12-30 11:24:18
3639,2011_07_ATL_DET,2011102303,DET,ATL,REG,7,ATL,away,DET,ATL,64.0,2011-10-23,384.0,384.0,384.0,Half2,0,24.0,0,4,2.0,0,06:24,ATL 36,15,37.0,(6:24) (No Huddle) 33-M.Turner up the middle to ATL 45 for 9 yards (55-S.Tulloch). DET-23-C.Houston was injured during the play. His return is Questionable.,run,9.0,0,1,0.0,0,0,0,,,,,middle,,,,,,3,3,0.0,,,,,3.0,3.0,16,23,23.0,16.0,7.0,23.0,16.0,7.0,0.228584945201874,0.113855287432671,0.003480655606836,0.186771094799042,0.176691189408302,0.0037130156997591,0.286903768777847,0.0,0.0,0.88990114396438,0.182889485033229,-11.9005488336465,11.9005488336465,1.48854267820958,-1.48854267820958,-2.00208579325752,2.00208579325752,,,0.0,0.0,-3.71673760085832,3.71673760085832,-2.43185022894659,2.43185022894659,0.266233051137533,-0.266233051137533,-1.41978006311163,1.41978006311163,0.880496740341187,0.119503259658813,0.119503259658813,0.880496740341187,0.0108222961425781,0.0136686563491821,-0.0136686563491821,0.108680963516235,0.891319036483765,0.863283693790436,0.136716306209564,-0.048038913322656,0.048038913322656,-0.105575870287849,0.105575870287849,,,0.0,0.0,-0.0555972146783089,0.0555972146783089,-0.11751711073821,0.11751711073821,-0.0555972146783089,0.0555972146783089,-0.0122335076660435,0.0122335076660435,0.0,0.0,0.0,0.0,0.0,0.0,0.0,0.0,0.0,0,0.0,0.0,0.0,0.0,0.0,0.0,0.0,0.0,0.0,0.0,0.0,0.0,0.0,0.0,1.0,0.0,0.0,0.0,0.0,0.0,0.0,0.0,1.0,0.0,0.0,0.0,0.0,0.0,0.0,0.0,0.0,0.0,0.0,0.0,0.0,0.0,0.0,0.0,0.0,0.0,0.0,,,,,,,00-0022821,M.Turner,9.0,,,,,,,,,,,,,,,,,,,,,,,,,,,,,,,,,,,,,,,,,,,DET,,00-0024331,,S.Tulloch,,,,,,,,,,,,,,0.0,,,,,,,,,,,,,,,,,,,,,,,,,,,,,,,,0.0,,,,,0,,,0.0,0.0,0.0,0.0,,,2011,,,50,1,First down,3639,"10/23/11, 13:05:15",2011-10-23T19:57:57Z,Ford Field,"Controlled Climate Temp: 67° F, Humidity: 58%, Wind: mph",10012011-1023-038e-d2c8-f4e2f597bcc2,0,0,RUSH,0,,,,24,Punt,2011-10-23T19:55:39Z,7.0,4:13,3.0,0.0,0.0,4.0,4.0,0.0,PUNT,PUNT,07:33,03:20,ATL 23,DET 40,3570.0,3833.0,23,16,Home,-7,39,4.5,47.0,0,dome,fieldturf,,,Jim Schwartz,Mike Smith,DET00,Ford Field,0,1.0,,,M.Turner,33.0,,,0,1,0.0,0,1,,00-0022821,,M.Turner,33.0,00-0022821,M.Turner,00-0022821,M.Turner,00-0022821,0,1,0.182889485033229,,,,,,0.679662525653839,-67.9662525653839,2011-10-23,C.Houston,2011,REG,DET,7,00-0025428,CB,Chris Houston,Chris,Houston,Back,,Probable,Back,,Limited Participation in Practice,2011-10-21T12:54:09Z,2011-10-21 12:54:09
3571,2011_05_TEN_PIT,2011100900,PIT,TEN,REG,5,PIT,home,TEN,PIT,58.0,2011-10-09,405.0,405.0,405.0,Half2,0,17.0,0,4,3.0,0,06:45,PIT 42,8,-3.0,(6:45) (Shotgun) 7-B.Roethlisberger pass incomplete deep right to 84-A.Brown. TEN-33-M.Griffin was injured during the play. Coverage by #30McCourty and #33 Griffin.,pass,0.0,1,0,1.0,0,0,0,deep,right,28.0,,,,,,,,3,2,0.0,,,,,3.0,2.0,31,10,31.0,10.0,21.0,31.0,10.0,21.0,0.259355813264847,0.105683200061321,0.0017655577976256,0.167697593569756,0.18438021838665,0.0044086654670536,0.276708960533142,0.0,0.0,1.00445683905855,-1.34134342800826,19.731739838737,-19.731739838737,8.41738569637528,-8.41738569637528,15.7560403318845,-15.7560403318845,2.77810471539851,-4.11944814340677,0.0,0.0,0.487634714052547,-0.487634714052547,7.40544430868491,-7.40544430868491,-7.32074655720498,7.32074655720498,21.776876994502,-21.776876994502,0.999280154705048,0.0007198452949523,0.999280154705048,0.0007198452949523,-0.0001804232597351,-9.28044319152832e-05,-9.28044319152832e-05,0.999099731445312,0.0009002685546875,0.999663114547729,0.999663114547729,0.165997593689385,-0.165997593689385,0.368807640144081,-0.368807640144081,0.0,-0.0001804232597351,0.0,0.0,0.0986017525161134,-0.0986017525161134,0.188982859381655,-0.188982859381655,0.0980441955348925,-0.0980441955348925,0.224332778609538,-0.224332778609538,0.0,0.0,0.0,0.0,0.0,1.0,0.0,0.0,1.0,0,0.0,0.0,0.0,0.0,0.0,0.0,0.0,0.0,0.0,0.0,0.0,0.0,0.0,0.0,0.0,0.0,0.0,0.0,0.0,0.0,0.0,0.0,0.0,1.0,0.0,0.0,0.0,0.0,0.0,0.0,0.0,0.0,0.0,0.0,0.0,0.0,0.0,0.0,0.0,0.0,0.0,00-0022924,B.Roethlisberger,,00-0027793,A.Brown,,,,,,,,,,,,,,,,,,,,,,,,,,,,,,,,,,,,,,,,,,,,,,,,,,,,,,,,,,,,,,,,,0.0,,,,,,,,,,,,,,,,,,,,,,,,,,,,,,,,0.0,,,,,0,,,0.0,0.0,0.0,0.0,,,2011,0.307615548372269,-30.7615548372269,52,0,Punt,3571,"10/9/11, 13:03:37",2011-10-09T19:42:33Z,Acrisure Stadium,"Sunny Temp: 70° F, Humidity: 53%, Wind: From SE 3 mph",10012011-1009-002a-cd4e-f809698a1a0a,0,0,PASS,0,,,,17,Punt,2011-10-09T19:40:43Z,3.0,1:01,0.0,0.0,0.0,4.0,4.0,-5.0,DOWNS,BLOCKED_PUNT,07:28,06:27,PIT 40,PIT 37,3512.0,3627.0,17,38,Home,21,55,3.0,40.0,0,outdoors,grass,70.0,3.0,Mike Tomlin,Mike Munchak,PIT00,Heinz Field,0,0.0,B.Roethlisberger,7.0,,,A.Brown,84.0,1,0,0.0,0,1,00-0022924,,00-0027793,B.Roethlisberger,7.0,00-0022924,A.Brown,00-0027793,A.Brown,00-0027793,0,0,-1.34134342800826,0.570711453884073,7.35232125449693,4.0,1.0,1.0,0.747491717338562,25.2508282661438,2011-10-09,M.Griffin,2011,REG,TEN,5,00-0025406,S,Michael Griffin,Michael,Griffin,Illness,,Probable,Illness,,Full Participation in Practice,2011-10-07T11:24:24Z,2011-10-07 11:24:24
3544,2011_02_PHI_ATL,2011091814,ATL,PHI,REG,2,PHI,away,ATL,PHI,61.0,2011-09-18,569.0,569.0,569.0,Half2,0,25.0,0,4,2.0,0,09:29,PHI 39,10,28.0,(9:29) 3-M.Kafka pass short middle to 25-L.McCoy to PHI 41 for 2 yards (50-C.Lofton). ATL-91-C.Peters was injured during the play. His return is Probable.,pass,2.0,0,0,1.0,0,0,0,short,middle,1.0,1.0,,,,,,,2,2,0.0,,,,,2.0,2.0,28,31,31.0,28.0,3.0,31.0,28.0,3.0,0.141032084822655,0.122776195406914,0.0022858574520796,0.187525033950806,0.221555322408676,0.0017542372224852,0.323071300983429,0.0,0.0,1.24409800977446,-0.63951537408866,-7.98991169250803,7.98991169250803,-0.442377997329459,0.442377997329459,-3.5677400710352,3.5677400710352,-0.757324615726247,0.117809241637588,-0.757324615726247,0.117809241637588,9.79097394598648,-9.79097394598648,-8.06018129272455,8.06018129272455,9.31263426877558,-9.31263426877558,-6.40694603620211,6.40694603620211,0.719678342342377,0.280321657657623,0.280321657657623,0.719678342342377,-0.0204260349273682,-0.0331470370292664,0.0331470370292664,0.300747692584991,0.699252307415009,0.791359901428223,0.208640098571777,-0.0310069954679828,0.0310069954679828,-0.383522201555534,0.383522201555534,0.0,-0.0204260349273682,0.0,-0.0204260349273682,0.32273117011115,-0.32273117011115,-0.374525688122525,0.374525688122525,0.320815268211812,-0.320815268211812,-0.526743076275601,0.526743076275601,0.0,0.0,0.0,0.0,0.0,0.0,0.0,0.0,0.0,0,0.0,0.0,0.0,0.0,0.0,0.0,0.0,0.0,0.0,0.0,0.0,0.0,0.0,0.0,1.0,0.0,0.0,0.0,0.0,0.0,0.0,0.0,0.0,1.0,0.0,0.0,0.0,0.0,0.0,0.0,0.0,0.0,0.0,0.0,0.0,1.0,0.0,0.0,0.0,0.0,0.0,00-0027722,M.Kafka,2.0,00-0027029,L.McCoy,2.0,,,,,,,,,,,,,,,,,,,,,,,,,,,,,,,,,,,,,,,,,,,,,,ATL,,00-0026177,,C.Lofton,,,,,,,,,,,,,,0.0,,,,,,,,,,,,,,,,,,,,,,,,,,,,,,,,0.0,,,,,0,,,0.0,0.0,0.0,0.0,,,2011,0.802364468574524,19.7635531425476,55,0,Punt,3544,"9/18/11, 20:31:09",2011-09-19T03:20:44Z,Georgia Dome,"Temp: ° F, Wind: mph",10012011-0918-148f-3712-89c78af862d3,0,0,PASS,0,,,,25,Punt,2011-09-19T03:17:09Z,4.0,2:33,1.0,0.0,0.0,4.0,4.0,0.0,KICKOFF,PUNT,10:45,08:12,PHI 20,PHI 48,3488.0,3596.0,31,35,Home,4,66,-2.5,49.0,0,dome,fieldturf,,,Mike Smith,Andy Reid,ATL00,Georgia Dome,0,0.0,M.Kafka,3.0,,,L.McCoy,25.0,1,0,0.0,0,1,00-0027722,,00-0027029,M.Kafka,3.0,00-0027722,L.McCoy,00-0027029,L.McCoy,00-0027029,0,0,-0.63951537408866,0.976224738721425,6.52541989763267,5.0,0.454635741654784,0.243530424777418,0.576475322246552,42.3524677753449,2011-09-18,C.Peters,2011,REG,ATL,2,00-0027686,DT,Corey Peters,Corey,Peters,Knee,,Probable,Knee,,Full Participation in Practice,2011-09-16T11:51:48Z,2011-09-16 11:51:48
3517,2011_05_NYJ_NE,2011100909,NE,NYJ,REG,5,NYJ,away,NE,NE,49.0,2011-10-09,669.0,669.0,669.0,Half2,0,20.0,0,4,1.0,0,11:09,NE 49,10,85.0,(11:09) 23-S.Greene left end to NE 40 for 9 yards (50-R.Ninkovich; 25-P.Chung). NE-92-A.Haynesworth was injured during the play.,run,9.0,0,0,0.0,0,0,0,,,,,left,end,,,,,2,3,0.0,,,,,3.0,2.0,27,14,14.0,27.0,-13.0,14.0,27.0,-13.0,0.0958493202924728,0.0941241756081581,0.0015085759805515,0.132935747504234,0.278466731309891,0.0018822371494025,0.395233184099197,0.0,0.0,2.38985704560764,0.706664828350768,9.05270351085778,-9.05270351085778,-2.47321472677868,2.47321472677868,6.52706199844063,-6.52706199844063,,,0.0,0.0,3.18050659753499,-3.18050659753499,10.7022926052545,-10.7022926052545,19.5765222866612,-19.5765222866612,-10.0279090274959,10.0279090274959,0.0629236251115799,0.93707637488842,0.93707637488842,0.0629236251115799,0.0166841894388199,0.0136062130331993,-0.0136062130331993,0.9203921854496,0.0796078145503998,0.0292895212769508,0.970710478723049,-0.0151169363063169,0.0151169363063169,0.251807768673334,-0.251807768673334,,,0.0,0.0,0.0695405051416491,-0.0695405051416491,0.383249312639236,-0.383249312639236,0.0712418005174731,-0.0712418005174731,0.258461654186249,-0.258461654186249,0.0,0.0,0.0,0.0,0.0,0.0,0.0,0.0,0.0,0,0.0,0.0,0.0,0.0,0.0,0.0,0.0,0.0,0.0,0.0,0.0,0.0,0.0,0.0,0.0,0.0,0.0,0.0,0.0,0.0,0.0,0.0,1.0,0.0,0.0,0.0,0.0,0.0,0.0,0.0,0.0,0.0,0.0,0.0,0.0,0.0,1.0,0.0,0.0,0.0,0.0,,,,,,,00-0026899,S.Greene,9.0,,,,,,,,,,,,,,,,,,,,,,,,,,,,,,,,,,,,,,,,,,,,,,,,,00-0024349,R.Ninkovich,NE,00-0027010,P.Chung,NE,,,,,,,0.0,,,,,,,,,,,,,,,,,,,,,,,,,,,,,,,,0.0,,,,,0,,,0.0,0.0,0.0,0.0,,,2011,,,47,1,First down,3517,"10/9/11, 16:16:07",2011-10-09T22:49:57Z,Gillette Stadium,"Sunny and warm Temp: 82° F, Humidity: 40%, Wind: NW 9 mph",10012011-1009-09e3-ffd0-c3cc2c26dcd0,0,0,RUSH,0,,,,20,Touchdown,2011-10-09T22:47:16Z,11.0,5:43,5.0,0.0,1.0,4.0,4.0,0.0,KICKOFF,TOUCHDOWN,12:57,07:14,NYJ 15,NE 21,3424.0,3719.0,21,30,Home,9,51,7.5,50.5,1,outdoors,fieldturf,82.0,9.0,Bill Belichick,Rex Ryan,BOS00,Gillette Stadium,0,1.0,,,S.Greene,23.0,,,0,1,0.0,0,1,,00-0026899,,S.Greene,23.0,00-0026899,S.Greene,00-0026899,S.Greene,00-0026899,0,0,0.706664828350768,,,,,,0.696970164775848,-69.6970164775848,2011-10-09,A.Haynesworth,2011,REG,NE,5,00-0021149,DT,Albert Haynesworth,Albert,Haynesworth,Back,,Questionable,Back,,Limited Participation in Practice,2011-10-07T12:33:50Z,2011-10-07 12:33:50
3389,2011_19_NO_SF,2012011401,SF,NO,POST,19,SF,home,NO,SF,69.0,2012-01-14,113.0,1013.0,1013.0,Half2,0,23.0,0,3,2.0,0,01:53,SF 31,10,16.0,"(1:53) 11-Alex Smith pass incomplete short right to 19-T.Ginn [92-S.Rogers]. SF-19-T.Ginn was injured during the play. His return is Questionable. Penalty on SF-19-T.Ginn, Offensive Pass Interference, declined.",pass,0.0,0,0,1.0,0,0,0,short,right,10.0,,,,,,,,2,2,0.0,,,,,2.0,2.0,20,14,20.0,14.0,6.0,20.0,14.0,6.0,0.0565457381308079,0.158519938588142,0.0016337941633537,0.21778891980648,0.231288388371468,0.0057972073554992,0.328426033258438,0.0,0.0,1.00109196989797,-0.755217598285526,4.84492342921709,-4.84492342921709,0.0818923552869819,-0.0818923552869819,-5.90319715734521,5.90319715734521,1.09751765104011,-1.85273524932563,0.0,0.0,-5.70108350095688,5.70108350095688,-2.47711192231509,2.47711192231509,-4.65935124608222,4.65935124608222,2.67587101229284,-2.67587101229284,0.781657814979553,0.218342185020447,0.781657814979553,0.218342185020447,-0.0191553235054016,-0.0250622034072876,-0.0250622034072876,0.762502491474152,0.237497508525848,0.695498585700989,0.695498585700989,0.0795080289244652,-0.0795080289244652,0.0689169901375529,-0.0689169901375529,0.0,-0.0191553235054016,0.0,0.0,-0.0764980828933226,0.0764980828933226,0.105509510034011,-0.105509510034011,0.261124380809833,-0.261124380809833,-0.0425078368249671,0.0425078368249671,0.0,0.0,0.0,0.0,0.0,0.0,0.0,0.0,1.0,0,0.0,0.0,0.0,0.0,0.0,0.0,0.0,0.0,0.0,0.0,0.0,0.0,0.0,0.0,0.0,0.0,0.0,0.0,0.0,0.0,0.0,1.0,0.0,1.0,0.0,0.0,0.0,0.0,0.0,0.0,0.0,0.0,0.0,0.0,0.0,0.0,0.0,0.0,0.0,0.0,0.0,00-0023436,Alex Smith,,00-0025396,T.Ginn,,,,,,,,,,,,,,,,,,,,,,,,,,,,,,,,,,,,,00-0020528,S.Rogers,,,,,,,,,,,,,,,,,,,,,,,,,,,0.0,,,,,,,,,,,,,,,,,,,,,,,,,,,,,,,,0.0,,,,,0,,,0.0,0.0,0.0,0.0,,,2011,0.348041325807571,-34.8041325807571,44,0,Punt,3389,"1/14/12, 16:35:36",2012-01-15T00:08:02Z,Candlestick Park,"Sunny Temp: 62° F, Humidity: 14%, Wind: northeast 2 mph",10012012-0114-0151-32f1-440849c0ebbc,0,0,PASS,0,,,,22,Punt,2012-01-15T00:06:34Z,4.0,1:47,1.0,0.0,0.0,3.0,3.0,0.0,PUNT,PUNT,03:21,01:34,SF 15,SF 31,3343.0,3455.0,32,36,Home,4,68,-3.5,46.5,0,outdoors,grass,62.0,2.0,Jim Harbaugh,Sean Payton,SFO00,Candlestick Park,0,0.0,A.Smith,11.0,,,T.Ginn,19.0,1,0,0.0,0,1,00-0023436,,00-0025396,A.Smith,11.0,00-0023436,T.Ginn,00-0025396,T.Ginn,00-0025396,0,0,-0.755217598285526,0.243980441406986,3.50722731120914,1.0,0.998082370089833,0.953968921268824,0.541306793689728,45.8693206310272,2012-01-14,T.Ginn,2011,DIV,SF,19,00-0025396,WR,Ted Ginn,Ted,Ginn,Ankle,,Questionable,Ankle,,Limited Participation in Practice,2012-01-13T12:36:52Z,2012-01-13 12:36:52
3380,2011_13_NYJ_WAS,2011120400,WAS,NYJ,REG,13,WAS,home,NYJ,NYJ,40.0,2011-12-04,648.0,648.0,648.0,Half2,0,19.0,0,4,3.0,0,10:48,NYJ 40,5,46.0,(10:48) (Shotgun) 8-R.Grossman pass incomplete short middle to 82-L.Paulsen [52-D.Harris]. NYJ-97-C.Pace was injured during the play.,pass,0.0,1,0,1.0,0,0,0,short,middle,-15.0,,,,,,,,3,2,0.0,,,,,3.0,2.0,13,13,13.0,13.0,0.0,13.0,13.0,0.0,0.0939568281173706,0.100144326686859,0.0011131699429824,0.136019632220268,0.293054133653641,0.0044464082457125,0.371265530586243,0.0,0.0,2.23211718606763,-1.67435777653009,-2.0005122217699,2.0005122217699,-2.33115642424673,2.33115642424673,-4.77350423365461,4.77350423365461,-2.52104988950305,0.84669211297296,0.0,0.0,4.09856192868383,-4.09856192868383,-0.403000812392717,0.403000812392717,-3.01602060776722,3.01602060776722,-0.266848111162394,0.266848111162394,0.607761085033417,0.392238914966583,0.607761085033417,0.392238914966583,-0.0717235803604126,-0.0552879571914673,-0.0552879571914673,0.536037504673004,0.463962495326996,0.526581048965454,0.526581048965454,-0.12985522303959,0.12985522303959,-0.0764763355255127,0.0764763355255127,0.0,-0.0717235803604126,0.0,0.0,0.0860282182693481,-0.0860282182693481,0.0632156431674957,-0.0632156431674957,0.0860282182693481,-0.0860282182693481,-0.13586288690567,0.13586288690567,0.0,0.0,0.0,0.0,0.0,1.0,0.0,0.0,1.0,0,0.0,0.0,0.0,0.0,0.0,0.0,0.0,0.0,0.0,0.0,0.0,0.0,0.0,0.0,0.0,0.0,0.0,0.0,0.0,0.0,0.0,1.0,0.0,1.0,0.0,0.0,0.0,0.0,0.0,0.0,0.0,0.0,0.0,0.0,0.0,0.0,0.0,0.0,0.0,0.0,0.0,00-0022121,R.Grossman,,00-0027215,L.Paulsen,,,,,,,,,,,,,,,,,,,,,,,,,,,,,,,,,,,,,00-0025434,D.Harris,,,,,,,,,,,,,,,,,,,,,,,,,,,0.0,,,,,,,,,,,,,,,,,,,,,,,,,,,,,,,,0.0,,,,,0,,,0.0,0.0,0.0,0.0,,,2011,0.249354541301727,-24.9354541301727,42,0,Punt,3380,"12/4/11, 13:02:55",2011-12-04T20:39:23Z,Commanders Field,"Sunny Temp: 53° F, Humidity: 57%, Wind: SW 5 mph",10012011-1204-00c0-7b46-d52132762254,0,0,PASS,0,,,,19,Punt,2011-12-04T20:29:40Z,9.0,4:50,3.0,0.0,0.0,3.0,4.0,0.0,PUNT,PUNT,00:20,10:30,WAS 14,NYJ 40,3177.0,3417.0,34,19,Home,-15,53,-3.0,38.5,0,outdoors,grass,53.0,5.0,Mike Shanahan,Rex Ryan,WAS00,FedExField,0,0.0,R.Grossman,8.0,,,L.Paulsen,82.0,1,0,0.0,0,1,00-0022121,,00-0027215,R.Grossman,8.0,00-0022121,L.Paulsen,00-0027215,L.Paulsen,00-0027215,0,1,-1.67435777653009,1.50176661241943,14.0363223381864,13.0,0.261862775369082,0.261862775369082,0.937254428863525,6.27455711364746,2011-12-04,C.Pace,2011,REG,NYJ,13,00-0022120,LB,Calvin Pace,Calvin,Pace,Groin,,Probable,Groin,,Full Participation in Practice,2011-12-02T10:39:24Z,2011-12-02 10:39:24
3340,2011_14_CLE_PIT,2011120800,PIT,CLE,REG,14,CLE,away,PIT,PIT,39.0,2011-12-08,359.0,359.0,359.0,Half2,0,19.0,0,4,2.0,0,05:59,PIT 39,5,40.0,"(5:59) 12-C.McCoy pass short left to 31-M.Hardesty to PIT 34 for 5 yards (24-I.Taylor) [92-J.Harrison]. CLE-12-C.McCoy was injured during the play. CLE-81-A.Smith was injured during the play. PENALTY on PIT-92-J.Harrison, Roughing the Passer, 15 yards, enforced at PIT 34.",pass,5.0,0,0,1.0,0,0,0,short,left,0.0,5.0,,,,,,,3,2,0.0,,,,,2.0,3.0,7,3,3.0,7.0,-4.0,3.0,7.0,-4.0,0.19216500222683,0.0536286011338234,0.0007120544323697,0.0861233174800873,0.280721127986908,0.0033793083857744,0.383270561695099,0.0,0.0,2.76664279797114,1.46951400919352,-1.70117341726586,1.70117341726586,5.55870280210151,-5.55870280210151,-1.64036278842832,1.64036278842832,-0.674782219808549,2.14429622900207,-0.674782219808549,2.14429622900207,-7.44612442978541,7.44612442978541,-0.404463246348314,0.404463246348314,-14.3263749026519,14.3263749026519,12.6386530500604,-12.6386530500604,0.363642036914825,0.636357963085175,0.636357963085175,0.363642036914825,0.154324233531952,0.0806381404399872,-0.0806381404399872,0.482033729553223,0.517966270446777,0.233105838298798,0.766894161701202,0.153709918260574,-0.153709918260574,-0.263954931358122,0.263954931358122,0.0,0.154324233531952,0.0,0.154324233531952,-0.0514804720878601,0.0514804720878601,-0.332724892953657,0.332724892953657,-0.0514804720878601,0.0514804720878601,-0.212643974880003,0.212643974880003,0.0,0.0,1.0,1.0,0.0,0.0,0.0,0.0,0.0,0,0.0,0.0,0.0,0.0,0.0,0.0,0.0,0.0,0.0,0.0,0.0,0.0,0.0,0.0,1.0,0.0,1.0,0.0,0.0,0.0,0.0,1.0,0.0,1.0,0.0,0.0,0.0,0.0,0.0,0.0,0.0,0.0,0.0,0.0,0.0,1.0,0.0,0.0,0.0,0.0,0.0,00-0027688,C.McCoy,5.0,00-0027666,M.Hardesty,5.0,,,,,,,,,,,,,,,,,,,,,,,,,,,,,,,,,,,,00-0020712,J.Harrison,,,,,,,,,PIT,,00-0021891,,I.Taylor,,,,,,,,,,,,,,0.0,,,,,,,,,,,,,,,,,,,,,,,,,,,,,,,,0.0,PIT,00-0020712,J.Harrison,15.0,0,,Roughing the Passer,0.0,0.0,0.0,0.0,,,2011,0.2885422706604,71.14577293396,48,1,First down,3340,"12/8/11, 20:29:17",2011-12-09T04:03:19Z,Acrisure Stadium,"Fair Temp: 31° F, Humidity: 74%, Wind: From S 6 mph",10012011-1208-00ba-f45f-67d234ead8df,0,0,PASS,0,,,,19,Turnover,2011-12-09T04:02:08Z,8.0,3:59,4.0,1.0,0.0,4.0,4.0,5.0,INTERCEPTION,INTERCEPTION,07:10,03:11,CLE 44,PIT 16,3295.0,3480.0,3,14,Home,11,17,14.0,40.0,1,outdoors,grass,31.0,6.0,Mike Tomlin,Pat Shurmur,PIT00,Heinz Field,0,1.0,C.McCoy,12.0,,,M.Hardesty,31.0,1,0,1.0,0,1,00-0027688,,00-0027666,C.McCoy,12.0,00-0027688,M.Hardesty,00-0027666,M.Hardesty,00-0027666,0,0,1.46951400919352,0.927417125634544,6.23536268511089,5.0,0.61265571572585,0.507056096277665,0.547414541244507,45.2585458755493,2011-12-08,C.McCoy,2011,REG,CLE,14,00-0027688,QB,Colt McCoy,Colt,McCoy,Knee,,Probable,Knee,,Full Participation in Practice,2011-12-07T09:27:34Z,2011-12-07 09:27:34
3332,2011_15_NE_DEN,2011121811,DEN,NE,REG,15,DEN,home,NE,NE,36.0,2011-12-18,560.0,560.0,560.0,Half2,0,19.0,0,4,1.0,0,09:20,NE 36,10,89.0,(9:20) (Shotgun) 15-T.Tebow pass short left to 35-L.Ball to NE 2 for 34 yards (31-S.Brown; 24-K.Arrington). NE-24-K.Arrington was injured during the play.,pass,34.0,1,0,1.0,0,0,0,short,left,6.0,28.0,,,,,,,3,3,0.0,,,,,3.0,3.0,16,34,16.0,34.0,-18.0,16.0,34.0,-18.0,0.067095011472702,0.0514534004032612,0.0009693934698589,0.0786768645048142,0.337400645017624,0.0028856396675109,0.461519002914429,0.0,0.0,3.54156919510569,2.60450148658128,-15.8573343198788,15.8573343198788,-3.61766775928379,3.61766775928379,-4.44714579266081,4.44714579266081,0.196925535681658,2.40757595089963,0.196925535681658,2.40757595089963,3.50041024963139,-3.50041024963139,-11.5841127138701,11.5841127138701,-1.11710496759042,1.11710496759042,-3.38599576242784,3.38599576242784,0.021597346290946,0.978402653709054,0.021597346290946,0.978402653709054,0.0053502265363931,0.0022354796528816,0.0022354796528816,0.0269475728273392,0.973052427172661,0.0098141264170408,0.0098141264170408,-0.268483587596511,0.268483587596511,-0.14611153335384,0.14611153335384,0.0,0.0053502265363931,0.0,0.0053502265363931,-0.0359279539278227,0.0359279539278227,-0.175426446411518,0.175426446411518,-0.0359279539278227,0.0359279539278227,-0.085961101155487,0.085961101155487,0.0,0.0,1.0,0.0,0.0,0.0,0.0,0.0,0.0,0,0.0,0.0,0.0,0.0,0.0,0.0,0.0,0.0,0.0,0.0,0.0,0.0,0.0,0.0,0.0,0.0,0.0,0.0,0.0,0.0,0.0,0.0,0.0,1.0,0.0,0.0,0.0,0.0,0.0,0.0,0.0,0.0,0.0,0.0,0.0,1.0,1.0,0.0,0.0,0.0,0.0,00-0027876,T.Tebow,34.0,00-0026432,L.Ball,34.0,,,,,,,,,,,,,,,,,,,,,,,,,,,,,,,,,,,,,,,,,,,,,,,,,,,,00-0027232,S.Brown,NE,00-0026071,K.Arrington,NE,,,,,,,0.0,,,,,,,,,,,,,,,,,,,,,,,,,,,,,,,,0.0,,,,,0,,,0.0,0.0,0.0,0.0,,,2011,0.724341571331024,27.5658428668976,53,1,First down,3332,"12/18/11, 16:16:06",2011-12-18T23:53:33Z,Empower Field at Mile High,"Mostly Sunny Temp: 63° F, Humidity: 16%, Wind: N 3 mph",10012011-1218-111e-43d0-391dc04b11a8,0,0,PASS,0,,,,19,Touchdown,2011-12-18T23:50:30Z,7.0,2:38,4.0,1.0,1.0,4.0,4.0,0.0,PUNT,TOUCHDOWN,11:19,08:41,DEN 11,NE 2,3219.0,3379.0,41,23,Home,-18,64,-7.0,47.5,0,outdoors,grass,63.0,3.0,John Fox,Bill Belichick,DEN00,Sports Authority Field at Mile High,0,1.0,T.Tebow,15.0,,,L.Ball,35.0,1,0,1.0,0,1,00-0027876,,00-0026432,T.Tebow,15.0,00-0027876,L.Ball,00-0026432,L.Ball,00-0026432,0,1,2.60450148658128,0.350915083095028,3.65284510113997,2.0,0.994842225627508,0.325491689087357,0.79965090751648,20.0349092483521,2011-12-18,K.Arrington,2011,REG,NE,15,00-0026071,CB,Kyle Arrington,Kyle,Arrington,Foot,,Questionable,Foot,,Limited Participation in Practice,2011-12-16T12:15:00Z,2011-12-16 12:15:00
3324,2011_11_PHI_NYG,2011112011,NYG,PHI,REG,11,PHI,away,NYG,PHI,55.0,2011-11-20,490.0,490.0,490.0,Half2,0,24.0,0,4,2.0,0,08:10,PHI 45,16,80.0,(8:10) (Shotgun) 9-V.Young pass short middle to 81-J.Avant to NYG 42 for 13 yards (21-K.Phillips). PHI-69-E.Mathis was injured during the play.,pass,13.0,1,0,1.0,0,0,0,short,middle,12.0,1.0,,,,,,,3,2,0.0,,,,,2.0,3.0,10,10,10.0,10.0,0.0,10.0,10.0,0.0,0.212188616394997,0.102938234806061,0.002204405143857,0.178418844938278,0.213296115398407,0.004720794968307,0.286232948303223,0.0,0.0,1.09080514498055,0.881124186329544,-3.85927328304388,3.85927328304388,-1.18690619926201,1.18690619926201,-6.77642132142405,6.77642132142405,0.623141491552815,0.257982694776729,0.623141491552815,0.257982694776729,-3.45379036862869,3.45379036862869,-4.17096664495444,4.17096664495444,-10.058321704797,10.058321704797,3.96434750042777,-3.96434750042777,0.467927366495132,0.532072633504868,0.532072633504868,0.467927366495132,0.0230838358402252,0.0522410273551941,-0.0522410273551941,0.508988797664642,0.491011202335358,0.437458127737045,0.562541872262955,-0.108933910727501,0.108933910727501,-0.0161846401201669,0.0161846401201669,0.0,0.0230838358402252,0.0,0.0230838358402252,0.256443233530774,-0.256443233530774,-0.339374317160997,0.339374317160997,0.247522981207624,-0.247522981207624,-0.241490586034212,0.241490586034212,0.0,0.0,0.0,0.0,0.0,0.0,0.0,0.0,0.0,0,0.0,0.0,0.0,0.0,0.0,0.0,0.0,0.0,0.0,0.0,0.0,0.0,0.0,0.0,1.0,0.0,0.0,0.0,0.0,0.0,0.0,0.0,0.0,1.0,0.0,0.0,0.0,0.0,0.0,0.0,0.0,0.0,0.0,0.0,0.0,1.0,0.0,0.0,0.0,0.0,0.0,00-0024218,V.Young,13.0,00-0024324,J.Avant,13.0,,,,,,,,,,,,,,,,,,,,,,,,,,,,,,,,,,,,,,,,,,,,,,NYG,,00-0026171,,K.Phillips,,,,,,,,,,,,,,0.0,,,,,,,,,,,,,,,,,,,,,,,,,,,,,,,,0.0,,,,,0,,,0.0,0.0,0.0,0.0,,,2011,0.687500655651093,31.2499344348907,44,1,First down,3324,"11/20/11, 20:31:56",2011-11-21T04:01:36Z,MetLife Stadium,"Partly Cloudy Temp: 58° F, Humidity: 66%, Wind: Southwest 10 mph",10012011-1120-1175-48e6-4d4a288659cc,0,0,PASS,0,,,,24,Touchdown,2011-11-21T03:56:00Z,18.0,8:51,6.0,1.0,1.0,4.0,4.0,0.0,KICKOFF,TOUCHDOWN,11:36,02:45,PHI 20,NYG 8,3151.0,3612.0,17,10,Home,-7,27,6.0,45.0,1,outdoors,fieldturf,58.0,10.0,Tom Coughlin,Andy Reid,NYC01,MetLife Stadium,0,1.0,V.Young,9.0,,,J.Avant,81.0,1,0,0.0,0,1,00-0024218,,00-0024324,V.Young,9.0,00-0024218,J.Avant,00-0024324,J.Avant,00-0024324,0,0,0.881124186329544,0.671575254457811,3.77325173627469,2.0,0.998488086857833,0.336578753602225,0.829433441162109,17.0566558837891,2011-11-20,E.Mathis,2011,REG,PHI,11,00-0023514,G,Evan Mathis,Evan,Mathis,Toe,,Probable,Toe,,Full Participation in Practice,2011-11-18T10:31:25Z,2011-11-18 10:31:25
3322,2011_14_HOU_CIN,2011121103,CIN,HOU,REG,14,HOU,away,CIN,HOU,71.0,2011-12-11,542.0,542.0,542.0,Half2,0,20.0,0,4,2.0,0,09:02,HOU 29,13,83.0,(9:02) 13-T.Yates pass short middle to 85-J.Dreessen to HOU 39 for 10 yards (53-T.Howard). HOU-85-J.Dreessen was injured during the play.,pass,10.0,0,0,1.0,0,0,0,short,middle,6.0,4.0,,,,,,,3,2,0.0,,,,,2.0,3.0,19,10,10.0,19.0,-9.0,10.0,19.0,-9.0,0.184560060501099,0.145837292075157,0.0035562852863222,0.248774632811546,0.166708737611771,0.0024081980809569,0.248154759407043,0.0,0.0,0.0559790483675897,0.558244082611054,6.91440781811252,-6.91440781811252,6.4630825301283,-6.4630825301283,-7.5199616711202,7.5199616711202,-0.0743480692617595,0.632592151872814,-0.0743480692617595,0.632592151872814,3.09200266835978,-3.09200266835978,-10.6923482719304,10.6923482719304,-9.73098600649973,9.73098600649973,0.616677529321806,-0.616677529321806,0.0973194912075996,0.9026805087924,0.9026805087924,0.0973194912075996,0.0135431289672852,0.0105728209018707,-0.0105728209018707,0.889137379825115,0.110862620174885,0.0934552103281021,0.906544789671898,0.372529111802578,-0.372529111802578,-0.196079110932919,0.196079110932919,0.0,0.0135431289672852,0.0,0.0135431289672852,-0.0030792653560638,0.0030792653560638,-0.280892698300454,0.280892698300454,-0.0060926973819732,0.0060926973819732,-0.248310802710625,0.248310802710625,0.0,0.0,0.0,0.0,0.0,0.0,0.0,0.0,0.0,0,0.0,0.0,0.0,0.0,0.0,0.0,0.0,0.0,0.0,0.0,0.0,0.0,0.0,0.0,1.0,0.0,0.0,0.0,0.0,0.0,0.0,0.0,0.0,1.0,0.0,0.0,0.0,0.0,0.0,0.0,0.0,0.0,0.0,0.0,0.0,1.0,0.0,0.0,0.0,0.0,0.0,00-0028090,T.Yates,10.0,00-0023630,J.Dreessen,10.0,,,,,,,,,,,,,,,,,,,,,,,,,,,,,,,,,,,,,,,,,,,,,,CIN,,00-0024253,,T.Howard,,,,,,,,,,,,,,0.0,,,,,,,,,,,,,,,,,,,,,,,,,,,,,,,,0.0,,,,,0,,,0.0,0.0,0.0,0.0,,,2011,0.760297298431397,23.9702701568604,48,1,First down,3322,"12/11/11, 13:02:46",2011-12-11T20:35:34Z,Paycor Stadium,"Sunny Temp: 34° F, Humidity: 47%, Wind: SSW 4 mph",10012011-1211-037a-b8ee-7aeadaceb419,0,0,PASS,0,,,,20,Field goal,2011-12-11T20:32:40Z,13.0,6:04,5.0,1.0,1.0,4.0,4.0,-5.0,FUMBLE,FIELD_GOAL,11:35,05:31,HOU 2,CIN 15,3206.0,3507.0,20,19,Home,-1,39,2.5,37.5,0,outdoors,fieldturf,34.0,4.0,Marvin Lewis,Gary Kubiak,CIN00,Paul Brown Stadium,0,1.0,T.Yates,13.0,,,J.Dreessen,85.0,1,0,0.0,0,1,00-0028090,,00-0023630,T.Yates,13.0,00-0028090,J.Dreessen,00-0023630,J.Dreessen,00-0023630,0,0,0.558244082611054,0.710727282148863,4.36783161685889,3.0,0.814158355409745,0.180251413548831,0.904135882854462,9.58641171455383,2011-12-11,J.Dreessen,2011,REG,HOU,14,00-0023630,TE,Joel Dreessen,Joel,Dreessen,Groin,,Probable,Groin,,Full Participation in Practice,2011-12-09T11:05:03Z,2011-12-09 11:05:03
3242,2011_12_ARI_STL,2011112704,LA,ARI,REG,12,ARI,away,LA,ARI,51.0,2011-11-27,561.0,561.0,561.0,Half2,0,23.0,0,4,2.0,0,09:21,ARI 49,6,-2.0,"(9:21) 26-C.Wells left tackle to ARI 44 for -5 yards (51-B.Poppinga). FUMBLES (51-B.Poppinga), RECOVERED by LA-51-B.Poppinga at ARI 43. 51-B.Poppinga to ARI 43 for no gain (71-D.Colledge). ARI-26-C.Wells was injured during the play.",run,-6.0,0,0,0.0,0,0,0,,,,,left,tackle,,,,,3,1,0.0,,,,,1.0,3.0,13,20,20.0,13.0,7.0,20.0,13.0,7.0,0.124067783355713,0.0901501998305321,0.0014699099119752,0.153957739472389,0.267740309238434,0.0036093064118176,0.3590047955513,0.0,0.0,1.97237851377577,-5.14701552363113,-8.26049029238348,8.26049029238348,-5.42474146257155,5.42474146257155,2.45391185939854,-2.45391185939854,,,0.0,0.0,1.28848844318418,-1.28848844318418,-0.689502714540551,0.689502714540551,11.1390202831826,-11.1390202831826,-4.16515379646251,4.16515379646251,0.884272813796997,0.115727186203003,0.115727186203003,0.884272813796997,-0.130971699953079,-0.141981184482574,0.141981184482574,0.246698886156082,0.753301113843918,0.878562808036804,0.121437191963196,-0.246364954287927,0.246364954287927,-0.054575651884079,0.054575651884079,,,0.0,0.0,0.0805180668830872,-0.0805180668830872,-0.0980877131223679,0.0980877131223679,0.078805536031723,-0.078805536031723,-0.0183143615722656,0.0183143615722656,0.0,0.0,0.0,0.0,0.0,0.0,0.0,0.0,0.0,0,0.0,0.0,0.0,0.0,0.0,0.0,0.0,0.0,0.0,0.0,0.0,1.0,0.0,0.0,1.0,0.0,0.0,1.0,1.0,0.0,0.0,0.0,1.0,0.0,0.0,0.0,0.0,0.0,0.0,0.0,0.0,0.0,0.0,0.0,1.0,0.0,0.0,0.0,0.0,0.0,0.0,,,,,,,00-0027007,C.Wells,-6.0,,,,,,,,,,,,,,,,,,,,,,,,,,,,,,,,,,,,,LA,00-0023559,B.Poppinga,,,,LA,ARI,00-0023559,00-0024262,B.Poppinga,D.Colledge,,,,,,,,,,,,,0.0,,,,,,,,,,,ARI,00-0027007,C.Wells,,,,LA,0.0,00-0023559,B.Poppinga,,,,,,,,,,,,0.0,,,,,0,,,0.0,0.0,0.0,0.0,,,2011,,,44,0,Turnover,3242,"11/27/11, 13:03:59",2011-11-27T20:36:49Z,Edward Jones Dome,"Temp: ° F, Wind: mph",10012011-1127-046c-e6e0-4bd96ae6c04b,0,0,RUSH,0,,,,23,Turnover,2011-11-27T20:36:08Z,2.0,0:48,0.0,0.0,0.0,4.0,4.0,0.0,PUNT,FUMBLE,09:59,09:11,ARI 45,ARI 49,3221.0,3242.0,23,20,Home,-3,43,1.0,40.0,1,dome,astroplay,,,Steve Spagnuolo,Ken Whisenhunt,STL00,Edward Jones Dome,0,0.0,,,C.Wells,26.0,,,0,1,0.0,0,1,,00-0027007,,C.Wells,26.0,00-0027007,C.Wells,00-0027007,C.Wells,00-0027007,0,1,-5.14701552363113,,,,,,0.444479286670685,-44.4479286670685,2011-11-27,C.Wells,2011,REG,ARI,12,00-0027007,RB,Chris Wells,Chris,Wells,Knee,,Probable,Knee,,Full Participation in Practice,2011-11-25T11:50:02Z,2011-11-25 11:50:02
3230,2011_02_PHI_ATL,2011091814,ATL,PHI,REG,2,ATL,home,PHI,ATL,52.0,2011-09-18,862.0,862.0,862.0,Half2,0,24.0,0,4,1.0,0,14:22,ATL 48,10,80.0,(14:22) 2-M.Ryan pass incomplete deep left to 11-J.Jones (24-N.Asomugha). PHI-75-J.Parker was injured during the play. His return is Probable.,pass,0.0,0,0,1.0,0,0,0,deep,left,30.0,,,,,,,,2,2,0.0,,,,,2.0,2.0,21,31,21.0,31.0,-10.0,21.0,31.0,-10.0,0.0396089255809784,0.0939991697669029,0.0010760447476059,0.131922572851181,0.297264724969864,0.0055750058963894,0.430553585290909,0.0,0.0,2.70921167498454,-0.500286916038021,-12.9008802559023,12.9008802559023,0.378033868502826,-0.378033868502826,-9.2912043832999,9.2912043832999,1.83361399697606,-2.33390091301408,0.0,0.0,5.01120321056806,-5.01120321056806,-9.43404100220254,9.43404100220254,4.91144264221657,-4.91144264221657,-7.7292187219078,7.7292187219078,0.191373988986015,0.808626011013985,0.191373988986015,0.808626011013985,-0.0203408300876617,-0.0166207700967789,-0.0166207700967789,0.171033158898354,0.828966841101646,0.15548737347126,0.15548737347126,0.0329804384423871,-0.0329804384423871,-0.564155653665815,0.564155653665815,0.0,-0.0203408300876617,0.0,0.0,0.352352744818191,-0.352352744818191,-0.603693805168881,0.603693805168881,0.350436842918853,-0.350436842918853,-0.736998103092923,0.736998103092923,0.0,0.0,0.0,0.0,0.0,0.0,0.0,0.0,1.0,0,0.0,0.0,0.0,0.0,0.0,0.0,0.0,0.0,0.0,0.0,0.0,0.0,0.0,0.0,0.0,0.0,0.0,0.0,0.0,0.0,0.0,0.0,0.0,1.0,0.0,0.0,0.0,0.0,0.0,0.0,0.0,0.0,0.0,0.0,0.0,0.0,0.0,0.0,0.0,0.0,0.0,00-0026143,M.Ryan,,00-0027944,J.Jones,,,,,,,,,,,,,,,,,,,,,,,,,,,,,,,,,,,,,,,,,,,,,,,,,,,,,,,,,,,,,,,,,0.0,,,,,,,00-0022077,N.Asomugha,,,,,,,,,,,,,,,,,,,,,,,,0.0,,,,,0,,,0.0,0.0,0.0,0.0,,,2011,0.33056977391243,-33.056977391243,50,1,First down,3230,"9/18/11, 20:31:09",2011-09-19T03:07:03Z,Georgia Dome,"Temp: ° F, Wind: mph",10012011-0918-148f-3712-89c78af862d3,0,0,PASS,0,,,,24,Touchdown,2011-09-19T02:59:45Z,12.0,6:14,6.0,1.0,1.0,3.0,4.0,0.0,KICKOFF,TOUCHDOWN,01:59,10:45,ATL 20,PHI 1,3077.0,3461.0,31,35,Home,4,66,-2.5,49.0,0,dome,fieldturf,,,Mike Smith,Andy Reid,ATL00,Georgia Dome,0,0.0,M.Ryan,2.0,,,J.Jones,11.0,1,0,0.0,0,1,00-0026143,,00-0027944,M.Ryan,2.0,00-0026143,J.Jones,00-0027944,J.Jones,00-0027944,0,0,-0.500286916038021,0.583940949993035,7.38632325851359,5.0,1.0,1.0,0.647574901580811,35.2425098419189,2011-09-18,J.Parker,2011,REG,PHI,2,00-0019986,DE,Juqua Parker,Juqua,Parker,Foot,,Probable,Foot,,Full Participation in Practice,2011-09-16T11:06:24Z,2011-09-16 11:06:24
3181,2011_16_JAX_TEN,2011122403,TEN,JAX,REG,16,TEN,home,JAX,JAX,32.0,2011-12-24,854.0,854.0,854.0,Half2,0,21.0,0,4,1.0,0,14:14,JAX 32,10,63.0,(14:14) 8-M.Hasselbeck scrambles up the middle to JAX 25 for 7 yards (69-L.Douzable). TEN-28-C.Johnson was injured during the play. His return is Questionable.,run,7.0,0,0,1.0,0,0,1,,,,,middle,,,,,,3,3,0.0,,,,,3.0,3.0,20,10,20.0,10.0,10.0,20.0,10.0,10.0,0.030206099152565,0.0483967773616314,0.0006602408247999,0.0732495412230492,0.371718019247055,0.0022586761042475,0.473510682582855,0.0,0.0,3.77498858573381,0.32310747995507,13.1477689426436,-13.1477689426436,1.96938225632766,-1.96938225632766,0.812808690499836,-0.812808690499836,,,0.0,0.0,8.36286373529583,-8.36286373529583,-0.626617706909525,0.626617706909525,11.6346173210768,-11.6346173210768,-11.2226842518194,11.2226842518194,0.928269267082214,0.0717307329177856,0.928269267082214,0.0717307329177856,0.0022404193878173,0.0026284456253051,0.0026284456253051,0.930509686470032,0.0694903135299683,0.967735826969147,0.967735826969147,0.101671094976411,-0.101671094976411,0.0615529611119809,-0.0615529611119809,,,0.0,0.0,0.0231142491102219,-0.0231142491102219,0.160572771669346,-0.160572771669346,0.0219928473234177,-0.0219928473234177,0.0524025901565137,-0.0524025901565137,0.0,0.0,0.0,0.0,0.0,0.0,0.0,0.0,0.0,0,0.0,0.0,0.0,0.0,0.0,0.0,0.0,0.0,0.0,0.0,0.0,0.0,0.0,0.0,1.0,0.0,0.0,0.0,0.0,0.0,0.0,0.0,1.0,0.0,0.0,0.0,0.0,0.0,0.0,0.0,0.0,0.0,0.0,0.0,0.0,0.0,0.0,0.0,0.0,0.0,0.0,,,,,,,00-0007091,M.Hasselbeck,7.0,,,,,,,,,,,,,,,,,,,,,,,,,,,,,,,,,,,,,,,,,,,JAX,,00-0025942,,L.Douzable,,,,,,,,,,,,,,0.0,,,,,,,,,,,,,,,,,,,,,,,,,,,,,,,,0.0,,,,,0,,,0.0,0.0,0.0,0.0,,,2011,,,48,1,First down,3181,"12/24/11, 13:02:42",2011-12-24T20:25:59Z,Nissan Stadium,"Sunny Temp: 44° F, Humidity: 60%, Wind: E/NE 2 mph",10012011-1224-037d-edbf-d260909cd49e,0,0,RUSH,0,,,,21,Field goal,2011-12-24T20:23:47Z,7.0,2:19,2.0,1.0,1.0,4.0,4.0,0.0,PUNT,FIELD_GOAL,14:48,12:29,TEN 20,JAX 17,3157.0,3301.0,17,23,Home,6,40,8.5,38.5,1,outdoors,grass,44.0,2.0,Mike Munchak,Mel Tucker,NAS00,LP Field,0,1.0,M.Hasselbeck,8.0,,8.0,,,1,0,0.0,0,1,00-0007091,,,M.Hasselbeck,8.0,00-0007091,M.Hasselbeck,00-0007091,M.Hasselbeck,00-0007091,0,1,0.32310747995507,,,,,,0.329074293375015,67.0925706624985,2011-12-24,C.Johnson,2011,REG,TEN,16,00-0026164,RB,Chris Johnson,Chris,Johnson,Ankle,,Questionable,Ankle,,Limited Participation in Practice,2011-12-23T09:13:39Z,2011-12-23 09:13:39
3158,2011_11_KC_NE,2011112100,NE,KC,REG,11,KC,away,NE,KC,76.0,2011-11-21,802.0,802.0,802.0,Half2,0,18.0,0,4,2.0,0,13:22,KC 24,18,69.0,(13:22) 4-T.Palko pass deep middle to 82-D.Bowe to KC 49 for 25 yards (24-K.Arrington). NE-24-K.Arrington was injured during the play.,pass,25.0,0,0,1.0,0,0,0,deep,middle,16.0,9.0,,,,,,,3,3,0.0,,,,,3.0,3.0,27,3,3.0,27.0,-24.0,3.0,27.0,-24.0,0.0782535821199417,0.193245351314545,0.0047473181039094,0.303082019090652,0.165542915463448,0.0030713432934135,0.252057492733002,0.0,0.0,-0.443630941677839,2.5285658207722,21.514473436617,-21.514473436617,3.08769988152199,-3.08769988152199,9.77185209124273,-9.77185209124273,1.22661353414878,1.30195228662342,1.22661353414878,1.30195228662342,-8.91508774919203,8.91508774919203,16.9909524935283,-16.9909524935283,-11.835891440307,11.835891440307,24.0555673362365,-24.0555673362365,0.0026658093556761,0.997334190644324,0.997334190644324,0.0026658093556761,0.0008918936364352,0.0002573949750512,-0.0002573949750512,0.996442297007889,0.0035577029921114,0.0006458495627157,0.999354150437284,0.0731157623231411,-0.0731157623231411,0.113281213309218,-0.113281213309218,0.0,0.0008918936364352,0.0,0.0008918936364352,0.0161744486540556,-0.0161744486540556,0.150941397159894,-0.150941397159894,0.0148272514343262,-0.0148272514343262,0.224976868465145,-0.224976868465145,0.0,0.0,1.0,0.0,0.0,0.0,0.0,0.0,0.0,0,0.0,0.0,0.0,0.0,0.0,0.0,0.0,0.0,0.0,0.0,0.0,0.0,0.0,0.0,1.0,0.0,0.0,0.0,0.0,0.0,0.0,0.0,0.0,1.0,0.0,0.0,0.0,0.0,0.0,0.0,0.0,0.0,0.0,0.0,0.0,1.0,0.0,0.0,0.0,0.0,0.0,00-0024812,T.Palko,25.0,00-0025410,D.Bowe,25.0,,,,,,,,,,,,,,,,,,,,,,,,,,,,,,,,,,,,,,,,,,,,,,NE,,00-0026071,,K.Arrington,,,,,,,,,,,,,,0.0,,,,,,,,,,,,,,,,,,,,,,,,,,,,,,,,0.0,,,,,0,,,0.0,0.0,0.0,0.0,,,2011,0.655663549900055,34.4336450099945,43,1,First down,3158,"11/21/11, 20:40:32",2011-11-22T03:55:37Z,Gillette Stadium,"Clear and cold Temp: 33° F, Wind: ENE 2 mph",10012011-1121-00ac-ae4c-e7750016d1a5,0,0,PASS,0,,,,18,Turnover,2011-11-22T03:53:06Z,10.0,4:10,4.0,1.0,0.0,4.0,4.0,0.0,KICKOFF,INTERCEPTION,15:00,10:50,KC 18,NE 13,3060.0,3307.0,3,34,Home,31,37,17.0,46.5,0,outdoors,fieldturf,33.0,2.0,Bill Belichick,Todd Haley,BOS00,Gillette Stadium,0,1.0,T.Palko,4.0,,,D.Bowe,82.0,1,0,1.0,0,1,00-0024812,,00-0025410,T.Palko,4.0,00-0024812,D.Bowe,00-0025410,D.Bowe,00-0025410,0,0,2.5285658207722,0.66355144306215,3.90183024728321,2.0,1.0,0.52775629441021,0.876426637172699,12.3573362827301,2011-11-21,K.Arrington,2011,REG,NE,11,00-0026071,CB,Kyle Arrington,Kyle,Arrington,Foot,,Questionable,Foot,,Limited Participation in Practice,2011-11-19T12:53:35Z,2011-11-19 12:53:35
3110,2011_16_MIA_NE,2011122401,NE,MIA,REG,16,MIA,away,NE,MIA,93.0,2011-12-24,393.0,1293.0,1293.0,Half2,0,19.0,0,3,2.0,0,06:33,MIA 7,20,-7.0,(6:33) 22-R.Bush left end to MIA 16 for 9 yards (31-S.Brown; 51-J.Mayo). NE-44-J.Ihedigbo was injured during the play.,run,9.0,0,0,0.0,0,0,0,,,,,left,end,,,,,3,3,0.0,,,,,3.0,3.0,10,17,17.0,10.0,7.0,17.0,10.0,7.0,0.0156732406467199,0.240906432271004,0.0266915690153837,0.37884995341301,0.153605788946152,0.0015331399627029,0.182739868760109,0.0,0.0,-1.68498938065022,0.186214106623083,-8.86107651784982,8.86107651784982,5.90399931406137,-5.90399931406137,-12.1577039364792,12.1577039364792,,,0.0,0.0,-4.84011720644776,4.84011720644776,-0.527612667458033,0.527612667458033,-17.1965790524264,17.1965790524264,5.25265476692501,-5.25265476692501,0.719018399715424,0.280981600284576,0.280981600284576,0.719018399715424,0.0076351761817932,0.0159307718276978,-0.0159307718276978,0.273346424102783,0.726653575897217,0.605979025363922,0.394020974636078,0.101977713406086,-0.101977713406086,-0.312888286501896,0.312888286501896,,,0.0,0.0,0.076042667606583,-0.076042667606583,-0.298414737055542,0.298414737055542,0.076042667606583,-0.076042667606583,-0.374106802115681,0.374106802115681,0.0,0.0,0.0,0.0,0.0,0.0,0.0,0.0,0.0,0,0.0,0.0,0.0,0.0,0.0,0.0,0.0,0.0,0.0,0.0,0.0,0.0,0.0,0.0,0.0,0.0,0.0,0.0,0.0,0.0,0.0,0.0,1.0,0.0,0.0,0.0,0.0,0.0,0.0,0.0,0.0,0.0,0.0,0.0,0.0,0.0,1.0,0.0,0.0,0.0,0.0,,,,,,,00-0024217,R.Bush,9.0,,,,,,,,,,,,,,,,,,,,,,,,,,,,,,,,,,,,,,,,,,,,,,,,,00-0027232,S.Brown,NE,00-0026150,J.Mayo,NE,,,,,,,0.0,,,,,,,,,,,,,,,,,,,,,,,,,,,,,,,,0.0,,,,,0,,,0.0,0.0,0.0,0.0,,,2011,,,39,0,Punt,3110,"12/24/11, 13:02:44",2011-12-24T20:14:09Z,Gillette Stadium,"Sunny and cold Temp: 30° F, Wind: North 7 mph",10012011-1224-018c-bf96-ff07ed13604f,0,0,RUSH,0,,,,19,Punt,2011-12-24T20:12:36Z,3.0,2:08,0.0,0.0,0.0,3.0,3.0,0.0,KICKOFF,PUNT,07:10,05:02,MIA 17,MIA 10,3068.0,3165.0,24,27,Home,3,51,7.5,49.0,1,outdoors,fieldturf,30.0,7.0,Bill Belichick,Todd Bowles,BOS00,Gillette Stadium,0,1.0,,,R.Bush,22.0,,,0,1,0.0,0,1,,00-0024217,,R.Bush,22.0,00-0024217,R.Bush,00-0024217,R.Bush,00-0024217,0,0,0.186214106623083,,,,,,0.537252247333527,-53.7252247333527,2011-12-24,J.Ihedigbo,2011,REG,NE,16,00-0025753,S,James Ihedigbo,James,Ihedigbo,Shoulder,,Questionable,Shoulder,,Limited Participation in Practice,2011-12-23T12:07:44Z,2011-12-23 12:07:44
3067,2011_09_DEN_OAK,2011110607,LV,DEN,REG,9,DEN,away,LV,LV,37.0,2011-11-06,211.0,1111.0,1111.0,Half2,0,18.0,0,3,3.0,0,03:31,LV 37,13,52.0,"(3:31) (Shotgun) 15-T.Tebow up the middle to LV 25 for 12 yards (33-T.Branch, 56-D.Blackstock). DEN-74-O.Franklin was injured during the play.",run,12.0,1,0,0.0,0,0,0,,,,,middle,,,,,,3,3,0.0,,,,,3.0,3.0,24,14,14.0,24.0,-10.0,14.0,24.0,-10.0,0.0244501680135727,0.122754864394665,0.0016595594352111,0.191710278391838,0.386750310659409,0.0053021842613816,0.267372637987137,0.0,0.0,1.32890810561366,0.759470318163258,6.94759631849002,-6.94759631849002,-1.38627801068218,1.38627801068218,7.14879695817532,-7.14879695817532,,,0.0,0.0,3.97154959375621,-3.97154959375621,5.81534990758519,-5.81534990758519,-3.48382552966359,3.48382552966359,12.0143505055416,-12.0143505055416,0.151409193873405,0.848590806126595,0.848590806126595,0.151409193873405,0.0326913446187973,0.0024914592504501,-0.0024914592504501,0.815899461507797,0.184100538492203,0.0917235910892487,0.908276408910751,-0.0417063534259796,0.0417063534259796,0.322562613987819,-0.322562613987819,,,0.0,0.0,-0.0225856899910337,0.0225856899910337,0.367327147596292,-0.367327147596292,0.0406742692298525,-0.0406742692298525,0.335454383366518,-0.335454383366518,0.0,0.0,0.0,0.0,0.0,1.0,0.0,0.0,0.0,0,0.0,0.0,0.0,0.0,0.0,0.0,0.0,0.0,0.0,0.0,0.0,0.0,0.0,0.0,0.0,0.0,0.0,0.0,0.0,0.0,0.0,0.0,1.0,0.0,0.0,0.0,0.0,0.0,0.0,0.0,0.0,0.0,0.0,0.0,0.0,0.0,1.0,0.0,0.0,0.0,0.0,,,,,,,00-0027876,T.Tebow,12.0,,,,,,,,,,,,,,,,,,,,,,,,,,,,,,,,,,,,,,,,,,,,,,,,,00-0023530,D.Blackstock,LV,,,,,,,,,,1.0,00-0026240,T.Branch,LV,,,,,,,,,,,,,,,,,,,,,,,,,,,,,0.0,,,,,0,,,0.0,0.0,0.0,0.0,,,2011,,,40,0,Field goal,3067,"11/6/11, 16:06:03",2011-11-06T23:28:02Z,Oakland-Alameda County Stadium,"Partly Cloudy Temp: 62° F, Humidity: 50%, Wind: S 5 mph",10012011-1106-07b8-003f-b4a0aa4d9d47,0,0,RUSH,0,,,,18,Field goal,2011-11-06T23:21:45Z,7.0,3:49,2.0,0.0,1.0,3.0,3.0,-5.0,KICKOFF,FIELD_GOAL,06:41,02:52,DEN 23,LV 25,2914.0,3091.0,38,24,Home,-14,62,7.0,41.5,1,outdoors,grass,62.0,5.0,Hue Jackson,John Fox,OAK00,O.co Coliseum,0,1.0,,,T.Tebow,15.0,,,0,1,0.0,0,1,,00-0027876,,T.Tebow,15.0,00-0027876,T.Tebow,00-0027876,T.Tebow,00-0027876,0,1,0.759470318163258,,,,,,0.96932464838028,-96.932464838028,2011-11-06,O.Franklin,2011,REG,DEN,9,00-0027984,T,Orlando Franklin,Orlando,Franklin,Groin,,Probable,Groin,,Limited Participation in Practice,2011-11-04T11:46:26Z,2011-11-04 11:46:26
2932,2011_20_NYG_SF,2012012201,SF,NYG,POST,20,NYG,away,SF,NYG,68.0,2012-01-22,65.0,965.0,965.0,Half2,0,18.0,0,3,3.0,0,01:05,NYG 32,5,5.0,(1:05) (Shotgun) 10-E.Manning pass incomplete deep middle to 88-H.Nicks (25-T.Brown). SF-25-T.Brown was injured during the play. His return is Questionable.,pass,0.0,1,0,1.0,0,0,0,deep,middle,16.0,,,,,,,,3,3,0.0,,,,,3.0,3.0,14,10,10.0,14.0,-4.0,10.0,14.0,-4.0,0.0465505421161652,0.175376877188683,0.0039073228836059,0.290715903043747,0.195285245776176,0.0028253705240786,0.285338789224625,0.0,0.0,0.0199214043095708,-1.28715618234128,3.88935829775141,-3.88935829775141,5.42483887058916,-5.42483887058916,-1.81922911992297,1.81922911992297,2.03667241148651,-3.32382859382778,0.0,0.0,-11.1535459430306,11.1535459430306,1.75434711849084,-1.75434711849084,-13.8493517861352,13.8493517861352,7.78524076176109,-7.78524076176109,0.288321673870087,0.711678326129913,0.711678326129913,0.288321673870087,-0.0341837108135223,-0.0459507405757904,0.0459507405757904,0.745862036943436,0.254137963056564,0.307479947805405,0.692520052194595,0.0994929075241089,-0.0994929075241089,-0.0266110112178587,0.0266110112178587,0.0,-0.0341837108135223,0.0,0.0,-0.138422851371145,0.138422851371145,-0.129042274140766,0.129042274140766,-0.138422851371145,0.138422851371145,-0.0027723673815037,0.0027723673815037,0.0,0.0,0.0,0.0,0.0,1.0,0.0,0.0,1.0,0,0.0,0.0,0.0,0.0,0.0,0.0,0.0,0.0,0.0,0.0,0.0,0.0,0.0,0.0,0.0,0.0,0.0,0.0,0.0,0.0,0.0,0.0,0.0,1.0,0.0,0.0,0.0,0.0,0.0,0.0,0.0,0.0,0.0,0.0,0.0,0.0,0.0,0.0,0.0,0.0,0.0,00-0022803,E.Manning,,00-0027005,H.Nicks,,,,,,,,,,,,,,,,,,,,,,,,,,,,,,,,,,,,,,,,,,,,,,,,,,,,,,,,,,,,,,,,,0.0,,,,,,,00-0025534,T.Brown,,,,,,,,,,,,,,,,,,,,,,,,0.0,,,,,0,,,0.0,0.0,0.0,0.0,,,2011,0.610023260116577,-61.0023260116577,38,0,Punt,2932,"1/22/12, 18:41:49",2012-01-23T02:00:42Z,Candlestick Park,"Rain Temp: 52° F, Humidity: 77%, Wind: southeast 15 mph",10012012-0122-018f-443d-98f851607c59,0,0,PASS,0,,,,18,Punt,2012-01-23T01:59:16Z,3.0,1:02,0.0,0.0,0.0,3.0,3.0,0.0,PUNT,PUNT,01:55,00:53,NYG 27,NYG 32,2889.0,2957.0,20,17,Home,-3,37,2.0,40.5,0,outdoors,grass,52.0,15.0,Jim Harbaugh,Tom Coughlin,SFO00,Candlestick Park,0,0.0,E.Manning,10.0,,,H.Nicks,88.0,1,0,0.0,0,1,00-0022803,,00-0027005,E.Manning,10.0,00-0022803,H.Nicks,00-0027005,H.Nicks,00-0027005,0,1,-1.28715618234128,0.361628167757654,5.26173133781413,2.0,1.0,1.0,0.963785767555237,3.62142324447632,2012-01-22,T.Brown,2011,CON,SF,20,00-0025534,CB,Tarell Brown,Tarell,Brown,Thigh,,Questionable,Thigh,,Limited Participation in Practice,2012-01-20T15:02:07Z,2012-01-20 15:02:07
2912,2011_03_NYG_PHI,2011092505,PHI,NYG,REG,3,PHI,home,NYG,NYG,43.0,2011-09-25,703.0,703.0,703.0,Half2,0,15.0,0,4,4.0,0,11:43,NYG 43,1,27.0,(11:43) 25-L.McCoy right end to NYG 46 for -3 yards (59-M.Boley). PHI-7-M.Vick was injured during the play. He is Out.,run,-3.0,0,0,0.0,0,0,0,,,,,right,end,,,,,3,2,0.0,,,,,3.0,2.0,16,14,16.0,14.0,2.0,16.0,14.0,2.0,0.106131911277771,0.152368500828743,0.0015908805653452,0.200658336281776,0.19312547147274,0.0067236106842756,0.339401304721832,0.0,0.0,1.10373715125024,-3.00911075226031,-1.35530248738792,1.35530248738792,-0.81354634445832,0.81354634445832,-0.394396439701587,0.394396439701587,,,0.0,0.0,8.20493915147381,-8.20493915147381,-6.84077462353162,6.84077462353162,6.05705652706092,-6.05705652706092,-10.0471009323204,10.0471009323204,0.718425035476685,0.281574964523315,0.718425035476685,0.281574964523315,-0.158451408147812,-0.100332081317902,-0.100332081317902,0.559973627328873,0.440026372671127,0.770169377326965,0.770169377326965,-0.147274273538718,0.147274273538718,0.131165682269745,-0.131165682269745,,,0.0,0.0,0.0662622153759003,-0.0662622153759003,0.0611878176466752,-0.0611878176466752,0.0662622153759003,-0.0662622153759003,-0.122574389980621,0.122574389980621,0.0,0.0,0.0,0.0,0.0,0.0,0.0,1.0,0.0,0,0.0,0.0,0.0,0.0,0.0,0.0,0.0,0.0,0.0,0.0,0.0,0.0,0.0,0.0,1.0,0.0,0.0,1.0,0.0,0.0,0.0,0.0,1.0,0.0,0.0,0.0,0.0,0.0,0.0,0.0,0.0,0.0,0.0,0.0,0.0,0.0,0.0,0.0,0.0,0.0,0.0,,,,,,,00-0027029,L.McCoy,-3.0,,,,,,,,,,,,,,,,,,,,,,,,,,,,,00-0023593,M.Boley,,,,,,,,,,,,,NYG,,00-0023593,,M.Boley,,,,,,,,,,,,,,0.0,,,,,,,,,,,,,,,,,,,,,,,,,,,,,,,,0.0,,,,,0,,,0.0,0.0,0.0,0.0,,,2011,,,41,0,Turnover on downs,2912,"9/25/11, 13:03:45",2011-09-25T19:22:06Z,Lincoln Financial Field,"Cloudy Temp: 76° F, Humidity: 79%, Wind: NNE 5 mph",10012011-0925-0543-427c-a4a30506d991,0,0,RUSH,0,,,,15,Turnover on downs,2011-09-25T19:17:15Z,5.0,2:43,1.0,0.0,0.0,4.0,4.0,0.0,PUNT,DOWNS,14:20,11:37,PHI 27,NYG 43,2821.0,2912.0,29,16,Home,-13,45,9.0,46.5,1,outdoors,grass,76.0,5.0,Andy Reid,Tom Coughlin,PHI00,Lincoln Financial Field,0,0.0,,,L.McCoy,25.0,,,0,1,0.0,0,1,,00-0027029,,L.McCoy,25.0,00-0027029,L.McCoy,00-0027029,L.McCoy,00-0027029,0,0,-3.00911075226031,,,,,,0.177994534373283,-17.7994534373283,2011-09-25,M.Vick,2011,REG,PHI,3,00-0020245,QB,Michael Vick,Michael,Vick,Concussion,,Questionable,Concussion,,Full Participation in Practice,2011-09-23T12:41:07Z,2011-09-23 12:41:07
2897,2011_05_PHI_BUF,2011100907,BUF,PHI,REG,5,BUF,home,PHI,BUF,80.0,2011-10-09,437.0,1337.0,1337.0,Half2,0,15.0,0,3,1.0,0,07:17,BUF 20,10,22.0,"(7:17) 14-R.Fitzpatrick pass short middle to 22-F.Jackson pushed ob at BUF 40 for 20 yards (23-D.Rodgers-Cromartie). PHI-97-C.Jenkins was injured during the play. Dump pass, caught at BUF 17. C.Jenkins walks off.",pass,20.0,0,0,1.0,0,0,0,short,middle,-3.0,23.0,,,,,,,3,3,0.0,,,,,3.0,3.0,28,14,28.0,14.0,14.0,28.0,14.0,14.0,0.0162324085831642,0.172046571969986,0.0033714759629219,0.246244087815285,0.212429970502853,0.0035292590036988,0.346146255731583,0.0,0.0,0.820780937094241,1.35638101305813,15.3444127820053,-15.3444127820053,0.216625133587513,-0.216625133587513,15.9676682951394,-15.9676682951394,-1.08448679465801,2.44086780771613,-1.08448679465801,2.44086780771613,-12.1904583622236,12.1904583622236,11.3949751986074,-11.3949751986074,-13.5745928885881,13.5745928885881,29.5422611837275,-29.5422611837275,0.932730317115784,0.0672696828842163,0.932730317115784,0.0672696828842163,0.0148090720176697,0.0249493718147278,0.0249493718147278,0.947539389133453,0.0524606108665466,0.869629681110382,0.869629681110382,0.170057299595159,-0.170057299595159,-0.552427735848501,0.552427735848501,0.0039591789245605,0.0108498930931091,0.0039591789245605,0.0108498930931091,0.0583497797076038,-0.0583497797076038,-0.0996847189962864,0.0996847189962864,0.0544222284976772,-0.0544222284976772,-0.606849964346178,0.606849964346178,0.0,0.0,1.0,0.0,0.0,0.0,0.0,0.0,0.0,0,0.0,0.0,0.0,0.0,0.0,0.0,0.0,0.0,0.0,0.0,0.0,0.0,0.0,0.0,1.0,0.0,0.0,0.0,0.0,0.0,0.0,0.0,0.0,1.0,0.0,0.0,0.0,0.0,0.0,0.0,0.0,0.0,0.0,0.0,0.0,1.0,0.0,0.0,0.0,0.0,0.0,00-0023682,R.Fitzpatrick,20.0,00-0024204,F.Jackson,20.0,,,,,,,,,,,,,,,,,,,,,,,,,,,,,,,,,,,,,,,,,,,,,,PHI,,00-0026156,,D.Rodgers-Cromartie,,,,,,,,,,,,,,0.0,,,,,,,,,,,,,,,,,,,,,,,,,,,,,,,,0.0,,,,,0,,,0.0,0.0,0.0,0.0,,,2011,0.799140810966492,20.0859189033508,41,1,First down,2897,"10/9/11, 13:04:22",2011-10-09T19:12:28Z,Highmark Stadium,"Sunny Temp: 74° F, Humidity: 47%, Wind: WSW 6 mph",10012011-1009-0720-083b-c5a67fbf9aee,0,0,PASS,0,,,,15,Punt,2011-10-09T19:10:03Z,4.0,2:01,1.0,0.0,0.0,3.0,3.0,0.0,KICKOFF,PUNT,07:17,05:16,BUF 20,BUF 42,2879.0,3011.0,24,31,Home,7,55,-3.0,52.5,0,outdoors,a_turf,74.0,6.0,Chan Gailey,Andy Reid,BUF00,Ralph Wilson Stadium,0,1.0,R.Fitzpatrick,14.0,,,F.Jackson,22.0,1,0,1.0,0,1,00-0023682,,00-0024204,R.Fitzpatrick,14.0,00-0023682,F.Jackson,00-0024204,F.Jackson,00-0024204,1,0,1.35638101305813,1.30914287625545,9.99409053203999,9.0,0.580988312256523,0.25860532943625,0.408628523349762,59.1371476650238,2011-10-09,C.Jenkins,2011,REG,PHI,5,00-0021706,DT,Cullen Jenkins,Cullen,Jenkins,Tricep,,Probable,Tricep,,Full Participation in Practice,2011-10-07T10:57:47Z,2011-10-07 10:57:47
2889,2011_10_BAL_SEA,2011111311,SEA,BAL,REG,10,SEA,home,BAL,SEA,77.0,2011-11-13,481.0,1381.0,1381.0,Half2,0,19.0,0,3,2.0,0,08:01,SEA 23,9,33.0,(8:01) 7-T.Jackson pass incomplete deep middle to 18-S.Rice (29-Ca.Williams) [93-C.Redding]. SEA-18-S.Rice was injured during the play. His return is Questionable.,pass,0.0,0,0,1.0,0,0,0,deep,middle,27.0,,,,,,,,3,3,0.0,,,,,3.0,3.0,22,7,22.0,7.0,15.0,22.0,7.0,15.0,0.0162841212004423,0.175877392292023,0.0033003380522131,0.273362278938293,0.207300081849098,0.0039538070559501,0.319922000169754,0.0,0.0,0.421493055298924,-0.717754671350122,14.4841245062999,-14.4841245062999,-6.16027105215471,6.16027105215471,4.98521496797973,-4.98521496797973,2.44254919327796,-3.16030386462808,0.0,0.0,-1.87542544345564,1.87542544345564,0.430740874810778,-0.430740874810778,-1.14966088771547,1.14966088771547,8.07512794686812,-8.07512794686812,0.936707377433777,0.0632926225662231,0.936707377433777,0.0632926225662231,-0.0087158679962158,-0.0114894509315491,-0.0114894509315491,0.927991509437561,0.072008490562439,0.82433009147644,0.82433009147644,-0.160581038506065,0.160581038506065,0.174780843629541,-0.174780843629541,0.0,-0.0087158679962158,0.0,0.0,-0.0965966751435375,0.0965966751435375,0.152541287243366,-0.152541287243366,-0.0887301137307263,0.0887301137307263,0.29299695789814,-0.29299695789814,0.0,0.0,0.0,0.0,0.0,0.0,0.0,0.0,1.0,0,0.0,0.0,0.0,0.0,0.0,0.0,0.0,0.0,0.0,0.0,0.0,0.0,0.0,0.0,0.0,0.0,0.0,0.0,0.0,0.0,0.0,1.0,0.0,1.0,0.0,0.0,0.0,0.0,0.0,0.0,0.0,0.0,0.0,0.0,0.0,0.0,0.0,0.0,0.0,0.0,0.0,00-0024279,T.Jackson,,00-0025431,S.Rice,,,,,,,,,,,,,,,,,,,,,,,,,,,,,,,,,,,,,00-0021998,C.Redding,,,,,,,,,,,,,,,,,,,,,,,,,,,0.0,,,,,,,00-0026369,Ca.Williams,,,,,,,,,,,,,,,,,,,,,,,,0.0,,,,,0,,,0.0,0.0,0.0,0.0,,,2011,0.274951547384262,-27.4951547384262,38,1,First down,2889,"11/13/11, 16:05:40",2011-11-13T23:14:58Z,Lumen Field,"Cloudy Temp: 50° F, Wind: SSW 10 mph",10012011-1113-1116-4279-53c788a5965a,0,0,PASS,0,,,,17,Punt,2011-11-13T23:13:27Z,8.0,3:45,2.0,0.0,0.0,3.0,3.0,0.0,PUNT,PUNT,09:31,05:46,SEA 9,SEA 42,2826.0,3006.0,17,22,Home,5,39,-7.0,38.5,0,outdoors,fieldturf,50.0,10.0,Pete Carroll,John Harbaugh,SEA00,CenturyLink Field,0,0.0,T.Jackson,7.0,,,S.Rice,18.0,1,0,0.0,0,1,00-0024279,,00-0025431,T.Jackson,7.0,00-0024279,S.Rice,00-0025431,S.Rice,00-0025431,0,1,-0.717754671350122,0.655804891902325,9.8088042094605,4.0,1.0,1.0,0.657296478748322,34.2703521251678,2011-11-13,S.Rice,2011,REG,SEA,10,00-0025431,WR,Sidney Rice,Sidney,Rice,Foot,,Probable,Foot,,Full Participation in Practice,2011-11-11T13:21:51Z,2011-11-11 13:21:51
2857,2011_01_DAL_NYJ,2011091112,NYJ,DAL,REG,1,NYJ,home,DAL,NYJ,85.0,2011-09-11,844.0,844.0,844.0,Half2,0,18.0,0,4,2.0,0,14:04,NYJ 15,11,84.0,(14:04) (Shotgun) 6-M.Sanchez pass short middle to 10-S.Holmes to NYJ 43 for 28 yards (26-A.Elam). DAL-21-M.Jenkins was injured during the play.,pass,28.0,1,0,1.0,0,0,0,short,middle,6.0,22.0,,,,,,,3,3,0.0,,,,,3.0,3.0,10,24,10.0,24.0,-14.0,10.0,24.0,-14.0,0.0768343880772591,0.217150628566742,0.0045658955350518,0.27883517742157,0.166600570082665,0.0027757808566093,0.253237575292587,0.0,0.0,-0.334413619711995,2.57428262103349,-15.3607904093732,15.3607904093732,-1.0548520553275,1.0548520553275,-14.137421947559,14.137421947559,0.0555314640514553,2.51875115698203,0.0555314640514553,2.51875115698203,-3.55948562594131,3.55948562594131,-0.569400795910042,0.569400795910042,3.917689046124,-3.917689046124,-19.6569710702795,19.6569710702795,0.0480781868100166,0.951921813189983,0.0480781868100166,0.951921813189983,0.0360121577978134,0.0377287194132805,0.0377287194132805,0.0840903446078301,0.91590965539217,0.0954362228512764,0.0954362228512764,-0.0660149676895702,0.0660149676895702,-0.46610941519331,0.46610941519331,0.0,0.0360121577978134,0.0,0.0360121577978134,-0.164118295212498,0.164118295212498,-0.0149669796228409,0.0149669796228409,-0.164118295212498,0.164118295212498,-0.31780318915844,0.31780318915844,0.0,0.0,1.0,0.0,0.0,0.0,0.0,0.0,0.0,0,0.0,0.0,0.0,0.0,0.0,0.0,0.0,0.0,0.0,0.0,0.0,0.0,0.0,0.0,1.0,0.0,0.0,0.0,0.0,0.0,0.0,0.0,0.0,1.0,0.0,0.0,0.0,0.0,0.0,0.0,0.0,0.0,0.0,0.0,0.0,1.0,0.0,0.0,0.0,0.0,0.0,00-0026898,M.Sanchez,28.0,00-0024240,S.Holmes,28.0,,,,,,,,,,,,,,,,,,,,,,,,,,,,,,,,,,,,,,,,,,,,,,DAL,,00-0023405,,A.Elam,,,,,,,,,,,,,,0.0,,,,,,,,,,,,,,,,,,,,,,,,,,,,,,,,0.0,,,,,0,,,0.0,0.0,0.0,0.0,,,2011,0.750393509864807,24.9606490135193,43,1,First down,2857,"9/11/11, 20:33:11",2011-09-12T02:46:42Z,MetLife Stadium,"Cloudy Temp: 70° F, Humidity: 89%, Wind: E-SE 6 mph",10012011-0911-127a-e89d-175e1c29fa87,0,0,PASS,0,,,,18,Touchdown,2011-09-12T02:45:10Z,7.0,2:54,4.0,0.0,1.0,4.0,4.0,0.0,KICKOFF,TOUCHDOWN,14:50,11:56,NYJ 16,DAL 26,2814.0,2996.0,24,27,Home,3,51,6.5,40.5,0,outdoors,fieldturf,70.0,6.0,Rex Ryan,Jason Garrett,NYC01,MetLife Stadium,0,1.0,M.Sanchez,6.0,,,S.Holmes,10.0,1,0,1.0,0,1,00-0026898,,00-0024240,M.Sanchez,6.0,00-0026898,S.Holmes,00-0024240,S.Holmes,00-0024240,0,0,2.57428262103349,0.798021871409305,4.22537592089066,3.0,0.991756647767033,0.283890716673341,0.879868090152741,12.013190984726,2011-09-11,M.Jenkins,2011,REG,DAL,1,00-0026165,CB,Mike Jenkins,Mike,Jenkins,Neck,Knee,Questionable,Neck,Knee,Limited Participation in Practice,2011-09-09T11:47:44Z,2011-09-09 11:47:44
2700,2011_03_NYG_PHI,2011092505,PHI,NYG,REG,3,NYG,away,PHI,PHI,35.0,2011-09-25,59.0,959.0,959.0,Half2,0,14.0,0,3,,0,00:59,PHI 35,0,-3.0,6-A.Henery kicks 72 yards from PHI 35 to NYG -7. 15-D.Thomas to NYG 26 for 33 yards (14-R.Cooper). PHI-14-R.Cooper was injured during the play. He is Out.,kickoff,0.0,0,0,0.0,0,0,0,,,,,,,,72.0,,,3,2,0.0,,,,,2.0,3.0,16,14,14.0,16.0,-2.0,14.0,16.0,-2.0,0.0614654906094074,0.17498591542244,0.0032935324124991,0.277622759342194,0.197257697582245,0.0025925263762474,0.282782077789307,0.0,0.0,0.101528563536704,0.363962454721332,0.0845800953641183,-0.0845800953641183,1.39794951532296,-1.39794951532296,-2.09846536679593,2.09846536679593,,,0.0,0.0,9.02322773897322,-9.02322773897322,-7.3950713876111,7.3950713876111,6.87534511456033,-6.87534511456033,-10.6013976963999,10.6013976963999,0.3911212682724,0.6088787317276,0.6088787317276,0.3911212682724,0.01130610704422,0.010504424571991,-0.010504424571991,0.59757262468338,0.40242737531662,0.297080308198929,0.702919691801071,-0.0200567423344942,0.0200567423344942,0.0492130805985261,-0.0492130805985261,,,0.0,0.0,0.0662622153759003,-0.0662622153759003,0.0608708997504045,-0.0608708997504045,0.0662622153759003,-0.0662622153759003,-0.122891307876892,0.122891307876892,0.0,0.0,0.0,0.0,0.0,0.0,0.0,0.0,0.0,0,0.0,0.0,0.0,0.0,0.0,0.0,0.0,1.0,0.0,0.0,0.0,0.0,0.0,0.0,1.0,0.0,0.0,0.0,0.0,0.0,0.0,0.0,0.0,0.0,0.0,0.0,0.0,0.0,0.0,0.0,0.0,0.0,1.0,0.0,0.0,0.0,0.0,0.0,0.0,0.0,0.0,,,,,,,,,,,,,,,,,,,,,,,,,,D.Thomas,00-0026174,,,,,A.Henery,00-0028058,,,,,,,,,,,,,,,,,,,PHI,,00-0027758,,R.Cooper,,,,,,,,,,,,,,0.0,,,,,,,,,,,,,,,,,,,,,,,,,,,,,,,NYG,33.0,,,,,0,,,0.0,0.0,0.0,0.0,,,2011,,,39,0,Punt,2700,"9/25/11, 13:03:45",2011-09-25T19:10:02Z,Lincoln Financial Field,"Cloudy Temp: 76° F, Humidity: 79%, Wind: NNE 5 mph",10012011-0925-0543-427c-a4a30506d991,0,0,KICK_OFF,1,,,,14,Punt,2011-09-25T19:10:02Z,3.0,1:39,0.0,0.0,0.0,3.0,4.0,0.0,KICKOFF,PUNT,00:59,14:20,NYG 26,NYG 23,2700.0,2802.0,29,16,Home,-13,45,9.0,46.5,1,outdoors,grass,76.0,5.0,Andy Reid,Tom Coughlin,PHI00,Lincoln Financial Field,0,1.0,,,,,,,0,0,0.0,1,0,,,,,,,,,,,0,0,0.363962454721332,,,,,,,,2011-09-25,R.Cooper,2011,REG,PHI,3,00-0027758,WR,Riley Cooper,Riley,Cooper,Hamstring,,Probable,Hamstring,,Full Participation in Practice,2011-09-23T12:40:46Z,2011-09-23 12:40:46
2696,2011_12_NE_PHI,2011112709,PHI,NE,REG,12,PHI,home,NE,NE,2.0,2011-11-27,416.0,1316.0,1316.0,Half2,0,16.0,0,3,3.0,0,06:56,NE 2,1,78.0,(6:56) 25-L.McCoy right end to NE 2 for no gain (44-J.Ihedigbo). NE-44-J.Ihedigbo was injured during the play. His return is Probable.,run,0.0,0,0,0.0,0,0,0,,,,,right,end,,,,,3,3,0.0,,,,,3.0,3.0,13,31,13.0,31.0,-18.0,13.0,31.0,-18.0,0.0022577897179871,0.0145432064309716,0.0004326307389419,0.0253210607916117,0.24506251513958,0.006012191530317,0.70637059211731,0.0,0.0,5.47006376698846,-1.42517108732136,-16.8959226235716,16.8959226235716,-3.78371938702185,3.78371938702185,-12.7320656244492,12.7320656244492,,,0.0,0.0,9.08408904733369,-9.08408904733369,-17.0222442598897,17.0222442598897,10.7770997133339,-10.7770997133339,-22.6312399444368,22.6312399444368,0.109572902321815,0.890427097678185,0.109572902321815,0.890427097678185,-0.0307493060827255,-0.0136504769325256,-0.0136504769325256,0.07882359623909,0.92117640376091,0.0604805462062359,0.0604805462062359,-0.206353345537124,0.206353345537124,-0.348285328588423,0.348285328588423,,,0.0,0.0,0.0615032985806465,-0.0615032985806465,-0.236377980551657,0.236377980551657,0.0615032985806465,-0.0615032985806465,-0.403915930530962,0.403915930530962,0.0,0.0,0.0,0.0,0.0,1.0,0.0,0.0,0.0,0,0.0,0.0,0.0,0.0,0.0,0.0,0.0,0.0,0.0,0.0,0.0,0.0,0.0,0.0,1.0,0.0,0.0,0.0,0.0,0.0,0.0,0.0,1.0,0.0,0.0,0.0,0.0,0.0,0.0,0.0,0.0,0.0,0.0,0.0,0.0,0.0,0.0,0.0,0.0,0.0,0.0,,,,,,,00-0027029,L.McCoy,0.0,,,,,,,,,,,,,,,,,,,,,,,,,,,,,,,,,,,,,,,,,,,NE,,00-0025753,,J.Ihedigbo,,,,,,,,,,,,,,0.0,,,,,,,,,,,,,,,,,,,,,,,,,,,,,,,,0.0,,,,,0,,,0.0,0.0,0.0,0.0,,,2011,,,45,0,Turnover on downs,2696,"11/27/11, 16:15:42",2011-11-27T23:21:04Z,Lincoln Financial Field,"Cloudy Temp: 63° F, Humidity: 56%, Wind: SSW 12 mph",10012011-1127-0950-f5c5-316da6226448,0,0,RUSH,0,,,,16,Turnover on downs,2011-11-27T23:13:09Z,10.0,5:00,3.0,1.0,0.0,3.0,3.0,0.0,KICKOFF,DOWNS,11:27,06:27,PHI 20,NE 2,2497.0,2738.0,38,20,Home,-18,58,-3.0,50.5,0,outdoors,grass,63.0,12.0,Andy Reid,Bill Belichick,PHI00,Lincoln Financial Field,0,0.0,,,L.McCoy,25.0,,,0,1,0.0,0,1,,00-0027029,,L.McCoy,25.0,00-0027029,L.McCoy,00-0027029,L.McCoy,00-0027029,0,1,-1.42517108732136,,,,,,0.320763558149338,-32.0763558149338,2011-11-27,J.Ihedigbo,2011,REG,NE,12,00-0025753,S,James Ihedigbo,James,Ihedigbo,Shoulder,,Questionable,Shoulder,,Limited Participation in Practice,2011-11-25T12:48:17Z,2011-11-25 12:48:17
2689,2011_19_DEN_NE,2012011400,NE,DEN,POST,19,NE,home,DEN,DEN,45.0,2012-01-14,606.0,1506.0,1506.0,Half2,0,20.0,0,3,2.0,0,10:06,DEN 45,4,32.0,(10:06) (No Huddle) 22-S.Ridley left end to DEN 34 for 11 yards (21-A.Goodman). DEN-30-D.Bruton was injured during the play.,run,11.0,0,1,0.0,0,0,0,,,,,left,end,,,,,2,3,0.0,,,,,2.0,3.0,42,7,42.0,7.0,35.0,42.0,7.0,35.0,0.0085425321012735,0.0931068509817123,0.000919101992622,0.129925653338432,0.309132874011993,0.0111531345173717,0.447219848632813,0.0,0.0,2.889605501201,0.774558741250075,38.5736667321105,-38.5736667321105,2.35757513705175,-2.35757513705175,31.116983569169,-31.116983569169,,,0.0,0.0,9.126053381362,-9.126053381362,17.4550973764854,-17.4550973764854,11.8331281529972,-11.8331281529972,11.7074106654036,-11.7074106654036,0.998865604400635,0.0011343955993652,0.998865604400635,0.0011343955993652,0.0001816153526306,2.36630439758301e-05,2.36630439758301e-05,0.999047219753265,0.0009527802467346,0.999809086322784,0.999809086322784,0.0922983963422133,-0.0922983963422133,0.318020999298916,-0.318020999298916,,,0.0,0.0,0.0339530542136536,-0.0339530542136536,0.231307388162968,-0.231307388162968,0.0333493038655625,-0.0333493038655625,0.145871024458466,-0.145871024458466,0.0,1.0,0.0,0.0,0.0,0.0,0.0,0.0,0.0,0,0.0,0.0,0.0,0.0,0.0,0.0,0.0,0.0,0.0,0.0,0.0,0.0,0.0,0.0,1.0,0.0,0.0,0.0,0.0,0.0,0.0,0.0,1.0,0.0,0.0,0.0,0.0,0.0,0.0,0.0,0.0,0.0,0.0,0.0,0.0,0.0,0.0,0.0,0.0,0.0,0.0,,,,,,,00-0028011,S.Ridley,11.0,,,,,,,,,,,,,,,,,,,,,,,,,,,,,,,,,,,,,,,,,,,DEN,,00-0021194,,A.Goodman,,,,,,,,,,,,,,0.0,,,,,,,,,,,,,,,,,,,,,,,,,,,,,,,,0.0,,,,,0,,,0.0,0.0,0.0,0.0,,,2011,,,42,1,First down,2689,"1/14/12, 20:16:26",2012-01-15T03:24:39Z,Gillette Stadium,"Partly Cloudy and cold Temp: 24° F, Wind: WNW 13 with gusts to 20 mph",10012012-0114-0068-db28-5cfbcb0e7f73,0,0,RUSH,0,,,,20,Turnover,2012-01-15T03:24:16Z,5.0,1:59,2.0,0.0,0.0,3.0,3.0,0.0,PUNT,FUMBLE,10:29,08:30,NE 49,DEN 23,2668.0,2759.0,10,45,Home,35,55,14.0,50.0,0,outdoors,fieldturf,24.0,13.0,Bill Belichick,John Fox,BOS00,Gillette Stadium,0,1.0,,,S.Ridley,22.0,,,0,1,1.0,0,1,,00-0028011,,S.Ridley,22.0,00-0028011,S.Ridley,00-0028011,S.Ridley,00-0028011,0,1,0.774558741250075,,,,,,0.340473294258118,-34.0473294258118,2012-01-14,D.Bruton,2011,DIV,DEN,19,00-0027083,S,David Bruton,David,Bruton,Achilles,,Probable,Achilles,,Full Participation in Practice,2012-01-13T09:09:34Z,2012-01-13 09:09:34
2573,2011_01_CAR_ARI,2011091109,ARI,CAR,REG,1,ARI,home,CAR,CAR,48.0,2011-09-11,652.0,1552.0,1552.0,Half2,0,15.0,1,3,1.0,0,10:52,CAR 48,10,48.0,"(10:52) 4-K.Kolb pass deep right to 87-J.King for 48 yards, TOUCHDOWN. CAR-52-J.Beason was injured during the play.",pass,48.0,0,0,1.0,0,0,0,deep,right,16.0,32.0,,,,,,,3,3,0.0,,ARI,J.King,00-0024369,3.0,3.0,13,14,7.0,14.0,-7.0,13.0,14.0,-1.0,0.0023030450101941,0.0910818800330162,0.0010013611754402,0.133549675345421,0.302477151155472,0.0053391493856906,0.464247763156891,0.0,0.0,2.95774800446816,4.04225199553184,-1.40334868440192,1.40334868440192,0.674390560016036,-0.674390560016036,-2.71651409237111,2.71651409237111,1.09308544336818,2.94916655216366,1.09308544336818,2.94916655216366,-8.37116716926849,8.37116716926849,-0.721737942716572,0.721737942716572,-15.6401106661027,15.6401106661027,12.6078031771758,-12.6078031771758,0.335612893104553,0.664387106895447,0.335612893104553,0.664387106895447,0.195760471494381,0.142298610380939,0.142298610380939,0.531373364598934,0.468626635401066,0.468032002449036,0.468032002449036,0.0781448513798551,-0.0781448513798551,-0.0021066745293824,0.0021066745293824,0.0,0.195760471494381,0.0,0.195760471494381,-0.178616668683514,0.178616668683514,-0.040167343730771,0.040167343730771,-0.178616668683514,0.178616668683514,0.138918626194156,-0.138918626194156,0.0,0.0,1.0,0.0,0.0,0.0,0.0,0.0,0.0,0,0.0,0.0,0.0,0.0,0.0,0.0,0.0,0.0,0.0,0.0,0.0,0.0,0.0,0.0,0.0,0.0,0.0,0.0,0.0,0.0,0.0,0.0,0.0,1.0,0.0,1.0,1.0,0.0,0.0,0.0,0.0,0.0,0.0,0.0,0.0,1.0,0.0,0.0,0.0,0.0,0.0,00-0025423,K.Kolb,48.0,00-0024369,J.King,48.0,,,,,,,,,,,,,,,,,,,,,,,,,,,,,,,,,,,,,,,,,,,,,,,,,,,,,,,,,,,,,,,,0.0,,,,,,,,,,,,,,,,,,,,,,,,,,,,,,,,0.0,,,,,0,,,0.0,0.0,0.0,0.0,,,2011,0.574305415153503,42.5694584846497,33,1,Touchdown,2573,"9/11/11, 16:22:41",2011-09-11T22:09:25Z,State Farm Stadium,"Temp: ° F, Wind: mph",10012011-0911-09e4-d972-93e060fdc03a,0,0,PASS,0,,,,15,Touchdown,2011-09-11T22:09:25Z,1.0,0:12,1.0,0.0,1.0,3.0,3.0,0.0,INTERCEPTION,TOUCHDOWN,10:52,10:40,CAR 48,CAR 48,2573.0,2602.0,21,28,Home,7,49,6.5,37.5,0,closed,grass,,,Ken Whisenhunt,Ron Rivera,PHO00,University of Phoenix Stadium,0,1.0,K.Kolb,4.0,,,J.King,87.0,1,0,1.0,0,1,00-0025423,,00-0024369,K.Kolb,4.0,00-0025423,J.King,00-0024369,J.King,00-0024369,0,0,4.04225199553184,0.248499347062819,3.71785614854889,2.0,1.0,1.0,0.495959639549255,50.4040360450745,2011-09-11,J.Beason,2011,REG,CAR,1,00-0025412,LB,Jon Beason,Jon,Beason,Ankle,,Questionable,Ankle,,Limited Participation in Practice,2011-09-09T10:10:59Z,2011-09-09 10:10:59
2573,2011_03_HOU_NO,2011092501,NO,HOU,REG,3,NO,home,HOU,NO,69.0,2011-09-25,207.0,1107.0,1107.0,Half2,0,14.0,0,3,1.0,0,03:27,NO 31,10,24.0,"(3:27) 9-D.Brees pass short middle to 43-D.Sproles to NO 33 for 2 yards (33-T.Nolan) [56-B.Cushing]. HOU-90-M.Williams was injured during the play. His return is Probable. Pass 2, YAC 0",pass,2.0,0,0,1.0,0,0,0,short,middle,2.0,0.0,,,,,,,3,3,0.0,,,,,3.0,3.0,17,19,17.0,19.0,-2.0,17.0,19.0,-2.0,0.0230621080845594,0.128639757633209,0.0023011714220047,0.199936166405678,0.227875262498856,0.0040854369290173,0.414100110530853,0.0,0.0,1.80042265448719,-0.408086483366787,-5.01574191725521,5.01574191725521,0.340213866729755,-0.340213866729755,-7.12069574504944,7.12069574504944,-0.408086483366787,0.0,-0.408086483366787,0.0,-0.580378600502167,0.580378600502167,-4.68673702305723,4.68673702305723,-1.42546273149901,1.42546273149901,-5.48643270060388,5.48643270060388,0.493005216121674,0.506994783878326,0.493005216121674,0.506994783878326,-0.0081651806831359,-0.0229466557502747,-0.0229466557502747,0.484840035438538,0.515159964561462,0.52275538444519,0.52275538444519,0.0412649441477563,-0.0412649441477563,-0.246904359866928,0.246904359866928,-0.0081651806831359,0.0,-0.0081651806831359,0.0,-0.0672100412495602,0.0672100412495602,-0.133071207846188,0.133071207846188,-0.0672100412495602,0.0672100412495602,-0.145782524193311,0.145782524193311,0.0,0.0,0.0,0.0,0.0,0.0,0.0,0.0,0.0,0,0.0,0.0,0.0,0.0,0.0,0.0,0.0,0.0,0.0,0.0,0.0,0.0,0.0,0.0,1.0,0.0,0.0,0.0,0.0,0.0,0.0,1.0,0.0,1.0,0.0,0.0,0.0,0.0,0.0,0.0,0.0,0.0,0.0,0.0,0.0,1.0,0.0,0.0,0.0,0.0,0.0,00-0020531,D.Brees,2.0,00-0023564,D.Sproles,2.0,,,,,,,,,,,,,,,,,,,,,,,,,,,,,,,,,,,,00-0026991,B.Cushing,,,,,,,,,HOU,,00-0026948,,T.Nolan,,,,,,,,,,,,,,0.0,,,,,,,,,,,,,,,,,,,,,,,,,,,,,,,,0.0,,,,,0,,,0.0,0.0,0.0,0.0,,,2011,0.542046964168549,45.7953035831451,37,1,First down,2573,"9/25/11, 13:02:55",2011-09-25T19:04:58Z,Caesars Superdome,"Sunny Temp: 85° F, Humidity: 58%, Wind: SSE 8 mph",10012011-0925-019e-bf54-22db402bac94,0,0,PASS,0,,,,14,Turnover,2011-09-25T18:59:06Z,7.0,3:08,2.0,0.0,0.0,3.0,3.0,0.0,KICKOFF,INTERCEPTION,05:08,02:00,NO 20,NO 44,2486.0,2655.0,33,40,Home,7,73,3.5,51.0,0,dome,sportturf,,,Sean Payton,Gary Kubiak,NOR00,Mercedes-Benz Superdome,0,0.0,D.Brees,9.0,,,D.Sproles,43.0,1,0,0.0,0,1,00-0020531,,00-0023564,D.Brees,9.0,00-0020531,D.Sproles,00-0023564,D.Sproles,00-0023564,0,0,-0.408086483366787,0.684025971639588,5.8091515425258,4.0,0.65850283484906,0.257111552171409,0.516722500324249,48.3277499675751,2011-09-25,M.Williams,2011,REG,HOU,3,00-0023750,LB,Mario Williams,Mario,Williams,Thumb,,Probable,Thumb,,Full Participation in Practice,2011-09-23T11:50:18Z,2011-09-23 11:50:18
